[2025-12-12 13:48:07] 
[2025-12-12 13:48:07] ━━━━━━━━━━━━━━━━━━━━━━━━━━━━━━━━━━━━━━━━━━━━━━━━━━━━━━━━━━━━━━━━━━
[2025-12-12 13:48:07] 🚀 Starting BSA Analysis Pipeline
[2025-12-12 13:48:07] ━━━━━━━━━━━━━━━━━━━━━━━━━━━━━━━━━━━━━━━━━━━━━━━━━━━━━━━━━━━━━━━━━━
[2025-12-12 13:48:07]  Start time: 2025年 12月 12日 星期五 13:48:07 CST
[2025-12-12 13:48:07] 
[2025-12-12 13:48:07] ━━━━━━━━━━━━━━━━━━━━━━━━━━━━━━━━━━━━━━━━━━━━━━━━━━━━━━━━━━━━━━━━━━
[2025-12-12 13:48:07] 📋 Configuration Summary
[2025-12-12 13:48:07] ━━━━━━━━━━━━━━━━━━━━━━━━━━━━━━━━━━━━━━━━━━━━━━━━━━━━━━━━━━━━━━━━━━
[2025-12-12 13:48:07] Input/Output:
[2025-12-12 13:48:07]   📂 Input directory : /share/org/YZWL/yzwl_lixg/project/25.大蒜芥/01.data/clean
[2025-12-12 13:48:07]   📄 Reference genome: /share/org/YZWL/yzwl_lixg/project/25.大蒜芥/01.data/genome/120.sorted.genome.fa
[2025-12-12 13:48:07]    Output directory: /share/org/YZWL/yzwl_lixg/project/25.大蒜芥/02.mapping
[2025-12-12 13:48:07] 
[2025-12-12 13:48:07] Resource Allocation:
[2025-12-12 13:48:07]   ⚡ Max threads     : 88
[2025-12-12 13:48:07]   🧵 BWA threads     : 80
[2025-12-12 13:48:07]   💾 Java memory     : 128g
[2025-12-12 13:48:07]   🧮 HMM threads     : 64
[2025-12-12 13:48:07]   🔢 Ploidy          : 2
[2025-12-12 13:48:07] 
[2025-12-12 13:48:07] Pipeline Steps:
[2025-12-12 13:48:07]   ✓ Mapping (BWA MEM)
[2025-12-12 13:48:07]   ✓ Mark Duplicates
[2025-12-12 13:48:07]   ✓ HaplotypeCaller (GVCF)
[2025-12-12 13:48:07]   ⭐️  SKIP Joint Genotyping
[2025-12-12 13:48:07] 
[2025-12-12 13:48:07] Options:
[2025-12-12 13:48:07]   💾 Keep intermediate: false
[2025-12-12 13:48:07]    Dry run          : false
[2025-12-12 13:48:07]   📊 ERC mode         : GVCF
[2025-12-12 13:48:07] 
[2025-12-12 13:48:07] ━━━━━━━━━━━━━━━━━━━━━━━━━━━━━━━━━━━━━━━━━━━━━━━━━━━━━━━━━━━━━━━━━━
[2025-12-12 13:48:07] 💻 System Resources
[2025-12-12 13:48:07] ━━━━━━━━━━━━━━━━━━━━━━━━━━━━━━━━━━━━━━━━━━━━━━━━━━━━━━━━━━━━━━━━━━
[2025-12-12 13:48:07] 🖥️  Available CPUs: 88
[2025-12-12 13:48:07] ⚡ Requested threads: 88
[2025-12-12 13:48:07] 🧵 BWA threads: 80
[2025-12-12 13:48:07] 💾 Total memory: 1.0Ti
[2025-12-12 13:48:07] 💾 Available memory: 913Gi
[2025-12-12 13:48:07] 💾 GATK Java memory: 128g
[2025-12-12 13:48:07] 💿 Available disk space: 2.0P
[2025-12-12 13:48:07] 
[2025-12-12 13:48:07] ━━━━━━━━━━━━━━━━━━━━━━━━━━━━━━━━━━━━━━━━━━━━━━━━━━━━━━━━━━━━━━━━━━
[2025-12-12 13:48:07] 🛠️  Software Versions
[2025-12-12 13:48:07] ━━━━━━━━━━━━━━━━━━━━━━━━━━━━━━━━━━━━━━━━━━━━━━━━━━━━━━━━━━━━━━━━━━
[2025-12-12 13:48:07] 📦 BWA: Version: 0.7.19-r1273
unknown
[2025-12-12 13:48:08] 📦 Samtools: samtools 1.22
[2025-12-12 13:48:10] 📦 GATK: The Genome Analysis Toolkit (GATK) v4.6.2.0
[2025-12-12 13:48:10] 
[2025-12-12 13:48:10] ━━━━━━━━━━━━━━━━━━━━━━━━━━━━━━━━━━━━━━━━━━━━━━━━━━━━━━━━━━━━━━━━━━
[2025-12-12 13:48:10] 📚 Preparing Reference Genome
[2025-12-12 13:48:10] ━━━━━━━━━━━━━━━━━━━━━━━━━━━━━━━━━━━━━━━━━━━━━━━━━━━━━━━━━━━━━━━━━━
[2025-12-12 13:48:10] ⚠️  BWA index not found, building...
[2025-12-12 13:48:10] ▶️  Running: bwa index /share/org/YZWL/yzwl_lixg/project/25.大蒜芥/01.data/genome/120.sorted.genome.fa
[2025-12-12 13:51:29] ✅ Command completed successfully
[2025-12-12 13:51:29] ✅ BWA index created
[2025-12-12 13:51:29] ⚠️  FASTA index not found, building...
[2025-12-12 13:51:29] ▶️  Running: samtools faidx /share/org/YZWL/yzwl_lixg/project/25.大蒜芥/01.data/genome/120.sorted.genome.fa
[2025-12-12 13:51:29] ✅ Command completed successfully
[2025-12-12 13:51:29] ✅ FASTA index created
[2025-12-12 13:51:29] ⚠️  Sequence dictionary not found, building...
[2025-12-12 13:51:29] ▶️  Running: gatk CreateSequenceDictionary -R /share/org/YZWL/yzwl_lixg/project/25.大蒜芥/01.data/genome/120.sorted.genome.fa -O /share/org/YZWL/yzwl_lixg/project/25.大蒜芥/01.data/genome/120.sorted.genome.dict
[2025-12-12 13:51:32] ✅ Command completed successfully
[2025-12-12 13:51:32] ✅ Sequence dictionary created
[2025-12-12 13:51:32] 📋 Auto-detecting samples from input directory...
[2025-12-12 13:51:32]    Found 4 samples
[2025-12-12 13:51:32] 
[2025-12-12 13:51:32] ━━━━━━━━━━━━━━━━━━━━━━━━━━━━━━━━━━━━━━━━━━━━━━━━━━━━━━━━━━━━━━━━━━
[2025-12-12 13:51:32] 🧬 Processing 4 Samples
[2025-12-12 13:51:32] ━━━━━━━━━━━━━━━━━━━━━━━━━━━━━━━━━━━━━━━━━━━━━━━━━━━━━━━━━━━━━━━━━━
[2025-12-12 13:51:32] 
[2025-12-12 13:51:32] ╔════════════════════════════════════════════════════════════════╗
[2025-12-12 13:51:32] ║ Sample 1/4: 116
[2025-12-12 13:51:32] ╚═════════════════════════════════════════════════════════════════
[2025-12-12 13:51:32]  [1/3] BWA MEM alignment...
[2025-12-12 13:51:32] ▶️  Running: bwa mem -t 80 -M -R "@RG	ID:116	SM:116	PL:ILLUMINA	LB:116_lib" /share/org/YZWL/yzwl_lixg/project/25.大蒜芥/01.data/genome/120.sorted.genome.fa /share/org/YZWL/yzwl_lixg/project/25.大蒜芥/01.data/clean/116_1.clean.fq.gz /share/org/YZWL/yzwl_lixg/project/25.大蒜芥/01.data/clean/116_2.clean.fq.gz |                         samtools sort -@ 64 -o /share/org/YZWL/yzwl_lixg/project/25.大蒜芥/02.mapping/01.bam/116.sorted.bam -
[2025-12-12 14:00:44] ✅ Command completed successfully
[2025-12-12 14:00:44] ▶️  Running: samtools index /share/org/YZWL/yzwl_lixg/project/25.大蒜芥/02.mapping/01.bam/116.sorted.bam
[2025-12-12 14:01:44] ✅ Command completed successfully
[2025-12-12 14:01:44] ✅ Alignment completed
[2025-12-12 14:01:44] 👯 [2/3] Marking PCR duplicates...
[2025-12-12 14:01:44] ▶️  Running: gatk --java-options "-Xmx128g" MarkDuplicates                          -I /share/org/YZWL/yzwl_lixg/project/25.大蒜芥/02.mapping/01.bam/116.sorted.bam                          -O /share/org/YZWL/yzwl_lixg/project/25.大蒜芥/02.mapping/01.bam/116.dedup.bam                          -M /share/org/YZWL/yzwl_lixg/project/25.大蒜芥/02.mapping/01.bam/116.dedup.metrics                          --CREATE_INDEX true                          --VALIDATION_STRINGENCY SILENT
[2025-12-12 14:12:07] ✅ Command completed successfully
[2025-12-12 14:12:07] 🗑️  Removing intermediate sorted BAM
[2025-12-12 14:12:07] ✅ Duplicate marking completed
[2025-12-12 14:12:07]    📊 Duplication rate: 0.031937
[2025-12-12 14:12:07]  [3/3] Running HaplotypeCaller...
[2025-12-12 14:12:07] ▶️  Running: gatk --java-options "-Xmx128g" HaplotypeCaller                          -R /share/org/YZWL/yzwl_lixg/project/25.大蒜芥/01.data/genome/120.sorted.genome.fa                          -I /share/org/YZWL/yzwl_lixg/project/25.大蒜芥/02.mapping/01.bam/116.dedup.bam                          -O /share/org/YZWL/yzwl_lixg/project/25.大蒜芥/02.mapping/02.gvcf/116.g.vcf.gz                          -ERC GVCF                          --sample-ploidy 2                          --native-pair-hmm-threads 64
[2025-12-12 16:50:19] ✅ Command completed successfully
[2025-12-12 16:50:19] ✅ GVCF generated
[2025-12-12 16:50:19] ✅ Sample 116 completed
[2025-12-12 16:50:19] 
[2025-12-12 16:50:19] ╔════════════════════════════════════════════════════════════════╗
[2025-12-12 16:50:19] ║ Sample 2/4: 118
[2025-12-12 16:50:19] ╚═════════════════════════════════════════════════════════════════
[2025-12-12 16:50:19]  [1/3] BWA MEM alignment...
[2025-12-12 16:50:19] ▶️  Running: bwa mem -t 80 -M -R "@RG	ID:118	SM:118	PL:ILLUMINA	LB:118_lib" /share/org/YZWL/yzwl_lixg/project/25.大蒜芥/01.data/genome/120.sorted.genome.fa /share/org/YZWL/yzwl_lixg/project/25.大蒜芥/01.data/clean/118_1.clean.fq.gz /share/org/YZWL/yzwl_lixg/project/25.大蒜芥/01.data/clean/118_2.clean.fq.gz |                         samtools sort -@ 64 -o /share/org/YZWL/yzwl_lixg/project/25.大蒜芥/02.mapping/01.bam/118.sorted.bam -
[2025-12-12 17:00:43] ✅ Command completed successfully
[2025-12-12 17:00:43] ▶️  Running: samtools index /share/org/YZWL/yzwl_lixg/project/25.大蒜芥/02.mapping/01.bam/118.sorted.bam
[2025-12-12 17:01:41] ✅ Command completed successfully
[2025-12-12 17:01:41] ✅ Alignment completed
[2025-12-12 17:01:41] 👯 [2/3] Marking PCR duplicates...
[2025-12-12 17:01:41] ▶️  Running: gatk --java-options "-Xmx128g" MarkDuplicates                          -I /share/org/YZWL/yzwl_lixg/project/25.大蒜芥/02.mapping/01.bam/118.sorted.bam                          -O /share/org/YZWL/yzwl_lixg/project/25.大蒜芥/02.mapping/01.bam/118.dedup.bam                          -M /share/org/YZWL/yzwl_lixg/project/25.大蒜芥/02.mapping/01.bam/118.dedup.metrics                          --CREATE_INDEX true                          --VALIDATION_STRINGENCY SILENT
[2025-12-12 17:13:16] ✅ Command completed successfully
[2025-12-12 17:13:16] 🗑️  Removing intermediate sorted BAM
[2025-12-12 17:13:16] ✅ Duplicate marking completed
[2025-12-12 17:13:16]    📊 Duplication rate: 0.033528
[2025-12-12 17:13:16]  [3/3] Running HaplotypeCaller...
[2025-12-12 17:13:16] ▶️  Running: gatk --java-options "-Xmx128g" HaplotypeCaller                          -R /share/org/YZWL/yzwl_lixg/project/25.大蒜芥/01.data/genome/120.sorted.genome.fa                          -I /share/org/YZWL/yzwl_lixg/project/25.大蒜芥/02.mapping/01.bam/118.dedup.bam                          -O /share/org/YZWL/yzwl_lixg/project/25.大蒜芥/02.mapping/02.gvcf/118.g.vcf.gz                          -ERC GVCF                          --sample-ploidy 2                          --native-pair-hmm-threads 64
[2025-12-12 19:44:09] ✅ Command completed successfully
[2025-12-12 19:44:09] ✅ GVCF generated
[2025-12-12 19:44:09] ✅ Sample 118 completed
[2025-12-12 19:44:09] 
[2025-12-12 19:44:09] ╔════════════════════════════════════════════════════════════════╗
[2025-12-12 19:44:09] ║ Sample 3/4: 119
[2025-12-12 19:44:09] ╚═════════════════════════════════════════════════════════════════
[2025-12-12 19:44:09]  [1/3] BWA MEM alignment...
[2025-12-12 19:44:09] ▶️  Running: bwa mem -t 80 -M -R "@RG	ID:119	SM:119	PL:ILLUMINA	LB:119_lib" /share/org/YZWL/yzwl_lixg/project/25.大蒜芥/01.data/genome/120.sorted.genome.fa /share/org/YZWL/yzwl_lixg/project/25.大蒜芥/01.data/clean/119_1.clean.fq.gz /share/org/YZWL/yzwl_lixg/project/25.大蒜芥/01.data/clean/119_2.clean.fq.gz |                         samtools sort -@ 64 -o /share/org/YZWL/yzwl_lixg/project/25.大蒜芥/02.mapping/01.bam/119.sorted.bam -
[2025-12-12 19:53:20] ✅ Command completed successfully
[2025-12-12 19:53:20] ▶️  Running: samtools index /share/org/YZWL/yzwl_lixg/project/25.大蒜芥/02.mapping/01.bam/119.sorted.bam
[2025-12-12 19:54:05] ✅ Command completed successfully
[2025-12-12 19:54:05] ✅ Alignment completed
[2025-12-12 19:54:05] 👯 [2/3] Marking PCR duplicates...
[2025-12-12 19:54:05] ▶️  Running: gatk --java-options "-Xmx128g" MarkDuplicates                          -I /share/org/YZWL/yzwl_lixg/project/25.大蒜芥/02.mapping/01.bam/119.sorted.bam                          -O /share/org/YZWL/yzwl_lixg/project/25.大蒜芥/02.mapping/01.bam/119.dedup.bam                          -M /share/org/YZWL/yzwl_lixg/project/25.大蒜芥/02.mapping/01.bam/119.dedup.metrics                          --CREATE_INDEX true                          --VALIDATION_STRINGENCY SILENT
[2025-12-12 20:03:40] ✅ Command completed successfully
[2025-12-12 20:03:40] 🗑️  Removing intermediate sorted BAM
[2025-12-12 20:03:40] ✅ Duplicate marking completed
[2025-12-12 20:03:40]    📊 Duplication rate: 0.027264
[2025-12-12 20:03:40]  [3/3] Running HaplotypeCaller...
[2025-12-12 20:03:40] ▶️  Running: gatk --java-options "-Xmx128g" HaplotypeCaller                          -R /share/org/YZWL/yzwl_lixg/project/25.大蒜芥/01.data/genome/120.sorted.genome.fa                          -I /share/org/YZWL/yzwl_lixg/project/25.大蒜芥/02.mapping/01.bam/119.dedup.bam                          -O /share/org/YZWL/yzwl_lixg/project/25.大蒜芥/02.mapping/02.gvcf/119.g.vcf.gz                          -ERC GVCF                          --sample-ploidy 2                          --native-pair-hmm-threads 64
[2025-12-12 21:46:44] ✅ Command completed successfully
[2025-12-12 21:46:44] ✅ GVCF generated
[2025-12-12 21:46:44] ✅ Sample 119 completed
[2025-12-12 21:46:44] 
[2025-12-12 21:46:44] ╔════════════════════════════════════════════════════════════════╗
[2025-12-12 21:46:44] ║ Sample 4/4: 120
[2025-12-12 21:46:44] ╚═════════════════════════════════════════════════════════════════
[2025-12-12 21:46:44]  [1/3] BWA MEM alignment...
[2025-12-12 21:46:44] ▶️  Running: bwa mem -t 80 -M -R "@RG	ID:120	SM:120	PL:ILLUMINA	LB:120_lib" /share/org/YZWL/yzwl_lixg/project/25.大蒜芥/01.data/genome/120.sorted.genome.fa /share/org/YZWL/yzwl_lixg/project/25.大蒜芥/01.data/clean/120_1.clean.fq.gz /share/org/YZWL/yzwl_lixg/project/25.大蒜芥/01.data/clean/120_2.clean.fq.gz |                         samtools sort -@ 64 -o /share/org/YZWL/yzwl_lixg/project/25.大蒜芥/02.mapping/01.bam/120.sorted.bam -
[2025-12-12 21:53:59] ✅ Command completed successfully
[2025-12-12 21:53:59] ▶️  Running: samtools index /share/org/YZWL/yzwl_lixg/project/25.大蒜芥/02.mapping/01.bam/120.sorted.bam
[2025-12-12 21:55:01] ✅ Command completed successfully
[2025-12-12 21:55:01] ✅ Alignment completed
[2025-12-12 21:55:01] 👯 [2/3] Marking PCR duplicates...
[2025-12-12 21:55:01] ▶️  Running: gatk --java-options "-Xmx128g" MarkDuplicates                          -I /share/org/YZWL/yzwl_lixg/project/25.大蒜芥/02.mapping/01.bam/120.sorted.bam                          -O /share/org/YZWL/yzwl_lixg/project/25.大蒜芥/02.mapping/01.bam/120.dedup.bam                          -M /share/org/YZWL/yzwl_lixg/project/25.大蒜芥/02.mapping/01.bam/120.dedup.metrics                          --CREATE_INDEX true                          --VALIDATION_STRINGENCY SILENT
[2025-12-12 22:04:06] ✅ Command completed successfully
[2025-12-12 22:04:06] 🗑️  Removing intermediate sorted BAM
[2025-12-12 22:04:06] ✅ Duplicate marking completed
[2025-12-12 22:04:06]    📊 Duplication rate: 0.04291
[2025-12-12 22:04:06]  [3/3] Running HaplotypeCaller...
[2025-12-12 22:04:06] ▶️  Running: gatk --java-options "-Xmx128g" HaplotypeCaller                          -R /share/org/YZWL/yzwl_lixg/project/25.大蒜芥/01.data/genome/120.sorted.genome.fa                          -I /share/org/YZWL/yzwl_lixg/project/25.大蒜芥/02.mapping/01.bam/120.dedup.bam                          -O /share/org/YZWL/yzwl_lixg/project/25.大蒜芥/02.mapping/02.gvcf/120.g.vcf.gz                          -ERC GVCF                          --sample-ploidy 2                          --native-pair-hmm-threads 64
[2025-12-13 00:13:20] ✅ Command completed successfully
[2025-12-13 00:13:20] ✅ GVCF generated
[2025-12-13 00:13:20] ✅ Sample 120 completed
[2025-12-13 00:13:20] 
[2025-12-13 00:13:20]  End time: 2025年 12月 13日 星期六 00:13:20 CST
[2025-12-13 00:13:20] ️  Total runtime: 10h 25m 13s
[2025-12-13 00:13:20] 
[2025-12-13 00:13:20] ━━━━━━━━━━━━━━━━━━━━━━━━━━━━━━━━━━━━━━━━━━━━━━━━━━━━━━━━━━━━━━━━━━
[2025-12-13 00:13:20] 📊 Generating Final Report
[2025-12-13 00:13:20] ━━━━━━━━━━━━━━━━━━━━━━━━━━━━━━━━━━━━━━━━━━━━━━━━━━━━━━━━━━━━━━━━━━
[2025-12-13 00:13:20] 📊 Report saved to: /share/org/YZWL/yzwl_lixg/project/25.大蒜芥/02.mapping/reports/pipeline_report_20251212_134807.txt
[2025-12-13 00:13:20] 
[2025-12-13 00:13:20] ━━━━━━━━━━━━━━━━━━━━━━━━━━━━━━━━━━━━━━━━━━━━━━━━━━━━━━━━━━━━━━━━━━
[2025-12-13 00:13:20]  Pipeline Finished Successfully!
[2025-12-13 00:13:20] ━━━━━━━━━━━━━━━━━━━━━━━━━━━━━━━━━━━━━━━━━━━━━━━━━━━━━━━━━━━━━━━━━━
Traceback (most recent call last):
  File "/share/org/YZWL/yzwl_lixg/software/scripts/23.bam文件统计.py", line 11, in <module>
    import pandas as pd
ModuleNotFoundError: No module named 'pandas'
Job 68398477 stderr output:

