2026-02-03 22:20:18.308 - INFO - ================================================================================
2026-02-03 22:20:18.308 - INFO - 开始基因组组装流程|Starting Genome Assembly Pipeline
2026-02-03 22:20:18.308 - INFO - ================================================================================
2026-02-03 22:20:18.308 - INFO - 检查依赖软件|Checking dependencies
2026-02-03 22:20:18.533 - INFO - 组装配置|Assembly Configuration:
2026-02-03 22:20:18.533 - INFO -   样本名称|Sample Name: 41
2026-02-03 22:20:18.533 - INFO -   基因组大小|Genome Size: 85m
2026-02-03 22:20:18.533 - INFO -   倍性|Ploidy: 2
2026-02-03 22:20:18.533 - INFO -   线程数|Threads: 64
2026-02-03 22:20:18.533 - INFO -   HiFi数据|HiFi Data: /share/org/YZWL/yzwl_lixg/project/28.大豆疫霉菌三代基因组/01.data/clean/hifi/41.clean.fq.gz
2026-02-03 22:20:18.533 - INFO -   组装模式|Assembly Mode: HiFi only
2026-02-03 22:20:18.534 - INFO -   NGS数据目录|NGS Data Directory: /share/org/YZWL/yzwl_lixg/project/28.大豆疫霉菌三代基因组/01.data/ngs/41
2026-02-03 22:20:18.534 - INFO -   高质量覆盖度阈值|High Coverage Threshold: 95.0%
2026-02-03 22:20:18.534 - INFO -   NGS polish|NGS Polish: 启用|Enabled
2026-02-03 22:20:18.534 - INFO -   工作目录|Work Directory: /share/org/YZWL/yzwl_lixg/project/28.大豆疫霉菌三代基因组/02.hifiasm/41
2026-02-03 22:20:18.534 - INFO - ================================================================================
2026-02-03 22:20:18.534 - INFO - 断点续传模式|Resume mode: enabled
2026-02-03 22:20:18.534 - INFO - ================================================================================
2026-02-03 22:20:18.534 - INFO - 检查已完成步骤|Checking completed steps:
2026-02-03 22:20:18.534 - INFO - 初次组装步骤|Initial assembly steps:
2026-02-03 22:20:18.534 - INFO -   [未完成|pending] Hifiasm组装|Hifiasm assembly
2026-02-03 22:20:18.534 - INFO -   [已完成|completed] GFA转FASTA|GFA to FASTA conversion
2026-02-03 22:20:18.534 - INFO -   [已完成|completed] Contig-reads映射生成|Contig-reads mapping generated
2026-02-03 22:20:18.535 - INFO - NGS polish步骤|NGS polish steps:
2026-02-03 22:20:18.535 - INFO -   [未完成|pending] BWA比对|BWA alignment
2026-02-03 22:20:18.535 - INFO -   [未完成|pending] 覆盖度过滤|Coverage filter
2026-02-03 22:20:18.535 - INFO -   [未完成|pending] 筛选reads|Filter reads
2026-02-03 22:20:18.535 - INFO -   [未完成|pending] 重新组装|Reassembly
2026-02-03 22:20:18.535 - INFO - ================================================================================
2026-02-03 22:20:18.535 - INFO - 运行hifiasm组装(仅HiFi模式)|Running hifiasm assembly (HiFi only mode)
2026-02-03 22:20:18.535 - INFO - 执行命令|Executing command: hifiasm -o 41 -t 64 --hg-size 85m --n-hap 2 /share/org/YZWL/yzwl_lixg/project/28.大豆疫霉菌三代基因组/01.data/clean/hifi/41.clean.fq.gz 2>&1|tee /share/org/YZWL/yzwl_lixg/project/28.大豆疫霉菌三代基因组/02.hifiasm/41/05.logs/hifiasm_assembly.log
Reads has been loaded.
Loading ma_hit_ts from disk... 
ma_hit_ts has been read.
Loading ma_hit_ts from disk... 
ma_hit_ts has been read.
[M::ha_assemble::137.707*0.99] ==> loaded corrected reads and overlaps from disk
[M::ha_opt_update_cov_min] updated max_n_chain to 1350
[M::purge_dups] homozygous read coverage threshold: 540
[M::purge_dups] purge duplication coverage threshold: 675
[M::ug_ext_gfa::] # tips::90
Writing raw unitig GFA to disk... 
Writing processed unitig GFA to disk... 
[M::purge_dups] homozygous read coverage threshold: 540
[M::purge_dups] purge duplication coverage threshold: 675
[M::mc_solve:: # edges: 1160]
[M::mc_solve_core_adv::0.105] ==> Partition
[M::adjust_utg_by_primary] primary contig coverage range: [459, infinity]
Writing 41.bp.p_ctg.gfa to disk... 
[M::reduce_hamming_error_adv::0.091] # inserted edges: 16, # fixed bubbles: 8
[M::adjust_utg_by_trio] primary contig coverage range: [459, infinity]
[M::recall_arcs] # transitive arcs::76
[M::recall_arcs] # new arcs::5002, # old arcs::3622
[M::clean_trio_untig_graph] # adjusted arcs::0
[M::adjust_utg_by_trio] primary contig coverage range: [459, infinity]
[M::recall_arcs] # transitive arcs::96
[M::recall_arcs] # new arcs::5376, # old arcs::3716
[M::clean_trio_untig_graph] # adjusted arcs::0
[M::output_trio_graph_joint] dedup_base::13106059, miss_base::0
Writing 41.bp.hap1.p_ctg.gfa to disk... 
Writing 41.bp.hap2.p_ctg.gfa to disk... 
Inconsistency threshold for low-quality regions in BED files: 70%
[M::main] Version: 0.25.0-r726
[M::main] CMD: hifiasm -o 41 -t 64 --hg-size 85m --n-hap 2 /share/org/YZWL/yzwl_lixg/project/28.大豆疫霉菌三代基因组/01.data/clean/hifi/41.clean.fq.gz
[M::main] Real time: 2647.288 sec; CPU: 2736.939 sec; Peak RSS: 52.684 GB
2026-02-03 23:04:27.200 - INFO - 命令执行成功|Command executed successfully
2026-02-03 23:04:27.200 - INFO - 组装完成(HiFi only)|Assembly completed(HiFi only)
2026-02-03 23:04:27.200 - INFO - 检测到FASTA转换已完成，跳过|FASTA conversion already completed, skipping
2026-02-03 23:04:27.200 - INFO - 转换GFA为FASTA格式|Converting GFA to FASTA format
2026-02-03 23:04:27.200 - WARNING - 文件不存在|File not found: 41.hap1.p_ctg.gfa
2026-02-03 23:04:27.200 - WARNING - 文件不存在|File not found: 41.hap2.p_ctg.gfa
2026-02-03 23:04:27.200 - WARNING - 文件不存在|File not found: 41.p_ctg.gfa
2026-02-03 23:04:27.200 - WARNING - 文件不存在|File not found: 41.a_ctg.gfa
2026-02-03 23:04:27.200 - INFO - 检测到contig-reads映射已生成，跳过|Contig-reads mapping already generated, skipping
2026-02-03 23:04:27.201 - INFO - ================================================================================
2026-02-03 23:04:27.203 - INFO - 检测到NGS数据，开始NGS polish流程|NGS data detected, starting NGS polish
2026-02-03 23:04:27.203 - INFO - ================================================================================
2026-02-03 23:04:27.203 - INFO - ================================================================================
2026-02-03 23:04:27.203 - INFO - 开始NGS polish流程|Starting NGS Polish Pipeline
2026-02-03 23:04:27.203 - INFO - ================================================================================
2026-02-03 23:04:27.203 - INFO - [1/4] 运行BWA比对|Running BWA alignment
2026-02-03 23:04:27.810 - INFO - ================================================================================
2026-02-03 23:04:27.810 - INFO - 开始BWA全基因组比对分析流程|Starting BWA alignment pipeline
2026-02-03 23:04:27.810 - INFO - ================================================================================
2026-02-03 23:04:27.810 - INFO - 步骤1/6: 检查依赖软件|Step 1/6: Checking dependencies
2026-02-03 23:04:27.810 - INFO - 检查依赖软件|Checking dependencies
2026-02-03 23:04:28.330 - INFO - BWA 可用|BWA available: [main]
2026-02-03 23:04:30.569 - INFO - SAMtools 可用|SAMtools available: samtools
2026-02-03 23:04:30.569 - INFO - 步骤2/6: 检查基因组索引|Step 2/6: Checking genome index
2026-02-03 23:04:30.569 - INFO - 检查基因组索引|Checking genome index
2026-02-03 23:04:30.569 - INFO - 缺少索引文件|Missing index files: .amb, .ann, .bwt, .pac, .sa
2026-02-03 23:04:30.569 - INFO - 开始构建BWA索引|Building BWA index
2026-02-03 23:04:30.569 - INFO - 执行步骤|Executing step: 构建BWA索引|Building BWA index
2026-02-03 23:04:30.569 - INFO - 命令|Command: bwa index /share/org/YZWL/yzwl_lixg/project/28.大豆疫霉菌三代基因组/02.hifiasm/41/02.fasta/41.primary.fa
2026-02-03 23:05:33.204 - INFO - 命令执行成功|Command executed successfully
2026-02-03 23:05:33.204 - INFO - BWA索引构建成功|BWA index built successfully
2026-02-03 23:05:33.204 - INFO - 步骤3/6: 查找FASTQ文件|Step 3/6: Finding FASTQ files
2026-02-03 23:05:33.204 - INFO - 查找FASTQ文件|Finding FASTQ files
2026-02-03 23:05:33.204 - INFO - 输入目录|Input directory: /share/org/YZWL/yzwl_lixg/project/28.大豆疫霉菌三代基因组/01.data/ngs/41
2026-02-03 23:05:33.204 - INFO - 匹配模式|Pattern: _1.clean.fq.gz
2026-02-03 23:05:33.204 - INFO - 找到样品|Found sample: 41
2026-02-03 23:05:33.204 - INFO - 共找到 1 个样品对|Found 1 sample pairs
2026-02-03 23:05:33.204 - INFO - 步骤4/6: 批量比对 (1 个样品)|Step 4/6: Batch alignment (1 samples)
2026-02-03 23:05:33.204 - INFO - ================================================================================
2026-02-03 23:05:33.204 - INFO - 处理样品 1/1: 41|Processing sample 1/1: 41
2026-02-03 23:05:33.204 - INFO - ================================================================================
2026-02-03 23:05:33.204 - INFO - 开始比对样品|Starting alignment for sample: 41
2026-02-03 23:05:33.205 - INFO - 执行步骤|Executing step: BWA mem比对|BWA mem alignment: 41
2026-02-03 23:05:33.205 - INFO - 命令|Command: bwa mem -t 64 -k 19 -w 100 -d 100 -r 1.5 -y 20 -c 500 -D 0.5 -W 0 -m 50 -A 1 -B 4 -O 6,6 -E 1,1 -L 5,5 -U 17 -T 30 -h 5,200 -R '@RG\tID:41\tSM:41\tPL:ILLUMINA' /share/org/YZWL/yzwl_lixg/project/28.大豆疫霉菌三代基因组/02.hifiasm/41/02.fasta/41.primary.fa /share/org/YZWL/yzwl_lixg/project/28.大豆疫霉菌三代基因组/01.data/ngs/41/41_1.clean.fq.gz /share/org/YZWL/yzwl_lixg/project/28.大豆疫霉菌三代基因组/01.data/ngs/41/41_2.clean.fq.gz > /share/org/YZWL/yzwl_lixg/project/28.大豆疫霉菌三代基因组/02.hifiasm/41/03.ngs_polish/01.bwa_alignment/bam/41.sam
2026-02-03 23:10:06.614 - INFO - 命令执行成功|Command executed successfully
2026-02-03 23:10:06.615 - INFO - 执行步骤|Executing step: SAM转BAM|SAM to BAM conversion
2026-02-03 23:10:06.615 - INFO - 命令|Command: samtools view -@ 64 -b -o /share/org/YZWL/yzwl_lixg/project/28.大豆疫霉菌三代基因组/02.hifiasm/41/03.ngs_polish/01.bwa_alignment/bam/41.raw.bam /share/org/YZWL/yzwl_lixg/project/28.大豆疫霉菌三代基因组/02.hifiasm/41/03.ngs_polish/01.bwa_alignment/bam/41.sam
2026-02-03 23:10:32.980 - INFO - 命令执行成功|Command executed successfully
2026-02-03 23:10:32.980 - INFO - 执行步骤|Executing step: 排序BAM|Sorting BAM
2026-02-03 23:10:32.980 - INFO - 命令|Command: samtools sort -@ 64 -o /share/org/YZWL/yzwl_lixg/project/28.大豆疫霉菌三代基因组/02.hifiasm/41/03.ngs_polish/01.bwa_alignment/bam/41.sorted.bam /share/org/YZWL/yzwl_lixg/project/28.大豆疫霉菌三代基因组/02.hifiasm/41/03.ngs_polish/01.bwa_alignment/bam/41.raw.bam
2026-02-03 23:11:09.121 - INFO - 命令执行成功|Command executed successfully
2026-02-03 23:11:09.122 - INFO - 执行步骤|Executing step: 构建BAM索引|Building BAM index
2026-02-03 23:11:09.122 - INFO - 命令|Command: samtools index -@ 64 /share/org/YZWL/yzwl_lixg/project/28.大豆疫霉菌三代基因组/02.hifiasm/41/03.ngs_polish/01.bwa_alignment/bam/41.bam
2026-02-03 23:11:11.567 - INFO - 命令执行成功|Command executed successfully
2026-02-03 23:11:11.567 - INFO - 清理中间文件|Cleaning up intermediate files
2026-02-03 23:11:11.567 - INFO - 已删除SAM文件|Removed SAM file: 41.sam
2026-02-03 23:11:11.567 - INFO - 已删除原始BAM|Removed raw BAM: 41.raw.bam
2026-02-03 23:11:11.568 - INFO - 样品比对完成|Sample alignment completed: 41
2026-02-03 23:11:11.568 - INFO - 生成比对统计|Generating alignment statistics: 41
2026-02-03 23:11:11.568 - INFO - 执行步骤|Executing step: 生成flagstat统计|Generating flagstat: 41
2026-02-03 23:11:11.568 - INFO - 命令|Command: samtools flagstat /share/org/YZWL/yzwl_lixg/project/28.大豆疫霉菌三代基因组/02.hifiasm/41/03.ngs_polish/01.bwa_alignment/bam/41.bam > /share/org/YZWL/yzwl_lixg/project/28.大豆疫霉菌三代基因组/02.hifiasm/41/03.ngs_polish/01.bwa_alignment/stats/41.flagstat.txt
2026-02-03 23:11:24.885 - INFO - 命令执行成功|Command executed successfully
2026-02-03 23:11:24.885 - INFO - 执行步骤|Executing step: 生成详细统计|Generating detailed stats: 41
2026-02-03 23:11:24.885 - INFO - 命令|Command: samtools stats /share/org/YZWL/yzwl_lixg/project/28.大豆疫霉菌三代基因组/02.hifiasm/41/03.ngs_polish/01.bwa_alignment/bam/41.bam > /share/org/YZWL/yzwl_lixg/project/28.大豆疫霉菌三代基因组/02.hifiasm/41/03.ngs_polish/01.bwa_alignment/stats/41.stats.txt
2026-02-03 23:12:28.671 - INFO - 命令执行成功|Command executed successfully
2026-02-03 23:12:28.671 - INFO - 统计生成完成|Statistics generation completed: 41
2026-02-03 23:12:28.671 - INFO - 开始覆盖度分析|Starting coverage analysis: 41
2026-02-03 23:12:28.672 - INFO - 执行步骤|Executing step: 计算位点覆盖度|Calculating depth: 41
2026-02-03 23:12:28.672 - INFO - 命令|Command: samtools depth /share/org/YZWL/yzwl_lixg/project/28.大豆疫霉菌三代基因组/02.hifiasm/41/03.ngs_polish/01.bwa_alignment/bam/41.bam > /share/org/YZWL/yzwl_lixg/project/28.大豆疫霉菌三代基因组/02.hifiasm/41/03.ngs_polish/01.bwa_alignment/coverage/41.depth.txt
2026-02-03 23:12:48.360 - INFO - 命令执行成功|Command executed successfully
2026-02-03 23:12:48.360 - INFO - 计算滑窗覆盖度|Calculating windowed coverage
2026-02-03 23:12:48.360 - INFO -    窗口大小|Window size: 1,000,000 bp
2026-02-03 23:12:48.360 - INFO -    步长|Step size: 100,000 bp
2026-02-03 23:14:23.951 - INFO - 滑窗覆盖度计算完成|Windowed coverage completed
2026-02-03 23:14:23.951 - INFO -    输出文件|Output file: /share/org/YZWL/yzwl_lixg/project/28.大豆疫霉菌三代基因组/02.hifiasm/41/03.ngs_polish/01.bwa_alignment/windows/41.window.bed
2026-02-03 23:14:23.951 - INFO - 覆盖度分析完成|Coverage analysis completed: 41
2026-02-03 23:14:23.952 - INFO - 步骤6/6: 生成汇总报告|Step 6/6: Generating summary report
2026-02-03 23:14:23.952 - INFO - 生成汇总报告|Generating summary report
2026-02-03 23:14:23.952 - INFO - 汇总报告已生成|Summary report generated: /share/org/YZWL/yzwl_lixg/project/28.大豆疫霉菌三代基因组/02.hifiasm/41/03.ngs_polish/01.bwa_alignment/alignment_summary.txt
2026-02-03 23:14:23.952 - INFO - ================================================================================
2026-02-03 23:14:23.952 - INFO - BWA全基因组比对分析完成|BWA alignment analysis completed
2026-02-03 23:14:23.952 - INFO - ================================================================================
2026-02-03 23:14:23.952 - INFO - 成功处理样品数|Successfully processed: 1/1
2026-02-03 23:14:23.952 - INFO - 输出目录|Output directory: /share/org/YZWL/yzwl_lixg/project/28.大豆疫霉菌三代基因组/02.hifiasm/41/03.ngs_polish/01.bwa_alignment
2026-02-03 23:14:23.952 - INFO - BWA比对完成|BWA alignment completed: /share/org/YZWL/yzwl_lixg/project/28.大豆疫霉菌三代基因组/02.hifiasm/41/03.ngs_polish/01.bwa_alignment
2026-02-03 23:14:23.952 - INFO - [2/4] 运行覆盖度过滤|Running coverage filter
2026-02-03 23:14:24.998 - INFO - 使用BAM文件|Using BAM file: /share/org/YZWL/yzwl_lixg/project/28.大豆疫霉菌三代基因组/02.hifiasm/41/03.ngs_polish/01.bwa_alignment/bam/41.bam
2026-02-03 23:14:25.152 - INFO - ============================================================
2026-02-03 23:14:25.152 - INFO - 覆盖度过滤流程|Coverage Filter Pipeline
2026-02-03 23:14:25.152 - INFO - ============================================================
2026-02-03 23:14:25.235 - INFO - 所有依赖检查通过|All dependencies check passed
2026-02-03 23:14:25.236 - INFO - [1/4] 计算覆盖度|Calculating coverage
2026-02-03 23:14:25.236 - INFO - 开始计算覆盖度|Starting coverage calculation
2026-02-03 23:14:25.236 - INFO - 执行步骤|Executing step: 覆盖度计算|Coverage calculation
2026-02-03 23:15:15.353 - INFO - 覆盖度文件已生成|Coverage file generated: /share/org/YZWL/yzwl_lixg/project/28.大豆疫霉菌三代基因组/02.hifiasm/41/03.ngs_polish/02.coverage_filter/41_coverage.txt
2026-02-03 23:15:15.354 - INFO - [2/4] 分类序列质量|Classifying sequence quality
2026-02-03 23:15:15.354 - INFO - 开始分类序列质量|Starting sequence quality classification
2026-02-03 23:15:15.354 - INFO - 执行步骤|Executing step: 提取高质量序列|Extracting high quality sequences
2026-02-03 23:15:15.725 - INFO - 高质量序列|High quality sequences: 162
2026-02-03 23:15:15.725 - INFO - 执行步骤|Executing step: 提取中等质量序列|Extracting medium quality sequences
2026-02-03 23:15:15.730 - INFO - 中等质量序列|Medium quality sequences: 317
2026-02-03 23:15:15.730 - INFO - 执行步骤|Executing step: 提取低质量序列|Extracting low quality sequences
2026-02-03 23:15:15.735 - INFO - 低质量序列|Low quality sequences: 3
2026-02-03 23:15:15.735 - INFO - [3/4] 提取过滤后的序列|Extracting filtered sequences
2026-02-03 23:15:15.735 - INFO - 开始提取序列|Starting sequence extraction
2026-02-03 23:15:15.735 - INFO - 执行步骤|Executing step: 提取高质量序列|Extracting high quality sequences
2026-02-03 23:15:16.159 - INFO - 执行步骤|Executing step: 提取中等质量序列|Extracting medium quality sequences
2026-02-03 23:15:16.275 - INFO - 执行步骤|Executing step: 提取低质量序列|Extracting low quality sequences
2026-02-03 23:15:16.333 - INFO - 序列提取完成|Sequence extraction completed
2026-02-03 23:15:16.333 - INFO - [4/4] 生成统计报告|Generating statistics report
2026-02-03 23:15:16.333 - INFO - 开始生成统计信息|Starting statistics generation
2026-02-03 23:15:16.457 - INFO - 原始序列统计完成|Original sequence statistics completed
2026-02-03 23:15:16.517 - INFO - 高质量序列统计完成|High quality sequence statistics completed
2026-02-03 23:15:16.541 - INFO - 中等质量序列统计完成|Medium quality sequence statistics completed
2026-02-03 23:15:16.556 - INFO - 低质量序列统计完成|Low quality sequence statistics completed
2026-02-03 23:15:16.575 - INFO - 报告已保存到|Report saved to: /share/org/YZWL/yzwl_lixg/project/28.大豆疫霉菌三代基因组/02.hifiasm/41/03.ngs_polish/02.coverage_filter/41_report.txt
2026-02-03 23:15:16.575 - INFO - ============================================================
2026-02-03 23:15:16.576 - INFO - 过滤流程完成|Filter pipeline completed
2026-02-03 23:15:16.576 - INFO - ============================================================
2026-02-03 23:15:16.576 - INFO - 覆盖度过滤完成|Coverage filter completed: /share/org/YZWL/yzwl_lixg/project/28.大豆疫霉菌三代基因组/02.hifiasm/41/03.ngs_polish/02.coverage_filter/41_high_quality.list
2026-02-03 23:15:16.576 - INFO - [3/4] 提取高质量HiFi reads|Extracting high-quality HiFi reads
2026-02-03 23:15:16.576 - INFO - 从contig-reads映射中提取read names|Extracting read names from contig-reads mapping
2026-02-03 23:15:16.576 - INFO - 执行命令|Executing: grep -Fwf /share/org/YZWL/yzwl_lixg/project/28.大豆疫霉菌三代基因组/02.hifiasm/41/03.ngs_polish/02.coverage_filter/41_high_quality.list /share/org/YZWL/yzwl_lixg/project/28.大豆疫霉菌三代基因组/02.hifiasm/41/02.fasta/41.p_ctg.contig_reads.tsv | cut -f2 > /share/org/YZWL/yzwl_lixg/project/28.大豆疫霉菌三代基因组/02.hifiasm/41/03.ngs_polish/03.filtered_reads/high_quality_read_names.txt
2026-02-03 23:15:16.621 - INFO - 找到|Found 46648 个高质量reads|high-quality reads
2026-02-03 23:15:16.622 - INFO - 使用seqkit提取reads|Extracting reads using seqkit
2026-02-03 23:15:16.622 - INFO - 执行命令|Executing: seqkit grep -n -f /share/org/YZWL/yzwl_lixg/project/28.大豆疫霉菌三代基因组/02.hifiasm/41/03.ngs_polish/03.filtered_reads/high_quality_read_names.txt /share/org/YZWL/yzwl_lixg/project/28.大豆疫霉菌三代基因组/01.data/clean/hifi/41.clean.fq.gz -j 64 -o /share/org/YZWL/yzwl_lixg/project/28.大豆疫霉菌三代基因组/02.hifiasm/41/03.ngs_polish/03.filtered_reads/41_high_quality_reads.fq.gz
2026-02-03 23:26:53.257 - INFO - 高质量reads提取完成|High-quality reads extracted: /share/org/YZWL/yzwl_lixg/project/28.大豆疫霉菌三代基因组/02.hifiasm/41/03.ngs_polish/03.filtered_reads/41_high_quality_reads.fq.gz
2026-02-03 23:26:53.257 - INFO - [4/4] 使用高质量reads重新组装|Reassembly with high-quality reads
2026-02-03 23:26:53.258 - INFO - 使用筛选后的reads进行重新组装|Reassembly with filtered reads: /share/org/YZWL/yzwl_lixg/project/28.大豆疫霉菌三代基因组/02.hifiasm/41/03.ngs_polish/03.filtered_reads/41_high_quality_reads.fq.gz
2026-02-03 23:26:53.258 - INFO - 运行hifiasm组装(仅HiFi模式)|Running hifiasm assembly (HiFi only mode)
2026-02-03 23:26:53.258 - INFO - 执行命令|Executing command: hifiasm -o 41 -t 64 --hg-size 85m --n-hap 2 /share/org/YZWL/yzwl_lixg/project/28.大豆疫霉菌三代基因组/02.hifiasm/41/03.ngs_polish/03.filtered_reads/41_high_quality_reads.fq.gz 2>&1|tee /share/org/YZWL/yzwl_lixg/project/28.大豆疫霉菌三代基因组/02.hifiasm/41/05.logs/hifiasm_assembly.log
[M::ha_analyze_count] lowest: count[5] = 33973
[M::ha_analyze_count] highest: count[15] = 5966589
[M::ha_hist_line]     2: ** 100212
[M::ha_hist_line]     3: * 45684
[M::ha_hist_line]     4: * 32952
[M::ha_hist_line]     5: * 33973
[M::ha_hist_line]     6: * 53372
[M::ha_hist_line]     7: ** 124326
[M::ha_hist_line]     8: ***** 295817
[M::ha_hist_line]     9: *********** 681167
[M::ha_hist_line]    10: ************************** 1522705
[M::ha_hist_line]    11: ****************************************** 2498173
[M::ha_hist_line]    12: **************************************************************** 3815951
[M::ha_hist_line]    13: ************************************************************************************ 5011550
[M::ha_hist_line]    14: ************************************************************************************************ 5751726
[M::ha_hist_line]    15: **************************************************************************************************** 5966589
[M::ha_hist_line]    16: ******************************************************************************************* 5439616
[M::ha_hist_line]    17: ****************************************************************************** 4648058
[M::ha_hist_line]    18: ************************************************************ 3552555
[M::ha_hist_line]    19: ******************************************* 2572484
[M::ha_hist_line]    20: ***************************** 1713710
[M::ha_hist_line]    21: ****************** 1100728
[M::ha_hist_line]    22: ************ 700531
[M::ha_hist_line]    23: ******* 417766
[M::ha_hist_line]    24: ***** 279965
[M::ha_hist_line]    25: *** 207426
[M::ha_hist_line]    26: *** 185791
[M::ha_hist_line]    27: *** 185580
[M::ha_hist_line]    28: *** 185647
[M::ha_hist_line]    29: *** 197883
[M::ha_hist_line]    30: **** 213699
[M::ha_hist_line]    31: *** 201614
[M::ha_hist_line]    32: *** 182309
[M::ha_hist_line]    33: *** 157011
[M::ha_hist_line]    34: ** 134476
[M::ha_hist_line]    35: ** 109901
[M::ha_hist_line]    36: * 87701
[M::ha_hist_line]    37: * 71397
[M::ha_hist_line]    38: * 60232
[M::ha_hist_line]    39: * 53064
[M::ha_hist_line]    40: * 51358
[M::ha_hist_line]    41: * 47890
[M::ha_hist_line]    42: * 46674
[M::ha_hist_line]    43: * 46736
[M::ha_hist_line]    44: * 46529
[M::ha_hist_line]    45: * 44997
[M::ha_hist_line]    46: * 40705
[M::ha_hist_line]    47: * 36880
[M::ha_hist_line]    48: * 37656
[M::ha_hist_line]    49: * 36373
[M::ha_hist_line]    50: * 32680
[M::ha_hist_line]  rest: ******************** 1174352
[M::ha_analyze_count] left: none
[M::ha_analyze_count] right: none
[M::ha_ft_gen] peak_hom: 15; peak_het: -1
[M::ha_ct_shrink::18.438*7.69] ==> counted 736852 distinct minimizer k-mers
[M::ha_ft_gen::18.616*7.62@17.433GB] ==> filtered out 736852 k-mers occurring 75 or more times
[M::ha_opt_update_cov] updated max_n_chain to 100
[M::yak_count] collected 37704088 minimizers
[M::ha_pt_gen::31.068*6.44] ==> counted 2753414 distinct minimizer k-mers
[M::ha_pt_gen] count[4095] = 0 (for sanity check)
[M::ha_analyze_count] lowest: count[5] = 3042
[M::ha_analyze_count] highest: count[15] = 251598
[M::ha_hist_line]     1: ****************************************************************************************************> 576470
[M::ha_hist_line]     2: ****** 15291
[M::ha_hist_line]     3: ** 4740
[M::ha_hist_line]     4: * 3289
[M::ha_hist_line]     5: * 3042
[M::ha_hist_line]     6: ** 3857
[M::ha_hist_line]     7: *** 7709
[M::ha_hist_line]     8: ****** 14860
[M::ha_hist_line]     9: ************* 32075
[M::ha_hist_line]    10: *************************** 67823
[M::ha_hist_line]    11: ******************************************** 109494
[M::ha_hist_line]    12: ****************************************************************** 164891
[M::ha_hist_line]    13: ************************************************************************************* 214159
[M::ha_hist_line]    14: ************************************************************************************************* 243973
[M::ha_hist_line]    15: **************************************************************************************************** 251598
[M::ha_hist_line]    16: ******************************************************************************************* 228044
[M::ha_hist_line]    17: ***************************************************************************** 194330
[M::ha_hist_line]    18: *********************************************************** 148556
[M::ha_hist_line]    19: ******************************************* 107717
[M::ha_hist_line]    20: ***************************** 72107
[M::ha_hist_line]    21: ******************* 47056
[M::ha_hist_line]    22: ************ 29927
[M::ha_hist_line]    23: ******* 18606
[M::ha_hist_line]    24: ***** 13094
[M::ha_hist_line]    25: **** 10200
[M::ha_hist_line]    26: **** 9586
[M::ha_hist_line]    27: **** 9754
[M::ha_hist_line]    28: **** 9616
[M::ha_hist_line]    29: **** 10456
[M::ha_hist_line]    30: **** 10767
[M::ha_hist_line]    31: **** 10383
[M::ha_hist_line]    32: **** 9309
[M::ha_hist_line]    33: *** 8283
[M::ha_hist_line]    34: *** 6959
[M::ha_hist_line]    35: ** 5917
[M::ha_hist_line]    36: ** 4960
[M::ha_hist_line]    37: ** 3997
[M::ha_hist_line]    38: * 3700
[M::ha_hist_line]    39: * 3185
[M::ha_hist_line]    40: * 3111
[M::ha_hist_line]    41: * 2851
[M::ha_hist_line]    42: * 2988
[M::ha_hist_line]    43: * 2813
[M::ha_hist_line]    44: * 2824
[M::ha_hist_line]    45: * 2819
[M::ha_hist_line]    46: * 2577
[M::ha_hist_line]    47: * 2503
[M::ha_hist_line]    48: * 2530
[M::ha_hist_line]    49: * 2366
[M::ha_hist_line]    50: * 2213
[M::ha_hist_line]    51: * 1924
[M::ha_hist_line]    52: * 1917
[M::ha_hist_line]    53: * 1758
[M::ha_hist_line]    54: * 1651
[M::ha_hist_line]    55: * 1516
[M::ha_hist_line]    56: * 1507
[M::ha_hist_line]    57: * 1443
[M::ha_hist_line]    58: * 1427
[M::ha_hist_line]    59: * 1339
[M::ha_hist_line]    60: * 1357
[M::ha_hist_line]    61: * 1329
[M::ha_hist_line]    62: * 1313
[M::ha_hist_line]  rest: ****** 15558
[M::ha_analyze_count] left: none
[M::ha_analyze_count] right: none
[M::ha_pt_gen] peak_hom: 15; peak_het: -1
[M::ha_ct_shrink::31.076*6.44] ==> counted 2176944 distinct minimizer k-mers
[M::ha_pt_gen::] counting in normal mode
[M::yak_count] collected 37704088 minimizers
[M::ha_pt_gen::33.035*7.57] ==> indexed 37127618 positions, counted 2176944 distinct minimizer k-mers
[M::pec::16.184] # bases: 1317496538; # corrected bases: 2461328
[M::pec::0.092] # exact o: 1351540; # non-exact o: 72800
[M::ha_assemble::49.434*25.65@17.433GB] ==> corrected reads for round 1
[M::ha_assemble] # bases: 1317496538; # corrected bases: 2461328
[M::yak_count] collected 37562480 minimizers
[M::ha_pt_gen::51.094*25.73] ==> counted 2175513 distinct minimizer k-mers
[M::ha_pt_gen] count[4095] = 0 (for sanity check)
[M::ha_analyze_count] lowest: count[5] = 2593
[M::ha_analyze_count] highest: count[15] = 253161
[M::ha_hist_line]     1: ****** 15813
[M::ha_hist_line]     2: * 2303
[M::ha_hist_line]     3: * 2831
[M::ha_hist_line]     4: * 2490
[M::ha_hist_line]     5: * 2593
[M::ha_hist_line]     6: * 3250
[M::ha_hist_line]     7: *** 6483
[M::ha_hist_line]     8: ***** 12577
[M::ha_hist_line]     9: *********** 27012
[M::ha_hist_line]    10: ************************ 61596
[M::ha_hist_line]    11: **************************************** 100094
[M::ha_hist_line]    12: ************************************************************* 155312
[M::ha_hist_line]    13: ********************************************************************************** 206623
[M::ha_hist_line]    14: ********************************************************************************************** 238395
[M::ha_hist_line]    15: **************************************************************************************************** 253161
[M::ha_hist_line]    16: ******************************************************************************************** 232791
[M::ha_hist_line]    17: ******************************************************************************** 201724
[M::ha_hist_line]    18: ************************************************************** 155814
[M::ha_hist_line]    19: ********************************************* 115079
[M::ha_hist_line]    20: ******************************* 77513
[M::ha_hist_line]    21: ******************** 51382
[M::ha_hist_line]    22: ************* 32800
[M::ha_hist_line]    23: ******** 19877
[M::ha_hist_line]    24: ***** 13868
[M::ha_hist_line]    25: **** 10341
[M::ha_hist_line]    26: **** 9386
[M::ha_hist_line]    27: **** 9684
[M::ha_hist_line]    28: **** 9443
[M::ha_hist_line]    29: **** 10114
[M::ha_hist_line]    30: **** 10708
[M::ha_hist_line]    31: **** 10508
[M::ha_hist_line]    32: **** 9827
[M::ha_hist_line]    33: *** 8518
[M::ha_hist_line]    34: *** 7515
[M::ha_hist_line]    35: ** 6263
[M::ha_hist_line]    36: ** 5180
[M::ha_hist_line]    37: ** 4272
[M::ha_hist_line]    38: ** 3841
[M::ha_hist_line]    39: * 3250
[M::ha_hist_line]    40: * 3182
[M::ha_hist_line]    41: * 2833
[M::ha_hist_line]    42: * 2994
[M::ha_hist_line]    43: * 2672
[M::ha_hist_line]    44: * 2906
[M::ha_hist_line]    45: * 2814
[M::ha_hist_line]    46: * 2647
[M::ha_hist_line]    47: * 2378
[M::ha_hist_line]    48: * 2531
[M::ha_hist_line]    49: * 2560
[M::ha_hist_line]    50: * 2266
[M::ha_hist_line]    51: * 1991
[M::ha_hist_line]    52: * 1983
[M::ha_hist_line]    53: * 1872
[M::ha_hist_line]    54: * 1657
[M::ha_hist_line]    55: * 1579
[M::ha_hist_line]    56: * 1541
[M::ha_hist_line]    57: * 1383
[M::ha_hist_line]    58: * 1491
[M::ha_hist_line]    59: * 1389
[M::ha_hist_line]    60: * 1344
[M::ha_hist_line]    61: * 1299
[M::ha_hist_line]  rest: ******* 17970
[M::ha_analyze_count] left: none
[M::ha_analyze_count] right: none
[M::ha_pt_gen] peak_hom: 15; peak_het: -1
[M::ha_ct_shrink::51.099*25.73] ==> counted 2159700 distinct minimizer k-mers
[M::ha_pt_gen::] counting in normal mode
[M::yak_count] collected 37562480 minimizers
[M::ha_pt_gen::53.238*25.61] ==> indexed 37546667 positions, counted 2159700 distinct minimizer k-mers
[M::pec::11.347] # bases: 1317496279; # corrected bases: 23130
[M::pec::0.096] # exact o: 1519342; # non-exact o: 27987
[M::ha_assemble::64.726*31.97@17.433GB] ==> corrected reads for round 2
[M::ha_assemble] # bases: 1317496279; # corrected bases: 23130
[M::yak_count] collected 37553299 minimizers
[M::ha_pt_gen::66.321*31.90] ==> counted 2164194 distinct minimizer k-mers
[M::ha_pt_gen] count[4095] = 0 (for sanity check)
[M::ha_analyze_count] lowest: count[5] = 2593
[M::ha_analyze_count] highest: count[15] = 253204
[M::ha_hist_line]     1: ** 5265
[M::ha_hist_line]     2: * 1742
[M::ha_hist_line]     3: * 2562
[M::ha_hist_line]     4: * 2309
[M::ha_hist_line]     5: * 2593
[M::ha_hist_line]     6: * 3271
[M::ha_hist_line]     7: *** 6530
[M::ha_hist_line]     8: ***** 12751
[M::ha_hist_line]     9: *********** 27065
[M::ha_hist_line]    10: ************************ 61515
[M::ha_hist_line]    11: **************************************** 100074
[M::ha_hist_line]    12: ************************************************************* 155352
[M::ha_hist_line]    13: ********************************************************************************** 206601
[M::ha_hist_line]    14: ********************************************************************************************** 238346
[M::ha_hist_line]    15: **************************************************************************************************** 253204
[M::ha_hist_line]    16: ******************************************************************************************** 232753
[M::ha_hist_line]    17: ******************************************************************************** 201711
[M::ha_hist_line]    18: ************************************************************** 155938
[M::ha_hist_line]    19: ********************************************* 115024
[M::ha_hist_line]    20: ******************************* 77592
[M::ha_hist_line]    21: ******************** 51353
[M::ha_hist_line]    22: ************* 32867
[M::ha_hist_line]    23: ******** 19918
[M::ha_hist_line]    24: ***** 13854
[M::ha_hist_line]    25: **** 10415
[M::ha_hist_line]    26: **** 9349
[M::ha_hist_line]    27: **** 9652
[M::ha_hist_line]    28: **** 9409
[M::ha_hist_line]    29: **** 10135
[M::ha_hist_line]    30: **** 10703
[M::ha_hist_line]    31: **** 10522
[M::ha_hist_line]    32: **** 9731
[M::ha_hist_line]    33: *** 8540
[M::ha_hist_line]    34: *** 7502
[M::ha_hist_line]    35: ** 6253
[M::ha_hist_line]    36: ** 5138
[M::ha_hist_line]    37: ** 4248
[M::ha_hist_line]    38: ** 3877
[M::ha_hist_line]    39: * 3214
[M::ha_hist_line]    40: * 3187
[M::ha_hist_line]    41: * 2908
[M::ha_hist_line]    42: * 2947
[M::ha_hist_line]    43: * 2662
[M::ha_hist_line]    44: * 2919
[M::ha_hist_line]    45: * 2811
[M::ha_hist_line]    46: * 2638
[M::ha_hist_line]    47: * 2398
[M::ha_hist_line]    48: * 2537
[M::ha_hist_line]    49: * 2519
[M::ha_hist_line]    50: * 2255
[M::ha_hist_line]    51: * 2019
[M::ha_hist_line]    52: * 1952
[M::ha_hist_line]    53: * 1851
[M::ha_hist_line]    54: * 1665
[M::ha_hist_line]    55: * 1606
[M::ha_hist_line]    56: * 1503
[M::ha_hist_line]    57: * 1399
[M::ha_hist_line]    58: * 1479
[M::ha_hist_line]    59: * 1384
[M::ha_hist_line]    60: * 1385
[M::ha_hist_line]    61: * 1276
[M::ha_hist_line]  rest: ******* 18016
[M::ha_analyze_count] left: none
[M::ha_analyze_count] right: none
[M::ha_pt_gen] peak_hom: 15; peak_het: -1
[M::ha_ct_shrink::66.326*31.90] ==> counted 2158929 distinct minimizer k-mers
[M::ha_pt_gen::] counting in normal mode
[M::yak_count] collected 37553299 minimizers
[M::ha_pt_gen::68.382*31.65] ==> indexed 37548034 positions, counted 2158929 distinct minimizer k-mers
[M::pec::11.036] # bases: 1317500611; # corrected bases: 3468
[M::pec::0.089] # exact o: 1554720; # non-exact o: 13017
[M::ha_assemble::79.519*35.69@17.433GB] ==> corrected reads for round 3
[M::ha_assemble] # bases: 1317500611; # corrected bases: 3468
[M::yak_count] collected 37551886 minimizers
[M::ha_pt_gen::81.137*35.55] ==> counted 2162519 distinct minimizer k-mers
[M::ha_pt_gen] count[4095] = 0 (for sanity check)
[M::ha_analyze_count] lowest: count[5] = 2568
[M::ha_analyze_count] highest: count[15] = 253201
[M::ha_hist_line]     1: * 3636
[M::ha_hist_line]     2: * 1703
[M::ha_hist_line]     3: * 2555
[M::ha_hist_line]     4: * 2320
[M::ha_hist_line]     5: * 2568
[M::ha_hist_line]     6: * 3289
[M::ha_hist_line]     7: *** 6526
[M::ha_hist_line]     8: ***** 12740
[M::ha_hist_line]     9: *********** 27071
[M::ha_hist_line]    10: ************************ 61520
[M::ha_hist_line]    11: **************************************** 100083
[M::ha_hist_line]    12: ************************************************************* 155337
[M::ha_hist_line]    13: ********************************************************************************** 206608
[M::ha_hist_line]    14: ********************************************************************************************** 238331
[M::ha_hist_line]    15: **************************************************************************************************** 253201
[M::ha_hist_line]    16: ******************************************************************************************** 232768
[M::ha_hist_line]    17: ******************************************************************************** 201715
[M::ha_hist_line]    18: ************************************************************** 155937
[M::ha_hist_line]    19: ********************************************* 115032
[M::ha_hist_line]    20: ******************************* 77581
[M::ha_hist_line]    21: ******************** 51356
[M::ha_hist_line]    22: ************* 32867
[M::ha_hist_line]    23: ******** 19916
[M::ha_hist_line]    24: ***** 13853
[M::ha_hist_line]    25: **** 10415
[M::ha_hist_line]    26: **** 9338
[M::ha_hist_line]    27: **** 9654
[M::ha_hist_line]    28: **** 9421
[M::ha_hist_line]    29: **** 10135
[M::ha_hist_line]    30: **** 10703
[M::ha_hist_line]    31: **** 10519
[M::ha_hist_line]    32: **** 9733
[M::ha_hist_line]    33: *** 8540
[M::ha_hist_line]    34: *** 7502
[M::ha_hist_line]    35: ** 6263
[M::ha_hist_line]    36: ** 5136
[M::ha_hist_line]    37: ** 4241
[M::ha_hist_line]    38: ** 3872
[M::ha_hist_line]    39: * 3218
[M::ha_hist_line]    40: * 3188
[M::ha_hist_line]    41: * 2908
[M::ha_hist_line]    42: * 2942
[M::ha_hist_line]    43: * 2665
[M::ha_hist_line]    44: * 2923
[M::ha_hist_line]    45: * 2813
[M::ha_hist_line]    46: * 2631
[M::ha_hist_line]    47: * 2393
[M::ha_hist_line]    48: * 2544
[M::ha_hist_line]    49: * 2521
[M::ha_hist_line]    50: * 2253
[M::ha_hist_line]    51: * 2020
[M::ha_hist_line]    52: * 1948
[M::ha_hist_line]    53: * 1854
[M::ha_hist_line]    54: * 1667
[M::ha_hist_line]    55: * 1608
[M::ha_hist_line]    56: * 1494
[M::ha_hist_line]    57: * 1390
[M::ha_hist_line]    58: * 1476
[M::ha_hist_line]    59: * 1390
[M::ha_hist_line]    60: * 1392
[M::ha_hist_line]    61: * 1274
[M::ha_hist_line]  rest: ******* 18022
[M::ha_analyze_count] left: none
[M::ha_analyze_count] right: none
[M::ha_pt_gen] peak_hom: 15; peak_het: -1
[M::ha_ct_shrink::81.142*35.55] ==> counted 2158883 distinct minimizer k-mers
[M::ha_pt_gen::] counting in normal mode
[M::yak_count] collected 37551886 minimizers
[M::ha_pt_gen::83.269*35.23] ==> indexed 37548250 positions, counted 2158883 distinct minimizer k-mers
[M::ha_print_ovlp_stat_0] # overlaps: 1570099
[M::ha_print_ovlp_stat_0] # strong overlaps: 203360
[M::ha_print_ovlp_stat_0] # weak overlaps: 1366739
[M::ha_print_ovlp_stat_0] # exact overlaps: 1556793
[M::ha_print_ovlp_stat_0] # inexact overlaps: 13306
[M::ha_print_ovlp_stat_0] # overlaps without large indels: 1567502
[M::ha_print_ovlp_stat_0] # reverse overlaps: 133914
[M::ha_print_ovlp_stat_0] # running time: 4.644
[M::ha_assemble::87.957*36.18@17.433GB] ==> found overlaps for the final round
[M::ha_opt_update_cov_min] updated max_n_chain to 100
Writing reads to disk... 
Reads has been written.
Writing ma_hit_ts to disk... 
ma_hit_ts has been written.
Writing ma_hit_ts to disk... 
ma_hit_ts has been written.
bin files have been written.
[M::purge_dups] homozygous read coverage threshold: 14
[M::purge_dups] purge duplication coverage threshold: 18
[M::ug_ext_gfa::] # tips::7
Writing raw unitig GFA to disk... 
Writing processed unitig GFA to disk... 
[M::purge_dups] homozygous read coverage threshold: 14
[M::purge_dups] purge duplication coverage threshold: 18
[M::mc_solve:: # edges: 14]
[M::mc_solve_core_adv::0.001] ==> Partition
[M::adjust_utg_by_primary] primary contig coverage range: [11, infinity]
Writing 41.bp.p_ctg.gfa to disk... 
[M::reduce_hamming_error_adv::0.005] # inserted edges: 0, # fixed bubbles: 0
[M::adjust_utg_by_trio] primary contig coverage range: [11, infinity]
[M::recall_arcs] # transitive arcs::32
[M::recall_arcs] # new arcs::1444, # old arcs::904
[M::clean_trio_untig_graph] # adjusted arcs::0
[M::adjust_utg_by_trio] primary contig coverage range: [11, infinity]
[M::recall_arcs] # transitive arcs::280
[M::recall_arcs] # new arcs::1388, # old arcs::716
[M::clean_trio_untig_graph] # adjusted arcs::0
[M::output_trio_graph_joint] dedup_base::39078, miss_base::0
Writing 41.bp.hap1.p_ctg.gfa to disk... 
Writing 41.bp.hap2.p_ctg.gfa to disk... 
Inconsistency threshold for low-quality regions in BED files: 70%
[M::main] Version: 0.25.0-r726
[M::main] CMD: hifiasm -o 41 -t 64 --hg-size 85m --n-hap 2 /share/org/YZWL/yzwl_lixg/project/28.大豆疫霉菌三代基因组/02.hifiasm/41/03.ngs_polish/03.filtered_reads/41_high_quality_reads.fq.gz
[M::main] Real time: 95.622 sec; CPU: 3191.364 sec; Peak RSS: 17.433 GB
2026-02-03 23:28:29.030 - INFO - 命令执行成功|Command executed successfully
2026-02-03 23:28:29.030 - INFO - 组装完成(HiFi only)|Assembly completed(HiFi only)
2026-02-03 23:28:29.030 - INFO - 转换GFA为FASTA格式|Converting GFA to FASTA format
2026-02-03 23:28:29.030 - WARNING - 文件不存在|File not found: 41.hap1.p_ctg.gfa
2026-02-03 23:28:29.030 - WARNING - 文件不存在|File not found: 41.hap2.p_ctg.gfa
2026-02-03 23:28:29.030 - WARNING - 文件不存在|File not found: 41.p_ctg.gfa
2026-02-03 23:28:29.031 - WARNING - 文件不存在|File not found: 41.a_ctg.gfa
2026-02-03 23:28:29.031 - INFO - ============================================================
2026-02-03 23:28:29.031 - INFO - 生成Contig-Reads映射|Generating Contig-Reads mapping
2026-02-03 23:28:29.031 - INFO - ============================================================
2026-02-03 23:28:29.031 - INFO - 跳过|Skip: 41.p_ctg.gfa (不存在|not exist)
2026-02-03 23:28:29.031 - INFO - 跳过|Skip: 41.hap1.p_ctg.gfa (不存在|not exist)
2026-02-03 23:28:29.031 - INFO - 跳过|Skip: 41.hap2.p_ctg.gfa (不存在|not exist)
2026-02-03 23:28:29.031 - INFO - 成功处理|Successfully processed: 0/3 个文件
2026-02-03 23:28:29.031 - INFO - ============================================================
2026-02-03 23:28:29.031 - INFO - 复制最终组装结果|Copying final assembly results
2026-02-03 23:28:29.047 - INFO - 重新组装完成|Reassembly completed
2026-02-03 23:28:29.047 - INFO - 最终结果保存在|Final results saved to: /share/org/YZWL/yzwl_lixg/project/28.大豆疫霉菌三代基因组/02.hifiasm/41/03.ngs_polish/04.reassembly
2026-02-03 23:28:29.047 - INFO - ================================================================================
2026-02-03 23:28:29.047 - INFO - NGS polish流程完成|NGS Polish Pipeline Completed
2026-02-03 23:28:29.047 - INFO - ================================================================================
2026-02-03 23:28:29.053 - INFO -  统计报告已生成|Statistics report generated: /share/org/YZWL/yzwl_lixg/project/28.大豆疫霉菌三代基因组/02.hifiasm/41/04.statistics/41_assembly_statistics.txt
2026-02-03 23:28:29.053 - INFO - ================================================================================
2026-02-03 23:28:29.053 - INFO - 组装流程完成|Assembly Pipeline Completed
2026-02-03 23:28:29.053 - INFO - ================================================================================
2026-02-03 23:28:29.053 - INFO - 总耗时|Total Duration: 4090 秒
2026-02-03 23:28:29.053 - INFO - 生成FASTA文件|Generated FASTA files: 0
2026-02-03 23:28:29.053 - INFO - 输出文件结构|Output File Structure:
2026-02-03 23:28:29.053 - INFO - 
 /share/org/YZWL/yzwl_lixg/project/28.大豆疫霉菌三代基因组/02.hifiasm/41/
   │
   ├──  01.raw_output/     (初次组装原始输出|Initial assembly raw output)
   │   ├──  41.hap1.p_ctg.gfa
   │   ├──  41.hap2.p_ctg.gfa
   │   ├──  41.p_ctg.gfa
   │   └──  其他中间文件|Other intermediate files
   │
   ├──  02.fasta/          (初次组装FASTA|Initial assembly FASTA)
   │   ├──  41.hap1.fa
   │   ├──  41.hap2.fa
   │   ├──  41.primary.fa
   │   ├──  41.alternate.fa
   │   ├──  41.p_ctg.contig_reads.tsv (contig-reads映射|mapping)
   │   ├──  41.hap1.p_ctg.contig_reads.tsv
   │   └──  41.hap2.p_ctg.contig_reads.tsv
   │
   ├──  03.ngs_polish/     (NGS筛选和重新组装|NGS filtering & reassembly)
   │   ├──  01.bwa_alignment/              (BWA比对结果|BWA alignment)
   │   │   └──  bam/41.bam
   │   ├──  02.coverage_filter/            (覆盖度过滤结果|Coverage filter)
   │   │   └──  41_high_quality.list
   │   ├──  03.filtered_reads/             (筛选的reads|Filtered reads)
   │   │   └──  41_high_quality_reads.fq.gz
   │   ├──  04.reassembly/                 (重新组装结果|Reassembly)
   │   │   ├──  01.raw_output/
   │   │   └──  02.fasta/
   │   └──  41.polished.fa (最终polished基因组|Final polished genome)
   │
   ├──  04.statistics/     (统计信息|Statistics)
   │   └──  41_assembly_statistics.txt
   │
   └──  05.logs/           (日志文件|Log files)
       └──  assembly.log
            
2026-02-03 23:28:29.053 - INFO -  下一步建议|Next Steps:
2026-02-03 23:28:29.053 - INFO -    1. 查看polished基因组|1. View polished genome
2026-02-03 23:28:29.053 - INFO -       /share/org/YZWL/yzwl_lixg/project/28.大豆疫霉菌三代基因组/02.hifiasm/41/03.ngs_polish/41.polished.fa
2026-02-03 23:28:29.053 - INFO -    2. 查看统计报告|2. View statistics report
2026-02-03 23:28:29.053 - INFO -    3. 检查组装质量|3. Check assembly quality (QUAST/BUSCO)
2026-02-03 23:28:29.053 - INFO -    4. 可视化组装|4. Visualize assembly (Bandage)
2026-02-03 23:28:29.053 - INFO -    5. 查看contig-reads映射|5. View contig-reads mapping
