[33m[WARN][0m you may switch on flag -g/--remove-gaps to remove spaces
Usage: biopytools ragtag [OPTIONS]
Try 'biopytools ragtag -h' for help.

Error: Invalid value for '-r' / '--reference': 文件存在|File does not exist: 01.data/genome/Psoja_T2T.fa
Usage: biopytools genomesyn [OPTIONS]
Try 'biopytools genomesyn -h' for help.

Error: Invalid value for '-i' / '--ref': Path '04.ragtag/41/hifiasm/41_RagTag_scaffolded.fa' does not exist.
Usage: biopytools ragtag [OPTIONS]
Try 'biopytools ragtag -h' for help.

Error: Invalid value for '-r' / '--reference': 文件存在|File does not exist: 01.data/genome/Psoja_T2T.fa
Usage: biopytools genomesyn [OPTIONS]
Try 'biopytools genomesyn -h' for help.

Error: Invalid value for '-i' / '--ref': Path '04.ragtag/41/hifiasm/41_hap1_RagTag_scaffolded.fa' does not exist.
Usage: biopytools ragtag [OPTIONS]
Try 'biopytools ragtag -h' for help.

Error: Invalid value for '-r' / '--reference': 文件存在|File does not exist: 01.data/genome/Psoja_T2T.fa
Usage: biopytools genomesyn [OPTIONS]
Try 'biopytools genomesyn -h' for help.

Error: Invalid value for '-i' / '--ref': Path '04.ragtag/41/hifiasm/41_hap2_RagTag_scaffolded.fa' does not exist.
2026-01-24 22:40:23.400 - WARNING - 命令错误输出|Command stderr:
-- canu master +27 changes (r10515 2a41e933b8de6ed66723d75d36dd071b46d2c347)
--
-- CITATIONS
--
-- For assemblies of PacBio HiFi reads:
--   Nurk S, Walenz BP, Rhiea A, Vollger MR, Logsdon GA, Grothe R, Miga KH, Eichler EE, Phillippy AM, Koren S.
--   HiCanu: accurate assembly of segmental duplications, satellites, and allelic variants from high-fidelity long reads.
--   biorXiv. 2020.
--   https://doi.org/10.1101/2020.03.14.992248
-- 
-- Read and contig alignments during correction and consensus use:
--   Šošic M, Šikic M.
--   Edlib: a C/C ++ library for fast, exact sequence alignment using edit distance.
--   Bioinformatics. 2017 May 1;33(9):1394-1395.
--   http://doi.org/10.1093/bioinformatics/btw753
-- 
-- Overlaps are generated using:
--   Berlin K, et al.
--   Assembling large genomes with single-molecule sequencing and locality-sensitive hashing.
--   Nat Biotechnol. 2015 Jun;33(6):623-30.
--   http://doi.org/10.1038/nbt.3238
-- 
--   Myers EW, et al.
--   A Whole-Genome Assembly of Drosophila.
--   Science. 2000 Mar 24;287(5461):2196-204.
--   http://doi.org/10.1126/science.287.5461.2196
-- 
-- Contig consensus sequences are generated using an algorithm derived from pbdagcon:
--   Chin CS, et al.
--   Nonhybrid, finished microbial genome assemblies from long-read SMRT sequencing data.
--   Nat Methods. 2013 Jun;10(6):563-9
--   http://doi.org/10.1038/nmeth.2474
-- 
-- CONFIGURE CANU
--
-- Detected Java(TM) Runtime Environment '17.0.15-internal' (from '/share/org/YZWL/yzwl_lixg/.local/bin/java') without -d64 support.
--
-- WARNING:
-- WARNING:  Failed to run gnuplot using command 'gnuplot'.
-- WARNING:  Plots will be disabled.
-- WARNING:
--
-- Detected samtools version '1.22' / htslib version 'htscodecs=1.6.3' (from 'samtools').
--
-- Detected 88 CPUs and 503 gigabytes of memory on the local machine.
--
-- Detected Slurm with 'sinfo' binary in /opt/skyformai/bin/sinfo.
--          Slurm disabled by useGrid=false
--
-- Detected  '' with 'pbsnodes' binary in /opt/skyformai/bin/pbsnodes.
--           disabled by useGrid=false
--
-- Detected LSF with 'bsub' binary in /opt/skyformai/bin/bsub.
--          LSF disabled by useGrid=false
--
-- Local machine mode enabled; grid support not detected or not allowed.
--
-- Found trimmed raw PacBio HiFi reads in the input files.
--
--                                (tag)Concurrency
--                         (tag)Threads          |
--                (tag)Memory         |          |
--        (tag)             |         |          |       total usage      algorithm
--        -------  ----------  --------   --------  --------------------  -----------------------------
-- Local: meryl     12.000 GB    4 CPUs x  22 jobs   264.000 GB  88 CPUs  (k-mer counting)
-- Local: cormhap   13.000 GB   11 CPUs x   8 jobs   104.000 GB  88 CPUs  (overlap detection with mhap)
-- Local: obtovl     8.000 GB    8 CPUs x  11 jobs    88.000 GB  88 CPUs  (overlap detection)
-- Local: utgovl     8.000 GB    8 CPUs x  11 jobs    88.000 GB  88 CPUs  (overlap detection)
-- Local: cor        -.--- GB    4 CPUs x   - jobs     -.--- GB   - CPUs  (read correction)
-- Local: ovb        4.000 GB    1 CPU  x  88 jobs   352.000 GB  88 CPUs  (overlap store bucketizer)
-- Local: ovs        8.000 GB    1 CPU  x  62 jobs   496.000 GB  62 CPUs  (overlap store sorting)
-- Local: red       16.000 GB    4 CPUs x  22 jobs   352.000 GB  88 CPUs  (read error detection)
-- Local: oea        8.000 GB    1 CPU  x  62 jobs   496.000 GB  62 CPUs  (overlap error adjustment)
-- Local: bat       32.000 GB    8 CPUs x   1 job     32.000 GB   8 CPUs  (contig construction with bogart)
-- Local: cns        -.--- GB    8 CPUs x   - jobs     -.--- GB   - CPUs  (consensus)
--
-- Generating assembly '41' in '/share/org/YZWL/yzwl_lixg/project/28.大豆疫霉三代基因组/05.过滤hifi数新组装挂载/03.hicanu/41/01.raw_output':
--   genomeSize:
--     85000000
--
--   Overlap Generation Limits:
--     corOvlErrorRate 0.0000 (  0.00%)
--     obtOvlErrorRate 0.0250 (  2.50%)
--     utgOvlErrorRate 0.0100 (  1.00%)
--
--   Overlap Processing Limits:
--     corErrorRate    0.0000 (  0.00%)
--     obtErrorRate    0.0250 (  2.50%)
--     utgErrorRate    0.0003 (  0.03%)
--     cnsErrorRate    0.0500 (  5.00%)
--
--   Stages to run:
--     assemble HiFi reads.
--
--
-- BEGIN STORE CREATION
----------------------------------------
-- Starting command on Sat Jan 24 20:52:39 2026 with 3950447.671 GB free disk space

    cd .
    ./41.seqStore.sh \
    > ./41.seqStore.err 2>&1

-- Finished on Sat Jan 24 20:56:30 2026 (231 seconds) with 3950330.125 GB free disk space
----------------------------------------
--
-- In sequence store './41.seqStore':
--   Found 241679 reads.
--   Found 4250013559 bases (50 times coverage).
--    Histogram of corrected reads:
--    
--    G=4250013559                       sum of  ||               length     num
--    NG         length     index       lengths  ||                range    seqs
--    ----- ------------ --------- ------------  ||  ------------------- -------
--    00010        26431     15031    425006421  ||       5000-6128        14535|------------------------------------------
--    00020        24538     31766    850013151  ||       6129-7257        12518|-------------------------------------
--    00030        23203     49594   1275016512  ||       7258-8386        10307|------------------------------
--    00040        22101     68373   1700021951  ||       8387-9515         8885|--------------------------
--    00050        21069     88069   2125027674  ||       9516-10644        8053|------------------------
--    00060        20007    108758   2550027996  ||      10645-11773        7064|---------------------
--    00070        18732    130672   2975018778  ||      11774-12902        6276|-------------------
--    00080        16558    154570   3400024461  ||      12903-14031        5760|-----------------
--    00090        10931    185536   3825020739  ||      14032-15160        5492|----------------
--    00100         5000    241679   4250013559  ||      15161-16289        6343|-------------------
--    001.000x              241679   4250013559  ||      16290-17418        9124|---------------------------
--                                               ||      17419-18547       13896|----------------------------------------
--                                               ||      18548-19676       18490|------------------------------------------------------
--                                               ||      19677-20805       21658|---------------------------------------------------------------
--                                               ||      20806-21934       21890|---------------------------------------------------------------
--                                               ||      21935-23063       19641|---------------------------------------------------------
--                                               ||      23064-24192       15908|----------------------------------------------
--                                               ||      24193-25321       12138|-----------------------------------
--                                               ||      25322-26450        8819|--------------------------
--                                               ||      26451-27579        6117|------------------
--                                               ||      27580-28708        4023|------------
--                                               ||      28709-29837        2386|-------
--                                               ||      29838-30966        1308|----
--                                               ||      30967-32095         654|--
--                                               ||      32096-33224         270|-
--                                               ||      33225-34353          89|-
--                                               ||      34354-35482          20|-
--                                               ||      35483-36611           5|-
--                                               ||      36612-37740           2|-
--                                               ||      37741-38869           2|-
--                                               ||      38870-39998           3|-
--                                               ||      39999-41127           0|
--                                               ||      41128-42256           0|
--                                               ||      42257-43385           0|
--                                               ||      43386-44514           1|-
--                                               ||      44515-45643           0|
--                                               ||      45644-46772           0|
--                                               ||      46773-47901           1|-
--                                               ||      47902-49030           0|
--                                               ||      49031-50159           1|-
--    
--
-- In sequence store './41.seqStore':
--   Found 241679 reads.
--   Found 4250013559 bases (50 times coverage).
--    Histogram of corrected-trimmed reads:
--    
--    G=4250013559                       sum of  ||               length     num
--    NG         length     index       lengths  ||                range    seqs
--    ----- ------------ --------- ------------  ||  ------------------- -------
--    00010        26431     15031    425006421  ||       5000-6128        14535|------------------------------------------
--    00020        24538     31766    850013151  ||       6129-7257        12518|-------------------------------------
--    00030        23203     49594   1275016512  ||       7258-8386        10307|------------------------------
--    00040        22101     68373   1700021951  ||       8387-9515         8885|--------------------------
--    00050        21069     88069   2125027674  ||       9516-10644        8053|------------------------
--    00060        20007    108758   2550027996  ||      10645-11773        7064|---------------------
--    00070        18732    130672   2975018778  ||      11774-12902        6276|-------------------
--    00080        16558    154570   3400024461  ||      12903-14031        5760|-----------------
--    00090        10931    185536   3825020739  ||      14032-15160        5492|----------------
--    00100         5000    241679   4250013559  ||      15161-16289        6343|-------------------
--    001.000x              241679   4250013559  ||      16290-17418        9124|---------------------------
--                                               ||      17419-18547       13896|----------------------------------------
--                                               ||      18548-19676       18490|------------------------------------------------------
--                                               ||      19677-20805       21658|---------------------------------------------------------------
--                                               ||      20806-21934       21890|---------------------------------------------------------------
--                                               ||      21935-23063       19641|---------------------------------------------------------
--                                               ||      23064-24192       15908|----------------------------------------------
--                                               ||      24193-25321       12138|-----------------------------------
--                                               ||      25322-26450        8819|--------------------------
--                                               ||      26451-27579        6117|------------------
--                                               ||      27580-28708        4023|------------
--                                               ||      28709-29837        2386|-------
--                                               ||      29838-30966        1308|----
--                                               ||      30967-32095         654|--
--                                               ||      32096-33224         270|-
--                                               ||      33225-34353          89|-
--                                               ||      34354-35482          20|-
--                                               ||      35483-36611           5|-
--                                               ||      36612-37740           2|-
--                                               ||      37741-38869           2|-
--                                               ||      38870-39998           3|-
--                                               ||      39999-41127           0|
--                                               ||      41128-42256           0|
--                                               ||      42257-43385           0|
--                                               ||      43386-44514           1|-
--                                               ||      44515-45643           0|
--                                               ||      45644-46772           0|
--                                               ||      46773-47901           1|-
--                                               ||      47902-49030           0|
--                                               ||      49031-50159           1|-
--    
--
-- Correction skipped; not enabled.
--
-- Trimming skipped; not enabled.
--
-- BEGIN ASSEMBLY
----------------------------------------
-- Starting command on Sat Jan 24 20:56:30 2026 with 3950330.078 GB free disk space

    cd unitigging/0-mercounts
    ./meryl-configure.sh \
    > ./meryl-configure.err 2>&1

-- Finished on Sat Jan 24 20:56:31 2026 (one second) with 3950330.078 GB free disk space
----------------------------------------
--  segments   memory batches
--  -------- -------- -------
--        01 10.81 GB       2
--        02  5.75 GB       2
--        04  2.97 GB       2
--        06  2.14 GB       2
--        08  1.61 GB       2
--        12  1.07 GB       2
--        16  0.81 GB       2
--        20  0.65 GB       2
--        24  0.54 GB       2
--        32  0.41 GB       2
--        40  0.32 GB       2
--        48  -.-- GB       -  (segment size too small)
--        56  -.-- GB       -  (segment size too small)
--        64  -.-- GB       -  (segment size too small)
--        96  -.-- GB       -  (segment size too small)
--
--  For 241679 reads with 4250013559 bases, limit to 42 batches.
--  Will count kmers using 01 jobs, each using 12 GB and 4 threads.
--
-- Finished stage 'merylConfigure', reset canuIteration.
--
-- Running jobs.  First attempt out of 2.
----------------------------------------
-- Starting 'meryl' concurrent execution on Sat Jan 24 20:56:31 2026 with 3950330.046 GB free disk space (1 processes; 22 concurrently)

    cd unitigging/0-mercounts
    ./meryl-count.sh 1 > ./meryl-count.000001.out 2>&1

-- Finished on Sat Jan 24 20:59:57 2026 (206 seconds) with 3951105.859 GB free disk space
----------------------------------------
-- Found 1 Kmer counting (meryl) outputs.
-- Finished stage 'utg-merylCountCheck', reset canuIteration.
--
-- Running jobs.  First attempt out of 2.
----------------------------------------
-- Starting 'meryl' concurrent execution on Sat Jan 24 20:59:57 2026 with 3951105.828 GB free disk space (1 processes; 22 concurrently)

    cd unitigging/0-mercounts
    ./meryl-process.sh 1 > ./meryl-process.000001.out 2>&1

-- Finished on Sat Jan 24 21:00:03 2026 (6 seconds) with 3951105.437 GB free disk space
----------------------------------------
-- Meryl finished successfully.  Kmer frequency histogram:
--
-- WARNING: gnuplot failed.
--
----------------------------------------
--
--  22-mers                                                                                           Fraction
--    Occurrences   NumMers                                                                         Unique Total
--       1-     1         0                                                                        0.0000 0.0000
--       2-     2    261263 *                                                                      0.0058 0.0002
--       3-     4     76613                                                                        0.0070 0.0002
--       5-     7     21827                                                                        0.0077 0.0003
--       8-    11     12750                                                                        0.0081 0.0003
--      12-    16     23896                                                                        0.0083 0.0004
--      17-    22    137424                                                                        0.0090 0.0005
--      23-    29    961821 ****                                                                   0.0131 0.0017
--      30-    37   5764422 *************************                                              0.0408 0.0126
--      38-    46  15822003 ********************************************************************** 0.1898 0.0863
--      47-    56  13675050 ************************************************************           0.5554 0.3081
--      57-    67   3400032 ***************                                                        0.8304 0.5073
--      68-    79    742125 ***                                                                    0.8929 0.5608
--      80-    92    938500 ****                                                                   0.9091 0.5778
--      93-   106    774817 ***                                                                    0.9302 0.6035
--     107-   121    305589 *                                                                      0.9464 0.6262
--     122-   137    288397 *                                                                      0.9529 0.6366
--     138-   154    266641 *                                                                      0.9593 0.6484
--     155-   172    170977                                                                        0.9651 0.6602
--     173-   191    165290                                                                        0.9688 0.6688
--     192-   211    129275                                                                        0.9725 0.6782
--     212-   232    121356                                                                        0.9753 0.6862
--     233-   254    109744                                                                        0.9780 0.6946
--     255-   277     83269                                                                        0.9804 0.7028
--     278-   301     77043                                                                        0.9822 0.7096
--     302-   326     69791                                                                        0.9839 0.7166
--     327-   352     59103                                                                        0.9855 0.7234
--     353-   379     50764                                                                        0.9868 0.7296
--     380-   407     47004                                                                        0.9879 0.7353
--     408-   436     45152                                                                        0.9889 0.7411
--     437-   466     34329                                                                        0.9899 0.7470
--     467-   497     33474                                                                        0.9907 0.7518
--     498-   529     24673                                                                        0.9914 0.7568
--     530-   562     24370                                                                        0.9919 0.7607
--     563-   596     20787                                                                        0.9925 0.7648
--     597-   631     17480                                                                        0.9929 0.7686
--     632-   667     17317                                                                        0.9933 0.7719
--     668-   704     14302                                                                        0.9937 0.7754
--     705-   742     12705                                                                        0.9940 0.7784
--     743-   781     12499                                                                        0.9943 0.7813
--     782-   821     12693                                                                        0.9946 0.7843
--
--           0 (max occurrences)
--  3211411242 (total mers, non-unique)
--    45057871 (distinct mers, non-unique)
--           0 (unique mers)
-- Finished stage 'meryl-process', reset canuIteration.
--
-- Removing meryl database 'unitigging/0-mercounts/41.ms22'.
--
-- OVERLAPPER (normal) (assembly) erate=0.01
--
----------------------------------------
-- Starting command on Sat Jan 24 21:00:03 2026 with 3951105.421 GB free disk space

    cd unitigging/1-overlapper
    /share/org/YZWL/yzwl_lixg/miniforge3/envs/canu_v.2.3/bin/overlapInCorePartition \
     -S  ../../41.seqStore \
     -hl 160000000 \
     -rl 5000000000 \
     -ol 500 \
     -o  ./41.partition \
    > ./41.partition.err 2>&1

-- Finished on Sat Jan 24 21:00:03 2026 (lickety-split) with 3951105.406 GB free disk space
----------------------------------------
--
-- Configured 21 overlapInCore jobs.
-- Finished stage 'utg-overlapConfigure', reset canuIteration.
--
-- Running jobs.  First attempt out of 2.
----------------------------------------
-- Starting 'utgovl' concurrent execution on Sat Jan 24 21:00:03 2026 with 3951105.375 GB free disk space (21 processes; 11 concurrently)

    cd unitigging/1-overlapper
    ./overlap.sh 1 > ./overlap.000001.out 2>&1
    ./overlap.sh 2 > ./overlap.000002.out 2>&1
    ./overlap.sh 3 > ./overlap.000003.out 2>&1
    ./overlap.sh 4 > ./overlap.000004.out 2>&1
    ./overlap.sh 5 > ./overlap.000005.out 2>&1
    ./overlap.sh 6 > ./overlap.000006.out 2>&1
    ./overlap.sh 7 > ./overlap.000007.out 2>&1
    ./overlap.sh 8 > ./overlap.000008.out 2>&1
    ./overlap.sh 9 > ./overlap.000009.out 2>&1
    ./overlap.sh 10 > ./overlap.000010.out 2>&1
    ./overlap.sh 11 > ./overlap.000011.out 2>&1
    ./overlap.sh 12 > ./overlap.000012.out 2>&1
    ./overlap.sh 13 > ./overlap.000013.out 2>&1
    ./overlap.sh 14 > ./overlap.000014.out 2>&1
    ./overlap.sh 15 > ./overlap.000015.out 2>&1
    ./overlap.sh 16 > ./overlap.000016.out 2>&1
    ./overlap.sh 17 > ./overlap.000017.out 2>&1
    ./overlap.sh 18 > ./overlap.000018.out 2>&1
    ./overlap.sh 19 > ./overlap.000019.out 2>&1
    ./overlap.sh 20 > ./overlap.000020.out 2>&1
    ./overlap.sh 21 > ./overlap.000021.out 2>&1

-- Finished on Sat Jan 24 21:30:02 2026 (1799 seconds) with 3950369.203 GB free disk space
----------------------------------------
-- Found 21 overlapInCore output files.
--
-- overlapInCore compute 'unitigging/1-overlapper':
--   kmer hits
--     with no overlap       1312879591  75.7619048 +- 39187923.301
--     with an overlap         39284719  00.9047619 +- 1012617.26
--
--   overlaps                  39284719  00.9047619 +- 1012617.26
--     contained                8677243  .047619048 +- 221274.777
--     dovetail                30607476  8.85714286 +- 793852.189
--
--   overlaps rejected
--     multiple per pair              0           0 +- 0
--     bad short window               0           0 +- 0
--     bad long window                0           0 +- 0
-- Finished stage 'utg-overlapCheck', reset canuIteration.
----------------------------------------
-- Starting command on Sat Jan 24 21:30:02 2026 with 3950369.187 GB free disk space

    cd unitigging
    /share/org/YZWL/yzwl_lixg/miniforge3/envs/canu_v.2.3/bin/ovStoreConfig \
     -S ../41.seqStore \
     -M 4-8 \
     -L ./1-overlapper/ovljob.files \
     -create ./41.ovlStore.config \
     > ./41.ovlStore.config.txt \
    2> ./41.ovlStore.config.err

-- Finished on Sat Jan 24 21:30:02 2026 (fast as lightning) with 3950369.171 GB free disk space
----------------------------------------
--
-- Creating overlap store unitigging/41.ovlStore using:
--      1 bucket
--      1 slice
--        using at most 3 GB memory each
--
-- Running jobs.  First attempt out of 2.
----------------------------------------
-- Starting 'ovS' concurrent execution on Sat Jan 24 21:30:02 2026 with 3950369.156 GB free disk space (1 processes; 62 concurrently)

    cd unitigging
    ./41.ovlStore.sh 1 > ./41.ovlStore.000001.out 2>&1

-- Finished on Sat Jan 24 21:30:18 2026 (16 seconds) with 3950367.906 GB free disk space
----------------------------------------
-- Checking store.
----------------------------------------
-- Starting command on Sat Jan 24 21:30:18 2026 with 3950367.906 GB free disk space

    cd unitigging
    /share/org/YZWL/yzwl_lixg/miniforge3/envs/canu_v.2.3/bin/ovStoreDump \
     -S ../41.seqStore \
     -O  ./41.ovlStore \
     -counts \
     > ./41.ovlStore/counts.dat 2> ./41.ovlStore/counts.err

-- Finished on Sat Jan 24 21:30:19 2026 (one second) with 3950367.875 GB free disk space
----------------------------------------
--
-- Overlap store 'unitigging/41.ovlStore' successfully constructed.
-- Found 78569438 overlaps for 236119 reads; 1133521 reads have no overlaps.
--
--
-- Purged 0.769 GB in 63 overlap output files.
----------------------------------------
-- Starting command on Sat Jan 24 21:30:19 2026 with 3950367.875 GB free disk space

    cd unitigging
    /share/org/YZWL/yzwl_lixg/miniforge3/envs/canu_v.2.3/bin/ovStoreStats \
     -C 50 \
     -S ../41.seqStore \
     -O  ./41.ovlStore \
     -o  ./41.ovlStore \
     > ./41.ovlStore.summary.err 2>&1

-- Finished on Sat Jan 24 21:30:30 2026 (11 seconds) with 3950367.859 GB free disk space
----------------------------------------
--
-- Overlap store 'unitigging/41.ovlStore' contains:
--
--   category            reads     %          read length        feature size or coverage  analysis
--   ----------------  -------  -------  ----------------------  ------------------------  --------------------
--   middle-missing        131    0.05    15018.82 +- 6267.39        575.53 +- 488.80     (bad trimming)
--   middle-hump            16    0.01    17271.25 +- 4254.60       5071.69 +- 4149.05    (bad trimming)
--   no-5-prime            571    0.24    13884.98 +- 4802.39       1461.73 +- 2456.01    (bad trimming)
--   no-3-prime            649    0.27    13258.46 +- 4908.63       1375.85 +- 2483.69    (bad trimming)
--   
--   low-coverage         1143    0.47    11935.85 +- 4898.83          5.92 +- 3.72       (easy to assemble, potential for lower quality consensus)
--   unique             191310   79.16    13524.38 +- 5164.63         45.35 +- 8.82       (easy to assemble, perfect, yay)
--   repeat-cont         17821    7.37    11283.98 +- 4498.46       1695.04 +- 1297.55    (potential for consensus errors, no impact on assembly)
--   repeat-dove           241    0.10    20713.14 +- 1830.09        688.98 +- 837.00     (hard to assemble, likely won't assemble correctly or even at all)
--   
--   span-repeat          3139    1.30    14651.18 +- 4478.96       4034.78 +- 4099.69    (read spans a large repeat, usually easy to assemble)
--   uniq-repeat-cont    14045    5.81    13005.08 +- 4507.73                             (should be uniquely placed, low potential for consensus errors, no impact on assembly)
--   uniq-repeat-dove     3173    1.31    18941.10 +- 2684.48                             (will end contigs, potential to misassemble)
--   uniq-anchor          3880    1.61    13718.94 +- 4802.52       7662.85 +- 5101.35    (repeat read, with unique section, probable bad read)
-- Finished stage 'utg-createOverlapStore', reset canuIteration.
--
-- Loading read lengths.
-- Loading number of overlaps per read.
--
-- Configure RED for 16gb memory.
--                   Batches of at most (unlimited) reads.
--                                      500000000 bases.
--                   Expecting evidence of at most 536870912 bases per iteration.
--
--           Total                                               Reads                 Olaps Evidence
--    Job   Memory      Read Range         Reads        Bases   Memory        Olaps   Memory   Memory  (Memory in MB)
--   ---- -------- ------------------- --------- ------------ -------- ------------ -------- --------
--      1 16384.64         1-31463          5580    108878169 13290.97      1893593    21.67  1024.00
--      2 16384.21     31464-69962          6767    108868354 13289.81      1957741    22.40  1024.00
--      3 16385.50     69963-101173         5521    108909766 13294.82      1632185    18.68  1024.00
--      4 16385.34    101174-135152         5919    108822513 13284.18      2547311    29.15  1024.00
--      5 16385.53    135153-173767         6895    108961267 13301.15      1081387    12.38  1024.00
--      6 16386.06    173768-208801         6287    108844455 13286.87      2375180    27.18  1024.00
--      7 16384.27    208802-240075         5676    108819022 13283.75      2492352    28.52  1024.00
--      8 16385.29    240076-274354         6154    108902083 13293.90      1693991    19.39  1024.00
--      9 16386.10    274355-314995         7092    108836558 13285.94      2460696    28.16  1024.00
--     10 16384.13    314996-346535         5570    108824087 13284.37      2426276    27.77  1024.00
--     11 16385.26    346536-380427         5963    108899239 13293.55      1722535    19.71  1024.00
--     12 16385.71    380428-421880         7362    108821238 13284.07      2589306    29.63  1024.00
--     13 16385.36    421881-453462         5577    108911555 13295.04      1600992    18.32  1024.00
--     14 16384.27    453463-485573         5763    108834243 13285.61      2329218    26.66  1024.00
--     15 16385.49    485574-521887         6451    108968687 13302.04       999972    11.44  1024.00
--     16 16384.01    521888-559600         6760    108801982 13281.70      2647999    30.30  1024.00
--     17 16385.05    559601-592145         5684    108805949 13282.16      2699868    30.90  1024.00
--     18 16385.00    592146-626571         6085    108893396 13292.84      1761165    20.15  1024.00
--     19 16386.25    626572-668346         7276    108801449 13281.66      2847763    32.59  1024.00
--     20 16384.75    668347-699841         5546    108916905 13295.70      1490563    17.06  1024.00
--     21 16384.42    699842-733824         5888    108823078 13284.25      2461659    28.17  1024.00
--     22 16386.35    733825-775617         7271    108939011 13298.45      1389418    15.90  1024.00
--     23 16384.19    775618-808357         5779    108842301 13286.60      2236849    25.60  1024.00
--     24 16385.76    808358-840241         5618    108804128 13281.93      2781187    31.83  1024.00
--     25 16384.31    840242-876932         6409    108944746 13299.12      1152906    13.19  1024.00
--     26 16386.28    876933-914674         6694    108838333 13286.14      2458990    28.14  1024.00
--     27 16384.49    914675-945403         5549    108857923 13288.50      2096492    23.99  1024.00
--     28 16385.93    945404-978644         5899    108906975 13294.49      1698497    19.44  1024.00
--     29 16384.21    978645-1019033        7110    108828459 13284.95      2381934    27.26  1024.00
--     30 16384.74   1019034-1049996        5468    108928993 13297.17      1360414    15.57  1024.00
--     31 16386.33   1049997-1082741        5740    108875202 13290.61      2072265    23.72  1024.00
--     32 16386.71   1082742-1119973        6635    108990747 13304.74       870737     9.96  1024.00
--     33 16385.43   1119974-1155291        6125    108862956 13289.13      2123847    24.31  1024.00
--     34 16386.99   1155292-1187509        5600    108883860 13291.66      2038455    23.33  1024.00
--     35 16385.68   1187510-1222181        6134    108914784 13295.45      1592405    18.22  1024.00
--     36 16385.32   1222182-1261713        6915    108847723 13287.29      2273882    26.02  1024.00
--     37 16384.65   1261714-1292543        5512    108833900 13285.56      2367388    27.09  1024.00
--     38 16385.34   1292544-1326062        5845    108907287 13294.53      1643172    18.80  1024.00
--     39 16384.85   1326063-1368100        7296    108845257 13287.00      2258286    25.84  1024.00
--     40  3563.06   1368101-1369640         264      4016979   490.36        60562     0.69  1024.00
--   ---- -------- ------------------- --------- ------------ -------- ------------ -------- --------
--                                                 4250013559              78569438
-- Finished stage 'readErrorDetectionConfigure', reset canuIteration.
--
-- Running jobs.  First attempt out of 2.
----------------------------------------
-- Starting 'red' concurrent execution on Sat Jan 24 21:30:36 2026 with 3950328.64 GB free disk space (40 processes; 22 concurrently)

    cd unitigging/3-overlapErrorAdjustment
    ./red.sh 1 > ./red.000001.out 2>&1
    ./red.sh 2 > ./red.000002.out 2>&1
    ./red.sh 3 > ./red.000003.out 2>&1
    ./red.sh 4 > ./red.000004.out 2>&1
    ./red.sh 5 > ./red.000005.out 2>&1
    ./red.sh 6 > ./red.000006.out 2>&1
    ./red.sh 7 > ./red.000007.out 2>&1
    ./red.sh 8 > ./red.000008.out 2>&1
    ./red.sh 9 > ./red.000009.out 2>&1
    ./red.sh 10 > ./red.000010.out 2>&1
    ./red.sh 11 > ./red.000011.out 2>&1
    ./red.sh 12 > ./red.000012.out 2>&1
    ./red.sh 13 > ./red.000013.out 2>&1
    ./red.sh 14 > ./red.000014.out 2>&1
    ./red.sh 15 > ./red.000015.out 2>&1
    ./red.sh 16 > ./red.000016.out 2>&1
    ./red.sh 17 > ./red.000017.out 2>&1
    ./red.sh 18 > ./red.000018.out 2>&1
    ./red.sh 19 > ./red.000019.out 2>&1
    ./red.sh 20 > ./red.000020.out 2>&1
    ./red.sh 21 > ./red.000021.out 2>&1
    ./red.sh 22 > ./red.000022.out 2>&1
    ./red.sh 23 > ./red.000023.out 2>&1
    ./red.sh 24 > ./red.000024.out 2>&1
    ./red.sh 25 > ./red.000025.out 2>&1
    ./red.sh 26 > ./red.000026.out 2>&1
    ./red.sh 27 > ./red.000027.out 2>&1
    ./red.sh 28 > ./red.000028.out 2>&1
    ./red.sh 29 > ./red.000029.out 2>&1
    ./red.sh 30 > ./red.000030.out 2>&1
    ./red.sh 31 > ./red.000031.out 2>&1
    ./red.sh 32 > ./red.000032.out 2>&1
    ./red.sh 33 > ./red.000033.out 2>&1
    ./red.sh 34 > ./red.000034.out 2>&1
    ./red.sh 35 > ./red.000035.out 2>&1
    ./red.sh 36 > ./red.000036.out 2>&1
    ./red.sh 37 > ./red.000037.out 2>&1
    ./red.sh 38 > ./red.000038.out 2>&1
    ./red.sh 39 > ./red.000039.out 2>&1
    ./red.sh 40 > ./red.000040.out 2>&1

-- Finished on Sat Jan 24 21:46:02 2026 (926 seconds) with 3953894.062 GB free disk space
----------------------------------------
-- Found 40 read error detection output files.
-- Finished stage 'readErrorDetectionCheck', reset canuIteration.
--
-- Loading read lengths.
-- Loading number of overlaps per read.
--
-- Configure OEA for 8gb memory.
--                   Batches of at most (unlimited) reads.
--                                      300000000 bases.
--
--           Total                                               Reads                 Olaps  Adjusts
--    Job   Memory      Read Range         Reads        Bases   Memory        Olaps   Memory   Memory  (Memory in MB)
--   ---- -------- ------------------- --------- ------------ -------- ------------ -------- --------
--      1  2835.21         1-93487         16500    300012617   294.62      4312409   131.60   360.99
--      2  2912.95     93488-193913        17761    300016290   294.66      6858420   209.30   360.99
--      3  2848.59    193914-285203        16452    300001372   294.61      4750965   144.99   360.99
--      4  2898.15    285204-381223        16852    300015550   294.63      6374224   194.53   360.99
--      5  2879.52    381224-477817        17247    300011756   294.64      5763580   175.89   360.99
--      6  2882.84    477818-576837        17526    300009356   294.65      5871909   179.20   360.99
--      7  2887.17    576838-677648        17641    300005486   294.65      6013818   183.53   360.99
--      8  2894.76    677649-777550        17460    300008395   294.64      6262852   191.13   360.99
--      9  2852.55    777551-869263        16043    300019216   294.61      4880629   148.94   360.99
--     10  2886.97    869264-963617        16870    300003017   294.62      6008216   183.36   360.99
--     11  2857.27    963618-1060072       17026    300011340   294.63      5034517   153.64   360.99
--     12  2833.07   1060073-1157302       17102    300009787   294.63      4241561   129.44   360.99
--     13  2879.11   1157303-1256023       17303    300006309   294.64      5750077   175.48   360.99
--     14  2843.12   1256024-1347910       16181    300006319   294.60      4571986   139.53   360.99
--     15  2521.87   1347911-1369640        3715     49876749    55.68      1874275    57.20   360.99
--   ---- -------- ------------------- --------- ------------ -------- ------------ -------- --------
--                                                 4250013559              78569438
-- Finished stage 'overlapErrorAdjustmentConfigure', reset canuIteration.
--
-- Running jobs.  First attempt out of 2.
----------------------------------------
-- Starting 'oea' concurrent execution on Sat Jan 24 21:46:08 2026 with 3953893.984 GB free disk space (15 processes; 62 concurrently)

    cd unitigging/3-overlapErrorAdjustment
    ./oea.sh 1 > ./oea.000001.out 2>&1
    ./oea.sh 2 > ./oea.000002.out 2>&1
    ./oea.sh 3 > ./oea.000003.out 2>&1
    ./oea.sh 4 > ./oea.000004.out 2>&1
    ./oea.sh 5 > ./oea.000005.out 2>&1
    ./oea.sh 6 > ./oea.000006.out 2>&1
    ./oea.sh 7 > ./oea.000007.out 2>&1
    ./oea.sh 8 > ./oea.000008.out 2>&1
    ./oea.sh 9 > ./oea.000009.out 2>&1
    ./oea.sh 10 > ./oea.000010.out 2>&1
    ./oea.sh 11 > ./oea.000011.out 2>&1
    ./oea.sh 12 > ./oea.000012.out 2>&1
    ./oea.sh 13 > ./oea.000013.out 2>&1
    ./oea.sh 14 > ./oea.000014.out 2>&1
    ./oea.sh 15 > ./oea.000015.out 2>&1

-- Finished on Sat Jan 24 22:29:08 2026 (2580 seconds) with 3966762.406 GB free disk space
----------------------------------------
-- Found 15 overlap error adjustment output files.
-- Finished stage 'overlapErrorAdjustmentCheck', reset canuIteration.
----------------------------------------
-- Starting command on Sat Jan 24 22:29:08 2026 with 3966762.39 GB free disk space

    cd unitigging/3-overlapErrorAdjustment
    /share/org/YZWL/yzwl_lixg/miniforge3/envs/canu_v.2.3/bin/loadErates \
      -S ../../41.seqStore \
      -O ../41.ovlStore \
      -L ./oea.files \
    > ./oea.apply.err 2>&1

-- Finished on Sat Jan 24 22:29:08 2026 (in the blink of an eye) with 3966762.234 GB free disk space
----------------------------------------
-- No report available.
-- Finished stage 'updateOverlapStore', reset canuIteration.
-- Finished stage 'unitig', reset canuIteration.
--
-- Running jobs.  First attempt out of 2.
----------------------------------------
-- Starting 'bat' concurrent execution on Sat Jan 24 22:29:08 2026 with 3966762.187 GB free disk space (1 processes; 1 concurrently)

    cd unitigging/4-unitigger
    ./unitigger.sh 1 > ./unitigger.000001.out 2>&1

-- Finished on Sat Jan 24 22:29:29 2026 (21 seconds) with 3966761.984 GB free disk space
----------------------------------------
-- Unitigger finished successfully.
--  
--  ERROR RATES
--  -----------
--                                                   --------threshold------
--  271843                       fraction error      fraction        percent
--  samples                              (1e-5)         error          error
--                   --------------------------      --------       --------
--  command line (-eg)                           ->     30.00        0.0300%
--  command line (-ef)                           ->  -----.--      ---.----%
--  command line (-eM)                           ->     30.00        0.0300%
--  mean + std.dev       0.46 +-  12 *     3.06  ->     37.14        0.0371%
--  median + mad         0.00 +-  12 *     0.00  ->      0.00        0.0000%
--  90th percentile                              ->      1.00        0.0010%  (enabled)
--  
--  BEST EDGE FILTERING
--  -------------------
--  At graph threshold 0.0300%, reads:
--    available to have edges:        47820
--    with at least one edge:         41048
--  
--  At max threshold 0.0300%, reads:  (not computed)
--    available to have edges:            0
--    with at least one edge:             0
--  
--  At tight threshold 0.0010%, reads with:
--    both edges below error threshold:     35644  (80.00% minReadsBest threshold = 32838)
--    one  edge  above error threshold:      3810
--    both edges above error threshold:      1594
--    at least one edge:                    41048
--  
--  At loose threshold 0.0300%, reads with:
--    both edges below error threshold:     41048  (80.00% minReadsBest threshold = 32838)
--    one  edge  above error threshold:         0
--    both edges above error threshold:         0
--    at least one edge:                    41048
--  
--  
--  INITIAL EDGES
--  -------- ----------------------------------------
--    188219 reads are contained
--   1145451 reads have no best edges (singleton)
--       305 reads have only one best edge (spur) 
--                160 are mutual best
--     35665 reads have two best edges 
--                924 have one mutual best edge
--              34399 have two mutual best edges
--  
--  
--  FINAL EDGES
--  -------- ----------------------------------------
--    188219 reads are contained
--   1145790 reads have no best edges (singleton)
--       205 reads have only one best edge (spur) 
--                166 are mutual best
--     35426 reads have two best edges 
--                792 have one mutual best edge
--              34384 have two mutual best edges
--  
--  
--  EDGE FILTERING
--  -------- ------------------------------------------
--         0 reads are ignored
--     10269 reads have a gap in overlap coverage
--       158 reads have lopsided best edges
-- Found, in version 1, after unitig construction:
--   contigs:      138 sequences, total length 69655254 bp (including 203 repeats of total length 6285510 bp).
--   bubbles:      251 sequences, total length 10100192 bp.
--   unassembled:  18369 sequences, total length 235800135 bp.
--
-- Contig sizes based on genome size 85mbp:
--
--            NG (bp)  LG (contigs)    sum (bp)
--         ----------  ------------  ----------
--     10     6243254             2    12879213
--     20     6242501             3    19121714
--     30     4545469             5    29765500
--     40     4390990             6    34156490
--     50     3304749             9    45645350
--     60     2608046            11    51266553
--     70     1357776            15    59592603
--     80       29651            56    68016129
--
-- Finished stage 'unitigCheck', reset canuIteration.
----------------------------------------
-- Starting command on Sat Jan 24 22:29:29 2026 with 3966761.968 GB free disk space

    cd unitigging
    /share/org/YZWL/yzwl_lixg/miniforge3/envs/canu_v.2.3/bin/utgcns \
      -S ../41.seqStore \
      -T  ./41.ctgStore 1 \
      -partition 0.8 1.5 0.1 \
    > ./41.ctgStore/partitioning.log 2>&1

-- Finished on Sat Jan 24 22:29:38 2026 (9 seconds) with 3966760.765 GB free disk space
----------------------------------------
-- Using slow alignment for consensus (iteration '0').
-- Configured 11 consensus jobs.
-- Finished stage 'consensusConfigure', reset canuIteration.
--
-- Local: cns        9.875 GB    8 CPUs x  11 jobs   108.625 GB  88 CPUs  (consensus)
--
--
-- Running jobs.  First attempt out of 2.
----------------------------------------
-- Starting 'cns' concurrent execution on Sat Jan 24 22:29:38 2026 with 3966760.734 GB free disk space (11 processes; 11 concurrently)

    cd unitigging/5-consensus
    ./consensus.sh 1 > ./consensus.000001.out 2>&1
    ./consensus.sh 2 > ./consensus.000002.out 2>&1
    ./consensus.sh 3 > ./consensus.000003.out 2>&1
    ./consensus.sh 4 > ./consensus.000004.out 2>&1
    ./consensus.sh 5 > ./consensus.000005.out 2>&1
    ./consensus.sh 6 > ./consensus.000006.out 2>&1
    ./consensus.sh 7 > ./consensus.000007.out 2>&1
    ./consensus.sh 8 > ./consensus.000008.out 2>&1
    ./consensus.sh 9 > ./consensus.000009.out 2>&1
    ./consensus.sh 10 > ./consensus.000010.out 2>&1
    ./consensus.sh 11 > ./consensus.000011.out 2>&1

-- Finished on Sat Jan 24 22:36:23 2026 (405 seconds) with 3984726.171 GB free disk space
----------------------------------------
-- Using slow alignment for consensus (iteration '1').
-- Configured 11 consensus jobs.
-- All 11 consensus jobs finished successfully.
-- Finished stage 'consensusCheck', reset canuIteration.
-- Using slow alignment for consensus (iteration '0').
-- Configured 11 consensus jobs.
----------------------------------------
-- Starting command on Sat Jan 24 22:36:23 2026 with 3984726.125 GB free disk space

    cd unitigging
    /share/org/YZWL/yzwl_lixg/miniforge3/envs/canu_v.2.3/bin/tgStoreLoad \
      -S ../41.seqStore \
      -T  ./41.ctgStore 2 \
      -L ./5-consensus/ctgcns.files \
    > ./5-consensus/ctgcns.files.ctgStoreLoad.err 2>&1

-- Finished on Sat Jan 24 22:36:24 2026 (one second) with 3984725.25 GB free disk space
----------------------------------------
----------------------------------------
-- Starting command on Sat Jan 24 22:36:24 2026 with 3984725.25 GB free disk space

    cd unitigging
    /share/org/YZWL/yzwl_lixg/miniforge3/envs/canu_v.2.3/bin/tgTigDisplay \
      -S ../41.seqStore \
      -b \
      -o ../41.contigs.unsorted.bam \
      -L ./5-consensus/ctgcns.files \
    > ./5-consensus/ctgcns.files.contigs.bam.err 2>&1

-- Finished on Sat Jan 24 22:39:06 2026 (162 seconds) with 3991135.281 GB free disk space
----------------------------------------
----------------------------------------
-- Starting command on Sat Jan 24 22:39:06 2026 with 3991135.281 GB free disk space

    cd .
    samtools sort \
      --write-index \
      --threads 2 \
      -o ./41.contigs.bam ./41.contigs.unsorted.bam \
    > ./ctgcns.bam.err 2>&1

-- Finished on Sat Jan 24 22:40:20 2026 (74 seconds) with 3994965.125 GB free disk space
----------------------------------------
-- Purging consensus output after loading to ctgStore.
-- Purged 11 .cns outputs.
----------------------------------------
-- Starting command on Sat Jan 24 22:40:20 2026 with 3994967.046 GB free disk space

    cd unitigging
    /share/org/YZWL/yzwl_lixg/miniforge3/envs/canu_v.2.3/bin/tgStoreDump \
      -S ../41.seqStore \
      -T ./41.ctgStore 2 \
      -sizes -s 85000000 \
    > ./41.ctgStore/seqDB.v002.sizes.txt
ZERO length suplied to intervalList::add(), ignoring interval.
ZERO length suplied to intervalList::add(), ignoring interval.
ZERO length suplied to intervalList::add(), ignoring interval.
ZERO length suplied to intervalList::add(), ignoring interval.
ZERO length suplied to intervalList::add(), ignoring interval.
ZERO length suplied to intervalList::add(), ignoring interval.
ZERO length suplied to intervalList::add(), ignoring interval.
ZERO length suplied to intervalList::add(), ignoring interval.
ZERO length suplied to intervalList::add(), ignoring interval.
ZERO length suplied to intervalList::add(), ignoring interval.
ZERO length suplied to intervalList::add(), ignoring interval.
ZERO length suplied to intervalList::add(), ignoring interval.
ZERO length suplied to intervalList::add(), ignoring interval.
ZERO length suplied to intervalList::add(), ignoring interval.
ZERO length suplied to intervalList::add(), ignoring interval.
ZERO length suplied to intervalList::add(), ignoring interval.
ZERO length suplied to intervalList::add(), ignoring interval.
ZERO length suplied to intervalList::add(), ignoring interval.
ZERO length suplied to intervalList::add(), ignoring interval.
ZERO length suplied to intervalList::add(), ignoring interval.
ZERO length suplied to intervalList::add(), ignoring interval.
ZERO length suplied to intervalList::add(), ignoring interval.
ZERO length suplied to intervalList::add(), ignoring interval.
ZERO length suplied to intervalList::add(), ignoring interval.
ZERO length suplied to intervalList::add(), ignoring interval.
ZERO length suplied to intervalList::add(), ignoring interval.
ZERO length suplied to intervalList::add(), ignoring interval.
ZERO length suplied to intervalList::add(), ignoring interval.
ZERO length suplied to intervalList::add(), ignoring interval.
ZERO length suplied to intervalList::add(), ignoring interval.
ZERO length suplied to intervalList::add(), ignoring interval.
ZERO length suplied to intervalList::add(), ignoring interval.
ZERO length suplied to intervalList::add(), ignoring interval.
ZERO length suplied to intervalList::add(), ignoring interval.
ZERO length suplied to intervalList::add(), ignoring interval.
ZERO length suplied to intervalList::add(), ignoring interval.
ZERO length suplied to intervalList::add(), ignoring interval.
ZERO length suplied to intervalList::add(), ignoring interval.
ZERO length suplied to intervalList::add(), ignoring interval.
ZERO length suplied to intervalList::add(), ignoring interval.
ZERO length suplied to intervalList::add(), ignoring interval.
ZERO length suplied to intervalList::add(), ignoring interval.
ZERO length suplied to intervalList::add(), ignoring interval.
ZERO length suplied to intervalList::add(), ignoring interval.
ZERO length suplied to intervalList::add(), ignoring interval.
ZERO length suplied to intervalList::add(), ignoring interval.
ZERO length suplied to intervalList::add(), ignoring interval.
ZERO length suplied to intervalList::add(), ignoring interval.
ZERO length suplied to intervalList::add(), ignoring interval.
ZERO length suplied to intervalList::add(), ignoring interval.
ZERO length suplied to intervalList::add(), ignoring interval.
ZERO length suplied to intervalList::add(), ignoring interval.
ZERO length suplied to intervalList::add(), ignoring interval.
ZERO length suplied to intervalList::add(), ignoring interval.
ZERO length suplied to intervalList::add(), ignoring interval.
ZERO length suplied to intervalList::add(), ignoring interval.
ZERO length suplied to intervalList::add(), ignoring interval.
ZERO length suplied to intervalList::add(), ignoring interval.
ZERO length suplied to intervalList::add(), ignoring interval.
ZERO length suplied to intervalList::add(), ignoring interval.
ZERO length suplied to intervalList::add(), ignoring interval.
ZERO length suplied to intervalList::add(), ignoring interval.
ZERO length suplied to intervalList::add(), ignoring interval.
ZERO length suplied to intervalList::add(), ignoring interval.
ZERO length suplied to intervalList::add(), ignoring interval.
ZERO length suplied to intervalList::add(), ignoring interval.
ZERO length suplied to intervalList::add(), ignoring interval.
ZERO length suplied to intervalList::add(), ignoring interval.
ZERO length suplied to intervalList::add(), ignoring interval.
ZERO length suplied to intervalList::add(), ignoring interval.
ZERO length suplied to intervalList::add(), ignoring interval.

-- Finished on Sat Jan 24 22:40:20 2026 (lickety-split) with 3994967.046 GB free disk space
----------------------------------------
-- Found, in version 2, after consensus generation:
--   contigs:      138 sequences, total length 90968969 bp (including 203 repeats of total length 8502008 bp).
--   bubbles:      251 sequences, total length 13310540 bp.
--   unassembled:  18369 sequences, total length 326176478 bp.
--
-- Contig sizes based on genome size 85mbp:
--
--            NG (bp)  LG (contigs)    sum (bp)
--         ----------  ------------  ----------
--     10     8647194             1     8647194
--     20     8107038             3    24864469
--     30     7924037             4    32788506
--     40     5898948             5    38687454
--     50     5730032             6    44417486
--     60     5220008             8    55086895
--     70     3932794            10    63330616
--     80     3237292            12    69965822
--     90     1771407            15    77577403
--    100      989252            21    85677591
--
-- Finished stage 'consensusLoad', reset canuIteration.
----------------------------------------
-- Starting command on Sat Jan 24 22:40:20 2026 with 3994967.031 GB free disk space

    cd .
    /share/org/YZWL/yzwl_lixg/miniforge3/envs/canu_v.2.3/bin/tgStoreDump \
      -S ./41.seqStore \
      -T ./unitigging/41.ctgStore 2 \
      -o ./41.contigs \
      -layout \
    > ./41.contigs.layout.err 2>&1

-- Finished on Sat Jan 24 22:40:21 2026 (one second) with 3994966.984 GB free disk space
----------------------------------------
----------------------------------------
-- Starting command on Sat Jan 24 22:40:21 2026 with 3994966.984 GB free disk space

    cd .
    /share/org/YZWL/yzwl_lixg/miniforge3/envs/canu_v.2.3/bin/tgStoreDump \
      -S ./41.seqStore \
      -T ./unitigging/41.ctgStore 2 \
      -consensus -fasta \
      -unassembled \
    > ./41.unassembled.fasta
    2> ./41.unassembled.err
ZERO length suplied to intervalList::add(), ignoring interval.
ZERO length suplied to intervalList::add(), ignoring interval.
ZERO length suplied to intervalList::add(), ignoring interval.
ZERO length suplied to intervalList::add(), ignoring interval.
ZERO length suplied to intervalList::add(), ignoring interval.
ZERO length suplied to intervalList::add(), ignoring interval.
ZERO length suplied to intervalList::add(), ignoring interval.
ZERO length suplied to intervalList::add(), ignoring interval.
ZERO length suplied to intervalList::add(), ignoring interval.
ZERO length suplied to intervalList::add(), ignoring interval.
ZERO length suplied to intervalList::add(), ignoring interval.
ZERO length suplied to intervalList::add(), ignoring interval.
ZERO length suplied to intervalList::add(), ignoring interval.
ZERO length suplied to intervalList::add(), ignoring interval.
ZERO length suplied to intervalList::add(), ignoring interval.
ZERO length suplied to intervalList::add(), ignoring interval.
ZERO length suplied to intervalList::add(), ignoring interval.
ZERO length suplied to intervalList::add(), ignoring interval.
ZERO length suplied to intervalList::add(), ignoring interval.
ZERO length suplied to intervalList::add(), ignoring interval.
ZERO length suplied to intervalList::add(), ignoring interval.
ZERO length suplied to intervalList::add(), ignoring interval.
ZERO length suplied to intervalList::add(), ignoring interval.
ZERO length suplied to intervalList::add(), ignoring interval.
ZERO length suplied to intervalList::add(), ignoring interval.
ZERO length suplied to intervalList::add(), ignoring interval.
ZERO length suplied to intervalList::add(), ignoring interval.
ZERO length suplied to intervalList::add(), ignoring interval.
ZERO length suplied to intervalList::add(), ignoring interval.
ZERO length suplied to intervalList::add(), ignoring interval.
ZERO length suplied to intervalList::add(), ignoring interval.
ZERO length suplied to intervalList::add(), ignoring interval.
ZERO length suplied to intervalList::add(), ignoring interval.
ZERO length suplied to intervalList::add(), ignoring interval.
ZERO length suplied to intervalList::add(), ignoring interval.
ZERO length suplied to intervalList::add(), ignoring interval.
ZERO length suplied to intervalList::add(), ignoring interval.
ZERO length suplied to intervalList::add(), ignoring interval.
ZERO length suplied to intervalList::add(), ignoring interval.
ZERO length suplied to intervalList::add(), ignoring interval.
ZERO length suplied to intervalList::add(), ignoring interval.
ZERO length suplied to intervalList::add(), ignoring interval.
ZERO length suplied to intervalList::add(), ignoring interval.
ZERO length suplied to intervalList::add(), ignoring interval.
ZERO length suplied to intervalList::add(), ignoring interval.
ZERO length suplied to intervalList::add(), ignoring interval.
ZERO length suplied to intervalList::add(), ignoring interval.
ZERO length suplied to intervalList::add(), ignoring interval.
ZERO length suplied to intervalList::add(), ignoring interval.
ZERO length suplied to intervalList::add(), ignoring interval.
ZERO length suplied to intervalList::add(), ignoring interval.
ZERO length suplied to intervalList::add(), ignoring interval.
ZERO length suplied to intervalList::add(), ignoring interval.
ZERO length suplied to intervalList::add(), ignoring interval.
ZERO length suplied to intervalList::add(), ignoring interval.
ZERO length suplied to intervalList::add(), ignoring interval.
ZERO length suplied to intervalList::add(), ignoring interval.
ZERO length suplied to intervalList::add(), ignoring interval.
ZERO length suplied to intervalList::add(), ignoring interval.
ZERO length suplied to intervalList::add(), ignoring interval.
ZERO length suplied to intervalList::add(), ignoring interval.
ZERO length suplied to intervalList::add(), ignoring interval.
ZERO length suplied to intervalList::add(), ignoring interval.
ZERO length suplied to intervalList::add(), ignoring interval.
ZERO length suplied to intervalList::add(), ignoring interval.
ZERO length suplied to intervalList::add(), ignoring interval.
ZERO length suplied to intervalList::add(), ignoring interval.
ZERO length suplied to intervalList::add(), ignoring interval.
ZERO length suplied to intervalList::add(), ignoring interval.
ZERO length suplied to intervalList::add(), ignoring interval.
ZERO length suplied to intervalList::add(), ignoring interval.

-- Finished on Sat Jan 24 22:40:22 2026 (one second) with 3994966.656 GB free disk space
----------------------------------------
----------------------------------------
-- Starting command on Sat Jan 24 22:40:22 2026 with 3994966.656 GB free disk space

    cd .
    /share/org/YZWL/yzwl_lixg/miniforge3/envs/canu_v.2.3/bin/tgStoreDump \
      -S ./41.seqStore \
      -T ./unitigging/41.ctgStore 2 \
      -consensus -fasta \
      -contigs \
    > ./41.contigs.fasta
    2> ./41.contigs.err
ZERO length suplied to intervalList::add(), ignoring interval.
ZERO length suplied to intervalList::add(), ignoring interval.
ZERO length suplied to intervalList::add(), ignoring interval.
ZERO length suplied to intervalList::add(), ignoring interval.
ZERO length suplied to intervalList::add(), ignoring interval.
ZERO length suplied to intervalList::add(), ignoring interval.
ZERO length suplied to intervalList::add(), ignoring interval.
ZERO length suplied to intervalList::add(), ignoring interval.
ZERO length suplied to intervalList::add(), ignoring interval.
ZERO length suplied to intervalList::add(), ignoring interval.
ZERO length suplied to intervalList::add(), ignoring interval.
ZERO length suplied to intervalList::add(), ignoring interval.
ZERO length suplied to intervalList::add(), ignoring interval.
ZERO length suplied to intervalList::add(), ignoring interval.
ZERO length suplied to intervalList::add(), ignoring interval.
ZERO length suplied to intervalList::add(), ignoring interval.
ZERO length suplied to intervalList::add(), ignoring interval.
ZERO length suplied to intervalList::add(), ignoring interval.
ZERO length suplied to intervalList::add(), ignoring interval.
ZERO length suplied to intervalList::add(), ignoring interval.
ZERO length suplied to intervalList::add(), ignoring interval.
ZERO length suplied to intervalList::add(), ignoring interval.
ZERO length suplied to intervalList::add(), ignoring interval.
ZERO length suplied to intervalList::add(), ignoring interval.
ZERO length suplied to intervalList::add(), ignoring interval.
ZERO length suplied to intervalList::add(), ignoring interval.
ZERO length suplied to intervalList::add(), ignoring interval.
ZERO length suplied to intervalList::add(), ignoring interval.
ZERO length suplied to intervalList::add(), ignoring interval.
ZERO length suplied to intervalList::add(), ignoring interval.
ZERO length suplied to intervalList::add(), ignoring interval.
ZERO length suplied to intervalList::add(), ignoring interval.
ZERO length suplied to intervalList::add(), ignoring interval.
ZERO length suplied to intervalList::add(), ignoring interval.
ZERO length suplied to intervalList::add(), ignoring interval.
ZERO length suplied to intervalList::add(), ignoring interval.
ZERO length suplied to intervalList::add(), ignoring interval.
ZERO length suplied to intervalList::add(), ignoring interval.
ZERO length suplied to intervalList::add(), ignoring interval.
ZERO length suplied to intervalList::add(), ignoring interval.
ZERO length suplied to intervalList::add(), ignoring interval.
ZERO length suplied to intervalList::add(), ignoring interval.
ZERO length suplied to intervalList::add(), ignoring interval.
ZERO length suplied to intervalList::add(), ignoring interval.
ZERO length suplied to intervalList::add(), ignoring interval.
ZERO length suplied to intervalList::add(), ignoring interval.
ZERO length suplied to intervalList::add(), ignoring interval.
ZERO length suplied to intervalList::add(), ignoring interval.
ZERO length suplied to intervalList::add(), ignoring interval.
ZERO length suplied to intervalList::add(), ignoring interval.
ZERO length suplied to intervalList::add(), ignoring interval.
ZERO length suplied to intervalList::add(), ignoring interval.
ZERO length suplied to intervalList::add(), ignoring interval.
ZERO length suplied to intervalList::add(), ignoring interval.
ZERO length suplied to intervalList::add(), ignoring interval.
ZERO length suplied to intervalList::add(), ignoring interval.
ZERO length suplied to intervalList::add(), ignoring interval.
ZERO length suplied to intervalList::add(), ignoring interval.
ZERO length suplied to intervalList::add(), ignoring interval.
ZERO length suplied to intervalList::add(), ignoring interval.
ZERO length suplied to intervalList::add(), ignoring interval.
ZERO length suplied to intervalList::add(), ignoring interval.
ZERO length suplied to intervalList::add(), ignoring interval.
ZERO length suplied to intervalList::add(), ignoring interval.
ZERO length suplied to intervalList::add(), ignoring interval.
ZERO length suplied to intervalList::add(), ignoring interval.
ZERO length suplied to intervalList::add(), ignoring interval.
ZERO length suplied to intervalList::add(), ignoring interval.
ZERO length suplied to intervalList::add(), ignoring interval.
ZERO length suplied to intervalList::add(), ignoring interval.
ZERO length suplied to intervalList::add(), ignoring interval.

-- Finished on Sat Jan 24 22:40:23 2026 (one second) with 3994966.546 GB free disk space
----------------------------------------
-- Finished stage 'generateOutputs', reset canuIteration.
--
-- Assembly '41' finished in '/share/org/YZWL/yzwl_lixg/project/28.大豆疫霉三代基因组/05.过滤hifi数新组装挂载/03.hicanu/41/01.raw_output'.
--
-- Summary saved in '41.report'.
--
-- Sequences saved:
--   Contigs       -> '41.contigs.fasta'
--   Unassembled   -> '41.unassembled.fasta'
--
-- Read layouts saved:
--   Contigs       -> '41.contigs.layout'.
--
-- Bye.

Usage: biopytools ragtag [OPTIONS]
Try 'biopytools ragtag -h' for help.

Error: Invalid value for '-q' / '--query': 文件存在|File does not exist: /share/org/YZWL/yzwl_lixg/project/28.大豆疫霉三代基因组/03.hicanu/41/02.fasta/41.contigs.fasta
Usage: biopytools genomesyn [OPTIONS]
Try 'biopytools genomesyn -h' for help.

Error: Invalid value for '-i' / '--ref': Path '04.ragtag/41/hicanu/41_RagTag_scaffolded.fa' does not exist.
Job 69021379 stderr output:

