Usage: biopytools ragtag [OPTIONS]
Try 'biopytools ragtag -h' for help.

Error: Invalid value for '-r' / '--reference': 文件不存在|File does not exist: /share/org/YZWL/yzwl_lixg/project/28.大豆疫霉菌三代基因组/04.ragtag/Psoja_T2T.fa
Usage: biopytools genomesyn [OPTIONS]
Try 'biopytools genomesyn -h' for help.

Error: Invalid value for '-i' / '--ref': Path '04.ragtag/A1-2/hifiasm/A1-2_RagTag_scaffolded.fa' does not exist.
2026-01-16 00:55:05.782 - WARNING - 命令错误输出|Command stderr:
-- canu master +27 changes (r10515 2a41e933b8de6ed66723d75d36dd071b46d2c347)
--
-- CITATIONS
--
-- For assemblies of PacBio HiFi reads:
--   Nurk S, Walenz BP, Rhiea A, Vollger MR, Logsdon GA, Grothe R, Miga KH, Eichler EE, Phillippy AM, Koren S.
--   HiCanu: accurate assembly of segmental duplications, satellites, and allelic variants from high-fidelity long reads.
--   biorXiv. 2020.
--   https://doi.org/10.1101/2020.03.14.992248
-- 
-- Read and contig alignments during correction and consensus use:
--   Šošic M, Šikic M.
--   Edlib: a C/C ++ library for fast, exact sequence alignment using edit distance.
--   Bioinformatics. 2017 May 1;33(9):1394-1395.
--   http://doi.org/10.1093/bioinformatics/btw753
-- 
-- Overlaps are generated using:
--   Berlin K, et al.
--   Assembling large genomes with single-molecule sequencing and locality-sensitive hashing.
--   Nat Biotechnol. 2015 Jun;33(6):623-30.
--   http://doi.org/10.1038/nbt.3238
-- 
--   Myers EW, et al.
--   A Whole-Genome Assembly of Drosophila.
--   Science. 2000 Mar 24;287(5461):2196-204.
--   http://doi.org/10.1126/science.287.5461.2196
-- 
-- Contig consensus sequences are generated using an algorithm derived from pbdagcon:
--   Chin CS, et al.
--   Nonhybrid, finished microbial genome assemblies from long-read SMRT sequencing data.
--   Nat Methods. 2013 Jun;10(6):563-9
--   http://doi.org/10.1038/nmeth.2474
-- 
-- CONFIGURE CANU
--
-- Detected Java(TM) Runtime Environment '17.0.15-internal' (from '/share/org/YZWL/yzwl_lixg/.local/bin/java') without -d64 support.
--
-- WARNING:
-- WARNING:  Failed to run gnuplot using command 'gnuplot'.
-- WARNING:  Plots will be disabled.
-- WARNING:
--
-- Detected samtools version '1.22' / htslib version 'htscodecs=1.6.3' (from 'samtools').
--
-- Detected 88 CPUs and 503 gigabytes of memory on the local machine.
--
-- Detected Slurm with 'sinfo' binary in /opt/skyformai/bin/sinfo.
--          Slurm disabled by useGrid=false
--
-- Detected  '' with 'pbsnodes' binary in /opt/skyformai/bin/pbsnodes.
--           disabled by useGrid=false
--
-- Detected LSF with 'bsub' binary in /opt/skyformai/bin/bsub.
--          LSF disabled by useGrid=false
--
-- Local machine mode enabled; grid support not detected or not allowed.
--
-- Found trimmed raw PacBio HiFi reads in the input files.
--
--                                (tag)Concurrency
--                         (tag)Threads          |
--                (tag)Memory         |          |
--        (tag)             |         |          |       total usage      algorithm
--        -------  ----------  --------   --------  --------------------  -----------------------------
-- Local: meryl     12.000 GB    4 CPUs x  22 jobs   264.000 GB  88 CPUs  (k-mer counting)
-- Local: cormhap   13.000 GB   11 CPUs x   8 jobs   104.000 GB  88 CPUs  (overlap detection with mhap)
-- Local: obtovl     8.000 GB    8 CPUs x  11 jobs    88.000 GB  88 CPUs  (overlap detection)
-- Local: utgovl     8.000 GB    8 CPUs x  11 jobs    88.000 GB  88 CPUs  (overlap detection)
-- Local: cor        -.--- GB    4 CPUs x   - jobs     -.--- GB   - CPUs  (read correction)
-- Local: ovb        4.000 GB    1 CPU  x  88 jobs   352.000 GB  88 CPUs  (overlap store bucketizer)
-- Local: ovs        8.000 GB    1 CPU  x  62 jobs   496.000 GB  62 CPUs  (overlap store sorting)
-- Local: red       16.000 GB    4 CPUs x  22 jobs   352.000 GB  88 CPUs  (read error detection)
-- Local: oea        8.000 GB    1 CPU  x  62 jobs   496.000 GB  62 CPUs  (overlap error adjustment)
-- Local: bat       32.000 GB    8 CPUs x   1 job     32.000 GB   8 CPUs  (contig construction with bogart)
-- Local: cns        -.--- GB    8 CPUs x   - jobs     -.--- GB   - CPUs  (consensus)
--
-- Generating assembly 'A1-2' in '/share/org/YZWL/yzwl_lixg/project/28.大豆疫霉菌三代基因组/03.hicanu/A1-2/01.raw_output':
--   genomeSize:
--     85000000
--
--   Overlap Generation Limits:
--     corOvlErrorRate 0.0000 (  0.00%)
--     obtOvlErrorRate 0.0250 (  2.50%)
--     utgOvlErrorRate 0.0100 (  1.00%)
--
--   Overlap Processing Limits:
--     corErrorRate    0.0000 (  0.00%)
--     obtErrorRate    0.0250 (  2.50%)
--     utgErrorRate    0.0003 (  0.03%)
--     cnsErrorRate    0.0500 (  5.00%)
--
--   Stages to run:
--     assemble HiFi reads.
--
--
-- BEGIN STORE CREATION
----------------------------------------
-- Starting command on Thu Jan 15 23:24:44 2026 with 4570144.703 GB free disk space

    cd .
    ./A1-2.seqStore.sh \
    > ./A1-2.seqStore.err 2>&1

-- Finished on Thu Jan 15 23:31:19 2026 (395 seconds) with 4570113.64 GB free disk space
----------------------------------------
--
-- In sequence store './A1-2.seqStore':
--   Found 249731 reads.
--   Found 4250015080 bases (50 times coverage).
--    Histogram of corrected reads:
--    
--    G=4250015080                       sum of  ||               length     num
--    NG         length     index       lengths  ||                range    seqs
--    ----- ------------ --------- ------------  ||  ------------------- -------
--    00010        26789     14849    425013275  ||       1241-2514         8459|---------------------
--    00020        24958     31327    850023397  ||       2515-3788        12917|--------------------------------
--    00030        23656     48835   1275022852  ||       3789-5062        11594|-----------------------------
--    00040        22589     67227   1700008735  ||       5063-6336         9692|------------------------
--    00050        21615     86463   2125022817  ||       6337-7610         8237|---------------------
--    00060        20617    106591   2550013136  ||       7611-8884         6948|------------------
--    00070        19483    127769   2975025505  ||       8885-10158        6215|----------------
--    00080        17861    150454   3400016430  ||      10159-11432        5278|--------------
--    00090        12115    177780   3825020906  ||      11433-12706        4689|------------
--    00100         1241    249731   4250015080  ||      12707-13980        4331|-----------
--    001.000x              249731   4250015080  ||      13981-15254        4440|-----------
--                                               ||      15255-16528        5970|---------------
--                                               ||      16529-17802        9911|-------------------------
--                                               ||      17803-19076       16643|------------------------------------------
--                                               ||      19077-20350       22553|--------------------------------------------------------
--                                               ||      20351-21624       25567|---------------------------------------------------------------
--                                               ||      21625-22898       24695|-------------------------------------------------------------
--                                               ||      22899-24172       20335|---------------------------------------------------
--                                               ||      24173-25446       15191|--------------------------------------
--                                               ||      25447-26720       10748|---------------------------
--                                               ||      26721-27994        6880|-----------------
--                                               ||      27995-29268        4394|-----------
--                                               ||      29269-30542        2301|------
--                                               ||      30543-31816        1075|---
--                                               ||      31817-33090         451|--
--                                               ||      33091-34364         148|-
--                                               ||      34365-35638          45|-
--                                               ||      35639-36912          10|-
--                                               ||      36913-38186           2|-
--                                               ||      38187-39460           1|-
--                                               ||      39461-40734           1|-
--                                               ||      40735-42008           1|-
--                                               ||      42009-43282           2|-
--                                               ||      43283-44556           0|
--                                               ||      44557-45830           2|-
--                                               ||      45831-47104           2|-
--                                               ||      47105-48378           2|-
--                                               ||      48379-49652           0|
--                                               ||      49653-50926           0|
--                                               ||      50927-52200           1|-
--    
--
-- In sequence store './A1-2.seqStore':
--   Found 249731 reads.
--   Found 4250015080 bases (50 times coverage).
--    Histogram of corrected-trimmed reads:
--    
--    G=4250015080                       sum of  ||               length     num
--    NG         length     index       lengths  ||                range    seqs
--    ----- ------------ --------- ------------  ||  ------------------- -------
--    00010        26789     14849    425013275  ||       1241-2514         8459|---------------------
--    00020        24958     31327    850023397  ||       2515-3788        12917|--------------------------------
--    00030        23656     48835   1275022852  ||       3789-5062        11594|-----------------------------
--    00040        22589     67227   1700008735  ||       5063-6336         9692|------------------------
--    00050        21615     86463   2125022817  ||       6337-7610         8237|---------------------
--    00060        20617    106591   2550013136  ||       7611-8884         6948|------------------
--    00070        19483    127769   2975025505  ||       8885-10158        6215|----------------
--    00080        17861    150454   3400016430  ||      10159-11432        5278|--------------
--    00090        12115    177780   3825020906  ||      11433-12706        4689|------------
--    00100         1241    249731   4250015080  ||      12707-13980        4331|-----------
--    001.000x              249731   4250015080  ||      13981-15254        4440|-----------
--                                               ||      15255-16528        5970|---------------
--                                               ||      16529-17802        9911|-------------------------
--                                               ||      17803-19076       16643|------------------------------------------
--                                               ||      19077-20350       22553|--------------------------------------------------------
--                                               ||      20351-21624       25567|---------------------------------------------------------------
--                                               ||      21625-22898       24695|-------------------------------------------------------------
--                                               ||      22899-24172       20335|---------------------------------------------------
--                                               ||      24173-25446       15191|--------------------------------------
--                                               ||      25447-26720       10748|---------------------------
--                                               ||      26721-27994        6880|-----------------
--                                               ||      27995-29268        4394|-----------
--                                               ||      29269-30542        2301|------
--                                               ||      30543-31816        1075|---
--                                               ||      31817-33090         451|--
--                                               ||      33091-34364         148|-
--                                               ||      34365-35638          45|-
--                                               ||      35639-36912          10|-
--                                               ||      36913-38186           2|-
--                                               ||      38187-39460           1|-
--                                               ||      39461-40734           1|-
--                                               ||      40735-42008           1|-
--                                               ||      42009-43282           2|-
--                                               ||      43283-44556           0|
--                                               ||      44557-45830           2|-
--                                               ||      45831-47104           2|-
--                                               ||      47105-48378           2|-
--                                               ||      48379-49652           0|
--                                               ||      49653-50926           0|
--                                               ||      50927-52200           1|-
--    
--
-- Correction skipped; not enabled.
--
-- Trimming skipped; not enabled.
--
-- BEGIN ASSEMBLY
----------------------------------------
-- Starting command on Thu Jan 15 23:31:20 2026 with 4570113.593 GB free disk space

    cd unitigging/0-mercounts
    ./meryl-configure.sh \
    > ./meryl-configure.err 2>&1

-- Finished on Thu Jan 15 23:31:21 2026 (one second) with 4570113.593 GB free disk space
----------------------------------------
--  segments   memory batches
--  -------- -------- -------
--        01 10.81 GB       2
--        02  5.61 GB       2
--        04  2.97 GB       2
--        06  2.14 GB       2
--        08  1.61 GB       2
--        12  1.07 GB       2
--        16  0.81 GB       2
--        20  0.65 GB       2
--        24  0.54 GB       2
--        32  0.41 GB       2
--        40  0.32 GB       2
--        48  -.-- GB       -  (segment size too small)
--        56  -.-- GB       -  (segment size too small)
--        64  -.-- GB       -  (segment size too small)
--        96  -.-- GB       -  (segment size too small)
--
--  For 249731 reads with 4250015080 bases, limit to 42 batches.
--  Will count kmers using 01 jobs, each using 12 GB and 4 threads.
--
-- Finished stage 'merylConfigure', reset canuIteration.
--
-- Running jobs.  First attempt out of 2.
----------------------------------------
-- Starting 'meryl' concurrent execution on Thu Jan 15 23:31:21 2026 with 4570113.562 GB free disk space (1 processes; 22 concurrently)

    cd unitigging/0-mercounts
    ./meryl-count.sh 1 > ./meryl-count.000001.out 2>&1

-- Finished on Thu Jan 15 23:34:40 2026 (199 seconds) with 4569894.093 GB free disk space
----------------------------------------
-- Found 1 Kmer counting (meryl) outputs.
-- Finished stage 'utg-merylCountCheck', reset canuIteration.
--
-- Running jobs.  First attempt out of 2.
----------------------------------------
-- Starting 'meryl' concurrent execution on Thu Jan 15 23:34:40 2026 with 4569894.062 GB free disk space (1 processes; 22 concurrently)

    cd unitigging/0-mercounts
    ./meryl-process.sh 1 > ./meryl-process.000001.out 2>&1

-- Finished on Thu Jan 15 23:34:46 2026 (6 seconds) with 4569894.734 GB free disk space
----------------------------------------
-- Meryl finished successfully.  Kmer frequency histogram:
--
-- WARNING: gnuplot failed.
--
----------------------------------------
--
--  22-mers                                                                                           Fraction
--    Occurrences   NumMers                                                                         Unique Total
--       1-     1         0                                                                        0.0000 0.0000
--       2-     2    547079 **                                                                     0.0120 0.0003
--       3-     4    158703                                                                        0.0147 0.0005
--       5-     7     34680                                                                        0.0159 0.0006
--       8-    11     17995                                                                        0.0164 0.0006
--      12-    16     22535                                                                        0.0168 0.0006
--      17-    22    124663                                                                        0.0174 0.0008
--      23-    29   1080584 ****                                                                   0.0210 0.0018
--      30-    37   6263605 ***************************                                            0.0520 0.0141
--      38-    46  16225231 ********************************************************************** 0.2131 0.0944
--      47-    56  13180405 ********************************************************               0.5803 0.3182
--      57-    67   2987013 ************                                                           0.8428 0.5098
--      68-    79    763566 ***                                                                    0.8970 0.5567
--      80-    92    986945 ****                                                                   0.9135 0.5741
--      93-   106    708955 ***                                                                    0.9352 0.6008
--     107-   121    308390 *                                                                      0.9499 0.6215
--     122-   137    294094 *                                                                      0.9566 0.6322
--     138-   154    231866 *                                                                      0.9630 0.6442
--     155-   172    166445                                                                        0.9679 0.6543
--     173-   191    150731                                                                        0.9716 0.6627
--     192-   211    112693                                                                        0.9749 0.6712
--     212-   232    111636                                                                        0.9773 0.6782
--     233-   254     90365                                                                        0.9798 0.6860
--     255-   277     89986                                                                        0.9817 0.6927
--     278-   301     71715                                                                        0.9837 0.7001
--     302-   326     62041                                                                        0.9853 0.7065
--     327-   352     59494                                                                        0.9866 0.7126
--     353-   379     41875                                                                        0.9879 0.7188
--     380-   407     43311                                                                        0.9888 0.7236
--     408-   436     38914                                                                        0.9898 0.7289
--     437-   466     31218                                                                        0.9906 0.7340
--     467-   497     29190                                                                        0.9913 0.7383
--     498-   529     25245                                                                        0.9920 0.7427
--     530-   562     20489                                                                        0.9925 0.7468
--     563-   596     18603                                                                        0.9930 0.7502
--     597-   631     16434                                                                        0.9934 0.7535
--     632-   667     15232                                                                        0.9937 0.7567
--     668-   704     13838                                                                        0.9941 0.7597
--     705-   742     12046                                                                        0.9944 0.7627
--     743-   781     13109                                                                        0.9946 0.7654
--     782-   821     10683                                                                        0.9949 0.7685
--
--           0 (max occurrences)
--  3211547503 (total mers, non-unique)
--    45401430 (distinct mers, non-unique)
--           0 (unique mers)
-- Finished stage 'meryl-process', reset canuIteration.
--
-- Removing meryl database 'unitigging/0-mercounts/A1-2.ms22'.
--
-- OVERLAPPER (normal) (assembly) erate=0.01
--
----------------------------------------
-- Starting command on Thu Jan 15 23:34:46 2026 with 4569894.718 GB free disk space

    cd unitigging/1-overlapper
    /share/org/YZWL/yzwl_lixg/miniforge3/envs/canu_v.2.3/bin/overlapInCorePartition \
     -S  ../../A1-2.seqStore \
     -hl 160000000 \
     -rl 5000000000 \
     -ol 500 \
     -o  ./A1-2.partition \
    > ./A1-2.partition.err 2>&1

-- Finished on Thu Jan 15 23:34:46 2026 (fast as lightning) with 4569894.703 GB free disk space
----------------------------------------
--
-- Configured 21 overlapInCore jobs.
-- Finished stage 'utg-overlapConfigure', reset canuIteration.
--
-- Running jobs.  First attempt out of 2.
----------------------------------------
-- Starting 'utgovl' concurrent execution on Thu Jan 15 23:34:46 2026 with 4569894.671 GB free disk space (21 processes; 11 concurrently)

    cd unitigging/1-overlapper
    ./overlap.sh 1 > ./overlap.000001.out 2>&1
    ./overlap.sh 2 > ./overlap.000002.out 2>&1
    ./overlap.sh 3 > ./overlap.000003.out 2>&1
    ./overlap.sh 4 > ./overlap.000004.out 2>&1
    ./overlap.sh 5 > ./overlap.000005.out 2>&1
    ./overlap.sh 6 > ./overlap.000006.out 2>&1
    ./overlap.sh 7 > ./overlap.000007.out 2>&1
    ./overlap.sh 8 > ./overlap.000008.out 2>&1
    ./overlap.sh 9 > ./overlap.000009.out 2>&1
    ./overlap.sh 10 > ./overlap.000010.out 2>&1
    ./overlap.sh 11 > ./overlap.000011.out 2>&1
    ./overlap.sh 12 > ./overlap.000012.out 2>&1
    ./overlap.sh 13 > ./overlap.000013.out 2>&1
    ./overlap.sh 14 > ./overlap.000014.out 2>&1
    ./overlap.sh 15 > ./overlap.000015.out 2>&1
    ./overlap.sh 16 > ./overlap.000016.out 2>&1
    ./overlap.sh 17 > ./overlap.000017.out 2>&1
    ./overlap.sh 18 > ./overlap.000018.out 2>&1
    ./overlap.sh 19 > ./overlap.000019.out 2>&1
    ./overlap.sh 20 > ./overlap.000020.out 2>&1
    ./overlap.sh 21 > ./overlap.000021.out 2>&1

-- Finished on Fri Jan 16 00:00:19 2026 (1533 seconds) with 4566625.39 GB free disk space
----------------------------------------
-- Found 21 overlapInCore output files.
--
-- overlapInCore compute 'unitigging/1-overlapper':
--   kmer hits
--     with no overlap       1198400266  79.3333333 +- 35749457.721
--     with an overlap         24714236  8.38095238 +- 655615.299
--
--   overlaps                  24714236  8.38095238 +- 655615.299
--     contained                6073842  .571428571 +- 160684.413
--     dovetail                18640394  .809523809 +- 500653.745
--
--   overlaps rejected
--     multiple per pair              0           0 +- 0
--     bad short window               0           0 +- 0
--     bad long window                0           0 +- 0
-- Finished stage 'utg-overlapCheck', reset canuIteration.
----------------------------------------
-- Starting command on Fri Jan 16 00:00:19 2026 with 4566625.375 GB free disk space

    cd unitigging
    /share/org/YZWL/yzwl_lixg/miniforge3/envs/canu_v.2.3/bin/ovStoreConfig \
     -S ../A1-2.seqStore \
     -M 4-8 \
     -L ./1-overlapper/ovljob.files \
     -create ./A1-2.ovlStore.config \
     > ./A1-2.ovlStore.config.txt \
    2> ./A1-2.ovlStore.config.err

-- Finished on Fri Jan 16 00:00:19 2026 (in the blink of an eye) with 4566625.359 GB free disk space
----------------------------------------
--
-- Creating overlap store unitigging/A1-2.ovlStore using:
--      1 bucket
--      1 slice
--        using at most 2 GB memory each
--
-- Running jobs.  First attempt out of 2.
----------------------------------------
-- Starting 'ovS' concurrent execution on Fri Jan 16 00:00:19 2026 with 4566625.343 GB free disk space (1 processes; 62 concurrently)

    cd unitigging
    ./A1-2.ovlStore.sh 1 > ./A1-2.ovlStore.000001.out 2>&1

-- Finished on Fri Jan 16 00:00:32 2026 (13 seconds) with 4566574.484 GB free disk space
----------------------------------------
-- Checking store.
----------------------------------------
-- Starting command on Fri Jan 16 00:00:32 2026 with 4566574.484 GB free disk space

    cd unitigging
    /share/org/YZWL/yzwl_lixg/miniforge3/envs/canu_v.2.3/bin/ovStoreDump \
     -S ../A1-2.seqStore \
     -O  ./A1-2.ovlStore \
     -counts \
     > ./A1-2.ovlStore/counts.dat 2> ./A1-2.ovlStore/counts.err

-- Finished on Fri Jan 16 00:00:32 2026 (in the blink of an eye) with 4566574.453 GB free disk space
----------------------------------------
--
-- Overlap store 'unitigging/A1-2.ovlStore' successfully constructed.
-- Found 49428472 overlaps for 237988 reads; 1267249 reads have no overlaps.
--
--
-- Purged 0.54 GB in 63 overlap output files.
----------------------------------------
-- Starting command on Fri Jan 16 00:00:33 2026 with 4566574.453 GB free disk space

    cd unitigging
    /share/org/YZWL/yzwl_lixg/miniforge3/envs/canu_v.2.3/bin/ovStoreStats \
     -C 50 \
     -S ../A1-2.seqStore \
     -O  ./A1-2.ovlStore \
     -o  ./A1-2.ovlStore \
     > ./A1-2.ovlStore.summary.err 2>&1

-- Finished on Fri Jan 16 00:00:39 2026 (6 seconds) with 4566525.859 GB free disk space
----------------------------------------
--
-- Overlap store 'unitigging/A1-2.ovlStore' contains:
--
--   category            reads     %          read length        feature size or coverage  analysis
--   ----------------  -------  -------  ----------------------  ------------------------  --------------------
--   middle-missing        156    0.06    15665.76 +- 7409.08       1213.41 +- 2487.23    (bad trimming)
--   middle-hump            19    0.01    17963.47 +- 2902.91       7335.11 +- 3739.61    (bad trimming)
--   no-5-prime            726    0.29    14772.63 +- 5227.52       2094.61 +- 3214.80    (bad trimming)
--   no-3-prime            842    0.34    12556.96 +- 6481.07       1979.48 +- 3099.48    (bad trimming)
--   
--   low-coverage         2064    0.83    11827.30 +- 5826.55          5.99 +- 3.65       (easy to assemble, potential for lower quality consensus)
--   unique             198074   79.31    13069.87 +- 6099.43         44.86 +- 8.64       (easy to assemble, perfect, yay)
--   repeat-cont         13862    5.55    10655.68 +- 5507.71       1163.63 +- 822.16     (potential for consensus errors, no impact on assembly)
--   repeat-dove           173    0.07    20213.05 +- 2183.91        646.74 +- 730.89     (hard to assemble, likely won't assemble correctly or even at all)
--   
--   span-repeat          3253    1.30    15077.23 +- 4685.54       3869.22 +- 4068.88    (read spans a large repeat, usually easy to assemble)
--   uniq-repeat-cont    13048    5.22    13340.84 +- 4909.69                             (should be uniquely placed, low potential for consensus errors, no impact on assembly)
--   uniq-repeat-dove     3101    1.24    19235.13 +- 2412.35                             (will end contigs, potential to misassemble)
--   uniq-anchor          2670    1.07    14283.76 +- 4975.23       7984.42 +- 5347.96    (repeat read, with unique section, probable bad read)
-- Finished stage 'utg-createOverlapStore', reset canuIteration.
--
-- Loading read lengths.
-- Loading number of overlaps per read.
--
-- Configure RED for 16gb memory.
--                   Batches of at most (unlimited) reads.
--                                      500000000 bases.
--                   Expecting evidence of at most 536870912 bases per iteration.
--
--           Total                                               Reads                 Olaps Evidence
--    Job   Memory      Read Range         Reads        Bases   Memory        Olaps   Memory   Memory  (Memory in MB)
--   ---- -------- ------------------- --------- ------------ -------- ------------ -------- --------
--      1 16386.02         1-33385          5464    108951437 13299.91      1233562    14.12  1024.00
--      2 16384.20     33386-74957          6816    108940809 13298.65      1183399    13.54  1024.00
--      3 16386.96     74958-107360         5422    108968350 13301.97      1135274    12.99  1024.00
--      4 16384.95    107361-141359         5722    108926495 13296.87      1405180    16.08  1024.00
--      5 16384.28    141360-183410         7030    108973166 13302.61       844655     9.67  1024.00
--      6 16384.98    183411-226775         7125    108930490 13297.40      1361166    15.58  1024.00
--      7 16384.75    226776-260235         5609    108887265 13292.08      1806288    20.67  1024.00
--      8 16384.43    260236-297459         6304    108977879 13303.16       809899     9.27  1024.00
--      9 16385.27    297460-346821         8204    108919128 13296.05      1504898    17.22  1024.00
--     10 16384.53    346822-379704         5488    108916325 13295.62      1477664    16.91  1024.00
--     11 16385.48    379705-414790         5843    108962120 13301.22      1071129    12.26  1024.00
--     12 16384.39    414791-467371         8717    108914482 13295.50      1476357    16.90  1024.00
--     13 16387.21    467372-499952         5412    108982972 13303.76      1001108    11.46  1024.00
--     14 16385.78    499953-534606         5626    108920433 13296.13      1542659    17.65  1024.00
--     15 16385.48    534607-576603         6979    108987414 13304.35       798186     9.13  1024.00
--     16 16386.48    576604-621330         7295    108944891 13299.17      1338370    15.32  1024.00
--     17 16384.50    621331-654373         5619    108887562 13292.12      1781614    20.39  1024.00
--     18 16384.11    654374-691239         6157    108951955 13299.99      1059162    12.12  1024.00
--     19 16384.70    691240-743021         8535    108902750 13294.06      1629030    18.64  1024.00
--     20 16385.13    743022-776476         5411    108907206 13294.51      1627701    18.63  1024.00
--     21 16384.45    776477-811079         5844    108955100 13300.37      1055832    12.08  1024.00
--     22 16384.03    811080-858506         7810    108918776 13295.99      1401558    16.04  1024.00
--     23 16385.55    858507-893465         5839    108955585 13300.43      1147156    13.13  1024.00
--     24 16385.84    893466-926260         5551    108928272 13297.08      1463934    16.75  1024.00
--     25 16384.54    926261-965972         6475    108984314 13303.95       750451     8.59  1024.00
--     26 16385.71    965973-1010143        7396    108934547 13297.91      1380558    15.80  1024.00
--     27 16385.70   1010144-1043387        5443    108928602 13297.12      1448808    16.58  1024.00
--     28 16385.02   1043388-1077571        5838    108952799 13300.09      1129985    12.93  1024.00
--     29 16384.21   1077572-1125183        8008    108920252 13296.18      1400558    16.03  1024.00
--     30 16384.47   1125184-1158386        5350    108957510 13300.65      1033087    11.82  1024.00
--     31 16385.59   1158387-1192040        5595    108941158 13298.66      1304662    14.93  1024.00
--     32 16384.01   1192041-1233308        6808    108975008 13302.83       801959     9.18  1024.00
--     33 16385.52   1233309-1272859        6625    108945322 13299.20      1251137    14.32  1024.00
--     34 16385.90   1272860-1305737        5417    108909011 13294.73      1675625    19.18  1024.00
--     35 16384.33   1305738-1341853        6002    108977205 13303.07       808686     9.25  1024.00
--     36 16384.66   1341854-1388064        7665    108928736 13297.21      1350346    15.45  1024.00
--     37 16384.40   1388065-1421282        5415    108923441 13296.49      1390718    15.92  1024.00
--     38 16385.46   1421283-1455816        5727    108963261 13301.36      1057033    12.10  1024.00
--     39 16385.11   1455817-1504631        8048    108920696 13296.24      1474676    16.88  1024.00
--     40  3236.03   1504632-1505237          97      1342356   163.86        14402     0.16  1024.00
--   ---- -------- ------------------- --------- ------------ -------- ------------ -------- --------
--                                                 4250015080              49428472
-- Finished stage 'readErrorDetectionConfigure', reset canuIteration.
--
-- Running jobs.  First attempt out of 2.
----------------------------------------
-- Starting 'red' concurrent execution on Fri Jan 16 00:00:45 2026 with 4566523.718 GB free disk space (40 processes; 22 concurrently)

    cd unitigging/3-overlapErrorAdjustment
    ./red.sh 1 > ./red.000001.out 2>&1
    ./red.sh 2 > ./red.000002.out 2>&1
    ./red.sh 3 > ./red.000003.out 2>&1
    ./red.sh 4 > ./red.000004.out 2>&1
    ./red.sh 5 > ./red.000005.out 2>&1
    ./red.sh 6 > ./red.000006.out 2>&1
    ./red.sh 7 > ./red.000007.out 2>&1
    ./red.sh 8 > ./red.000008.out 2>&1
    ./red.sh 9 > ./red.000009.out 2>&1
    ./red.sh 10 > ./red.000010.out 2>&1
    ./red.sh 11 > ./red.000011.out 2>&1
    ./red.sh 12 > ./red.000012.out 2>&1
    ./red.sh 13 > ./red.000013.out 2>&1
    ./red.sh 14 > ./red.000014.out 2>&1
    ./red.sh 15 > ./red.000015.out 2>&1
    ./red.sh 16 > ./red.000016.out 2>&1
    ./red.sh 17 > ./red.000017.out 2>&1
    ./red.sh 18 > ./red.000018.out 2>&1
    ./red.sh 19 > ./red.000019.out 2>&1
    ./red.sh 20 > ./red.000020.out 2>&1
    ./red.sh 21 > ./red.000021.out 2>&1
    ./red.sh 22 > ./red.000022.out 2>&1
    ./red.sh 23 > ./red.000023.out 2>&1
    ./red.sh 24 > ./red.000024.out 2>&1
    ./red.sh 25 > ./red.000025.out 2>&1
    ./red.sh 26 > ./red.000026.out 2>&1
    ./red.sh 27 > ./red.000027.out 2>&1
    ./red.sh 28 > ./red.000028.out 2>&1
    ./red.sh 29 > ./red.000029.out 2>&1
    ./red.sh 30 > ./red.000030.out 2>&1
    ./red.sh 31 > ./red.000031.out 2>&1
    ./red.sh 32 > ./red.000032.out 2>&1
    ./red.sh 33 > ./red.000033.out 2>&1
    ./red.sh 34 > ./red.000034.out 2>&1
    ./red.sh 35 > ./red.000035.out 2>&1
    ./red.sh 36 > ./red.000036.out 2>&1
    ./red.sh 37 > ./red.000037.out 2>&1
    ./red.sh 38 > ./red.000038.out 2>&1
    ./red.sh 39 > ./red.000039.out 2>&1
    ./red.sh 40 > ./red.000040.out 2>&1

-- Finished on Fri Jan 16 00:12:42 2026 (717 seconds) with 4565411.953 GB free disk space
----------------------------------------
-- Found 40 read error detection output files.
-- Finished stage 'readErrorDetectionCheck', reset canuIteration.
--
-- Loading read lengths.
-- Loading number of overlaps per read.
--
-- Configure OEA for 8gb memory.
--                   Batches of at most (unlimited) reads.
--                                      300000000 bases.
--
--           Total                                               Reads                 Olaps  Adjusts
--    Job   Memory      Read Range         Reads        Bases   Memory        Olaps   Memory   Memory  (Memory in MB)
--   ---- -------- ------------------- --------- ------------ -------- ------------ -------- --------
--      1  2793.94         1-99228         16351    300012491   294.61      2860073    87.28   364.05
--      2  2829.14     99229-210375        18607    300010977   294.68      4011224   122.41   364.05
--      3  2802.62    210376-311591        16853    300020008   294.64      3143759    95.94   364.05
--      4  2823.49    311592-415354        17312    300014075   294.64      3827156   116.80   364.05
--      5  2822.23    415355-526532        18315    300006369   294.67      3785378   115.52   364.05
--      6  2803.34    526533-638136        18505    300012374   294.68      3166036    96.62   364.05
--      7  2823.73    638137-752637        18905    300017092   294.70      3833584   116.99   364.05
--      8  2832.37    752638-861308        18037    300004088   294.66      4117994   125.67   364.05
--      9  2797.99    861309-956248        15824    300015577   294.60      2993246    91.35   364.05
--     10  2822.16    956249-1061285       17499    300005823   294.64      3783865   115.47   364.05
--     11  2804.50   1061286-1168103       17726    300003557   294.65      3204835    97.80   364.05
--     12  2796.99   1168104-1274455       17677    300022723   294.66      2958307    90.28   364.05
--     13  2819.38   1274456-1381648       17779    300003028   294.65      3692416   112.68   364.05
--     14  2796.66   1381649-1479018       15926    300000370   294.59      2949831    90.02   364.05
--     15  2501.33   1479019-1505237        4415     49866528    55.69      1100768    33.59   364.05
--   ---- -------- ------------------- --------- ------------ -------- ------------ -------- --------
--                                                 4250015080              49428472
-- Finished stage 'overlapErrorAdjustmentConfigure', reset canuIteration.
--
-- Running jobs.  First attempt out of 2.
----------------------------------------
-- Starting 'oea' concurrent execution on Fri Jan 16 00:12:49 2026 with 4565411.875 GB free disk space (15 processes; 62 concurrently)

    cd unitigging/3-overlapErrorAdjustment
    ./oea.sh 1 > ./oea.000001.out 2>&1
    ./oea.sh 2 > ./oea.000002.out 2>&1
    ./oea.sh 3 > ./oea.000003.out 2>&1
    ./oea.sh 4 > ./oea.000004.out 2>&1
    ./oea.sh 5 > ./oea.000005.out 2>&1
    ./oea.sh 6 > ./oea.000006.out 2>&1
    ./oea.sh 7 > ./oea.000007.out 2>&1
    ./oea.sh 8 > ./oea.000008.out 2>&1
    ./oea.sh 9 > ./oea.000009.out 2>&1
    ./oea.sh 10 > ./oea.000010.out 2>&1
    ./oea.sh 11 > ./oea.000011.out 2>&1
    ./oea.sh 12 > ./oea.000012.out 2>&1
    ./oea.sh 13 > ./oea.000013.out 2>&1
    ./oea.sh 14 > ./oea.000014.out 2>&1
    ./oea.sh 15 > ./oea.000015.out 2>&1

-- Finished on Fri Jan 16 00:43:27 2026 (1838 seconds) with 4561223.031 GB free disk space
----------------------------------------
-- Found 15 overlap error adjustment output files.
-- Finished stage 'overlapErrorAdjustmentCheck', reset canuIteration.
----------------------------------------
-- Starting command on Fri Jan 16 00:43:27 2026 with 4561223.015 GB free disk space

    cd unitigging/3-overlapErrorAdjustment
    /share/org/YZWL/yzwl_lixg/miniforge3/envs/canu_v.2.3/bin/loadErates \
      -S ../../A1-2.seqStore \
      -O ../A1-2.ovlStore \
      -L ./oea.files \
    > ./oea.apply.err 2>&1

-- Finished on Fri Jan 16 00:43:27 2026 (in the blink of an eye) with 4561222.906 GB free disk space
----------------------------------------
-- No report available.
-- Finished stage 'updateOverlapStore', reset canuIteration.
-- Finished stage 'unitig', reset canuIteration.
--
-- Running jobs.  First attempt out of 2.
----------------------------------------
-- Starting 'bat' concurrent execution on Fri Jan 16 00:43:27 2026 with 4561222.859 GB free disk space (1 processes; 1 concurrently)

    cd unitigging/4-unitigger
    ./unitigger.sh 1 > ./unitigger.000001.out 2>&1

-- Finished on Fri Jan 16 00:43:40 2026 (13 seconds) with 4561162.468 GB free disk space
----------------------------------------
-- Unitigger finished successfully.
--  
--  ERROR RATES
--  -----------
--                                                   --------threshold------
--  271236                       fraction error      fraction        percent
--  samples                              (1e-5)         error          error
--                   --------------------------      --------       --------
--  command line (-eg)                           ->     30.00        0.0300%
--  command line (-ef)                           ->  -----.--      ---.----%
--  command line (-eM)                           ->     30.00        0.0300%
--  mean + std.dev       0.44 +-  12 *     3.03  ->     36.75        0.0367%
--  median + mad         0.00 +-  12 *     0.00  ->      0.00        0.0000%
--  90th percentile                              ->      1.00        0.0010%  (enabled)
--  
--  BEST EDGE FILTERING
--  -------------------
--  At graph threshold 0.0300%, reads:
--    available to have edges:        55197
--    with at least one edge:         40621
--  
--  At max threshold 0.0300%, reads:
--    available to have edges:        55197
--    with at least one edge:         40621
--  
--  At tight threshold 0.0010%, reads with:
--    both edges below error threshold:     35756  (80.00% minReadsBest threshold = 32496)
--    one  edge  above error threshold:      3656
--    both edges above error threshold:      1209
--    at least one edge:                    40621
--  
--  At loose threshold 0.0300%, reads with:
--    both edges below error threshold:     40621  (80.00% minReadsBest threshold = 32496)
--    one  edge  above error threshold:         0
--    both edges above error threshold:         0
--    at least one edge:                    40621
--  
--  
--  INITIAL EDGES
--  -------- ----------------------------------------
--    189663 reads are contained
--   1281261 reads have no best edges (singleton)
--       357 reads have only one best edge (spur) 
--                180 are mutual best
--     33956 reads have two best edges 
--                668 have one mutual best edge
--              33036 have two mutual best edges
--  
--  
--  FINAL EDGES
--  -------- ----------------------------------------
--    189663 reads are contained
--   1281594 reads have no best edges (singleton)
--       237 reads have only one best edge (spur) 
--                189 are mutual best
--     33743 reads have two best edges 
--                511 have one mutual best edge
--              33046 have two mutual best edges
--  
--  
--  EDGE FILTERING
--  -------- ------------------------------------------
--         0 reads are ignored
--     10392 reads have a gap in overlap coverage
--       133 reads have lopsided best edges
-- Found, in version 1, after unitig construction:
--   contigs:      56 sequences, total length 67493280 bp (including 66 repeats of total length 1595691 bp).
--   bubbles:      123 sequences, total length 3356161 bp.
--   unassembled:  26504 sequences, total length 327556432 bp.
--
-- Contig sizes based on genome size 85mbp:
--
--            NG (bp)  LG (contigs)    sum (bp)
--         ----------  ------------  ----------
--     10     6109325             2    13106867
--     20     4611522             3    17718389
--     30     4471976             5    26670162
--     40     4241879             7    35319676
--     50     3504645             9    42802481
--     60     2991854            12    52441151
--     70     1545114            16    60680142
--
-- Finished stage 'unitigCheck', reset canuIteration.
----------------------------------------
-- Starting command on Fri Jan 16 00:43:40 2026 with 4561162.453 GB free disk space

    cd unitigging
    /share/org/YZWL/yzwl_lixg/miniforge3/envs/canu_v.2.3/bin/utgcns \
      -S ../A1-2.seqStore \
      -T  ./A1-2.ctgStore 1 \
      -partition 0.8 1.5 0.1 \
    > ./A1-2.ctgStore/partitioning.log 2>&1

-- Finished on Fri Jan 16 00:43:49 2026 (9 seconds) with 4561161.25 GB free disk space
----------------------------------------
-- Using slow alignment for consensus (iteration '0').
-- Configured 11 consensus jobs.
-- Finished stage 'consensusConfigure', reset canuIteration.
--
-- Local: cns       10.500 GB    8 CPUs x  11 jobs   115.500 GB  88 CPUs  (consensus)
--
--
-- Running jobs.  First attempt out of 2.
----------------------------------------
-- Starting 'cns' concurrent execution on Fri Jan 16 00:43:50 2026 with 4561161.218 GB free disk space (11 processes; 11 concurrently)

    cd unitigging/5-consensus
    ./consensus.sh 1 > ./consensus.000001.out 2>&1
    ./consensus.sh 2 > ./consensus.000002.out 2>&1
    ./consensus.sh 3 > ./consensus.000003.out 2>&1
    ./consensus.sh 4 > ./consensus.000004.out 2>&1
    ./consensus.sh 5 > ./consensus.000005.out 2>&1
    ./consensus.sh 6 > ./consensus.000006.out 2>&1
    ./consensus.sh 7 > ./consensus.000007.out 2>&1
    ./consensus.sh 8 > ./consensus.000008.out 2>&1
    ./consensus.sh 9 > ./consensus.000009.out 2>&1
    ./consensus.sh 10 > ./consensus.000010.out 2>&1
    ./consensus.sh 11 > ./consensus.000011.out 2>&1

-- Finished on Fri Jan 16 00:50:39 2026 (409 seconds) with 4560032.093 GB free disk space
----------------------------------------
-- Using slow alignment for consensus (iteration '1').
-- Configured 11 consensus jobs.
-- All 11 consensus jobs finished successfully.
-- Finished stage 'consensusCheck', reset canuIteration.
-- Using slow alignment for consensus (iteration '0').
-- Configured 11 consensus jobs.
----------------------------------------
-- Starting command on Fri Jan 16 00:50:40 2026 with 4560032.046 GB free disk space

    cd unitigging
    /share/org/YZWL/yzwl_lixg/miniforge3/envs/canu_v.2.3/bin/tgStoreLoad \
      -S ../A1-2.seqStore \
      -T  ./A1-2.ctgStore 2 \
      -L ./5-consensus/ctgcns.files \
    > ./5-consensus/ctgcns.files.ctgStoreLoad.err 2>&1

-- Finished on Fri Jan 16 00:50:41 2026 (one second) with 4560030.953 GB free disk space
----------------------------------------
----------------------------------------
-- Starting command on Fri Jan 16 00:50:41 2026 with 4560030.953 GB free disk space

    cd unitigging
    /share/org/YZWL/yzwl_lixg/miniforge3/envs/canu_v.2.3/bin/tgTigDisplay \
      -S ../A1-2.seqStore \
      -b \
      -o ../A1-2.contigs.unsorted.bam \
      -L ./5-consensus/ctgcns.files \
    > ./5-consensus/ctgcns.files.contigs.bam.err 2>&1

-- Finished on Fri Jan 16 00:53:25 2026 (164 seconds) with 4559671.687 GB free disk space
----------------------------------------
----------------------------------------
-- Starting command on Fri Jan 16 00:53:25 2026 with 4559671.687 GB free disk space

    cd .
    samtools sort \
      --write-index \
      --threads 2 \
      -o ./A1-2.contigs.bam ./A1-2.contigs.unsorted.bam \
    > ./ctgcns.bam.err 2>&1

-- Finished on Fri Jan 16 00:55:02 2026 (97 seconds) with 4559390.203 GB free disk space
----------------------------------------
-- Purging consensus output after loading to ctgStore.
-- Purged 11 .cns outputs.
----------------------------------------
-- Starting command on Fri Jan 16 00:55:02 2026 with 4559392.281 GB free disk space

    cd unitigging
    /share/org/YZWL/yzwl_lixg/miniforge3/envs/canu_v.2.3/bin/tgStoreDump \
      -S ../A1-2.seqStore \
      -T ./A1-2.ctgStore 2 \
      -sizes -s 85000000 \
    > ./A1-2.ctgStore/seqDB.v002.sizes.txt
ZERO length suplied to intervalList::add(), ignoring interval.
ZERO length suplied to intervalList::add(), ignoring interval.
ZERO length suplied to intervalList::add(), ignoring interval.
ZERO length suplied to intervalList::add(), ignoring interval.
ZERO length suplied to intervalList::add(), ignoring interval.
ZERO length suplied to intervalList::add(), ignoring interval.
ZERO length suplied to intervalList::add(), ignoring interval.
ZERO length suplied to intervalList::add(), ignoring interval.
ZERO length suplied to intervalList::add(), ignoring interval.
ZERO length suplied to intervalList::add(), ignoring interval.
ZERO length suplied to intervalList::add(), ignoring interval.
ZERO length suplied to intervalList::add(), ignoring interval.
ZERO length suplied to intervalList::add(), ignoring interval.

-- Finished on Fri Jan 16 00:55:02 2026 (fast as lightning) with 4559392.281 GB free disk space
----------------------------------------
-- Found, in version 2, after consensus generation:
--   contigs:      56 sequences, total length 88008490 bp (including 66 repeats of total length 2268349 bp).
--   bubbles:      123 sequences, total length 4557160 bp.
--   unassembled:  26504 sequences, total length 450080773 bp.
--
-- Contig sizes based on genome size 85mbp:
--
--            NG (bp)  LG (contigs)    sum (bp)
--         ----------  ------------  ----------
--     10     9095797             1     9095797
--     20     7933332             2    17029129
--     30     5839822             4    28854397
--     40     5804015             5    34658412
--     50     5521094             7    45936096
--     60     5199872             8    51135968
--     70     4356093            10    60074012
--     80     3905599            12    68276246
--     90     2731908            15    76994480
--    100      579066            21    85447142
--
-- Finished stage 'consensusLoad', reset canuIteration.
----------------------------------------
-- Starting command on Fri Jan 16 00:55:02 2026 with 4559392.265 GB free disk space

    cd .
    /share/org/YZWL/yzwl_lixg/miniforge3/envs/canu_v.2.3/bin/tgStoreDump \
      -S ./A1-2.seqStore \
      -T ./unitigging/A1-2.ctgStore 2 \
      -o ./A1-2.contigs \
      -layout \
    > ./A1-2.contigs.layout.err 2>&1

-- Finished on Fri Jan 16 00:55:03 2026 (one second) with 4559392.218 GB free disk space
----------------------------------------
----------------------------------------
-- Starting command on Fri Jan 16 00:55:03 2026 with 4559392.218 GB free disk space

    cd .
    /share/org/YZWL/yzwl_lixg/miniforge3/envs/canu_v.2.3/bin/tgStoreDump \
      -S ./A1-2.seqStore \
      -T ./unitigging/A1-2.ctgStore 2 \
      -consensus -fasta \
      -unassembled \
    > ./A1-2.unassembled.fasta
    2> ./A1-2.unassembled.err
ZERO length suplied to intervalList::add(), ignoring interval.
ZERO length suplied to intervalList::add(), ignoring interval.
ZERO length suplied to intervalList::add(), ignoring interval.
ZERO length suplied to intervalList::add(), ignoring interval.
ZERO length suplied to intervalList::add(), ignoring interval.
ZERO length suplied to intervalList::add(), ignoring interval.
ZERO length suplied to intervalList::add(), ignoring interval.
ZERO length suplied to intervalList::add(), ignoring interval.
ZERO length suplied to intervalList::add(), ignoring interval.
ZERO length suplied to intervalList::add(), ignoring interval.
ZERO length suplied to intervalList::add(), ignoring interval.
ZERO length suplied to intervalList::add(), ignoring interval.
ZERO length suplied to intervalList::add(), ignoring interval.

-- Finished on Fri Jan 16 00:55:05 2026 (2 seconds) with 4559182.125 GB free disk space
----------------------------------------
----------------------------------------
-- Starting command on Fri Jan 16 00:55:05 2026 with 4559182.125 GB free disk space

    cd .
    /share/org/YZWL/yzwl_lixg/miniforge3/envs/canu_v.2.3/bin/tgStoreDump \
      -S ./A1-2.seqStore \
      -T ./unitigging/A1-2.ctgStore 2 \
      -consensus -fasta \
      -contigs \
    > ./A1-2.contigs.fasta
    2> ./A1-2.contigs.err
ZERO length suplied to intervalList::add(), ignoring interval.
ZERO length suplied to intervalList::add(), ignoring interval.
ZERO length suplied to intervalList::add(), ignoring interval.
ZERO length suplied to intervalList::add(), ignoring interval.
ZERO length suplied to intervalList::add(), ignoring interval.
ZERO length suplied to intervalList::add(), ignoring interval.
ZERO length suplied to intervalList::add(), ignoring interval.
ZERO length suplied to intervalList::add(), ignoring interval.
ZERO length suplied to intervalList::add(), ignoring interval.
ZERO length suplied to intervalList::add(), ignoring interval.
ZERO length suplied to intervalList::add(), ignoring interval.
ZERO length suplied to intervalList::add(), ignoring interval.
ZERO length suplied to intervalList::add(), ignoring interval.

-- Finished on Fri Jan 16 00:55:05 2026 (furiously fast) with 4559182.015 GB free disk space
----------------------------------------
-- Finished stage 'generateOutputs', reset canuIteration.
--
-- Assembly 'A1-2' finished in '/share/org/YZWL/yzwl_lixg/project/28.大豆疫霉菌三代基因组/03.hicanu/A1-2/01.raw_output'.
--
-- Summary saved in 'A1-2.report'.
--
-- Sequences saved:
--   Contigs       -> 'A1-2.contigs.fasta'
--   Unassembled   -> 'A1-2.unassembled.fasta'
--
-- Read layouts saved:
--   Contigs       -> 'A1-2.contigs.layout'.
--
-- Bye.

2026-01-16 00:55:05.786 - WARNING - 输出文件不存在|Output file does not exist: /share/org/YZWL/yzwl_lixg/project/28.大豆疫霉菌三代基因组/03.hicanu/A1-2/01.raw_output/A1-2.unitigs.fasta
Usage: biopytools ragtag [OPTIONS]
Try 'biopytools ragtag -h' for help.

Error: Invalid value for '-r' / '--reference': 文件不存在|File does not exist: /share/org/YZWL/yzwl_lixg/project/28.大豆疫霉菌三代基因组/04.ragtag/Psoja_T2T.fa
Usage: biopytools genomesyn [OPTIONS]
Try 'biopytools genomesyn -h' for help.

Error: Invalid value for '-i' / '--ref': Path '04.ragtag/A1-2/hicanu/A1-2_RagTag_scaffolded.fa' does not exist.
Job 68886683 stderr output:

