Usage: biopytools ragtag [OPTIONS]
Try 'biopytools ragtag -h' for help.

Error: Invalid value for '-r' / '--reference': 文件不存在|File does not exist: /share/org/YZWL/yzwl_lixg/project/28.大豆疫霉菌三代基因组/04.ragtag/Psoja_T2T.fa
Usage: biopytools genomesyn [OPTIONS]
Try 'biopytools genomesyn -h' for help.

Error: Invalid value for '-i' / '--ref': Path '04.ragtag/A2-5/hifiasm/A2-5_RagTag_scaffolded.fa' does not exist.
2026-01-16 04:08:58.946 - WARNING - 命令错误输出|Command stderr:
-- canu master +27 changes (r10515 2a41e933b8de6ed66723d75d36dd071b46d2c347)
--
-- CITATIONS
--
-- For assemblies of PacBio HiFi reads:
--   Nurk S, Walenz BP, Rhiea A, Vollger MR, Logsdon GA, Grothe R, Miga KH, Eichler EE, Phillippy AM, Koren S.
--   HiCanu: accurate assembly of segmental duplications, satellites, and allelic variants from high-fidelity long reads.
--   biorXiv. 2020.
--   https://doi.org/10.1101/2020.03.14.992248
-- 
-- Read and contig alignments during correction and consensus use:
--   Šošic M, Šikic M.
--   Edlib: a C/C ++ library for fast, exact sequence alignment using edit distance.
--   Bioinformatics. 2017 May 1;33(9):1394-1395.
--   http://doi.org/10.1093/bioinformatics/btw753
-- 
-- Overlaps are generated using:
--   Berlin K, et al.
--   Assembling large genomes with single-molecule sequencing and locality-sensitive hashing.
--   Nat Biotechnol. 2015 Jun;33(6):623-30.
--   http://doi.org/10.1038/nbt.3238
-- 
--   Myers EW, et al.
--   A Whole-Genome Assembly of Drosophila.
--   Science. 2000 Mar 24;287(5461):2196-204.
--   http://doi.org/10.1126/science.287.5461.2196
-- 
-- Contig consensus sequences are generated using an algorithm derived from pbdagcon:
--   Chin CS, et al.
--   Nonhybrid, finished microbial genome assemblies from long-read SMRT sequencing data.
--   Nat Methods. 2013 Jun;10(6):563-9
--   http://doi.org/10.1038/nmeth.2474
-- 
-- CONFIGURE CANU
--
-- Detected Java(TM) Runtime Environment '17.0.15-internal' (from '/share/org/YZWL/yzwl_lixg/.local/bin/java') without -d64 support.
--
-- WARNING:
-- WARNING:  Failed to run gnuplot using command 'gnuplot'.
-- WARNING:  Plots will be disabled.
-- WARNING:
--
-- Detected samtools version '1.22' / htslib version 'htscodecs=1.6.3' (from 'samtools').
--
-- Detected 88 CPUs and 503 gigabytes of memory on the local machine.
--
-- Detected Slurm with 'sinfo' binary in /opt/skyformai/bin/sinfo.
--          Slurm disabled by useGrid=false
--
-- Detected  '' with 'pbsnodes' binary in /opt/skyformai/bin/pbsnodes.
--           disabled by useGrid=false
--
-- Detected LSF with 'bsub' binary in /opt/skyformai/bin/bsub.
--          LSF disabled by useGrid=false
--
-- Local machine mode enabled; grid support not detected or not allowed.
--
-- Found trimmed raw PacBio HiFi reads in the input files.
--
--                                (tag)Concurrency
--                         (tag)Threads          |
--                (tag)Memory         |          |
--        (tag)             |         |          |       total usage      algorithm
--        -------  ----------  --------   --------  --------------------  -----------------------------
-- Local: meryl     12.000 GB    4 CPUs x  22 jobs   264.000 GB  88 CPUs  (k-mer counting)
-- Local: cormhap   13.000 GB   11 CPUs x   8 jobs   104.000 GB  88 CPUs  (overlap detection with mhap)
-- Local: obtovl     8.000 GB    8 CPUs x  11 jobs    88.000 GB  88 CPUs  (overlap detection)
-- Local: utgovl     8.000 GB    8 CPUs x  11 jobs    88.000 GB  88 CPUs  (overlap detection)
-- Local: cor        -.--- GB    4 CPUs x   - jobs     -.--- GB   - CPUs  (read correction)
-- Local: ovb        4.000 GB    1 CPU  x  88 jobs   352.000 GB  88 CPUs  (overlap store bucketizer)
-- Local: ovs        8.000 GB    1 CPU  x  62 jobs   496.000 GB  62 CPUs  (overlap store sorting)
-- Local: red       16.000 GB    4 CPUs x  22 jobs   352.000 GB  88 CPUs  (read error detection)
-- Local: oea        8.000 GB    1 CPU  x  62 jobs   496.000 GB  62 CPUs  (overlap error adjustment)
-- Local: bat       32.000 GB    8 CPUs x   1 job     32.000 GB   8 CPUs  (contig construction with bogart)
-- Local: cns        -.--- GB    8 CPUs x   - jobs     -.--- GB   - CPUs  (consensus)
--
-- Generating assembly 'A2-5' in '/share/org/YZWL/yzwl_lixg/project/28.大豆疫霉菌三代基因组/03.hicanu/A2-5/01.raw_output':
--   genomeSize:
--     85000000
--
--   Overlap Generation Limits:
--     corOvlErrorRate 0.0000 (  0.00%)
--     obtOvlErrorRate 0.0250 (  2.50%)
--     utgOvlErrorRate 0.0100 (  1.00%)
--
--   Overlap Processing Limits:
--     corErrorRate    0.0000 (  0.00%)
--     obtErrorRate    0.0250 (  2.50%)
--     utgErrorRate    0.0003 (  0.03%)
--     cnsErrorRate    0.0500 (  5.00%)
--
--   Stages to run:
--     assemble HiFi reads.
--
--
-- BEGIN STORE CREATION
----------------------------------------
-- Starting command on Fri Jan 16 02:28:25 2026 with 4559333.578 GB free disk space

    cd .
    ./A2-5.seqStore.sh \
    > ./A2-5.seqStore.err 2>&1

-- Finished on Fri Jan 16 02:36:14 2026 (469 seconds) with 4559012.203 GB free disk space
----------------------------------------
--
-- In sequence store './A2-5.seqStore':
--   Found 401107 reads.
--   Found 4250017804 bases (50 times coverage).
--    Histogram of corrected reads:
--    
--    G=4250017804                       sum of  ||               length     num
--    NG         length     index       lengths  ||                range    seqs
--    ----- ------------ --------- ------------  ||  ------------------- -------
--    00010        24046     16294    425012978  ||       1241-2294        24621|-----------------------------------------
--    00020        22049     34804    850010472  ||       2295-3348        38455|---------------------------------------------------------------
--    00030        20607     54754   1275006153  ||       3349-4402        36484|------------------------------------------------------------
--    00040        19125     76134   1700026177  ||       4403-5456        32268|-----------------------------------------------------
--    00050        16802     99675   2125014235  ||       5457-6510        27931|----------------------------------------------
--    00060        13518    127856   2550022252  ||       6511-7564        24341|----------------------------------------
--    00070        10627    163317   2975023041  ||       7565-8618        21051|-----------------------------------
--    00080         7918    209552   3400014903  ||       8619-9672        18113|------------------------------
--    00090         5262    274792   3825018275  ||       9673-10726       15987|---------------------------
--    00100         1241    401107   4250017804  ||      10727-11780       14308|------------------------
--    001.000x              401107   4250017804  ||      11781-12834       12389|---------------------
--                                               ||      12835-13888       11049|-------------------
--                                               ||      13889-14942        9630|----------------
--                                               ||      14943-15996        8374|--------------
--                                               ||      15997-17050        8511|--------------
--                                               ||      17051-18104        9739|----------------
--                                               ||      18105-19158       12177|--------------------
--                                               ||      19159-20212       15008|-------------------------
--                                               ||      20213-21266       15573|--------------------------
--                                               ||      21267-22320       13364|----------------------
--                                               ||      22321-23374       10321|-----------------
--                                               ||      23375-24428        7577|-------------
--                                               ||      24429-25482        5159|---------
--                                               ||      25483-26536        3518|------
--                                               ||      26537-27590        2227|----
--                                               ||      27591-28644        1390|---
--                                               ||      28645-29698         778|--
--                                               ||      29699-30752         437|-
--                                               ||      30753-31806         195|-
--                                               ||      31807-32860          78|-
--                                               ||      32861-33914          33|-
--                                               ||      33915-34968          10|-
--                                               ||      34969-36022           3|-
--                                               ||      36023-37076           0|
--                                               ||      37077-38130           2|-
--                                               ||      38131-39184           1|-
--                                               ||      39185-40238           1|-
--                                               ||      40239-41292           1|-
--                                               ||      41293-42346           0|
--                                               ||      42347-43400           3|-
--    
--
-- In sequence store './A2-5.seqStore':
--   Found 401107 reads.
--   Found 4250017804 bases (50 times coverage).
--    Histogram of corrected-trimmed reads:
--    
--    G=4250017804                       sum of  ||               length     num
--    NG         length     index       lengths  ||                range    seqs
--    ----- ------------ --------- ------------  ||  ------------------- -------
--    00010        24046     16294    425012978  ||       1241-2294        24621|-----------------------------------------
--    00020        22049     34804    850010472  ||       2295-3348        38455|---------------------------------------------------------------
--    00030        20607     54754   1275006153  ||       3349-4402        36484|------------------------------------------------------------
--    00040        19125     76134   1700026177  ||       4403-5456        32268|-----------------------------------------------------
--    00050        16802     99675   2125014235  ||       5457-6510        27931|----------------------------------------------
--    00060        13518    127856   2550022252  ||       6511-7564        24341|----------------------------------------
--    00070        10627    163317   2975023041  ||       7565-8618        21051|-----------------------------------
--    00080         7918    209552   3400014903  ||       8619-9672        18113|------------------------------
--    00090         5262    274792   3825018275  ||       9673-10726       15987|---------------------------
--    00100         1241    401107   4250017804  ||      10727-11780       14308|------------------------
--    001.000x              401107   4250017804  ||      11781-12834       12389|---------------------
--                                               ||      12835-13888       11049|-------------------
--                                               ||      13889-14942        9630|----------------
--                                               ||      14943-15996        8374|--------------
--                                               ||      15997-17050        8511|--------------
--                                               ||      17051-18104        9739|----------------
--                                               ||      18105-19158       12177|--------------------
--                                               ||      19159-20212       15008|-------------------------
--                                               ||      20213-21266       15573|--------------------------
--                                               ||      21267-22320       13364|----------------------
--                                               ||      22321-23374       10321|-----------------
--                                               ||      23375-24428        7577|-------------
--                                               ||      24429-25482        5159|---------
--                                               ||      25483-26536        3518|------
--                                               ||      26537-27590        2227|----
--                                               ||      27591-28644        1390|---
--                                               ||      28645-29698         778|--
--                                               ||      29699-30752         437|-
--                                               ||      30753-31806         195|-
--                                               ||      31807-32860          78|-
--                                               ||      32861-33914          33|-
--                                               ||      33915-34968          10|-
--                                               ||      34969-36022           3|-
--                                               ||      36023-37076           0|
--                                               ||      37077-38130           2|-
--                                               ||      38131-39184           1|-
--                                               ||      39185-40238           1|-
--                                               ||      40239-41292           1|-
--                                               ||      41293-42346           0|
--                                               ||      42347-43400           3|-
--    
--
-- Correction skipped; not enabled.
--
-- Trimming skipped; not enabled.
--
-- BEGIN ASSEMBLY
----------------------------------------
-- Starting command on Fri Jan 16 02:36:14 2026 with 4559012.156 GB free disk space

    cd unitigging/0-mercounts
    ./meryl-configure.sh \
    > ./meryl-configure.err 2>&1

-- Finished on Fri Jan 16 02:36:16 2026 (2 seconds) with 4559012.156 GB free disk space
----------------------------------------
--  segments   memory batches
--  -------- -------- -------
--        01 10.81 GB       2
--        02  5.61 GB       2
--        04  2.97 GB       2
--        06  2.14 GB       2
--        08  1.61 GB       2
--        12  1.07 GB       2
--        16  0.81 GB       2
--        20  0.65 GB       2
--        24  0.54 GB       2
--        32  0.41 GB       2
--        40  0.32 GB       2
--        48  -.-- GB       -  (segment size too small)
--        56  -.-- GB       -  (segment size too small)
--        64  -.-- GB       -  (segment size too small)
--        96  -.-- GB       -  (segment size too small)
--
--  For 401107 reads with 4250017804 bases, limit to 42 batches.
--  Will count kmers using 01 jobs, each using 12 GB and 4 threads.
--
-- Finished stage 'merylConfigure', reset canuIteration.
--
-- Running jobs.  First attempt out of 2.
----------------------------------------
-- Starting 'meryl' concurrent execution on Fri Jan 16 02:36:16 2026 with 4559012.125 GB free disk space (1 processes; 22 concurrently)

    cd unitigging/0-mercounts
    ./meryl-count.sh 1 > ./meryl-count.000001.out 2>&1

-- Finished on Fri Jan 16 02:39:36 2026 (200 seconds) with 4559149.062 GB free disk space
----------------------------------------
-- Found 1 Kmer counting (meryl) outputs.
-- Finished stage 'utg-merylCountCheck', reset canuIteration.
--
-- Running jobs.  First attempt out of 2.
----------------------------------------
-- Starting 'meryl' concurrent execution on Fri Jan 16 02:39:36 2026 with 4559149.031 GB free disk space (1 processes; 22 concurrently)

    cd unitigging/0-mercounts
    ./meryl-process.sh 1 > ./meryl-process.000001.out 2>&1

-- Finished on Fri Jan 16 02:39:42 2026 (6 seconds) with 4559149.562 GB free disk space
----------------------------------------
-- Meryl finished successfully.  Kmer frequency histogram:
--
-- WARNING: gnuplot failed.
--
----------------------------------------
--
--  22-mers                                                                                           Fraction
--    Occurrences   NumMers                                                                         Unique Total
--       1-     1         0                                                                        0.0000 0.0000
--       2-     2    258112 *                                                                      0.0057 0.0002
--       3-     4     86551                                                                        0.0071 0.0002
--       5-     7     28213                                                                        0.0080 0.0003
--       8-    11      9681                                                                        0.0084 0.0003
--      12-    16      7621                                                                        0.0085 0.0004
--      17-    22     56567                                                                        0.0087 0.0004
--      23-    29    598910 **                                                                     0.0105 0.0009
--      30-    37   4867386 ********************                                                   0.0286 0.0080
--      38-    46  16739454 ********************************************************************** 0.1592 0.0729
--      47-    56  14641054 *************************************************************          0.5494 0.3095
--      57-    67   2932504 ************                                                           0.8431 0.5217
--      68-    79    523892 **                                                                     0.8942 0.5653
--      80-    92   1073849 ****                                                                   0.9063 0.5780
--      93-   106    852303 ***                                                                    0.9307 0.6078
--     107-   121    300009 *                                                                      0.9484 0.6324
--     122-   137    298194 *                                                                      0.9547 0.6425
--     138-   154    247488 *                                                                      0.9614 0.6548
--     155-   172    155702                                                                        0.9667 0.6656
--     173-   191    162909                                                                        0.9701 0.6736
--     192-   211    122228                                                                        0.9737 0.6827
--     212-   232    109102                                                                        0.9764 0.6903
--     233-   254    102788                                                                        0.9788 0.6978
--     255-   277     80929                                                                        0.9811 0.7055
--     278-   301     82376                                                                        0.9828 0.7122
--     302-   326     67959                                                                        0.9847 0.7197
--     327-   352     52792                                                                        0.9862 0.7262
--     353-   379     46710                                                                        0.9873 0.7317
--     380-   407     40155                                                                        0.9883 0.7371
--     408-   436     36021                                                                        0.9892 0.7419
--     437-   466     33446                                                                        0.9900 0.7466
--     467-   497     29611                                                                        0.9908 0.7513
--     498-   529     26260                                                                        0.9914 0.7557
--     530-   562     20847                                                                        0.9920 0.7599
--     563-   596     20227                                                                        0.9925 0.7635
--     597-   631     18583                                                                        0.9929 0.7671
--     632-   667     16659                                                                        0.9933 0.7707
--     668-   704     14720                                                                        0.9937 0.7740
--     705-   742     13136                                                                        0.9940 0.7771
--     743-   781     12317                                                                        0.9943 0.7801
--     782-   821     13409                                                                        0.9946 0.7830
--
--           0 (max occurrences)
--  3213038468 (total mers, non-unique)
--    45031690 (distinct mers, non-unique)
--           0 (unique mers)
-- Finished stage 'meryl-process', reset canuIteration.
--
-- Removing meryl database 'unitigging/0-mercounts/A2-5.ms22'.
--
-- OVERLAPPER (normal) (assembly) erate=0.01
--
----------------------------------------
-- Starting command on Fri Jan 16 02:39:42 2026 with 4559149.546 GB free disk space

    cd unitigging/1-overlapper
    /share/org/YZWL/yzwl_lixg/miniforge3/envs/canu_v.2.3/bin/overlapInCorePartition \
     -S  ../../A2-5.seqStore \
     -hl 160000000 \
     -rl 5000000000 \
     -ol 500 \
     -o  ./A2-5.partition \
    > ./A2-5.partition.err 2>&1

-- Finished on Fri Jan 16 02:39:42 2026 (like a bat out of hell) with 4559149.531 GB free disk space
----------------------------------------
--
-- Configured 21 overlapInCore jobs.
-- Finished stage 'utg-overlapConfigure', reset canuIteration.
--
-- Running jobs.  First attempt out of 2.
----------------------------------------
-- Starting 'utgovl' concurrent execution on Fri Jan 16 02:39:42 2026 with 4559149.5 GB free disk space (21 processes; 11 concurrently)

    cd unitigging/1-overlapper
    ./overlap.sh 1 > ./overlap.000001.out 2>&1
    ./overlap.sh 2 > ./overlap.000002.out 2>&1
    ./overlap.sh 3 > ./overlap.000003.out 2>&1
    ./overlap.sh 4 > ./overlap.000004.out 2>&1
    ./overlap.sh 5 > ./overlap.000005.out 2>&1
    ./overlap.sh 6 > ./overlap.000006.out 2>&1
    ./overlap.sh 7 > ./overlap.000007.out 2>&1
    ./overlap.sh 8 > ./overlap.000008.out 2>&1
    ./overlap.sh 9 > ./overlap.000009.out 2>&1
    ./overlap.sh 10 > ./overlap.000010.out 2>&1
    ./overlap.sh 11 > ./overlap.000011.out 2>&1
    ./overlap.sh 12 > ./overlap.000012.out 2>&1
    ./overlap.sh 13 > ./overlap.000013.out 2>&1
    ./overlap.sh 14 > ./overlap.000014.out 2>&1
    ./overlap.sh 15 > ./overlap.000015.out 2>&1
    ./overlap.sh 16 > ./overlap.000016.out 2>&1
    ./overlap.sh 17 > ./overlap.000017.out 2>&1
    ./overlap.sh 18 > ./overlap.000018.out 2>&1
    ./overlap.sh 19 > ./overlap.000019.out 2>&1
    ./overlap.sh 20 > ./overlap.000020.out 2>&1
    ./overlap.sh 21 > ./overlap.000021.out 2>&1

-- Finished on Fri Jan 16 03:00:29 2026 (1247 seconds) with 4558296.906 GB free disk space
----------------------------------------
-- Found 21 overlapInCore output files.
--
-- overlapInCore compute 'unitigging/1-overlapper':
--   kmer hits
--     with no overlap       1434607798  657.047619 +- 41597439.36
--     with an overlap         45186867  5.57142857 +- 1236547.121
--
--   overlaps                  45186867  5.57142857 +- 1236547.121
--     contained               17344061  .666666667 +- 475142.384
--     dovetail                27842806  47.9047619 +- 763240.141
--
--   overlaps rejected
--     multiple per pair              0           0 +- 0
--     bad short window               0           0 +- 0
--     bad long window                0           0 +- 0
-- Finished stage 'utg-overlapCheck', reset canuIteration.
----------------------------------------
-- Starting command on Fri Jan 16 03:00:29 2026 with 4558296.89 GB free disk space

    cd unitigging
    /share/org/YZWL/yzwl_lixg/miniforge3/envs/canu_v.2.3/bin/ovStoreConfig \
     -S ../A2-5.seqStore \
     -M 4-8 \
     -L ./1-overlapper/ovljob.files \
     -create ./A2-5.ovlStore.config \
     > ./A2-5.ovlStore.config.txt \
    2> ./A2-5.ovlStore.config.err

-- Finished on Fri Jan 16 03:00:29 2026 (like a bat out of hell) with 4558296.875 GB free disk space
----------------------------------------
--
-- Creating overlap store unitigging/A2-5.ovlStore using:
--      1 bucket
--      1 slice
--        using at most 3 GB memory each
--
-- Running jobs.  First attempt out of 2.
----------------------------------------
-- Starting 'ovS' concurrent execution on Fri Jan 16 03:00:29 2026 with 4558296.859 GB free disk space (1 processes; 62 concurrently)

    cd unitigging
    ./A2-5.ovlStore.sh 1 > ./A2-5.ovlStore.000001.out 2>&1

-- Finished on Fri Jan 16 03:00:49 2026 (20 seconds) with 4558241.937 GB free disk space
----------------------------------------
-- Checking store.
----------------------------------------
-- Starting command on Fri Jan 16 03:00:49 2026 with 4558241.937 GB free disk space

    cd unitigging
    /share/org/YZWL/yzwl_lixg/miniforge3/envs/canu_v.2.3/bin/ovStoreDump \
     -S ../A2-5.seqStore \
     -O  ./A2-5.ovlStore \
     -counts \
     > ./A2-5.ovlStore/counts.dat 2> ./A2-5.ovlStore/counts.err

-- Finished on Fri Jan 16 03:00:49 2026 (lickety-split) with 4558241.89 GB free disk space
----------------------------------------
--
-- Overlap store 'unitigging/A2-5.ovlStore' successfully constructed.
-- Found 90373734 overlaps for 387128 reads; 2524061 reads have no overlaps.
--
--
-- Purged 0.976 GB in 63 overlap output files.
----------------------------------------
-- Starting command on Fri Jan 16 03:00:50 2026 with 4558242.718 GB free disk space

    cd unitigging
    /share/org/YZWL/yzwl_lixg/miniforge3/envs/canu_v.2.3/bin/ovStoreStats \
     -C 50 \
     -S ../A2-5.seqStore \
     -O  ./A2-5.ovlStore \
     -o  ./A2-5.ovlStore \
     > ./A2-5.ovlStore.summary.err 2>&1

-- Finished on Fri Jan 16 03:01:03 2026 (13 seconds) with 4558242.703 GB free disk space
----------------------------------------
--
-- Overlap store 'unitigging/A2-5.ovlStore' contains:
--
--   category            reads     %          read length        feature size or coverage  analysis
--   ----------------  -------  -------  ----------------------  ------------------------  --------------------
--   middle-missing        215    0.05    11902.40 +- 7318.04        560.84 +- 1010.38    (bad trimming)
--   middle-hump            35    0.01    13311.03 +- 4911.45       5756.91 +- 4137.27    (bad trimming)
--   no-5-prime           1032    0.26     9282.74 +- 5946.16       1092.29 +- 2147.21    (bad trimming)
--   no-3-prime           1636    0.41     7447.43 +- 5835.45        797.31 +- 1758.16    (bad trimming)
--   
--   low-coverage         2559    0.64     6480.79 +- 4986.61          5.83 +- 3.67       (easy to assemble, potential for lower quality consensus)
--   unique             314868   78.50     8101.68 +- 5537.52         45.42 +- 7.89       (easy to assemble, perfect, yay)
--   repeat-cont         30666    7.65     6549.11 +- 4727.01       1082.20 +- 884.29     (potential for consensus errors, no impact on assembly)
--   repeat-dove           323    0.08    19029.67 +- 1570.29        539.07 +- 601.70     (hard to assemble, likely won't assemble correctly or even at all)
--   
--   span-repeat          5399    1.35    10367.97 +- 5593.25       2800.91 +- 3138.93    (read spans a large repeat, usually easy to assemble)
--   uniq-repeat-cont    20777    5.18     8643.63 +- 4851.05                             (should be uniquely placed, low potential for consensus errors, no impact on assembly)
--   uniq-repeat-dove     3219    0.80    17302.42 +- 3005.90                             (will end contigs, potential to misassemble)
--   uniq-anchor          6399    1.60     9853.96 +- 4896.02       5438.64 +- 4518.45    (repeat read, with unique section, probable bad read)
-- Finished stage 'utg-createOverlapStore', reset canuIteration.
--
-- Loading read lengths.
-- Loading number of overlaps per read.
--
-- Configure RED for 16gb memory.
--                   Batches of at most (unlimited) reads.
--                                      500000000 bases.
--                   Expecting evidence of at most 536870912 bases per iteration.
--
--           Total                                               Reads                 Olaps Evidence
--    Job   Memory      Read Range         Reads        Bases   Memory        Olaps   Memory   Memory  (Memory in MB)
--   ---- -------- ------------------- --------- ------------ -------- ------------ -------- --------
--      1 16385.66         1-52932          7275    108882140 13291.51      1936023    22.16  1024.00
--      2 16384.05     52933-127012        10144    108897048 13293.42      1627980    18.63  1024.00
--      3 16384.67    127013-195360         9528    108808411 13282.58      2629883    30.10  1024.00
--      4 16385.64    195361-257025         8528    108823409 13284.38      2557219    29.27  1024.00
--      5 16384.24    257026-339817        11364    108915294 13295.68      1446924    16.56  1024.00
--      6 16385.54    339818-445515        14535    108733699 13273.61      3488963    39.93  1024.00
--      7 16384.87    445516-501335         7866    108842976 13286.74      2283263    26.13  1024.00
--      8 16384.53    501336-570623         9409    108883730 13291.77      1814102    20.76  1024.00
--      9 16384.16    570624-688264        16158    108730915 13273.33      3393542    38.84  1024.00
--     10 16384.36    688265-745040         7884    108895410 13293.14      1679138    19.22  1024.00
--     11 16384.95    745041-805951         8368    108855813 13288.33      2151368    24.62  1024.00
--     12 16384.42    805952-889351        11402    108890220 13292.62      1729997    19.80  1024.00
--     13 16384.12    889352-979630        12403    108775092 13278.60      2928931    33.52  1024.00
--     14 16386.47    979631-1035049        7743    108824506 13284.49      2619912    29.98  1024.00
--     15 16384.34   1035050-1106147        9739    108909811 13294.96      1518598    17.38  1024.00
--     16 16384.30   1106148-1211296       14347    108727384 13272.84      3448601    39.47  1024.00
--     17 16384.19   1211297-1265985        7572    108856191 13288.35      2083073    23.84  1024.00
--     18 16385.44   1265986-1329514        8808    108869667 13290.03      2045411    23.41  1024.00
--     19 16384.24   1329515-1432564       14173    108813448 13283.34      2525266    28.90  1024.00
--     20 16384.77   1432565-1497597        8940    108827767 13284.92      2433572    27.85  1024.00
--     21 16386.29   1497598-1555988        8087    108850028 13287.61      2331266    26.68  1024.00
--     22 16384.21   1555989-1636117       10907    108910404 13295.07      1497291    17.14  1024.00
--     23 16385.15   1636118-1721468       11829    108778203 13278.96      2987096    34.18  1024.00
--     24 16385.19   1721469-1778639        7954    108807451 13282.41      2690043    30.79  1024.00
--     25 16384.43   1778640-1851700        9953    108908611 13294.82      1538454    17.61  1024.00
--     26 16384.74   1851701-1960880       15028    108735509 13273.85      3398222    38.89  1024.00
--     27 16384.22   1960881-2016037        7615    108852151 13287.86      2128634    24.36  1024.00
--     28 16384.25   2016038-2079371        8719    108873945 13290.55      1896414    21.70  1024.00
--     29 16385.44   2079372-2177914       13534    108882313 13291.72      1897449    21.71  1024.00
--     30 16386.36   2177915-2247979        9591    108798802 13281.41      2879518    32.95  1024.00
--     31 16384.69   2247980-2305499        7975    108839313 13286.30      2305863    26.39  1024.00
--     32 16385.00   2305500-2386152       11002    108922631 13296.57      1435965    16.43  1024.00
--     33 16384.43   2386153-2471848       11733    108782998 13279.54      2874001    32.89  1024.00
--     34 16384.14   2471849-2526651        7562    108823913 13284.41      2423099    27.73  1024.00
--     35 16384.22   2526652-2595819        9496    108907384 13294.66      1535074    17.57  1024.00
--     36 16384.94   2595820-2690651       13247    108777483 13278.92      2972638    34.02  1024.00
--     37 16386.61   2690652-2742810        7338    108875353 13290.68      2091158    23.93  1024.00
--     38 16384.50   2742811-2805332        8668    108877802 13291.02      1877319    21.48  1024.00
--     39 16385.95   2805333-2905512       13915    108779678 13279.21      3036235    34.75  1024.00
--     40  3718.15   2905513-2911189         768      5270901   643.44       236229     2.70  1024.00
--   ---- -------- ------------------- --------- ------------ -------- ------------ -------- --------
--                                                 4250017804              90373734
-- Finished stage 'readErrorDetectionConfigure', reset canuIteration.
--
-- Running jobs.  First attempt out of 2.
----------------------------------------
-- Starting 'red' concurrent execution on Fri Jan 16 03:01:14 2026 with 4558236.531 GB free disk space (40 processes; 22 concurrently)

    cd unitigging/3-overlapErrorAdjustment
    ./red.sh 1 > ./red.000001.out 2>&1
    ./red.sh 2 > ./red.000002.out 2>&1
    ./red.sh 3 > ./red.000003.out 2>&1
    ./red.sh 4 > ./red.000004.out 2>&1
    ./red.sh 5 > ./red.000005.out 2>&1
    ./red.sh 6 > ./red.000006.out 2>&1
    ./red.sh 7 > ./red.000007.out 2>&1
    ./red.sh 8 > ./red.000008.out 2>&1
    ./red.sh 9 > ./red.000009.out 2>&1
    ./red.sh 10 > ./red.000010.out 2>&1
    ./red.sh 11 > ./red.000011.out 2>&1
    ./red.sh 12 > ./red.000012.out 2>&1
    ./red.sh 13 > ./red.000013.out 2>&1
    ./red.sh 14 > ./red.000014.out 2>&1
    ./red.sh 15 > ./red.000015.out 2>&1
    ./red.sh 16 > ./red.000016.out 2>&1
    ./red.sh 17 > ./red.000017.out 2>&1
    ./red.sh 18 > ./red.000018.out 2>&1
    ./red.sh 19 > ./red.000019.out 2>&1
    ./red.sh 20 > ./red.000020.out 2>&1
    ./red.sh 21 > ./red.000021.out 2>&1
    ./red.sh 22 > ./red.000022.out 2>&1
    ./red.sh 23 > ./red.000023.out 2>&1
    ./red.sh 24 > ./red.000024.out 2>&1
    ./red.sh 25 > ./red.000025.out 2>&1
    ./red.sh 26 > ./red.000026.out 2>&1
    ./red.sh 27 > ./red.000027.out 2>&1
    ./red.sh 28 > ./red.000028.out 2>&1
    ./red.sh 29 > ./red.000029.out 2>&1
    ./red.sh 30 > ./red.000030.out 2>&1
    ./red.sh 31 > ./red.000031.out 2>&1
    ./red.sh 32 > ./red.000032.out 2>&1
    ./red.sh 33 > ./red.000033.out 2>&1
    ./red.sh 34 > ./red.000034.out 2>&1
    ./red.sh 35 > ./red.000035.out 2>&1
    ./red.sh 36 > ./red.000036.out 2>&1
    ./red.sh 37 > ./red.000037.out 2>&1
    ./red.sh 38 > ./red.000038.out 2>&1
    ./red.sh 39 > ./red.000039.out 2>&1
    ./red.sh 40 > ./red.000040.out 2>&1

-- Finished on Fri Jan 16 03:15:31 2026 (857 seconds) with 4557765.14 GB free disk space
----------------------------------------
-- Found 40 read error detection output files.
-- Finished stage 'readErrorDetectionCheck', reset canuIteration.
--
-- Loading read lengths.
-- Loading number of overlaps per read.
--
-- Configure OEA for 8gb memory.
--                   Batches of at most (unlimited) reads.
--                                      300000000 bases.
--
--           Total                                               Reads                 Olaps  Adjusts
--    Job   Memory      Read Range         Reads        Bases   Memory        Olaps   Memory   Memory  (Memory in MB)
--   ---- -------- ------------------- --------- ------------ -------- ------------ -------- --------
--      1  2901.86         1-181490        25040    300007503   294.87      5423828   165.52   393.47
--      2  2942.37    181491-405408        30838    300003176   295.05      6745493   205.86   393.47
--      3  2920.21    405409-593800        26021    300014908   294.91      6023642   183.83   393.47
--      4  2949.10    593801-807695        29407    300004537   295.00      6967411   212.63   393.47
--      5  2935.14    807696-1022807       29586    300002028   295.01      6509914   198.67   393.47
--      6  2938.46   1022808-1239600       29759    300005888   295.02      6618278   201.97   393.47
--      7  2944.70   1239601-1459930       30370    300009826   295.04      6822197   208.20   393.47
--      8  2895.34   1459931-1640857       24799    300003083   294.86      5210473   159.01   393.47
--      9  2943.97   1640858-1835859       26936    300009413   294.93      6801566   207.57   393.47
--     10  2951.61   1835860-2049911       29434    300006328   295.01      7049517   215.13   393.47
--     11  2930.55   2049912-2265494       29670    300017009   295.02      6358864   194.06   393.47
--     12  2912.04   2265495-2475928       28810    300018967   295.00      5753014   175.57   393.47
--     13  2939.97   2475929-2682334       28555    300010430   294.98      6669011   203.52   393.47
--     14  2887.49   2682335-2855546       24230    300013073   294.85      4953383   151.17   393.47
--     15  2572.57   2855547-2911189        7652     49891635    55.81      2467143    75.29   393.47
--   ---- -------- ------------------- --------- ------------ -------- ------------ -------- --------
--                                                 4250017804              90373734
-- Finished stage 'overlapErrorAdjustmentConfigure', reset canuIteration.
--
-- Running jobs.  First attempt out of 2.
----------------------------------------
-- Starting 'oea' concurrent execution on Fri Jan 16 03:15:44 2026 with 4557760.656 GB free disk space (15 processes; 62 concurrently)

    cd unitigging/3-overlapErrorAdjustment
    ./oea.sh 1 > ./oea.000001.out 2>&1
    ./oea.sh 2 > ./oea.000002.out 2>&1
    ./oea.sh 3 > ./oea.000003.out 2>&1
    ./oea.sh 4 > ./oea.000004.out 2>&1
    ./oea.sh 5 > ./oea.000005.out 2>&1
    ./oea.sh 6 > ./oea.000006.out 2>&1
    ./oea.sh 7 > ./oea.000007.out 2>&1
    ./oea.sh 8 > ./oea.000008.out 2>&1
    ./oea.sh 9 > ./oea.000009.out 2>&1
    ./oea.sh 10 > ./oea.000010.out 2>&1
    ./oea.sh 11 > ./oea.000011.out 2>&1
    ./oea.sh 12 > ./oea.000012.out 2>&1
    ./oea.sh 13 > ./oea.000013.out 2>&1
    ./oea.sh 14 > ./oea.000014.out 2>&1
    ./oea.sh 15 > ./oea.000015.out 2>&1

-- Finished on Fri Jan 16 03:55:55 2026 (2411 seconds) with 4555868.703 GB free disk space
----------------------------------------
-- Found 15 overlap error adjustment output files.
-- Finished stage 'overlapErrorAdjustmentCheck', reset canuIteration.
----------------------------------------
-- Starting command on Fri Jan 16 03:55:55 2026 with 4555868.687 GB free disk space

    cd unitigging/3-overlapErrorAdjustment
    /share/org/YZWL/yzwl_lixg/miniforge3/envs/canu_v.2.3/bin/loadErates \
      -S ../../A2-5.seqStore \
      -O ../A2-5.ovlStore \
      -L ./oea.files \
    > ./oea.apply.err 2>&1

-- Finished on Fri Jan 16 03:55:55 2026 (like a bat out of hell) with 4555868.515 GB free disk space
----------------------------------------
-- No report available.
-- Finished stage 'updateOverlapStore', reset canuIteration.
-- Finished stage 'unitig', reset canuIteration.
--
-- Running jobs.  First attempt out of 2.
----------------------------------------
-- Starting 'bat' concurrent execution on Fri Jan 16 03:55:55 2026 with 4555868.468 GB free disk space (1 processes; 1 concurrently)

    cd unitigging/4-unitigger
    ./unitigger.sh 1 > ./unitigger.000001.out 2>&1

-- Finished on Fri Jan 16 03:56:18 2026 (23 seconds) with 4555860.734 GB free disk space
----------------------------------------
-- Unitigger finished successfully.
--  
--  ERROR RATES
--  -----------
--                                                   --------threshold------
--  418431                       fraction error      fraction        percent
--  samples                              (1e-5)         error          error
--                   --------------------------      --------       --------
--  command line (-eg)                           ->     30.00        0.0300%
--  command line (-ef)                           ->  -----.--      ---.----%
--  command line (-eM)                           ->     30.00        0.0300%
--  mean + std.dev       0.26 +-  12 *     2.35  ->     28.46        0.0285%
--  median + mad         0.00 +-  12 *     0.00  ->      0.00        0.0000%
--  90th percentile                              ->      1.00        0.0010%  (enabled)
--  
--  BEST EDGE FILTERING
--  -------------------
--  At graph threshold 0.0300%, reads:
--    available to have edges:        59691
--    with at least one edge:         41729
--  
--  At max threshold 0.0300%, reads:
--    available to have edges:        59691
--    with at least one edge:         41729
--  
--  At tight threshold 0.0010%, reads with:
--    both edges below error threshold:     36975  (80.00% minReadsBest threshold = 33383)
--    one  edge  above error threshold:      3584
--    both edges above error threshold:      1170
--    at least one edge:                    41729
--  
--  At loose threshold 0.0285%, reads with:
--    both edges below error threshold:     41202  (80.00% minReadsBest threshold = 33383)
--    one  edge  above error threshold:       514
--    both edges above error threshold:        13
--    at least one edge:                    41729
--  
--  
--  INITIAL EDGES
--  -------- ----------------------------------------
--    335710 reads are contained
--   2543218 reads have no best edges (singleton)
--       393 reads have only one best edge (spur) 
--                209 are mutual best
--     31868 reads have two best edges 
--                699 have one mutual best edge
--              30792 have two mutual best edges
--  
--  
--  FINAL EDGES
--  -------- ----------------------------------------
--    335710 reads are contained
--   2543595 reads have no best edges (singleton)
--       261 reads have only one best edge (spur) 
--                229 are mutual best
--     31623 reads have two best edges 
--                593 have one mutual best edge
--              30774 have two mutual best edges
--  
--  
--  EDGE FILTERING
--  -------- ------------------------------------------
--         0 reads are ignored
--     16247 reads have a gap in overlap coverage
--       219 reads have lopsided best edges
-- Found, in version 1, after unitig construction:
--   contigs:      92 sequences, total length 67933911 bp (including 108 repeats of total length 2312797 bp).
--   bubbles:      143 sequences, total length 3490105 bp.
--   unassembled:  34392 sequences, total length 277789701 bp.
--
-- Contig sizes based on genome size 85mbp:
--
--            NG (bp)  LG (contigs)    sum (bp)
--         ----------  ------------  ----------
--     10     9571677             1     9571677
--     20     7570973             2    17142650
--     30     4601637             4    28055312
--     40     4226443             6    36612533
--     50     3319356             8    43280813
--     60     2574300            11    51210838
--     70     1624913            15    59619864
--
-- Finished stage 'unitigCheck', reset canuIteration.
----------------------------------------
-- Starting command on Fri Jan 16 03:56:18 2026 with 4555860.718 GB free disk space

    cd unitigging
    /share/org/YZWL/yzwl_lixg/miniforge3/envs/canu_v.2.3/bin/utgcns \
      -S ../A2-5.seqStore \
      -T  ./A2-5.ctgStore 1 \
      -partition 0.8 1.5 0.1 \
    > ./A2-5.ctgStore/partitioning.log 2>&1

-- Finished on Fri Jan 16 03:56:27 2026 (9 seconds) with 4555859.593 GB free disk space
----------------------------------------
-- Using slow alignment for consensus (iteration '0').
-- Configured 10 consensus jobs.
-- Finished stage 'consensusConfigure', reset canuIteration.
--
-- Local: cns       14.125 GB    8 CPUs x  11 jobs   155.375 GB  88 CPUs  (consensus)
--
--
-- Running jobs.  First attempt out of 2.
----------------------------------------
-- Starting 'cns' concurrent execution on Fri Jan 16 03:56:28 2026 with 4555859.562 GB free disk space (10 processes; 11 concurrently)

    cd unitigging/5-consensus
    ./consensus.sh 1 > ./consensus.000001.out 2>&1
    ./consensus.sh 2 > ./consensus.000002.out 2>&1
    ./consensus.sh 3 > ./consensus.000003.out 2>&1
    ./consensus.sh 4 > ./consensus.000004.out 2>&1
    ./consensus.sh 5 > ./consensus.000005.out 2>&1
    ./consensus.sh 6 > ./consensus.000006.out 2>&1
    ./consensus.sh 7 > ./consensus.000007.out 2>&1
    ./consensus.sh 8 > ./consensus.000008.out 2>&1
    ./consensus.sh 9 > ./consensus.000009.out 2>&1
    ./consensus.sh 10 > ./consensus.000010.out 2>&1

-- Finished on Fri Jan 16 04:04:53 2026 (505 seconds) with 4555495.546 GB free disk space
----------------------------------------
-- Using slow alignment for consensus (iteration '1').
-- Configured 10 consensus jobs.
-- All 10 consensus jobs finished successfully.
-- Finished stage 'consensusCheck', reset canuIteration.
-- Using slow alignment for consensus (iteration '0').
-- Configured 10 consensus jobs.
----------------------------------------
-- Starting command on Fri Jan 16 04:04:53 2026 with 4555495.5 GB free disk space

    cd unitigging
    /share/org/YZWL/yzwl_lixg/miniforge3/envs/canu_v.2.3/bin/tgStoreLoad \
      -S ../A2-5.seqStore \
      -T  ./A2-5.ctgStore 2 \
      -L ./5-consensus/ctgcns.files \
    > ./5-consensus/ctgcns.files.ctgStoreLoad.err 2>&1

-- Finished on Fri Jan 16 04:04:54 2026 (one second) with 4555494.546 GB free disk space
----------------------------------------
----------------------------------------
-- Starting command on Fri Jan 16 04:04:54 2026 with 4555494.546 GB free disk space

    cd unitigging
    /share/org/YZWL/yzwl_lixg/miniforge3/envs/canu_v.2.3/bin/tgTigDisplay \
      -S ../A2-5.seqStore \
      -b \
      -o ../A2-5.contigs.unsorted.bam \
      -L ./5-consensus/ctgcns.files \
    > ./5-consensus/ctgcns.files.contigs.bam.err 2>&1

-- Finished on Fri Jan 16 04:07:52 2026 (178 seconds) with 4555375.5 GB free disk space
----------------------------------------
----------------------------------------
-- Starting command on Fri Jan 16 04:07:52 2026 with 4555375.5 GB free disk space

    cd .
    samtools sort \
      --write-index \
      --threads 2 \
      -o ./A2-5.contigs.bam ./A2-5.contigs.unsorted.bam \
    > ./ctgcns.bam.err 2>&1

-- Finished on Fri Jan 16 04:08:55 2026 (63 seconds) with 4555322.609 GB free disk space
----------------------------------------
-- Purging consensus output after loading to ctgStore.
-- Purged 10 .cns outputs.
----------------------------------------
-- Starting command on Fri Jan 16 04:08:55 2026 with 4555324.484 GB free disk space

    cd unitigging
    /share/org/YZWL/yzwl_lixg/miniforge3/envs/canu_v.2.3/bin/tgStoreDump \
      -S ../A2-5.seqStore \
      -T ./A2-5.ctgStore 2 \
      -sizes -s 85000000 \
    > ./A2-5.ctgStore/seqDB.v002.sizes.txt
ZERO length suplied to intervalList::add(), ignoring interval.
ZERO length suplied to intervalList::add(), ignoring interval.
ZERO length suplied to intervalList::add(), ignoring interval.
ZERO length suplied to intervalList::add(), ignoring interval.
ZERO length suplied to intervalList::add(), ignoring interval.
ZERO length suplied to intervalList::add(), ignoring interval.
ZERO length suplied to intervalList::add(), ignoring interval.
ZERO length suplied to intervalList::add(), ignoring interval.
ZERO length suplied to intervalList::add(), ignoring interval.
ZERO length suplied to intervalList::add(), ignoring interval.
ZERO length suplied to intervalList::add(), ignoring interval.
ZERO length suplied to intervalList::add(), ignoring interval.
ZERO length suplied to intervalList::add(), ignoring interval.
ZERO length suplied to intervalList::add(), ignoring interval.
ZERO length suplied to intervalList::add(), ignoring interval.
ZERO length suplied to intervalList::add(), ignoring interval.
ZERO length suplied to intervalList::add(), ignoring interval.
ZERO length suplied to intervalList::add(), ignoring interval.
ZERO length suplied to intervalList::add(), ignoring interval.
ZERO length suplied to intervalList::add(), ignoring interval.
ZERO length suplied to intervalList::add(), ignoring interval.
ZERO length suplied to intervalList::add(), ignoring interval.
ZERO length suplied to intervalList::add(), ignoring interval.
ZERO length suplied to intervalList::add(), ignoring interval.
ZERO length suplied to intervalList::add(), ignoring interval.
ZERO length suplied to intervalList::add(), ignoring interval.
ZERO length suplied to intervalList::add(), ignoring interval.
ZERO length suplied to intervalList::add(), ignoring interval.
ZERO length suplied to intervalList::add(), ignoring interval.
ZERO length suplied to intervalList::add(), ignoring interval.
ZERO length suplied to intervalList::add(), ignoring interval.
ZERO length suplied to intervalList::add(), ignoring interval.
ZERO length suplied to intervalList::add(), ignoring interval.
ZERO length suplied to intervalList::add(), ignoring interval.
ZERO length suplied to intervalList::add(), ignoring interval.
ZERO length suplied to intervalList::add(), ignoring interval.
ZERO length suplied to intervalList::add(), ignoring interval.
ZERO length suplied to intervalList::add(), ignoring interval.
ZERO length suplied to intervalList::add(), ignoring interval.
ZERO length suplied to intervalList::add(), ignoring interval.
ZERO length suplied to intervalList::add(), ignoring interval.
ZERO length suplied to intervalList::add(), ignoring interval.
ZERO length suplied to intervalList::add(), ignoring interval.
ZERO length suplied to intervalList::add(), ignoring interval.
ZERO length suplied to intervalList::add(), ignoring interval.
ZERO length suplied to intervalList::add(), ignoring interval.
ZERO length suplied to intervalList::add(), ignoring interval.
ZERO length suplied to intervalList::add(), ignoring interval.
ZERO length suplied to intervalList::add(), ignoring interval.
ZERO length suplied to intervalList::add(), ignoring interval.
ZERO length suplied to intervalList::add(), ignoring interval.
ZERO length suplied to intervalList::add(), ignoring interval.
ZERO length suplied to intervalList::add(), ignoring interval.
ZERO length suplied to intervalList::add(), ignoring interval.
ZERO length suplied to intervalList::add(), ignoring interval.
ZERO length suplied to intervalList::add(), ignoring interval.
ZERO length suplied to intervalList::add(), ignoring interval.
ZERO length suplied to intervalList::add(), ignoring interval.
ZERO length suplied to intervalList::add(), ignoring interval.
ZERO length suplied to intervalList::add(), ignoring interval.
ZERO length suplied to intervalList::add(), ignoring interval.
ZERO length suplied to intervalList::add(), ignoring interval.
ZERO length suplied to intervalList::add(), ignoring interval.
ZERO length suplied to intervalList::add(), ignoring interval.

-- Finished on Fri Jan 16 04:08:55 2026 (like a bat out of hell) with 4555324.484 GB free disk space
----------------------------------------
-- Found, in version 2, after consensus generation:
--   contigs:      92 sequences, total length 88633887 bp (including 108 repeats of total length 3231266 bp).
--   bubbles:      143 sequences, total length 4716684 bp.
--   unassembled:  34392 sequences, total length 380491615 bp.
--
-- Contig sizes based on genome size 85mbp:
--
--            NG (bp)  LG (contigs)    sum (bp)
--         ----------  ------------  ----------
--     10    12447893             1    12447893
--     20     9861879             2    22309772
--     30     8198315             3    30508087
--     40     5973741             4    36481828
--     50     5499616             6    47634582
--     60     4368667             7    52003249
--     70     3573411             9    59904995
--     80     3263556            12    69922576
--     90     2117145            15    77602830
--    100      594444            21    85541085
--
-- Finished stage 'consensusLoad', reset canuIteration.
----------------------------------------
-- Starting command on Fri Jan 16 04:08:55 2026 with 4555324.468 GB free disk space

    cd .
    /share/org/YZWL/yzwl_lixg/miniforge3/envs/canu_v.2.3/bin/tgStoreDump \
      -S ./A2-5.seqStore \
      -T ./unitigging/A2-5.ctgStore 2 \
      -o ./A2-5.contigs \
      -layout \
    > ./A2-5.contigs.layout.err 2>&1

-- Finished on Fri Jan 16 04:08:56 2026 (one second) with 4555324.406 GB free disk space
----------------------------------------
----------------------------------------
-- Starting command on Fri Jan 16 04:08:56 2026 with 4555324.406 GB free disk space

    cd .
    /share/org/YZWL/yzwl_lixg/miniforge3/envs/canu_v.2.3/bin/tgStoreDump \
      -S ./A2-5.seqStore \
      -T ./unitigging/A2-5.ctgStore 2 \
      -consensus -fasta \
      -unassembled \
    > ./A2-5.unassembled.fasta
    2> ./A2-5.unassembled.err
ZERO length suplied to intervalList::add(), ignoring interval.
ZERO length suplied to intervalList::add(), ignoring interval.
ZERO length suplied to intervalList::add(), ignoring interval.
ZERO length suplied to intervalList::add(), ignoring interval.
ZERO length suplied to intervalList::add(), ignoring interval.
ZERO length suplied to intervalList::add(), ignoring interval.
ZERO length suplied to intervalList::add(), ignoring interval.
ZERO length suplied to intervalList::add(), ignoring interval.
ZERO length suplied to intervalList::add(), ignoring interval.
ZERO length suplied to intervalList::add(), ignoring interval.
ZERO length suplied to intervalList::add(), ignoring interval.
ZERO length suplied to intervalList::add(), ignoring interval.
ZERO length suplied to intervalList::add(), ignoring interval.
ZERO length suplied to intervalList::add(), ignoring interval.
ZERO length suplied to intervalList::add(), ignoring interval.
ZERO length suplied to intervalList::add(), ignoring interval.
ZERO length suplied to intervalList::add(), ignoring interval.
ZERO length suplied to intervalList::add(), ignoring interval.
ZERO length suplied to intervalList::add(), ignoring interval.
ZERO length suplied to intervalList::add(), ignoring interval.
ZERO length suplied to intervalList::add(), ignoring interval.
ZERO length suplied to intervalList::add(), ignoring interval.
ZERO length suplied to intervalList::add(), ignoring interval.
ZERO length suplied to intervalList::add(), ignoring interval.
ZERO length suplied to intervalList::add(), ignoring interval.
ZERO length suplied to intervalList::add(), ignoring interval.
ZERO length suplied to intervalList::add(), ignoring interval.
ZERO length suplied to intervalList::add(), ignoring interval.
ZERO length suplied to intervalList::add(), ignoring interval.
ZERO length suplied to intervalList::add(), ignoring interval.
ZERO length suplied to intervalList::add(), ignoring interval.
ZERO length suplied to intervalList::add(), ignoring interval.
ZERO length suplied to intervalList::add(), ignoring interval.
ZERO length suplied to intervalList::add(), ignoring interval.
ZERO length suplied to intervalList::add(), ignoring interval.
ZERO length suplied to intervalList::add(), ignoring interval.
ZERO length suplied to intervalList::add(), ignoring interval.
ZERO length suplied to intervalList::add(), ignoring interval.
ZERO length suplied to intervalList::add(), ignoring interval.
ZERO length suplied to intervalList::add(), ignoring interval.
ZERO length suplied to intervalList::add(), ignoring interval.
ZERO length suplied to intervalList::add(), ignoring interval.
ZERO length suplied to intervalList::add(), ignoring interval.
ZERO length suplied to intervalList::add(), ignoring interval.
ZERO length suplied to intervalList::add(), ignoring interval.
ZERO length suplied to intervalList::add(), ignoring interval.
ZERO length suplied to intervalList::add(), ignoring interval.
ZERO length suplied to intervalList::add(), ignoring interval.
ZERO length suplied to intervalList::add(), ignoring interval.
ZERO length suplied to intervalList::add(), ignoring interval.
ZERO length suplied to intervalList::add(), ignoring interval.
ZERO length suplied to intervalList::add(), ignoring interval.
ZERO length suplied to intervalList::add(), ignoring interval.
ZERO length suplied to intervalList::add(), ignoring interval.
ZERO length suplied to intervalList::add(), ignoring interval.
ZERO length suplied to intervalList::add(), ignoring interval.
ZERO length suplied to intervalList::add(), ignoring interval.
ZERO length suplied to intervalList::add(), ignoring interval.
ZERO length suplied to intervalList::add(), ignoring interval.
ZERO length suplied to intervalList::add(), ignoring interval.
ZERO length suplied to intervalList::add(), ignoring interval.
ZERO length suplied to intervalList::add(), ignoring interval.
ZERO length suplied to intervalList::add(), ignoring interval.
ZERO length suplied to intervalList::add(), ignoring interval.

-- Finished on Fri Jan 16 04:08:58 2026 (2 seconds) with 4555324.031 GB free disk space
----------------------------------------
----------------------------------------
-- Starting command on Fri Jan 16 04:08:58 2026 with 4555324.031 GB free disk space

    cd .
    /share/org/YZWL/yzwl_lixg/miniforge3/envs/canu_v.2.3/bin/tgStoreDump \
      -S ./A2-5.seqStore \
      -T ./unitigging/A2-5.ctgStore 2 \
      -consensus -fasta \
      -contigs \
    > ./A2-5.contigs.fasta
    2> ./A2-5.contigs.err
ZERO length suplied to intervalList::add(), ignoring interval.
ZERO length suplied to intervalList::add(), ignoring interval.
ZERO length suplied to intervalList::add(), ignoring interval.
ZERO length suplied to intervalList::add(), ignoring interval.
ZERO length suplied to intervalList::add(), ignoring interval.
ZERO length suplied to intervalList::add(), ignoring interval.
ZERO length suplied to intervalList::add(), ignoring interval.
ZERO length suplied to intervalList::add(), ignoring interval.
ZERO length suplied to intervalList::add(), ignoring interval.
ZERO length suplied to intervalList::add(), ignoring interval.
ZERO length suplied to intervalList::add(), ignoring interval.
ZERO length suplied to intervalList::add(), ignoring interval.
ZERO length suplied to intervalList::add(), ignoring interval.
ZERO length suplied to intervalList::add(), ignoring interval.
ZERO length suplied to intervalList::add(), ignoring interval.
ZERO length suplied to intervalList::add(), ignoring interval.
ZERO length suplied to intervalList::add(), ignoring interval.
ZERO length suplied to intervalList::add(), ignoring interval.
ZERO length suplied to intervalList::add(), ignoring interval.
ZERO length suplied to intervalList::add(), ignoring interval.
ZERO length suplied to intervalList::add(), ignoring interval.
ZERO length suplied to intervalList::add(), ignoring interval.
ZERO length suplied to intervalList::add(), ignoring interval.
ZERO length suplied to intervalList::add(), ignoring interval.
ZERO length suplied to intervalList::add(), ignoring interval.
ZERO length suplied to intervalList::add(), ignoring interval.
ZERO length suplied to intervalList::add(), ignoring interval.
ZERO length suplied to intervalList::add(), ignoring interval.
ZERO length suplied to intervalList::add(), ignoring interval.
ZERO length suplied to intervalList::add(), ignoring interval.
ZERO length suplied to intervalList::add(), ignoring interval.
ZERO length suplied to intervalList::add(), ignoring interval.
ZERO length suplied to intervalList::add(), ignoring interval.
ZERO length suplied to intervalList::add(), ignoring interval.
ZERO length suplied to intervalList::add(), ignoring interval.
ZERO length suplied to intervalList::add(), ignoring interval.
ZERO length suplied to intervalList::add(), ignoring interval.
ZERO length suplied to intervalList::add(), ignoring interval.
ZERO length suplied to intervalList::add(), ignoring interval.
ZERO length suplied to intervalList::add(), ignoring interval.
ZERO length suplied to intervalList::add(), ignoring interval.
ZERO length suplied to intervalList::add(), ignoring interval.
ZERO length suplied to intervalList::add(), ignoring interval.
ZERO length suplied to intervalList::add(), ignoring interval.
ZERO length suplied to intervalList::add(), ignoring interval.
ZERO length suplied to intervalList::add(), ignoring interval.
ZERO length suplied to intervalList::add(), ignoring interval.
ZERO length suplied to intervalList::add(), ignoring interval.
ZERO length suplied to intervalList::add(), ignoring interval.
ZERO length suplied to intervalList::add(), ignoring interval.
ZERO length suplied to intervalList::add(), ignoring interval.
ZERO length suplied to intervalList::add(), ignoring interval.
ZERO length suplied to intervalList::add(), ignoring interval.
ZERO length suplied to intervalList::add(), ignoring interval.
ZERO length suplied to intervalList::add(), ignoring interval.
ZERO length suplied to intervalList::add(), ignoring interval.
ZERO length suplied to intervalList::add(), ignoring interval.
ZERO length suplied to intervalList::add(), ignoring interval.
ZERO length suplied to intervalList::add(), ignoring interval.
ZERO length suplied to intervalList::add(), ignoring interval.
ZERO length suplied to intervalList::add(), ignoring interval.
ZERO length suplied to intervalList::add(), ignoring interval.
ZERO length suplied to intervalList::add(), ignoring interval.
ZERO length suplied to intervalList::add(), ignoring interval.

-- Finished on Fri Jan 16 04:08:58 2026 (fast as lightning) with 4555323.937 GB free disk space
----------------------------------------
-- Finished stage 'generateOutputs', reset canuIteration.
--
-- Assembly 'A2-5' finished in '/share/org/YZWL/yzwl_lixg/project/28.大豆疫霉菌三代基因组/03.hicanu/A2-5/01.raw_output'.
--
-- Summary saved in 'A2-5.report'.
--
-- Sequences saved:
--   Contigs       -> 'A2-5.contigs.fasta'
--   Unassembled   -> 'A2-5.unassembled.fasta'
--
-- Read layouts saved:
--   Contigs       -> 'A2-5.contigs.layout'.
--
-- Bye.

2026-01-16 04:08:58.950 - WARNING - 输出文件不存在|Output file does not exist: /share/org/YZWL/yzwl_lixg/project/28.大豆疫霉菌三代基因组/03.hicanu/A2-5/01.raw_output/A2-5.unitigs.fasta
Usage: biopytools ragtag [OPTIONS]
Try 'biopytools ragtag -h' for help.

Error: Invalid value for '-r' / '--reference': 文件不存在|File does not exist: /share/org/YZWL/yzwl_lixg/project/28.大豆疫霉菌三代基因组/04.ragtag/Psoja_T2T.fa
Usage: biopytools genomesyn [OPTIONS]
Try 'biopytools genomesyn -h' for help.

Error: Invalid value for '-i' / '--ref': Path '04.ragtag/A2-5/hicanu/A2-5_RagTag_scaffolded.fa' does not exist.
Job 68886713 stderr output:

