Usage: biopytools ragtag [OPTIONS]
Try 'biopytools ragtag -h' for help.

Error: Invalid value for '-r' / '--reference': 文件不存在|File does not exist: /share/org/YZWL/yzwl_lixg/project/28.大豆疫霉菌三代基因组/04.ragtag/Psoja_T2T.fa
Usage: biopytools genomesyn [OPTIONS]
Try 'biopytools genomesyn -h' for help.

Error: Invalid value for '-i' / '--ref': Path '04.ragtag/A1-8/hifiasm/A1-8_RagTag_scaffolded.fa' does not exist.
2026-01-16 02:12:02.619 - WARNING - 命令错误输出|Command stderr:
-- canu master +27 changes (r10515 2a41e933b8de6ed66723d75d36dd071b46d2c347)
--
-- CITATIONS
--
-- For assemblies of PacBio HiFi reads:
--   Nurk S, Walenz BP, Rhiea A, Vollger MR, Logsdon GA, Grothe R, Miga KH, Eichler EE, Phillippy AM, Koren S.
--   HiCanu: accurate assembly of segmental duplications, satellites, and allelic variants from high-fidelity long reads.
--   biorXiv. 2020.
--   https://doi.org/10.1101/2020.03.14.992248
-- 
-- Read and contig alignments during correction and consensus use:
--   Šošic M, Šikic M.
--   Edlib: a C/C ++ library for fast, exact sequence alignment using edit distance.
--   Bioinformatics. 2017 May 1;33(9):1394-1395.
--   http://doi.org/10.1093/bioinformatics/btw753
-- 
-- Overlaps are generated using:
--   Berlin K, et al.
--   Assembling large genomes with single-molecule sequencing and locality-sensitive hashing.
--   Nat Biotechnol. 2015 Jun;33(6):623-30.
--   http://doi.org/10.1038/nbt.3238
-- 
--   Myers EW, et al.
--   A Whole-Genome Assembly of Drosophila.
--   Science. 2000 Mar 24;287(5461):2196-204.
--   http://doi.org/10.1126/science.287.5461.2196
-- 
-- Contig consensus sequences are generated using an algorithm derived from pbdagcon:
--   Chin CS, et al.
--   Nonhybrid, finished microbial genome assemblies from long-read SMRT sequencing data.
--   Nat Methods. 2013 Jun;10(6):563-9
--   http://doi.org/10.1038/nmeth.2474
-- 
-- CONFIGURE CANU
--
-- Detected Java(TM) Runtime Environment '17.0.15-internal' (from '/share/org/YZWL/yzwl_lixg/.local/bin/java') without -d64 support.
--
-- WARNING:
-- WARNING:  Failed to run gnuplot using command 'gnuplot'.
-- WARNING:  Plots will be disabled.
-- WARNING:
--
-- Detected samtools version '1.22' / htslib version 'htscodecs=1.6.3' (from 'samtools').
--
-- Detected 88 CPUs and 503 gigabytes of memory on the local machine.
--
-- Detected Slurm with 'sinfo' binary in /opt/skyformai/bin/sinfo.
--          Slurm disabled by useGrid=false
--
-- Detected  '' with 'pbsnodes' binary in /opt/skyformai/bin/pbsnodes.
--           disabled by useGrid=false
--
-- Detected LSF with 'bsub' binary in /opt/skyformai/bin/bsub.
--          LSF disabled by useGrid=false
--
-- Local machine mode enabled; grid support not detected or not allowed.
--
-- Found trimmed raw PacBio HiFi reads in the input files.
--
--                                (tag)Concurrency
--                         (tag)Threads          |
--                (tag)Memory         |          |
--        (tag)             |         |          |       total usage      algorithm
--        -------  ----------  --------   --------  --------------------  -----------------------------
-- Local: meryl     12.000 GB    4 CPUs x  22 jobs   264.000 GB  88 CPUs  (k-mer counting)
-- Local: cormhap   13.000 GB   11 CPUs x   8 jobs   104.000 GB  88 CPUs  (overlap detection with mhap)
-- Local: obtovl     8.000 GB    8 CPUs x  11 jobs    88.000 GB  88 CPUs  (overlap detection)
-- Local: utgovl     8.000 GB    8 CPUs x  11 jobs    88.000 GB  88 CPUs  (overlap detection)
-- Local: cor        -.--- GB    4 CPUs x   - jobs     -.--- GB   - CPUs  (read correction)
-- Local: ovb        4.000 GB    1 CPU  x  88 jobs   352.000 GB  88 CPUs  (overlap store bucketizer)
-- Local: ovs        8.000 GB    1 CPU  x  62 jobs   496.000 GB  62 CPUs  (overlap store sorting)
-- Local: red       16.000 GB    4 CPUs x  22 jobs   352.000 GB  88 CPUs  (read error detection)
-- Local: oea        8.000 GB    1 CPU  x  62 jobs   496.000 GB  62 CPUs  (overlap error adjustment)
-- Local: bat       32.000 GB    8 CPUs x   1 job     32.000 GB   8 CPUs  (contig construction with bogart)
-- Local: cns        -.--- GB    8 CPUs x   - jobs     -.--- GB   - CPUs  (consensus)
--
-- Generating assembly 'A1-8' in '/share/org/YZWL/yzwl_lixg/project/28.大豆疫霉菌三代基因组/03.hicanu/A1-8/01.raw_output':
--   genomeSize:
--     85000000
--
--   Overlap Generation Limits:
--     corOvlErrorRate 0.0000 (  0.00%)
--     obtOvlErrorRate 0.0250 (  2.50%)
--     utgOvlErrorRate 0.0100 (  1.00%)
--
--   Overlap Processing Limits:
--     corErrorRate    0.0000 (  0.00%)
--     obtErrorRate    0.0250 (  2.50%)
--     utgErrorRate    0.0003 (  0.03%)
--     cnsErrorRate    0.0500 (  5.00%)
--
--   Stages to run:
--     assemble HiFi reads.
--
--
-- BEGIN STORE CREATION
----------------------------------------
-- Starting command on Fri Jan 16 00:37:56 2026 with 4562301.375 GB free disk space

    cd .
    ./A1-8.seqStore.sh \
    > ./A1-8.seqStore.err 2>&1

-- Finished on Fri Jan 16 00:45:15 2026 (439 seconds) with 4561140.406 GB free disk space
----------------------------------------
--
-- In sequence store './A1-8.seqStore':
--   Found 262994 reads.
--   Found 4250002705 bases (50 times coverage).
--    Histogram of corrected reads:
--    
--    G=4250002705                       sum of  ||               length     num
--    NG         length     index       lengths  ||                range    seqs
--    ----- ------------ --------- ------------  ||  ------------------- -------
--    00010        26545     14870    425002086  ||       1253-2608        11482|----------------------------
--    00020        24521     31581    850022617  ||       2609-3964        15816|--------------------------------------
--    00030        23101     49458   1275009175  ||       3965-5320        13580|---------------------------------
--    00040        21955     68337   1700020826  ||       5321-6676        11425|---------------------------
--    00050        20903     88178   2125004768  ||       6677-8032         9859|------------------------
--    00060        19873    109027   2550015335  ||       8033-9388         8669|---------------------
--    00070        18700    131046   2975014007  ||       9389-10744        7640|-------------------
--    00080        16913    154806   3400015902  ||      10745-12100        6450|----------------
--    00090        10631    185089   3825011648  ||      12101-13456        5492|-------------
--    00100         1253    262994   4250002705  ||      13457-14812        5019|------------
--    001.000x              262994   4250002705  ||      14813-16168        6839|-----------------
--                                               ||      16169-17524       12507|------------------------------
--                                               ||      17525-18880       20296|------------------------------------------------
--                                               ||      18881-20236       26274|--------------------------------------------------------------
--                                               ||      20237-21592       26710|---------------------------------------------------------------
--                                               ||      21593-22948       23105|-------------------------------------------------------
--                                               ||      22949-24304       17940|-------------------------------------------
--                                               ||      24305-25660       12950|-------------------------------
--                                               ||      25661-27016        8761|---------------------
--                                               ||      27017-28372        5569|--------------
--                                               ||      28373-29728        3328|--------
--                                               ||      29729-31084        1845|-----
--                                               ||      31085-32440         917|---
--                                               ||      32441-33796         357|-
--                                               ||      33797-35152         115|-
--                                               ||      35153-36508          32|-
--                                               ||      36509-37864           7|-
--                                               ||      37865-39220           3|-
--                                               ||      39221-40576           4|-
--                                               ||      40577-41932           0|
--                                               ||      41933-43288           0|
--                                               ||      43289-44644           0|
--                                               ||      44645-46000           2|-
--                                               ||      46001-47356           0|
--                                               ||      47357-48712           0|
--                                               ||      48713-50068           0|
--                                               ||      50069-51424           0|
--                                               ||      51425-52780           0|
--                                               ||      52781-54136           0|
--                                               ||      54137-55492           1|-
--    
--
-- In sequence store './A1-8.seqStore':
--   Found 262994 reads.
--   Found 4250002705 bases (50 times coverage).
--    Histogram of corrected-trimmed reads:
--    
--    G=4250002705                       sum of  ||               length     num
--    NG         length     index       lengths  ||                range    seqs
--    ----- ------------ --------- ------------  ||  ------------------- -------
--    00010        26545     14870    425002086  ||       1253-2608        11482|----------------------------
--    00020        24521     31581    850022617  ||       2609-3964        15816|--------------------------------------
--    00030        23101     49458   1275009175  ||       3965-5320        13580|---------------------------------
--    00040        21955     68337   1700020826  ||       5321-6676        11425|---------------------------
--    00050        20903     88178   2125004768  ||       6677-8032         9859|------------------------
--    00060        19873    109027   2550015335  ||       8033-9388         8669|---------------------
--    00070        18700    131046   2975014007  ||       9389-10744        7640|-------------------
--    00080        16913    154806   3400015902  ||      10745-12100        6450|----------------
--    00090        10631    185089   3825011648  ||      12101-13456        5492|-------------
--    00100         1253    262994   4250002705  ||      13457-14812        5019|------------
--    001.000x              262994   4250002705  ||      14813-16168        6839|-----------------
--                                               ||      16169-17524       12507|------------------------------
--                                               ||      17525-18880       20296|------------------------------------------------
--                                               ||      18881-20236       26274|--------------------------------------------------------------
--                                               ||      20237-21592       26710|---------------------------------------------------------------
--                                               ||      21593-22948       23105|-------------------------------------------------------
--                                               ||      22949-24304       17940|-------------------------------------------
--                                               ||      24305-25660       12950|-------------------------------
--                                               ||      25661-27016        8761|---------------------
--                                               ||      27017-28372        5569|--------------
--                                               ||      28373-29728        3328|--------
--                                               ||      29729-31084        1845|-----
--                                               ||      31085-32440         917|---
--                                               ||      32441-33796         357|-
--                                               ||      33797-35152         115|-
--                                               ||      35153-36508          32|-
--                                               ||      36509-37864           7|-
--                                               ||      37865-39220           3|-
--                                               ||      39221-40576           4|-
--                                               ||      40577-41932           0|
--                                               ||      41933-43288           0|
--                                               ||      43289-44644           0|
--                                               ||      44645-46000           2|-
--                                               ||      46001-47356           0|
--                                               ||      47357-48712           0|
--                                               ||      48713-50068           0|
--                                               ||      50069-51424           0|
--                                               ||      51425-52780           0|
--                                               ||      52781-54136           0|
--                                               ||      54137-55492           1|-
--    
--
-- Correction skipped; not enabled.
--
-- Trimming skipped; not enabled.
--
-- BEGIN ASSEMBLY
----------------------------------------
-- Starting command on Fri Jan 16 00:45:16 2026 with 4561140.359 GB free disk space

    cd unitigging/0-mercounts
    ./meryl-configure.sh \
    > ./meryl-configure.err 2>&1

-- Finished on Fri Jan 16 00:45:17 2026 (one second) with 4561140.359 GB free disk space
----------------------------------------
--  segments   memory batches
--  -------- -------- -------
--        01 10.81 GB       2
--        02  5.75 GB       2
--        04  2.97 GB       2
--        06  2.14 GB       2
--        08  1.61 GB       2
--        12  1.07 GB       2
--        16  0.81 GB       2
--        20  0.65 GB       2
--        24  0.54 GB       2
--        32  0.41 GB       2
--        40  0.32 GB       2
--        48  -.-- GB       -  (segment size too small)
--        56  -.-- GB       -  (segment size too small)
--        64  -.-- GB       -  (segment size too small)
--        96  -.-- GB       -  (segment size too small)
--
--  For 262994 reads with 4250002705 bases, limit to 42 batches.
--  Will count kmers using 01 jobs, each using 12 GB and 4 threads.
--
-- Finished stage 'merylConfigure', reset canuIteration.
--
-- Running jobs.  First attempt out of 2.
----------------------------------------
-- Starting 'meryl' concurrent execution on Fri Jan 16 00:45:17 2026 with 4561140.328 GB free disk space (1 processes; 22 concurrently)

    cd unitigging/0-mercounts
    ./meryl-count.sh 1 > ./meryl-count.000001.out 2>&1

-- Finished on Fri Jan 16 00:48:43 2026 (206 seconds) with 4560154.203 GB free disk space
----------------------------------------
-- Found 1 Kmer counting (meryl) outputs.
-- Finished stage 'utg-merylCountCheck', reset canuIteration.
--
-- Running jobs.  First attempt out of 2.
----------------------------------------
-- Starting 'meryl' concurrent execution on Fri Jan 16 00:48:43 2026 with 4560154.171 GB free disk space (1 processes; 22 concurrently)

    cd unitigging/0-mercounts
    ./meryl-process.sh 1 > ./meryl-process.000001.out 2>&1

-- Finished on Fri Jan 16 00:48:49 2026 (6 seconds) with 4560154.781 GB free disk space
----------------------------------------
-- Meryl finished successfully.  Kmer frequency histogram:
--
-- WARNING: gnuplot failed.
--
----------------------------------------
--
--  22-mers                                                                                           Fraction
--    Occurrences   NumMers                                                                         Unique Total
--       1-     1         0                                                                        0.0000 0.0000
--       2-     2    204682                                                                        0.0046 0.0001
--       3-     4     70527                                                                        0.0056 0.0002
--       5-     7     25237                                                                        0.0064 0.0002
--       8-    11      8278                                                                        0.0068 0.0003
--      12-    16      8638                                                                        0.0069 0.0003
--      17-    22    108191                                                                        0.0072 0.0003
--      23-    29   1001502 ****                                                                   0.0105 0.0013
--      30-    37   6313755 **************************                                             0.0400 0.0129
--      38-    46  16519201 ********************************************************************** 0.2049 0.0943
--      47-    56  13027166 *******************************************************                0.5832 0.3223
--      57-    67   2748326 ***********                                                            0.8433 0.5095
--      68-    79    717947 ***                                                                    0.8931 0.5519
--      80-    92    974258 ****                                                                   0.9092 0.5687
--      93-   106    780453 ***                                                                    0.9310 0.5952
--     107-   121    293291 *                                                                      0.9474 0.6179
--     122-   137    288283 *                                                                      0.9536 0.6279
--     138-   154    236236 *                                                                      0.9601 0.6397
--     155-   172    172641                                                                        0.9652 0.6501
--     173-   191    190750                                                                        0.9690 0.6590
--     192-   211    129863                                                                        0.9732 0.6697
--     212-   232    106641                                                                        0.9761 0.6777
--     233-   254     95047                                                                        0.9784 0.6850
--     255-   277     90464                                                                        0.9805 0.6922
--     278-   301     78162                                                                        0.9825 0.6996
--     302-   326     72092                                                                        0.9843 0.7067
--     327-   352     56984                                                                        0.9858 0.7136
--     353-   379     50544                                                                        0.9871 0.7197
--     380-   407     47443                                                                        0.9882 0.7254
--     408-   436     38569                                                                        0.9893 0.7311
--     437-   466     33464                                                                        0.9901 0.7362
--     467-   497     30464                                                                        0.9909 0.7409
--     498-   529     27265                                                                        0.9915 0.7454
--     530-   562     22675                                                                        0.9922 0.7498
--     563-   596     21031                                                                        0.9927 0.7536
--     597-   631     17104                                                                        0.9931 0.7574
--     632-   667     17134                                                                        0.9935 0.7606
--     668-   704     15645                                                                        0.9939 0.7641
--     705-   742     14002                                                                        0.9942 0.7675
--     743-   781     12324                                                                        0.9945 0.7706
--     782-   821     11807                                                                        0.9948 0.7735
--
--           0 (max occurrences)
--  3214360606 (total mers, non-unique)
--    44899639 (distinct mers, non-unique)
--           0 (unique mers)
-- Finished stage 'meryl-process', reset canuIteration.
--
-- Removing meryl database 'unitigging/0-mercounts/A1-8.ms22'.
--
-- OVERLAPPER (normal) (assembly) erate=0.01
--
----------------------------------------
-- Starting command on Fri Jan 16 00:48:49 2026 with 4560154.765 GB free disk space

    cd unitigging/1-overlapper
    /share/org/YZWL/yzwl_lixg/miniforge3/envs/canu_v.2.3/bin/overlapInCorePartition \
     -S  ../../A1-8.seqStore \
     -hl 160000000 \
     -rl 5000000000 \
     -ol 500 \
     -o  ./A1-8.partition \
    > ./A1-8.partition.err 2>&1

-- Finished on Fri Jan 16 00:48:49 2026 (fast as lightning) with 4560154.75 GB free disk space
----------------------------------------
--
-- Configured 21 overlapInCore jobs.
-- Finished stage 'utg-overlapConfigure', reset canuIteration.
--
-- Running jobs.  First attempt out of 2.
----------------------------------------
-- Starting 'utgovl' concurrent execution on Fri Jan 16 00:48:49 2026 with 4560154.718 GB free disk space (21 processes; 11 concurrently)

    cd unitigging/1-overlapper
    ./overlap.sh 1 > ./overlap.000001.out 2>&1
    ./overlap.sh 2 > ./overlap.000002.out 2>&1
    ./overlap.sh 3 > ./overlap.000003.out 2>&1
    ./overlap.sh 4 > ./overlap.000004.out 2>&1
    ./overlap.sh 5 > ./overlap.000005.out 2>&1
    ./overlap.sh 6 > ./overlap.000006.out 2>&1
    ./overlap.sh 7 > ./overlap.000007.out 2>&1
    ./overlap.sh 8 > ./overlap.000008.out 2>&1
    ./overlap.sh 9 > ./overlap.000009.out 2>&1
    ./overlap.sh 10 > ./overlap.000010.out 2>&1
    ./overlap.sh 11 > ./overlap.000011.out 2>&1
    ./overlap.sh 12 > ./overlap.000012.out 2>&1
    ./overlap.sh 13 > ./overlap.000013.out 2>&1
    ./overlap.sh 14 > ./overlap.000014.out 2>&1
    ./overlap.sh 15 > ./overlap.000015.out 2>&1
    ./overlap.sh 16 > ./overlap.000016.out 2>&1
    ./overlap.sh 17 > ./overlap.000017.out 2>&1
    ./overlap.sh 18 > ./overlap.000018.out 2>&1
    ./overlap.sh 19 > ./overlap.000019.out 2>&1
    ./overlap.sh 20 > ./overlap.000020.out 2>&1
    ./overlap.sh 21 > ./overlap.000021.out 2>&1

-- Finished on Fri Jan 16 01:17:41 2026 (1732 seconds) with 4558065.5 GB free disk space
----------------------------------------
-- Found 21 overlapInCore output files.
--
-- overlapInCore compute 'unitigging/1-overlapper':
--   kmer hits
--     with no overlap       1290348300  57.1428571 +- 38688664.527
--     with an overlap         31402716  7.42857143 +- 851620.417
--
--   overlaps                  31402716  7.42857143 +- 851620.417
--     contained                8243244  .428571429 +- 223220.335
--     dovetail                23159472     1102832 +- 634899.72
--
--   overlaps rejected
--     multiple per pair              0           0 +- 0
--     bad short window               0           0 +- 0
--     bad long window                0           0 +- 0
-- Finished stage 'utg-overlapCheck', reset canuIteration.
----------------------------------------
-- Starting command on Fri Jan 16 01:17:41 2026 with 4558065.484 GB free disk space

    cd unitigging
    /share/org/YZWL/yzwl_lixg/miniforge3/envs/canu_v.2.3/bin/ovStoreConfig \
     -S ../A1-8.seqStore \
     -M 4-8 \
     -L ./1-overlapper/ovljob.files \
     -create ./A1-8.ovlStore.config \
     > ./A1-8.ovlStore.config.txt \
    2> ./A1-8.ovlStore.config.err

-- Finished on Fri Jan 16 01:17:41 2026 (lickety-split) with 4558065.468 GB free disk space
----------------------------------------
--
-- Creating overlap store unitigging/A1-8.ovlStore using:
--      1 bucket
--      1 slice
--        using at most 3 GB memory each
--
-- Running jobs.  First attempt out of 2.
----------------------------------------
-- Starting 'ovS' concurrent execution on Fri Jan 16 01:17:41 2026 with 4558065.453 GB free disk space (1 processes; 62 concurrently)

    cd unitigging
    ./A1-8.ovlStore.sh 1 > ./A1-8.ovlStore.000001.out 2>&1

-- Finished on Fri Jan 16 01:17:54 2026 (13 seconds) with 4558064.046 GB free disk space
----------------------------------------
-- Checking store.
----------------------------------------
-- Starting command on Fri Jan 16 01:17:54 2026 with 4558064.046 GB free disk space

    cd unitigging
    /share/org/YZWL/yzwl_lixg/miniforge3/envs/canu_v.2.3/bin/ovStoreDump \
     -S ../A1-8.seqStore \
     -O  ./A1-8.ovlStore \
     -counts \
     > ./A1-8.ovlStore/counts.dat 2> ./A1-8.ovlStore/counts.err

-- Finished on Fri Jan 16 01:17:54 2026 (lickety-split) with 4558064.015 GB free disk space
----------------------------------------
--
-- Overlap store 'unitigging/A1-8.ovlStore' successfully constructed.
-- Found 62805432 overlaps for 253912 reads; 1520403 reads have no overlaps.
--
--
-- Purged 0.667 GB in 63 overlap output files.
----------------------------------------
-- Starting command on Fri Jan 16 01:17:55 2026 with 4558064.015 GB free disk space

    cd unitigging
    /share/org/YZWL/yzwl_lixg/miniforge3/envs/canu_v.2.3/bin/ovStoreStats \
     -C 50 \
     -S ../A1-8.seqStore \
     -O  ./A1-8.ovlStore \
     -o  ./A1-8.ovlStore \
     > ./A1-8.ovlStore.summary.err 2>&1

-- Finished on Fri Jan 16 01:18:04 2026 (9 seconds) with 4558085.437 GB free disk space
----------------------------------------
--
-- Overlap store 'unitigging/A1-8.ovlStore' contains:
--
--   category            reads     %          read length        feature size or coverage  analysis
--   ----------------  -------  -------  ----------------------  ------------------------  --------------------
--   middle-missing        123    0.05    15685.28 +- 7526.02        667.07 +- 740.96     (bad trimming)
--   middle-hump            19    0.01    16024.11 +- 3141.69       6621.11 +- 5085.61    (bad trimming)
--   no-5-prime            509    0.19    13993.05 +- 5510.40       1866.51 +- 2794.88    (bad trimming)
--   no-3-prime            598    0.23    12843.67 +- 6401.78       1948.81 +- 2946.44    (bad trimming)
--   
--   low-coverage         1528    0.58    10920.85 +- 5860.88          5.99 +- 3.57       (easy to assemble, potential for lower quality consensus)
--   unique             206096   78.37    12384.35 +- 6100.60         44.77 +- 8.48       (easy to assemble, perfect, yay)
--   repeat-cont         20188    7.68    10316.43 +- 5481.37       1124.83 +- 944.94     (potential for consensus errors, no impact on assembly)
--   repeat-dove           376    0.14    20621.02 +- 1966.60        464.31 +- 586.24     (hard to assemble, likely won't assemble correctly or even at all)
--   
--   span-repeat          3068    1.17    14246.80 +- 5246.76       3631.64 +- 4181.35    (read spans a large repeat, usually easy to assemble)
--   uniq-repeat-cont    14517    5.52    12788.91 +- 4976.18                             (should be uniquely placed, low potential for consensus errors, no impact on assembly)
--   uniq-repeat-dove     2761    1.05    19304.70 +- 2592.54                             (will end contigs, potential to misassemble)
--   uniq-anchor          4129    1.57    14334.80 +- 4840.25       7326.51 +- 5127.27    (repeat read, with unique section, probable bad read)
-- Finished stage 'utg-createOverlapStore', reset canuIteration.
--
-- Loading read lengths.
-- Loading number of overlaps per read.
--
-- Configure RED for 16gb memory.
--                   Batches of at most (unlimited) reads.
--                                      500000000 bases.
--                   Expecting evidence of at most 536870912 bases per iteration.
--
--           Total                                               Reads                 Olaps Evidence
--    Job   Memory      Read Range         Reads        Bases   Memory        Olaps   Memory   Memory  (Memory in MB)
--   ---- -------- ------------------- --------- ------------ -------- ------------ -------- --------
--      1 16386.62         1-37160          5509    108951205 13299.88      1287991    14.74  1024.00
--      2 16386.11     37161-80043          6350    108949203 13299.66      1262527    14.45  1024.00
--      3 16385.73     80044-126255         7085    108920787 13296.22      1530286    17.51  1024.00
--      4 16384.87    126256-165444         5912    108870490 13290.04      1994629    22.83  1024.00
--      5 16386.62    165445-210022         6616    108950045 13299.77      1297101    14.84  1024.00
--      6 16384.96    210023-271261         9213    108858648 13288.70      2120197    24.26  1024.00
--      7 16386.31    271262-310367         5666    108905457 13294.30      1748332    20.01  1024.00
--      8 16384.66    310368-352326         6136    108923665 13296.54      1408706    16.12  1024.00
--      9 16384.35    352327-415884         9378    108852205 13287.92      2135093    24.43  1024.00
--     10 16384.47    415885-453124         5526    108955663 13300.43      1052847    12.05  1024.00
--     11 16384.54    453125-492691         5885    108882369 13291.49      1839436    21.05  1024.00
--     12 16385.14    492692-542211         7380    108974868 13302.83       901046    10.31  1024.00
--     13 16384.12    542212-593055         7483    108874016 13290.52      1887632    21.60  1024.00
--     14 16384.59    593056-633038         5781    108870204 13290.00      1974215    22.59  1024.00
--     15 16385.10    633039-677106         6485    108951526 13299.95      1148559    13.14  1024.00
--     16 16384.10    677107-734940         8586    108866213 13289.60      1966033    22.50  1024.00
--     17 16384.38    734941-771778         5598    108895289 13293.06      1688710    19.33  1024.00
--     18 16384.07    771779-812948         6121    108915502 13295.54      1443893    16.52  1024.00
--     19 16384.95    812949-874608         9131    108860236 13288.89      2102668    24.06  1024.00
--     20 16384.56    874609-913070         5576    108946939 13299.36      1153267    13.20  1024.00
--     21 16384.82    913071-952442         5846    108887662 13292.13      1807560    20.69  1024.00
--     22 16385.39    952443-1001842        7234    108974780 13302.81       924012    10.57  1024.00
--     23 16384.91   1001843-1051122        7341    108882738 13291.58      1863607    21.33  1024.00
--     24 16386.74   1051123-1089776        5774    108878499 13291.01      2073430    23.73  1024.00
--     25 16386.61   1089777-1133423        6451    108970582 13302.28      1077712    12.33  1024.00
--     26 16386.97   1133424-1191962        8713    108880147 13291.31      2068014    23.67  1024.00
--     27 16384.92   1191963-1229438        5559    108901397 13293.80      1670238    19.11  1024.00
--     28 16385.88   1229439-1269563        6030    108929949 13297.30      1448302    16.57  1024.00
--     29 16384.23   1269564-1325824        8472    108867924 13289.81      1958961    22.42  1024.00
--     30 16384.72   1325825-1364079        5640    108946418 13299.30      1172707    13.42  1024.00
--     31 16384.45   1364080-1402370        5712    108883775 13291.66      1817417    20.80  1024.00
--     32 16384.65   1402371-1448479        6741    108974143 13302.72       867681     9.93  1024.00
--     33 16384.33   1448480-1496533        7185    108892124 13292.72      1713328    19.61  1024.00
--     34 16384.60   1496534-1535454        5697    108905024 13294.25      1603631    18.35  1024.00
--     35 16384.03   1535455-1577761        6201    108910005 13294.87      1498843    17.15  1024.00
--     36 16385.07   1577762-1633708        8197    108872548 13290.36      1984111    22.71  1024.00
--     37 16386.15   1633709-1672185        5606    108908632 13294.69      1700354    19.46  1024.00
--     38 16384.18   1672186-1713154        6091    108915724 13295.57      1451585    16.61  1024.00
--     39 16385.90   1713155-1772960        8887    108865187 13289.49      2133093    24.41  1024.00
--     40  3387.38   1772961-1774315         200      2580917   315.06        27678     0.32  1024.00
--   ---- -------- ------------------- --------- ------------ -------- ------------ -------- --------
--                                                 4250002705              62805432
-- Finished stage 'readErrorDetectionConfigure', reset canuIteration.
--
-- Running jobs.  First attempt out of 2.
----------------------------------------
-- Starting 'red' concurrent execution on Fri Jan 16 01:18:11 2026 with 4558085.39 GB free disk space (40 processes; 22 concurrently)

    cd unitigging/3-overlapErrorAdjustment
    ./red.sh 1 > ./red.000001.out 2>&1
    ./red.sh 2 > ./red.000002.out 2>&1
    ./red.sh 3 > ./red.000003.out 2>&1
    ./red.sh 4 > ./red.000004.out 2>&1
    ./red.sh 5 > ./red.000005.out 2>&1
    ./red.sh 6 > ./red.000006.out 2>&1
    ./red.sh 7 > ./red.000007.out 2>&1
    ./red.sh 8 > ./red.000008.out 2>&1
    ./red.sh 9 > ./red.000009.out 2>&1
    ./red.sh 10 > ./red.000010.out 2>&1
    ./red.sh 11 > ./red.000011.out 2>&1
    ./red.sh 12 > ./red.000012.out 2>&1
    ./red.sh 13 > ./red.000013.out 2>&1
    ./red.sh 14 > ./red.000014.out 2>&1
    ./red.sh 15 > ./red.000015.out 2>&1
    ./red.sh 16 > ./red.000016.out 2>&1
    ./red.sh 17 > ./red.000017.out 2>&1
    ./red.sh 18 > ./red.000018.out 2>&1
    ./red.sh 19 > ./red.000019.out 2>&1
    ./red.sh 20 > ./red.000020.out 2>&1
    ./red.sh 21 > ./red.000021.out 2>&1
    ./red.sh 22 > ./red.000022.out 2>&1
    ./red.sh 23 > ./red.000023.out 2>&1
    ./red.sh 24 > ./red.000024.out 2>&1
    ./red.sh 25 > ./red.000025.out 2>&1
    ./red.sh 26 > ./red.000026.out 2>&1
    ./red.sh 27 > ./red.000027.out 2>&1
    ./red.sh 28 > ./red.000028.out 2>&1
    ./red.sh 29 > ./red.000029.out 2>&1
    ./red.sh 30 > ./red.000030.out 2>&1
    ./red.sh 31 > ./red.000031.out 2>&1
    ./red.sh 32 > ./red.000032.out 2>&1
    ./red.sh 33 > ./red.000033.out 2>&1
    ./red.sh 34 > ./red.000034.out 2>&1
    ./red.sh 35 > ./red.000035.out 2>&1
    ./red.sh 36 > ./red.000036.out 2>&1
    ./red.sh 37 > ./red.000037.out 2>&1
    ./red.sh 38 > ./red.000038.out 2>&1
    ./red.sh 39 > ./red.000039.out 2>&1
    ./red.sh 40 > ./red.000040.out 2>&1

-- Finished on Fri Jan 16 01:29:57 2026 (706 seconds) with 4559466.828 GB free disk space
----------------------------------------
-- Found 40 read error detection output files.
-- Finished stage 'readErrorDetectionCheck', reset canuIteration.
--
-- Loading read lengths.
-- Loading number of overlaps per read.
--
-- Configure OEA for 8gb memory.
--                   Batches of at most (unlimited) reads.
--                                      300000000 bases.
--
--           Total                                               Reads                 Olaps  Adjusts
--    Job   Memory      Read Range         Reads        Bases   Memory        Olaps   Memory   Memory  (Memory in MB)
--   ---- -------- ------------------- --------- ------------ -------- ------------ -------- --------
--      1  2829.62         1-117057        17554    300020265   294.66      3907509   119.25   367.72
--      2  2837.97    117058-243390        18965    300005362   294.69      4180075   127.57   367.72
--      3  2856.09    243391-364730        17794    300005090   294.65      4775082   145.72   367.72
--      4  2857.76    364731-493622        19083    300000410   294.69      4828406   147.35   367.72
--      5  2842.20    493623-623468        19189    300011051   294.70      4318228   131.78   367.72
--      6  2843.87    623469-754358        19310    300000878   294.69      4373261   133.46   367.72
--      7  2850.35    754359-885913        19531    300005332   294.70      4585118   139.93   367.72
--      8  2826.48    885914-1003296       17284    300016327   294.65      3804742   116.11   367.72
--      9  2856.05   1003297-1123322       17846    300019141   294.67      4773314   145.67   367.72
--     10  2857.04   1123323-1251086       18977    300017462   294.70      4804614   146.63   367.72
--     11  2844.44   1251087-1375659       18651    300002827   294.67      4392360   134.04   367.72
--     12  2823.12   1375660-1498809       18241    300007441   294.67      3694173   112.74   367.72
--     13  2861.29   1498810-1626711       18755    300013901   294.69      4944183   150.88   367.72
--     14  2824.47   1626712-1741012       16859    300008206   294.62      3739525   114.12   367.72
--     15  2522.85   1741013-1774315        4955     49869012    55.71      1684842    51.42   367.72
--   ---- -------- ------------------- --------- ------------ -------- ------------ -------- --------
--                                                 4250002705              62805432
-- Finished stage 'overlapErrorAdjustmentConfigure', reset canuIteration.
--
-- Running jobs.  First attempt out of 2.
----------------------------------------
-- Starting 'oea' concurrent execution on Fri Jan 16 01:30:04 2026 with 4559580.687 GB free disk space (15 processes; 62 concurrently)

    cd unitigging/3-overlapErrorAdjustment
    ./oea.sh 1 > ./oea.000001.out 2>&1
    ./oea.sh 2 > ./oea.000002.out 2>&1
    ./oea.sh 3 > ./oea.000003.out 2>&1
    ./oea.sh 4 > ./oea.000004.out 2>&1
    ./oea.sh 5 > ./oea.000005.out 2>&1
    ./oea.sh 6 > ./oea.000006.out 2>&1
    ./oea.sh 7 > ./oea.000007.out 2>&1
    ./oea.sh 8 > ./oea.000008.out 2>&1
    ./oea.sh 9 > ./oea.000009.out 2>&1
    ./oea.sh 10 > ./oea.000010.out 2>&1
    ./oea.sh 11 > ./oea.000011.out 2>&1
    ./oea.sh 12 > ./oea.000012.out 2>&1
    ./oea.sh 13 > ./oea.000013.out 2>&1
    ./oea.sh 14 > ./oea.000014.out 2>&1
    ./oea.sh 15 > ./oea.000015.out 2>&1

-- Finished on Fri Jan 16 01:59:42 2026 (1778 seconds) with 4559281.156 GB free disk space
----------------------------------------
-- Found 15 overlap error adjustment output files.
-- Finished stage 'overlapErrorAdjustmentCheck', reset canuIteration.
----------------------------------------
-- Starting command on Fri Jan 16 01:59:42 2026 with 4559281.14 GB free disk space

    cd unitigging/3-overlapErrorAdjustment
    /share/org/YZWL/yzwl_lixg/miniforge3/envs/canu_v.2.3/bin/loadErates \
      -S ../../A1-8.seqStore \
      -O ../A1-8.ovlStore \
      -L ./oea.files \
    > ./oea.apply.err 2>&1

-- Finished on Fri Jan 16 01:59:42 2026 (lickety-split) with 4559281 GB free disk space
----------------------------------------
-- No report available.
-- Finished stage 'updateOverlapStore', reset canuIteration.
-- Finished stage 'unitig', reset canuIteration.
--
-- Running jobs.  First attempt out of 2.
----------------------------------------
-- Starting 'bat' concurrent execution on Fri Jan 16 01:59:42 2026 with 4559280.953 GB free disk space (1 processes; 1 concurrently)

    cd unitigging/4-unitigger
    ./unitigger.sh 1 > ./unitigger.000001.out 2>&1

-- Finished on Fri Jan 16 01:59:59 2026 (17 seconds) with 4559280.765 GB free disk space
----------------------------------------
-- Unitigger finished successfully.
--  
--  ERROR RATES
--  -----------
--                                                   --------threshold------
--  286549                       fraction error      fraction        percent
--  samples                              (1e-5)         error          error
--                   --------------------------      --------       --------
--  command line (-eg)                           ->     30.00        0.0300%
--  command line (-ef)                           ->  -----.--      ---.----%
--  command line (-eM)                           ->     30.00        0.0300%
--  mean + std.dev       0.38 +-  12 *     2.82  ->     34.22        0.0342%
--  median + mad         0.00 +-  12 *     0.00  ->      0.00        0.0000%
--  90th percentile                              ->      1.00        0.0010%  (enabled)
--  
--  BEST EDGE FILTERING
--  -------------------
--  At graph threshold 0.0300%, reads:
--    available to have edges:        48231
--    with at least one edge:         37606
--  
--  At max threshold 0.0300%, reads:
--    available to have edges:        48231
--    with at least one edge:         37606
--  
--  At tight threshold 0.0010%, reads with:
--    both edges below error threshold:     33200  (80.00% minReadsBest threshold = 30084)
--    one  edge  above error threshold:      3221
--    both edges above error threshold:      1185
--    at least one edge:                    37606
--  
--  At loose threshold 0.0300%, reads with:
--    both edges below error threshold:     37606  (80.00% minReadsBest threshold = 30084)
--    one  edge  above error threshold:         0
--    both edges above error threshold:         0
--    at least one edge:                    37606
--  
--  
--  INITIAL EDGES
--  -------- ----------------------------------------
--    209734 reads are contained
--   1532057 reads have no best edges (singleton)
--       382 reads have only one best edge (spur) 
--                194 are mutual best
--     32142 reads have two best edges 
--                688 have one mutual best edge
--              31114 have two mutual best edges
--  
--  
--  FINAL EDGES
--  -------- ----------------------------------------
--    209734 reads are contained
--   1532393 reads have no best edges (singleton)
--       272 reads have only one best edge (spur) 
--                221 are mutual best
--     31916 reads have two best edges 
--                575 have one mutual best edge
--              31093 have two mutual best edges
--  
--  
--  EDGE FILTERING
--  -------- ------------------------------------------
--         0 reads are ignored
--      9693 reads have a gap in overlap coverage
--       138 reads have lopsided best edges
-- Found, in version 1, after unitig construction:
--   contigs:      104 sequences, total length 68303163 bp (including 104 repeats of total length 2291728 bp).
--   bubbles:      125 sequences, total length 3397995 bp.
--   unassembled:  21166 sequences, total length 247498750 bp.
--
-- Contig sizes based on genome size 85mbp:
--
--            NG (bp)  LG (contigs)    sum (bp)
--         ----------  ------------  ----------
--     10     8739886             1     8739886
--     20     6329266             3    22780870
--     30     4708689             4    27489559
--     40     4577570             6    36756685
--     50     3343268             8    43899622
--     60     2712949            11    52969901
--     70     2061671            14    59745313
--     80       18281            87    68016536
--
-- Finished stage 'unitigCheck', reset canuIteration.
----------------------------------------
-- Starting command on Fri Jan 16 01:59:59 2026 with 4559280.75 GB free disk space

    cd unitigging
    /share/org/YZWL/yzwl_lixg/miniforge3/envs/canu_v.2.3/bin/utgcns \
      -S ../A1-8.seqStore \
      -T  ./A1-8.ctgStore 1 \
      -partition 0.8 1.5 0.1 \
    > ./A1-8.ctgStore/partitioning.log 2>&1

-- Finished on Fri Jan 16 02:00:08 2026 (9 seconds) with 4559128.562 GB free disk space
----------------------------------------
-- Using slow alignment for consensus (iteration '0').
-- Configured 10 consensus jobs.
-- Finished stage 'consensusConfigure', reset canuIteration.
--
-- Local: cns       13.000 GB    8 CPUs x  11 jobs   143.000 GB  88 CPUs  (consensus)
--
--
-- Running jobs.  First attempt out of 2.
----------------------------------------
-- Starting 'cns' concurrent execution on Fri Jan 16 02:00:08 2026 with 4559128.531 GB free disk space (10 processes; 11 concurrently)

    cd unitigging/5-consensus
    ./consensus.sh 1 > ./consensus.000001.out 2>&1
    ./consensus.sh 2 > ./consensus.000002.out 2>&1
    ./consensus.sh 3 > ./consensus.000003.out 2>&1
    ./consensus.sh 4 > ./consensus.000004.out 2>&1
    ./consensus.sh 5 > ./consensus.000005.out 2>&1
    ./consensus.sh 6 > ./consensus.000006.out 2>&1
    ./consensus.sh 7 > ./consensus.000007.out 2>&1
    ./consensus.sh 8 > ./consensus.000008.out 2>&1
    ./consensus.sh 9 > ./consensus.000009.out 2>&1
    ./consensus.sh 10 > ./consensus.000010.out 2>&1

-- Finished on Fri Jan 16 02:08:03 2026 (475 seconds) with 4558838.281 GB free disk space
----------------------------------------
-- Using slow alignment for consensus (iteration '1').
-- Configured 10 consensus jobs.
-- All 10 consensus jobs finished successfully.
-- Finished stage 'consensusCheck', reset canuIteration.
-- Using slow alignment for consensus (iteration '0').
-- Configured 10 consensus jobs.
----------------------------------------
-- Starting command on Fri Jan 16 02:08:03 2026 with 4558838.234 GB free disk space

    cd unitigging
    /share/org/YZWL/yzwl_lixg/miniforge3/envs/canu_v.2.3/bin/tgStoreLoad \
      -S ../A1-8.seqStore \
      -T  ./A1-8.ctgStore 2 \
      -L ./5-consensus/ctgcns.files \
    > ./5-consensus/ctgcns.files.ctgStoreLoad.err 2>&1

-- Finished on Fri Jan 16 02:08:05 2026 (2 seconds) with 4558837.359 GB free disk space
----------------------------------------
----------------------------------------
-- Starting command on Fri Jan 16 02:08:05 2026 with 4558837.359 GB free disk space

    cd unitigging
    /share/org/YZWL/yzwl_lixg/miniforge3/envs/canu_v.2.3/bin/tgTigDisplay \
      -S ../A1-8.seqStore \
      -b \
      -o ../A1-8.contigs.unsorted.bam \
      -L ./5-consensus/ctgcns.files \
    > ./5-consensus/ctgcns.files.contigs.bam.err 2>&1

-- Finished on Fri Jan 16 02:10:50 2026 (165 seconds) with 4559032.89 GB free disk space
----------------------------------------
----------------------------------------
-- Starting command on Fri Jan 16 02:10:50 2026 with 4559032.89 GB free disk space

    cd .
    samtools sort \
      --write-index \
      --threads 2 \
      -o ./A1-8.contigs.bam ./A1-8.contigs.unsorted.bam \
    > ./ctgcns.bam.err 2>&1

-- Finished on Fri Jan 16 02:11:59 2026 (69 seconds) with 4558966.718 GB free disk space
----------------------------------------
-- Purging consensus output after loading to ctgStore.
-- Purged 10 .cns outputs.
----------------------------------------
-- Starting command on Fri Jan 16 02:11:59 2026 with 4558967.734 GB free disk space

    cd unitigging
    /share/org/YZWL/yzwl_lixg/miniforge3/envs/canu_v.2.3/bin/tgStoreDump \
      -S ../A1-8.seqStore \
      -T ./A1-8.ctgStore 2 \
      -sizes -s 85000000 \
    > ./A1-8.ctgStore/seqDB.v002.sizes.txt
ZERO length suplied to intervalList::add(), ignoring interval.
ZERO length suplied to intervalList::add(), ignoring interval.
ZERO length suplied to intervalList::add(), ignoring interval.
ZERO length suplied to intervalList::add(), ignoring interval.
ZERO length suplied to intervalList::add(), ignoring interval.
ZERO length suplied to intervalList::add(), ignoring interval.
ZERO length suplied to intervalList::add(), ignoring interval.
ZERO length suplied to intervalList::add(), ignoring interval.
ZERO length suplied to intervalList::add(), ignoring interval.
ZERO length suplied to intervalList::add(), ignoring interval.
ZERO length suplied to intervalList::add(), ignoring interval.
ZERO length suplied to intervalList::add(), ignoring interval.
ZERO length suplied to intervalList::add(), ignoring interval.
ZERO length suplied to intervalList::add(), ignoring interval.
ZERO length suplied to intervalList::add(), ignoring interval.
ZERO length suplied to intervalList::add(), ignoring interval.
ZERO length suplied to intervalList::add(), ignoring interval.
ZERO length suplied to intervalList::add(), ignoring interval.
ZERO length suplied to intervalList::add(), ignoring interval.
ZERO length suplied to intervalList::add(), ignoring interval.
ZERO length suplied to intervalList::add(), ignoring interval.
ZERO length suplied to intervalList::add(), ignoring interval.
ZERO length suplied to intervalList::add(), ignoring interval.

-- Finished on Fri Jan 16 02:11:59 2026 (in the blink of an eye) with 4558967.734 GB free disk space
----------------------------------------
-- Found, in version 2, after consensus generation:
--   contigs:      104 sequences, total length 89156599 bp (including 104 repeats of total length 3264636 bp).
--   bubbles:      125 sequences, total length 4623668 bp.
--   unassembled:  21166 sequences, total length 339004392 bp.
--
-- Contig sizes based on genome size 85mbp:
--
--            NG (bp)  LG (contigs)    sum (bp)
--         ----------  ------------  ----------
--     10    11358343             1    11358343
--     20    10054862             2    21413205
--     30     8223107             3    29636312
--     40     6132456             4    35768768
--     50     5963962             6    47824804
--     60     4918946             7    52743750
--     70     4222098             9    61322874
--     80     3535247            11    68927256
--     90     2692260            14    77773000
--    100      750741            19    85050283
--
-- Finished stage 'consensusLoad', reset canuIteration.
----------------------------------------
-- Starting command on Fri Jan 16 02:11:59 2026 with 4558967.718 GB free disk space

    cd .
    /share/org/YZWL/yzwl_lixg/miniforge3/envs/canu_v.2.3/bin/tgStoreDump \
      -S ./A1-8.seqStore \
      -T ./unitigging/A1-8.ctgStore 2 \
      -o ./A1-8.contigs \
      -layout \
    > ./A1-8.contigs.layout.err 2>&1

-- Finished on Fri Jan 16 02:12:00 2026 (one second) with 4558967.671 GB free disk space
----------------------------------------
----------------------------------------
-- Starting command on Fri Jan 16 02:12:00 2026 with 4558967.671 GB free disk space

    cd .
    /share/org/YZWL/yzwl_lixg/miniforge3/envs/canu_v.2.3/bin/tgStoreDump \
      -S ./A1-8.seqStore \
      -T ./unitigging/A1-8.ctgStore 2 \
      -consensus -fasta \
      -unassembled \
    > ./A1-8.unassembled.fasta
    2> ./A1-8.unassembled.err
ZERO length suplied to intervalList::add(), ignoring interval.
ZERO length suplied to intervalList::add(), ignoring interval.
ZERO length suplied to intervalList::add(), ignoring interval.
ZERO length suplied to intervalList::add(), ignoring interval.
ZERO length suplied to intervalList::add(), ignoring interval.
ZERO length suplied to intervalList::add(), ignoring interval.
ZERO length suplied to intervalList::add(), ignoring interval.
ZERO length suplied to intervalList::add(), ignoring interval.
ZERO length suplied to intervalList::add(), ignoring interval.
ZERO length suplied to intervalList::add(), ignoring interval.
ZERO length suplied to intervalList::add(), ignoring interval.
ZERO length suplied to intervalList::add(), ignoring interval.
ZERO length suplied to intervalList::add(), ignoring interval.
ZERO length suplied to intervalList::add(), ignoring interval.
ZERO length suplied to intervalList::add(), ignoring interval.
ZERO length suplied to intervalList::add(), ignoring interval.
ZERO length suplied to intervalList::add(), ignoring interval.
ZERO length suplied to intervalList::add(), ignoring interval.
ZERO length suplied to intervalList::add(), ignoring interval.
ZERO length suplied to intervalList::add(), ignoring interval.
ZERO length suplied to intervalList::add(), ignoring interval.
ZERO length suplied to intervalList::add(), ignoring interval.
ZERO length suplied to intervalList::add(), ignoring interval.

-- Finished on Fri Jan 16 02:12:01 2026 (one second) with 4558967.328 GB free disk space
----------------------------------------
----------------------------------------
-- Starting command on Fri Jan 16 02:12:01 2026 with 4558967.328 GB free disk space

    cd .
    /share/org/YZWL/yzwl_lixg/miniforge3/envs/canu_v.2.3/bin/tgStoreDump \
      -S ./A1-8.seqStore \
      -T ./unitigging/A1-8.ctgStore 2 \
      -consensus -fasta \
      -contigs \
    > ./A1-8.contigs.fasta
    2> ./A1-8.contigs.err
ZERO length suplied to intervalList::add(), ignoring interval.
ZERO length suplied to intervalList::add(), ignoring interval.
ZERO length suplied to intervalList::add(), ignoring interval.
ZERO length suplied to intervalList::add(), ignoring interval.
ZERO length suplied to intervalList::add(), ignoring interval.
ZERO length suplied to intervalList::add(), ignoring interval.
ZERO length suplied to intervalList::add(), ignoring interval.
ZERO length suplied to intervalList::add(), ignoring interval.
ZERO length suplied to intervalList::add(), ignoring interval.
ZERO length suplied to intervalList::add(), ignoring interval.
ZERO length suplied to intervalList::add(), ignoring interval.
ZERO length suplied to intervalList::add(), ignoring interval.
ZERO length suplied to intervalList::add(), ignoring interval.
ZERO length suplied to intervalList::add(), ignoring interval.
ZERO length suplied to intervalList::add(), ignoring interval.
ZERO length suplied to intervalList::add(), ignoring interval.
ZERO length suplied to intervalList::add(), ignoring interval.
ZERO length suplied to intervalList::add(), ignoring interval.
ZERO length suplied to intervalList::add(), ignoring interval.
ZERO length suplied to intervalList::add(), ignoring interval.
ZERO length suplied to intervalList::add(), ignoring interval.
ZERO length suplied to intervalList::add(), ignoring interval.
ZERO length suplied to intervalList::add(), ignoring interval.

-- Finished on Fri Jan 16 02:12:02 2026 (one second) with 4558967.218 GB free disk space
----------------------------------------
-- Finished stage 'generateOutputs', reset canuIteration.
--
-- Assembly 'A1-8' finished in '/share/org/YZWL/yzwl_lixg/project/28.大豆疫霉菌三代基因组/03.hicanu/A1-8/01.raw_output'.
--
-- Summary saved in 'A1-8.report'.
--
-- Sequences saved:
--   Contigs       -> 'A1-8.contigs.fasta'
--   Unassembled   -> 'A1-8.unassembled.fasta'
--
-- Read layouts saved:
--   Contigs       -> 'A1-8.contigs.layout'.
--
-- Bye.

2026-01-16 02:12:02.624 - WARNING - 输出文件不存在|Output file does not exist: /share/org/YZWL/yzwl_lixg/project/28.大豆疫霉菌三代基因组/03.hicanu/A1-8/01.raw_output/A1-8.unitigs.fasta
Usage: biopytools ragtag [OPTIONS]
Try 'biopytools ragtag -h' for help.

Error: Invalid value for '-r' / '--reference': 文件不存在|File does not exist: /share/org/YZWL/yzwl_lixg/project/28.大豆疫霉菌三代基因组/04.ragtag/Psoja_T2T.fa
Usage: biopytools genomesyn [OPTIONS]
Try 'biopytools genomesyn -h' for help.

Error: Invalid value for '-i' / '--ref': Path '04.ragtag/A1-8/hicanu/A1-8_RagTag_scaffolded.fa' does not exist.
Job 68886685 stderr output:

