2026-01-16 16:35:31.809 - WARNING - 命令错误输出|Command stderr:
-- canu master +27 changes (r10515 2a41e933b8de6ed66723d75d36dd071b46d2c347)
--
-- CITATIONS
--
-- For assemblies of PacBio HiFi reads:
--   Nurk S, Walenz BP, Rhiea A, Vollger MR, Logsdon GA, Grothe R, Miga KH, Eichler EE, Phillippy AM, Koren S.
--   HiCanu: accurate assembly of segmental duplications, satellites, and allelic variants from high-fidelity long reads.
--   biorXiv. 2020.
--   https://doi.org/10.1101/2020.03.14.992248
-- 
-- Read and contig alignments during correction and consensus use:
--   Šošic M, Šikic M.
--   Edlib: a C/C ++ library for fast, exact sequence alignment using edit distance.
--   Bioinformatics. 2017 May 1;33(9):1394-1395.
--   http://doi.org/10.1093/bioinformatics/btw753
-- 
-- Overlaps are generated using:
--   Berlin K, et al.
--   Assembling large genomes with single-molecule sequencing and locality-sensitive hashing.
--   Nat Biotechnol. 2015 Jun;33(6):623-30.
--   http://doi.org/10.1038/nbt.3238
-- 
--   Myers EW, et al.
--   A Whole-Genome Assembly of Drosophila.
--   Science. 2000 Mar 24;287(5461):2196-204.
--   http://doi.org/10.1126/science.287.5461.2196
-- 
-- Contig consensus sequences are generated using an algorithm derived from pbdagcon:
--   Chin CS, et al.
--   Nonhybrid, finished microbial genome assemblies from long-read SMRT sequencing data.
--   Nat Methods. 2013 Jun;10(6):563-9
--   http://doi.org/10.1038/nmeth.2474
-- 
-- CONFIGURE CANU
--
-- Detected Java(TM) Runtime Environment '25.0.1-internal' (from '/share/org/YZWL/yzwl_lixg/miniforge3/envs/telocomp/lib/jvm/bin/java') without -d64 support.
--
-- WARNING:
-- WARNING:  Failed to run gnuplot using command 'gnuplot'.
-- WARNING:  Plots will be disabled.
-- WARNING:
--
-- Detected samtools version '1.22' / htslib version 'htscodecs=1.6.3' (from 'samtools').
--
-- Detected 88 CPUs and 503 gigabytes of memory on the local machine.
--
-- Detected Slurm with 'sinfo' binary in /opt/skyformai/bin/sinfo.
--          Slurm disabled by useGrid=false
--
-- Detected  '' with 'pbsnodes' binary in /opt/skyformai/bin/pbsnodes.
--           disabled by useGrid=false
--
-- Detected LSF with 'bsub' binary in /opt/skyformai/bin/bsub.
--          LSF disabled by useGrid=false
--
-- Local machine mode enabled; grid support not detected or not allowed.
--
-- Found trimmed raw PacBio HiFi reads in the input files.
--
--                                (tag)Concurrency
--                         (tag)Threads          |
--                (tag)Memory         |          |
--        (tag)             |         |          |       total usage      algorithm
--        -------  ----------  --------   --------  --------------------  -----------------------------
-- Local: meryl     12.000 GB    4 CPUs x  22 jobs   264.000 GB  88 CPUs  (k-mer counting)
-- Local: cormhap   13.000 GB   11 CPUs x   8 jobs   104.000 GB  88 CPUs  (overlap detection with mhap)
-- Local: obtovl     8.000 GB    8 CPUs x  11 jobs    88.000 GB  88 CPUs  (overlap detection)
-- Local: utgovl     8.000 GB    8 CPUs x  11 jobs    88.000 GB  88 CPUs  (overlap detection)
-- Local: cor        -.--- GB    4 CPUs x   - jobs     -.--- GB   - CPUs  (read correction)
-- Local: ovb        4.000 GB    1 CPU  x  88 jobs   352.000 GB  88 CPUs  (overlap store bucketizer)
-- Local: ovs        8.000 GB    1 CPU  x  62 jobs   496.000 GB  62 CPUs  (overlap store sorting)
-- Local: red       16.000 GB    4 CPUs x  22 jobs   352.000 GB  88 CPUs  (read error detection)
-- Local: oea        8.000 GB    1 CPU  x  62 jobs   496.000 GB  62 CPUs  (overlap error adjustment)
-- Local: bat       32.000 GB    8 CPUs x   1 job     32.000 GB   8 CPUs  (contig construction with bogart)
-- Local: cns        -.--- GB    8 CPUs x   - jobs     -.--- GB   - CPUs  (consensus)
--
-- Generating assembly 'A3-18' in '/share/org/YZWL/yzwl_lixg/project/28.大豆疫霉菌三代基因组/03.hicanu/A3-18/01.raw_output':
--   genomeSize:
--     85000000
--
--   Overlap Generation Limits:
--     corOvlErrorRate 0.0000 (  0.00%)
--     obtOvlErrorRate 0.0250 (  2.50%)
--     utgOvlErrorRate 0.0100 (  1.00%)
--
--   Overlap Processing Limits:
--     corErrorRate    0.0000 (  0.00%)
--     obtErrorRate    0.0250 (  2.50%)
--     utgErrorRate    0.0003 (  0.03%)
--     cnsErrorRate    0.0500 (  5.00%)
--
--   Stages to run:
--     assemble HiFi reads.
--
--
-- BEGIN STORE CREATION
----------------------------------------
-- Starting command on Fri Jan 16 14:59:54 2026 with 4527727.828 GB free disk space

    cd .
    ./A3-18.seqStore.sh \
    > ./A3-18.seqStore.err 2>&1

-- Finished on Fri Jan 16 15:07:56 2026 (482 seconds) with 4526333.984 GB free disk space
----------------------------------------
--
-- In sequence store './A3-18.seqStore':
--   Found 252510 reads.
--   Found 4250008779 bases (50 times coverage).
--    Histogram of corrected reads:
--    
--    G=4250008779                       sum of  ||               length     num
--    NG         length     index       lengths  ||                range    seqs
--    ----- ------------ --------- ------------  ||  ------------------- -------
--    00010        26265     15032    425007015  ||       1252-2350         6480|------------------
--    00020        24207     31933    850002391  ||       2351-3449         9750|---------------------------
--    00030        22779     50056   1275019992  ||       3450-4548         9121|-------------------------
--    00040        21625     69217   1700011172  ||       4549-5647         8115|----------------------
--    00050        20597     89359   2125007919  ||       5648-6746         7176|--------------------
--    00060        19609    110501   2550022811  ||       6747-7845         6210|-----------------
--    00070        18550    132762   2975009259  ||       7846-8944         5772|----------------
--    00080        17110    156535   3400019616  ||       8945-10043        5286|---------------
--    00090        12615    184092   3825018366  ||      10044-11142        4776|-------------
--    00100         1252    252510   4250008779  ||      11143-12241        4335|------------
--    001.000x              252510   4250008779  ||      12242-13340        3979|-----------
--                                               ||      13341-14439        4223|------------
--                                               ||      14440-15538        5690|----------------
--                                               ||      15539-16637        9355|--------------------------
--                                               ||      16638-17736       14836|----------------------------------------
--                                               ||      17737-18835       20319|-------------------------------------------------------
--                                               ||      18836-19934       23536|---------------------------------------------------------------
--                                               ||      19935-21033       23094|--------------------------------------------------------------
--                                               ||      21034-22132       20260|-------------------------------------------------------
--                                               ||      22133-23231       16548|---------------------------------------------
--                                               ||      23232-24330       13009|-----------------------------------
--                                               ||      24331-25429        9835|---------------------------
--                                               ||      25430-26528        7312|--------------------
--                                               ||      26529-27627        5219|--------------
--                                               ||      27628-28726        3420|----------
--                                               ||      28727-29825        2268|-------
--                                               ||      29826-30924        1316|----
--                                               ||      30925-32023         757|---
--                                               ||      32024-33122         299|-
--                                               ||      33123-34221         136|-
--                                               ||      34222-35320          60|-
--                                               ||      35321-36419           8|-
--                                               ||      36420-37518           3|-
--                                               ||      37519-38617           2|-
--                                               ||      38618-39716           1|-
--                                               ||      39717-40815           0|
--                                               ||      40816-41914           2|-
--                                               ||      41915-43013           0|
--                                               ||      43014-44112           1|-
--                                               ||      44113-45211           1|-
--    
--
-- In sequence store './A3-18.seqStore':
--   Found 252510 reads.
--   Found 4250008779 bases (50 times coverage).
--    Histogram of corrected-trimmed reads:
--    
--    G=4250008779                       sum of  ||               length     num
--    NG         length     index       lengths  ||                range    seqs
--    ----- ------------ --------- ------------  ||  ------------------- -------
--    00010        26265     15032    425007015  ||       1252-2350         6480|------------------
--    00020        24207     31933    850002391  ||       2351-3449         9750|---------------------------
--    00030        22779     50056   1275019992  ||       3450-4548         9121|-------------------------
--    00040        21625     69217   1700011172  ||       4549-5647         8115|----------------------
--    00050        20597     89359   2125007919  ||       5648-6746         7176|--------------------
--    00060        19609    110501   2550022811  ||       6747-7845         6210|-----------------
--    00070        18550    132762   2975009259  ||       7846-8944         5772|----------------
--    00080        17110    156535   3400019616  ||       8945-10043        5286|---------------
--    00090        12615    184092   3825018366  ||      10044-11142        4776|-------------
--    00100         1252    252510   4250008779  ||      11143-12241        4335|------------
--    001.000x              252510   4250008779  ||      12242-13340        3979|-----------
--                                               ||      13341-14439        4223|------------
--                                               ||      14440-15538        5690|----------------
--                                               ||      15539-16637        9355|--------------------------
--                                               ||      16638-17736       14836|----------------------------------------
--                                               ||      17737-18835       20319|-------------------------------------------------------
--                                               ||      18836-19934       23536|---------------------------------------------------------------
--                                               ||      19935-21033       23094|--------------------------------------------------------------
--                                               ||      21034-22132       20260|-------------------------------------------------------
--                                               ||      22133-23231       16548|---------------------------------------------
--                                               ||      23232-24330       13009|-----------------------------------
--                                               ||      24331-25429        9835|---------------------------
--                                               ||      25430-26528        7312|--------------------
--                                               ||      26529-27627        5219|--------------
--                                               ||      27628-28726        3420|----------
--                                               ||      28727-29825        2268|-------
--                                               ||      29826-30924        1316|----
--                                               ||      30925-32023         757|---
--                                               ||      32024-33122         299|-
--                                               ||      33123-34221         136|-
--                                               ||      34222-35320          60|-
--                                               ||      35321-36419           8|-
--                                               ||      36420-37518           3|-
--                                               ||      37519-38617           2|-
--                                               ||      38618-39716           1|-
--                                               ||      39717-40815           0|
--                                               ||      40816-41914           2|-
--                                               ||      41915-43013           0|
--                                               ||      43014-44112           1|-
--                                               ||      44113-45211           1|-
--    
--
-- Correction skipped; not enabled.
--
-- Trimming skipped; not enabled.
--
-- BEGIN ASSEMBLY
----------------------------------------
-- Starting command on Fri Jan 16 15:07:56 2026 with 4526333.921 GB free disk space

    cd unitigging/0-mercounts
    ./meryl-configure.sh \
    > ./meryl-configure.err 2>&1

-- Finished on Fri Jan 16 15:07:57 2026 (one second) with 4526333.921 GB free disk space
----------------------------------------
--  segments   memory batches
--  -------- -------- -------
--        01 10.81 GB       2
--        02  5.61 GB       2
--        04  2.97 GB       2
--        06  2.15 GB       2
--        08  1.61 GB       2
--        12  1.07 GB       2
--        16  0.81 GB       2
--        20  0.65 GB       2
--        24  0.54 GB       2
--        32  0.41 GB       2
--        40  0.33 GB       2
--        48  -.-- GB       -  (segment size too small)
--        56  -.-- GB       -  (segment size too small)
--        64  -.-- GB       -  (segment size too small)
--        96  -.-- GB       -  (segment size too small)
--
--  For 252510 reads with 4250008779 bases, limit to 42 batches.
--  Will count kmers using 01 jobs, each using 12 GB and 4 threads.
--
-- Finished stage 'merylConfigure', reset canuIteration.
--
-- Running jobs.  First attempt out of 2.
----------------------------------------
-- Starting 'meryl' concurrent execution on Fri Jan 16 15:07:57 2026 with 4526333.89 GB free disk space (1 processes; 22 concurrently)

    cd unitigging/0-mercounts
    ./meryl-count.sh 1 > ./meryl-count.000001.out 2>&1

-- Finished on Fri Jan 16 15:11:27 2026 (210 seconds) with 4525774.609 GB free disk space
----------------------------------------
-- Found 1 Kmer counting (meryl) outputs.
-- Finished stage 'utg-merylCountCheck', reset canuIteration.
--
-- Running jobs.  First attempt out of 2.
----------------------------------------
-- Starting 'meryl' concurrent execution on Fri Jan 16 15:11:27 2026 with 4525774.578 GB free disk space (1 processes; 22 concurrently)

    cd unitigging/0-mercounts
    ./meryl-process.sh 1 > ./meryl-process.000001.out 2>&1

-- Finished on Fri Jan 16 15:11:33 2026 (6 seconds) with 4525775.109 GB free disk space
----------------------------------------
-- Meryl finished successfully.  Kmer frequency histogram:
--
-- WARNING: gnuplot failed.
--
----------------------------------------
--
--  22-mers                                                                                           Fraction
--    Occurrences   NumMers                                                                         Unique Total
--       1-     1         0                                                                        0.0000 0.0000
--       2-     2    235353 *                                                                      0.0051 0.0001
--       3-     4     78561                                                                        0.0063 0.0002
--       5-     7     29824                                                                        0.0071 0.0003
--       8-    11     40034                                                                        0.0077 0.0003
--      12-    16    208325                                                                        0.0088 0.0005
--      17-    22    708803 ***                                                                    0.0147 0.0018
--      23-    29   1434822 ******                                                                 0.0318 0.0068
--      30-    37   5030934 ***********************                                                0.0666 0.0205
--      38-    46  14987159 ********************************************************************** 0.1953 0.0852
--      47-    56  14318600 ******************************************************************     0.5373 0.2962
--      57-    67   3986379 ******************                                                     0.8234 0.5070
--      68-    79    743864 ***                                                                    0.8960 0.5703
--      80-    92    908916 ****                                                                   0.9115 0.5867
--      93-   106    805985 ***                                                                    0.9317 0.6118
--     107-   121    350217 *                                                                      0.9483 0.6354
--     122-   137    264235 *                                                                      0.9555 0.6471
--     138-   154    266141 *                                                                      0.9613 0.6578
--     155-   172    179299                                                                        0.9670 0.6697
--     173-   191    152118                                                                        0.9708 0.6786
--     192-   211    124470                                                                        0.9741 0.6872
--     212-   232    109130                                                                        0.9767 0.6948
--     233-   254     98998                                                                        0.9791 0.7024
--     255-   277     88703                                                                        0.9813 0.7098
--     278-   301     75324                                                                        0.9832 0.7171
--     302-   326     68230                                                                        0.9848 0.7239
--     327-   352     55427                                                                        0.9863 0.7304
--     353-   379     42409                                                                        0.9875 0.7363
--     380-   407     40115                                                                        0.9884 0.7410
--     408-   436     39724                                                                        0.9893 0.7459
--     437-   466     34439                                                                        0.9901 0.7511
--     467-   497     29130                                                                        0.9909 0.7559
--     498-   529     31942                                                                        0.9915 0.7603
--     530-   562     21603                                                                        0.9922 0.7653
--     563-   596     19463                                                                        0.9927 0.7690
--     597-   631     18191                                                                        0.9931 0.7724
--     632-   667     16800                                                                        0.9935 0.7759
--     668-   704     17274                                                                        0.9938 0.7793
--     705-   742     14271                                                                        0.9942 0.7829
--     743-   781     12531                                                                        0.9945 0.7861
--     782-   821     12316                                                                        0.9948 0.7891
--
--           0 (max occurrences)
--  3223169211 (total mers, non-unique)
--    45926756 (distinct mers, non-unique)
--           0 (unique mers)
-- Finished stage 'meryl-process', reset canuIteration.
--
-- Removing meryl database 'unitigging/0-mercounts/A3-18.ms22'.
--
-- OVERLAPPER (normal) (assembly) erate=0.01
--
----------------------------------------
-- Starting command on Fri Jan 16 15:11:33 2026 with 4525775.093 GB free disk space

    cd unitigging/1-overlapper
    /share/org/YZWL/yzwl_lixg/miniforge3/envs/canu_v.2.3/bin/overlapInCorePartition \
     -S  ../../A3-18.seqStore \
     -hl 160000000 \
     -rl 5000000000 \
     -ol 500 \
     -o  ./A3-18.partition \
    > ./A3-18.partition.err 2>&1

-- Finished on Fri Jan 16 15:11:33 2026 (lickety-split) with 4525775.078 GB free disk space
----------------------------------------
--
-- Configured 21 overlapInCore jobs.
-- Finished stage 'utg-overlapConfigure', reset canuIteration.
--
-- Running jobs.  First attempt out of 2.
----------------------------------------
-- Starting 'utgovl' concurrent execution on Fri Jan 16 15:11:33 2026 with 4525775.046 GB free disk space (21 processes; 11 concurrently)

    cd unitigging/1-overlapper
    ./overlap.sh 1 > ./overlap.000001.out 2>&1
    ./overlap.sh 2 > ./overlap.000002.out 2>&1
    ./overlap.sh 3 > ./overlap.000003.out 2>&1
    ./overlap.sh 4 > ./overlap.000004.out 2>&1
    ./overlap.sh 5 > ./overlap.000005.out 2>&1
    ./overlap.sh 6 > ./overlap.000006.out 2>&1
    ./overlap.sh 7 > ./overlap.000007.out 2>&1
    ./overlap.sh 8 > ./overlap.000008.out 2>&1
    ./overlap.sh 9 > ./overlap.000009.out 2>&1
    ./overlap.sh 10 > ./overlap.000010.out 2>&1
    ./overlap.sh 11 > ./overlap.000011.out 2>&1
    ./overlap.sh 12 > ./overlap.000012.out 2>&1
    ./overlap.sh 13 > ./overlap.000013.out 2>&1
    ./overlap.sh 14 > ./overlap.000014.out 2>&1
    ./overlap.sh 15 > ./overlap.000015.out 2>&1
    ./overlap.sh 16 > ./overlap.000016.out 2>&1
    ./overlap.sh 17 > ./overlap.000017.out 2>&1
    ./overlap.sh 18 > ./overlap.000018.out 2>&1
    ./overlap.sh 19 > ./overlap.000019.out 2>&1
    ./overlap.sh 20 > ./overlap.000020.out 2>&1
    ./overlap.sh 21 > ./overlap.000021.out 2>&1

-- Finished on Fri Jan 16 15:40:15 2026 (1722 seconds) with 4522092.593 GB free disk space
----------------------------------------
-- Found 21 overlapInCore output files.
--
-- overlapInCore compute 'unitigging/1-overlapper':
--   kmer hits
--     with no overlap       1285933740    61234940 +- 37680493.152
--     with an overlap         20841279  .857142857 +- 567835.806
--
--   overlaps                  20841279  .857142857 +- 567835.806
--     contained                5093970      242570 +- 138551.735
--     dovetail                15747309  .857142857 +- 432081.544
--
--   overlaps rejected
--     multiple per pair              0           0 +- 0
--     bad short window               0           0 +- 0
--     bad long window                0           0 +- 0
-- Finished stage 'utg-overlapCheck', reset canuIteration.
----------------------------------------
-- Starting command on Fri Jan 16 15:40:15 2026 with 4522092.578 GB free disk space

    cd unitigging
    /share/org/YZWL/yzwl_lixg/miniforge3/envs/canu_v.2.3/bin/ovStoreConfig \
     -S ../A3-18.seqStore \
     -M 4-8 \
     -L ./1-overlapper/ovljob.files \
     -create ./A3-18.ovlStore.config \
     > ./A3-18.ovlStore.config.txt \
    2> ./A3-18.ovlStore.config.err

-- Finished on Fri Jan 16 15:40:15 2026 (furiously fast) with 4522092.562 GB free disk space
----------------------------------------
--
-- Creating overlap store unitigging/A3-18.ovlStore using:
--      1 bucket
--      1 slice
--        using at most 2 GB memory each
--
-- Running jobs.  First attempt out of 2.
----------------------------------------
-- Starting 'ovS' concurrent execution on Fri Jan 16 15:40:15 2026 with 4522092.546 GB free disk space (1 processes; 62 concurrently)

    cd unitigging
    ./A3-18.ovlStore.sh 1 > ./A3-18.ovlStore.000001.out 2>&1

-- Finished on Fri Jan 16 15:40:24 2026 (9 seconds) with 4522017.75 GB free disk space
----------------------------------------
-- Checking store.
----------------------------------------
-- Starting command on Fri Jan 16 15:40:24 2026 with 4522017.75 GB free disk space

    cd unitigging
    /share/org/YZWL/yzwl_lixg/miniforge3/envs/canu_v.2.3/bin/ovStoreDump \
     -S ../A3-18.seqStore \
     -O  ./A3-18.ovlStore \
     -counts \
     > ./A3-18.ovlStore/counts.dat 2> ./A3-18.ovlStore/counts.err

-- Finished on Fri Jan 16 15:40:24 2026 (in the blink of an eye) with 4522017.718 GB free disk space
----------------------------------------
--
-- Overlap store 'unitigging/A3-18.ovlStore' successfully constructed.
-- Found 41682558 overlaps for 246582 reads; 1628254 reads have no overlaps.
--
--
-- Purged 0.509 GB in 63 overlap output files.
----------------------------------------
-- Starting command on Fri Jan 16 15:40:25 2026 with 4522017.718 GB free disk space

    cd unitigging
    /share/org/YZWL/yzwl_lixg/miniforge3/envs/canu_v.2.3/bin/ovStoreStats \
     -C 50 \
     -S ../A3-18.seqStore \
     -O  ./A3-18.ovlStore \
     -o  ./A3-18.ovlStore \
     > ./A3-18.ovlStore.summary.err 2>&1

-- Finished on Fri Jan 16 15:40:31 2026 (6 seconds) with 4522017.703 GB free disk space
----------------------------------------
--
-- Overlap store 'unitigging/A3-18.ovlStore' contains:
--
--   category            reads     %          read length        feature size or coverage  analysis
--   ----------------  -------  -------  ----------------------  ------------------------  --------------------
--   middle-missing        108    0.04    14784.81 +- 6451.77        737.99 +- 851.13     (bad trimming)
--   middle-hump             9    0.00    15199.33 +- 5679.81       5065.67 +- 3115.70    (bad trimming)
--   no-5-prime            425    0.17    13791.76 +- 5148.73       1857.30 +- 2879.31    (bad trimming)
--   no-3-prime            460    0.18    12082.24 +- 6161.99       1611.02 +- 2588.18    (bad trimming)
--   
--   low-coverage         1369    0.54    10477.31 +- 5822.58          6.44 +- 4.00       (easy to assemble, potential for lower quality consensus)
--   unique             199141   78.86    12898.81 +- 5678.60         44.34 +- 9.74       (easy to assemble, perfect, yay)
--   repeat-cont         15359    6.08    10609.32 +- 5314.45        730.18 +- 520.30     (potential for consensus errors, no impact on assembly)
--   repeat-dove           281    0.11    20389.39 +- 1824.34        437.31 +- 397.93     (hard to assemble, likely won't assemble correctly or even at all)
--   
--   span-repeat          6754    2.67    15037.39 +- 4431.52       3519.70 +- 3702.03    (read spans a large repeat, usually easy to assemble)
--   uniq-repeat-cont    14946    5.92    12720.14 +- 4681.84                             (should be uniquely placed, low potential for consensus errors, no impact on assembly)
--   uniq-repeat-dove     4110    1.63    18547.20 +- 2659.73                             (will end contigs, potential to misassemble)
--   uniq-anchor          3620    1.43    13987.44 +- 4668.28       8196.15 +- 5092.62    (repeat read, with unique section, probable bad read)
-- Finished stage 'utg-createOverlapStore', reset canuIteration.
--
-- Loading read lengths.
-- Loading number of overlaps per read.
--
-- Configure RED for 16gb memory.
--                   Batches of at most (unlimited) reads.
--                                      500000000 bases.
--                   Expecting evidence of at most 536870912 bases per iteration.
--
--           Total                                               Reads                 Olaps Evidence
--    Job   Memory      Read Range         Reads        Bases   Memory        Olaps   Memory   Memory  (Memory in MB)
--   ---- -------- ------------------- --------- ------------ -------- ------------ -------- --------
--      1 16385.75         1-40913          5499    108983401 13303.81       868772     9.94  1024.00
--      2 16384.56     40914-84743          5953    108966431 13301.75       944275    10.81  1024.00
--      3 16384.05     84744-135430         6877    108944322 13299.08      1132812    12.96  1024.00
--      4 16384.95    135431-178146         5748    108961890 13301.19      1027768    11.76  1024.00
--      5 16384.51    178147-225246         6379    108966247 13301.74       940494    10.76  1024.00
--      6 16385.57    225247-281731         7594    108943557 13299.01      1272100    14.56  1024.00
--      7 16386.67    281732-322454         5679    108977863 13303.14      1007048    11.52  1024.00
--      8 16384.56    322455-368787         6243    108961118 13301.11       999783    11.44  1024.00
--      9 16385.24    368788-426923         7919    108936529 13298.17      1317488    15.08  1024.00
--     10 16386.79    426924-468075         5672    108985889 13304.12       931958    10.67  1024.00
--     11 16385.17    468076-513946         6161    108967083 13301.84       990342    11.33  1024.00
--     12 16384.55    513947-572988         7951    108933610 13297.81      1288131    14.74  1024.00
--     13 16386.25    572989-614677         5633    108980402 13303.45       943422    10.80  1024.00
--     14 16385.07    614678-660865         6160    108962015 13301.22      1035410    11.85  1024.00
--     15 16385.08    660866-721334         8056    108935138 13298.00      1317867    15.08  1024.00
--     16 16384.29    721335-763792         5657    108963797 13301.42       949400    10.87  1024.00
--     17 16385.82    763793-808114         6084    108969669 13302.15      1019073    11.66  1024.00
--     18 16385.98    808115-869238         8234    108945742 13299.30      1282820    14.68  1024.00
--     19 16386.12    869239-910638         5563    108975662 13302.87       983014    11.25  1024.00
--     20 16384.07    910639-955411         6005    108954791 13300.33      1025671    11.74  1024.00
--     21 16386.23    955412-1014737        7998    108942841 13298.94      1336112    15.29  1024.00
--     22 16385.94   1014738-1056756        5604    108980866 13303.50       911655    10.43  1024.00
--     23 16384.08   1056757-1102039        5950    108958432 13300.78       987569    11.30  1024.00
--     24 16384.90   1102040-1159589        7723    108939125 13298.48      1260262    14.42  1024.00
--     25 16385.88   1159590-1200224        5544    108973654 13302.62       983955    11.26  1024.00
--     26 16385.06   1200225-1246032        6019    108965870 13301.69       993492    11.37  1024.00
--     27 16386.11   1246033-1304167        7748    108949441 13299.74      1255871    14.37  1024.00
--     28 16385.94   1304168-1346048        5572    108975154 13302.81       972918    11.13  1024.00
--     29 16385.30   1346049-1389501        5883    108968005 13301.94       992570    11.36  1024.00
--     30 16385.81   1389502-1447525        7754    108946182 13299.34      1264875    14.48  1024.00
--     31 16385.44   1447526-1487935        5520    108968393 13301.98      1001403    11.46  1024.00
--     32 16385.52   1487936-1532025        5923    108974861 13302.78       938015    10.73  1024.00
--     33 16385.49   1532026-1589504        7741    108940699 13298.67      1294705    14.82  1024.00
--     34 16386.11   1589505-1629595        5550    108997609 13305.55       748117     8.56  1024.00
--     35 16384.81   1629596-1673461        5846    108955493 13300.42      1083294    12.40  1024.00
--     36 16385.46   1673462-1731797        7885    108938847 13298.45      1311850    15.01  1024.00
--     37 16385.47   1731798-1773356        5490    108993038 13304.99       741249     8.48  1024.00
--     38 16385.26   1773357-1817274        5852    108960932 13301.08      1064700    12.18  1024.00
--     39 16384.28   1817275-1874476        7803    108934083 13297.86      1259358    14.41  1024.00
--     40  3136.74   1874477-1874836          38       530098    64.71         2940     0.03  1024.00
--   ---- -------- ------------------- --------- ------------ -------- ------------ -------- --------
--                                                 4250008779              41682558
-- Finished stage 'readErrorDetectionConfigure', reset canuIteration.
--
-- Running jobs.  First attempt out of 2.
----------------------------------------
-- Starting 'red' concurrent execution on Fri Jan 16 15:40:38 2026 with 4521964.609 GB free disk space (40 processes; 22 concurrently)

    cd unitigging/3-overlapErrorAdjustment
    ./red.sh 1 > ./red.000001.out 2>&1
    ./red.sh 2 > ./red.000002.out 2>&1
    ./red.sh 3 > ./red.000003.out 2>&1
    ./red.sh 4 > ./red.000004.out 2>&1
    ./red.sh 5 > ./red.000005.out 2>&1
    ./red.sh 6 > ./red.000006.out 2>&1
    ./red.sh 7 > ./red.000007.out 2>&1
    ./red.sh 8 > ./red.000008.out 2>&1
    ./red.sh 9 > ./red.000009.out 2>&1
    ./red.sh 10 > ./red.000010.out 2>&1
    ./red.sh 11 > ./red.000011.out 2>&1
    ./red.sh 12 > ./red.000012.out 2>&1
    ./red.sh 13 > ./red.000013.out 2>&1
    ./red.sh 14 > ./red.000014.out 2>&1
    ./red.sh 15 > ./red.000015.out 2>&1
    ./red.sh 16 > ./red.000016.out 2>&1
    ./red.sh 17 > ./red.000017.out 2>&1
    ./red.sh 18 > ./red.000018.out 2>&1
    ./red.sh 19 > ./red.000019.out 2>&1
    ./red.sh 20 > ./red.000020.out 2>&1
    ./red.sh 21 > ./red.000021.out 2>&1
    ./red.sh 22 > ./red.000022.out 2>&1
    ./red.sh 23 > ./red.000023.out 2>&1
    ./red.sh 24 > ./red.000024.out 2>&1
    ./red.sh 25 > ./red.000025.out 2>&1
    ./red.sh 26 > ./red.000026.out 2>&1
    ./red.sh 27 > ./red.000027.out 2>&1
    ./red.sh 28 > ./red.000028.out 2>&1
    ./red.sh 29 > ./red.000029.out 2>&1
    ./red.sh 30 > ./red.000030.out 2>&1
    ./red.sh 31 > ./red.000031.out 2>&1
    ./red.sh 32 > ./red.000032.out 2>&1
    ./red.sh 33 > ./red.000033.out 2>&1
    ./red.sh 34 > ./red.000034.out 2>&1
    ./red.sh 35 > ./red.000035.out 2>&1
    ./red.sh 36 > ./red.000036.out 2>&1
    ./red.sh 37 > ./red.000037.out 2>&1
    ./red.sh 38 > ./red.000038.out 2>&1
    ./red.sh 39 > ./red.000039.out 2>&1
    ./red.sh 40 > ./red.000040.out 2>&1

-- Finished on Fri Jan 16 15:52:36 2026 (718 seconds) with 4521623.375 GB free disk space
----------------------------------------
-- Found 40 read error detection output files.
-- Finished stage 'readErrorDetectionCheck', reset canuIteration.
--
-- Loading read lengths.
-- Loading number of overlaps per read.
--
-- Configure OEA for 8gb memory.
--                   Batches of at most (unlimited) reads.
--                                      300000000 bases.
--
--           Total                                               Reads                 Olaps  Adjusts
--    Job   Memory      Read Range         Reads        Bases   Memory        Olaps   Memory   Memory  (Memory in MB)
--   ---- -------- ------------------- --------- ------------ -------- ------------ -------- --------
--      1  2800.34         1-125227        16965    300016946   294.64      2792041    85.21   372.50
--      2  2809.85    125228-261487        18365    300021003   294.68      3102133    94.67   372.50
--      3  2792.20    261488-384716        16768    300006958   294.62      2525820    77.08   372.50
--      4  2807.41    384717-514564        17712    300010016   294.65      3023251    92.26   372.50
--      5  2809.10    514565-649464        18115    300015273   294.67      3078032    93.93   372.50
--      6  2810.18    649465-785899        18331    300021422   294.68      3112961    95.00   372.50
--      7  2800.99    785900-921777        18377    300022262   294.68      2811802    85.81   372.50
--      8  2809.60    921778-1057989       18197    300019307   294.68      3094027    94.42   372.50
--      9  2802.52   1057990-1191511       17819    300000893   294.65      2863149    87.38   372.50
--     10  2804.31   1191512-1326530       17954    300000163   294.65      2921784    89.17   372.50
--     11  2809.29   1326531-1459211       17824    300019272   294.66      3084388    94.13   372.50
--     12  2809.35   1459212-1591111       17837    300005331   294.65      3086885    94.20   372.50
--     13  2793.88   1591112-1715286       16877    300002377   294.62      2580900    78.76   372.50
--     14  2798.69   1715287-1843432       17115    300015449   294.64      2737854    83.55   372.50
--     15  2502.63   1843433-1874836        4254     49832107    55.65       867531    26.47   372.50
--   ---- -------- ------------------- --------- ------------ -------- ------------ -------- --------
--                                                 4250008779              41682558
-- Finished stage 'overlapErrorAdjustmentConfigure', reset canuIteration.
--
-- Running jobs.  First attempt out of 2.
----------------------------------------
-- Starting 'oea' concurrent execution on Fri Jan 16 15:52:44 2026 with 4521626.671 GB free disk space (15 processes; 62 concurrently)

    cd unitigging/3-overlapErrorAdjustment
    ./oea.sh 1 > ./oea.000001.out 2>&1
    ./oea.sh 2 > ./oea.000002.out 2>&1
    ./oea.sh 3 > ./oea.000003.out 2>&1
    ./oea.sh 4 > ./oea.000004.out 2>&1
    ./oea.sh 5 > ./oea.000005.out 2>&1
    ./oea.sh 6 > ./oea.000006.out 2>&1
    ./oea.sh 7 > ./oea.000007.out 2>&1
    ./oea.sh 8 > ./oea.000008.out 2>&1
    ./oea.sh 9 > ./oea.000009.out 2>&1
    ./oea.sh 10 > ./oea.000010.out 2>&1
    ./oea.sh 11 > ./oea.000011.out 2>&1
    ./oea.sh 12 > ./oea.000012.out 2>&1
    ./oea.sh 13 > ./oea.000013.out 2>&1
    ./oea.sh 14 > ./oea.000014.out 2>&1
    ./oea.sh 15 > ./oea.000015.out 2>&1

-- Finished on Fri Jan 16 16:22:27 2026 (1783 seconds) with 4520441.609 GB free disk space
----------------------------------------
-- Found 15 overlap error adjustment output files.
-- Finished stage 'overlapErrorAdjustmentCheck', reset canuIteration.
----------------------------------------
-- Starting command on Fri Jan 16 16:22:27 2026 with 4520441.593 GB free disk space

    cd unitigging/3-overlapErrorAdjustment
    /share/org/YZWL/yzwl_lixg/miniforge3/envs/canu_v.2.3/bin/loadErates \
      -S ../../A3-18.seqStore \
      -O ../A3-18.ovlStore \
      -L ./oea.files \
    > ./oea.apply.err 2>&1

-- Finished on Fri Jan 16 16:22:27 2026 (lickety-split) with 4520441.5 GB free disk space
----------------------------------------
-- No report available.
-- Finished stage 'updateOverlapStore', reset canuIteration.
-- Finished stage 'unitig', reset canuIteration.
--
-- Running jobs.  First attempt out of 2.
----------------------------------------
-- Starting 'bat' concurrent execution on Fri Jan 16 16:22:27 2026 with 4520441.453 GB free disk space (1 processes; 1 concurrently)

    cd unitigging/4-unitigger
    ./unitigger.sh 1 > ./unitigger.000001.out 2>&1

-- Finished on Fri Jan 16 16:22:39 2026 (12 seconds) with 4520441.234 GB free disk space
----------------------------------------
-- Unitigger finished successfully.
--  
--  ERROR RATES
--  -----------
--                                                   --------threshold------
--  289925                       fraction error      fraction        percent
--  samples                              (1e-5)         error          error
--                   --------------------------      --------       --------
--  command line (-eg)                           ->     30.00        0.0300%
--  command line (-ef)                           ->  -----.--      ---.----%
--  command line (-eM)                           ->     30.00        0.0300%
--  mean + std.dev       0.62 +-  12 *     3.33  ->     40.62        0.0406%
--  median + mad         0.00 +-  12 *     0.00  ->      0.00        0.0000%
--  90th percentile                              ->      1.00        0.0010%  (enabled)
--  
--  BEST EDGE FILTERING
--  -------------------
--  At graph threshold 0.0300%, reads:
--    available to have edges:        55804
--    with at least one edge:         48265
--  
--  At max threshold 0.0300%, reads:  (not computed)
--    available to have edges:            0
--    with at least one edge:             0
--  
--  At tight threshold 0.0010%, reads with:
--    both edges below error threshold:     38716  (80.00% minReadsBest threshold = 38612)
--    one  edge  above error threshold:      6896
--    both edges above error threshold:      2653
--    at least one edge:                    48265
--  
--  At loose threshold 0.0300%, reads with:
--    both edges below error threshold:     48265  (80.00% minReadsBest threshold = 38612)
--    one  edge  above error threshold:         0
--    both edges above error threshold:         0
--    at least one edge:                    48265
--  
--  
--  INITIAL EDGES
--  -------- ----------------------------------------
--    187903 reads are contained
--   1639623 reads have no best edges (singleton)
--       366 reads have only one best edge (spur) 
--                225 are mutual best
--     46944 reads have two best edges 
--               2031 have one mutual best edge
--              44504 have two mutual best edges
--  
--  
--  FINAL EDGES
--  -------- ----------------------------------------
--    187903 reads are contained
--   1639952 reads have no best edges (singleton)
--       313 reads have only one best edge (spur) 
--                258 are mutual best
--     46668 reads have two best edges 
--               1910 have one mutual best edge
--              44446 have two mutual best edges
--  
--  
--  EDGE FILTERING
--  -------- ------------------------------------------
--         0 reads are ignored
--      9568 reads have a gap in overlap coverage
--       165 reads have lopsided best edges
-- Found, in version 1, after unitig construction:
--   contigs:      202 sequences, total length 75075012 bp (including 438 repeats of total length 19802313 bp).
--   bubbles:      917 sequences, total length 56369183 bp.
--   unassembled:  17865 sequences, total length 219831975 bp.
--
-- Contig sizes based on genome size 85mbp:
--
--            NG (bp)  LG (contigs)    sum (bp)
--         ----------  ------------  ----------
--     10     4872090             2    10414572
--     20     3982631             4    18678223
--     30     3328131             7    28757045
--     40     2698554             9    34203698
--     50     2072998            13    43409300
--     60     1530442            18    51818121
--     70      973735            25    60400373
--     80      332652            40    68119978
--
-- Finished stage 'unitigCheck', reset canuIteration.
----------------------------------------
-- Starting command on Fri Jan 16 16:22:39 2026 with 4520441.218 GB free disk space

    cd unitigging
    /share/org/YZWL/yzwl_lixg/miniforge3/envs/canu_v.2.3/bin/utgcns \
      -S ../A3-18.seqStore \
      -T  ./A3-18.ctgStore 1 \
      -partition 0.8 1.5 0.1 \
    > ./A3-18.ctgStore/partitioning.log 2>&1

-- Finished on Fri Jan 16 16:22:48 2026 (9 seconds) with 4520450.046 GB free disk space
----------------------------------------
-- Using slow alignment for consensus (iteration '0').
-- Configured 13 consensus jobs.
-- Finished stage 'consensusConfigure', reset canuIteration.
--
-- Local: cns        8.375 GB    8 CPUs x  11 jobs    92.125 GB  88 CPUs  (consensus)
--
--
-- Running jobs.  First attempt out of 2.
----------------------------------------
-- Starting 'cns' concurrent execution on Fri Jan 16 16:22:48 2026 with 4520450.015 GB free disk space (13 processes; 11 concurrently)

    cd unitigging/5-consensus
    ./consensus.sh 1 > ./consensus.000001.out 2>&1
    ./consensus.sh 2 > ./consensus.000002.out 2>&1
    ./consensus.sh 3 > ./consensus.000003.out 2>&1
    ./consensus.sh 4 > ./consensus.000004.out 2>&1
    ./consensus.sh 5 > ./consensus.000005.out 2>&1
    ./consensus.sh 6 > ./consensus.000006.out 2>&1
    ./consensus.sh 7 > ./consensus.000007.out 2>&1
    ./consensus.sh 8 > ./consensus.000008.out 2>&1
    ./consensus.sh 9 > ./consensus.000009.out 2>&1
    ./consensus.sh 10 > ./consensus.000010.out 2>&1
    ./consensus.sh 11 > ./consensus.000011.out 2>&1
    ./consensus.sh 12 > ./consensus.000012.out 2>&1
    ./consensus.sh 13 > ./consensus.000013.out 2>&1

-- Finished on Fri Jan 16 16:30:47 2026 (479 seconds) with 4520281.5 GB free disk space
----------------------------------------
-- Using slow alignment for consensus (iteration '1').
-- Configured 13 consensus jobs.
-- All 13 consensus jobs finished successfully.
-- Finished stage 'consensusCheck', reset canuIteration.
-- Using slow alignment for consensus (iteration '0').
-- Configured 13 consensus jobs.
----------------------------------------
-- Starting command on Fri Jan 16 16:30:48 2026 with 4520281.453 GB free disk space

    cd unitigging
    /share/org/YZWL/yzwl_lixg/miniforge3/envs/canu_v.2.3/bin/tgStoreLoad \
      -S ../A3-18.seqStore \
      -T  ./A3-18.ctgStore 2 \
      -L ./5-consensus/ctgcns.files \
    > ./5-consensus/ctgcns.files.ctgStoreLoad.err 2>&1

-- Finished on Fri Jan 16 16:30:48 2026 (lickety-split) with 4520280.5 GB free disk space
----------------------------------------
----------------------------------------
-- Starting command on Fri Jan 16 16:30:48 2026 with 4520280.5 GB free disk space

    cd unitigging
    /share/org/YZWL/yzwl_lixg/miniforge3/envs/canu_v.2.3/bin/tgTigDisplay \
      -S ../A3-18.seqStore \
      -b \
      -o ../A3-18.contigs.unsorted.bam \
      -L ./5-consensus/ctgcns.files \
    > ./5-consensus/ctgcns.files.contigs.bam.err 2>&1

-- Finished on Fri Jan 16 16:34:24 2026 (216 seconds) with 4520220.75 GB free disk space
----------------------------------------
----------------------------------------
-- Starting command on Fri Jan 16 16:34:24 2026 with 4520220.75 GB free disk space

    cd .
    samtools sort \
      --write-index \
      --threads 2 \
      -o ./A3-18.contigs.bam ./A3-18.contigs.unsorted.bam \
    > ./ctgcns.bam.err 2>&1

-- Finished on Fri Jan 16 16:35:28 2026 (64 seconds) with 4520300.906 GB free disk space
----------------------------------------
-- Purging consensus output after loading to ctgStore.
-- Purged 13 .cns outputs.
----------------------------------------
-- Starting command on Fri Jan 16 16:35:28 2026 with 4520302.89 GB free disk space

    cd unitigging
    /share/org/YZWL/yzwl_lixg/miniforge3/envs/canu_v.2.3/bin/tgStoreDump \
      -S ../A3-18.seqStore \
      -T ./A3-18.ctgStore 2 \
      -sizes -s 85000000 \
    > ./A3-18.ctgStore/seqDB.v002.sizes.txt
ZERO length suplied to intervalList::add(), ignoring interval.
ZERO length suplied to intervalList::add(), ignoring interval.
ZERO length suplied to intervalList::add(), ignoring interval.
ZERO length suplied to intervalList::add(), ignoring interval.
ZERO length suplied to intervalList::add(), ignoring interval.
ZERO length suplied to intervalList::add(), ignoring interval.
ZERO length suplied to intervalList::add(), ignoring interval.
ZERO length suplied to intervalList::add(), ignoring interval.
ZERO length suplied to intervalList::add(), ignoring interval.
ZERO length suplied to intervalList::add(), ignoring interval.
ZERO length suplied to intervalList::add(), ignoring interval.
ZERO length suplied to intervalList::add(), ignoring interval.
ZERO length suplied to intervalList::add(), ignoring interval.
ZERO length suplied to intervalList::add(), ignoring interval.
ZERO length suplied to intervalList::add(), ignoring interval.
ZERO length suplied to intervalList::add(), ignoring interval.
ZERO length suplied to intervalList::add(), ignoring interval.
ZERO length suplied to intervalList::add(), ignoring interval.
ZERO length suplied to intervalList::add(), ignoring interval.
ZERO length suplied to intervalList::add(), ignoring interval.
ZERO length suplied to intervalList::add(), ignoring interval.
ZERO length suplied to intervalList::add(), ignoring interval.
ZERO length suplied to intervalList::add(), ignoring interval.
ZERO length suplied to intervalList::add(), ignoring interval.
ZERO length suplied to intervalList::add(), ignoring interval.
ZERO length suplied to intervalList::add(), ignoring interval.
ZERO length suplied to intervalList::add(), ignoring interval.
ZERO length suplied to intervalList::add(), ignoring interval.
ZERO length suplied to intervalList::add(), ignoring interval.
ZERO length suplied to intervalList::add(), ignoring interval.
ZERO length suplied to intervalList::add(), ignoring interval.
ZERO length suplied to intervalList::add(), ignoring interval.
ZERO length suplied to intervalList::add(), ignoring interval.
ZERO length suplied to intervalList::add(), ignoring interval.
ZERO length suplied to intervalList::add(), ignoring interval.
ZERO length suplied to intervalList::add(), ignoring interval.
ZERO length suplied to intervalList::add(), ignoring interval.
ZERO length suplied to intervalList::add(), ignoring interval.
ZERO length suplied to intervalList::add(), ignoring interval.
ZERO length suplied to intervalList::add(), ignoring interval.
ZERO length suplied to intervalList::add(), ignoring interval.
ZERO length suplied to intervalList::add(), ignoring interval.
ZERO length suplied to intervalList::add(), ignoring interval.
ZERO length suplied to intervalList::add(), ignoring interval.
ZERO length suplied to intervalList::add(), ignoring interval.
ZERO length suplied to intervalList::add(), ignoring interval.
ZERO length suplied to intervalList::add(), ignoring interval.
ZERO length suplied to intervalList::add(), ignoring interval.
ZERO length suplied to intervalList::add(), ignoring interval.
ZERO length suplied to intervalList::add(), ignoring interval.
ZERO length suplied to intervalList::add(), ignoring interval.
ZERO length suplied to intervalList::add(), ignoring interval.
ZERO length suplied to intervalList::add(), ignoring interval.
ZERO length suplied to intervalList::add(), ignoring interval.
ZERO length suplied to intervalList::add(), ignoring interval.
ZERO length suplied to intervalList::add(), ignoring interval.
ZERO length suplied to intervalList::add(), ignoring interval.
ZERO length suplied to intervalList::add(), ignoring interval.
ZERO length suplied to intervalList::add(), ignoring interval.
ZERO length suplied to intervalList::add(), ignoring interval.
ZERO length suplied to intervalList::add(), ignoring interval.

-- Finished on Fri Jan 16 16:35:28 2026 (lickety-split) with 4520302.89 GB free disk space
----------------------------------------
-- Found, in version 2, after consensus generation:
--   contigs:      202 sequences, total length 98021756 bp (including 438 repeats of total length 26098915 bp).
--   bubbles:      917 sequences, total length 73616081 bp.
--   unassembled:  17865 sequences, total length 299660411 bp.
--
-- Contig sizes based on genome size 85mbp:
--
--            NG (bp)  LG (contigs)    sum (bp)
--         ----------  ------------  ----------
--     10     6334144             2    13539421
--     20     5571967             3    19111388
--     30     4402124             5    28714263
--     40     4311370             7    37417094
--     50     3521860             9    44491148
--     60     2895933            12    53778604
--     70     2333487            15    61427046
--     80     1832715            19    69281862
--     90     1293636            24    77368358
--    100      492005            32    85077167
--    110       66182            64    93527804
--
-- Finished stage 'consensusLoad', reset canuIteration.
----------------------------------------
-- Starting command on Fri Jan 16 16:35:28 2026 with 4520302.875 GB free disk space

    cd .
    /share/org/YZWL/yzwl_lixg/miniforge3/envs/canu_v.2.3/bin/tgStoreDump \
      -S ./A3-18.seqStore \
      -T ./unitigging/A3-18.ctgStore 2 \
      -o ./A3-18.contigs \
      -layout \
    > ./A3-18.contigs.layout.err 2>&1

-- Finished on Fri Jan 16 16:35:29 2026 (one second) with 4520302.828 GB free disk space
----------------------------------------
----------------------------------------
-- Starting command on Fri Jan 16 16:35:29 2026 with 4520302.828 GB free disk space

    cd .
    /share/org/YZWL/yzwl_lixg/miniforge3/envs/canu_v.2.3/bin/tgStoreDump \
      -S ./A3-18.seqStore \
      -T ./unitigging/A3-18.ctgStore 2 \
      -consensus -fasta \
      -unassembled \
    > ./A3-18.unassembled.fasta
    2> ./A3-18.unassembled.err
ZERO length suplied to intervalList::add(), ignoring interval.
ZERO length suplied to intervalList::add(), ignoring interval.
ZERO length suplied to intervalList::add(), ignoring interval.
ZERO length suplied to intervalList::add(), ignoring interval.
ZERO length suplied to intervalList::add(), ignoring interval.
ZERO length suplied to intervalList::add(), ignoring interval.
ZERO length suplied to intervalList::add(), ignoring interval.
ZERO length suplied to intervalList::add(), ignoring interval.
ZERO length suplied to intervalList::add(), ignoring interval.
ZERO length suplied to intervalList::add(), ignoring interval.
ZERO length suplied to intervalList::add(), ignoring interval.
ZERO length suplied to intervalList::add(), ignoring interval.
ZERO length suplied to intervalList::add(), ignoring interval.
ZERO length suplied to intervalList::add(), ignoring interval.
ZERO length suplied to intervalList::add(), ignoring interval.
ZERO length suplied to intervalList::add(), ignoring interval.
ZERO length suplied to intervalList::add(), ignoring interval.
ZERO length suplied to intervalList::add(), ignoring interval.
ZERO length suplied to intervalList::add(), ignoring interval.
ZERO length suplied to intervalList::add(), ignoring interval.
ZERO length suplied to intervalList::add(), ignoring interval.
ZERO length suplied to intervalList::add(), ignoring interval.
ZERO length suplied to intervalList::add(), ignoring interval.
ZERO length suplied to intervalList::add(), ignoring interval.
ZERO length suplied to intervalList::add(), ignoring interval.
ZERO length suplied to intervalList::add(), ignoring interval.
ZERO length suplied to intervalList::add(), ignoring interval.
ZERO length suplied to intervalList::add(), ignoring interval.
ZERO length suplied to intervalList::add(), ignoring interval.
ZERO length suplied to intervalList::add(), ignoring interval.
ZERO length suplied to intervalList::add(), ignoring interval.
ZERO length suplied to intervalList::add(), ignoring interval.
ZERO length suplied to intervalList::add(), ignoring interval.
ZERO length suplied to intervalList::add(), ignoring interval.
ZERO length suplied to intervalList::add(), ignoring interval.
ZERO length suplied to intervalList::add(), ignoring interval.
ZERO length suplied to intervalList::add(), ignoring interval.
ZERO length suplied to intervalList::add(), ignoring interval.
ZERO length suplied to intervalList::add(), ignoring interval.
ZERO length suplied to intervalList::add(), ignoring interval.
ZERO length suplied to intervalList::add(), ignoring interval.
ZERO length suplied to intervalList::add(), ignoring interval.
ZERO length suplied to intervalList::add(), ignoring interval.
ZERO length suplied to intervalList::add(), ignoring interval.
ZERO length suplied to intervalList::add(), ignoring interval.
ZERO length suplied to intervalList::add(), ignoring interval.
ZERO length suplied to intervalList::add(), ignoring interval.
ZERO length suplied to intervalList::add(), ignoring interval.
ZERO length suplied to intervalList::add(), ignoring interval.
ZERO length suplied to intervalList::add(), ignoring interval.
ZERO length suplied to intervalList::add(), ignoring interval.
ZERO length suplied to intervalList::add(), ignoring interval.
ZERO length suplied to intervalList::add(), ignoring interval.
ZERO length suplied to intervalList::add(), ignoring interval.
ZERO length suplied to intervalList::add(), ignoring interval.
ZERO length suplied to intervalList::add(), ignoring interval.
ZERO length suplied to intervalList::add(), ignoring interval.
ZERO length suplied to intervalList::add(), ignoring interval.
ZERO length suplied to intervalList::add(), ignoring interval.
ZERO length suplied to intervalList::add(), ignoring interval.
ZERO length suplied to intervalList::add(), ignoring interval.

-- Finished on Fri Jan 16 16:35:30 2026 (one second) with 4520303.531 GB free disk space
----------------------------------------
----------------------------------------
-- Starting command on Fri Jan 16 16:35:30 2026 with 4520303.531 GB free disk space

    cd .
    /share/org/YZWL/yzwl_lixg/miniforge3/envs/canu_v.2.3/bin/tgStoreDump \
      -S ./A3-18.seqStore \
      -T ./unitigging/A3-18.ctgStore 2 \
      -consensus -fasta \
      -contigs \
    > ./A3-18.contigs.fasta
    2> ./A3-18.contigs.err
ZERO length suplied to intervalList::add(), ignoring interval.
ZERO length suplied to intervalList::add(), ignoring interval.
ZERO length suplied to intervalList::add(), ignoring interval.
ZERO length suplied to intervalList::add(), ignoring interval.
ZERO length suplied to intervalList::add(), ignoring interval.
ZERO length suplied to intervalList::add(), ignoring interval.
ZERO length suplied to intervalList::add(), ignoring interval.
ZERO length suplied to intervalList::add(), ignoring interval.
ZERO length suplied to intervalList::add(), ignoring interval.
ZERO length suplied to intervalList::add(), ignoring interval.
ZERO length suplied to intervalList::add(), ignoring interval.
ZERO length suplied to intervalList::add(), ignoring interval.
ZERO length suplied to intervalList::add(), ignoring interval.
ZERO length suplied to intervalList::add(), ignoring interval.
ZERO length suplied to intervalList::add(), ignoring interval.
ZERO length suplied to intervalList::add(), ignoring interval.
ZERO length suplied to intervalList::add(), ignoring interval.
ZERO length suplied to intervalList::add(), ignoring interval.
ZERO length suplied to intervalList::add(), ignoring interval.
ZERO length suplied to intervalList::add(), ignoring interval.
ZERO length suplied to intervalList::add(), ignoring interval.
ZERO length suplied to intervalList::add(), ignoring interval.
ZERO length suplied to intervalList::add(), ignoring interval.
ZERO length suplied to intervalList::add(), ignoring interval.
ZERO length suplied to intervalList::add(), ignoring interval.
ZERO length suplied to intervalList::add(), ignoring interval.
ZERO length suplied to intervalList::add(), ignoring interval.
ZERO length suplied to intervalList::add(), ignoring interval.
ZERO length suplied to intervalList::add(), ignoring interval.
ZERO length suplied to intervalList::add(), ignoring interval.
ZERO length suplied to intervalList::add(), ignoring interval.
ZERO length suplied to intervalList::add(), ignoring interval.
ZERO length suplied to intervalList::add(), ignoring interval.
ZERO length suplied to intervalList::add(), ignoring interval.
ZERO length suplied to intervalList::add(), ignoring interval.
ZERO length suplied to intervalList::add(), ignoring interval.
ZERO length suplied to intervalList::add(), ignoring interval.
ZERO length suplied to intervalList::add(), ignoring interval.
ZERO length suplied to intervalList::add(), ignoring interval.
ZERO length suplied to intervalList::add(), ignoring interval.
ZERO length suplied to intervalList::add(), ignoring interval.
ZERO length suplied to intervalList::add(), ignoring interval.
ZERO length suplied to intervalList::add(), ignoring interval.
ZERO length suplied to intervalList::add(), ignoring interval.
ZERO length suplied to intervalList::add(), ignoring interval.
ZERO length suplied to intervalList::add(), ignoring interval.
ZERO length suplied to intervalList::add(), ignoring interval.
ZERO length suplied to intervalList::add(), ignoring interval.
ZERO length suplied to intervalList::add(), ignoring interval.
ZERO length suplied to intervalList::add(), ignoring interval.
ZERO length suplied to intervalList::add(), ignoring interval.
ZERO length suplied to intervalList::add(), ignoring interval.
ZERO length suplied to intervalList::add(), ignoring interval.
ZERO length suplied to intervalList::add(), ignoring interval.
ZERO length suplied to intervalList::add(), ignoring interval.
ZERO length suplied to intervalList::add(), ignoring interval.
ZERO length suplied to intervalList::add(), ignoring interval.
ZERO length suplied to intervalList::add(), ignoring interval.
ZERO length suplied to intervalList::add(), ignoring interval.
ZERO length suplied to intervalList::add(), ignoring interval.
ZERO length suplied to intervalList::add(), ignoring interval.

-- Finished on Fri Jan 16 16:35:31 2026 (one second) with 4520303.343 GB free disk space
----------------------------------------
-- Finished stage 'generateOutputs', reset canuIteration.
--
-- Assembly 'A3-18' finished in '/share/org/YZWL/yzwl_lixg/project/28.大豆疫霉菌三代基因组/03.hicanu/A3-18/01.raw_output'.
--
-- Summary saved in 'A3-18.report'.
--
-- Sequences saved:
--   Contigs       -> 'A3-18.contigs.fasta'
--   Unassembled   -> 'A3-18.unassembled.fasta'
--
-- Read layouts saved:
--   Contigs       -> 'A3-18.contigs.layout'.
--
-- Bye.

2026-01-16 16:35:31.812 - WARNING - 输出文件不存在|Output file does not exist: /share/org/YZWL/yzwl_lixg/project/28.大豆疫霉菌三代基因组/03.hicanu/A3-18/01.raw_output/A3-18.unitigs.fasta
Job 68889955 stderr output:

