Usage: biopytools ragtag [OPTIONS]
Try 'biopytools ragtag -h' for help.

Error: Invalid value for '-r' / '--reference': 文件不存在|File does not exist: /share/org/YZWL/yzwl_lixg/project/28.大豆疫霉菌三代基因组/04.ragtag/Psoja_T2T.fa
Usage: biopytools genomesyn [OPTIONS]
Try 'biopytools genomesyn -h' for help.

Error: Invalid value for '-i' / '--ref': Path '04.ragtag/A3-55/hifiasm/A3-55_RagTag_scaffolded.fa' does not exist.
2026-01-16 01:02:55.586 - WARNING - 命令错误输出|Command stderr:
-- canu master +27 changes (r10515 2a41e933b8de6ed66723d75d36dd071b46d2c347)
--
-- CITATIONS
--
-- For assemblies of PacBio HiFi reads:
--   Nurk S, Walenz BP, Rhiea A, Vollger MR, Logsdon GA, Grothe R, Miga KH, Eichler EE, Phillippy AM, Koren S.
--   HiCanu: accurate assembly of segmental duplications, satellites, and allelic variants from high-fidelity long reads.
--   biorXiv. 2020.
--   https://doi.org/10.1101/2020.03.14.992248
-- 
-- Read and contig alignments during correction and consensus use:
--   Šošic M, Šikic M.
--   Edlib: a C/C ++ library for fast, exact sequence alignment using edit distance.
--   Bioinformatics. 2017 May 1;33(9):1394-1395.
--   http://doi.org/10.1093/bioinformatics/btw753
-- 
-- Overlaps are generated using:
--   Berlin K, et al.
--   Assembling large genomes with single-molecule sequencing and locality-sensitive hashing.
--   Nat Biotechnol. 2015 Jun;33(6):623-30.
--   http://doi.org/10.1038/nbt.3238
-- 
--   Myers EW, et al.
--   A Whole-Genome Assembly of Drosophila.
--   Science. 2000 Mar 24;287(5461):2196-204.
--   http://doi.org/10.1126/science.287.5461.2196
-- 
-- Contig consensus sequences are generated using an algorithm derived from pbdagcon:
--   Chin CS, et al.
--   Nonhybrid, finished microbial genome assemblies from long-read SMRT sequencing data.
--   Nat Methods. 2013 Jun;10(6):563-9
--   http://doi.org/10.1038/nmeth.2474
-- 
-- CONFIGURE CANU
--
-- Detected Java(TM) Runtime Environment '17.0.15-internal' (from '/share/org/YZWL/yzwl_lixg/.local/bin/java') without -d64 support.
--
-- WARNING:
-- WARNING:  Failed to run gnuplot using command 'gnuplot'.
-- WARNING:  Plots will be disabled.
-- WARNING:
--
-- Detected samtools version '1.22' / htslib version 'htscodecs=1.6.3' (from 'samtools').
--
-- Detected 88 CPUs and 503 gigabytes of memory on the local machine.
--
-- Detected Slurm with 'sinfo' binary in /opt/skyformai/bin/sinfo.
--          Slurm disabled by useGrid=false
--
-- Detected  '' with 'pbsnodes' binary in /opt/skyformai/bin/pbsnodes.
--           disabled by useGrid=false
--
-- Detected LSF with 'bsub' binary in /opt/skyformai/bin/bsub.
--          LSF disabled by useGrid=false
--
-- Local machine mode enabled; grid support not detected or not allowed.
--
-- Found trimmed raw PacBio HiFi reads in the input files.
--
--                                (tag)Concurrency
--                         (tag)Threads          |
--                (tag)Memory         |          |
--        (tag)             |         |          |       total usage      algorithm
--        -------  ----------  --------   --------  --------------------  -----------------------------
-- Local: meryl     12.000 GB    4 CPUs x  22 jobs   264.000 GB  88 CPUs  (k-mer counting)
-- Local: cormhap   13.000 GB   11 CPUs x   8 jobs   104.000 GB  88 CPUs  (overlap detection with mhap)
-- Local: obtovl     8.000 GB    8 CPUs x  11 jobs    88.000 GB  88 CPUs  (overlap detection)
-- Local: utgovl     8.000 GB    8 CPUs x  11 jobs    88.000 GB  88 CPUs  (overlap detection)
-- Local: cor        -.--- GB    4 CPUs x   - jobs     -.--- GB   - CPUs  (read correction)
-- Local: ovb        4.000 GB    1 CPU  x  88 jobs   352.000 GB  88 CPUs  (overlap store bucketizer)
-- Local: ovs        8.000 GB    1 CPU  x  62 jobs   496.000 GB  62 CPUs  (overlap store sorting)
-- Local: red       16.000 GB    4 CPUs x  22 jobs   352.000 GB  88 CPUs  (read error detection)
-- Local: oea        8.000 GB    1 CPU  x  62 jobs   496.000 GB  62 CPUs  (overlap error adjustment)
-- Local: bat       32.000 GB    8 CPUs x   1 job     32.000 GB   8 CPUs  (contig construction with bogart)
-- Local: cns        -.--- GB    8 CPUs x   - jobs     -.--- GB   - CPUs  (consensus)
--
-- Generating assembly 'A3-55' in '/share/org/YZWL/yzwl_lixg/project/28.大豆疫霉菌三代基因组/03.hicanu/A3-55/01.raw_output':
--   genomeSize:
--     85000000
--
--   Overlap Generation Limits:
--     corOvlErrorRate 0.0000 (  0.00%)
--     obtOvlErrorRate 0.0250 (  2.50%)
--     utgOvlErrorRate 0.0100 (  1.00%)
--
--   Overlap Processing Limits:
--     corErrorRate    0.0000 (  0.00%)
--     obtErrorRate    0.0250 (  2.50%)
--     utgErrorRate    0.0003 (  0.03%)
--     cnsErrorRate    0.0500 (  5.00%)
--
--   Stages to run:
--     assemble HiFi reads.
--
--
-- BEGIN STORE CREATION
----------------------------------------
-- Starting command on Thu Jan 15 23:33:38 2026 with 4569911.421 GB free disk space

    cd .
    ./A3-55.seqStore.sh \
    > ./A3-55.seqStore.err 2>&1

-- Finished on Thu Jan 15 23:40:02 2026 (384 seconds) with 4568789.156 GB free disk space
----------------------------------------
--
-- In sequence store './A3-55.seqStore':
--   Found 279873 reads.
--   Found 4250013509 bases (50 times coverage).
--    Histogram of corrected reads:
--    
--    G=4250013509                       sum of  ||               length     num
--    NG         length     index       lengths  ||                range    seqs
--    ----- ------------ --------- ------------  ||  ------------------- -------
--    00010        25364     15319    425018859  ||       1224-2754        11765|-----------------------
--    00020        23018     32983    850003081  ||       2755-4285        17863|-----------------------------------
--    00030        21473     52131   1275004403  ||       4286-5816        16199|--------------------------------
--    00040        20259     72523   1700011661  ||       5817-7347        14002|---------------------------
--    00050        19181     94093   2125019933  ||       7348-8878        11840|-----------------------
--    00060        18129    116871   2550015125  ||       8879-10409       10380|--------------------
--    00070        16920    141098   2975024745  ||      10410-11940        9000|------------------
--    00080        15112    167500   3400014835  ||      11941-13471        8524|-----------------
--    00090         9912    201008   3825018263  ||      13472-15002       11692|-----------------------
--    00100         1224    279873   4250013509  ||      15003-16533       20772|----------------------------------------
--    001.000x              279873   4250013509  ||      16534-18064       29574|---------------------------------------------------------
--                                               ||      18065-19595       32915|---------------------------------------------------------------
--                                               ||      19596-21126       27851|------------------------------------------------------
--                                               ||      21127-22657       20697|----------------------------------------
--                                               ||      22658-24188       14068|---------------------------
--                                               ||      24189-25719        9220|------------------
--                                               ||      25720-27250        6028|------------
--                                               ||      27251-28781        3624|-------
--                                               ||      28782-30312        2092|-----
--                                               ||      30313-31843        1032|--
--                                               ||      31844-33374         443|-
--                                               ||      33375-34905         213|-
--                                               ||      34906-36436          54|-
--                                               ||      36437-37967          16|-
--                                               ||      37968-39498           2|-
--                                               ||      39499-41029           2|-
--                                               ||      41030-42560           0|
--                                               ||      42561-44091           2|-
--                                               ||      44092-45622           1|-
--                                               ||      45623-47153           0|
--                                               ||      47154-48684           0|
--                                               ||      48685-50215           1|-
--                                               ||      50216-51746           0|
--                                               ||      51747-53277           0|
--                                               ||      53278-54808           0|
--                                               ||      54809-56339           0|
--                                               ||      56340-57870           0|
--                                               ||      57871-59401           0|
--                                               ||      59402-60932           0|
--                                               ||      60933-62463           1|-
--    
--
-- In sequence store './A3-55.seqStore':
--   Found 279873 reads.
--   Found 4250013509 bases (50 times coverage).
--    Histogram of corrected-trimmed reads:
--    
--    G=4250013509                       sum of  ||               length     num
--    NG         length     index       lengths  ||                range    seqs
--    ----- ------------ --------- ------------  ||  ------------------- -------
--    00010        25364     15319    425018859  ||       1224-2754        11765|-----------------------
--    00020        23018     32983    850003081  ||       2755-4285        17863|-----------------------------------
--    00030        21473     52131   1275004403  ||       4286-5816        16199|--------------------------------
--    00040        20259     72523   1700011661  ||       5817-7347        14002|---------------------------
--    00050        19181     94093   2125019933  ||       7348-8878        11840|-----------------------
--    00060        18129    116871   2550015125  ||       8879-10409       10380|--------------------
--    00070        16920    141098   2975024745  ||      10410-11940        9000|------------------
--    00080        15112    167500   3400014835  ||      11941-13471        8524|-----------------
--    00090         9912    201008   3825018263  ||      13472-15002       11692|-----------------------
--    00100         1224    279873   4250013509  ||      15003-16533       20772|----------------------------------------
--    001.000x              279873   4250013509  ||      16534-18064       29574|---------------------------------------------------------
--                                               ||      18065-19595       32915|---------------------------------------------------------------
--                                               ||      19596-21126       27851|------------------------------------------------------
--                                               ||      21127-22657       20697|----------------------------------------
--                                               ||      22658-24188       14068|---------------------------
--                                               ||      24189-25719        9220|------------------
--                                               ||      25720-27250        6028|------------
--                                               ||      27251-28781        3624|-------
--                                               ||      28782-30312        2092|-----
--                                               ||      30313-31843        1032|--
--                                               ||      31844-33374         443|-
--                                               ||      33375-34905         213|-
--                                               ||      34906-36436          54|-
--                                               ||      36437-37967          16|-
--                                               ||      37968-39498           2|-
--                                               ||      39499-41029           2|-
--                                               ||      41030-42560           0|
--                                               ||      42561-44091           2|-
--                                               ||      44092-45622           1|-
--                                               ||      45623-47153           0|
--                                               ||      47154-48684           0|
--                                               ||      48685-50215           1|-
--                                               ||      50216-51746           0|
--                                               ||      51747-53277           0|
--                                               ||      53278-54808           0|
--                                               ||      54809-56339           0|
--                                               ||      56340-57870           0|
--                                               ||      57871-59401           0|
--                                               ||      59402-60932           0|
--                                               ||      60933-62463           1|-
--    
--
-- Correction skipped; not enabled.
--
-- Trimming skipped; not enabled.
--
-- BEGIN ASSEMBLY
----------------------------------------
-- Starting command on Thu Jan 15 23:40:02 2026 with 4568789.109 GB free disk space

    cd unitigging/0-mercounts
    ./meryl-configure.sh \
    > ./meryl-configure.err 2>&1

-- Finished on Thu Jan 15 23:40:03 2026 (one second) with 4568789.109 GB free disk space
----------------------------------------
--  segments   memory batches
--  -------- -------- -------
--        01 10.81 GB       2
--        02  5.75 GB       2
--        04  2.97 GB       2
--        06  2.14 GB       2
--        08  1.61 GB       2
--        12  1.07 GB       2
--        16  0.81 GB       2
--        20  0.65 GB       2
--        24  0.54 GB       2
--        32  0.41 GB       2
--        40  0.32 GB       2
--        48  -.-- GB       -  (segment size too small)
--        56  -.-- GB       -  (segment size too small)
--        64  -.-- GB       -  (segment size too small)
--        96  -.-- GB       -  (segment size too small)
--
--  For 279873 reads with 4250013509 bases, limit to 42 batches.
--  Will count kmers using 01 jobs, each using 12 GB and 4 threads.
--
-- Finished stage 'merylConfigure', reset canuIteration.
--
-- Running jobs.  First attempt out of 2.
----------------------------------------
-- Starting 'meryl' concurrent execution on Thu Jan 15 23:40:03 2026 with 4568789.078 GB free disk space (1 processes; 22 concurrently)

    cd unitigging/0-mercounts
    ./meryl-count.sh 1 > ./meryl-count.000001.out 2>&1

-- Finished on Thu Jan 15 23:43:25 2026 (202 seconds) with 4567810.718 GB free disk space
----------------------------------------
-- Found 1 Kmer counting (meryl) outputs.
-- Finished stage 'utg-merylCountCheck', reset canuIteration.
--
-- Running jobs.  First attempt out of 2.
----------------------------------------
-- Starting 'meryl' concurrent execution on Thu Jan 15 23:43:25 2026 with 4567810.687 GB free disk space (1 processes; 22 concurrently)

    cd unitigging/0-mercounts
    ./meryl-process.sh 1 > ./meryl-process.000001.out 2>&1

-- Finished on Thu Jan 15 23:43:31 2026 (6 seconds) with 4567813.312 GB free disk space
----------------------------------------
-- Meryl finished successfully.  Kmer frequency histogram:
--
-- WARNING: gnuplot failed.
--
----------------------------------------
--
--  22-mers                                                                                           Fraction
--    Occurrences   NumMers                                                                         Unique Total
--       1-     1         0                                                                        0.0000 0.0000
--       2-     2    201530                                                                        0.0045 0.0001
--       3-     4     68373                                                                        0.0056 0.0002
--       5-     7     18216                                                                        0.0062 0.0002
--       8-    11      5979                                                                        0.0065 0.0002
--      12-    16     13909                                                                        0.0066 0.0003
--      17-    22    123852                                                                        0.0070 0.0004
--      23-    29    767567 ***                                                                    0.0105 0.0014
--      30-    37   5443028 ***********************                                                0.0332 0.0103
--      38-    46  16301519 ********************************************************************** 0.1770 0.0816
--      47-    56  13787890 ***********************************************************            0.5521 0.3084
--      57-    67   3434896 **************                                                         0.8314 0.5103
--      68-    79    613130 **                                                                     0.8941 0.5639
--      80-    92    982396 ****                                                                   0.9077 0.5781
--      93-   106    820482 ***                                                                    0.9298 0.6051
--     107-   121    346806 *                                                                      0.9471 0.6292
--     122-   137    282485 *                                                                      0.9544 0.6409
--     138-   154    254947 *                                                                      0.9608 0.6526
--     155-   172    173274                                                                        0.9662 0.6637
--     173-   191    164162                                                                        0.9701 0.6726
--     192-   211    126645                                                                        0.9737 0.6817
--     212-   232    108487                                                                        0.9765 0.6896
--     233-   254     99628                                                                        0.9788 0.6971
--     255-   277     88436                                                                        0.9810 0.7046
--     278-   301     78544                                                                        0.9830 0.7119
--     302-   326     63622                                                                        0.9847 0.7189
--     327-   352     54115                                                                        0.9861 0.7251
--     353-   379     45535                                                                        0.9873 0.7308
--     380-   407     45577                                                                        0.9883 0.7360
--     408-   436     36818                                                                        0.9893 0.7415
--     437-   466     36839                                                                        0.9902 0.7463
--     467-   497     25806                                                                        0.9910 0.7515
--     498-   529     24687                                                                        0.9915 0.7553
--     530-   562     21941                                                                        0.9921 0.7592
--     563-   596     19835                                                                        0.9926 0.7629
--     597-   631     16506                                                                        0.9930 0.7665
--     632-   667     16464                                                                        0.9934 0.7697
--     668-   704     14612                                                                        0.9937 0.7730
--     705-   742     14275                                                                        0.9941 0.7761
--     743-   781     12121                                                                        0.9944 0.7793
--     782-   821     12488                                                                        0.9946 0.7821
--
--           0 (max occurrences)
--  3213749301 (total mers, non-unique)
--    44996162 (distinct mers, non-unique)
--           0 (unique mers)
-- Finished stage 'meryl-process', reset canuIteration.
--
-- Removing meryl database 'unitigging/0-mercounts/A3-55.ms22'.
--
-- OVERLAPPER (normal) (assembly) erate=0.01
--
----------------------------------------
-- Starting command on Thu Jan 15 23:43:31 2026 with 4567813.296 GB free disk space

    cd unitigging/1-overlapper
    /share/org/YZWL/yzwl_lixg/miniforge3/envs/canu_v.2.3/bin/overlapInCorePartition \
     -S  ../../A3-55.seqStore \
     -hl 160000000 \
     -rl 5000000000 \
     -ol 500 \
     -o  ./A3-55.partition \
    > ./A3-55.partition.err 2>&1

-- Finished on Thu Jan 15 23:43:31 2026 (fast as lightning) with 4567813.281 GB free disk space
----------------------------------------
--
-- Configured 21 overlapInCore jobs.
-- Finished stage 'utg-overlapConfigure', reset canuIteration.
--
-- Running jobs.  First attempt out of 2.
----------------------------------------
-- Starting 'utgovl' concurrent execution on Thu Jan 15 23:43:31 2026 with 4567813.25 GB free disk space (21 processes; 11 concurrently)

    cd unitigging/1-overlapper
    ./overlap.sh 1 > ./overlap.000001.out 2>&1
    ./overlap.sh 2 > ./overlap.000002.out 2>&1
    ./overlap.sh 3 > ./overlap.000003.out 2>&1
    ./overlap.sh 4 > ./overlap.000004.out 2>&1
    ./overlap.sh 5 > ./overlap.000005.out 2>&1
    ./overlap.sh 6 > ./overlap.000006.out 2>&1
    ./overlap.sh 7 > ./overlap.000007.out 2>&1
    ./overlap.sh 8 > ./overlap.000008.out 2>&1
    ./overlap.sh 9 > ./overlap.000009.out 2>&1
    ./overlap.sh 10 > ./overlap.000010.out 2>&1
    ./overlap.sh 11 > ./overlap.000011.out 2>&1
    ./overlap.sh 12 > ./overlap.000012.out 2>&1
    ./overlap.sh 13 > ./overlap.000013.out 2>&1
    ./overlap.sh 14 > ./overlap.000014.out 2>&1
    ./overlap.sh 15 > ./overlap.000015.out 2>&1
    ./overlap.sh 16 > ./overlap.000016.out 2>&1
    ./overlap.sh 17 > ./overlap.000017.out 2>&1
    ./overlap.sh 18 > ./overlap.000018.out 2>&1
    ./overlap.sh 19 > ./overlap.000019.out 2>&1
    ./overlap.sh 20 > ./overlap.000020.out 2>&1
    ./overlap.sh 21 > ./overlap.000021.out 2>&1

-- Finished on Fri Jan 16 00:11:15 2026 (1664 seconds) with 4565636.515 GB free disk space
----------------------------------------
-- Found 21 overlapInCore output files.
--
-- overlapInCore compute 'unitigging/1-overlapper':
--   kmer hits
--     with no overlap       1337292117    63680577 +- 39661749.379
--     with an overlap         40211622  9.14285714 +- 1112892.363
--
--   overlaps                  40211622  9.14285714 +- 1112892.363
--     contained                9800649  .571428571 +- 264455.875
--     dovetail                30410973  1.57142857 +- 851974.554
--
--   overlaps rejected
--     multiple per pair              0           0 +- 0
--     bad short window               0           0 +- 0
--     bad long window                0           0 +- 0
-- Finished stage 'utg-overlapCheck', reset canuIteration.
----------------------------------------
-- Starting command on Fri Jan 16 00:11:16 2026 with 4565636.5 GB free disk space

    cd unitigging
    /share/org/YZWL/yzwl_lixg/miniforge3/envs/canu_v.2.3/bin/ovStoreConfig \
     -S ../A3-55.seqStore \
     -M 4-8 \
     -L ./1-overlapper/ovljob.files \
     -create ./A3-55.ovlStore.config \
     > ./A3-55.ovlStore.config.txt \
    2> ./A3-55.ovlStore.config.err

-- Finished on Fri Jan 16 00:11:16 2026 (like a bat out of hell) with 4565636.484 GB free disk space
----------------------------------------
--
-- Creating overlap store unitigging/A3-55.ovlStore using:
--      1 bucket
--      1 slice
--        using at most 3 GB memory each
--
-- Running jobs.  First attempt out of 2.
----------------------------------------
-- Starting 'ovS' concurrent execution on Fri Jan 16 00:11:16 2026 with 4565636.468 GB free disk space (1 processes; 62 concurrently)

    cd unitigging
    ./A3-55.ovlStore.sh 1 > ./A3-55.ovlStore.000001.out 2>&1

-- Finished on Fri Jan 16 00:11:33 2026 (17 seconds) with 4565624.343 GB free disk space
----------------------------------------
-- Checking store.
----------------------------------------
-- Starting command on Fri Jan 16 00:11:33 2026 with 4565624.343 GB free disk space

    cd unitigging
    /share/org/YZWL/yzwl_lixg/miniforge3/envs/canu_v.2.3/bin/ovStoreDump \
     -S ../A3-55.seqStore \
     -O  ./A3-55.ovlStore \
     -counts \
     > ./A3-55.ovlStore/counts.dat 2> ./A3-55.ovlStore/counts.err

-- Finished on Fri Jan 16 00:11:34 2026 (one second) with 4565624.312 GB free disk space
----------------------------------------
--
-- Overlap store 'unitigging/A3-55.ovlStore' successfully constructed.
-- Found 80423244 overlaps for 272521 reads; 1377041 reads have no overlaps.
--
--
-- Purged 0.801 GB in 63 overlap output files.
----------------------------------------
-- Starting command on Fri Jan 16 00:11:34 2026 with 4565625.281 GB free disk space

    cd unitigging
    /share/org/YZWL/yzwl_lixg/miniforge3/envs/canu_v.2.3/bin/ovStoreStats \
     -C 50 \
     -S ../A3-55.seqStore \
     -O  ./A3-55.ovlStore \
     -o  ./A3-55.ovlStore \
     > ./A3-55.ovlStore.summary.err 2>&1

-- Finished on Fri Jan 16 00:11:46 2026 (12 seconds) with 4565625.25 GB free disk space
----------------------------------------
--
-- Overlap store 'unitigging/A3-55.ovlStore' contains:
--
--   category            reads     %          read length        feature size or coverage  analysis
--   ----------------  -------  -------  ----------------------  ------------------------  --------------------
--   middle-missing        150    0.05    14672.44 +- 6785.97       1082.47 +- 1829.71    (bad trimming)
--   middle-hump            16    0.01    16005.69 +- 2867.81       6526.62 +- 4331.74    (bad trimming)
--   no-5-prime            542    0.19    13184.16 +- 4845.27       1858.21 +- 2905.18    (bad trimming)
--   no-3-prime            698    0.25    11354.99 +- 6025.59       1654.93 +- 2877.30    (bad trimming)
--   
--   low-coverage         1430    0.51    10511.49 +- 5487.48          5.88 +- 3.69       (easy to assemble, potential for lower quality consensus)
--   unique             224955   80.38    11626.58 +- 5573.17         45.55 +- 8.42       (easy to assemble, perfect, yay)
--   repeat-cont         20064    7.17     9643.80 +- 4843.35       1561.30 +- 1229.43    (potential for consensus errors, no impact on assembly)
--   repeat-dove           208    0.07    20068.72 +- 2181.21        771.27 +- 958.99     (hard to assemble, likely won't assemble correctly or even at all)
--   
--   span-repeat          2686    0.96    12955.49 +- 5000.84       3056.35 +- 3600.79    (read spans a large repeat, usually easy to assemble)
--   uniq-repeat-cont    14637    5.23    11876.10 +- 4575.32                             (should be uniquely placed, low potential for consensus errors, no impact on assembly)
--   uniq-repeat-dove     2717    0.97    18423.53 +- 2985.19                             (will end contigs, potential to misassemble)
--   uniq-anchor          4418    1.58    13007.68 +- 4461.56       7422.43 +- 4783.57    (repeat read, with unique section, probable bad read)
-- Finished stage 'utg-createOverlapStore', reset canuIteration.
--
-- Loading read lengths.
-- Loading number of overlaps per read.
--
-- Configure RED for 16gb memory.
--                   Batches of at most (unlimited) reads.
--                                      500000000 bases.
--                   Expecting evidence of at most 536870912 bases per iteration.
--
--           Total                                               Reads                 Olaps Evidence
--    Job   Memory      Read Range         Reads        Bases   Memory        Olaps   Memory   Memory  (Memory in MB)
--   ---- -------- ------------------- --------- ------------ -------- ------------ -------- --------
--      1 16384.92         1-37450          6308    108963665 13301.43      1004061    11.49  1024.00
--      2 16384.37     37451-75250          6427    108787101 13279.88      2838945    32.49  1024.00
--      3 16386.06     75251-121780         7856    108970335 13302.29      1028868    11.77  1024.00
--      4 16385.82    121781-169230         8121    108834208 13285.68      2458397    28.13  1024.00
--      5 16384.37    169231-206964         6387    108795481 13280.90      2750324    31.47  1024.00
--      6 16384.79    206965-254826         7984    108944793 13299.18      1189342    13.61  1024.00
--      7 16387.04    254827-302049         7988    108833732 13285.62      2571068    29.42  1024.00
--      8 16385.60    302050-339317         6341    108826438 13284.68      2527405    28.92  1024.00
--      9 16385.76    339318-385224         7801    108954166 13300.31      1174939    13.45  1024.00
--     10 16384.72    385225-431155         7868    108847463 13287.29      2221955    25.43  1024.00
--     11 16384.29    431156-468310         6261    108813492 13283.09      2551439    29.20  1024.00
--     12 16385.34    468311-512559         7685    108960324 13301.06      1072681    12.28  1024.00
--     13 16385.34    512560-558093         7764    108845245 13287.02      2300123    26.32  1024.00
--     14 16385.74    558094-594850         6266    108805271 13282.09      2765495    31.65  1024.00
--     15 16384.19    594851-640723         7683    108948147 13299.58      1101900    12.61  1024.00
--     16 16385.87    640724-686163         7598    108783354 13279.46      3006876    34.41  1024.00
--     17 16385.54    686164-723074         6332    108849347 13287.47      2278167    26.07  1024.00
--     18 16384.80    723075-769169         7858    108946975 13299.44      1167240    13.36  1024.00
--     19 16384.33    769170-813579         7504    108781818 13279.27      2888710    33.06  1024.00
--     20 16384.56    813580-850066         6205    108854006 13288.04      2142983    24.52  1024.00
--     21 16384.49    850067-895437         7725    108951245 13299.96      1095134    12.53  1024.00
--     22 16386.82    895438-936275         7056    108789686 13280.21      3024002    34.61  1024.00
--     23 16384.47    936276-973501         6245    108852258 13287.83      2153162    24.64  1024.00
--     24 16384.86    973502-1020671        7938    108946314 13299.36      1179404    13.50  1024.00
--     25 16386.23   1020672-1061015        6787    108819809 13283.88      2651698    30.35  1024.00
--     26 16385.84   1061016-1098244        6277    108858786 13288.62      2203245    25.21  1024.00
--     27 16385.17   1098245-1146118        8222    108937347 13298.27      1301697    14.90  1024.00
--     28 16384.19   1146119-1185520        6732    108808263 13282.47      2596672    29.72  1024.00
--     29 16384.88   1185521-1221954        6224    108838809 13286.18      2332511    26.69  1024.00
--     30 16384.60   1221955-1269774        8177    108932891 13297.73      1299673    14.87  1024.00
--     31 16387.08   1269775-1309211        6567    108827355 13284.80      2646441    30.29  1024.00
--     32 16384.28   1309212-1346582        6306    108843142 13286.71      2234240    25.57  1024.00
--     33 16384.06   1346583-1396624        8407    108818705 13283.80      2469381    28.26  1024.00
--     34 16385.26   1396625-1433350        6345    108918476 13295.91      1515861    17.35  1024.00
--     35 16384.33   1433351-1471055        6362    108857011 13288.41      2090203    23.92  1024.00
--     36 16385.02   1471056-1522226        8663    108817092 13283.61      2569878    29.41  1024.00
--     37 16384.97   1522227-1558557        6308    108917647 13295.81      1499504    17.16  1024.00
--     38 16384.43   1558558-1596164        6370    108870531 13290.06      1954807    22.37  1024.00
--     39 16385.95   1596165-1647607        8591    108831634 13285.38      2496582    28.57  1024.00
--     40  3589.29   1647608-1649562         334      4231147   516.51        68231     0.78  1024.00
--   ---- -------- ------------------- --------- ------------ -------- ------------ -------- --------
--                                                 4250013509              80423244
-- Finished stage 'readErrorDetectionConfigure', reset canuIteration.
--
-- Running jobs.  First attempt out of 2.
----------------------------------------
-- Starting 'red' concurrent execution on Fri Jan 16 00:11:52 2026 with 4565465.593 GB free disk space (40 processes; 22 concurrently)

    cd unitigging/3-overlapErrorAdjustment
    ./red.sh 1 > ./red.000001.out 2>&1
    ./red.sh 2 > ./red.000002.out 2>&1
    ./red.sh 3 > ./red.000003.out 2>&1
    ./red.sh 4 > ./red.000004.out 2>&1
    ./red.sh 5 > ./red.000005.out 2>&1
    ./red.sh 6 > ./red.000006.out 2>&1
    ./red.sh 7 > ./red.000007.out 2>&1
    ./red.sh 8 > ./red.000008.out 2>&1
    ./red.sh 9 > ./red.000009.out 2>&1
    ./red.sh 10 > ./red.000010.out 2>&1
    ./red.sh 11 > ./red.000011.out 2>&1
    ./red.sh 12 > ./red.000012.out 2>&1
    ./red.sh 13 > ./red.000013.out 2>&1
    ./red.sh 14 > ./red.000014.out 2>&1
    ./red.sh 15 > ./red.000015.out 2>&1
    ./red.sh 16 > ./red.000016.out 2>&1
    ./red.sh 17 > ./red.000017.out 2>&1
    ./red.sh 18 > ./red.000018.out 2>&1
    ./red.sh 19 > ./red.000019.out 2>&1
    ./red.sh 20 > ./red.000020.out 2>&1
    ./red.sh 21 > ./red.000021.out 2>&1
    ./red.sh 22 > ./red.000022.out 2>&1
    ./red.sh 23 > ./red.000023.out 2>&1
    ./red.sh 24 > ./red.000024.out 2>&1
    ./red.sh 25 > ./red.000025.out 2>&1
    ./red.sh 26 > ./red.000026.out 2>&1
    ./red.sh 27 > ./red.000027.out 2>&1
    ./red.sh 28 > ./red.000028.out 2>&1
    ./red.sh 29 > ./red.000029.out 2>&1
    ./red.sh 30 > ./red.000030.out 2>&1
    ./red.sh 31 > ./red.000031.out 2>&1
    ./red.sh 32 > ./red.000032.out 2>&1
    ./red.sh 33 > ./red.000033.out 2>&1
    ./red.sh 34 > ./red.000034.out 2>&1
    ./red.sh 35 > ./red.000035.out 2>&1
    ./red.sh 36 > ./red.000036.out 2>&1
    ./red.sh 37 > ./red.000037.out 2>&1
    ./red.sh 38 > ./red.000038.out 2>&1
    ./red.sh 39 > ./red.000039.out 2>&1
    ./red.sh 40 > ./red.000040.out 2>&1

-- Finished on Fri Jan 16 00:22:49 2026 (657 seconds) with 4564543.375 GB free disk space
----------------------------------------
-- Found 40 read error detection output files.
-- Finished stage 'readErrorDetectionCheck', reset canuIteration.
--
-- Loading read lengths.
-- Loading number of overlaps per read.
--
-- Configure OEA for 8gb memory.
--                   Batches of at most (unlimited) reads.
--                                      300000000 bases.
--
--           Total                                               Reads                 Olaps  Adjusts
--    Job   Memory      Read Range         Reads        Bases   Memory        Olaps   Memory   Memory  (Memory in MB)
--   ---- -------- ------------------- --------- ------------ -------- ------------ -------- --------
--      1  2847.35         1-107703        18260    300022987   294.68      4563180   139.26   365.41
--      2  2893.83    107704-228769        20480    300005901   294.73      6084743   185.69   365.41
--      3  2892.56    228770-350000        20494    300009556   294.74      6043007   184.42   365.41
--      4  2880.44    350001-469196        20254    300002885   294.72      5646249   172.31   365.41
--      5  2882.54    469197-586567        20146    300020141   294.74      5714701   174.40   365.41
--      6  2881.16    586568-705419        20002    300004927   294.72      5670013   173.04   365.41
--      7  2894.70    705420-823922        20154    300022460   294.74      6112843   186.55   365.41
--      8  2871.52    823923-938023        19506    300006917   294.70      5354576   163.41   365.41
--      9  2865.68    938024-1053706       19505    300000017   294.70      5163390   157.57   365.41
--     10  2889.93   1053707-1170377       19763    300006925   294.71      5957577   181.81   365.41
--     11  2892.28   1170378-1285215       19571    300002459   294.70      6035024   184.17   365.41
--     12  2896.90   1285216-1400772       19499    300008852   294.71      6186043   188.78   365.41
--     13  2840.70   1400773-1509755       18459    300021989   294.69      4345286   132.61   365.41
--     14  2878.01   1509756-1621454       19109    300012010   294.70      5567429   169.90   365.41
--     15  2529.51   1621455-1649562        4671     49865483    55.70      1979183    60.40   365.41
--   ---- -------- ------------------- --------- ------------ -------- ------------ -------- --------
--                                                 4250013509              80423244
-- Finished stage 'overlapErrorAdjustmentConfigure', reset canuIteration.
--
-- Running jobs.  First attempt out of 2.
----------------------------------------
-- Starting 'oea' concurrent execution on Fri Jan 16 00:22:56 2026 with 4564543.296 GB free disk space (15 processes; 62 concurrently)

    cd unitigging/3-overlapErrorAdjustment
    ./oea.sh 1 > ./oea.000001.out 2>&1
    ./oea.sh 2 > ./oea.000002.out 2>&1
    ./oea.sh 3 > ./oea.000003.out 2>&1
    ./oea.sh 4 > ./oea.000004.out 2>&1
    ./oea.sh 5 > ./oea.000005.out 2>&1
    ./oea.sh 6 > ./oea.000006.out 2>&1
    ./oea.sh 7 > ./oea.000007.out 2>&1
    ./oea.sh 8 > ./oea.000008.out 2>&1
    ./oea.sh 9 > ./oea.000009.out 2>&1
    ./oea.sh 10 > ./oea.000010.out 2>&1
    ./oea.sh 11 > ./oea.000011.out 2>&1
    ./oea.sh 12 > ./oea.000012.out 2>&1
    ./oea.sh 13 > ./oea.000013.out 2>&1
    ./oea.sh 14 > ./oea.000014.out 2>&1
    ./oea.sh 15 > ./oea.000015.out 2>&1

-- Finished on Fri Jan 16 00:50:10 2026 (1634 seconds) with 4560129.671 GB free disk space
----------------------------------------
-- Found 15 overlap error adjustment output files.
-- Finished stage 'overlapErrorAdjustmentCheck', reset canuIteration.
----------------------------------------
-- Starting command on Fri Jan 16 00:50:10 2026 with 4560129.656 GB free disk space

    cd unitigging/3-overlapErrorAdjustment
    /share/org/YZWL/yzwl_lixg/miniforge3/envs/canu_v.2.3/bin/loadErates \
      -S ../../A3-55.seqStore \
      -O ../A3-55.ovlStore \
      -L ./oea.files \
    > ./oea.apply.err 2>&1

-- Finished on Fri Jan 16 00:50:11 2026 (one second) with 4560129.484 GB free disk space
----------------------------------------
-- No report available.
-- Finished stage 'updateOverlapStore', reset canuIteration.
-- Finished stage 'unitig', reset canuIteration.
--
-- Running jobs.  First attempt out of 2.
----------------------------------------
-- Starting 'bat' concurrent execution on Fri Jan 16 00:50:11 2026 with 4560129.437 GB free disk space (1 processes; 1 concurrently)

    cd unitigging/4-unitigger
    ./unitigger.sh 1 > ./unitigger.000001.out 2>&1

-- Finished on Fri Jan 16 00:50:34 2026 (23 seconds) with 4560032.171 GB free disk space
----------------------------------------
-- Unitigger finished successfully.
--  
--  ERROR RATES
--  -----------
--                                                   --------threshold------
--  302939                       fraction error      fraction        percent
--  samples                              (1e-5)         error          error
--                   --------------------------      --------       --------
--  command line (-eg)                           ->     30.00        0.0300%
--  command line (-ef)                           ->  -----.--      ---.----%
--  command line (-eM)                           ->     30.00        0.0300%
--  mean + std.dev       0.30 +-  12 *     2.51  ->     30.43        0.0304%
--  median + mad         0.00 +-  12 *     0.00  ->      0.00        0.0000%
--  90th percentile                              ->      1.00        0.0010%  (enabled)
--  
--  BEST EDGE FILTERING
--  -------------------
--  At graph threshold 0.0300%, reads:
--    available to have edges:        44297
--    with at least one edge:         35418
--  
--  At max threshold 0.0300%, reads:
--    available to have edges:        44297
--    with at least one edge:         35418
--  
--  At tight threshold 0.0010%, reads with:
--    both edges below error threshold:     31564  (80.00% minReadsBest threshold = 28334)
--    one  edge  above error threshold:      2862
--    both edges above error threshold:       992
--    at least one edge:                    35418
--  
--  At loose threshold 0.0300%, reads with:
--    both edges below error threshold:     35418  (80.00% minReadsBest threshold = 28334)
--    one  edge  above error threshold:         0
--    both edges above error threshold:         0
--    at least one edge:                    35418
--  
--  
--  INITIAL EDGES
--  -------- ----------------------------------------
--    230641 reads are contained
--   1388337 reads have no best edges (singleton)
--       307 reads have only one best edge (spur) 
--                156 are mutual best
--     30277 reads have two best edges 
--                746 have one mutual best edge
--              29172 have two mutual best edges
--  
--  
--  FINAL EDGES
--  -------- ----------------------------------------
--    230641 reads are contained
--   1388691 reads have no best edges (singleton)
--       182 reads have only one best edge (spur) 
--                162 are mutual best
--     30048 reads have two best edges 
--                612 have one mutual best edge
--              29172 have two mutual best edges
--  
--  
--  EDGE FILTERING
--  -------- ------------------------------------------
--         0 reads are ignored
--      9658 reads have a gap in overlap coverage
--       172 reads have lopsided best edges
-- Found, in version 1, after unitig construction:
--   contigs:      75 sequences, total length 68373491 bp (including 78 repeats of total length 1885135 bp).
--   bubbles:      129 sequences, total length 3354735 bp.
--   unassembled:  18828 sequences, total length 211262557 bp.
--
-- Contig sizes based on genome size 85mbp:
--
--            NG (bp)  LG (contigs)    sum (bp)
--         ----------  ------------  ----------
--     10     8819273             1     8819273
--     20     6508179             3    21844026
--     30     6192883             4    28036909
--     40     6156773             5    34193682
--     50     3430999             8    45280302
--     60     3254764            10    51912534
--     70     2767615            13    60614147
--     80       20713            53    68013507
--
-- Finished stage 'unitigCheck', reset canuIteration.
----------------------------------------
-- Starting command on Fri Jan 16 00:50:34 2026 with 4560032.156 GB free disk space

    cd unitigging
    /share/org/YZWL/yzwl_lixg/miniforge3/envs/canu_v.2.3/bin/utgcns \
      -S ../A3-55.seqStore \
      -T  ./A3-55.ctgStore 1 \
      -partition 0.8 1.5 0.1 \
    > ./A3-55.ctgStore/partitioning.log 2>&1

-- Finished on Fri Jan 16 00:50:43 2026 (9 seconds) with 4560030.843 GB free disk space
----------------------------------------
-- Using slow alignment for consensus (iteration '0').
-- Configured 10 consensus jobs.
-- Finished stage 'consensusConfigure', reset canuIteration.
--
-- Local: cns       13.000 GB    8 CPUs x  11 jobs   143.000 GB  88 CPUs  (consensus)
--
--
-- Running jobs.  First attempt out of 2.
----------------------------------------
-- Starting 'cns' concurrent execution on Fri Jan 16 00:50:44 2026 with 4560030.812 GB free disk space (10 processes; 11 concurrently)

    cd unitigging/5-consensus
    ./consensus.sh 1 > ./consensus.000001.out 2>&1
    ./consensus.sh 2 > ./consensus.000002.out 2>&1
    ./consensus.sh 3 > ./consensus.000003.out 2>&1
    ./consensus.sh 4 > ./consensus.000004.out 2>&1
    ./consensus.sh 5 > ./consensus.000005.out 2>&1
    ./consensus.sh 6 > ./consensus.000006.out 2>&1
    ./consensus.sh 7 > ./consensus.000007.out 2>&1
    ./consensus.sh 8 > ./consensus.000008.out 2>&1
    ./consensus.sh 9 > ./consensus.000009.out 2>&1
    ./consensus.sh 10 > ./consensus.000010.out 2>&1

-- Finished on Fri Jan 16 00:58:39 2026 (475 seconds) with 4558667.906 GB free disk space
----------------------------------------
-- Using slow alignment for consensus (iteration '1').
-- Configured 10 consensus jobs.
-- All 10 consensus jobs finished successfully.
-- Finished stage 'consensusCheck', reset canuIteration.
-- Using slow alignment for consensus (iteration '0').
-- Configured 10 consensus jobs.
----------------------------------------
-- Starting command on Fri Jan 16 00:58:39 2026 with 4558667.859 GB free disk space

    cd unitigging
    /share/org/YZWL/yzwl_lixg/miniforge3/envs/canu_v.2.3/bin/tgStoreLoad \
      -S ../A3-55.seqStore \
      -T  ./A3-55.ctgStore 2 \
      -L ./5-consensus/ctgcns.files \
    > ./5-consensus/ctgcns.files.ctgStoreLoad.err 2>&1

-- Finished on Fri Jan 16 00:58:41 2026 (2 seconds) with 4558667.062 GB free disk space
----------------------------------------
----------------------------------------
-- Starting command on Fri Jan 16 00:58:41 2026 with 4558667.062 GB free disk space

    cd unitigging
    /share/org/YZWL/yzwl_lixg/miniforge3/envs/canu_v.2.3/bin/tgTigDisplay \
      -S ../A3-55.seqStore \
      -b \
      -o ../A3-55.contigs.unsorted.bam \
      -L ./5-consensus/ctgcns.files \
    > ./5-consensus/ctgcns.files.contigs.bam.err 2>&1

-- Finished on Fri Jan 16 01:01:27 2026 (166 seconds) with 4558232.734 GB free disk space
----------------------------------------
----------------------------------------
-- Starting command on Fri Jan 16 01:01:27 2026 with 4558232.734 GB free disk space

    cd .
    samtools sort \
      --write-index \
      --threads 2 \
      -o ./A3-55.contigs.bam ./A3-55.contigs.unsorted.bam \
    > ./ctgcns.bam.err 2>&1

-- Finished on Fri Jan 16 01:02:52 2026 (85 seconds) with 4558275.203 GB free disk space
----------------------------------------
-- Purging consensus output after loading to ctgStore.
-- Purged 10 .cns outputs.
----------------------------------------
-- Starting command on Fri Jan 16 01:02:52 2026 with 4558277.062 GB free disk space

    cd unitigging
    /share/org/YZWL/yzwl_lixg/miniforge3/envs/canu_v.2.3/bin/tgStoreDump \
      -S ../A3-55.seqStore \
      -T ./A3-55.ctgStore 2 \
      -sizes -s 85000000 \
    > ./A3-55.ctgStore/seqDB.v002.sizes.txt
ZERO length suplied to intervalList::add(), ignoring interval.
ZERO length suplied to intervalList::add(), ignoring interval.
ZERO length suplied to intervalList::add(), ignoring interval.
ZERO length suplied to intervalList::add(), ignoring interval.
ZERO length suplied to intervalList::add(), ignoring interval.
ZERO length suplied to intervalList::add(), ignoring interval.

-- Finished on Fri Jan 16 01:02:52 2026 (lickety-split) with 4558277.062 GB free disk space
----------------------------------------
-- Found, in version 2, after consensus generation:
--   contigs:      75 sequences, total length 89175182 bp (including 78 repeats of total length 2587636 bp).
--   bubbles:      129 sequences, total length 4499554 bp.
--   unassembled:  18828 sequences, total length 290003514 bp.
--
-- Contig sizes based on genome size 85mbp:
--
--            NG (bp)  LG (contigs)    sum (bp)
--         ----------  ------------  ----------
--     10    11461619             1    11461619
--     20     8461793             2    19923412
--     30     8461493             3    28384905
--     40     8070931             4    36455836
--     50     7988829             5    44444665
--     60     4632220             7    54432469
--     70     4408504             9    63303237
--     80     3882154            11    71427381
--     90     3611587            13    78892540
--    100     1226383            17    85634113
--
-- Finished stage 'consensusLoad', reset canuIteration.
----------------------------------------
-- Starting command on Fri Jan 16 01:02:52 2026 with 4558277.046 GB free disk space

    cd .
    /share/org/YZWL/yzwl_lixg/miniforge3/envs/canu_v.2.3/bin/tgStoreDump \
      -S ./A3-55.seqStore \
      -T ./unitigging/A3-55.ctgStore 2 \
      -o ./A3-55.contigs \
      -layout \
    > ./A3-55.contigs.layout.err 2>&1

-- Finished on Fri Jan 16 01:02:53 2026 (one second) with 4558277.015 GB free disk space
----------------------------------------
----------------------------------------
-- Starting command on Fri Jan 16 01:02:53 2026 with 4558277.015 GB free disk space

    cd .
    /share/org/YZWL/yzwl_lixg/miniforge3/envs/canu_v.2.3/bin/tgStoreDump \
      -S ./A3-55.seqStore \
      -T ./unitigging/A3-55.ctgStore 2 \
      -consensus -fasta \
      -unassembled \
    > ./A3-55.unassembled.fasta
    2> ./A3-55.unassembled.err
ZERO length suplied to intervalList::add(), ignoring interval.
ZERO length suplied to intervalList::add(), ignoring interval.
ZERO length suplied to intervalList::add(), ignoring interval.
ZERO length suplied to intervalList::add(), ignoring interval.
ZERO length suplied to intervalList::add(), ignoring interval.
ZERO length suplied to intervalList::add(), ignoring interval.

-- Finished on Fri Jan 16 01:02:54 2026 (one second) with 4558276.734 GB free disk space
----------------------------------------
----------------------------------------
-- Starting command on Fri Jan 16 01:02:54 2026 with 4558276.734 GB free disk space

    cd .
    /share/org/YZWL/yzwl_lixg/miniforge3/envs/canu_v.2.3/bin/tgStoreDump \
      -S ./A3-55.seqStore \
      -T ./unitigging/A3-55.ctgStore 2 \
      -consensus -fasta \
      -contigs \
    > ./A3-55.contigs.fasta
    2> ./A3-55.contigs.err
ZERO length suplied to intervalList::add(), ignoring interval.
ZERO length suplied to intervalList::add(), ignoring interval.
ZERO length suplied to intervalList::add(), ignoring interval.
ZERO length suplied to intervalList::add(), ignoring interval.
ZERO length suplied to intervalList::add(), ignoring interval.
ZERO length suplied to intervalList::add(), ignoring interval.

-- Finished on Fri Jan 16 01:02:55 2026 (one second) with 4558276.625 GB free disk space
----------------------------------------
-- Finished stage 'generateOutputs', reset canuIteration.
--
-- Assembly 'A3-55' finished in '/share/org/YZWL/yzwl_lixg/project/28.大豆疫霉菌三代基因组/03.hicanu/A3-55/01.raw_output'.
--
-- Summary saved in 'A3-55.report'.
--
-- Sequences saved:
--   Contigs       -> 'A3-55.contigs.fasta'
--   Unassembled   -> 'A3-55.unassembled.fasta'
--
-- Read layouts saved:
--   Contigs       -> 'A3-55.contigs.layout'.
--
-- Bye.

2026-01-16 01:02:55.590 - WARNING - 输出文件不存在|Output file does not exist: /share/org/YZWL/yzwl_lixg/project/28.大豆疫霉菌三代基因组/03.hicanu/A3-55/01.raw_output/A3-55.unitigs.fasta
Usage: biopytools ragtag [OPTIONS]
Try 'biopytools ragtag -h' for help.

Error: Invalid value for '-r' / '--reference': 文件不存在|File does not exist: /share/org/YZWL/yzwl_lixg/project/28.大豆疫霉菌三代基因组/04.ragtag/Psoja_T2T.fa
Usage: biopytools genomesyn [OPTIONS]
Try 'biopytools genomesyn -h' for help.

Error: Invalid value for '-i' / '--ref': Path '04.ragtag/A3-55/hicanu/A3-55_RagTag_scaffolded.fa' does not exist.
Job 68886807 stderr output:

