2026-01-15 19:51:45.684 - WARNING - 命令错误输出|Command stderr:
-- canu master +27 changes (r10515 2a41e933b8de6ed66723d75d36dd071b46d2c347)
--
-- CITATIONS
--
-- For assemblies of PacBio HiFi reads:
--   Nurk S, Walenz BP, Rhiea A, Vollger MR, Logsdon GA, Grothe R, Miga KH, Eichler EE, Phillippy AM, Koren S.
--   HiCanu: accurate assembly of segmental duplications, satellites, and allelic variants from high-fidelity long reads.
--   biorXiv. 2020.
--   https://doi.org/10.1101/2020.03.14.992248
-- 
-- Read and contig alignments during correction and consensus use:
--   Šošic M, Šikic M.
--   Edlib: a C/C ++ library for fast, exact sequence alignment using edit distance.
--   Bioinformatics. 2017 May 1;33(9):1394-1395.
--   http://doi.org/10.1093/bioinformatics/btw753
-- 
-- Overlaps are generated using:
--   Berlin K, et al.
--   Assembling large genomes with single-molecule sequencing and locality-sensitive hashing.
--   Nat Biotechnol. 2015 Jun;33(6):623-30.
--   http://doi.org/10.1038/nbt.3238
-- 
--   Myers EW, et al.
--   A Whole-Genome Assembly of Drosophila.
--   Science. 2000 Mar 24;287(5461):2196-204.
--   http://doi.org/10.1126/science.287.5461.2196
-- 
-- Contig consensus sequences are generated using an algorithm derived from pbdagcon:
--   Chin CS, et al.
--   Nonhybrid, finished microbial genome assemblies from long-read SMRT sequencing data.
--   Nat Methods. 2013 Jun;10(6):563-9
--   http://doi.org/10.1038/nmeth.2474
-- 
-- CONFIGURE CANU
--
-- Detected Java(TM) Runtime Environment '17.0.15-internal' (from '/share/org/YZWL/yzwl_lixg/.local/bin/java') without -d64 support.
--
-- WARNING:
-- WARNING:  Failed to run gnuplot using command 'gnuplot'.
-- WARNING:  Plots will be disabled.
-- WARNING:
--
-- Detected samtools version '1.22' / htslib version 'htscodecs=1.6.3' (from 'samtools').
--
-- Detected 88 CPUs and 503 gigabytes of memory on the local machine.
--
-- Detected Slurm with 'sinfo' binary in /opt/skyformai/bin/sinfo.
--          Slurm disabled by useGrid=false
--
-- Detected  '' with 'pbsnodes' binary in /opt/skyformai/bin/pbsnodes.
--           disabled by useGrid=false
--
-- Detected LSF with 'bsub' binary in /opt/skyformai/bin/bsub.
--          LSF disabled by useGrid=false
--
-- Local machine mode enabled; grid support not detected or not allowed.
--
-- Found trimmed raw PacBio HiFi reads in the input files.
--
--                                (tag)Concurrency
--                         (tag)Threads          |
--                (tag)Memory         |          |
--        (tag)             |         |          |       total usage      algorithm
--        -------  ----------  --------   --------  --------------------  -----------------------------
-- Local: meryl     12.000 GB    4 CPUs x  22 jobs   264.000 GB  88 CPUs  (k-mer counting)
-- Local: cormhap   13.000 GB   11 CPUs x   8 jobs   104.000 GB  88 CPUs  (overlap detection with mhap)
-- Local: obtovl     8.000 GB    8 CPUs x  11 jobs    88.000 GB  88 CPUs  (overlap detection)
-- Local: utgovl     8.000 GB    8 CPUs x  11 jobs    88.000 GB  88 CPUs  (overlap detection)
-- Local: cor        -.--- GB    4 CPUs x   - jobs     -.--- GB   - CPUs  (read correction)
-- Local: ovb        4.000 GB    1 CPU  x  88 jobs   352.000 GB  88 CPUs  (overlap store bucketizer)
-- Local: ovs        8.000 GB    1 CPU  x  62 jobs   496.000 GB  62 CPUs  (overlap store sorting)
-- Local: red       16.000 GB    4 CPUs x  22 jobs   352.000 GB  88 CPUs  (read error detection)
-- Local: oea        8.000 GB    1 CPU  x  62 jobs   496.000 GB  62 CPUs  (overlap error adjustment)
-- Local: bat       32.000 GB    8 CPUs x   1 job     32.000 GB   8 CPUs  (contig construction with bogart)
-- Local: cns        -.--- GB    8 CPUs x   - jobs     -.--- GB   - CPUs  (consensus)
--
-- Generating assembly 'A2-3' in '/share/org/YZWL/yzwl_lixg/project/28.大豆疫霉菌三代基因组/03.hicanu/A2-3/01.raw_output':
--   genomeSize:
--     85000000
--
--   Overlap Generation Limits:
--     corOvlErrorRate 0.0000 (  0.00%)
--     obtOvlErrorRate 0.0250 (  2.50%)
--     utgOvlErrorRate 0.0100 (  1.00%)
--
--   Overlap Processing Limits:
--     corErrorRate    0.0000 (  0.00%)
--     obtErrorRate    0.0250 (  2.50%)
--     utgErrorRate    0.0003 (  0.03%)
--     cnsErrorRate    0.0500 (  5.00%)
--
--   Stages to run:
--     assemble HiFi reads.
--
--
-- BEGIN STORE CREATION
----------------------------------------
-- Starting command on Thu Jan 15 18:39:23 2026 with 4583887.765 GB free disk space

    cd .
    ./A2-3.seqStore.sh \
    > ./A2-3.seqStore.err 2>&1

-- Finished on Thu Jan 15 18:46:08 2026 (405 seconds) with 4583018.656 GB free disk space
----------------------------------------
--
-- In sequence store './A2-3.seqStore':
--   Found 270990 reads.
--   Found 4250022748 bases (50 times coverage).
--    Histogram of corrected reads:
--    
--    G=4250022748                       sum of  ||               length     num
--    NG         length     index       lengths  ||                range    seqs
--    ----- ------------ --------- ------------  ||  ------------------- -------
--    00010        26085     15176    425026687  ||       1254-2424        11246|-------------------------------
--    00020        24190     32144    850008976  ||       2425-3595        15013|-----------------------------------------
--    00030        22846     50244   1275018678  ||       3596-4766        13676|--------------------------------------
--    00040        21730     69325   1700020594  ||       4767-5937        11378|--------------------------------
--    00050        20698     89366   2125023969  ||       5938-7108         9814|---------------------------
--    00060        19616    110448   2550030963  ||       7109-8279         8609|------------------------
--    00070        18322    132829   2975031073  ||       8280-9450         7520|---------------------
--    00080        16160    157311   3400031820  ||       9451-10621        6809|-------------------
--    00090        10194    189289   3825027050  ||      10622-11792        6303|------------------
--    00100         1254    270990   4250022748  ||      11793-12963        5574|----------------
--    001.000x              270990   4250022748  ||      12964-14134        5565|----------------
--                                               ||      14135-15305        6280|------------------
--                                               ||      15306-16476        8524|------------------------
--                                               ||      16477-17647       12477|-----------------------------------
--                                               ||      17648-18818       17463|------------------------------------------------
--                                               ||      18819-19989       21476|-----------------------------------------------------------
--                                               ||      19990-21160       23097|---------------------------------------------------------------
--                                               ||      21161-22331       21495|-----------------------------------------------------------
--                                               ||      22332-23502       18002|--------------------------------------------------
--                                               ||      23503-24673       13754|--------------------------------------
--                                               ||      24674-25844       10114|----------------------------
--                                               ||      25845-27015        6837|-------------------
--                                               ||      27016-28186        4404|-------------
--                                               ||      28187-29357        2751|--------
--                                               ||      29358-30528        1521|-----
--                                               ||      30529-31699         790|---
--                                               ||      31700-32870         323|-
--                                               ||      32871-34041         115|-
--                                               ||      34042-35212          37|-
--                                               ||      35213-36383           7|-
--                                               ||      36384-37554           1|-
--                                               ||      37555-38725           0|
--                                               ||      38726-39896           2|-
--                                               ||      39897-41067           3|-
--                                               ||      41068-42238           1|-
--                                               ||      42239-43409           1|-
--                                               ||      43410-44580           2|-
--                                               ||      44581-45751           2|-
--                                               ||      45752-46922           2|-
--                                               ||      46923-48093           2|-
--    
--
-- In sequence store './A2-3.seqStore':
--   Found 270990 reads.
--   Found 4250022748 bases (50 times coverage).
--    Histogram of corrected-trimmed reads:
--    
--    G=4250022748                       sum of  ||               length     num
--    NG         length     index       lengths  ||                range    seqs
--    ----- ------------ --------- ------------  ||  ------------------- -------
--    00010        26085     15176    425026687  ||       1254-2424        11246|-------------------------------
--    00020        24190     32144    850008976  ||       2425-3595        15013|-----------------------------------------
--    00030        22846     50244   1275018678  ||       3596-4766        13676|--------------------------------------
--    00040        21730     69325   1700020594  ||       4767-5937        11378|--------------------------------
--    00050        20698     89366   2125023969  ||       5938-7108         9814|---------------------------
--    00060        19616    110448   2550030963  ||       7109-8279         8609|------------------------
--    00070        18322    132829   2975031073  ||       8280-9450         7520|---------------------
--    00080        16160    157311   3400031820  ||       9451-10621        6809|-------------------
--    00090        10194    189289   3825027050  ||      10622-11792        6303|------------------
--    00100         1254    270990   4250022748  ||      11793-12963        5574|----------------
--    001.000x              270990   4250022748  ||      12964-14134        5565|----------------
--                                               ||      14135-15305        6280|------------------
--                                               ||      15306-16476        8524|------------------------
--                                               ||      16477-17647       12477|-----------------------------------
--                                               ||      17648-18818       17463|------------------------------------------------
--                                               ||      18819-19989       21476|-----------------------------------------------------------
--                                               ||      19990-21160       23097|---------------------------------------------------------------
--                                               ||      21161-22331       21495|-----------------------------------------------------------
--                                               ||      22332-23502       18002|--------------------------------------------------
--                                               ||      23503-24673       13754|--------------------------------------
--                                               ||      24674-25844       10114|----------------------------
--                                               ||      25845-27015        6837|-------------------
--                                               ||      27016-28186        4404|-------------
--                                               ||      28187-29357        2751|--------
--                                               ||      29358-30528        1521|-----
--                                               ||      30529-31699         790|---
--                                               ||      31700-32870         323|-
--                                               ||      32871-34041         115|-
--                                               ||      34042-35212          37|-
--                                               ||      35213-36383           7|-
--                                               ||      36384-37554           1|-
--                                               ||      37555-38725           0|
--                                               ||      38726-39896           2|-
--                                               ||      39897-41067           3|-
--                                               ||      41068-42238           1|-
--                                               ||      42239-43409           1|-
--                                               ||      43410-44580           2|-
--                                               ||      44581-45751           2|-
--                                               ||      45752-46922           2|-
--                                               ||      46923-48093           2|-
--    
--
-- Correction skipped; not enabled.
--
-- Trimming skipped; not enabled.
--
-- BEGIN ASSEMBLY
----------------------------------------
-- Starting command on Thu Jan 15 18:46:08 2026 with 4583018.609 GB free disk space

    cd unitigging/0-mercounts
    ./meryl-configure.sh \
    > ./meryl-configure.err 2>&1

-- Finished on Thu Jan 15 18:46:09 2026 (one second) with 4583018.609 GB free disk space
----------------------------------------
--  segments   memory batches
--  -------- -------- -------
--        01 10.81 GB       2
--        02  5.75 GB       2
--        04  2.97 GB       2
--        06  2.15 GB       2
--        08  1.62 GB       2
--        12  1.08 GB       2
--        16  0.81 GB       2
--        20  0.65 GB       2
--        24  0.54 GB       2
--        32  0.41 GB       2
--        40  0.33 GB       2
--        48  -.-- GB       -  (segment size too small)
--        56  -.-- GB       -  (segment size too small)
--        64  -.-- GB       -  (segment size too small)
--        96  -.-- GB       -  (segment size too small)
--
--  For 270990 reads with 4250022748 bases, limit to 42 batches.
--  Will count kmers using 01 jobs, each using 12 GB and 4 threads.
--
-- Finished stage 'merylConfigure', reset canuIteration.
--
-- Running jobs.  First attempt out of 2.
----------------------------------------
-- Starting 'meryl' concurrent execution on Thu Jan 15 18:46:09 2026 with 4583018.578 GB free disk space (1 processes; 22 concurrently)

    cd unitigging/0-mercounts
    ./meryl-count.sh 1 > ./meryl-count.000001.out 2>&1

-- Finished on Thu Jan 15 18:49:41 2026 (212 seconds) with 4582284.187 GB free disk space
----------------------------------------
-- Found 1 Kmer counting (meryl) outputs.
-- Finished stage 'utg-merylCountCheck', reset canuIteration.
--
-- Running jobs.  First attempt out of 2.
----------------------------------------
-- Starting 'meryl' concurrent execution on Thu Jan 15 18:49:41 2026 with 4582284.156 GB free disk space (1 processes; 22 concurrently)

    cd unitigging/0-mercounts
    ./meryl-process.sh 1 > ./meryl-process.000001.out 2>&1

-- Finished on Thu Jan 15 18:49:47 2026 (6 seconds) with 4582284.812 GB free disk space
----------------------------------------
-- Meryl finished successfully.  Kmer frequency histogram:
--
-- WARNING: gnuplot failed.
--
----------------------------------------
--
--  22-mers                                                                                           Fraction
--    Occurrences   NumMers                                                                         Unique Total
--       1-     1         0                                                                        0.0000 0.0000
--       2-     2    310038 *                                                                      0.0069 0.0002
--       3-     4    104932                                                                        0.0085 0.0003
--       5-     7     35658                                                                        0.0096 0.0004
--       8-    11     14277                                                                        0.0101 0.0004
--      12-    16     17817                                                                        0.0104 0.0004
--      17-    22     89770                                                                        0.0108 0.0005
--      23-    29    714508 ***                                                                    0.0136 0.0014
--      30-    37   4193232 ******************                                                     0.0337 0.0092
--      38-    46  14292718 **************************************************************         0.1448 0.0642
--      47-    56  16028977 ********************************************************************** 0.4823 0.2687
--      57-    67   4369485 *******************                                                    0.8129 0.5079
--      68-    79    651908 **                                                                     0.8931 0.5764
--      80-    92    977504 ****                                                                   0.9067 0.5905
--      93-   106    874325 ***                                                                    0.9289 0.6176
--     107-   121    346514 *                                                                      0.9473 0.6431
--     122-   137    286065 *                                                                      0.9545 0.6546
--     138-   154    266940 *                                                                      0.9609 0.6664
--     155-   172    158348                                                                        0.9667 0.6781
--     173-   191    165853                                                                        0.9701 0.6860
--     192-   211    133727                                                                        0.9738 0.6954
--     212-   232    105006                                                                        0.9767 0.7036
--     233-   254     99867                                                                        0.9790 0.7108
--     255-   277     76604                                                                        0.9812 0.7183
--     278-   301     75032                                                                        0.9829 0.7245
--     302-   326     65555                                                                        0.9846 0.7313
--     327-   352     53635                                                                        0.9860 0.7376
--     353-   379     47658                                                                        0.9872 0.7432
--     380-   407     39955                                                                        0.9883 0.7486
--     408-   436     34930                                                                        0.9891 0.7534
--     437-   466     29813                                                                        0.9899 0.7580
--     467-   497     26039                                                                        0.9906 0.7622
--     498-   529     25825                                                                        0.9911 0.7660
--     530-   562     27529                                                                        0.9917 0.7701
--     563-   596     26817                                                                        0.9923 0.7748
--     597-   631     24381                                                                        0.9929 0.7796
--     632-   667     23523                                                                        0.9934 0.7843
--     668-   704     16579                                                                        0.9940 0.7889
--     705-   742     16119                                                                        0.9943 0.7925
--     743-   781     15401                                                                        0.9947 0.7961
--     782-   821     12623                                                                        0.9950 0.7997
--
--           0 (max occurrences)
--  3227436269 (total mers, non-unique)
--    45087510 (distinct mers, non-unique)
--           0 (unique mers)
-- Finished stage 'meryl-process', reset canuIteration.
--
-- Removing meryl database 'unitigging/0-mercounts/A2-3.ms22'.
--
-- OVERLAPPER (normal) (assembly) erate=0.01
--
----------------------------------------
-- Starting command on Thu Jan 15 18:49:47 2026 with 4582284.796 GB free disk space

    cd unitigging/1-overlapper
    /share/org/YZWL/yzwl_lixg/miniforge3/envs/canu_v.2.3/bin/overlapInCorePartition \
     -S  ../../A2-3.seqStore \
     -hl 160000000 \
     -rl 5000000000 \
     -ol 500 \
     -o  ./A2-3.partition \
    > ./A2-3.partition.err 2>&1

-- Finished on Thu Jan 15 18:49:47 2026 (fast as lightning) with 4582284.781 GB free disk space
----------------------------------------
--
-- Configured 21 overlapInCore jobs.
-- Finished stage 'utg-overlapConfigure', reset canuIteration.
--
-- Running jobs.  First attempt out of 2.
----------------------------------------
-- Starting 'utgovl' concurrent execution on Thu Jan 15 18:49:47 2026 with 4582284.75 GB free disk space (21 processes; 11 concurrently)

    cd unitigging/1-overlapper
    ./overlap.sh 1 > ./overlap.000001.out 2>&1
    ./overlap.sh 2 > ./overlap.000002.out 2>&1
    ./overlap.sh 3 > ./overlap.000003.out 2>&1
    ./overlap.sh 4 > ./overlap.000004.out 2>&1
    ./overlap.sh 5 > ./overlap.000005.out 2>&1
    ./overlap.sh 6 > ./overlap.000006.out 2>&1
    ./overlap.sh 7 > ./overlap.000007.out 2>&1
    ./overlap.sh 8 > ./overlap.000008.out 2>&1
    ./overlap.sh 9 > ./overlap.000009.out 2>&1
    ./overlap.sh 10 > ./overlap.000010.out 2>&1
    ./overlap.sh 11 > ./overlap.000011.out 2>&1
    ./overlap.sh 12 > ./overlap.000012.out 2>&1
    ./overlap.sh 13 > ./overlap.000013.out 2>&1
    ./overlap.sh 14 > ./overlap.000014.out 2>&1
    ./overlap.sh 15 > ./overlap.000015.out 2>&1
    ./overlap.sh 16 > ./overlap.000016.out 2>&1
    ./overlap.sh 17 > ./overlap.000017.out 2>&1
    ./overlap.sh 18 > ./overlap.000018.out 2>&1
    ./overlap.sh 19 > ./overlap.000019.out 2>&1
    ./overlap.sh 20 > ./overlap.000020.out 2>&1
    ./overlap.sh 21 > ./overlap.000021.out 2>&1

-- Finished on Thu Jan 15 19:13:26 2026 (1419 seconds) with 4581077.484 GB free disk space
----------------------------------------
-- Found 21 overlapInCore output files.
--
-- overlapInCore compute 'unitigging/1-overlapper':
--   kmer hits
--     with no overlap       1287794985  70.7142857 +- 37336367.542
--     with an overlap         16917403  .619047619 +- 461433.915
--
--   overlaps                  16917403  .619047619 +- 461433.915
--     contained                4906746  .571428571 +- 132993.057
--     dovetail                12010657  .047619048 +- 332177.84
--
--   overlaps rejected
--     multiple per pair              0           0 +- 0
--     bad short window               0           0 +- 0
--     bad long window                0           0 +- 0
-- Finished stage 'utg-overlapCheck', reset canuIteration.
----------------------------------------
-- Starting command on Thu Jan 15 19:13:26 2026 with 4581077.468 GB free disk space

    cd unitigging
    /share/org/YZWL/yzwl_lixg/miniforge3/envs/canu_v.2.3/bin/ovStoreConfig \
     -S ../A2-3.seqStore \
     -M 4-8 \
     -L ./1-overlapper/ovljob.files \
     -create ./A2-3.ovlStore.config \
     > ./A2-3.ovlStore.config.txt \
    2> ./A2-3.ovlStore.config.err

-- Finished on Thu Jan 15 19:13:26 2026 (furiously fast) with 4580935.359 GB free disk space
----------------------------------------
--
-- Creating overlap store unitigging/A2-3.ovlStore using:
--      1 bucket
--      1 slice
--        using at most 2 GB memory each
--
-- Running jobs.  First attempt out of 2.
----------------------------------------
-- Starting 'ovS' concurrent execution on Thu Jan 15 19:13:26 2026 with 4580935.343 GB free disk space (1 processes; 62 concurrently)

    cd unitigging
    ./A2-3.ovlStore.sh 1 > ./A2-3.ovlStore.000001.out 2>&1

-- Finished on Thu Jan 15 19:13:33 2026 (7 seconds) with 4580936.046 GB free disk space
----------------------------------------
-- Checking store.
----------------------------------------
-- Starting command on Thu Jan 15 19:13:33 2026 with 4580936.046 GB free disk space

    cd unitigging
    /share/org/YZWL/yzwl_lixg/miniforge3/envs/canu_v.2.3/bin/ovStoreDump \
     -S ../A2-3.seqStore \
     -O  ./A2-3.ovlStore \
     -counts \
     > ./A2-3.ovlStore/counts.dat 2> ./A2-3.ovlStore/counts.err

-- Finished on Thu Jan 15 19:13:33 2026 (lickety-split) with 4580936.015 GB free disk space
----------------------------------------
--
-- Overlap store 'unitigging/A2-3.ovlStore' successfully constructed.
-- Found 33834806 overlaps for 261464 reads; 1382188 reads have no overlaps.
--
--
-- Purged 0.423 GB in 63 overlap output files.
----------------------------------------
-- Starting command on Thu Jan 15 19:13:33 2026 with 4580936.015 GB free disk space

    cd unitigging
    /share/org/YZWL/yzwl_lixg/miniforge3/envs/canu_v.2.3/bin/ovStoreStats \
     -C 50 \
     -S ../A2-3.seqStore \
     -O  ./A2-3.ovlStore \
     -o  ./A2-3.ovlStore \
     > ./A2-3.ovlStore.summary.err 2>&1

-- Finished on Thu Jan 15 19:13:38 2026 (5 seconds) with 4580936 GB free disk space
----------------------------------------
--
-- Overlap store 'unitigging/A2-3.ovlStore' contains:
--
--   category            reads     %          read length        feature size or coverage  analysis
--   ----------------  -------  -------  ----------------------  ------------------------  --------------------
--   middle-missing        127    0.05    14443.26 +- 8419.62        769.58 +- 1310.43    (bad trimming)
--   middle-hump            18    0.01    13641.22 +- 4583.13       4319.11 +- 3004.52    (bad trimming)
--   no-5-prime            681    0.25    12854.82 +- 5657.96       1730.14 +- 3052.98    (bad trimming)
--   no-3-prime            926    0.34    10616.34 +- 6595.37       1283.50 +- 2397.83    (bad trimming)
--   
--   low-coverage         1970    0.73    10363.31 +- 5806.34          6.28 +- 3.72       (easy to assemble, potential for lower quality consensus)
--   unique             222583   82.14    12100.57 +- 6054.89         46.72 +- 8.43       (easy to assemble, perfect, yay)
--   repeat-cont         10530    3.89     8761.94 +- 5775.53        509.05 +- 379.21     (potential for consensus errors, no impact on assembly)
--   repeat-dove           174    0.06    19980.40 +- 2155.04        371.12 +- 300.08     (hard to assemble, likely won't assemble correctly or even at all)
--   
--   span-repeat          3400    1.25    13783.84 +- 5130.35       3343.25 +- 3762.98    (read spans a large repeat, usually easy to assemble)
--   uniq-repeat-cont    14299    5.28    12223.70 +- 5010.11                             (should be uniquely placed, low potential for consensus errors, no impact on assembly)
--   uniq-repeat-dove     3205    1.18    18677.34 +- 2737.65                             (will end contigs, potential to misassemble)
--   uniq-anchor          3551    1.31    13446.70 +- 4872.97       8119.20 +- 4993.65    (repeat read, with unique section, probable bad read)
-- Finished stage 'utg-createOverlapStore', reset canuIteration.
--
-- Loading read lengths.
-- Loading number of overlaps per read.
--
-- Configure RED for 16gb memory.
--                   Batches of at most (unlimited) reads.
--                                      500000000 bases.
--                   Expecting evidence of at most 536870912 bases per iteration.
--
--           Total                                               Reads                 Olaps Evidence
--    Job   Memory      Read Range         Reads        Bases   Memory        Olaps   Memory   Memory  (Memory in MB)
--   ---- -------- ------------------- --------- ------------ -------- ------------ -------- --------
--      1 16386.29         1-34663          5652    109002764 13306.18       708407     8.11  1024.00
--      2 16384.11     34664-74009          6569    108973544 13302.64       827431     9.47  1024.00
--      3 16386.18     74010-115508         6964    108988254 13304.45       849944     9.73  1024.00
--      4 16386.31    115509-152518         6057    108985841 13304.13       889831    10.18  1024.00
--      5 16386.09    152519-194820         6992    108989952 13304.66       824099     9.43  1024.00
--      6 16386.14    194821-250991         9326    108965258 13301.72      1085841    12.43  1024.00
--      7 16385.25    250992-285852         5879    108987848 13304.37       776436     8.89  1024.00
--      8 16384.54    285853-324492         6449    108974581 13302.76       854666     9.78  1024.00
--      9 16384.77    324493-384776         9869    108955370 13300.53      1069446    12.24  1024.00
--     10 16384.47    384777-420202         5730    108984402 13303.94       745071     8.53  1024.00
--     11 16386.04    420203-457413         6109    108988825 13304.49       834339     9.55  1024.00
--     12 16386.15    457414-504792         7744    108986677 13304.28       861903     9.86  1024.00
--     13 16384.97    504793-551373         7618    108974056 13302.74       894578    10.24  1024.00
--     14 16385.15    551374-587417         5878    108975722 13302.89       897136    10.27  1024.00
--     15 16385.25    587418-628309         6734    108989273 13304.57       758400     8.68  1024.00
--     16 16384.23    628310-681110         8635    108957773 13300.78      1000126    11.45  1024.00
--     17 16385.58    681111-716873         5801    108987882 13304.37       805350     9.22  1024.00
--     18 16385.29    716874-754981         6313    108978274 13303.21       880908    10.08  1024.00
--     19 16385.26    754982-811250         9170    108962841 13301.42      1034888    11.84  1024.00
--     20 16385.87    811251-845652         5665    108995490 13305.29       749578     8.58  1024.00
--     21 16385.97    845653-882030         6043    108985384 13304.07       864640     9.90  1024.00
--     22 16384.72    882031-927221         7418    108976778 13303.06       843478     9.65  1024.00
--     23 16384.96    927222-972516         7521    108973663 13302.69       898009    10.28  1024.00
--     24 16384.14    972517-1009267        6022    108969342 13302.11       876453    10.03  1024.00
--     25 16384.09   1009268-1050664        6927    108978384 13303.24       772917     8.85  1024.00
--     26 16384.69   1050665-1104407        8844    108959795 13301.03      1018649    11.66  1024.00
--     27 16385.12   1104408-1139087        5817    108986680 13304.22       777354     8.90  1024.00
--     28 16385.75   1139088-1177961        6372    108981439 13303.60       886957    10.15  1024.00
--     29 16384.80   1177962-1234413        9253    108956873 13300.69      1057981    12.11  1024.00
--     30 16385.03   1234414-1269566        5633    108987873 13304.36       757723     8.67  1024.00
--     31 16387.05   1269567-1305672        5987    108996272 13305.40       843232     9.65  1024.00
--     32 16384.89   1305673-1349695        7367    108983172 13303.84       790363     9.04  1024.00
--     33 16385.22   1349696-1394364        7356    108980693 13303.54       845612     9.68  1024.00
--     34 16385.07   1394365-1429550        5793    108979245 13303.31       852951     9.76  1024.00
--     35 16385.32   1429551-1468591        6438    108990244 13304.68       755209     8.64  1024.00
--     36 16386.14   1468592-1519049        8439    108975117 13302.89       983130    11.25  1024.00
--     37 16386.09   1519050-1553553        5707    108995693 13305.32       766444     8.77  1024.00
--     38 16385.91   1553554-1589624        6048    108988310 13304.43       828738     9.48  1024.00
--     39 16362.46   1589625-1643652        8851    108773164 13278.25      1066588    12.21  1024.00
--   ---- -------- ------------------- --------- ------------ -------- ------------ -------- --------
--                                                 4250022748              33834806
-- Finished stage 'readErrorDetectionConfigure', reset canuIteration.
--
-- Running jobs.  First attempt out of 2.
----------------------------------------
-- Starting 'red' concurrent execution on Thu Jan 15 19:13:44 2026 with 4580935.953 GB free disk space (39 processes; 22 concurrently)

    cd unitigging/3-overlapErrorAdjustment
    ./red.sh 1 > ./red.000001.out 2>&1
    ./red.sh 2 > ./red.000002.out 2>&1
    ./red.sh 3 > ./red.000003.out 2>&1
    ./red.sh 4 > ./red.000004.out 2>&1
    ./red.sh 5 > ./red.000005.out 2>&1
    ./red.sh 6 > ./red.000006.out 2>&1
    ./red.sh 7 > ./red.000007.out 2>&1
    ./red.sh 8 > ./red.000008.out 2>&1
    ./red.sh 9 > ./red.000009.out 2>&1
    ./red.sh 10 > ./red.000010.out 2>&1
    ./red.sh 11 > ./red.000011.out 2>&1
    ./red.sh 12 > ./red.000012.out 2>&1
    ./red.sh 13 > ./red.000013.out 2>&1
    ./red.sh 14 > ./red.000014.out 2>&1
    ./red.sh 15 > ./red.000015.out 2>&1
    ./red.sh 16 > ./red.000016.out 2>&1
    ./red.sh 17 > ./red.000017.out 2>&1
    ./red.sh 18 > ./red.000018.out 2>&1
    ./red.sh 19 > ./red.000019.out 2>&1
    ./red.sh 20 > ./red.000020.out 2>&1
    ./red.sh 21 > ./red.000021.out 2>&1
    ./red.sh 22 > ./red.000022.out 2>&1
    ./red.sh 23 > ./red.000023.out 2>&1
    ./red.sh 24 > ./red.000024.out 2>&1
    ./red.sh 25 > ./red.000025.out 2>&1
    ./red.sh 26 > ./red.000026.out 2>&1
    ./red.sh 27 > ./red.000027.out 2>&1
    ./red.sh 28 > ./red.000028.out 2>&1
    ./red.sh 29 > ./red.000029.out 2>&1
    ./red.sh 30 > ./red.000030.out 2>&1
    ./red.sh 31 > ./red.000031.out 2>&1
    ./red.sh 32 > ./red.000032.out 2>&1
    ./red.sh 33 > ./red.000033.out 2>&1
    ./red.sh 34 > ./red.000034.out 2>&1
    ./red.sh 35 > ./red.000035.out 2>&1
    ./red.sh 36 > ./red.000036.out 2>&1
    ./red.sh 37 > ./red.000037.out 2>&1
    ./red.sh 38 > ./red.000038.out 2>&1
    ./red.sh 39 > ./red.000039.out 2>&1

-- Finished on Thu Jan 15 19:21:56 2026 (492 seconds) with 4585832.281 GB free disk space
----------------------------------------
-- Found 39 read error detection output files.
-- Finished stage 'readErrorDetectionCheck', reset canuIteration.
--
-- Loading read lengths.
-- Loading number of overlaps per read.
--
-- Configure OEA for 8gb memory.
--                   Batches of at most (unlimited) reads.
--                                      300000000 bases.
--
--           Total                                               Reads                 Olaps  Adjusts
--    Job   Memory      Read Range         Reads        Bases   Memory        Olaps   Memory   Memory  (Memory in MB)
--   ---- -------- ------------------- --------- ------------ -------- ------------ -------- --------
--      1  2781.55         1-106979        17775    300003106   294.65      2231021    68.09   370.81
--      2  2791.51    106980-230433        20354    300001933   294.73      2554818    77.97   370.81
--      3  2781.03    230434-335970        17651    300006394   294.65      2214239    67.57   370.81
--      4  2789.08    335971-457870        19885    300025965   294.73      2474953    75.53   370.81
--      5  2788.52    457871-578664        19750    300011025   294.72      2457295    74.99   370.81
--      6  2783.77    578665-699326        19752    300024856   294.73      2301300    70.23   370.81
--      7  2791.22    699327-820505        19853    300021259   294.73      2545434    77.68   370.81
--      8  2784.00    820506-928726        17843    300002247   294.65      2311343    70.54   370.81
--      9  2784.78    928727-1040243       18483    300005442   294.67      2336310    71.30   370.81
--     10  2789.67   1040244-1158632       19629    300005489   294.71      2495292    76.15   370.81
--     11  2786.33   1158633-1279469       19700    300000005   294.70      2386076    72.82   370.81
--     12  2783.75   1279470-1395538       19234    300010670   294.70      2301409    70.23   370.81
--     13  2787.57   1395539-1512062       19302    300018901   294.71      2426213    74.04   370.81
--     14  2779.49   1512063-1613533       16807    300000535   294.62      2164780    66.06   370.81
--     15  2493.90   1613534-1643652        4972     49884921    55.73       634323    19.36   370.81
--   ---- -------- ------------------- --------- ------------ -------- ------------ -------- --------
--                                                 4250022748              33834806
-- Finished stage 'overlapErrorAdjustmentConfigure', reset canuIteration.
--
-- Running jobs.  First attempt out of 2.
----------------------------------------
-- Starting 'oea' concurrent execution on Thu Jan 15 19:22:03 2026 with 4585832.203 GB free disk space (15 processes; 62 concurrently)

    cd unitigging/3-overlapErrorAdjustment
    ./oea.sh 1 > ./oea.000001.out 2>&1
    ./oea.sh 2 > ./oea.000002.out 2>&1
    ./oea.sh 3 > ./oea.000003.out 2>&1
    ./oea.sh 4 > ./oea.000004.out 2>&1
    ./oea.sh 5 > ./oea.000005.out 2>&1
    ./oea.sh 6 > ./oea.000006.out 2>&1
    ./oea.sh 7 > ./oea.000007.out 2>&1
    ./oea.sh 8 > ./oea.000008.out 2>&1
    ./oea.sh 9 > ./oea.000009.out 2>&1
    ./oea.sh 10 > ./oea.000010.out 2>&1
    ./oea.sh 11 > ./oea.000011.out 2>&1
    ./oea.sh 12 > ./oea.000012.out 2>&1
    ./oea.sh 13 > ./oea.000013.out 2>&1
    ./oea.sh 14 > ./oea.000014.out 2>&1
    ./oea.sh 15 > ./oea.000015.out 2>&1

-- Finished on Thu Jan 15 19:38:18 2026 (975 seconds) with 4586063.156 GB free disk space
----------------------------------------
-- Found 15 overlap error adjustment output files.
-- Finished stage 'overlapErrorAdjustmentCheck', reset canuIteration.
----------------------------------------
-- Starting command on Thu Jan 15 19:38:18 2026 with 4586063.14 GB free disk space

    cd unitigging/3-overlapErrorAdjustment
    /share/org/YZWL/yzwl_lixg/miniforge3/envs/canu_v.2.3/bin/loadErates \
      -S ../../A2-3.seqStore \
      -O ../A2-3.ovlStore \
      -L ./oea.files \
    > ./oea.apply.err 2>&1

-- Finished on Thu Jan 15 19:38:18 2026 (fast as lightning) with 4586063.062 GB free disk space
----------------------------------------
-- No report available.
-- Finished stage 'updateOverlapStore', reset canuIteration.
-- Finished stage 'unitig', reset canuIteration.
--
-- Running jobs.  First attempt out of 2.
----------------------------------------
-- Starting 'bat' concurrent execution on Thu Jan 15 19:38:18 2026 with 4586063.015 GB free disk space (1 processes; 1 concurrently)

    cd unitigging/4-unitigger
    ./unitigger.sh 1 > ./unitigger.000001.out 2>&1

-- Finished on Thu Jan 15 19:38:29 2026 (11 seconds) with 4586131.031 GB free disk space
----------------------------------------
-- Unitigger finished successfully.
--  
--  ERROR RATES
--  -----------
--                                                   --------threshold------
--  294334                       fraction error      fraction        percent
--  samples                              (1e-5)         error          error
--                   --------------------------      --------       --------
--  command line (-eg)                           ->     30.00        0.0300%
--  command line (-ef)                           ->  -----.--      ---.----%
--  command line (-eM)                           ->     30.00        0.0300%
--  mean + std.dev       0.39 +-  12 *     2.84  ->     34.42        0.0344%
--  median + mad         0.00 +-  12 *     0.00  ->      0.00        0.0000%
--  90th percentile                              ->      1.00        0.0010%  (enabled)
--  
--  BEST EDGE FILTERING
--  -------------------
--  At graph threshold 0.0300%, reads:
--    available to have edges:        53528
--    with at least one edge:         41133
--  
--  At max threshold 0.0300%, reads:
--    available to have edges:        53528
--    with at least one edge:         41133
--  
--  At tight threshold 0.0010%, reads with:
--    both edges below error threshold:     36174  (80.00% minReadsBest threshold = 32906)
--    one  edge  above error threshold:      3743
--    both edges above error threshold:      1216
--    at least one edge:                    41133
--  
--  At loose threshold 0.0300%, reads with:
--    both edges below error threshold:     41133  (80.00% minReadsBest threshold = 32906)
--    one  edge  above error threshold:         0
--    both edges above error threshold:         0
--    at least one edge:                    41133
--  
--  
--  INITIAL EDGES
--  -------- ----------------------------------------
--    213001 reads are contained
--   1396879 reads have no best edges (singleton)
--       298 reads have only one best edge (spur) 
--                180 are mutual best
--     33474 reads have two best edges 
--                676 have one mutual best edge
--              32502 have two mutual best edges
--  
--  
--  FINAL EDGES
--  -------- ----------------------------------------
--    213001 reads are contained
--   1397150 reads have no best edges (singleton)
--       215 reads have only one best edge (spur) 
--                179 are mutual best
--     33286 reads have two best edges 
--                553 have one mutual best edge
--              32497 have two mutual best edges
--  
--  
--  EDGE FILTERING
--  -------- ------------------------------------------
--         0 reads are ignored
--     11383 reads have a gap in overlap coverage
--       143 reads have lopsided best edges
-- Found, in version 1, after unitig construction:
--   contigs:      64 sequences, total length 67538512 bp (including 68 repeats of total length 1543421 bp).
--   bubbles:      115 sequences, total length 3025987 bp.
--   unassembled:  24947 sequences, total length 288998409 bp.
--
-- Contig sizes based on genome size 85mbp:
--
--            NG (bp)  LG (contigs)    sum (bp)
--         ----------  ------------  ----------
--     10     8762567             1     8762567
--     20     4578452             3    19375156
--     30     3794146             5    27739234
--     40     3379782             7    34742144
--     50     2969788            10    44457778
--     60     2277411            13    51938448
--     70     1958306            17    60403859
--
-- Finished stage 'unitigCheck', reset canuIteration.
----------------------------------------
-- Starting command on Thu Jan 15 19:38:29 2026 with 4586131.015 GB free disk space

    cd unitigging
    /share/org/YZWL/yzwl_lixg/miniforge3/envs/canu_v.2.3/bin/utgcns \
      -S ../A2-3.seqStore \
      -T  ./A2-3.ctgStore 1 \
      -partition 0.8 1.5 0.1 \
    > ./A2-3.ctgStore/partitioning.log 2>&1

-- Finished on Thu Jan 15 19:38:38 2026 (9 seconds) with 4586131.5 GB free disk space
----------------------------------------
-- Using slow alignment for consensus (iteration '0').
-- Configured 10 consensus jobs.
-- Finished stage 'consensusConfigure', reset canuIteration.
--
-- Local: cns       13.000 GB    8 CPUs x  11 jobs   143.000 GB  88 CPUs  (consensus)
--
--
-- Running jobs.  First attempt out of 2.
----------------------------------------
-- Starting 'cns' concurrent execution on Thu Jan 15 19:38:38 2026 with 4586131.468 GB free disk space (10 processes; 11 concurrently)

    cd unitigging/5-consensus
    ./consensus.sh 1 > ./consensus.000001.out 2>&1
    ./consensus.sh 2 > ./consensus.000002.out 2>&1
    ./consensus.sh 3 > ./consensus.000003.out 2>&1
    ./consensus.sh 4 > ./consensus.000004.out 2>&1
    ./consensus.sh 5 > ./consensus.000005.out 2>&1
    ./consensus.sh 6 > ./consensus.000006.out 2>&1
    ./consensus.sh 7 > ./consensus.000007.out 2>&1
    ./consensus.sh 8 > ./consensus.000008.out 2>&1
    ./consensus.sh 9 > ./consensus.000009.out 2>&1
    ./consensus.sh 10 > ./consensus.000010.out 2>&1

-- Finished on Thu Jan 15 19:46:40 2026 (482 seconds) with 4587277.515 GB free disk space
----------------------------------------
-- Using slow alignment for consensus (iteration '1').
-- Configured 10 consensus jobs.
-- All 10 consensus jobs finished successfully.
-- Finished stage 'consensusCheck', reset canuIteration.
-- Using slow alignment for consensus (iteration '0').
-- Configured 10 consensus jobs.
----------------------------------------
-- Starting command on Thu Jan 15 19:46:40 2026 with 4587277.468 GB free disk space

    cd unitigging
    /share/org/YZWL/yzwl_lixg/miniforge3/envs/canu_v.2.3/bin/tgStoreLoad \
      -S ../A2-3.seqStore \
      -T  ./A2-3.ctgStore 2 \
      -L ./5-consensus/ctgcns.files \
    > ./5-consensus/ctgcns.files.ctgStoreLoad.err 2>&1

-- Finished on Thu Jan 15 19:46:41 2026 (one second) with 4587276.484 GB free disk space
----------------------------------------
----------------------------------------
-- Starting command on Thu Jan 15 19:46:41 2026 with 4587276.484 GB free disk space

    cd unitigging
    /share/org/YZWL/yzwl_lixg/miniforge3/envs/canu_v.2.3/bin/tgTigDisplay \
      -S ../A2-3.seqStore \
      -b \
      -o ../A2-3.contigs.unsorted.bam \
      -L ./5-consensus/ctgcns.files \
    > ./5-consensus/ctgcns.files.contigs.bam.err 2>&1

-- Finished on Thu Jan 15 19:50:16 2026 (215 seconds) with 4587377.765 GB free disk space
----------------------------------------
----------------------------------------
-- Starting command on Thu Jan 15 19:50:16 2026 with 4587377.765 GB free disk space

    cd .
    samtools sort \
      --write-index \
      --threads 2 \
      -o ./A2-3.contigs.bam ./A2-3.contigs.unsorted.bam \
    > ./ctgcns.bam.err 2>&1

-- Finished on Thu Jan 15 19:51:42 2026 (86 seconds) with 4587446.281 GB free disk space
----------------------------------------
-- Purging consensus output after loading to ctgStore.
-- Purged 10 .cns outputs.
----------------------------------------
-- Starting command on Thu Jan 15 19:51:42 2026 with 4587448.234 GB free disk space

    cd unitigging
    /share/org/YZWL/yzwl_lixg/miniforge3/envs/canu_v.2.3/bin/tgStoreDump \
      -S ../A2-3.seqStore \
      -T ./A2-3.ctgStore 2 \
      -sizes -s 85000000 \
    > ./A2-3.ctgStore/seqDB.v002.sizes.txt
ZERO length suplied to intervalList::add(), ignoring interval.
ZERO length suplied to intervalList::add(), ignoring interval.
ZERO length suplied to intervalList::add(), ignoring interval.
ZERO length suplied to intervalList::add(), ignoring interval.
ZERO length suplied to intervalList::add(), ignoring interval.
ZERO length suplied to intervalList::add(), ignoring interval.
ZERO length suplied to intervalList::add(), ignoring interval.
ZERO length suplied to intervalList::add(), ignoring interval.
ZERO length suplied to intervalList::add(), ignoring interval.
ZERO length suplied to intervalList::add(), ignoring interval.
ZERO length suplied to intervalList::add(), ignoring interval.
ZERO length suplied to intervalList::add(), ignoring interval.
ZERO length suplied to intervalList::add(), ignoring interval.
ZERO length suplied to intervalList::add(), ignoring interval.
ZERO length suplied to intervalList::add(), ignoring interval.
ZERO length suplied to intervalList::add(), ignoring interval.
ZERO length suplied to intervalList::add(), ignoring interval.
ZERO length suplied to intervalList::add(), ignoring interval.
ZERO length suplied to intervalList::add(), ignoring interval.
ZERO length suplied to intervalList::add(), ignoring interval.
ZERO length suplied to intervalList::add(), ignoring interval.
ZERO length suplied to intervalList::add(), ignoring interval.
ZERO length suplied to intervalList::add(), ignoring interval.
ZERO length suplied to intervalList::add(), ignoring interval.
ZERO length suplied to intervalList::add(), ignoring interval.
ZERO length suplied to intervalList::add(), ignoring interval.
ZERO length suplied to intervalList::add(), ignoring interval.
ZERO length suplied to intervalList::add(), ignoring interval.
ZERO length suplied to intervalList::add(), ignoring interval.
ZERO length suplied to intervalList::add(), ignoring interval.
ZERO length suplied to intervalList::add(), ignoring interval.
ZERO length suplied to intervalList::add(), ignoring interval.
ZERO length suplied to intervalList::add(), ignoring interval.
ZERO length suplied to intervalList::add(), ignoring interval.
ZERO length suplied to intervalList::add(), ignoring interval.
ZERO length suplied to intervalList::add(), ignoring interval.
ZERO length suplied to intervalList::add(), ignoring interval.
ZERO length suplied to intervalList::add(), ignoring interval.
ZERO length suplied to intervalList::add(), ignoring interval.
ZERO length suplied to intervalList::add(), ignoring interval.
ZERO length suplied to intervalList::add(), ignoring interval.
ZERO length suplied to intervalList::add(), ignoring interval.
ZERO length suplied to intervalList::add(), ignoring interval.
ZERO length suplied to intervalList::add(), ignoring interval.

-- Finished on Thu Jan 15 19:51:42 2026 (like a bat out of hell) with 4587448.234 GB free disk space
----------------------------------------
-- Found, in version 2, after consensus generation:
--   contigs:      64 sequences, total length 88051486 bp (including 68 repeats of total length 2120366 bp).
--   bubbles:      115 sequences, total length 4004384 bp.
--   unassembled:  24947 sequences, total length 391431499 bp.
--
-- Contig sizes based on genome size 85mbp:
--
--            NG (bp)  LG (contigs)    sum (bp)
--         ----------  ------------  ----------
--     10    11387196             1    11387196
--     20     7835312             2    19222508
--     30     5958704             4    31144259
--     40     4910403             5    36054662
--     50     4407768             7    45184571
--     60     4393049             9    53985151
--     70     3514305            11    61377013
--     80     2945188            14    70562256
--     90     2546316            17    78640048
--    100     1023197            22    85580021
--
-- Finished stage 'consensusLoad', reset canuIteration.
----------------------------------------
-- Starting command on Thu Jan 15 19:51:42 2026 with 4587448.218 GB free disk space

    cd .
    /share/org/YZWL/yzwl_lixg/miniforge3/envs/canu_v.2.3/bin/tgStoreDump \
      -S ./A2-3.seqStore \
      -T ./unitigging/A2-3.ctgStore 2 \
      -o ./A2-3.contigs \
      -layout \
    > ./A2-3.contigs.layout.err 2>&1

-- Finished on Thu Jan 15 19:51:43 2026 (one second) with 4587449.14 GB free disk space
----------------------------------------
----------------------------------------
-- Starting command on Thu Jan 15 19:51:43 2026 with 4587449.14 GB free disk space

    cd .
    /share/org/YZWL/yzwl_lixg/miniforge3/envs/canu_v.2.3/bin/tgStoreDump \
      -S ./A2-3.seqStore \
      -T ./unitigging/A2-3.ctgStore 2 \
      -consensus -fasta \
      -unassembled \
    > ./A2-3.unassembled.fasta
    2> ./A2-3.unassembled.err
ZERO length suplied to intervalList::add(), ignoring interval.
ZERO length suplied to intervalList::add(), ignoring interval.
ZERO length suplied to intervalList::add(), ignoring interval.
ZERO length suplied to intervalList::add(), ignoring interval.
ZERO length suplied to intervalList::add(), ignoring interval.
ZERO length suplied to intervalList::add(), ignoring interval.
ZERO length suplied to intervalList::add(), ignoring interval.
ZERO length suplied to intervalList::add(), ignoring interval.
ZERO length suplied to intervalList::add(), ignoring interval.
ZERO length suplied to intervalList::add(), ignoring interval.
ZERO length suplied to intervalList::add(), ignoring interval.
ZERO length suplied to intervalList::add(), ignoring interval.
ZERO length suplied to intervalList::add(), ignoring interval.
ZERO length suplied to intervalList::add(), ignoring interval.
ZERO length suplied to intervalList::add(), ignoring interval.
ZERO length suplied to intervalList::add(), ignoring interval.
ZERO length suplied to intervalList::add(), ignoring interval.
ZERO length suplied to intervalList::add(), ignoring interval.
ZERO length suplied to intervalList::add(), ignoring interval.
ZERO length suplied to intervalList::add(), ignoring interval.
ZERO length suplied to intervalList::add(), ignoring interval.
ZERO length suplied to intervalList::add(), ignoring interval.
ZERO length suplied to intervalList::add(), ignoring interval.
ZERO length suplied to intervalList::add(), ignoring interval.
ZERO length suplied to intervalList::add(), ignoring interval.
ZERO length suplied to intervalList::add(), ignoring interval.
ZERO length suplied to intervalList::add(), ignoring interval.
ZERO length suplied to intervalList::add(), ignoring interval.
ZERO length suplied to intervalList::add(), ignoring interval.
ZERO length suplied to intervalList::add(), ignoring interval.
ZERO length suplied to intervalList::add(), ignoring interval.
ZERO length suplied to intervalList::add(), ignoring interval.
ZERO length suplied to intervalList::add(), ignoring interval.
ZERO length suplied to intervalList::add(), ignoring interval.
ZERO length suplied to intervalList::add(), ignoring interval.
ZERO length suplied to intervalList::add(), ignoring interval.
ZERO length suplied to intervalList::add(), ignoring interval.
ZERO length suplied to intervalList::add(), ignoring interval.
ZERO length suplied to intervalList::add(), ignoring interval.
ZERO length suplied to intervalList::add(), ignoring interval.
ZERO length suplied to intervalList::add(), ignoring interval.
ZERO length suplied to intervalList::add(), ignoring interval.
ZERO length suplied to intervalList::add(), ignoring interval.
ZERO length suplied to intervalList::add(), ignoring interval.

-- Finished on Thu Jan 15 19:51:44 2026 (one second) with 4587448.75 GB free disk space
----------------------------------------
----------------------------------------
-- Starting command on Thu Jan 15 19:51:44 2026 with 4587448.75 GB free disk space

    cd .
    /share/org/YZWL/yzwl_lixg/miniforge3/envs/canu_v.2.3/bin/tgStoreDump \
      -S ./A2-3.seqStore \
      -T ./unitigging/A2-3.ctgStore 2 \
      -consensus -fasta \
      -contigs \
    > ./A2-3.contigs.fasta
    2> ./A2-3.contigs.err
ZERO length suplied to intervalList::add(), ignoring interval.
ZERO length suplied to intervalList::add(), ignoring interval.
ZERO length suplied to intervalList::add(), ignoring interval.
ZERO length suplied to intervalList::add(), ignoring interval.
ZERO length suplied to intervalList::add(), ignoring interval.
ZERO length suplied to intervalList::add(), ignoring interval.
ZERO length suplied to intervalList::add(), ignoring interval.
ZERO length suplied to intervalList::add(), ignoring interval.
ZERO length suplied to intervalList::add(), ignoring interval.
ZERO length suplied to intervalList::add(), ignoring interval.
ZERO length suplied to intervalList::add(), ignoring interval.
ZERO length suplied to intervalList::add(), ignoring interval.
ZERO length suplied to intervalList::add(), ignoring interval.
ZERO length suplied to intervalList::add(), ignoring interval.
ZERO length suplied to intervalList::add(), ignoring interval.
ZERO length suplied to intervalList::add(), ignoring interval.
ZERO length suplied to intervalList::add(), ignoring interval.
ZERO length suplied to intervalList::add(), ignoring interval.
ZERO length suplied to intervalList::add(), ignoring interval.
ZERO length suplied to intervalList::add(), ignoring interval.
ZERO length suplied to intervalList::add(), ignoring interval.
ZERO length suplied to intervalList::add(), ignoring interval.
ZERO length suplied to intervalList::add(), ignoring interval.
ZERO length suplied to intervalList::add(), ignoring interval.
ZERO length suplied to intervalList::add(), ignoring interval.
ZERO length suplied to intervalList::add(), ignoring interval.
ZERO length suplied to intervalList::add(), ignoring interval.
ZERO length suplied to intervalList::add(), ignoring interval.
ZERO length suplied to intervalList::add(), ignoring interval.
ZERO length suplied to intervalList::add(), ignoring interval.
ZERO length suplied to intervalList::add(), ignoring interval.
ZERO length suplied to intervalList::add(), ignoring interval.
ZERO length suplied to intervalList::add(), ignoring interval.
ZERO length suplied to intervalList::add(), ignoring interval.
ZERO length suplied to intervalList::add(), ignoring interval.
ZERO length suplied to intervalList::add(), ignoring interval.
ZERO length suplied to intervalList::add(), ignoring interval.
ZERO length suplied to intervalList::add(), ignoring interval.
ZERO length suplied to intervalList::add(), ignoring interval.
ZERO length suplied to intervalList::add(), ignoring interval.
ZERO length suplied to intervalList::add(), ignoring interval.
ZERO length suplied to intervalList::add(), ignoring interval.
ZERO length suplied to intervalList::add(), ignoring interval.
ZERO length suplied to intervalList::add(), ignoring interval.

-- Finished on Thu Jan 15 19:51:45 2026 (one second) with 4587448.64 GB free disk space
----------------------------------------
-- Finished stage 'generateOutputs', reset canuIteration.
--
-- Assembly 'A2-3' finished in '/share/org/YZWL/yzwl_lixg/project/28.大豆疫霉菌三代基因组/03.hicanu/A2-3/01.raw_output'.
--
-- Summary saved in 'A2-3.report'.
--
-- Sequences saved:
--   Contigs       -> 'A2-3.contigs.fasta'
--   Unassembled   -> 'A2-3.unassembled.fasta'
--
-- Read layouts saved:
--   Contigs       -> 'A2-3.contigs.layout'.
--
-- Bye.

2026-01-15 19:51:45.687 - WARNING - 输出文件不存在|Output file does not exist: /share/org/YZWL/yzwl_lixg/project/28.大豆疫霉菌三代基因组/03.hicanu/A2-3/01.raw_output/A2-3.unitigs.fasta
Usage: biopytools ragtag [OPTIONS]
Try 'biopytools ragtag -h' for help.

Error: Invalid value for '-r' / '--reference': 文件不存在|File does not exist: /share/org/YZWL/yzwl_lixg/project/28.大豆疫霉菌三代基因组/04.ragtag/Psoja_T2T.fa
Usage: biopytools ragtag [OPTIONS]
Try 'biopytools ragtag -h' for help.

Error: Invalid value for '-r' / '--reference': 文件不存在|File does not exist: /share/org/YZWL/yzwl_lixg/project/28.大豆疫霉菌三代基因组/04.ragtag/Psoja_T2T.fa
mkdir: 无法创建目录 “04.ragtag/A2-3/hicanu/共线性”: No such file or directory
Usage: biopytools genomesyn [OPTIONS]
Try 'biopytools genomesyn -h' for help.

Error: Invalid value for '-i' / '--ref': Path '04.ragtag/A2-3/hifiasm/A2-3_RagTag_scaffolded.fa' does not exist.
Usage: biopytools genomesyn [OPTIONS]
Try 'biopytools genomesyn -h' for help.

Error: Invalid value for '-i' / '--ref': Path '04.ragtag/A2-3/hicanu/A2-3_RagTag_scaffolded.fa' does not exist.
Job 68882060 stderr output:

