Usage: biopytools ragtag [OPTIONS]
Try 'biopytools ragtag -h' for help.

Error: Invalid value for '-r' / '--reference': 文件不存在|File does not exist: /share/org/YZWL/yzwl_lixg/project/28.大豆疫霉菌三代基因组/04.ragtag/Psoja_T2T.fa
Usage: biopytools genomesyn [OPTIONS]
Try 'biopytools genomesyn -h' for help.

Error: Invalid value for '-i' / '--ref': Path '04.ragtag/B3-15/hifiasm/B3-15_RagTag_scaffolded.fa' does not exist.
2026-01-16 02:33:02.579 - WARNING - 命令错误输出|Command stderr:
-- canu master +27 changes (r10515 2a41e933b8de6ed66723d75d36dd071b46d2c347)
--
-- CITATIONS
--
-- For assemblies of PacBio HiFi reads:
--   Nurk S, Walenz BP, Rhiea A, Vollger MR, Logsdon GA, Grothe R, Miga KH, Eichler EE, Phillippy AM, Koren S.
--   HiCanu: accurate assembly of segmental duplications, satellites, and allelic variants from high-fidelity long reads.
--   biorXiv. 2020.
--   https://doi.org/10.1101/2020.03.14.992248
-- 
-- Read and contig alignments during correction and consensus use:
--   Šošic M, Šikic M.
--   Edlib: a C/C ++ library for fast, exact sequence alignment using edit distance.
--   Bioinformatics. 2017 May 1;33(9):1394-1395.
--   http://doi.org/10.1093/bioinformatics/btw753
-- 
-- Overlaps are generated using:
--   Berlin K, et al.
--   Assembling large genomes with single-molecule sequencing and locality-sensitive hashing.
--   Nat Biotechnol. 2015 Jun;33(6):623-30.
--   http://doi.org/10.1038/nbt.3238
-- 
--   Myers EW, et al.
--   A Whole-Genome Assembly of Drosophila.
--   Science. 2000 Mar 24;287(5461):2196-204.
--   http://doi.org/10.1126/science.287.5461.2196
-- 
-- Contig consensus sequences are generated using an algorithm derived from pbdagcon:
--   Chin CS, et al.
--   Nonhybrid, finished microbial genome assemblies from long-read SMRT sequencing data.
--   Nat Methods. 2013 Jun;10(6):563-9
--   http://doi.org/10.1038/nmeth.2474
-- 
-- CONFIGURE CANU
--
-- Detected Java(TM) Runtime Environment '17.0.15-internal' (from '/share/org/YZWL/yzwl_lixg/.local/bin/java') without -d64 support.
--
-- WARNING:
-- WARNING:  Failed to run gnuplot using command 'gnuplot'.
-- WARNING:  Plots will be disabled.
-- WARNING:
--
-- Detected samtools version '1.22' / htslib version 'htscodecs=1.6.3' (from 'samtools').
--
-- Detected 88 CPUs and 503 gigabytes of memory on the local machine.
--
-- Detected Slurm with 'sinfo' binary in /opt/skyformai/bin/sinfo.
--          Slurm disabled by useGrid=false
--
-- Detected  '' with 'pbsnodes' binary in /opt/skyformai/bin/pbsnodes.
--           disabled by useGrid=false
--
-- Detected LSF with 'bsub' binary in /opt/skyformai/bin/bsub.
--          LSF disabled by useGrid=false
--
-- Local machine mode enabled; grid support not detected or not allowed.
--
-- Found trimmed raw PacBio HiFi reads in the input files.
--
--                                (tag)Concurrency
--                         (tag)Threads          |
--                (tag)Memory         |          |
--        (tag)             |         |          |       total usage      algorithm
--        -------  ----------  --------   --------  --------------------  -----------------------------
-- Local: meryl     12.000 GB    4 CPUs x  22 jobs   264.000 GB  88 CPUs  (k-mer counting)
-- Local: cormhap   13.000 GB   11 CPUs x   8 jobs   104.000 GB  88 CPUs  (overlap detection with mhap)
-- Local: obtovl     8.000 GB    8 CPUs x  11 jobs    88.000 GB  88 CPUs  (overlap detection)
-- Local: utgovl     8.000 GB    8 CPUs x  11 jobs    88.000 GB  88 CPUs  (overlap detection)
-- Local: cor        -.--- GB    4 CPUs x   - jobs     -.--- GB   - CPUs  (read correction)
-- Local: ovb        4.000 GB    1 CPU  x  88 jobs   352.000 GB  88 CPUs  (overlap store bucketizer)
-- Local: ovs        8.000 GB    1 CPU  x  62 jobs   496.000 GB  62 CPUs  (overlap store sorting)
-- Local: red       16.000 GB    4 CPUs x  22 jobs   352.000 GB  88 CPUs  (read error detection)
-- Local: oea        8.000 GB    1 CPU  x  62 jobs   496.000 GB  62 CPUs  (overlap error adjustment)
-- Local: bat       32.000 GB    8 CPUs x   1 job     32.000 GB   8 CPUs  (contig construction with bogart)
-- Local: cns        -.--- GB    8 CPUs x   - jobs     -.--- GB   - CPUs  (consensus)
--
-- Generating assembly 'B3-15' in '/share/org/YZWL/yzwl_lixg/project/28.大豆疫霉菌三代基因组/03.hicanu/B3-15/01.raw_output':
--   genomeSize:
--     85000000
--
--   Overlap Generation Limits:
--     corOvlErrorRate 0.0000 (  0.00%)
--     obtOvlErrorRate 0.0250 (  2.50%)
--     utgOvlErrorRate 0.0100 (  1.00%)
--
--   Overlap Processing Limits:
--     corErrorRate    0.0000 (  0.00%)
--     obtErrorRate    0.0250 (  2.50%)
--     utgErrorRate    0.0003 (  0.03%)
--     cnsErrorRate    0.0500 (  5.00%)
--
--   Stages to run:
--     assemble HiFi reads.
--
--
-- BEGIN STORE CREATION
----------------------------------------
-- Starting command on Fri Jan 16 00:15:30 2026 with 4565275.421 GB free disk space

    cd .
    ./B3-15.seqStore.sh \
    > ./B3-15.seqStore.err 2>&1

-- Finished on Fri Jan 16 00:22:49 2026 (439 seconds) with 4564535.578 GB free disk space
----------------------------------------
--
-- In sequence store './B3-15.seqStore':
--   Found 249732 reads.
--   Found 4250006117 bases (50 times coverage).
--    Histogram of corrected reads:
--    
--    G=4250006117                       sum of  ||               length     num
--    NG         length     index       lengths  ||                range    seqs
--    ----- ------------ --------- ------------  ||  ------------------- -------
--    00010        25303     15302    425003681  ||       1225-2339         2003|-----
--    00020        22746     33084    850023387  ||       2340-3454         3657|--------
--    00030        20995     52564   1275016087  ||       3455-4569         3728|---------
--    00040        19609     73532   1700016287  ||       4570-5684         3674|---------
--    00050        18428     95901   2125019159  ||       5685-6799         3720|---------
--    00060        17366    119657   2550004663  ||       6800-7914         3990|---------
--    00070        16370    144863   2975011135  ||       7915-9029         4038|---------
--    00080        15322    171670   3400019552  ||       9030-10144        3853|---------
--    00090        13774    200721   3825005571  ||      10145-11259        3715|---------
--    00100         1225    249732   4250006117  ||      11260-12374        4477|----------
--    001.000x              249732   4250006117  ||      12375-13489        8740|--------------------
--                                               ||      13490-14604       16812|-------------------------------------
--                                               ||      14605-15719       25515|--------------------------------------------------------
--                                               ||      15720-16834       28911|---------------------------------------------------------------
--                                               ||      16835-17949       26610|----------------------------------------------------------
--                                               ||      17950-19064       22995|---------------------------------------------------
--                                               ||      19065-20179       19064|------------------------------------------
--                                               ||      20180-21294       15506|----------------------------------
--                                               ||      21295-22409       12429|----------------------------
--                                               ||      22410-23524        9740|----------------------
--                                               ||      23525-24639        7568|-----------------
--                                               ||      24640-25754        5838|-------------
--                                               ||      25755-26869        4311|----------
--                                               ||      26870-27984        3158|-------
--                                               ||      27985-29099        2200|-----
--                                               ||      29100-30214        1477|----
--                                               ||      30215-31329         959|---
--                                               ||      31330-32444         556|--
--                                               ||      32445-33559         267|-
--                                               ||      33560-34674         132|-
--                                               ||      34675-35789          54|-
--                                               ||      35790-36904          22|-
--                                               ||      36905-38019           7|-
--                                               ||      38020-39134           2|-
--                                               ||      39135-40249           2|-
--                                               ||      40250-41364           0|
--                                               ||      41365-42479           0|
--                                               ||      42480-43594           0|
--                                               ||      43595-44709           0|
--                                               ||      44710-45824           2|-
--    
--
-- In sequence store './B3-15.seqStore':
--   Found 249732 reads.
--   Found 4250006117 bases (50 times coverage).
--    Histogram of corrected-trimmed reads:
--    
--    G=4250006117                       sum of  ||               length     num
--    NG         length     index       lengths  ||                range    seqs
--    ----- ------------ --------- ------------  ||  ------------------- -------
--    00010        25303     15302    425003681  ||       1225-2339         2003|-----
--    00020        22746     33084    850023387  ||       2340-3454         3657|--------
--    00030        20995     52564   1275016087  ||       3455-4569         3728|---------
--    00040        19609     73532   1700016287  ||       4570-5684         3674|---------
--    00050        18428     95901   2125019159  ||       5685-6799         3720|---------
--    00060        17366    119657   2550004663  ||       6800-7914         3990|---------
--    00070        16370    144863   2975011135  ||       7915-9029         4038|---------
--    00080        15322    171670   3400019552  ||       9030-10144        3853|---------
--    00090        13774    200721   3825005571  ||      10145-11259        3715|---------
--    00100         1225    249732   4250006117  ||      11260-12374        4477|----------
--    001.000x              249732   4250006117  ||      12375-13489        8740|--------------------
--                                               ||      13490-14604       16812|-------------------------------------
--                                               ||      14605-15719       25515|--------------------------------------------------------
--                                               ||      15720-16834       28911|---------------------------------------------------------------
--                                               ||      16835-17949       26610|----------------------------------------------------------
--                                               ||      17950-19064       22995|---------------------------------------------------
--                                               ||      19065-20179       19064|------------------------------------------
--                                               ||      20180-21294       15506|----------------------------------
--                                               ||      21295-22409       12429|----------------------------
--                                               ||      22410-23524        9740|----------------------
--                                               ||      23525-24639        7568|-----------------
--                                               ||      24640-25754        5838|-------------
--                                               ||      25755-26869        4311|----------
--                                               ||      26870-27984        3158|-------
--                                               ||      27985-29099        2200|-----
--                                               ||      29100-30214        1477|----
--                                               ||      30215-31329         959|---
--                                               ||      31330-32444         556|--
--                                               ||      32445-33559         267|-
--                                               ||      33560-34674         132|-
--                                               ||      34675-35789          54|-
--                                               ||      35790-36904          22|-
--                                               ||      36905-38019           7|-
--                                               ||      38020-39134           2|-
--                                               ||      39135-40249           2|-
--                                               ||      40250-41364           0|
--                                               ||      41365-42479           0|
--                                               ||      42480-43594           0|
--                                               ||      43595-44709           0|
--                                               ||      44710-45824           2|-
--    
--
-- Correction skipped; not enabled.
--
-- Trimming skipped; not enabled.
--
-- BEGIN ASSEMBLY
----------------------------------------
-- Starting command on Fri Jan 16 00:22:49 2026 with 4564535.531 GB free disk space

    cd unitigging/0-mercounts
    ./meryl-configure.sh \
    > ./meryl-configure.err 2>&1

-- Finished on Fri Jan 16 00:22:50 2026 (one second) with 4564535.531 GB free disk space
----------------------------------------
--  segments   memory batches
--  -------- -------- -------
--        01 10.72 GB       2
--        02  5.61 GB       2
--        04  2.94 GB       2
--        06  2.13 GB       2
--        08  1.60 GB       2
--        12  1.07 GB       2
--        16  0.80 GB       2
--        20  0.64 GB       2
--        24  0.54 GB       2
--        32  0.40 GB       2
--        40  0.32 GB       2
--        48  -.-- GB       -  (segment size too small)
--        56  -.-- GB       -  (segment size too small)
--        64  -.-- GB       -  (segment size too small)
--        96  -.-- GB       -  (segment size too small)
--
--  For 249732 reads with 4250006117 bases, limit to 42 batches.
--  Will count kmers using 01 jobs, each using 12 GB and 4 threads.
--
-- Finished stage 'merylConfigure', reset canuIteration.
--
-- Running jobs.  First attempt out of 2.
----------------------------------------
-- Starting 'meryl' concurrent execution on Fri Jan 16 00:22:50 2026 with 4564535.5 GB free disk space (1 processes; 22 concurrently)

    cd unitigging/0-mercounts
    ./meryl-count.sh 1 > ./meryl-count.000001.out 2>&1

-- Finished on Fri Jan 16 00:26:11 2026 (201 seconds) with 4563928.984 GB free disk space
----------------------------------------
-- Found 1 Kmer counting (meryl) outputs.
-- Finished stage 'utg-merylCountCheck', reset canuIteration.
--
-- Running jobs.  First attempt out of 2.
----------------------------------------
-- Starting 'meryl' concurrent execution on Fri Jan 16 00:26:11 2026 with 4563928.953 GB free disk space (1 processes; 22 concurrently)

    cd unitigging/0-mercounts
    ./meryl-process.sh 1 > ./meryl-process.000001.out 2>&1

-- Finished on Fri Jan 16 00:26:14 2026 (3 seconds) with 4563928.578 GB free disk space
----------------------------------------
-- Meryl finished successfully.  Kmer frequency histogram:
--
-- WARNING: gnuplot failed.
--
----------------------------------------
--
--  22-mers                                                                                           Fraction
--    Occurrences   NumMers                                                                         Unique Total
--       1-     1         0                                                                        0.0000 0.0000
--       2-     2    227758                                                                        0.0051 0.0001
--       3-     4     76533                                                                        0.0063 0.0002
--       5-     7     21024                                                                        0.0070 0.0003
--       8-    11      6647                                                                        0.0073 0.0003
--      12-    16     17731                                                                        0.0074 0.0003
--      17-    22    141334                                                                        0.0080 0.0004
--      23-    29   1085700 ****                                                                   0.0122 0.0017
--      30-    37   6609871 ***************************                                            0.0434 0.0139
--      38-    46  16729431 ********************************************************************** 0.2161 0.0997
--      47-    56  12647519 ****************************************************                   0.5961 0.3297
--      57-    67   2596690 **********                                                             0.8483 0.5120
--      68-    79    696618 **                                                                     0.8960 0.5530
--      80-    92   1043174 ****                                                                   0.9116 0.5694
--      93-   106    684877 **                                                                     0.9349 0.5979
--     107-   121    298527 *                                                                      0.9493 0.6179
--     122-   137    294637 *                                                                      0.9556 0.6281
--     138-   154    246828 *                                                                      0.9622 0.6403
--     155-   172    155974                                                                        0.9675 0.6511
--     173-   191    163978                                                                        0.9710 0.6591
--     192-   211    109369                                                                        0.9746 0.6683
--     212-   232    114611                                                                        0.9770 0.6752
--     233-   254     87333                                                                        0.9796 0.6832
--     255-   277     86902                                                                        0.9815 0.6897
--     278-   301     81891                                                                        0.9834 0.6970
--     302-   326     63121                                                                        0.9852 0.7043
--     327-   352     52761                                                                        0.9866 0.7105
--     353-   379     45602                                                                        0.9878 0.7161
--     380-   407     37728                                                                        0.9888 0.7213
--     408-   436     37820                                                                        0.9896 0.7259
--     437-   466     31806                                                                        0.9905 0.7309
--     467-   497     29458                                                                        0.9912 0.7354
--     498-   529     25199                                                                        0.9918 0.7398
--     530-   562     21310                                                                        0.9924 0.7439
--     563-   596     19886                                                                        0.9928 0.7475
--     597-   631     15152                                                                        0.9933 0.7510
--     632-   667     14806                                                                        0.9936 0.7540
--     668-   704     15417                                                                        0.9939 0.7569
--     705-   742     14414                                                                        0.9943 0.7603
--     743-   781     13275                                                                        0.9946 0.7635
--     782-   821     11891                                                                        0.9949 0.7667
--
--           0 (max occurrences)
--  3195107772 (total mers, non-unique)
--    44891561 (distinct mers, non-unique)
--           0 (unique mers)
-- Finished stage 'meryl-process', reset canuIteration.
--
-- Removing meryl database 'unitigging/0-mercounts/B3-15.ms22'.
--
-- OVERLAPPER (normal) (assembly) erate=0.01
--
----------------------------------------
-- Starting command on Fri Jan 16 00:26:14 2026 with 4563929.546 GB free disk space

    cd unitigging/1-overlapper
    /share/org/YZWL/yzwl_lixg/miniforge3/envs/canu_v.2.3/bin/overlapInCorePartition \
     -S  ../../B3-15.seqStore \
     -hl 160000000 \
     -rl 5000000000 \
     -ol 500 \
     -o  ./B3-15.partition \
    > ./B3-15.partition.err 2>&1

-- Finished on Fri Jan 16 00:26:14 2026 (in the blink of an eye) with 4563929.531 GB free disk space
----------------------------------------
--
-- Configured 21 overlapInCore jobs.
-- Finished stage 'utg-overlapConfigure', reset canuIteration.
--
-- Running jobs.  First attempt out of 2.
----------------------------------------
-- Starting 'utgovl' concurrent execution on Fri Jan 16 00:26:14 2026 with 4563929.5 GB free disk space (21 processes; 11 concurrently)

    cd unitigging/1-overlapper
    ./overlap.sh 1 > ./overlap.000001.out 2>&1
    ./overlap.sh 2 > ./overlap.000002.out 2>&1
    ./overlap.sh 3 > ./overlap.000003.out 2>&1
    ./overlap.sh 4 > ./overlap.000004.out 2>&1
    ./overlap.sh 5 > ./overlap.000005.out 2>&1
    ./overlap.sh 6 > ./overlap.000006.out 2>&1
    ./overlap.sh 7 > ./overlap.000007.out 2>&1
    ./overlap.sh 8 > ./overlap.000008.out 2>&1
    ./overlap.sh 9 > ./overlap.000009.out 2>&1
    ./overlap.sh 10 > ./overlap.000010.out 2>&1
    ./overlap.sh 11 > ./overlap.000011.out 2>&1
    ./overlap.sh 12 > ./overlap.000012.out 2>&1
    ./overlap.sh 13 > ./overlap.000013.out 2>&1
    ./overlap.sh 14 > ./overlap.000014.out 2>&1
    ./overlap.sh 15 > ./overlap.000015.out 2>&1
    ./overlap.sh 16 > ./overlap.000016.out 2>&1
    ./overlap.sh 17 > ./overlap.000017.out 2>&1
    ./overlap.sh 18 > ./overlap.000018.out 2>&1
    ./overlap.sh 19 > ./overlap.000019.out 2>&1
    ./overlap.sh 20 > ./overlap.000020.out 2>&1
    ./overlap.sh 21 > ./overlap.000021.out 2>&1

-- Finished on Fri Jan 16 01:19:26 2026 (3192 seconds) with 4558446.796 GB free disk space
----------------------------------------
-- Found 21 overlapInCore output files.
--
-- overlapInCore compute 'unitigging/1-overlapper':
--   kmer hits
--     with no overlap       1325702868    63128708 +- 40333570.06
--     with an overlap         27088827  4.14285714 +- 902818.224
--
--   overlaps                  27088827  4.14285714 +- 902818.224
--     contained                5175085  .619047619 +- 173353.61
--     dovetail                21913742  1.52380952 +- 729806.244
--
--   overlaps rejected
--     multiple per pair              0           0 +- 0
--     bad short window               0           0 +- 0
--     bad long window                0           0 +- 0
-- Finished stage 'utg-overlapCheck', reset canuIteration.
----------------------------------------
-- Starting command on Fri Jan 16 01:19:26 2026 with 4558446.781 GB free disk space

    cd unitigging
    /share/org/YZWL/yzwl_lixg/miniforge3/envs/canu_v.2.3/bin/ovStoreConfig \
     -S ../B3-15.seqStore \
     -M 4-8 \
     -L ./1-overlapper/ovljob.files \
     -create ./B3-15.ovlStore.config \
     > ./B3-15.ovlStore.config.txt \
    2> ./B3-15.ovlStore.config.err

-- Finished on Fri Jan 16 01:19:27 2026 (one second) with 4558446.765 GB free disk space
----------------------------------------
--
-- Creating overlap store unitigging/B3-15.ovlStore using:
--      1 bucket
--      1 slice
--        using at most 2 GB memory each
--
-- Running jobs.  First attempt out of 2.
----------------------------------------
-- Starting 'ovS' concurrent execution on Fri Jan 16 01:19:27 2026 with 4558446.75 GB free disk space (1 processes; 62 concurrently)

    cd unitigging
    ./B3-15.ovlStore.sh 1 > ./B3-15.ovlStore.000001.out 2>&1

-- Finished on Fri Jan 16 01:19:38 2026 (11 seconds) with 4558729.281 GB free disk space
----------------------------------------
-- Checking store.
----------------------------------------
-- Starting command on Fri Jan 16 01:19:38 2026 with 4558729.281 GB free disk space

    cd unitigging
    /share/org/YZWL/yzwl_lixg/miniforge3/envs/canu_v.2.3/bin/ovStoreDump \
     -S ../B3-15.seqStore \
     -O  ./B3-15.ovlStore \
     -counts \
     > ./B3-15.ovlStore/counts.dat 2> ./B3-15.ovlStore/counts.err

-- Finished on Fri Jan 16 01:19:38 2026 (in the blink of an eye) with 4558729.25 GB free disk space
----------------------------------------
--
-- Overlap store 'unitigging/B3-15.ovlStore' successfully constructed.
-- Found 54177654 overlaps for 237183 reads; 1449505 reads have no overlaps.
--
--
-- Purged 0.602 GB in 63 overlap output files.
----------------------------------------
-- Starting command on Fri Jan 16 01:19:39 2026 with 4558729.25 GB free disk space

    cd unitigging
    /share/org/YZWL/yzwl_lixg/miniforge3/envs/canu_v.2.3/bin/ovStoreStats \
     -C 50 \
     -S ../B3-15.seqStore \
     -O  ./B3-15.ovlStore \
     -o  ./B3-15.ovlStore \
     > ./B3-15.ovlStore.summary.err 2>&1

-- Finished on Fri Jan 16 01:19:47 2026 (8 seconds) with 4558801.218 GB free disk space
----------------------------------------
--
-- Overlap store 'unitigging/B3-15.ovlStore' contains:
--
--   category            reads     %          read length        feature size or coverage  analysis
--   ----------------  -------  -------  ----------------------  ------------------------  --------------------
--   middle-missing        135    0.05    14015.36 +- 5376.90        981.48 +- 1366.84    (bad trimming)
--   middle-hump            54    0.02    14007.48 +- 3376.07       4446.48 +- 2573.76    (bad trimming)
--   no-5-prime            880    0.35    12479.30 +- 3931.20       2175.43 +- 2592.04    (bad trimming)
--   no-3-prime            951    0.38    12139.68 +- 4252.61       2405.56 +- 2901.63    (bad trimming)
--   
--   low-coverage         2626    1.05    10321.24 +- 3531.43          5.73 +- 3.67       (easy to assemble, potential for lower quality consensus)
--   unique             193232   77.38    13089.50 +- 4289.34         44.51 +- 8.33       (easy to assemble, perfect, yay)
--   repeat-cont         13364    5.35    11812.76 +- 4102.90       1437.83 +- 1170.44    (potential for consensus errors, no impact on assembly)
--   repeat-dove           190    0.08    20814.13 +- 2169.91        839.74 +- 920.26     (hard to assemble, likely won't assemble correctly or even at all)
--   
--   span-repeat          2240    0.90    13494.38 +- 3916.42       3424.77 +- 3546.53    (read spans a large repeat, usually easy to assemble)
--   uniq-repeat-cont    14951    5.99    12546.95 +- 3420.54                             (should be uniquely placed, low potential for consensus errors, no impact on assembly)
--   uniq-repeat-dove     2839    1.14    18145.95 +- 3169.37                             (will end contigs, potential to misassemble)
--   uniq-anchor          5721    2.29    13234.67 +- 3612.80       8262.22 +- 4339.91    (repeat read, with unique section, probable bad read)
-- Finished stage 'utg-createOverlapStore', reset canuIteration.
--
-- Loading read lengths.
-- Loading number of overlaps per read.
--
-- Configure RED for 16gb memory.
--                   Batches of at most (unlimited) reads.
--                                      500000000 bases.
--                   Expecting evidence of at most 536870912 bases per iteration.
--
--           Total                                               Reads                 Olaps Evidence
--    Job   Memory      Read Range         Reads        Bases   Memory        Olaps   Memory   Memory  (Memory in MB)
--   ---- -------- ------------------- --------- ------------ -------- ------------ -------- --------
--      1 16386.14         1-39156          5871    109006291 13306.62       656977     7.52  1024.00
--      2 16384.19     39157-83345          6498    108862176 13289.04      2022417    23.14  1024.00
--      3 16385.22     83346-123806         6045    108997689 13305.57       668130     7.65  1024.00
--      4 16385.16    123807-165167         6184    108891226 13292.58      1798131    20.58  1024.00
--      5 16385.78    165168-213421         7162    108906747 13294.51      1684498    19.28  1024.00
--      6 16384.07    213422-257116         6429    108984748 13304.00       705025     8.07  1024.00
--      7 16384.27    257117-298910         6114    108882842 13291.55      1809920    20.71  1024.00
--      8 16385.18    298911-344872         6862    108910005 13294.89      1598091    18.29  1024.00
--      9 16385.83    344873-390484         6619    108991923 13304.89       781702     8.95  1024.00
--     10 16384.50    390485-432332         6098    108870135 13290.00      1965736    22.50  1024.00
--     11 16384.21    432333-477959         6804    108929968 13297.33      1300296    14.88  1024.00
--     12 16385.48    477960-521868         6652    108956255 13300.53      1131301    12.95  1024.00
--     13 16385.08    521869-562137         6074    108947197 13299.41      1194613    13.67  1024.00
--     14 16385.06    562138-606830         6591    108925382 13296.76      1423693    16.29  1024.00
--     15 16384.21    606831-653130         6793    108891362 13292.62      1711849    19.59  1024.00
--     16 16386.35    653131-693414         6021    109008688 13306.91       650000     7.44  1024.00
--     17 16385.35    693415-736787         6472    108874522 13290.55      1992457    22.80  1024.00
--     18 16384.10    736788-783188         6932    108896154 13293.21      1651232    18.90  1024.00
--     19 16384.08    783189-824337         5970    108990353 13304.67       647083     7.41  1024.00
--     20 16384.91    824338-867244         6387    108874366 13290.53      1955812    22.38  1024.00
--     21 16384.67    867245-913804         6900    108906149 13294.42      1594344    18.25  1024.00
--     22 16385.45    913805-954248         5947    109000031 13305.86       663300     7.59  1024.00
--     23 16384.88    954249-997038         6307    108876953 13290.84      1925935    22.04  1024.00
--     24 16385.20    997039-1044408        6918    108896532 13293.25      1743143    19.95  1024.00
--     25 16386.29   1044409-1085065        5905    109007846 13306.81       653760     7.48  1024.00
--     26 16384.57   1085066-1126936        6229    108875291 13290.64      1916403    21.93  1024.00
--     27 16385.85   1126937-1174286        6931    108923382 13296.53      1513538    17.32  1024.00
--     28 16385.37   1174287-1213421        5858    109002102 13306.11       635252     7.27  1024.00
--     29 16384.48   1213422-1255670        6212    108863540 13289.20      2034174    23.28  1024.00
--     30 16384.96   1255671-1301941        6958    108907960 13294.65      1599788    18.31  1024.00
--     31 16385.17   1301942-1341343        5897    109001569 13306.04       623331     7.13  1024.00
--     32 16384.13   1341344-1382965        6141    108864973 13289.37      1988613    22.76  1024.00
--     33 16384.51   1382966-1429827        6974    108916499 13295.69      1469941    16.82  1024.00
--     34 16384.33   1429828-1469438        5830    108994944 13305.23       620223     7.10  1024.00
--     35 16385.14   1469439-1510367        6101    108871532 13290.17      2006550    22.96  1024.00
--     36 16384.06   1510368-1557754        7013    108895572 13293.14      1653507    18.92  1024.00
--     37 16385.36   1557755-1596739        5834    109002879 13306.20       625910     7.16  1024.00
--     38 16386.18   1596740-1638228        6096    108884966 13291.81      1954297    22.37  1024.00
--     39 16385.88   1638229-1685862        6986    108916726 13295.72      1586962    18.16  1024.00
--     40  3291.79   1685863-1686688         117      1798642   219.56        19720     0.23  1024.00
--   ---- -------- ------------------- --------- ------------ -------- ------------ -------- --------
--                                                 4250006117              54177654
-- Finished stage 'readErrorDetectionConfigure', reset canuIteration.
--
-- Running jobs.  First attempt out of 2.
----------------------------------------
-- Starting 'red' concurrent execution on Fri Jan 16 01:19:53 2026 with 4558801.171 GB free disk space (40 processes; 22 concurrently)

    cd unitigging/3-overlapErrorAdjustment
    ./red.sh 1 > ./red.000001.out 2>&1
    ./red.sh 2 > ./red.000002.out 2>&1
    ./red.sh 3 > ./red.000003.out 2>&1
    ./red.sh 4 > ./red.000004.out 2>&1
    ./red.sh 5 > ./red.000005.out 2>&1
    ./red.sh 6 > ./red.000006.out 2>&1
    ./red.sh 7 > ./red.000007.out 2>&1
    ./red.sh 8 > ./red.000008.out 2>&1
    ./red.sh 9 > ./red.000009.out 2>&1
    ./red.sh 10 > ./red.000010.out 2>&1
    ./red.sh 11 > ./red.000011.out 2>&1
    ./red.sh 12 > ./red.000012.out 2>&1
    ./red.sh 13 > ./red.000013.out 2>&1
    ./red.sh 14 > ./red.000014.out 2>&1
    ./red.sh 15 > ./red.000015.out 2>&1
    ./red.sh 16 > ./red.000016.out 2>&1
    ./red.sh 17 > ./red.000017.out 2>&1
    ./red.sh 18 > ./red.000018.out 2>&1
    ./red.sh 19 > ./red.000019.out 2>&1
    ./red.sh 20 > ./red.000020.out 2>&1
    ./red.sh 21 > ./red.000021.out 2>&1
    ./red.sh 22 > ./red.000022.out 2>&1
    ./red.sh 23 > ./red.000023.out 2>&1
    ./red.sh 24 > ./red.000024.out 2>&1
    ./red.sh 25 > ./red.000025.out 2>&1
    ./red.sh 26 > ./red.000026.out 2>&1
    ./red.sh 27 > ./red.000027.out 2>&1
    ./red.sh 28 > ./red.000028.out 2>&1
    ./red.sh 29 > ./red.000029.out 2>&1
    ./red.sh 30 > ./red.000030.out 2>&1
    ./red.sh 31 > ./red.000031.out 2>&1
    ./red.sh 32 > ./red.000032.out 2>&1
    ./red.sh 33 > ./red.000033.out 2>&1
    ./red.sh 34 > ./red.000034.out 2>&1
    ./red.sh 35 > ./red.000035.out 2>&1
    ./red.sh 36 > ./red.000036.out 2>&1
    ./red.sh 37 > ./red.000037.out 2>&1
    ./red.sh 38 > ./red.000038.out 2>&1
    ./red.sh 39 > ./red.000039.out 2>&1
    ./red.sh 40 > ./red.000040.out 2>&1

-- Finished on Fri Jan 16 01:36:49 2026 (1016 seconds) with 4560087.484 GB free disk space
----------------------------------------
-- Found 40 read error detection output files.
-- Finished stage 'readErrorDetectionCheck', reset canuIteration.
--
-- Loading read lengths.
-- Loading number of overlaps per read.
--
-- Configure OEA for 8gb memory.
--                   Batches of at most (unlimited) reads.
--                                      300000000 bases.
--
--           Total                                               Reads                 Olaps  Adjusts
--    Job   Memory      Read Range         Reads        Bases   Memory        Olaps   Memory   Memory  (Memory in MB)
--   ---- -------- ------------------- --------- ------------ -------- ------------ -------- --------
--      1  2808.13         1-113929        16936    300001140   294.62      3227166    98.49   367.02
--      2  2832.69    113930-237405        18358    300013245   294.68      4030295   122.99   367.02
--      3  2831.49    237406-360459        18169    300003390   294.66      3991563   121.81   367.02
--      4  2830.46    360460-478723        17326    300012314   294.64      3958191   120.79   367.02
--      5  2812.18    478724-595796        17579    300013132   294.65      3359083   102.51   367.02
--      6  2835.71    595797-715127        17724    300008750   294.65      4129904   126.03   367.02
--      7  2835.23    715128-836193        17796    300024157   294.67      4113640   125.54   367.02
--      8  2795.61    836194-955624        17735    300012974   294.66      2815705    85.93   367.02
--      9  2835.98    955625-1076294       17650    300001184   294.64      4139246   126.32   367.02
--     10  2829.36   1076295-1195314       17593    300000161   294.64      3922443   119.70   367.02
--     11  2836.20   1195315-1313476       17600    300006032   294.65      4146085   126.53   367.02
--     12  2828.80   1313477-1431572       17581    300000993   294.64      3903904   119.14   367.02
--     13  2834.43   1431573-1548833       17304    300012051   294.64      4088237   124.76   367.02
--     14  2807.38   1548834-1663026       16930    300022779   294.64      3202031    97.72   367.02
--     15  2505.79   1663027-1686688        3451     49873815    55.67      1150161    35.10   367.02
--   ---- -------- ------------------- --------- ------------ -------- ------------ -------- --------
--                                                 4250006117              54177654
-- Finished stage 'overlapErrorAdjustmentConfigure', reset canuIteration.
--
-- Running jobs.  First attempt out of 2.
----------------------------------------
-- Starting 'oea' concurrent execution on Fri Jan 16 01:36:56 2026 with 4560088.578 GB free disk space (15 processes; 62 concurrently)

    cd unitigging/3-overlapErrorAdjustment
    ./oea.sh 1 > ./oea.000001.out 2>&1
    ./oea.sh 2 > ./oea.000002.out 2>&1
    ./oea.sh 3 > ./oea.000003.out 2>&1
    ./oea.sh 4 > ./oea.000004.out 2>&1
    ./oea.sh 5 > ./oea.000005.out 2>&1
    ./oea.sh 6 > ./oea.000006.out 2>&1
    ./oea.sh 7 > ./oea.000007.out 2>&1
    ./oea.sh 8 > ./oea.000008.out 2>&1
    ./oea.sh 9 > ./oea.000009.out 2>&1
    ./oea.sh 10 > ./oea.000010.out 2>&1
    ./oea.sh 11 > ./oea.000011.out 2>&1
    ./oea.sh 12 > ./oea.000012.out 2>&1
    ./oea.sh 13 > ./oea.000013.out 2>&1
    ./oea.sh 14 > ./oea.000014.out 2>&1
    ./oea.sh 15 > ./oea.000015.out 2>&1

-- Finished on Fri Jan 16 02:20:57 2026 (2641 seconds) with 4559416.031 GB free disk space
----------------------------------------
-- Found 15 overlap error adjustment output files.
-- Finished stage 'overlapErrorAdjustmentCheck', reset canuIteration.
----------------------------------------
-- Starting command on Fri Jan 16 02:20:57 2026 with 4559416.015 GB free disk space

    cd unitigging/3-overlapErrorAdjustment
    /share/org/YZWL/yzwl_lixg/miniforge3/envs/canu_v.2.3/bin/loadErates \
      -S ../../B3-15.seqStore \
      -O ../B3-15.ovlStore \
      -L ./oea.files \
    > ./oea.apply.err 2>&1

-- Finished on Fri Jan 16 02:20:57 2026 (lickety-split) with 4559415.906 GB free disk space
----------------------------------------
-- No report available.
-- Finished stage 'updateOverlapStore', reset canuIteration.
-- Finished stage 'unitig', reset canuIteration.
--
-- Running jobs.  First attempt out of 2.
----------------------------------------
-- Starting 'bat' concurrent execution on Fri Jan 16 02:20:57 2026 with 4559415.859 GB free disk space (1 processes; 1 concurrently)

    cd unitigging/4-unitigger
    ./unitigger.sh 1 > ./unitigger.000001.out 2>&1

-- Finished on Fri Jan 16 02:21:11 2026 (14 seconds) with 4559415.687 GB free disk space
----------------------------------------
-- Unitigger finished successfully.
--  
--  ERROR RATES
--  -----------
--                                                   --------threshold------
--  266421                       fraction error      fraction        percent
--  samples                              (1e-5)         error          error
--                   --------------------------      --------       --------
--  command line (-eg)                           ->     30.00        0.0300%
--  command line (-ef)                           ->  -----.--      ---.----%
--  command line (-eM)                           ->     30.00        0.0300%
--  mean + std.dev       0.42 +-  12 *     2.95  ->     35.78        0.0358%
--  median + mad         0.00 +-  12 *     0.00  ->      0.00        0.0000%
--  90th percentile                              ->      1.00        0.0010%  (enabled)
--  
--  BEST EDGE FILTERING
--  -------------------
--  At graph threshold 0.0300%, reads:
--    available to have edges:        49354
--    with at least one edge:         35060
--  
--  At max threshold 0.0300%, reads:
--    available to have edges:        49354
--    with at least one edge:         35060
--  
--  At tight threshold 0.0010%, reads with:
--    both edges below error threshold:     30581  (80.00% minReadsBest threshold = 28048)
--    one  edge  above error threshold:      3256
--    both edges above error threshold:      1223
--    at least one edge:                    35060
--  
--  At loose threshold 0.0300%, reads with:
--    both edges below error threshold:     35060  (80.00% minReadsBest threshold = 28048)
--    one  edge  above error threshold:         0
--    both edges above error threshold:         0
--    at least one edge:                    35060
--  
--  
--  INITIAL EDGES
--  -------- ----------------------------------------
--    194974 reads are contained
--   1461873 reads have no best edges (singleton)
--       612 reads have only one best edge (spur) 
--                369 are mutual best
--     29229 reads have two best edges 
--                813 have one mutual best edge
--              27975 have two mutual best edges
--  
--  
--  FINAL EDGES
--  -------- ----------------------------------------
--    194974 reads are contained
--   1462204 reads have no best edges (singleton)
--       491 reads have only one best edge (spur) 
--                387 are mutual best
--     29019 reads have two best edges 
--                713 have one mutual best edge
--              27967 have two mutual best edges
--  
--  
--  EDGE FILTERING
--  -------- ------------------------------------------
--         0 reads are ignored
--     10388 reads have a gap in overlap coverage
--       144 reads have lopsided best edges
-- Found, in version 1, after unitig construction:
--   contigs:      132 sequences, total length 69628107 bp (including 113 repeats of total length 2634602 bp).
--   bubbles:      133 sequences, total length 3505326 bp.
--   unassembled:  25196 sequences, total length 279891180 bp.
--
-- Contig sizes based on genome size 85mbp:
--
--            NG (bp)  LG (contigs)    sum (bp)
--         ----------  ------------  ----------
--     10     8751035             1     8751035
--     20     6784997             3    22566080
--     30     6459763             4    29025843
--     40     5882542             5    34908385
--     50     3819529             7    43327333
--     60     2999118            10    52891828
--     70     1334856            14    60590607
--     80       28100            53    68003405
--
-- Finished stage 'unitigCheck', reset canuIteration.
----------------------------------------
-- Starting command on Fri Jan 16 02:21:11 2026 with 4559415.671 GB free disk space

    cd unitigging
    /share/org/YZWL/yzwl_lixg/miniforge3/envs/canu_v.2.3/bin/utgcns \
      -S ../B3-15.seqStore \
      -T  ./B3-15.ctgStore 1 \
      -partition 0.8 1.5 0.1 \
    > ./B3-15.ctgStore/partitioning.log 2>&1

-- Finished on Fri Jan 16 02:21:20 2026 (9 seconds) with 4559414.437 GB free disk space
----------------------------------------
-- Using slow alignment for consensus (iteration '0').
-- Configured 10 consensus jobs.
-- Finished stage 'consensusConfigure', reset canuIteration.
--
-- Local: cns       13.000 GB    8 CPUs x  11 jobs   143.000 GB  88 CPUs  (consensus)
--
--
-- Running jobs.  First attempt out of 2.
----------------------------------------
-- Starting 'cns' concurrent execution on Fri Jan 16 02:21:20 2026 with 4559414.406 GB free disk space (10 processes; 11 concurrently)

    cd unitigging/5-consensus
    ./consensus.sh 1 > ./consensus.000001.out 2>&1
    ./consensus.sh 2 > ./consensus.000002.out 2>&1
    ./consensus.sh 3 > ./consensus.000003.out 2>&1
    ./consensus.sh 4 > ./consensus.000004.out 2>&1
    ./consensus.sh 5 > ./consensus.000005.out 2>&1
    ./consensus.sh 6 > ./consensus.000006.out 2>&1
    ./consensus.sh 7 > ./consensus.000007.out 2>&1
    ./consensus.sh 8 > ./consensus.000008.out 2>&1
    ./consensus.sh 9 > ./consensus.000009.out 2>&1
    ./consensus.sh 10 > ./consensus.000010.out 2>&1

-- Finished on Fri Jan 16 02:29:12 2026 (472 seconds) with 4559268.515 GB free disk space
----------------------------------------
-- Using slow alignment for consensus (iteration '1').
-- Configured 10 consensus jobs.
-- All 10 consensus jobs finished successfully.
-- Finished stage 'consensusCheck', reset canuIteration.
-- Using slow alignment for consensus (iteration '0').
-- Configured 10 consensus jobs.
----------------------------------------
-- Starting command on Fri Jan 16 02:29:13 2026 with 4559268.468 GB free disk space

    cd unitigging
    /share/org/YZWL/yzwl_lixg/miniforge3/envs/canu_v.2.3/bin/tgStoreLoad \
      -S ../B3-15.seqStore \
      -T  ./B3-15.ctgStore 2 \
      -L ./5-consensus/ctgcns.files \
    > ./5-consensus/ctgcns.files.ctgStoreLoad.err 2>&1

-- Finished on Fri Jan 16 02:29:14 2026 (one second) with 4559267.421 GB free disk space
----------------------------------------
----------------------------------------
-- Starting command on Fri Jan 16 02:29:14 2026 with 4559267.421 GB free disk space

    cd unitigging
    /share/org/YZWL/yzwl_lixg/miniforge3/envs/canu_v.2.3/bin/tgTigDisplay \
      -S ../B3-15.seqStore \
      -b \
      -o ../B3-15.contigs.unsorted.bam \
      -L ./5-consensus/ctgcns.files \
    > ./5-consensus/ctgcns.files.contigs.bam.err 2>&1

-- Finished on Fri Jan 16 02:31:54 2026 (160 seconds) with 4559187.671 GB free disk space
----------------------------------------
----------------------------------------
-- Starting command on Fri Jan 16 02:31:54 2026 with 4559187.671 GB free disk space

    cd .
    samtools sort \
      --write-index \
      --threads 2 \
      -o ./B3-15.contigs.bam ./B3-15.contigs.unsorted.bam \
    > ./ctgcns.bam.err 2>&1

-- Finished on Fri Jan 16 02:32:58 2026 (64 seconds) with 4559177.937 GB free disk space
----------------------------------------
-- Purging consensus output after loading to ctgStore.
-- Purged 10 .cns outputs.
----------------------------------------
-- Starting command on Fri Jan 16 02:32:58 2026 with 4559180.781 GB free disk space

    cd unitigging
    /share/org/YZWL/yzwl_lixg/miniforge3/envs/canu_v.2.3/bin/tgStoreDump \
      -S ../B3-15.seqStore \
      -T ./B3-15.ctgStore 2 \
      -sizes -s 85000000 \
    > ./B3-15.ctgStore/seqDB.v002.sizes.txt
ZERO length suplied to intervalList::add(), ignoring interval.
ZERO length suplied to intervalList::add(), ignoring interval.
ZERO length suplied to intervalList::add(), ignoring interval.
ZERO length suplied to intervalList::add(), ignoring interval.
ZERO length suplied to intervalList::add(), ignoring interval.
ZERO length suplied to intervalList::add(), ignoring interval.
ZERO length suplied to intervalList::add(), ignoring interval.
ZERO length suplied to intervalList::add(), ignoring interval.
ZERO length suplied to intervalList::add(), ignoring interval.
ZERO length suplied to intervalList::add(), ignoring interval.
ZERO length suplied to intervalList::add(), ignoring interval.
ZERO length suplied to intervalList::add(), ignoring interval.
ZERO length suplied to intervalList::add(), ignoring interval.
ZERO length suplied to intervalList::add(), ignoring interval.
ZERO length suplied to intervalList::add(), ignoring interval.
ZERO length suplied to intervalList::add(), ignoring interval.
ZERO length suplied to intervalList::add(), ignoring interval.
ZERO length suplied to intervalList::add(), ignoring interval.
ZERO length suplied to intervalList::add(), ignoring interval.
ZERO length suplied to intervalList::add(), ignoring interval.
ZERO length suplied to intervalList::add(), ignoring interval.
ZERO length suplied to intervalList::add(), ignoring interval.
ZERO length suplied to intervalList::add(), ignoring interval.
ZERO length suplied to intervalList::add(), ignoring interval.
ZERO length suplied to intervalList::add(), ignoring interval.
ZERO length suplied to intervalList::add(), ignoring interval.
ZERO length suplied to intervalList::add(), ignoring interval.
ZERO length suplied to intervalList::add(), ignoring interval.
ZERO length suplied to intervalList::add(), ignoring interval.
ZERO length suplied to intervalList::add(), ignoring interval.
ZERO length suplied to intervalList::add(), ignoring interval.
ZERO length suplied to intervalList::add(), ignoring interval.
ZERO length suplied to intervalList::add(), ignoring interval.
ZERO length suplied to intervalList::add(), ignoring interval.
ZERO length suplied to intervalList::add(), ignoring interval.
ZERO length suplied to intervalList::add(), ignoring interval.
ZERO length suplied to intervalList::add(), ignoring interval.
ZERO length suplied to intervalList::add(), ignoring interval.
ZERO length suplied to intervalList::add(), ignoring interval.
ZERO length suplied to intervalList::add(), ignoring interval.
ZERO length suplied to intervalList::add(), ignoring interval.
ZERO length suplied to intervalList::add(), ignoring interval.
ZERO length suplied to intervalList::add(), ignoring interval.
ZERO length suplied to intervalList::add(), ignoring interval.
ZERO length suplied to intervalList::add(), ignoring interval.
ZERO length suplied to intervalList::add(), ignoring interval.
ZERO length suplied to intervalList::add(), ignoring interval.
ZERO length suplied to intervalList::add(), ignoring interval.

-- Finished on Fri Jan 16 02:32:59 2026 (one second) with 4559180.781 GB free disk space
----------------------------------------
-- Found, in version 2, after consensus generation:
--   contigs:      132 sequences, total length 91205702 bp (including 113 repeats of total length 3640514 bp).
--   bubbles:      133 sequences, total length 4805772 bp.
--   unassembled:  25196 sequences, total length 420871124 bp.
--
-- Contig sizes based on genome size 85mbp:
--
--            NG (bp)  LG (contigs)    sum (bp)
--         ----------  ------------  ----------
--     10    11373369             1    11373369
--     20     9142940             2    20516309
--     30     8845622             3    29361931
--     40     8391213             4    37753144
--     50     7637527             5    45390671
--     60     5991980             6    51382651
--     70     4618122             8    60988794
--     80     3911144            10    68842576
--     90     2287134            13    77151897
--    100      656243            19    85506837
--
-- Finished stage 'consensusLoad', reset canuIteration.
----------------------------------------
-- Starting command on Fri Jan 16 02:32:59 2026 with 4559180.765 GB free disk space

    cd .
    /share/org/YZWL/yzwl_lixg/miniforge3/envs/canu_v.2.3/bin/tgStoreDump \
      -S ./B3-15.seqStore \
      -T ./unitigging/B3-15.ctgStore 2 \
      -o ./B3-15.contigs \
      -layout \
    > ./B3-15.contigs.layout.err 2>&1

-- Finished on Fri Jan 16 02:32:59 2026 (furiously fast) with 4559180.718 GB free disk space
----------------------------------------
----------------------------------------
-- Starting command on Fri Jan 16 02:32:59 2026 with 4559180.718 GB free disk space

    cd .
    /share/org/YZWL/yzwl_lixg/miniforge3/envs/canu_v.2.3/bin/tgStoreDump \
      -S ./B3-15.seqStore \
      -T ./unitigging/B3-15.ctgStore 2 \
      -consensus -fasta \
      -unassembled \
    > ./B3-15.unassembled.fasta
    2> ./B3-15.unassembled.err
ZERO length suplied to intervalList::add(), ignoring interval.
ZERO length suplied to intervalList::add(), ignoring interval.
ZERO length suplied to intervalList::add(), ignoring interval.
ZERO length suplied to intervalList::add(), ignoring interval.
ZERO length suplied to intervalList::add(), ignoring interval.
ZERO length suplied to intervalList::add(), ignoring interval.
ZERO length suplied to intervalList::add(), ignoring interval.
ZERO length suplied to intervalList::add(), ignoring interval.
ZERO length suplied to intervalList::add(), ignoring interval.
ZERO length suplied to intervalList::add(), ignoring interval.
ZERO length suplied to intervalList::add(), ignoring interval.
ZERO length suplied to intervalList::add(), ignoring interval.
ZERO length suplied to intervalList::add(), ignoring interval.
ZERO length suplied to intervalList::add(), ignoring interval.
ZERO length suplied to intervalList::add(), ignoring interval.
ZERO length suplied to intervalList::add(), ignoring interval.
ZERO length suplied to intervalList::add(), ignoring interval.
ZERO length suplied to intervalList::add(), ignoring interval.
ZERO length suplied to intervalList::add(), ignoring interval.
ZERO length suplied to intervalList::add(), ignoring interval.
ZERO length suplied to intervalList::add(), ignoring interval.
ZERO length suplied to intervalList::add(), ignoring interval.
ZERO length suplied to intervalList::add(), ignoring interval.
ZERO length suplied to intervalList::add(), ignoring interval.
ZERO length suplied to intervalList::add(), ignoring interval.
ZERO length suplied to intervalList::add(), ignoring interval.
ZERO length suplied to intervalList::add(), ignoring interval.
ZERO length suplied to intervalList::add(), ignoring interval.
ZERO length suplied to intervalList::add(), ignoring interval.
ZERO length suplied to intervalList::add(), ignoring interval.
ZERO length suplied to intervalList::add(), ignoring interval.
ZERO length suplied to intervalList::add(), ignoring interval.
ZERO length suplied to intervalList::add(), ignoring interval.
ZERO length suplied to intervalList::add(), ignoring interval.
ZERO length suplied to intervalList::add(), ignoring interval.
ZERO length suplied to intervalList::add(), ignoring interval.
ZERO length suplied to intervalList::add(), ignoring interval.
ZERO length suplied to intervalList::add(), ignoring interval.
ZERO length suplied to intervalList::add(), ignoring interval.
ZERO length suplied to intervalList::add(), ignoring interval.
ZERO length suplied to intervalList::add(), ignoring interval.
ZERO length suplied to intervalList::add(), ignoring interval.
ZERO length suplied to intervalList::add(), ignoring interval.
ZERO length suplied to intervalList::add(), ignoring interval.
ZERO length suplied to intervalList::add(), ignoring interval.
ZERO length suplied to intervalList::add(), ignoring interval.
ZERO length suplied to intervalList::add(), ignoring interval.
ZERO length suplied to intervalList::add(), ignoring interval.

-- Finished on Fri Jan 16 02:33:01 2026 (2 seconds) with 4559180.296 GB free disk space
----------------------------------------
----------------------------------------
-- Starting command on Fri Jan 16 02:33:01 2026 with 4559180.296 GB free disk space

    cd .
    /share/org/YZWL/yzwl_lixg/miniforge3/envs/canu_v.2.3/bin/tgStoreDump \
      -S ./B3-15.seqStore \
      -T ./unitigging/B3-15.ctgStore 2 \
      -consensus -fasta \
      -contigs \
    > ./B3-15.contigs.fasta
    2> ./B3-15.contigs.err
ZERO length suplied to intervalList::add(), ignoring interval.
ZERO length suplied to intervalList::add(), ignoring interval.
ZERO length suplied to intervalList::add(), ignoring interval.
ZERO length suplied to intervalList::add(), ignoring interval.
ZERO length suplied to intervalList::add(), ignoring interval.
ZERO length suplied to intervalList::add(), ignoring interval.
ZERO length suplied to intervalList::add(), ignoring interval.
ZERO length suplied to intervalList::add(), ignoring interval.
ZERO length suplied to intervalList::add(), ignoring interval.
ZERO length suplied to intervalList::add(), ignoring interval.
ZERO length suplied to intervalList::add(), ignoring interval.
ZERO length suplied to intervalList::add(), ignoring interval.
ZERO length suplied to intervalList::add(), ignoring interval.
ZERO length suplied to intervalList::add(), ignoring interval.
ZERO length suplied to intervalList::add(), ignoring interval.
ZERO length suplied to intervalList::add(), ignoring interval.
ZERO length suplied to intervalList::add(), ignoring interval.
ZERO length suplied to intervalList::add(), ignoring interval.
ZERO length suplied to intervalList::add(), ignoring interval.
ZERO length suplied to intervalList::add(), ignoring interval.
ZERO length suplied to intervalList::add(), ignoring interval.
ZERO length suplied to intervalList::add(), ignoring interval.
ZERO length suplied to intervalList::add(), ignoring interval.
ZERO length suplied to intervalList::add(), ignoring interval.
ZERO length suplied to intervalList::add(), ignoring interval.
ZERO length suplied to intervalList::add(), ignoring interval.
ZERO length suplied to intervalList::add(), ignoring interval.
ZERO length suplied to intervalList::add(), ignoring interval.
ZERO length suplied to intervalList::add(), ignoring interval.
ZERO length suplied to intervalList::add(), ignoring interval.
ZERO length suplied to intervalList::add(), ignoring interval.
ZERO length suplied to intervalList::add(), ignoring interval.
ZERO length suplied to intervalList::add(), ignoring interval.
ZERO length suplied to intervalList::add(), ignoring interval.
ZERO length suplied to intervalList::add(), ignoring interval.
ZERO length suplied to intervalList::add(), ignoring interval.
ZERO length suplied to intervalList::add(), ignoring interval.
ZERO length suplied to intervalList::add(), ignoring interval.
ZERO length suplied to intervalList::add(), ignoring interval.
ZERO length suplied to intervalList::add(), ignoring interval.
ZERO length suplied to intervalList::add(), ignoring interval.
ZERO length suplied to intervalList::add(), ignoring interval.
ZERO length suplied to intervalList::add(), ignoring interval.
ZERO length suplied to intervalList::add(), ignoring interval.
ZERO length suplied to intervalList::add(), ignoring interval.
ZERO length suplied to intervalList::add(), ignoring interval.
ZERO length suplied to intervalList::add(), ignoring interval.
ZERO length suplied to intervalList::add(), ignoring interval.

-- Finished on Fri Jan 16 02:33:02 2026 (one second) with 4559180.187 GB free disk space
----------------------------------------
-- Finished stage 'generateOutputs', reset canuIteration.
--
-- Assembly 'B3-15' finished in '/share/org/YZWL/yzwl_lixg/project/28.大豆疫霉菌三代基因组/03.hicanu/B3-15/01.raw_output'.
--
-- Summary saved in 'B3-15.report'.
--
-- Sequences saved:
--   Contigs       -> 'B3-15.contigs.fasta'
--   Unassembled   -> 'B3-15.unassembled.fasta'
--
-- Read layouts saved:
--   Contigs       -> 'B3-15.contigs.layout'.
--
-- Bye.

2026-01-16 02:33:02.582 - WARNING - 输出文件不存在|Output file does not exist: /share/org/YZWL/yzwl_lixg/project/28.大豆疫霉菌三代基因组/03.hicanu/B3-15/01.raw_output/B3-15.unitigs.fasta
Usage: biopytools ragtag [OPTIONS]
Try 'biopytools ragtag -h' for help.

Error: Invalid value for '-r' / '--reference': 文件不存在|File does not exist: /share/org/YZWL/yzwl_lixg/project/28.大豆疫霉菌三代基因组/04.ragtag/Psoja_T2T.fa
Usage: biopytools genomesyn [OPTIONS]
Try 'biopytools genomesyn -h' for help.

Error: Invalid value for '-i' / '--ref': Path '04.ragtag/B3-15/hicanu/B3-15_RagTag_scaffolded.fa' does not exist.
Job 68886834 stderr output:

