2026-01-16 16:35:37.565 - WARNING - 命令错误输出|Command stderr:
-- canu master +27 changes (r10515 2a41e933b8de6ed66723d75d36dd071b46d2c347)
--
-- CITATIONS
--
-- For assemblies of PacBio HiFi reads:
--   Nurk S, Walenz BP, Rhiea A, Vollger MR, Logsdon GA, Grothe R, Miga KH, Eichler EE, Phillippy AM, Koren S.
--   HiCanu: accurate assembly of segmental duplications, satellites, and allelic variants from high-fidelity long reads.
--   biorXiv. 2020.
--   https://doi.org/10.1101/2020.03.14.992248
-- 
-- Read and contig alignments during correction and consensus use:
--   Šošic M, Šikic M.
--   Edlib: a C/C ++ library for fast, exact sequence alignment using edit distance.
--   Bioinformatics. 2017 May 1;33(9):1394-1395.
--   http://doi.org/10.1093/bioinformatics/btw753
-- 
-- Overlaps are generated using:
--   Berlin K, et al.
--   Assembling large genomes with single-molecule sequencing and locality-sensitive hashing.
--   Nat Biotechnol. 2015 Jun;33(6):623-30.
--   http://doi.org/10.1038/nbt.3238
-- 
--   Myers EW, et al.
--   A Whole-Genome Assembly of Drosophila.
--   Science. 2000 Mar 24;287(5461):2196-204.
--   http://doi.org/10.1126/science.287.5461.2196
-- 
-- Contig consensus sequences are generated using an algorithm derived from pbdagcon:
--   Chin CS, et al.
--   Nonhybrid, finished microbial genome assemblies from long-read SMRT sequencing data.
--   Nat Methods. 2013 Jun;10(6):563-9
--   http://doi.org/10.1038/nmeth.2474
-- 
-- CONFIGURE CANU
--
-- Detected Java(TM) Runtime Environment '25.0.1-internal' (from '/share/org/YZWL/yzwl_lixg/miniforge3/envs/telocomp/lib/jvm/bin/java') without -d64 support.
--
-- WARNING:
-- WARNING:  Failed to run gnuplot using command 'gnuplot'.
-- WARNING:  Plots will be disabled.
-- WARNING:
--
-- Detected samtools version '1.22' / htslib version 'htscodecs=1.6.3' (from 'samtools').
--
-- Detected 88 CPUs and 503 gigabytes of memory on the local machine.
--
-- Detected Slurm with 'sinfo' binary in /opt/skyformai/bin/sinfo.
--          Slurm disabled by useGrid=false
--
-- Detected  '' with 'pbsnodes' binary in /opt/skyformai/bin/pbsnodes.
--           disabled by useGrid=false
--
-- Detected LSF with 'bsub' binary in /opt/skyformai/bin/bsub.
--          LSF disabled by useGrid=false
--
-- Local machine mode enabled; grid support not detected or not allowed.
--
-- Found trimmed raw PacBio HiFi reads in the input files.
--
--                                (tag)Concurrency
--                         (tag)Threads          |
--                (tag)Memory         |          |
--        (tag)             |         |          |       total usage      algorithm
--        -------  ----------  --------   --------  --------------------  -----------------------------
-- Local: meryl     12.000 GB    4 CPUs x  22 jobs   264.000 GB  88 CPUs  (k-mer counting)
-- Local: cormhap   13.000 GB   11 CPUs x   8 jobs   104.000 GB  88 CPUs  (overlap detection with mhap)
-- Local: obtovl     8.000 GB    8 CPUs x  11 jobs    88.000 GB  88 CPUs  (overlap detection)
-- Local: utgovl     8.000 GB    8 CPUs x  11 jobs    88.000 GB  88 CPUs  (overlap detection)
-- Local: cor        -.--- GB    4 CPUs x   - jobs     -.--- GB   - CPUs  (read correction)
-- Local: ovb        4.000 GB    1 CPU  x  88 jobs   352.000 GB  88 CPUs  (overlap store bucketizer)
-- Local: ovs        8.000 GB    1 CPU  x  62 jobs   496.000 GB  62 CPUs  (overlap store sorting)
-- Local: red       16.000 GB    4 CPUs x  22 jobs   352.000 GB  88 CPUs  (read error detection)
-- Local: oea        8.000 GB    1 CPU  x  62 jobs   496.000 GB  62 CPUs  (overlap error adjustment)
-- Local: bat       32.000 GB    8 CPUs x   1 job     32.000 GB   8 CPUs  (contig construction with bogart)
-- Local: cns        -.--- GB    8 CPUs x   - jobs     -.--- GB   - CPUs  (consensus)
--
-- Generating assembly 'A3-48' in '/share/org/YZWL/yzwl_lixg/project/28.大豆疫霉菌三代基因组/03.hicanu/A3-48/01.raw_output':
--   genomeSize:
--     85000000
--
--   Overlap Generation Limits:
--     corOvlErrorRate 0.0000 (  0.00%)
--     obtOvlErrorRate 0.0250 (  2.50%)
--     utgOvlErrorRate 0.0100 (  1.00%)
--
--   Overlap Processing Limits:
--     corErrorRate    0.0000 (  0.00%)
--     obtErrorRate    0.0250 (  2.50%)
--     utgErrorRate    0.0003 (  0.03%)
--     cnsErrorRate    0.0500 (  5.00%)
--
--   Stages to run:
--     assemble HiFi reads.
--
--
-- BEGIN STORE CREATION
----------------------------------------
-- Starting command on Fri Jan 16 14:28:19 2026 with 4530562.093 GB free disk space

    cd .
    ./A3-48.seqStore.sh \
    > ./A3-48.seqStore.err 2>&1

-- Finished on Fri Jan 16 14:36:42 2026 (503 seconds) with 4529153.015 GB free disk space
----------------------------------------
--
-- In sequence store './A3-48.seqStore':
--   Found 239136 reads.
--   Found 4250015123 bases (50 times coverage).
--    Histogram of corrected reads:
--    
--    G=4250015123                       sum of  ||               length     num
--    NG         length     index       lengths  ||                range    seqs
--    ----- ------------ --------- ------------  ||  ------------------- -------
--    00010        26981     14496    425005094  ||       1235-2351         4276|------------
--    00020        24591     31055    850013893  ||       2352-3468         6828|------------------
--    00030        22971     48964   1275024236  ||       3469-4585         6473|-----------------
--    00040        21687     68019   1700023156  ||       4586-5702         5925|----------------
--    00050        20620     88120   2125015920  ||       5703-6819         5365|---------------
--    00060        19610    109257   2550020653  ||       6820-7936         4871|-------------
--    00070        18567    131514   2975019999  ||       7937-9053         4468|------------
--    00080        17284    155188   3400026949  ||       9054-10170        4190|-----------
--    00090        14736    181343   3825016790  ||      10171-11287        3843|-----------
--    00100         1235    239136   4250015123  ||      11288-12404        3474|----------
--    001.000x              239136   4250015123  ||      12405-13521        3278|---------
--                                               ||      13522-14638        4290|------------
--                                               ||      14639-15755        7504|--------------------
--                                               ||      15756-16872       12894|----------------------------------
--                                               ||      16873-17989       18584|-------------------------------------------------
--                                               ||      17990-19106       22654|------------------------------------------------------------
--                                               ||      19107-20223       24024|---------------------------------------------------------------
--                                               ||      20224-21340       21936|----------------------------------------------------------
--                                               ||      21341-22457       18199|------------------------------------------------
--                                               ||      22458-23574       14530|---------------------------------------
--                                               ||      23575-24691       11367|------------------------------
--                                               ||      24692-25808        8766|-----------------------
--                                               ||      25809-26925        6607|------------------
--                                               ||      26926-28042        4893|-------------
--                                               ||      28043-29159        3547|----------
--                                               ||      29160-30276        2558|-------
--                                               ||      30277-31393        1693|-----
--                                               ||      31394-32510         989|---
--                                               ||      32511-33627         575|--
--                                               ||      33628-34744         316|-
--                                               ||      34745-35861         142|-
--                                               ||      35862-36978          48|-
--                                               ||      36979-38095           9|-
--                                               ||      38096-39212           5|-
--                                               ||      39213-40329           7|-
--                                               ||      40330-41446           2|-
--                                               ||      41447-42563           1|-
--                                               ||      42564-43680           3|-
--                                               ||      43681-44797           0|
--                                               ||      44798-45914           2|-
--    
--
-- In sequence store './A3-48.seqStore':
--   Found 239136 reads.
--   Found 4250015123 bases (50 times coverage).
--    Histogram of corrected-trimmed reads:
--    
--    G=4250015123                       sum of  ||               length     num
--    NG         length     index       lengths  ||                range    seqs
--    ----- ------------ --------- ------------  ||  ------------------- -------
--    00010        26981     14496    425005094  ||       1235-2351         4276|------------
--    00020        24591     31055    850013893  ||       2352-3468         6828|------------------
--    00030        22971     48964   1275024236  ||       3469-4585         6473|-----------------
--    00040        21687     68019   1700023156  ||       4586-5702         5925|----------------
--    00050        20620     88120   2125015920  ||       5703-6819         5365|---------------
--    00060        19610    109257   2550020653  ||       6820-7936         4871|-------------
--    00070        18567    131514   2975019999  ||       7937-9053         4468|------------
--    00080        17284    155188   3400026949  ||       9054-10170        4190|-----------
--    00090        14736    181343   3825016790  ||      10171-11287        3843|-----------
--    00100         1235    239136   4250015123  ||      11288-12404        3474|----------
--    001.000x              239136   4250015123  ||      12405-13521        3278|---------
--                                               ||      13522-14638        4290|------------
--                                               ||      14639-15755        7504|--------------------
--                                               ||      15756-16872       12894|----------------------------------
--                                               ||      16873-17989       18584|-------------------------------------------------
--                                               ||      17990-19106       22654|------------------------------------------------------------
--                                               ||      19107-20223       24024|---------------------------------------------------------------
--                                               ||      20224-21340       21936|----------------------------------------------------------
--                                               ||      21341-22457       18199|------------------------------------------------
--                                               ||      22458-23574       14530|---------------------------------------
--                                               ||      23575-24691       11367|------------------------------
--                                               ||      24692-25808        8766|-----------------------
--                                               ||      25809-26925        6607|------------------
--                                               ||      26926-28042        4893|-------------
--                                               ||      28043-29159        3547|----------
--                                               ||      29160-30276        2558|-------
--                                               ||      30277-31393        1693|-----
--                                               ||      31394-32510         989|---
--                                               ||      32511-33627         575|--
--                                               ||      33628-34744         316|-
--                                               ||      34745-35861         142|-
--                                               ||      35862-36978          48|-
--                                               ||      36979-38095           9|-
--                                               ||      38096-39212           5|-
--                                               ||      39213-40329           7|-
--                                               ||      40330-41446           2|-
--                                               ||      41447-42563           1|-
--                                               ||      42564-43680           3|-
--                                               ||      43681-44797           0|
--                                               ||      44798-45914           2|-
--    
--
-- Correction skipped; not enabled.
--
-- Trimming skipped; not enabled.
--
-- BEGIN ASSEMBLY
----------------------------------------
-- Starting command on Fri Jan 16 14:36:43 2026 with 4529152.968 GB free disk space

    cd unitigging/0-mercounts
    ./meryl-configure.sh \
    > ./meryl-configure.err 2>&1

-- Finished on Fri Jan 16 14:36:44 2026 (one second) with 4529152.968 GB free disk space
----------------------------------------
--  segments   memory batches
--  -------- -------- -------
--        01 10.81 GB       2
--        02  5.61 GB       2
--        04  2.97 GB       2
--        06  2.14 GB       2
--        08  1.60 GB       2
--        12  1.07 GB       2
--        16  0.81 GB       2
--        20  0.65 GB       2
--        24  0.54 GB       2
--        32  0.41 GB       2
--        40  0.32 GB       2
--        48  -.-- GB       -  (segment size too small)
--        56  -.-- GB       -  (segment size too small)
--        64  -.-- GB       -  (segment size too small)
--        96  -.-- GB       -  (segment size too small)
--
--  For 239136 reads with 4250015123 bases, limit to 42 batches.
--  Will count kmers using 01 jobs, each using 12 GB and 4 threads.
--
-- Finished stage 'merylConfigure', reset canuIteration.
--
-- Running jobs.  First attempt out of 2.
----------------------------------------
-- Starting 'meryl' concurrent execution on Fri Jan 16 14:36:44 2026 with 4529152.937 GB free disk space (1 processes; 22 concurrently)

    cd unitigging/0-mercounts
    ./meryl-count.sh 1 > ./meryl-count.000001.out 2>&1

-- Finished on Fri Jan 16 14:40:10 2026 (206 seconds) with 4529201.968 GB free disk space
----------------------------------------
-- Found 1 Kmer counting (meryl) outputs.
-- Finished stage 'utg-merylCountCheck', reset canuIteration.
--
-- Running jobs.  First attempt out of 2.
----------------------------------------
-- Starting 'meryl' concurrent execution on Fri Jan 16 14:40:10 2026 with 4529201.937 GB free disk space (1 processes; 22 concurrently)

    cd unitigging/0-mercounts
    ./meryl-process.sh 1 > ./meryl-process.000001.out 2>&1

-- Finished on Fri Jan 16 14:40:15 2026 (5 seconds) with 4529202.64 GB free disk space
----------------------------------------
-- Meryl finished successfully.  Kmer frequency histogram:
--
-- WARNING: gnuplot failed.
--
----------------------------------------
--
--  22-mers                                                                                           Fraction
--    Occurrences   NumMers                                                                         Unique Total
--       1-     1         0                                                                        0.0000 0.0000
--       2-     2    247437 *                                                                      0.0055 0.0002
--       3-     4     88122                                                                        0.0068 0.0002
--       5-     7     30519                                                                        0.0078 0.0003
--       8-    11     12757                                                                        0.0082 0.0003
--      12-    16     16048                                                                        0.0085 0.0004
--      17-    22    123294                                                                        0.0089 0.0004
--      23-    29    937983 ****                                                                   0.0125 0.0015
--      30-    37   6214907 **************************                                             0.0402 0.0124
--      38-    46  16178631 ********************************************************************** 0.2014 0.0923
--      47-    56  13478729 **********************************************************             0.5727 0.3175
--      57-    67   2949943 ************                                                           0.8418 0.5123
--      68-    79    707814 ***                                                                    0.8954 0.5583
--      80-    92    990091 ****                                                                   0.9110 0.5746
--      93-   106    779707 ***                                                                    0.9332 0.6018
--     107-   121    301435 *                                                                      0.9496 0.6247
--     122-   137    274130 *                                                                      0.9559 0.6348
--     138-   154    242518 *                                                                      0.9621 0.6461
--     155-   172    147372                                                                        0.9672 0.6568
--     173-   191    155514                                                                        0.9705 0.6643
--     192-   211    125772                                                                        0.9739 0.6730
--     212-   232    120879                                                                        0.9767 0.6809
--     233-   254     97825                                                                        0.9793 0.6892
--     255-   277     88020                                                                        0.9815 0.6966
--     278-   301     70814                                                                        0.9834 0.7039
--     302-   326     59263                                                                        0.9850 0.7102
--     327-   352     55378                                                                        0.9863 0.7160
--     353-   379     44827                                                                        0.9875 0.7218
--     380-   407     36122                                                                        0.9885 0.7268
--     408-   436     32836                                                                        0.9893 0.7313
--     437-   466     34807                                                                        0.9900 0.7356
--     467-   497     28788                                                                        0.9908 0.7404
--     498-   529     24158                                                                        0.9914 0.7448
--     530-   562     21159                                                                        0.9920 0.7486
--     563-   596     19843                                                                        0.9924 0.7522
--     597-   631     17667                                                                        0.9929 0.7558
--     632-   667     15369                                                                        0.9933 0.7591
--     668-   704     15227                                                                        0.9936 0.7622
--     705-   742     11337                                                                        0.9939 0.7655
--     743-   781     12622                                                                        0.9942 0.7680
--     782-   821     15847                                                                        0.9945 0.7711
--
--           0 (max occurrences)
--  3209016977 (total mers, non-unique)
--    45059499 (distinct mers, non-unique)
--           0 (unique mers)
-- Finished stage 'meryl-process', reset canuIteration.
--
-- Removing meryl database 'unitigging/0-mercounts/A3-48.ms22'.
--
-- OVERLAPPER (normal) (assembly) erate=0.01
--
----------------------------------------
-- Starting command on Fri Jan 16 14:40:15 2026 with 4529202.625 GB free disk space

    cd unitigging/1-overlapper
    /share/org/YZWL/yzwl_lixg/miniforge3/envs/canu_v.2.3/bin/overlapInCorePartition \
     -S  ../../A3-48.seqStore \
     -hl 160000000 \
     -rl 5000000000 \
     -ol 500 \
     -o  ./A3-48.partition \
    > ./A3-48.partition.err 2>&1

-- Finished on Fri Jan 16 14:40:16 2026 (one second) with 4529202.609 GB free disk space
----------------------------------------
--
-- Configured 21 overlapInCore jobs.
-- Finished stage 'utg-overlapConfigure', reset canuIteration.
--
-- Running jobs.  First attempt out of 2.
----------------------------------------
-- Starting 'utgovl' concurrent execution on Fri Jan 16 14:40:16 2026 with 4529202.578 GB free disk space (21 processes; 11 concurrently)

    cd unitigging/1-overlapper
    ./overlap.sh 1 > ./overlap.000001.out 2>&1
    ./overlap.sh 2 > ./overlap.000002.out 2>&1
    ./overlap.sh 3 > ./overlap.000003.out 2>&1
    ./overlap.sh 4 > ./overlap.000004.out 2>&1
    ./overlap.sh 5 > ./overlap.000005.out 2>&1
    ./overlap.sh 6 > ./overlap.000006.out 2>&1
    ./overlap.sh 7 > ./overlap.000007.out 2>&1
    ./overlap.sh 8 > ./overlap.000008.out 2>&1
    ./overlap.sh 9 > ./overlap.000009.out 2>&1
    ./overlap.sh 10 > ./overlap.000010.out 2>&1
    ./overlap.sh 11 > ./overlap.000011.out 2>&1
    ./overlap.sh 12 > ./overlap.000012.out 2>&1
    ./overlap.sh 13 > ./overlap.000013.out 2>&1
    ./overlap.sh 14 > ./overlap.000014.out 2>&1
    ./overlap.sh 15 > ./overlap.000015.out 2>&1
    ./overlap.sh 16 > ./overlap.000016.out 2>&1
    ./overlap.sh 17 > ./overlap.000017.out 2>&1
    ./overlap.sh 18 > ./overlap.000018.out 2>&1
    ./overlap.sh 19 > ./overlap.000019.out 2>&1
    ./overlap.sh 20 > ./overlap.000020.out 2>&1
    ./overlap.sh 21 > ./overlap.000021.out 2>&1

-- Finished on Fri Jan 16 15:06:32 2026 (1576 seconds) with 4526645.734 GB free disk space
----------------------------------------
-- Found 21 overlapInCore output files.
--
-- overlapInCore compute 'unitigging/1-overlapper':
--   kmer hits
--     with no overlap       1262463098  90.3809524 +- 38055377.625
--     with an overlap         41470671  3.85714286 +- 1137998.915
--
--   overlaps                  41470671  3.85714286 +- 1137998.915
--     contained                8812573  .333333333 +- 241409.644
--     dovetail                32658098  7.52380952 +- 899956.936
--
--   overlaps rejected
--     multiple per pair              0           0 +- 0
--     bad short window               0           0 +- 0
--     bad long window                0           0 +- 0
-- Finished stage 'utg-overlapCheck', reset canuIteration.
----------------------------------------
-- Starting command on Fri Jan 16 15:06:32 2026 with 4526645.718 GB free disk space

    cd unitigging
    /share/org/YZWL/yzwl_lixg/miniforge3/envs/canu_v.2.3/bin/ovStoreConfig \
     -S ../A3-48.seqStore \
     -M 4-8 \
     -L ./1-overlapper/ovljob.files \
     -create ./A3-48.ovlStore.config \
     > ./A3-48.ovlStore.config.txt \
    2> ./A3-48.ovlStore.config.err

-- Finished on Fri Jan 16 15:06:32 2026 (in the blink of an eye) with 4526645.703 GB free disk space
----------------------------------------
--
-- Creating overlap store unitigging/A3-48.ovlStore using:
--      1 bucket
--      1 slice
--        using at most 3 GB memory each
--
-- Running jobs.  First attempt out of 2.
----------------------------------------
-- Starting 'ovS' concurrent execution on Fri Jan 16 15:06:32 2026 with 4526645.687 GB free disk space (1 processes; 62 concurrently)

    cd unitigging
    ./A3-48.ovlStore.sh 1 > ./A3-48.ovlStore.000001.out 2>&1

-- Finished on Fri Jan 16 15:06:49 2026 (17 seconds) with 4526432.109 GB free disk space
----------------------------------------
-- Checking store.
----------------------------------------
-- Starting command on Fri Jan 16 15:06:49 2026 with 4526432.109 GB free disk space

    cd unitigging
    /share/org/YZWL/yzwl_lixg/miniforge3/envs/canu_v.2.3/bin/ovStoreDump \
     -S ../A3-48.seqStore \
     -O  ./A3-48.ovlStore \
     -counts \
     > ./A3-48.ovlStore/counts.dat 2> ./A3-48.ovlStore/counts.err

-- Finished on Fri Jan 16 15:06:49 2026 (furiously fast) with 4526432.078 GB free disk space
----------------------------------------
--
-- Overlap store 'unitigging/A3-48.ovlStore' successfully constructed.
-- Found 82941342 overlaps for 234086 reads; 1581904 reads have no overlaps.
--
--
-- Purged 0.848 GB in 63 overlap output files.
----------------------------------------
-- Starting command on Fri Jan 16 15:06:50 2026 with 4526432.796 GB free disk space

    cd unitigging
    /share/org/YZWL/yzwl_lixg/miniforge3/envs/canu_v.2.3/bin/ovStoreStats \
     -C 50 \
     -S ../A3-48.seqStore \
     -O  ./A3-48.ovlStore \
     -o  ./A3-48.ovlStore \
     > ./A3-48.ovlStore.summary.err 2>&1

-- Finished on Fri Jan 16 15:07:02 2026 (12 seconds) with 4526433.906 GB free disk space
----------------------------------------
--
-- Overlap store 'unitigging/A3-48.ovlStore' contains:
--
--   category            reads     %          read length        feature size or coverage  analysis
--   ----------------  -------  -------  ----------------------  ------------------------  --------------------
--   middle-missing        120    0.05    16555.97 +- 6636.12       1143.58 +- 1576.91    (bad trimming)
--   middle-hump             7    0.00    15453.71 +- 5368.91       6326.00 +- 4239.55    (bad trimming)
--   no-5-prime            396    0.17    14200.13 +- 5045.33       1557.21 +- 2557.10    (bad trimming)
--   no-3-prime            458    0.19    12087.16 +- 6180.41       1370.18 +- 2391.41    (bad trimming)
--   
--   low-coverage          943    0.39    10899.75 +- 5434.42          6.17 +- 3.73       (easy to assemble, potential for lower quality consensus)
--   unique             190861   79.81    13660.37 +- 5365.04         45.04 +- 8.47       (easy to assemble, perfect, yay)
--   repeat-cont         21493    8.99    11956.82 +- 4754.07       1561.34 +- 1098.80    (potential for consensus errors, no impact on assembly)
--   repeat-dove           289    0.12    21503.60 +- 2322.00        785.52 +- 831.27     (hard to assemble, likely won't assemble correctly or even at all)
--   
--   span-repeat          2185    0.91    14587.92 +- 4689.71       3337.87 +- 3981.20    (read spans a large repeat, usually easy to assemble)
--   uniq-repeat-cont    12180    5.09    13562.16 +- 4289.58                             (should be uniquely placed, low potential for consensus errors, no impact on assembly)
--   uniq-repeat-dove     2478    1.04    19275.30 +- 3027.62                             (will end contigs, potential to misassemble)
--   uniq-anchor          2676    1.12    14019.01 +- 4512.90       8722.50 +- 5082.99    (repeat read, with unique section, probable bad read)
-- Finished stage 'utg-createOverlapStore', reset canuIteration.
--
-- Loading read lengths.
-- Loading number of overlaps per read.
--
-- Configure RED for 16gb memory.
--                   Batches of at most (unlimited) reads.
--                                      500000000 bases.
--                   Expecting evidence of at most 536870912 bases per iteration.
--
--           Total                                               Reads                 Olaps Evidence
--    Job   Memory      Read Range         Reads        Bases   Memory        Olaps   Memory   Memory  (Memory in MB)
--   ---- -------- ------------------- --------- ------------ -------- ------------ -------- --------
--      1 16385.50         1-40653          5338    108895285 13293.05      1786702    20.45  1024.00
--      2 16386.19     40654-84216          5768    108925548 13296.76      1523018    17.43  1024.00
--      3 16386.00     84217-134249         6355    108885755 13291.92      1929976    22.09  1024.00
--      4 16384.40    134250-174097         5548    108829939 13285.08      2387187    27.32  1024.00
--      5 16384.95    174098-221081         6089    108894356 13292.96      1747017    19.99  1024.00
--      6 16384.98    221082-273545         7013    108836199 13285.89      2367402    27.09  1024.00
--      7 16385.06    273546-316773         5547    108847867 13287.27      2254145    25.80  1024.00
--      8 16384.93    316774-362809         6080    108894125 13292.93      1747447    20.00  1024.00
--      9 16384.41    362810-416147         7071    108830972 13285.25      2373415    27.16  1024.00
--     10 16384.75    416148-458132         5531    108844190 13286.82      2265771    25.93  1024.00
--     11 16385.09    458133-504181         6021    108890141 13292.44      1803942    20.64  1024.00
--     12 16385.48    504182-559034         7120    108831819 13285.36      2457040    28.12  1024.00
--     13 16384.51    559035-601136         5481    108838585 13286.13      2305192    26.38  1024.00
--     14 16385.90    601137-646708         5971    108906680 13294.46      1698330    19.44  1024.00
--     15 16386.03    646709-701151         7179    108839182 13286.26      2426633    27.77  1024.00
--     16 16384.92    701152-742108         5490    108856569 13288.33      2149099    24.59  1024.00
--     17 16386.21    742109-786835         5958    108890148 13292.44      1901909    21.77  1024.00
--     18 16384.87    786836-842777         7286    108821030 13284.05      2518559    28.82  1024.00
--     19 16384.51    842778-884894         5487    108839010 13286.18      2300513    26.33  1024.00
--     20 16385.68    884895-929643         5864    108880645 13291.28      1957012    22.40  1024.00
--     21 16384.12    929644-983364         7259    108829932 13285.13      2358420    26.99  1024.00
--     22 16385.90    983365-1025227        5468    108864204 13289.26      2153536    24.65  1024.00
--     23 16385.44   1025228-1069256        5819    108885362 13291.85      1886356    21.59  1024.00
--     24 16385.23   1069257-1121901        7043    108826915 13284.76      2488042    28.47  1024.00
--     25 16384.18   1121902-1161992        5430    108853177 13287.91      2120901    24.27  1024.00
--     26 16384.36   1161993-1206041        5794    108871449 13290.15      1940602    22.21  1024.00
--     27 16385.54   1206042-1260638        7152    108818975 13283.79      2599251    29.75  1024.00
--     28 16385.66   1260639-1301332        5411    108860189 13288.77      2175529    24.90  1024.00
--     29 16384.16   1301333-1344594        5721    108872306 13290.26      1913548    21.90  1024.00
--     30 16386.28   1344595-1398326        7117    108846546 13287.16      2370011    27.12  1024.00
--     31 16386.87   1398327-1440164        5400    108884519 13291.74      2020972    23.13  1024.00
--     32 16385.48   1440165-1483953        5708    108892117 13292.67      1818125    20.81  1024.00
--     33 16386.34   1483954-1538092        7095    108844423 13286.90      2398510    27.45  1024.00
--     34 16387.17   1538093-1578874        5356    108941359 13298.67      1441828    16.50  1024.00
--     35 16384.39   1578875-1621544        5675    108826370 13284.65      2424112    27.74  1024.00
--     36 16385.06   1621545-1676112        7165    108811373 13282.86      2638193    30.19  1024.00
--     37 16386.76   1676113-1717246        5360    108955587 13300.41      1253716    14.35  1024.00
--     38 16384.63   1717247-1759224        5595    108813360 13283.06      2584536    29.58  1024.00
--     39 16384.39   1759225-1813388        7046    108830616 13285.21      2375033    27.18  1024.00
--     40  3611.05   1813389-1815990         325      4408299   538.13        79812     0.91  1024.00
--   ---- -------- ------------------- --------- ------------ -------- ------------ -------- --------
--                                                 4250015123              82941342
-- Finished stage 'readErrorDetectionConfigure', reset canuIteration.
--
-- Running jobs.  First attempt out of 2.
----------------------------------------
-- Starting 'red' concurrent execution on Fri Jan 16 15:07:09 2026 with 4526434.89 GB free disk space (40 processes; 22 concurrently)

    cd unitigging/3-overlapErrorAdjustment
    ./red.sh 1 > ./red.000001.out 2>&1
    ./red.sh 2 > ./red.000002.out 2>&1
    ./red.sh 3 > ./red.000003.out 2>&1
    ./red.sh 4 > ./red.000004.out 2>&1
    ./red.sh 5 > ./red.000005.out 2>&1
    ./red.sh 6 > ./red.000006.out 2>&1
    ./red.sh 7 > ./red.000007.out 2>&1
    ./red.sh 8 > ./red.000008.out 2>&1
    ./red.sh 9 > ./red.000009.out 2>&1
    ./red.sh 10 > ./red.000010.out 2>&1
    ./red.sh 11 > ./red.000011.out 2>&1
    ./red.sh 12 > ./red.000012.out 2>&1
    ./red.sh 13 > ./red.000013.out 2>&1
    ./red.sh 14 > ./red.000014.out 2>&1
    ./red.sh 15 > ./red.000015.out 2>&1
    ./red.sh 16 > ./red.000016.out 2>&1
    ./red.sh 17 > ./red.000017.out 2>&1
    ./red.sh 18 > ./red.000018.out 2>&1
    ./red.sh 19 > ./red.000019.out 2>&1
    ./red.sh 20 > ./red.000020.out 2>&1
    ./red.sh 21 > ./red.000021.out 2>&1
    ./red.sh 22 > ./red.000022.out 2>&1
    ./red.sh 23 > ./red.000023.out 2>&1
    ./red.sh 24 > ./red.000024.out 2>&1
    ./red.sh 25 > ./red.000025.out 2>&1
    ./red.sh 26 > ./red.000026.out 2>&1
    ./red.sh 27 > ./red.000027.out 2>&1
    ./red.sh 28 > ./red.000028.out 2>&1
    ./red.sh 29 > ./red.000029.out 2>&1
    ./red.sh 30 > ./red.000030.out 2>&1
    ./red.sh 31 > ./red.000031.out 2>&1
    ./red.sh 32 > ./red.000032.out 2>&1
    ./red.sh 33 > ./red.000033.out 2>&1
    ./red.sh 34 > ./red.000034.out 2>&1
    ./red.sh 35 > ./red.000035.out 2>&1
    ./red.sh 36 > ./red.000036.out 2>&1
    ./red.sh 37 > ./red.000037.out 2>&1
    ./red.sh 38 > ./red.000038.out 2>&1
    ./red.sh 39 > ./red.000039.out 2>&1
    ./red.sh 40 > ./red.000040.out 2>&1

-- Finished on Fri Jan 16 15:29:34 2026 (1345 seconds) with 4523759.406 GB free disk space
----------------------------------------
-- Found 40 read error detection output files.
-- Finished stage 'readErrorDetectionCheck', reset canuIteration.
--
-- Loading read lengths.
-- Loading number of overlaps per read.
--
-- Configure OEA for 8gb memory.
--                   Batches of at most (unlimited) reads.
--                                      300000000 bases.
--
--           Total                                               Reads                 Olaps  Adjusts
--    Job   Memory      Read Range         Reads        Bases   Memory        Olaps   Memory   Memory  (Memory in MB)
--   ---- -------- ------------------- --------- ------------ -------- ------------ -------- --------
--      1  2868.12         1-123290        16141    300017644   294.61      5061860   154.48   371.03
--      2  2908.98    123291-253875        17316    300001491   294.63      6400262   195.32   371.03
--      3  2857.32    253876-378357        16310    300006170   294.61      4708034   143.68   371.03
--      4  2897.85    378358-505353        16751    300011177   294.62      6035568   184.19   371.03
--      5  2906.25    505354-635736        17005    300002609   294.62      6311066   192.60   371.03
--      6  2901.93    635737-765336        17159    300024154   294.65      6168610   188.25   371.03
--      7  2900.50    765337-897124        17295    300006366   294.64      6121999   186.83   371.03
--      8  2885.60    897125-1027444       17211    300011818   294.64      5633651   171.93   371.03
--      9  2887.86   1027445-1154114       16955    300016177   294.64      5707879   174.19   371.03
--     10  2886.08   1154115-1283003       17031    300019631   294.64      5649437   172.41   371.03
--     11  2905.56   1283004-1411719       16925    300010645   294.63      6288164   191.90   371.03
--     12  2899.58   1411720-1540909       16880    300004468   294.62      6092547   185.93   371.03
--     13  2865.49   1540910-1663751       16242    300010696   294.61      4975881   151.85   371.03
--     14  2892.53   1663752-1786595       16120    300005336   294.60      5862298   178.90   371.03
--     15  2533.42   1786596-1815990        3795     49866741    55.67      1924086    58.72   371.03
--   ---- -------- ------------------- --------- ------------ -------- ------------ -------- --------
--                                                 4250015123              82941342
-- Finished stage 'overlapErrorAdjustmentConfigure', reset canuIteration.
--
-- Running jobs.  First attempt out of 2.
----------------------------------------
-- Starting 'oea' concurrent execution on Fri Jan 16 15:29:42 2026 with 4523759.328 GB free disk space (15 processes; 62 concurrently)

    cd unitigging/3-overlapErrorAdjustment
    ./oea.sh 1 > ./oea.000001.out 2>&1
    ./oea.sh 2 > ./oea.000002.out 2>&1
    ./oea.sh 3 > ./oea.000003.out 2>&1
    ./oea.sh 4 > ./oea.000004.out 2>&1
    ./oea.sh 5 > ./oea.000005.out 2>&1
    ./oea.sh 6 > ./oea.000006.out 2>&1
    ./oea.sh 7 > ./oea.000007.out 2>&1
    ./oea.sh 8 > ./oea.000008.out 2>&1
    ./oea.sh 9 > ./oea.000009.out 2>&1
    ./oea.sh 10 > ./oea.000010.out 2>&1
    ./oea.sh 11 > ./oea.000011.out 2>&1
    ./oea.sh 12 > ./oea.000012.out 2>&1
    ./oea.sh 13 > ./oea.000013.out 2>&1
    ./oea.sh 14 > ./oea.000014.out 2>&1
    ./oea.sh 15 > ./oea.000015.out 2>&1

-- Finished on Fri Jan 16 16:24:07 2026 (3265 seconds) with 4520440.609 GB free disk space
----------------------------------------
-- Found 15 overlap error adjustment output files.
-- Finished stage 'overlapErrorAdjustmentCheck', reset canuIteration.
----------------------------------------
-- Starting command on Fri Jan 16 16:24:07 2026 with 4520440.593 GB free disk space

    cd unitigging/3-overlapErrorAdjustment
    /share/org/YZWL/yzwl_lixg/miniforge3/envs/canu_v.2.3/bin/loadErates \
      -S ../../A3-48.seqStore \
      -O ../A3-48.ovlStore \
      -L ./oea.files \
    > ./oea.apply.err 2>&1

-- Finished on Fri Jan 16 16:24:07 2026 (furiously fast) with 4520440.421 GB free disk space
----------------------------------------
-- No report available.
-- Finished stage 'updateOverlapStore', reset canuIteration.
-- Finished stage 'unitig', reset canuIteration.
--
-- Running jobs.  First attempt out of 2.
----------------------------------------
-- Starting 'bat' concurrent execution on Fri Jan 16 16:24:07 2026 with 4520440.375 GB free disk space (1 processes; 1 concurrently)

    cd unitigging/4-unitigger
    ./unitigger.sh 1 > ./unitigger.000001.out 2>&1

-- Finished on Fri Jan 16 16:24:26 2026 (19 seconds) with 4520440.203 GB free disk space
----------------------------------------
-- Unitigger finished successfully.
--  
--  ERROR RATES
--  -----------
--                                                   --------threshold------
--  263964                       fraction error      fraction        percent
--  samples                              (1e-5)         error          error
--                   --------------------------      --------       --------
--  command line (-eg)                           ->     30.00        0.0300%
--  command line (-ef)                           ->  -----.--      ---.----%
--  command line (-eM)                           ->     30.00        0.0300%
--  mean + std.dev       0.43 +-  12 *     3.05  ->     37.00        0.0370%
--  median + mad         0.00 +-  12 *     0.00  ->      0.00        0.0000%
--  90th percentile                              ->      1.00        0.0010%  (enabled)
--  
--  BEST EDGE FILTERING
--  -------------------
--  At graph threshold 0.0300%, reads:
--    available to have edges:        41639
--    with at least one edge:         34997
--  
--  At max threshold 0.0300%, reads:  (not computed)
--    available to have edges:            0
--    with at least one edge:             0
--  
--  At tight threshold 0.0010%, reads with:
--    both edges below error threshold:     30330  (80.00% minReadsBest threshold = 27997)
--    one  edge  above error threshold:      3388
--    both edges above error threshold:      1279
--    at least one edge:                    34997
--  
--  At loose threshold 0.0300%, reads with:
--    both edges below error threshold:     34997  (80.00% minReadsBest threshold = 27997)
--    one  edge  above error threshold:         0
--    both edges above error threshold:         0
--    at least one edge:                    34997
--  
--  
--  INITIAL EDGES
--  -------- ----------------------------------------
--    191207 reads are contained
--   1594700 reads have no best edges (singleton)
--       323 reads have only one best edge (spur) 
--                149 are mutual best
--     29760 reads have two best edges 
--                797 have one mutual best edge
--              28579 have two mutual best edges
--  
--  
--  FINAL EDGES
--  -------- ----------------------------------------
--    191207 reads are contained
--   1595087 reads have no best edges (singleton)
--       184 reads have only one best edge (spur) 
--                145 are mutual best
--     29512 reads have two best edges 
--                669 have one mutual best edge
--              28567 have two mutual best edges
--  
--  
--  EDGE FILTERING
--  -------- ------------------------------------------
--         0 reads are ignored
--     11089 reads have a gap in overlap coverage
--       161 reads have lopsided best edges
-- Found, in version 1, after unitig construction:
--   contigs:      104 sequences, total length 68413829 bp (including 147 repeats of total length 3752505 bp).
--   bubbles:      166 sequences, total length 4432574 bp.
--   unassembled:  18007 sequences, total length 229274198 bp.
--
-- Contig sizes based on genome size 85mbp:
--
--            NG (bp)  LG (contigs)    sum (bp)
--         ----------  ------------  ----------
--     10     6242349             2    12528794
--     20     5118414             3    17647208
--     30     4575011             5    26910175
--     40     3669526             7    34443286
--     50     3374685            10    44804595
--     60     2564898            13    53364149
--     70     1717908            16    59885538
--     80       20380            81    68016866
--
-- Finished stage 'unitigCheck', reset canuIteration.
----------------------------------------
-- Starting command on Fri Jan 16 16:24:26 2026 with 4520440.187 GB free disk space

    cd unitigging
    /share/org/YZWL/yzwl_lixg/miniforge3/envs/canu_v.2.3/bin/utgcns \
      -S ../A3-48.seqStore \
      -T  ./A3-48.ctgStore 1 \
      -partition 0.8 1.5 0.1 \
    > ./A3-48.ctgStore/partitioning.log 2>&1

-- Finished on Fri Jan 16 16:24:35 2026 (9 seconds) with 4520438.937 GB free disk space
----------------------------------------
-- Using slow alignment for consensus (iteration '0').
-- Configured 11 consensus jobs.
-- Finished stage 'consensusConfigure', reset canuIteration.
--
-- Local: cns        9.375 GB    8 CPUs x  11 jobs   103.125 GB  88 CPUs  (consensus)
--
--
-- Running jobs.  First attempt out of 2.
----------------------------------------
-- Starting 'cns' concurrent execution on Fri Jan 16 16:24:35 2026 with 4520438.906 GB free disk space (11 processes; 11 concurrently)

    cd unitigging/5-consensus
    ./consensus.sh 1 > ./consensus.000001.out 2>&1
    ./consensus.sh 2 > ./consensus.000002.out 2>&1
    ./consensus.sh 3 > ./consensus.000003.out 2>&1
    ./consensus.sh 4 > ./consensus.000004.out 2>&1
    ./consensus.sh 5 > ./consensus.000005.out 2>&1
    ./consensus.sh 6 > ./consensus.000006.out 2>&1
    ./consensus.sh 7 > ./consensus.000007.out 2>&1
    ./consensus.sh 8 > ./consensus.000008.out 2>&1
    ./consensus.sh 9 > ./consensus.000009.out 2>&1
    ./consensus.sh 10 > ./consensus.000010.out 2>&1
    ./consensus.sh 11 > ./consensus.000011.out 2>&1

-- Finished on Fri Jan 16 16:31:17 2026 (402 seconds) with 4520283.765 GB free disk space
----------------------------------------
-- Using slow alignment for consensus (iteration '1').
-- Configured 11 consensus jobs.
-- All 11 consensus jobs finished successfully.
-- Finished stage 'consensusCheck', reset canuIteration.
-- Using slow alignment for consensus (iteration '0').
-- Configured 11 consensus jobs.
----------------------------------------
-- Starting command on Fri Jan 16 16:31:17 2026 with 4520283.718 GB free disk space

    cd unitigging
    /share/org/YZWL/yzwl_lixg/miniforge3/envs/canu_v.2.3/bin/tgStoreLoad \
      -S ../A3-48.seqStore \
      -T  ./A3-48.ctgStore 2 \
      -L ./5-consensus/ctgcns.files \
    > ./5-consensus/ctgcns.files.ctgStoreLoad.err 2>&1

-- Finished on Fri Jan 16 16:31:18 2026 (one second) with 4520282.859 GB free disk space
----------------------------------------
----------------------------------------
-- Starting command on Fri Jan 16 16:31:18 2026 with 4520282.859 GB free disk space

    cd unitigging
    /share/org/YZWL/yzwl_lixg/miniforge3/envs/canu_v.2.3/bin/tgTigDisplay \
      -S ../A3-48.seqStore \
      -b \
      -o ../A3-48.contigs.unsorted.bam \
      -L ./5-consensus/ctgcns.files \
    > ./5-consensus/ctgcns.files.contigs.bam.err 2>&1

-- Finished on Fri Jan 16 16:34:33 2026 (195 seconds) with 4520220.515 GB free disk space
----------------------------------------
----------------------------------------
-- Starting command on Fri Jan 16 16:34:33 2026 with 4520220.515 GB free disk space

    cd .
    samtools sort \
      --write-index \
      --threads 2 \
      -o ./A3-48.contigs.bam ./A3-48.contigs.unsorted.bam \
    > ./ctgcns.bam.err 2>&1

-- Finished on Fri Jan 16 16:35:34 2026 (61 seconds) with 4520298.953 GB free disk space
----------------------------------------
-- Purging consensus output after loading to ctgStore.
-- Purged 11 .cns outputs.
----------------------------------------
-- Starting command on Fri Jan 16 16:35:34 2026 with 4520300.062 GB free disk space

    cd unitigging
    /share/org/YZWL/yzwl_lixg/miniforge3/envs/canu_v.2.3/bin/tgStoreDump \
      -S ../A3-48.seqStore \
      -T ./A3-48.ctgStore 2 \
      -sizes -s 85000000 \
    > ./A3-48.ctgStore/seqDB.v002.sizes.txt
ZERO length suplied to intervalList::add(), ignoring interval.
ZERO length suplied to intervalList::add(), ignoring interval.
ZERO length suplied to intervalList::add(), ignoring interval.
ZERO length suplied to intervalList::add(), ignoring interval.
ZERO length suplied to intervalList::add(), ignoring interval.
ZERO length suplied to intervalList::add(), ignoring interval.
ZERO length suplied to intervalList::add(), ignoring interval.
ZERO length suplied to intervalList::add(), ignoring interval.
ZERO length suplied to intervalList::add(), ignoring interval.
ZERO length suplied to intervalList::add(), ignoring interval.
ZERO length suplied to intervalList::add(), ignoring interval.
ZERO length suplied to intervalList::add(), ignoring interval.
ZERO length suplied to intervalList::add(), ignoring interval.
ZERO length suplied to intervalList::add(), ignoring interval.
ZERO length suplied to intervalList::add(), ignoring interval.
ZERO length suplied to intervalList::add(), ignoring interval.
ZERO length suplied to intervalList::add(), ignoring interval.
ZERO length suplied to intervalList::add(), ignoring interval.
ZERO length suplied to intervalList::add(), ignoring interval.
ZERO length suplied to intervalList::add(), ignoring interval.
ZERO length suplied to intervalList::add(), ignoring interval.
ZERO length suplied to intervalList::add(), ignoring interval.
ZERO length suplied to intervalList::add(), ignoring interval.
ZERO length suplied to intervalList::add(), ignoring interval.

-- Finished on Fri Jan 16 16:35:34 2026 (lickety-split) with 4520300.515 GB free disk space
----------------------------------------
-- Found, in version 2, after consensus generation:
--   contigs:      104 sequences, total length 89334112 bp (including 147 repeats of total length 5195950 bp).
--   bubbles:      166 sequences, total length 6009838 bp.
--   unassembled:  18007 sequences, total length 318077732 bp.
--
-- Contig sizes based on genome size 85mbp:
--
--            NG (bp)  LG (contigs)    sum (bp)
--         ----------  ------------  ----------
--     10     8104313             2    16269942
--     20     6647013             3    22916955
--     30     6112543             4    29029498
--     40     5962358             5    34991856
--     50     4779816             7    44815729
--     60     4432979             9    53915703
--     70     4340354            11    62646111
--     80     3327479            13    69443769
--     90     2249391            16    77951972
--    100      624601            23    85129857
--
-- Finished stage 'consensusLoad', reset canuIteration.
----------------------------------------
-- Starting command on Fri Jan 16 16:35:34 2026 with 4520300.5 GB free disk space

    cd .
    /share/org/YZWL/yzwl_lixg/miniforge3/envs/canu_v.2.3/bin/tgStoreDump \
      -S ./A3-48.seqStore \
      -T ./unitigging/A3-48.ctgStore 2 \
      -o ./A3-48.contigs \
      -layout \
    > ./A3-48.contigs.layout.err 2>&1

-- Finished on Fri Jan 16 16:35:35 2026 (one second) with 4520300.468 GB free disk space
----------------------------------------
----------------------------------------
-- Starting command on Fri Jan 16 16:35:35 2026 with 4520300.468 GB free disk space

    cd .
    /share/org/YZWL/yzwl_lixg/miniforge3/envs/canu_v.2.3/bin/tgStoreDump \
      -S ./A3-48.seqStore \
      -T ./unitigging/A3-48.ctgStore 2 \
      -consensus -fasta \
      -unassembled \
    > ./A3-48.unassembled.fasta
    2> ./A3-48.unassembled.err
ZERO length suplied to intervalList::add(), ignoring interval.
ZERO length suplied to intervalList::add(), ignoring interval.
ZERO length suplied to intervalList::add(), ignoring interval.
ZERO length suplied to intervalList::add(), ignoring interval.
ZERO length suplied to intervalList::add(), ignoring interval.
ZERO length suplied to intervalList::add(), ignoring interval.
ZERO length suplied to intervalList::add(), ignoring interval.
ZERO length suplied to intervalList::add(), ignoring interval.
ZERO length suplied to intervalList::add(), ignoring interval.
ZERO length suplied to intervalList::add(), ignoring interval.
ZERO length suplied to intervalList::add(), ignoring interval.
ZERO length suplied to intervalList::add(), ignoring interval.
ZERO length suplied to intervalList::add(), ignoring interval.
ZERO length suplied to intervalList::add(), ignoring interval.
ZERO length suplied to intervalList::add(), ignoring interval.
ZERO length suplied to intervalList::add(), ignoring interval.
ZERO length suplied to intervalList::add(), ignoring interval.
ZERO length suplied to intervalList::add(), ignoring interval.
ZERO length suplied to intervalList::add(), ignoring interval.
ZERO length suplied to intervalList::add(), ignoring interval.
ZERO length suplied to intervalList::add(), ignoring interval.
ZERO length suplied to intervalList::add(), ignoring interval.
ZERO length suplied to intervalList::add(), ignoring interval.
ZERO length suplied to intervalList::add(), ignoring interval.

-- Finished on Fri Jan 16 16:35:36 2026 (one second) with 4520297.281 GB free disk space
----------------------------------------
----------------------------------------
-- Starting command on Fri Jan 16 16:35:36 2026 with 4520297.281 GB free disk space

    cd .
    /share/org/YZWL/yzwl_lixg/miniforge3/envs/canu_v.2.3/bin/tgStoreDump \
      -S ./A3-48.seqStore \
      -T ./unitigging/A3-48.ctgStore 2 \
      -consensus -fasta \
      -contigs \
    > ./A3-48.contigs.fasta
    2> ./A3-48.contigs.err
ZERO length suplied to intervalList::add(), ignoring interval.
ZERO length suplied to intervalList::add(), ignoring interval.
ZERO length suplied to intervalList::add(), ignoring interval.
ZERO length suplied to intervalList::add(), ignoring interval.
ZERO length suplied to intervalList::add(), ignoring interval.
ZERO length suplied to intervalList::add(), ignoring interval.
ZERO length suplied to intervalList::add(), ignoring interval.
ZERO length suplied to intervalList::add(), ignoring interval.
ZERO length suplied to intervalList::add(), ignoring interval.
ZERO length suplied to intervalList::add(), ignoring interval.
ZERO length suplied to intervalList::add(), ignoring interval.
ZERO length suplied to intervalList::add(), ignoring interval.
ZERO length suplied to intervalList::add(), ignoring interval.
ZERO length suplied to intervalList::add(), ignoring interval.
ZERO length suplied to intervalList::add(), ignoring interval.
ZERO length suplied to intervalList::add(), ignoring interval.
ZERO length suplied to intervalList::add(), ignoring interval.
ZERO length suplied to intervalList::add(), ignoring interval.
ZERO length suplied to intervalList::add(), ignoring interval.
ZERO length suplied to intervalList::add(), ignoring interval.
ZERO length suplied to intervalList::add(), ignoring interval.
ZERO length suplied to intervalList::add(), ignoring interval.
ZERO length suplied to intervalList::add(), ignoring interval.
ZERO length suplied to intervalList::add(), ignoring interval.

-- Finished on Fri Jan 16 16:35:37 2026 (one second) with 4520297.203 GB free disk space
----------------------------------------
-- Finished stage 'generateOutputs', reset canuIteration.
--
-- Assembly 'A3-48' finished in '/share/org/YZWL/yzwl_lixg/project/28.大豆疫霉菌三代基因组/03.hicanu/A3-48/01.raw_output'.
--
-- Summary saved in 'A3-48.report'.
--
-- Sequences saved:
--   Contigs       -> 'A3-48.contigs.fasta'
--   Unassembled   -> 'A3-48.unassembled.fasta'
--
-- Read layouts saved:
--   Contigs       -> 'A3-48.contigs.layout'.
--
-- Bye.

2026-01-16 16:35:37.568 - WARNING - 输出文件不存在|Output file does not exist: /share/org/YZWL/yzwl_lixg/project/28.大豆疫霉菌三代基因组/03.hicanu/A3-48/01.raw_output/A3-48.unitigs.fasta
Job 68889958 stderr output:

