2026-01-16 14:29:28.383 - WARNING - 命令错误输出|Command stderr:
-- canu master +27 changes (r10515 2a41e933b8de6ed66723d75d36dd071b46d2c347)
--
-- CITATIONS
--
-- For assemblies of PacBio HiFi reads:
--   Nurk S, Walenz BP, Rhiea A, Vollger MR, Logsdon GA, Grothe R, Miga KH, Eichler EE, Phillippy AM, Koren S.
--   HiCanu: accurate assembly of segmental duplications, satellites, and allelic variants from high-fidelity long reads.
--   biorXiv. 2020.
--   https://doi.org/10.1101/2020.03.14.992248
-- 
-- Read and contig alignments during correction and consensus use:
--   Šošic M, Šikic M.
--   Edlib: a C/C ++ library for fast, exact sequence alignment using edit distance.
--   Bioinformatics. 2017 May 1;33(9):1394-1395.
--   http://doi.org/10.1093/bioinformatics/btw753
-- 
-- Overlaps are generated using:
--   Berlin K, et al.
--   Assembling large genomes with single-molecule sequencing and locality-sensitive hashing.
--   Nat Biotechnol. 2015 Jun;33(6):623-30.
--   http://doi.org/10.1038/nbt.3238
-- 
--   Myers EW, et al.
--   A Whole-Genome Assembly of Drosophila.
--   Science. 2000 Mar 24;287(5461):2196-204.
--   http://doi.org/10.1126/science.287.5461.2196
-- 
-- Contig consensus sequences are generated using an algorithm derived from pbdagcon:
--   Chin CS, et al.
--   Nonhybrid, finished microbial genome assemblies from long-read SMRT sequencing data.
--   Nat Methods. 2013 Jun;10(6):563-9
--   http://doi.org/10.1038/nmeth.2474
-- 
-- CONFIGURE CANU
--
-- Detected Java(TM) Runtime Environment '25.0.1-internal' (from '/share/org/YZWL/yzwl_lixg/miniforge3/envs/telocomp/lib/jvm/bin/java') without -d64 support.
--
-- WARNING:
-- WARNING:  Failed to run gnuplot using command 'gnuplot'.
-- WARNING:  Plots will be disabled.
-- WARNING:
--
-- Detected samtools version '1.22' / htslib version 'htscodecs=1.6.3' (from 'samtools').
--
-- Detected 88 CPUs and 503 gigabytes of memory on the local machine.
--
-- Detected Slurm with 'sinfo' binary in /opt/skyformai/bin/sinfo.
--          Slurm disabled by useGrid=false
--
-- Detected  '' with 'pbsnodes' binary in /opt/skyformai/bin/pbsnodes.
--           disabled by useGrid=false
--
-- Detected LSF with 'bsub' binary in /opt/skyformai/bin/bsub.
--          LSF disabled by useGrid=false
--
-- Local machine mode enabled; grid support not detected or not allowed.
--
-- Found trimmed raw PacBio HiFi reads in the input files.
--
--                                (tag)Concurrency
--                         (tag)Threads          |
--                (tag)Memory         |          |
--        (tag)             |         |          |       total usage      algorithm
--        -------  ----------  --------   --------  --------------------  -----------------------------
-- Local: meryl     12.000 GB    4 CPUs x  22 jobs   264.000 GB  88 CPUs  (k-mer counting)
-- Local: cormhap   13.000 GB   11 CPUs x   8 jobs   104.000 GB  88 CPUs  (overlap detection with mhap)
-- Local: obtovl     8.000 GB    8 CPUs x  11 jobs    88.000 GB  88 CPUs  (overlap detection)
-- Local: utgovl     8.000 GB    8 CPUs x  11 jobs    88.000 GB  88 CPUs  (overlap detection)
-- Local: cor        -.--- GB    4 CPUs x   - jobs     -.--- GB   - CPUs  (read correction)
-- Local: ovb        4.000 GB    1 CPU  x  88 jobs   352.000 GB  88 CPUs  (overlap store bucketizer)
-- Local: ovs        8.000 GB    1 CPU  x  62 jobs   496.000 GB  62 CPUs  (overlap store sorting)
-- Local: red       16.000 GB    4 CPUs x  22 jobs   352.000 GB  88 CPUs  (read error detection)
-- Local: oea        8.000 GB    1 CPU  x  62 jobs   496.000 GB  62 CPUs  (overlap error adjustment)
-- Local: bat       32.000 GB    8 CPUs x   1 job     32.000 GB   8 CPUs  (contig construction with bogart)
-- Local: cns        -.--- GB    8 CPUs x   - jobs     -.--- GB   - CPUs  (consensus)
--
-- Generating assembly '41' in '/share/org/YZWL/yzwl_lixg/project/28.大豆疫霉菌三代基因组/03.hicanu/41/01.raw_output':
--   genomeSize:
--     85000000
--
--   Overlap Generation Limits:
--     corOvlErrorRate 0.0000 (  0.00%)
--     obtOvlErrorRate 0.0250 (  2.50%)
--     utgOvlErrorRate 0.0100 (  1.00%)
--
--   Overlap Processing Limits:
--     corErrorRate    0.0000 (  0.00%)
--     obtErrorRate    0.0250 (  2.50%)
--     utgErrorRate    0.0003 (  0.03%)
--     cnsErrorRate    0.0500 (  5.00%)
--
--   Stages to run:
--     assemble HiFi reads.
--
--
-- BEGIN STORE CREATION
----------------------------------------
-- Starting command on Fri Jan 16 12:41:23 2026 with 4530899.921 GB free disk space

    cd .
    ./41.seqStore.sh \
    > ./41.seqStore.err 2>&1

-- Finished on Fri Jan 16 12:48:00 2026 (397 seconds) with 4532147.671 GB free disk space
----------------------------------------
--
-- In sequence store './41.seqStore':
--   Found 288135 reads.
--   Found 4250017968 bases (50 times coverage).
--    Histogram of corrected reads:
--    
--    G=4250017968                       sum of  ||               length     num
--    NG         length     index       lengths  ||                range    seqs
--    ----- ------------ --------- ------------  ||  ------------------- -------
--    00010        26349     15047    425008399  ||       1228-2413        14081|----------------------------------------
--    00020        24418     31846    850006271  ||       2414-3599        21051|------------------------------------------------------------
--    00030        23060     49773   1275006083  ||       3600-4785        18546|-----------------------------------------------------
--    00040        21931     68680   1700023444  ||       4786-5971        15447|--------------------------------------------
--    00050        20854     88553   2125024281  ||       5972-7157        12629|------------------------------------
--    00060        19710    109500   2550021535  ||       7158-8343        10652|-------------------------------
--    00070        18234    131855   2975016412  ||       8344-9529         9043|--------------------------
--    00080        14823    157103   3400024916  ||       9530-10715        8119|------------------------
--    00090         8482    194605   3825017885  ||      10716-11901        7037|--------------------
--    00100         1228    288135   4250017968  ||      11902-13087        6162|------------------
--    001.000x              288135   4250017968  ||      13088-14273        5676|-----------------
--                                               ||      14274-15459        5702|-----------------
--                                               ||      15460-16645        6918|--------------------
--                                               ||      16646-17831       10512|------------------------------
--                                               ||      17832-19017       15627|---------------------------------------------
--                                               ||      19018-20203       20278|----------------------------------------------------------
--                                               ||      20204-21389       22207|---------------------------------------------------------------
--                                               ||      21390-22575       20970|------------------------------------------------------------
--                                               ||      22576-23761       17547|--------------------------------------------------
--                                               ||      23762-24947       13530|---------------------------------------
--                                               ||      24948-26133        9921|-----------------------------
--                                               ||      26134-27319        6788|--------------------
--                                               ||      27320-28505        4409|-------------
--                                               ||      28506-29691        2721|--------
--                                               ||      29692-30877        1451|-----
--                                               ||      30878-32063         672|--
--                                               ||      32064-33249         305|-
--                                               ||      33250-34435          98|-
--                                               ||      34436-35621          25|-
--                                               ||      35622-36807           4|-
--                                               ||      36808-37993           1|-
--                                               ||      37994-39179           2|-
--                                               ||      39180-40365           0|
--                                               ||      40366-41551           0|
--                                               ||      41552-42737           0|
--                                               ||      42738-43923           2|-
--                                               ||      43924-45109           0|
--                                               ||      45110-46295           0|
--                                               ||      46296-47481           1|-
--                                               ||      47482-48667           1|-
--    
--
-- In sequence store './41.seqStore':
--   Found 288135 reads.
--   Found 4250017968 bases (50 times coverage).
--    Histogram of corrected-trimmed reads:
--    
--    G=4250017968                       sum of  ||               length     num
--    NG         length     index       lengths  ||                range    seqs
--    ----- ------------ --------- ------------  ||  ------------------- -------
--    00010        26349     15047    425008399  ||       1228-2413        14081|----------------------------------------
--    00020        24418     31846    850006271  ||       2414-3599        21051|------------------------------------------------------------
--    00030        23060     49773   1275006083  ||       3600-4785        18546|-----------------------------------------------------
--    00040        21931     68680   1700023444  ||       4786-5971        15447|--------------------------------------------
--    00050        20854     88553   2125024281  ||       5972-7157        12629|------------------------------------
--    00060        19710    109500   2550021535  ||       7158-8343        10652|-------------------------------
--    00070        18234    131855   2975016412  ||       8344-9529         9043|--------------------------
--    00080        14823    157103   3400024916  ||       9530-10715        8119|------------------------
--    00090         8482    194605   3825017885  ||      10716-11901        7037|--------------------
--    00100         1228    288135   4250017968  ||      11902-13087        6162|------------------
--    001.000x              288135   4250017968  ||      13088-14273        5676|-----------------
--                                               ||      14274-15459        5702|-----------------
--                                               ||      15460-16645        6918|--------------------
--                                               ||      16646-17831       10512|------------------------------
--                                               ||      17832-19017       15627|---------------------------------------------
--                                               ||      19018-20203       20278|----------------------------------------------------------
--                                               ||      20204-21389       22207|---------------------------------------------------------------
--                                               ||      21390-22575       20970|------------------------------------------------------------
--                                               ||      22576-23761       17547|--------------------------------------------------
--                                               ||      23762-24947       13530|---------------------------------------
--                                               ||      24948-26133        9921|-----------------------------
--                                               ||      26134-27319        6788|--------------------
--                                               ||      27320-28505        4409|-------------
--                                               ||      28506-29691        2721|--------
--                                               ||      29692-30877        1451|-----
--                                               ||      30878-32063         672|--
--                                               ||      32064-33249         305|-
--                                               ||      33250-34435          98|-
--                                               ||      34436-35621          25|-
--                                               ||      35622-36807           4|-
--                                               ||      36808-37993           1|-
--                                               ||      37994-39179           2|-
--                                               ||      39180-40365           0|
--                                               ||      40366-41551           0|
--                                               ||      41552-42737           0|
--                                               ||      42738-43923           2|-
--                                               ||      43924-45109           0|
--                                               ||      45110-46295           0|
--                                               ||      46296-47481           1|-
--                                               ||      47482-48667           1|-
--    
--
-- Correction skipped; not enabled.
--
-- Trimming skipped; not enabled.
--
-- BEGIN ASSEMBLY
----------------------------------------
-- Starting command on Fri Jan 16 12:48:01 2026 with 4532147.625 GB free disk space

    cd unitigging/0-mercounts
    ./meryl-configure.sh \
    > ./meryl-configure.err 2>&1

-- Finished on Fri Jan 16 12:48:03 2026 (2 seconds) with 4532147.593 GB free disk space
----------------------------------------
--  segments   memory batches
--  -------- -------- -------
--        01 10.81 GB       2
--        02  5.75 GB       2
--        04  2.97 GB       2
--        06  2.14 GB       2
--        08  1.61 GB       2
--        12  1.07 GB       2
--        16  0.81 GB       2
--        20  0.65 GB       2
--        24  0.54 GB       2
--        32  0.41 GB       2
--        40  0.32 GB       2
--        48  -.-- GB       -  (segment size too small)
--        56  -.-- GB       -  (segment size too small)
--        64  -.-- GB       -  (segment size too small)
--        96  -.-- GB       -  (segment size too small)
--
--  For 288135 reads with 4250017968 bases, limit to 42 batches.
--  Will count kmers using 01 jobs, each using 12 GB and 4 threads.
--
-- Finished stage 'merylConfigure', reset canuIteration.
--
-- Running jobs.  First attempt out of 2.
----------------------------------------
-- Starting 'meryl' concurrent execution on Fri Jan 16 12:48:03 2026 with 4532147.562 GB free disk space (1 processes; 22 concurrently)

    cd unitigging/0-mercounts
    ./meryl-count.sh 1 > ./meryl-count.000001.out 2>&1

-- Finished on Fri Jan 16 12:51:25 2026 (202 seconds) with 4532820.281 GB free disk space
----------------------------------------
-- Found 1 Kmer counting (meryl) outputs.
-- Finished stage 'utg-merylCountCheck', reset canuIteration.
--
-- Running jobs.  First attempt out of 2.
----------------------------------------
-- Starting 'meryl' concurrent execution on Fri Jan 16 12:51:25 2026 with 4532820.25 GB free disk space (1 processes; 22 concurrently)

    cd unitigging/0-mercounts
    ./meryl-process.sh 1 > ./meryl-process.000001.out 2>&1

-- Finished on Fri Jan 16 12:51:32 2026 (7 seconds) with 4532820.859 GB free disk space
----------------------------------------
-- Meryl finished successfully.  Kmer frequency histogram:
--
-- WARNING: gnuplot failed.
--
----------------------------------------
--
--  22-mers                                                                                           Fraction
--    Occurrences   NumMers                                                                         Unique Total
--       1-     1         0                                                                        0.0000 0.0000
--       2-     2    258193 *                                                                      0.0057 0.0002
--       3-     4     80363                                                                        0.0069 0.0002
--       5-     7     28036                                                                        0.0078 0.0003
--       8-    11     11371                                                                        0.0082 0.0003
--      12-    16     22051                                                                        0.0084 0.0004
--      17-    22    144244                                                                        0.0091 0.0005
--      23-    29    930413 ****                                                                   0.0132 0.0017
--      30-    37   5542984 ************************                                               0.0398 0.0121
--      38-    46  15783801 ********************************************************************** 0.1853 0.0844
--      47-    56  14249880 ***************************************************************        0.5493 0.3053
--      57-    67   3131491 *************                                                          0.8366 0.5134
--      68-    79    684199 ***                                                                    0.8929 0.5617
--      80-    92    994808 ****                                                                   0.9082 0.5777
--      93-   106    753461 ***                                                                    0.9303 0.6047
--     107-   121    325093 *                                                                      0.9463 0.6270
--     122-   137    282858 *                                                                      0.9530 0.6379
--     138-   154    257025 *                                                                      0.9593 0.6494
--     155-   172    188358                                                                        0.9649 0.6609
--     173-   191    157751                                                                        0.9690 0.6703
--     192-   211    135590                                                                        0.9725 0.6791
--     212-   232    115313                                                                        0.9754 0.6875
--     233-   254    101392                                                                        0.9780 0.6955
--     255-   277     93773                                                                        0.9802 0.7032
--     278-   301     77412                                                                        0.9823 0.7108
--     302-   326     70938                                                                        0.9840 0.7179
--     327-   352     63014                                                                        0.9855 0.7247
--     353-   379     46528                                                                        0.9869 0.7314
--     380-   407     47452                                                                        0.9880 0.7367
--     408-   436     42310                                                                        0.9890 0.7425
--     437-   466     33085                                                                        0.9899 0.7480
--     467-   497     33909                                                                        0.9907 0.7526
--     498-   529     29949                                                                        0.9914 0.7577
--     530-   562     23486                                                                        0.9921 0.7625
--     563-   596     20267                                                                        0.9926 0.7665
--     597-   631     17572                                                                        0.9930 0.7701
--     632-   667     15221                                                                        0.9934 0.7734
--     668-   704     13617                                                                        0.9938 0.7765
--     705-   742     12654                                                                        0.9941 0.7794
--     743-   781     12201                                                                        0.9943 0.7823
--     782-   821     12600                                                                        0.9946 0.7852
--
--           0 (max occurrences)
--  3210773361 (total mers, non-unique)
--    45075189 (distinct mers, non-unique)
--           0 (unique mers)
-- Finished stage 'meryl-process', reset canuIteration.
--
-- Removing meryl database 'unitigging/0-mercounts/41.ms22'.
--
-- OVERLAPPER (normal) (assembly) erate=0.01
--
----------------------------------------
-- Starting command on Fri Jan 16 12:51:32 2026 with 4532820.843 GB free disk space

    cd unitigging/1-overlapper
    /share/org/YZWL/yzwl_lixg/miniforge3/envs/canu_v.2.3/bin/overlapInCorePartition \
     -S  ../../41.seqStore \
     -hl 160000000 \
     -rl 5000000000 \
     -ol 500 \
     -o  ./41.partition \
    > ./41.partition.err 2>&1

-- Finished on Fri Jan 16 12:51:32 2026 (lickety-split) with 4532820.828 GB free disk space
----------------------------------------
--
-- Configured 21 overlapInCore jobs.
-- Finished stage 'utg-overlapConfigure', reset canuIteration.
--
-- Running jobs.  First attempt out of 2.
----------------------------------------
-- Starting 'utgovl' concurrent execution on Fri Jan 16 12:51:32 2026 with 4532820.796 GB free disk space (21 processes; 11 concurrently)

    cd unitigging/1-overlapper
    ./overlap.sh 1 > ./overlap.000001.out 2>&1
    ./overlap.sh 2 > ./overlap.000002.out 2>&1
    ./overlap.sh 3 > ./overlap.000003.out 2>&1
    ./overlap.sh 4 > ./overlap.000004.out 2>&1
    ./overlap.sh 5 > ./overlap.000005.out 2>&1
    ./overlap.sh 6 > ./overlap.000006.out 2>&1
    ./overlap.sh 7 > ./overlap.000007.out 2>&1
    ./overlap.sh 8 > ./overlap.000008.out 2>&1
    ./overlap.sh 9 > ./overlap.000009.out 2>&1
    ./overlap.sh 10 > ./overlap.000010.out 2>&1
    ./overlap.sh 11 > ./overlap.000011.out 2>&1
    ./overlap.sh 12 > ./overlap.000012.out 2>&1
    ./overlap.sh 13 > ./overlap.000013.out 2>&1
    ./overlap.sh 14 > ./overlap.000014.out 2>&1
    ./overlap.sh 15 > ./overlap.000015.out 2>&1
    ./overlap.sh 16 > ./overlap.000016.out 2>&1
    ./overlap.sh 17 > ./overlap.000017.out 2>&1
    ./overlap.sh 18 > ./overlap.000018.out 2>&1
    ./overlap.sh 19 > ./overlap.000019.out 2>&1
    ./overlap.sh 20 > ./overlap.000020.out 2>&1
    ./overlap.sh 21 > ./overlap.000021.out 2>&1

-- Finished on Fri Jan 16 13:19:57 2026 (1705 seconds) with 4532617.89 GB free disk space
----------------------------------------
-- Found 21 overlapInCore output files.
--
-- overlapInCore compute 'unitigging/1-overlapper':
--   kmer hits
--     with no overlap       1343628795  23.5714286 +- 39803288.014
--     with an overlap         43903467  1.28571429 +- 1136932.181
--
--   overlaps                  43903467  1.28571429 +- 1136932.181
--     contained               13489777  .333333333 +- 359289.088
--     dovetail                30413690  0.95238095 +- 788745.725
--
--   overlaps rejected
--     multiple per pair              0           0 +- 0
--     bad short window               0           0 +- 0
--     bad long window                0           0 +- 0
-- Finished stage 'utg-overlapCheck', reset canuIteration.
----------------------------------------
-- Starting command on Fri Jan 16 13:19:57 2026 with 4532617.875 GB free disk space

    cd unitigging
    /share/org/YZWL/yzwl_lixg/miniforge3/envs/canu_v.2.3/bin/ovStoreConfig \
     -S ../41.seqStore \
     -M 4-8 \
     -L ./1-overlapper/ovljob.files \
     -create ./41.ovlStore.config \
     > ./41.ovlStore.config.txt \
    2> ./41.ovlStore.config.err

-- Finished on Fri Jan 16 13:19:57 2026 (in the blink of an eye) with 4532617.843 GB free disk space
----------------------------------------
--
-- Creating overlap store unitigging/41.ovlStore using:
--      1 bucket
--      1 slice
--        using at most 3 GB memory each
--
-- Running jobs.  First attempt out of 2.
----------------------------------------
-- Starting 'ovS' concurrent execution on Fri Jan 16 13:19:57 2026 with 4532617.828 GB free disk space (1 processes; 62 concurrently)

    cd unitigging
    ./41.ovlStore.sh 1 > ./41.ovlStore.000001.out 2>&1

-- Finished on Fri Jan 16 13:20:16 2026 (19 seconds) with 4532562.234 GB free disk space
----------------------------------------
-- Checking store.
----------------------------------------
-- Starting command on Fri Jan 16 13:20:16 2026 with 4532562.234 GB free disk space

    cd unitigging
    /share/org/YZWL/yzwl_lixg/miniforge3/envs/canu_v.2.3/bin/ovStoreDump \
     -S ../41.seqStore \
     -O  ./41.ovlStore \
     -counts \
     > ./41.ovlStore/counts.dat 2> ./41.ovlStore/counts.err

-- Finished on Fri Jan 16 13:20:16 2026 (lickety-split) with 4532562.187 GB free disk space
----------------------------------------
--
-- Overlap store 'unitigging/41.ovlStore' successfully constructed.
-- Found 87806934 overlaps for 279982 reads; 1426038 reads have no overlaps.
--
--
-- Purged 0.863 GB in 63 overlap output files.
----------------------------------------
-- Starting command on Fri Jan 16 13:20:17 2026 with 4532563.062 GB free disk space

    cd unitigging
    /share/org/YZWL/yzwl_lixg/miniforge3/envs/canu_v.2.3/bin/ovStoreStats \
     -C 50 \
     -S ../41.seqStore \
     -O  ./41.ovlStore \
     -o  ./41.ovlStore \
     > ./41.ovlStore.summary.err 2>&1

-- Finished on Fri Jan 16 13:20:29 2026 (12 seconds) with 4532562.906 GB free disk space
----------------------------------------
--
-- Overlap store 'unitigging/41.ovlStore' contains:
--
--   category            reads     %          read length        feature size or coverage  analysis
--   ----------------  -------  -------  ----------------------  ------------------------  --------------------
--   middle-missing        131    0.05    13835.74 +- 7538.41        572.89 +- 683.05     (bad trimming)
--   middle-hump            25    0.01     7868.20 +- 6667.86       3493.08 +- 4113.48    (bad trimming)
--   no-5-prime            625    0.22    12679.13 +- 6046.13       1252.87 +- 2345.11    (bad trimming)
--   no-3-prime            877    0.30    10171.91 +- 6578.93       1153.97 +- 2341.56    (bad trimming)
--   
--   low-coverage         1577    0.55     8951.31 +- 6292.82          5.75 +- 3.65       (easy to assemble, potential for lower quality consensus)
--   unique             226979   78.78    11322.38 +- 6405.83         45.46 +- 8.66       (easy to assemble, perfect, yay)
--   repeat-cont         22918    7.95     8988.67 +- 5506.77       1607.57 +- 1289.81    (potential for consensus errors, no impact on assembly)
--   repeat-dove           268    0.09    20456.59 +- 1749.17        674.06 +- 859.36     (hard to assemble, likely won't assemble correctly or even at all)
--   
--   span-repeat          4310    1.50    13654.53 +- 5532.50       3456.81 +- 3993.15    (read spans a large repeat, usually easy to assemble)
--   uniq-repeat-cont    15016    5.21    11842.16 +- 5351.19                             (should be uniquely placed, low potential for consensus errors, no impact on assembly)
--   uniq-repeat-dove     3174    1.10    18967.27 +- 2703.25                             (will end contigs, potential to misassemble)
--   uniq-anchor          4082    1.42    13013.14 +- 5275.10       7598.00 +- 5228.27    (repeat read, with unique section, probable bad read)
-- Finished stage 'utg-createOverlapStore', reset canuIteration.
--
-- Loading read lengths.
-- Loading number of overlaps per read.
--
-- Configure RED for 16gb memory.
--                   Batches of at most (unlimited) reads.
--                                      500000000 bases.
--                   Expecting evidence of at most 536870912 bases per iteration.
--
--           Total                                               Reads                 Olaps Evidence
--    Job   Memory      Read Range         Reads        Bases   Memory        Olaps   Memory   Memory  (Memory in MB)
--   ---- -------- ------------------- --------- ------------ -------- ------------ -------- --------
--      1 16385.76         1-34702          5827    108889251 13292.33      1872380    21.43  1024.00
--      2 16384.97     34703-81676          7953    108859935 13288.82      2110239    24.15  1024.00
--      3 16384.01     81677-115923         5811    108906741 13294.46      1533396    17.55  1024.00
--      4 16385.11    115924-153422         6277    108823131 13284.27      2519810    28.84  1024.00
--      5 16384.20    153423-203221         8461    108924260 13296.68      1355374    15.51  1024.00
--      6 16386.13    203222-254942         8613    108794305 13280.83      2910267    33.31  1024.00
--      7 16384.49    254943-290844         6049    108762928 13276.91      3108673    35.58  1024.00
--      8 16385.44    290845-332493         7135    108931191 13297.49      1394111    15.95  1024.00
--      9 16385.79    332494-393622        10158    108779304 13279.04      3036519    34.75  1024.00
--     10 16384.33    393623-427916         5918    108802100 13281.69      2677556    30.64  1024.00
--     11 16384.41    427917-466806         6536    108896763 13293.27      1672911    19.14  1024.00
--     12 16384.07    466807-531837        10879    108753106 13275.87      3163331    36.20  1024.00
--     13 16385.13    531838-567433         6056    108915386 13295.53      1537872    17.60  1024.00
--     14 16386.16    567434-604398         6210    108828748 13284.95      2552285    29.21  1024.00
--     15 16385.61    604399-651296         7963    108960991 13301.15      1088447    12.46  1024.00
--     16 16386.16    651297-707220         9441    108761616 13276.86      3259109    37.30  1024.00
--     17 16384.04    707221-743266         6070    108771539 13277.97      2977189    34.07  1024.00
--     18 16385.86    743267-784544         7015    108894147 13292.96      1826266    20.90  1024.00
--     19 16385.49    784545-849565        11041    108724663 13272.40      3590239    41.09  1024.00
--     20 16384.71    849566-883937         5794    108883327 13291.60      1844499    21.11  1024.00
--     21 16384.39    883938-920564         6272    108819207 13283.79      2498616    28.59  1024.00
--     22 16385.36    920565-974592         9045    108905808 13294.45      1652110    18.91  1024.00
--     23 16385.64    974593-1016873        7142    108831531 13285.32      2474275    28.32  1024.00
--     24 16385.31   1016874-1051979        5983    108780029 13279.00      2997637    34.31  1024.00
--     25 16385.42   1051980-1093880        7110    108940903 13298.67      1288456    14.75  1024.00
--     26 16385.74   1093881-1148994        9225    108804480 13282.09      2765525    31.65  1024.00
--     27 16384.05   1148995-1184169        5888    108831362 13285.26      2340412    26.78  1024.00
--     28 16385.05   1184170-1222332        6469    108893126 13292.82      1767540    20.23  1024.00
--     29 16384.05   1222333-1280879        9942    108777632 13278.83      2902373    33.22  1024.00
--     30 16385.81   1280880-1314386        5685    108926085 13296.82      1484395    16.99  1024.00
--     31 16385.26   1314387-1350641        6076    108853482 13287.97      2209524    25.29  1024.00
--     32 16384.18   1350642-1397312        7962    108935088 13297.99      1239503    14.18  1024.00
--     33 16384.02   1397313-1444405        7961    108828138 13284.94      2366543    27.08  1024.00
--     34 16385.87   1444406-1479378        5906    108811831 13282.88      2708235    30.99  1024.00
--     35 16384.40   1479379-1519602        6732    108931202 13297.48      1304277    14.93  1024.00
--     36 16384.71   1519603-1574594        9238    108797005 13281.18      2755529    31.53  1024.00
--     37 16386.53   1574595-1609028        5835    108859908 13288.75      2253235    25.79  1024.00
--     38 16385.68   1609029-1646338        6351    108902469 13293.96      1722959    19.72  1024.00
--     39 16384.32   1646339-1703484        9672    108776127 13278.64      2942708    33.68  1024.00
--     40  3677.33   1703485-1706020         434      4949123   604.15       102609     1.17  1024.00
--   ---- -------- ------------------- --------- ------------ -------- ------------ -------- --------
--                                                 4250017968              87806934
-- Finished stage 'readErrorDetectionConfigure', reset canuIteration.
--
-- Running jobs.  First attempt out of 2.
----------------------------------------
-- Starting 'red' concurrent execution on Fri Jan 16 13:20:37 2026 with 4532501.484 GB free disk space (40 processes; 22 concurrently)

    cd unitigging/3-overlapErrorAdjustment
    ./red.sh 1 > ./red.000001.out 2>&1
    ./red.sh 2 > ./red.000002.out 2>&1
    ./red.sh 3 > ./red.000003.out 2>&1
    ./red.sh 4 > ./red.000004.out 2>&1
    ./red.sh 5 > ./red.000005.out 2>&1
    ./red.sh 6 > ./red.000006.out 2>&1
    ./red.sh 7 > ./red.000007.out 2>&1
    ./red.sh 8 > ./red.000008.out 2>&1
    ./red.sh 9 > ./red.000009.out 2>&1
    ./red.sh 10 > ./red.000010.out 2>&1
    ./red.sh 11 > ./red.000011.out 2>&1
    ./red.sh 12 > ./red.000012.out 2>&1
    ./red.sh 13 > ./red.000013.out 2>&1
    ./red.sh 14 > ./red.000014.out 2>&1
    ./red.sh 15 > ./red.000015.out 2>&1
    ./red.sh 16 > ./red.000016.out 2>&1
    ./red.sh 17 > ./red.000017.out 2>&1
    ./red.sh 18 > ./red.000018.out 2>&1
    ./red.sh 19 > ./red.000019.out 2>&1
    ./red.sh 20 > ./red.000020.out 2>&1
    ./red.sh 21 > ./red.000021.out 2>&1
    ./red.sh 22 > ./red.000022.out 2>&1
    ./red.sh 23 > ./red.000023.out 2>&1
    ./red.sh 24 > ./red.000024.out 2>&1
    ./red.sh 25 > ./red.000025.out 2>&1
    ./red.sh 26 > ./red.000026.out 2>&1
    ./red.sh 27 > ./red.000027.out 2>&1
    ./red.sh 28 > ./red.000028.out 2>&1
    ./red.sh 29 > ./red.000029.out 2>&1
    ./red.sh 30 > ./red.000030.out 2>&1
    ./red.sh 31 > ./red.000031.out 2>&1
    ./red.sh 32 > ./red.000032.out 2>&1
    ./red.sh 33 > ./red.000033.out 2>&1
    ./red.sh 34 > ./red.000034.out 2>&1
    ./red.sh 35 > ./red.000035.out 2>&1
    ./red.sh 36 > ./red.000036.out 2>&1
    ./red.sh 37 > ./red.000037.out 2>&1
    ./red.sh 38 > ./red.000038.out 2>&1
    ./red.sh 39 > ./red.000039.out 2>&1
    ./red.sh 40 > ./red.000040.out 2>&1

-- Finished on Fri Jan 16 13:34:43 2026 (846 seconds) with 4532273.171 GB free disk space
----------------------------------------
-- Found 40 read error detection output files.
-- Finished stage 'readErrorDetectionCheck', reset canuIteration.
--
-- Loading read lengths.
-- Loading number of overlaps per read.
--
-- Configure OEA for 8gb memory.
--                   Batches of at most (unlimited) reads.
--                                      300000000 bases.
--
--           Total                                               Reads                 Olaps  Adjusts
--    Job   Memory      Read Range         Reads        Bases   Memory        Olaps   Memory   Memory  (Memory in MB)
--   ---- -------- ------------------- --------- ------------ -------- ------------ -------- --------
--      1  2847.74         1-106907        18111    300010625   294.67      4509793   137.63   367.45
--      2  2937.25    106908-237789        21971    300000924   294.77      7439075   227.02   367.45
--      3  2867.30    237790-348964        18806    300017076   294.69      5149874   157.16   367.45
--      4  2928.00    348965-467680        20017    300000683   294.71      7138085   217.84   367.45
--      5  2913.36    467681-596097        21589    300014031   294.77      6656293   203.13   367.45
--      6  2907.77    596098-726235        22003    300019146   294.79      6472502   197.53   367.45
--      7  2924.78    726236-859719        22596    300011706   294.80      7029540   214.52   367.45
--      8  2895.76    859720-978991        20231    300008587   294.73      6081261   185.59   367.45
--      9  2901.36    978992-1084156       17834    300002533   294.65      6267134   191.26   367.45
--     10  2910.47   1084157-1204732       20226    300015410   294.73      6562948   200.29   367.45
--     11  2887.84   1204733-1325578       20470    300004904   294.73      5821677   177.66   367.45
--     12  2861.03   1325579-1447003       20548    300012671   294.74      4942690   150.84   367.45
--     13  2911.46   1447004-1568500       20477    300020938   294.75      6594913   201.26   367.45
--     14  2852.11   1568501-1673479       17706    300009548   294.65      4653282   142.01   367.45
--     15  2547.10   1673480-1706020        5550     49869186    55.73      2487867    75.92   367.45
--   ---- -------- ------------------- --------- ------------ -------- ------------ -------- --------
--                                                 4250017968              87806934
-- Finished stage 'overlapErrorAdjustmentConfigure', reset canuIteration.
--
-- Running jobs.  First attempt out of 2.
----------------------------------------
-- Starting 'oea' concurrent execution on Fri Jan 16 13:34:51 2026 with 4532273.062 GB free disk space (15 processes; 62 concurrently)

    cd unitigging/3-overlapErrorAdjustment
    ./oea.sh 1 > ./oea.000001.out 2>&1
    ./oea.sh 2 > ./oea.000002.out 2>&1
    ./oea.sh 3 > ./oea.000003.out 2>&1
    ./oea.sh 4 > ./oea.000004.out 2>&1
    ./oea.sh 5 > ./oea.000005.out 2>&1
    ./oea.sh 6 > ./oea.000006.out 2>&1
    ./oea.sh 7 > ./oea.000007.out 2>&1
    ./oea.sh 8 > ./oea.000008.out 2>&1
    ./oea.sh 9 > ./oea.000009.out 2>&1
    ./oea.sh 10 > ./oea.000010.out 2>&1
    ./oea.sh 11 > ./oea.000011.out 2>&1
    ./oea.sh 12 > ./oea.000012.out 2>&1
    ./oea.sh 13 > ./oea.000013.out 2>&1
    ./oea.sh 14 > ./oea.000014.out 2>&1
    ./oea.sh 15 > ./oea.000015.out 2>&1

-- Finished on Fri Jan 16 14:18:11 2026 (2600 seconds) with 4531047.765 GB free disk space
----------------------------------------
-- Found 15 overlap error adjustment output files.
-- Finished stage 'overlapErrorAdjustmentCheck', reset canuIteration.
----------------------------------------
-- Starting command on Fri Jan 16 14:18:11 2026 with 4531047.75 GB free disk space

    cd unitigging/3-overlapErrorAdjustment
    /share/org/YZWL/yzwl_lixg/miniforge3/envs/canu_v.2.3/bin/loadErates \
      -S ../../41.seqStore \
      -O ../41.ovlStore \
      -L ./oea.files \
    > ./oea.apply.err 2>&1

-- Finished on Fri Jan 16 14:18:11 2026 (fast as lightning) with 4531047.578 GB free disk space
----------------------------------------
-- No report available.
-- Finished stage 'updateOverlapStore', reset canuIteration.
-- Finished stage 'unitig', reset canuIteration.
--
-- Running jobs.  First attempt out of 2.
----------------------------------------
-- Starting 'bat' concurrent execution on Fri Jan 16 14:18:11 2026 with 4531047.531 GB free disk space (1 processes; 1 concurrently)

    cd unitigging/4-unitigger
    ./unitigger.sh 1 > ./unitigger.000001.out 2>&1

-- Finished on Fri Jan 16 14:18:34 2026 (23 seconds) with 4530975.359 GB free disk space
----------------------------------------
-- Unitigger finished successfully.
--  
--  ERROR RATES
--  -----------
--                                                   --------threshold------
--  314651                       fraction error      fraction        percent
--  samples                              (1e-5)         error          error
--                   --------------------------      --------       --------
--  command line (-eg)                           ->     30.00        0.0300%
--  command line (-ef)                           ->  -----.--      ---.----%
--  command line (-eM)                           ->     30.00        0.0300%
--  mean + std.dev       0.39 +-  12 *     2.84  ->     34.45        0.0344%
--  median + mad         0.00 +-  12 *     0.00  ->      0.00        0.0000%
--  90th percentile                              ->      1.00        0.0010%  (enabled)
--  
--  BEST EDGE FILTERING
--  -------------------
--  At graph threshold 0.0300%, reads:
--    available to have edges:        50648
--    with at least one edge:         40685
--  
--  At max threshold 0.0300%, reads:  (not computed)
--    available to have edges:            0
--    with at least one edge:             0
--  
--  At tight threshold 0.0010%, reads with:
--    both edges below error threshold:     35206  (80.00% minReadsBest threshold = 32548)
--    one  edge  above error threshold:      3914
--    both edges above error threshold:      1565
--    at least one edge:                    40685
--  
--  At loose threshold 0.0300%, reads with:
--    both edges below error threshold:     40685  (80.00% minReadsBest threshold = 32548)
--    one  edge  above error threshold:         0
--    both edges above error threshold:         0
--    at least one edge:                    40685
--  
--  
--  INITIAL EDGES
--  -------- ----------------------------------------
--    231740 reads are contained
--   1439220 reads have no best edges (singleton)
--       300 reads have only one best edge (spur) 
--                157 are mutual best
--     34760 reads have two best edges 
--                889 have one mutual best edge
--              33529 have two mutual best edges
--  
--  
--  FINAL EDGES
--  -------- ----------------------------------------
--    231740 reads are contained
--   1439521 reads have no best edges (singleton)
--       208 reads have only one best edge (spur) 
--                167 are mutual best
--     34551 reads have two best edges 
--                805 have one mutual best edge
--              33508 have two mutual best edges
--  
--  
--  EDGE FILTERING
--  -------- ------------------------------------------
--         0 reads are ignored
--     11331 reads have a gap in overlap coverage
--       158 reads have lopsided best edges
-- Found, in version 1, after unitig construction:
--   contigs:      102 sequences, total length 68569093 bp (including 174 repeats of total length 4684053 bp).
--   bubbles:      257 sequences, total length 10582677 bp.
--   unassembled:  21925 sequences, total length 237108822 bp.
--
-- Contig sizes based on genome size 85mbp:
--
--            NG (bp)  LG (contigs)    sum (bp)
--         ----------  ------------  ----------
--     10     6077165             2    12407063
--     20     6041748             3    18448811
--     30     4601090             5    28929318
--     40     4190419             7    37653520
--     50     3826837             9    45478106
--     60     3013416            11    51784758
--     70     1444643            15    59859224
--     80       21581            69    68020035
--
-- Finished stage 'unitigCheck', reset canuIteration.
----------------------------------------
-- Starting command on Fri Jan 16 14:18:34 2026 with 4530975.343 GB free disk space

    cd unitigging
    /share/org/YZWL/yzwl_lixg/miniforge3/envs/canu_v.2.3/bin/utgcns \
      -S ../41.seqStore \
      -T  ./41.ctgStore 1 \
      -partition 0.8 1.5 0.1 \
    > ./41.ctgStore/partitioning.log 2>&1

-- Finished on Fri Jan 16 14:18:44 2026 (10 seconds) with 4530974.734 GB free disk space
----------------------------------------
-- Using slow alignment for consensus (iteration '0').
-- Configured 11 consensus jobs.
-- Finished stage 'consensusConfigure', reset canuIteration.
--
-- Local: cns        9.500 GB    8 CPUs x  11 jobs   104.500 GB  88 CPUs  (consensus)
--
--
-- Running jobs.  First attempt out of 2.
----------------------------------------
-- Starting 'cns' concurrent execution on Fri Jan 16 14:18:44 2026 with 4530974.703 GB free disk space (11 processes; 11 concurrently)

    cd unitigging/5-consensus
    ./consensus.sh 1 > ./consensus.000001.out 2>&1
    ./consensus.sh 2 > ./consensus.000002.out 2>&1
    ./consensus.sh 3 > ./consensus.000003.out 2>&1
    ./consensus.sh 4 > ./consensus.000004.out 2>&1
    ./consensus.sh 5 > ./consensus.000005.out 2>&1
    ./consensus.sh 6 > ./consensus.000006.out 2>&1
    ./consensus.sh 7 > ./consensus.000007.out 2>&1
    ./consensus.sh 8 > ./consensus.000008.out 2>&1
    ./consensus.sh 9 > ./consensus.000009.out 2>&1
    ./consensus.sh 10 > ./consensus.000010.out 2>&1
    ./consensus.sh 11 > ./consensus.000011.out 2>&1

-- Finished on Fri Jan 16 14:25:31 2026 (407 seconds) with 4531298.046 GB free disk space
----------------------------------------
-- Using slow alignment for consensus (iteration '1').
-- Configured 11 consensus jobs.
-- All 11 consensus jobs finished successfully.
-- Finished stage 'consensusCheck', reset canuIteration.
-- Using slow alignment for consensus (iteration '0').
-- Configured 11 consensus jobs.
----------------------------------------
-- Starting command on Fri Jan 16 14:25:31 2026 with 4531298 GB free disk space

    cd unitigging
    /share/org/YZWL/yzwl_lixg/miniforge3/envs/canu_v.2.3/bin/tgStoreLoad \
      -S ../41.seqStore \
      -T  ./41.ctgStore 2 \
      -L ./5-consensus/ctgcns.files \
    > ./5-consensus/ctgcns.files.ctgStoreLoad.err 2>&1

-- Finished on Fri Jan 16 14:25:32 2026 (one second) with 4531297.125 GB free disk space
----------------------------------------
----------------------------------------
-- Starting command on Fri Jan 16 14:25:32 2026 with 4531297.125 GB free disk space

    cd unitigging
    /share/org/YZWL/yzwl_lixg/miniforge3/envs/canu_v.2.3/bin/tgTigDisplay \
      -S ../41.seqStore \
      -b \
      -o ../41.contigs.unsorted.bam \
      -L ./5-consensus/ctgcns.files \
    > ./5-consensus/ctgcns.files.contigs.bam.err 2>&1

-- Finished on Fri Jan 16 14:28:22 2026 (170 seconds) with 4530554.109 GB free disk space
----------------------------------------
----------------------------------------
-- Starting command on Fri Jan 16 14:28:22 2026 with 4530554.109 GB free disk space

    cd .
    samtools sort \
      --write-index \
      --threads 2 \
      -o ./41.contigs.bam ./41.contigs.unsorted.bam \
    > ./ctgcns.bam.err 2>&1

-- Finished on Fri Jan 16 14:29:24 2026 (62 seconds) with 4530503.468 GB free disk space
----------------------------------------
-- Purging consensus output after loading to ctgStore.
-- Purged 11 .cns outputs.
----------------------------------------
-- Starting command on Fri Jan 16 14:29:24 2026 with 4530504.515 GB free disk space

    cd unitigging
    /share/org/YZWL/yzwl_lixg/miniforge3/envs/canu_v.2.3/bin/tgStoreDump \
      -S ../41.seqStore \
      -T ./41.ctgStore 2 \
      -sizes -s 85000000 \
    > ./41.ctgStore/seqDB.v002.sizes.txt
ZERO length suplied to intervalList::add(), ignoring interval.
ZERO length suplied to intervalList::add(), ignoring interval.
ZERO length suplied to intervalList::add(), ignoring interval.
ZERO length suplied to intervalList::add(), ignoring interval.
ZERO length suplied to intervalList::add(), ignoring interval.
ZERO length suplied to intervalList::add(), ignoring interval.
ZERO length suplied to intervalList::add(), ignoring interval.
ZERO length suplied to intervalList::add(), ignoring interval.
ZERO length suplied to intervalList::add(), ignoring interval.
ZERO length suplied to intervalList::add(), ignoring interval.

-- Finished on Fri Jan 16 14:29:24 2026 (furiously fast) with 4530504.515 GB free disk space
----------------------------------------
-- Found, in version 2, after consensus generation:
--   contigs:      102 sequences, total length 89473961 bp (including 174 repeats of total length 6312815 bp).
--   bubbles:      257 sequences, total length 13935492 bp.
--   unassembled:  21925 sequences, total length 327488097 bp.
--
-- Contig sizes based on genome size 85mbp:
--
--            NG (bp)  LG (contigs)    sum (bp)
--         ----------  ------------  ----------
--     10     7895919             2    16145554
--     20     7849132             3    23994686
--     30     7633359             4    31628045
--     40     5994203             5    37622248
--     50     5883662             6    43505910
--     60     5220090             8    54180997
--     70     4295525            10    63472060
--     80     3212487            12    70616171
--     90     1886260            15    77927446
--    100      485507            22    85228307
--
-- Finished stage 'consensusLoad', reset canuIteration.
----------------------------------------
-- Starting command on Fri Jan 16 14:29:24 2026 with 4530504.5 GB free disk space

    cd .
    /share/org/YZWL/yzwl_lixg/miniforge3/envs/canu_v.2.3/bin/tgStoreDump \
      -S ./41.seqStore \
      -T ./unitigging/41.ctgStore 2 \
      -o ./41.contigs \
      -layout \
    > ./41.contigs.layout.err 2>&1

-- Finished on Fri Jan 16 14:29:25 2026 (one second) with 4530504.468 GB free disk space
----------------------------------------
----------------------------------------
-- Starting command on Fri Jan 16 14:29:25 2026 with 4530504.468 GB free disk space

    cd .
    /share/org/YZWL/yzwl_lixg/miniforge3/envs/canu_v.2.3/bin/tgStoreDump \
      -S ./41.seqStore \
      -T ./unitigging/41.ctgStore 2 \
      -consensus -fasta \
      -unassembled \
    > ./41.unassembled.fasta
    2> ./41.unassembled.err
ZERO length suplied to intervalList::add(), ignoring interval.
ZERO length suplied to intervalList::add(), ignoring interval.
ZERO length suplied to intervalList::add(), ignoring interval.
ZERO length suplied to intervalList::add(), ignoring interval.
ZERO length suplied to intervalList::add(), ignoring interval.
ZERO length suplied to intervalList::add(), ignoring interval.
ZERO length suplied to intervalList::add(), ignoring interval.
ZERO length suplied to intervalList::add(), ignoring interval.
ZERO length suplied to intervalList::add(), ignoring interval.
ZERO length suplied to intervalList::add(), ignoring interval.

-- Finished on Fri Jan 16 14:29:27 2026 (2 seconds) with 4530504.109 GB free disk space
----------------------------------------
----------------------------------------
-- Starting command on Fri Jan 16 14:29:27 2026 with 4530504.109 GB free disk space

    cd .
    /share/org/YZWL/yzwl_lixg/miniforge3/envs/canu_v.2.3/bin/tgStoreDump \
      -S ./41.seqStore \
      -T ./unitigging/41.ctgStore 2 \
      -consensus -fasta \
      -contigs \
    > ./41.contigs.fasta
    2> ./41.contigs.err
ZERO length suplied to intervalList::add(), ignoring interval.
ZERO length suplied to intervalList::add(), ignoring interval.
ZERO length suplied to intervalList::add(), ignoring interval.
ZERO length suplied to intervalList::add(), ignoring interval.
ZERO length suplied to intervalList::add(), ignoring interval.
ZERO length suplied to intervalList::add(), ignoring interval.
ZERO length suplied to intervalList::add(), ignoring interval.
ZERO length suplied to intervalList::add(), ignoring interval.
ZERO length suplied to intervalList::add(), ignoring interval.
ZERO length suplied to intervalList::add(), ignoring interval.

-- Finished on Fri Jan 16 14:29:28 2026 (one second) with 4530503.968 GB free disk space
----------------------------------------
-- Finished stage 'generateOutputs', reset canuIteration.
--
-- Assembly '41' finished in '/share/org/YZWL/yzwl_lixg/project/28.大豆疫霉菌三代基因组/03.hicanu/41/01.raw_output'.
--
-- Summary saved in '41.report'.
--
-- Sequences saved:
--   Contigs       -> '41.contigs.fasta'
--   Unassembled   -> '41.unassembled.fasta'
--
-- Read layouts saved:
--   Contigs       -> '41.contigs.layout'.
--
-- Bye.

2026-01-16 14:29:28.385 - WARNING - 输出文件不存在|Output file does not exist: /share/org/YZWL/yzwl_lixg/project/28.大豆疫霉菌三代基因组/03.hicanu/41/01.raw_output/41.unitigs.fasta
Job 68889937 stderr output:

