2026-01-16 14:43:11.519 - WARNING - 命令错误输出|Command stderr:
-- canu master +27 changes (r10515 2a41e933b8de6ed66723d75d36dd071b46d2c347)
--
-- CITATIONS
--
-- For assemblies of PacBio HiFi reads:
--   Nurk S, Walenz BP, Rhiea A, Vollger MR, Logsdon GA, Grothe R, Miga KH, Eichler EE, Phillippy AM, Koren S.
--   HiCanu: accurate assembly of segmental duplications, satellites, and allelic variants from high-fidelity long reads.
--   biorXiv. 2020.
--   https://doi.org/10.1101/2020.03.14.992248
-- 
-- Read and contig alignments during correction and consensus use:
--   Šošic M, Šikic M.
--   Edlib: a C/C ++ library for fast, exact sequence alignment using edit distance.
--   Bioinformatics. 2017 May 1;33(9):1394-1395.
--   http://doi.org/10.1093/bioinformatics/btw753
-- 
-- Overlaps are generated using:
--   Berlin K, et al.
--   Assembling large genomes with single-molecule sequencing and locality-sensitive hashing.
--   Nat Biotechnol. 2015 Jun;33(6):623-30.
--   http://doi.org/10.1038/nbt.3238
-- 
--   Myers EW, et al.
--   A Whole-Genome Assembly of Drosophila.
--   Science. 2000 Mar 24;287(5461):2196-204.
--   http://doi.org/10.1126/science.287.5461.2196
-- 
-- Contig consensus sequences are generated using an algorithm derived from pbdagcon:
--   Chin CS, et al.
--   Nonhybrid, finished microbial genome assemblies from long-read SMRT sequencing data.
--   Nat Methods. 2013 Jun;10(6):563-9
--   http://doi.org/10.1038/nmeth.2474
-- 
-- CONFIGURE CANU
--
-- Detected Java(TM) Runtime Environment '25.0.1-internal' (from '/share/org/YZWL/yzwl_lixg/miniforge3/envs/telocomp/lib/jvm/bin/java') without -d64 support.
--
-- WARNING:
-- WARNING:  Failed to run gnuplot using command 'gnuplot'.
-- WARNING:  Plots will be disabled.
-- WARNING:
--
-- Detected samtools version '1.22' / htslib version 'htscodecs=1.6.3' (from 'samtools').
--
-- Detected 88 CPUs and 503 gigabytes of memory on the local machine.
--
-- Detected Slurm with 'sinfo' binary in /opt/skyformai/bin/sinfo.
--          Slurm disabled by useGrid=false
--
-- Detected  '' with 'pbsnodes' binary in /opt/skyformai/bin/pbsnodes.
--           disabled by useGrid=false
--
-- Detected LSF with 'bsub' binary in /opt/skyformai/bin/bsub.
--          LSF disabled by useGrid=false
--
-- Local machine mode enabled; grid support not detected or not allowed.
--
-- Found trimmed raw PacBio HiFi reads in the input files.
--
--                                (tag)Concurrency
--                         (tag)Threads          |
--                (tag)Memory         |          |
--        (tag)             |         |          |       total usage      algorithm
--        -------  ----------  --------   --------  --------------------  -----------------------------
-- Local: meryl     12.000 GB    4 CPUs x  22 jobs   264.000 GB  88 CPUs  (k-mer counting)
-- Local: cormhap   13.000 GB   11 CPUs x   8 jobs   104.000 GB  88 CPUs  (overlap detection with mhap)
-- Local: obtovl     8.000 GB    8 CPUs x  11 jobs    88.000 GB  88 CPUs  (overlap detection)
-- Local: utgovl     8.000 GB    8 CPUs x  11 jobs    88.000 GB  88 CPUs  (overlap detection)
-- Local: cor        -.--- GB    4 CPUs x   - jobs     -.--- GB   - CPUs  (read correction)
-- Local: ovb        4.000 GB    1 CPU  x  88 jobs   352.000 GB  88 CPUs  (overlap store bucketizer)
-- Local: ovs        8.000 GB    1 CPU  x  62 jobs   496.000 GB  62 CPUs  (overlap store sorting)
-- Local: red       16.000 GB    4 CPUs x  22 jobs   352.000 GB  88 CPUs  (read error detection)
-- Local: oea        8.000 GB    1 CPU  x  62 jobs   496.000 GB  62 CPUs  (overlap error adjustment)
-- Local: bat       32.000 GB    8 CPUs x   1 job     32.000 GB   8 CPUs  (contig construction with bogart)
-- Local: cns        -.--- GB    8 CPUs x   - jobs     -.--- GB   - CPUs  (consensus)
--
-- Generating assembly 'A3-22' in '/share/org/YZWL/yzwl_lixg/project/28.大豆疫霉菌三代基因组/03.hicanu/A3-22/01.raw_output':
--   genomeSize:
--     85000000
--
--   Overlap Generation Limits:
--     corOvlErrorRate 0.0000 (  0.00%)
--     obtOvlErrorRate 0.0250 (  2.50%)
--     utgOvlErrorRate 0.0100 (  1.00%)
--
--   Overlap Processing Limits:
--     corErrorRate    0.0000 (  0.00%)
--     obtErrorRate    0.0250 (  2.50%)
--     utgErrorRate    0.0003 (  0.03%)
--     cnsErrorRate    0.0500 (  5.00%)
--
--   Stages to run:
--     assemble HiFi reads.
--
--
-- BEGIN STORE CREATION
----------------------------------------
-- Starting command on Fri Jan 16 13:22:35 2026 with 4532417.046 GB free disk space

    cd .
    ./A3-22.seqStore.sh \
    > ./A3-22.seqStore.err 2>&1

-- Finished on Fri Jan 16 13:29:40 2026 (425 seconds) with 4532352.093 GB free disk space
----------------------------------------
--
-- In sequence store './A3-22.seqStore':
--   Found 233378 reads.
--   Found 4250012328 bases (50 times coverage).
--    Histogram of corrected reads:
--    
--    G=4250012328                       sum of  ||               length     num
--    NG         length     index       lengths  ||                range    seqs
--    ----- ------------ --------- ------------  ||  ------------------- -------
--    00010        27880     14035    425013941  ||       1253-2581         6041|---------------
--    00020        25472     30035    850020283  ||       2582-3910         8649|---------------------
--    00030        23841     47305   1275010861  ||       3911-5239         7649|-------------------
--    00040        22565     65640   1700025795  ||       5240-6568         6888|-----------------
--    00050        21466     84956   2125016299  ||       6569-7897         5838|--------------
--    00060        20431    105249   2550019412  ||       7898-9226         5204|-------------
--    00070        19353    126606   2975025810  ||       9227-10555        4683|------------
--    00080        17985    149333   3400017691  ||      10556-11884        4332|-----------
--    00090        14986    174624   3825012102  ||      11885-13213        3936|----------
--    00100         1253    233378   4250012328  ||      13214-14542        3898|----------
--    001.000x              233378   4250012328  ||      14543-15871        5877|--------------
--                                               ||      15872-17200       11134|---------------------------
--                                               ||      17201-18529       18267|--------------------------------------------
--                                               ||      18530-19858       24181|----------------------------------------------------------
--                                               ||      19859-21187       26560|---------------------------------------------------------------
--                                               ||      21188-22516       23797|---------------------------------------------------------
--                                               ||      22517-23845       19201|----------------------------------------------
--                                               ||      23846-25174       14496|-----------------------------------
--                                               ||      25175-26503       10727|--------------------------
--                                               ||      26504-27832        7765|-------------------
--                                               ||      27833-29161        5408|-------------
--                                               ||      29162-30490        3696|---------
--                                               ||      30491-31819        2310|------
--                                               ||      31820-33148        1459|----
--                                               ||      33149-34477         768|--
--                                               ||      34478-35806         361|-
--                                               ||      35807-37135         170|-
--                                               ||      37136-38464          60|-
--                                               ||      38465-39793          14|-
--                                               ||      39794-41122           1|-
--                                               ||      41123-42451           3|-
--                                               ||      42452-43780           2|-
--                                               ||      43781-45109           0|
--                                               ||      45110-46438           0|
--                                               ||      46439-47767           0|
--                                               ||      47768-49096           0|
--                                               ||      49097-50425           2|-
--                                               ||      50426-51754           0|
--                                               ||      51755-53083           0|
--                                               ||      53084-54412           0|
--                                               ||      54413-55741           1|-
--    
--
-- In sequence store './A3-22.seqStore':
--   Found 233378 reads.
--   Found 4250012328 bases (50 times coverage).
--    Histogram of corrected-trimmed reads:
--    
--    G=4250012328                       sum of  ||               length     num
--    NG         length     index       lengths  ||                range    seqs
--    ----- ------------ --------- ------------  ||  ------------------- -------
--    00010        27880     14035    425013941  ||       1253-2581         6041|---------------
--    00020        25472     30035    850020283  ||       2582-3910         8649|---------------------
--    00030        23841     47305   1275010861  ||       3911-5239         7649|-------------------
--    00040        22565     65640   1700025795  ||       5240-6568         6888|-----------------
--    00050        21466     84956   2125016299  ||       6569-7897         5838|--------------
--    00060        20431    105249   2550019412  ||       7898-9226         5204|-------------
--    00070        19353    126606   2975025810  ||       9227-10555        4683|------------
--    00080        17985    149333   3400017691  ||      10556-11884        4332|-----------
--    00090        14986    174624   3825012102  ||      11885-13213        3936|----------
--    00100         1253    233378   4250012328  ||      13214-14542        3898|----------
--    001.000x              233378   4250012328  ||      14543-15871        5877|--------------
--                                               ||      15872-17200       11134|---------------------------
--                                               ||      17201-18529       18267|--------------------------------------------
--                                               ||      18530-19858       24181|----------------------------------------------------------
--                                               ||      19859-21187       26560|---------------------------------------------------------------
--                                               ||      21188-22516       23797|---------------------------------------------------------
--                                               ||      22517-23845       19201|----------------------------------------------
--                                               ||      23846-25174       14496|-----------------------------------
--                                               ||      25175-26503       10727|--------------------------
--                                               ||      26504-27832        7765|-------------------
--                                               ||      27833-29161        5408|-------------
--                                               ||      29162-30490        3696|---------
--                                               ||      30491-31819        2310|------
--                                               ||      31820-33148        1459|----
--                                               ||      33149-34477         768|--
--                                               ||      34478-35806         361|-
--                                               ||      35807-37135         170|-
--                                               ||      37136-38464          60|-
--                                               ||      38465-39793          14|-
--                                               ||      39794-41122           1|-
--                                               ||      41123-42451           3|-
--                                               ||      42452-43780           2|-
--                                               ||      43781-45109           0|
--                                               ||      45110-46438           0|
--                                               ||      46439-47767           0|
--                                               ||      47768-49096           0|
--                                               ||      49097-50425           2|-
--                                               ||      50426-51754           0|
--                                               ||      51755-53083           0|
--                                               ||      53084-54412           0|
--                                               ||      54413-55741           1|-
--    
--
-- Correction skipped; not enabled.
--
-- Trimming skipped; not enabled.
--
-- BEGIN ASSEMBLY
----------------------------------------
-- Starting command on Fri Jan 16 13:29:40 2026 with 4532352.046 GB free disk space

    cd unitigging/0-mercounts
    ./meryl-configure.sh \
    > ./meryl-configure.err 2>&1

-- Finished on Fri Jan 16 13:29:41 2026 (one second) with 4532352.046 GB free disk space
----------------------------------------
--  segments   memory batches
--  -------- -------- -------
--        01 10.81 GB       2
--        02  5.61 GB       2
--        04  2.97 GB       2
--        06  2.15 GB       2
--        08  1.61 GB       2
--        12  1.07 GB       2
--        16  0.81 GB       2
--        20  0.65 GB       2
--        24  0.54 GB       2
--        32  0.41 GB       2
--        40  0.33 GB       2
--        48  -.-- GB       -  (segment size too small)
--        56  -.-- GB       -  (segment size too small)
--        64  -.-- GB       -  (segment size too small)
--        96  -.-- GB       -  (segment size too small)
--
--  For 233378 reads with 4250012328 bases, limit to 42 batches.
--  Will count kmers using 01 jobs, each using 12 GB and 4 threads.
--
-- Finished stage 'merylConfigure', reset canuIteration.
--
-- Running jobs.  First attempt out of 2.
----------------------------------------
-- Starting 'meryl' concurrent execution on Fri Jan 16 13:29:41 2026 with 4532352.015 GB free disk space (1 processes; 22 concurrently)

    cd unitigging/0-mercounts
    ./meryl-count.sh 1 > ./meryl-count.000001.out 2>&1

-- Finished on Fri Jan 16 13:33:26 2026 (225 seconds) with 4532214.687 GB free disk space
----------------------------------------
-- Found 1 Kmer counting (meryl) outputs.
-- Finished stage 'utg-merylCountCheck', reset canuIteration.
--
-- Running jobs.  First attempt out of 2.
----------------------------------------
-- Starting 'meryl' concurrent execution on Fri Jan 16 13:33:26 2026 with 4532214.656 GB free disk space (1 processes; 22 concurrently)

    cd unitigging/0-mercounts
    ./meryl-process.sh 1 > ./meryl-process.000001.out 2>&1

-- Finished on Fri Jan 16 13:33:32 2026 (6 seconds) with 4532215.531 GB free disk space
----------------------------------------
-- Meryl finished successfully.  Kmer frequency histogram:
--
-- WARNING: gnuplot failed.
--
----------------------------------------
--
--  22-mers                                                                                           Fraction
--    Occurrences   NumMers                                                                         Unique Total
--       1-     1         0                                                                        0.0000 0.0000
--       2-     2    270120 *                                                                      0.0060 0.0002
--       3-     4     77155                                                                        0.0072 0.0002
--       5-     7     21089                                                                        0.0079 0.0003
--       8-    11      9284                                                                        0.0082 0.0003
--      12-    16     14465                                                                        0.0084 0.0004
--      17-    22     88139                                                                        0.0088 0.0004
--      23-    29    658464 **                                                                     0.0115 0.0012
--      30-    37   4379180 *******************                                                    0.0303 0.0086
--      38-    46  14374728 ****************************************************************       0.1473 0.0665
--      47-    56  15585046 ********************************************************************** 0.4842 0.2707
--      57-    67   4589812 ********************                                                   0.8063 0.5040
--      68-    79    719000 ***                                                                    0.8912 0.5765
--      80-    92    924044 ****                                                                   0.9061 0.5920
--      93-   106    896682 ****                                                                   0.9270 0.6175
--     107-   121    375748 *                                                                      0.9461 0.6441
--     122-   137    271997 *                                                                      0.9539 0.6566
--     138-   154    265643 *                                                                      0.9600 0.6676
--     155-   172    187354                                                                        0.9658 0.6796
--     173-   191    142930                                                                        0.9698 0.6888
--     192-   211    139995                                                                        0.9730 0.6969
--     212-   232     97741                                                                        0.9760 0.7055
--     233-   254     96814                                                                        0.9782 0.7122
--     255-   277     93514                                                                        0.9803 0.7196
--     278-   301     84771                                                                        0.9824 0.7273
--     302-   326     70631                                                                        0.9843 0.7349
--     327-   352     55021                                                                        0.9858 0.7417
--     353-   379     45041                                                                        0.9870 0.7474
--     380-   407     44673                                                                        0.9880 0.7525
--     408-   436     38295                                                                        0.9890 0.7579
--     437-   466     33554                                                                        0.9898 0.7630
--     467-   497     30689                                                                        0.9906 0.7676
--     498-   529     26382                                                                        0.9913 0.7722
--     530-   562     24122                                                                        0.9918 0.7764
--     563-   596     20004                                                                        0.9924 0.7804
--     597-   631     17588                                                                        0.9928 0.7840
--     632-   667     16442                                                                        0.9932 0.7874
--     668-   704     15786                                                                        0.9936 0.7907
--     705-   742     15407                                                                        0.9939 0.7940
--     743-   781     12972                                                                        0.9943 0.7975
--     782-   821     13488                                                                        0.9945 0.8006
--
--           0 (max occurrences)
--  3222987491 (total mers, non-unique)
--    45076631 (distinct mers, non-unique)
--           0 (unique mers)
-- Finished stage 'meryl-process', reset canuIteration.
--
-- Removing meryl database 'unitigging/0-mercounts/A3-22.ms22'.
--
-- OVERLAPPER (normal) (assembly) erate=0.01
--
----------------------------------------
-- Starting command on Fri Jan 16 13:33:32 2026 with 4532215.515 GB free disk space

    cd unitigging/1-overlapper
    /share/org/YZWL/yzwl_lixg/miniforge3/envs/canu_v.2.3/bin/overlapInCorePartition \
     -S  ../../A3-22.seqStore \
     -hl 160000000 \
     -rl 5000000000 \
     -ol 500 \
     -o  ./A3-22.partition \
    > ./A3-22.partition.err 2>&1

-- Finished on Fri Jan 16 13:33:32 2026 (fast as lightning) with 4532215.5 GB free disk space
----------------------------------------
--
-- Configured 21 overlapInCore jobs.
-- Finished stage 'utg-overlapConfigure', reset canuIteration.
--
-- Running jobs.  First attempt out of 2.
----------------------------------------
-- Starting 'utgovl' concurrent execution on Fri Jan 16 13:33:32 2026 with 4532215.468 GB free disk space (21 processes; 11 concurrently)

    cd unitigging/1-overlapper
    ./overlap.sh 1 > ./overlap.000001.out 2>&1
    ./overlap.sh 2 > ./overlap.000002.out 2>&1
    ./overlap.sh 3 > ./overlap.000003.out 2>&1
    ./overlap.sh 4 > ./overlap.000004.out 2>&1
    ./overlap.sh 5 > ./overlap.000005.out 2>&1
    ./overlap.sh 6 > ./overlap.000006.out 2>&1
    ./overlap.sh 7 > ./overlap.000007.out 2>&1
    ./overlap.sh 8 > ./overlap.000008.out 2>&1
    ./overlap.sh 9 > ./overlap.000009.out 2>&1
    ./overlap.sh 10 > ./overlap.000010.out 2>&1
    ./overlap.sh 11 > ./overlap.000011.out 2>&1
    ./overlap.sh 12 > ./overlap.000012.out 2>&1
    ./overlap.sh 13 > ./overlap.000013.out 2>&1
    ./overlap.sh 14 > ./overlap.000014.out 2>&1
    ./overlap.sh 15 > ./overlap.000015.out 2>&1
    ./overlap.sh 16 > ./overlap.000016.out 2>&1
    ./overlap.sh 17 > ./overlap.000017.out 2>&1
    ./overlap.sh 18 > ./overlap.000018.out 2>&1
    ./overlap.sh 19 > ./overlap.000019.out 2>&1
    ./overlap.sh 20 > ./overlap.000020.out 2>&1
    ./overlap.sh 21 > ./overlap.000021.out 2>&1

-- Finished on Fri Jan 16 14:04:10 2026 (1838 seconds) with 4531888.546 GB free disk space
----------------------------------------
-- Found 21 overlapInCore output files.
--
-- overlapInCore compute 'unitigging/1-overlapper':
--   kmer hits
--     with no overlap       1326020466  31.7142857 +- 38785116.517
--     with an overlap         21503997  9.85714286 +- 592802.46
--
--   overlaps                  21503997  9.85714286 +- 592802.46
--     contained                4658831  .095238095 +- 125536.082
--     dovetail                16845166  .761904762 +- 469656.55
--
--   overlaps rejected
--     multiple per pair              0           0 +- 0
--     bad short window               0           0 +- 0
--     bad long window                0           0 +- 0
-- Finished stage 'utg-overlapCheck', reset canuIteration.
----------------------------------------
-- Starting command on Fri Jan 16 14:04:10 2026 with 4531888.531 GB free disk space

    cd unitigging
    /share/org/YZWL/yzwl_lixg/miniforge3/envs/canu_v.2.3/bin/ovStoreConfig \
     -S ../A3-22.seqStore \
     -M 4-8 \
     -L ./1-overlapper/ovljob.files \
     -create ./A3-22.ovlStore.config \
     > ./A3-22.ovlStore.config.txt \
    2> ./A3-22.ovlStore.config.err

-- Finished on Fri Jan 16 14:04:10 2026 (in the blink of an eye) with 4531888.515 GB free disk space
----------------------------------------
--
-- Creating overlap store unitigging/A3-22.ovlStore using:
--      1 bucket
--      1 slice
--        using at most 2 GB memory each
--
-- Running jobs.  First attempt out of 2.
----------------------------------------
-- Starting 'ovS' concurrent execution on Fri Jan 16 14:04:10 2026 with 4531888.5 GB free disk space (1 processes; 62 concurrently)

    cd unitigging
    ./A3-22.ovlStore.sh 1 > ./A3-22.ovlStore.000001.out 2>&1

-- Finished on Fri Jan 16 14:04:19 2026 (9 seconds) with 4531887.578 GB free disk space
----------------------------------------
-- Checking store.
----------------------------------------
-- Starting command on Fri Jan 16 14:04:19 2026 with 4531887.578 GB free disk space

    cd unitigging
    /share/org/YZWL/yzwl_lixg/miniforge3/envs/canu_v.2.3/bin/ovStoreDump \
     -S ../A3-22.seqStore \
     -O  ./A3-22.ovlStore \
     -counts \
     > ./A3-22.ovlStore/counts.dat 2> ./A3-22.ovlStore/counts.err

-- Finished on Fri Jan 16 14:04:19 2026 (furiously fast) with 4531887.546 GB free disk space
----------------------------------------
--
-- Overlap store 'unitigging/A3-22.ovlStore' successfully constructed.
-- Found 43007994 overlaps for 228930 reads; 1304702 reads have no overlaps.
--
--
-- Purged 0.491 GB in 63 overlap output files.
----------------------------------------
-- Starting command on Fri Jan 16 14:04:20 2026 with 4531887.546 GB free disk space

    cd unitigging
    /share/org/YZWL/yzwl_lixg/miniforge3/envs/canu_v.2.3/bin/ovStoreStats \
     -C 50 \
     -S ../A3-22.seqStore \
     -O  ./A3-22.ovlStore \
     -o  ./A3-22.ovlStore \
     > ./A3-22.ovlStore.summary.err 2>&1

-- Finished on Fri Jan 16 14:04:26 2026 (6 seconds) with 4531887.531 GB free disk space
----------------------------------------
--
-- Overlap store 'unitigging/A3-22.ovlStore' contains:
--
--   category            reads     %          read length        feature size or coverage  analysis
--   ----------------  -------  -------  ----------------------  ------------------------  --------------------
--   middle-missing        127    0.05    15667.70 +- 7396.50        812.57 +- 1268.02    (bad trimming)
--   middle-hump            14    0.01    16729.93 +- 3034.98       5084.71 +- 4642.55    (bad trimming)
--   no-5-prime            419    0.18    14677.20 +- 5159.86       2361.69 +- 3322.90    (bad trimming)
--   no-3-prime            462    0.20    13011.27 +- 6466.25       1944.52 +- 3135.17    (bad trimming)
--   
--   low-coverage         1043    0.45    12035.78 +- 5536.27          5.65 +- 3.64       (easy to assemble, potential for lower quality consensus)
--   unique             193607   82.96    14008.55 +- 5711.88         46.90 +- 8.63       (easy to assemble, perfect, yay)
--   repeat-cont         12613    5.40    11439.65 +- 5323.41        942.57 +- 703.25     (potential for consensus errors, no impact on assembly)
--   repeat-dove           203    0.09    21477.66 +- 2310.46        480.82 +- 521.42     (hard to assemble, likely won't assemble correctly or even at all)
--   
--   span-repeat          2143    0.92    14748.66 +- 5071.84       3332.19 +- 3961.38    (read spans a large repeat, usually easy to assemble)
--   uniq-repeat-cont    12411    5.32    13898.98 +- 4608.56                             (should be uniquely placed, low potential for consensus errors, no impact on assembly)
--   uniq-repeat-dove     2526    1.08    20123.37 +- 3185.00                             (will end contigs, potential to misassemble)
--   uniq-anchor          3362    1.44    14701.12 +- 4794.13       8875.51 +- 5224.93    (repeat read, with unique section, probable bad read)
-- Finished stage 'utg-createOverlapStore', reset canuIteration.
--
-- Loading read lengths.
-- Loading number of overlaps per read.
--
-- Configure RED for 16gb memory.
--                   Batches of at most (unlimited) reads.
--                                      500000000 bases.
--                   Expecting evidence of at most 536870912 bases per iteration.
--
--           Total                                               Reads                 Olaps Evidence
--    Job   Memory      Read Range         Reads        Bases   Memory        Olaps   Memory   Memory  (Memory in MB)
--   ---- -------- ------------------- --------- ------------ -------- ------------ -------- --------
--      1 16384.13         1-34339          5165    108960285 13300.98       974550    11.15  1024.00
--      2 16384.57     34340-71022          5606    108973510 13302.61       870347     9.96  1024.00
--      3 16386.56     71023-111989         6299    108971218 13302.35      1067179    12.21  1024.00
--      4 16384.52    111990-147983         5430    108945986 13299.24      1160179    13.28  1024.00
--      5 16385.71    147984-186876         5882    108973976 13302.67       964626    11.04  1024.00
--      6 16385.76    186877-231718         6859    108947097 13299.42      1252672    14.34  1024.00
--      7 16384.91    231719-267591         5387    108948018 13299.49      1172651    13.42  1024.00
--      8 16384.77    267592-305230         5881    108967501 13301.88       951318    10.89  1024.00
--      9 16384.08    305231-351750         7097    108934808 13297.93      1236496    14.15  1024.00
--     10 16384.24    351751-386059         5326    108948175 13299.51      1113010    12.74  1024.00
--     11 16385.42    386060-423557         5777    108969592 13302.13       986452    11.29  1024.00
--     12 16385.19    423558-470674         7205    108946681 13299.38      1206401    13.81  1024.00
--     13 16386.72    470675-505852         5309    108960001 13300.95      1203058    13.77  1024.00
--     14 16384.20    505853-543483         5744    108957763 13300.69      1005440    11.51  1024.00
--     15 16385.40    543484-592293         7270    108939983 13298.57      1295784    14.83  1024.00
--     16 16385.96    592294-627277         5321    108964559 13301.51      1088578    12.46  1024.00
--     17 16384.11    627278-665277         5730    108963873 13301.43       933157    10.68  1024.00
--     18 16384.44    665278-713347         7258    108933406 13297.76      1282037    14.67  1024.00
--     19 16385.71    713348-747180         5254    108950624 13299.80      1214881    13.90  1024.00
--     20 16387.62    747181-783823         5644    108991025 13304.75       949806    10.87  1024.00
--     21 16385.67    783824-831112         7156    108945091 13299.19      1265483    14.48  1024.00
--     22 16384.51    831113-865962         5273    108953318 13300.13      1081432    12.38  1024.00
--     23 16386.68    865963-902716         5561    108980333 13303.44       982595    11.24  1024.00
--     24 16384.85    902717-947869         6966    108938049 13298.32      1269362    14.53  1024.00
--     25 16385.79    947870-982443         5239    108967378 13301.85      1043654    11.94  1024.00
--     26 16386.67    982444-1018977        5595    108980824 13303.50       976246    11.17  1024.00
--     27 16385.05   1018978-1065644        7071    108942982 13298.93      1234187    14.12  1024.00
--     28 16384.63   1065645-1100232        5253    108948943 13299.60      1138467    13.03  1024.00
--     29 16386.43   1100233-1137059        5553    108979562 13303.34       968850    11.09  1024.00
--     30 16385.44   1137060-1183648        6972    108935328 13297.99      1349750    15.45  1024.00
--     31 16384.65   1183649-1217972        5264    108953121 13300.11      1095846    12.54  1024.00
--     32 16385.09   1217973-1254465        5572    108971615 13302.37       936414    10.72  1024.00
--     33 16384.72   1254466-1300803        7000    108945290 13299.21      1181239    13.52  1024.00
--     34 16384.28   1300804-1334258        5223    108968502 13301.98       899842    10.30  1024.00
--     35 16384.31   1334259-1370361        5472    108943759 13298.97      1165795    13.34  1024.00
--     36 16384.91   1370362-1417489        7088    108944788 13299.15      1202976    13.77  1024.00
--     37 16384.29   1417490-1451774        5147    108973432 13302.58       847914     9.70  1024.00
--     38 16385.23   1451775-1487901        5459    108952376 13300.02      1154457    13.21  1024.00
--     39 16385.91   1487902-1533245        7019    108945745 13299.26      1280224    14.65  1024.00
--     40  3156.75   1533246-1533632          51       693811    84.70         4639     0.05  1024.00
--   ---- -------- ------------------- --------- ------------ -------- ------------ -------- --------
--                                                 4250012328              43007994
-- Finished stage 'readErrorDetectionConfigure', reset canuIteration.
--
-- Running jobs.  First attempt out of 2.
----------------------------------------
-- Starting 'red' concurrent execution on Fri Jan 16 14:04:32 2026 with 4531887.484 GB free disk space (40 processes; 22 concurrently)

    cd unitigging/3-overlapErrorAdjustment
    ./red.sh 1 > ./red.000001.out 2>&1
    ./red.sh 2 > ./red.000002.out 2>&1
    ./red.sh 3 > ./red.000003.out 2>&1
    ./red.sh 4 > ./red.000004.out 2>&1
    ./red.sh 5 > ./red.000005.out 2>&1
    ./red.sh 6 > ./red.000006.out 2>&1
    ./red.sh 7 > ./red.000007.out 2>&1
    ./red.sh 8 > ./red.000008.out 2>&1
    ./red.sh 9 > ./red.000009.out 2>&1
    ./red.sh 10 > ./red.000010.out 2>&1
    ./red.sh 11 > ./red.000011.out 2>&1
    ./red.sh 12 > ./red.000012.out 2>&1
    ./red.sh 13 > ./red.000013.out 2>&1
    ./red.sh 14 > ./red.000014.out 2>&1
    ./red.sh 15 > ./red.000015.out 2>&1
    ./red.sh 16 > ./red.000016.out 2>&1
    ./red.sh 17 > ./red.000017.out 2>&1
    ./red.sh 18 > ./red.000018.out 2>&1
    ./red.sh 19 > ./red.000019.out 2>&1
    ./red.sh 20 > ./red.000020.out 2>&1
    ./red.sh 21 > ./red.000021.out 2>&1
    ./red.sh 22 > ./red.000022.out 2>&1
    ./red.sh 23 > ./red.000023.out 2>&1
    ./red.sh 24 > ./red.000024.out 2>&1
    ./red.sh 25 > ./red.000025.out 2>&1
    ./red.sh 26 > ./red.000026.out 2>&1
    ./red.sh 27 > ./red.000027.out 2>&1
    ./red.sh 28 > ./red.000028.out 2>&1
    ./red.sh 29 > ./red.000029.out 2>&1
    ./red.sh 30 > ./red.000030.out 2>&1
    ./red.sh 31 > ./red.000031.out 2>&1
    ./red.sh 32 > ./red.000032.out 2>&1
    ./red.sh 33 > ./red.000033.out 2>&1
    ./red.sh 34 > ./red.000034.out 2>&1
    ./red.sh 35 > ./red.000035.out 2>&1
    ./red.sh 36 > ./red.000036.out 2>&1
    ./red.sh 37 > ./red.000037.out 2>&1
    ./red.sh 38 > ./red.000038.out 2>&1
    ./red.sh 39 > ./red.000039.out 2>&1
    ./red.sh 40 > ./red.000040.out 2>&1

-- Finished on Fri Jan 16 14:13:53 2026 (561 seconds) with 4531231.328 GB free disk space
----------------------------------------
-- Found 40 read error detection output files.
-- Finished stage 'readErrorDetectionCheck', reset canuIteration.
--
-- Loading read lengths.
-- Loading number of overlaps per read.
--
-- Configure OEA for 8gb memory.
--                   Batches of at most (unlimited) reads.
--                                      300000000 bases.
--
--           Total                                               Reads                 Olaps  Adjusts
--    Job   Memory      Read Range         Reads        Bases   Memory        Olaps   Memory   Memory  (Memory in MB)
--   ---- -------- ------------------- --------- ------------ -------- ------------ -------- --------
--      1  2793.20         1-103499        15784    300010155   294.59      2756535    84.12   366.48
--      2  2808.08    103500-215400        16902    300012654   294.63      3242830    98.96   366.48
--      3  2789.03    215401-318525        15820    300014462   294.60      2619844    79.95   366.48
--      4  2804.87    318526-424080        16291    300008345   294.61      3138431    95.78   366.48
--      5  2808.32    424081-534340        16775    300022719   294.64      3250711    99.20   366.48
--      6  2804.61    534341-646604        16873    300003384   294.62      3129521    95.51   366.48
--      7  2801.89    646605-757130        16844    300020787   294.64      3039951    92.77   366.48
--      8  2804.13    757131-866943        16736    300007161   294.62      3113707    95.02   366.48
--      9  2798.47    866944-974778        16444    300009626   294.61      2928768    89.38   366.48
--     10  2797.13    974779-1083747       16620    300006939   294.62      2884502    88.03   366.48
--     11  2810.08   1083748-1193116       16500    300013139   294.62      3308804   100.98   366.48
--     12  2802.49   1193117-1302215       16540    300003254   294.61      3060509    93.40   366.48
--     13  2791.79   1302216-1405870       15868    300008494   294.59      2710348    82.71   366.48
--     14  2798.94   1405871-1509009       15595    300006710   294.58      2945010    89.87   366.48
--     15  2496.96   1509010-1533632        3786     49864499    55.67       878523    26.81   366.48
--   ---- -------- ------------------- --------- ------------ -------- ------------ -------- --------
--                                                 4250012328              43007994
-- Finished stage 'overlapErrorAdjustmentConfigure', reset canuIteration.
--
-- Running jobs.  First attempt out of 2.
----------------------------------------
-- Starting 'oea' concurrent execution on Fri Jan 16 14:14:00 2026 with 4531231.25 GB free disk space (15 processes; 62 concurrently)

    cd unitigging/3-overlapErrorAdjustment
    ./oea.sh 1 > ./oea.000001.out 2>&1
    ./oea.sh 2 > ./oea.000002.out 2>&1
    ./oea.sh 3 > ./oea.000003.out 2>&1
    ./oea.sh 4 > ./oea.000004.out 2>&1
    ./oea.sh 5 > ./oea.000005.out 2>&1
    ./oea.sh 6 > ./oea.000006.out 2>&1
    ./oea.sh 7 > ./oea.000007.out 2>&1
    ./oea.sh 8 > ./oea.000008.out 2>&1
    ./oea.sh 9 > ./oea.000009.out 2>&1
    ./oea.sh 10 > ./oea.000010.out 2>&1
    ./oea.sh 11 > ./oea.000011.out 2>&1
    ./oea.sh 12 > ./oea.000012.out 2>&1
    ./oea.sh 13 > ./oea.000013.out 2>&1
    ./oea.sh 14 > ./oea.000014.out 2>&1
    ./oea.sh 15 > ./oea.000015.out 2>&1

-- Finished on Fri Jan 16 14:31:33 2026 (1053 seconds) with 4530342.031 GB free disk space
----------------------------------------
-- Found 15 overlap error adjustment output files.
-- Finished stage 'overlapErrorAdjustmentCheck', reset canuIteration.
----------------------------------------
-- Starting command on Fri Jan 16 14:31:33 2026 with 4530342.015 GB free disk space

    cd unitigging/3-overlapErrorAdjustment
    /share/org/YZWL/yzwl_lixg/miniforge3/envs/canu_v.2.3/bin/loadErates \
      -S ../../A3-22.seqStore \
      -O ../A3-22.ovlStore \
      -L ./oea.files \
    > ./oea.apply.err 2>&1

-- Finished on Fri Jan 16 14:31:33 2026 (fast as lightning) with 4530341.921 GB free disk space
----------------------------------------
-- No report available.
-- Finished stage 'updateOverlapStore', reset canuIteration.
-- Finished stage 'unitig', reset canuIteration.
--
-- Running jobs.  First attempt out of 2.
----------------------------------------
-- Starting 'bat' concurrent execution on Fri Jan 16 14:31:33 2026 with 4530341.875 GB free disk space (1 processes; 1 concurrently)

    cd unitigging/4-unitigger
    ./unitigger.sh 1 > ./unitigger.000001.out 2>&1

-- Finished on Fri Jan 16 14:31:45 2026 (12 seconds) with 4530341.718 GB free disk space
----------------------------------------
-- Unitigger finished successfully.
--  
--  ERROR RATES
--  -----------
--                                                   --------threshold------
--  258305                       fraction error      fraction        percent
--  samples                              (1e-5)         error          error
--                   --------------------------      --------       --------
--  command line (-eg)                           ->     30.00        0.0300%
--  command line (-ef)                           ->  -----.--      ---.----%
--  command line (-eM)                           ->     30.00        0.0300%
--  mean + std.dev       0.34 +-  12 *     2.63  ->     31.88        0.0319%
--  median + mad         0.00 +-  12 *     0.00  ->      0.00        0.0000%
--  90th percentile                              ->      1.00        0.0010%  (enabled)
--  
--  BEST EDGE FILTERING
--  -------------------
--  At graph threshold 0.0300%, reads:
--    available to have edges:        39046
--    with at least one edge:         33487
--  
--  At max threshold 0.0300%, reads:  (not computed)
--    available to have edges:            0
--    with at least one edge:             0
--  
--  At tight threshold 0.0010%, reads with:
--    both edges below error threshold:     29660  (80.00% minReadsBest threshold = 26789)
--    one  edge  above error threshold:      2748
--    both edges above error threshold:      1079
--    at least one edge:                    33487
--  
--  At loose threshold 0.0300%, reads with:
--    both edges below error threshold:     33487  (80.00% minReadsBest threshold = 26789)
--    one  edge  above error threshold:         0
--    both edges above error threshold:         0
--    at least one edge:                    33487
--  
--  
--  INITIAL EDGES
--  -------- ----------------------------------------
--    189892 reads are contained
--   1314495 reads have no best edges (singleton)
--       258 reads have only one best edge (spur) 
--                124 are mutual best
--     28987 reads have two best edges 
--                696 have one mutual best edge
--              28004 have two mutual best edges
--  
--  
--  FINAL EDGES
--  -------- ----------------------------------------
--    189892 reads are contained
--   1314788 reads have no best edges (singleton)
--       162 reads have only one best edge (spur) 
--                128 are mutual best
--     28790 reads have two best edges 
--                556 have one mutual best edge
--              28001 have two mutual best edges
--  
--  
--  EDGE FILTERING
--  -------- ------------------------------------------
--         0 reads are ignored
--      8367 reads have a gap in overlap coverage
--       136 reads have lopsided best edges
-- Found, in version 1, after unitig construction:
--   contigs:      76 sequences, total length 68306092 bp (including 77 repeats of total length 1882015 bp).
--   bubbles:      125 sequences, total length 3535711 bp.
--   unassembled:  14796 sequences, total length 196417328 bp.
--
-- Contig sizes based on genome size 85mbp:
--
--            NG (bp)  LG (contigs)    sum (bp)
--         ----------  ------------  ----------
--     10     6517751             2    13552495
--     20     6248950             3    19801445
--     30     4207841             5    28614873
--     40     3341970             7    36058306
--     50     3271890             9    42614255
--     60     2408423            13    53143601
--     70     1723278            17    60723424
--     80       19497            60    68015498
--
-- Finished stage 'unitigCheck', reset canuIteration.
----------------------------------------
-- Starting command on Fri Jan 16 14:31:45 2026 with 4530341.703 GB free disk space

    cd unitigging
    /share/org/YZWL/yzwl_lixg/miniforge3/envs/canu_v.2.3/bin/utgcns \
      -S ../A3-22.seqStore \
      -T  ./A3-22.ctgStore 1 \
      -partition 0.8 1.5 0.1 \
    > ./A3-22.ctgStore/partitioning.log 2>&1

-- Finished on Fri Jan 16 14:32:00 2026 (15 seconds) with 4530183.328 GB free disk space
----------------------------------------
-- Using slow alignment for consensus (iteration '0').
-- Configured 11 consensus jobs.
-- Finished stage 'consensusConfigure', reset canuIteration.
--
-- Local: cns       10.500 GB    8 CPUs x  11 jobs   115.500 GB  88 CPUs  (consensus)
--
--
-- Running jobs.  First attempt out of 2.
----------------------------------------
-- Starting 'cns' concurrent execution on Fri Jan 16 14:32:00 2026 with 4530183.296 GB free disk space (11 processes; 11 concurrently)

    cd unitigging/5-consensus
    ./consensus.sh 1 > ./consensus.000001.out 2>&1
    ./consensus.sh 2 > ./consensus.000002.out 2>&1
    ./consensus.sh 3 > ./consensus.000003.out 2>&1
    ./consensus.sh 4 > ./consensus.000004.out 2>&1
    ./consensus.sh 5 > ./consensus.000005.out 2>&1
    ./consensus.sh 6 > ./consensus.000006.out 2>&1
    ./consensus.sh 7 > ./consensus.000007.out 2>&1
    ./consensus.sh 8 > ./consensus.000008.out 2>&1
    ./consensus.sh 9 > ./consensus.000009.out 2>&1
    ./consensus.sh 10 > ./consensus.000010.out 2>&1
    ./consensus.sh 11 > ./consensus.000011.out 2>&1

-- Finished on Fri Jan 16 14:38:50 2026 (410 seconds) with 4529231.359 GB free disk space
----------------------------------------
-- Using slow alignment for consensus (iteration '1').
-- Configured 11 consensus jobs.
-- All 11 consensus jobs finished successfully.
-- Finished stage 'consensusCheck', reset canuIteration.
-- Using slow alignment for consensus (iteration '0').
-- Configured 11 consensus jobs.
----------------------------------------
-- Starting command on Fri Jan 16 14:38:50 2026 with 4529231.312 GB free disk space

    cd unitigging
    /share/org/YZWL/yzwl_lixg/miniforge3/envs/canu_v.2.3/bin/tgStoreLoad \
      -S ../A3-22.seqStore \
      -T  ./A3-22.ctgStore 2 \
      -L ./5-consensus/ctgcns.files \
    > ./5-consensus/ctgcns.files.ctgStoreLoad.err 2>&1

-- Finished on Fri Jan 16 14:38:51 2026 (one second) with 4529230.546 GB free disk space
----------------------------------------
----------------------------------------
-- Starting command on Fri Jan 16 14:38:51 2026 with 4529230.546 GB free disk space

    cd unitigging
    /share/org/YZWL/yzwl_lixg/miniforge3/envs/canu_v.2.3/bin/tgTigDisplay \
      -S ../A3-22.seqStore \
      -b \
      -o ../A3-22.contigs.unsorted.bam \
      -L ./5-consensus/ctgcns.files \
    > ./5-consensus/ctgcns.files.contigs.bam.err 2>&1

-- Finished on Fri Jan 16 14:42:03 2026 (192 seconds) with 4529164.109 GB free disk space
----------------------------------------
----------------------------------------
-- Starting command on Fri Jan 16 14:42:03 2026 with 4529164.109 GB free disk space

    cd .
    samtools sort \
      --write-index \
      --threads 2 \
      -o ./A3-22.contigs.bam ./A3-22.contigs.unsorted.bam \
    > ./ctgcns.bam.err 2>&1

-- Finished on Fri Jan 16 14:43:08 2026 (65 seconds) with 4529139.281 GB free disk space
----------------------------------------
-- Purging consensus output after loading to ctgStore.
-- Purged 11 .cns outputs.
----------------------------------------
-- Starting command on Fri Jan 16 14:43:08 2026 with 4529140.328 GB free disk space

    cd unitigging
    /share/org/YZWL/yzwl_lixg/miniforge3/envs/canu_v.2.3/bin/tgStoreDump \
      -S ../A3-22.seqStore \
      -T ./A3-22.ctgStore 2 \
      -sizes -s 85000000 \
    > ./A3-22.ctgStore/seqDB.v002.sizes.txt
ZERO length suplied to intervalList::add(), ignoring interval.
ZERO length suplied to intervalList::add(), ignoring interval.
ZERO length suplied to intervalList::add(), ignoring interval.
ZERO length suplied to intervalList::add(), ignoring interval.
ZERO length suplied to intervalList::add(), ignoring interval.
ZERO length suplied to intervalList::add(), ignoring interval.
ZERO length suplied to intervalList::add(), ignoring interval.
ZERO length suplied to intervalList::add(), ignoring interval.
ZERO length suplied to intervalList::add(), ignoring interval.
ZERO length suplied to intervalList::add(), ignoring interval.
ZERO length suplied to intervalList::add(), ignoring interval.
ZERO length suplied to intervalList::add(), ignoring interval.
ZERO length suplied to intervalList::add(), ignoring interval.
ZERO length suplied to intervalList::add(), ignoring interval.
ZERO length suplied to intervalList::add(), ignoring interval.
ZERO length suplied to intervalList::add(), ignoring interval.
ZERO length suplied to intervalList::add(), ignoring interval.
ZERO length suplied to intervalList::add(), ignoring interval.
ZERO length suplied to intervalList::add(), ignoring interval.
ZERO length suplied to intervalList::add(), ignoring interval.
ZERO length suplied to intervalList::add(), ignoring interval.
ZERO length suplied to intervalList::add(), ignoring interval.
ZERO length suplied to intervalList::add(), ignoring interval.

-- Finished on Fri Jan 16 14:43:09 2026 (one second) with 4529140.328 GB free disk space
----------------------------------------
-- Found, in version 2, after consensus generation:
--   contigs:      76 sequences, total length 89085196 bp (including 77 repeats of total length 2593537 bp).
--   bubbles:      125 sequences, total length 4709689 bp.
--   unassembled:  14796 sequences, total length 268850608 bp.
--
-- Contig sizes based on genome size 85mbp:
--
--            NG (bp)  LG (contigs)    sum (bp)
--         ----------  ------------  ----------
--     10     9148183             1     9148183
--     20     8459451             2    17607634
--     30     8113715             3    25721349
--     40     5476105             5    37175235
--     50     5357334             6    42532569
--     60     4282529             8    51159611
--     70     3629351            11    62861979
--     80     3135077            13    69149355
--     90     2268819            16    76787923
--    100     1185339            21    85534607
--
-- Finished stage 'consensusLoad', reset canuIteration.
----------------------------------------
-- Starting command on Fri Jan 16 14:43:09 2026 with 4529140.312 GB free disk space

    cd .
    /share/org/YZWL/yzwl_lixg/miniforge3/envs/canu_v.2.3/bin/tgStoreDump \
      -S ./A3-22.seqStore \
      -T ./unitigging/A3-22.ctgStore 2 \
      -o ./A3-22.contigs \
      -layout \
    > ./A3-22.contigs.layout.err 2>&1

-- Finished on Fri Jan 16 14:43:09 2026 (fast as lightning) with 4529140.281 GB free disk space
----------------------------------------
----------------------------------------
-- Starting command on Fri Jan 16 14:43:09 2026 with 4529140.281 GB free disk space

    cd .
    /share/org/YZWL/yzwl_lixg/miniforge3/envs/canu_v.2.3/bin/tgStoreDump \
      -S ./A3-22.seqStore \
      -T ./unitigging/A3-22.ctgStore 2 \
      -consensus -fasta \
      -unassembled \
    > ./A3-22.unassembled.fasta
    2> ./A3-22.unassembled.err
ZERO length suplied to intervalList::add(), ignoring interval.
ZERO length suplied to intervalList::add(), ignoring interval.
ZERO length suplied to intervalList::add(), ignoring interval.
ZERO length suplied to intervalList::add(), ignoring interval.
ZERO length suplied to intervalList::add(), ignoring interval.
ZERO length suplied to intervalList::add(), ignoring interval.
ZERO length suplied to intervalList::add(), ignoring interval.
ZERO length suplied to intervalList::add(), ignoring interval.
ZERO length suplied to intervalList::add(), ignoring interval.
ZERO length suplied to intervalList::add(), ignoring interval.
ZERO length suplied to intervalList::add(), ignoring interval.
ZERO length suplied to intervalList::add(), ignoring interval.
ZERO length suplied to intervalList::add(), ignoring interval.
ZERO length suplied to intervalList::add(), ignoring interval.
ZERO length suplied to intervalList::add(), ignoring interval.
ZERO length suplied to intervalList::add(), ignoring interval.
ZERO length suplied to intervalList::add(), ignoring interval.
ZERO length suplied to intervalList::add(), ignoring interval.
ZERO length suplied to intervalList::add(), ignoring interval.
ZERO length suplied to intervalList::add(), ignoring interval.
ZERO length suplied to intervalList::add(), ignoring interval.
ZERO length suplied to intervalList::add(), ignoring interval.
ZERO length suplied to intervalList::add(), ignoring interval.

-- Finished on Fri Jan 16 14:43:10 2026 (one second) with 4529140.015 GB free disk space
----------------------------------------
----------------------------------------
-- Starting command on Fri Jan 16 14:43:10 2026 with 4529140.015 GB free disk space

    cd .
    /share/org/YZWL/yzwl_lixg/miniforge3/envs/canu_v.2.3/bin/tgStoreDump \
      -S ./A3-22.seqStore \
      -T ./unitigging/A3-22.ctgStore 2 \
      -consensus -fasta \
      -contigs \
    > ./A3-22.contigs.fasta
    2> ./A3-22.contigs.err
ZERO length suplied to intervalList::add(), ignoring interval.
ZERO length suplied to intervalList::add(), ignoring interval.
ZERO length suplied to intervalList::add(), ignoring interval.
ZERO length suplied to intervalList::add(), ignoring interval.
ZERO length suplied to intervalList::add(), ignoring interval.
ZERO length suplied to intervalList::add(), ignoring interval.
ZERO length suplied to intervalList::add(), ignoring interval.
ZERO length suplied to intervalList::add(), ignoring interval.
ZERO length suplied to intervalList::add(), ignoring interval.
ZERO length suplied to intervalList::add(), ignoring interval.
ZERO length suplied to intervalList::add(), ignoring interval.
ZERO length suplied to intervalList::add(), ignoring interval.
ZERO length suplied to intervalList::add(), ignoring interval.
ZERO length suplied to intervalList::add(), ignoring interval.
ZERO length suplied to intervalList::add(), ignoring interval.
ZERO length suplied to intervalList::add(), ignoring interval.
ZERO length suplied to intervalList::add(), ignoring interval.
ZERO length suplied to intervalList::add(), ignoring interval.
ZERO length suplied to intervalList::add(), ignoring interval.
ZERO length suplied to intervalList::add(), ignoring interval.
ZERO length suplied to intervalList::add(), ignoring interval.
ZERO length suplied to intervalList::add(), ignoring interval.
ZERO length suplied to intervalList::add(), ignoring interval.

-- Finished on Fri Jan 16 14:43:11 2026 (one second) with 4529139.906 GB free disk space
----------------------------------------
-- Finished stage 'generateOutputs', reset canuIteration.
--
-- Assembly 'A3-22' finished in '/share/org/YZWL/yzwl_lixg/project/28.大豆疫霉菌三代基因组/03.hicanu/A3-22/01.raw_output'.
--
-- Summary saved in 'A3-22.report'.
--
-- Sequences saved:
--   Contigs       -> 'A3-22.contigs.fasta'
--   Unassembled   -> 'A3-22.unassembled.fasta'
--
-- Read layouts saved:
--   Contigs       -> 'A3-22.contigs.layout'.
--
-- Bye.

2026-01-16 14:43:11.521 - WARNING - 输出文件不存在|Output file does not exist: /share/org/YZWL/yzwl_lixg/project/28.大豆疫霉菌三代基因组/03.hicanu/A3-22/01.raw_output/A3-22.unitigs.fasta
Job 68889956 stderr output:

