Usage: biopytools ragtag [OPTIONS]
Try 'biopytools ragtag -h' for help.

Error: Invalid value for '-r' / '--reference': 文件不存在|File does not exist: /share/org/YZWL/yzwl_lixg/project/28.大豆疫霉菌三代基因组/04.ragtag/Psoja_T2T.fa
Usage: biopytools genomesyn [OPTIONS]
Try 'biopytools genomesyn -h' for help.

Error: Invalid value for '-i' / '--ref': Path '04.ragtag/B4-5/hifiasm/B4-5_RagTag_scaffolded.fa' does not exist.
2026-01-16 03:59:16.119 - WARNING - 命令错误输出|Command stderr:
-- canu master +27 changes (r10515 2a41e933b8de6ed66723d75d36dd071b46d2c347)
--
-- CITATIONS
--
-- For assemblies of PacBio HiFi reads:
--   Nurk S, Walenz BP, Rhiea A, Vollger MR, Logsdon GA, Grothe R, Miga KH, Eichler EE, Phillippy AM, Koren S.
--   HiCanu: accurate assembly of segmental duplications, satellites, and allelic variants from high-fidelity long reads.
--   biorXiv. 2020.
--   https://doi.org/10.1101/2020.03.14.992248
-- 
-- Read and contig alignments during correction and consensus use:
--   Šošic M, Šikic M.
--   Edlib: a C/C ++ library for fast, exact sequence alignment using edit distance.
--   Bioinformatics. 2017 May 1;33(9):1394-1395.
--   http://doi.org/10.1093/bioinformatics/btw753
-- 
-- Overlaps are generated using:
--   Berlin K, et al.
--   Assembling large genomes with single-molecule sequencing and locality-sensitive hashing.
--   Nat Biotechnol. 2015 Jun;33(6):623-30.
--   http://doi.org/10.1038/nbt.3238
-- 
--   Myers EW, et al.
--   A Whole-Genome Assembly of Drosophila.
--   Science. 2000 Mar 24;287(5461):2196-204.
--   http://doi.org/10.1126/science.287.5461.2196
-- 
-- Contig consensus sequences are generated using an algorithm derived from pbdagcon:
--   Chin CS, et al.
--   Nonhybrid, finished microbial genome assemblies from long-read SMRT sequencing data.
--   Nat Methods. 2013 Jun;10(6):563-9
--   http://doi.org/10.1038/nmeth.2474
-- 
-- CONFIGURE CANU
--
-- Detected Java(TM) Runtime Environment '17.0.15-internal' (from '/share/org/YZWL/yzwl_lixg/.local/bin/java') without -d64 support.
--
-- WARNING:
-- WARNING:  Failed to run gnuplot using command 'gnuplot'.
-- WARNING:  Plots will be disabled.
-- WARNING:
--
-- Detected samtools version '1.22' / htslib version 'htscodecs=1.6.3' (from 'samtools').
--
-- Detected 88 CPUs and 503 gigabytes of memory on the local machine.
--
-- Detected Slurm with 'sinfo' binary in /opt/skyformai/bin/sinfo.
--          Slurm disabled by useGrid=false
--
-- Detected  '' with 'pbsnodes' binary in /opt/skyformai/bin/pbsnodes.
--           disabled by useGrid=false
--
-- Detected LSF with 'bsub' binary in /opt/skyformai/bin/bsub.
--          LSF disabled by useGrid=false
--
-- Local machine mode enabled; grid support not detected or not allowed.
--
-- Found trimmed raw PacBio HiFi reads in the input files.
--
--                                (tag)Concurrency
--                         (tag)Threads          |
--                (tag)Memory         |          |
--        (tag)             |         |          |       total usage      algorithm
--        -------  ----------  --------   --------  --------------------  -----------------------------
-- Local: meryl     12.000 GB    4 CPUs x  22 jobs   264.000 GB  88 CPUs  (k-mer counting)
-- Local: cormhap   13.000 GB   11 CPUs x   8 jobs   104.000 GB  88 CPUs  (overlap detection with mhap)
-- Local: obtovl     8.000 GB    8 CPUs x  11 jobs    88.000 GB  88 CPUs  (overlap detection)
-- Local: utgovl     8.000 GB    8 CPUs x  11 jobs    88.000 GB  88 CPUs  (overlap detection)
-- Local: cor        -.--- GB    4 CPUs x   - jobs     -.--- GB   - CPUs  (read correction)
-- Local: ovb        4.000 GB    1 CPU  x  88 jobs   352.000 GB  88 CPUs  (overlap store bucketizer)
-- Local: ovs        8.000 GB    1 CPU  x  62 jobs   496.000 GB  62 CPUs  (overlap store sorting)
-- Local: red       16.000 GB    4 CPUs x  22 jobs   352.000 GB  88 CPUs  (read error detection)
-- Local: oea        8.000 GB    1 CPU  x  62 jobs   496.000 GB  62 CPUs  (overlap error adjustment)
-- Local: bat       32.000 GB    8 CPUs x   1 job     32.000 GB   8 CPUs  (contig construction with bogart)
-- Local: cns        -.--- GB    8 CPUs x   - jobs     -.--- GB   - CPUs  (consensus)
--
-- Generating assembly 'B4-5' in '/share/org/YZWL/yzwl_lixg/project/28.大豆疫霉菌三代基因组/03.hicanu/B4-5/01.raw_output':
--   genomeSize:
--     85000000
--
--   Overlap Generation Limits:
--     corOvlErrorRate 0.0000 (  0.00%)
--     obtOvlErrorRate 0.0250 (  2.50%)
--     utgOvlErrorRate 0.0100 (  1.00%)
--
--   Overlap Processing Limits:
--     corErrorRate    0.0000 (  0.00%)
--     obtErrorRate    0.0250 (  2.50%)
--     utgErrorRate    0.0003 (  0.03%)
--     cnsErrorRate    0.0500 (  5.00%)
--
--   Stages to run:
--     assemble HiFi reads.
--
--
-- BEGIN STORE CREATION
----------------------------------------
-- Starting command on Fri Jan 16 01:03:44 2026 with 4557949.39 GB free disk space

    cd .
    ./B4-5.seqStore.sh \
    > ./B4-5.seqStore.err 2>&1

-- Finished on Fri Jan 16 01:11:44 2026 (480 seconds) with 4557898.875 GB free disk space
----------------------------------------
--
-- In sequence store './B4-5.seqStore':
--   Found 254787 reads.
--   Found 4250006306 bases (50 times coverage).
--    Histogram of corrected reads:
--    
--    G=4250006306                       sum of  ||               length     num
--    NG         length     index       lengths  ||                range    seqs
--    ----- ------------ --------- ------------  ||  ------------------- -------
--    00010        25370     15291    425008569  ||       1265-2448         4097|---------
--    00020        22901     32988    850008026  ||       2449-3632         5922|-------------
--    00030        21223     52301   1275016321  ||       3633-4816         5708|-------------
--    00040        19938     72980   1700016076  ||       4817-6000         5561|------------
--    00050        18851     94909   2125003157  ||       6001-7184         5311|------------
--    00060        17876    118063   2550008161  ||       7185-8368         5561|------------
--    00070        16904    142498   2975017658  ||       8369-9552         5959|-------------
--    00080        15690    168519   3400017750  ||       9553-10736        6362|--------------
--    00090        12871    197749   3825007343  ||      10737-11920        6826|---------------
--    00100         1265    254787   4250006306  ||      11921-13104        7242|----------------
--    001.000x              254787   4250006306  ||      13105-14288        9159|--------------------
--                                               ||      14289-15472       14863|--------------------------------
--                                               ||      15473-16656       23592|---------------------------------------------------
--                                               ||      16657-17840       29692|---------------------------------------------------------------
--                                               ||      17841-19024       27725|-----------------------------------------------------------
--                                               ||      19025-20208       23031|-------------------------------------------------
--                                               ||      20209-21392       18235|---------------------------------------
--                                               ||      21393-22576       13800|------------------------------
--                                               ||      22577-23760       10544|-----------------------
--                                               ||      23761-24944        7921|-----------------
--                                               ||      24945-26128        6005|-------------
--                                               ||      26129-27312        4221|---------
--                                               ||      27313-28496        2919|-------
--                                               ||      28497-29680        1890|-----
--                                               ||      29681-30864        1210|---
--                                               ||      30865-32048         736|--
--                                               ||      32049-33232         394|-
--                                               ||      33233-34416         183|-
--                                               ||      34417-35600          78|-
--                                               ||      35601-36784          24|-
--                                               ||      36785-37968           9|-
--                                               ||      37969-39152           5|-
--                                               ||      39153-40336           1|-
--                                               ||      40337-41520           0|
--                                               ||      41521-42704           0|
--                                               ||      42705-43888           0|
--                                               ||      43889-45072           0|
--                                               ||      45073-46256           0|
--                                               ||      46257-47440           0|
--                                               ||      47441-48624           1|-
--    
--
-- In sequence store './B4-5.seqStore':
--   Found 254787 reads.
--   Found 4250006306 bases (50 times coverage).
--    Histogram of corrected-trimmed reads:
--    
--    G=4250006306                       sum of  ||               length     num
--    NG         length     index       lengths  ||                range    seqs
--    ----- ------------ --------- ------------  ||  ------------------- -------
--    00010        25370     15291    425008569  ||       1265-2448         4097|---------
--    00020        22901     32988    850008026  ||       2449-3632         5922|-------------
--    00030        21223     52301   1275016321  ||       3633-4816         5708|-------------
--    00040        19938     72980   1700016076  ||       4817-6000         5561|------------
--    00050        18851     94909   2125003157  ||       6001-7184         5311|------------
--    00060        17876    118063   2550008161  ||       7185-8368         5561|------------
--    00070        16904    142498   2975017658  ||       8369-9552         5959|-------------
--    00080        15690    168519   3400017750  ||       9553-10736        6362|--------------
--    00090        12871    197749   3825007343  ||      10737-11920        6826|---------------
--    00100         1265    254787   4250006306  ||      11921-13104        7242|----------------
--    001.000x              254787   4250006306  ||      13105-14288        9159|--------------------
--                                               ||      14289-15472       14863|--------------------------------
--                                               ||      15473-16656       23592|---------------------------------------------------
--                                               ||      16657-17840       29692|---------------------------------------------------------------
--                                               ||      17841-19024       27725|-----------------------------------------------------------
--                                               ||      19025-20208       23031|-------------------------------------------------
--                                               ||      20209-21392       18235|---------------------------------------
--                                               ||      21393-22576       13800|------------------------------
--                                               ||      22577-23760       10544|-----------------------
--                                               ||      23761-24944        7921|-----------------
--                                               ||      24945-26128        6005|-------------
--                                               ||      26129-27312        4221|---------
--                                               ||      27313-28496        2919|-------
--                                               ||      28497-29680        1890|-----
--                                               ||      29681-30864        1210|---
--                                               ||      30865-32048         736|--
--                                               ||      32049-33232         394|-
--                                               ||      33233-34416         183|-
--                                               ||      34417-35600          78|-
--                                               ||      35601-36784          24|-
--                                               ||      36785-37968           9|-
--                                               ||      37969-39152           5|-
--                                               ||      39153-40336           1|-
--                                               ||      40337-41520           0|
--                                               ||      41521-42704           0|
--                                               ||      42705-43888           0|
--                                               ||      43889-45072           0|
--                                               ||      45073-46256           0|
--                                               ||      46257-47440           0|
--                                               ||      47441-48624           1|-
--    
--
-- Correction skipped; not enabled.
--
-- Trimming skipped; not enabled.
--
-- BEGIN ASSEMBLY
----------------------------------------
-- Starting command on Fri Jan 16 01:11:45 2026 with 4557898.828 GB free disk space

    cd unitigging/0-mercounts
    ./meryl-configure.sh \
    > ./meryl-configure.err 2>&1

-- Finished on Fri Jan 16 01:11:46 2026 (one second) with 4557898.828 GB free disk space
----------------------------------------
--  segments   memory batches
--  -------- -------- -------
--        01 10.72 GB       2
--        02  5.68 GB       2
--        04  2.94 GB       2
--        06  2.12 GB       2
--        08  1.60 GB       2
--        12  1.06 GB       2
--        16  0.80 GB       2
--        20  0.64 GB       2
--        24  0.54 GB       2
--        32  0.40 GB       2
--        40  0.32 GB       2
--        48  -.-- GB       -  (segment size too small)
--        56  -.-- GB       -  (segment size too small)
--        64  -.-- GB       -  (segment size too small)
--        96  -.-- GB       -  (segment size too small)
--
--  For 254787 reads with 4250006306 bases, limit to 42 batches.
--  Will count kmers using 01 jobs, each using 12 GB and 4 threads.
--
-- Finished stage 'merylConfigure', reset canuIteration.
--
-- Running jobs.  First attempt out of 2.
----------------------------------------
-- Starting 'meryl' concurrent execution on Fri Jan 16 01:11:46 2026 with 4557898.796 GB free disk space (1 processes; 22 concurrently)

    cd unitigging/0-mercounts
    ./meryl-count.sh 1 > ./meryl-count.000001.out 2>&1

-- Finished on Fri Jan 16 01:15:25 2026 (219 seconds) with 4557664.39 GB free disk space
----------------------------------------
-- Found 1 Kmer counting (meryl) outputs.
-- Finished stage 'utg-merylCountCheck', reset canuIteration.
--
-- Running jobs.  First attempt out of 2.
----------------------------------------
-- Starting 'meryl' concurrent execution on Fri Jan 16 01:15:25 2026 with 4557664.359 GB free disk space (1 processes; 22 concurrently)

    cd unitigging/0-mercounts
    ./meryl-process.sh 1 > ./meryl-process.000001.out 2>&1

-- Finished on Fri Jan 16 01:15:29 2026 (4 seconds) with 4557664.031 GB free disk space
----------------------------------------
-- Meryl finished successfully.  Kmer frequency histogram:
--
-- WARNING: gnuplot failed.
--
----------------------------------------
--
--  22-mers                                                                                           Fraction
--    Occurrences   NumMers                                                                         Unique Total
--       1-     1         0                                                                        0.0000 0.0000
--       2-     2    294081 *                                                                      0.0065 0.0002
--       3-     4     80312                                                                        0.0078 0.0003
--       5-     7     23467                                                                        0.0086 0.0003
--       8-    11      8521                                                                        0.0089 0.0003
--      12-    16     13669                                                                        0.0090 0.0004
--      17-    22    133953                                                                        0.0095 0.0004
--      23-    29    938282 ***                                                                    0.0136 0.0017
--      30-    37   6136754 **************************                                             0.0406 0.0124
--      38-    46  16481737 ********************************************************************** 0.2010 0.0926
--      47-    56  13478456 *********************************************************              0.5783 0.3227
--      57-    67   2687278 ***********                                                            0.8475 0.5187
--      68-    79    631339 **                                                                     0.8952 0.5598
--      80-    92   1038194 ****                                                                   0.9095 0.5750
--      93-   106    768499 ***                                                                    0.9327 0.6035
--     107-   121    272231 *                                                                      0.9487 0.6259
--     122-   137    284007 *                                                                      0.9545 0.6353
--     138-   154    265566 *                                                                      0.9609 0.6472
--     155-   172    166621                                                                        0.9666 0.6589
--     173-   191    171534                                                                        0.9703 0.6674
--     192-   211    116313                                                                        0.9740 0.6771
--     212-   232    117198                                                                        0.9765 0.6843
--     233-   254     92925                                                                        0.9792 0.6925
--     255-   277     88643                                                                        0.9812 0.6995
--     278-   301     74802                                                                        0.9832 0.7070
--     302-   326     70581                                                                        0.9848 0.7137
--     327-   352     57427                                                                        0.9864 0.7206
--     353-   379     46808                                                                        0.9876 0.7267
--     380-   407     40172                                                                        0.9886 0.7320
--     408-   436     34345                                                                        0.9895 0.7370
--     437-   466     36019                                                                        0.9903 0.7415
--     467-   497     27760                                                                        0.9911 0.7466
--     498-   529     25479                                                                        0.9917 0.7508
--     530-   562     20037                                                                        0.9923 0.7548
--     563-   596     17911                                                                        0.9927 0.7583
--     597-   631     16104                                                                        0.9931 0.7615
--     632-   667     15231                                                                        0.9935 0.7646
--     668-   704     16994                                                                        0.9938 0.7677
--     705-   742     13752                                                                        0.9942 0.7714
--     743-   781     12505                                                                        0.9945 0.7745
--     782-   821     12148                                                                        0.9948 0.7775
--
--           0 (max occurrences)
--  3186962269 (total mers, non-unique)
--    45052162 (distinct mers, non-unique)
--           0 (unique mers)
-- Finished stage 'meryl-process', reset canuIteration.
--
-- Removing meryl database 'unitigging/0-mercounts/B4-5.ms22'.
--
-- OVERLAPPER (normal) (assembly) erate=0.01
--
----------------------------------------
-- Starting command on Fri Jan 16 01:15:29 2026 with 4557665.046 GB free disk space

    cd unitigging/1-overlapper
    /share/org/YZWL/yzwl_lixg/miniforge3/envs/canu_v.2.3/bin/overlapInCorePartition \
     -S  ../../B4-5.seqStore \
     -hl 160000000 \
     -rl 5000000000 \
     -ol 500 \
     -o  ./B4-5.partition \
    > ./B4-5.partition.err 2>&1

-- Finished on Fri Jan 16 01:15:30 2026 (one second) with 4557665.031 GB free disk space
----------------------------------------
--
-- Configured 21 overlapInCore jobs.
-- Finished stage 'utg-overlapConfigure', reset canuIteration.
--
-- Running jobs.  First attempt out of 2.
----------------------------------------
-- Starting 'utgovl' concurrent execution on Fri Jan 16 01:15:30 2026 with 4557665 GB free disk space (21 processes; 11 concurrently)

    cd unitigging/1-overlapper
    ./overlap.sh 1 > ./overlap.000001.out 2>&1
    ./overlap.sh 2 > ./overlap.000002.out 2>&1
    ./overlap.sh 3 > ./overlap.000003.out 2>&1
    ./overlap.sh 4 > ./overlap.000004.out 2>&1
    ./overlap.sh 5 > ./overlap.000005.out 2>&1
    ./overlap.sh 6 > ./overlap.000006.out 2>&1
    ./overlap.sh 7 > ./overlap.000007.out 2>&1
    ./overlap.sh 8 > ./overlap.000008.out 2>&1
    ./overlap.sh 9 > ./overlap.000009.out 2>&1
    ./overlap.sh 10 > ./overlap.000010.out 2>&1
    ./overlap.sh 11 > ./overlap.000011.out 2>&1
    ./overlap.sh 12 > ./overlap.000012.out 2>&1
    ./overlap.sh 13 > ./overlap.000013.out 2>&1
    ./overlap.sh 14 > ./overlap.000014.out 2>&1
    ./overlap.sh 15 > ./overlap.000015.out 2>&1
    ./overlap.sh 16 > ./overlap.000016.out 2>&1
    ./overlap.sh 17 > ./overlap.000017.out 2>&1
    ./overlap.sh 18 > ./overlap.000018.out 2>&1
    ./overlap.sh 19 > ./overlap.000019.out 2>&1
    ./overlap.sh 20 > ./overlap.000020.out 2>&1
    ./overlap.sh 21 > ./overlap.000021.out 2>&1

-- Finished on Fri Jan 16 02:05:00 2026 (2970 seconds) with 4558891.312 GB free disk space
----------------------------------------
-- Found 21 overlapInCore output files.
--
-- overlapInCore compute 'unitigging/1-overlapper':
--   kmer hits
--     with no overlap       1353020806  62.1904762 +- 41256133.685
--     with an overlap         28814939  9.95238095 +- 952483.184
--
--   overlaps                  28814939  9.95238095 +- 952483.184
--     contained                6344778  .285714286 +- 208125.577
--     dovetail                22470161  7.66666667 +- 745804.722
--
--   overlaps rejected
--     multiple per pair              0           0 +- 0
--     bad short window               0           0 +- 0
--     bad long window                0           0 +- 0
-- Finished stage 'utg-overlapCheck', reset canuIteration.
----------------------------------------
-- Starting command on Fri Jan 16 02:05:00 2026 with 4558891.296 GB free disk space

    cd unitigging
    /share/org/YZWL/yzwl_lixg/miniforge3/envs/canu_v.2.3/bin/ovStoreConfig \
     -S ../B4-5.seqStore \
     -M 4-8 \
     -L ./1-overlapper/ovljob.files \
     -create ./B4-5.ovlStore.config \
     > ./B4-5.ovlStore.config.txt \
    2> ./B4-5.ovlStore.config.err

-- Finished on Fri Jan 16 02:05:01 2026 (one second) with 4558891.281 GB free disk space
----------------------------------------
--
-- Creating overlap store unitigging/B4-5.ovlStore using:
--      1 bucket
--      1 slice
--        using at most 3 GB memory each
--
-- Running jobs.  First attempt out of 2.
----------------------------------------
-- Starting 'ovS' concurrent execution on Fri Jan 16 02:05:01 2026 with 4558891.265 GB free disk space (1 processes; 62 concurrently)

    cd unitigging
    ./B4-5.ovlStore.sh 1 > ./B4-5.ovlStore.000001.out 2>&1

-- Finished on Fri Jan 16 02:05:13 2026 (12 seconds) with 4558889.968 GB free disk space
----------------------------------------
-- Checking store.
----------------------------------------
-- Starting command on Fri Jan 16 02:05:13 2026 with 4558889.968 GB free disk space

    cd unitigging
    /share/org/YZWL/yzwl_lixg/miniforge3/envs/canu_v.2.3/bin/ovStoreDump \
     -S ../B4-5.seqStore \
     -O  ./B4-5.ovlStore \
     -counts \
     > ./B4-5.ovlStore/counts.dat 2> ./B4-5.ovlStore/counts.err

-- Finished on Fri Jan 16 02:05:14 2026 (one second) with 4558889.937 GB free disk space
----------------------------------------
--
-- Overlap store 'unitigging/B4-5.ovlStore' successfully constructed.
-- Found 57629878 overlaps for 241612 reads; 1611452 reads have no overlaps.
--
--
-- Purged 0.651 GB in 63 overlap output files.
----------------------------------------
-- Starting command on Fri Jan 16 02:05:15 2026 with 4558889.937 GB free disk space

    cd unitigging
    /share/org/YZWL/yzwl_lixg/miniforge3/envs/canu_v.2.3/bin/ovStoreStats \
     -C 50 \
     -S ../B4-5.seqStore \
     -O  ./B4-5.ovlStore \
     -o  ./B4-5.ovlStore \
     > ./B4-5.ovlStore.summary.err 2>&1

-- Finished on Fri Jan 16 02:05:23 2026 (8 seconds) with 4558889.921 GB free disk space
----------------------------------------
--
-- Overlap store 'unitigging/B4-5.ovlStore' contains:
--
--   category            reads     %          read length        feature size or coverage  analysis
--   ----------------  -------  -------  ----------------------  ------------------------  --------------------
--   middle-missing        145    0.06    14620.86 +- 5348.35        995.92 +- 1411.15    (bad trimming)
--   middle-hump            65    0.03    13881.32 +- 2441.42       4301.85 +- 2727.03    (bad trimming)
--   no-5-prime            865    0.34    12559.17 +- 3473.75       2679.36 +- 2801.39    (bad trimming)
--   no-3-prime            864    0.34    11894.01 +- 4143.50       2774.07 +- 2940.42    (bad trimming)
--   
--   low-coverage         2899    1.14    10232.93 +- 3721.12          5.70 +- 3.69       (easy to assemble, potential for lower quality consensus)
--   unique             200530   78.70    12828.78 +- 4735.46         44.89 +- 8.20       (easy to assemble, perfect, yay)
--   repeat-cont         12570    4.93    11211.73 +- 4666.19       1614.47 +- 1359.95    (potential for consensus errors, no impact on assembly)
--   repeat-dove           204    0.08    20619.66 +- 2199.86        904.69 +- 1048.70    (hard to assemble, likely won't assemble correctly or even at all)
--   
--   span-repeat          2447    0.96    13305.06 +- 4079.46       3338.33 +- 3519.74    (read spans a large repeat, usually easy to assemble)
--   uniq-repeat-cont    13535    5.31    12322.01 +- 3810.62                             (should be uniquely placed, low potential for consensus errors, no impact on assembly)
--   uniq-repeat-dove     2591    1.02    18102.99 +- 3092.66                             (will end contigs, potential to misassemble)
--   uniq-anchor          4897    1.92    12924.55 +- 3966.05       8356.52 +- 4439.78    (repeat read, with unique section, probable bad read)
-- Finished stage 'utg-createOverlapStore', reset canuIteration.
--
-- Loading read lengths.
-- Loading number of overlaps per read.
--
-- Configure RED for 16gb memory.
--                   Batches of at most (unlimited) reads.
--                                      500000000 bases.
--                   Expecting evidence of at most 536870912 bases per iteration.
--
--           Total                                               Reads                 Olaps Evidence
--    Job   Memory      Read Range         Reads        Bases   Memory        Olaps   Memory   Memory  (Memory in MB)
--   ---- -------- ------------------- --------- ------------ -------- ------------ -------- --------
--      1 16385.92         1-41934          5828    109004390 13306.38       658141     7.53  1024.00
--      2 16384.99     41935-88236          6364    108892966 13292.80      1764273    20.19  1024.00
--      3 16385.96     88237-137329         6790    108939913 13298.54      1347044    15.42  1024.00
--      4 16385.93    137330-182127         6054    108991964 13304.87       791685     9.06  1024.00
--      5 16384.51    182128-230430         6676    108870947 13290.12      1956031    22.38  1024.00
--      6 16385.03    230431-283486         7247    108902319 13293.97      1665539    19.06  1024.00
--      7 16384.48    283487-327159         6047    108977343 13303.09       820929     9.39  1024.00
--      8 16384.77    327160-376192         6645    108866836 13289.62      2022725    23.15  1024.00
--      9 16384.13    376193-429555         7361    108887702 13292.19      1742706    19.94  1024.00
--     10 16385.09    429556-472537         5975    108981017 13303.53       835163     9.56  1024.00
--     11 16384.62    472538-519647         6528    108862588 13289.10      2055506    23.52  1024.00
--     12 16384.88    519648-573683         7368    108906545 13294.49      1607313    18.39  1024.00
--     13 16385.10    573684-617610         5979    108988917 13304.50       751409     8.60  1024.00
--     14 16384.99    617611-665163         6530    108865089 13289.40      2061125    23.59  1024.00
--     15 16385.26    665164-718946         7316    108906656 13294.50      1639274    18.76  1024.00
--     16 16385.80    718947-761357         5956    108985105 13304.03       853587     9.77  1024.00
--     17 16384.66    761358-808087         6418    108867705 13289.72      2005048    22.95  1024.00
--     18 16384.03    808088-863113         7512    108889553 13292.42      1713562    19.61  1024.00
--     19 16384.51    863114-906727         5976    108983853 13303.88       754361     8.63  1024.00
--     20 16385.85    906728-953886         6434    108872283 13290.28      2059760    23.57  1024.00
--     21 16384.61    953887-1009639        7547    108895954 13293.20      1696007    19.41  1024.00
--     22 16385.26   1009640-1053216        5968    108992239 13304.90       730310     8.36  1024.00
--     23 16384.15   1053217-1099406        6344    108847470 13287.24      2175855    24.90  1024.00
--     24 16384.36   1099407-1152930        7507    108885235 13291.89      1788208    20.46  1024.00
--     25 16385.21   1152931-1195284        5884    108993357 13305.04       713679     8.17  1024.00
--     26 16386.29   1195285-1240564        6280    108871170 13290.14      2110318    24.15  1024.00
--     27 16385.67   1240565-1294319        7417    108907077 13294.55      1670312    19.12  1024.00
--     28 16384.57   1294320-1337032        5821    108986925 13304.25       726902     8.32  1024.00
--     29 16386.93   1337033-1381708        6158    108859874 13288.75      2287634    26.18  1024.00
--     30 16384.96   1381709-1435280        7374    108910635 13294.99      1570346    17.97  1024.00
--     31 16386.37   1435281-1477127        5825    108999605 13305.80       749048     8.57  1024.00
--     32 16385.51   1477128-1521403        6124    108879846 13291.19      1950796    22.33  1024.00
--     33 16385.58   1521404-1573875        7292    108915379 13295.56      1574551    18.02  1024.00
--     34 16386.64   1573876-1616415        5800    109004152 13306.35       724301     8.29  1024.00
--     35 16384.54   1616416-1659519        6024    108858331 13288.56      2095513    23.98  1024.00
--     36 16385.75   1659520-1712164        7242    108904555 13294.24      1704694    19.51  1024.00
--     37 16385.36   1712165-1753981        5744    108993236 13305.02       728665     8.34  1024.00
--     38 16386.31   1753982-1799252        6034    108887534 13292.13      1938855    22.19  1024.00
--     39 16386.23   1799253-1852022        7264    108921307 13296.29      1568340    17.95  1024.00
--     40  3322.33   1852023-1853064         134      2048734   250.09        20363     0.23  1024.00
--   ---- -------- ------------------- --------- ------------ -------- ------------ -------- --------
--                                                 4250006306              57629878
-- Finished stage 'readErrorDetectionConfigure', reset canuIteration.
--
-- Running jobs.  First attempt out of 2.
----------------------------------------
-- Starting 'red' concurrent execution on Fri Jan 16 02:05:30 2026 with 4558889.875 GB free disk space (40 processes; 22 concurrently)

    cd unitigging/3-overlapErrorAdjustment
    ./red.sh 1 > ./red.000001.out 2>&1
    ./red.sh 2 > ./red.000002.out 2>&1
    ./red.sh 3 > ./red.000003.out 2>&1
    ./red.sh 4 > ./red.000004.out 2>&1
    ./red.sh 5 > ./red.000005.out 2>&1
    ./red.sh 6 > ./red.000006.out 2>&1
    ./red.sh 7 > ./red.000007.out 2>&1
    ./red.sh 8 > ./red.000008.out 2>&1
    ./red.sh 9 > ./red.000009.out 2>&1
    ./red.sh 10 > ./red.000010.out 2>&1
    ./red.sh 11 > ./red.000011.out 2>&1
    ./red.sh 12 > ./red.000012.out 2>&1
    ./red.sh 13 > ./red.000013.out 2>&1
    ./red.sh 14 > ./red.000014.out 2>&1
    ./red.sh 15 > ./red.000015.out 2>&1
    ./red.sh 16 > ./red.000016.out 2>&1
    ./red.sh 17 > ./red.000017.out 2>&1
    ./red.sh 18 > ./red.000018.out 2>&1
    ./red.sh 19 > ./red.000019.out 2>&1
    ./red.sh 20 > ./red.000020.out 2>&1
    ./red.sh 21 > ./red.000021.out 2>&1
    ./red.sh 22 > ./red.000022.out 2>&1
    ./red.sh 23 > ./red.000023.out 2>&1
    ./red.sh 24 > ./red.000024.out 2>&1
    ./red.sh 25 > ./red.000025.out 2>&1
    ./red.sh 26 > ./red.000026.out 2>&1
    ./red.sh 27 > ./red.000027.out 2>&1
    ./red.sh 28 > ./red.000028.out 2>&1
    ./red.sh 29 > ./red.000029.out 2>&1
    ./red.sh 30 > ./red.000030.out 2>&1
    ./red.sh 31 > ./red.000031.out 2>&1
    ./red.sh 32 > ./red.000032.out 2>&1
    ./red.sh 33 > ./red.000033.out 2>&1
    ./red.sh 34 > ./red.000034.out 2>&1
    ./red.sh 35 > ./red.000035.out 2>&1
    ./red.sh 36 > ./red.000036.out 2>&1
    ./red.sh 37 > ./red.000037.out 2>&1
    ./red.sh 38 > ./red.000038.out 2>&1
    ./red.sh 39 > ./red.000039.out 2>&1
    ./red.sh 40 > ./red.000040.out 2>&1

-- Finished on Fri Jan 16 02:29:54 2026 (1464 seconds) with 4559301.859 GB free disk space
----------------------------------------
-- Found 40 read error detection output files.
-- Finished stage 'readErrorDetectionCheck', reset canuIteration.
--
-- Loading read lengths.
-- Loading number of overlaps per read.
--
-- Configure OEA for 8gb memory.
--                   Batches of at most (unlimited) reads.
--                                      300000000 bases.
--
--           Total                                               Reads                 Olaps  Adjusts
--    Job   Memory      Read Range         Reads        Bases   Memory        Olaps   Memory   Memory  (Memory in MB)
--   ---- -------- ------------------- --------- ------------ -------- ------------ -------- --------
--      1  2823.63         1-126850        17551    300005431   294.64      3608826   110.13   370.85
--      2  2843.15    126851-262158        18513    300013454   294.68      4247234   129.62   370.85
--      3  2844.41    262159-393359        17912    300003704   294.65      4289354   130.90   370.85
--      4  2821.10    393360-520466        17667    300015864   294.66      3525362   107.59   370.85
--      5  2842.76    520467-653749        18166    300012316   294.67      4234950   129.24   370.85
--      6  2844.84    653750-784922        18103    300019615   294.67      4302903   131.31   370.85
--      7  2809.59    784923-919318        18366    300019790   294.68      3147332    96.05   370.85
--      8  2845.54    919319-1054650       18459    300012585   294.68      4325738   132.01   370.85
--      9  2848.54   1054651-1186211       18252    300003768   294.66      4424414   135.02   370.85
--     10  2842.84   1186212-1317416       18113    300012929   294.67      4237521   129.32   370.85
--     11  2849.15   1317417-1447868       17924    300012474   294.66      4444386   135.63   370.85
--     12  2838.35   1447869-1575994       17821    300007790   294.65      4090772   124.84   370.85
--     13  2843.91   1575995-1701085       17215    300019523   294.65      4273100   130.40   370.85
--     14  2815.04   1701086-1825275       17013    300006294   294.63      3327727   101.55   370.85
--     15  2509.60   1825276-1853064        3712     49840769    55.65      1150259    35.10   370.85
--   ---- -------- ------------------- --------- ------------ -------- ------------ -------- --------
--                                                 4250006306              57629878
-- Finished stage 'overlapErrorAdjustmentConfigure', reset canuIteration.
--
-- Running jobs.  First attempt out of 2.
----------------------------------------
-- Starting 'oea' concurrent execution on Fri Jan 16 02:30:01 2026 with 4559301.781 GB free disk space (15 processes; 62 concurrently)

    cd unitigging/3-overlapErrorAdjustment
    ./oea.sh 1 > ./oea.000001.out 2>&1
    ./oea.sh 2 > ./oea.000002.out 2>&1
    ./oea.sh 3 > ./oea.000003.out 2>&1
    ./oea.sh 4 > ./oea.000004.out 2>&1
    ./oea.sh 5 > ./oea.000005.out 2>&1
    ./oea.sh 6 > ./oea.000006.out 2>&1
    ./oea.sh 7 > ./oea.000007.out 2>&1
    ./oea.sh 8 > ./oea.000008.out 2>&1
    ./oea.sh 9 > ./oea.000009.out 2>&1
    ./oea.sh 10 > ./oea.000010.out 2>&1
    ./oea.sh 11 > ./oea.000011.out 2>&1
    ./oea.sh 12 > ./oea.000012.out 2>&1
    ./oea.sh 13 > ./oea.000013.out 2>&1
    ./oea.sh 14 > ./oea.000014.out 2>&1
    ./oea.sh 15 > ./oea.000015.out 2>&1

-- Finished on Fri Jan 16 03:47:11 2026 (4630 seconds) with 4556444.296 GB free disk space
----------------------------------------
-- Found 15 overlap error adjustment output files.
-- Finished stage 'overlapErrorAdjustmentCheck', reset canuIteration.
----------------------------------------
-- Starting command on Fri Jan 16 03:47:11 2026 with 4556444.281 GB free disk space

    cd unitigging/3-overlapErrorAdjustment
    /share/org/YZWL/yzwl_lixg/miniforge3/envs/canu_v.2.3/bin/loadErates \
      -S ../../B4-5.seqStore \
      -O ../B4-5.ovlStore \
      -L ./oea.files \
    > ./oea.apply.err 2>&1

-- Finished on Fri Jan 16 03:47:11 2026 (furiously fast) with 4556444.156 GB free disk space
----------------------------------------
-- No report available.
-- Finished stage 'updateOverlapStore', reset canuIteration.
-- Finished stage 'unitig', reset canuIteration.
--
-- Running jobs.  First attempt out of 2.
----------------------------------------
-- Starting 'bat' concurrent execution on Fri Jan 16 03:47:11 2026 with 4556444.109 GB free disk space (1 processes; 1 concurrently)

    cd unitigging/4-unitigger
    ./unitigger.sh 1 > ./unitigger.000001.out 2>&1

-- Finished on Fri Jan 16 03:47:28 2026 (17 seconds) with 4556416.125 GB free disk space
----------------------------------------
-- Unitigger finished successfully.
--  
--  ERROR RATES
--  -----------
--                                                   --------threshold------
--  271895                       fraction error      fraction        percent
--  samples                              (1e-5)         error          error
--                   --------------------------      --------       --------
--  command line (-eg)                           ->     30.00        0.0300%
--  command line (-ef)                           ->  -----.--      ---.----%
--  command line (-eM)                           ->     30.00        0.0300%
--  mean + std.dev       0.43 +-  12 *     2.98  ->     36.13        0.0361%
--  median + mad         0.00 +-  12 *     0.00  ->      0.00        0.0000%
--  90th percentile                              ->      1.00        0.0010%  (enabled)
--  
--  BEST EDGE FILTERING
--  -------------------
--  At graph threshold 0.0300%, reads:
--    available to have edges:        49994
--    with at least one edge:         35238
--  
--  At max threshold 0.0300%, reads:
--    available to have edges:        49994
--    with at least one edge:         35238
--  
--  At tight threshold 0.0010%, reads with:
--    both edges below error threshold:     30629  (80.00% minReadsBest threshold = 28190)
--    one  edge  above error threshold:      3287
--    both edges above error threshold:      1322
--    at least one edge:                    35238
--  
--  At loose threshold 0.0300%, reads with:
--    both edges below error threshold:     35238  (80.00% minReadsBest threshold = 28190)
--    one  edge  above error threshold:         0
--    both edges above error threshold:         0
--    at least one edge:                    35238
--  
--  
--  INITIAL EDGES
--  -------- ----------------------------------------
--    199531 reads are contained
--   1623093 reads have no best edges (singleton)
--       669 reads have only one best edge (spur) 
--                425 are mutual best
--     29771 reads have two best edges 
--                751 have one mutual best edge
--              28602 have two mutual best edges
--  
--  
--  FINAL EDGES
--  -------- ----------------------------------------
--    199531 reads are contained
--   1623405 reads have no best edges (singleton)
--       567 reads have only one best edge (spur) 
--                423 are mutual best
--     29561 reads have two best edges 
--                629 have one mutual best edge
--              28608 have two mutual best edges
--  
--  
--  EDGE FILTERING
--  -------- ------------------------------------------
--         0 reads are ignored
--      9701 reads have a gap in overlap coverage
--       149 reads have lopsided best edges
-- Found, in version 1, after unitig construction:
--   contigs:      176 sequences, total length 70110094 bp (including 150 repeats of total length 3494372 bp).
--   bubbles:      135 sequences, total length 3617062 bp.
--   unassembled:  25747 sequences, total length 279546927 bp.
--
-- Contig sizes based on genome size 85mbp:
--
--            NG (bp)  LG (contigs)    sum (bp)
--         ----------  ------------  ----------
--     10     8645566             1     8645566
--     20     6446873             3    22673897
--     30     6228499             4    28902396
--     40     4239040             6    37708071
--     50     3072326             8    44836987
--     60     2450085            11    52634773
--     70     1622753            15    59768595
--     80       29754            68    68020162
--
-- Finished stage 'unitigCheck', reset canuIteration.
----------------------------------------
-- Starting command on Fri Jan 16 03:47:28 2026 with 4556416.109 GB free disk space

    cd unitigging
    /share/org/YZWL/yzwl_lixg/miniforge3/envs/canu_v.2.3/bin/utgcns \
      -S ../B4-5.seqStore \
      -T  ./B4-5.ctgStore 1 \
      -partition 0.8 1.5 0.1 \
    > ./B4-5.ctgStore/partitioning.log 2>&1

-- Finished on Fri Jan 16 03:47:37 2026 (9 seconds) with 4556414.921 GB free disk space
----------------------------------------
-- Using slow alignment for consensus (iteration '0').
-- Configured 10 consensus jobs.
-- Finished stage 'consensusConfigure', reset canuIteration.
--
-- Local: cns       12.750 GB    8 CPUs x  11 jobs   140.250 GB  88 CPUs  (consensus)
--
--
-- Running jobs.  First attempt out of 2.
----------------------------------------
-- Starting 'cns' concurrent execution on Fri Jan 16 03:47:37 2026 with 4556414.89 GB free disk space (10 processes; 11 concurrently)

    cd unitigging/5-consensus
    ./consensus.sh 1 > ./consensus.000001.out 2>&1
    ./consensus.sh 2 > ./consensus.000002.out 2>&1
    ./consensus.sh 3 > ./consensus.000003.out 2>&1
    ./consensus.sh 4 > ./consensus.000004.out 2>&1
    ./consensus.sh 5 > ./consensus.000005.out 2>&1
    ./consensus.sh 6 > ./consensus.000006.out 2>&1
    ./consensus.sh 7 > ./consensus.000007.out 2>&1
    ./consensus.sh 8 > ./consensus.000008.out 2>&1
    ./consensus.sh 9 > ./consensus.000009.out 2>&1
    ./consensus.sh 10 > ./consensus.000010.out 2>&1

-- Finished on Fri Jan 16 03:55:24 2026 (467 seconds) with 4555886.515 GB free disk space
----------------------------------------
-- Using slow alignment for consensus (iteration '1').
-- Configured 10 consensus jobs.
-- All 10 consensus jobs finished successfully.
-- Finished stage 'consensusCheck', reset canuIteration.
-- Using slow alignment for consensus (iteration '0').
-- Configured 10 consensus jobs.
----------------------------------------
-- Starting command on Fri Jan 16 03:55:24 2026 with 4555886.468 GB free disk space

    cd unitigging
    /share/org/YZWL/yzwl_lixg/miniforge3/envs/canu_v.2.3/bin/tgStoreLoad \
      -S ../B4-5.seqStore \
      -T  ./B4-5.ctgStore 2 \
      -L ./5-consensus/ctgcns.files \
    > ./5-consensus/ctgcns.files.ctgStoreLoad.err 2>&1

-- Finished on Fri Jan 16 03:55:26 2026 (2 seconds) with 4555885.406 GB free disk space
----------------------------------------
----------------------------------------
-- Starting command on Fri Jan 16 03:55:26 2026 with 4555885.406 GB free disk space

    cd unitigging
    /share/org/YZWL/yzwl_lixg/miniforge3/envs/canu_v.2.3/bin/tgTigDisplay \
      -S ../B4-5.seqStore \
      -b \
      -o ../B4-5.contigs.unsorted.bam \
      -L ./5-consensus/ctgcns.files \
    > ./5-consensus/ctgcns.files.contigs.bam.err 2>&1

-- Finished on Fri Jan 16 03:58:09 2026 (163 seconds) with 4555742.609 GB free disk space
----------------------------------------
----------------------------------------
-- Starting command on Fri Jan 16 03:58:09 2026 with 4555742.609 GB free disk space

    cd .
    samtools sort \
      --write-index \
      --threads 2 \
      -o ./B4-5.contigs.bam ./B4-5.contigs.unsorted.bam \
    > ./ctgcns.bam.err 2>&1

-- Finished on Fri Jan 16 03:59:12 2026 (63 seconds) with 4555702.093 GB free disk space
----------------------------------------
-- Purging consensus output after loading to ctgStore.
-- Purged 10 .cns outputs.
----------------------------------------
-- Starting command on Fri Jan 16 03:59:12 2026 with 4555705.031 GB free disk space

    cd unitigging
    /share/org/YZWL/yzwl_lixg/miniforge3/envs/canu_v.2.3/bin/tgStoreDump \
      -S ../B4-5.seqStore \
      -T ./B4-5.ctgStore 2 \
      -sizes -s 85000000 \
    > ./B4-5.ctgStore/seqDB.v002.sizes.txt
ZERO length suplied to intervalList::add(), ignoring interval.
ZERO length suplied to intervalList::add(), ignoring interval.
ZERO length suplied to intervalList::add(), ignoring interval.
ZERO length suplied to intervalList::add(), ignoring interval.
ZERO length suplied to intervalList::add(), ignoring interval.
ZERO length suplied to intervalList::add(), ignoring interval.
ZERO length suplied to intervalList::add(), ignoring interval.
ZERO length suplied to intervalList::add(), ignoring interval.
ZERO length suplied to intervalList::add(), ignoring interval.
ZERO length suplied to intervalList::add(), ignoring interval.
ZERO length suplied to intervalList::add(), ignoring interval.
ZERO length suplied to intervalList::add(), ignoring interval.
ZERO length suplied to intervalList::add(), ignoring interval.
ZERO length suplied to intervalList::add(), ignoring interval.
ZERO length suplied to intervalList::add(), ignoring interval.
ZERO length suplied to intervalList::add(), ignoring interval.
ZERO length suplied to intervalList::add(), ignoring interval.
ZERO length suplied to intervalList::add(), ignoring interval.
ZERO length suplied to intervalList::add(), ignoring interval.
ZERO length suplied to intervalList::add(), ignoring interval.
ZERO length suplied to intervalList::add(), ignoring interval.
ZERO length suplied to intervalList::add(), ignoring interval.
ZERO length suplied to intervalList::add(), ignoring interval.
ZERO length suplied to intervalList::add(), ignoring interval.
ZERO length suplied to intervalList::add(), ignoring interval.
ZERO length suplied to intervalList::add(), ignoring interval.
ZERO length suplied to intervalList::add(), ignoring interval.
ZERO length suplied to intervalList::add(), ignoring interval.
ZERO length suplied to intervalList::add(), ignoring interval.
ZERO length suplied to intervalList::add(), ignoring interval.
ZERO length suplied to intervalList::add(), ignoring interval.
ZERO length suplied to intervalList::add(), ignoring interval.
ZERO length suplied to intervalList::add(), ignoring interval.

-- Finished on Fri Jan 16 03:59:12 2026 (in the blink of an eye) with 4555705.031 GB free disk space
----------------------------------------
-- Found, in version 2, after consensus generation:
--   contigs:      176 sequences, total length 92034921 bp (including 150 repeats of total length 4772722 bp).
--   bubbles:      135 sequences, total length 4961284 bp.
--   unassembled:  25747 sequences, total length 429013282 bp.
--
-- Contig sizes based on genome size 85mbp:
--
--            NG (bp)  LG (contigs)    sum (bp)
--         ----------  ------------  ----------
--     10    11236199             1    11236199
--     20     9885607             2    21121806
--     30     8374872             3    29496678
--     40     8087903             4    37584581
--     50     5925462             5    43510043
--     60     5296523             7    54324457
--     70     3583281             9    61916094
--     80     3188546            11    68493404
--     90     2113825            15    77808825
--    100      943573            21    85269736
--
-- Finished stage 'consensusLoad', reset canuIteration.
----------------------------------------
-- Starting command on Fri Jan 16 03:59:12 2026 with 4555705.015 GB free disk space

    cd .
    /share/org/YZWL/yzwl_lixg/miniforge3/envs/canu_v.2.3/bin/tgStoreDump \
      -S ./B4-5.seqStore \
      -T ./unitigging/B4-5.ctgStore 2 \
      -o ./B4-5.contigs \
      -layout \
    > ./B4-5.contigs.layout.err 2>&1

-- Finished on Fri Jan 16 03:59:13 2026 (one second) with 4555704.968 GB free disk space
----------------------------------------
----------------------------------------
-- Starting command on Fri Jan 16 03:59:13 2026 with 4555704.968 GB free disk space

    cd .
    /share/org/YZWL/yzwl_lixg/miniforge3/envs/canu_v.2.3/bin/tgStoreDump \
      -S ./B4-5.seqStore \
      -T ./unitigging/B4-5.ctgStore 2 \
      -consensus -fasta \
      -unassembled \
    > ./B4-5.unassembled.fasta
    2> ./B4-5.unassembled.err
ZERO length suplied to intervalList::add(), ignoring interval.
ZERO length suplied to intervalList::add(), ignoring interval.
ZERO length suplied to intervalList::add(), ignoring interval.
ZERO length suplied to intervalList::add(), ignoring interval.
ZERO length suplied to intervalList::add(), ignoring interval.
ZERO length suplied to intervalList::add(), ignoring interval.
ZERO length suplied to intervalList::add(), ignoring interval.
ZERO length suplied to intervalList::add(), ignoring interval.
ZERO length suplied to intervalList::add(), ignoring interval.
ZERO length suplied to intervalList::add(), ignoring interval.
ZERO length suplied to intervalList::add(), ignoring interval.
ZERO length suplied to intervalList::add(), ignoring interval.
ZERO length suplied to intervalList::add(), ignoring interval.
ZERO length suplied to intervalList::add(), ignoring interval.
ZERO length suplied to intervalList::add(), ignoring interval.
ZERO length suplied to intervalList::add(), ignoring interval.
ZERO length suplied to intervalList::add(), ignoring interval.
ZERO length suplied to intervalList::add(), ignoring interval.
ZERO length suplied to intervalList::add(), ignoring interval.
ZERO length suplied to intervalList::add(), ignoring interval.
ZERO length suplied to intervalList::add(), ignoring interval.
ZERO length suplied to intervalList::add(), ignoring interval.
ZERO length suplied to intervalList::add(), ignoring interval.
ZERO length suplied to intervalList::add(), ignoring interval.
ZERO length suplied to intervalList::add(), ignoring interval.
ZERO length suplied to intervalList::add(), ignoring interval.
ZERO length suplied to intervalList::add(), ignoring interval.
ZERO length suplied to intervalList::add(), ignoring interval.
ZERO length suplied to intervalList::add(), ignoring interval.
ZERO length suplied to intervalList::add(), ignoring interval.
ZERO length suplied to intervalList::add(), ignoring interval.
ZERO length suplied to intervalList::add(), ignoring interval.
ZERO length suplied to intervalList::add(), ignoring interval.

-- Finished on Fri Jan 16 03:59:15 2026 (2 seconds) with 4555704.562 GB free disk space
----------------------------------------
----------------------------------------
-- Starting command on Fri Jan 16 03:59:15 2026 with 4555704.562 GB free disk space

    cd .
    /share/org/YZWL/yzwl_lixg/miniforge3/envs/canu_v.2.3/bin/tgStoreDump \
      -S ./B4-5.seqStore \
      -T ./unitigging/B4-5.ctgStore 2 \
      -consensus -fasta \
      -contigs \
    > ./B4-5.contigs.fasta
    2> ./B4-5.contigs.err
ZERO length suplied to intervalList::add(), ignoring interval.
ZERO length suplied to intervalList::add(), ignoring interval.
ZERO length suplied to intervalList::add(), ignoring interval.
ZERO length suplied to intervalList::add(), ignoring interval.
ZERO length suplied to intervalList::add(), ignoring interval.
ZERO length suplied to intervalList::add(), ignoring interval.
ZERO length suplied to intervalList::add(), ignoring interval.
ZERO length suplied to intervalList::add(), ignoring interval.
ZERO length suplied to intervalList::add(), ignoring interval.
ZERO length suplied to intervalList::add(), ignoring interval.
ZERO length suplied to intervalList::add(), ignoring interval.
ZERO length suplied to intervalList::add(), ignoring interval.
ZERO length suplied to intervalList::add(), ignoring interval.
ZERO length suplied to intervalList::add(), ignoring interval.
ZERO length suplied to intervalList::add(), ignoring interval.
ZERO length suplied to intervalList::add(), ignoring interval.
ZERO length suplied to intervalList::add(), ignoring interval.
ZERO length suplied to intervalList::add(), ignoring interval.
ZERO length suplied to intervalList::add(), ignoring interval.
ZERO length suplied to intervalList::add(), ignoring interval.
ZERO length suplied to intervalList::add(), ignoring interval.
ZERO length suplied to intervalList::add(), ignoring interval.
ZERO length suplied to intervalList::add(), ignoring interval.
ZERO length suplied to intervalList::add(), ignoring interval.
ZERO length suplied to intervalList::add(), ignoring interval.
ZERO length suplied to intervalList::add(), ignoring interval.
ZERO length suplied to intervalList::add(), ignoring interval.
ZERO length suplied to intervalList::add(), ignoring interval.
ZERO length suplied to intervalList::add(), ignoring interval.
ZERO length suplied to intervalList::add(), ignoring interval.
ZERO length suplied to intervalList::add(), ignoring interval.
ZERO length suplied to intervalList::add(), ignoring interval.
ZERO length suplied to intervalList::add(), ignoring interval.

-- Finished on Fri Jan 16 03:59:16 2026 (one second) with 4555704.453 GB free disk space
----------------------------------------
-- Finished stage 'generateOutputs', reset canuIteration.
--
-- Assembly 'B4-5' finished in '/share/org/YZWL/yzwl_lixg/project/28.大豆疫霉菌三代基因组/03.hicanu/B4-5/01.raw_output'.
--
-- Summary saved in 'B4-5.report'.
--
-- Sequences saved:
--   Contigs       -> 'B4-5.contigs.fasta'
--   Unassembled   -> 'B4-5.unassembled.fasta'
--
-- Read layouts saved:
--   Contigs       -> 'B4-5.contigs.layout'.
--
-- Bye.

2026-01-16 03:59:16.123 - WARNING - 输出文件不存在|Output file does not exist: /share/org/YZWL/yzwl_lixg/project/28.大豆疫霉菌三代基因组/03.hicanu/B4-5/01.raw_output/B4-5.unitigs.fasta
Usage: biopytools ragtag [OPTIONS]
Try 'biopytools ragtag -h' for help.

Error: Invalid value for '-r' / '--reference': 文件不存在|File does not exist: /share/org/YZWL/yzwl_lixg/project/28.大豆疫霉菌三代基因组/04.ragtag/Psoja_T2T.fa
Usage: biopytools genomesyn [OPTIONS]
Try 'biopytools genomesyn -h' for help.

Error: Invalid value for '-i' / '--ref': Path '04.ragtag/B4-5/hicanu/B4-5_RagTag_scaffolded.fa' does not exist.
Job 68886856 stderr output:

