Usage: biopytools ragtag [OPTIONS]
Try 'biopytools ragtag -h' for help.

Error: Invalid value for '-r' / '--reference': 文件不存在|File does not exist: /share/org/YZWL/yzwl_lixg/project/28.大豆疫霉菌三代基因组/04.ragtag/Psoja_T2T.fa
Usage: biopytools genomesyn [OPTIONS]
Try 'biopytools genomesyn -h' for help.

Error: Invalid value for '-i' / '--ref': Path '04.ragtag/41/hifiasm/41_RagTag_scaffolded.fa' does not exist.
2026-01-16 01:35:21.498 - WARNING - 命令错误输出|Command stderr:
-- canu master +27 changes (r10515 2a41e933b8de6ed66723d75d36dd071b46d2c347)
--
-- CITATIONS
--
-- For assemblies of PacBio HiFi reads:
--   Nurk S, Walenz BP, Rhiea A, Vollger MR, Logsdon GA, Grothe R, Miga KH, Eichler EE, Phillippy AM, Koren S.
--   HiCanu: accurate assembly of segmental duplications, satellites, and allelic variants from high-fidelity long reads.
--   biorXiv. 2020.
--   https://doi.org/10.1101/2020.03.14.992248
-- 
-- Read and contig alignments during correction and consensus use:
--   Šošic M, Šikic M.
--   Edlib: a C/C ++ library for fast, exact sequence alignment using edit distance.
--   Bioinformatics. 2017 May 1;33(9):1394-1395.
--   http://doi.org/10.1093/bioinformatics/btw753
-- 
-- Overlaps are generated using:
--   Berlin K, et al.
--   Assembling large genomes with single-molecule sequencing and locality-sensitive hashing.
--   Nat Biotechnol. 2015 Jun;33(6):623-30.
--   http://doi.org/10.1038/nbt.3238
-- 
--   Myers EW, et al.
--   A Whole-Genome Assembly of Drosophila.
--   Science. 2000 Mar 24;287(5461):2196-204.
--   http://doi.org/10.1126/science.287.5461.2196
-- 
-- Contig consensus sequences are generated using an algorithm derived from pbdagcon:
--   Chin CS, et al.
--   Nonhybrid, finished microbial genome assemblies from long-read SMRT sequencing data.
--   Nat Methods. 2013 Jun;10(6):563-9
--   http://doi.org/10.1038/nmeth.2474
-- 
-- CONFIGURE CANU
--
-- Detected Java(TM) Runtime Environment '17.0.15-internal' (from '/share/org/YZWL/yzwl_lixg/.local/bin/java') without -d64 support.
--
-- WARNING:
-- WARNING:  Failed to run gnuplot using command 'gnuplot'.
-- WARNING:  Plots will be disabled.
-- WARNING:
--
-- Detected samtools version '1.22' / htslib version 'htscodecs=1.6.3' (from 'samtools').
--
-- Detected 88 CPUs and 503 gigabytes of memory on the local machine.
--
-- Detected Slurm with 'sinfo' binary in /opt/skyformai/bin/sinfo.
--          Slurm disabled by useGrid=false
--
-- Detected  '' with 'pbsnodes' binary in /opt/skyformai/bin/pbsnodes.
--           disabled by useGrid=false
--
-- Detected LSF with 'bsub' binary in /opt/skyformai/bin/bsub.
--          LSF disabled by useGrid=false
--
-- Local machine mode enabled; grid support not detected or not allowed.
--
-- Found trimmed raw PacBio HiFi reads in the input files.
--
--                                (tag)Concurrency
--                         (tag)Threads          |
--                (tag)Memory         |          |
--        (tag)             |         |          |       total usage      algorithm
--        -------  ----------  --------   --------  --------------------  -----------------------------
-- Local: meryl     12.000 GB    4 CPUs x  22 jobs   264.000 GB  88 CPUs  (k-mer counting)
-- Local: cormhap   13.000 GB   11 CPUs x   8 jobs   104.000 GB  88 CPUs  (overlap detection with mhap)
-- Local: obtovl     8.000 GB    8 CPUs x  11 jobs    88.000 GB  88 CPUs  (overlap detection)
-- Local: utgovl     8.000 GB    8 CPUs x  11 jobs    88.000 GB  88 CPUs  (overlap detection)
-- Local: cor        -.--- GB    4 CPUs x   - jobs     -.--- GB   - CPUs  (read correction)
-- Local: ovb        4.000 GB    1 CPU  x  88 jobs   352.000 GB  88 CPUs  (overlap store bucketizer)
-- Local: ovs        8.000 GB    1 CPU  x  62 jobs   496.000 GB  62 CPUs  (overlap store sorting)
-- Local: red       16.000 GB    4 CPUs x  22 jobs   352.000 GB  88 CPUs  (read error detection)
-- Local: oea        8.000 GB    1 CPU  x  62 jobs   496.000 GB  62 CPUs  (overlap error adjustment)
-- Local: bat       32.000 GB    8 CPUs x   1 job     32.000 GB   8 CPUs  (contig construction with bogart)
-- Local: cns        -.--- GB    8 CPUs x   - jobs     -.--- GB   - CPUs  (consensus)
--
-- Generating assembly '41' in '/share/org/YZWL/yzwl_lixg/project/28.大豆疫霉菌三代基因组/03.hicanu/41/01.raw_output':
--   genomeSize:
--     85000000
--
--   Overlap Generation Limits:
--     corOvlErrorRate 0.0000 (  0.00%)
--     obtOvlErrorRate 0.0250 (  2.50%)
--     utgOvlErrorRate 0.0100 (  1.00%)
--
--   Overlap Processing Limits:
--     corErrorRate    0.0000 (  0.00%)
--     obtErrorRate    0.0250 (  2.50%)
--     utgErrorRate    0.0003 (  0.03%)
--     cnsErrorRate    0.0500 (  5.00%)
--
--   Stages to run:
--     assemble HiFi reads.
--
--
-- BEGIN STORE CREATION
----------------------------------------
-- Starting command on Thu Jan 15 23:45:01 2026 with 4567685.234 GB free disk space

    cd .
    ./41.seqStore.sh \
    > ./41.seqStore.err 2>&1

-- Finished on Thu Jan 15 23:51:40 2026 (399 seconds) with 4566851.125 GB free disk space
----------------------------------------
--
-- In sequence store './41.seqStore':
--   Found 287810 reads.
--   Found 4250003935 bases (50 times coverage).
--    Histogram of corrected reads:
--    
--    G=4250003935                       sum of  ||               length     num
--    NG         length     index       lengths  ||                range    seqs
--    ----- ------------ --------- ------------  ||  ------------------- -------
--    00010        26333     15064    425024376  ||       1210-2350        12977|---------------------------------------
--    00020        24410     31871    850015425  ||       2351-3491        20392|-------------------------------------------------------------
--    00030        23059     49808   1275022995  ||       3492-4632        18058|------------------------------------------------------
--    00040        21915     68724   1700015622  ||       4633-5773        15120|---------------------------------------------
--    00050        20835     88610   2125004568  ||       5774-6914        12464|-------------------------------------
--    00060        19715    109565   2550021067  ||       6915-8055        10570|--------------------------------
--    00070        18245    131908   2975010797  ||       8056-9196         8963|---------------------------
--    00080        14894    157110   3400003937  ||       9197-10337        7945|------------------------
--    00090         8526    194422   3825004830  ||      10338-11478        7032|---------------------
--    00100         1210    287810   4250003935  ||      11479-12619        6337|-------------------
--    001.000x              287810   4250003935  ||      12620-13760        5604|-----------------
--                                               ||      13761-14901        5268|----------------
--                                               ||      14902-16042        5864|------------------
--                                               ||      16043-17183        8112|-------------------------
--                                               ||      17184-18324       12176|-------------------------------------
--                                               ||      18325-19465       17101|---------------------------------------------------
--                                               ||      19466-20606       20839|--------------------------------------------------------------
--                                               ||      20607-21747       21244|---------------------------------------------------------------
--                                               ||      21748-22888       19332|----------------------------------------------------------
--                                               ||      22889-24029       16174|------------------------------------------------
--                                               ||      24030-25170       12085|------------------------------------
--                                               ||      25171-26311        8962|---------------------------
--                                               ||      26312-27452        6225|-------------------
--                                               ||      27453-28593        4020|------------
--                                               ||      28594-29734        2506|--------
--                                               ||      29735-30875        1332|----
--                                               ||      30876-32016         668|--
--                                               ||      32017-33157         289|-
--                                               ||      33158-34298         107|-
--                                               ||      34299-35439          36|-
--                                               ||      35440-36580           2|-
--                                               ||      36581-37721           0|
--                                               ||      37722-38862           0|
--                                               ||      38863-40003           2|-
--                                               ||      40004-41144           0|
--                                               ||      41145-42285           0|
--                                               ||      42286-43426           2|-
--                                               ||      43427-44567           0|
--                                               ||      44568-45708           1|-
--                                               ||      45709-46849           1|-
--    
--
-- In sequence store './41.seqStore':
--   Found 287810 reads.
--   Found 4250003935 bases (50 times coverage).
--    Histogram of corrected-trimmed reads:
--    
--    G=4250003935                       sum of  ||               length     num
--    NG         length     index       lengths  ||                range    seqs
--    ----- ------------ --------- ------------  ||  ------------------- -------
--    00010        26333     15064    425024376  ||       1210-2350        12977|---------------------------------------
--    00020        24410     31871    850015425  ||       2351-3491        20392|-------------------------------------------------------------
--    00030        23059     49808   1275022995  ||       3492-4632        18058|------------------------------------------------------
--    00040        21915     68724   1700015622  ||       4633-5773        15120|---------------------------------------------
--    00050        20835     88610   2125004568  ||       5774-6914        12464|-------------------------------------
--    00060        19715    109565   2550021067  ||       6915-8055        10570|--------------------------------
--    00070        18245    131908   2975010797  ||       8056-9196         8963|---------------------------
--    00080        14894    157110   3400003937  ||       9197-10337        7945|------------------------
--    00090         8526    194422   3825004830  ||      10338-11478        7032|---------------------
--    00100         1210    287810   4250003935  ||      11479-12619        6337|-------------------
--    001.000x              287810   4250003935  ||      12620-13760        5604|-----------------
--                                               ||      13761-14901        5268|----------------
--                                               ||      14902-16042        5864|------------------
--                                               ||      16043-17183        8112|-------------------------
--                                               ||      17184-18324       12176|-------------------------------------
--                                               ||      18325-19465       17101|---------------------------------------------------
--                                               ||      19466-20606       20839|--------------------------------------------------------------
--                                               ||      20607-21747       21244|---------------------------------------------------------------
--                                               ||      21748-22888       19332|----------------------------------------------------------
--                                               ||      22889-24029       16174|------------------------------------------------
--                                               ||      24030-25170       12085|------------------------------------
--                                               ||      25171-26311        8962|---------------------------
--                                               ||      26312-27452        6225|-------------------
--                                               ||      27453-28593        4020|------------
--                                               ||      28594-29734        2506|--------
--                                               ||      29735-30875        1332|----
--                                               ||      30876-32016         668|--
--                                               ||      32017-33157         289|-
--                                               ||      33158-34298         107|-
--                                               ||      34299-35439          36|-
--                                               ||      35440-36580           2|-
--                                               ||      36581-37721           0|
--                                               ||      37722-38862           0|
--                                               ||      38863-40003           2|-
--                                               ||      40004-41144           0|
--                                               ||      41145-42285           0|
--                                               ||      42286-43426           2|-
--                                               ||      43427-44567           0|
--                                               ||      44568-45708           1|-
--                                               ||      45709-46849           1|-
--    
--
-- Correction skipped; not enabled.
--
-- Trimming skipped; not enabled.
--
-- BEGIN ASSEMBLY
----------------------------------------
-- Starting command on Thu Jan 15 23:51:41 2026 with 4566851.078 GB free disk space

    cd unitigging/0-mercounts
    ./meryl-configure.sh \
    > ./meryl-configure.err 2>&1

-- Finished on Thu Jan 15 23:51:43 2026 (2 seconds) with 4566819.296 GB free disk space
----------------------------------------
--  segments   memory batches
--  -------- -------- -------
--        01 10.81 GB       2
--        02  5.75 GB       2
--        04  2.97 GB       2
--        06  2.14 GB       2
--        08  1.61 GB       2
--        12  1.07 GB       2
--        16  0.81 GB       2
--        20  0.65 GB       2
--        24  0.54 GB       2
--        32  0.41 GB       2
--        40  0.32 GB       2
--        48  -.-- GB       -  (segment size too small)
--        56  -.-- GB       -  (segment size too small)
--        64  -.-- GB       -  (segment size too small)
--        96  -.-- GB       -  (segment size too small)
--
--  For 287810 reads with 4250003935 bases, limit to 42 batches.
--  Will count kmers using 01 jobs, each using 12 GB and 4 threads.
--
-- Finished stage 'merylConfigure', reset canuIteration.
--
-- Running jobs.  First attempt out of 2.
----------------------------------------
-- Starting 'meryl' concurrent execution on Thu Jan 15 23:51:43 2026 with 4566819.265 GB free disk space (1 processes; 22 concurrently)

    cd unitigging/0-mercounts
    ./meryl-count.sh 1 > ./meryl-count.000001.out 2>&1

-- Finished on Thu Jan 15 23:55:06 2026 (203 seconds) with 4566811.062 GB free disk space
----------------------------------------
-- Found 1 Kmer counting (meryl) outputs.
-- Finished stage 'utg-merylCountCheck', reset canuIteration.
--
-- Running jobs.  First attempt out of 2.
----------------------------------------
-- Starting 'meryl' concurrent execution on Thu Jan 15 23:55:06 2026 with 4566811.031 GB free disk space (1 processes; 22 concurrently)

    cd unitigging/0-mercounts
    ./meryl-process.sh 1 > ./meryl-process.000001.out 2>&1

-- Finished on Thu Jan 15 23:55:12 2026 (6 seconds) with 4566811.281 GB free disk space
----------------------------------------
-- Meryl finished successfully.  Kmer frequency histogram:
--
-- WARNING: gnuplot failed.
--
----------------------------------------
--
--  22-mers                                                                                           Fraction
--    Occurrences   NumMers                                                                         Unique Total
--       1-     1         0                                                                        0.0000 0.0000
--       2-     2    271011 *                                                                      0.0060 0.0002
--       3-     4     81574                                                                        0.0073 0.0003
--       5-     7     25173                                                                        0.0081 0.0003
--       8-    11     14262                                                                        0.0085 0.0003
--      12-    16     25602                                                                        0.0088 0.0004
--      17-    22    131649                                                                        0.0095 0.0005
--      23-    29    914723 ***                                                                    0.0134 0.0017
--      30-    37   5661464 ************************                                               0.0393 0.0118
--      38-    46  16217312 ********************************************************************** 0.1885 0.0860
--      47-    56  13500785 **********************************************************             0.5597 0.3110
--      57-    67   3345565 **************                                                         0.8317 0.5082
--      68-    79    670794 **                                                                     0.8929 0.5607
--      80-    92   1022647 ****                                                                   0.9078 0.5763
--      93-   106    761239 ***                                                                    0.9307 0.6043
--     107-   121    306943 *                                                                      0.9464 0.6263
--     122-   137    288305 *                                                                      0.9530 0.6369
--     138-   154    270039 *                                                                      0.9594 0.6487
--     155-   172    165392                                                                        0.9652 0.6606
--     173-   191    173313                                                                        0.9689 0.6690
--     192-   211    129860                                                                        0.9727 0.6788
--     212-   232    110650                                                                        0.9755 0.6867
--     233-   254    104996                                                                        0.9780 0.6944
--     255-   277     85662                                                                        0.9803 0.7023
--     278-   301     82115                                                                        0.9822 0.7095
--     302-   326     64841                                                                        0.9840 0.7168
--     327-   352     63859                                                                        0.9854 0.7231
--     353-   379     51574                                                                        0.9868 0.7298
--     380-   407     47650                                                                        0.9879 0.7356
--     408-   436     39507                                                                        0.9890 0.7415
--     437-   466     37268                                                                        0.9899 0.7466
--     467-   497     30429                                                                        0.9907 0.7518
--     498-   529     29015                                                                        0.9914 0.7564
--     530-   562     25447                                                                        0.9920 0.7610
--     563-   596     19443                                                                        0.9926 0.7653
--     597-   631     17025                                                                        0.9930 0.7688
--     632-   667     15243                                                                        0.9934 0.7721
--     668-   704     14607                                                                        0.9937 0.7751
--     705-   742     14428                                                                        0.9940 0.7783
--     743-   781     14274                                                                        0.9943 0.7815
--     782-   821     12440                                                                        0.9947 0.7849
--
--           0 (max occurrences)
--  3210652461 (total mers, non-unique)
--    45087077 (distinct mers, non-unique)
--           0 (unique mers)
-- Finished stage 'meryl-process', reset canuIteration.
--
-- Removing meryl database 'unitigging/0-mercounts/41.ms22'.
--
-- OVERLAPPER (normal) (assembly) erate=0.01
--
----------------------------------------
-- Starting command on Thu Jan 15 23:55:13 2026 with 4566811.937 GB free disk space

    cd unitigging/1-overlapper
    /share/org/YZWL/yzwl_lixg/miniforge3/envs/canu_v.2.3/bin/overlapInCorePartition \
     -S  ../../41.seqStore \
     -hl 160000000 \
     -rl 5000000000 \
     -ol 500 \
     -o  ./41.partition \
    > ./41.partition.err 2>&1

-- Finished on Thu Jan 15 23:55:13 2026 (like a bat out of hell) with 4566811.921 GB free disk space
----------------------------------------
--
-- Configured 21 overlapInCore jobs.
-- Finished stage 'utg-overlapConfigure', reset canuIteration.
--
-- Running jobs.  First attempt out of 2.
----------------------------------------
-- Starting 'utgovl' concurrent execution on Thu Jan 15 23:55:13 2026 with 4566811.89 GB free disk space (21 processes; 11 concurrently)

    cd unitigging/1-overlapper
    ./overlap.sh 1 > ./overlap.000001.out 2>&1
    ./overlap.sh 2 > ./overlap.000002.out 2>&1
    ./overlap.sh 3 > ./overlap.000003.out 2>&1
    ./overlap.sh 4 > ./overlap.000004.out 2>&1
    ./overlap.sh 5 > ./overlap.000005.out 2>&1
    ./overlap.sh 6 > ./overlap.000006.out 2>&1
    ./overlap.sh 7 > ./overlap.000007.out 2>&1
    ./overlap.sh 8 > ./overlap.000008.out 2>&1
    ./overlap.sh 9 > ./overlap.000009.out 2>&1
    ./overlap.sh 10 > ./overlap.000010.out 2>&1
    ./overlap.sh 11 > ./overlap.000011.out 2>&1
    ./overlap.sh 12 > ./overlap.000012.out 2>&1
    ./overlap.sh 13 > ./overlap.000013.out 2>&1
    ./overlap.sh 14 > ./overlap.000014.out 2>&1
    ./overlap.sh 15 > ./overlap.000015.out 2>&1
    ./overlap.sh 16 > ./overlap.000016.out 2>&1
    ./overlap.sh 17 > ./overlap.000017.out 2>&1
    ./overlap.sh 18 > ./overlap.000018.out 2>&1
    ./overlap.sh 19 > ./overlap.000019.out 2>&1
    ./overlap.sh 20 > ./overlap.000020.out 2>&1
    ./overlap.sh 21 > ./overlap.000021.out 2>&1

-- Finished on Fri Jan 16 00:22:31 2026 (1638 seconds) with 4564543.312 GB free disk space
----------------------------------------
-- Found 21 overlapInCore output files.
--
-- overlapInCore compute 'unitigging/1-overlapper':
--   kmer hits
--     with no overlap       1342353907  14.6190476 +- 39808188.779
--     with an overlap         43726347     2082207 +- 1128361.398
--
--   overlaps                  43726347     2082207 +- 1128361.398
--     contained               13297238  .809523809 +- 346611.228
--     dovetail                30429109  5.19047619 +- 792002.906
--
--   overlaps rejected
--     multiple per pair              0           0 +- 0
--     bad short window               0           0 +- 0
--     bad long window                0           0 +- 0
-- Finished stage 'utg-overlapCheck', reset canuIteration.
----------------------------------------
-- Starting command on Fri Jan 16 00:22:31 2026 with 4564543.296 GB free disk space

    cd unitigging
    /share/org/YZWL/yzwl_lixg/miniforge3/envs/canu_v.2.3/bin/ovStoreConfig \
     -S ../41.seqStore \
     -M 4-8 \
     -L ./1-overlapper/ovljob.files \
     -create ./41.ovlStore.config \
     > ./41.ovlStore.config.txt \
    2> ./41.ovlStore.config.err

-- Finished on Fri Jan 16 00:22:31 2026 (in the blink of an eye) with 4564543.281 GB free disk space
----------------------------------------
--
-- Creating overlap store unitigging/41.ovlStore using:
--      1 bucket
--      1 slice
--        using at most 3 GB memory each
--
-- Running jobs.  First attempt out of 2.
----------------------------------------
-- Starting 'ovS' concurrent execution on Fri Jan 16 00:22:31 2026 with 4564543.265 GB free disk space (1 processes; 62 concurrently)

    cd unitigging
    ./41.ovlStore.sh 1 > ./41.ovlStore.000001.out 2>&1

-- Finished on Fri Jan 16 00:22:49 2026 (18 seconds) with 4564541.234 GB free disk space
----------------------------------------
-- Checking store.
----------------------------------------
-- Starting command on Fri Jan 16 00:22:49 2026 with 4564541.234 GB free disk space

    cd unitigging
    /share/org/YZWL/yzwl_lixg/miniforge3/envs/canu_v.2.3/bin/ovStoreDump \
     -S ../41.seqStore \
     -O  ./41.ovlStore \
     -counts \
     > ./41.ovlStore/counts.dat 2> ./41.ovlStore/counts.err

-- Finished on Fri Jan 16 00:22:49 2026 (in the blink of an eye) with 4564541.218 GB free disk space
----------------------------------------
--
-- Overlap store 'unitigging/41.ovlStore' successfully constructed.
-- Found 87452694 overlaps for 279691 reads; 1426329 reads have no overlaps.
--
--
-- Purged 0.86 GB in 63 overlap output files.
----------------------------------------
-- Starting command on Fri Jan 16 00:22:50 2026 with 4564542.109 GB free disk space

    cd unitigging
    /share/org/YZWL/yzwl_lixg/miniforge3/envs/canu_v.2.3/bin/ovStoreStats \
     -C 50 \
     -S ../41.seqStore \
     -O  ./41.ovlStore \
     -o  ./41.ovlStore \
     > ./41.ovlStore.summary.err 2>&1

-- Finished on Fri Jan 16 00:23:02 2026 (12 seconds) with 4564542 GB free disk space
----------------------------------------
--
-- Overlap store 'unitigging/41.ovlStore' contains:
--
--   category            reads     %          read length        feature size or coverage  analysis
--   ----------------  -------  -------  ----------------------  ------------------------  --------------------
--   middle-missing        127    0.04    13725.64 +- 7438.28        592.02 +- 817.66     (bad trimming)
--   middle-hump            42    0.01     8072.98 +- 7975.49       3551.62 +- 4890.23    (bad trimming)
--   no-5-prime            655    0.23    12716.86 +- 5969.68       1379.93 +- 2573.60    (bad trimming)
--   no-3-prime            916    0.32    10188.00 +- 6496.92       1188.67 +- 2311.28    (bad trimming)
--   
--   low-coverage         1546    0.54     8697.35 +- 6172.44          5.89 +- 3.72       (easy to assemble, potential for lower quality consensus)
--   unique             226187   78.59    11337.47 +- 6397.78         45.34 +- 8.65       (easy to assemble, perfect, yay)
--   repeat-cont         22790    7.92     8996.92 +- 5513.69       1609.74 +- 1281.07    (potential for consensus errors, no impact on assembly)
--   repeat-dove           269    0.09    20341.71 +- 1796.03        655.61 +- 883.96     (hard to assemble, likely won't assemble correctly or even at all)
--   
--   span-repeat          4342    1.51    13846.62 +- 5565.65       3620.60 +- 4086.92    (read spans a large repeat, usually easy to assemble)
--   uniq-repeat-cont    15470    5.38    11806.12 +- 5346.08                             (should be uniquely placed, low potential for consensus errors, no impact on assembly)
--   uniq-repeat-dove     3034    1.05    18985.81 +- 2636.56                             (will end contigs, potential to misassemble)
--   uniq-anchor          4313    1.50    13071.90 +- 5282.65       7484.76 +- 5299.43    (repeat read, with unique section, probable bad read)
-- Finished stage 'utg-createOverlapStore', reset canuIteration.
--
-- Loading read lengths.
-- Loading number of overlaps per read.
--
-- Configure RED for 16gb memory.
--                   Batches of at most (unlimited) reads.
--                                      500000000 bases.
--                   Expecting evidence of at most 536870912 bases per iteration.
--
--           Total                                               Reads                 Olaps Evidence
--    Job   Memory      Read Range         Reads        Bases   Memory        Olaps   Memory   Memory  (Memory in MB)
--   ---- -------- ------------------- --------- ------------ -------- ------------ -------- --------
--      1 16384.58         1-34540          5800    108884317 13291.73      1822572    20.86  1024.00
--      2 16384.31     34541-81666          7875    108842926 13286.74      2234616    25.57  1024.00
--      3 16385.77     81667-115398         5818    108920749 13296.17      1537525    17.60  1024.00
--      4 16386.28    115399-153175         6341    108823752 13284.35      2615070    29.93  1024.00
--      5 16384.61    153176-204734         8583    108920248 13296.20      1434055    16.41  1024.00
--      6 16385.47    204735-254270         8449    108798423 13281.32      2808990    32.15  1024.00
--      7 16384.91    254271-289027         5957    108775110 13278.40      3015910    34.51  1024.00
--      8 16384.44    289028-331535         7090    108907558 13294.60      1558580    17.84  1024.00
--      9 16385.07    331536-392874        10490    108774335 13278.45      3025111    34.62  1024.00
--     10 16386.20    392875-428060         5915    108833212 13285.49      2508292    28.71  1024.00
--     11 16385.66    428061-466175         6538    108899700 13293.63      1750843    20.04  1024.00
--     12 16385.95    466176-529308        10610    108775255 13278.56      3092469    35.39  1024.00
--     13 16384.44    529309-567236         6307    108883125 13291.60      1821424    20.84  1024.00
--     14 16385.38    567237-604039         6207    108799800 13281.42      2792869    31.96  1024.00
--     15 16384.06    604040-649620         7796    108952532 13300.11      1043415    11.94  1024.00
--     16 16384.62    649621-706685         9491    108762434 13276.96      3115469    35.65  1024.00
--     17 16385.03    706686-743705         6105    108810208 13282.69      2651652    30.35  1024.00
--     18 16385.43    743706-784160         6868    108886232 13291.99      1873263    21.44  1024.00
--     19 16384.34    784161-849219        10989    108723414 13272.25      3503790    40.10  1024.00
--     20 16386.08    849220-883362         5772    108902439 13293.94      1760452    20.15  1024.00
--     21 16385.41    883363-919482         6282    108820167 13283.91      2578080    29.50  1024.00
--     22 16384.10    919483-970440         8637    108917327 13295.84      1420765    16.26  1024.00
--     23 16385.67    970441-1015644        7583    108802497 13281.79      2785191    31.87  1024.00
--     24 16385.21   1015645-1050901        5974    108786897 13279.84      2915806    33.37  1024.00
--     25 16384.82   1050902-1093438        7113    108929088 13297.23      1362173    15.59  1024.00
--     26 16384.74   1093439-1148296        9191    108794685 13280.89      2783075    31.85  1024.00
--     27 16384.34   1148297-1183508        5830    108837469 13286.01      2301381    26.34  1024.00
--     28 16384.88   1183509-1220584        6402    108900524 13293.72      1673708    19.15  1024.00
--     29 16384.37   1220585-1279820        9982    108793418 13280.76      2762050    31.61  1024.00
--     30 16384.07   1279821-1313446        5686    108904059 13294.13      1567231    17.94  1024.00
--     31 16384.08   1313447-1350034        6094    108855641 13288.23      2083488    23.84  1024.00
--     32 16384.58   1350035-1396783        7868    108943683 13299.04      1183186    13.54  1024.00
--     33 16385.19   1396784-1443840        7979    108840291 13286.42      2339603    26.77  1024.00
--     34 16385.25   1443841-1479045        5923    108803720 13281.89      2740447    31.36  1024.00
--     35 16385.20   1479046-1518247        6731    108943451 13298.97      1242944    14.22  1024.00
--     36 16385.42   1518248-1573353        9258    108801078 13281.67      2773898    31.74  1024.00
--     37 16386.39   1573354-1607703        5790    108844082 13286.81      2410102    27.58  1024.00
--     38 16384.54   1607704-1646279        6362    108896132 13293.19      1691472    19.36  1024.00
--     39 16384.72   1646280-1703728        9688    108796786 13281.16      2757453    31.56  1024.00
--     40  3673.56   1703729-1706020         436      4917171   600.25       114274     1.31  1024.00
--   ---- -------- ------------------- --------- ------------ -------- ------------ -------- --------
--                                                 4250003935              87452694
-- Finished stage 'readErrorDetectionConfigure', reset canuIteration.
--
-- Running jobs.  First attempt out of 2.
----------------------------------------
-- Starting 'red' concurrent execution on Fri Jan 16 00:23:08 2026 with 4564525.062 GB free disk space (40 processes; 22 concurrently)

    cd unitigging/3-overlapErrorAdjustment
    ./red.sh 1 > ./red.000001.out 2>&1
    ./red.sh 2 > ./red.000002.out 2>&1
    ./red.sh 3 > ./red.000003.out 2>&1
    ./red.sh 4 > ./red.000004.out 2>&1
    ./red.sh 5 > ./red.000005.out 2>&1
    ./red.sh 6 > ./red.000006.out 2>&1
    ./red.sh 7 > ./red.000007.out 2>&1
    ./red.sh 8 > ./red.000008.out 2>&1
    ./red.sh 9 > ./red.000009.out 2>&1
    ./red.sh 10 > ./red.000010.out 2>&1
    ./red.sh 11 > ./red.000011.out 2>&1
    ./red.sh 12 > ./red.000012.out 2>&1
    ./red.sh 13 > ./red.000013.out 2>&1
    ./red.sh 14 > ./red.000014.out 2>&1
    ./red.sh 15 > ./red.000015.out 2>&1
    ./red.sh 16 > ./red.000016.out 2>&1
    ./red.sh 17 > ./red.000017.out 2>&1
    ./red.sh 18 > ./red.000018.out 2>&1
    ./red.sh 19 > ./red.000019.out 2>&1
    ./red.sh 20 > ./red.000020.out 2>&1
    ./red.sh 21 > ./red.000021.out 2>&1
    ./red.sh 22 > ./red.000022.out 2>&1
    ./red.sh 23 > ./red.000023.out 2>&1
    ./red.sh 24 > ./red.000024.out 2>&1
    ./red.sh 25 > ./red.000025.out 2>&1
    ./red.sh 26 > ./red.000026.out 2>&1
    ./red.sh 27 > ./red.000027.out 2>&1
    ./red.sh 28 > ./red.000028.out 2>&1
    ./red.sh 29 > ./red.000029.out 2>&1
    ./red.sh 30 > ./red.000030.out 2>&1
    ./red.sh 31 > ./red.000031.out 2>&1
    ./red.sh 32 > ./red.000032.out 2>&1
    ./red.sh 33 > ./red.000033.out 2>&1
    ./red.sh 34 > ./red.000034.out 2>&1
    ./red.sh 35 > ./red.000035.out 2>&1
    ./red.sh 36 > ./red.000036.out 2>&1
    ./red.sh 37 > ./red.000037.out 2>&1
    ./red.sh 38 > ./red.000038.out 2>&1
    ./red.sh 39 > ./red.000039.out 2>&1
    ./red.sh 40 > ./red.000040.out 2>&1

-- Finished on Fri Jan 16 00:38:30 2026 (922 seconds) with 4562098.5 GB free disk space
----------------------------------------
-- Found 40 read error detection output files.
-- Finished stage 'readErrorDetectionCheck', reset canuIteration.
--
-- Loading read lengths.
-- Loading number of overlaps per read.
--
-- Configure OEA for 8gb memory.
--                   Batches of at most (unlimited) reads.
--                                      300000000 bases.
--
--           Total                                               Reads                 Olaps  Adjusts
--    Job   Memory      Read Range         Reads        Bases   Memory        Olaps   Memory   Memory  (Memory in MB)
--   ---- -------- ------------------- --------- ------------ -------- ------------ -------- --------
--      1  2850.18         1-106783        18032    300007426   294.66      4589662   140.07   367.45
--      2  2939.31    106784-237544        21969    300000391   294.77      7506708   229.09   367.45
--      3  2872.52    237545-347213        18617    300003396   294.67      5321292   162.39   367.45
--      4  2921.20    347214-467184        20411    300002521   294.73      6914678   211.02   367.45
--      5  2927.83    467185-595544        21538    300013479   294.77      7130506   217.61   367.45
--      6  2895.84    595545-726078        21913    300006125   294.78      6082159   185.61   367.45
--      7  2920.05    726079-858945        22427    300012393   294.80      6874795   209.80   367.45
--      8  2887.90    858946-974694        19700    300001294   294.70      5824359   177.75   367.45
--      9  2910.99    974695-1084104       18413    300019120   294.68      6581659   200.86   367.45
--     10  2908.20   1084105-1203580       20090    300019264   294.73      6488586   198.02   367.45
--     11  2881.19   1203581-1325131       20470    300021633   294.75      5603102   170.99   367.45
--     12  2858.40   1325132-1446409       20484    300012398   294.74      4856527   148.21   367.45
--     13  2911.11   1446410-1567617       20504    300004676   294.73      6584013   200.93   367.45
--     14  2855.86   1567618-1674181       17723    300006890   294.65      4776184   145.76   367.45
--     15  2541.94   1674182-1706020        5519     49872929    55.73      2318464    70.75   367.45
--   ---- -------- ------------------- --------- ------------ -------- ------------ -------- --------
--                                                 4250003935              87452694
-- Finished stage 'overlapErrorAdjustmentConfigure', reset canuIteration.
--
-- Running jobs.  First attempt out of 2.
----------------------------------------
-- Starting 'oea' concurrent execution on Fri Jan 16 00:38:37 2026 with 4562097.828 GB free disk space (15 processes; 62 concurrently)

    cd unitigging/3-overlapErrorAdjustment
    ./oea.sh 1 > ./oea.000001.out 2>&1
    ./oea.sh 2 > ./oea.000002.out 2>&1
    ./oea.sh 3 > ./oea.000003.out 2>&1
    ./oea.sh 4 > ./oea.000004.out 2>&1
    ./oea.sh 5 > ./oea.000005.out 2>&1
    ./oea.sh 6 > ./oea.000006.out 2>&1
    ./oea.sh 7 > ./oea.000007.out 2>&1
    ./oea.sh 8 > ./oea.000008.out 2>&1
    ./oea.sh 9 > ./oea.000009.out 2>&1
    ./oea.sh 10 > ./oea.000010.out 2>&1
    ./oea.sh 11 > ./oea.000011.out 2>&1
    ./oea.sh 12 > ./oea.000012.out 2>&1
    ./oea.sh 13 > ./oea.000013.out 2>&1
    ./oea.sh 14 > ./oea.000014.out 2>&1
    ./oea.sh 15 > ./oea.000015.out 2>&1

-- Finished on Fri Jan 16 01:23:46 2026 (2709 seconds) with 4558862.703 GB free disk space
----------------------------------------
-- Found 15 overlap error adjustment output files.
-- Finished stage 'overlapErrorAdjustmentCheck', reset canuIteration.
----------------------------------------
-- Starting command on Fri Jan 16 01:23:46 2026 with 4558862.687 GB free disk space

    cd unitigging/3-overlapErrorAdjustment
    /share/org/YZWL/yzwl_lixg/miniforge3/envs/canu_v.2.3/bin/loadErates \
      -S ../../41.seqStore \
      -O ../41.ovlStore \
      -L ./oea.files \
    > ./oea.apply.err 2>&1

-- Finished on Fri Jan 16 01:23:46 2026 (fast as lightning) with 4558862.515 GB free disk space
----------------------------------------
-- No report available.
-- Finished stage 'updateOverlapStore', reset canuIteration.
-- Finished stage 'unitig', reset canuIteration.
--
-- Running jobs.  First attempt out of 2.
----------------------------------------
-- Starting 'bat' concurrent execution on Fri Jan 16 01:23:46 2026 with 4558855.359 GB free disk space (1 processes; 1 concurrently)

    cd unitigging/4-unitigger
    ./unitigger.sh 1 > ./unitigger.000001.out 2>&1

-- Finished on Fri Jan 16 01:24:08 2026 (22 seconds) with 4558854.875 GB free disk space
----------------------------------------
-- Unitigger finished successfully.
--  
--  ERROR RATES
--  -----------
--                                                   --------threshold------
--  314233                       fraction error      fraction        percent
--  samples                              (1e-5)         error          error
--                   --------------------------      --------       --------
--  command line (-eg)                           ->     30.00        0.0300%
--  command line (-ef)                           ->  -----.--      ---.----%
--  command line (-eM)                           ->     30.00        0.0300%
--  mean + std.dev       0.39 +-  12 *     2.81  ->     34.05        0.0341%
--  median + mad         0.00 +-  12 *     0.00  ->      0.00        0.0000%
--  90th percentile                              ->      1.00        0.0010%  (enabled)
--  
--  BEST EDGE FILTERING
--  -------------------
--  At graph threshold 0.0300%, reads:
--    available to have edges:        50600
--    with at least one edge:         40653
--  
--  At max threshold 0.0300%, reads:  (not computed)
--    available to have edges:            0
--    with at least one edge:             0
--  
--  At tight threshold 0.0010%, reads with:
--    both edges below error threshold:     35213  (80.00% minReadsBest threshold = 32522)
--    one  edge  above error threshold:      3923
--    both edges above error threshold:      1517
--    at least one edge:                    40653
--  
--  At loose threshold 0.0300%, reads with:
--    both edges below error threshold:     40653  (80.00% minReadsBest threshold = 32522)
--    one  edge  above error threshold:         0
--    both edges above error threshold:         0
--    at least one edge:                    40653
--  
--  
--  INITIAL EDGES
--  -------- ----------------------------------------
--    231457 reads are contained
--   1439514 reads have no best edges (singleton)
--       305 reads have only one best edge (spur) 
--                164 are mutual best
--     34744 reads have two best edges 
--                870 have one mutual best edge
--              33511 have two mutual best edges
--  
--  
--  FINAL EDGES
--  -------- ----------------------------------------
--    231457 reads are contained
--   1439844 reads have no best edges (singleton)
--       203 reads have only one best edge (spur) 
--                176 are mutual best
--     34516 reads have two best edges 
--                750 have one mutual best edge
--              33507 have two mutual best edges
--  
--  
--  EDGE FILTERING
--  -------- ------------------------------------------
--         0 reads are ignored
--     11362 reads have a gap in overlap coverage
--       155 reads have lopsided best edges
-- Found, in version 1, after unitig construction:
--   contigs:      96 sequences, total length 68729052 bp (including 159 repeats of total length 5302298 bp).
--   bubbles:      260 sequences, total length 10618934 bp.
--   unassembled:  21413 sequences, total length 228857550 bp.
--
-- Contig sizes based on genome size 85mbp:
--
--            NG (bp)  LG (contigs)    sum (bp)
--         ----------  ------------  ----------
--     10     6242800             2    14247675
--     20     5835964             3    20083639
--     30     5790688             4    25874327
--     40     4389261             6    34805498
--     50     3875843             8    42679050
--     60     2510788            11    51801748
--     70     1426436            15    59694916
--     80       27536            58    68002598
--
-- Finished stage 'unitigCheck', reset canuIteration.
----------------------------------------
-- Starting command on Fri Jan 16 01:24:08 2026 with 4558854.859 GB free disk space

    cd unitigging
    /share/org/YZWL/yzwl_lixg/miniforge3/envs/canu_v.2.3/bin/utgcns \
      -S ../41.seqStore \
      -T  ./41.ctgStore 1 \
      -partition 0.8 1.5 0.1 \
    > ./41.ctgStore/partitioning.log 2>&1

-- Finished on Fri Jan 16 01:24:17 2026 (9 seconds) with 4558853.703 GB free disk space
----------------------------------------
-- Using slow alignment for consensus (iteration '0').
-- Configured 11 consensus jobs.
-- Finished stage 'consensusConfigure', reset canuIteration.
--
-- Local: cns       11.875 GB    8 CPUs x  11 jobs   130.625 GB  88 CPUs  (consensus)
--
--
-- Running jobs.  First attempt out of 2.
----------------------------------------
-- Starting 'cns' concurrent execution on Fri Jan 16 01:24:17 2026 with 4558853.671 GB free disk space (11 processes; 11 concurrently)

    cd unitigging/5-consensus
    ./consensus.sh 1 > ./consensus.000001.out 2>&1
    ./consensus.sh 2 > ./consensus.000002.out 2>&1
    ./consensus.sh 3 > ./consensus.000003.out 2>&1
    ./consensus.sh 4 > ./consensus.000004.out 2>&1
    ./consensus.sh 5 > ./consensus.000005.out 2>&1
    ./consensus.sh 6 > ./consensus.000006.out 2>&1
    ./consensus.sh 7 > ./consensus.000007.out 2>&1
    ./consensus.sh 8 > ./consensus.000008.out 2>&1
    ./consensus.sh 9 > ./consensus.000009.out 2>&1
    ./consensus.sh 10 > ./consensus.000010.out 2>&1
    ./consensus.sh 11 > ./consensus.000011.out 2>&1

-- Finished on Fri Jan 16 01:31:20 2026 (423 seconds) with 4559630.968 GB free disk space
----------------------------------------
-- Using slow alignment for consensus (iteration '1').
-- Configured 11 consensus jobs.
-- All 11 consensus jobs finished successfully.
-- Finished stage 'consensusCheck', reset canuIteration.
-- Using slow alignment for consensus (iteration '0').
-- Configured 11 consensus jobs.
----------------------------------------
-- Starting command on Fri Jan 16 01:31:20 2026 with 4559630.921 GB free disk space

    cd unitigging
    /share/org/YZWL/yzwl_lixg/miniforge3/envs/canu_v.2.3/bin/tgStoreLoad \
      -S ../41.seqStore \
      -T  ./41.ctgStore 2 \
      -L ./5-consensus/ctgcns.files \
    > ./5-consensus/ctgcns.files.ctgStoreLoad.err 2>&1

-- Finished on Fri Jan 16 01:31:21 2026 (one second) with 4559630.078 GB free disk space
----------------------------------------
----------------------------------------
-- Starting command on Fri Jan 16 01:31:21 2026 with 4559630.078 GB free disk space

    cd unitigging
    /share/org/YZWL/yzwl_lixg/miniforge3/envs/canu_v.2.3/bin/tgTigDisplay \
      -S ../41.seqStore \
      -b \
      -o ../41.contigs.unsorted.bam \
      -L ./5-consensus/ctgcns.files \
    > ./5-consensus/ctgcns.files.contigs.bam.err 2>&1

-- Finished on Fri Jan 16 01:34:06 2026 (165 seconds) with 4559898.421 GB free disk space
----------------------------------------
----------------------------------------
-- Starting command on Fri Jan 16 01:34:06 2026 with 4559898.421 GB free disk space

    cd .
    samtools sort \
      --write-index \
      --threads 2 \
      -o ./41.contigs.bam ./41.contigs.unsorted.bam \
    > ./ctgcns.bam.err 2>&1

-- Finished on Fri Jan 16 01:35:18 2026 (72 seconds) with 4560226.406 GB free disk space
----------------------------------------
-- Purging consensus output after loading to ctgStore.
-- Purged 11 .cns outputs.
----------------------------------------
-- Starting command on Fri Jan 16 01:35:18 2026 with 4560227.531 GB free disk space

    cd unitigging
    /share/org/YZWL/yzwl_lixg/miniforge3/envs/canu_v.2.3/bin/tgStoreDump \
      -S ../41.seqStore \
      -T ./41.ctgStore 2 \
      -sizes -s 85000000 \
    > ./41.ctgStore/seqDB.v002.sizes.txt
ZERO length suplied to intervalList::add(), ignoring interval.
ZERO length suplied to intervalList::add(), ignoring interval.
ZERO length suplied to intervalList::add(), ignoring interval.
ZERO length suplied to intervalList::add(), ignoring interval.
ZERO length suplied to intervalList::add(), ignoring interval.
ZERO length suplied to intervalList::add(), ignoring interval.
ZERO length suplied to intervalList::add(), ignoring interval.

-- Finished on Fri Jan 16 01:35:18 2026 (furiously fast) with 4560227.515 GB free disk space
----------------------------------------
-- Found, in version 2, after consensus generation:
--   contigs:      96 sequences, total length 89700397 bp (including 159 repeats of total length 7147300 bp).
--   bubbles:      260 sequences, total length 13988280 bp.
--   unassembled:  21413 sequences, total length 314332874 bp.
--
-- Contig sizes based on genome size 85mbp:
--
--            NG (bp)  LG (contigs)    sum (bp)
--         ----------  ------------  ----------
--     10    10435656             1    10435656
--     20     8106854             2    18542510
--     30     7581410             3    26123920
--     40     5894165             5    39542750
--     50     5726997             6    45269747
--     60     5046007             8    55535000
--     70     4329475             9    59864475
--     80     3196171            12    70622552
--     90     1857404            15    77700388
--    100      556657            21    85046962
--
-- Finished stage 'consensusLoad', reset canuIteration.
----------------------------------------
-- Starting command on Fri Jan 16 01:35:18 2026 with 4560227.5 GB free disk space

    cd .
    /share/org/YZWL/yzwl_lixg/miniforge3/envs/canu_v.2.3/bin/tgStoreDump \
      -S ./41.seqStore \
      -T ./unitigging/41.ctgStore 2 \
      -o ./41.contigs \
      -layout \
    > ./41.contigs.layout.err 2>&1

-- Finished on Fri Jan 16 01:35:19 2026 (one second) with 4560227.468 GB free disk space
----------------------------------------
----------------------------------------
-- Starting command on Fri Jan 16 01:35:19 2026 with 4560227.468 GB free disk space

    cd .
    /share/org/YZWL/yzwl_lixg/miniforge3/envs/canu_v.2.3/bin/tgStoreDump \
      -S ./41.seqStore \
      -T ./unitigging/41.ctgStore 2 \
      -consensus -fasta \
      -unassembled \
    > ./41.unassembled.fasta
    2> ./41.unassembled.err
ZERO length suplied to intervalList::add(), ignoring interval.
ZERO length suplied to intervalList::add(), ignoring interval.
ZERO length suplied to intervalList::add(), ignoring interval.
ZERO length suplied to intervalList::add(), ignoring interval.
ZERO length suplied to intervalList::add(), ignoring interval.
ZERO length suplied to intervalList::add(), ignoring interval.
ZERO length suplied to intervalList::add(), ignoring interval.

-- Finished on Fri Jan 16 01:35:20 2026 (one second) with 4560227.156 GB free disk space
----------------------------------------
----------------------------------------
-- Starting command on Fri Jan 16 01:35:20 2026 with 4560227.156 GB free disk space

    cd .
    /share/org/YZWL/yzwl_lixg/miniforge3/envs/canu_v.2.3/bin/tgStoreDump \
      -S ./41.seqStore \
      -T ./unitigging/41.ctgStore 2 \
      -consensus -fasta \
      -contigs \
    > ./41.contigs.fasta
    2> ./41.contigs.err
ZERO length suplied to intervalList::add(), ignoring interval.
ZERO length suplied to intervalList::add(), ignoring interval.
ZERO length suplied to intervalList::add(), ignoring interval.
ZERO length suplied to intervalList::add(), ignoring interval.
ZERO length suplied to intervalList::add(), ignoring interval.
ZERO length suplied to intervalList::add(), ignoring interval.
ZERO length suplied to intervalList::add(), ignoring interval.

-- Finished on Fri Jan 16 01:35:21 2026 (one second) with 4560227.046 GB free disk space
----------------------------------------
-- Finished stage 'generateOutputs', reset canuIteration.
--
-- Assembly '41' finished in '/share/org/YZWL/yzwl_lixg/project/28.大豆疫霉菌三代基因组/03.hicanu/41/01.raw_output'.
--
-- Summary saved in '41.report'.
--
-- Sequences saved:
--   Contigs       -> '41.contigs.fasta'
--   Unassembled   -> '41.unassembled.fasta'
--
-- Read layouts saved:
--   Contigs       -> '41.contigs.layout'.
--
-- Bye.

2026-01-16 01:35:21.502 - WARNING - 输出文件不存在|Output file does not exist: /share/org/YZWL/yzwl_lixg/project/28.大豆疫霉菌三代基因组/03.hicanu/41/01.raw_output/41.unitigs.fasta
Usage: biopytools ragtag [OPTIONS]
Try 'biopytools ragtag -h' for help.

Error: Invalid value for '-r' / '--reference': 文件不存在|File does not exist: /share/org/YZWL/yzwl_lixg/project/28.大豆疫霉菌三代基因组/04.ragtag/Psoja_T2T.fa
Usage: biopytools genomesyn [OPTIONS]
Try 'biopytools genomesyn -h' for help.

Error: Invalid value for '-i' / '--ref': Path '04.ragtag/41/hicanu/41_RagTag_scaffolded.fa' does not exist.
Job 68886681 stderr output:

