Usage: biopytools ragtag [OPTIONS]
Try 'biopytools ragtag -h' for help.

Error: Invalid value for '-r' / '--reference': 文件不存在|File does not exist: /share/org/YZWL/yzwl_lixg/project/28.大豆疫霉菌三代基因组/04.ragtag/Psoja_T2T.fa
Usage: biopytools genomesyn [OPTIONS]
Try 'biopytools genomesyn -h' for help.

Error: Invalid value for '-i' / '--ref': Path '04.ragtag/A2-1/hifiasm/A2-1_RagTag_scaffolded.fa' does not exist.
2026-01-16 00:59:50.350 - WARNING - 命令错误输出|Command stderr:
-- canu master +27 changes (r10515 2a41e933b8de6ed66723d75d36dd071b46d2c347)
--
-- CITATIONS
--
-- For assemblies of PacBio HiFi reads:
--   Nurk S, Walenz BP, Rhiea A, Vollger MR, Logsdon GA, Grothe R, Miga KH, Eichler EE, Phillippy AM, Koren S.
--   HiCanu: accurate assembly of segmental duplications, satellites, and allelic variants from high-fidelity long reads.
--   biorXiv. 2020.
--   https://doi.org/10.1101/2020.03.14.992248
-- 
-- Read and contig alignments during correction and consensus use:
--   Šošic M, Šikic M.
--   Edlib: a C/C ++ library for fast, exact sequence alignment using edit distance.
--   Bioinformatics. 2017 May 1;33(9):1394-1395.
--   http://doi.org/10.1093/bioinformatics/btw753
-- 
-- Overlaps are generated using:
--   Berlin K, et al.
--   Assembling large genomes with single-molecule sequencing and locality-sensitive hashing.
--   Nat Biotechnol. 2015 Jun;33(6):623-30.
--   http://doi.org/10.1038/nbt.3238
-- 
--   Myers EW, et al.
--   A Whole-Genome Assembly of Drosophila.
--   Science. 2000 Mar 24;287(5461):2196-204.
--   http://doi.org/10.1126/science.287.5461.2196
-- 
-- Contig consensus sequences are generated using an algorithm derived from pbdagcon:
--   Chin CS, et al.
--   Nonhybrid, finished microbial genome assemblies from long-read SMRT sequencing data.
--   Nat Methods. 2013 Jun;10(6):563-9
--   http://doi.org/10.1038/nmeth.2474
-- 
-- CONFIGURE CANU
--
-- Detected Java(TM) Runtime Environment '17.0.15-internal' (from '/share/org/YZWL/yzwl_lixg/.local/bin/java') without -d64 support.
--
-- WARNING:
-- WARNING:  Failed to run gnuplot using command 'gnuplot'.
-- WARNING:  Plots will be disabled.
-- WARNING:
--
-- Detected samtools version '1.22' / htslib version 'htscodecs=1.6.3' (from 'samtools').
--
-- Detected 88 CPUs and 503 gigabytes of memory on the local machine.
--
-- Detected Slurm with 'sinfo' binary in /opt/skyformai/bin/sinfo.
--          Slurm disabled by useGrid=false
--
-- Detected  '' with 'pbsnodes' binary in /opt/skyformai/bin/pbsnodes.
--           disabled by useGrid=false
--
-- Detected LSF with 'bsub' binary in /opt/skyformai/bin/bsub.
--          LSF disabled by useGrid=false
--
-- Local machine mode enabled; grid support not detected or not allowed.
--
-- Found trimmed raw PacBio HiFi reads in the input files.
--
--                                (tag)Concurrency
--                         (tag)Threads          |
--                (tag)Memory         |          |
--        (tag)             |         |          |       total usage      algorithm
--        -------  ----------  --------   --------  --------------------  -----------------------------
-- Local: meryl     12.000 GB    4 CPUs x  22 jobs   264.000 GB  88 CPUs  (k-mer counting)
-- Local: cormhap   13.000 GB   11 CPUs x   8 jobs   104.000 GB  88 CPUs  (overlap detection with mhap)
-- Local: obtovl     8.000 GB    8 CPUs x  11 jobs    88.000 GB  88 CPUs  (overlap detection)
-- Local: utgovl     8.000 GB    8 CPUs x  11 jobs    88.000 GB  88 CPUs  (overlap detection)
-- Local: cor        -.--- GB    4 CPUs x   - jobs     -.--- GB   - CPUs  (read correction)
-- Local: ovb        4.000 GB    1 CPU  x  88 jobs   352.000 GB  88 CPUs  (overlap store bucketizer)
-- Local: ovs        8.000 GB    1 CPU  x  62 jobs   496.000 GB  62 CPUs  (overlap store sorting)
-- Local: red       16.000 GB    4 CPUs x  22 jobs   352.000 GB  88 CPUs  (read error detection)
-- Local: oea        8.000 GB    1 CPU  x  62 jobs   496.000 GB  62 CPUs  (overlap error adjustment)
-- Local: bat       32.000 GB    8 CPUs x   1 job     32.000 GB   8 CPUs  (contig construction with bogart)
-- Local: cns        -.--- GB    8 CPUs x   - jobs     -.--- GB   - CPUs  (consensus)
--
-- Generating assembly 'A2-1' in '/share/org/YZWL/yzwl_lixg/project/28.大豆疫霉菌三代基因组/03.hicanu/A2-1/01.raw_output':
--   genomeSize:
--     85000000
--
--   Overlap Generation Limits:
--     corOvlErrorRate 0.0000 (  0.00%)
--     obtOvlErrorRate 0.0250 (  2.50%)
--     utgOvlErrorRate 0.0100 (  1.00%)
--
--   Overlap Processing Limits:
--     corErrorRate    0.0000 (  0.00%)
--     obtErrorRate    0.0250 (  2.50%)
--     utgErrorRate    0.0003 (  0.03%)
--     cnsErrorRate    0.0500 (  5.00%)
--
--   Stages to run:
--     assemble HiFi reads.
--
--
-- BEGIN STORE CREATION
----------------------------------------
-- Starting command on Thu Jan 15 23:37:21 2026 with 4569177.468 GB free disk space

    cd .
    ./A2-1.seqStore.sh \
    > ./A2-1.seqStore.err 2>&1

-- Finished on Thu Jan 15 23:43:51 2026 (390 seconds) with 4567812.093 GB free disk space
----------------------------------------
--
-- In sequence store './A2-1.seqStore':
--   Found 251890 reads.
--   Found 4250002882 bases (50 times coverage).
--    Histogram of corrected reads:
--    
--    G=4250002882                       sum of  ||               length     num
--    NG         length     index       lengths  ||                range    seqs
--    ----- ------------ --------- ------------  ||  ------------------- -------
--    00010        27044     14645    425024993  ||       1242-2590        10873|--------------------------
--    00020        25056     31017    850011384  ||       2591-3939        13973|---------------------------------
--    00030        23683     48484   1275022519  ||       3940-5288        11972|----------------------------
--    00040        22568     66878   1700014092  ||       5289-6637         9990|------------------------
--    00050        21554     86151   2125017870  ||       6638-7986         8526|--------------------
--    00060        20555    106337   2550003984  ||       7987-9335         7257|-----------------
--    00070        19429    127583   2975013437  ||       9336-10684        6281|---------------
--    00080        17779    150344   3400013726  ||      10685-12033        5727|--------------
--    00090        11837    178101   3825007546  ||      12034-13382        4959|------------
--    00100         1242    251890   4250002882  ||      13383-14731        4563|-----------
--    001.000x              251890   4250002882  ||      14732-16080        5349|-------------
--                                               ||      16081-17429        8864|---------------------
--                                               ||      17430-18778       15686|-------------------------------------
--                                               ||      18779-20127       23162|-------------------------------------------------------
--                                               ||      20128-21476       27008|---------------------------------------------------------------
--                                               ||      21477-22825       25404|------------------------------------------------------------
--                                               ||      22826-24174       20781|-------------------------------------------------
--                                               ||      24175-25523       15137|------------------------------------
--                                               ||      25524-26872       10639|-------------------------
--                                               ||      26873-28221        6998|-----------------
--                                               ||      28222-29570        4342|-----------
--                                               ||      29571-30919        2453|------
--                                               ||      30920-32268        1196|---
--                                               ||      32269-33617         487|--
--                                               ||      33618-34966         181|-
--                                               ||      34967-36315          59|-
--                                               ||      36316-37664          13|-
--                                               ||      37665-39013           5|-
--                                               ||      39014-40362           0|
--                                               ||      40363-41711           0|
--                                               ||      41712-43060           0|
--                                               ||      43061-44409           2|-
--                                               ||      44410-45758           1|-
--                                               ||      45759-47107           0|
--                                               ||      47108-48456           0|
--                                               ||      48457-49805           0|
--                                               ||      49806-51154           0|
--                                               ||      51155-52503           0|
--                                               ||      52504-53852           0|
--                                               ||      53853-55201           2|-
--    
--
-- In sequence store './A2-1.seqStore':
--   Found 251890 reads.
--   Found 4250002882 bases (50 times coverage).
--    Histogram of corrected-trimmed reads:
--    
--    G=4250002882                       sum of  ||               length     num
--    NG         length     index       lengths  ||                range    seqs
--    ----- ------------ --------- ------------  ||  ------------------- -------
--    00010        27044     14645    425024993  ||       1242-2590        10873|--------------------------
--    00020        25056     31017    850011384  ||       2591-3939        13973|---------------------------------
--    00030        23683     48484   1275022519  ||       3940-5288        11972|----------------------------
--    00040        22568     66878   1700014092  ||       5289-6637         9990|------------------------
--    00050        21554     86151   2125017870  ||       6638-7986         8526|--------------------
--    00060        20555    106337   2550003984  ||       7987-9335         7257|-----------------
--    00070        19429    127583   2975013437  ||       9336-10684        6281|---------------
--    00080        17779    150344   3400013726  ||      10685-12033        5727|--------------
--    00090        11837    178101   3825007546  ||      12034-13382        4959|------------
--    00100         1242    251890   4250002882  ||      13383-14731        4563|-----------
--    001.000x              251890   4250002882  ||      14732-16080        5349|-------------
--                                               ||      16081-17429        8864|---------------------
--                                               ||      17430-18778       15686|-------------------------------------
--                                               ||      18779-20127       23162|-------------------------------------------------------
--                                               ||      20128-21476       27008|---------------------------------------------------------------
--                                               ||      21477-22825       25404|------------------------------------------------------------
--                                               ||      22826-24174       20781|-------------------------------------------------
--                                               ||      24175-25523       15137|------------------------------------
--                                               ||      25524-26872       10639|-------------------------
--                                               ||      26873-28221        6998|-----------------
--                                               ||      28222-29570        4342|-----------
--                                               ||      29571-30919        2453|------
--                                               ||      30920-32268        1196|---
--                                               ||      32269-33617         487|--
--                                               ||      33618-34966         181|-
--                                               ||      34967-36315          59|-
--                                               ||      36316-37664          13|-
--                                               ||      37665-39013           5|-
--                                               ||      39014-40362           0|
--                                               ||      40363-41711           0|
--                                               ||      41712-43060           0|
--                                               ||      43061-44409           2|-
--                                               ||      44410-45758           1|-
--                                               ||      45759-47107           0|
--                                               ||      47108-48456           0|
--                                               ||      48457-49805           0|
--                                               ||      49806-51154           0|
--                                               ||      51155-52503           0|
--                                               ||      52504-53852           0|
--                                               ||      53853-55201           2|-
--    
--
-- Correction skipped; not enabled.
--
-- Trimming skipped; not enabled.
--
-- BEGIN ASSEMBLY
----------------------------------------
-- Starting command on Thu Jan 15 23:43:52 2026 with 4567812.046 GB free disk space

    cd unitigging/0-mercounts
    ./meryl-configure.sh \
    > ./meryl-configure.err 2>&1

-- Finished on Thu Jan 15 23:43:54 2026 (2 seconds) with 4567812.046 GB free disk space
----------------------------------------
--  segments   memory batches
--  -------- -------- -------
--        01 10.81 GB       2
--        02  5.61 GB       2
--        04  2.97 GB       2
--        06  2.15 GB       2
--        08  1.61 GB       2
--        12  1.07 GB       2
--        16  0.81 GB       2
--        20  0.65 GB       2
--        24  0.54 GB       2
--        32  0.41 GB       2
--        40  0.33 GB       2
--        48  -.-- GB       -  (segment size too small)
--        56  -.-- GB       -  (segment size too small)
--        64  -.-- GB       -  (segment size too small)
--        96  -.-- GB       -  (segment size too small)
--
--  For 251890 reads with 4250002882 bases, limit to 42 batches.
--  Will count kmers using 01 jobs, each using 12 GB and 4 threads.
--
-- Finished stage 'merylConfigure', reset canuIteration.
--
-- Running jobs.  First attempt out of 2.
----------------------------------------
-- Starting 'meryl' concurrent execution on Thu Jan 15 23:43:54 2026 with 4567812.015 GB free disk space (1 processes; 22 concurrently)

    cd unitigging/0-mercounts
    ./meryl-count.sh 1 > ./meryl-count.000001.out 2>&1

-- Finished on Thu Jan 15 23:47:17 2026 (203 seconds) with 4567161.796 GB free disk space
----------------------------------------
-- Found 1 Kmer counting (meryl) outputs.
-- Finished stage 'utg-merylCountCheck', reset canuIteration.
--
-- Running jobs.  First attempt out of 2.
----------------------------------------
-- Starting 'meryl' concurrent execution on Thu Jan 15 23:47:17 2026 with 4567161.765 GB free disk space (1 processes; 22 concurrently)

    cd unitigging/0-mercounts
    ./meryl-process.sh 1 > ./meryl-process.000001.out 2>&1

-- Finished on Thu Jan 15 23:47:23 2026 (6 seconds) with 4567162.359 GB free disk space
----------------------------------------
-- Meryl finished successfully.  Kmer frequency histogram:
--
-- WARNING: gnuplot failed.
--
----------------------------------------
--
--  22-mers                                                                                           Fraction
--    Occurrences   NumMers                                                                         Unique Total
--       1-     1         0                                                                        0.0000 0.0000
--       2-     2    336550 *                                                                      0.0075 0.0002
--       3-     4    101688                                                                        0.0091 0.0003
--       5-     7     29883                                                                        0.0101 0.0004
--       8-    11      9908                                                                        0.0105 0.0004
--      12-    16      9530                                                                        0.0106 0.0004
--      17-    22     93266                                                                        0.0109 0.0005
--      23-    29    517330 **                                                                     0.0136 0.0012
--      30-    37   3865339 ****************                                                       0.0283 0.0070
--      38-    46  13613861 *********************************************************              0.1327 0.0589
--      47-    56  16699396 ********************************************************************** 0.4560 0.2553
--      57-    67   4835095 ********************                                                   0.8046 0.5084
--      68-    79    653885 **                                                                     0.8925 0.5834
--      80-    92    910260 ***                                                                    0.9062 0.5977
--      93-   106    905442 ***                                                                    0.9269 0.6229
--     107-   121    394821 *                                                                      0.9462 0.6499
--     122-   137    256082 *                                                                      0.9544 0.6628
--     138-   154    276310 *                                                                      0.9602 0.6735
--     155-   172    157622                                                                        0.9661 0.6857
--     173-   191    161506                                                                        0.9695 0.6934
--     192-   211    137286                                                                        0.9732 0.7027
--     212-   232    105913                                                                        0.9761 0.7111
--     233-   254    100178                                                                        0.9785 0.7185
--     255-   277     94056                                                                        0.9807 0.7260
--     278-   301     67376                                                                        0.9828 0.7337
--     302-   326     64252                                                                        0.9842 0.7397
--     327-   352     59949                                                                        0.9856 0.7459
--     353-   379     46787                                                                        0.9870 0.7523
--     380-   407     48073                                                                        0.9880 0.7576
--     408-   436     36117                                                                        0.9891 0.7634
--     437-   466     32092                                                                        0.9899 0.7682
--     467-   497     30146                                                                        0.9906 0.7726
--     498-   529     26054                                                                        0.9912 0.7771
--     530-   562     24181                                                                        0.9918 0.7812
--     563-   596     22128                                                                        0.9924 0.7853
--     597-   631     20256                                                                        0.9928 0.7893
--     632-   667     20525                                                                        0.9933 0.7932
--     668-   704     18540                                                                        0.9937 0.7973
--     705-   742     15252                                                                        0.9942 0.8012
--     743-   781     12565                                                                        0.9945 0.8046
--     782-   821     12888                                                                        0.9948 0.8076
--
--           0 (max occurrences)
--  3219222196 (total mers, non-unique)
--    45045368 (distinct mers, non-unique)
--           0 (unique mers)
-- Finished stage 'meryl-process', reset canuIteration.
--
-- Removing meryl database 'unitigging/0-mercounts/A2-1.ms22'.
--
-- OVERLAPPER (normal) (assembly) erate=0.01
--
----------------------------------------
-- Starting command on Thu Jan 15 23:47:23 2026 with 4567162.343 GB free disk space

    cd unitigging/1-overlapper
    /share/org/YZWL/yzwl_lixg/miniforge3/envs/canu_v.2.3/bin/overlapInCorePartition \
     -S  ../../A2-1.seqStore \
     -hl 160000000 \
     -rl 5000000000 \
     -ol 500 \
     -o  ./A2-1.partition \
    > ./A2-1.partition.err 2>&1

-- Finished on Thu Jan 15 23:47:23 2026 (in the blink of an eye) with 4567162.328 GB free disk space
----------------------------------------
--
-- Configured 21 overlapInCore jobs.
-- Finished stage 'utg-overlapConfigure', reset canuIteration.
--
-- Running jobs.  First attempt out of 2.
----------------------------------------
-- Starting 'utgovl' concurrent execution on Thu Jan 15 23:47:23 2026 with 4567162.296 GB free disk space (21 processes; 11 concurrently)

    cd unitigging/1-overlapper
    ./overlap.sh 1 > ./overlap.000001.out 2>&1
    ./overlap.sh 2 > ./overlap.000002.out 2>&1
    ./overlap.sh 3 > ./overlap.000003.out 2>&1
    ./overlap.sh 4 > ./overlap.000004.out 2>&1
    ./overlap.sh 5 > ./overlap.000005.out 2>&1
    ./overlap.sh 6 > ./overlap.000006.out 2>&1
    ./overlap.sh 7 > ./overlap.000007.out 2>&1
    ./overlap.sh 8 > ./overlap.000008.out 2>&1
    ./overlap.sh 9 > ./overlap.000009.out 2>&1
    ./overlap.sh 10 > ./overlap.000010.out 2>&1
    ./overlap.sh 11 > ./overlap.000011.out 2>&1
    ./overlap.sh 12 > ./overlap.000012.out 2>&1
    ./overlap.sh 13 > ./overlap.000013.out 2>&1
    ./overlap.sh 14 > ./overlap.000014.out 2>&1
    ./overlap.sh 15 > ./overlap.000015.out 2>&1
    ./overlap.sh 16 > ./overlap.000016.out 2>&1
    ./overlap.sh 17 > ./overlap.000017.out 2>&1
    ./overlap.sh 18 > ./overlap.000018.out 2>&1
    ./overlap.sh 19 > ./overlap.000019.out 2>&1
    ./overlap.sh 20 > ./overlap.000020.out 2>&1
    ./overlap.sh 21 > ./overlap.000021.out 2>&1

-- Finished on Fri Jan 16 00:12:36 2026 (1513 seconds) with 4565411.937 GB free disk space
----------------------------------------
-- Found 21 overlapInCore output files.
--
-- overlapInCore compute 'unitigging/1-overlapper':
--   kmer hits
--     with no overlap       1321628179  75.1904762 +- 38609189.643
--     with an overlap         25952473  2.04761905 +- 705861.992
--
--   overlaps                  25952473  2.04761905 +- 705861.992
--     contained                6716885  .666666667 +- 183569.484
--     dovetail                19235588  .380952381 +- 529419.091
--
--   overlaps rejected
--     multiple per pair              0           0 +- 0
--     bad short window               0           0 +- 0
--     bad long window                0           0 +- 0
-- Finished stage 'utg-overlapCheck', reset canuIteration.
----------------------------------------
-- Starting command on Fri Jan 16 00:12:36 2026 with 4565411.921 GB free disk space

    cd unitigging
    /share/org/YZWL/yzwl_lixg/miniforge3/envs/canu_v.2.3/bin/ovStoreConfig \
     -S ../A2-1.seqStore \
     -M 4-8 \
     -L ./1-overlapper/ovljob.files \
     -create ./A2-1.ovlStore.config \
     > ./A2-1.ovlStore.config.txt \
    2> ./A2-1.ovlStore.config.err

-- Finished on Fri Jan 16 00:12:36 2026 (lickety-split) with 4565411.906 GB free disk space
----------------------------------------
--
-- Creating overlap store unitigging/A2-1.ovlStore using:
--      1 bucket
--      1 slice
--        using at most 2 GB memory each
--
-- Running jobs.  First attempt out of 2.
----------------------------------------
-- Starting 'ovS' concurrent execution on Fri Jan 16 00:12:36 2026 with 4565411.89 GB free disk space (1 processes; 62 concurrently)

    cd unitigging
    ./A2-1.ovlStore.sh 1 > ./A2-1.ovlStore.000001.out 2>&1

-- Finished on Fri Jan 16 00:12:47 2026 (11 seconds) with 4565410.734 GB free disk space
----------------------------------------
-- Checking store.
----------------------------------------
-- Starting command on Fri Jan 16 00:12:47 2026 with 4565410.734 GB free disk space

    cd unitigging
    /share/org/YZWL/yzwl_lixg/miniforge3/envs/canu_v.2.3/bin/ovStoreDump \
     -S ../A2-1.seqStore \
     -O  ./A2-1.ovlStore \
     -counts \
     > ./A2-1.ovlStore/counts.dat 2> ./A2-1.ovlStore/counts.err

-- Finished on Fri Jan 16 00:12:47 2026 (furiously fast) with 4565410.703 GB free disk space
----------------------------------------
--
-- Overlap store 'unitigging/A2-1.ovlStore' successfully constructed.
-- Found 51904946 overlaps for 248153 reads; 1235810 reads have no overlaps.
--
--
-- Purged 0.562 GB in 63 overlap output files.
----------------------------------------
-- Starting command on Fri Jan 16 00:12:48 2026 with 4565410.703 GB free disk space

    cd unitigging
    /share/org/YZWL/yzwl_lixg/miniforge3/envs/canu_v.2.3/bin/ovStoreStats \
     -C 50 \
     -S ../A2-1.seqStore \
     -O  ./A2-1.ovlStore \
     -o  ./A2-1.ovlStore \
     > ./A2-1.ovlStore.summary.err 2>&1

-- Finished on Fri Jan 16 00:12:55 2026 (7 seconds) with 4565410.687 GB free disk space
----------------------------------------
--
-- Overlap store 'unitigging/A2-1.ovlStore' contains:
--
--   category            reads     %          read length        feature size or coverage  analysis
--   ----------------  -------  -------  ----------------------  ------------------------  --------------------
--   middle-missing        115    0.05    15420.00 +- 7286.36        732.38 +- 1023.32    (bad trimming)
--   middle-hump             8    0.00    17797.62 +- 2440.77       4839.00 +- 2859.15    (bad trimming)
--   no-5-prime            474    0.19    12206.14 +- 6506.23       1068.76 +- 2174.72    (bad trimming)
--   no-3-prime            598    0.24     9954.10 +- 6734.34        901.01 +- 1920.28    (bad trimming)
--   
--   low-coverage          970    0.39     9531.43 +- 6330.98          6.11 +- 3.82       (easy to assemble, potential for lower quality consensus)
--   unique             209708   83.25    12998.08 +- 6168.02         47.29 +- 8.37       (easy to assemble, perfect, yay)
--   repeat-cont         15519    6.16    10468.95 +- 5636.90       1061.12 +- 769.47     (potential for consensus errors, no impact on assembly)
--   repeat-dove           268    0.11    20661.94 +- 1798.24        615.88 +- 562.83     (hard to assemble, likely won't assemble correctly or even at all)
--   
--   span-repeat          2309    0.92    14284.71 +- 5374.57       3281.84 +- 4000.55    (read spans a large repeat, usually easy to assemble)
--   uniq-repeat-cont    12285    4.88    13056.90 +- 5094.56                             (should be uniquely placed, low potential for consensus errors, no impact on assembly)
--   uniq-repeat-dove     2755    1.09    19379.24 +- 2850.38                             (will end contigs, potential to misassemble)
--   uniq-anchor          3144    1.25    14244.14 +- 5131.52       8365.33 +- 5407.50    (repeat read, with unique section, probable bad read)
-- Finished stage 'utg-createOverlapStore', reset canuIteration.
--
-- Loading read lengths.
-- Loading number of overlaps per read.
--
-- Configure RED for 16gb memory.
--                   Batches of at most (unlimited) reads.
--                                      500000000 bases.
--                   Expecting evidence of at most 536870912 bases per iteration.
--
--           Total                                               Reads                 Olaps Evidence
--    Job   Memory      Read Range         Reads        Bases   Memory        Olaps   Memory   Memory  (Memory in MB)
--   ---- -------- ------------------- --------- ------------ -------- ------------ -------- --------
--      1 16384.06         1-31307          5369    108950052 13299.74      1077183    12.33  1024.00
--      2 16385.13     31308-67618          6102    108964846 13301.56      1010649    11.57  1024.00
--      3 16384.17     67619-105734         6563    108939307 13298.46      1197452    13.70  1024.00
--      4 16386.69    105735-139185         5694    108931238 13297.45      1506312    17.24  1024.00
--      5 16387.14    139186-177206         6513    108977196 13303.09      1053350    12.05  1024.00
--      6 16385.02    177207-227088         8496    108897365 13293.40      1714013    19.62  1024.00
--      7 16384.84    227089-259940         5485    108929356 13297.21      1365841    15.63  1024.00
--      8 16385.00    259941-295676         6042    108936783 13298.14      1298633    14.86  1024.00
--      9 16384.97    295677-347806         8860    108890978 13292.63      1777179    20.34  1024.00
--     10 16385.71    347807-379493         5351    108971957 13302.41       987864    11.31  1024.00
--     11 16386.26    379494-413042         5709    108924435 13296.62      1541686    17.64  1024.00
--     12 16384.32    413043-455833         7278    108953177 13300.18      1060692    12.14  1024.00
--     13 16386.19    455834-496173         6909    108938360 13298.36      1383626    15.83  1024.00
--     14 16385.09    496174-529553         5529    108917941 13295.82      1508920    17.27  1024.00
--     15 16384.56    529554-566354         6283    108951836 13299.98      1098712    12.57  1024.00
--     16 16386.47    566355-613939         8004    108927224 13297.03      1523648    17.44  1024.00
--     17 16385.54    613940-646270         5443    108927493 13296.98      1446697    16.56  1024.00
--     18 16385.15    646271-680712         5905    108945366 13299.18      1220818    13.97  1024.00
--     19 16384.15    680713-730957         8481    108887280 13292.17      1745342    19.97  1024.00
--     20 16384.52    730958-762418         5350    108970882 13302.28       894956    10.24  1024.00
--     21 16384.37    762419-796505         5683    108912225 13295.13      1506209    17.24  1024.00
--     22 16385.94    796506-838306         6986    108966173 13301.75      1064532    12.18  1024.00
--     23 16384.97    838307-878234         6854    108936924 13298.18      1291944    14.79  1024.00
--     24 16385.00    878235-910866         5613    108909548 13294.80      1590640    18.20  1024.00
--     25 16386.46    910867-948754         6400    108967390 13301.88      1098558    12.57  1024.00
--     26 16386.28    948755-996421         8139    108910085 13294.94      1689353    19.33  1024.00
--     27 16384.61    996422-1028335        5451    108927510 13296.99      1365571    15.63  1024.00
--     28 16386.23   1028336-1063535        5921    108952110 13300.00      1243394    14.23  1024.00
--     29 16386.58   1063536-1112928        8329    108917219 13295.82      1638959    18.76  1024.00
--     30 16386.71   1112929-1144686        5352    108984708 13303.97       939049    10.75  1024.00
--     31 16385.28   1144687-1177955        5646    108909164 13294.75      1619157    18.53  1024.00
--     32 16384.50   1177956-1217572        6842    108967491 13301.91       925459    10.59  1024.00
--     33 16385.33   1217573-1257760        6833    108929718 13297.30      1400714    16.03  1024.00
--     34 16385.51   1257761-1289632        5438    108934397 13297.83      1370488    15.68  1024.00
--     35 16385.49   1289633-1324355        6011    108949494 13299.69      1205922    13.80  1024.00
--     36 16387.18   1324356-1370093        7763    108930345 13297.41      1553103    17.77  1024.00
--     37 16385.36   1370094-1402160        5394    108942913 13298.87      1266840    14.50  1024.00
--     38 16384.41   1402161-1436100        5739    108941033 13298.65      1202831    13.77  1024.00
--     39 16385.72   1436101-1483342        8020    108922613 13296.47      1507221    17.25  1024.00
--     40  3250.20   1483343-1483963         110      1458750   178.07        11429     0.13  1024.00
--   ---- -------- ------------------- --------- ------------ -------- ------------ -------- --------
--                                                 4250002882              51904946
-- Finished stage 'readErrorDetectionConfigure', reset canuIteration.
--
-- Running jobs.  First attempt out of 2.
----------------------------------------
-- Starting 'red' concurrent execution on Fri Jan 16 00:13:01 2026 with 4565410.64 GB free disk space (40 processes; 22 concurrently)

    cd unitigging/3-overlapErrorAdjustment
    ./red.sh 1 > ./red.000001.out 2>&1
    ./red.sh 2 > ./red.000002.out 2>&1
    ./red.sh 3 > ./red.000003.out 2>&1
    ./red.sh 4 > ./red.000004.out 2>&1
    ./red.sh 5 > ./red.000005.out 2>&1
    ./red.sh 6 > ./red.000006.out 2>&1
    ./red.sh 7 > ./red.000007.out 2>&1
    ./red.sh 8 > ./red.000008.out 2>&1
    ./red.sh 9 > ./red.000009.out 2>&1
    ./red.sh 10 > ./red.000010.out 2>&1
    ./red.sh 11 > ./red.000011.out 2>&1
    ./red.sh 12 > ./red.000012.out 2>&1
    ./red.sh 13 > ./red.000013.out 2>&1
    ./red.sh 14 > ./red.000014.out 2>&1
    ./red.sh 15 > ./red.000015.out 2>&1
    ./red.sh 16 > ./red.000016.out 2>&1
    ./red.sh 17 > ./red.000017.out 2>&1
    ./red.sh 18 > ./red.000018.out 2>&1
    ./red.sh 19 > ./red.000019.out 2>&1
    ./red.sh 20 > ./red.000020.out 2>&1
    ./red.sh 21 > ./red.000021.out 2>&1
    ./red.sh 22 > ./red.000022.out 2>&1
    ./red.sh 23 > ./red.000023.out 2>&1
    ./red.sh 24 > ./red.000024.out 2>&1
    ./red.sh 25 > ./red.000025.out 2>&1
    ./red.sh 26 > ./red.000026.out 2>&1
    ./red.sh 27 > ./red.000027.out 2>&1
    ./red.sh 28 > ./red.000028.out 2>&1
    ./red.sh 29 > ./red.000029.out 2>&1
    ./red.sh 30 > ./red.000030.out 2>&1
    ./red.sh 31 > ./red.000031.out 2>&1
    ./red.sh 32 > ./red.000032.out 2>&1
    ./red.sh 33 > ./red.000033.out 2>&1
    ./red.sh 34 > ./red.000034.out 2>&1
    ./red.sh 35 > ./red.000035.out 2>&1
    ./red.sh 36 > ./red.000036.out 2>&1
    ./red.sh 37 > ./red.000037.out 2>&1
    ./red.sh 38 > ./red.000038.out 2>&1
    ./red.sh 39 > ./red.000039.out 2>&1
    ./red.sh 40 > ./red.000040.out 2>&1

-- Finished on Fri Jan 16 00:24:17 2026 (676 seconds) with 4564359.64 GB free disk space
----------------------------------------
-- Found 40 read error detection output files.
-- Finished stage 'readErrorDetectionCheck', reset canuIteration.
--
-- Loading read lengths.
-- Loading number of overlaps per read.
--
-- Configure OEA for 8gb memory.
--                   Batches of at most (unlimited) reads.
--                                      300000000 bases.
--
--           Total                                               Reads                 Olaps  Adjusts
--    Job   Memory      Read Range         Reads        Bases   Memory        Olaps   Memory   Memory  (Memory in MB)
--   ---- -------- ------------------- --------- ------------ -------- ------------ -------- --------
--      1  2806.65         1-98068         16677    300014927   294.63      3131856    95.58   368.45
--      2  2835.22     98069-209932        19148    300004959   294.69      4065812   124.08   368.45
--      3  2808.71    209933-305948        16234    300004096   294.60      3200107    97.66   368.45
--      4  2837.49    305949-413577        18217    300004982   294.66      4141389   126.39   368.45
--      5  2821.15    413578-521433        18306    300019824   294.68      3605184   110.02   368.45
--      6  2822.65    521434-630790        18438    300016103   294.68      3654363   111.52   368.45
--      7  2829.69    630791-739136        18452    300019545   294.68      3884990   118.56   368.45
--      8  2812.76    739137-840952        17001    300006052   294.63      3332210   101.69   368.45
--      9  2825.92    840953-939719        16910    300017316   294.63      3763180   114.84   368.45
--     10  2835.49    939720-1046650       18214    300004070   294.66      4075665   124.38   368.45
--     11  2821.15   1046651-1154161       18118    300005522   294.66      3605908   110.04   368.45
--     12  2813.45   1154162-1259199       17951    300015849   294.67      3353424   102.34   368.45
--     13  2832.74   1259200-1363866       17922    300009311   294.66      3985840   121.64   368.45
--     14  2802.31   1363867-1457064       15790    300002064   294.59      2990884    91.27   368.45
--     15  2506.13   1457065-1483963        4512     49858262    55.69      1114134    34.00   368.45
--   ---- -------- ------------------- --------- ------------ -------- ------------ -------- --------
--                                                 4250002882              51904946
-- Finished stage 'overlapErrorAdjustmentConfigure', reset canuIteration.
--
-- Running jobs.  First attempt out of 2.
----------------------------------------
-- Starting 'oea' concurrent execution on Fri Jan 16 00:24:23 2026 with 4564359.562 GB free disk space (15 processes; 62 concurrently)

    cd unitigging/3-overlapErrorAdjustment
    ./oea.sh 1 > ./oea.000001.out 2>&1
    ./oea.sh 2 > ./oea.000002.out 2>&1
    ./oea.sh 3 > ./oea.000003.out 2>&1
    ./oea.sh 4 > ./oea.000004.out 2>&1
    ./oea.sh 5 > ./oea.000005.out 2>&1
    ./oea.sh 6 > ./oea.000006.out 2>&1
    ./oea.sh 7 > ./oea.000007.out 2>&1
    ./oea.sh 8 > ./oea.000008.out 2>&1
    ./oea.sh 9 > ./oea.000009.out 2>&1
    ./oea.sh 10 > ./oea.000010.out 2>&1
    ./oea.sh 11 > ./oea.000011.out 2>&1
    ./oea.sh 12 > ./oea.000012.out 2>&1
    ./oea.sh 13 > ./oea.000013.out 2>&1
    ./oea.sh 14 > ./oea.000014.out 2>&1
    ./oea.sh 15 > ./oea.000015.out 2>&1

-- Finished on Fri Jan 16 00:48:28 2026 (1445 seconds) with 4560156.437 GB free disk space
----------------------------------------
-- Found 15 overlap error adjustment output files.
-- Finished stage 'overlapErrorAdjustmentCheck', reset canuIteration.
----------------------------------------
-- Starting command on Fri Jan 16 00:48:28 2026 with 4560156.421 GB free disk space

    cd unitigging/3-overlapErrorAdjustment
    /share/org/YZWL/yzwl_lixg/miniforge3/envs/canu_v.2.3/bin/loadErates \
      -S ../../A2-1.seqStore \
      -O ../A2-1.ovlStore \
      -L ./oea.files \
    > ./oea.apply.err 2>&1

-- Finished on Fri Jan 16 00:48:28 2026 (lickety-split) with 4560156.312 GB free disk space
----------------------------------------
-- No report available.
-- Finished stage 'updateOverlapStore', reset canuIteration.
-- Finished stage 'unitig', reset canuIteration.
--
-- Running jobs.  First attempt out of 2.
----------------------------------------
-- Starting 'bat' concurrent execution on Fri Jan 16 00:48:28 2026 with 4560156.265 GB free disk space (1 processes; 1 concurrently)

    cd unitigging/4-unitigger
    ./unitigger.sh 1 > ./unitigger.000001.out 2>&1

-- Finished on Fri Jan 16 00:48:43 2026 (15 seconds) with 4560153.468 GB free disk space
----------------------------------------
-- Unitigger finished successfully.
--  
--  ERROR RATES
--  -----------
--                                                   --------threshold------
--  281942                       fraction error      fraction        percent
--  samples                              (1e-5)         error          error
--                   --------------------------      --------       --------
--  command line (-eg)                           ->     30.00        0.0300%
--  command line (-ef)                           ->  -----.--      ---.----%
--  command line (-eM)                           ->     30.00        0.0300%
--  mean + std.dev       0.38 +-  12 *     2.81  ->     34.14        0.0341%
--  median + mad         0.00 +-  12 *     0.00  ->      0.00        0.0000%
--  90th percentile                              ->      1.00        0.0010%  (enabled)
--  
--  BEST EDGE FILTERING
--  -------------------
--  At graph threshold 0.0300%, reads:
--    available to have edges:        43999
--    with at least one edge:         39007
--  
--  At max threshold 0.0300%, reads:  (not computed)
--    available to have edges:            0
--    with at least one edge:             0
--  
--  At tight threshold 0.0010%, reads with:
--    both edges below error threshold:     34389  (80.00% minReadsBest threshold = 31205)
--    one  edge  above error threshold:      3315
--    both edges above error threshold:      1303
--    at least one edge:                    39007
--  
--  At loose threshold 0.0300%, reads with:
--    both edges below error threshold:     39007  (80.00% minReadsBest threshold = 31205)
--    one  edge  above error threshold:         0
--    both edges above error threshold:         0
--    at least one edge:                    39007
--  
--  
--  INITIAL EDGES
--  -------- ----------------------------------------
--    202567 reads are contained
--   1248092 reads have no best edges (singleton)
--       317 reads have only one best edge (spur) 
--                152 are mutual best
--     32987 reads have two best edges 
--                838 have one mutual best edge
--              31729 have two mutual best edges
--  
--  
--  FINAL EDGES
--  -------- ----------------------------------------
--    202567 reads are contained
--   1248460 reads have no best edges (singleton)
--       194 reads have only one best edge (spur) 
--                162 are mutual best
--     32742 reads have two best edges 
--                696 have one mutual best edge
--              31730 have two mutual best edges
--  
--  
--  EDGE FILTERING
--  -------- ------------------------------------------
--         0 reads are ignored
--     11051 reads have a gap in overlap coverage
--       167 reads have lopsided best edges
-- Found, in version 1, after unitig construction:
--   contigs:      159 sequences, total length 69166013 bp (including 187 repeats of total length 4046670 bp).
--   bubbles:      161 sequences, total length 4133724 bp.
--   unassembled:  16567 sequences, total length 205350028 bp.
--
-- Contig sizes based on genome size 85mbp:
--
--            NG (bp)  LG (contigs)    sum (bp)
--         ----------  ------------  ----------
--     10     6529069             2    13467809
--     20     5896192             3    19364001
--     30     3883570             5    27778404
--     40     3322394             7    34937252
--     50     2499601            10    43411394
--     60     1765532            14    51347882
--     70     1197271            20    59896767
--     80       20741            96    68013312
--
-- Finished stage 'unitigCheck', reset canuIteration.
----------------------------------------
-- Starting command on Fri Jan 16 00:48:43 2026 with 4560153.453 GB free disk space

    cd unitigging
    /share/org/YZWL/yzwl_lixg/miniforge3/envs/canu_v.2.3/bin/utgcns \
      -S ../A2-1.seqStore \
      -T  ./A2-1.ctgStore 1 \
      -partition 0.8 1.5 0.1 \
    > ./A2-1.ctgStore/partitioning.log 2>&1

-- Finished on Fri Jan 16 00:48:52 2026 (9 seconds) with 4560152.234 GB free disk space
----------------------------------------
-- Using slow alignment for consensus (iteration '0').
-- Configured 11 consensus jobs.
-- Finished stage 'consensusConfigure', reset canuIteration.
--
-- Local: cns       10.375 GB    8 CPUs x  11 jobs   114.125 GB  88 CPUs  (consensus)
--
--
-- Running jobs.  First attempt out of 2.
----------------------------------------
-- Starting 'cns' concurrent execution on Fri Jan 16 00:48:53 2026 with 4560152.203 GB free disk space (11 processes; 11 concurrently)

    cd unitigging/5-consensus
    ./consensus.sh 1 > ./consensus.000001.out 2>&1
    ./consensus.sh 2 > ./consensus.000002.out 2>&1
    ./consensus.sh 3 > ./consensus.000003.out 2>&1
    ./consensus.sh 4 > ./consensus.000004.out 2>&1
    ./consensus.sh 5 > ./consensus.000005.out 2>&1
    ./consensus.sh 6 > ./consensus.000006.out 2>&1
    ./consensus.sh 7 > ./consensus.000007.out 2>&1
    ./consensus.sh 8 > ./consensus.000008.out 2>&1
    ./consensus.sh 9 > ./consensus.000009.out 2>&1
    ./consensus.sh 10 > ./consensus.000010.out 2>&1
    ./consensus.sh 11 > ./consensus.000011.out 2>&1

-- Finished on Fri Jan 16 00:55:28 2026 (395 seconds) with 4559188.296 GB free disk space
----------------------------------------
-- Using slow alignment for consensus (iteration '1').
-- Configured 11 consensus jobs.
-- All 11 consensus jobs finished successfully.
-- Finished stage 'consensusCheck', reset canuIteration.
-- Using slow alignment for consensus (iteration '0').
-- Configured 11 consensus jobs.
----------------------------------------
-- Starting command on Fri Jan 16 00:55:28 2026 with 4559188.25 GB free disk space

    cd unitigging
    /share/org/YZWL/yzwl_lixg/miniforge3/envs/canu_v.2.3/bin/tgStoreLoad \
      -S ../A2-1.seqStore \
      -T  ./A2-1.ctgStore 2 \
      -L ./5-consensus/ctgcns.files \
    > ./5-consensus/ctgcns.files.ctgStoreLoad.err 2>&1

-- Finished on Fri Jan 16 00:55:29 2026 (one second) with 4559187.453 GB free disk space
----------------------------------------
----------------------------------------
-- Starting command on Fri Jan 16 00:55:29 2026 with 4559187.453 GB free disk space

    cd unitigging
    /share/org/YZWL/yzwl_lixg/miniforge3/envs/canu_v.2.3/bin/tgTigDisplay \
      -S ../A2-1.seqStore \
      -b \
      -o ../A2-1.contigs.unsorted.bam \
      -L ./5-consensus/ctgcns.files \
    > ./5-consensus/ctgcns.files.contigs.bam.err 2>&1

-- Finished on Fri Jan 16 00:58:13 2026 (164 seconds) with 4558815.125 GB free disk space
----------------------------------------
----------------------------------------
-- Starting command on Fri Jan 16 00:58:13 2026 with 4558815.125 GB free disk space

    cd .
    samtools sort \
      --write-index \
      --threads 2 \
      -o ./A2-1.contigs.bam ./A2-1.contigs.unsorted.bam \
    > ./ctgcns.bam.err 2>&1

-- Finished on Fri Jan 16 00:59:47 2026 (94 seconds) with 4558675.046 GB free disk space
----------------------------------------
-- Purging consensus output after loading to ctgStore.
-- Purged 11 .cns outputs.
----------------------------------------
-- Starting command on Fri Jan 16 00:59:47 2026 with 4558677.062 GB free disk space

    cd unitigging
    /share/org/YZWL/yzwl_lixg/miniforge3/envs/canu_v.2.3/bin/tgStoreDump \
      -S ../A2-1.seqStore \
      -T ./A2-1.ctgStore 2 \
      -sizes -s 85000000 \
    > ./A2-1.ctgStore/seqDB.v002.sizes.txt
ZERO length suplied to intervalList::add(), ignoring interval.
ZERO length suplied to intervalList::add(), ignoring interval.
ZERO length suplied to intervalList::add(), ignoring interval.
ZERO length suplied to intervalList::add(), ignoring interval.
ZERO length suplied to intervalList::add(), ignoring interval.
ZERO length suplied to intervalList::add(), ignoring interval.
ZERO length suplied to intervalList::add(), ignoring interval.
ZERO length suplied to intervalList::add(), ignoring interval.
ZERO length suplied to intervalList::add(), ignoring interval.
ZERO length suplied to intervalList::add(), ignoring interval.
ZERO length suplied to intervalList::add(), ignoring interval.
ZERO length suplied to intervalList::add(), ignoring interval.
ZERO length suplied to intervalList::add(), ignoring interval.

-- Finished on Fri Jan 16 00:59:47 2026 (furiously fast) with 4558677.062 GB free disk space
----------------------------------------
-- Found, in version 2, after consensus generation:
--   contigs:      159 sequences, total length 90285669 bp (including 187 repeats of total length 5520707 bp).
--   bubbles:      161 sequences, total length 5517117 bp.
--   unassembled:  16567 sequences, total length 281546424 bp.
--
-- Contig sizes based on genome size 85mbp:
--
--            NG (bp)  LG (contigs)    sum (bp)
--         ----------  ------------  ----------
--     10     9021343             1     9021343
--     20     8474887             2    17496230
--     30     5903781             4    31059125
--     40     5055309             5    36114434
--     50     4320914             7    45445672
--     60     3535191             9    53213574
--     70     2690381            12    62080738
--     80     2243531            15    69071542
--     90     1567660            20    77976135
--    100      570438            28    85294708
--
-- Finished stage 'consensusLoad', reset canuIteration.
----------------------------------------
-- Starting command on Fri Jan 16 00:59:48 2026 with 4558677.046 GB free disk space

    cd .
    /share/org/YZWL/yzwl_lixg/miniforge3/envs/canu_v.2.3/bin/tgStoreDump \
      -S ./A2-1.seqStore \
      -T ./unitigging/A2-1.ctgStore 2 \
      -o ./A2-1.contigs \
      -layout \
    > ./A2-1.contigs.layout.err 2>&1

-- Finished on Fri Jan 16 00:59:48 2026 (one second) with 4558677.015 GB free disk space
----------------------------------------
----------------------------------------
-- Starting command on Fri Jan 16 00:59:48 2026 with 4558677.015 GB free disk space

    cd .
    /share/org/YZWL/yzwl_lixg/miniforge3/envs/canu_v.2.3/bin/tgStoreDump \
      -S ./A2-1.seqStore \
      -T ./unitigging/A2-1.ctgStore 2 \
      -consensus -fasta \
      -unassembled \
    > ./A2-1.unassembled.fasta
    2> ./A2-1.unassembled.err
ZERO length suplied to intervalList::add(), ignoring interval.
ZERO length suplied to intervalList::add(), ignoring interval.
ZERO length suplied to intervalList::add(), ignoring interval.
ZERO length suplied to intervalList::add(), ignoring interval.
ZERO length suplied to intervalList::add(), ignoring interval.
ZERO length suplied to intervalList::add(), ignoring interval.
ZERO length suplied to intervalList::add(), ignoring interval.
ZERO length suplied to intervalList::add(), ignoring interval.
ZERO length suplied to intervalList::add(), ignoring interval.
ZERO length suplied to intervalList::add(), ignoring interval.
ZERO length suplied to intervalList::add(), ignoring interval.
ZERO length suplied to intervalList::add(), ignoring interval.
ZERO length suplied to intervalList::add(), ignoring interval.

-- Finished on Fri Jan 16 00:59:49 2026 (one second) with 4558676.734 GB free disk space
----------------------------------------
----------------------------------------
-- Starting command on Fri Jan 16 00:59:49 2026 with 4558676.734 GB free disk space

    cd .
    /share/org/YZWL/yzwl_lixg/miniforge3/envs/canu_v.2.3/bin/tgStoreDump \
      -S ./A2-1.seqStore \
      -T ./unitigging/A2-1.ctgStore 2 \
      -consensus -fasta \
      -contigs \
    > ./A2-1.contigs.fasta
    2> ./A2-1.contigs.err
ZERO length suplied to intervalList::add(), ignoring interval.
ZERO length suplied to intervalList::add(), ignoring interval.
ZERO length suplied to intervalList::add(), ignoring interval.
ZERO length suplied to intervalList::add(), ignoring interval.
ZERO length suplied to intervalList::add(), ignoring interval.
ZERO length suplied to intervalList::add(), ignoring interval.
ZERO length suplied to intervalList::add(), ignoring interval.
ZERO length suplied to intervalList::add(), ignoring interval.
ZERO length suplied to intervalList::add(), ignoring interval.
ZERO length suplied to intervalList::add(), ignoring interval.
ZERO length suplied to intervalList::add(), ignoring interval.
ZERO length suplied to intervalList::add(), ignoring interval.
ZERO length suplied to intervalList::add(), ignoring interval.

-- Finished on Fri Jan 16 00:59:50 2026 (one second) with 4558676.625 GB free disk space
----------------------------------------
-- Finished stage 'generateOutputs', reset canuIteration.
--
-- Assembly 'A2-1' finished in '/share/org/YZWL/yzwl_lixg/project/28.大豆疫霉菌三代基因组/03.hicanu/A2-1/01.raw_output'.
--
-- Summary saved in 'A2-1.report'.
--
-- Sequences saved:
--   Contigs       -> 'A2-1.contigs.fasta'
--   Unassembled   -> 'A2-1.unassembled.fasta'
--
-- Read layouts saved:
--   Contigs       -> 'A2-1.contigs.layout'.
--
-- Bye.

2026-01-16 00:59:50.369 - WARNING - 输出文件不存在|Output file does not exist: /share/org/YZWL/yzwl_lixg/project/28.大豆疫霉菌三代基因组/03.hicanu/A2-1/01.raw_output/A2-1.unitigs.fasta
Usage: biopytools ragtag [OPTIONS]
Try 'biopytools ragtag -h' for help.

Error: Invalid value for '-r' / '--reference': 文件不存在|File does not exist: /share/org/YZWL/yzwl_lixg/project/28.大豆疫霉菌三代基因组/04.ragtag/Psoja_T2T.fa
Usage: biopytools genomesyn [OPTIONS]
Try 'biopytools genomesyn -h' for help.

Error: Invalid value for '-i' / '--ref': Path '04.ragtag/A2-1/hicanu/A2-1_RagTag_scaffolded.fa' does not exist.
Job 68886710 stderr output:

