2026-01-16 15:44:30.063 - WARNING - 命令错误输出|Command stderr:
-- canu master +27 changes (r10515 2a41e933b8de6ed66723d75d36dd071b46d2c347)
--
-- CITATIONS
--
-- For assemblies of PacBio HiFi reads:
--   Nurk S, Walenz BP, Rhiea A, Vollger MR, Logsdon GA, Grothe R, Miga KH, Eichler EE, Phillippy AM, Koren S.
--   HiCanu: accurate assembly of segmental duplications, satellites, and allelic variants from high-fidelity long reads.
--   biorXiv. 2020.
--   https://doi.org/10.1101/2020.03.14.992248
-- 
-- Read and contig alignments during correction and consensus use:
--   Šošic M, Šikic M.
--   Edlib: a C/C ++ library for fast, exact sequence alignment using edit distance.
--   Bioinformatics. 2017 May 1;33(9):1394-1395.
--   http://doi.org/10.1093/bioinformatics/btw753
-- 
-- Overlaps are generated using:
--   Berlin K, et al.
--   Assembling large genomes with single-molecule sequencing and locality-sensitive hashing.
--   Nat Biotechnol. 2015 Jun;33(6):623-30.
--   http://doi.org/10.1038/nbt.3238
-- 
--   Myers EW, et al.
--   A Whole-Genome Assembly of Drosophila.
--   Science. 2000 Mar 24;287(5461):2196-204.
--   http://doi.org/10.1126/science.287.5461.2196
-- 
-- Contig consensus sequences are generated using an algorithm derived from pbdagcon:
--   Chin CS, et al.
--   Nonhybrid, finished microbial genome assemblies from long-read SMRT sequencing data.
--   Nat Methods. 2013 Jun;10(6):563-9
--   http://doi.org/10.1038/nmeth.2474
-- 
-- CONFIGURE CANU
--
-- Detected Java(TM) Runtime Environment '25.0.1-internal' (from '/share/org/YZWL/yzwl_lixg/miniforge3/envs/telocomp/lib/jvm/bin/java') without -d64 support.
--
-- WARNING:
-- WARNING:  Failed to run gnuplot using command 'gnuplot'.
-- WARNING:  Plots will be disabled.
-- WARNING:
--
-- Detected samtools version '1.22' / htslib version 'htscodecs=1.6.3' (from 'samtools').
--
-- Detected 88 CPUs and 503 gigabytes of memory on the local machine.
--
-- Detected Slurm with 'sinfo' binary in /opt/skyformai/bin/sinfo.
--          Slurm disabled by useGrid=false
--
-- Detected  '' with 'pbsnodes' binary in /opt/skyformai/bin/pbsnodes.
--           disabled by useGrid=false
--
-- Detected LSF with 'bsub' binary in /opt/skyformai/bin/bsub.
--          LSF disabled by useGrid=false
--
-- Local machine mode enabled; grid support not detected or not allowed.
--
-- Found trimmed raw PacBio HiFi reads in the input files.
--
--                                (tag)Concurrency
--                         (tag)Threads          |
--                (tag)Memory         |          |
--        (tag)             |         |          |       total usage      algorithm
--        -------  ----------  --------   --------  --------------------  -----------------------------
-- Local: meryl     12.000 GB    4 CPUs x  22 jobs   264.000 GB  88 CPUs  (k-mer counting)
-- Local: cormhap   13.000 GB   11 CPUs x   8 jobs   104.000 GB  88 CPUs  (overlap detection with mhap)
-- Local: obtovl     8.000 GB    8 CPUs x  11 jobs    88.000 GB  88 CPUs  (overlap detection)
-- Local: utgovl     8.000 GB    8 CPUs x  11 jobs    88.000 GB  88 CPUs  (overlap detection)
-- Local: cor        -.--- GB    4 CPUs x   - jobs     -.--- GB   - CPUs  (read correction)
-- Local: ovb        4.000 GB    1 CPU  x  88 jobs   352.000 GB  88 CPUs  (overlap store bucketizer)
-- Local: ovs        8.000 GB    1 CPU  x  62 jobs   496.000 GB  62 CPUs  (overlap store sorting)
-- Local: red       16.000 GB    4 CPUs x  22 jobs   352.000 GB  88 CPUs  (read error detection)
-- Local: oea        8.000 GB    1 CPU  x  62 jobs   496.000 GB  62 CPUs  (overlap error adjustment)
-- Local: bat       32.000 GB    8 CPUs x   1 job     32.000 GB   8 CPUs  (contig construction with bogart)
-- Local: cns        -.--- GB    8 CPUs x   - jobs     -.--- GB   - CPUs  (consensus)
--
-- Generating assembly 'A3-14' in '/share/org/YZWL/yzwl_lixg/project/28.大豆疫霉菌三代基因组/03.hicanu/A3-14/01.raw_output':
--   genomeSize:
--     85000000
--
--   Overlap Generation Limits:
--     corOvlErrorRate 0.0000 (  0.00%)
--     obtOvlErrorRate 0.0250 (  2.50%)
--     utgOvlErrorRate 0.0100 (  1.00%)
--
--   Overlap Processing Limits:
--     corErrorRate    0.0000 (  0.00%)
--     obtErrorRate    0.0250 (  2.50%)
--     utgErrorRate    0.0003 (  0.03%)
--     cnsErrorRate    0.0500 (  5.00%)
--
--   Stages to run:
--     assemble HiFi reads.
--
--
-- BEGIN STORE CREATION
----------------------------------------
-- Starting command on Fri Jan 16 13:03:43 2026 with 4534161.375 GB free disk space

    cd .
    ./A3-14.seqStore.sh \
    > ./A3-14.seqStore.err 2>&1

-- Finished on Fri Jan 16 13:10:51 2026 (428 seconds) with 4533383.406 GB free disk space
----------------------------------------
--
-- In sequence store './A3-14.seqStore':
--   Found 255201 reads.
--   Found 4250013126 bases (50 times coverage).
--    Histogram of corrected reads:
--    
--    G=4250013126                       sum of  ||               length     num
--    NG         length     index       lengths  ||                range    seqs
--    ----- ------------ --------- ------------  ||  ------------------- -------
--    00010        25264     15421    425022707  ||       1231-2328         3513|---------
--    00020        23014     33112    850020253  ||       2329-3426         6648|----------------
--    00030        21473     52260   1275008483  ||       3427-4524         6907|-----------------
--    00040        20279     72645   1700025071  ||       4525-5622         6722|----------------
--    00050        19263     94156   2125008882  ||       5623-6720         6450|----------------
--    00060        18306    116786   2550014231  ||       6721-7818         6032|---------------
--    00070        17324    140635   2975025788  ||       7819-8916         5780|--------------
--    00080        16082    166030   3400026564  ||       8917-10014        5268|-------------
--    00090        13202    194467   3825017330  ||      10015-11112        4783|------------
--    00100         1231    255201   4250013126  ||      11113-12210        4356|-----------
--    001.000x              255201   4250013126  ||      12211-13308        4793|------------
--                                               ||      13309-14406        7067|-----------------
--                                               ||      14407-15504       12035|-----------------------------
--                                               ||      15505-16602       18530|--------------------------------------------
--                                               ||      16603-17700       24576|----------------------------------------------------------
--                                               ||      17701-18798       26745|---------------------------------------------------------------
--                                               ||      18799-19896       24699|-----------------------------------------------------------
--                                               ||      19897-20994       20463|-------------------------------------------------
--                                               ||      20995-22092       16129|--------------------------------------
--                                               ||      22093-23190       12392|------------------------------
--                                               ||      23191-24288        9502|-----------------------
--                                               ||      24289-25386        7069|-----------------
--                                               ||      25387-26484        5041|------------
--                                               ||      26485-27582        3558|---------
--                                               ||      27583-28680        2479|------
--                                               ||      28681-29778        1547|----
--                                               ||      29779-30876        1021|---
--                                               ||      30877-31974         552|--
--                                               ||      31975-33072         308|-
--                                               ||      33073-34170         136|-
--                                               ||      34171-35268          67|-
--                                               ||      35269-36366          18|-
--                                               ||      36367-37464           9|-
--                                               ||      37465-38562           2|-
--                                               ||      38563-39660           1|-
--                                               ||      39661-40758           1|-
--                                               ||      40759-41856           0|
--                                               ||      41857-42954           1|-
--                                               ||      42955-44052           0|
--                                               ||      44053-45150           1|-
--    
--
-- In sequence store './A3-14.seqStore':
--   Found 255201 reads.
--   Found 4250013126 bases (50 times coverage).
--    Histogram of corrected-trimmed reads:
--    
--    G=4250013126                       sum of  ||               length     num
--    NG         length     index       lengths  ||                range    seqs
--    ----- ------------ --------- ------------  ||  ------------------- -------
--    00010        25264     15421    425022707  ||       1231-2328         3513|---------
--    00020        23014     33112    850020253  ||       2329-3426         6648|----------------
--    00030        21473     52260   1275008483  ||       3427-4524         6907|-----------------
--    00040        20279     72645   1700025071  ||       4525-5622         6722|----------------
--    00050        19263     94156   2125008882  ||       5623-6720         6450|----------------
--    00060        18306    116786   2550014231  ||       6721-7818         6032|---------------
--    00070        17324    140635   2975025788  ||       7819-8916         5780|--------------
--    00080        16082    166030   3400026564  ||       8917-10014        5268|-------------
--    00090        13202    194467   3825017330  ||      10015-11112        4783|------------
--    00100         1231    255201   4250013126  ||      11113-12210        4356|-----------
--    001.000x              255201   4250013126  ||      12211-13308        4793|------------
--                                               ||      13309-14406        7067|-----------------
--                                               ||      14407-15504       12035|-----------------------------
--                                               ||      15505-16602       18530|--------------------------------------------
--                                               ||      16603-17700       24576|----------------------------------------------------------
--                                               ||      17701-18798       26745|---------------------------------------------------------------
--                                               ||      18799-19896       24699|-----------------------------------------------------------
--                                               ||      19897-20994       20463|-------------------------------------------------
--                                               ||      20995-22092       16129|--------------------------------------
--                                               ||      22093-23190       12392|------------------------------
--                                               ||      23191-24288        9502|-----------------------
--                                               ||      24289-25386        7069|-----------------
--                                               ||      25387-26484        5041|------------
--                                               ||      26485-27582        3558|---------
--                                               ||      27583-28680        2479|------
--                                               ||      28681-29778        1547|----
--                                               ||      29779-30876        1021|---
--                                               ||      30877-31974         552|--
--                                               ||      31975-33072         308|-
--                                               ||      33073-34170         136|-
--                                               ||      34171-35268          67|-
--                                               ||      35269-36366          18|-
--                                               ||      36367-37464           9|-
--                                               ||      37465-38562           2|-
--                                               ||      38563-39660           1|-
--                                               ||      39661-40758           1|-
--                                               ||      40759-41856           0|
--                                               ||      41857-42954           1|-
--                                               ||      42955-44052           0|
--                                               ||      44053-45150           1|-
--    
--
-- Correction skipped; not enabled.
--
-- Trimming skipped; not enabled.
--
-- BEGIN ASSEMBLY
----------------------------------------
-- Starting command on Fri Jan 16 13:10:52 2026 with 4533383.359 GB free disk space

    cd unitigging/0-mercounts
    ./meryl-configure.sh \
    > ./meryl-configure.err 2>&1

-- Finished on Fri Jan 16 13:10:53 2026 (one second) with 4533383.359 GB free disk space
----------------------------------------
--  segments   memory batches
--  -------- -------- -------
--        01 10.72 GB       2
--        02  5.69 GB       2
--        04  2.94 GB       2
--        06  2.13 GB       2
--        08  1.60 GB       2
--        12  1.07 GB       2
--        16  0.80 GB       2
--        20  0.65 GB       2
--        24  0.54 GB       2
--        32  0.40 GB       2
--        40  0.32 GB       2
--        48  -.-- GB       -  (segment size too small)
--        56  -.-- GB       -  (segment size too small)
--        64  -.-- GB       -  (segment size too small)
--        96  -.-- GB       -  (segment size too small)
--
--  For 255201 reads with 4250013126 bases, limit to 42 batches.
--  Will count kmers using 01 jobs, each using 12 GB and 4 threads.
--
-- Finished stage 'merylConfigure', reset canuIteration.
--
-- Running jobs.  First attempt out of 2.
----------------------------------------
-- Starting 'meryl' concurrent execution on Fri Jan 16 13:10:53 2026 with 4533383.328 GB free disk space (1 processes; 22 concurrently)

    cd unitigging/0-mercounts
    ./meryl-count.sh 1 > ./meryl-count.000001.out 2>&1

-- Finished on Fri Jan 16 13:14:22 2026 (209 seconds) with 4533009.875 GB free disk space
----------------------------------------
-- Found 1 Kmer counting (meryl) outputs.
-- Finished stage 'utg-merylCountCheck', reset canuIteration.
--
-- Running jobs.  First attempt out of 2.
----------------------------------------
-- Starting 'meryl' concurrent execution on Fri Jan 16 13:14:22 2026 with 4533009.843 GB free disk space (1 processes; 22 concurrently)

    cd unitigging/0-mercounts
    ./meryl-process.sh 1 > ./meryl-process.000001.out 2>&1

-- Finished on Fri Jan 16 13:14:25 2026 (3 seconds) with 4533012.953 GB free disk space
----------------------------------------
-- Meryl finished successfully.  Kmer frequency histogram:
--
-- WARNING: gnuplot failed.
--
----------------------------------------
--
--  22-mers                                                                                           Fraction
--    Occurrences   NumMers                                                                         Unique Total
--       1-     1         0                                                                        0.0000 0.0000
--       2-     2    224979                                                                        0.0050 0.0001
--       3-     4     73249                                                                        0.0062 0.0002
--       5-     7     22042                                                                        0.0069 0.0003
--       8-    11      6500                                                                        0.0072 0.0003
--      12-    16     15906                                                                        0.0073 0.0003
--      17-    22    116916                                                                        0.0078 0.0004
--      23-    29    980167 ****                                                                   0.0113 0.0014
--      30-    37   6209360 *************************                                              0.0397 0.0126
--      38-    46  16907177 ********************************************************************** 0.2033 0.0938
--      47-    56  13167949 ******************************************************                 0.5892 0.3274
--      57-    67   2470107 **********                                                             0.8507 0.5163
--      68-    79    667550 **                                                                     0.8951 0.5543
--      80-    92   1076814 ****                                                                   0.9102 0.5702
--      93-   106    730270 ***                                                                    0.9343 0.5996
--     107-   121    264441 *                                                                      0.9493 0.6205
--     122-   137    293926 *                                                                      0.9551 0.6298
--     138-   154    239657                                                                        0.9617 0.6419
--     155-   172    169395                                                                        0.9668 0.6524
--     173-   191    161217                                                                        0.9705 0.6611
--     192-   211    138240                                                                        0.9741 0.6701
--     212-   232    107877                                                                        0.9771 0.6787
--     233-   254     87176                                                                        0.9795 0.6862
--     255-   277     85508                                                                        0.9814 0.6928
--     278-   301     76559                                                                        0.9833 0.6998
--     302-   326     71550                                                                        0.9850 0.7067
--     327-   352     56753                                                                        0.9866 0.7138
--     353-   379     41962                                                                        0.9878 0.7197
--     380-   407     39294                                                                        0.9887 0.7245
--     408-   436     36191                                                                        0.9896 0.7293
--     437-   466     33204                                                                        0.9904 0.7340
--     467-   497     30587                                                                        0.9911 0.7387
--     498-   529     24511                                                                        0.9918 0.7432
--     530-   562     21674                                                                        0.9924 0.7472
--     563-   596     18553                                                                        0.9928 0.7508
--     597-   631     16330                                                                        0.9933 0.7542
--     632-   667     15596                                                                        0.9936 0.7573
--     668-   704     13777                                                                        0.9940 0.7605
--     705-   742     12022                                                                        0.9943 0.7634
--     743-   781     11521                                                                        0.9945 0.7661
--     782-   821     10463                                                                        0.9948 0.7688
--
--           0 (max occurrences)
--  3204548151 (total mers, non-unique)
--    44971221 (distinct mers, non-unique)
--           0 (unique mers)
-- Finished stage 'meryl-process', reset canuIteration.
--
-- Removing meryl database 'unitigging/0-mercounts/A3-14.ms22'.
--
-- OVERLAPPER (normal) (assembly) erate=0.01
--
----------------------------------------
-- Starting command on Fri Jan 16 13:14:25 2026 with 4533013.921 GB free disk space

    cd unitigging/1-overlapper
    /share/org/YZWL/yzwl_lixg/miniforge3/envs/canu_v.2.3/bin/overlapInCorePartition \
     -S  ../../A3-14.seqStore \
     -hl 160000000 \
     -rl 5000000000 \
     -ol 500 \
     -o  ./A3-14.partition \
    > ./A3-14.partition.err 2>&1

-- Finished on Fri Jan 16 13:14:25 2026 (lickety-split) with 4533013.906 GB free disk space
----------------------------------------
--
-- Configured 21 overlapInCore jobs.
-- Finished stage 'utg-overlapConfigure', reset canuIteration.
--
-- Running jobs.  First attempt out of 2.
----------------------------------------
-- Starting 'utgovl' concurrent execution on Fri Jan 16 13:14:25 2026 with 4533013.875 GB free disk space (21 processes; 11 concurrently)

    cd unitigging/1-overlapper
    ./overlap.sh 1 > ./overlap.000001.out 2>&1
    ./overlap.sh 2 > ./overlap.000002.out 2>&1
    ./overlap.sh 3 > ./overlap.000003.out 2>&1
    ./overlap.sh 4 > ./overlap.000004.out 2>&1
    ./overlap.sh 5 > ./overlap.000005.out 2>&1
    ./overlap.sh 6 > ./overlap.000006.out 2>&1
    ./overlap.sh 7 > ./overlap.000007.out 2>&1
    ./overlap.sh 8 > ./overlap.000008.out 2>&1
    ./overlap.sh 9 > ./overlap.000009.out 2>&1
    ./overlap.sh 10 > ./overlap.000010.out 2>&1
    ./overlap.sh 11 > ./overlap.000011.out 2>&1
    ./overlap.sh 12 > ./overlap.000012.out 2>&1
    ./overlap.sh 13 > ./overlap.000013.out 2>&1
    ./overlap.sh 14 > ./overlap.000014.out 2>&1
    ./overlap.sh 15 > ./overlap.000015.out 2>&1
    ./overlap.sh 16 > ./overlap.000016.out 2>&1
    ./overlap.sh 17 > ./overlap.000017.out 2>&1
    ./overlap.sh 18 > ./overlap.000018.out 2>&1
    ./overlap.sh 19 > ./overlap.000019.out 2>&1
    ./overlap.sh 20 > ./overlap.000020.out 2>&1
    ./overlap.sh 21 > ./overlap.000021.out 2>&1

-- Finished on Fri Jan 16 14:02:20 2026 (2875 seconds) with 4531977.953 GB free disk space
----------------------------------------
-- Found 21 overlapInCore output files.
--
-- overlapInCore compute 'unitigging/1-overlapper':
--   kmer hits
--     with no overlap       1331471406  00.2857143 +- 40113234.574
--     with an overlap         52317893  8.23809524 +- 1435802.947
--
--   overlaps                  52317893  8.23809524 +- 1435802.947
--     contained               10878858  .857142857 +- 283585.002
--     dovetail                41439035  7.38095238 +- 1155055.842
--
--   overlaps rejected
--     multiple per pair              0           0 +- 0
--     bad short window               0           0 +- 0
--     bad long window                0           0 +- 0
-- Finished stage 'utg-overlapCheck', reset canuIteration.
----------------------------------------
-- Starting command on Fri Jan 16 14:02:20 2026 with 4531977.937 GB free disk space

    cd unitigging
    /share/org/YZWL/yzwl_lixg/miniforge3/envs/canu_v.2.3/bin/ovStoreConfig \
     -S ../A3-14.seqStore \
     -M 4-8 \
     -L ./1-overlapper/ovljob.files \
     -create ./A3-14.ovlStore.config \
     > ./A3-14.ovlStore.config.txt \
    2> ./A3-14.ovlStore.config.err

-- Finished on Fri Jan 16 14:02:20 2026 (furiously fast) with 4531977.921 GB free disk space
----------------------------------------
--
-- Creating overlap store unitigging/A3-14.ovlStore using:
--      1 bucket
--      1 slice
--        using at most 4 GB memory each
--
-- Running jobs.  First attempt out of 2.
----------------------------------------
-- Starting 'ovS' concurrent execution on Fri Jan 16 14:02:20 2026 with 4531977.906 GB free disk space (1 processes; 62 concurrently)

    cd unitigging
    ./A3-14.ovlStore.sh 1 > ./A3-14.ovlStore.000001.out 2>&1

-- Finished on Fri Jan 16 14:02:42 2026 (22 seconds) with 4531975.718 GB free disk space
----------------------------------------
-- Checking store.
----------------------------------------
-- Starting command on Fri Jan 16 14:02:42 2026 with 4531975.718 GB free disk space

    cd unitigging
    /share/org/YZWL/yzwl_lixg/miniforge3/envs/canu_v.2.3/bin/ovStoreDump \
     -S ../A3-14.seqStore \
     -O  ./A3-14.ovlStore \
     -counts \
     > ./A3-14.ovlStore/counts.dat 2> ./A3-14.ovlStore/counts.err

-- Finished on Fri Jan 16 14:02:42 2026 (fast as lightning) with 4531975.687 GB free disk space
----------------------------------------
--
-- Overlap store 'unitigging/A3-14.ovlStore' successfully constructed.
-- Found 104635786 overlaps for 247936 reads; 1449823 reads have no overlaps.
--
--
-- Purged 1.005 GB in 63 overlap output files.
----------------------------------------
-- Starting command on Fri Jan 16 14:02:43 2026 with 4531976.734 GB free disk space

    cd unitigging
    /share/org/YZWL/yzwl_lixg/miniforge3/envs/canu_v.2.3/bin/ovStoreStats \
     -C 50 \
     -S ../A3-14.seqStore \
     -O  ./A3-14.ovlStore \
     -o  ./A3-14.ovlStore \
     > ./A3-14.ovlStore.summary.err 2>&1

-- Finished on Fri Jan 16 14:02:58 2026 (15 seconds) with 4531974.671 GB free disk space
----------------------------------------
--
-- Overlap store 'unitigging/A3-14.ovlStore' contains:
--
--   category            reads     %          read length        feature size or coverage  analysis
--   ----------------  -------  -------  ----------------------  ------------------------  --------------------
--   middle-missing        112    0.04    14685.93 +- 5888.45        702.07 +- 756.59     (bad trimming)
--   middle-hump            15    0.01    14548.27 +- 2623.12       4775.53 +- 2956.74    (bad trimming)
--   no-5-prime            482    0.19    13376.92 +- 4538.46       2013.50 +- 3039.59    (bad trimming)
--   no-3-prime            484    0.19    12393.76 +- 5443.63       1916.96 +- 2870.64    (bad trimming)
--   
--   low-coverage         1147    0.45    10809.65 +- 4905.97          5.72 +- 3.67       (easy to assemble, potential for lower quality consensus)
--   unique             199253   78.08    12765.30 +- 4965.79         44.63 +- 8.18       (easy to assemble, perfect, yay)
--   repeat-cont         22258    8.72    11052.50 +- 4285.06       2084.20 +- 1578.61    (potential for consensus errors, no impact on assembly)
--   repeat-dove           239    0.09    20534.74 +- 2062.33        868.29 +- 1131.45    (hard to assemble, likely won't assemble correctly or even at all)
--   
--   span-repeat          2332    0.91    13766.67 +- 4388.74       3403.83 +- 3787.97    (read spans a large repeat, usually easy to assemble)
--   uniq-repeat-cont    14102    5.53    12705.50 +- 3949.31                             (should be uniquely placed, low potential for consensus errors, no impact on assembly)
--   uniq-repeat-dove     2742    1.07    18446.09 +- 2831.18                             (will end contigs, potential to misassemble)
--   uniq-anchor          4770    1.87    13400.98 +- 4157.59       8254.93 +- 4723.68    (repeat read, with unique section, probable bad read)
-- Finished stage 'utg-createOverlapStore', reset canuIteration.
--
-- Loading read lengths.
-- Loading number of overlaps per read.
--
-- Configure RED for 16gb memory.
--                   Batches of at most (unlimited) reads.
--                                      500000000 bases.
--                   Expecting evidence of at most 536870912 bases per iteration.
--
--           Total                                               Reads                 Olaps Evidence
--    Job   Memory      Read Range         Reads        Bases   Memory        Olaps   Memory   Memory  (Memory in MB)
--   ---- -------- ------------------- --------- ------------ -------- ------------ -------- --------
--      1 16384.21         1-39125          5812    108862952 13289.12      2018162    23.10  1024.00
--      2 16385.20     39126-80256          6094    108740806 13274.22      3406789    38.99  1024.00
--      3 16385.80     80257-129471         7428    108842369 13286.66      2371593    27.14  1024.00
--      4 16384.75    129472-170591         6200    108786497 13279.80      2879519    32.95  1024.00
--      5 16384.66    170592-210619         6073    108686432 13267.58      3939628    45.09  1024.00
--      6 16384.27    210620-257335         6985    108949532 13299.72      1096307    12.55  1024.00
--      7 16385.20    257336-304590         7195    108799659 13281.43      2775644    31.76  1024.00
--      8 16385.73    304591-343717         5964    108739917 13274.10      3463066    39.63  1024.00
--      9 16384.09    343718-386217         6420    108804943 13282.06      2624067    30.03  1024.00
--     10 16384.20    386218-437928         7769    108778609 13278.88      2911367    33.32  1024.00
--     11 16384.80    437929-477942         5881    108757920 13276.30      3189964    36.51  1024.00
--     12 16384.97    477943-518811         6226    108814363 13283.20      2601571    29.77  1024.00
--     13 16386.79    518812-571987         8001    108812580 13283.04      2774197    31.75  1024.00
--     14 16384.61    571988-610784         5823    108872167 13290.24      1954540    22.37  1024.00
--     15 16385.12    610785-650761         6024    108729753 13272.86      3517526    40.25  1024.00
--     16 16385.44    650762-698438         7199    108927930 13297.09      1428839    16.35  1024.00
--     17 16384.06    698439-744687         6920    108837602 13286.06      2272272    26.00  1024.00
--     18 16384.26    744688-784484         6002    108667745 13265.29      4103880    46.97  1024.00
--     19 16384.55    784485-829610         6693    108911573 13295.08      1526388    17.47  1024.00
--     20 16385.96    829611-879783         7567    108804781 13282.07      2786552    31.89  1024.00
--     21 16385.91    879784-919277         5915    108745808 13274.82      3415277    39.08  1024.00
--     22 16384.43    919278-960591         6345    108812213 13282.94      2576795    29.49  1024.00
--     23 16386.39    960592-1012227        7926    108815356 13283.37      2709815    31.01  1024.00
--     24 16386.49   1012228-1050996        5803    108782216 13279.26      3078636    35.23  1024.00
--     25 16384.64   1050997-1090327        6052    108819069 13283.77      2523253    28.88  1024.00
--     26 16384.43   1090328-1140065        7500    108836196 13285.90      2317462    26.52  1024.00
--     27 16385.93   1140066-1180399        6029    108818044 13283.64      2646683    30.29  1024.00
--     28 16384.90   1180400-1220733        5908    108721957 13271.91      3581998    40.99  1024.00
--     29 16385.00   1220734-1266070        6829    108953678 13300.22      1116447    12.78  1024.00
--     30 16385.42   1266071-1310088        6574    108835886 13285.84      2409877    27.58  1024.00
--     31 16386.26   1310089-1348978        5835    108694611 13268.57      3992675    45.69  1024.00
--     32 16384.81   1348979-1390735        6263    108897732 13293.38      1698325    19.44  1024.00
--     33 16387.06   1390736-1437353        7018    108829626 13285.09      2619157    29.97  1024.00
--     34 16385.08   1437354-1476012        5819    108799619 13281.39      2769159    31.69  1024.00
--     35 16384.72   1476013-1516411        6119    108805933 13282.17      2669365    30.55  1024.00
--     36 16384.44   1516412-1566425        7294    108812799 13283.04      2568682    29.40  1024.00
--     37 16384.41   1566426-1605197        5792    108775354 13278.42      2969822    33.99  1024.00
--     38 16386.53   1605198-1645066        6040    108852536 13287.85      2331158    26.68  1024.00
--     39 16384.17   1645067-1694768        7416    108782009 13279.29      2872917    32.88  1024.00
--     40  3866.23   1694769-1697759         448      6494354   792.78       126412     1.45  1024.00
--   ---- -------- ------------------- --------- ------------ -------- ------------ -------- --------
--                                                 4250013126             104635786
-- Finished stage 'readErrorDetectionConfigure', reset canuIteration.
--
-- Running jobs.  First attempt out of 2.
----------------------------------------
-- Starting 'red' concurrent execution on Fri Jan 16 14:03:05 2026 with 4531974.625 GB free disk space (40 processes; 22 concurrently)

    cd unitigging/3-overlapErrorAdjustment
    ./red.sh 1 > ./red.000001.out 2>&1
    ./red.sh 2 > ./red.000002.out 2>&1
    ./red.sh 3 > ./red.000003.out 2>&1
    ./red.sh 4 > ./red.000004.out 2>&1
    ./red.sh 5 > ./red.000005.out 2>&1
    ./red.sh 6 > ./red.000006.out 2>&1
    ./red.sh 7 > ./red.000007.out 2>&1
    ./red.sh 8 > ./red.000008.out 2>&1
    ./red.sh 9 > ./red.000009.out 2>&1
    ./red.sh 10 > ./red.000010.out 2>&1
    ./red.sh 11 > ./red.000011.out 2>&1
    ./red.sh 12 > ./red.000012.out 2>&1
    ./red.sh 13 > ./red.000013.out 2>&1
    ./red.sh 14 > ./red.000014.out 2>&1
    ./red.sh 15 > ./red.000015.out 2>&1
    ./red.sh 16 > ./red.000016.out 2>&1
    ./red.sh 17 > ./red.000017.out 2>&1
    ./red.sh 18 > ./red.000018.out 2>&1
    ./red.sh 19 > ./red.000019.out 2>&1
    ./red.sh 20 > ./red.000020.out 2>&1
    ./red.sh 21 > ./red.000021.out 2>&1
    ./red.sh 22 > ./red.000022.out 2>&1
    ./red.sh 23 > ./red.000023.out 2>&1
    ./red.sh 24 > ./red.000024.out 2>&1
    ./red.sh 25 > ./red.000025.out 2>&1
    ./red.sh 26 > ./red.000026.out 2>&1
    ./red.sh 27 > ./red.000027.out 2>&1
    ./red.sh 28 > ./red.000028.out 2>&1
    ./red.sh 29 > ./red.000029.out 2>&1
    ./red.sh 30 > ./red.000030.out 2>&1
    ./red.sh 31 > ./red.000031.out 2>&1
    ./red.sh 32 > ./red.000032.out 2>&1
    ./red.sh 33 > ./red.000033.out 2>&1
    ./red.sh 34 > ./red.000034.out 2>&1
    ./red.sh 35 > ./red.000035.out 2>&1
    ./red.sh 36 > ./red.000036.out 2>&1
    ./red.sh 37 > ./red.000037.out 2>&1
    ./red.sh 38 > ./red.000038.out 2>&1
    ./red.sh 39 > ./red.000039.out 2>&1
    ./red.sh 40 > ./red.000040.out 2>&1

-- Finished on Fri Jan 16 14:23:48 2026 (1243 seconds) with 4531391.359 GB free disk space
----------------------------------------
-- Found 40 read error detection output files.
-- Finished stage 'readErrorDetectionCheck', reset canuIteration.
--
-- Loading read lengths.
-- Loading number of overlaps per read.
--
-- Configure OEA for 8gb memory.
--                   Batches of at most (unlimited) reads.
--                                      300000000 bases.
--
--           Total                                               Reads                 Olaps  Adjusts
--    Job   Memory      Read Range         Reads        Bases   Memory        Olaps   Memory   Memory  (Memory in MB)
--   ---- -------- ------------------- --------- ------------ -------- ------------ -------- --------
--      1  2903.44         1-114738        17152    300008818   294.63      6406795   195.52   365.28
--      2  2977.44    114739-232903        17820    300013842   294.66      8831036   269.50   365.28
--      3  2968.60    232904-355301        18466    300012172   294.68      8540721   260.64   365.28
--      4  2918.99    355302-479264        18564    300021212   294.69      6914559   211.02   365.28
--      5  2924.12    479265-602729        18609    300012959   294.68      7083054   216.16   365.28
--      6  2925.57    602730-726765        18719    300013484   294.69      7130335   217.60   365.28
--      7  2911.68    726766-847445        18045    300009360   294.66      6675961   203.73   365.28
--      8  2954.77    847446-963361        17573    300000038   294.64      8088728   246.85   365.28
--      9  2956.73    963362-1083177       18232    300004265   294.66      8152256   248.79   365.28
--     10  2914.66   1083178-1203913       18028    300014673   294.67      6773536   206.71   365.28
--     11  2918.56   1203914-1322923       17839    300007150   294.65      6901609   210.62   365.28
--     12  2918.06   1322924-1440679       17719    300010833   294.65      6885353   210.12   365.28
--     13  2947.72   1440680-1560372       17853    300012273   294.66      7857130   239.78   365.28
--     14  2894.18   1560373-1671926       16695    300009762   294.62      6103795   186.27   365.28
--     15  2538.87   1671927-1697759        3887     49862285    55.67      2290918    69.91   365.28
--   ---- -------- ------------------- --------- ------------ -------- ------------ -------- --------
--                                                 4250013126             104635786
-- Finished stage 'overlapErrorAdjustmentConfigure', reset canuIteration.
--
-- Running jobs.  First attempt out of 2.
----------------------------------------
-- Starting 'oea' concurrent execution on Fri Jan 16 14:23:56 2026 with 4531398.984 GB free disk space (15 processes; 62 concurrently)

    cd unitigging/3-overlapErrorAdjustment
    ./oea.sh 1 > ./oea.000001.out 2>&1
    ./oea.sh 2 > ./oea.000002.out 2>&1
    ./oea.sh 3 > ./oea.000003.out 2>&1
    ./oea.sh 4 > ./oea.000004.out 2>&1
    ./oea.sh 5 > ./oea.000005.out 2>&1
    ./oea.sh 6 > ./oea.000006.out 2>&1
    ./oea.sh 7 > ./oea.000007.out 2>&1
    ./oea.sh 8 > ./oea.000008.out 2>&1
    ./oea.sh 9 > ./oea.000009.out 2>&1
    ./oea.sh 10 > ./oea.000010.out 2>&1
    ./oea.sh 11 > ./oea.000011.out 2>&1
    ./oea.sh 12 > ./oea.000012.out 2>&1
    ./oea.sh 13 > ./oea.000013.out 2>&1
    ./oea.sh 14 > ./oea.000014.out 2>&1
    ./oea.sh 15 > ./oea.000015.out 2>&1

-- Finished on Fri Jan 16 15:31:51 2026 (4075 seconds) with 4523554.046 GB free disk space
----------------------------------------
-- Found 15 overlap error adjustment output files.
-- Finished stage 'overlapErrorAdjustmentCheck', reset canuIteration.
----------------------------------------
-- Starting command on Fri Jan 16 15:31:51 2026 with 4523554.031 GB free disk space

    cd unitigging/3-overlapErrorAdjustment
    /share/org/YZWL/yzwl_lixg/miniforge3/envs/canu_v.2.3/bin/loadErates \
      -S ../../A3-14.seqStore \
      -O ../A3-14.ovlStore \
      -L ./oea.files \
    > ./oea.apply.err 2>&1

-- Finished on Fri Jan 16 15:31:51 2026 (fast as lightning) with 4523553.828 GB free disk space
----------------------------------------
-- No report available.
-- Finished stage 'updateOverlapStore', reset canuIteration.
-- Finished stage 'unitig', reset canuIteration.
--
-- Running jobs.  First attempt out of 2.
----------------------------------------
-- Starting 'bat' concurrent execution on Fri Jan 16 15:31:51 2026 with 4523553.781 GB free disk space (1 processes; 1 concurrently)

    cd unitigging/4-unitigger
    ./unitigger.sh 1 > ./unitigger.000001.out 2>&1

-- Finished on Fri Jan 16 15:32:18 2026 (27 seconds) with 4523251.437 GB free disk space
----------------------------------------
-- Unitigger finished successfully.
--  
--  ERROR RATES
--  -----------
--                                                   --------threshold------
--  279398                       fraction error      fraction        percent
--  samples                              (1e-5)         error          error
--                   --------------------------      --------       --------
--  command line (-eg)                           ->     30.00        0.0300%
--  command line (-ef)                           ->  -----.--      ---.----%
--  command line (-eM)                           ->     30.00        0.0300%
--  mean + std.dev       0.36 +-  12 *     2.78  ->     33.70        0.0337%
--  median + mad         0.00 +-  12 *     0.00  ->      0.00        0.0000%
--  90th percentile                              ->      1.00        0.0010%  (enabled)
--  
--  BEST EDGE FILTERING
--  -------------------
--  At graph threshold 0.0300%, reads:
--    available to have edges:        44862
--    with at least one edge:         36223
--  
--  At max threshold 0.0300%, reads:  (not computed)
--    available to have edges:            0
--    with at least one edge:             0
--  
--  At tight threshold 0.0010%, reads with:
--    both edges below error threshold:     32066  (80.00% minReadsBest threshold = 28978)
--    one  edge  above error threshold:      3058
--    both edges above error threshold:      1099
--    at least one edge:                    36223
--  
--  At loose threshold 0.0300%, reads with:
--    both edges below error threshold:     36223  (80.00% minReadsBest threshold = 28978)
--    one  edge  above error threshold:         0
--    both edges above error threshold:         0
--    at least one edge:                    36223
--  
--  
--  INITIAL EDGES
--  -------- ----------------------------------------
--    205161 reads are contained
--   1461021 reads have no best edges (singleton)
--       330 reads have only one best edge (spur) 
--                150 are mutual best
--     31247 reads have two best edges 
--                846 have one mutual best edge
--              30000 have two mutual best edges
--  
--  
--  FINAL EDGES
--  -------- ----------------------------------------
--    205161 reads are contained
--   1461390 reads have no best edges (singleton)
--       203 reads have only one best edge (spur) 
--                152 are mutual best
--     31005 reads have two best edges 
--                686 have one mutual best edge
--              29992 have two mutual best edges
--  
--  
--  EDGE FILTERING
--  -------- ------------------------------------------
--         0 reads are ignored
--      9702 reads have a gap in overlap coverage
--       160 reads have lopsided best edges
-- Found, in version 1, after unitig construction:
--   contigs:      92 sequences, total length 68428659 bp (including 137 repeats of total length 3038959 bp).
--   bubbles:      156 sequences, total length 4010909 bp.
--   unassembled:  19027 sequences, total length 224257840 bp.
--
-- Contig sizes based on genome size 85mbp:
--
--            NG (bp)  LG (contigs)    sum (bp)
--         ----------  ------------  ----------
--     10     8743842             1     8743842
--     20     5817836             3    22595582
--     30     5558515             4    28154097
--     40     4140009             6    36725205
--     50     3540539             8    44351721
--     60     3363481            10    51080454
--     70     2416668            13    59811071
--     80       19358            67    68016983
--
-- Finished stage 'unitigCheck', reset canuIteration.
----------------------------------------
-- Starting command on Fri Jan 16 15:32:18 2026 with 4523251.421 GB free disk space

    cd unitigging
    /share/org/YZWL/yzwl_lixg/miniforge3/envs/canu_v.2.3/bin/utgcns \
      -S ../A3-14.seqStore \
      -T  ./A3-14.ctgStore 1 \
      -partition 0.8 1.5 0.1 \
    > ./A3-14.ctgStore/partitioning.log 2>&1

-- Finished on Fri Jan 16 15:32:27 2026 (9 seconds) with 4523250.937 GB free disk space
----------------------------------------
-- Using slow alignment for consensus (iteration '0').
-- Configured 10 consensus jobs.
-- Finished stage 'consensusConfigure', reset canuIteration.
--
-- Local: cns       13.000 GB    8 CPUs x  11 jobs   143.000 GB  88 CPUs  (consensus)
--
--
-- Running jobs.  First attempt out of 2.
----------------------------------------
-- Starting 'cns' concurrent execution on Fri Jan 16 15:32:27 2026 with 4523250.906 GB free disk space (10 processes; 11 concurrently)

    cd unitigging/5-consensus
    ./consensus.sh 1 > ./consensus.000001.out 2>&1
    ./consensus.sh 2 > ./consensus.000002.out 2>&1
    ./consensus.sh 3 > ./consensus.000003.out 2>&1
    ./consensus.sh 4 > ./consensus.000004.out 2>&1
    ./consensus.sh 5 > ./consensus.000005.out 2>&1
    ./consensus.sh 6 > ./consensus.000006.out 2>&1
    ./consensus.sh 7 > ./consensus.000007.out 2>&1
    ./consensus.sh 8 > ./consensus.000008.out 2>&1
    ./consensus.sh 9 > ./consensus.000009.out 2>&1
    ./consensus.sh 10 > ./consensus.000010.out 2>&1

-- Finished on Fri Jan 16 15:40:19 2026 (472 seconds) with 4522133.5 GB free disk space
----------------------------------------
-- Using slow alignment for consensus (iteration '1').
-- Configured 10 consensus jobs.
-- All 10 consensus jobs finished successfully.
-- Finished stage 'consensusCheck', reset canuIteration.
-- Using slow alignment for consensus (iteration '0').
-- Configured 10 consensus jobs.
----------------------------------------
-- Starting command on Fri Jan 16 15:40:19 2026 with 4522133.453 GB free disk space

    cd unitigging
    /share/org/YZWL/yzwl_lixg/miniforge3/envs/canu_v.2.3/bin/tgStoreLoad \
      -S ../A3-14.seqStore \
      -T  ./A3-14.ctgStore 2 \
      -L ./5-consensus/ctgcns.files \
    > ./5-consensus/ctgcns.files.ctgStoreLoad.err 2>&1

-- Finished on Fri Jan 16 15:40:20 2026 (one second) with 4522132.625 GB free disk space
----------------------------------------
----------------------------------------
-- Starting command on Fri Jan 16 15:40:20 2026 with 4522132.625 GB free disk space

    cd unitigging
    /share/org/YZWL/yzwl_lixg/miniforge3/envs/canu_v.2.3/bin/tgTigDisplay \
      -S ../A3-14.seqStore \
      -b \
      -o ../A3-14.contigs.unsorted.bam \
      -L ./5-consensus/ctgcns.files \
    > ./5-consensus/ctgcns.files.contigs.bam.err 2>&1

-- Finished on Fri Jan 16 15:43:29 2026 (189 seconds) with 4521919.953 GB free disk space
----------------------------------------
----------------------------------------
-- Starting command on Fri Jan 16 15:43:29 2026 with 4521919.953 GB free disk space

    cd .
    samtools sort \
      --write-index \
      --threads 2 \
      -o ./A3-14.contigs.bam ./A3-14.contigs.unsorted.bam \
    > ./ctgcns.bam.err 2>&1

-- Finished on Fri Jan 16 15:44:27 2026 (58 seconds) with 4521732.156 GB free disk space
----------------------------------------
-- Purging consensus output after loading to ctgStore.
-- Purged 10 .cns outputs.
----------------------------------------
-- Starting command on Fri Jan 16 15:44:27 2026 with 4521733.875 GB free disk space

    cd unitigging
    /share/org/YZWL/yzwl_lixg/miniforge3/envs/canu_v.2.3/bin/tgStoreDump \
      -S ../A3-14.seqStore \
      -T ./A3-14.ctgStore 2 \
      -sizes -s 85000000 \
    > ./A3-14.ctgStore/seqDB.v002.sizes.txt
ZERO length suplied to intervalList::add(), ignoring interval.
ZERO length suplied to intervalList::add(), ignoring interval.
ZERO length suplied to intervalList::add(), ignoring interval.
ZERO length suplied to intervalList::add(), ignoring interval.
ZERO length suplied to intervalList::add(), ignoring interval.
ZERO length suplied to intervalList::add(), ignoring interval.
ZERO length suplied to intervalList::add(), ignoring interval.
ZERO length suplied to intervalList::add(), ignoring interval.
ZERO length suplied to intervalList::add(), ignoring interval.
ZERO length suplied to intervalList::add(), ignoring interval.
ZERO length suplied to intervalList::add(), ignoring interval.
ZERO length suplied to intervalList::add(), ignoring interval.
ZERO length suplied to intervalList::add(), ignoring interval.
ZERO length suplied to intervalList::add(), ignoring interval.
ZERO length suplied to intervalList::add(), ignoring interval.
ZERO length suplied to intervalList::add(), ignoring interval.
ZERO length suplied to intervalList::add(), ignoring interval.
ZERO length suplied to intervalList::add(), ignoring interval.
ZERO length suplied to intervalList::add(), ignoring interval.
ZERO length suplied to intervalList::add(), ignoring interval.
ZERO length suplied to intervalList::add(), ignoring interval.
ZERO length suplied to intervalList::add(), ignoring interval.
ZERO length suplied to intervalList::add(), ignoring interval.
ZERO length suplied to intervalList::add(), ignoring interval.
ZERO length suplied to intervalList::add(), ignoring interval.
ZERO length suplied to intervalList::add(), ignoring interval.
ZERO length suplied to intervalList::add(), ignoring interval.
ZERO length suplied to intervalList::add(), ignoring interval.
ZERO length suplied to intervalList::add(), ignoring interval.
ZERO length suplied to intervalList::add(), ignoring interval.
ZERO length suplied to intervalList::add(), ignoring interval.
ZERO length suplied to intervalList::add(), ignoring interval.
ZERO length suplied to intervalList::add(), ignoring interval.

-- Finished on Fri Jan 16 15:44:27 2026 (like a bat out of hell) with 4521733.875 GB free disk space
----------------------------------------
-- Found, in version 2, after consensus generation:
--   contigs:      92 sequences, total length 89316786 bp (including 137 repeats of total length 4249877 bp).
--   bubbles:      156 sequences, total length 5422500 bp.
--   unassembled:  19027 sequences, total length 314294768 bp.
--
-- Contig sizes based on genome size 85mbp:
--
--            NG (bp)  LG (contigs)    sum (bp)
--         ----------  ------------  ----------
--     10    11364267             1    11364267
--     20    10475828             2    21840095
--     30     7552291             3    29392386
--     40     7219659             4    36612045
--     50     5409990             6    47804345
--     60     5309296             7    53113641
--     70     4391595             9    62119865
--     80     4373193            11    70873139
--     90     3145925            13    77869132
--    100     1127759            18    85823518
--
-- Finished stage 'consensusLoad', reset canuIteration.
----------------------------------------
-- Starting command on Fri Jan 16 15:44:27 2026 with 4521733.859 GB free disk space

    cd .
    /share/org/YZWL/yzwl_lixg/miniforge3/envs/canu_v.2.3/bin/tgStoreDump \
      -S ./A3-14.seqStore \
      -T ./unitigging/A3-14.ctgStore 2 \
      -o ./A3-14.contigs \
      -layout \
    > ./A3-14.contigs.layout.err 2>&1

-- Finished on Fri Jan 16 15:44:27 2026 (lickety-split) with 4521733.812 GB free disk space
----------------------------------------
----------------------------------------
-- Starting command on Fri Jan 16 15:44:27 2026 with 4521733.812 GB free disk space

    cd .
    /share/org/YZWL/yzwl_lixg/miniforge3/envs/canu_v.2.3/bin/tgStoreDump \
      -S ./A3-14.seqStore \
      -T ./unitigging/A3-14.ctgStore 2 \
      -consensus -fasta \
      -unassembled \
    > ./A3-14.unassembled.fasta
    2> ./A3-14.unassembled.err
ZERO length suplied to intervalList::add(), ignoring interval.
ZERO length suplied to intervalList::add(), ignoring interval.
ZERO length suplied to intervalList::add(), ignoring interval.
ZERO length suplied to intervalList::add(), ignoring interval.
ZERO length suplied to intervalList::add(), ignoring interval.
ZERO length suplied to intervalList::add(), ignoring interval.
ZERO length suplied to intervalList::add(), ignoring interval.
ZERO length suplied to intervalList::add(), ignoring interval.
ZERO length suplied to intervalList::add(), ignoring interval.
ZERO length suplied to intervalList::add(), ignoring interval.
ZERO length suplied to intervalList::add(), ignoring interval.
ZERO length suplied to intervalList::add(), ignoring interval.
ZERO length suplied to intervalList::add(), ignoring interval.
ZERO length suplied to intervalList::add(), ignoring interval.
ZERO length suplied to intervalList::add(), ignoring interval.
ZERO length suplied to intervalList::add(), ignoring interval.
ZERO length suplied to intervalList::add(), ignoring interval.
ZERO length suplied to intervalList::add(), ignoring interval.
ZERO length suplied to intervalList::add(), ignoring interval.
ZERO length suplied to intervalList::add(), ignoring interval.
ZERO length suplied to intervalList::add(), ignoring interval.
ZERO length suplied to intervalList::add(), ignoring interval.
ZERO length suplied to intervalList::add(), ignoring interval.
ZERO length suplied to intervalList::add(), ignoring interval.
ZERO length suplied to intervalList::add(), ignoring interval.
ZERO length suplied to intervalList::add(), ignoring interval.
ZERO length suplied to intervalList::add(), ignoring interval.
ZERO length suplied to intervalList::add(), ignoring interval.
ZERO length suplied to intervalList::add(), ignoring interval.
ZERO length suplied to intervalList::add(), ignoring interval.
ZERO length suplied to intervalList::add(), ignoring interval.
ZERO length suplied to intervalList::add(), ignoring interval.
ZERO length suplied to intervalList::add(), ignoring interval.

-- Finished on Fri Jan 16 15:44:29 2026 (2 seconds) with 4521733.5 GB free disk space
----------------------------------------
----------------------------------------
-- Starting command on Fri Jan 16 15:44:29 2026 with 4521733.5 GB free disk space

    cd .
    /share/org/YZWL/yzwl_lixg/miniforge3/envs/canu_v.2.3/bin/tgStoreDump \
      -S ./A3-14.seqStore \
      -T ./unitigging/A3-14.ctgStore 2 \
      -consensus -fasta \
      -contigs \
    > ./A3-14.contigs.fasta
    2> ./A3-14.contigs.err
ZERO length suplied to intervalList::add(), ignoring interval.
ZERO length suplied to intervalList::add(), ignoring interval.
ZERO length suplied to intervalList::add(), ignoring interval.
ZERO length suplied to intervalList::add(), ignoring interval.
ZERO length suplied to intervalList::add(), ignoring interval.
ZERO length suplied to intervalList::add(), ignoring interval.
ZERO length suplied to intervalList::add(), ignoring interval.
ZERO length suplied to intervalList::add(), ignoring interval.
ZERO length suplied to intervalList::add(), ignoring interval.
ZERO length suplied to intervalList::add(), ignoring interval.
ZERO length suplied to intervalList::add(), ignoring interval.
ZERO length suplied to intervalList::add(), ignoring interval.
ZERO length suplied to intervalList::add(), ignoring interval.
ZERO length suplied to intervalList::add(), ignoring interval.
ZERO length suplied to intervalList::add(), ignoring interval.
ZERO length suplied to intervalList::add(), ignoring interval.
ZERO length suplied to intervalList::add(), ignoring interval.
ZERO length suplied to intervalList::add(), ignoring interval.
ZERO length suplied to intervalList::add(), ignoring interval.
ZERO length suplied to intervalList::add(), ignoring interval.
ZERO length suplied to intervalList::add(), ignoring interval.
ZERO length suplied to intervalList::add(), ignoring interval.
ZERO length suplied to intervalList::add(), ignoring interval.
ZERO length suplied to intervalList::add(), ignoring interval.
ZERO length suplied to intervalList::add(), ignoring interval.
ZERO length suplied to intervalList::add(), ignoring interval.
ZERO length suplied to intervalList::add(), ignoring interval.
ZERO length suplied to intervalList::add(), ignoring interval.
ZERO length suplied to intervalList::add(), ignoring interval.
ZERO length suplied to intervalList::add(), ignoring interval.
ZERO length suplied to intervalList::add(), ignoring interval.
ZERO length suplied to intervalList::add(), ignoring interval.
ZERO length suplied to intervalList::add(), ignoring interval.

-- Finished on Fri Jan 16 15:44:30 2026 (one second) with 4521733.39 GB free disk space
----------------------------------------
-- Finished stage 'generateOutputs', reset canuIteration.
--
-- Assembly 'A3-14' finished in '/share/org/YZWL/yzwl_lixg/project/28.大豆疫霉菌三代基因组/03.hicanu/A3-14/01.raw_output'.
--
-- Summary saved in 'A3-14.report'.
--
-- Sequences saved:
--   Contigs       -> 'A3-14.contigs.fasta'
--   Unassembled   -> 'A3-14.unassembled.fasta'
--
-- Read layouts saved:
--   Contigs       -> 'A3-14.contigs.layout'.
--
-- Bye.

2026-01-16 15:44:30.066 - WARNING - 输出文件不存在|Output file does not exist: /share/org/YZWL/yzwl_lixg/project/28.大豆疫霉菌三代基因组/03.hicanu/A3-14/01.raw_output/A3-14.unitigs.fasta
Job 68889950 stderr output:

