2026-01-16 15:31:31.998 - WARNING - 命令错误输出|Command stderr:
-- canu master +27 changes (r10515 2a41e933b8de6ed66723d75d36dd071b46d2c347)
--
-- CITATIONS
--
-- For assemblies of PacBio HiFi reads:
--   Nurk S, Walenz BP, Rhiea A, Vollger MR, Logsdon GA, Grothe R, Miga KH, Eichler EE, Phillippy AM, Koren S.
--   HiCanu: accurate assembly of segmental duplications, satellites, and allelic variants from high-fidelity long reads.
--   biorXiv. 2020.
--   https://doi.org/10.1101/2020.03.14.992248
-- 
-- Read and contig alignments during correction and consensus use:
--   Šošic M, Šikic M.
--   Edlib: a C/C ++ library for fast, exact sequence alignment using edit distance.
--   Bioinformatics. 2017 May 1;33(9):1394-1395.
--   http://doi.org/10.1093/bioinformatics/btw753
-- 
-- Overlaps are generated using:
--   Berlin K, et al.
--   Assembling large genomes with single-molecule sequencing and locality-sensitive hashing.
--   Nat Biotechnol. 2015 Jun;33(6):623-30.
--   http://doi.org/10.1038/nbt.3238
-- 
--   Myers EW, et al.
--   A Whole-Genome Assembly of Drosophila.
--   Science. 2000 Mar 24;287(5461):2196-204.
--   http://doi.org/10.1126/science.287.5461.2196
-- 
-- Contig consensus sequences are generated using an algorithm derived from pbdagcon:
--   Chin CS, et al.
--   Nonhybrid, finished microbial genome assemblies from long-read SMRT sequencing data.
--   Nat Methods. 2013 Jun;10(6):563-9
--   http://doi.org/10.1038/nmeth.2474
-- 
-- CONFIGURE CANU
--
-- Detected Java(TM) Runtime Environment '25.0.1-internal' (from '/share/org/YZWL/yzwl_lixg/miniforge3/envs/telocomp/lib/jvm/bin/java') without -d64 support.
--
-- WARNING:
-- WARNING:  Failed to run gnuplot using command 'gnuplot'.
-- WARNING:  Plots will be disabled.
-- WARNING:
--
-- Detected samtools version '1.22' / htslib version 'htscodecs=1.6.3' (from 'samtools').
--
-- Detected 88 CPUs and 503 gigabytes of memory on the local machine.
--
-- Detected Slurm with 'sinfo' binary in /opt/skyformai/bin/sinfo.
--          Slurm disabled by useGrid=false
--
-- Detected  '' with 'pbsnodes' binary in /opt/skyformai/bin/pbsnodes.
--           disabled by useGrid=false
--
-- Detected LSF with 'bsub' binary in /opt/skyformai/bin/bsub.
--          LSF disabled by useGrid=false
--
-- Local machine mode enabled; grid support not detected or not allowed.
--
-- Found trimmed raw PacBio HiFi reads in the input files.
--
--                                (tag)Concurrency
--                         (tag)Threads          |
--                (tag)Memory         |          |
--        (tag)             |         |          |       total usage      algorithm
--        -------  ----------  --------   --------  --------------------  -----------------------------
-- Local: meryl     12.000 GB    4 CPUs x  22 jobs   264.000 GB  88 CPUs  (k-mer counting)
-- Local: cormhap   13.000 GB   11 CPUs x   8 jobs   104.000 GB  88 CPUs  (overlap detection with mhap)
-- Local: obtovl     8.000 GB    8 CPUs x  11 jobs    88.000 GB  88 CPUs  (overlap detection)
-- Local: utgovl     8.000 GB    8 CPUs x  11 jobs    88.000 GB  88 CPUs  (overlap detection)
-- Local: cor        -.--- GB    4 CPUs x   - jobs     -.--- GB   - CPUs  (read correction)
-- Local: ovb        4.000 GB    1 CPU  x  88 jobs   352.000 GB  88 CPUs  (overlap store bucketizer)
-- Local: ovs        8.000 GB    1 CPU  x  62 jobs   496.000 GB  62 CPUs  (overlap store sorting)
-- Local: red       16.000 GB    4 CPUs x  22 jobs   352.000 GB  88 CPUs  (read error detection)
-- Local: oea        8.000 GB    1 CPU  x  62 jobs   496.000 GB  62 CPUs  (overlap error adjustment)
-- Local: bat       32.000 GB    8 CPUs x   1 job     32.000 GB   8 CPUs  (contig construction with bogart)
-- Local: cns        -.--- GB    8 CPUs x   - jobs     -.--- GB   - CPUs  (consensus)
--
-- Generating assembly 'B4-10' in '/share/org/YZWL/yzwl_lixg/project/28.大豆疫霉菌三代基因组/03.hicanu/B4-10/01.raw_output':
--   genomeSize:
--     85000000
--
--   Overlap Generation Limits:
--     corOvlErrorRate 0.0000 (  0.00%)
--     obtOvlErrorRate 0.0250 (  2.50%)
--     utgOvlErrorRate 0.0100 (  1.00%)
--
--   Overlap Processing Limits:
--     corErrorRate    0.0000 (  0.00%)
--     obtErrorRate    0.0250 (  2.50%)
--     utgErrorRate    0.0003 (  0.03%)
--     cnsErrorRate    0.0500 (  5.00%)
--
--   Stages to run:
--     assemble HiFi reads.
--
--
-- BEGIN STORE CREATION
----------------------------------------
-- Starting command on Fri Jan 16 12:59:13 2026 with 4534002.765 GB free disk space

    cd .
    ./B4-10.seqStore.sh \
    > ./B4-10.seqStore.err 2>&1

-- Finished on Fri Jan 16 13:06:13 2026 (420 seconds) with 4534033.343 GB free disk space
----------------------------------------
--
-- In sequence store './B4-10.seqStore':
--   Found 268900 reads.
--   Found 4250007781 bases (50 times coverage).
--    Histogram of corrected reads:
--    
--    G=4250007781                       sum of  ||               length     num
--    NG         length     index       lengths  ||                range    seqs
--    ----- ------------ --------- ------------  ||  ------------------- -------
--    00010        24521     15843    425010436  ||       1242-2415         4887|-----------
--    00020        22240     34120    850013021  ||       2416-3589         8934|-------------------
--    00030        20738     53935   1275014370  ||       3590-4763         9002|-------------------
--    00040        19561     75056   1700013580  ||       4764-5937         8957|-------------------
--    00050        18582     97359   2125007773  ||       5938-7111         8258|-----------------
--    00060        17680    120808   2550016775  ||       7112-8285         7713|----------------
--    00070        16755    145484   2975011791  ||       8286-9459         7263|---------------
--    00080        15504    171764   3400014255  ||       9460-10633        6543|--------------
--    00090        11732    201979   3825016431  ||      10634-11807        5741|------------
--    00100         1242    268900   4250007781  ||      11808-12981        5744|------------
--    001.000x              268900   4250007781  ||      12982-14155        7695|----------------
--                                               ||      14156-15329       13424|----------------------------
--                                               ||      15330-16503       23118|------------------------------------------------
--                                               ||      16504-17677       30750|---------------------------------------------------------------
--                                               ||      17678-18851       30120|--------------------------------------------------------------
--                                               ||      18852-20025       24728|---------------------------------------------------
--                                               ||      20026-21199       18918|---------------------------------------
--                                               ||      21200-22373       14453|------------------------------
--                                               ||      22374-23547       10518|----------------------
--                                               ||      23548-24721        7399|----------------
--                                               ||      24722-25895        5366|-----------
--                                               ||      25896-27069        3708|--------
--                                               ||      27070-28243        2412|-----
--                                               ||      28244-29417        1469|----
--                                               ||      29418-30591         893|--
--                                               ||      30592-31765         485|-
--                                               ||      31766-32939         230|-
--                                               ||      32940-34113         117|-
--                                               ||      34114-35287          31|-
--                                               ||      35288-36461          16|-
--                                               ||      36462-37635           4|-
--                                               ||      37636-38809           1|-
--                                               ||      38810-39983           2|-
--                                               ||      39984-41157           0|
--                                               ||      41158-42331           0|
--                                               ||      42332-43505           0|
--                                               ||      43506-44679           0|
--                                               ||      44680-45853           0|
--                                               ||      45854-47027           0|
--                                               ||      47028-48201           1|-
--    
--
-- In sequence store './B4-10.seqStore':
--   Found 268900 reads.
--   Found 4250007781 bases (50 times coverage).
--    Histogram of corrected-trimmed reads:
--    
--    G=4250007781                       sum of  ||               length     num
--    NG         length     index       lengths  ||                range    seqs
--    ----- ------------ --------- ------------  ||  ------------------- -------
--    00010        24521     15843    425010436  ||       1242-2415         4887|-----------
--    00020        22240     34120    850013021  ||       2416-3589         8934|-------------------
--    00030        20738     53935   1275014370  ||       3590-4763         9002|-------------------
--    00040        19561     75056   1700013580  ||       4764-5937         8957|-------------------
--    00050        18582     97359   2125007773  ||       5938-7111         8258|-----------------
--    00060        17680    120808   2550016775  ||       7112-8285         7713|----------------
--    00070        16755    145484   2975011791  ||       8286-9459         7263|---------------
--    00080        15504    171764   3400014255  ||       9460-10633        6543|--------------
--    00090        11732    201979   3825016431  ||      10634-11807        5741|------------
--    00100         1242    268900   4250007781  ||      11808-12981        5744|------------
--    001.000x              268900   4250007781  ||      12982-14155        7695|----------------
--                                               ||      14156-15329       13424|----------------------------
--                                               ||      15330-16503       23118|------------------------------------------------
--                                               ||      16504-17677       30750|---------------------------------------------------------------
--                                               ||      17678-18851       30120|--------------------------------------------------------------
--                                               ||      18852-20025       24728|---------------------------------------------------
--                                               ||      20026-21199       18918|---------------------------------------
--                                               ||      21200-22373       14453|------------------------------
--                                               ||      22374-23547       10518|----------------------
--                                               ||      23548-24721        7399|----------------
--                                               ||      24722-25895        5366|-----------
--                                               ||      25896-27069        3708|--------
--                                               ||      27070-28243        2412|-----
--                                               ||      28244-29417        1469|----
--                                               ||      29418-30591         893|--
--                                               ||      30592-31765         485|-
--                                               ||      31766-32939         230|-
--                                               ||      32940-34113         117|-
--                                               ||      34114-35287          31|-
--                                               ||      35288-36461          16|-
--                                               ||      36462-37635           4|-
--                                               ||      37636-38809           1|-
--                                               ||      38810-39983           2|-
--                                               ||      39984-41157           0|
--                                               ||      41158-42331           0|
--                                               ||      42332-43505           0|
--                                               ||      43506-44679           0|
--                                               ||      44680-45853           0|
--                                               ||      45854-47027           0|
--                                               ||      47028-48201           1|-
--    
--
-- Correction skipped; not enabled.
--
-- Trimming skipped; not enabled.
--
-- BEGIN ASSEMBLY
----------------------------------------
-- Starting command on Fri Jan 16 13:06:13 2026 with 4534033.281 GB free disk space

    cd unitigging/0-mercounts
    ./meryl-configure.sh \
    > ./meryl-configure.err 2>&1

-- Finished on Fri Jan 16 13:06:14 2026 (one second) with 4534033.281 GB free disk space
----------------------------------------
--  segments   memory batches
--  -------- -------- -------
--        01 10.72 GB       2
--        02  5.61 GB       2
--        04  2.94 GB       2
--        06  2.13 GB       2
--        08  1.60 GB       2
--        12  1.07 GB       2
--        16  0.80 GB       2
--        20  0.65 GB       2
--        24  0.54 GB       2
--        32  0.40 GB       2
--        40  0.32 GB       2
--        48  -.-- GB       -  (segment size too small)
--        56  -.-- GB       -  (segment size too small)
--        64  -.-- GB       -  (segment size too small)
--        96  -.-- GB       -  (segment size too small)
--
--  For 268900 reads with 4250007781 bases, limit to 42 batches.
--  Will count kmers using 01 jobs, each using 12 GB and 4 threads.
--
-- Finished stage 'merylConfigure', reset canuIteration.
--
-- Running jobs.  First attempt out of 2.
----------------------------------------
-- Starting 'meryl' concurrent execution on Fri Jan 16 13:06:14 2026 with 4534033.25 GB free disk space (1 processes; 22 concurrently)

    cd unitigging/0-mercounts
    ./meryl-count.sh 1 > ./meryl-count.000001.out 2>&1

-- Finished on Fri Jan 16 13:09:46 2026 (212 seconds) with 4533608.046 GB free disk space
----------------------------------------
-- Found 1 Kmer counting (meryl) outputs.
-- Finished stage 'utg-merylCountCheck', reset canuIteration.
--
-- Running jobs.  First attempt out of 2.
----------------------------------------
-- Starting 'meryl' concurrent execution on Fri Jan 16 13:09:46 2026 with 4533608.015 GB free disk space (1 processes; 22 concurrently)

    cd unitigging/0-mercounts
    ./meryl-process.sh 1 > ./meryl-process.000001.out 2>&1

-- Finished on Fri Jan 16 13:09:49 2026 (3 seconds) with 4533607.609 GB free disk space
----------------------------------------
-- Meryl finished successfully.  Kmer frequency histogram:
--
-- WARNING: gnuplot failed.
--
----------------------------------------
--
--  22-mers                                                                                           Fraction
--    Occurrences   NumMers                                                                         Unique Total
--       1-     1         0                                                                        0.0000 0.0000
--       2-     2    227164                                                                        0.0051 0.0001
--       3-     4     72615                                                                        0.0062 0.0002
--       5-     7     17851                                                                        0.0069 0.0002
--       8-    11      5722                                                                        0.0071 0.0003
--      12-    16     11194                                                                        0.0072 0.0003
--      17-    22     75130                                                                        0.0076 0.0003
--      23-    29    771108 ***                                                                    0.0098 0.0010
--      30-    37   5193981 **********************                                                 0.0326 0.0099
--      38-    46  16080041 ********************************************************************** 0.1705 0.0784
--      47-    56  14588141 ***************************************************************        0.5458 0.3064
--      57-    67   3031693 *************                                                          0.8392 0.5186
--      68-    79    628543 **                                                                     0.8936 0.5650
--      80-    92   1008211 ****                                                                   0.9078 0.5799
--      93-   106    848717 ***                                                                    0.9304 0.6076
--     107-   121    288963 *                                                                      0.9483 0.6324
--     122-   137    284271 *                                                                      0.9544 0.6422
--     138-   154    282630 *                                                                      0.9608 0.6541
--     155-   172    150270                                                                        0.9669 0.6665
--     173-   191    158785                                                                        0.9702 0.6742
--     192-   211    122930                                                                        0.9737 0.6831
--     212-   232    107356                                                                        0.9764 0.6907
--     233-   254    108064                                                                        0.9788 0.6982
--     255-   277     85113                                                                        0.9812 0.7064
--     278-   301     77975                                                                        0.9831 0.7133
--     302-   326     61518                                                                        0.9848 0.7203
--     327-   352     55421                                                                        0.9862 0.7263
--     353-   379     44911                                                                        0.9874 0.7323
--     380-   407     45431                                                                        0.9884 0.7373
--     408-   436     35461                                                                        0.9894 0.7429
--     437-   466     36737                                                                        0.9902 0.7475
--     467-   497     29838                                                                        0.9910 0.7527
--     498-   529     26330                                                                        0.9916 0.7572
--     530-   562     22221                                                                        0.9922 0.7614
--     563-   596     19862                                                                        0.9927 0.7651
--     597-   631     17133                                                                        0.9932 0.7687
--     632-   667     16509                                                                        0.9935 0.7720
--     668-   704     14118                                                                        0.9939 0.7753
--     705-   742     12978                                                                        0.9942 0.7784
--     743-   781     12177                                                                        0.9945 0.7813
--     782-   821     11177                                                                        0.9948 0.7842
--
--           0 (max occurrences)
--  3203091723 (total mers, non-unique)
--    44912198 (distinct mers, non-unique)
--           0 (unique mers)
-- Finished stage 'meryl-process', reset canuIteration.
--
-- Removing meryl database 'unitigging/0-mercounts/B4-10.ms22'.
--
-- OVERLAPPER (normal) (assembly) erate=0.01
--
----------------------------------------
-- Starting command on Fri Jan 16 13:09:49 2026 with 4533608.703 GB free disk space

    cd unitigging/1-overlapper
    /share/org/YZWL/yzwl_lixg/miniforge3/envs/canu_v.2.3/bin/overlapInCorePartition \
     -S  ../../B4-10.seqStore \
     -hl 160000000 \
     -rl 5000000000 \
     -ol 500 \
     -o  ./B4-10.partition \
    > ./B4-10.partition.err 2>&1

-- Finished on Fri Jan 16 13:09:50 2026 (one second) with 4533608.687 GB free disk space
----------------------------------------
--
-- Configured 21 overlapInCore jobs.
-- Finished stage 'utg-overlapConfigure', reset canuIteration.
--
-- Running jobs.  First attempt out of 2.
----------------------------------------
-- Starting 'utgovl' concurrent execution on Fri Jan 16 13:09:50 2026 with 4533608.656 GB free disk space (21 processes; 11 concurrently)

    cd unitigging/1-overlapper
    ./overlap.sh 1 > ./overlap.000001.out 2>&1
    ./overlap.sh 2 > ./overlap.000002.out 2>&1
    ./overlap.sh 3 > ./overlap.000003.out 2>&1
    ./overlap.sh 4 > ./overlap.000004.out 2>&1
    ./overlap.sh 5 > ./overlap.000005.out 2>&1
    ./overlap.sh 6 > ./overlap.000006.out 2>&1
    ./overlap.sh 7 > ./overlap.000007.out 2>&1
    ./overlap.sh 8 > ./overlap.000008.out 2>&1
    ./overlap.sh 9 > ./overlap.000009.out 2>&1
    ./overlap.sh 10 > ./overlap.000010.out 2>&1
    ./overlap.sh 11 > ./overlap.000011.out 2>&1
    ./overlap.sh 12 > ./overlap.000012.out 2>&1
    ./overlap.sh 13 > ./overlap.000013.out 2>&1
    ./overlap.sh 14 > ./overlap.000014.out 2>&1
    ./overlap.sh 15 > ./overlap.000015.out 2>&1
    ./overlap.sh 16 > ./overlap.000016.out 2>&1
    ./overlap.sh 17 > ./overlap.000017.out 2>&1
    ./overlap.sh 18 > ./overlap.000018.out 2>&1
    ./overlap.sh 19 > ./overlap.000019.out 2>&1
    ./overlap.sh 20 > ./overlap.000020.out 2>&1
    ./overlap.sh 21 > ./overlap.000021.out 2>&1

-- Finished on Fri Jan 16 13:56:04 2026 (2774 seconds) with 4532305.593 GB free disk space
----------------------------------------
-- Found 21 overlapInCore output files.
--
-- overlapInCore compute 'unitigging/1-overlapper':
--   kmer hits
--     with no overlap       1422945012  86.2857143 +- 43075690.766
--     with an overlap         51277875  3.57142857 +- 1405155.522
--
--   overlaps                  51277875  3.57142857 +- 1405155.522
--     contained               11839046  .095238095 +- 320425.344
--     dovetail                39438829  9.47619048 +- 1087103.159
--
--   overlaps rejected
--     multiple per pair              0           0 +- 0
--     bad short window               0           0 +- 0
--     bad long window                0           0 +- 0
-- Finished stage 'utg-overlapCheck', reset canuIteration.
----------------------------------------
-- Starting command on Fri Jan 16 13:56:04 2026 with 4532305.578 GB free disk space

    cd unitigging
    /share/org/YZWL/yzwl_lixg/miniforge3/envs/canu_v.2.3/bin/ovStoreConfig \
     -S ../B4-10.seqStore \
     -M 4-8 \
     -L ./1-overlapper/ovljob.files \
     -create ./B4-10.ovlStore.config \
     > ./B4-10.ovlStore.config.txt \
    2> ./B4-10.ovlStore.config.err

-- Finished on Fri Jan 16 13:56:04 2026 (fast as lightning) with 4532305.562 GB free disk space
----------------------------------------
--
-- Creating overlap store unitigging/B4-10.ovlStore using:
--      1 bucket
--      1 slice
--        using at most 4 GB memory each
--
-- Running jobs.  First attempt out of 2.
----------------------------------------
-- Starting 'ovS' concurrent execution on Fri Jan 16 13:56:04 2026 with 4532305.546 GB free disk space (1 processes; 62 concurrently)

    cd unitigging
    ./B4-10.ovlStore.sh 1 > ./B4-10.ovlStore.000001.out 2>&1

-- Finished on Fri Jan 16 13:56:25 2026 (21 seconds) with 4532319.296 GB free disk space
----------------------------------------
-- Checking store.
----------------------------------------
-- Starting command on Fri Jan 16 13:56:25 2026 with 4532319.296 GB free disk space

    cd unitigging
    /share/org/YZWL/yzwl_lixg/miniforge3/envs/canu_v.2.3/bin/ovStoreDump \
     -S ../B4-10.seqStore \
     -O  ./B4-10.ovlStore \
     -counts \
     > ./B4-10.ovlStore/counts.dat 2> ./B4-10.ovlStore/counts.err

-- Finished on Fri Jan 16 13:56:25 2026 (lickety-split) with 4532319.281 GB free disk space
----------------------------------------
--
-- Overlap store 'unitigging/B4-10.ovlStore' successfully constructed.
-- Found 102555750 overlaps for 262431 reads; 1467464 reads have no overlaps.
--
--
-- Purged 0.996 GB in 63 overlap output files.
----------------------------------------
-- Starting command on Fri Jan 16 13:56:26 2026 with 4532320.25 GB free disk space

    cd unitigging
    /share/org/YZWL/yzwl_lixg/miniforge3/envs/canu_v.2.3/bin/ovStoreStats \
     -C 50 \
     -S ../B4-10.seqStore \
     -O  ./B4-10.ovlStore \
     -o  ./B4-10.ovlStore \
     > ./B4-10.ovlStore.summary.err 2>&1

-- Finished on Fri Jan 16 13:56:41 2026 (15 seconds) with 4532320.234 GB free disk space
----------------------------------------
--
-- Overlap store 'unitigging/B4-10.ovlStore' contains:
--
--   category            reads     %          read length        feature size or coverage  analysis
--   ----------------  -------  -------  ----------------------  ------------------------  --------------------
--   middle-missing        130    0.05    13917.11 +- 6149.16        731.35 +- 778.82     (bad trimming)
--   middle-hump            21    0.01    12131.48 +- 3107.60       3840.62 +- 3575.82    (bad trimming)
--   no-5-prime            490    0.18    11907.49 +- 4601.76       1513.27 +- 2242.57    (bad trimming)
--   no-3-prime            469    0.17    11059.65 +- 5058.47       1698.47 +- 2539.63    (bad trimming)
--   
--   low-coverage         1306    0.49     9447.95 +- 4401.34          5.60 +- 3.68       (easy to assemble, potential for lower quality consensus)
--   unique             214642   79.82    12132.09 +- 4941.27         45.61 +- 8.13       (easy to assemble, perfect, yay)
--   repeat-cont         20421    7.59    10300.90 +- 4356.76       2167.34 +- 1686.43    (potential for consensus errors, no impact on assembly)
--   repeat-dove           204    0.08    19840.50 +- 2055.62        673.14 +- 969.17     (hard to assemble, likely won't assemble correctly or even at all)
--   
--   span-repeat          2487    0.92    13139.44 +- 4263.93       2753.64 +- 3207.60    (read spans a large repeat, usually easy to assemble)
--   uniq-repeat-cont    14133    5.26    11983.32 +- 4102.04                             (should be uniquely placed, low potential for consensus errors, no impact on assembly)
--   uniq-repeat-dove     2824    1.05    17723.75 +- 2847.81                             (will end contigs, potential to misassemble)
--   uniq-anchor          5304    1.97    12758.70 +- 4181.17       7701.82 +- 4509.00    (repeat read, with unique section, probable bad read)
-- Finished stage 'utg-createOverlapStore', reset canuIteration.
--
-- Loading read lengths.
-- Loading number of overlaps per read.
--
-- Configure RED for 16gb memory.
--                   Batches of at most (unlimited) reads.
--                                      500000000 bases.
--                   Expecting evidence of at most 536870912 bases per iteration.
--
--           Total                                               Reads                 Olaps Evidence
--    Job   Memory      Read Range         Reads        Bases   Memory        Olaps   Memory   Memory  (Memory in MB)
--   ---- -------- ------------------- --------- ------------ -------- ------------ -------- --------
--      1 16385.49         1-38208          5992    108856917 13288.39      2193212    25.10  1024.00
--      2 16386.16     38209-80711          6571    108850114 13287.57      2323302    26.59  1024.00
--      3 16384.26     80712-126961         7258    108869118 13289.92      1952821    22.35  1024.00
--      4 16385.29    126962-167135         6264    108689928 13268.01      3956294    45.28  1024.00
--      5 16384.11    167136-212487         7007    108871936 13290.25      1910161    21.86  1024.00
--      6 16384.92    212488-262373         7850    108816029 13283.45      2574771    29.47  1024.00
--      7 16385.13    262374-302993         6273    108717700 13271.40      3646389    41.73  1024.00
--      8 16384.11    302994-348727         7060    108874295 13290.54      1884764    21.57  1024.00
--      9 16384.09    348728-400369         8034    108791725 13280.49      2761032    31.60  1024.00
--     10 16385.64    400370-440097         6219    108705261 13269.88      3823584    43.76  1024.00
--     11 16384.67    440098-484115         6873    108873927 13290.49      1937757    22.18  1024.00
--     12 16385.95    484116-535724         8107    108827382 13284.85      2542737    29.10  1024.00
--     13 16385.54    535725-575116         6165    108793714 13280.68      2871224    32.86  1024.00
--     14 16386.10    575117-617353         6658    108802594 13281.78      2824741    32.33  1024.00
--     15 16385.45    617354-668917         8160    108801095 13281.64      2779337    31.81  1024.00
--     16 16385.03    668918-709912         6181    108806937 13282.29      2686275    30.74  1024.00
--     17 16385.44    709913-752599         6647    108795416 13280.90      2843281    32.54  1024.00
--     18 16386.28    752600-805613         8238    108822373 13284.24      2625122    30.04  1024.00
--     19 16384.81    805614-844906         6170    108825483 13284.55      2468808    28.25  1024.00
--     20 16386.02    844907-887357         6658    108807207 13282.34      2768112    31.68  1024.00
--     21 16386.24    887358-940550         8375    108796132 13281.04      2900696    33.20  1024.00
--     22 16385.63    940551-979595         6114    108814167 13283.17      2661302    30.46  1024.00
--     23 16384.77    979596-1022070        6560    108797634 13281.17      2761345    31.60  1024.00
--     24 16384.56   1022071-1075254        8217    108806987 13282.36      2638924    30.20  1024.00
--     25 16385.10   1075255-1114442        6076    108808731 13282.51      2673392    30.59  1024.00
--     26 16385.79   1114443-1155802        6435    108810663 13282.75      2711972    31.04  1024.00
--     27 16386.17   1155803-1208099        8136    108836190 13285.92      2468561    28.25  1024.00
--     28 16384.80   1208100-1247096        6024    108824326 13284.41      2480533    28.39  1024.00
--     29 16385.23   1247097-1288636        6370    108796601 13281.04      2813107    32.19  1024.00
--     30 16385.83   1288637-1340155        7980    108824847 13284.53      2559618    29.29  1024.00
--     31 16385.47   1340156-1378552        5963    108831185 13285.24      2466598    28.23  1024.00
--     32 16384.90   1378553-1418561        6276    108799290 13281.36      2755809    31.54  1024.00
--     33 16385.18   1418562-1469608        7826    108818095 13283.71      2575249    29.47  1024.00
--     34 16384.07   1469609-1507451        5932    108856565 13288.34      2073332    23.73  1024.00
--     35 16385.93   1507452-1547348        6169    108804999 13282.05      2785417    31.88  1024.00
--     36 16386.29   1547349-1597492        7743    108838623 13286.21      2453517    28.08  1024.00
--     37 16385.25   1597493-1635717        5960    108864894 13289.36      2087673    23.89  1024.00
--     38 16384.72   1635718-1675906        6209    108795940 13280.95      2775864    31.77  1024.00
--     39 16385.61   1675907-1726729        7677    108834148 13285.66      2442739    27.95  1024.00
--     40  3835.89   1726730-1729895         473      6248613   762.79        96378     1.10  1024.00
--   ---- -------- ------------------- --------- ------------ -------- ------------ -------- --------
--                                                 4250007781             102555750
-- Finished stage 'readErrorDetectionConfigure', reset canuIteration.
--
-- Running jobs.  First attempt out of 2.
----------------------------------------
-- Starting 'red' concurrent execution on Fri Jan 16 13:56:48 2026 with 4532208.328 GB free disk space (40 processes; 22 concurrently)

    cd unitigging/3-overlapErrorAdjustment
    ./red.sh 1 > ./red.000001.out 2>&1
    ./red.sh 2 > ./red.000002.out 2>&1
    ./red.sh 3 > ./red.000003.out 2>&1
    ./red.sh 4 > ./red.000004.out 2>&1
    ./red.sh 5 > ./red.000005.out 2>&1
    ./red.sh 6 > ./red.000006.out 2>&1
    ./red.sh 7 > ./red.000007.out 2>&1
    ./red.sh 8 > ./red.000008.out 2>&1
    ./red.sh 9 > ./red.000009.out 2>&1
    ./red.sh 10 > ./red.000010.out 2>&1
    ./red.sh 11 > ./red.000011.out 2>&1
    ./red.sh 12 > ./red.000012.out 2>&1
    ./red.sh 13 > ./red.000013.out 2>&1
    ./red.sh 14 > ./red.000014.out 2>&1
    ./red.sh 15 > ./red.000015.out 2>&1
    ./red.sh 16 > ./red.000016.out 2>&1
    ./red.sh 17 > ./red.000017.out 2>&1
    ./red.sh 18 > ./red.000018.out 2>&1
    ./red.sh 19 > ./red.000019.out 2>&1
    ./red.sh 20 > ./red.000020.out 2>&1
    ./red.sh 21 > ./red.000021.out 2>&1
    ./red.sh 22 > ./red.000022.out 2>&1
    ./red.sh 23 > ./red.000023.out 2>&1
    ./red.sh 24 > ./red.000024.out 2>&1
    ./red.sh 25 > ./red.000025.out 2>&1
    ./red.sh 26 > ./red.000026.out 2>&1
    ./red.sh 27 > ./red.000027.out 2>&1
    ./red.sh 28 > ./red.000028.out 2>&1
    ./red.sh 29 > ./red.000029.out 2>&1
    ./red.sh 30 > ./red.000030.out 2>&1
    ./red.sh 31 > ./red.000031.out 2>&1
    ./red.sh 32 > ./red.000032.out 2>&1
    ./red.sh 33 > ./red.000033.out 2>&1
    ./red.sh 34 > ./red.000034.out 2>&1
    ./red.sh 35 > ./red.000035.out 2>&1
    ./red.sh 36 > ./red.000036.out 2>&1
    ./red.sh 37 > ./red.000037.out 2>&1
    ./red.sh 38 > ./red.000038.out 2>&1
    ./red.sh 39 > ./red.000039.out 2>&1
    ./red.sh 40 > ./red.000040.out 2>&1

-- Finished on Fri Jan 16 14:17:03 2026 (1215 seconds) with 4531065.375 GB free disk space
----------------------------------------
-- Found 40 read error detection output files.
-- Finished stage 'readErrorDetectionCheck', reset canuIteration.
--
-- Loading read lengths.
-- Loading number of overlaps per read.
--
-- Configure OEA for 8gb memory.
--                   Batches of at most (unlimited) reads.
--                                      300000000 bases.
--
--           Total                                               Reads                 Olaps  Adjusts
--    Job   Memory      Read Range         Reads        Bases   Memory        Olaps   Memory   Memory  (Memory in MB)
--   ---- -------- ------------------- --------- ------------ -------- ------------ -------- --------
--      1  2903.07         1-117483        18338    300015252   294.68      6300907   192.29   368.11
--      2  2962.77    117484-243439        19658    300014708   294.72      8255876   251.95   368.11
--      3  2912.63    243440-364966        18849    300001646   294.68      6614059   201.85   368.11
--      4  2949.23    364967-485585        18783    300010422   294.69      7813238   238.44   368.11
--      5  2956.67    485586-607635        19179    300005150   294.69      8056552   245.87   368.11
--      6  2949.31    607636-731855        19358    300013486   294.71      7815093   238.50   368.11
--      7  2926.58    731856-857246        19477    300013029   294.71      7070164   215.76   368.11
--      8  2925.85    857247-981971        19590    300005876   294.71      7046400   215.04   368.11
--      9  2933.08    981972-1107223       19354    300006530   294.70      7283555   222.28   368.11
--     10  2904.28   1107224-1230073       19156    300012012   294.70      6339878   193.48   368.11
--     11  2945.64   1230074-1352721       18893    300017037   294.70      7695065   234.83   368.11
--     12  2942.79   1352722-1472665       18613    300001161   294.67      7602624   232.01   368.11
--     13  2897.23   1472666-1587342       17828    300001315   294.65      6110277   186.47   368.11
--     14  2917.16   1587343-1703337       17791    300007239   294.65      6763337   206.40   368.11
--     15  2526.39   1703338-1729895        4033     49882918    55.70      1788725    54.59   368.11
--   ---- -------- ------------------- --------- ------------ -------- ------------ -------- --------
--                                                 4250007781             102555750
-- Finished stage 'overlapErrorAdjustmentConfigure', reset canuIteration.
--
-- Running jobs.  First attempt out of 2.
----------------------------------------
-- Starting 'oea' concurrent execution on Fri Jan 16 14:17:11 2026 with 4531065.296 GB free disk space (15 processes; 62 concurrently)

    cd unitigging/3-overlapErrorAdjustment
    ./oea.sh 1 > ./oea.000001.out 2>&1
    ./oea.sh 2 > ./oea.000002.out 2>&1
    ./oea.sh 3 > ./oea.000003.out 2>&1
    ./oea.sh 4 > ./oea.000004.out 2>&1
    ./oea.sh 5 > ./oea.000005.out 2>&1
    ./oea.sh 6 > ./oea.000006.out 2>&1
    ./oea.sh 7 > ./oea.000007.out 2>&1
    ./oea.sh 8 > ./oea.000008.out 2>&1
    ./oea.sh 9 > ./oea.000009.out 2>&1
    ./oea.sh 10 > ./oea.000010.out 2>&1
    ./oea.sh 11 > ./oea.000011.out 2>&1
    ./oea.sh 12 > ./oea.000012.out 2>&1
    ./oea.sh 13 > ./oea.000013.out 2>&1
    ./oea.sh 14 > ./oea.000014.out 2>&1
    ./oea.sh 15 > ./oea.000015.out 2>&1

-- Finished on Fri Jan 16 15:20:31 2026 (3800 seconds) with 4525107.093 GB free disk space
----------------------------------------
-- Found 15 overlap error adjustment output files.
-- Finished stage 'overlapErrorAdjustmentCheck', reset canuIteration.
----------------------------------------
-- Starting command on Fri Jan 16 15:20:31 2026 with 4525107.078 GB free disk space

    cd unitigging/3-overlapErrorAdjustment
    /share/org/YZWL/yzwl_lixg/miniforge3/envs/canu_v.2.3/bin/loadErates \
      -S ../../B4-10.seqStore \
      -O ../B4-10.ovlStore \
      -L ./oea.files \
    > ./oea.apply.err 2>&1

-- Finished on Fri Jan 16 15:20:31 2026 (like a bat out of hell) with 4525106.875 GB free disk space
----------------------------------------
-- No report available.
-- Finished stage 'updateOverlapStore', reset canuIteration.
-- Finished stage 'unitig', reset canuIteration.
--
-- Running jobs.  First attempt out of 2.
----------------------------------------
-- Starting 'bat' concurrent execution on Fri Jan 16 15:20:31 2026 with 4525106.828 GB free disk space (1 processes; 1 concurrently)

    cd unitigging/4-unitigger
    ./unitigger.sh 1 > ./unitigger.000001.out 2>&1

-- Finished on Fri Jan 16 15:21:01 2026 (30 seconds) with 4525054.843 GB free disk space
----------------------------------------
-- Unitigger finished successfully.
--  
--  ERROR RATES
--  -----------
--                                                   --------threshold------
--  293993                       fraction error      fraction        percent
--  samples                              (1e-5)         error          error
--                   --------------------------      --------       --------
--  command line (-eg)                           ->     30.00        0.0300%
--  command line (-ef)                           ->  -----.--      ---.----%
--  command line (-eM)                           ->     30.00        0.0300%
--  mean + std.dev       0.34 +-  12 *     2.69  ->     32.60        0.0326%
--  median + mad         0.00 +-  12 *     0.00  ->      0.00        0.0000%
--  90th percentile                              ->      1.00        0.0010%  (enabled)
--  
--  BEST EDGE FILTERING
--  -------------------
--  At graph threshold 0.0300%, reads:
--    available to have edges:        44739
--    with at least one edge:         36725
--  
--  At max threshold 0.0300%, reads:  (not computed)
--    available to have edges:            0
--    with at least one edge:             0
--  
--  At tight threshold 0.0010%, reads with:
--    both edges below error threshold:     32692  (80.00% minReadsBest threshold = 29380)
--    one  edge  above error threshold:      3049
--    both edges above error threshold:       984
--    at least one edge:                    36725
--  
--  At loose threshold 0.0300%, reads with:
--    both edges below error threshold:     36725  (80.00% minReadsBest threshold = 29380)
--    one  edge  above error threshold:         0
--    both edges above error threshold:         0
--    at least one edge:                    36725
--  
--  
--  INITIAL EDGES
--  -------- ----------------------------------------
--    218819 reads are contained
--   1479353 reads have no best edges (singleton)
--       373 reads have only one best edge (spur) 
--                185 are mutual best
--     31350 reads have two best edges 
--                789 have one mutual best edge
--              30200 have two mutual best edges
--  
--  
--  FINAL EDGES
--  -------- ----------------------------------------
--    218819 reads are contained
--   1479741 reads have no best edges (singleton)
--       280 reads have only one best edge (spur) 
--                225 are mutual best
--     31055 reads have two best edges 
--                607 have one mutual best edge
--              30188 have two mutual best edges
--  
--  
--  EDGE FILTERING
--  -------- ------------------------------------------
--         0 reads are ignored
--     10415 reads have a gap in overlap coverage
--       160 reads have lopsided best edges
-- Found, in version 1, after unitig construction:
--   contigs:      73 sequences, total length 67576403 bp (including 83 repeats of total length 2046869 bp).
--   bubbles:      121 sequences, total length 3234899 bp.
--   unassembled:  18867 sequences, total length 205281665 bp.
--
-- Contig sizes based on genome size 85mbp:
--
--            NG (bp)  LG (contigs)    sum (bp)
--         ----------  ------------  ----------
--     10     6196239             2    12680867
--     20     4584162             3    17265029
--     30     4534928             5    26365094
--     40     4221904             7    34935113
--     50     2980464            10    44615547
--     60     2731764            13    53217555
--     70     1590548            17    59977912
--
-- Finished stage 'unitigCheck', reset canuIteration.
----------------------------------------
-- Starting command on Fri Jan 16 15:21:01 2026 with 4525054.828 GB free disk space

    cd unitigging
    /share/org/YZWL/yzwl_lixg/miniforge3/envs/canu_v.2.3/bin/utgcns \
      -S ../B4-10.seqStore \
      -T  ./B4-10.ctgStore 1 \
      -partition 0.8 1.5 0.1 \
    > ./B4-10.ctgStore/partitioning.log 2>&1

-- Finished on Fri Jan 16 15:21:11 2026 (10 seconds) with 4525053.609 GB free disk space
----------------------------------------
-- Using slow alignment for consensus (iteration '0').
-- Configured 11 consensus jobs.
-- Finished stage 'consensusConfigure', reset canuIteration.
--
-- Local: cns        9.750 GB    8 CPUs x  11 jobs   107.250 GB  88 CPUs  (consensus)
--
--
-- Running jobs.  First attempt out of 2.
----------------------------------------
-- Starting 'cns' concurrent execution on Fri Jan 16 15:21:11 2026 with 4525053.578 GB free disk space (11 processes; 11 concurrently)

    cd unitigging/5-consensus
    ./consensus.sh 1 > ./consensus.000001.out 2>&1
    ./consensus.sh 2 > ./consensus.000002.out 2>&1
    ./consensus.sh 3 > ./consensus.000003.out 2>&1
    ./consensus.sh 4 > ./consensus.000004.out 2>&1
    ./consensus.sh 5 > ./consensus.000005.out 2>&1
    ./consensus.sh 6 > ./consensus.000006.out 2>&1
    ./consensus.sh 7 > ./consensus.000007.out 2>&1
    ./consensus.sh 8 > ./consensus.000008.out 2>&1
    ./consensus.sh 9 > ./consensus.000009.out 2>&1
    ./consensus.sh 10 > ./consensus.000010.out 2>&1
    ./consensus.sh 11 > ./consensus.000011.out 2>&1

-- Finished on Fri Jan 16 15:27:46 2026 (395 seconds) with 4524083.328 GB free disk space
----------------------------------------
-- Using slow alignment for consensus (iteration '1').
-- Configured 11 consensus jobs.
-- All 11 consensus jobs finished successfully.
-- Finished stage 'consensusCheck', reset canuIteration.
-- Using slow alignment for consensus (iteration '0').
-- Configured 11 consensus jobs.
----------------------------------------
-- Starting command on Fri Jan 16 15:27:47 2026 with 4524083.265 GB free disk space

    cd unitigging
    /share/org/YZWL/yzwl_lixg/miniforge3/envs/canu_v.2.3/bin/tgStoreLoad \
      -S ../B4-10.seqStore \
      -T  ./B4-10.ctgStore 2 \
      -L ./5-consensus/ctgcns.files \
    > ./5-consensus/ctgcns.files.ctgStoreLoad.err 2>&1

-- Finished on Fri Jan 16 15:27:48 2026 (one second) with 4524082.468 GB free disk space
----------------------------------------
----------------------------------------
-- Starting command on Fri Jan 16 15:27:48 2026 with 4524082.468 GB free disk space

    cd unitigging
    /share/org/YZWL/yzwl_lixg/miniforge3/envs/canu_v.2.3/bin/tgTigDisplay \
      -S ../B4-10.seqStore \
      -b \
      -o ../B4-10.contigs.unsorted.bam \
      -L ./5-consensus/ctgcns.files \
    > ./5-consensus/ctgcns.files.contigs.bam.err 2>&1

-- Finished on Fri Jan 16 15:30:26 2026 (158 seconds) with 4523758.625 GB free disk space
----------------------------------------
----------------------------------------
-- Starting command on Fri Jan 16 15:30:26 2026 with 4523758.625 GB free disk space

    cd .
    samtools sort \
      --write-index \
      --threads 2 \
      -o ./B4-10.contigs.bam ./B4-10.contigs.unsorted.bam \
    > ./ctgcns.bam.err 2>&1

-- Finished on Fri Jan 16 15:31:29 2026 (63 seconds) with 4523547.203 GB free disk space
----------------------------------------
-- Purging consensus output after loading to ctgStore.
-- Purged 11 .cns outputs.
----------------------------------------
-- Starting command on Fri Jan 16 15:31:29 2026 with 4523548.218 GB free disk space

    cd unitigging
    /share/org/YZWL/yzwl_lixg/miniforge3/envs/canu_v.2.3/bin/tgStoreDump \
      -S ../B4-10.seqStore \
      -T ./B4-10.ctgStore 2 \
      -sizes -s 85000000 \
    > ./B4-10.ctgStore/seqDB.v002.sizes.txt
ZERO length suplied to intervalList::add(), ignoring interval.
ZERO length suplied to intervalList::add(), ignoring interval.
ZERO length suplied to intervalList::add(), ignoring interval.
ZERO length suplied to intervalList::add(), ignoring interval.
ZERO length suplied to intervalList::add(), ignoring interval.
ZERO length suplied to intervalList::add(), ignoring interval.
ZERO length suplied to intervalList::add(), ignoring interval.
ZERO length suplied to intervalList::add(), ignoring interval.
ZERO length suplied to intervalList::add(), ignoring interval.
ZERO length suplied to intervalList::add(), ignoring interval.
ZERO length suplied to intervalList::add(), ignoring interval.

-- Finished on Fri Jan 16 15:31:29 2026 (in the blink of an eye) with 4523548.218 GB free disk space
----------------------------------------
-- Found, in version 2, after consensus generation:
--   contigs:      73 sequences, total length 88077525 bp (including 83 repeats of total length 2773540 bp).
--   bubbles:      121 sequences, total length 4439610 bp.
--   unassembled:  18867 sequences, total length 295582280 bp.
--
-- Contig sizes based on genome size 85mbp:
--
--            NG (bp)  LG (contigs)    sum (bp)
--         ----------  ------------  ----------
--     10     8045755             2    16471549
--     20     5948955             3    22420504
--     30     5944820             4    28365324
--     40     5909447             5    34274771
--     50     5494195             7    45412259
--     60     4340209             9    54144502
--     70     3886872            11    61925102
--     80     3561169            13    69251733
--     90     2070802            17    78084243
--    100      691636            22    85190204
--
-- Finished stage 'consensusLoad', reset canuIteration.
----------------------------------------
-- Starting command on Fri Jan 16 15:31:29 2026 with 4523548.203 GB free disk space

    cd .
    /share/org/YZWL/yzwl_lixg/miniforge3/envs/canu_v.2.3/bin/tgStoreDump \
      -S ./B4-10.seqStore \
      -T ./unitigging/B4-10.ctgStore 2 \
      -o ./B4-10.contigs \
      -layout \
    > ./B4-10.contigs.layout.err 2>&1

-- Finished on Fri Jan 16 15:31:29 2026 (lickety-split) with 4523548.171 GB free disk space
----------------------------------------
----------------------------------------
-- Starting command on Fri Jan 16 15:31:29 2026 with 4523548.171 GB free disk space

    cd .
    /share/org/YZWL/yzwl_lixg/miniforge3/envs/canu_v.2.3/bin/tgStoreDump \
      -S ./B4-10.seqStore \
      -T ./unitigging/B4-10.ctgStore 2 \
      -consensus -fasta \
      -unassembled \
    > ./B4-10.unassembled.fasta
    2> ./B4-10.unassembled.err
ZERO length suplied to intervalList::add(), ignoring interval.
ZERO length suplied to intervalList::add(), ignoring interval.
ZERO length suplied to intervalList::add(), ignoring interval.
ZERO length suplied to intervalList::add(), ignoring interval.
ZERO length suplied to intervalList::add(), ignoring interval.
ZERO length suplied to intervalList::add(), ignoring interval.
ZERO length suplied to intervalList::add(), ignoring interval.
ZERO length suplied to intervalList::add(), ignoring interval.
ZERO length suplied to intervalList::add(), ignoring interval.
ZERO length suplied to intervalList::add(), ignoring interval.
ZERO length suplied to intervalList::add(), ignoring interval.

-- Finished on Fri Jan 16 15:31:31 2026 (2 seconds) with 4523547.875 GB free disk space
----------------------------------------
----------------------------------------
-- Starting command on Fri Jan 16 15:31:31 2026 with 4523547.875 GB free disk space

    cd .
    /share/org/YZWL/yzwl_lixg/miniforge3/envs/canu_v.2.3/bin/tgStoreDump \
      -S ./B4-10.seqStore \
      -T ./unitigging/B4-10.ctgStore 2 \
      -consensus -fasta \
      -contigs \
    > ./B4-10.contigs.fasta
    2> ./B4-10.contigs.err
ZERO length suplied to intervalList::add(), ignoring interval.
ZERO length suplied to intervalList::add(), ignoring interval.
ZERO length suplied to intervalList::add(), ignoring interval.
ZERO length suplied to intervalList::add(), ignoring interval.
ZERO length suplied to intervalList::add(), ignoring interval.
ZERO length suplied to intervalList::add(), ignoring interval.
ZERO length suplied to intervalList::add(), ignoring interval.
ZERO length suplied to intervalList::add(), ignoring interval.
ZERO length suplied to intervalList::add(), ignoring interval.
ZERO length suplied to intervalList::add(), ignoring interval.
ZERO length suplied to intervalList::add(), ignoring interval.

-- Finished on Fri Jan 16 15:31:31 2026 (in the blink of an eye) with 4523547.765 GB free disk space
----------------------------------------
-- Finished stage 'generateOutputs', reset canuIteration.
--
-- Assembly 'B4-10' finished in '/share/org/YZWL/yzwl_lixg/project/28.大豆疫霉菌三代基因组/03.hicanu/B4-10/01.raw_output'.
--
-- Summary saved in 'B4-10.report'.
--
-- Sequences saved:
--   Contigs       -> 'B4-10.contigs.fasta'
--   Unassembled   -> 'B4-10.unassembled.fasta'
--
-- Read layouts saved:
--   Contigs       -> 'B4-10.contigs.layout'.
--
-- Bye.

2026-01-16 15:31:32.000 - WARNING - 输出文件不存在|Output file does not exist: /share/org/YZWL/yzwl_lixg/project/28.大豆疫霉菌三代基因组/03.hicanu/B4-10/01.raw_output/B4-10.unitigs.fasta
Job 68889975 stderr output:

