2026-01-15 19:45:18.990 - WARNING - 命令错误输出|Command stderr:
-- canu master +27 changes (r10515 2a41e933b8de6ed66723d75d36dd071b46d2c347)
--
-- CITATIONS
--
-- For assemblies of PacBio HiFi reads:
--   Nurk S, Walenz BP, Rhiea A, Vollger MR, Logsdon GA, Grothe R, Miga KH, Eichler EE, Phillippy AM, Koren S.
--   HiCanu: accurate assembly of segmental duplications, satellites, and allelic variants from high-fidelity long reads.
--   biorXiv. 2020.
--   https://doi.org/10.1101/2020.03.14.992248
-- 
-- Read and contig alignments during correction and consensus use:
--   Šošic M, Šikic M.
--   Edlib: a C/C ++ library for fast, exact sequence alignment using edit distance.
--   Bioinformatics. 2017 May 1;33(9):1394-1395.
--   http://doi.org/10.1093/bioinformatics/btw753
-- 
-- Overlaps are generated using:
--   Berlin K, et al.
--   Assembling large genomes with single-molecule sequencing and locality-sensitive hashing.
--   Nat Biotechnol. 2015 Jun;33(6):623-30.
--   http://doi.org/10.1038/nbt.3238
-- 
--   Myers EW, et al.
--   A Whole-Genome Assembly of Drosophila.
--   Science. 2000 Mar 24;287(5461):2196-204.
--   http://doi.org/10.1126/science.287.5461.2196
-- 
-- Contig consensus sequences are generated using an algorithm derived from pbdagcon:
--   Chin CS, et al.
--   Nonhybrid, finished microbial genome assemblies from long-read SMRT sequencing data.
--   Nat Methods. 2013 Jun;10(6):563-9
--   http://doi.org/10.1038/nmeth.2474
-- 
-- CONFIGURE CANU
--
-- Detected Java(TM) Runtime Environment '17.0.15-internal' (from '/share/org/YZWL/yzwl_lixg/.local/bin/java') without -d64 support.
--
-- WARNING:
-- WARNING:  Failed to run gnuplot using command 'gnuplot'.
-- WARNING:  Plots will be disabled.
-- WARNING:
--
-- Detected samtools version '1.22' / htslib version 'htscodecs=1.6.3' (from 'samtools').
--
-- Detected 88 CPUs and 503 gigabytes of memory on the local machine.
--
-- Detected Slurm with 'sinfo' binary in /opt/skyformai/bin/sinfo.
--          Slurm disabled by useGrid=false
--
-- Detected  '' with 'pbsnodes' binary in /opt/skyformai/bin/pbsnodes.
--           disabled by useGrid=false
--
-- Detected LSF with 'bsub' binary in /opt/skyformai/bin/bsub.
--          LSF disabled by useGrid=false
--
-- Local machine mode enabled; grid support not detected or not allowed.
--
-- Found trimmed raw PacBio HiFi reads in the input files.
--
--                                (tag)Concurrency
--                         (tag)Threads          |
--                (tag)Memory         |          |
--        (tag)             |         |          |       total usage      algorithm
--        -------  ----------  --------   --------  --------------------  -----------------------------
-- Local: meryl     12.000 GB    4 CPUs x  22 jobs   264.000 GB  88 CPUs  (k-mer counting)
-- Local: cormhap   13.000 GB   11 CPUs x   8 jobs   104.000 GB  88 CPUs  (overlap detection with mhap)
-- Local: obtovl     8.000 GB    8 CPUs x  11 jobs    88.000 GB  88 CPUs  (overlap detection)
-- Local: utgovl     8.000 GB    8 CPUs x  11 jobs    88.000 GB  88 CPUs  (overlap detection)
-- Local: cor        -.--- GB    4 CPUs x   - jobs     -.--- GB   - CPUs  (read correction)
-- Local: ovb        4.000 GB    1 CPU  x  88 jobs   352.000 GB  88 CPUs  (overlap store bucketizer)
-- Local: ovs        8.000 GB    1 CPU  x  62 jobs   496.000 GB  62 CPUs  (overlap store sorting)
-- Local: red       16.000 GB    4 CPUs x  22 jobs   352.000 GB  88 CPUs  (read error detection)
-- Local: oea        8.000 GB    1 CPU  x  62 jobs   496.000 GB  62 CPUs  (overlap error adjustment)
-- Local: bat       32.000 GB    8 CPUs x   1 job     32.000 GB   8 CPUs  (contig construction with bogart)
-- Local: cns        -.--- GB    8 CPUs x   - jobs     -.--- GB   - CPUs  (consensus)
--
-- Generating assembly 'A1-2' in '/share/org/YZWL/yzwl_lixg/project/28.大豆疫霉菌三代基因组/03.hicanu/A1-2/01.raw_output':
--   genomeSize:
--     85000000
--
--   Overlap Generation Limits:
--     corOvlErrorRate 0.0000 (  0.00%)
--     obtOvlErrorRate 0.0250 (  2.50%)
--     utgOvlErrorRate 0.0100 (  1.00%)
--
--   Overlap Processing Limits:
--     corErrorRate    0.0000 (  0.00%)
--     obtErrorRate    0.0250 (  2.50%)
--     utgErrorRate    0.0003 (  0.03%)
--     cnsErrorRate    0.0500 (  5.00%)
--
--   Stages to run:
--     assemble HiFi reads.
--
--
-- BEGIN STORE CREATION
----------------------------------------
-- Starting command on Thu Jan 15 18:14:01 2026 with 4588761.343 GB free disk space

    cd .
    ./A1-2.seqStore.sh \
    > ./A1-2.seqStore.err 2>&1

-- Finished on Thu Jan 15 18:20:47 2026 (406 seconds) with 4587542.046 GB free disk space
----------------------------------------
--
-- In sequence store './A1-2.seqStore':
--   Found 250191 reads.
--   Found 4250005842 bases (50 times coverage).
--    Histogram of corrected reads:
--    
--    G=4250005842                       sum of  ||               length     num
--    NG         length     index       lengths  ||                range    seqs
--    ----- ------------ --------- ------------  ||  ------------------- -------
--    00010        26809     14847    425021595  ||       1235-2383         7338|---------------------
--    00020        24962     31318    850024821  ||       2384-3532        11565|--------------------------------
--    00030        23672     48820   1275021624  ||       3533-4681        11005|-------------------------------
--    00040        22599     67202   1700008255  ||       4682-5830         9421|--------------------------
--    00050        21617     86432   2125010954  ||       5831-6979         7903|----------------------
--    00060        20613    106560   2550023959  ||       6980-8128         7011|--------------------
--    00070        19474    127747   2975021389  ||       8129-9277         6138|-----------------
--    00080        17832    150449   3400013228  ||       9278-10426        5507|----------------
--    00090        11982    177914   3825015988  ||      10427-11575        4825|--------------
--    00100         1235    250191   4250005842  ||      11576-12724        4220|------------
--    001.000x              250191   4250005842  ||      12725-13873        3844|-----------
--                                               ||      13874-15022        3998|-----------
--                                               ||      15023-16171        4663|-------------
--                                               ||      16172-17320        7565|---------------------
--                                               ||      17321-18469       12203|----------------------------------
--                                               ||      18470-19618       17745|-------------------------------------------------
--                                               ||      19619-20767       21745|------------------------------------------------------------
--                                               ||      20768-21916       23062|---------------------------------------------------------------
--                                               ||      21917-23065       21609|------------------------------------------------------------
--                                               ||      23066-24214       18024|--------------------------------------------------
--                                               ||      24215-25363       13798|--------------------------------------
--                                               ||      25364-26512       10105|----------------------------
--                                               ||      26513-27661        6865|-------------------
--                                               ||      27662-28810        4679|-------------
--                                               ||      28811-29959        2765|--------
--                                               ||      29960-31108        1457|----
--                                               ||      31109-32257         698|--
--                                               ||      32258-33406         298|-
--                                               ||      33407-34555         101|-
--                                               ||      34556-35704          16|-
--                                               ||      35705-36853           7|-
--                                               ||      36854-38002           2|-
--                                               ||      38003-39151           0|
--                                               ||      39152-40300           0|
--                                               ||      40301-41449           1|-
--                                               ||      41450-42598           1|-
--                                               ||      42599-43747           0|
--                                               ||      43748-44896           2|-
--                                               ||      44897-46045           2|-
--                                               ||      46046-47194           3|-
--    
--
-- In sequence store './A1-2.seqStore':
--   Found 250191 reads.
--   Found 4250005842 bases (50 times coverage).
--    Histogram of corrected-trimmed reads:
--    
--    G=4250005842                       sum of  ||               length     num
--    NG         length     index       lengths  ||                range    seqs
--    ----- ------------ --------- ------------  ||  ------------------- -------
--    00010        26809     14847    425021595  ||       1235-2383         7338|---------------------
--    00020        24962     31318    850024821  ||       2384-3532        11565|--------------------------------
--    00030        23672     48820   1275021624  ||       3533-4681        11005|-------------------------------
--    00040        22599     67202   1700008255  ||       4682-5830         9421|--------------------------
--    00050        21617     86432   2125010954  ||       5831-6979         7903|----------------------
--    00060        20613    106560   2550023959  ||       6980-8128         7011|--------------------
--    00070        19474    127747   2975021389  ||       8129-9277         6138|-----------------
--    00080        17832    150449   3400013228  ||       9278-10426        5507|----------------
--    00090        11982    177914   3825015988  ||      10427-11575        4825|--------------
--    00100         1235    250191   4250005842  ||      11576-12724        4220|------------
--    001.000x              250191   4250005842  ||      12725-13873        3844|-----------
--                                               ||      13874-15022        3998|-----------
--                                               ||      15023-16171        4663|-------------
--                                               ||      16172-17320        7565|---------------------
--                                               ||      17321-18469       12203|----------------------------------
--                                               ||      18470-19618       17745|-------------------------------------------------
--                                               ||      19619-20767       21745|------------------------------------------------------------
--                                               ||      20768-21916       23062|---------------------------------------------------------------
--                                               ||      21917-23065       21609|------------------------------------------------------------
--                                               ||      23066-24214       18024|--------------------------------------------------
--                                               ||      24215-25363       13798|--------------------------------------
--                                               ||      25364-26512       10105|----------------------------
--                                               ||      26513-27661        6865|-------------------
--                                               ||      27662-28810        4679|-------------
--                                               ||      28811-29959        2765|--------
--                                               ||      29960-31108        1457|----
--                                               ||      31109-32257         698|--
--                                               ||      32258-33406         298|-
--                                               ||      33407-34555         101|-
--                                               ||      34556-35704          16|-
--                                               ||      35705-36853           7|-
--                                               ||      36854-38002           2|-
--                                               ||      38003-39151           0|
--                                               ||      39152-40300           0|
--                                               ||      40301-41449           1|-
--                                               ||      41450-42598           1|-
--                                               ||      42599-43747           0|
--                                               ||      43748-44896           2|-
--                                               ||      44897-46045           2|-
--                                               ||      46046-47194           3|-
--    
--
-- Correction skipped; not enabled.
--
-- Trimming skipped; not enabled.
--
-- BEGIN ASSEMBLY
----------------------------------------
-- Starting command on Thu Jan 15 18:20:47 2026 with 4587541.984 GB free disk space

    cd unitigging/0-mercounts
    ./meryl-configure.sh \
    > ./meryl-configure.err 2>&1

-- Finished on Thu Jan 15 18:20:48 2026 (one second) with 4587541.984 GB free disk space
----------------------------------------
--  segments   memory batches
--  -------- -------- -------
--        01 10.81 GB       2
--        02  5.75 GB       2
--        04  2.97 GB       2
--        06  2.14 GB       2
--        08  1.61 GB       2
--        12  1.07 GB       2
--        16  0.81 GB       2
--        20  0.65 GB       2
--        24  0.54 GB       2
--        32  0.41 GB       2
--        40  0.32 GB       2
--        48  -.-- GB       -  (segment size too small)
--        56  -.-- GB       -  (segment size too small)
--        64  -.-- GB       -  (segment size too small)
--        96  -.-- GB       -  (segment size too small)
--
--  For 250191 reads with 4250005842 bases, limit to 42 batches.
--  Will count kmers using 01 jobs, each using 12 GB and 4 threads.
--
-- Finished stage 'merylConfigure', reset canuIteration.
--
-- Running jobs.  First attempt out of 2.
----------------------------------------
-- Starting 'meryl' concurrent execution on Thu Jan 15 18:20:48 2026 with 4587541.953 GB free disk space (1 processes; 22 concurrently)

    cd unitigging/0-mercounts
    ./meryl-count.sh 1 > ./meryl-count.000001.out 2>&1

-- Finished on Thu Jan 15 18:24:16 2026 (208 seconds) with 4586784.312 GB free disk space
----------------------------------------
-- Found 1 Kmer counting (meryl) outputs.
-- Finished stage 'utg-merylCountCheck', reset canuIteration.
--
-- Running jobs.  First attempt out of 2.
----------------------------------------
-- Starting 'meryl' concurrent execution on Thu Jan 15 18:24:16 2026 with 4586784.281 GB free disk space (1 processes; 22 concurrently)

    cd unitigging/0-mercounts
    ./meryl-process.sh 1 > ./meryl-process.000001.out 2>&1

-- Finished on Thu Jan 15 18:24:22 2026 (6 seconds) with 4586783.875 GB free disk space
----------------------------------------
-- Meryl finished successfully.  Kmer frequency histogram:
--
-- WARNING: gnuplot failed.
--
----------------------------------------
--
--  22-mers                                                                                           Fraction
--    Occurrences   NumMers                                                                         Unique Total
--       1-     1         0                                                                        0.0000 0.0000
--       2-     2    511338 **                                                                     0.0113 0.0003
--       3-     4    199265                                                                        0.0146 0.0005
--       5-     7     45905                                                                        0.0162 0.0006
--       8-    11     18880                                                                        0.0168 0.0006
--      12-    16     15436                                                                        0.0171 0.0007
--      17-    22    119122                                                                        0.0176 0.0008
--      23-    29   1008999 ****                                                                   0.0211 0.0018
--      30-    37   6335146 ***************************                                            0.0505 0.0135
--      38-    46  16380334 ********************************************************************** 0.2125 0.0944
--      47-    56  13050731 *******************************************************                0.5843 0.3212
--      57-    67   2994514 ************                                                           0.8426 0.5094
--      68-    79    708147 ***                                                                    0.8971 0.5565
--      80-    92    998296 ****                                                                   0.9128 0.5730
--      93-   106    755636 ***                                                                    0.9350 0.6004
--     107-   121    292903 *                                                                      0.9505 0.6222
--     122-   137    282914 *                                                                      0.9567 0.6322
--     138-   154    245601 *                                                                      0.9630 0.6439
--     155-   172    153496                                                                        0.9682 0.6545
--     173-   191    158970                                                                        0.9716 0.6625
--     192-   211    119427                                                                        0.9750 0.6713
--     212-   232    109449                                                                        0.9776 0.6787
--     233-   254     96872                                                                        0.9800 0.6863
--     255-   277     92126                                                                        0.9821 0.6936
--     278-   301     69651                                                                        0.9841 0.7012
--     302-   326     65357                                                                        0.9857 0.7074
--     327-   352     50740                                                                        0.9871 0.7137
--     353-   379     43398                                                                        0.9882 0.7191
--     380-   407     40067                                                                        0.9891 0.7240
--     408-   436     33030                                                                        0.9900 0.7289
--     437-   466     30579                                                                        0.9907 0.7332
--     467-   497     26982                                                                        0.9914 0.7375
--     498-   529     23064                                                                        0.9920 0.7415
--     530-   562     20591                                                                        0.9925 0.7452
--     563-   596     18096                                                                        0.9930 0.7487
--     597-   631     16720                                                                        0.9933 0.7519
--     632-   667     16390                                                                        0.9937 0.7551
--     668-   704     14063                                                                        0.9941 0.7585
--     705-   742     12251                                                                        0.9944 0.7614
--     743-   781     11766                                                                        0.9947 0.7642
--     782-   821     10816                                                                        0.9949 0.7670
--
--           0 (max occurrences)
--  3211315744 (total mers, non-unique)
--    45417590 (distinct mers, non-unique)
--           0 (unique mers)
-- Finished stage 'meryl-process', reset canuIteration.
--
-- Removing meryl database 'unitigging/0-mercounts/A1-2.ms22'.
--
-- OVERLAPPER (normal) (assembly) erate=0.01
--
----------------------------------------
-- Starting command on Thu Jan 15 18:24:22 2026 with 4586785.046 GB free disk space

    cd unitigging/1-overlapper
    /share/org/YZWL/yzwl_lixg/miniforge3/envs/canu_v.2.3/bin/overlapInCorePartition \
     -S  ../../A1-2.seqStore \
     -hl 160000000 \
     -rl 5000000000 \
     -ol 500 \
     -o  ./A1-2.partition \
    > ./A1-2.partition.err 2>&1

-- Finished on Thu Jan 15 18:24:22 2026 (in the blink of an eye) with 4586785.031 GB free disk space
----------------------------------------
--
-- Configured 21 overlapInCore jobs.
-- Finished stage 'utg-overlapConfigure', reset canuIteration.
--
-- Running jobs.  First attempt out of 2.
----------------------------------------
-- Starting 'utgovl' concurrent execution on Thu Jan 15 18:24:22 2026 with 4586785 GB free disk space (21 processes; 11 concurrently)

    cd unitigging/1-overlapper
    ./overlap.sh 1 > ./overlap.000001.out 2>&1
    ./overlap.sh 2 > ./overlap.000002.out 2>&1
    ./overlap.sh 3 > ./overlap.000003.out 2>&1
    ./overlap.sh 4 > ./overlap.000004.out 2>&1
    ./overlap.sh 5 > ./overlap.000005.out 2>&1
    ./overlap.sh 6 > ./overlap.000006.out 2>&1
    ./overlap.sh 7 > ./overlap.000007.out 2>&1
    ./overlap.sh 8 > ./overlap.000008.out 2>&1
    ./overlap.sh 9 > ./overlap.000009.out 2>&1
    ./overlap.sh 10 > ./overlap.000010.out 2>&1
    ./overlap.sh 11 > ./overlap.000011.out 2>&1
    ./overlap.sh 12 > ./overlap.000012.out 2>&1
    ./overlap.sh 13 > ./overlap.000013.out 2>&1
    ./overlap.sh 14 > ./overlap.000014.out 2>&1
    ./overlap.sh 15 > ./overlap.000015.out 2>&1
    ./overlap.sh 16 > ./overlap.000016.out 2>&1
    ./overlap.sh 17 > ./overlap.000017.out 2>&1
    ./overlap.sh 18 > ./overlap.000018.out 2>&1
    ./overlap.sh 19 > ./overlap.000019.out 2>&1
    ./overlap.sh 20 > ./overlap.000020.out 2>&1
    ./overlap.sh 21 > ./overlap.000021.out 2>&1

-- Finished on Thu Jan 15 18:50:32 2026 (1570 seconds) with 4582323.937 GB free disk space
----------------------------------------
-- Found 21 overlapInCore output files.
--
-- overlapInCore compute 'unitigging/1-overlapper':
--   kmer hits
--     with no overlap       1207954714  653.047619 +- 36249463.277
--     with an overlap         25249841  3.38095238 +- 663355.561
--
--   overlaps                  25249841  3.38095238 +- 663355.561
--     contained                6250126  .047619048 +- 162788.867
--     dovetail                18999715  .333333333 +- 505833.203
--
--   overlaps rejected
--     multiple per pair              0           0 +- 0
--     bad short window               0           0 +- 0
--     bad long window                0           0 +- 0
-- Finished stage 'utg-overlapCheck', reset canuIteration.
----------------------------------------
-- Starting command on Thu Jan 15 18:50:32 2026 with 4582323.921 GB free disk space

    cd unitigging
    /share/org/YZWL/yzwl_lixg/miniforge3/envs/canu_v.2.3/bin/ovStoreConfig \
     -S ../A1-2.seqStore \
     -M 4-8 \
     -L ./1-overlapper/ovljob.files \
     -create ./A1-2.ovlStore.config \
     > ./A1-2.ovlStore.config.txt \
    2> ./A1-2.ovlStore.config.err

-- Finished on Thu Jan 15 18:50:33 2026 (one second) with 4582323.906 GB free disk space
----------------------------------------
--
-- Creating overlap store unitigging/A1-2.ovlStore using:
--      1 bucket
--      1 slice
--        using at most 2 GB memory each
--
-- Running jobs.  First attempt out of 2.
----------------------------------------
-- Starting 'ovS' concurrent execution on Thu Jan 15 18:50:33 2026 with 4582323.89 GB free disk space (1 processes; 62 concurrently)

    cd unitigging
    ./A1-2.ovlStore.sh 1 > ./A1-2.ovlStore.000001.out 2>&1

-- Finished on Thu Jan 15 18:50:45 2026 (12 seconds) with 4582037.531 GB free disk space
----------------------------------------
-- Checking store.
----------------------------------------
-- Starting command on Thu Jan 15 18:50:45 2026 with 4582037.531 GB free disk space

    cd unitigging
    /share/org/YZWL/yzwl_lixg/miniforge3/envs/canu_v.2.3/bin/ovStoreDump \
     -S ../A1-2.seqStore \
     -O  ./A1-2.ovlStore \
     -counts \
     > ./A1-2.ovlStore/counts.dat 2> ./A1-2.ovlStore/counts.err

-- Finished on Thu Jan 15 18:50:46 2026 (one second) with 4582037.5 GB free disk space
----------------------------------------
--
-- Overlap store 'unitigging/A1-2.ovlStore' successfully constructed.
-- Found 50499682 overlaps for 238233 reads; 1267004 reads have no overlaps.
--
--
-- Purged 0.548 GB in 63 overlap output files.
----------------------------------------
-- Starting command on Thu Jan 15 18:50:46 2026 with 4582036.062 GB free disk space

    cd unitigging
    /share/org/YZWL/yzwl_lixg/miniforge3/envs/canu_v.2.3/bin/ovStoreStats \
     -C 50 \
     -S ../A1-2.seqStore \
     -O  ./A1-2.ovlStore \
     -o  ./A1-2.ovlStore \
     > ./A1-2.ovlStore.summary.err 2>&1

-- Finished on Thu Jan 15 18:50:53 2026 (7 seconds) with 4582036.046 GB free disk space
----------------------------------------
--
-- Overlap store 'unitigging/A1-2.ovlStore' contains:
--
--   category            reads     %          read length        feature size or coverage  analysis
--   ----------------  -------  -------  ----------------------  ------------------------  --------------------
--   middle-missing        126    0.05    16156.83 +- 5817.07       1219.94 +- 1897.78    (bad trimming)
--   middle-hump            29    0.01    16960.07 +- 3052.21       6253.76 +- 3945.26    (bad trimming)
--   no-5-prime            708    0.28    14163.45 +- 5544.21       2079.33 +- 3171.80    (bad trimming)
--   no-3-prime            854    0.34    12741.28 +- 6529.00       1873.49 +- 3063.08    (bad trimming)
--   
--   low-coverage         2152    0.86    11775.78 +- 5701.65          6.13 +- 3.70       (easy to assemble, potential for lower quality consensus)
--   unique             198007   79.14    13069.23 +- 6103.59         44.80 +- 8.59       (easy to assemble, perfect, yay)
--   repeat-cont         14271    5.70    10583.65 +- 5530.79       1189.27 +- 848.22     (potential for consensus errors, no impact on assembly)
--   repeat-dove           188    0.08    20411.31 +- 1786.70        613.50 +- 701.16     (hard to assemble, likely won't assemble correctly or even at all)
--   
--   span-repeat          2993    1.20    14747.76 +- 4866.97       3649.55 +- 4066.88    (read spans a large repeat, usually easy to assemble)
--   uniq-repeat-cont    12990    5.19    13276.90 +- 4928.44                             (should be uniquely placed, low potential for consensus errors, no impact on assembly)
--   uniq-repeat-dove     3132    1.25    19191.00 +- 2498.09                             (will end contigs, potential to misassemble)
--   uniq-anchor          2783    1.11    14247.55 +- 4946.11       8054.75 +- 5232.64    (repeat read, with unique section, probable bad read)
-- Finished stage 'utg-createOverlapStore', reset canuIteration.
--
-- Loading read lengths.
-- Loading number of overlaps per read.
--
-- Configure RED for 16gb memory.
--                   Batches of at most (unlimited) reads.
--                                      500000000 bases.
--                   Expecting evidence of at most 536870912 bases per iteration.
--
--           Total                                               Reads                 Olaps Evidence
--    Job   Memory      Read Range         Reads        Bases   Memory        Olaps   Memory   Memory  (Memory in MB)
--   ---- -------- ------------------- --------- ------------ -------- ------------ -------- --------
--      1 16385.78         1-32680          5422    108949750 13299.70      1230652    14.08  1024.00
--      2 16384.26     32681-74172          6853    108941989 13298.80      1176125    13.46  1024.00
--      3 16385.55     74173-106853         5470    108967167 13301.83      1024528    11.72  1024.00
--      4 16386.33    106854-142014         5739    108931474 13297.48      1472837    16.86  1024.00
--      5 16386.18    142015-184527         7115    108982293 13303.73       913858    10.46  1024.00
--      6 16385.81    184528-227804         7131    108939151 13298.46      1341457    15.35  1024.00
--      7 16385.06    227805-260999         5565    108875266 13290.61      1961352    22.45  1024.00
--      8 16385.33    261000-298696         6288    108986236 13304.18       799260     9.15  1024.00
--      9 16386.30    298697-348122         8161    108922260 13296.43      1561306    17.87  1024.00
--     10 16384.70    348123-380565         5496    108913012 13295.22      1527520    17.48  1024.00
--     11 16385.77    380566-416079         5884    108961054 13301.10      1107357    12.67  1024.00
--     12 16384.77    416080-468332         8800    108906129 13294.48      1597589    18.28  1024.00
--     13 16386.92    468333-500898         5406    108980293 13303.43      1004551    11.50  1024.00
--     14 16386.24    500899-535455         5651    108917572 13295.78      1612976    18.46  1024.00
--     15 16385.66    535456-578739         7146    108986901 13304.29       818545     9.37  1024.00
--     16 16384.45    578740-622177         7272    108918013 13295.88      1447517    16.57  1024.00
--     17 16385.72    622178-656242         5596    108886047 13291.93      1904041    21.79  1024.00
--     18 16386.78    656243-693696         6210    108975512 13302.87      1040622    11.91  1024.00
--     19 16386.97    693697-744656         8449    108920098 13296.18      1641951    18.79  1024.00
--     20 16386.10    744657-776661         5457    108915879 13295.57      1619240    18.53  1024.00
--     21 16386.53    776662-811544         5795    108969052 13302.07      1088908    12.46  1024.00
--     22 16384.63    811545-859397         7961    108913905 13295.40      1505131    17.22  1024.00
--     23 16384.68    859398-894283         5744    108951981 13299.98      1109875    12.70  1024.00
--     24 16384.25    894284-927336         5580    108907695 13294.57      1544999    17.68  1024.00
--     25 16384.33    927337-965869         6474    108983479 13303.85       740568     8.48  1024.00
--     26 16385.70    965870-1010008        7347    108938650 13298.41      1336803    15.30  1024.00
--     27 16384.16   1010009-1042682        5426    108921987 13296.31      1384658    15.85  1024.00
--     28 16384.76   1042683-1078092        5878    108946168 13299.28      1178487    13.49  1024.00
--     29 16384.45   1078093-1126350        8044    108918137 13295.92      1443883    16.52  1024.00
--     30 16385.24   1126351-1158943        5390    108966470 13301.74      1004457    11.50  1024.00
--     31 16385.50   1158944-1192610        5632    108935102 13297.92      1361415    15.58  1024.00
--     32 16384.28   1192611-1233395        6838    108972814 13302.56       848907     9.71  1024.00
--     33 16384.09   1233396-1273640        6599    108932753 13297.66      1260534    14.43  1024.00
--     34 16385.11   1273641-1306511        5451    108903560 13294.06      1664630    19.05  1024.00
--     35 16386.18   1306512-1342367        6009    108993641 13305.08       795446     9.10  1024.00
--     36 16385.01   1342368-1389197        7605    108933489 13297.78      1330233    15.22  1024.00
--     37 16384.39   1389198-1421675        5404    108916108 13295.59      1467753    16.80  1024.00
--     38 16384.19   1421676-1456184        5742    108947308 13299.41      1116351    12.78  1024.00
--     39 16386.26   1456185-1504647        8055    108927846 13297.11      1498970    17.15  1024.00
--     40  3236.91   1504648-1505237         106      1349601   164.75        14390     0.16  1024.00
--   ---- -------- ------------------- --------- ------------ -------- ------------ -------- --------
--                                                 4250005842              50499682
-- Finished stage 'readErrorDetectionConfigure', reset canuIteration.
--
-- Running jobs.  First attempt out of 2.
----------------------------------------
-- Starting 'red' concurrent execution on Thu Jan 15 18:50:59 2026 with 4582036 GB free disk space (40 processes; 22 concurrently)

    cd unitigging/3-overlapErrorAdjustment
    ./red.sh 1 > ./red.000001.out 2>&1
    ./red.sh 2 > ./red.000002.out 2>&1
    ./red.sh 3 > ./red.000003.out 2>&1
    ./red.sh 4 > ./red.000004.out 2>&1
    ./red.sh 5 > ./red.000005.out 2>&1
    ./red.sh 6 > ./red.000006.out 2>&1
    ./red.sh 7 > ./red.000007.out 2>&1
    ./red.sh 8 > ./red.000008.out 2>&1
    ./red.sh 9 > ./red.000009.out 2>&1
    ./red.sh 10 > ./red.000010.out 2>&1
    ./red.sh 11 > ./red.000011.out 2>&1
    ./red.sh 12 > ./red.000012.out 2>&1
    ./red.sh 13 > ./red.000013.out 2>&1
    ./red.sh 14 > ./red.000014.out 2>&1
    ./red.sh 15 > ./red.000015.out 2>&1
    ./red.sh 16 > ./red.000016.out 2>&1
    ./red.sh 17 > ./red.000017.out 2>&1
    ./red.sh 18 > ./red.000018.out 2>&1
    ./red.sh 19 > ./red.000019.out 2>&1
    ./red.sh 20 > ./red.000020.out 2>&1
    ./red.sh 21 > ./red.000021.out 2>&1
    ./red.sh 22 > ./red.000022.out 2>&1
    ./red.sh 23 > ./red.000023.out 2>&1
    ./red.sh 24 > ./red.000024.out 2>&1
    ./red.sh 25 > ./red.000025.out 2>&1
    ./red.sh 26 > ./red.000026.out 2>&1
    ./red.sh 27 > ./red.000027.out 2>&1
    ./red.sh 28 > ./red.000028.out 2>&1
    ./red.sh 29 > ./red.000029.out 2>&1
    ./red.sh 30 > ./red.000030.out 2>&1
    ./red.sh 31 > ./red.000031.out 2>&1
    ./red.sh 32 > ./red.000032.out 2>&1
    ./red.sh 33 > ./red.000033.out 2>&1
    ./red.sh 34 > ./red.000034.out 2>&1
    ./red.sh 35 > ./red.000035.out 2>&1
    ./red.sh 36 > ./red.000036.out 2>&1
    ./red.sh 37 > ./red.000037.out 2>&1
    ./red.sh 38 > ./red.000038.out 2>&1
    ./red.sh 39 > ./red.000039.out 2>&1
    ./red.sh 40 > ./red.000040.out 2>&1

-- Finished on Thu Jan 15 19:02:39 2026 (700 seconds) with 4581167.734 GB free disk space
----------------------------------------
-- Found 40 read error detection output files.
-- Finished stage 'readErrorDetectionCheck', reset canuIteration.
--
-- Loading read lengths.
-- Loading number of overlaps per read.
--
-- Configure OEA for 8gb memory.
--                   Batches of at most (unlimited) reads.
--                                      300000000 bases.
--
--           Total                                               Reads                 Olaps  Adjusts
--    Job   Memory      Read Range         Reads        Bases   Memory        Olaps   Memory   Memory  (Memory in MB)
--   ---- -------- ------------------- --------- ------------ -------- ------------ -------- --------
--      1  2793.65         1-98916         16371    300018507   294.62      2848950    86.94   364.09
--      2  2829.29     98917-211457        18705    300014916   294.69      4014344   122.51   364.09
--      3  2806.52    211458-313134        16809    300006031   294.62      3270571    99.81   364.09
--      4  2829.14    313135-416605        17337    300002965   294.63      4011153   122.41   364.09
--      5  2827.81    416606-527092        18410    300002196   294.67      3966748   121.06   364.09
--      6  2815.48    527093-639390        18648    300004361   294.68      3562406   108.72   364.09
--      7  2819.00    639391-753197        18861    300010525   294.69      3677207   112.22   364.09
--      8  2833.96    753198-862009        18145    300023465   294.68      4167898   127.19   364.09
--      9  2801.92    862010-956707        15830    300000121   294.59      3120845    95.24   364.09
--     10  2819.54    956708-1061257       17420    300020089   294.65      3695888   112.79   364.09
--     11  2807.33   1061258-1168307       17829    300009040   294.66      3295935   100.58   364.09
--     12  2798.55   1168308-1275197       17704    300010196   294.65      3008225    91.80   364.09
--     13  2817.72   1275198-1382840       17766    300006415   294.65      3636546   110.98   364.09
--     14  2800.93   1382841-1478424       15916    300002083   294.59      3088253    94.25   364.09
--     15  2502.42   1478425-1505237        4440     49874932    55.70      1134713    34.63   364.09
--   ---- -------- ------------------- --------- ------------ -------- ------------ -------- --------
--                                                 4250005842              50499682
-- Finished stage 'overlapErrorAdjustmentConfigure', reset canuIteration.
--
-- Running jobs.  First attempt out of 2.
----------------------------------------
-- Starting 'oea' concurrent execution on Thu Jan 15 19:02:46 2026 with 4581167.656 GB free disk space (15 processes; 62 concurrently)

    cd unitigging/3-overlapErrorAdjustment
    ./oea.sh 1 > ./oea.000001.out 2>&1
    ./oea.sh 2 > ./oea.000002.out 2>&1
    ./oea.sh 3 > ./oea.000003.out 2>&1
    ./oea.sh 4 > ./oea.000004.out 2>&1
    ./oea.sh 5 > ./oea.000005.out 2>&1
    ./oea.sh 6 > ./oea.000006.out 2>&1
    ./oea.sh 7 > ./oea.000007.out 2>&1
    ./oea.sh 8 > ./oea.000008.out 2>&1
    ./oea.sh 9 > ./oea.000009.out 2>&1
    ./oea.sh 10 > ./oea.000010.out 2>&1
    ./oea.sh 11 > ./oea.000011.out 2>&1
    ./oea.sh 12 > ./oea.000012.out 2>&1
    ./oea.sh 13 > ./oea.000013.out 2>&1
    ./oea.sh 14 > ./oea.000014.out 2>&1
    ./oea.sh 15 > ./oea.000015.out 2>&1

-- Finished on Thu Jan 15 19:33:51 2026 (1865 seconds) with 4585380.171 GB free disk space
----------------------------------------
-- Found 15 overlap error adjustment output files.
-- Finished stage 'overlapErrorAdjustmentCheck', reset canuIteration.
----------------------------------------
-- Starting command on Thu Jan 15 19:33:51 2026 with 4585380.156 GB free disk space

    cd unitigging/3-overlapErrorAdjustment
    /share/org/YZWL/yzwl_lixg/miniforge3/envs/canu_v.2.3/bin/loadErates \
      -S ../../A1-2.seqStore \
      -O ../A1-2.ovlStore \
      -L ./oea.files \
    > ./oea.apply.err 2>&1

-- Finished on Thu Jan 15 19:33:51 2026 (like a bat out of hell) with 4585380.046 GB free disk space
----------------------------------------
-- No report available.
-- Finished stage 'updateOverlapStore', reset canuIteration.
-- Finished stage 'unitig', reset canuIteration.
--
-- Running jobs.  First attempt out of 2.
----------------------------------------
-- Starting 'bat' concurrent execution on Thu Jan 15 19:33:51 2026 with 4585380 GB free disk space (1 processes; 1 concurrently)

    cd unitigging/4-unitigger
    ./unitigger.sh 1 > ./unitigger.000001.out 2>&1

-- Finished on Thu Jan 15 19:34:04 2026 (13 seconds) with 4585473.703 GB free disk space
----------------------------------------
-- Unitigger finished successfully.
--  
--  ERROR RATES
--  -----------
--                                                   --------threshold------
--  271416                       fraction error      fraction        percent
--  samples                              (1e-5)         error          error
--                   --------------------------      --------       --------
--  command line (-eg)                           ->     30.00        0.0300%
--  command line (-ef)                           ->  -----.--      ---.----%
--  command line (-eM)                           ->     30.00        0.0300%
--  mean + std.dev       0.44 +-  12 *     3.04  ->     36.91        0.0369%
--  median + mad         0.00 +-  12 *     0.00  ->      0.00        0.0000%
--  90th percentile                              ->      1.00        0.0010%  (enabled)
--  
--  BEST EDGE FILTERING
--  -------------------
--  At graph threshold 0.0300%, reads:
--    available to have edges:        55326
--    with at least one edge:         40465
--  
--  At max threshold 0.0300%, reads:
--    available to have edges:        55326
--    with at least one edge:         40465
--  
--  At tight threshold 0.0010%, reads with:
--    both edges below error threshold:     35587  (80.00% minReadsBest threshold = 32372)
--    one  edge  above error threshold:      3584
--    both edges above error threshold:      1294
--    at least one edge:                    40465
--  
--  At loose threshold 0.0300%, reads with:
--    both edges below error threshold:     40465  (80.00% minReadsBest threshold = 32372)
--    one  edge  above error threshold:         0
--    both edges above error threshold:         0
--    at least one edge:                    40465
--  
--  
--  INITIAL EDGES
--  -------- ----------------------------------------
--    189901 reads are contained
--   1281052 reads have no best edges (singleton)
--       374 reads have only one best edge (spur) 
--                203 are mutual best
--     33910 reads have two best edges 
--                665 have one mutual best edge
--              32968 have two mutual best edges
--  
--  
--  FINAL EDGES
--  -------- ----------------------------------------
--    189901 reads are contained
--   1281396 reads have no best edges (singleton)
--       249 reads have only one best edge (spur) 
--                210 are mutual best
--     33691 reads have two best edges 
--                520 have one mutual best edge
--              32970 have two mutual best edges
--  
--  
--  EDGE FILTERING
--  -------- ------------------------------------------
--         0 reads are ignored
--     10395 reads have a gap in overlap coverage
--       149 reads have lopsided best edges
-- Found, in version 1, after unitig construction:
--   contigs:      72 sequences, total length 67645440 bp (including 84 repeats of total length 1881972 bp).
--   bubbles:      134 sequences, total length 3633139 bp.
--   unassembled:  26764 sequences, total length 328691111 bp.
--
-- Contig sizes based on genome size 85mbp:
--
--            NG (bp)  LG (contigs)    sum (bp)
--         ----------  ------------  ----------
--     10     6970050             2    14213051
--     20     6638836             3    20851887
--     30     6126850             4    26978737
--     40     4409084             6    37401512
--     50     3461846             8    44841432
--     60     3355419            10    51605545
--     70     1492206            14    60797285
--
-- Finished stage 'unitigCheck', reset canuIteration.
----------------------------------------
-- Starting command on Thu Jan 15 19:34:04 2026 with 4585473.687 GB free disk space

    cd unitigging
    /share/org/YZWL/yzwl_lixg/miniforge3/envs/canu_v.2.3/bin/utgcns \
      -S ../A1-2.seqStore \
      -T  ./A1-2.ctgStore 1 \
      -partition 0.8 1.5 0.1 \
    > ./A1-2.ctgStore/partitioning.log 2>&1

-- Finished on Thu Jan 15 19:34:13 2026 (9 seconds) with 4585472.5 GB free disk space
----------------------------------------
-- Using slow alignment for consensus (iteration '0').
-- Configured 11 consensus jobs.
-- Finished stage 'consensusConfigure', reset canuIteration.
--
-- Local: cns       10.750 GB    8 CPUs x  11 jobs   118.250 GB  88 CPUs  (consensus)
--
--
-- Running jobs.  First attempt out of 2.
----------------------------------------
-- Starting 'cns' concurrent execution on Thu Jan 15 19:34:13 2026 with 4585472.468 GB free disk space (11 processes; 11 concurrently)

    cd unitigging/5-consensus
    ./consensus.sh 1 > ./consensus.000001.out 2>&1
    ./consensus.sh 2 > ./consensus.000002.out 2>&1
    ./consensus.sh 3 > ./consensus.000003.out 2>&1
    ./consensus.sh 4 > ./consensus.000004.out 2>&1
    ./consensus.sh 5 > ./consensus.000005.out 2>&1
    ./consensus.sh 6 > ./consensus.000006.out 2>&1
    ./consensus.sh 7 > ./consensus.000007.out 2>&1
    ./consensus.sh 8 > ./consensus.000008.out 2>&1
    ./consensus.sh 9 > ./consensus.000009.out 2>&1
    ./consensus.sh 10 > ./consensus.000010.out 2>&1
    ./consensus.sh 11 > ./consensus.000011.out 2>&1

-- Finished on Thu Jan 15 19:41:01 2026 (408 seconds) with 4586622.687 GB free disk space
----------------------------------------
-- Using slow alignment for consensus (iteration '1').
-- Configured 11 consensus jobs.
-- All 11 consensus jobs finished successfully.
-- Finished stage 'consensusCheck', reset canuIteration.
-- Using slow alignment for consensus (iteration '0').
-- Configured 11 consensus jobs.
----------------------------------------
-- Starting command on Thu Jan 15 19:41:01 2026 with 4586622.64 GB free disk space

    cd unitigging
    /share/org/YZWL/yzwl_lixg/miniforge3/envs/canu_v.2.3/bin/tgStoreLoad \
      -S ../A1-2.seqStore \
      -T  ./A1-2.ctgStore 2 \
      -L ./5-consensus/ctgcns.files \
    > ./5-consensus/ctgcns.files.ctgStoreLoad.err 2>&1

-- Finished on Thu Jan 15 19:41:02 2026 (one second) with 4586621.546 GB free disk space
----------------------------------------
----------------------------------------
-- Starting command on Thu Jan 15 19:41:02 2026 with 4586621.546 GB free disk space

    cd unitigging
    /share/org/YZWL/yzwl_lixg/miniforge3/envs/canu_v.2.3/bin/tgTigDisplay \
      -S ../A1-2.seqStore \
      -b \
      -o ../A1-2.contigs.unsorted.bam \
      -L ./5-consensus/ctgcns.files \
    > ./5-consensus/ctgcns.files.contigs.bam.err 2>&1

-- Finished on Thu Jan 15 19:43:47 2026 (165 seconds) with 4586929.046 GB free disk space
----------------------------------------
----------------------------------------
-- Starting command on Thu Jan 15 19:43:47 2026 with 4586929.046 GB free disk space

    cd .
    samtools sort \
      --write-index \
      --threads 2 \
      -o ./A1-2.contigs.bam ./A1-2.contigs.unsorted.bam \
    > ./ctgcns.bam.err 2>&1

-- Finished on Thu Jan 15 19:45:15 2026 (88 seconds) with 4586924.421 GB free disk space
----------------------------------------
-- Purging consensus output after loading to ctgStore.
-- Purged 11 .cns outputs.
----------------------------------------
-- Starting command on Thu Jan 15 19:45:15 2026 with 4586927.468 GB free disk space

    cd unitigging
    /share/org/YZWL/yzwl_lixg/miniforge3/envs/canu_v.2.3/bin/tgStoreDump \
      -S ../A1-2.seqStore \
      -T ./A1-2.ctgStore 2 \
      -sizes -s 85000000 \
    > ./A1-2.ctgStore/seqDB.v002.sizes.txt
ZERO length suplied to intervalList::add(), ignoring interval.
ZERO length suplied to intervalList::add(), ignoring interval.
ZERO length suplied to intervalList::add(), ignoring interval.
ZERO length suplied to intervalList::add(), ignoring interval.
ZERO length suplied to intervalList::add(), ignoring interval.
ZERO length suplied to intervalList::add(), ignoring interval.

-- Finished on Thu Jan 15 19:45:15 2026 (lickety-split) with 4586927.468 GB free disk space
----------------------------------------
-- Found, in version 2, after consensus generation:
--   contigs:      72 sequences, total length 88220362 bp (including 84 repeats of total length 2668438 bp).
--   bubbles:      134 sequences, total length 4949815 bp.
--   unassembled:  26764 sequences, total length 451500967 bp.
--
-- Contig sizes based on genome size 85mbp:
--
--            NG (bp)  LG (contigs)    sum (bp)
--         ----------  ------------  ----------
--     10     9406180             1     9406180
--     20     9061460             2    18467640
--     30     8646285             3    27113925
--     40     7956037             4    35069962
--     50     7811915             5    42881877
--     60     5199749             7    53840075
--     70     4447783             9    62805458
--     80     4129343            11    71296121
--     90     2690476            13    77196094
--    100      576363            19    85188011
--
-- Finished stage 'consensusLoad', reset canuIteration.
----------------------------------------
-- Starting command on Thu Jan 15 19:45:15 2026 with 4586927.453 GB free disk space

    cd .
    /share/org/YZWL/yzwl_lixg/miniforge3/envs/canu_v.2.3/bin/tgStoreDump \
      -S ./A1-2.seqStore \
      -T ./unitigging/A1-2.ctgStore 2 \
      -o ./A1-2.contigs \
      -layout \
    > ./A1-2.contigs.layout.err 2>&1

-- Finished on Thu Jan 15 19:45:16 2026 (one second) with 4586927.421 GB free disk space
----------------------------------------
----------------------------------------
-- Starting command on Thu Jan 15 19:45:16 2026 with 4586927.421 GB free disk space

    cd .
    /share/org/YZWL/yzwl_lixg/miniforge3/envs/canu_v.2.3/bin/tgStoreDump \
      -S ./A1-2.seqStore \
      -T ./unitigging/A1-2.ctgStore 2 \
      -consensus -fasta \
      -unassembled \
    > ./A1-2.unassembled.fasta
    2> ./A1-2.unassembled.err
ZERO length suplied to intervalList::add(), ignoring interval.
ZERO length suplied to intervalList::add(), ignoring interval.
ZERO length suplied to intervalList::add(), ignoring interval.
ZERO length suplied to intervalList::add(), ignoring interval.
ZERO length suplied to intervalList::add(), ignoring interval.
ZERO length suplied to intervalList::add(), ignoring interval.

-- Finished on Thu Jan 15 19:45:18 2026 (2 seconds) with 4586926.984 GB free disk space
----------------------------------------
----------------------------------------
-- Starting command on Thu Jan 15 19:45:18 2026 with 4586926.984 GB free disk space

    cd .
    /share/org/YZWL/yzwl_lixg/miniforge3/envs/canu_v.2.3/bin/tgStoreDump \
      -S ./A1-2.seqStore \
      -T ./unitigging/A1-2.ctgStore 2 \
      -consensus -fasta \
      -contigs \
    > ./A1-2.contigs.fasta
    2> ./A1-2.contigs.err
ZERO length suplied to intervalList::add(), ignoring interval.
ZERO length suplied to intervalList::add(), ignoring interval.
ZERO length suplied to intervalList::add(), ignoring interval.
ZERO length suplied to intervalList::add(), ignoring interval.
ZERO length suplied to intervalList::add(), ignoring interval.
ZERO length suplied to intervalList::add(), ignoring interval.

-- Finished on Thu Jan 15 19:45:18 2026 (in the blink of an eye) with 4586926.875 GB free disk space
----------------------------------------
-- Finished stage 'generateOutputs', reset canuIteration.
--
-- Assembly 'A1-2' finished in '/share/org/YZWL/yzwl_lixg/project/28.大豆疫霉菌三代基因组/03.hicanu/A1-2/01.raw_output'.
--
-- Summary saved in 'A1-2.report'.
--
-- Sequences saved:
--   Contigs       -> 'A1-2.contigs.fasta'
--   Unassembled   -> 'A1-2.unassembled.fasta'
--
-- Read layouts saved:
--   Contigs       -> 'A1-2.contigs.layout'.
--
-- Bye.

2026-01-15 19:45:18.992 - WARNING - 输出文件不存在|Output file does not exist: /share/org/YZWL/yzwl_lixg/project/28.大豆疫霉菌三代基因组/03.hicanu/A1-2/01.raw_output/A1-2.unitigs.fasta
Usage: biopytools ragtag [OPTIONS]
Try 'biopytools ragtag -h' for help.

Error: Invalid value for '-r' / '--reference': 文件不存在|File does not exist: /share/org/YZWL/yzwl_lixg/project/28.大豆疫霉菌三代基因组/04.ragtag/Psoja_T2T.fa
Usage: biopytools ragtag [OPTIONS]
Try 'biopytools ragtag -h' for help.

Error: Invalid value for '-r' / '--reference': 文件不存在|File does not exist: /share/org/YZWL/yzwl_lixg/project/28.大豆疫霉菌三代基因组/04.ragtag/Psoja_T2T.fa
mkdir: 无法创建目录 “04.ragtag/A1-2/hicanu/共线性”: No such file or directory
Usage: biopytools genomesyn [OPTIONS]
Try 'biopytools genomesyn -h' for help.

Error: Invalid value for '-i' / '--ref': Path '04.ragtag/A1-2/hifiasm/A1-2_RagTag_scaffolded.fa' does not exist.
Usage: biopytools genomesyn [OPTIONS]
Try 'biopytools genomesyn -h' for help.

Error: Invalid value for '-i' / '--ref': Path '04.ragtag/A1-2/hicanu/A1-2_RagTag_scaffolded.fa' does not exist.
Job 68882053 stderr output:

