Usage: biopytools ragtag [OPTIONS]
Try 'biopytools ragtag -h' for help.

Error: Invalid value for '-r' / '--reference': 文件不存在|File does not exist: /share/org/YZWL/yzwl_lixg/project/28.大豆疫霉菌三代基因组/04.ragtag/Psoja_T2T.fa
Usage: biopytools genomesyn [OPTIONS]
Try 'biopytools genomesyn -h' for help.

Error: Invalid value for '-i' / '--ref': Path '04.ragtag/A3-54/hifiasm/A3-54_RagTag_scaffolded.fa' does not exist.
2026-01-16 03:31:04.483 - WARNING - 命令错误输出|Command stderr:
-- canu master +27 changes (r10515 2a41e933b8de6ed66723d75d36dd071b46d2c347)
--
-- CITATIONS
--
-- For assemblies of PacBio HiFi reads:
--   Nurk S, Walenz BP, Rhiea A, Vollger MR, Logsdon GA, Grothe R, Miga KH, Eichler EE, Phillippy AM, Koren S.
--   HiCanu: accurate assembly of segmental duplications, satellites, and allelic variants from high-fidelity long reads.
--   biorXiv. 2020.
--   https://doi.org/10.1101/2020.03.14.992248
-- 
-- Read and contig alignments during correction and consensus use:
--   Šošic M, Šikic M.
--   Edlib: a C/C ++ library for fast, exact sequence alignment using edit distance.
--   Bioinformatics. 2017 May 1;33(9):1394-1395.
--   http://doi.org/10.1093/bioinformatics/btw753
-- 
-- Overlaps are generated using:
--   Berlin K, et al.
--   Assembling large genomes with single-molecule sequencing and locality-sensitive hashing.
--   Nat Biotechnol. 2015 Jun;33(6):623-30.
--   http://doi.org/10.1038/nbt.3238
-- 
--   Myers EW, et al.
--   A Whole-Genome Assembly of Drosophila.
--   Science. 2000 Mar 24;287(5461):2196-204.
--   http://doi.org/10.1126/science.287.5461.2196
-- 
-- Contig consensus sequences are generated using an algorithm derived from pbdagcon:
--   Chin CS, et al.
--   Nonhybrid, finished microbial genome assemblies from long-read SMRT sequencing data.
--   Nat Methods. 2013 Jun;10(6):563-9
--   http://doi.org/10.1038/nmeth.2474
-- 
-- CONFIGURE CANU
--
-- Detected Java(TM) Runtime Environment '17.0.15-internal' (from '/share/org/YZWL/yzwl_lixg/.local/bin/java') without -d64 support.
--
-- WARNING:
-- WARNING:  Failed to run gnuplot using command 'gnuplot'.
-- WARNING:  Plots will be disabled.
-- WARNING:
--
-- Detected samtools version '1.22' / htslib version 'htscodecs=1.6.3' (from 'samtools').
--
-- Detected 88 CPUs and 503 gigabytes of memory on the local machine.
--
-- Detected Slurm with 'sinfo' binary in /opt/skyformai/bin/sinfo.
--          Slurm disabled by useGrid=false
--
-- Detected  '' with 'pbsnodes' binary in /opt/skyformai/bin/pbsnodes.
--           disabled by useGrid=false
--
-- Detected LSF with 'bsub' binary in /opt/skyformai/bin/bsub.
--          LSF disabled by useGrid=false
--
-- Local machine mode enabled; grid support not detected or not allowed.
--
-- Found trimmed raw PacBio HiFi reads in the input files.
--
--                                (tag)Concurrency
--                         (tag)Threads          |
--                (tag)Memory         |          |
--        (tag)             |         |          |       total usage      algorithm
--        -------  ----------  --------   --------  --------------------  -----------------------------
-- Local: meryl     12.000 GB    4 CPUs x  22 jobs   264.000 GB  88 CPUs  (k-mer counting)
-- Local: cormhap   13.000 GB   11 CPUs x   8 jobs   104.000 GB  88 CPUs  (overlap detection with mhap)
-- Local: obtovl     8.000 GB    8 CPUs x  11 jobs    88.000 GB  88 CPUs  (overlap detection)
-- Local: utgovl     8.000 GB    8 CPUs x  11 jobs    88.000 GB  88 CPUs  (overlap detection)
-- Local: cor        -.--- GB    4 CPUs x   - jobs     -.--- GB   - CPUs  (read correction)
-- Local: ovb        4.000 GB    1 CPU  x  88 jobs   352.000 GB  88 CPUs  (overlap store bucketizer)
-- Local: ovs        8.000 GB    1 CPU  x  62 jobs   496.000 GB  62 CPUs  (overlap store sorting)
-- Local: red       16.000 GB    4 CPUs x  22 jobs   352.000 GB  88 CPUs  (read error detection)
-- Local: oea        8.000 GB    1 CPU  x  62 jobs   496.000 GB  62 CPUs  (overlap error adjustment)
-- Local: bat       32.000 GB    8 CPUs x   1 job     32.000 GB   8 CPUs  (contig construction with bogart)
-- Local: cns        -.--- GB    8 CPUs x   - jobs     -.--- GB   - CPUs  (consensus)
--
-- Generating assembly 'A3-54' in '/share/org/YZWL/yzwl_lixg/project/28.大豆疫霉菌三代基因组/03.hicanu/A3-54/01.raw_output':
--   genomeSize:
--     85000000
--
--   Overlap Generation Limits:
--     corOvlErrorRate 0.0000 (  0.00%)
--     obtOvlErrorRate 0.0250 (  2.50%)
--     utgOvlErrorRate 0.0100 (  1.00%)
--
--   Overlap Processing Limits:
--     corErrorRate    0.0000 (  0.00%)
--     obtErrorRate    0.0250 (  2.50%)
--     utgErrorRate    0.0003 (  0.03%)
--     cnsErrorRate    0.0500 (  5.00%)
--
--   Stages to run:
--     assemble HiFi reads.
--
--
-- BEGIN STORE CREATION
----------------------------------------
-- Starting command on Fri Jan 16 01:35:55 2026 with 4560148.546 GB free disk space

    cd .
    ./A3-54.seqStore.sh \
    > ./A3-54.seqStore.err 2>&1

-- Finished on Fri Jan 16 01:44:24 2026 (509 seconds) with 4559732.39 GB free disk space
----------------------------------------
--
-- In sequence store './A3-54.seqStore':
--   Found 238364 reads.
--   Found 4250015317 bases (50 times coverage).
--    Histogram of corrected reads:
--    
--    G=4250015317                       sum of  ||               length     num
--    NG         length     index       lengths  ||                range    seqs
--    ----- ------------ --------- ------------  ||  ------------------- -------
--    00010        26522     14649    425006309  ||       1238-2391         2737|-------
--    00020        23944     31573    850008878  ||       2392-3545         4753|-----------
--    00030        22205     50032   1275025623  ||       3546-4699         4811|-----------
--    00040        20845     69796   1700022760  ||       4700-5853         4441|-----------
--    00050        19703     90782   2125018605  ||       5854-7007         4177|----------
--    00060        18687    112935   2550021283  ||       7008-8161         3949|----------
--    00070        17710    136292   2975026236  ||       8162-9315         3890|---------
--    00080        16591    161044   3400018162  ||       9316-10469        3697|---------
--    00090        14766    187969   3825019622  ||      10470-11623        3303|--------
--    00100         1238    238364   4250015317  ||      11624-12777        3367|--------
--    001.000x              238364   4250015317  ||      12778-13931        4868|------------
--                                               ||      13932-15085        9759|-----------------------
--                                               ||      15086-16239       16932|---------------------------------------
--                                               ||      16240-17393       23903|-------------------------------------------------------
--                                               ||      17394-18547       27560|---------------------------------------------------------------
--                                               ||      18548-19701       25391|-----------------------------------------------------------
--                                               ||      19702-20855       21206|-------------------------------------------------
--                                               ||      20856-22009       17053|---------------------------------------
--                                               ||      22010-23163       13540|-------------------------------
--                                               ||      23164-24317       10535|-------------------------
--                                               ||      24318-25471        8033|-------------------
--                                               ||      25472-26625        6287|---------------
--                                               ||      26626-27779        4597|-----------
--                                               ||      27780-28933        3396|--------
--                                               ||      28934-30087        2455|------
--                                               ||      30088-31241        1627|----
--                                               ||      31242-32395         975|---
--                                               ||      32396-33549         566|--
--                                               ||      33550-34703         301|-
--                                               ||      34704-35857         153|-
--                                               ||      35858-37011          70|-
--                                               ||      37012-38165          19|-
--                                               ||      38166-39319           5|-
--                                               ||      39320-40473           3|-
--                                               ||      40474-41627           0|
--                                               ||      41628-42781           1|-
--                                               ||      42782-43935           1|-
--                                               ||      43936-45089           0|
--                                               ||      45090-46243           2|-
--                                               ||      46244-47397           1|-
--    
--
-- In sequence store './A3-54.seqStore':
--   Found 238364 reads.
--   Found 4250015317 bases (50 times coverage).
--    Histogram of corrected-trimmed reads:
--    
--    G=4250015317                       sum of  ||               length     num
--    NG         length     index       lengths  ||                range    seqs
--    ----- ------------ --------- ------------  ||  ------------------- -------
--    00010        26522     14649    425006309  ||       1238-2391         2737|-------
--    00020        23944     31573    850008878  ||       2392-3545         4753|-----------
--    00030        22205     50032   1275025623  ||       3546-4699         4811|-----------
--    00040        20845     69796   1700022760  ||       4700-5853         4441|-----------
--    00050        19703     90782   2125018605  ||       5854-7007         4177|----------
--    00060        18687    112935   2550021283  ||       7008-8161         3949|----------
--    00070        17710    136292   2975026236  ||       8162-9315         3890|---------
--    00080        16591    161044   3400018162  ||       9316-10469        3697|---------
--    00090        14766    187969   3825019622  ||      10470-11623        3303|--------
--    00100         1238    238364   4250015317  ||      11624-12777        3367|--------
--    001.000x              238364   4250015317  ||      12778-13931        4868|------------
--                                               ||      13932-15085        9759|-----------------------
--                                               ||      15086-16239       16932|---------------------------------------
--                                               ||      16240-17393       23903|-------------------------------------------------------
--                                               ||      17394-18547       27560|---------------------------------------------------------------
--                                               ||      18548-19701       25391|-----------------------------------------------------------
--                                               ||      19702-20855       21206|-------------------------------------------------
--                                               ||      20856-22009       17053|---------------------------------------
--                                               ||      22010-23163       13540|-------------------------------
--                                               ||      23164-24317       10535|-------------------------
--                                               ||      24318-25471        8033|-------------------
--                                               ||      25472-26625        6287|---------------
--                                               ||      26626-27779        4597|-----------
--                                               ||      27780-28933        3396|--------
--                                               ||      28934-30087        2455|------
--                                               ||      30088-31241        1627|----
--                                               ||      31242-32395         975|---
--                                               ||      32396-33549         566|--
--                                               ||      33550-34703         301|-
--                                               ||      34704-35857         153|-
--                                               ||      35858-37011          70|-
--                                               ||      37012-38165          19|-
--                                               ||      38166-39319           5|-
--                                               ||      39320-40473           3|-
--                                               ||      40474-41627           0|
--                                               ||      41628-42781           1|-
--                                               ||      42782-43935           1|-
--                                               ||      43936-45089           0|
--                                               ||      45090-46243           2|-
--                                               ||      46244-47397           1|-
--    
--
-- Correction skipped; not enabled.
--
-- Trimming skipped; not enabled.
--
-- BEGIN ASSEMBLY
----------------------------------------
-- Starting command on Fri Jan 16 01:44:25 2026 with 4559732.343 GB free disk space

    cd unitigging/0-mercounts
    ./meryl-configure.sh \
    > ./meryl-configure.err 2>&1

-- Finished on Fri Jan 16 01:44:27 2026 (2 seconds) with 4559732.343 GB free disk space
----------------------------------------
--  segments   memory batches
--  -------- -------- -------
--        01 10.81 GB       2
--        02  5.61 GB       2
--        04  2.97 GB       2
--        06  2.14 GB       2
--        08  1.60 GB       2
--        12  1.07 GB       2
--        16  0.81 GB       2
--        20  0.65 GB       2
--        24  0.54 GB       2
--        32  0.41 GB       2
--        40  0.32 GB       2
--        48  -.-- GB       -  (segment size too small)
--        56  -.-- GB       -  (segment size too small)
--        64  -.-- GB       -  (segment size too small)
--        96  -.-- GB       -  (segment size too small)
--
--  For 238364 reads with 4250015317 bases, limit to 42 batches.
--  Will count kmers using 01 jobs, each using 12 GB and 4 threads.
--
-- Finished stage 'merylConfigure', reset canuIteration.
--
-- Running jobs.  First attempt out of 2.
----------------------------------------
-- Starting 'meryl' concurrent execution on Fri Jan 16 01:44:27 2026 with 4559732.312 GB free disk space (1 processes; 22 concurrently)

    cd unitigging/0-mercounts
    ./meryl-count.sh 1 > ./meryl-count.000001.out 2>&1

-- Finished on Fri Jan 16 01:47:57 2026 (210 seconds) with 4559564.828 GB free disk space
----------------------------------------
-- Found 1 Kmer counting (meryl) outputs.
-- Finished stage 'utg-merylCountCheck', reset canuIteration.
--
-- Running jobs.  First attempt out of 2.
----------------------------------------
-- Starting 'meryl' concurrent execution on Fri Jan 16 01:47:57 2026 with 4559564.796 GB free disk space (1 processes; 22 concurrently)

    cd unitigging/0-mercounts
    ./meryl-process.sh 1 > ./meryl-process.000001.out 2>&1

-- Finished on Fri Jan 16 01:48:03 2026 (6 seconds) with 4559547.875 GB free disk space
----------------------------------------
-- Meryl finished successfully.  Kmer frequency histogram:
--
-- WARNING: gnuplot failed.
--
----------------------------------------
--
--  22-mers                                                                                           Fraction
--    Occurrences   NumMers                                                                         Unique Total
--       1-     1         0                                                                        0.0000 0.0000
--       2-     2    211498                                                                        0.0047 0.0001
--       3-     4     87000                                                                        0.0060 0.0002
--       5-     7     37797                                                                        0.0070 0.0003
--       8-    11     17356                                                                        0.0076 0.0003
--      12-    16     43378                                                                        0.0079 0.0004
--      17-    22    263473 *                                                                      0.0092 0.0006
--      23-    29   1631692 ******                                                                 0.0166 0.0028
--      30-    37   8843935 ***********************************                                    0.0629 0.0210
--      38-    46  17422820 ********************************************************************** 0.2871 0.1317
--      47-    56  10162597 ****************************************                               0.6709 0.3630
--      57-    67   1666502 ******                                                                 0.8661 0.5033
--      68-    79    841806 ***                                                                    0.8972 0.5302
--      80-    92   1023135 ****                                                                   0.9161 0.5501
--      93-   106    543468 **                                                                     0.9383 0.5770
--     107-   121    282978 *                                                                      0.9496 0.5929
--     122-   137    293914 *                                                                      0.9559 0.6029
--     138-   154    213830                                                                        0.9622 0.6146
--     155-   172    169890                                                                        0.9668 0.6240
--     173-   191    147109                                                                        0.9706 0.6327
--     192-   211    136286                                                                        0.9738 0.6409
--     212-   232    116883                                                                        0.9769 0.6497
--     233-   254     94163                                                                        0.9794 0.6575
--     255-   277     80327                                                                        0.9815 0.6647
--     278-   301     68827                                                                        0.9832 0.6712
--     302-   326     61852                                                                        0.9848 0.6774
--     327-   352     54718                                                                        0.9861 0.6835
--     353-   379     42795                                                                        0.9873 0.6892
--     380-   407     37726                                                                        0.9883 0.6940
--     408-   436     37786                                                                        0.9891 0.6986
--     437-   466     33045                                                                        0.9899 0.7036
--     467-   497     33557                                                                        0.9907 0.7082
--     498-   529     26500                                                                        0.9914 0.7132
--     530-   562     20977                                                                        0.9920 0.7175
--     563-   596     23136                                                                        0.9924 0.7210
--     597-   631     18463                                                                        0.9929 0.7251
--     632-   667     17318                                                                        0.9934 0.7287
--     668-   704     17977                                                                        0.9937 0.7322
--     705-   742     21207                                                                        0.9941 0.7361
--     743-   781     14017                                                                        0.9946 0.7408
--     782-   821     11398                                                                        0.9949 0.7441
--
--           0 (max occurrences)
--  3211128654 (total mers, non-unique)
--    45091223 (distinct mers, non-unique)
--           0 (unique mers)
-- Finished stage 'meryl-process', reset canuIteration.
--
-- Removing meryl database 'unitigging/0-mercounts/A3-54.ms22'.
--
-- OVERLAPPER (normal) (assembly) erate=0.01
--
----------------------------------------
-- Starting command on Fri Jan 16 01:48:03 2026 with 4559547.859 GB free disk space

    cd unitigging/1-overlapper
    /share/org/YZWL/yzwl_lixg/miniforge3/envs/canu_v.2.3/bin/overlapInCorePartition \
     -S  ../../A3-54.seqStore \
     -hl 160000000 \
     -rl 5000000000 \
     -ol 500 \
     -o  ./A3-54.partition \
    > ./A3-54.partition.err 2>&1

-- Finished on Fri Jan 16 01:48:03 2026 (lickety-split) with 4559547.843 GB free disk space
----------------------------------------
--
-- Configured 21 overlapInCore jobs.
-- Finished stage 'utg-overlapConfigure', reset canuIteration.
--
-- Running jobs.  First attempt out of 2.
----------------------------------------
-- Starting 'utgovl' concurrent execution on Fri Jan 16 01:48:03 2026 with 4559547.812 GB free disk space (21 processes; 11 concurrently)

    cd unitigging/1-overlapper
    ./overlap.sh 1 > ./overlap.000001.out 2>&1
    ./overlap.sh 2 > ./overlap.000002.out 2>&1
    ./overlap.sh 3 > ./overlap.000003.out 2>&1
    ./overlap.sh 4 > ./overlap.000004.out 2>&1
    ./overlap.sh 5 > ./overlap.000005.out 2>&1
    ./overlap.sh 6 > ./overlap.000006.out 2>&1
    ./overlap.sh 7 > ./overlap.000007.out 2>&1
    ./overlap.sh 8 > ./overlap.000008.out 2>&1
    ./overlap.sh 9 > ./overlap.000009.out 2>&1
    ./overlap.sh 10 > ./overlap.000010.out 2>&1
    ./overlap.sh 11 > ./overlap.000011.out 2>&1
    ./overlap.sh 12 > ./overlap.000012.out 2>&1
    ./overlap.sh 13 > ./overlap.000013.out 2>&1
    ./overlap.sh 14 > ./overlap.000014.out 2>&1
    ./overlap.sh 15 > ./overlap.000015.out 2>&1
    ./overlap.sh 16 > ./overlap.000016.out 2>&1
    ./overlap.sh 17 > ./overlap.000017.out 2>&1
    ./overlap.sh 18 > ./overlap.000018.out 2>&1
    ./overlap.sh 19 > ./overlap.000019.out 2>&1
    ./overlap.sh 20 > ./overlap.000020.out 2>&1
    ./overlap.sh 21 > ./overlap.000021.out 2>&1

-- Finished on Fri Jan 16 02:12:11 2026 (1448 seconds) with 4558967.234 GB free disk space
----------------------------------------
-- Found 21 overlapInCore output files.
--
-- overlapInCore compute 'unitigging/1-overlapper':
--   kmer hits
--     with no overlap       1138093712  38.6666667 +- 34342965.072
--     with an overlap         27817081  22.9047619 +- 791835.159
--
--   overlaps                  27817081  22.9047619 +- 791835.159
--     contained                5526717      263177 +- 151725.292
--     dovetail                22290364  45.9047619 +- 640834.944
--
--   overlaps rejected
--     multiple per pair              0           0 +- 0
--     bad short window               0           0 +- 0
--     bad long window                0           0 +- 0
-- Finished stage 'utg-overlapCheck', reset canuIteration.
----------------------------------------
-- Starting command on Fri Jan 16 02:12:11 2026 with 4558967.218 GB free disk space

    cd unitigging
    /share/org/YZWL/yzwl_lixg/miniforge3/envs/canu_v.2.3/bin/ovStoreConfig \
     -S ../A3-54.seqStore \
     -M 4-8 \
     -L ./1-overlapper/ovljob.files \
     -create ./A3-54.ovlStore.config \
     > ./A3-54.ovlStore.config.txt \
    2> ./A3-54.ovlStore.config.err

-- Finished on Fri Jan 16 02:12:12 2026 (one second) with 4558967.203 GB free disk space
----------------------------------------
--
-- Creating overlap store unitigging/A3-54.ovlStore using:
--      1 bucket
--      1 slice
--        using at most 2 GB memory each
--
-- Running jobs.  First attempt out of 2.
----------------------------------------
-- Starting 'ovS' concurrent execution on Fri Jan 16 02:12:12 2026 with 4558967.187 GB free disk space (1 processes; 62 concurrently)

    cd unitigging
    ./A3-54.ovlStore.sh 1 > ./A3-54.ovlStore.000001.out 2>&1

-- Finished on Fri Jan 16 02:12:24 2026 (12 seconds) with 4559352.437 GB free disk space
----------------------------------------
-- Checking store.
----------------------------------------
-- Starting command on Fri Jan 16 02:12:24 2026 with 4559352.437 GB free disk space

    cd unitigging
    /share/org/YZWL/yzwl_lixg/miniforge3/envs/canu_v.2.3/bin/ovStoreDump \
     -S ../A3-54.seqStore \
     -O  ./A3-54.ovlStore \
     -counts \
     > ./A3-54.ovlStore/counts.dat 2> ./A3-54.ovlStore/counts.err

-- Finished on Fri Jan 16 02:12:24 2026 (lickety-split) with 4559352.406 GB free disk space
----------------------------------------
--
-- Overlap store 'unitigging/A3-54.ovlStore' successfully constructed.
-- Found 55634162 overlaps for 226291 reads; 1656183 reads have no overlaps.
--
--
-- Purged 0.627 GB in 63 overlap output files.
----------------------------------------
-- Starting command on Fri Jan 16 02:12:25 2026 with 4559352.406 GB free disk space

    cd unitigging
    /share/org/YZWL/yzwl_lixg/miniforge3/envs/canu_v.2.3/bin/ovStoreStats \
     -C 50 \
     -S ../A3-54.seqStore \
     -O  ./A3-54.ovlStore \
     -o  ./A3-54.ovlStore \
     > ./A3-54.ovlStore.summary.err 2>&1

-- Finished on Fri Jan 16 02:12:32 2026 (7 seconds) with 4559352.39 GB free disk space
----------------------------------------
--
-- Overlap store 'unitigging/A3-54.ovlStore' contains:
--
--   category            reads     %          read length        feature size or coverage  analysis
--   ----------------  -------  -------  ----------------------  ------------------------  --------------------
--   middle-missing        100    0.04    17142.23 +- 6732.57        826.37 +- 1051.76    (bad trimming)
--   middle-hump            16    0.01    14397.88 +- 2234.72       4116.12 +- 2785.48    (bad trimming)
--   no-5-prime            479    0.20    14508.64 +- 4838.93       2196.87 +- 3010.87    (bad trimming)
--   no-3-prime            556    0.23    13674.93 +- 5401.11       2079.20 +- 3018.02    (bad trimming)
--   
--   low-coverage         1704    0.71    12176.51 +- 4561.82          6.14 +- 3.65       (easy to assemble, potential for lower quality consensus)
--   unique             181038   75.95    13710.46 +- 4760.11         42.66 +- 8.35       (easy to assemble, perfect, yay)
--   repeat-cont         19071    8.00    12201.09 +- 4337.69       1055.43 +- 718.20     (potential for consensus errors, no impact on assembly)
--   repeat-dove           254    0.11    21489.24 +- 2191.76        542.39 +- 572.04     (hard to assemble, likely won't assemble correctly or even at all)
--   
--   span-repeat          3451    1.45    14689.85 +- 4213.89       4260.36 +- 4350.23    (read spans a large repeat, usually easy to assemble)
--   uniq-repeat-cont    13955    5.85    13487.97 +- 3825.07                             (should be uniquely placed, low potential for consensus errors, no impact on assembly)
--   uniq-repeat-dove     2509    1.05    19131.28 +- 3069.77                             (will end contigs, potential to misassemble)
--   uniq-anchor          3158    1.32    14459.16 +- 4076.67       7063.80 +- 4848.39    (repeat read, with unique section, probable bad read)
-- Finished stage 'utg-createOverlapStore', reset canuIteration.
--
-- Loading read lengths.
-- Loading number of overlaps per read.
--
-- Configure RED for 16gb memory.
--                   Batches of at most (unlimited) reads.
--                                      500000000 bases.
--                   Expecting evidence of at most 536870912 bases per iteration.
--
--           Total                                               Reads                 Olaps Evidence
--    Job   Memory      Read Range         Reads        Bases   Memory        Olaps   Memory   Memory  (Memory in MB)
--   ---- -------- ------------------- --------- ------------ -------- ------------ -------- --------
--      1 16384.45         1-45516          5721    108977610 13303.11       816214     9.34  1024.00
--      2 16385.39     45517-90857          5775    108861438 13288.93      2137568    24.46  1024.00
--      3 16386.93     90858-142388         6576    108992867 13305.00       867654     9.93  1024.00
--      4 16385.85    142389-192413         6408    108938114 13298.31      1357499    15.54  1024.00
--      5 16384.45    192414-238311         5813    108862688 13289.09      2041313    23.36  1024.00
--      6 16386.71    238312-290179         6523    108982108 13303.69       963717    11.03  1024.00
--      7 16384.43    290180-340869         6357    108919703 13296.06      1430040    16.37  1024.00
--      8 16384.49    340870-386748         5746    108890811 13292.52      1745463    19.98  1024.00
--      9 16384.20    386749-439013         6520    108963724 13301.44       939993    10.76  1024.00
--     10 16385.54    439014-487896         6222    108923599 13296.53      1485798    17.00  1024.00
--     11 16386.76    487897-533706         5719    108901672 13293.84      1828318    20.92  1024.00
--     12 16384.38    533707-585472         6555    108963361 13301.40       960016    10.99  1024.00
--     13 16385.79    585473-633057         6063    108930777 13297.40      1431872    16.39  1024.00
--     14 16384.39    633058-677792         5732    108873306 13290.38      1923716    22.02  1024.00
--     15 16386.41    677793-729527         6520    108978515 13303.25       975482    11.16  1024.00
--     16 16384.74    729528-777728         6059    108916935 13295.71      1487774    17.03  1024.00
--     17 16384.03    777729-822661         5751    108878985 13291.07      1831139    20.96  1024.00
--     18 16384.25    822662-874637         6601    108955838 13300.48      1028515    11.77  1024.00
--     19 16384.36    874638-921469         6014    108915969 13295.60      1464833    16.76  1024.00
--     20 16384.18    921470-967060         5748    108873852 13290.45      1899531    21.74  1024.00
--     21 16384.21    967061-1017669        6505    108961548 13301.17       964104    11.03  1024.00
--     22 16384.84   1017670-1064743        5987    108926559 13296.89      1394297    15.96  1024.00
--     23 16386.32   1064744-1110508        5727    108889941 13292.41      1914917    21.91  1024.00
--     24 16384.12   1110509-1161089        6477    108961401 13301.16       958342    10.97  1024.00
--     25 16384.68   1161090-1208099        5909    108927188 13296.96      1373896    15.72  1024.00
--     26 16384.60   1208100-1252781        5757    108873123 13290.36      1943916    22.25  1024.00
--     27 16384.54   1252782-1306099        6723    108933850 13297.80      1287797    14.74  1024.00
--     28 16384.67   1306100-1350625        5682    108949342 13299.66      1136960    13.01  1024.00
--     29 16386.08   1350626-1395845        5720    108890617 13292.49      1886123    21.58  1024.00
--     30 16385.28   1395846-1447855        6651    108964102 13301.49      1030120    11.79  1024.00
--     31 16385.70   1447856-1493422        5740    108949359 13299.66      1226554    14.04  1024.00
--     32 16386.18   1493423-1539579        5740    108888604 13292.25      1916907    21.94  1024.00
--     33 16385.24   1539580-1592430        6641    108941046 13298.68      1272286    14.56  1024.00
--     34 16385.51   1592431-1637281        5705    108955853 13300.45      1140437    13.05  1024.00
--     35 16385.22   1637282-1683279        5799    108894817 13293.01      1765867    20.21  1024.00
--     36 16386.60   1683280-1737262        6885    108926943 13296.96      1541555    17.64  1024.00
--     37 16385.18   1737263-1781371        5614    108961648 13301.16      1050633    12.02  1024.00
--     38 16385.36   1781372-1826865        5762    108896199 13293.17      1763950    20.19  1024.00
--     39 16384.10   1826866-1881692        6797    108916516 13295.69      1434308    16.41  1024.00
--     40  3304.69   1881693-1882474         120      1904789   232.52        14738     0.17  1024.00
--   ---- -------- ------------------- --------- ------------ -------- ------------ -------- --------
--                                                 4250015317              55634162
-- Finished stage 'readErrorDetectionConfigure', reset canuIteration.
--
-- Running jobs.  First attempt out of 2.
----------------------------------------
-- Starting 'red' concurrent execution on Fri Jan 16 02:12:39 2026 with 4559352.343 GB free disk space (40 processes; 22 concurrently)

    cd unitigging/3-overlapErrorAdjustment
    ./red.sh 1 > ./red.000001.out 2>&1
    ./red.sh 2 > ./red.000002.out 2>&1
    ./red.sh 3 > ./red.000003.out 2>&1
    ./red.sh 4 > ./red.000004.out 2>&1
    ./red.sh 5 > ./red.000005.out 2>&1
    ./red.sh 6 > ./red.000006.out 2>&1
    ./red.sh 7 > ./red.000007.out 2>&1
    ./red.sh 8 > ./red.000008.out 2>&1
    ./red.sh 9 > ./red.000009.out 2>&1
    ./red.sh 10 > ./red.000010.out 2>&1
    ./red.sh 11 > ./red.000011.out 2>&1
    ./red.sh 12 > ./red.000012.out 2>&1
    ./red.sh 13 > ./red.000013.out 2>&1
    ./red.sh 14 > ./red.000014.out 2>&1
    ./red.sh 15 > ./red.000015.out 2>&1
    ./red.sh 16 > ./red.000016.out 2>&1
    ./red.sh 17 > ./red.000017.out 2>&1
    ./red.sh 18 > ./red.000018.out 2>&1
    ./red.sh 19 > ./red.000019.out 2>&1
    ./red.sh 20 > ./red.000020.out 2>&1
    ./red.sh 21 > ./red.000021.out 2>&1
    ./red.sh 22 > ./red.000022.out 2>&1
    ./red.sh 23 > ./red.000023.out 2>&1
    ./red.sh 24 > ./red.000024.out 2>&1
    ./red.sh 25 > ./red.000025.out 2>&1
    ./red.sh 26 > ./red.000026.out 2>&1
    ./red.sh 27 > ./red.000027.out 2>&1
    ./red.sh 28 > ./red.000028.out 2>&1
    ./red.sh 29 > ./red.000029.out 2>&1
    ./red.sh 30 > ./red.000030.out 2>&1
    ./red.sh 31 > ./red.000031.out 2>&1
    ./red.sh 32 > ./red.000032.out 2>&1
    ./red.sh 33 > ./red.000033.out 2>&1
    ./red.sh 34 > ./red.000034.out 2>&1
    ./red.sh 35 > ./red.000035.out 2>&1
    ./red.sh 36 > ./red.000036.out 2>&1
    ./red.sh 37 > ./red.000037.out 2>&1
    ./red.sh 38 > ./red.000038.out 2>&1
    ./red.sh 39 > ./red.000039.out 2>&1
    ./red.sh 40 > ./red.000040.out 2>&1

-- Finished on Fri Jan 16 02:30:05 2026 (1046 seconds) with 4559272.375 GB free disk space
----------------------------------------
-- Found 40 read error detection output files.
-- Finished stage 'readErrorDetectionCheck', reset canuIteration.
--
-- Loading read lengths.
-- Loading number of overlaps per read.
--
-- Configure OEA for 8gb memory.
--                   Batches of at most (unlimited) reads.
--                                      300000000 bases.
--
--           Total                                               Reads                 Olaps  Adjusts
--    Job   Memory      Read Range         Reads        Bases   Memory        Olaps   Memory   Memory  (Memory in MB)
--   ---- -------- ------------------- --------- ------------ -------- ------------ -------- --------
--      1  2820.12         1-128142        16252    300015586   294.61      3508260   107.06   370.44
--      2  2837.80    128143-262937        17170    300006339   294.63      4087151   124.73   370.44
--      3  2834.01    262938-399596        17090    300018855   294.64      3962494   120.93   370.44
--      4  2837.11    399597-534534        16968    300008361   294.63      4064565   124.04   370.44
--      5  2832.51    534535-667636        16905    300017985   294.64      3913691   119.44   370.44
--      6  2831.77    667637-800597        16905    300001148   294.62      3889843   118.71   370.44
--      7  2832.43    800598-934334        16969    300003894   294.62      3911556   119.37   370.44
--      8  2824.65    934335-1066201       16843    300003062   294.62      3656662   111.59   370.44
--      9  2830.64   1066202-1198588       16748    300002570   294.62      3853117   117.59   370.44
--     10  2841.91   1198589-1330701       16820    300009097   294.62      4222035   128.85   370.44
--     11  2833.44   1330702-1462780       16783    300006108   294.62      3944574   120.38   370.44
--     12  2838.25   1462781-1595920       16669    300011793   294.62      4102202   125.19   370.44
--     13  2819.09   1595921-1724242       16290    300016095   294.61      3474607   106.04   370.44
--     14  2834.43   1724243-1854869       16525    300001535   294.61      3977371   121.38   370.44
--     15  2506.66   1854870-1882474        3427     49892889    55.69      1066034    32.53   370.44
--   ---- -------- ------------------- --------- ------------ -------- ------------ -------- --------
--                                                 4250015317              55634162
-- Finished stage 'overlapErrorAdjustmentConfigure', reset canuIteration.
--
-- Running jobs.  First attempt out of 2.
----------------------------------------
-- Starting 'oea' concurrent execution on Fri Jan 16 02:30:13 2026 with 4559291.968 GB free disk space (15 processes; 62 concurrently)

    cd unitigging/3-overlapErrorAdjustment
    ./oea.sh 1 > ./oea.000001.out 2>&1
    ./oea.sh 2 > ./oea.000002.out 2>&1
    ./oea.sh 3 > ./oea.000003.out 2>&1
    ./oea.sh 4 > ./oea.000004.out 2>&1
    ./oea.sh 5 > ./oea.000005.out 2>&1
    ./oea.sh 6 > ./oea.000006.out 2>&1
    ./oea.sh 7 > ./oea.000007.out 2>&1
    ./oea.sh 8 > ./oea.000008.out 2>&1
    ./oea.sh 9 > ./oea.000009.out 2>&1
    ./oea.sh 10 > ./oea.000010.out 2>&1
    ./oea.sh 11 > ./oea.000011.out 2>&1
    ./oea.sh 12 > ./oea.000012.out 2>&1
    ./oea.sh 13 > ./oea.000013.out 2>&1
    ./oea.sh 14 > ./oea.000014.out 2>&1
    ./oea.sh 15 > ./oea.000015.out 2>&1

-- Finished on Fri Jan 16 03:19:10 2026 (2937 seconds) with 4557657.218 GB free disk space
----------------------------------------
-- Found 15 overlap error adjustment output files.
-- Finished stage 'overlapErrorAdjustmentCheck', reset canuIteration.
----------------------------------------
-- Starting command on Fri Jan 16 03:19:10 2026 with 4557657.203 GB free disk space

    cd unitigging/3-overlapErrorAdjustment
    /share/org/YZWL/yzwl_lixg/miniforge3/envs/canu_v.2.3/bin/loadErates \
      -S ../../A3-54.seqStore \
      -O ../A3-54.ovlStore \
      -L ./oea.files \
    > ./oea.apply.err 2>&1

-- Finished on Fri Jan 16 03:19:10 2026 (in the blink of an eye) with 4557657.093 GB free disk space
----------------------------------------
-- No report available.
-- Finished stage 'updateOverlapStore', reset canuIteration.
-- Finished stage 'unitig', reset canuIteration.
--
-- Running jobs.  First attempt out of 2.
----------------------------------------
-- Starting 'bat' concurrent execution on Fri Jan 16 03:19:10 2026 with 4557657.046 GB free disk space (1 processes; 1 concurrently)

    cd unitigging/4-unitigger
    ./unitigger.sh 1 > ./unitigger.000001.out 2>&1

-- Finished on Fri Jan 16 03:19:24 2026 (14 seconds) with 4557650.109 GB free disk space
----------------------------------------
-- Unitigger finished successfully.
--  
--  ERROR RATES
--  -----------
--                                                   --------threshold------
--  253493                       fraction error      fraction        percent
--  samples                              (1e-5)         error          error
--                   --------------------------      --------       --------
--  command line (-eg)                           ->     30.00        0.0300%
--  command line (-ef)                           ->  -----.--      ---.----%
--  command line (-eM)                           ->     30.00        0.0300%
--  mean + std.dev       0.49 +-  12 *     3.23  ->     39.28        0.0393%
--  median + mad         0.00 +-  12 *     0.00  ->      0.00        0.0000%
--  90th percentile                              ->      1.00        0.0010%  (enabled)
--  
--  BEST EDGE FILTERING
--  -------------------
--  At graph threshold 0.0300%, reads:
--    available to have edges:        49758
--    with at least one edge:         34435
--  
--  At max threshold 0.0300%, reads:
--    available to have edges:        49758
--    with at least one edge:         34435
--  
--  At tight threshold 0.0010%, reads with:
--    both edges below error threshold:     29440  (80.00% minReadsBest threshold = 27548)
--    one  edge  above error threshold:      3776
--    both edges above error threshold:      1219
--    at least one edge:                    34435
--  
--  At loose threshold 0.0300%, reads with:
--    both edges below error threshold:     34435  (80.00% minReadsBest threshold = 27548)
--    one  edge  above error threshold:         0
--    both edges above error threshold:         0
--    at least one edge:                    34435
--  
--  
--  INITIAL EDGES
--  -------- ----------------------------------------
--    183029 reads are contained
--   1670568 reads have no best edges (singleton)
--       372 reads have only one best edge (spur) 
--                192 are mutual best
--     28505 reads have two best edges 
--                714 have one mutual best edge
--              27496 have two mutual best edges
--  
--  
--  FINAL EDGES
--  -------- ----------------------------------------
--    183029 reads are contained
--   1670914 reads have no best edges (singleton)
--       237 reads have only one best edge (spur) 
--                200 are mutual best
--     28294 reads have two best edges 
--                584 have one mutual best edge
--              27497 have two mutual best edges
--  
--  
--  EDGE FILTERING
--  -------- ------------------------------------------
--         0 reads are ignored
--     10454 reads have a gap in overlap coverage
--       142 reads have lopsided best edges
-- Found, in version 1, after unitig construction:
--   contigs:      110 sequences, total length 69866217 bp (including 106 repeats of total length 2575942 bp).
--   bubbles:      143 sequences, total length 4189166 bp.
--   unassembled:  26589 sequences, total length 339434836 bp.
--
-- Contig sizes based on genome size 85mbp:
--
--            NG (bp)  LG (contigs)    sum (bp)
--         ----------  ------------  ----------
--     10     8762234             1     8762234
--     20     6280054             3    22995831
--     30     4624304             4    27620135
--     40     3898450             6    36103966
--     50     3680450             8    43543115
--     60     2754028            11    53025155
--     70     2519833            14    60803593
--     80       46940            37    68013492
--
-- Finished stage 'unitigCheck', reset canuIteration.
----------------------------------------
-- Starting command on Fri Jan 16 03:19:24 2026 with 4557650.093 GB free disk space

    cd unitigging
    /share/org/YZWL/yzwl_lixg/miniforge3/envs/canu_v.2.3/bin/utgcns \
      -S ../A3-54.seqStore \
      -T  ./A3-54.ctgStore 1 \
      -partition 0.8 1.5 0.1 \
    > ./A3-54.ctgStore/partitioning.log 2>&1

-- Finished on Fri Jan 16 03:19:34 2026 (10 seconds) with 4557648.89 GB free disk space
----------------------------------------
-- Using slow alignment for consensus (iteration '0').
-- Configured 10 consensus jobs.
-- Finished stage 'consensusConfigure', reset canuIteration.
--
-- Local: cns       13.000 GB    8 CPUs x  11 jobs   143.000 GB  88 CPUs  (consensus)
--
--
-- Running jobs.  First attempt out of 2.
----------------------------------------
-- Starting 'cns' concurrent execution on Fri Jan 16 03:19:34 2026 with 4557648.859 GB free disk space (10 processes; 11 concurrently)

    cd unitigging/5-consensus
    ./consensus.sh 1 > ./consensus.000001.out 2>&1
    ./consensus.sh 2 > ./consensus.000002.out 2>&1
    ./consensus.sh 3 > ./consensus.000003.out 2>&1
    ./consensus.sh 4 > ./consensus.000004.out 2>&1
    ./consensus.sh 5 > ./consensus.000005.out 2>&1
    ./consensus.sh 6 > ./consensus.000006.out 2>&1
    ./consensus.sh 7 > ./consensus.000007.out 2>&1
    ./consensus.sh 8 > ./consensus.000008.out 2>&1
    ./consensus.sh 9 > ./consensus.000009.out 2>&1
    ./consensus.sh 10 > ./consensus.000010.out 2>&1

-- Finished on Fri Jan 16 03:27:27 2026 (473 seconds) with 4557101.171 GB free disk space
----------------------------------------
-- Using slow alignment for consensus (iteration '1').
-- Configured 10 consensus jobs.
-- All 10 consensus jobs finished successfully.
-- Finished stage 'consensusCheck', reset canuIteration.
-- Using slow alignment for consensus (iteration '0').
-- Configured 10 consensus jobs.
----------------------------------------
-- Starting command on Fri Jan 16 03:27:27 2026 with 4557101.125 GB free disk space

    cd unitigging
    /share/org/YZWL/yzwl_lixg/miniforge3/envs/canu_v.2.3/bin/tgStoreLoad \
      -S ../A3-54.seqStore \
      -T  ./A3-54.ctgStore 2 \
      -L ./5-consensus/ctgcns.files \
    > ./5-consensus/ctgcns.files.ctgStoreLoad.err 2>&1

-- Finished on Fri Jan 16 03:27:29 2026 (2 seconds) with 4557100 GB free disk space
----------------------------------------
----------------------------------------
-- Starting command on Fri Jan 16 03:27:29 2026 with 4557100 GB free disk space

    cd unitigging
    /share/org/YZWL/yzwl_lixg/miniforge3/envs/canu_v.2.3/bin/tgTigDisplay \
      -S ../A3-54.seqStore \
      -b \
      -o ../A3-54.contigs.unsorted.bam \
      -L ./5-consensus/ctgcns.files \
    > ./5-consensus/ctgcns.files.contigs.bam.err 2>&1

-- Finished on Fri Jan 16 03:30:05 2026 (156 seconds) with 4557027.515 GB free disk space
----------------------------------------
----------------------------------------
-- Starting command on Fri Jan 16 03:30:05 2026 with 4557027.515 GB free disk space

    cd .
    samtools sort \
      --write-index \
      --threads 2 \
      -o ./A3-54.contigs.bam ./A3-54.contigs.unsorted.bam \
    > ./ctgcns.bam.err 2>&1

-- Finished on Fri Jan 16 03:31:00 2026 (55 seconds) with 4556985.828 GB free disk space
----------------------------------------
-- Purging consensus output after loading to ctgStore.
-- Purged 10 .cns outputs.
----------------------------------------
-- Starting command on Fri Jan 16 03:31:00 2026 with 4556988.625 GB free disk space

    cd unitigging
    /share/org/YZWL/yzwl_lixg/miniforge3/envs/canu_v.2.3/bin/tgStoreDump \
      -S ../A3-54.seqStore \
      -T ./A3-54.ctgStore 2 \
      -sizes -s 85000000 \
    > ./A3-54.ctgStore/seqDB.v002.sizes.txt
ZERO length suplied to intervalList::add(), ignoring interval.
ZERO length suplied to intervalList::add(), ignoring interval.
ZERO length suplied to intervalList::add(), ignoring interval.
ZERO length suplied to intervalList::add(), ignoring interval.
ZERO length suplied to intervalList::add(), ignoring interval.
ZERO length suplied to intervalList::add(), ignoring interval.
ZERO length suplied to intervalList::add(), ignoring interval.
ZERO length suplied to intervalList::add(), ignoring interval.
ZERO length suplied to intervalList::add(), ignoring interval.
ZERO length suplied to intervalList::add(), ignoring interval.
ZERO length suplied to intervalList::add(), ignoring interval.
ZERO length suplied to intervalList::add(), ignoring interval.
ZERO length suplied to intervalList::add(), ignoring interval.
ZERO length suplied to intervalList::add(), ignoring interval.
ZERO length suplied to intervalList::add(), ignoring interval.
ZERO length suplied to intervalList::add(), ignoring interval.
ZERO length suplied to intervalList::add(), ignoring interval.
ZERO length suplied to intervalList::add(), ignoring interval.
ZERO length suplied to intervalList::add(), ignoring interval.
ZERO length suplied to intervalList::add(), ignoring interval.
ZERO length suplied to intervalList::add(), ignoring interval.
ZERO length suplied to intervalList::add(), ignoring interval.
ZERO length suplied to intervalList::add(), ignoring interval.
ZERO length suplied to intervalList::add(), ignoring interval.
ZERO length suplied to intervalList::add(), ignoring interval.
ZERO length suplied to intervalList::add(), ignoring interval.
ZERO length suplied to intervalList::add(), ignoring interval.
ZERO length suplied to intervalList::add(), ignoring interval.
ZERO length suplied to intervalList::add(), ignoring interval.
ZERO length suplied to intervalList::add(), ignoring interval.
ZERO length suplied to intervalList::add(), ignoring interval.
ZERO length suplied to intervalList::add(), ignoring interval.
ZERO length suplied to intervalList::add(), ignoring interval.
ZERO length suplied to intervalList::add(), ignoring interval.
ZERO length suplied to intervalList::add(), ignoring interval.
ZERO length suplied to intervalList::add(), ignoring interval.
ZERO length suplied to intervalList::add(), ignoring interval.
ZERO length suplied to intervalList::add(), ignoring interval.
ZERO length suplied to intervalList::add(), ignoring interval.
ZERO length suplied to intervalList::add(), ignoring interval.
ZERO length suplied to intervalList::add(), ignoring interval.
ZERO length suplied to intervalList::add(), ignoring interval.
ZERO length suplied to intervalList::add(), ignoring interval.
ZERO length suplied to intervalList::add(), ignoring interval.
ZERO length suplied to intervalList::add(), ignoring interval.
ZERO length suplied to intervalList::add(), ignoring interval.
ZERO length suplied to intervalList::add(), ignoring interval.
ZERO length suplied to intervalList::add(), ignoring interval.
ZERO length suplied to intervalList::add(), ignoring interval.
ZERO length suplied to intervalList::add(), ignoring interval.
ZERO length suplied to intervalList::add(), ignoring interval.
ZERO length suplied to intervalList::add(), ignoring interval.
ZERO length suplied to intervalList::add(), ignoring interval.
ZERO length suplied to intervalList::add(), ignoring interval.
ZERO length suplied to intervalList::add(), ignoring interval.
ZERO length suplied to intervalList::add(), ignoring interval.
ZERO length suplied to intervalList::add(), ignoring interval.
ZERO length suplied to intervalList::add(), ignoring interval.
ZERO length suplied to intervalList::add(), ignoring interval.
ZERO length suplied to intervalList::add(), ignoring interval.
ZERO length suplied to intervalList::add(), ignoring interval.

-- Finished on Fri Jan 16 03:31:00 2026 (furiously fast) with 4556988.625 GB free disk space
----------------------------------------
-- Found, in version 2, after consensus generation:
--   contigs:      110 sequences, total length 91269893 bp (including 106 repeats of total length 3623117 bp).
--   bubbles:      143 sequences, total length 5631174 bp.
--   unassembled:  26589 sequences, total length 466214813 bp.
--
-- Contig sizes based on genome size 85mbp:
--
--            NG (bp)  LG (contigs)    sum (bp)
--         ----------  ------------  ----------
--     10    11389689             1    11389689
--     20    10379674             2    21769363
--     30     8158052             3    29927415
--     40     6023944             4    35951359
--     50     5092881             6    47018003
--     60     4891432             7    51909435
--     70     4438383             9    61137927
--     80     3589832            11    69065091
--     90     3280647            14    79155662
--    100      771735            18    85268478
--
-- Finished stage 'consensusLoad', reset canuIteration.
----------------------------------------
-- Starting command on Fri Jan 16 03:31:00 2026 with 4556988.609 GB free disk space

    cd .
    /share/org/YZWL/yzwl_lixg/miniforge3/envs/canu_v.2.3/bin/tgStoreDump \
      -S ./A3-54.seqStore \
      -T ./unitigging/A3-54.ctgStore 2 \
      -o ./A3-54.contigs \
      -layout \
    > ./A3-54.contigs.layout.err 2>&1

-- Finished on Fri Jan 16 03:31:01 2026 (one second) with 4556988.562 GB free disk space
----------------------------------------
----------------------------------------
-- Starting command on Fri Jan 16 03:31:01 2026 with 4556988.562 GB free disk space

    cd .
    /share/org/YZWL/yzwl_lixg/miniforge3/envs/canu_v.2.3/bin/tgStoreDump \
      -S ./A3-54.seqStore \
      -T ./unitigging/A3-54.ctgStore 2 \
      -consensus -fasta \
      -unassembled \
    > ./A3-54.unassembled.fasta
    2> ./A3-54.unassembled.err
ZERO length suplied to intervalList::add(), ignoring interval.
ZERO length suplied to intervalList::add(), ignoring interval.
ZERO length suplied to intervalList::add(), ignoring interval.
ZERO length suplied to intervalList::add(), ignoring interval.
ZERO length suplied to intervalList::add(), ignoring interval.
ZERO length suplied to intervalList::add(), ignoring interval.
ZERO length suplied to intervalList::add(), ignoring interval.
ZERO length suplied to intervalList::add(), ignoring interval.
ZERO length suplied to intervalList::add(), ignoring interval.
ZERO length suplied to intervalList::add(), ignoring interval.
ZERO length suplied to intervalList::add(), ignoring interval.
ZERO length suplied to intervalList::add(), ignoring interval.
ZERO length suplied to intervalList::add(), ignoring interval.
ZERO length suplied to intervalList::add(), ignoring interval.
ZERO length suplied to intervalList::add(), ignoring interval.
ZERO length suplied to intervalList::add(), ignoring interval.
ZERO length suplied to intervalList::add(), ignoring interval.
ZERO length suplied to intervalList::add(), ignoring interval.
ZERO length suplied to intervalList::add(), ignoring interval.
ZERO length suplied to intervalList::add(), ignoring interval.
ZERO length suplied to intervalList::add(), ignoring interval.
ZERO length suplied to intervalList::add(), ignoring interval.
ZERO length suplied to intervalList::add(), ignoring interval.
ZERO length suplied to intervalList::add(), ignoring interval.
ZERO length suplied to intervalList::add(), ignoring interval.
ZERO length suplied to intervalList::add(), ignoring interval.
ZERO length suplied to intervalList::add(), ignoring interval.
ZERO length suplied to intervalList::add(), ignoring interval.
ZERO length suplied to intervalList::add(), ignoring interval.
ZERO length suplied to intervalList::add(), ignoring interval.
ZERO length suplied to intervalList::add(), ignoring interval.
ZERO length suplied to intervalList::add(), ignoring interval.
ZERO length suplied to intervalList::add(), ignoring interval.
ZERO length suplied to intervalList::add(), ignoring interval.
ZERO length suplied to intervalList::add(), ignoring interval.
ZERO length suplied to intervalList::add(), ignoring interval.
ZERO length suplied to intervalList::add(), ignoring interval.
ZERO length suplied to intervalList::add(), ignoring interval.
ZERO length suplied to intervalList::add(), ignoring interval.
ZERO length suplied to intervalList::add(), ignoring interval.
ZERO length suplied to intervalList::add(), ignoring interval.
ZERO length suplied to intervalList::add(), ignoring interval.
ZERO length suplied to intervalList::add(), ignoring interval.
ZERO length suplied to intervalList::add(), ignoring interval.
ZERO length suplied to intervalList::add(), ignoring interval.
ZERO length suplied to intervalList::add(), ignoring interval.
ZERO length suplied to intervalList::add(), ignoring interval.
ZERO length suplied to intervalList::add(), ignoring interval.
ZERO length suplied to intervalList::add(), ignoring interval.
ZERO length suplied to intervalList::add(), ignoring interval.
ZERO length suplied to intervalList::add(), ignoring interval.
ZERO length suplied to intervalList::add(), ignoring interval.
ZERO length suplied to intervalList::add(), ignoring interval.
ZERO length suplied to intervalList::add(), ignoring interval.
ZERO length suplied to intervalList::add(), ignoring interval.
ZERO length suplied to intervalList::add(), ignoring interval.
ZERO length suplied to intervalList::add(), ignoring interval.
ZERO length suplied to intervalList::add(), ignoring interval.
ZERO length suplied to intervalList::add(), ignoring interval.
ZERO length suplied to intervalList::add(), ignoring interval.
ZERO length suplied to intervalList::add(), ignoring interval.

-- Finished on Fri Jan 16 03:31:03 2026 (2 seconds) with 4556988.109 GB free disk space
----------------------------------------
----------------------------------------
-- Starting command on Fri Jan 16 03:31:03 2026 with 4556988.109 GB free disk space

    cd .
    /share/org/YZWL/yzwl_lixg/miniforge3/envs/canu_v.2.3/bin/tgStoreDump \
      -S ./A3-54.seqStore \
      -T ./unitigging/A3-54.ctgStore 2 \
      -consensus -fasta \
      -contigs \
    > ./A3-54.contigs.fasta
    2> ./A3-54.contigs.err
ZERO length suplied to intervalList::add(), ignoring interval.
ZERO length suplied to intervalList::add(), ignoring interval.
ZERO length suplied to intervalList::add(), ignoring interval.
ZERO length suplied to intervalList::add(), ignoring interval.
ZERO length suplied to intervalList::add(), ignoring interval.
ZERO length suplied to intervalList::add(), ignoring interval.
ZERO length suplied to intervalList::add(), ignoring interval.
ZERO length suplied to intervalList::add(), ignoring interval.
ZERO length suplied to intervalList::add(), ignoring interval.
ZERO length suplied to intervalList::add(), ignoring interval.
ZERO length suplied to intervalList::add(), ignoring interval.
ZERO length suplied to intervalList::add(), ignoring interval.
ZERO length suplied to intervalList::add(), ignoring interval.
ZERO length suplied to intervalList::add(), ignoring interval.
ZERO length suplied to intervalList::add(), ignoring interval.
ZERO length suplied to intervalList::add(), ignoring interval.
ZERO length suplied to intervalList::add(), ignoring interval.
ZERO length suplied to intervalList::add(), ignoring interval.
ZERO length suplied to intervalList::add(), ignoring interval.
ZERO length suplied to intervalList::add(), ignoring interval.
ZERO length suplied to intervalList::add(), ignoring interval.
ZERO length suplied to intervalList::add(), ignoring interval.
ZERO length suplied to intervalList::add(), ignoring interval.
ZERO length suplied to intervalList::add(), ignoring interval.
ZERO length suplied to intervalList::add(), ignoring interval.
ZERO length suplied to intervalList::add(), ignoring interval.
ZERO length suplied to intervalList::add(), ignoring interval.
ZERO length suplied to intervalList::add(), ignoring interval.
ZERO length suplied to intervalList::add(), ignoring interval.
ZERO length suplied to intervalList::add(), ignoring interval.
ZERO length suplied to intervalList::add(), ignoring interval.
ZERO length suplied to intervalList::add(), ignoring interval.
ZERO length suplied to intervalList::add(), ignoring interval.
ZERO length suplied to intervalList::add(), ignoring interval.
ZERO length suplied to intervalList::add(), ignoring interval.
ZERO length suplied to intervalList::add(), ignoring interval.
ZERO length suplied to intervalList::add(), ignoring interval.
ZERO length suplied to intervalList::add(), ignoring interval.
ZERO length suplied to intervalList::add(), ignoring interval.
ZERO length suplied to intervalList::add(), ignoring interval.
ZERO length suplied to intervalList::add(), ignoring interval.
ZERO length suplied to intervalList::add(), ignoring interval.
ZERO length suplied to intervalList::add(), ignoring interval.
ZERO length suplied to intervalList::add(), ignoring interval.
ZERO length suplied to intervalList::add(), ignoring interval.
ZERO length suplied to intervalList::add(), ignoring interval.
ZERO length suplied to intervalList::add(), ignoring interval.
ZERO length suplied to intervalList::add(), ignoring interval.
ZERO length suplied to intervalList::add(), ignoring interval.
ZERO length suplied to intervalList::add(), ignoring interval.
ZERO length suplied to intervalList::add(), ignoring interval.
ZERO length suplied to intervalList::add(), ignoring interval.
ZERO length suplied to intervalList::add(), ignoring interval.
ZERO length suplied to intervalList::add(), ignoring interval.
ZERO length suplied to intervalList::add(), ignoring interval.
ZERO length suplied to intervalList::add(), ignoring interval.
ZERO length suplied to intervalList::add(), ignoring interval.
ZERO length suplied to intervalList::add(), ignoring interval.
ZERO length suplied to intervalList::add(), ignoring interval.
ZERO length suplied to intervalList::add(), ignoring interval.
ZERO length suplied to intervalList::add(), ignoring interval.

-- Finished on Fri Jan 16 03:31:04 2026 (one second) with 4556988 GB free disk space
----------------------------------------
-- Finished stage 'generateOutputs', reset canuIteration.
--
-- Assembly 'A3-54' finished in '/share/org/YZWL/yzwl_lixg/project/28.大豆疫霉菌三代基因组/03.hicanu/A3-54/01.raw_output'.
--
-- Summary saved in 'A3-54.report'.
--
-- Sequences saved:
--   Contigs       -> 'A3-54.contigs.fasta'
--   Unassembled   -> 'A3-54.unassembled.fasta'
--
-- Read layouts saved:
--   Contigs       -> 'A3-54.contigs.layout'.
--
-- Bye.

2026-01-16 03:31:04.487 - WARNING - 输出文件不存在|Output file does not exist: /share/org/YZWL/yzwl_lixg/project/28.大豆疫霉菌三代基因组/03.hicanu/A3-54/01.raw_output/A3-54.unitigs.fasta
Usage: biopytools ragtag [OPTIONS]
Try 'biopytools ragtag -h' for help.

Error: Invalid value for '-r' / '--reference': 文件不存在|File does not exist: /share/org/YZWL/yzwl_lixg/project/28.大豆疫霉菌三代基因组/04.ragtag/Psoja_T2T.fa
Usage: biopytools genomesyn [OPTIONS]
Try 'biopytools genomesyn -h' for help.

Error: Invalid value for '-i' / '--ref': Path '04.ragtag/A3-54/hicanu/A3-54_RagTag_scaffolded.fa' does not exist.
Job 68886805 stderr output:

