Usage: biopytools ragtag [OPTIONS]
Try 'biopytools ragtag -h' for help.

Error: Invalid value for '-r' / '--reference': 文件不存在|File does not exist: /share/org/YZWL/yzwl_lixg/project/28.大豆疫霉菌三代基因组/04.ragtag/Psoja_T2T.fa
Usage: biopytools genomesyn [OPTIONS]
Try 'biopytools genomesyn -h' for help.

Error: Invalid value for '-i' / '--ref': Path '04.ragtag/A2-3/hifiasm/A2-3_RagTag_scaffolded.fa' does not exist.
2026-01-16 00:59:26.172 - WARNING - 命令错误输出|Command stderr:
-- canu master +27 changes (r10515 2a41e933b8de6ed66723d75d36dd071b46d2c347)
--
-- CITATIONS
--
-- For assemblies of PacBio HiFi reads:
--   Nurk S, Walenz BP, Rhiea A, Vollger MR, Logsdon GA, Grothe R, Miga KH, Eichler EE, Phillippy AM, Koren S.
--   HiCanu: accurate assembly of segmental duplications, satellites, and allelic variants from high-fidelity long reads.
--   biorXiv. 2020.
--   https://doi.org/10.1101/2020.03.14.992248
-- 
-- Read and contig alignments during correction and consensus use:
--   Šošic M, Šikic M.
--   Edlib: a C/C ++ library for fast, exact sequence alignment using edit distance.
--   Bioinformatics. 2017 May 1;33(9):1394-1395.
--   http://doi.org/10.1093/bioinformatics/btw753
-- 
-- Overlaps are generated using:
--   Berlin K, et al.
--   Assembling large genomes with single-molecule sequencing and locality-sensitive hashing.
--   Nat Biotechnol. 2015 Jun;33(6):623-30.
--   http://doi.org/10.1038/nbt.3238
-- 
--   Myers EW, et al.
--   A Whole-Genome Assembly of Drosophila.
--   Science. 2000 Mar 24;287(5461):2196-204.
--   http://doi.org/10.1126/science.287.5461.2196
-- 
-- Contig consensus sequences are generated using an algorithm derived from pbdagcon:
--   Chin CS, et al.
--   Nonhybrid, finished microbial genome assemblies from long-read SMRT sequencing data.
--   Nat Methods. 2013 Jun;10(6):563-9
--   http://doi.org/10.1038/nmeth.2474
-- 
-- CONFIGURE CANU
--
-- Detected Java(TM) Runtime Environment '17.0.15-internal' (from '/share/org/YZWL/yzwl_lixg/.local/bin/java') without -d64 support.
--
-- WARNING:
-- WARNING:  Failed to run gnuplot using command 'gnuplot'.
-- WARNING:  Plots will be disabled.
-- WARNING:
--
-- Detected samtools version '1.22' / htslib version 'htscodecs=1.6.3' (from 'samtools').
--
-- Detected 88 CPUs and 503 gigabytes of memory on the local machine.
--
-- Detected Slurm with 'sinfo' binary in /opt/skyformai/bin/sinfo.
--          Slurm disabled by useGrid=false
--
-- Detected  '' with 'pbsnodes' binary in /opt/skyformai/bin/pbsnodes.
--           disabled by useGrid=false
--
-- Detected LSF with 'bsub' binary in /opt/skyformai/bin/bsub.
--          LSF disabled by useGrid=false
--
-- Local machine mode enabled; grid support not detected or not allowed.
--
-- Found trimmed raw PacBio HiFi reads in the input files.
--
--                                (tag)Concurrency
--                         (tag)Threads          |
--                (tag)Memory         |          |
--        (tag)             |         |          |       total usage      algorithm
--        -------  ----------  --------   --------  --------------------  -----------------------------
-- Local: meryl     12.000 GB    4 CPUs x  22 jobs   264.000 GB  88 CPUs  (k-mer counting)
-- Local: cormhap   13.000 GB   11 CPUs x   8 jobs   104.000 GB  88 CPUs  (overlap detection with mhap)
-- Local: obtovl     8.000 GB    8 CPUs x  11 jobs    88.000 GB  88 CPUs  (overlap detection)
-- Local: utgovl     8.000 GB    8 CPUs x  11 jobs    88.000 GB  88 CPUs  (overlap detection)
-- Local: cor        -.--- GB    4 CPUs x   - jobs     -.--- GB   - CPUs  (read correction)
-- Local: ovb        4.000 GB    1 CPU  x  88 jobs   352.000 GB  88 CPUs  (overlap store bucketizer)
-- Local: ovs        8.000 GB    1 CPU  x  62 jobs   496.000 GB  62 CPUs  (overlap store sorting)
-- Local: red       16.000 GB    4 CPUs x  22 jobs   352.000 GB  88 CPUs  (read error detection)
-- Local: oea        8.000 GB    1 CPU  x  62 jobs   496.000 GB  62 CPUs  (overlap error adjustment)
-- Local: bat       32.000 GB    8 CPUs x   1 job     32.000 GB   8 CPUs  (contig construction with bogart)
-- Local: cns        -.--- GB    8 CPUs x   - jobs     -.--- GB   - CPUs  (consensus)
--
-- Generating assembly 'A2-3' in '/share/org/YZWL/yzwl_lixg/project/28.大豆疫霉菌三代基因组/03.hicanu/A2-3/01.raw_output':
--   genomeSize:
--     85000000
--
--   Overlap Generation Limits:
--     corOvlErrorRate 0.0000 (  0.00%)
--     obtOvlErrorRate 0.0250 (  2.50%)
--     utgOvlErrorRate 0.0100 (  1.00%)
--
--   Overlap Processing Limits:
--     corErrorRate    0.0000 (  0.00%)
--     obtErrorRate    0.0250 (  2.50%)
--     utgErrorRate    0.0003 (  0.03%)
--     cnsErrorRate    0.0500 (  5.00%)
--
--   Stages to run:
--     assemble HiFi reads.
--
--
-- BEGIN STORE CREATION
----------------------------------------
-- Starting command on Thu Jan 15 23:48:00 2026 with 4567158.015 GB free disk space

    cd .
    ./A2-3.seqStore.sh \
    > ./A2-3.seqStore.err 2>&1

-- Finished on Thu Jan 15 23:54:39 2026 (399 seconds) with 4566778.25 GB free disk space
----------------------------------------
--
-- In sequence store './A2-3.seqStore':
--   Found 271002 reads.
--   Found 4250002009 bases (50 times coverage).
--    Histogram of corrected reads:
--    
--    G=4250002009                       sum of  ||               length     num
--    NG         length     index       lengths  ||                range    seqs
--    ----- ------------ --------- ------------  ||  ------------------- -------
--    00010        26136     15153    425026001  ||       1234-2421        11009|------------------------------
--    00020        24226     32094    850002178  ||       2422-3609        15634|-------------------------------------------
--    00030        22870     50168   1275009016  ||       3610-4797        13740|--------------------------------------
--    00040        21758     69231   1700013940  ||       4798-5985        11768|--------------------------------
--    00050        20722     89246   2125010515  ||       5986-7173         9799|---------------------------
--    00060        19634    110303   2550005882  ||       7174-8361         8479|-----------------------
--    00070        18318    132671   2975016550  ||       8362-9549         7632|---------------------
--    00080        16169    157157   3400011139  ||       9550-10737        6894|-------------------
--    00090        10192    189147   3825008121  ||      10738-11925        6181|-----------------
--    00100         1234    271002   4250002009  ||      11926-13113        5733|----------------
--    001.000x              271002   4250002009  ||      13114-14301        5643|----------------
--                                               ||      14302-15489        6512|------------------
--                                               ||      15490-16677        9186|-------------------------
--                                               ||      16678-17865       13742|--------------------------------------
--                                               ||      17866-19053       18267|--------------------------------------------------
--                                               ||      19054-20241       22094|------------------------------------------------------------
--                                               ||      20242-21429       23319|---------------------------------------------------------------
--                                               ||      21430-22617       21216|----------------------------------------------------------
--                                               ||      22618-23805       17080|-----------------------------------------------
--                                               ||      23806-24993       13003|------------------------------------
--                                               ||      24994-26181        9209|-------------------------
--                                               ||      26182-27369        6222|-----------------
--                                               ||      27370-28557        4047|-----------
--                                               ||      28558-29745        2341|-------
--                                               ||      29746-30933        1292|----
--                                               ||      30934-32121         609|--
--                                               ||      32122-33309         242|-
--                                               ||      33310-34497          72|-
--                                               ||      34498-35685          25|-
--                                               ||      35686-36873           5|-
--                                               ||      36874-38061           1|-
--                                               ||      38062-39249           3|-
--                                               ||      39250-40437           0|
--                                               ||      40438-41625           0|
--                                               ||      41626-42813           0|
--                                               ||      42814-44001           1|-
--                                               ||      44002-45189           0|
--                                               ||      45190-46377           0|
--                                               ||      46378-47565           1|-
--                                               ||      47566-48753           1|-
--    
--
-- In sequence store './A2-3.seqStore':
--   Found 271002 reads.
--   Found 4250002009 bases (50 times coverage).
--    Histogram of corrected-trimmed reads:
--    
--    G=4250002009                       sum of  ||               length     num
--    NG         length     index       lengths  ||                range    seqs
--    ----- ------------ --------- ------------  ||  ------------------- -------
--    00010        26136     15153    425026001  ||       1234-2421        11009|------------------------------
--    00020        24226     32094    850002178  ||       2422-3609        15634|-------------------------------------------
--    00030        22870     50168   1275009016  ||       3610-4797        13740|--------------------------------------
--    00040        21758     69231   1700013940  ||       4798-5985        11768|--------------------------------
--    00050        20722     89246   2125010515  ||       5986-7173         9799|---------------------------
--    00060        19634    110303   2550005882  ||       7174-8361         8479|-----------------------
--    00070        18318    132671   2975016550  ||       8362-9549         7632|---------------------
--    00080        16169    157157   3400011139  ||       9550-10737        6894|-------------------
--    00090        10192    189147   3825008121  ||      10738-11925        6181|-----------------
--    00100         1234    271002   4250002009  ||      11926-13113        5733|----------------
--    001.000x              271002   4250002009  ||      13114-14301        5643|----------------
--                                               ||      14302-15489        6512|------------------
--                                               ||      15490-16677        9186|-------------------------
--                                               ||      16678-17865       13742|--------------------------------------
--                                               ||      17866-19053       18267|--------------------------------------------------
--                                               ||      19054-20241       22094|------------------------------------------------------------
--                                               ||      20242-21429       23319|---------------------------------------------------------------
--                                               ||      21430-22617       21216|----------------------------------------------------------
--                                               ||      22618-23805       17080|-----------------------------------------------
--                                               ||      23806-24993       13003|------------------------------------
--                                               ||      24994-26181        9209|-------------------------
--                                               ||      26182-27369        6222|-----------------
--                                               ||      27370-28557        4047|-----------
--                                               ||      28558-29745        2341|-------
--                                               ||      29746-30933        1292|----
--                                               ||      30934-32121         609|--
--                                               ||      32122-33309         242|-
--                                               ||      33310-34497          72|-
--                                               ||      34498-35685          25|-
--                                               ||      35686-36873           5|-
--                                               ||      36874-38061           1|-
--                                               ||      38062-39249           3|-
--                                               ||      39250-40437           0|
--                                               ||      40438-41625           0|
--                                               ||      41626-42813           0|
--                                               ||      42814-44001           1|-
--                                               ||      44002-45189           0|
--                                               ||      45190-46377           0|
--                                               ||      46378-47565           1|-
--                                               ||      47566-48753           1|-
--    
--
-- Correction skipped; not enabled.
--
-- Trimming skipped; not enabled.
--
-- BEGIN ASSEMBLY
----------------------------------------
-- Starting command on Thu Jan 15 23:54:39 2026 with 4566778.203 GB free disk space

    cd unitigging/0-mercounts
    ./meryl-configure.sh \
    > ./meryl-configure.err 2>&1

-- Finished on Thu Jan 15 23:54:40 2026 (one second) with 4566778.203 GB free disk space
----------------------------------------
--  segments   memory batches
--  -------- -------- -------
--        01 10.81 GB       2
--        02  5.75 GB       2
--        04  2.97 GB       2
--        06  2.15 GB       2
--        08  1.62 GB       2
--        12  1.08 GB       2
--        16  0.81 GB       2
--        20  0.65 GB       2
--        24  0.54 GB       2
--        32  0.41 GB       2
--        40  0.33 GB       2
--        48  -.-- GB       -  (segment size too small)
--        56  -.-- GB       -  (segment size too small)
--        64  -.-- GB       -  (segment size too small)
--        96  -.-- GB       -  (segment size too small)
--
--  For 271002 reads with 4250002009 bases, limit to 42 batches.
--  Will count kmers using 01 jobs, each using 12 GB and 4 threads.
--
-- Finished stage 'merylConfigure', reset canuIteration.
--
-- Running jobs.  First attempt out of 2.
----------------------------------------
-- Starting 'meryl' concurrent execution on Thu Jan 15 23:54:40 2026 with 4566778.171 GB free disk space (1 processes; 22 concurrently)

    cd unitigging/0-mercounts
    ./meryl-count.sh 1 > ./meryl-count.000001.out 2>&1

-- Finished on Thu Jan 15 23:58:04 2026 (204 seconds) with 4566702.39 GB free disk space
----------------------------------------
-- Found 1 Kmer counting (meryl) outputs.
-- Finished stage 'utg-merylCountCheck', reset canuIteration.
--
-- Running jobs.  First attempt out of 2.
----------------------------------------
-- Starting 'meryl' concurrent execution on Thu Jan 15 23:58:04 2026 with 4566702.359 GB free disk space (1 processes; 22 concurrently)

    cd unitigging/0-mercounts
    ./meryl-process.sh 1 > ./meryl-process.000001.out 2>&1

-- Finished on Thu Jan 15 23:58:11 2026 (7 seconds) with 4566701.89 GB free disk space
----------------------------------------
-- Meryl finished successfully.  Kmer frequency histogram:
--
-- WARNING: gnuplot failed.
--
----------------------------------------
--
--  22-mers                                                                                           Fraction
--    Occurrences   NumMers                                                                         Unique Total
--       1-     1         0                                                                        0.0000 0.0000
--       2-     2    312559 *                                                                      0.0069 0.0002
--       3-     4    102692                                                                        0.0085 0.0003
--       5-     7     35631                                                                        0.0096 0.0004
--       8-    11     19033                                                                        0.0101 0.0004
--      12-    16     31536                                                                        0.0105 0.0004
--      17-    22    108683                                                                        0.0113 0.0006
--      23-    29    683516 **                                                                     0.0145 0.0016
--      30-    37   3986614 *****************                                                      0.0334 0.0089
--      38-    46  14153677 *************************************************************          0.1394 0.0613
--      47-    56  16230581 ********************************************************************** 0.4759 0.2654
--      57-    67   4506042 *******************                                                    0.8108 0.5078
--      68-    79    639734 **                                                                     0.8927 0.5776
--      80-    92    974386 ****                                                                   0.9065 0.5920
--      93-   106    932221 ****                                                                   0.9287 0.6191
--     107-   121    314629 *                                                                      0.9482 0.6462
--     122-   137    278240 *                                                                      0.9548 0.6566
--     138-   154    275110 *                                                                      0.9610 0.6680
--     155-   172    158167                                                                        0.9670 0.6802
--     173-   191    170176                                                                        0.9704 0.6879
--     192-   211    126145                                                                        0.9742 0.6977
--     212-   232    104752                                                                        0.9769 0.7054
--     233-   254     98725                                                                        0.9792 0.7126
--     255-   277     76744                                                                        0.9814 0.7199
--     278-   301     73473                                                                        0.9831 0.7263
--     302-   326     61081                                                                        0.9847 0.7328
--     327-   352     50895                                                                        0.9860 0.7387
--     353-   379     48930                                                                        0.9871 0.7440
--     380-   407     38048                                                                        0.9882 0.7496
--     408-   436     36885                                                                        0.9891 0.7541
--     437-   466     28514                                                                        0.9899 0.7590
--     467-   497     31985                                                                        0.9905 0.7629
--     498-   529     24750                                                                        0.9912 0.7677
--     530-   562     27269                                                                        0.9918 0.7716
--     563-   596     24945                                                                        0.9924 0.7762
--     597-   631     25744                                                                        0.9929 0.7807
--     632-   667     22654                                                                        0.9935 0.7856
--     668-   704     19968                                                                        0.9940 0.7902
--     705-   742     15233                                                                        0.9944 0.7944
--     743-   781     14243                                                                        0.9948 0.7978
--     782-   821     13257                                                                        0.9951 0.8012
--
--           0 (max occurrences)
--  3227449779 (total mers, non-unique)
--    45086832 (distinct mers, non-unique)
--           0 (unique mers)
-- Finished stage 'meryl-process', reset canuIteration.
--
-- Removing meryl database 'unitigging/0-mercounts/A2-3.ms22'.
--
-- OVERLAPPER (normal) (assembly) erate=0.01
--
----------------------------------------
-- Starting command on Thu Jan 15 23:58:11 2026 with 4566702.953 GB free disk space

    cd unitigging/1-overlapper
    /share/org/YZWL/yzwl_lixg/miniforge3/envs/canu_v.2.3/bin/overlapInCorePartition \
     -S  ../../A2-3.seqStore \
     -hl 160000000 \
     -rl 5000000000 \
     -ol 500 \
     -o  ./A2-3.partition \
    > ./A2-3.partition.err 2>&1

-- Finished on Thu Jan 15 23:58:11 2026 (furiously fast) with 4566702.937 GB free disk space
----------------------------------------
--
-- Configured 21 overlapInCore jobs.
-- Finished stage 'utg-overlapConfigure', reset canuIteration.
--
-- Running jobs.  First attempt out of 2.
----------------------------------------
-- Starting 'utgovl' concurrent execution on Thu Jan 15 23:58:11 2026 with 4566702.906 GB free disk space (21 processes; 11 concurrently)

    cd unitigging/1-overlapper
    ./overlap.sh 1 > ./overlap.000001.out 2>&1
    ./overlap.sh 2 > ./overlap.000002.out 2>&1
    ./overlap.sh 3 > ./overlap.000003.out 2>&1
    ./overlap.sh 4 > ./overlap.000004.out 2>&1
    ./overlap.sh 5 > ./overlap.000005.out 2>&1
    ./overlap.sh 6 > ./overlap.000006.out 2>&1
    ./overlap.sh 7 > ./overlap.000007.out 2>&1
    ./overlap.sh 8 > ./overlap.000008.out 2>&1
    ./overlap.sh 9 > ./overlap.000009.out 2>&1
    ./overlap.sh 10 > ./overlap.000010.out 2>&1
    ./overlap.sh 11 > ./overlap.000011.out 2>&1
    ./overlap.sh 12 > ./overlap.000012.out 2>&1
    ./overlap.sh 13 > ./overlap.000013.out 2>&1
    ./overlap.sh 14 > ./overlap.000014.out 2>&1
    ./overlap.sh 15 > ./overlap.000015.out 2>&1
    ./overlap.sh 16 > ./overlap.000016.out 2>&1
    ./overlap.sh 17 > ./overlap.000017.out 2>&1
    ./overlap.sh 18 > ./overlap.000018.out 2>&1
    ./overlap.sh 19 > ./overlap.000019.out 2>&1
    ./overlap.sh 20 > ./overlap.000020.out 2>&1
    ./overlap.sh 21 > ./overlap.000021.out 2>&1

-- Finished on Fri Jan 16 00:22:20 2026 (1449 seconds) with 4564543.906 GB free disk space
----------------------------------------
-- Found 21 overlapInCore output files.
--
-- overlapInCore compute 'unitigging/1-overlapper':
--   kmer hits
--     with no overlap       1281208655  935.952381 +- 37134745.403
--     with an overlap         16737411  .571428571 +- 457615.405
--
--   overlaps                  16737411  .571428571 +- 457615.405
--     contained                4822581  .714285714 +- 131589.262
--     dovetail                11914830  .857142857 +- 330111.317
--
--   overlaps rejected
--     multiple per pair              0           0 +- 0
--     bad short window               0           0 +- 0
--     bad long window                0           0 +- 0
-- Finished stage 'utg-overlapCheck', reset canuIteration.
----------------------------------------
-- Starting command on Fri Jan 16 00:22:20 2026 with 4564543.89 GB free disk space

    cd unitigging
    /share/org/YZWL/yzwl_lixg/miniforge3/envs/canu_v.2.3/bin/ovStoreConfig \
     -S ../A2-3.seqStore \
     -M 4-8 \
     -L ./1-overlapper/ovljob.files \
     -create ./A2-3.ovlStore.config \
     > ./A2-3.ovlStore.config.txt \
    2> ./A2-3.ovlStore.config.err

-- Finished on Fri Jan 16 00:22:20 2026 (in the blink of an eye) with 4564543.875 GB free disk space
----------------------------------------
--
-- Creating overlap store unitigging/A2-3.ovlStore using:
--      1 bucket
--      1 slice
--        using at most 2 GB memory each
--
-- Running jobs.  First attempt out of 2.
----------------------------------------
-- Starting 'ovS' concurrent execution on Fri Jan 16 00:22:20 2026 with 4564543.859 GB free disk space (1 processes; 62 concurrently)

    cd unitigging
    ./A2-3.ovlStore.sh 1 > ./A2-3.ovlStore.000001.out 2>&1

-- Finished on Fri Jan 16 00:22:27 2026 (7 seconds) with 4564543.046 GB free disk space
----------------------------------------
-- Checking store.
----------------------------------------
-- Starting command on Fri Jan 16 00:22:27 2026 with 4564543.046 GB free disk space

    cd unitigging
    /share/org/YZWL/yzwl_lixg/miniforge3/envs/canu_v.2.3/bin/ovStoreDump \
     -S ../A2-3.seqStore \
     -O  ./A2-3.ovlStore \
     -counts \
     > ./A2-3.ovlStore/counts.dat 2> ./A2-3.ovlStore/counts.err

-- Finished on Fri Jan 16 00:22:27 2026 (like a bat out of hell) with 4564543.015 GB free disk space
----------------------------------------
--
-- Overlap store 'unitigging/A2-3.ovlStore' successfully constructed.
-- Found 33474822 overlaps for 261517 reads; 1382135 reads have no overlaps.
--
--
-- Purged 0.42 GB in 63 overlap output files.
----------------------------------------
-- Starting command on Fri Jan 16 00:22:28 2026 with 4564543.015 GB free disk space

    cd unitigging
    /share/org/YZWL/yzwl_lixg/miniforge3/envs/canu_v.2.3/bin/ovStoreStats \
     -C 50 \
     -S ../A2-3.seqStore \
     -O  ./A2-3.ovlStore \
     -o  ./A2-3.ovlStore \
     > ./A2-3.ovlStore.summary.err 2>&1

-- Finished on Fri Jan 16 00:22:32 2026 (4 seconds) with 4564542.984 GB free disk space
----------------------------------------
--
-- Overlap store 'unitigging/A2-3.ovlStore' contains:
--
--   category            reads     %          read length        feature size or coverage  analysis
--   ----------------  -------  -------  ----------------------  ------------------------  --------------------
--   middle-missing        121    0.04    12811.43 +- 6340.21        580.21 +- 851.35     (bad trimming)
--   middle-hump            10    0.00    14834.00 +- 3539.58       5922.00 +- 4403.03    (bad trimming)
--   no-5-prime            681    0.25    12881.94 +- 5762.27       1600.48 +- 2739.79    (bad trimming)
--   no-3-prime            934    0.34    10160.82 +- 6677.62       1287.08 +- 2476.81    (bad trimming)
--   
--   low-coverage         2059    0.76    10420.38 +- 5806.12          6.31 +- 3.72       (easy to assemble, potential for lower quality consensus)
--   unique             222844   82.23    12110.35 +- 6067.58         46.79 +- 8.34       (easy to assemble, perfect, yay)
--   repeat-cont         10294    3.80     8677.22 +- 5738.98        507.51 +- 367.11     (potential for consensus errors, no impact on assembly)
--   repeat-dove           177    0.07    20110.73 +- 2089.02        383.29 +- 278.41     (hard to assemble, likely won't assemble correctly or even at all)
--   
--   span-repeat          3328    1.23    13932.76 +- 5010.72       3361.12 +- 3877.63    (read spans a large repeat, usually easy to assemble)
--   uniq-repeat-cont    14338    5.29    12174.84 +- 5058.83                             (should be uniquely placed, low potential for consensus errors, no impact on assembly)
--   uniq-repeat-dove     3176    1.17    18689.33 +- 2699.82                             (will end contigs, potential to misassemble)
--   uniq-anchor          3555    1.31    13315.45 +- 4941.14       7919.13 +- 4997.86    (repeat read, with unique section, probable bad read)
-- Finished stage 'utg-createOverlapStore', reset canuIteration.
--
-- Loading read lengths.
-- Loading number of overlaps per read.
--
-- Configure RED for 16gb memory.
--                   Batches of at most (unlimited) reads.
--                                      500000000 bases.
--                   Expecting evidence of at most 536870912 bases per iteration.
--
--           Total                                               Reads                 Olaps Evidence
--    Job   Memory      Read Range         Reads        Bases   Memory        Olaps   Memory   Memory  (Memory in MB)
--   ---- -------- ------------------- --------- ------------ -------- ------------ -------- --------
--      1 16385.37         1-33996          5623    108994927 13305.22       712383     8.15  1024.00
--      2 16386.97     33997-75063          6646    108999831 13305.85       796499     9.12  1024.00
--      3 16384.81     75064-116820         6977    108976615 13303.03       854736     9.78  1024.00
--      4 16384.14    116821-152961         6006    108969229 13302.10       877882    10.05  1024.00
--      5 16384.28    152962-195748         6999    108977924 13303.19       794533     9.09  1024.00
--      6 16386.36    195749-251976         9282    108968932 13302.16      1065721    12.20  1024.00
--      7 16384.80    251977-287400         5875    108985175 13304.04       765873     8.76  1024.00
--      8 16384.35    287401-327120         6470    108969067 13302.09       896774    10.26  1024.00
--      9 16384.15    327121-386135         9845    108950329 13299.91      1069810    12.24  1024.00
--     10 16384.83    386136-421177         5726    108987895 13304.37       739667     8.46  1024.00
--     11 16385.17    421178-457799         6107    108981491 13303.60       836453     9.57  1024.00
--     12 16386.21    457800-505649         7713    108988265 13304.47       850810     9.74  1024.00
--     13 16386.65    505650-550753         7441    108988943 13304.55       883028    10.11  1024.00
--     14 16385.70    550754-586390         5892    108982707 13303.74       870545     9.96  1024.00
--     15 16384.72    586391-627356         6692    108985030 13304.05       757926     8.67  1024.00
--     16 16385.18    627357-680615         8710    108967343 13301.95       981488    11.23  1024.00
--     17 16385.68    680616-715625         5828    108991481 13304.81       775377     8.87  1024.00
--     18 16385.26    715626-753952         6280    108978389 13303.22       877075    10.04  1024.00
--     19 16385.04    753953-810531         9295    108962562 13301.39      1018263    11.65  1024.00
--     20 16386.26    810532-845473         5699    108999619 13305.80       739498     8.46  1024.00
--     21 16384.51    845474-881497         5989    108977677 13303.13       819844     9.38  1024.00
--     22 16385.54    881498-926310         7434    108986796 13304.29       808590     9.25  1024.00
--     23 16386.24    926311-971664         7504    108985625 13304.15       881657    10.09  1024.00
--     24 16384.89    971665-1009029        6016    108975499 13302.86       876071    10.03  1024.00
--     25 16386.20   1009030-1051459        6949    108996216 13305.42       767532     8.78  1024.00
--     26 16384.53   1051460-1104828        8823    108958534 13300.88      1017633    11.65  1024.00
--     27 16384.76   1104829-1139945        5826    108981936 13303.64       796576     9.12  1024.00
--     28 16384.08   1139946-1178715        6415    108968605 13302.03       877541    10.04  1024.00
--     29 16384.25   1178716-1234808        9276    108954056 13300.35      1039799    11.90  1024.00
--     30 16384.28   1234809-1268816        5663    108983978 13303.89       733466     8.39  1024.00
--     31 16385.75   1268817-1304859        5993    108987051 13304.27       828365     9.48  1024.00
--     32 16384.07   1304860-1349686        7388    108974045 13302.73       816420     9.34  1024.00
--     33 16384.98   1349687-1393964        7428    108977057 13303.10       863363     9.88  1024.00
--     34 16385.25   1393965-1429370        5829    108981960 13303.65       839455     9.61  1024.00
--     35 16385.92   1429371-1469729        6482    108994156 13305.15       766312     8.77  1024.00
--     36 16384.71   1469730-1520422        8261    108964827 13301.63       968234    11.08  1024.00
--     37 16386.16   1520423-1554918        5701    108996471 13305.41       764746     8.75  1024.00
--     38 16386.07   1554919-1590709        6044    108991856 13304.86       804753     9.21  1024.00
--     39 16360.54   1590710-1643652        8875    108759910 13276.64      1040124    11.90  1024.00
--   ---- -------- ------------------- --------- ------------ -------- ------------ -------- --------
--                                                 4250002009              33474822
-- Finished stage 'readErrorDetectionConfigure', reset canuIteration.
--
-- Running jobs.  First attempt out of 2.
----------------------------------------
-- Starting 'red' concurrent execution on Fri Jan 16 00:22:38 2026 with 4564542.937 GB free disk space (39 processes; 22 concurrently)

    cd unitigging/3-overlapErrorAdjustment
    ./red.sh 1 > ./red.000001.out 2>&1
    ./red.sh 2 > ./red.000002.out 2>&1
    ./red.sh 3 > ./red.000003.out 2>&1
    ./red.sh 4 > ./red.000004.out 2>&1
    ./red.sh 5 > ./red.000005.out 2>&1
    ./red.sh 6 > ./red.000006.out 2>&1
    ./red.sh 7 > ./red.000007.out 2>&1
    ./red.sh 8 > ./red.000008.out 2>&1
    ./red.sh 9 > ./red.000009.out 2>&1
    ./red.sh 10 > ./red.000010.out 2>&1
    ./red.sh 11 > ./red.000011.out 2>&1
    ./red.sh 12 > ./red.000012.out 2>&1
    ./red.sh 13 > ./red.000013.out 2>&1
    ./red.sh 14 > ./red.000014.out 2>&1
    ./red.sh 15 > ./red.000015.out 2>&1
    ./red.sh 16 > ./red.000016.out 2>&1
    ./red.sh 17 > ./red.000017.out 2>&1
    ./red.sh 18 > ./red.000018.out 2>&1
    ./red.sh 19 > ./red.000019.out 2>&1
    ./red.sh 20 > ./red.000020.out 2>&1
    ./red.sh 21 > ./red.000021.out 2>&1
    ./red.sh 22 > ./red.000022.out 2>&1
    ./red.sh 23 > ./red.000023.out 2>&1
    ./red.sh 24 > ./red.000024.out 2>&1
    ./red.sh 25 > ./red.000025.out 2>&1
    ./red.sh 26 > ./red.000026.out 2>&1
    ./red.sh 27 > ./red.000027.out 2>&1
    ./red.sh 28 > ./red.000028.out 2>&1
    ./red.sh 29 > ./red.000029.out 2>&1
    ./red.sh 30 > ./red.000030.out 2>&1
    ./red.sh 31 > ./red.000031.out 2>&1
    ./red.sh 32 > ./red.000032.out 2>&1
    ./red.sh 33 > ./red.000033.out 2>&1
    ./red.sh 34 > ./red.000034.out 2>&1
    ./red.sh 35 > ./red.000035.out 2>&1
    ./red.sh 36 > ./red.000036.out 2>&1
    ./red.sh 37 > ./red.000037.out 2>&1
    ./red.sh 38 > ./red.000038.out 2>&1
    ./red.sh 39 > ./red.000039.out 2>&1

-- Finished on Fri Jan 16 00:30:43 2026 (485 seconds) with 4563155.046 GB free disk space
----------------------------------------
-- Found 39 read error detection output files.
-- Finished stage 'readErrorDetectionCheck', reset canuIteration.
--
-- Loading read lengths.
-- Loading number of overlaps per read.
--
-- Configure OEA for 8gb memory.
--                   Batches of at most (unlimited) reads.
--                                      300000000 bases.
--
--           Total                                               Reads                 Olaps  Adjusts
--    Job   Memory      Read Range         Reads        Bases   Memory        Olaps   Memory   Memory  (Memory in MB)
--   ---- -------- ------------------- --------- ------------ -------- ------------ -------- --------
--      1  2781.18         1-108054        17810    300014594   294.66      2209016    67.41   371.11
--      2  2791.08    108055-232389        20534    300000897   294.73      2531059    77.24   371.11
--      3  2781.47    232390-338574        17484    300012893   294.65      2218811    67.71   371.11
--      4  2788.86    338575-458294        19804    300018564   294.72      2458383    75.02   371.11
--      5  2788.31    458295-578038        19562    300004341   294.70      2441224    74.50   371.11
--      6  2782.43    578039-698530        19785    300015153   294.72      2247884    68.60   371.11
--      7  2789.88    698531-819751        19945    300019104   294.73      2491624    76.04   371.11
--      8  2781.73    819752-927318        17774    300016018   294.66      2226997    67.96   371.11
--      9  2784.36    927319-1040577       18563    300001466   294.67      2312738    70.58   371.11
--     10  2790.20   1040578-1159394       19648    300005091   294.71      2502999    76.39   371.11
--     11  2785.89   1159395-1278723       19755    300022507   294.73      2361193    72.06   371.11
--     12  2784.41   1278724-1395140       19344    300011563   294.70      2313210    70.59   371.11
--     13  2787.18   1395141-1513116       19203    300014607   294.70      2404036    73.37   371.11
--     14  2778.78   1513117-1613735       16785    300002747   294.62      2131595    65.05   371.11
--     15  2493.84   1613736-1643652        5006     49842464    55.69       624053    19.04   371.11
--   ---- -------- ------------------- --------- ------------ -------- ------------ -------- --------
--                                                 4250002009              33474822
-- Finished stage 'overlapErrorAdjustmentConfigure', reset canuIteration.
--
-- Running jobs.  First attempt out of 2.
----------------------------------------
-- Starting 'oea' concurrent execution on Fri Jan 16 00:30:50 2026 with 4563154.968 GB free disk space (15 processes; 62 concurrently)

    cd unitigging/3-overlapErrorAdjustment
    ./oea.sh 1 > ./oea.000001.out 2>&1
    ./oea.sh 2 > ./oea.000002.out 2>&1
    ./oea.sh 3 > ./oea.000003.out 2>&1
    ./oea.sh 4 > ./oea.000004.out 2>&1
    ./oea.sh 5 > ./oea.000005.out 2>&1
    ./oea.sh 6 > ./oea.000006.out 2>&1
    ./oea.sh 7 > ./oea.000007.out 2>&1
    ./oea.sh 8 > ./oea.000008.out 2>&1
    ./oea.sh 9 > ./oea.000009.out 2>&1
    ./oea.sh 10 > ./oea.000010.out 2>&1
    ./oea.sh 11 > ./oea.000011.out 2>&1
    ./oea.sh 12 > ./oea.000012.out 2>&1
    ./oea.sh 13 > ./oea.000013.out 2>&1
    ./oea.sh 14 > ./oea.000014.out 2>&1
    ./oea.sh 15 > ./oea.000015.out 2>&1

-- Finished on Fri Jan 16 00:47:09 2026 (979 seconds) with 4560601.984 GB free disk space
----------------------------------------
-- Found 15 overlap error adjustment output files.
-- Finished stage 'overlapErrorAdjustmentCheck', reset canuIteration.
----------------------------------------
-- Starting command on Fri Jan 16 00:47:09 2026 with 4560601.968 GB free disk space

    cd unitigging/3-overlapErrorAdjustment
    /share/org/YZWL/yzwl_lixg/miniforge3/envs/canu_v.2.3/bin/loadErates \
      -S ../../A2-3.seqStore \
      -O ../A2-3.ovlStore \
      -L ./oea.files \
    > ./oea.apply.err 2>&1

-- Finished on Fri Jan 16 00:47:09 2026 (furiously fast) with 4560601.89 GB free disk space
----------------------------------------
-- No report available.
-- Finished stage 'updateOverlapStore', reset canuIteration.
-- Finished stage 'unitig', reset canuIteration.
--
-- Running jobs.  First attempt out of 2.
----------------------------------------
-- Starting 'bat' concurrent execution on Fri Jan 16 00:47:09 2026 with 4560601.843 GB free disk space (1 processes; 1 concurrently)

    cd unitigging/4-unitigger
    ./unitigger.sh 1 > ./unitigger.000001.out 2>&1

-- Finished on Fri Jan 16 00:47:20 2026 (11 seconds) with 4560480.89 GB free disk space
----------------------------------------
-- Unitigger finished successfully.
--  
--  ERROR RATES
--  -----------
--                                                   --------threshold------
--  294202                       fraction error      fraction        percent
--  samples                              (1e-5)         error          error
--                   --------------------------      --------       --------
--  command line (-eg)                           ->     30.00        0.0300%
--  command line (-ef)                           ->  -----.--      ---.----%
--  command line (-eM)                           ->     30.00        0.0300%
--  mean + std.dev       0.38 +-  12 *     2.78  ->     33.73        0.0337%
--  median + mad         0.00 +-  12 *     0.00  ->      0.00        0.0000%
--  90th percentile                              ->      1.00        0.0010%  (enabled)
--  
--  BEST EDGE FILTERING
--  -------------------
--  At graph threshold 0.0300%, reads:
--    available to have edges:        53425
--    with at least one edge:         41045
--  
--  At max threshold 0.0300%, reads:
--    available to have edges:        53425
--    with at least one edge:         41045
--  
--  At tight threshold 0.0010%, reads with:
--    both edges below error threshold:     36174  (80.00% minReadsBest threshold = 32836)
--    one  edge  above error threshold:      3729
--    both edges above error threshold:      1142
--    at least one edge:                    41045
--  
--  At loose threshold 0.0300%, reads with:
--    both edges below error threshold:     41045  (80.00% minReadsBest threshold = 32836)
--    one  edge  above error threshold:         0
--    both edges above error threshold:         0
--    at least one edge:                    41045
--  
--  
--  INITIAL EDGES
--  -------- ----------------------------------------
--    213276 reads are contained
--   1396800 reads have no best edges (singleton)
--       259 reads have only one best edge (spur) 
--                148 are mutual best
--     33317 reads have two best edges 
--                668 have one mutual best edge
--              32361 have two mutual best edges
--  
--  
--  FINAL EDGES
--  -------- ----------------------------------------
--    213276 reads are contained
--   1397046 reads have no best edges (singleton)
--       180 reads have only one best edge (spur) 
--                157 are mutual best
--     33150 reads have two best edges 
--                561 have one mutual best edge
--              32359 have two mutual best edges
--  
--  
--  EDGE FILTERING
--  -------- ------------------------------------------
--         0 reads are ignored
--     11354 reads have a gap in overlap coverage
--       133 reads have lopsided best edges
-- Found, in version 1, after unitig construction:
--   contigs:      76 sequences, total length 67662594 bp (including 73 repeats of total length 1615411 bp).
--   bubbles:      117 sequences, total length 3206701 bp.
--   unassembled:  24779 sequences, total length 286263984 bp.
--
-- Contig sizes based on genome size 85mbp:
--
--            NG (bp)  LG (contigs)    sum (bp)
--         ----------  ------------  ----------
--     10     6463776             2    14858915
--     20     6448785             3    21307700
--     30     4553034             4    25860734
--     40     2962436             7    35802161
--     50     2611085            10    44271220
--     60     2246852            13    51251142
--     70     1758592            18    60826432
--
-- Finished stage 'unitigCheck', reset canuIteration.
----------------------------------------
-- Starting command on Fri Jan 16 00:47:20 2026 with 4560480.875 GB free disk space

    cd unitigging
    /share/org/YZWL/yzwl_lixg/miniforge3/envs/canu_v.2.3/bin/utgcns \
      -S ../A2-3.seqStore \
      -T  ./A2-3.ctgStore 1 \
      -partition 0.8 1.5 0.1 \
    > ./A2-3.ctgStore/partitioning.log 2>&1

-- Finished on Fri Jan 16 00:47:29 2026 (9 seconds) with 4560479.156 GB free disk space
----------------------------------------
-- Using slow alignment for consensus (iteration '0').
-- Configured 10 consensus jobs.
-- Finished stage 'consensusConfigure', reset canuIteration.
--
-- Local: cns       12.500 GB    8 CPUs x  11 jobs   137.500 GB  88 CPUs  (consensus)
--
--
-- Running jobs.  First attempt out of 2.
----------------------------------------
-- Starting 'cns' concurrent execution on Fri Jan 16 00:47:29 2026 with 4560479.125 GB free disk space (10 processes; 11 concurrently)

    cd unitigging/5-consensus
    ./consensus.sh 1 > ./consensus.000001.out 2>&1
    ./consensus.sh 2 > ./consensus.000002.out 2>&1
    ./consensus.sh 3 > ./consensus.000003.out 2>&1
    ./consensus.sh 4 > ./consensus.000004.out 2>&1
    ./consensus.sh 5 > ./consensus.000005.out 2>&1
    ./consensus.sh 6 > ./consensus.000006.out 2>&1
    ./consensus.sh 7 > ./consensus.000007.out 2>&1
    ./consensus.sh 8 > ./consensus.000008.out 2>&1
    ./consensus.sh 9 > ./consensus.000009.out 2>&1
    ./consensus.sh 10 > ./consensus.000010.out 2>&1

-- Finished on Fri Jan 16 00:55:05 2026 (456 seconds) with 4559292.5 GB free disk space
----------------------------------------
-- Using slow alignment for consensus (iteration '1').
-- Configured 10 consensus jobs.
-- All 10 consensus jobs finished successfully.
-- Finished stage 'consensusCheck', reset canuIteration.
-- Using slow alignment for consensus (iteration '0').
-- Configured 10 consensus jobs.
----------------------------------------
-- Starting command on Fri Jan 16 00:55:06 2026 with 4559292.453 GB free disk space

    cd unitigging
    /share/org/YZWL/yzwl_lixg/miniforge3/envs/canu_v.2.3/bin/tgStoreLoad \
      -S ../A2-3.seqStore \
      -T  ./A2-3.ctgStore 2 \
      -L ./5-consensus/ctgcns.files \
    > ./5-consensus/ctgcns.files.ctgStoreLoad.err 2>&1

-- Finished on Fri Jan 16 00:55:07 2026 (one second) with 4559291.468 GB free disk space
----------------------------------------
----------------------------------------
-- Starting command on Fri Jan 16 00:55:07 2026 with 4559291.468 GB free disk space

    cd unitigging
    /share/org/YZWL/yzwl_lixg/miniforge3/envs/canu_v.2.3/bin/tgTigDisplay \
      -S ../A2-3.seqStore \
      -b \
      -o ../A2-3.contigs.unsorted.bam \
      -L ./5-consensus/ctgcns.files \
    > ./5-consensus/ctgcns.files.contigs.bam.err 2>&1

-- Finished on Fri Jan 16 00:57:54 2026 (167 seconds) with 4558781.656 GB free disk space
----------------------------------------
----------------------------------------
-- Starting command on Fri Jan 16 00:57:54 2026 with 4558781.656 GB free disk space

    cd .
    samtools sort \
      --write-index \
      --threads 2 \
      -o ./A2-3.contigs.bam ./A2-3.contigs.unsorted.bam \
    > ./ctgcns.bam.err 2>&1

-- Finished on Fri Jan 16 00:59:22 2026 (88 seconds) with 4558659.14 GB free disk space
----------------------------------------
-- Purging consensus output after loading to ctgStore.
-- Purged 10 .cns outputs.
----------------------------------------
-- Starting command on Fri Jan 16 00:59:22 2026 with 4558661.078 GB free disk space

    cd unitigging
    /share/org/YZWL/yzwl_lixg/miniforge3/envs/canu_v.2.3/bin/tgStoreDump \
      -S ../A2-3.seqStore \
      -T ./A2-3.ctgStore 2 \
      -sizes -s 85000000 \
    > ./A2-3.ctgStore/seqDB.v002.sizes.txt
ZERO length suplied to intervalList::add(), ignoring interval.
ZERO length suplied to intervalList::add(), ignoring interval.
ZERO length suplied to intervalList::add(), ignoring interval.
ZERO length suplied to intervalList::add(), ignoring interval.
ZERO length suplied to intervalList::add(), ignoring interval.
ZERO length suplied to intervalList::add(), ignoring interval.
ZERO length suplied to intervalList::add(), ignoring interval.
ZERO length suplied to intervalList::add(), ignoring interval.
ZERO length suplied to intervalList::add(), ignoring interval.
ZERO length suplied to intervalList::add(), ignoring interval.
ZERO length suplied to intervalList::add(), ignoring interval.
ZERO length suplied to intervalList::add(), ignoring interval.
ZERO length suplied to intervalList::add(), ignoring interval.
ZERO length suplied to intervalList::add(), ignoring interval.
ZERO length suplied to intervalList::add(), ignoring interval.

-- Finished on Fri Jan 16 00:59:23 2026 (one second) with 4558661.078 GB free disk space
----------------------------------------
-- Found, in version 2, after consensus generation:
--   contigs:      76 sequences, total length 88206569 bp (including 73 repeats of total length 2211522 bp).
--   bubbles:      117 sequences, total length 4251607 bp.
--   unassembled:  24779 sequences, total length 387789311 bp.
--
-- Contig sizes based on genome size 85mbp:
--
--            NG (bp)  LG (contigs)    sum (bp)
--         ----------  ------------  ----------
--     10    10909322             1    10909322
--     20     8388437             2    19297759
--     30     8375107             3    27672866
--     40     4737755             5    38347785
--     50     4358119             6    42705904
--     60     3794121             9    54207661
--     70     3205454            11    60815239
--     80     2710675            14    69410854
--     90     2307374            17    76894237
--    100      703774            23    85077583
--
-- Finished stage 'consensusLoad', reset canuIteration.
----------------------------------------
-- Starting command on Fri Jan 16 00:59:23 2026 with 4558661.062 GB free disk space

    cd .
    /share/org/YZWL/yzwl_lixg/miniforge3/envs/canu_v.2.3/bin/tgStoreDump \
      -S ./A2-3.seqStore \
      -T ./unitigging/A2-3.ctgStore 2 \
      -o ./A2-3.contigs \
      -layout \
    > ./A2-3.contigs.layout.err 2>&1

-- Finished on Fri Jan 16 00:59:23 2026 (in the blink of an eye) with 4558661.015 GB free disk space
----------------------------------------
----------------------------------------
-- Starting command on Fri Jan 16 00:59:23 2026 with 4558661.015 GB free disk space

    cd .
    /share/org/YZWL/yzwl_lixg/miniforge3/envs/canu_v.2.3/bin/tgStoreDump \
      -S ./A2-3.seqStore \
      -T ./unitigging/A2-3.ctgStore 2 \
      -consensus -fasta \
      -unassembled \
    > ./A2-3.unassembled.fasta
    2> ./A2-3.unassembled.err
ZERO length suplied to intervalList::add(), ignoring interval.
ZERO length suplied to intervalList::add(), ignoring interval.
ZERO length suplied to intervalList::add(), ignoring interval.
ZERO length suplied to intervalList::add(), ignoring interval.
ZERO length suplied to intervalList::add(), ignoring interval.
ZERO length suplied to intervalList::add(), ignoring interval.
ZERO length suplied to intervalList::add(), ignoring interval.
ZERO length suplied to intervalList::add(), ignoring interval.
ZERO length suplied to intervalList::add(), ignoring interval.
ZERO length suplied to intervalList::add(), ignoring interval.
ZERO length suplied to intervalList::add(), ignoring interval.
ZERO length suplied to intervalList::add(), ignoring interval.
ZERO length suplied to intervalList::add(), ignoring interval.
ZERO length suplied to intervalList::add(), ignoring interval.
ZERO length suplied to intervalList::add(), ignoring interval.

-- Finished on Fri Jan 16 00:59:25 2026 (2 seconds) with 4558661.671 GB free disk space
----------------------------------------
----------------------------------------
-- Starting command on Fri Jan 16 00:59:25 2026 with 4558661.671 GB free disk space

    cd .
    /share/org/YZWL/yzwl_lixg/miniforge3/envs/canu_v.2.3/bin/tgStoreDump \
      -S ./A2-3.seqStore \
      -T ./unitigging/A2-3.ctgStore 2 \
      -consensus -fasta \
      -contigs \
    > ./A2-3.contigs.fasta
    2> ./A2-3.contigs.err
ZERO length suplied to intervalList::add(), ignoring interval.
ZERO length suplied to intervalList::add(), ignoring interval.
ZERO length suplied to intervalList::add(), ignoring interval.
ZERO length suplied to intervalList::add(), ignoring interval.
ZERO length suplied to intervalList::add(), ignoring interval.
ZERO length suplied to intervalList::add(), ignoring interval.
ZERO length suplied to intervalList::add(), ignoring interval.
ZERO length suplied to intervalList::add(), ignoring interval.
ZERO length suplied to intervalList::add(), ignoring interval.
ZERO length suplied to intervalList::add(), ignoring interval.
ZERO length suplied to intervalList::add(), ignoring interval.
ZERO length suplied to intervalList::add(), ignoring interval.
ZERO length suplied to intervalList::add(), ignoring interval.
ZERO length suplied to intervalList::add(), ignoring interval.
ZERO length suplied to intervalList::add(), ignoring interval.

-- Finished on Fri Jan 16 00:59:26 2026 (one second) with 4558661.562 GB free disk space
----------------------------------------
-- Finished stage 'generateOutputs', reset canuIteration.
--
-- Assembly 'A2-3' finished in '/share/org/YZWL/yzwl_lixg/project/28.大豆疫霉菌三代基因组/03.hicanu/A2-3/01.raw_output'.
--
-- Summary saved in 'A2-3.report'.
--
-- Sequences saved:
--   Contigs       -> 'A2-3.contigs.fasta'
--   Unassembled   -> 'A2-3.unassembled.fasta'
--
-- Read layouts saved:
--   Contigs       -> 'A2-3.contigs.layout'.
--
-- Bye.

2026-01-16 00:59:26.176 - WARNING - 输出文件不存在|Output file does not exist: /share/org/YZWL/yzwl_lixg/project/28.大豆疫霉菌三代基因组/03.hicanu/A2-3/01.raw_output/A2-3.unitigs.fasta
Usage: biopytools ragtag [OPTIONS]
Try 'biopytools ragtag -h' for help.

Error: Invalid value for '-r' / '--reference': 文件不存在|File does not exist: /share/org/YZWL/yzwl_lixg/project/28.大豆疫霉菌三代基因组/04.ragtag/Psoja_T2T.fa
Usage: biopytools genomesyn [OPTIONS]
Try 'biopytools genomesyn -h' for help.

Error: Invalid value for '-i' / '--ref': Path '04.ragtag/A2-3/hicanu/A2-3_RagTag_scaffolded.fa' does not exist.
Job 68886712 stderr output:

