2026-01-16 14:36:53.029 - WARNING - 命令错误输出|Command stderr:
-- canu master +27 changes (r10515 2a41e933b8de6ed66723d75d36dd071b46d2c347)
--
-- CITATIONS
--
-- For assemblies of PacBio HiFi reads:
--   Nurk S, Walenz BP, Rhiea A, Vollger MR, Logsdon GA, Grothe R, Miga KH, Eichler EE, Phillippy AM, Koren S.
--   HiCanu: accurate assembly of segmental duplications, satellites, and allelic variants from high-fidelity long reads.
--   biorXiv. 2020.
--   https://doi.org/10.1101/2020.03.14.992248
-- 
-- Read and contig alignments during correction and consensus use:
--   Šošic M, Šikic M.
--   Edlib: a C/C ++ library for fast, exact sequence alignment using edit distance.
--   Bioinformatics. 2017 May 1;33(9):1394-1395.
--   http://doi.org/10.1093/bioinformatics/btw753
-- 
-- Overlaps are generated using:
--   Berlin K, et al.
--   Assembling large genomes with single-molecule sequencing and locality-sensitive hashing.
--   Nat Biotechnol. 2015 Jun;33(6):623-30.
--   http://doi.org/10.1038/nbt.3238
-- 
--   Myers EW, et al.
--   A Whole-Genome Assembly of Drosophila.
--   Science. 2000 Mar 24;287(5461):2196-204.
--   http://doi.org/10.1126/science.287.5461.2196
-- 
-- Contig consensus sequences are generated using an algorithm derived from pbdagcon:
--   Chin CS, et al.
--   Nonhybrid, finished microbial genome assemblies from long-read SMRT sequencing data.
--   Nat Methods. 2013 Jun;10(6):563-9
--   http://doi.org/10.1038/nmeth.2474
-- 
-- CONFIGURE CANU
--
-- Detected Java(TM) Runtime Environment '25.0.1-internal' (from '/share/org/YZWL/yzwl_lixg/miniforge3/envs/telocomp/lib/jvm/bin/java') without -d64 support.
--
-- WARNING:
-- WARNING:  Failed to run gnuplot using command 'gnuplot'.
-- WARNING:  Plots will be disabled.
-- WARNING:
--
-- Detected samtools version '1.22' / htslib version 'htscodecs=1.6.3' (from 'samtools').
--
-- Detected 88 CPUs and 503 gigabytes of memory on the local machine.
--
-- Detected Slurm with 'sinfo' binary in /opt/skyformai/bin/sinfo.
--          Slurm disabled by useGrid=false
--
-- Detected  '' with 'pbsnodes' binary in /opt/skyformai/bin/pbsnodes.
--           disabled by useGrid=false
--
-- Detected LSF with 'bsub' binary in /opt/skyformai/bin/bsub.
--          LSF disabled by useGrid=false
--
-- Local machine mode enabled; grid support not detected or not allowed.
--
-- Found trimmed raw PacBio HiFi reads in the input files.
--
--                                (tag)Concurrency
--                         (tag)Threads          |
--                (tag)Memory         |          |
--        (tag)             |         |          |       total usage      algorithm
--        -------  ----------  --------   --------  --------------------  -----------------------------
-- Local: meryl     12.000 GB    4 CPUs x  22 jobs   264.000 GB  88 CPUs  (k-mer counting)
-- Local: cormhap   13.000 GB   11 CPUs x   8 jobs   104.000 GB  88 CPUs  (overlap detection with mhap)
-- Local: obtovl     8.000 GB    8 CPUs x  11 jobs    88.000 GB  88 CPUs  (overlap detection)
-- Local: utgovl     8.000 GB    8 CPUs x  11 jobs    88.000 GB  88 CPUs  (overlap detection)
-- Local: cor        -.--- GB    4 CPUs x   - jobs     -.--- GB   - CPUs  (read correction)
-- Local: ovb        4.000 GB    1 CPU  x  88 jobs   352.000 GB  88 CPUs  (overlap store bucketizer)
-- Local: ovs        8.000 GB    1 CPU  x  62 jobs   496.000 GB  62 CPUs  (overlap store sorting)
-- Local: red       16.000 GB    4 CPUs x  22 jobs   352.000 GB  88 CPUs  (read error detection)
-- Local: oea        8.000 GB    1 CPU  x  62 jobs   496.000 GB  62 CPUs  (overlap error adjustment)
-- Local: bat       32.000 GB    8 CPUs x   1 job     32.000 GB   8 CPUs  (contig construction with bogart)
-- Local: cns        -.--- GB    8 CPUs x   - jobs     -.--- GB   - CPUs  (consensus)
--
-- Generating assembly 'A3-27' in '/share/org/YZWL/yzwl_lixg/project/28.大豆疫霉菌三代基因组/03.hicanu/A3-27/01.raw_output':
--   genomeSize:
--     85000000
--
--   Overlap Generation Limits:
--     corOvlErrorRate 0.0000 (  0.00%)
--     obtOvlErrorRate 0.0250 (  2.50%)
--     utgOvlErrorRate 0.0100 (  1.00%)
--
--   Overlap Processing Limits:
--     corErrorRate    0.0000 (  0.00%)
--     obtErrorRate    0.0250 (  2.50%)
--     utgErrorRate    0.0003 (  0.03%)
--     cnsErrorRate    0.0500 (  5.00%)
--
--   Stages to run:
--     assemble HiFi reads.
--
--
-- BEGIN STORE CREATION
----------------------------------------
-- Starting command on Fri Jan 16 12:56:17 2026 with 4533817.765 GB free disk space

    cd .
    ./A3-27.seqStore.sh \
    > ./A3-27.seqStore.err 2>&1

-- Finished on Fri Jan 16 13:03:03 2026 (406 seconds) with 4534212.593 GB free disk space
----------------------------------------
--
-- In sequence store './A3-27.seqStore':
--   Found 261092 reads.
--   Found 4250014277 bases (50 times coverage).
--    Histogram of corrected reads:
--    
--    G=4250014277                       sum of  ||               length     num
--    NG         length     index       lengths  ||                range    seqs
--    ----- ------------ --------- ------------  ||  ------------------- -------
--    00010        24871     15737    425007151  ||       1247-2740         8727|---------------
--    00020        22823     33639    850011508  ||       2741-4234        12467|---------------------
--    00030        21470     52864   1275014263  ||       4235-5728        11221|-------------------
--    00040        20429     73172   1700024733  ||       5729-7222         9821|-----------------
--    00050        19527     94461   2125011758  ||       7223-8716         8992|---------------
--    00060        18683    116712   2550018959  ||       8717-10210        7913|-------------
--    00070        17770    140017   2975012914  ||      10211-11704        6651|-----------
--    00080        16510    164754   3400026353  ||      11705-13198        5960|----------
--    00090        12210    193222   3825018322  ||      13199-14692        6609|-----------
--    00100         1247    261092   4250014277  ||      14693-16186       13284|----------------------
--    001.000x              261092   4250014277  ||      16187-17680       27422|---------------------------------------------
--                                               ||      17681-19174       38443|---------------------------------------------------------------
--                                               ||      19175-20668       35540|-----------------------------------------------------------
--                                               ||      20669-22162       25892|-------------------------------------------
--                                               ||      22163-23656       17181|-----------------------------
--                                               ||      23657-25150       10934|------------------
--                                               ||      25151-26644        6652|-----------
--                                               ||      26645-28138        3747|-------
--                                               ||      28139-29632        2090|----
--                                               ||      29633-31126        1010|--
--                                               ||      31127-32620         356|-
--                                               ||      32621-34114         129|-
--                                               ||      34115-35608          34|-
--                                               ||      35609-37102           8|-
--                                               ||      37103-38596           2|-
--                                               ||      38597-40090           1|-
--                                               ||      40091-41584           1|-
--                                               ||      41585-43078           0|
--                                               ||      43079-44572           0|
--                                               ||      44573-46066           2|-
--                                               ||      46067-47560           1|-
--                                               ||      47561-49054           0|
--                                               ||      49055-50548           0|
--                                               ||      50549-52042           1|-
--                                               ||      52043-53536           0|
--                                               ||      53537-55030           0|
--                                               ||      55031-56524           0|
--                                               ||      56525-58018           0|
--                                               ||      58019-59512           0|
--                                               ||      59513-61006           1|-
--    
--
-- In sequence store './A3-27.seqStore':
--   Found 261092 reads.
--   Found 4250014277 bases (50 times coverage).
--    Histogram of corrected-trimmed reads:
--    
--    G=4250014277                       sum of  ||               length     num
--    NG         length     index       lengths  ||                range    seqs
--    ----- ------------ --------- ------------  ||  ------------------- -------
--    00010        24871     15737    425007151  ||       1247-2740         8727|---------------
--    00020        22823     33639    850011508  ||       2741-4234        12467|---------------------
--    00030        21470     52864   1275014263  ||       4235-5728        11221|-------------------
--    00040        20429     73172   1700024733  ||       5729-7222         9821|-----------------
--    00050        19527     94461   2125011758  ||       7223-8716         8992|---------------
--    00060        18683    116712   2550018959  ||       8717-10210        7913|-------------
--    00070        17770    140017   2975012914  ||      10211-11704        6651|-----------
--    00080        16510    164754   3400026353  ||      11705-13198        5960|----------
--    00090        12210    193222   3825018322  ||      13199-14692        6609|-----------
--    00100         1247    261092   4250014277  ||      14693-16186       13284|----------------------
--    001.000x              261092   4250014277  ||      16187-17680       27422|---------------------------------------------
--                                               ||      17681-19174       38443|---------------------------------------------------------------
--                                               ||      19175-20668       35540|-----------------------------------------------------------
--                                               ||      20669-22162       25892|-------------------------------------------
--                                               ||      22163-23656       17181|-----------------------------
--                                               ||      23657-25150       10934|------------------
--                                               ||      25151-26644        6652|-----------
--                                               ||      26645-28138        3747|-------
--                                               ||      28139-29632        2090|----
--                                               ||      29633-31126        1010|--
--                                               ||      31127-32620         356|-
--                                               ||      32621-34114         129|-
--                                               ||      34115-35608          34|-
--                                               ||      35609-37102           8|-
--                                               ||      37103-38596           2|-
--                                               ||      38597-40090           1|-
--                                               ||      40091-41584           1|-
--                                               ||      41585-43078           0|
--                                               ||      43079-44572           0|
--                                               ||      44573-46066           2|-
--                                               ||      46067-47560           1|-
--                                               ||      47561-49054           0|
--                                               ||      49055-50548           0|
--                                               ||      50549-52042           1|-
--                                               ||      52043-53536           0|
--                                               ||      53537-55030           0|
--                                               ||      55031-56524           0|
--                                               ||      56525-58018           0|
--                                               ||      58019-59512           0|
--                                               ||      59513-61006           1|-
--    
--
-- Correction skipped; not enabled.
--
-- Trimming skipped; not enabled.
--
-- BEGIN ASSEMBLY
----------------------------------------
-- Starting command on Fri Jan 16 13:03:03 2026 with 4534212.546 GB free disk space

    cd unitigging/0-mercounts
    ./meryl-configure.sh \
    > ./meryl-configure.err 2>&1

-- Finished on Fri Jan 16 13:03:04 2026 (one second) with 4534212.546 GB free disk space
----------------------------------------
--  segments   memory batches
--  -------- -------- -------
--        01 10.72 GB       2
--        02  5.69 GB       2
--        04  2.94 GB       2
--        06  2.13 GB       2
--        08  1.60 GB       2
--        12  1.07 GB       2
--        16  0.80 GB       2
--        20  0.64 GB       2
--        24  0.54 GB       2
--        32  0.40 GB       2
--        40  0.32 GB       2
--        48  -.-- GB       -  (segment size too small)
--        56  -.-- GB       -  (segment size too small)
--        64  -.-- GB       -  (segment size too small)
--        96  -.-- GB       -  (segment size too small)
--
--  For 261092 reads with 4250014277 bases, limit to 42 batches.
--  Will count kmers using 01 jobs, each using 12 GB and 4 threads.
--
-- Finished stage 'merylConfigure', reset canuIteration.
--
-- Running jobs.  First attempt out of 2.
----------------------------------------
-- Starting 'meryl' concurrent execution on Fri Jan 16 13:03:04 2026 with 4534212.515 GB free disk space (1 processes; 22 concurrently)

    cd unitigging/0-mercounts
    ./meryl-count.sh 1 > ./meryl-count.000001.out 2>&1

-- Finished on Fri Jan 16 13:06:29 2026 (205 seconds) with 4534006.546 GB free disk space
----------------------------------------
-- Found 1 Kmer counting (meryl) outputs.
-- Finished stage 'utg-merylCountCheck', reset canuIteration.
--
-- Running jobs.  First attempt out of 2.
----------------------------------------
-- Starting 'meryl' concurrent execution on Fri Jan 16 13:06:29 2026 with 4534006.515 GB free disk space (1 processes; 22 concurrently)

    cd unitigging/0-mercounts
    ./meryl-process.sh 1 > ./meryl-process.000001.out 2>&1

-- Finished on Fri Jan 16 13:06:33 2026 (4 seconds) with 4534003.015 GB free disk space
----------------------------------------
-- Meryl finished successfully.  Kmer frequency histogram:
--
-- WARNING: gnuplot failed.
--
----------------------------------------
--
--  22-mers                                                                                           Fraction
--    Occurrences   NumMers                                                                         Unique Total
--       1-     1         0                                                                        0.0000 0.0000
--       2-     2   6541244 ***************************                                            0.1185 0.0041
--       3-     4   3385939 **************                                                         0.1653 0.0065
--       5-     7    384941 *                                                                      0.1844 0.0079
--       8-    11     91781                                                                        0.1875 0.0083
--      12-    16     53906                                                                        0.1888 0.0085
--      17-    22    190829                                                                        0.1898 0.0088
--      23-    29   1224756 *****                                                                  0.1943 0.0105
--      30-    37   6805721 ****************************                                           0.2226 0.0241
--      38-    46  16432403 ********************************************************************** 0.3650 0.1110
--      47-    56  12647420 *****************************************************                  0.6696 0.3386
--      57-    67   2633378 ***********                                                            0.8749 0.5218
--      68-    79    665930 **                                                                     0.9143 0.5636
--      80-    92   1019082 ****                                                                   0.9266 0.5795
--      93-   106    765685 ***                                                                    0.9451 0.6074
--     107-   121    313991 *                                                                      0.9581 0.6298
--     122-   137    290428 *                                                                      0.9636 0.6407
--     138-   154    237026 *                                                                      0.9689 0.6526
--     155-   172    170298                                                                        0.9730 0.6632
--     173-   191    149277                                                                        0.9761 0.6719
--     192-   211    129971                                                                        0.9788 0.6804
--     212-   232    102234                                                                        0.9811 0.6885
--     233-   254     93676                                                                        0.9830 0.6956
--     255-   277     82142                                                                        0.9846 0.7027
--     278-   301     83580                                                                        0.9861 0.7095
--     302-   326     68736                                                                        0.9876 0.7172
--     327-   352     53831                                                                        0.9889 0.7239
--     353-   379     49138                                                                        0.9898 0.7296
--     380-   407     42103                                                                        0.9907 0.7351
--     408-   436     38159                                                                        0.9915 0.7404
--     437-   466     39040                                                                        0.9922 0.7454
--     467-   497     26358                                                                        0.9929 0.7509
--     498-   529     23650                                                                        0.9933 0.7549
--     530-   562     20763                                                                        0.9938 0.7587
--     563-   596     18581                                                                        0.9941 0.7622
--     597-   631     16508                                                                        0.9945 0.7656
--     632-   667     15000                                                                        0.9948 0.7688
--     668-   704     14980                                                                        0.9950 0.7718
--     705-   742     12252                                                                        0.9953 0.7750
--     743-   781     11766                                                                        0.9955 0.7778
--     782-   821     12652                                                                        0.9957 0.7806
--
--           0 (max occurrences)
--  3183998128 (total mers, non-unique)
--    55182102 (distinct mers, non-unique)
--           0 (unique mers)
-- Finished stage 'meryl-process', reset canuIteration.
--
-- Removing meryl database 'unitigging/0-mercounts/A3-27.ms22'.
--
-- OVERLAPPER (normal) (assembly) erate=0.01
--
----------------------------------------
-- Starting command on Fri Jan 16 13:06:33 2026 with 4534003 GB free disk space

    cd unitigging/1-overlapper
    /share/org/YZWL/yzwl_lixg/miniforge3/envs/canu_v.2.3/bin/overlapInCorePartition \
     -S  ../../A3-27.seqStore \
     -hl 160000000 \
     -rl 5000000000 \
     -ol 500 \
     -o  ./A3-27.partition \
    > ./A3-27.partition.err 2>&1

-- Finished on Fri Jan 16 13:06:33 2026 (fast as lightning) with 4534002.984 GB free disk space
----------------------------------------
--
-- Configured 21 overlapInCore jobs.
-- Finished stage 'utg-overlapConfigure', reset canuIteration.
--
-- Running jobs.  First attempt out of 2.
----------------------------------------
-- Starting 'utgovl' concurrent execution on Fri Jan 16 13:06:33 2026 with 4534002.953 GB free disk space (21 processes; 11 concurrently)

    cd unitigging/1-overlapper
    ./overlap.sh 1 > ./overlap.000001.out 2>&1
    ./overlap.sh 2 > ./overlap.000002.out 2>&1
    ./overlap.sh 3 > ./overlap.000003.out 2>&1
    ./overlap.sh 4 > ./overlap.000004.out 2>&1
    ./overlap.sh 5 > ./overlap.000005.out 2>&1
    ./overlap.sh 6 > ./overlap.000006.out 2>&1
    ./overlap.sh 7 > ./overlap.000007.out 2>&1
    ./overlap.sh 8 > ./overlap.000008.out 2>&1
    ./overlap.sh 9 > ./overlap.000009.out 2>&1
    ./overlap.sh 10 > ./overlap.000010.out 2>&1
    ./overlap.sh 11 > ./overlap.000011.out 2>&1
    ./overlap.sh 12 > ./overlap.000012.out 2>&1
    ./overlap.sh 13 > ./overlap.000013.out 2>&1
    ./overlap.sh 14 > ./overlap.000014.out 2>&1
    ./overlap.sh 15 > ./overlap.000015.out 2>&1
    ./overlap.sh 16 > ./overlap.000016.out 2>&1
    ./overlap.sh 17 > ./overlap.000017.out 2>&1
    ./overlap.sh 18 > ./overlap.000018.out 2>&1
    ./overlap.sh 19 > ./overlap.000019.out 2>&1
    ./overlap.sh 20 > ./overlap.000020.out 2>&1
    ./overlap.sh 21 > ./overlap.000021.out 2>&1

-- Finished on Fri Jan 16 13:45:46 2026 (2353 seconds) with 4533046.171 GB free disk space
----------------------------------------
-- Found 21 overlapInCore output files.
--
-- overlapInCore compute 'unitigging/1-overlapper':
--   kmer hits
--     with no overlap       1304579251  21.4761905 +- 39641997.818
--     with an overlap         21237518  0.38095238 +- 690121.88
--
--   overlaps                  21237518  0.38095238 +- 690121.88
--     contained                4968613  .619047619 +- 160463.718
--     dovetail                16268905  .761904762 +- 530759.079
--
--   overlaps rejected
--     multiple per pair              0           0 +- 0
--     bad short window               0           0 +- 0
--     bad long window                0           0 +- 0
-- Finished stage 'utg-overlapCheck', reset canuIteration.
----------------------------------------
-- Starting command on Fri Jan 16 13:45:46 2026 with 4533046.156 GB free disk space

    cd unitigging
    /share/org/YZWL/yzwl_lixg/miniforge3/envs/canu_v.2.3/bin/ovStoreConfig \
     -S ../A3-27.seqStore \
     -M 4-8 \
     -L ./1-overlapper/ovljob.files \
     -create ./A3-27.ovlStore.config \
     > ./A3-27.ovlStore.config.txt \
    2> ./A3-27.ovlStore.config.err

-- Finished on Fri Jan 16 13:45:46 2026 (fast as lightning) with 4533046.14 GB free disk space
----------------------------------------
--
-- Creating overlap store unitigging/A3-27.ovlStore using:
--      1 bucket
--      1 slice
--        using at most 2 GB memory each
--
-- Running jobs.  First attempt out of 2.
----------------------------------------
-- Starting 'ovS' concurrent execution on Fri Jan 16 13:45:46 2026 with 4533046.125 GB free disk space (1 processes; 62 concurrently)

    cd unitigging
    ./A3-27.ovlStore.sh 1 > ./A3-27.ovlStore.000001.out 2>&1

-- Finished on Fri Jan 16 13:45:55 2026 (9 seconds) with 4533045.125 GB free disk space
----------------------------------------
-- Checking store.
----------------------------------------
-- Starting command on Fri Jan 16 13:45:55 2026 with 4533045.125 GB free disk space

    cd unitigging
    /share/org/YZWL/yzwl_lixg/miniforge3/envs/canu_v.2.3/bin/ovStoreDump \
     -S ../A3-27.seqStore \
     -O  ./A3-27.ovlStore \
     -counts \
     > ./A3-27.ovlStore/counts.dat 2> ./A3-27.ovlStore/counts.err

-- Finished on Fri Jan 16 13:45:55 2026 (in the blink of an eye) with 4533045.093 GB free disk space
----------------------------------------
--
-- Overlap store 'unitigging/A3-27.ovlStore' successfully constructed.
-- Found 42475036 overlaps for 248148 reads; 1390839 reads have no overlaps.
--
--
-- Purged 0.496 GB in 63 overlap output files.
----------------------------------------
-- Starting command on Fri Jan 16 13:45:56 2026 with 4533045.093 GB free disk space

    cd unitigging
    /share/org/YZWL/yzwl_lixg/miniforge3/envs/canu_v.2.3/bin/ovStoreStats \
     -C 50 \
     -S ../A3-27.seqStore \
     -O  ./A3-27.ovlStore \
     -o  ./A3-27.ovlStore \
     > ./A3-27.ovlStore.summary.err 2>&1

-- Finished on Fri Jan 16 13:46:02 2026 (6 seconds) with 4533045.078 GB free disk space
----------------------------------------
--
-- Overlap store 'unitigging/A3-27.ovlStore' contains:
--
--   category            reads     %          read length        feature size or coverage  analysis
--   ----------------  -------  -------  ----------------------  ------------------------  --------------------
--   middle-missing        549    0.21    14941.56 +- 4490.18       3155.70 +- 3105.43    (bad trimming)
--   middle-hump           146    0.06    13996.18 +- 3361.85       6428.77 +- 4294.08    (bad trimming)
--   no-5-prime           1561    0.60    13021.32 +- 3986.81       3499.52 +- 3646.62    (bad trimming)
--   no-3-prime           1751    0.67    12153.54 +- 4697.40       3201.27 +- 3587.09    (bad trimming)
--   
--   low-coverage         3905    1.50    10401.48 +- 4529.59          4.57 +- 3.47       (easy to assemble, potential for lower quality consensus)
--   unique             202568   77.58    12484.22 +- 5234.45         44.54 +- 8.49       (easy to assemble, perfect, yay)
--   repeat-cont         11600    4.44    10300.16 +- 5310.80        990.37 +- 897.49     (potential for consensus errors, no impact on assembly)
--   repeat-dove           236    0.09    19602.15 +- 2001.07        438.28 +- 518.20     (hard to assemble, likely won't assemble correctly or even at all)
--   
--   span-repeat          2766    1.06    13650.13 +- 4364.47       3327.32 +- 3643.66    (read spans a large repeat, usually easy to assemble)
--   uniq-repeat-cont    14222    5.45    12262.31 +- 4291.22                             (should be uniquely placed, low potential for consensus errors, no impact on assembly)
--   uniq-repeat-dove     3182    1.22    17714.05 +- 2782.16                             (will end contigs, potential to misassemble)
--   uniq-anchor          5662    2.17    13514.26 +- 4178.08       8043.16 +- 4628.46    (repeat read, with unique section, probable bad read)
-- Finished stage 'utg-createOverlapStore', reset canuIteration.
--
-- Loading read lengths.
-- Loading number of overlaps per read.
--
-- Configure RED for 16gb memory.
--                   Batches of at most (unlimited) reads.
--                                      500000000 bases.
--                   Expecting evidence of at most 536870912 bases per iteration.
--
--           Total                                               Reads                 Olaps Evidence
--    Job   Memory      Read Range         Reads        Bases   Memory        Olaps   Memory   Memory  (Memory in MB)
--   ---- -------- ------------------- --------- ------------ -------- ------------ -------- --------
--      1 16384.72         1-35875          5755    108997598 13305.55       625929     7.16  1024.00
--      2 16385.44     35876-74934          6232    108946769 13299.36      1229905    14.08  1024.00
--      3 16384.98     74935-119750         7043    108948849 13299.64      1165709    13.34  1024.00
--      4 16386.01    119751-157508         5949    109009050 13306.96       616784     7.06  1024.00
--      5 16385.75    157509-198954         6675    108945353 13299.20      1270669    14.54  1024.00
--      6 16384.53    198955-247225         7707    108934841 13297.95      1274136    14.58  1024.00
--      7 16386.05    247226-285126         5974    109007019 13306.71       641144     7.34  1024.00
--      8 16384.95    285127-327129         6623    108930998 13297.45      1354663    15.50  1024.00
--      9 16385.14    327130-376292         7919    108929614 13297.32      1382125    15.82  1024.00
--     10 16385.28    376293-413578         5926    109000303 13305.89       645575     7.39  1024.00
--     11 16384.77    413579-455316         6533    108936974 13298.18      1275106    14.59  1024.00
--     12 16384.85    455317-505897         8048    108930257 13297.40      1349845    15.45  1024.00
--     13 16384.56    505898-542813         5992    108994051 13305.13       649165     7.43  1024.00
--     14 16385.69    542814-584463         6505    108939047 13298.43      1333210    15.26  1024.00
--     15 16385.76    584464-634894         8039    108936979 13298.22      1357305    15.53  1024.00
--     16 16384.82    634895-673141         5971    108996460 13305.42       646351     7.40  1024.00
--     17 16385.41    673142-714118         6488    108934668 13297.89      1356010    15.52  1024.00
--     18 16384.76    714119-764330         8132    108927585 13297.08      1370008    15.68  1024.00
--     19 16385.15    764331-800896         5877    109001677 13306.05       620155     7.10  1024.00
--     20 16384.59    800897-841010         6372    108933550 13297.75      1296637    14.84  1024.00
--     21 16385.30    841011-891431         8001    108939972 13298.59      1285751    14.71  1024.00
--     22 16385.02    891432-928439         5850    108998847 13305.71       638714     7.31  1024.00
--     23 16385.83    928440-967287         6217    108940872 13298.64      1327014    15.19  1024.00
--     24 16384.25    967288-1016344        7752    108924633 13296.71      1358382    15.55  1024.00
--     25 16386.66   1016345-1053405        5881    109013149 13307.45       629707     7.21  1024.00
--     26 16384.18   1053406-1092592        6263    108928160 13297.09      1318789    15.09  1024.00
--     27 16384.06   1092593-1142130        7915    108929434 13297.30      1290123    14.76  1024.00
--     28 16384.50   1142131-1178719        5851    108991772 13304.84       669016     7.66  1024.00
--     29 16385.84   1178720-1217237        6201    108945610 13299.22      1277829    14.62  1024.00
--     30 16384.00   1217238-1266694        7910    108931090 13297.50      1267150    14.50  1024.00
--     31 16386.15   1266695-1303053        5825    109009652 13307.03       622742     7.13  1024.00
--     32 16385.45   1303054-1340660        6149    108938499 13298.35      1319046    15.10  1024.00
--     33 16385.02   1340661-1390188        7890    108930877 13297.47      1358567    15.55  1024.00
--     34 16386.36   1390189-1426254        5776    109010051 13307.07       636371     7.28  1024.00
--     35 16384.39   1426255-1465232        6159    108929002 13297.19      1327994    15.20  1024.00
--     36 16385.27   1465233-1514890        7959    108936201 13298.13      1323584    15.15  1024.00
--     37 16386.09   1514891-1551165        5744    109008010 13306.82       635201     7.27  1024.00
--     38 16385.59   1551166-1589723        6046    108946261 13299.29      1249194    14.30  1024.00
--     39 16385.55   1589724-1638667        7891    108924390 13296.68      1473563    16.86  1024.00
--     40  3152.17   1638668-1638987          52       656153    80.10         5868     0.07  1024.00
--   ---- -------- ------------------- --------- ------------ -------- ------------ -------- --------
--                                                 4250014277              42475036
-- Finished stage 'readErrorDetectionConfigure', reset canuIteration.
--
-- Running jobs.  First attempt out of 2.
----------------------------------------
-- Starting 'red' concurrent execution on Fri Jan 16 13:46:08 2026 with 4533045.031 GB free disk space (40 processes; 22 concurrently)

    cd unitigging/3-overlapErrorAdjustment
    ./red.sh 1 > ./red.000001.out 2>&1
    ./red.sh 2 > ./red.000002.out 2>&1
    ./red.sh 3 > ./red.000003.out 2>&1
    ./red.sh 4 > ./red.000004.out 2>&1
    ./red.sh 5 > ./red.000005.out 2>&1
    ./red.sh 6 > ./red.000006.out 2>&1
    ./red.sh 7 > ./red.000007.out 2>&1
    ./red.sh 8 > ./red.000008.out 2>&1
    ./red.sh 9 > ./red.000009.out 2>&1
    ./red.sh 10 > ./red.000010.out 2>&1
    ./red.sh 11 > ./red.000011.out 2>&1
    ./red.sh 12 > ./red.000012.out 2>&1
    ./red.sh 13 > ./red.000013.out 2>&1
    ./red.sh 14 > ./red.000014.out 2>&1
    ./red.sh 15 > ./red.000015.out 2>&1
    ./red.sh 16 > ./red.000016.out 2>&1
    ./red.sh 17 > ./red.000017.out 2>&1
    ./red.sh 18 > ./red.000018.out 2>&1
    ./red.sh 19 > ./red.000019.out 2>&1
    ./red.sh 20 > ./red.000020.out 2>&1
    ./red.sh 21 > ./red.000021.out 2>&1
    ./red.sh 22 > ./red.000022.out 2>&1
    ./red.sh 23 > ./red.000023.out 2>&1
    ./red.sh 24 > ./red.000024.out 2>&1
    ./red.sh 25 > ./red.000025.out 2>&1
    ./red.sh 26 > ./red.000026.out 2>&1
    ./red.sh 27 > ./red.000027.out 2>&1
    ./red.sh 28 > ./red.000028.out 2>&1
    ./red.sh 29 > ./red.000029.out 2>&1
    ./red.sh 30 > ./red.000030.out 2>&1
    ./red.sh 31 > ./red.000031.out 2>&1
    ./red.sh 32 > ./red.000032.out 2>&1
    ./red.sh 33 > ./red.000033.out 2>&1
    ./red.sh 34 > ./red.000034.out 2>&1
    ./red.sh 35 > ./red.000035.out 2>&1
    ./red.sh 36 > ./red.000036.out 2>&1
    ./red.sh 37 > ./red.000037.out 2>&1
    ./red.sh 38 > ./red.000038.out 2>&1
    ./red.sh 39 > ./red.000039.out 2>&1
    ./red.sh 40 > ./red.000040.out 2>&1

-- Finished on Fri Jan 16 13:57:19 2026 (671 seconds) with 4532290.406 GB free disk space
----------------------------------------
-- Found 40 read error detection output files.
-- Finished stage 'readErrorDetectionCheck', reset canuIteration.
--
-- Loading read lengths.
-- Loading number of overlaps per read.
--
-- Configure OEA for 8gb memory.
--                   Batches of at most (unlimited) reads.
--                                      300000000 bases.
--
--           Total                                               Reads                 Olaps  Adjusts
--    Job   Memory      Read Range         Reads        Bases   Memory        Olaps   Memory   Memory  (Memory in MB)
--   ---- -------- ------------------- --------- ------------ -------- ------------ -------- --------
--      1  2796.27         1-110559        17596    300005168   294.64      2844405    86.80   366.82
--      2  2801.44    110560-229732        18897    300002811   294.68      3012452    91.93   366.82
--      3  2801.09    229733-340735        17657    300005136   294.65      3002357    91.62   366.82
--      4  2789.76    340736-455901        18281    300008631   294.67      2630393    80.27   366.82
--      5  2805.70    455902-573963        18835    300017980   294.69      3151860    96.19   366.82
--      6  2805.32    573964-693682        18887    300004044   294.68      3139775    95.82   366.82
--      7  2787.75    693683-811159        18898    300012342   294.69      2563745    78.24   366.82
--      8  2802.83    811160-929591        18724    300013869   294.69      3057887    93.32   366.82
--      9  2806.65    929592-1045069       18390    300001132   294.66      3183893    97.16   366.82
--     10  2803.81   1045070-1161874       18587    300008554   294.68      3090497    94.31   366.82
--     11  2802.56   1161875-1277010       18508    300013718   294.68      3049361    93.06   366.82
--     12  2804.64   1277011-1391657       18441    300000321   294.67      3117932    95.15   366.82
--     13  2802.08   1391658-1503129       17737    300017493   294.66      3034326    92.60   366.82
--     14  2787.82   1503130-1613342       17426    300009220   294.64      2567396    78.35   366.82
--     15  2501.93   1613343-1638987        4228     49893858    55.71      1028757    31.40   366.82
--   ---- -------- ------------------- --------- ------------ -------- ------------ -------- --------
--                                                 4250014277              42475036
-- Finished stage 'overlapErrorAdjustmentConfigure', reset canuIteration.
--
-- Running jobs.  First attempt out of 2.
----------------------------------------
-- Starting 'oea' concurrent execution on Fri Jan 16 13:57:26 2026 with 4532289.593 GB free disk space (15 processes; 62 concurrently)

    cd unitigging/3-overlapErrorAdjustment
    ./oea.sh 1 > ./oea.000001.out 2>&1
    ./oea.sh 2 > ./oea.000002.out 2>&1
    ./oea.sh 3 > ./oea.000003.out 2>&1
    ./oea.sh 4 > ./oea.000004.out 2>&1
    ./oea.sh 5 > ./oea.000005.out 2>&1
    ./oea.sh 6 > ./oea.000006.out 2>&1
    ./oea.sh 7 > ./oea.000007.out 2>&1
    ./oea.sh 8 > ./oea.000008.out 2>&1
    ./oea.sh 9 > ./oea.000009.out 2>&1
    ./oea.sh 10 > ./oea.000010.out 2>&1
    ./oea.sh 11 > ./oea.000011.out 2>&1
    ./oea.sh 12 > ./oea.000012.out 2>&1
    ./oea.sh 13 > ./oea.000013.out 2>&1
    ./oea.sh 14 > ./oea.000014.out 2>&1
    ./oea.sh 15 > ./oea.000015.out 2>&1

-- Finished on Fri Jan 16 14:24:23 2026 (1617 seconds) with 4531406.25 GB free disk space
----------------------------------------
-- Found 15 overlap error adjustment output files.
-- Finished stage 'overlapErrorAdjustmentCheck', reset canuIteration.
----------------------------------------
-- Starting command on Fri Jan 16 14:24:23 2026 with 4531406.234 GB free disk space

    cd unitigging/3-overlapErrorAdjustment
    /share/org/YZWL/yzwl_lixg/miniforge3/envs/canu_v.2.3/bin/loadErates \
      -S ../../A3-27.seqStore \
      -O ../A3-27.ovlStore \
      -L ./oea.files \
    > ./oea.apply.err 2>&1

-- Finished on Fri Jan 16 14:24:24 2026 (one second) with 4531406.14 GB free disk space
----------------------------------------
-- No report available.
-- Finished stage 'updateOverlapStore', reset canuIteration.
-- Finished stage 'unitig', reset canuIteration.
--
-- Running jobs.  First attempt out of 2.
----------------------------------------
-- Starting 'bat' concurrent execution on Fri Jan 16 14:24:24 2026 with 4531406.093 GB free disk space (1 processes; 1 concurrently)

    cd unitigging/4-unitigger
    ./unitigger.sh 1 > ./unitigger.000001.out 2>&1

-- Finished on Fri Jan 16 14:24:37 2026 (13 seconds) with 4531401.812 GB free disk space
----------------------------------------
-- Unitigger finished successfully.
--  
--  ERROR RATES
--  -----------
--                                                   --------threshold------
--  282202                       fraction error      fraction        percent
--  samples                              (1e-5)         error          error
--                   --------------------------      --------       --------
--  command line (-eg)                           ->     30.00        0.0300%
--  command line (-ef)                           ->  -----.--      ---.----%
--  command line (-eM)                           ->     30.00        0.0300%
--  mean + std.dev       0.40 +-  12 *     2.86  ->     34.69        0.0347%
--  median + mad         0.00 +-  12 *     0.00  ->      0.00        0.0000%
--  90th percentile                              ->      1.00        0.0010%  (enabled)
--  
--  BEST EDGE FILTERING
--  -------------------
--  At graph threshold 0.0300%, reads:
--    available to have edges:        56859
--    with at least one edge:         41677
--  
--  At max threshold 0.0300%, reads:
--    available to have edges:        56859
--    with at least one edge:         41677
--  
--  At tight threshold 0.0010%, reads with:
--    both edges below error threshold:     36887  (80.00% minReadsBest threshold = 33341)
--    one  edge  above error threshold:      3625
--    both edges above error threshold:      1165
--    at least one edge:                    41677
--  
--  At loose threshold 0.0300%, reads with:
--    both edges below error threshold:     41677  (80.00% minReadsBest threshold = 33341)
--    one  edge  above error threshold:         0
--    both edges above error threshold:         0
--    at least one edge:                    41677
--  
--  
--  INITIAL EDGES
--  -------- ----------------------------------------
--    199169 reads are contained
--   1405299 reads have no best edges (singleton)
--       772 reads have only one best edge (spur) 
--                545 are mutual best
--     33747 reads have two best edges 
--                825 have one mutual best edge
--              32471 have two mutual best edges
--  
--  
--  FINAL EDGES
--  -------- ----------------------------------------
--    199169 reads are contained
--   1405632 reads have no best edges (singleton)
--       671 reads have only one best edge (spur) 
--                537 are mutual best
--     33515 reads have two best edges 
--                673 have one mutual best edge
--              32488 have two mutual best edges
--  
--  
--  EDGE FILTERING
--  -------- ------------------------------------------
--         0 reads are ignored
--     11585 reads have a gap in overlap coverage
--       148 reads have lopsided best edges
-- Found, in version 1, after unitig construction:
--   contigs:      103 sequences, total length 68958622 bp (including 84 repeats of total length 1992098 bp).
--   bubbles:      135 sequences, total length 3450151 bp.
--   unassembled:  28158 sequences, total length 312881085 bp.
--
-- Contig sizes based on genome size 85mbp:
--
--            NG (bp)  LG (contigs)    sum (bp)
--         ----------  ------------  ----------
--     10     6515653             2    14041549
--     20     6472886             3    20514435
--     30     6192457             4    26706892
--     40     4642898             6    36719956
--     50     3556676             8    44376137
--     60     3256539            10    51005743
--     70     1750133            14    60966444
--     80       26771            56    68016243
--
-- Finished stage 'unitigCheck', reset canuIteration.
----------------------------------------
-- Starting command on Fri Jan 16 14:24:37 2026 with 4531401.796 GB free disk space

    cd unitigging
    /share/org/YZWL/yzwl_lixg/miniforge3/envs/canu_v.2.3/bin/utgcns \
      -S ../A3-27.seqStore \
      -T  ./A3-27.ctgStore 1 \
      -partition 0.8 1.5 0.1 \
    > ./A3-27.ctgStore/partitioning.log 2>&1

-- Finished on Fri Jan 16 14:24:46 2026 (9 seconds) with 4531400.609 GB free disk space
----------------------------------------
-- Using slow alignment for consensus (iteration '0').
-- Configured 11 consensus jobs.
-- Finished stage 'consensusConfigure', reset canuIteration.
--
-- Local: cns       11.250 GB    8 CPUs x  11 jobs   123.750 GB  88 CPUs  (consensus)
--
--
-- Running jobs.  First attempt out of 2.
----------------------------------------
-- Starting 'cns' concurrent execution on Fri Jan 16 14:24:46 2026 with 4531400.578 GB free disk space (11 processes; 11 concurrently)

    cd unitigging/5-consensus
    ./consensus.sh 1 > ./consensus.000001.out 2>&1
    ./consensus.sh 2 > ./consensus.000002.out 2>&1
    ./consensus.sh 3 > ./consensus.000003.out 2>&1
    ./consensus.sh 4 > ./consensus.000004.out 2>&1
    ./consensus.sh 5 > ./consensus.000005.out 2>&1
    ./consensus.sh 6 > ./consensus.000006.out 2>&1
    ./consensus.sh 7 > ./consensus.000007.out 2>&1
    ./consensus.sh 8 > ./consensus.000008.out 2>&1
    ./consensus.sh 9 > ./consensus.000009.out 2>&1
    ./consensus.sh 10 > ./consensus.000010.out 2>&1
    ./consensus.sh 11 > ./consensus.000011.out 2>&1

-- Finished on Fri Jan 16 14:31:43 2026 (417 seconds) with 4530354.656 GB free disk space
----------------------------------------
-- Using slow alignment for consensus (iteration '1').
-- Configured 11 consensus jobs.
-- All 11 consensus jobs finished successfully.
-- Finished stage 'consensusCheck', reset canuIteration.
-- Using slow alignment for consensus (iteration '0').
-- Configured 11 consensus jobs.
----------------------------------------
-- Starting command on Fri Jan 16 14:31:44 2026 with 4530354.609 GB free disk space

    cd unitigging
    /share/org/YZWL/yzwl_lixg/miniforge3/envs/canu_v.2.3/bin/tgStoreLoad \
      -S ../A3-27.seqStore \
      -T  ./A3-27.ctgStore 2 \
      -L ./5-consensus/ctgcns.files \
    > ./5-consensus/ctgcns.files.ctgStoreLoad.err 2>&1

-- Finished on Fri Jan 16 14:31:45 2026 (one second) with 4530353.484 GB free disk space
----------------------------------------
----------------------------------------
-- Starting command on Fri Jan 16 14:31:45 2026 with 4530353.484 GB free disk space

    cd unitigging
    /share/org/YZWL/yzwl_lixg/miniforge3/envs/canu_v.2.3/bin/tgTigDisplay \
      -S ../A3-27.seqStore \
      -b \
      -o ../A3-27.contigs.unsorted.bam \
      -L ./5-consensus/ctgcns.files \
    > ./5-consensus/ctgcns.files.contigs.bam.err 2>&1

-- Finished on Fri Jan 16 14:35:47 2026 (242 seconds) with 4529103.343 GB free disk space
----------------------------------------
----------------------------------------
-- Starting command on Fri Jan 16 14:35:47 2026 with 4529103.343 GB free disk space

    cd .
    samtools sort \
      --write-index \
      --threads 2 \
      -o ./A3-27.contigs.bam ./A3-27.contigs.unsorted.bam \
    > ./ctgcns.bam.err 2>&1

-- Finished on Fri Jan 16 14:36:49 2026 (62 seconds) with 4529127.625 GB free disk space
----------------------------------------
-- Purging consensus output after loading to ctgStore.
-- Purged 11 .cns outputs.
----------------------------------------
-- Starting command on Fri Jan 16 14:36:49 2026 with 4529130.593 GB free disk space

    cd unitigging
    /share/org/YZWL/yzwl_lixg/miniforge3/envs/canu_v.2.3/bin/tgStoreDump \
      -S ../A3-27.seqStore \
      -T ./A3-27.ctgStore 2 \
      -sizes -s 85000000 \
    > ./A3-27.ctgStore/seqDB.v002.sizes.txt
ZERO length suplied to intervalList::add(), ignoring interval.
ZERO length suplied to intervalList::add(), ignoring interval.
ZERO length suplied to intervalList::add(), ignoring interval.
ZERO length suplied to intervalList::add(), ignoring interval.
ZERO length suplied to intervalList::add(), ignoring interval.
ZERO length suplied to intervalList::add(), ignoring interval.
ZERO length suplied to intervalList::add(), ignoring interval.
ZERO length suplied to intervalList::add(), ignoring interval.

-- Finished on Fri Jan 16 14:36:49 2026 (furiously fast) with 4529131.406 GB free disk space
----------------------------------------
-- Found, in version 2, after consensus generation:
--   contigs:      103 sequences, total length 90258530 bp (including 84 repeats of total length 2717220 bp).
--   bubbles:      135 sequences, total length 4710933 bp.
--   unassembled:  28158 sequences, total length 462542060 bp.
--
-- Contig sizes based on genome size 85mbp:
--
--            NG (bp)  LG (contigs)    sum (bp)
--         ----------  ------------  ----------
--     10     9775594             1     9775594
--     20     8456783             2    18232377
--     30     8414203             3    26646580
--     40     8066087             4    34712667
--     50     6049223             6    47736429
--     60     5355011             7    53091440
--     70     4402315             9    62124055
--     80     3890931            11    70259239
--     90     3000951            13    77080094
--    100     1160814            18    85076713
--
-- Finished stage 'consensusLoad', reset canuIteration.
----------------------------------------
-- Starting command on Fri Jan 16 14:36:49 2026 with 4529131.39 GB free disk space

    cd .
    /share/org/YZWL/yzwl_lixg/miniforge3/envs/canu_v.2.3/bin/tgStoreDump \
      -S ./A3-27.seqStore \
      -T ./unitigging/A3-27.ctgStore 2 \
      -o ./A3-27.contigs \
      -layout \
    > ./A3-27.contigs.layout.err 2>&1

-- Finished on Fri Jan 16 14:36:50 2026 (one second) with 4529131.359 GB free disk space
----------------------------------------
----------------------------------------
-- Starting command on Fri Jan 16 14:36:50 2026 with 4529131.359 GB free disk space

    cd .
    /share/org/YZWL/yzwl_lixg/miniforge3/envs/canu_v.2.3/bin/tgStoreDump \
      -S ./A3-27.seqStore \
      -T ./unitigging/A3-27.ctgStore 2 \
      -consensus -fasta \
      -unassembled \
    > ./A3-27.unassembled.fasta
    2> ./A3-27.unassembled.err
ZERO length suplied to intervalList::add(), ignoring interval.
ZERO length suplied to intervalList::add(), ignoring interval.
ZERO length suplied to intervalList::add(), ignoring interval.
ZERO length suplied to intervalList::add(), ignoring interval.
ZERO length suplied to intervalList::add(), ignoring interval.
ZERO length suplied to intervalList::add(), ignoring interval.
ZERO length suplied to intervalList::add(), ignoring interval.
ZERO length suplied to intervalList::add(), ignoring interval.

-- Finished on Fri Jan 16 14:36:52 2026 (2 seconds) with 4529131.25 GB free disk space
----------------------------------------
----------------------------------------
-- Starting command on Fri Jan 16 14:36:52 2026 with 4529131.25 GB free disk space

    cd .
    /share/org/YZWL/yzwl_lixg/miniforge3/envs/canu_v.2.3/bin/tgStoreDump \
      -S ./A3-27.seqStore \
      -T ./unitigging/A3-27.ctgStore 2 \
      -consensus -fasta \
      -contigs \
    > ./A3-27.contigs.fasta
    2> ./A3-27.contigs.err
ZERO length suplied to intervalList::add(), ignoring interval.
ZERO length suplied to intervalList::add(), ignoring interval.
ZERO length suplied to intervalList::add(), ignoring interval.
ZERO length suplied to intervalList::add(), ignoring interval.
ZERO length suplied to intervalList::add(), ignoring interval.
ZERO length suplied to intervalList::add(), ignoring interval.
ZERO length suplied to intervalList::add(), ignoring interval.
ZERO length suplied to intervalList::add(), ignoring interval.

-- Finished on Fri Jan 16 14:36:53 2026 (one second) with 4529131.187 GB free disk space
----------------------------------------
-- Finished stage 'generateOutputs', reset canuIteration.
--
-- Assembly 'A3-27' finished in '/share/org/YZWL/yzwl_lixg/project/28.大豆疫霉菌三代基因组/03.hicanu/A3-27/01.raw_output'.
--
-- Summary saved in 'A3-27.report'.
--
-- Sequences saved:
--   Contigs       -> 'A3-27.contigs.fasta'
--   Unassembled   -> 'A3-27.unassembled.fasta'
--
-- Read layouts saved:
--   Contigs       -> 'A3-27.contigs.layout'.
--
-- Bye.

2026-01-16 14:36:53.032 - WARNING - 输出文件不存在|Output file does not exist: /share/org/YZWL/yzwl_lixg/project/28.大豆疫霉菌三代基因组/03.hicanu/A3-27/01.raw_output/A3-27.unitigs.fasta
Job 68889957 stderr output:

