Usage: biopytools ragtag [OPTIONS]
Try 'biopytools ragtag -h' for help.

Error: Invalid value for '-r' / '--reference': 文件不存在|File does not exist: /share/org/YZWL/yzwl_lixg/project/28.大豆疫霉菌三代基因组/04.ragtag/Psoja_T2T.fa
Usage: biopytools genomesyn [OPTIONS]
Try 'biopytools genomesyn -h' for help.

Error: Invalid value for '-i' / '--ref': Path '04.ragtag/A1-17/hifiasm/A1-17_RagTag_scaffolded.fa' does not exist.
2026-01-16 01:40:32.505 - WARNING - 命令错误输出|Command stderr:
-- canu master +27 changes (r10515 2a41e933b8de6ed66723d75d36dd071b46d2c347)
--
-- CITATIONS
--
-- For assemblies of PacBio HiFi reads:
--   Nurk S, Walenz BP, Rhiea A, Vollger MR, Logsdon GA, Grothe R, Miga KH, Eichler EE, Phillippy AM, Koren S.
--   HiCanu: accurate assembly of segmental duplications, satellites, and allelic variants from high-fidelity long reads.
--   biorXiv. 2020.
--   https://doi.org/10.1101/2020.03.14.992248
-- 
-- Read and contig alignments during correction and consensus use:
--   Šošic M, Šikic M.
--   Edlib: a C/C ++ library for fast, exact sequence alignment using edit distance.
--   Bioinformatics. 2017 May 1;33(9):1394-1395.
--   http://doi.org/10.1093/bioinformatics/btw753
-- 
-- Overlaps are generated using:
--   Berlin K, et al.
--   Assembling large genomes with single-molecule sequencing and locality-sensitive hashing.
--   Nat Biotechnol. 2015 Jun;33(6):623-30.
--   http://doi.org/10.1038/nbt.3238
-- 
--   Myers EW, et al.
--   A Whole-Genome Assembly of Drosophila.
--   Science. 2000 Mar 24;287(5461):2196-204.
--   http://doi.org/10.1126/science.287.5461.2196
-- 
-- Contig consensus sequences are generated using an algorithm derived from pbdagcon:
--   Chin CS, et al.
--   Nonhybrid, finished microbial genome assemblies from long-read SMRT sequencing data.
--   Nat Methods. 2013 Jun;10(6):563-9
--   http://doi.org/10.1038/nmeth.2474
-- 
-- CONFIGURE CANU
--
-- Detected Java(TM) Runtime Environment '17.0.15-internal' (from '/share/org/YZWL/yzwl_lixg/.local/bin/java') without -d64 support.
--
-- WARNING:
-- WARNING:  Failed to run gnuplot using command 'gnuplot'.
-- WARNING:  Plots will be disabled.
-- WARNING:
--
-- Detected samtools version '1.22' / htslib version 'htscodecs=1.6.3' (from 'samtools').
--
-- Detected 88 CPUs and 503 gigabytes of memory on the local machine.
--
-- Detected Slurm with 'sinfo' binary in /opt/skyformai/bin/sinfo.
--          Slurm disabled by useGrid=false
--
-- Detected  '' with 'pbsnodes' binary in /opt/skyformai/bin/pbsnodes.
--           disabled by useGrid=false
--
-- Detected LSF with 'bsub' binary in /opt/skyformai/bin/bsub.
--          LSF disabled by useGrid=false
--
-- Local machine mode enabled; grid support not detected or not allowed.
--
-- Found trimmed raw PacBio HiFi reads in the input files.
--
--                                (tag)Concurrency
--                         (tag)Threads          |
--                (tag)Memory         |          |
--        (tag)             |         |          |       total usage      algorithm
--        -------  ----------  --------   --------  --------------------  -----------------------------
-- Local: meryl     12.000 GB    4 CPUs x  22 jobs   264.000 GB  88 CPUs  (k-mer counting)
-- Local: cormhap   13.000 GB   11 CPUs x   8 jobs   104.000 GB  88 CPUs  (overlap detection with mhap)
-- Local: obtovl     8.000 GB    8 CPUs x  11 jobs    88.000 GB  88 CPUs  (overlap detection)
-- Local: utgovl     8.000 GB    8 CPUs x  11 jobs    88.000 GB  88 CPUs  (overlap detection)
-- Local: cor        -.--- GB    4 CPUs x   - jobs     -.--- GB   - CPUs  (read correction)
-- Local: ovb        4.000 GB    1 CPU  x  88 jobs   352.000 GB  88 CPUs  (overlap store bucketizer)
-- Local: ovs        8.000 GB    1 CPU  x  62 jobs   496.000 GB  62 CPUs  (overlap store sorting)
-- Local: red       16.000 GB    4 CPUs x  22 jobs   352.000 GB  88 CPUs  (read error detection)
-- Local: oea        8.000 GB    1 CPU  x  62 jobs   496.000 GB  62 CPUs  (overlap error adjustment)
-- Local: bat       32.000 GB    8 CPUs x   1 job     32.000 GB   8 CPUs  (contig construction with bogart)
-- Local: cns        -.--- GB    8 CPUs x   - jobs     -.--- GB   - CPUs  (consensus)
--
-- Generating assembly 'A1-17' in '/share/org/YZWL/yzwl_lixg/project/28.大豆疫霉菌三代基因组/03.hicanu/A1-17/01.raw_output':
--   genomeSize:
--     85000000
--
--   Overlap Generation Limits:
--     corOvlErrorRate 0.0000 (  0.00%)
--     obtOvlErrorRate 0.0250 (  2.50%)
--     utgOvlErrorRate 0.0100 (  1.00%)
--
--   Overlap Processing Limits:
--     corErrorRate    0.0000 (  0.00%)
--     obtErrorRate    0.0250 (  2.50%)
--     utgErrorRate    0.0003 (  0.03%)
--     cnsErrorRate    0.0500 (  5.00%)
--
--   Stages to run:
--     assemble HiFi reads.
--
--
-- BEGIN STORE CREATION
----------------------------------------
-- Starting command on Thu Jan 15 23:34:54 2026 with 4569882.64 GB free disk space

    cd .
    ./A1-17.seqStore.sh \
    > ./A1-17.seqStore.err 2>&1

-- Finished on Thu Jan 15 23:41:17 2026 (383 seconds) with 4568479.14 GB free disk space
----------------------------------------
--
-- In sequence store './A1-17.seqStore':
--   Found 256873 reads.
--   Found 4250009290 bases (50 times coverage).
--    Histogram of corrected reads:
--    
--    G=4250009290                       sum of  ||               length     num
--    NG         length     index       lengths  ||                range    seqs
--    ----- ------------ --------- ------------  ||  ------------------- -------
--    00010        26538     14890    425010336  ||       1230-2284         6633|---------------------
--    00020        24539     31598    850008878  ||       2285-3339        11000|----------------------------------
--    00030        23151     49448   1275017873  ||       3340-4394        10448|---------------------------------
--    00040        22009     68284   1700024704  ||       4395-5449         9145|-----------------------------
--    00050        20950     88077   2125013654  ||       5450-6504         7916|-------------------------
--    00060        19884    108895   2550016265  ||       6505-7559         7094|----------------------
--    00070        18662    130933   2975011408  ||       7560-8614         6373|--------------------
--    00080        16925    154731   3400024116  ||       8615-9669         5708|------------------
--    00090        11583    183537   3825011028  ||       9670-10724        5144|----------------
--    00100         1230    256873   4250009290  ||      10725-11779        4725|---------------
--    001.000x              256873   4250009290  ||      11780-12834        4126|-------------
--                                               ||      12835-13889        3940|-------------
--                                               ||      13890-14944        4747|---------------
--                                               ||      14945-15999        6689|---------------------
--                                               ||      16000-17054        9868|-------------------------------
--                                               ||      17055-18109       13599|------------------------------------------
--                                               ||      18110-19164       17508|------------------------------------------------------
--                                               ||      19165-20219       19887|--------------------------------------------------------------
--                                               ||      20220-21274       20525|---------------------------------------------------------------
--                                               ||      21275-22329       19131|-----------------------------------------------------------
--                                               ||      22330-23384       16678|----------------------------------------------------
--                                               ||      23385-24439       13269|-----------------------------------------
--                                               ||      24440-25494       10366|--------------------------------
--                                               ||      25495-26549        7530|------------------------
--                                               ||      26550-27604        5409|-----------------
--                                               ||      27605-28659        3731|------------
--                                               ||      28660-29714        2467|--------
--                                               ||      29715-30769        1545|-----
--                                               ||      30770-31824         892|---
--                                               ||      31825-32879         456|--
--                                               ||      32880-33934         199|-
--                                               ||      33935-34989          74|-
--                                               ||      34990-36044          35|-
--                                               ||      36045-37099          10|-
--                                               ||      37100-38154           1|-
--                                               ||      38155-39209           1|-
--                                               ||      39210-40264           2|-
--                                               ||      40265-41319           0|
--                                               ||      41320-42374           1|-
--                                               ||      42375-43429           1|-
--    
--
-- In sequence store './A1-17.seqStore':
--   Found 256873 reads.
--   Found 4250009290 bases (50 times coverage).
--    Histogram of corrected-trimmed reads:
--    
--    G=4250009290                       sum of  ||               length     num
--    NG         length     index       lengths  ||                range    seqs
--    ----- ------------ --------- ------------  ||  ------------------- -------
--    00010        26538     14890    425010336  ||       1230-2284         6633|---------------------
--    00020        24539     31598    850008878  ||       2285-3339        11000|----------------------------------
--    00030        23151     49448   1275017873  ||       3340-4394        10448|---------------------------------
--    00040        22009     68284   1700024704  ||       4395-5449         9145|-----------------------------
--    00050        20950     88077   2125013654  ||       5450-6504         7916|-------------------------
--    00060        19884    108895   2550016265  ||       6505-7559         7094|----------------------
--    00070        18662    130933   2975011408  ||       7560-8614         6373|--------------------
--    00080        16925    154731   3400024116  ||       8615-9669         5708|------------------
--    00090        11583    183537   3825011028  ||       9670-10724        5144|----------------
--    00100         1230    256873   4250009290  ||      10725-11779        4725|---------------
--    001.000x              256873   4250009290  ||      11780-12834        4126|-------------
--                                               ||      12835-13889        3940|-------------
--                                               ||      13890-14944        4747|---------------
--                                               ||      14945-15999        6689|---------------------
--                                               ||      16000-17054        9868|-------------------------------
--                                               ||      17055-18109       13599|------------------------------------------
--                                               ||      18110-19164       17508|------------------------------------------------------
--                                               ||      19165-20219       19887|--------------------------------------------------------------
--                                               ||      20220-21274       20525|---------------------------------------------------------------
--                                               ||      21275-22329       19131|-----------------------------------------------------------
--                                               ||      22330-23384       16678|----------------------------------------------------
--                                               ||      23385-24439       13269|-----------------------------------------
--                                               ||      24440-25494       10366|--------------------------------
--                                               ||      25495-26549        7530|------------------------
--                                               ||      26550-27604        5409|-----------------
--                                               ||      27605-28659        3731|------------
--                                               ||      28660-29714        2467|--------
--                                               ||      29715-30769        1545|-----
--                                               ||      30770-31824         892|---
--                                               ||      31825-32879         456|--
--                                               ||      32880-33934         199|-
--                                               ||      33935-34989          74|-
--                                               ||      34990-36044          35|-
--                                               ||      36045-37099          10|-
--                                               ||      37100-38154           1|-
--                                               ||      38155-39209           1|-
--                                               ||      39210-40264           2|-
--                                               ||      40265-41319           0|
--                                               ||      41320-42374           1|-
--                                               ||      42375-43429           1|-
--    
--
-- Correction skipped; not enabled.
--
-- Trimming skipped; not enabled.
--
-- BEGIN ASSEMBLY
----------------------------------------
-- Starting command on Thu Jan 15 23:41:17 2026 with 4568479.093 GB free disk space

    cd unitigging/0-mercounts
    ./meryl-configure.sh \
    > ./meryl-configure.err 2>&1

-- Finished on Thu Jan 15 23:41:18 2026 (one second) with 4568479.093 GB free disk space
----------------------------------------
--  segments   memory batches
--  -------- -------- -------
--        01 10.81 GB       2
--        02  5.61 GB       2
--        04  2.97 GB       2
--        06  2.14 GB       2
--        08  1.60 GB       2
--        12  1.07 GB       2
--        16  0.81 GB       2
--        20  0.65 GB       2
--        24  0.54 GB       2
--        32  0.41 GB       2
--        40  0.32 GB       2
--        48  -.-- GB       -  (segment size too small)
--        56  -.-- GB       -  (segment size too small)
--        64  -.-- GB       -  (segment size too small)
--        96  -.-- GB       -  (segment size too small)
--
--  For 256873 reads with 4250009290 bases, limit to 42 batches.
--  Will count kmers using 01 jobs, each using 12 GB and 4 threads.
--
-- Finished stage 'merylConfigure', reset canuIteration.
--
-- Running jobs.  First attempt out of 2.
----------------------------------------
-- Starting 'meryl' concurrent execution on Thu Jan 15 23:41:18 2026 with 4568479.062 GB free disk space (1 processes; 22 concurrently)

    cd unitigging/0-mercounts
    ./meryl-count.sh 1 > ./meryl-count.000001.out 2>&1

-- Finished on Thu Jan 15 23:44:40 2026 (202 seconds) with 4567685 GB free disk space
----------------------------------------
-- Found 1 Kmer counting (meryl) outputs.
-- Finished stage 'utg-merylCountCheck', reset canuIteration.
--
-- Running jobs.  First attempt out of 2.
----------------------------------------
-- Starting 'meryl' concurrent execution on Thu Jan 15 23:44:40 2026 with 4567684.968 GB free disk space (1 processes; 22 concurrently)

    cd unitigging/0-mercounts
    ./meryl-process.sh 1 > ./meryl-process.000001.out 2>&1

-- Finished on Thu Jan 15 23:44:47 2026 (7 seconds) with 4567626.703 GB free disk space
----------------------------------------
-- Meryl finished successfully.  Kmer frequency histogram:
--
-- WARNING: gnuplot failed.
--
----------------------------------------
--
--  22-mers                                                                                           Fraction
--    Occurrences   NumMers                                                                         Unique Total
--       1-     1         0                                                                        0.0000 0.0000
--       2-     2    215561                                                                        0.0048 0.0001
--       3-     4     59635                                                                        0.0058 0.0002
--       5-     7     14030                                                                        0.0063 0.0002
--       8-    11      6610                                                                        0.0065 0.0002
--      12-    16     12241                                                                        0.0066 0.0003
--      17-    22    100288                                                                        0.0070 0.0003
--      23-    29    782633 ***                                                                    0.0101 0.0013
--      30-    37   5064988 ***********************                                                0.0326 0.0101
--      38-    46  15265088 ********************************************************************** 0.1661 0.0761
--      47-    56  14537464 ******************************************************************     0.5206 0.2905
--      57-    67   3955094 ******************                                                     0.8201 0.5075
--      68-    79    705233 ***                                                                    0.8931 0.5701
--      80-    92    917127 ****                                                                   0.9077 0.5853
--      93-   106    837637 ***                                                                    0.9286 0.6107
--     107-   121    358544 *                                                                      0.9464 0.6356
--     122-   137    256122 *                                                                      0.9539 0.6474
--     138-   154    261223 *                                                                      0.9596 0.6580
--     155-   172    176175                                                                        0.9653 0.6697
--     173-   191    144859                                                                        0.9692 0.6785
--     192-   211    119905                                                                        0.9724 0.6867
--     212-   232    119246                                                                        0.9750 0.6941
--     233-   254    104275                                                                        0.9777 0.7024
--     255-   277    105394                                                                        0.9800 0.7103
--     278-   301     78488                                                                        0.9823 0.7190
--     302-   326     68239                                                                        0.9840 0.7259
--     327-   352     56615                                                                        0.9855 0.7326
--     353-   379     52705                                                                        0.9868 0.7385
--     380-   407     42130                                                                        0.9880 0.7445
--     408-   436     41415                                                                        0.9889 0.7496
--     437-   466     36267                                                                        0.9898 0.7551
--     467-   497     33862                                                                        0.9906 0.7602
--     498-   529     29747                                                                        0.9914 0.7652
--     530-   562     23117                                                                        0.9920 0.7700
--     563-   596     20608                                                                        0.9925 0.7739
--     597-   631     15429                                                                        0.9930 0.7776
--     632-   667     15501                                                                        0.9933 0.7805
--     668-   704     14101                                                                        0.9937 0.7836
--     705-   742     13122                                                                        0.9940 0.7867
--     743-   781     15241                                                                        0.9943 0.7896
--     782-   821     13361                                                                        0.9946 0.7932
--
--           0 (max occurrences)
--  3210356669 (total mers, non-unique)
--    44918260 (distinct mers, non-unique)
--           0 (unique mers)
-- Finished stage 'meryl-process', reset canuIteration.
--
-- Removing meryl database 'unitigging/0-mercounts/A1-17.ms22'.
--
-- OVERLAPPER (normal) (assembly) erate=0.01
--
----------------------------------------
-- Starting command on Thu Jan 15 23:44:47 2026 with 4567626.687 GB free disk space

    cd unitigging/1-overlapper
    /share/org/YZWL/yzwl_lixg/miniforge3/envs/canu_v.2.3/bin/overlapInCorePartition \
     -S  ../../A1-17.seqStore \
     -hl 160000000 \
     -rl 5000000000 \
     -ol 500 \
     -o  ./A1-17.partition \
    > ./A1-17.partition.err 2>&1

-- Finished on Thu Jan 15 23:44:47 2026 (like a bat out of hell) with 4567626.671 GB free disk space
----------------------------------------
--
-- Configured 21 overlapInCore jobs.
-- Finished stage 'utg-overlapConfigure', reset canuIteration.
--
-- Running jobs.  First attempt out of 2.
----------------------------------------
-- Starting 'utgovl' concurrent execution on Thu Jan 15 23:44:47 2026 with 4567626.64 GB free disk space (21 processes; 11 concurrently)

    cd unitigging/1-overlapper
    ./overlap.sh 1 > ./overlap.000001.out 2>&1
    ./overlap.sh 2 > ./overlap.000002.out 2>&1
    ./overlap.sh 3 > ./overlap.000003.out 2>&1
    ./overlap.sh 4 > ./overlap.000004.out 2>&1
    ./overlap.sh 5 > ./overlap.000005.out 2>&1
    ./overlap.sh 6 > ./overlap.000006.out 2>&1
    ./overlap.sh 7 > ./overlap.000007.out 2>&1
    ./overlap.sh 8 > ./overlap.000008.out 2>&1
    ./overlap.sh 9 > ./overlap.000009.out 2>&1
    ./overlap.sh 10 > ./overlap.000010.out 2>&1
    ./overlap.sh 11 > ./overlap.000011.out 2>&1
    ./overlap.sh 12 > ./overlap.000012.out 2>&1
    ./overlap.sh 13 > ./overlap.000013.out 2>&1
    ./overlap.sh 14 > ./overlap.000014.out 2>&1
    ./overlap.sh 15 > ./overlap.000015.out 2>&1
    ./overlap.sh 16 > ./overlap.000016.out 2>&1
    ./overlap.sh 17 > ./overlap.000017.out 2>&1
    ./overlap.sh 18 > ./overlap.000018.out 2>&1
    ./overlap.sh 19 > ./overlap.000019.out 2>&1
    ./overlap.sh 20 > ./overlap.000020.out 2>&1
    ./overlap.sh 21 > ./overlap.000021.out 2>&1

-- Finished on Fri Jan 16 00:19:21 2026 (2074 seconds) with 4564832.14 GB free disk space
----------------------------------------
-- Found 21 overlapInCore output files.
--
-- overlapInCore compute 'unitigging/1-overlapper':
--   kmer hits
--     with no overlap       1396947682  18.1904762 +- 42024737.664
--     with an overlap         52196522  8.66666667 +- 1431834.761
--
--   overlaps                  52196522  8.66666667 +- 1431834.761
--     contained               12624620  .380952381 +- 346221.131
--     dovetail                39571902  6.28571429 +- 1095168.608
--
--   overlaps rejected
--     multiple per pair              0           0 +- 0
--     bad short window               0           0 +- 0
--     bad long window                0           0 +- 0
-- Finished stage 'utg-overlapCheck', reset canuIteration.
----------------------------------------
-- Starting command on Fri Jan 16 00:19:22 2026 with 4564832.125 GB free disk space

    cd unitigging
    /share/org/YZWL/yzwl_lixg/miniforge3/envs/canu_v.2.3/bin/ovStoreConfig \
     -S ../A1-17.seqStore \
     -M 4-8 \
     -L ./1-overlapper/ovljob.files \
     -create ./A1-17.ovlStore.config \
     > ./A1-17.ovlStore.config.txt \
    2> ./A1-17.ovlStore.config.err

-- Finished on Fri Jan 16 00:19:22 2026 (furiously fast) with 4564832.109 GB free disk space
----------------------------------------
--
-- Creating overlap store unitigging/A1-17.ovlStore using:
--      1 bucket
--      1 slice
--        using at most 4 GB memory each
--
-- Running jobs.  First attempt out of 2.
----------------------------------------
-- Starting 'ovS' concurrent execution on Fri Jan 16 00:19:22 2026 with 4564832.093 GB free disk space (1 processes; 62 concurrently)

    cd unitigging
    ./A1-17.ovlStore.sh 1 > ./A1-17.ovlStore.000001.out 2>&1

-- Finished on Fri Jan 16 00:19:43 2026 (21 seconds) with 4564804.906 GB free disk space
----------------------------------------
-- Checking store.
----------------------------------------
-- Starting command on Fri Jan 16 00:19:43 2026 with 4564804.906 GB free disk space

    cd unitigging
    /share/org/YZWL/yzwl_lixg/miniforge3/envs/canu_v.2.3/bin/ovStoreDump \
     -S ../A1-17.seqStore \
     -O  ./A1-17.ovlStore \
     -counts \
     > ./A1-17.ovlStore/counts.dat 2> ./A1-17.ovlStore/counts.err

-- Finished on Fri Jan 16 00:19:44 2026 (one second) with 4564804.875 GB free disk space
----------------------------------------
--
-- Overlap store 'unitigging/A1-17.ovlStore' successfully constructed.
-- Found 104393044 overlaps for 254491 reads; 1235230 reads have no overlaps.
--
--
-- Purged 0.986 GB in 63 overlap output files.
----------------------------------------
-- Starting command on Fri Jan 16 00:19:44 2026 with 4564805.937 GB free disk space

    cd unitigging
    /share/org/YZWL/yzwl_lixg/miniforge3/envs/canu_v.2.3/bin/ovStoreStats \
     -C 50 \
     -S ../A1-17.seqStore \
     -O  ./A1-17.ovlStore \
     -o  ./A1-17.ovlStore \
     > ./A1-17.ovlStore.summary.err 2>&1

-- Finished on Fri Jan 16 00:20:00 2026 (16 seconds) with 4564731.921 GB free disk space
----------------------------------------
--
-- Overlap store 'unitigging/A1-17.ovlStore' contains:
--
--   category            reads     %          read length        feature size or coverage  analysis
--   ----------------  -------  -------  ----------------------  ------------------------  --------------------
--   middle-missing        118    0.05    14764.78 +- 5549.65        667.25 +- 794.39     (bad trimming)
--   middle-hump             3    0.00    16788.00 +- 4043.36      10577.00 +- 3088.18    (bad trimming)
--   no-5-prime            394    0.15    12743.51 +- 5873.91        874.89 +- 1813.42    (bad trimming)
--   no-3-prime            371    0.14    10408.59 +- 6689.41        738.86 +- 1697.59    (bad trimming)
--   
--   low-coverage          524    0.20     6892.38 +- 5393.06          5.86 +- 3.86       (easy to assemble, potential for lower quality consensus)
--   unique             206166   80.26    12672.00 +- 5963.39         46.32 +- 8.69       (easy to assemble, perfect, yay)
--   repeat-cont         22684    8.83    10688.24 +- 5236.96       2060.33 +- 1521.41    (potential for consensus errors, no impact on assembly)
--   repeat-dove           288    0.11    21017.02 +- 1642.05        839.03 +- 1075.06    (hard to assemble, likely won't assemble correctly or even at all)
--   
--   span-repeat          2980    1.16    14474.83 +- 4969.29       2631.44 +- 3454.44    (read spans a large repeat, usually easy to assemble)
--   uniq-repeat-cont    13375    5.21    12720.04 +- 4865.05                             (should be uniquely placed, low potential for consensus errors, no impact on assembly)
--   uniq-repeat-dove     2898    1.13    19213.22 +- 2697.49                             (will end contigs, potential to misassemble)
--   uniq-anchor          4690    1.83    13742.99 +- 4837.78       8499.78 +- 5129.12    (repeat read, with unique section, probable bad read)
-- Finished stage 'utg-createOverlapStore', reset canuIteration.
--
-- Loading read lengths.
-- Loading number of overlaps per read.
--
-- Configure RED for 16gb memory.
--                   Batches of at most (unlimited) reads.
--                                      500000000 bases.
--                   Expecting evidence of at most 536870912 bases per iteration.
--
--           Total                                               Reads                 Olaps Evidence
--    Job   Memory      Read Range         Reads        Bases   Memory        Olaps   Memory   Memory  (Memory in MB)
--   ---- -------- ------------------- --------- ------------ -------- ------------ -------- --------
--      1 16384.67         1-32160          5537    108840573 13286.38      2297574    26.29  1024.00
--      2 16384.21     32161-68638          6218    108877458 13290.90      1861881    21.31  1024.00
--      3 16386.27     68639-108024         6816    108841111 13286.48      2428324    27.79  1024.00
--      4 16386.01    108025-141659         5747    108761480 13276.73      3258068    37.29  1024.00
--      5 16384.32    141660-178524         6436    108835086 13285.74      2323327    26.59  1024.00
--      6 16385.43    178525-228911         8607    108713146 13270.92      3715018    42.52  1024.00
--      7 16385.23    228912-261149         5656    108772277 13278.04      3074675    35.19  1024.00
--      8 16384.44    261150-295705         6076    108837746 13286.05      2305754    26.39  1024.00
--      9 16384.30    295706-347154         8982    108735157 13273.62      3379944    38.68  1024.00
--     10 16386.63    347155-379877         5592    108886535 13291.99      1977968    22.64  1024.00
--     11 16386.17    379878-413938         5798    108778420 13278.80      3090863    35.37  1024.00
--     12 16385.12    413939-455322         7120    108959171 13300.90      1067579    12.22  1024.00
--     13 16385.39    455323-497210         7200    108778679 13278.87      3016067    34.52  1024.00
--     14 16384.88    497211-530019         5696    108761310 13276.71      3161329    36.18  1024.00
--     15 16384.68    530020-565865         6286    108838504 13286.15      2318711    26.54  1024.00
--     16 16384.49    565866-613794         8320    108751704 13275.62      3222358    36.88  1024.00
--     17 16384.06    613795-646377         5564    108770287 13277.80      2994272    34.27  1024.00
--     18 16386.62    646378-681391         6055    108867270 13289.65      2181558    24.97  1024.00
--     19 16386.11    681392-733231         8812    108748593 13275.25      3395430    38.86  1024.00
--     20 16386.21    733232-765222         5500    108911764 13295.07      1672515    19.14  1024.00
--     21 16385.05    765223-798733         5755    108760782 13276.64      3180805    36.40  1024.00
--     22 16385.91    798734-840320         7106    108963106 13301.38      1094175    12.52  1024.00
--     23 16385.66    840321-881696         7171    108782293 13279.31      3000772    34.34  1024.00
--     24 16385.29    881697-914372         5717    108737955 13273.86      3445744    39.43  1024.00
--     25 16384.05    914373-951182         6333    108834196 13285.62      2309022    26.42  1024.00
--     26 16386.00    951183-999204         8227    108734410 13273.50      3538439    40.49  1024.00
--     27 16385.62    999205-1031097        5531    108779888 13278.97      3027489    34.65  1024.00
--     28 16385.75   1031098-1064656        5899    108865930 13289.48      2120667    24.27  1024.00
--     29 16384.99   1064657-1112813        8284    108736862 13273.80      3424442    39.19  1024.00
--     30 16384.37   1112814-1144906        5491    108872951 13290.33      1925962    22.04  1024.00
--     31 16384.23   1144907-1178127        5675    108765415 13277.21      3059983    35.02  1024.00
--     32 16384.19   1178128-1216368        6579    108943466 13298.97      1155524    13.22  1024.00
--     33 16384.98   1216369-1257285        6977    108778180 13278.81      2986522    34.18  1024.00
--     34 16385.42   1257286-1289565        5632    108772829 13278.11      3085354    35.31  1024.00
--     35 16384.21   1289566-1324657        6145    108841079 13286.46      2250410    25.75  1024.00
--     36 16385.65   1324658-1370542        7960    108733620 13273.40      3517628    40.26  1024.00
--     37 16385.24   1370543-1402811        5568    108784560 13279.54      2944432    33.70  1024.00
--     38 16384.26   1402812-1437347        5894    108864581 13289.32      2004831    22.94  1024.00
--     39 16385.69   1437348-1486806        8401    108743280 13274.59      3416544    39.10  1024.00
--     40  3860.92   1486807-1489721         510      6447636   787.08       161084     1.84  1024.00
--   ---- -------- ------------------- --------- ------------ -------- ------------ -------- --------
--                                                 4250009290             104393044
-- Finished stage 'readErrorDetectionConfigure', reset canuIteration.
--
-- Running jobs.  First attempt out of 2.
----------------------------------------
-- Starting 'red' concurrent execution on Fri Jan 16 00:20:05 2026 with 4564731.875 GB free disk space (40 processes; 22 concurrently)

    cd unitigging/3-overlapErrorAdjustment
    ./red.sh 1 > ./red.000001.out 2>&1
    ./red.sh 2 > ./red.000002.out 2>&1
    ./red.sh 3 > ./red.000003.out 2>&1
    ./red.sh 4 > ./red.000004.out 2>&1
    ./red.sh 5 > ./red.000005.out 2>&1
    ./red.sh 6 > ./red.000006.out 2>&1
    ./red.sh 7 > ./red.000007.out 2>&1
    ./red.sh 8 > ./red.000008.out 2>&1
    ./red.sh 9 > ./red.000009.out 2>&1
    ./red.sh 10 > ./red.000010.out 2>&1
    ./red.sh 11 > ./red.000011.out 2>&1
    ./red.sh 12 > ./red.000012.out 2>&1
    ./red.sh 13 > ./red.000013.out 2>&1
    ./red.sh 14 > ./red.000014.out 2>&1
    ./red.sh 15 > ./red.000015.out 2>&1
    ./red.sh 16 > ./red.000016.out 2>&1
    ./red.sh 17 > ./red.000017.out 2>&1
    ./red.sh 18 > ./red.000018.out 2>&1
    ./red.sh 19 > ./red.000019.out 2>&1
    ./red.sh 20 > ./red.000020.out 2>&1
    ./red.sh 21 > ./red.000021.out 2>&1
    ./red.sh 22 > ./red.000022.out 2>&1
    ./red.sh 23 > ./red.000023.out 2>&1
    ./red.sh 24 > ./red.000024.out 2>&1
    ./red.sh 25 > ./red.000025.out 2>&1
    ./red.sh 26 > ./red.000026.out 2>&1
    ./red.sh 27 > ./red.000027.out 2>&1
    ./red.sh 28 > ./red.000028.out 2>&1
    ./red.sh 29 > ./red.000029.out 2>&1
    ./red.sh 30 > ./red.000030.out 2>&1
    ./red.sh 31 > ./red.000031.out 2>&1
    ./red.sh 32 > ./red.000032.out 2>&1
    ./red.sh 33 > ./red.000033.out 2>&1
    ./red.sh 34 > ./red.000034.out 2>&1
    ./red.sh 35 > ./red.000035.out 2>&1
    ./red.sh 36 > ./red.000036.out 2>&1
    ./red.sh 37 > ./red.000037.out 2>&1
    ./red.sh 38 > ./red.000038.out 2>&1
    ./red.sh 39 > ./red.000039.out 2>&1
    ./red.sh 40 > ./red.000040.out 2>&1

-- Finished on Fri Jan 16 00:38:00 2026 (1075 seconds) with 4562322.015 GB free disk space
----------------------------------------
-- Found 40 read error detection output files.
-- Finished stage 'readErrorDetectionCheck', reset canuIteration.
--
-- Loading read lengths.
-- Loading number of overlaps per read.
--
-- Configure OEA for 8gb memory.
--                   Batches of at most (unlimited) reads.
--                                      300000000 bases.
--
--           Total                                               Reads                 Olaps  Adjusts
--    Job   Memory      Read Range         Reads        Bases   Memory        Olaps   Memory   Memory  (Memory in MB)
--   ---- -------- ------------------- --------- ------------ -------- ------------ -------- --------
--      1  2900.90         1-100233        17201    300023854   294.65      6419668   195.91   362.34
--      2  2930.12    100234-208446        18658    300001732   294.67      7376289   225.11   362.34
--      3  2940.16    208447-306240        17073    300006213   294.63      7706912   235.20   362.34
--      4  2956.09    306241-414993        18710    300007270   294.68      8227271   251.08   362.34
--      5  2920.21    414994-522431        18589    300015013   294.68      7051224   215.19   362.34
--      6  2890.57    522432-631507        18854    300023137   294.70      6079695   185.54   362.34
--      7  2961.68    631508-742609        19057    300021811   294.70      8409460   256.64   362.34
--      8  2894.20    742610-842620        17158    300003362   294.63      6200923   189.24   362.34
--      9  2954.52    842621-943437        17488    300005382   294.64      8176983   249.54   362.34
--     10  2944.73    943438-1049861       18370    300017377   294.68      7854854   239.71   362.34
--     11  2933.94   1049862-1155811       18185    300003763   294.66      7501897   228.94   362.34
--     12  2889.90   1155812-1260167       17887    300003214   294.65      6059310   184.92   362.34
--     13  2970.42   1260168-1365592       18415    300017390   294.68      8696665   265.40   362.34
--     14  2881.98   1365593-1462294       16524    300019882   294.63      5800540   177.02   362.34
--     15  2552.42   1462295-1489721        4704     49839890    55.67      2831353    86.41   362.34
--   ---- -------- ------------------- --------- ------------ -------- ------------ -------- --------
--                                                 4250009290             104393044
-- Finished stage 'overlapErrorAdjustmentConfigure', reset canuIteration.
--
-- Running jobs.  First attempt out of 2.
----------------------------------------
-- Starting 'oea' concurrent execution on Fri Jan 16 00:38:07 2026 with 4562321.937 GB free disk space (15 processes; 62 concurrently)

    cd unitigging/3-overlapErrorAdjustment
    ./oea.sh 1 > ./oea.000001.out 2>&1
    ./oea.sh 2 > ./oea.000002.out 2>&1
    ./oea.sh 3 > ./oea.000003.out 2>&1
    ./oea.sh 4 > ./oea.000004.out 2>&1
    ./oea.sh 5 > ./oea.000005.out 2>&1
    ./oea.sh 6 > ./oea.000006.out 2>&1
    ./oea.sh 7 > ./oea.000007.out 2>&1
    ./oea.sh 8 > ./oea.000008.out 2>&1
    ./oea.sh 9 > ./oea.000009.out 2>&1
    ./oea.sh 10 > ./oea.000010.out 2>&1
    ./oea.sh 11 > ./oea.000011.out 2>&1
    ./oea.sh 12 > ./oea.000012.out 2>&1
    ./oea.sh 13 > ./oea.000013.out 2>&1
    ./oea.sh 14 > ./oea.000014.out 2>&1
    ./oea.sh 15 > ./oea.000015.out 2>&1

-- Finished on Fri Jan 16 01:28:56 2026 (3049 seconds) with 4559498.468 GB free disk space
----------------------------------------
-- Found 15 overlap error adjustment output files.
-- Finished stage 'overlapErrorAdjustmentCheck', reset canuIteration.
----------------------------------------
-- Starting command on Fri Jan 16 01:28:56 2026 with 4559498.453 GB free disk space

    cd unitigging/3-overlapErrorAdjustment
    /share/org/YZWL/yzwl_lixg/miniforge3/envs/canu_v.2.3/bin/loadErates \
      -S ../../A1-17.seqStore \
      -O ../A1-17.ovlStore \
      -L ./oea.files \
    > ./oea.apply.err 2>&1

-- Finished on Fri Jan 16 01:28:56 2026 (in the blink of an eye) with 4559498.25 GB free disk space
----------------------------------------
-- No report available.
-- Finished stage 'updateOverlapStore', reset canuIteration.
-- Finished stage 'unitig', reset canuIteration.
--
-- Running jobs.  First attempt out of 2.
----------------------------------------
-- Starting 'bat' concurrent execution on Fri Jan 16 01:28:56 2026 with 4559498.203 GB free disk space (1 processes; 1 concurrently)

    cd unitigging/4-unitigger
    ./unitigger.sh 1 > ./unitigger.000001.out 2>&1

-- Finished on Fri Jan 16 01:29:22 2026 (26 seconds) with 4559541.437 GB free disk space
----------------------------------------
-- Unitigger finished successfully.
--  
--  ERROR RATES
--  -----------
--                                                   --------threshold------
--  288330                       fraction error      fraction        percent
--  samples                              (1e-5)         error          error
--                   --------------------------      --------       --------
--  command line (-eg)                           ->     30.00        0.0300%
--  command line (-ef)                           ->  -----.--      ---.----%
--  command line (-eM)                           ->     30.00        0.0300%
--  mean + std.dev       0.31 +-  12 *     2.54  ->     30.83        0.0308%
--  median + mad         0.00 +-  12 *     0.00  ->      0.00        0.0000%
--  90th percentile                              ->      1.00        0.0010%  (enabled)
--  
--  BEST EDGE FILTERING
--  -------------------
--  At graph threshold 0.0300%, reads:
--    available to have edges:        40751
--    with at least one edge:         37590
--  
--  At max threshold 0.0300%, reads:  (not computed)
--    available to have edges:            0
--    with at least one edge:             0
--  
--  At tight threshold 0.0010%, reads with:
--    both edges below error threshold:     33746  (80.00% minReadsBest threshold = 30072)
--    one  edge  above error threshold:      2729
--    both edges above error threshold:      1115
--    at least one edge:                    37590
--  
--  At loose threshold 0.0300%, reads with:
--    both edges below error threshold:     37590  (80.00% minReadsBest threshold = 30072)
--    one  edge  above error threshold:         0
--    both edges above error threshold:         0
--    at least one edge:                    37590
--  
--  
--  INITIAL EDGES
--  -------- ----------------------------------------
--    211121 reads are contained
--   1245387 reads have no best edges (singleton)
--       255 reads have only one best edge (spur) 
--                100 are mutual best
--     32958 reads have two best edges 
--                684 have one mutual best edge
--              31859 have two mutual best edges
--  
--  
--  FINAL EDGES
--  -------- ----------------------------------------
--    211121 reads are contained
--   1245741 reads have no best edges (singleton)
--       153 reads have only one best edge (spur) 
--                123 are mutual best
--     32706 reads have two best edges 
--                553 have one mutual best edge
--              31858 have two mutual best edges
--  
--  
--  EDGE FILTERING
--  -------- ------------------------------------------
--         0 reads are ignored
--      9642 reads have a gap in overlap coverage
--       185 reads have lopsided best edges
-- Found, in version 1, after unitig construction:
--   contigs:      106 sequences, total length 68625746 bp (including 120 repeats of total length 3070692 bp).
--   bubbles:      71 sequences, total length 2067032 bp.
--   unassembled:  12264 sequences, total length 146282088 bp.
--
-- Contig sizes based on genome size 85mbp:
--
--            NG (bp)  LG (contigs)    sum (bp)
--         ----------  ------------  ----------
--     10     6981997             2    14815963
--     20     6450229             3    21266192
--     30     6252852             4    27519044
--     40     4543181             6    36658754
--     50     3399688             8    44238699
--     60     2315648            11    51577508
--     70     1588404            16    61079548
--     80       19496            70    68004761
--
-- Finished stage 'unitigCheck', reset canuIteration.
----------------------------------------
-- Starting command on Fri Jan 16 01:29:22 2026 with 4559541.421 GB free disk space

    cd unitigging
    /share/org/YZWL/yzwl_lixg/miniforge3/envs/canu_v.2.3/bin/utgcns \
      -S ../A1-17.seqStore \
      -T  ./A1-17.ctgStore 1 \
      -partition 0.8 1.5 0.1 \
    > ./A1-17.ctgStore/partitioning.log 2>&1

-- Finished on Fri Jan 16 01:29:31 2026 (9 seconds) with 4559540.218 GB free disk space
----------------------------------------
-- Using slow alignment for consensus (iteration '0').
-- Configured 10 consensus jobs.
-- Finished stage 'consensusConfigure', reset canuIteration.
--
-- Local: cns       11.625 GB    8 CPUs x  11 jobs   127.875 GB  88 CPUs  (consensus)
--
--
-- Running jobs.  First attempt out of 2.
----------------------------------------
-- Starting 'cns' concurrent execution on Fri Jan 16 01:29:31 2026 with 4559540.187 GB free disk space (10 processes; 11 concurrently)

    cd unitigging/5-consensus
    ./consensus.sh 1 > ./consensus.000001.out 2>&1
    ./consensus.sh 2 > ./consensus.000002.out 2>&1
    ./consensus.sh 3 > ./consensus.000003.out 2>&1
    ./consensus.sh 4 > ./consensus.000004.out 2>&1
    ./consensus.sh 5 > ./consensus.000005.out 2>&1
    ./consensus.sh 6 > ./consensus.000006.out 2>&1
    ./consensus.sh 7 > ./consensus.000007.out 2>&1
    ./consensus.sh 8 > ./consensus.000008.out 2>&1
    ./consensus.sh 9 > ./consensus.000009.out 2>&1
    ./consensus.sh 10 > ./consensus.000010.out 2>&1

-- Finished on Fri Jan 16 01:36:41 2026 (430 seconds) with 4560144.765 GB free disk space
----------------------------------------
-- Using slow alignment for consensus (iteration '1').
-- Configured 10 consensus jobs.
-- All 10 consensus jobs finished successfully.
-- Finished stage 'consensusCheck', reset canuIteration.
-- Using slow alignment for consensus (iteration '0').
-- Configured 10 consensus jobs.
----------------------------------------
-- Starting command on Fri Jan 16 01:36:41 2026 with 4560144.718 GB free disk space

    cd unitigging
    /share/org/YZWL/yzwl_lixg/miniforge3/envs/canu_v.2.3/bin/tgStoreLoad \
      -S ../A1-17.seqStore \
      -T  ./A1-17.ctgStore 2 \
      -L ./5-consensus/ctgcns.files \
    > ./5-consensus/ctgcns.files.ctgStoreLoad.err 2>&1

-- Finished on Fri Jan 16 01:36:42 2026 (one second) with 4560144.093 GB free disk space
----------------------------------------
----------------------------------------
-- Starting command on Fri Jan 16 01:36:42 2026 with 4560144.093 GB free disk space

    cd unitigging
    /share/org/YZWL/yzwl_lixg/miniforge3/envs/canu_v.2.3/bin/tgTigDisplay \
      -S ../A1-17.seqStore \
      -b \
      -o ../A1-17.contigs.unsorted.bam \
      -L ./5-consensus/ctgcns.files \
    > ./5-consensus/ctgcns.files.contigs.bam.err 2>&1

-- Finished on Fri Jan 16 01:39:17 2026 (155 seconds) with 4560180.984 GB free disk space
----------------------------------------
----------------------------------------
-- Starting command on Fri Jan 16 01:39:17 2026 with 4560180.984 GB free disk space

    cd .
    samtools sort \
      --write-index \
      --threads 2 \
      -o ./A1-17.contigs.bam ./A1-17.contigs.unsorted.bam \
    > ./ctgcns.bam.err 2>&1

-- Finished on Fri Jan 16 01:40:30 2026 (73 seconds) with 4560095.343 GB free disk space
----------------------------------------
-- Purging consensus output after loading to ctgStore.
-- Purged 10 .cns outputs.
----------------------------------------
-- Starting command on Fri Jan 16 01:40:30 2026 with 4560097.25 GB free disk space

    cd unitigging
    /share/org/YZWL/yzwl_lixg/miniforge3/envs/canu_v.2.3/bin/tgStoreDump \
      -S ../A1-17.seqStore \
      -T ./A1-17.ctgStore 2 \
      -sizes -s 85000000 \
    > ./A1-17.ctgStore/seqDB.v002.sizes.txt
ZERO length suplied to intervalList::add(), ignoring interval.
ZERO length suplied to intervalList::add(), ignoring interval.
ZERO length suplied to intervalList::add(), ignoring interval.
ZERO length suplied to intervalList::add(), ignoring interval.
ZERO length suplied to intervalList::add(), ignoring interval.
ZERO length suplied to intervalList::add(), ignoring interval.
ZERO length suplied to intervalList::add(), ignoring interval.
ZERO length suplied to intervalList::add(), ignoring interval.
ZERO length suplied to intervalList::add(), ignoring interval.
ZERO length suplied to intervalList::add(), ignoring interval.
ZERO length suplied to intervalList::add(), ignoring interval.
ZERO length suplied to intervalList::add(), ignoring interval.

-- Finished on Fri Jan 16 01:40:30 2026 (fast as lightning) with 4560097.25 GB free disk space
----------------------------------------
-- Found, in version 2, after consensus generation:
--   contigs:      106 sequences, total length 89545489 bp (including 120 repeats of total length 4210630 bp).
--   bubbles:      71 sequences, total length 2780903 bp.
--   unassembled:  12264 sequences, total length 201377448 bp.
--
-- Contig sizes based on genome size 85mbp:
--
--            NG (bp)  LG (contigs)    sum (bp)
--         ----------  ------------  ----------
--     10    10210979             1    10210979
--     20     9081536             2    19292515
--     30     8378899             3    27671414
--     40     8120250             4    35791664
--     50     5896292             6    47676396
--     60     5440939             7    53117335
--     70     3317013             9    60873147
--     80     3006817            12    70124542
--     90     2333002            15    77465910
--    100     1031494            20    85625811
--
-- Finished stage 'consensusLoad', reset canuIteration.
----------------------------------------
-- Starting command on Fri Jan 16 01:40:30 2026 with 4560097.234 GB free disk space

    cd .
    /share/org/YZWL/yzwl_lixg/miniforge3/envs/canu_v.2.3/bin/tgStoreDump \
      -S ./A1-17.seqStore \
      -T ./unitigging/A1-17.ctgStore 2 \
      -o ./A1-17.contigs \
      -layout \
    > ./A1-17.contigs.layout.err 2>&1

-- Finished on Fri Jan 16 01:40:30 2026 (furiously fast) with 4560097.187 GB free disk space
----------------------------------------
----------------------------------------
-- Starting command on Fri Jan 16 01:40:30 2026 with 4560097.187 GB free disk space

    cd .
    /share/org/YZWL/yzwl_lixg/miniforge3/envs/canu_v.2.3/bin/tgStoreDump \
      -S ./A1-17.seqStore \
      -T ./unitigging/A1-17.ctgStore 2 \
      -consensus -fasta \
      -unassembled \
    > ./A1-17.unassembled.fasta
    2> ./A1-17.unassembled.err
ZERO length suplied to intervalList::add(), ignoring interval.
ZERO length suplied to intervalList::add(), ignoring interval.
ZERO length suplied to intervalList::add(), ignoring interval.
ZERO length suplied to intervalList::add(), ignoring interval.
ZERO length suplied to intervalList::add(), ignoring interval.
ZERO length suplied to intervalList::add(), ignoring interval.
ZERO length suplied to intervalList::add(), ignoring interval.
ZERO length suplied to intervalList::add(), ignoring interval.
ZERO length suplied to intervalList::add(), ignoring interval.
ZERO length suplied to intervalList::add(), ignoring interval.
ZERO length suplied to intervalList::add(), ignoring interval.
ZERO length suplied to intervalList::add(), ignoring interval.

-- Finished on Fri Jan 16 01:40:31 2026 (one second) with 4560096.984 GB free disk space
----------------------------------------
----------------------------------------
-- Starting command on Fri Jan 16 01:40:31 2026 with 4560096.984 GB free disk space

    cd .
    /share/org/YZWL/yzwl_lixg/miniforge3/envs/canu_v.2.3/bin/tgStoreDump \
      -S ./A1-17.seqStore \
      -T ./unitigging/A1-17.ctgStore 2 \
      -consensus -fasta \
      -contigs \
    > ./A1-17.contigs.fasta
    2> ./A1-17.contigs.err
ZERO length suplied to intervalList::add(), ignoring interval.
ZERO length suplied to intervalList::add(), ignoring interval.
ZERO length suplied to intervalList::add(), ignoring interval.
ZERO length suplied to intervalList::add(), ignoring interval.
ZERO length suplied to intervalList::add(), ignoring interval.
ZERO length suplied to intervalList::add(), ignoring interval.
ZERO length suplied to intervalList::add(), ignoring interval.
ZERO length suplied to intervalList::add(), ignoring interval.
ZERO length suplied to intervalList::add(), ignoring interval.
ZERO length suplied to intervalList::add(), ignoring interval.
ZERO length suplied to intervalList::add(), ignoring interval.
ZERO length suplied to intervalList::add(), ignoring interval.

-- Finished on Fri Jan 16 01:40:32 2026 (one second) with 4560096.875 GB free disk space
----------------------------------------
-- Finished stage 'generateOutputs', reset canuIteration.
--
-- Assembly 'A1-17' finished in '/share/org/YZWL/yzwl_lixg/project/28.大豆疫霉菌三代基因组/03.hicanu/A1-17/01.raw_output'.
--
-- Summary saved in 'A1-17.report'.
--
-- Sequences saved:
--   Contigs       -> 'A1-17.contigs.fasta'
--   Unassembled   -> 'A1-17.unassembled.fasta'
--
-- Read layouts saved:
--   Contigs       -> 'A1-17.contigs.layout'.
--
-- Bye.

2026-01-16 01:40:32.510 - WARNING - 输出文件不存在|Output file does not exist: /share/org/YZWL/yzwl_lixg/project/28.大豆疫霉菌三代基因组/03.hicanu/A1-17/01.raw_output/A1-17.unitigs.fasta
Usage: biopytools ragtag [OPTIONS]
Try 'biopytools ragtag -h' for help.

Error: Invalid value for '-r' / '--reference': 文件不存在|File does not exist: /share/org/YZWL/yzwl_lixg/project/28.大豆疫霉菌三代基因组/04.ragtag/Psoja_T2T.fa
Usage: biopytools genomesyn [OPTIONS]
Try 'biopytools genomesyn -h' for help.

Error: Invalid value for '-i' / '--ref': Path '04.ragtag/A1-17/hicanu/A1-17_RagTag_scaffolded.fa' does not exist.
Job 68886707 stderr output:

