Usage: biopytools ragtag [OPTIONS]
Try 'biopytools ragtag -h' for help.

Error: Invalid value for '-r' / '--reference': 文件不存在|File does not exist: /share/org/YZWL/yzwl_lixg/project/28.大豆疫霉菌三代基因组/04.ragtag/Psoja_T2T.fa
Usage: biopytools genomesyn [OPTIONS]
Try 'biopytools genomesyn -h' for help.

Error: Invalid value for '-i' / '--ref': Path '04.ragtag/A3-48/hifiasm/A3-48_RagTag_scaffolded.fa' does not exist.
2026-01-16 03:42:25.819 - WARNING - 命令错误输出|Command stderr:
-- canu master +27 changes (r10515 2a41e933b8de6ed66723d75d36dd071b46d2c347)
--
-- CITATIONS
--
-- For assemblies of PacBio HiFi reads:
--   Nurk S, Walenz BP, Rhiea A, Vollger MR, Logsdon GA, Grothe R, Miga KH, Eichler EE, Phillippy AM, Koren S.
--   HiCanu: accurate assembly of segmental duplications, satellites, and allelic variants from high-fidelity long reads.
--   biorXiv. 2020.
--   https://doi.org/10.1101/2020.03.14.992248
-- 
-- Read and contig alignments during correction and consensus use:
--   Šošic M, Šikic M.
--   Edlib: a C/C ++ library for fast, exact sequence alignment using edit distance.
--   Bioinformatics. 2017 May 1;33(9):1394-1395.
--   http://doi.org/10.1093/bioinformatics/btw753
-- 
-- Overlaps are generated using:
--   Berlin K, et al.
--   Assembling large genomes with single-molecule sequencing and locality-sensitive hashing.
--   Nat Biotechnol. 2015 Jun;33(6):623-30.
--   http://doi.org/10.1038/nbt.3238
-- 
--   Myers EW, et al.
--   A Whole-Genome Assembly of Drosophila.
--   Science. 2000 Mar 24;287(5461):2196-204.
--   http://doi.org/10.1126/science.287.5461.2196
-- 
-- Contig consensus sequences are generated using an algorithm derived from pbdagcon:
--   Chin CS, et al.
--   Nonhybrid, finished microbial genome assemblies from long-read SMRT sequencing data.
--   Nat Methods. 2013 Jun;10(6):563-9
--   http://doi.org/10.1038/nmeth.2474
-- 
-- CONFIGURE CANU
--
-- Detected Java(TM) Runtime Environment '17.0.15-internal' (from '/share/org/YZWL/yzwl_lixg/.local/bin/java') without -d64 support.
--
-- WARNING:
-- WARNING:  Failed to run gnuplot using command 'gnuplot'.
-- WARNING:  Plots will be disabled.
-- WARNING:
--
-- Detected samtools version '1.22' / htslib version 'htscodecs=1.6.3' (from 'samtools').
--
-- Detected 88 CPUs and 503 gigabytes of memory on the local machine.
--
-- Detected Slurm with 'sinfo' binary in /opt/skyformai/bin/sinfo.
--          Slurm disabled by useGrid=false
--
-- Detected  '' with 'pbsnodes' binary in /opt/skyformai/bin/pbsnodes.
--           disabled by useGrid=false
--
-- Detected LSF with 'bsub' binary in /opt/skyformai/bin/bsub.
--          LSF disabled by useGrid=false
--
-- Local machine mode enabled; grid support not detected or not allowed.
--
-- Found trimmed raw PacBio HiFi reads in the input files.
--
--                                (tag)Concurrency
--                         (tag)Threads          |
--                (tag)Memory         |          |
--        (tag)             |         |          |       total usage      algorithm
--        -------  ----------  --------   --------  --------------------  -----------------------------
-- Local: meryl     12.000 GB    4 CPUs x  22 jobs   264.000 GB  88 CPUs  (k-mer counting)
-- Local: cormhap   13.000 GB   11 CPUs x   8 jobs   104.000 GB  88 CPUs  (overlap detection with mhap)
-- Local: obtovl     8.000 GB    8 CPUs x  11 jobs    88.000 GB  88 CPUs  (overlap detection)
-- Local: utgovl     8.000 GB    8 CPUs x  11 jobs    88.000 GB  88 CPUs  (overlap detection)
-- Local: cor        -.--- GB    4 CPUs x   - jobs     -.--- GB   - CPUs  (read correction)
-- Local: ovb        4.000 GB    1 CPU  x  88 jobs   352.000 GB  88 CPUs  (overlap store bucketizer)
-- Local: ovs        8.000 GB    1 CPU  x  62 jobs   496.000 GB  62 CPUs  (overlap store sorting)
-- Local: red       16.000 GB    4 CPUs x  22 jobs   352.000 GB  88 CPUs  (read error detection)
-- Local: oea        8.000 GB    1 CPU  x  62 jobs   496.000 GB  62 CPUs  (overlap error adjustment)
-- Local: bat       32.000 GB    8 CPUs x   1 job     32.000 GB   8 CPUs  (contig construction with bogart)
-- Local: cns        -.--- GB    8 CPUs x   - jobs     -.--- GB   - CPUs  (consensus)
--
-- Generating assembly 'A3-48' in '/share/org/YZWL/yzwl_lixg/project/28.大豆疫霉菌三代基因组/03.hicanu/A3-48/01.raw_output':
--   genomeSize:
--     85000000
--
--   Overlap Generation Limits:
--     corOvlErrorRate 0.0000 (  0.00%)
--     obtOvlErrorRate 0.0250 (  2.50%)
--     utgOvlErrorRate 0.0100 (  1.00%)
--
--   Overlap Processing Limits:
--     corErrorRate    0.0000 (  0.00%)
--     obtErrorRate    0.0250 (  2.50%)
--     utgErrorRate    0.0003 (  0.03%)
--     cnsErrorRate    0.0500 (  5.00%)
--
--   Stages to run:
--     assemble HiFi reads.
--
--
-- BEGIN STORE CREATION
----------------------------------------
-- Starting command on Fri Jan 16 01:34:32 2026 with 4559897.734 GB free disk space

    cd .
    ./A3-48.seqStore.sh \
    > ./A3-48.seqStore.err 2>&1

-- Finished on Fri Jan 16 01:42:46 2026 (494 seconds) with 4559866.937 GB free disk space
----------------------------------------
--
-- In sequence store './A3-48.seqStore':
--   Found 239340 reads.
--   Found 4250014572 bases (50 times coverage).
--    Histogram of corrected reads:
--    
--    G=4250014572                       sum of  ||               length     num
--    NG         length     index       lengths  ||                range    seqs
--    ----- ------------ --------- ------------  ||  ------------------- -------
--    00010        27004     14492    425014489  ||       1228-2480         5032|------------
--    00020        24596     31040    850008339  ||       2481-3733         7759|-------------------
--    00030        22962     48952   1275007644  ||       3734-4986         7128|-----------------
--    00040        21697     68010   1700010711  ||       4987-6239         6333|---------------
--    00050        20613     88116   2125020658  ||       6240-7492         5744|--------------
--    00060        19618    109250   2550025877  ||       7493-8745         5229|-------------
--    00070        18567    131508   2975015265  ||       8746-9998         4868|------------
--    00080        17276    155194   3400019362  ||       9999-11251        4369|-----------
--    00090        14724    181374   3825016103  ||      11252-12504        3915|----------
--    00100         1228    239340   4250014572  ||      12505-13757        3722|---------
--    001.000x              239340   4250014572  ||      13758-15010        5503|-------------
--                                               ||      15011-16263       10689|--------------------------
--                                               ||      16264-17516       17816|------------------------------------------
--                                               ||      17517-18769       23964|---------------------------------------------------------
--                                               ||      18770-20022       26781|---------------------------------------------------------------
--                                               ||      20023-21275       25078|-----------------------------------------------------------
--                                               ||      21276-22528       20504|-------------------------------------------------
--                                               ||      22529-23781       15831|--------------------------------------
--                                               ||      23782-25034       11859|----------------------------
--                                               ||      25035-26287        8769|---------------------
--                                               ||      26288-27540        6472|----------------
--                                               ||      27541-28793        4549|-----------
--                                               ||      28794-30046        3180|--------
--                                               ||      30047-31299        2039|-----
--                                               ||      31300-32552        1102|---
--                                               ||      32553-33805         672|--
--                                               ||      33806-35058         273|-
--                                               ||      35059-36311         106|-
--                                               ||      36312-37564          32|-
--                                               ||      37565-38817           8|-
--                                               ||      38818-40070           4|-
--                                               ||      40071-41323           5|-
--                                               ||      41324-42576           1|-
--                                               ||      42577-43829           1|-
--                                               ||      43830-45082           1|-
--                                               ||      45083-46335           1|-
--                                               ||      46336-47588           0|
--                                               ||      47589-48841           0|
--                                               ||      48842-50094           0|
--                                               ||      50095-51347           1|-
--    
--
-- In sequence store './A3-48.seqStore':
--   Found 239340 reads.
--   Found 4250014572 bases (50 times coverage).
--    Histogram of corrected-trimmed reads:
--    
--    G=4250014572                       sum of  ||               length     num
--    NG         length     index       lengths  ||                range    seqs
--    ----- ------------ --------- ------------  ||  ------------------- -------
--    00010        27004     14492    425014489  ||       1228-2480         5032|------------
--    00020        24596     31040    850008339  ||       2481-3733         7759|-------------------
--    00030        22962     48952   1275007644  ||       3734-4986         7128|-----------------
--    00040        21697     68010   1700010711  ||       4987-6239         6333|---------------
--    00050        20613     88116   2125020658  ||       6240-7492         5744|--------------
--    00060        19618    109250   2550025877  ||       7493-8745         5229|-------------
--    00070        18567    131508   2975015265  ||       8746-9998         4868|------------
--    00080        17276    155194   3400019362  ||       9999-11251        4369|-----------
--    00090        14724    181374   3825016103  ||      11252-12504        3915|----------
--    00100         1228    239340   4250014572  ||      12505-13757        3722|---------
--    001.000x              239340   4250014572  ||      13758-15010        5503|-------------
--                                               ||      15011-16263       10689|--------------------------
--                                               ||      16264-17516       17816|------------------------------------------
--                                               ||      17517-18769       23964|---------------------------------------------------------
--                                               ||      18770-20022       26781|---------------------------------------------------------------
--                                               ||      20023-21275       25078|-----------------------------------------------------------
--                                               ||      21276-22528       20504|-------------------------------------------------
--                                               ||      22529-23781       15831|--------------------------------------
--                                               ||      23782-25034       11859|----------------------------
--                                               ||      25035-26287        8769|---------------------
--                                               ||      26288-27540        6472|----------------
--                                               ||      27541-28793        4549|-----------
--                                               ||      28794-30046        3180|--------
--                                               ||      30047-31299        2039|-----
--                                               ||      31300-32552        1102|---
--                                               ||      32553-33805         672|--
--                                               ||      33806-35058         273|-
--                                               ||      35059-36311         106|-
--                                               ||      36312-37564          32|-
--                                               ||      37565-38817           8|-
--                                               ||      38818-40070           4|-
--                                               ||      40071-41323           5|-
--                                               ||      41324-42576           1|-
--                                               ||      42577-43829           1|-
--                                               ||      43830-45082           1|-
--                                               ||      45083-46335           1|-
--                                               ||      46336-47588           0|
--                                               ||      47589-48841           0|
--                                               ||      48842-50094           0|
--                                               ||      50095-51347           1|-
--    
--
-- Correction skipped; not enabled.
--
-- Trimming skipped; not enabled.
--
-- BEGIN ASSEMBLY
----------------------------------------
-- Starting command on Fri Jan 16 01:42:47 2026 with 4559866.89 GB free disk space

    cd unitigging/0-mercounts
    ./meryl-configure.sh \
    > ./meryl-configure.err 2>&1

-- Finished on Fri Jan 16 01:42:49 2026 (2 seconds) with 4559866.89 GB free disk space
----------------------------------------
--  segments   memory batches
--  -------- -------- -------
--        01 10.81 GB       2
--        02  5.61 GB       2
--        04  2.97 GB       2
--        06  2.14 GB       2
--        08  1.60 GB       2
--        12  1.07 GB       2
--        16  0.81 GB       2
--        20  0.65 GB       2
--        24  0.54 GB       2
--        32  0.41 GB       2
--        40  0.32 GB       2
--        48  -.-- GB       -  (segment size too small)
--        56  -.-- GB       -  (segment size too small)
--        64  -.-- GB       -  (segment size too small)
--        96  -.-- GB       -  (segment size too small)
--
--  For 239340 reads with 4250014572 bases, limit to 42 batches.
--  Will count kmers using 01 jobs, each using 12 GB and 4 threads.
--
-- Finished stage 'merylConfigure', reset canuIteration.
--
-- Running jobs.  First attempt out of 2.
----------------------------------------
-- Starting 'meryl' concurrent execution on Fri Jan 16 01:42:49 2026 with 4559866.859 GB free disk space (1 processes; 22 concurrently)

    cd unitigging/0-mercounts
    ./meryl-count.sh 1 > ./meryl-count.000001.out 2>&1

-- Finished on Fri Jan 16 01:46:15 2026 (206 seconds) with 4559545.984 GB free disk space
----------------------------------------
-- Found 1 Kmer counting (meryl) outputs.
-- Finished stage 'utg-merylCountCheck', reset canuIteration.
--
-- Running jobs.  First attempt out of 2.
----------------------------------------
-- Starting 'meryl' concurrent execution on Fri Jan 16 01:46:15 2026 with 4559545.953 GB free disk space (1 processes; 22 concurrently)

    cd unitigging/0-mercounts
    ./meryl-process.sh 1 > ./meryl-process.000001.out 2>&1

-- Finished on Fri Jan 16 01:46:22 2026 (7 seconds) with 4559546.687 GB free disk space
----------------------------------------
-- Meryl finished successfully.  Kmer frequency histogram:
--
-- WARNING: gnuplot failed.
--
----------------------------------------
--
--  22-mers                                                                                           Fraction
--    Occurrences   NumMers                                                                         Unique Total
--       1-     1         0                                                                        0.0000 0.0000
--       2-     2    248384 *                                                                      0.0055 0.0002
--       3-     4     86943                                                                        0.0068 0.0002
--       5-     7     30649                                                                        0.0078 0.0003
--       8-    11     11042                                                                        0.0082 0.0003
--      12-    16     19835                                                                        0.0084 0.0004
--      17-    22    141542                                                                        0.0090 0.0005
--      23-    29    943202 ***                                                                    0.0131 0.0017
--      30-    37   6067228 *************************                                              0.0403 0.0124
--      38-    46  16518378 ********************************************************************** 0.1988 0.0911
--      47-    56  13247951 ********************************************************               0.5762 0.3198
--      57-    67   2981760 ************                                                           0.8420 0.5123
--      68-    79    722766 ***                                                                    0.8958 0.5584
--      80-    92    968635 ****                                                                   0.9120 0.5754
--      93-   106    761001 ***                                                                    0.9335 0.6016
--     107-   121    304834 *                                                                      0.9494 0.6238
--     122-   137    281307 *                                                                      0.9559 0.6342
--     138-   154    238826 *                                                                      0.9621 0.6458
--     155-   172    153058                                                                        0.9673 0.6564
--     173-   191    148291                                                                        0.9706 0.6640
--     192-   211    125896                                                                        0.9739 0.6724
--     212-   232    112862                                                                        0.9767 0.6803
--     233-   254    101060                                                                        0.9792 0.6881
--     255-   277     89438                                                                        0.9814 0.6957
--     278-   301     68347                                                                        0.9834 0.7031
--     302-   326     63527                                                                        0.9849 0.7092
--     327-   352     54311                                                                        0.9863 0.7154
--     353-   379     40079                                                                        0.9874 0.7210
--     380-   407     38478                                                                        0.9883 0.7256
--     408-   436     36319                                                                        0.9892 0.7303
--     437-   466     33531                                                                        0.9900 0.7351
--     467-   497     29677                                                                        0.9907 0.7398
--     498-   529     24371                                                                        0.9914 0.7442
--     530-   562     21654                                                                        0.9919 0.7481
--     563-   596     19742                                                                        0.9924 0.7517
--     597-   631     17294                                                                        0.9928 0.7554
--     632-   667     16103                                                                        0.9932 0.7586
--     668-   704     15395                                                                        0.9936 0.7619
--     705-   742     13469                                                                        0.9939 0.7651
--     743-   781     16313                                                                        0.9942 0.7682
--     782-   821     15918                                                                        0.9946 0.7722
--
--           0 (max occurrences)
--  3209160086 (total mers, non-unique)
--    45058533 (distinct mers, non-unique)
--           0 (unique mers)
-- Finished stage 'meryl-process', reset canuIteration.
--
-- Removing meryl database 'unitigging/0-mercounts/A3-48.ms22'.
--
-- OVERLAPPER (normal) (assembly) erate=0.01
--
----------------------------------------
-- Starting command on Fri Jan 16 01:46:22 2026 with 4559546.671 GB free disk space

    cd unitigging/1-overlapper
    /share/org/YZWL/yzwl_lixg/miniforge3/envs/canu_v.2.3/bin/overlapInCorePartition \
     -S  ../../A3-48.seqStore \
     -hl 160000000 \
     -rl 5000000000 \
     -ol 500 \
     -o  ./A3-48.partition \
    > ./A3-48.partition.err 2>&1

-- Finished on Fri Jan 16 01:46:22 2026 (in the blink of an eye) with 4559546.656 GB free disk space
----------------------------------------
--
-- Configured 21 overlapInCore jobs.
-- Finished stage 'utg-overlapConfigure', reset canuIteration.
--
-- Running jobs.  First attempt out of 2.
----------------------------------------
-- Starting 'utgovl' concurrent execution on Fri Jan 16 01:46:22 2026 with 4559546.625 GB free disk space (21 processes; 11 concurrently)

    cd unitigging/1-overlapper
    ./overlap.sh 1 > ./overlap.000001.out 2>&1
    ./overlap.sh 2 > ./overlap.000002.out 2>&1
    ./overlap.sh 3 > ./overlap.000003.out 2>&1
    ./overlap.sh 4 > ./overlap.000004.out 2>&1
    ./overlap.sh 5 > ./overlap.000005.out 2>&1
    ./overlap.sh 6 > ./overlap.000006.out 2>&1
    ./overlap.sh 7 > ./overlap.000007.out 2>&1
    ./overlap.sh 8 > ./overlap.000008.out 2>&1
    ./overlap.sh 9 > ./overlap.000009.out 2>&1
    ./overlap.sh 10 > ./overlap.000010.out 2>&1
    ./overlap.sh 11 > ./overlap.000011.out 2>&1
    ./overlap.sh 12 > ./overlap.000012.out 2>&1
    ./overlap.sh 13 > ./overlap.000013.out 2>&1
    ./overlap.sh 14 > ./overlap.000014.out 2>&1
    ./overlap.sh 15 > ./overlap.000015.out 2>&1
    ./overlap.sh 16 > ./overlap.000016.out 2>&1
    ./overlap.sh 17 > ./overlap.000017.out 2>&1
    ./overlap.sh 18 > ./overlap.000018.out 2>&1
    ./overlap.sh 19 > ./overlap.000019.out 2>&1
    ./overlap.sh 20 > ./overlap.000020.out 2>&1
    ./overlap.sh 21 > ./overlap.000021.out 2>&1

-- Finished on Fri Jan 16 02:13:30 2026 (1628 seconds) with 4559296.328 GB free disk space
----------------------------------------
-- Found 21 overlapInCore output files.
--
-- overlapInCore compute 'unitigging/1-overlapper':
--   kmer hits
--     with no overlap       1253532546    59692026 +- 37692530.242
--     with an overlap         40944819  3.28571429 +- 1121922.228
--
--   overlaps                  40944819  3.28571429 +- 1121922.228
--     contained                8775739  .333333333 +- 237224.226
--     dovetail                32169080  0.95238095 +- 888520.978
--
--   overlaps rejected
--     multiple per pair              0           0 +- 0
--     bad short window               0           0 +- 0
--     bad long window                0           0 +- 0
-- Finished stage 'utg-overlapCheck', reset canuIteration.
----------------------------------------
-- Starting command on Fri Jan 16 02:13:30 2026 with 4559296.312 GB free disk space

    cd unitigging
    /share/org/YZWL/yzwl_lixg/miniforge3/envs/canu_v.2.3/bin/ovStoreConfig \
     -S ../A3-48.seqStore \
     -M 4-8 \
     -L ./1-overlapper/ovljob.files \
     -create ./A3-48.ovlStore.config \
     > ./A3-48.ovlStore.config.txt \
    2> ./A3-48.ovlStore.config.err

-- Finished on Fri Jan 16 02:13:30 2026 (lickety-split) with 4559296.296 GB free disk space
----------------------------------------
--
-- Creating overlap store unitigging/A3-48.ovlStore using:
--      1 bucket
--      1 slice
--        using at most 3 GB memory each
--
-- Running jobs.  First attempt out of 2.
----------------------------------------
-- Starting 'ovS' concurrent execution on Fri Jan 16 02:13:30 2026 with 4559296.281 GB free disk space (1 processes; 62 concurrently)

    cd unitigging
    ./A3-48.ovlStore.sh 1 > ./A3-48.ovlStore.000001.out 2>&1

-- Finished on Fri Jan 16 02:13:49 2026 (19 seconds) with 4559294.781 GB free disk space
----------------------------------------
-- Checking store.
----------------------------------------
-- Starting command on Fri Jan 16 02:13:49 2026 with 4559294.781 GB free disk space

    cd unitigging
    /share/org/YZWL/yzwl_lixg/miniforge3/envs/canu_v.2.3/bin/ovStoreDump \
     -S ../A3-48.seqStore \
     -O  ./A3-48.ovlStore \
     -counts \
     > ./A3-48.ovlStore/counts.dat 2> ./A3-48.ovlStore/counts.err

-- Finished on Fri Jan 16 02:13:50 2026 (one second) with 4559294.75 GB free disk space
----------------------------------------
--
-- Overlap store 'unitigging/A3-48.ovlStore' successfully constructed.
-- Found 81889638 overlaps for 234263 reads; 1581727 reads have no overlaps.
--
--
-- Purged 0.839 GB in 63 overlap output files.
----------------------------------------
-- Starting command on Fri Jan 16 02:13:50 2026 with 4559295.796 GB free disk space

    cd unitigging
    /share/org/YZWL/yzwl_lixg/miniforge3/envs/canu_v.2.3/bin/ovStoreStats \
     -C 50 \
     -S ../A3-48.seqStore \
     -O  ./A3-48.ovlStore \
     -o  ./A3-48.ovlStore \
     > ./A3-48.ovlStore.summary.err 2>&1

-- Finished on Fri Jan 16 02:14:02 2026 (12 seconds) with 4559295.781 GB free disk space
----------------------------------------
--
-- Overlap store 'unitigging/A3-48.ovlStore' contains:
--
--   category            reads     %          read length        feature size or coverage  analysis
--   ----------------  -------  -------  ----------------------  ------------------------  --------------------
--   middle-missing        136    0.06    15188.74 +- 6774.59       1097.80 +- 1625.07    (bad trimming)
--   middle-hump            12    0.01    16630.00 +- 4916.90       5068.58 +- 4217.98    (bad trimming)
--   no-5-prime            402    0.17    14160.94 +- 4990.26       1682.41 +- 2714.89    (bad trimming)
--   no-3-prime            459    0.19    12348.80 +- 6195.21       1459.49 +- 2486.33    (bad trimming)
--   
--   low-coverage         1050    0.44    10955.04 +- 5579.26          6.19 +- 3.75       (easy to assemble, potential for lower quality consensus)
--   unique             190966   79.79    13646.50 +- 5370.92         45.05 +- 8.43       (easy to assemble, perfect, yay)
--   repeat-cont         21597    9.02    11928.44 +- 4810.54       1530.20 +- 1087.22    (potential for consensus errors, no impact on assembly)
--   repeat-dove           283    0.12    21541.65 +- 2314.43        700.56 +- 741.14     (hard to assemble, likely won't assemble correctly or even at all)
--   
--   span-repeat          2034    0.85    14856.24 +- 4598.07       3584.49 +- 4146.78    (read spans a large repeat, usually easy to assemble)
--   uniq-repeat-cont    12317    5.15    13632.08 +- 4228.23                             (should be uniquely placed, low potential for consensus errors, no impact on assembly)
--   uniq-repeat-dove     2428    1.01    19466.63 +- 2962.52                             (will end contigs, potential to misassemble)
--   uniq-anchor          2579    1.08    13737.14 +- 4517.58       8660.17 +- 5008.17    (repeat read, with unique section, probable bad read)
-- Finished stage 'utg-createOverlapStore', reset canuIteration.
--
-- Loading read lengths.
-- Loading number of overlaps per read.
--
-- Configure RED for 16gb memory.
--                   Batches of at most (unlimited) reads.
--                                      500000000 bases.
--                   Expecting evidence of at most 536870912 bases per iteration.
--
--           Total                                               Reads                 Olaps Evidence
--    Job   Memory      Read Range         Reads        Bases   Memory        Olaps   Memory   Memory  (Memory in MB)
--   ---- -------- ------------------- --------- ------------ -------- ------------ -------- --------
--      1 16384.97         1-40128          5367    108907840 13294.58      1607053    18.39  1024.00
--      2 16384.41     40129-82590          5704    108905944 13294.36      1577411    18.05  1024.00
--      3 16384.32     82591-130733         6435    108856241 13288.32      2097531    24.00  1024.00
--      4 16384.38    130734-172798         5554    108823095 13284.24      2458590    28.14  1024.00
--      5 16384.50    172799-218671         6060    108893046 13292.80      1721783    19.70  1024.00
--      6 16385.42    218672-272822         7065    108833458 13285.56      2434769    27.86  1024.00
--      7 16387.19    272823-315762         5582    108867399 13289.65      2231309    25.54  1024.00
--      8 16384.71    315763-361858         6076    108900189 13293.67      1663502    19.04  1024.00
--      9 16385.35    361859-417097         7122    108854394 13288.11      2205468    25.24  1024.00
--     10 16386.44    417098-458811         5500    108849539 13287.47      2356474    26.97  1024.00
--     11 16384.55    458812-504553         6032    108888176 13292.20      1778010    20.35  1024.00
--     12 16385.74    504554-558364         7158    108828125 13284.91      2519204    28.83  1024.00
--     13 16386.80    558365-599793         5518    108860123 13288.76      2275179    26.04  1024.00
--     14 16384.96    599794-645982         5975    108909788 13294.84      1583101    18.12  1024.00
--     15 16386.07    645983-700718         7166    108837462 13286.05      2448393    28.02  1024.00
--     16 16385.11    700719-742910         5493    108863038 13289.12      2096241    23.99  1024.00
--     17 16384.53    742911-788420         5928    108889924 13292.41      1757400    20.11  1024.00
--     18 16385.97    788421-843524         7270    108838328 13286.16      2430366    27.81  1024.00
--     19 16385.46    843525-884127         5434    108841453 13286.48      2357252    26.98  1024.00
--     20 16384.36    884128-928550         5869    108879538 13291.14      1853811    21.22  1024.00
--     21 16384.01    928551-983409         7211    108824163 13284.43      2410333    27.58  1024.00
--     22 16386.19    983410-1024249        5437    108871479 13290.15      2101239    24.05  1024.00
--     23 16386.52   1024250-1068111        5765    108911140 13295.00      1705472    19.52  1024.00
--     24 16384.76   1068112-1121567        7038    108836905 13285.98      2339979    26.78  1024.00
--     25 16385.10   1121568-1162731        5459    108841414 13286.48      2326226    26.62  1024.00
--     26 16384.35   1162732-1206648        5778    108871423 13290.15      1940212    22.20  1024.00
--     27 16384.15   1206649-1261116        7117    108826742 13284.74      2395189    27.41  1024.00
--     28 16385.38   1261117-1301741        5395    108847390 13287.20      2287499    26.18  1024.00
--     29 16386.22   1301742-1345896        5726    108896613 13293.22      1834503    20.99  1024.00
--     30 16386.12   1345897-1399748        7193    108853907 13288.06      2277670    26.07  1024.00
--     31 16384.09   1399749-1441295        5383    108856784 13288.35      2074619    23.74  1024.00
--     32 16384.07   1441296-1483894        5684    108886445 13291.98      1755658    20.09  1024.00
--     33 16384.11   1483895-1538398        7143    108823928 13284.40      2421749    27.71  1024.00
--     34 16386.22   1538399-1579809        5399    108919151 13295.96      1595372    18.26  1024.00
--     35 16385.74   1579810-1622785        5713    108860533 13288.82      2177991    24.93  1024.00
--     36 16384.55   1622786-1677237        7205    108824667 13284.49      2451958    28.06  1024.00
--     37 16384.53   1677238-1717226        5385    108925347 13296.72      1381201    15.81  1024.00
--     38 16385.97   1717227-1759708        5601    108820065 13283.88      2629268    30.09  1024.00
--     39 16384.07   1759709-1813578        7097    108838545 13286.18      2262293    25.89  1024.00
--     40  3603.90   1813579-1815990         303      4350831   531.12        68360     0.78  1024.00
--   ---- -------- ------------------- --------- ------------ -------- ------------ -------- --------
--                                                 4250014572              81889638
-- Finished stage 'readErrorDetectionConfigure', reset canuIteration.
--
-- Running jobs.  First attempt out of 2.
----------------------------------------
-- Starting 'red' concurrent execution on Fri Jan 16 02:14:09 2026 with 4559270.421 GB free disk space (40 processes; 22 concurrently)

    cd unitigging/3-overlapErrorAdjustment
    ./red.sh 1 > ./red.000001.out 2>&1
    ./red.sh 2 > ./red.000002.out 2>&1
    ./red.sh 3 > ./red.000003.out 2>&1
    ./red.sh 4 > ./red.000004.out 2>&1
    ./red.sh 5 > ./red.000005.out 2>&1
    ./red.sh 6 > ./red.000006.out 2>&1
    ./red.sh 7 > ./red.000007.out 2>&1
    ./red.sh 8 > ./red.000008.out 2>&1
    ./red.sh 9 > ./red.000009.out 2>&1
    ./red.sh 10 > ./red.000010.out 2>&1
    ./red.sh 11 > ./red.000011.out 2>&1
    ./red.sh 12 > ./red.000012.out 2>&1
    ./red.sh 13 > ./red.000013.out 2>&1
    ./red.sh 14 > ./red.000014.out 2>&1
    ./red.sh 15 > ./red.000015.out 2>&1
    ./red.sh 16 > ./red.000016.out 2>&1
    ./red.sh 17 > ./red.000017.out 2>&1
    ./red.sh 18 > ./red.000018.out 2>&1
    ./red.sh 19 > ./red.000019.out 2>&1
    ./red.sh 20 > ./red.000020.out 2>&1
    ./red.sh 21 > ./red.000021.out 2>&1
    ./red.sh 22 > ./red.000022.out 2>&1
    ./red.sh 23 > ./red.000023.out 2>&1
    ./red.sh 24 > ./red.000024.out 2>&1
    ./red.sh 25 > ./red.000025.out 2>&1
    ./red.sh 26 > ./red.000026.out 2>&1
    ./red.sh 27 > ./red.000027.out 2>&1
    ./red.sh 28 > ./red.000028.out 2>&1
    ./red.sh 29 > ./red.000029.out 2>&1
    ./red.sh 30 > ./red.000030.out 2>&1
    ./red.sh 31 > ./red.000031.out 2>&1
    ./red.sh 32 > ./red.000032.out 2>&1
    ./red.sh 33 > ./red.000033.out 2>&1
    ./red.sh 34 > ./red.000034.out 2>&1
    ./red.sh 35 > ./red.000035.out 2>&1
    ./red.sh 36 > ./red.000036.out 2>&1
    ./red.sh 37 > ./red.000037.out 2>&1
    ./red.sh 38 > ./red.000038.out 2>&1
    ./red.sh 39 > ./red.000039.out 2>&1
    ./red.sh 40 > ./red.000040.out 2>&1

-- Finished on Fri Jan 16 02:35:38 2026 (1289 seconds) with 4559028.906 GB free disk space
----------------------------------------
-- Found 40 read error detection output files.
-- Finished stage 'readErrorDetectionCheck', reset canuIteration.
--
-- Loading read lengths.
-- Loading number of overlaps per read.
--
-- Configure OEA for 8gb memory.
--                   Batches of at most (unlimited) reads.
--                                      300000000 bases.
--
--           Total                                               Reads                 Olaps  Adjusts
--    Job   Memory      Read Range         Reads        Bases   Memory        Olaps   Memory   Memory  (Memory in MB)
--   ---- -------- ------------------- --------- ------------ -------- ------------ -------- --------
--      1  2870.44         1-120584        16186    300027884   294.62      5135940   156.74   371.08
--      2  2910.22    120585-252104        17266    300006066   294.63      6439177   196.51   371.08
--      3  2856.27    252105-378369        16406    300007368   294.61      4671919   142.58   371.08
--      4  2894.65    378370-505799        16796    300005810   294.62      5929293   180.95   371.08
--      5  2902.93    505800-635157        17105    300001256   294.63      6200468   189.22   371.08
--      6  2897.24    635158-766484        17137    300004299   294.63      6013984   183.53   371.08
--      7  2894.59    766485-896359        17198    300007702   294.63      5926755   180.87   371.08
--      8  2886.83    896360-1026147       17112    300013030   294.64      5672526   173.11   371.08
--      9  2880.39   1026148-1154645       16925    300000005   294.62      5462150   166.69   371.08
--     10  2883.48   1154646-1284073       16988    300019412   294.64      5562536   169.76   371.08
--     11  2904.37   1284074-1412725       17000    300010856   294.63      6247340   190.65   371.08
--     12  2899.86   1412726-1541346       16898    300020378   294.64      6099452   186.14   371.08
--     13  2865.86   1541347-1665964       16464    300000310   294.61      4986576   152.18   371.08
--     14  2888.72   1665965-1787299       16058    300009426   294.60      5735666   175.04   371.08
--     15  2529.88   1787300-1815990        3801     49880770    55.69      1805856    55.11   371.08
--   ---- -------- ------------------- --------- ------------ -------- ------------ -------- --------
--                                                 4250014572              81889638
-- Finished stage 'overlapErrorAdjustmentConfigure', reset canuIteration.
--
-- Running jobs.  First attempt out of 2.
----------------------------------------
-- Starting 'oea' concurrent execution on Fri Jan 16 02:35:46 2026 with 4559028.921 GB free disk space (15 processes; 62 concurrently)

    cd unitigging/3-overlapErrorAdjustment
    ./oea.sh 1 > ./oea.000001.out 2>&1
    ./oea.sh 2 > ./oea.000002.out 2>&1
    ./oea.sh 3 > ./oea.000003.out 2>&1
    ./oea.sh 4 > ./oea.000004.out 2>&1
    ./oea.sh 5 > ./oea.000005.out 2>&1
    ./oea.sh 6 > ./oea.000006.out 2>&1
    ./oea.sh 7 > ./oea.000007.out 2>&1
    ./oea.sh 8 > ./oea.000008.out 2>&1
    ./oea.sh 9 > ./oea.000009.out 2>&1
    ./oea.sh 10 > ./oea.000010.out 2>&1
    ./oea.sh 11 > ./oea.000011.out 2>&1
    ./oea.sh 12 > ./oea.000012.out 2>&1
    ./oea.sh 13 > ./oea.000013.out 2>&1
    ./oea.sh 14 > ./oea.000014.out 2>&1
    ./oea.sh 15 > ./oea.000015.out 2>&1

-- Finished on Fri Jan 16 03:31:25 2026 (3339 seconds) with 4556966.218 GB free disk space
----------------------------------------
-- Found 15 overlap error adjustment output files.
-- Finished stage 'overlapErrorAdjustmentCheck', reset canuIteration.
----------------------------------------
-- Starting command on Fri Jan 16 03:31:25 2026 with 4556966.203 GB free disk space

    cd unitigging/3-overlapErrorAdjustment
    /share/org/YZWL/yzwl_lixg/miniforge3/envs/canu_v.2.3/bin/loadErates \
      -S ../../A3-48.seqStore \
      -O ../A3-48.ovlStore \
      -L ./oea.files \
    > ./oea.apply.err 2>&1

-- Finished on Fri Jan 16 03:31:25 2026 (in the blink of an eye) with 4556966.031 GB free disk space
----------------------------------------
-- No report available.
-- Finished stage 'updateOverlapStore', reset canuIteration.
-- Finished stage 'unitig', reset canuIteration.
--
-- Running jobs.  First attempt out of 2.
----------------------------------------
-- Starting 'bat' concurrent execution on Fri Jan 16 03:31:25 2026 with 4556965.984 GB free disk space (1 processes; 1 concurrently)

    cd unitigging/4-unitigger
    ./unitigger.sh 1 > ./unitigger.000001.out 2>&1

-- Finished on Fri Jan 16 03:31:46 2026 (21 seconds) with 4556951.921 GB free disk space
----------------------------------------
-- Unitigger finished successfully.
--  
--  ERROR RATES
--  -----------
--                                                   --------threshold------
--  264121                       fraction error      fraction        percent
--  samples                              (1e-5)         error          error
--                   --------------------------      --------       --------
--  command line (-eg)                           ->     30.00        0.0300%
--  command line (-ef)                           ->  -----.--      ---.----%
--  command line (-eM)                           ->     30.00        0.0300%
--  mean + std.dev       0.43 +-  12 *     3.04  ->     36.89        0.0369%
--  median + mad         0.00 +-  12 *     0.00  ->      0.00        0.0000%
--  90th percentile                              ->      1.00        0.0010%  (enabled)
--  
--  BEST EDGE FILTERING
--  -------------------
--  At graph threshold 0.0300%, reads:
--    available to have edges:        41683
--    with at least one edge:         34978
--  
--  At max threshold 0.0300%, reads:  (not computed)
--    available to have edges:            0
--    with at least one edge:             0
--  
--  At tight threshold 0.0010%, reads with:
--    both edges below error threshold:     30363  (80.00% minReadsBest threshold = 27982)
--    one  edge  above error threshold:      3352
--    both edges above error threshold:      1263
--    at least one edge:                    34978
--  
--  At loose threshold 0.0300%, reads with:
--    both edges below error threshold:     34978  (80.00% minReadsBest threshold = 27982)
--    one  edge  above error threshold:         0
--    both edges above error threshold:         0
--    at least one edge:                    34978
--  
--  
--  INITIAL EDGES
--  -------- ----------------------------------------
--    191520 reads are contained
--   1594451 reads have no best edges (singleton)
--       310 reads have only one best edge (spur) 
--                145 are mutual best
--     29709 reads have two best edges 
--                785 have one mutual best edge
--              28575 have two mutual best edges
--  
--  
--  FINAL EDGES
--  -------- ----------------------------------------
--    191520 reads are contained
--   1594808 reads have no best edges (singleton)
--       189 reads have only one best edge (spur) 
--                162 are mutual best
--     29473 reads have two best edges 
--                642 have one mutual best edge
--              28567 have two mutual best edges
--  
--  
--  EDGE FILTERING
--  -------- ------------------------------------------
--         0 reads are ignored
--     10986 reads have a gap in overlap coverage
--       140 reads have lopsided best edges
-- Found, in version 1, after unitig construction:
--   contigs:      121 sequences, total length 68769252 bp (including 163 repeats of total length 4096198 bp).
--   bubbles:      158 sequences, total length 4393765 bp.
--   unassembled:  17343 sequences, total length 219477473 bp.
--
-- Contig sizes based on genome size 85mbp:
--
--            NG (bp)  LG (contigs)    sum (bp)
--         ----------  ------------  ----------
--     10     6241039             2    12528409
--     20     5054336             3    17582745
--     30     4579105             5    26835083
--     40     3338785             8    37154065
--     50     2725759            10    42950601
--     60     2112457            14    52017792
--     70     1266084            19    59535629
--     80       20327            79    68015123
--
-- Finished stage 'unitigCheck', reset canuIteration.
----------------------------------------
-- Starting command on Fri Jan 16 03:31:46 2026 with 4556951.906 GB free disk space

    cd unitigging
    /share/org/YZWL/yzwl_lixg/miniforge3/envs/canu_v.2.3/bin/utgcns \
      -S ../A3-48.seqStore \
      -T  ./A3-48.ctgStore 1 \
      -partition 0.8 1.5 0.1 \
    > ./A3-48.ctgStore/partitioning.log 2>&1

-- Finished on Fri Jan 16 03:31:55 2026 (9 seconds) with 4556925.359 GB free disk space
----------------------------------------
-- Using slow alignment for consensus (iteration '0').
-- Configured 11 consensus jobs.
-- Finished stage 'consensusConfigure', reset canuIteration.
--
-- Local: cns        9.375 GB    8 CPUs x  11 jobs   103.125 GB  88 CPUs  (consensus)
--
--
-- Running jobs.  First attempt out of 2.
----------------------------------------
-- Starting 'cns' concurrent execution on Fri Jan 16 03:31:55 2026 with 4556925.328 GB free disk space (11 processes; 11 concurrently)

    cd unitigging/5-consensus
    ./consensus.sh 1 > ./consensus.000001.out 2>&1
    ./consensus.sh 2 > ./consensus.000002.out 2>&1
    ./consensus.sh 3 > ./consensus.000003.out 2>&1
    ./consensus.sh 4 > ./consensus.000004.out 2>&1
    ./consensus.sh 5 > ./consensus.000005.out 2>&1
    ./consensus.sh 6 > ./consensus.000006.out 2>&1
    ./consensus.sh 7 > ./consensus.000007.out 2>&1
    ./consensus.sh 8 > ./consensus.000008.out 2>&1
    ./consensus.sh 9 > ./consensus.000009.out 2>&1
    ./consensus.sh 10 > ./consensus.000010.out 2>&1
    ./consensus.sh 11 > ./consensus.000011.out 2>&1

-- Finished on Fri Jan 16 03:38:37 2026 (402 seconds) with 4556685.843 GB free disk space
----------------------------------------
-- Using slow alignment for consensus (iteration '1').
-- Configured 11 consensus jobs.
-- All 11 consensus jobs finished successfully.
-- Finished stage 'consensusCheck', reset canuIteration.
-- Using slow alignment for consensus (iteration '0').
-- Configured 11 consensus jobs.
----------------------------------------
-- Starting command on Fri Jan 16 03:38:38 2026 with 4556685.796 GB free disk space

    cd unitigging
    /share/org/YZWL/yzwl_lixg/miniforge3/envs/canu_v.2.3/bin/tgStoreLoad \
      -S ../A3-48.seqStore \
      -T  ./A3-48.ctgStore 2 \
      -L ./5-consensus/ctgcns.files \
    > ./5-consensus/ctgcns.files.ctgStoreLoad.err 2>&1

-- Finished on Fri Jan 16 03:38:39 2026 (one second) with 4556684.968 GB free disk space
----------------------------------------
----------------------------------------
-- Starting command on Fri Jan 16 03:38:39 2026 with 4556684.968 GB free disk space

    cd unitigging
    /share/org/YZWL/yzwl_lixg/miniforge3/envs/canu_v.2.3/bin/tgTigDisplay \
      -S ../A3-48.seqStore \
      -b \
      -o ../A3-48.contigs.unsorted.bam \
      -L ./5-consensus/ctgcns.files \
    > ./5-consensus/ctgcns.files.contigs.bam.err 2>&1

-- Finished on Fri Jan 16 03:41:17 2026 (158 seconds) with 4556630.734 GB free disk space
----------------------------------------
----------------------------------------
-- Starting command on Fri Jan 16 03:41:17 2026 with 4556630.734 GB free disk space

    cd .
    samtools sort \
      --write-index \
      --threads 2 \
      -o ./A3-48.contigs.bam ./A3-48.contigs.unsorted.bam \
    > ./ctgcns.bam.err 2>&1

-- Finished on Fri Jan 16 03:42:22 2026 (65 seconds) with 4556555.89 GB free disk space
----------------------------------------
-- Purging consensus output after loading to ctgStore.
-- Purged 11 .cns outputs.
----------------------------------------
-- Starting command on Fri Jan 16 03:42:22 2026 with 4556557.812 GB free disk space

    cd unitigging
    /share/org/YZWL/yzwl_lixg/miniforge3/envs/canu_v.2.3/bin/tgStoreDump \
      -S ../A3-48.seqStore \
      -T ./A3-48.ctgStore 2 \
      -sizes -s 85000000 \
    > ./A3-48.ctgStore/seqDB.v002.sizes.txt
ZERO length suplied to intervalList::add(), ignoring interval.
ZERO length suplied to intervalList::add(), ignoring interval.
ZERO length suplied to intervalList::add(), ignoring interval.
ZERO length suplied to intervalList::add(), ignoring interval.
ZERO length suplied to intervalList::add(), ignoring interval.
ZERO length suplied to intervalList::add(), ignoring interval.
ZERO length suplied to intervalList::add(), ignoring interval.
ZERO length suplied to intervalList::add(), ignoring interval.
ZERO length suplied to intervalList::add(), ignoring interval.
ZERO length suplied to intervalList::add(), ignoring interval.
ZERO length suplied to intervalList::add(), ignoring interval.
ZERO length suplied to intervalList::add(), ignoring interval.
ZERO length suplied to intervalList::add(), ignoring interval.
ZERO length suplied to intervalList::add(), ignoring interval.
ZERO length suplied to intervalList::add(), ignoring interval.
ZERO length suplied to intervalList::add(), ignoring interval.
ZERO length suplied to intervalList::add(), ignoring interval.
ZERO length suplied to intervalList::add(), ignoring interval.
ZERO length suplied to intervalList::add(), ignoring interval.
ZERO length suplied to intervalList::add(), ignoring interval.
ZERO length suplied to intervalList::add(), ignoring interval.
ZERO length suplied to intervalList::add(), ignoring interval.
ZERO length suplied to intervalList::add(), ignoring interval.
ZERO length suplied to intervalList::add(), ignoring interval.
ZERO length suplied to intervalList::add(), ignoring interval.
ZERO length suplied to intervalList::add(), ignoring interval.
ZERO length suplied to intervalList::add(), ignoring interval.
ZERO length suplied to intervalList::add(), ignoring interval.
ZERO length suplied to intervalList::add(), ignoring interval.
ZERO length suplied to intervalList::add(), ignoring interval.
ZERO length suplied to intervalList::add(), ignoring interval.
ZERO length suplied to intervalList::add(), ignoring interval.
ZERO length suplied to intervalList::add(), ignoring interval.
ZERO length suplied to intervalList::add(), ignoring interval.
ZERO length suplied to intervalList::add(), ignoring interval.
ZERO length suplied to intervalList::add(), ignoring interval.
ZERO length suplied to intervalList::add(), ignoring interval.
ZERO length suplied to intervalList::add(), ignoring interval.
ZERO length suplied to intervalList::add(), ignoring interval.
ZERO length suplied to intervalList::add(), ignoring interval.
ZERO length suplied to intervalList::add(), ignoring interval.
ZERO length suplied to intervalList::add(), ignoring interval.
ZERO length suplied to intervalList::add(), ignoring interval.
ZERO length suplied to intervalList::add(), ignoring interval.
ZERO length suplied to intervalList::add(), ignoring interval.
ZERO length suplied to intervalList::add(), ignoring interval.
ZERO length suplied to intervalList::add(), ignoring interval.
ZERO length suplied to intervalList::add(), ignoring interval.
ZERO length suplied to intervalList::add(), ignoring interval.
ZERO length suplied to intervalList::add(), ignoring interval.
ZERO length suplied to intervalList::add(), ignoring interval.
ZERO length suplied to intervalList::add(), ignoring interval.
ZERO length suplied to intervalList::add(), ignoring interval.
ZERO length suplied to intervalList::add(), ignoring interval.
ZERO length suplied to intervalList::add(), ignoring interval.
ZERO length suplied to intervalList::add(), ignoring interval.
ZERO length suplied to intervalList::add(), ignoring interval.
ZERO length suplied to intervalList::add(), ignoring interval.
ZERO length suplied to intervalList::add(), ignoring interval.
ZERO length suplied to intervalList::add(), ignoring interval.

-- Finished on Fri Jan 16 03:42:23 2026 (one second) with 4556557.812 GB free disk space
----------------------------------------
-- Found, in version 2, after consensus generation:
--   contigs:      121 sequences, total length 89828037 bp (including 163 repeats of total length 5724601 bp).
--   bubbles:      158 sequences, total length 5981067 bp.
--   unassembled:  17343 sequences, total length 303505735 bp.
--
-- Contig sizes based on genome size 85mbp:
--
--            NG (bp)  LG (contigs)    sum (bp)
--         ----------  ------------  ----------
--     10     8103825             2    16270545
--     20     6563353             3    22833898
--     30     6095530             4    28929428
--     40     5968040             5    34897468
--     50     4414180             7    43978401
--     60     4010177             9    52341664
--     70     2968977            12    62177660
--     80     2228745            15    69931403
--     90     1647724            19    77511490
--    100      565866            27    85312626
--
-- Finished stage 'consensusLoad', reset canuIteration.
----------------------------------------
-- Starting command on Fri Jan 16 03:42:23 2026 with 4556557.796 GB free disk space

    cd .
    /share/org/YZWL/yzwl_lixg/miniforge3/envs/canu_v.2.3/bin/tgStoreDump \
      -S ./A3-48.seqStore \
      -T ./unitigging/A3-48.ctgStore 2 \
      -o ./A3-48.contigs \
      -layout \
    > ./A3-48.contigs.layout.err 2>&1

-- Finished on Fri Jan 16 03:42:23 2026 (in the blink of an eye) with 4556557.734 GB free disk space
----------------------------------------
----------------------------------------
-- Starting command on Fri Jan 16 03:42:23 2026 with 4556557.734 GB free disk space

    cd .
    /share/org/YZWL/yzwl_lixg/miniforge3/envs/canu_v.2.3/bin/tgStoreDump \
      -S ./A3-48.seqStore \
      -T ./unitigging/A3-48.ctgStore 2 \
      -consensus -fasta \
      -unassembled \
    > ./A3-48.unassembled.fasta
    2> ./A3-48.unassembled.err
ZERO length suplied to intervalList::add(), ignoring interval.
ZERO length suplied to intervalList::add(), ignoring interval.
ZERO length suplied to intervalList::add(), ignoring interval.
ZERO length suplied to intervalList::add(), ignoring interval.
ZERO length suplied to intervalList::add(), ignoring interval.
ZERO length suplied to intervalList::add(), ignoring interval.
ZERO length suplied to intervalList::add(), ignoring interval.
ZERO length suplied to intervalList::add(), ignoring interval.
ZERO length suplied to intervalList::add(), ignoring interval.
ZERO length suplied to intervalList::add(), ignoring interval.
ZERO length suplied to intervalList::add(), ignoring interval.
ZERO length suplied to intervalList::add(), ignoring interval.
ZERO length suplied to intervalList::add(), ignoring interval.
ZERO length suplied to intervalList::add(), ignoring interval.
ZERO length suplied to intervalList::add(), ignoring interval.
ZERO length suplied to intervalList::add(), ignoring interval.
ZERO length suplied to intervalList::add(), ignoring interval.
ZERO length suplied to intervalList::add(), ignoring interval.
ZERO length suplied to intervalList::add(), ignoring interval.
ZERO length suplied to intervalList::add(), ignoring interval.
ZERO length suplied to intervalList::add(), ignoring interval.
ZERO length suplied to intervalList::add(), ignoring interval.
ZERO length suplied to intervalList::add(), ignoring interval.
ZERO length suplied to intervalList::add(), ignoring interval.
ZERO length suplied to intervalList::add(), ignoring interval.
ZERO length suplied to intervalList::add(), ignoring interval.
ZERO length suplied to intervalList::add(), ignoring interval.
ZERO length suplied to intervalList::add(), ignoring interval.
ZERO length suplied to intervalList::add(), ignoring interval.
ZERO length suplied to intervalList::add(), ignoring interval.
ZERO length suplied to intervalList::add(), ignoring interval.
ZERO length suplied to intervalList::add(), ignoring interval.
ZERO length suplied to intervalList::add(), ignoring interval.
ZERO length suplied to intervalList::add(), ignoring interval.
ZERO length suplied to intervalList::add(), ignoring interval.
ZERO length suplied to intervalList::add(), ignoring interval.
ZERO length suplied to intervalList::add(), ignoring interval.
ZERO length suplied to intervalList::add(), ignoring interval.
ZERO length suplied to intervalList::add(), ignoring interval.
ZERO length suplied to intervalList::add(), ignoring interval.
ZERO length suplied to intervalList::add(), ignoring interval.
ZERO length suplied to intervalList::add(), ignoring interval.
ZERO length suplied to intervalList::add(), ignoring interval.
ZERO length suplied to intervalList::add(), ignoring interval.
ZERO length suplied to intervalList::add(), ignoring interval.
ZERO length suplied to intervalList::add(), ignoring interval.
ZERO length suplied to intervalList::add(), ignoring interval.
ZERO length suplied to intervalList::add(), ignoring interval.
ZERO length suplied to intervalList::add(), ignoring interval.
ZERO length suplied to intervalList::add(), ignoring interval.
ZERO length suplied to intervalList::add(), ignoring interval.
ZERO length suplied to intervalList::add(), ignoring interval.
ZERO length suplied to intervalList::add(), ignoring interval.
ZERO length suplied to intervalList::add(), ignoring interval.
ZERO length suplied to intervalList::add(), ignoring interval.
ZERO length suplied to intervalList::add(), ignoring interval.
ZERO length suplied to intervalList::add(), ignoring interval.
ZERO length suplied to intervalList::add(), ignoring interval.
ZERO length suplied to intervalList::add(), ignoring interval.
ZERO length suplied to intervalList::add(), ignoring interval.

-- Finished on Fri Jan 16 03:42:25 2026 (2 seconds) with 4556557.437 GB free disk space
----------------------------------------
----------------------------------------
-- Starting command on Fri Jan 16 03:42:25 2026 with 4556557.437 GB free disk space

    cd .
    /share/org/YZWL/yzwl_lixg/miniforge3/envs/canu_v.2.3/bin/tgStoreDump \
      -S ./A3-48.seqStore \
      -T ./unitigging/A3-48.ctgStore 2 \
      -consensus -fasta \
      -contigs \
    > ./A3-48.contigs.fasta
    2> ./A3-48.contigs.err
ZERO length suplied to intervalList::add(), ignoring interval.
ZERO length suplied to intervalList::add(), ignoring interval.
ZERO length suplied to intervalList::add(), ignoring interval.
ZERO length suplied to intervalList::add(), ignoring interval.
ZERO length suplied to intervalList::add(), ignoring interval.
ZERO length suplied to intervalList::add(), ignoring interval.
ZERO length suplied to intervalList::add(), ignoring interval.
ZERO length suplied to intervalList::add(), ignoring interval.
ZERO length suplied to intervalList::add(), ignoring interval.
ZERO length suplied to intervalList::add(), ignoring interval.
ZERO length suplied to intervalList::add(), ignoring interval.
ZERO length suplied to intervalList::add(), ignoring interval.
ZERO length suplied to intervalList::add(), ignoring interval.
ZERO length suplied to intervalList::add(), ignoring interval.
ZERO length suplied to intervalList::add(), ignoring interval.
ZERO length suplied to intervalList::add(), ignoring interval.
ZERO length suplied to intervalList::add(), ignoring interval.
ZERO length suplied to intervalList::add(), ignoring interval.
ZERO length suplied to intervalList::add(), ignoring interval.
ZERO length suplied to intervalList::add(), ignoring interval.
ZERO length suplied to intervalList::add(), ignoring interval.
ZERO length suplied to intervalList::add(), ignoring interval.
ZERO length suplied to intervalList::add(), ignoring interval.
ZERO length suplied to intervalList::add(), ignoring interval.
ZERO length suplied to intervalList::add(), ignoring interval.
ZERO length suplied to intervalList::add(), ignoring interval.
ZERO length suplied to intervalList::add(), ignoring interval.
ZERO length suplied to intervalList::add(), ignoring interval.
ZERO length suplied to intervalList::add(), ignoring interval.
ZERO length suplied to intervalList::add(), ignoring interval.
ZERO length suplied to intervalList::add(), ignoring interval.
ZERO length suplied to intervalList::add(), ignoring interval.
ZERO length suplied to intervalList::add(), ignoring interval.
ZERO length suplied to intervalList::add(), ignoring interval.
ZERO length suplied to intervalList::add(), ignoring interval.
ZERO length suplied to intervalList::add(), ignoring interval.
ZERO length suplied to intervalList::add(), ignoring interval.
ZERO length suplied to intervalList::add(), ignoring interval.
ZERO length suplied to intervalList::add(), ignoring interval.
ZERO length suplied to intervalList::add(), ignoring interval.
ZERO length suplied to intervalList::add(), ignoring interval.
ZERO length suplied to intervalList::add(), ignoring interval.
ZERO length suplied to intervalList::add(), ignoring interval.
ZERO length suplied to intervalList::add(), ignoring interval.
ZERO length suplied to intervalList::add(), ignoring interval.
ZERO length suplied to intervalList::add(), ignoring interval.
ZERO length suplied to intervalList::add(), ignoring interval.
ZERO length suplied to intervalList::add(), ignoring interval.
ZERO length suplied to intervalList::add(), ignoring interval.
ZERO length suplied to intervalList::add(), ignoring interval.
ZERO length suplied to intervalList::add(), ignoring interval.
ZERO length suplied to intervalList::add(), ignoring interval.
ZERO length suplied to intervalList::add(), ignoring interval.
ZERO length suplied to intervalList::add(), ignoring interval.
ZERO length suplied to intervalList::add(), ignoring interval.
ZERO length suplied to intervalList::add(), ignoring interval.
ZERO length suplied to intervalList::add(), ignoring interval.
ZERO length suplied to intervalList::add(), ignoring interval.
ZERO length suplied to intervalList::add(), ignoring interval.
ZERO length suplied to intervalList::add(), ignoring interval.

-- Finished on Fri Jan 16 03:42:25 2026 (furiously fast) with 4556557.328 GB free disk space
----------------------------------------
-- Finished stage 'generateOutputs', reset canuIteration.
--
-- Assembly 'A3-48' finished in '/share/org/YZWL/yzwl_lixg/project/28.大豆疫霉菌三代基因组/03.hicanu/A3-48/01.raw_output'.
--
-- Summary saved in 'A3-48.report'.
--
-- Sequences saved:
--   Contigs       -> 'A3-48.contigs.fasta'
--   Unassembled   -> 'A3-48.unassembled.fasta'
--
-- Read layouts saved:
--   Contigs       -> 'A3-48.contigs.layout'.
--
-- Bye.

2026-01-16 03:42:25.835 - WARNING - 输出文件不存在|Output file does not exist: /share/org/YZWL/yzwl_lixg/project/28.大豆疫霉菌三代基因组/03.hicanu/A3-48/01.raw_output/A3-48.unitigs.fasta
Usage: biopytools ragtag [OPTIONS]
Try 'biopytools ragtag -h' for help.

Error: Invalid value for '-r' / '--reference': 文件不存在|File does not exist: /share/org/YZWL/yzwl_lixg/project/28.大豆疫霉菌三代基因组/04.ragtag/Psoja_T2T.fa
Usage: biopytools genomesyn [OPTIONS]
Try 'biopytools genomesyn -h' for help.

Error: Invalid value for '-i' / '--ref': Path '04.ragtag/A3-48/hicanu/A3-48_RagTag_scaffolded.fa' does not exist.
Job 68886782 stderr output:

