2026-01-15 19:54:54.175 - WARNING - 命令错误输出|Command stderr:
-- canu master +27 changes (r10515 2a41e933b8de6ed66723d75d36dd071b46d2c347)
--
-- CITATIONS
--
-- For assemblies of PacBio HiFi reads:
--   Nurk S, Walenz BP, Rhiea A, Vollger MR, Logsdon GA, Grothe R, Miga KH, Eichler EE, Phillippy AM, Koren S.
--   HiCanu: accurate assembly of segmental duplications, satellites, and allelic variants from high-fidelity long reads.
--   biorXiv. 2020.
--   https://doi.org/10.1101/2020.03.14.992248
-- 
-- Read and contig alignments during correction and consensus use:
--   Šošic M, Šikic M.
--   Edlib: a C/C ++ library for fast, exact sequence alignment using edit distance.
--   Bioinformatics. 2017 May 1;33(9):1394-1395.
--   http://doi.org/10.1093/bioinformatics/btw753
-- 
-- Overlaps are generated using:
--   Berlin K, et al.
--   Assembling large genomes with single-molecule sequencing and locality-sensitive hashing.
--   Nat Biotechnol. 2015 Jun;33(6):623-30.
--   http://doi.org/10.1038/nbt.3238
-- 
--   Myers EW, et al.
--   A Whole-Genome Assembly of Drosophila.
--   Science. 2000 Mar 24;287(5461):2196-204.
--   http://doi.org/10.1126/science.287.5461.2196
-- 
-- Contig consensus sequences are generated using an algorithm derived from pbdagcon:
--   Chin CS, et al.
--   Nonhybrid, finished microbial genome assemblies from long-read SMRT sequencing data.
--   Nat Methods. 2013 Jun;10(6):563-9
--   http://doi.org/10.1038/nmeth.2474
-- 
-- CONFIGURE CANU
--
-- Detected Java(TM) Runtime Environment '17.0.15-internal' (from '/share/org/YZWL/yzwl_lixg/.local/bin/java') without -d64 support.
--
-- WARNING:
-- WARNING:  Failed to run gnuplot using command 'gnuplot'.
-- WARNING:  Plots will be disabled.
-- WARNING:
--
-- Detected samtools version '1.22' / htslib version 'htscodecs=1.6.3' (from 'samtools').
--
-- Detected 88 CPUs and 503 gigabytes of memory on the local machine.
--
-- Detected Slurm with 'sinfo' binary in /opt/skyformai/bin/sinfo.
--          Slurm disabled by useGrid=false
--
-- Detected  '' with 'pbsnodes' binary in /opt/skyformai/bin/pbsnodes.
--           disabled by useGrid=false
--
-- Detected LSF with 'bsub' binary in /opt/skyformai/bin/bsub.
--          LSF disabled by useGrid=false
--
-- Local machine mode enabled; grid support not detected or not allowed.
--
-- Found trimmed raw PacBio HiFi reads in the input files.
--
--                                (tag)Concurrency
--                         (tag)Threads          |
--                (tag)Memory         |          |
--        (tag)             |         |          |       total usage      algorithm
--        -------  ----------  --------   --------  --------------------  -----------------------------
-- Local: meryl     12.000 GB    4 CPUs x  22 jobs   264.000 GB  88 CPUs  (k-mer counting)
-- Local: cormhap   13.000 GB   11 CPUs x   8 jobs   104.000 GB  88 CPUs  (overlap detection with mhap)
-- Local: obtovl     8.000 GB    8 CPUs x  11 jobs    88.000 GB  88 CPUs  (overlap detection)
-- Local: utgovl     8.000 GB    8 CPUs x  11 jobs    88.000 GB  88 CPUs  (overlap detection)
-- Local: cor        -.--- GB    4 CPUs x   - jobs     -.--- GB   - CPUs  (read correction)
-- Local: ovb        4.000 GB    1 CPU  x  88 jobs   352.000 GB  88 CPUs  (overlap store bucketizer)
-- Local: ovs        8.000 GB    1 CPU  x  62 jobs   496.000 GB  62 CPUs  (overlap store sorting)
-- Local: red       16.000 GB    4 CPUs x  22 jobs   352.000 GB  88 CPUs  (read error detection)
-- Local: oea        8.000 GB    1 CPU  x  62 jobs   496.000 GB  62 CPUs  (overlap error adjustment)
-- Local: bat       32.000 GB    8 CPUs x   1 job     32.000 GB   8 CPUs  (contig construction with bogart)
-- Local: cns        -.--- GB    8 CPUs x   - jobs     -.--- GB   - CPUs  (consensus)
--
-- Generating assembly 'A3-55' in '/share/org/YZWL/yzwl_lixg/project/28.大豆疫霉菌三代基因组/03.hicanu/A3-55/01.raw_output':
--   genomeSize:
--     85000000
--
--   Overlap Generation Limits:
--     corOvlErrorRate 0.0000 (  0.00%)
--     obtOvlErrorRate 0.0250 (  2.50%)
--     utgOvlErrorRate 0.0100 (  1.00%)
--
--   Overlap Processing Limits:
--     corErrorRate    0.0000 (  0.00%)
--     obtErrorRate    0.0250 (  2.50%)
--     utgErrorRate    0.0003 (  0.03%)
--     cnsErrorRate    0.0500 (  5.00%)
--
--   Stages to run:
--     assemble HiFi reads.
--
--
-- BEGIN STORE CREATION
----------------------------------------
-- Starting command on Thu Jan 15 18:22:51 2026 with 4587202.218 GB free disk space

    cd .
    ./A3-55.seqStore.sh \
    > ./A3-55.seqStore.err 2>&1

-- Finished on Thu Jan 15 18:29:22 2026 (391 seconds) with 4585702 GB free disk space
----------------------------------------
--
-- In sequence store './A3-55.seqStore':
--   Found 279610 reads.
--   Found 4250004169 bases (50 times coverage).
--    Histogram of corrected reads:
--    
--    G=4250004169                       sum of  ||               length     num
--    NG         length     index       lengths  ||                range    seqs
--    ----- ------------ --------- ------------  ||  ------------------- -------
--    00010        25410     15298    425015966  ||       1229-2423         8073|--------------------
--    00020        23030     32939    850003120  ||       2424-3618        13508|---------------------------------
--    00030        21479     52074   1275018639  ||       3619-4813        13577|----------------------------------
--    00040        20251     72470   1700004081  ||       4814-6008        12271|------------------------------
--    00050        19190     94033   2125010705  ||       6009-7203        10669|---------------------------
--    00060        18136    116808   2550015321  ||       7204-8398         9577|------------------------
--    00070        16925    141025   2975018628  ||       8399-9593         8746|----------------------
--    00080        15073    167459   3400014799  ||       9594-10788        7727|-------------------
--    00090         9919    201001   3825008807  ||      10789-11983        6877|-----------------
--    00100         1229    279610   4250004169  ||      11984-13178        6731|-----------------
--    001.000x              279610   4250004169  ||      13179-14373        7946|--------------------
--                                               ||      14374-15568       12196|------------------------------
--                                               ||      15569-16763       17861|--------------------------------------------
--                                               ||      16764-17958       23177|---------------------------------------------------------
--                                               ||      17959-19153       25817|---------------------------------------------------------------
--                                               ||      19154-20348       24218|------------------------------------------------------------
--                                               ||      20349-21543       19512|------------------------------------------------
--                                               ||      21544-22738       15049|-------------------------------------
--                                               ||      22739-23933       11204|----------------------------
--                                               ||      23934-25128        8066|--------------------
--                                               ||      25129-26323        5876|---------------
--                                               ||      26324-27518        4059|----------
--                                               ||      27519-28713        2824|-------
--                                               ||      28714-29908        1822|-----
--                                               ||      29909-31103        1059|---
--                                               ||      31104-32298         609|--
--                                               ||      32299-33493         290|-
--                                               ||      33494-34688         148|-
--                                               ||      34689-35883          70|-
--                                               ||      35884-37078          31|-
--                                               ||      37079-38273           9|-
--                                               ||      38274-39468           6|-
--                                               ||      39469-40663           1|-
--                                               ||      40664-41858           1|-
--                                               ||      41859-43053           1|-
--                                               ||      43054-44248           0|
--                                               ||      44249-45443           1|-
--                                               ||      45444-46638           0|
--                                               ||      46639-47833           0|
--                                               ||      47834-49028           1|-
--    
--
-- In sequence store './A3-55.seqStore':
--   Found 279610 reads.
--   Found 4250004169 bases (50 times coverage).
--    Histogram of corrected-trimmed reads:
--    
--    G=4250004169                       sum of  ||               length     num
--    NG         length     index       lengths  ||                range    seqs
--    ----- ------------ --------- ------------  ||  ------------------- -------
--    00010        25410     15298    425015966  ||       1229-2423         8073|--------------------
--    00020        23030     32939    850003120  ||       2424-3618        13508|---------------------------------
--    00030        21479     52074   1275018639  ||       3619-4813        13577|----------------------------------
--    00040        20251     72470   1700004081  ||       4814-6008        12271|------------------------------
--    00050        19190     94033   2125010705  ||       6009-7203        10669|---------------------------
--    00060        18136    116808   2550015321  ||       7204-8398         9577|------------------------
--    00070        16925    141025   2975018628  ||       8399-9593         8746|----------------------
--    00080        15073    167459   3400014799  ||       9594-10788        7727|-------------------
--    00090         9919    201001   3825008807  ||      10789-11983        6877|-----------------
--    00100         1229    279610   4250004169  ||      11984-13178        6731|-----------------
--    001.000x              279610   4250004169  ||      13179-14373        7946|--------------------
--                                               ||      14374-15568       12196|------------------------------
--                                               ||      15569-16763       17861|--------------------------------------------
--                                               ||      16764-17958       23177|---------------------------------------------------------
--                                               ||      17959-19153       25817|---------------------------------------------------------------
--                                               ||      19154-20348       24218|------------------------------------------------------------
--                                               ||      20349-21543       19512|------------------------------------------------
--                                               ||      21544-22738       15049|-------------------------------------
--                                               ||      22739-23933       11204|----------------------------
--                                               ||      23934-25128        8066|--------------------
--                                               ||      25129-26323        5876|---------------
--                                               ||      26324-27518        4059|----------
--                                               ||      27519-28713        2824|-------
--                                               ||      28714-29908        1822|-----
--                                               ||      29909-31103        1059|---
--                                               ||      31104-32298         609|--
--                                               ||      32299-33493         290|-
--                                               ||      33494-34688         148|-
--                                               ||      34689-35883          70|-
--                                               ||      35884-37078          31|-
--                                               ||      37079-38273           9|-
--                                               ||      38274-39468           6|-
--                                               ||      39469-40663           1|-
--                                               ||      40664-41858           1|-
--                                               ||      41859-43053           1|-
--                                               ||      43054-44248           0|
--                                               ||      44249-45443           1|-
--                                               ||      45444-46638           0|
--                                               ||      46639-47833           0|
--                                               ||      47834-49028           1|-
--    
--
-- Correction skipped; not enabled.
--
-- Trimming skipped; not enabled.
--
-- BEGIN ASSEMBLY
----------------------------------------
-- Starting command on Thu Jan 15 18:29:23 2026 with 4585701.953 GB free disk space

    cd unitigging/0-mercounts
    ./meryl-configure.sh \
    > ./meryl-configure.err 2>&1

-- Finished on Thu Jan 15 18:29:24 2026 (one second) with 4585701.953 GB free disk space
----------------------------------------
--  segments   memory batches
--  -------- -------- -------
--        01 10.81 GB       2
--        02  5.75 GB       2
--        04  2.97 GB       2
--        06  2.14 GB       2
--        08  1.61 GB       2
--        12  1.07 GB       2
--        16  0.81 GB       2
--        20  0.65 GB       2
--        24  0.54 GB       2
--        32  0.41 GB       2
--        40  0.32 GB       2
--        48  -.-- GB       -  (segment size too small)
--        56  -.-- GB       -  (segment size too small)
--        64  -.-- GB       -  (segment size too small)
--        96  -.-- GB       -  (segment size too small)
--
--  For 279610 reads with 4250004169 bases, limit to 42 batches.
--  Will count kmers using 01 jobs, each using 12 GB and 4 threads.
--
-- Finished stage 'merylConfigure', reset canuIteration.
--
-- Running jobs.  First attempt out of 2.
----------------------------------------
-- Starting 'meryl' concurrent execution on Thu Jan 15 18:29:24 2026 with 4585701.921 GB free disk space (1 processes; 22 concurrently)

    cd unitigging/0-mercounts
    ./meryl-count.sh 1 > ./meryl-count.000001.out 2>&1

-- Finished on Thu Jan 15 18:33:23 2026 (239 seconds) with 4584881.312 GB free disk space
----------------------------------------
-- Found 1 Kmer counting (meryl) outputs.
-- Finished stage 'utg-merylCountCheck', reset canuIteration.
--
-- Running jobs.  First attempt out of 2.
----------------------------------------
-- Starting 'meryl' concurrent execution on Thu Jan 15 18:33:23 2026 with 4584881.281 GB free disk space (1 processes; 22 concurrently)

    cd unitigging/0-mercounts
    ./meryl-process.sh 1 > ./meryl-process.000001.out 2>&1

-- Finished on Thu Jan 15 18:33:29 2026 (6 seconds) with 4584718.906 GB free disk space
----------------------------------------
-- Meryl finished successfully.  Kmer frequency histogram:
--
-- WARNING: gnuplot failed.
--
----------------------------------------
--
--  22-mers                                                                                           Fraction
--    Occurrences   NumMers                                                                         Unique Total
--       1-     1         0                                                                        0.0000 0.0000
--       2-     2    204635                                                                        0.0045 0.0001
--       3-     4     62567                                                                        0.0055 0.0002
--       5-     7     18403                                                                        0.0062 0.0002
--       8-    11      5948                                                                        0.0064 0.0002
--      12-    16     20432                                                                        0.0065 0.0003
--      17-    22     85392                                                                        0.0070 0.0004
--      23-    29    850822 ***                                                                    0.0098 0.0012
--      30-    37   5733811 *************************                                              0.0350 0.0111
--      38-    46  15949186 ********************************************************************** 0.1841 0.0848
--      47-    56  14029952 *************************************************************          0.5535 0.3084
--      57-    67   3191653 **************                                                         0.8363 0.5128
--      68-    79    623569 **                                                                     0.8941 0.5622
--      80-    92    974578 ****                                                                   0.9076 0.5763
--      93-   106    849798 ***                                                                    0.9296 0.6033
--     107-   121    313601 *                                                                      0.9476 0.6283
--     122-   137    271702 *                                                                      0.9541 0.6387
--     138-   154    282737 *                                                                      0.9603 0.6500
--     155-   172    167646                                                                        0.9664 0.6625
--     173-   191    161197                                                                        0.9700 0.6708
--     192-   211    112938                                                                        0.9736 0.6799
--     212-   232    112084                                                                        0.9760 0.6868
--     233-   254    104142                                                                        0.9786 0.6947
--     255-   277     86980                                                                        0.9808 0.7025
--     278-   301     77481                                                                        0.9827 0.7096
--     302-   326     69242                                                                        0.9845 0.7166
--     327-   352     56518                                                                        0.9860 0.7233
--     353-   379     46368                                                                        0.9872 0.7293
--     380-   407     44559                                                                        0.9883 0.7345
--     408-   436     38196                                                                        0.9892 0.7399
--     437-   466     36003                                                                        0.9901 0.7450
--     467-   497     27690                                                                        0.9909 0.7500
--     498-   529     25890                                                                        0.9915 0.7541
--     530-   562     23425                                                                        0.9921 0.7582
--     563-   596     19457                                                                        0.9926 0.7622
--     597-   631     17938                                                                        0.9930 0.7657
--     632-   667     15059                                                                        0.9934 0.7691
--     668-   704     13534                                                                        0.9937 0.7722
--     705-   742     12369                                                                        0.9940 0.7750
--     743-   781     14413                                                                        0.9943 0.7778
--     782-   821     11504                                                                        0.9946 0.7812
--
--           0 (max occurrences)
--  3213512743 (total mers, non-unique)
--    44993596 (distinct mers, non-unique)
--           0 (unique mers)
-- Finished stage 'meryl-process', reset canuIteration.
--
-- Removing meryl database 'unitigging/0-mercounts/A3-55.ms22'.
--
-- OVERLAPPER (normal) (assembly) erate=0.01
--
----------------------------------------
-- Starting command on Thu Jan 15 18:33:29 2026 with 4584718.89 GB free disk space

    cd unitigging/1-overlapper
    /share/org/YZWL/yzwl_lixg/miniforge3/envs/canu_v.2.3/bin/overlapInCorePartition \
     -S  ../../A3-55.seqStore \
     -hl 160000000 \
     -rl 5000000000 \
     -ol 500 \
     -o  ./A3-55.partition \
    > ./A3-55.partition.err 2>&1

-- Finished on Thu Jan 15 18:33:29 2026 (in the blink of an eye) with 4584718.859 GB free disk space
----------------------------------------
--
-- Configured 21 overlapInCore jobs.
-- Finished stage 'utg-overlapConfigure', reset canuIteration.
--
-- Running jobs.  First attempt out of 2.
----------------------------------------
-- Starting 'utgovl' concurrent execution on Thu Jan 15 18:33:29 2026 with 4584718.828 GB free disk space (21 processes; 11 concurrently)

    cd unitigging/1-overlapper
    ./overlap.sh 1 > ./overlap.000001.out 2>&1
    ./overlap.sh 2 > ./overlap.000002.out 2>&1
    ./overlap.sh 3 > ./overlap.000003.out 2>&1
    ./overlap.sh 4 > ./overlap.000004.out 2>&1
    ./overlap.sh 5 > ./overlap.000005.out 2>&1
    ./overlap.sh 6 > ./overlap.000006.out 2>&1
    ./overlap.sh 7 > ./overlap.000007.out 2>&1
    ./overlap.sh 8 > ./overlap.000008.out 2>&1
    ./overlap.sh 9 > ./overlap.000009.out 2>&1
    ./overlap.sh 10 > ./overlap.000010.out 2>&1
    ./overlap.sh 11 > ./overlap.000011.out 2>&1
    ./overlap.sh 12 > ./overlap.000012.out 2>&1
    ./overlap.sh 13 > ./overlap.000013.out 2>&1
    ./overlap.sh 14 > ./overlap.000014.out 2>&1
    ./overlap.sh 15 > ./overlap.000015.out 2>&1
    ./overlap.sh 16 > ./overlap.000016.out 2>&1
    ./overlap.sh 17 > ./overlap.000017.out 2>&1
    ./overlap.sh 18 > ./overlap.000018.out 2>&1
    ./overlap.sh 19 > ./overlap.000019.out 2>&1
    ./overlap.sh 20 > ./overlap.000020.out 2>&1
    ./overlap.sh 21 > ./overlap.000021.out 2>&1

-- Finished on Thu Jan 15 18:59:03 2026 (1534 seconds) with 4581275.359 GB free disk space
----------------------------------------
-- Found 21 overlapInCore output files.
--
-- overlapInCore compute 'unitigging/1-overlapper':
--   kmer hits
--     with no overlap       1345019691  56.7142857 +- 40082832.673
--     with an overlap         41661178  5.61904762 +- 1150992.011
--
--   overlaps                  41661178  5.61904762 +- 1150992.011
--     contained               10229161  .904761905 +- 274674.553
--     dovetail                31432017  2.71428571 +- 879054.891
--
--   overlaps rejected
--     multiple per pair              0           0 +- 0
--     bad short window               0           0 +- 0
--     bad long window                0           0 +- 0
-- Finished stage 'utg-overlapCheck', reset canuIteration.
----------------------------------------
-- Starting command on Thu Jan 15 18:59:03 2026 with 4581275.343 GB free disk space

    cd unitigging
    /share/org/YZWL/yzwl_lixg/miniforge3/envs/canu_v.2.3/bin/ovStoreConfig \
     -S ../A3-55.seqStore \
     -M 4-8 \
     -L ./1-overlapper/ovljob.files \
     -create ./A3-55.ovlStore.config \
     > ./A3-55.ovlStore.config.txt \
    2> ./A3-55.ovlStore.config.err

-- Finished on Thu Jan 15 18:59:03 2026 (lickety-split) with 4581275.328 GB free disk space
----------------------------------------
--
-- Creating overlap store unitigging/A3-55.ovlStore using:
--      1 bucket
--      1 slice
--        using at most 3 GB memory each
--
-- Running jobs.  First attempt out of 2.
----------------------------------------
-- Starting 'ovS' concurrent execution on Thu Jan 15 18:59:03 2026 with 4581275.312 GB free disk space (1 processes; 62 concurrently)

    cd unitigging
    ./A3-55.ovlStore.sh 1 > ./A3-55.ovlStore.000001.out 2>&1

-- Finished on Thu Jan 15 18:59:20 2026 (17 seconds) with 4581309.203 GB free disk space
----------------------------------------
-- Checking store.
----------------------------------------
-- Starting command on Thu Jan 15 18:59:20 2026 with 4581309.203 GB free disk space

    cd unitigging
    /share/org/YZWL/yzwl_lixg/miniforge3/envs/canu_v.2.3/bin/ovStoreDump \
     -S ../A3-55.seqStore \
     -O  ./A3-55.ovlStore \
     -counts \
     > ./A3-55.ovlStore/counts.dat 2> ./A3-55.ovlStore/counts.err

-- Finished on Thu Jan 15 18:59:20 2026 (like a bat out of hell) with 4581309.171 GB free disk space
----------------------------------------
--
-- Overlap store 'unitigging/A3-55.ovlStore' successfully constructed.
-- Found 83322356 overlaps for 272323 reads; 1377239 reads have no overlaps.
--
--
-- Purged 0.825 GB in 63 overlap output files.
----------------------------------------
-- Starting command on Thu Jan 15 18:59:21 2026 with 4581310.218 GB free disk space

    cd unitigging
    /share/org/YZWL/yzwl_lixg/miniforge3/envs/canu_v.2.3/bin/ovStoreStats \
     -C 50 \
     -S ../A3-55.seqStore \
     -O  ./A3-55.ovlStore \
     -o  ./A3-55.ovlStore \
     > ./A3-55.ovlStore.summary.err 2>&1

-- Finished on Thu Jan 15 18:59:33 2026 (12 seconds) with 4581310.203 GB free disk space
----------------------------------------
--
-- Overlap store 'unitigging/A3-55.ovlStore' contains:
--
--   category            reads     %          read length        feature size or coverage  analysis
--   ----------------  -------  -------  ----------------------  ------------------------  --------------------
--   middle-missing        161    0.06    14652.22 +- 6801.44        945.67 +- 1312.61    (bad trimming)
--   middle-hump            22    0.01    15942.82 +- 3750.36       6217.14 +- 4546.97    (bad trimming)
--   no-5-prime            574    0.21    12721.02 +- 5438.44       1692.89 +- 2730.88    (bad trimming)
--   no-3-prime            737    0.26    11214.32 +- 6122.36       1545.66 +- 2528.19    (bad trimming)
--   
--   low-coverage         1346    0.48     9976.70 +- 5487.12          5.94 +- 3.70       (easy to assemble, potential for lower quality consensus)
--   unique             223960   80.10    11639.29 +- 5572.50         45.51 +- 8.42       (easy to assemble, perfect, yay)
--   repeat-cont         20558    7.35     9719.27 +- 4869.55       1590.98 +- 1261.86    (potential for consensus errors, no impact on assembly)
--   repeat-dove           225    0.08    20182.06 +- 2320.12        640.46 +- 875.48     (hard to assemble, likely won't assemble correctly or even at all)
--   
--   span-repeat          2833    1.01    12786.35 +- 4960.57       2868.64 +- 3458.14    (read spans a large repeat, usually easy to assemble)
--   uniq-repeat-cont    14896    5.33    11866.81 +- 4531.58                             (should be uniquely placed, low potential for consensus errors, no impact on assembly)
--   uniq-repeat-dove     2830    1.01    18362.68 +- 2934.74                             (will end contigs, potential to misassemble)
--   uniq-anchor          4181    1.50    12782.13 +- 4584.39       7460.92 +- 4794.18    (repeat read, with unique section, probable bad read)
-- Finished stage 'utg-createOverlapStore', reset canuIteration.
--
-- Loading read lengths.
-- Loading number of overlaps per read.
--
-- Configure RED for 16gb memory.
--                   Batches of at most (unlimited) reads.
--                                      500000000 bases.
--                   Expecting evidence of at most 536870912 bases per iteration.
--
--           Total                                               Reads                 Olaps Evidence
--    Job   Memory      Read Range         Reads        Bases   Memory        Olaps   Memory   Memory  (Memory in MB)
--   ---- -------- ------------------- --------- ------------ -------- ------------ -------- --------
--      1 16385.96         1-37175          6285    108964081 13301.48      1090506    12.48  1024.00
--      2 16384.62     37176-74461          6397    108781714 13279.22      2918925    33.40  1024.00
--      3 16384.65     74462-120793         7897    108957813 13300.76      1038882    11.89  1024.00
--      4 16384.58    120794-168395         8091    108805001 13282.12      2661950    30.46  1024.00
--      5 16385.60    168396-205096         6312    108794447 13280.77      2868437    32.83  1024.00
--      6 16386.06    205097-251896         7937    108968676 13302.09      1046279    11.97  1024.00
--      7 16384.83    251897-299741         8024    108810536 13282.79      2624616    30.04  1024.00
--      8 16384.96    299742-336832         6274    108800041 13281.45      2752882    31.50  1024.00
--      9 16384.85    336833-383103         7785    108961156 13301.17      1020503    11.68  1024.00
--     10 16384.48    383104-430101         7931    108815877 13283.44      2537523    29.04  1024.00
--     11 16387.10    430102-466461         6255    108812111 13282.93      2811594    32.18  1024.00
--     12 16384.87    466462-511544         7719    108962120 13301.28      1012349    11.59  1024.00
--     13 16386.63    511545-557620         7790    108842440 13286.68      2442777    27.96  1024.00
--     14 16384.45    557621-594804         6213    108773791 13278.25      2988565    34.20  1024.00
--     15 16385.26    594805-641198         7757    108949561 13299.75      1180161    13.51  1024.00
--     16 16384.16    641199-685958         7529    108766284 13277.37      3039463    34.78  1024.00
--     17 16384.41    685959-723002         6313    108839083 13286.22      2288368    26.19  1024.00
--     18 16384.01    723003-768798         7848    108942773 13298.93      1142974    13.08  1024.00
--     19 16385.23    768799-813784         7542    108783366 13279.46      2950858    33.77  1024.00
--     20 16384.11    813785-850870         6277    108850900 13287.66      2136507    24.45  1024.00
--     21 16384.06    850871-897274         7925    108937122 13298.24      1207380    13.82  1024.00
--     22 16385.59    897275-937933         6944    108802119 13281.73      2784254    31.86  1024.00
--     23 16386.47    937934-973643         6189    108847102 13287.19      2383097    27.27  1024.00
--     24 16384.52    973644-1021807        8034    108927935 13297.12      1345764    15.40  1024.00
--     25 16385.44   1021808-1060827        6737    108796040 13280.98      2836691    32.46  1024.00
--     26 16384.19   1060828-1097732        6262    108831156 13285.25      2353848    26.94  1024.00
--     27 16384.04   1097733-1145415        8061    108923275 13296.55      1353431    15.49  1024.00
--     28 16384.36   1145416-1185113        6743    108832459 13285.42      2353608    26.93  1024.00
--     29 16385.01   1185114-1222198        6244    108844298 13286.85      2285275    26.15  1024.00
--     30 16385.00   1222199-1270792        8203    108927533 13297.08      1391301    15.92  1024.00
--     31 16384.03   1270793-1308768        6543    108801307 13281.62      2657648    30.41  1024.00
--     32 16386.58   1308769-1345975        6221    108863045 13289.14      2222960    25.44  1024.00
--     33 16384.05   1345976-1394311        8214    108906238 13294.48      1535932    17.58  1024.00
--     34 16385.65   1394312-1433408        6516    108825548 13284.57      2540501    29.07  1024.00
--     35 16387.22   1433409-1472050        6437    108871490 13290.18      2187693    25.04  1024.00
--     36 16384.94   1472051-1522983        8629    108795416 13280.96      2794214    31.98  1024.00
--     37 16384.29   1522984-1559053        6226    108921336 13296.26      1400946    16.03  1024.00
--     38 16385.00   1559054-1596695        6314    108834669 13285.68      2387157    27.32  1024.00
--     39 16385.97   1596696-1647501        8631    108815740 13283.44      2667748    30.53  1024.00
--     40  3624.50   1647502-1649562         361      4518570   551.59        78789     0.90  1024.00
--   ---- -------- ------------------- --------- ------------ -------- ------------ -------- --------
--                                                 4250004169              83322356
-- Finished stage 'readErrorDetectionConfigure', reset canuIteration.
--
-- Running jobs.  First attempt out of 2.
----------------------------------------
-- Starting 'red' concurrent execution on Thu Jan 15 18:59:40 2026 with 4581310.156 GB free disk space (40 processes; 22 concurrently)

    cd unitigging/3-overlapErrorAdjustment
    ./red.sh 1 > ./red.000001.out 2>&1
    ./red.sh 2 > ./red.000002.out 2>&1
    ./red.sh 3 > ./red.000003.out 2>&1
    ./red.sh 4 > ./red.000004.out 2>&1
    ./red.sh 5 > ./red.000005.out 2>&1
    ./red.sh 6 > ./red.000006.out 2>&1
    ./red.sh 7 > ./red.000007.out 2>&1
    ./red.sh 8 > ./red.000008.out 2>&1
    ./red.sh 9 > ./red.000009.out 2>&1
    ./red.sh 10 > ./red.000010.out 2>&1
    ./red.sh 11 > ./red.000011.out 2>&1
    ./red.sh 12 > ./red.000012.out 2>&1
    ./red.sh 13 > ./red.000013.out 2>&1
    ./red.sh 14 > ./red.000014.out 2>&1
    ./red.sh 15 > ./red.000015.out 2>&1
    ./red.sh 16 > ./red.000016.out 2>&1
    ./red.sh 17 > ./red.000017.out 2>&1
    ./red.sh 18 > ./red.000018.out 2>&1
    ./red.sh 19 > ./red.000019.out 2>&1
    ./red.sh 20 > ./red.000020.out 2>&1
    ./red.sh 21 > ./red.000021.out 2>&1
    ./red.sh 22 > ./red.000022.out 2>&1
    ./red.sh 23 > ./red.000023.out 2>&1
    ./red.sh 24 > ./red.000024.out 2>&1
    ./red.sh 25 > ./red.000025.out 2>&1
    ./red.sh 26 > ./red.000026.out 2>&1
    ./red.sh 27 > ./red.000027.out 2>&1
    ./red.sh 28 > ./red.000028.out 2>&1
    ./red.sh 29 > ./red.000029.out 2>&1
    ./red.sh 30 > ./red.000030.out 2>&1
    ./red.sh 31 > ./red.000031.out 2>&1
    ./red.sh 32 > ./red.000032.out 2>&1
    ./red.sh 33 > ./red.000033.out 2>&1
    ./red.sh 34 > ./red.000034.out 2>&1
    ./red.sh 35 > ./red.000035.out 2>&1
    ./red.sh 36 > ./red.000036.out 2>&1
    ./red.sh 37 > ./red.000037.out 2>&1
    ./red.sh 38 > ./red.000038.out 2>&1
    ./red.sh 39 > ./red.000039.out 2>&1
    ./red.sh 40 > ./red.000040.out 2>&1

-- Finished on Thu Jan 15 19:12:56 2026 (796 seconds) with 4581155.234 GB free disk space
----------------------------------------
-- Found 40 read error detection output files.
-- Finished stage 'readErrorDetectionCheck', reset canuIteration.
--
-- Loading read lengths.
-- Loading number of overlaps per read.
--
-- Configure OEA for 8gb memory.
--                   Batches of at most (unlimited) reads.
--                                      300000000 bases.
--
--           Total                                               Reads                 Olaps  Adjusts
--    Job   Memory      Read Range         Reads        Bases   Memory        Olaps   Memory   Memory  (Memory in MB)
--   ---- -------- ------------------- --------- ------------ -------- ------------ -------- --------
--      1  2854.18         1-106334        18142    300015734   294.67      4785559   146.04   365.47
--      2  2902.00    106335-225586        20397    300017524   294.74      6350101   193.79   365.47
--      3  2896.42    225587-347729        20466    300007577   294.73      6167686   188.22   365.47
--      4  2893.84    347730-467431        20344    300014430   294.74      6082976   185.64   365.47
--      5  2892.29    467432-586303        20149    300002985   294.72      6032603   184.10   365.47
--      6  2885.85    586304-705540        20007    300007259   294.72      5821543   177.66   365.47
--      7  2893.09    705541-824312        20160    300001935   294.72      6059016   184.91   365.47
--      8  2869.29    824313-939732        19661    300012511   294.71      5279193   161.11   365.47
--      9  2883.35    939733-1054160       19515    300012490   294.71      5739934   175.17   365.47
--     10  2889.78   1054161-1169731       19610    300013268   294.71      5950584   181.60   365.47
--     11  2893.49   1169732-1285216       19535    300006670   294.70      6072614   185.32   365.47
--     12  2895.88   1285217-1399105       19331    300019220   294.71      6150557   187.70   365.47
--     13  2846.86   1399106-1510661       18640    300004339   294.68      4545496   138.72   365.47
--     14  2894.38   1510662-1621772       18925    300000787   294.68      6102306   186.23   365.47
--     15  2535.76   1621773-1649562        4728     49867440    55.70      2182188    66.60   365.47
--   ---- -------- ------------------- --------- ------------ -------- ------------ -------- --------
--                                                 4250004169              83322356
-- Finished stage 'overlapErrorAdjustmentConfigure', reset canuIteration.
--
-- Running jobs.  First attempt out of 2.
----------------------------------------
-- Starting 'oea' concurrent execution on Thu Jan 15 19:13:04 2026 with 4581110.218 GB free disk space (15 processes; 62 concurrently)

    cd unitigging/3-overlapErrorAdjustment
    ./oea.sh 1 > ./oea.000001.out 2>&1
    ./oea.sh 2 > ./oea.000002.out 2>&1
    ./oea.sh 3 > ./oea.000003.out 2>&1
    ./oea.sh 4 > ./oea.000004.out 2>&1
    ./oea.sh 5 > ./oea.000005.out 2>&1
    ./oea.sh 6 > ./oea.000006.out 2>&1
    ./oea.sh 7 > ./oea.000007.out 2>&1
    ./oea.sh 8 > ./oea.000008.out 2>&1
    ./oea.sh 9 > ./oea.000009.out 2>&1
    ./oea.sh 10 > ./oea.000010.out 2>&1
    ./oea.sh 11 > ./oea.000011.out 2>&1
    ./oea.sh 12 > ./oea.000012.out 2>&1
    ./oea.sh 13 > ./oea.000013.out 2>&1
    ./oea.sh 14 > ./oea.000014.out 2>&1
    ./oea.sh 15 > ./oea.000015.out 2>&1

-- Finished on Thu Jan 15 19:42:10 2026 (1746 seconds) with 4586451.109 GB free disk space
----------------------------------------
-- Found 15 overlap error adjustment output files.
-- Finished stage 'overlapErrorAdjustmentCheck', reset canuIteration.
----------------------------------------
-- Starting command on Thu Jan 15 19:42:10 2026 with 4586451.093 GB free disk space

    cd unitigging/3-overlapErrorAdjustment
    /share/org/YZWL/yzwl_lixg/miniforge3/envs/canu_v.2.3/bin/loadErates \
      -S ../../A3-55.seqStore \
      -O ../A3-55.ovlStore \
      -L ./oea.files \
    > ./oea.apply.err 2>&1

-- Finished on Thu Jan 15 19:42:10 2026 (furiously fast) with 4586450.921 GB free disk space
----------------------------------------
-- No report available.
-- Finished stage 'updateOverlapStore', reset canuIteration.
-- Finished stage 'unitig', reset canuIteration.
--
-- Running jobs.  First attempt out of 2.
----------------------------------------
-- Starting 'bat' concurrent execution on Thu Jan 15 19:42:10 2026 with 4586450.875 GB free disk space (1 processes; 1 concurrently)

    cd unitigging/4-unitigger
    ./unitigger.sh 1 > ./unitigger.000001.out 2>&1

-- Finished on Thu Jan 15 19:42:32 2026 (22 seconds) with 4586419.859 GB free disk space
----------------------------------------
-- Unitigger finished successfully.
--  
--  ERROR RATES
--  -----------
--                                                   --------threshold------
--  302875                       fraction error      fraction        percent
--  samples                              (1e-5)         error          error
--                   --------------------------      --------       --------
--  command line (-eg)                           ->     30.00        0.0300%
--  command line (-ef)                           ->  -----.--      ---.----%
--  command line (-eM)                           ->     30.00        0.0300%
--  mean + std.dev       0.30 +-  12 *     2.49  ->     30.15        0.0302%
--  median + mad         0.00 +-  12 *     0.00  ->      0.00        0.0000%
--  90th percentile                              ->      1.00        0.0010%  (enabled)
--  
--  BEST EDGE FILTERING
--  -------------------
--  At graph threshold 0.0300%, reads:
--    available to have edges:        44521
--    with at least one edge:         35719
--  
--  At max threshold 0.0300%, reads:  (not computed)
--    available to have edges:            0
--    with at least one edge:             0
--  
--  At tight threshold 0.0010%, reads with:
--    both edges below error threshold:     31857  (80.00% minReadsBest threshold = 28575)
--    one  edge  above error threshold:      2877
--    both edges above error threshold:       985
--    at least one edge:                    35719
--  
--  At loose threshold 0.0300%, reads with:
--    both edges below error threshold:     35719  (80.00% minReadsBest threshold = 28575)
--    one  edge  above error threshold:         0
--    both edges above error threshold:         0
--    at least one edge:                    35719
--  
--  
--  INITIAL EDGES
--  -------- ----------------------------------------
--    230320 reads are contained
--   1388737 reads have no best edges (singleton)
--       321 reads have only one best edge (spur) 
--                160 are mutual best
--     30184 reads have two best edges 
--                674 have one mutual best edge
--              29178 have two mutual best edges
--  
--  
--  FINAL EDGES
--  -------- ----------------------------------------
--    230320 reads are contained
--   1389081 reads have no best edges (singleton)
--       203 reads have only one best edge (spur) 
--                169 are mutual best
--     29958 reads have two best edges 
--                539 have one mutual best edge
--              29170 have two mutual best edges
--  
--  
--  EDGE FILTERING
--  -------- ------------------------------------------
--         0 reads are ignored
--      9887 reads have a gap in overlap coverage
--       163 reads have lopsided best edges
-- Found, in version 1, after unitig construction:
--   contigs:      77 sequences, total length 68355948 bp (including 83 repeats of total length 2007672 bp).
--   bubbles:      113 sequences, total length 3005600 bp.
--   unassembled:  18740 sequences, total length 210590761 bp.
--
-- Contig sizes based on genome size 85mbp:
--
--            NG (bp)  LG (contigs)    sum (bp)
--         ----------  ------------  ----------
--     10     8803806             1     8803806
--     20     6188850             3    21601430
--     30     4398254             4    25999684
--     40     4092770             6    34194070
--     50     3429268             9    45202257
--     60     3256512            11    51834391
--     70     1354322            15    60457886
--     80       18992            56    68003868
--
-- Finished stage 'unitigCheck', reset canuIteration.
----------------------------------------
-- Starting command on Thu Jan 15 19:42:32 2026 with 4586419.843 GB free disk space

    cd unitigging
    /share/org/YZWL/yzwl_lixg/miniforge3/envs/canu_v.2.3/bin/utgcns \
      -S ../A3-55.seqStore \
      -T  ./A3-55.ctgStore 1 \
      -partition 0.8 1.5 0.1 \
    > ./A3-55.ctgStore/partitioning.log 2>&1

-- Finished on Thu Jan 15 19:42:41 2026 (9 seconds) with 4586418.64 GB free disk space
----------------------------------------
-- Using slow alignment for consensus (iteration '0').
-- Configured 10 consensus jobs.
-- Finished stage 'consensusConfigure', reset canuIteration.
--
-- Local: cns       13.000 GB    8 CPUs x  11 jobs   143.000 GB  88 CPUs  (consensus)
--
--
-- Running jobs.  First attempt out of 2.
----------------------------------------
-- Starting 'cns' concurrent execution on Thu Jan 15 19:42:41 2026 with 4586418.609 GB free disk space (10 processes; 11 concurrently)

    cd unitigging/5-consensus
    ./consensus.sh 1 > ./consensus.000001.out 2>&1
    ./consensus.sh 2 > ./consensus.000002.out 2>&1
    ./consensus.sh 3 > ./consensus.000003.out 2>&1
    ./consensus.sh 4 > ./consensus.000004.out 2>&1
    ./consensus.sh 5 > ./consensus.000005.out 2>&1
    ./consensus.sh 6 > ./consensus.000006.out 2>&1
    ./consensus.sh 7 > ./consensus.000007.out 2>&1
    ./consensus.sh 8 > ./consensus.000008.out 2>&1
    ./consensus.sh 9 > ./consensus.000009.out 2>&1
    ./consensus.sh 10 > ./consensus.000010.out 2>&1

-- Finished on Thu Jan 15 19:50:36 2026 (475 seconds) with 4587274.343 GB free disk space
----------------------------------------
-- Using slow alignment for consensus (iteration '1').
-- Configured 10 consensus jobs.
-- All 10 consensus jobs finished successfully.
-- Finished stage 'consensusCheck', reset canuIteration.
-- Using slow alignment for consensus (iteration '0').
-- Configured 10 consensus jobs.
----------------------------------------
-- Starting command on Thu Jan 15 19:50:36 2026 with 4587274.14 GB free disk space

    cd unitigging
    /share/org/YZWL/yzwl_lixg/miniforge3/envs/canu_v.2.3/bin/tgStoreLoad \
      -S ../A3-55.seqStore \
      -T  ./A3-55.ctgStore 2 \
      -L ./5-consensus/ctgcns.files \
    > ./5-consensus/ctgcns.files.ctgStoreLoad.err 2>&1

-- Finished on Thu Jan 15 19:50:37 2026 (one second) with 4587273.187 GB free disk space
----------------------------------------
----------------------------------------
-- Starting command on Thu Jan 15 19:50:37 2026 with 4587273.187 GB free disk space

    cd unitigging
    /share/org/YZWL/yzwl_lixg/miniforge3/envs/canu_v.2.3/bin/tgTigDisplay \
      -S ../A3-55.seqStore \
      -b \
      -o ../A3-55.contigs.unsorted.bam \
      -L ./5-consensus/ctgcns.files \
    > ./5-consensus/ctgcns.files.contigs.bam.err 2>&1

-- Finished on Thu Jan 15 19:53:35 2026 (178 seconds) with 4587406.531 GB free disk space
----------------------------------------
----------------------------------------
-- Starting command on Thu Jan 15 19:53:35 2026 with 4587406.531 GB free disk space

    cd .
    samtools sort \
      --write-index \
      --threads 2 \
      -o ./A3-55.contigs.bam ./A3-55.contigs.unsorted.bam \
    > ./ctgcns.bam.err 2>&1

-- Finished on Thu Jan 15 19:54:51 2026 (76 seconds) with 4587547.734 GB free disk space
----------------------------------------
-- Purging consensus output after loading to ctgStore.
-- Purged 10 .cns outputs.
----------------------------------------
-- Starting command on Thu Jan 15 19:54:51 2026 with 4587550.39 GB free disk space

    cd unitigging
    /share/org/YZWL/yzwl_lixg/miniforge3/envs/canu_v.2.3/bin/tgStoreDump \
      -S ../A3-55.seqStore \
      -T ./A3-55.ctgStore 2 \
      -sizes -s 85000000 \
    > ./A3-55.ctgStore/seqDB.v002.sizes.txt
ZERO length suplied to intervalList::add(), ignoring interval.
ZERO length suplied to intervalList::add(), ignoring interval.
ZERO length suplied to intervalList::add(), ignoring interval.
ZERO length suplied to intervalList::add(), ignoring interval.
ZERO length suplied to intervalList::add(), ignoring interval.
ZERO length suplied to intervalList::add(), ignoring interval.
ZERO length suplied to intervalList::add(), ignoring interval.
ZERO length suplied to intervalList::add(), ignoring interval.
ZERO length suplied to intervalList::add(), ignoring interval.

-- Finished on Thu Jan 15 19:54:51 2026 (furiously fast) with 4587550.39 GB free disk space
----------------------------------------
-- Found, in version 2, after consensus generation:
--   contigs:      77 sequences, total length 89160780 bp (including 83 repeats of total length 2781028 bp).
--   bubbles:      113 sequences, total length 4023141 bp.
--   unassembled:  18740 sequences, total length 289138421 bp.
--
-- Contig sizes based on genome size 85mbp:
--
--            NG (bp)  LG (contigs)    sum (bp)
--         ----------  ------------  ----------
--     10    11441755             1    11441755
--     20     8616427             2    20058182
--     30     8031149             3    28089331
--     40     5357993             5    39153619
--     50     5317108             6    44470727
--     60     4628927             8    54361655
--     70     4405221            10    63226688
--     80     3883456            12    71354594
--     90     2448574            14    76935713
--    100      768368            21    85723653
--
-- Finished stage 'consensusLoad', reset canuIteration.
----------------------------------------
-- Starting command on Thu Jan 15 19:54:51 2026 with 4587550.375 GB free disk space

    cd .
    /share/org/YZWL/yzwl_lixg/miniforge3/envs/canu_v.2.3/bin/tgStoreDump \
      -S ./A3-55.seqStore \
      -T ./unitigging/A3-55.ctgStore 2 \
      -o ./A3-55.contigs \
      -layout \
    > ./A3-55.contigs.layout.err 2>&1

-- Finished on Thu Jan 15 19:54:52 2026 (one second) with 4587550.328 GB free disk space
----------------------------------------
----------------------------------------
-- Starting command on Thu Jan 15 19:54:52 2026 with 4587550.328 GB free disk space

    cd .
    /share/org/YZWL/yzwl_lixg/miniforge3/envs/canu_v.2.3/bin/tgStoreDump \
      -S ./A3-55.seqStore \
      -T ./unitigging/A3-55.ctgStore 2 \
      -consensus -fasta \
      -unassembled \
    > ./A3-55.unassembled.fasta
    2> ./A3-55.unassembled.err
ZERO length suplied to intervalList::add(), ignoring interval.
ZERO length suplied to intervalList::add(), ignoring interval.
ZERO length suplied to intervalList::add(), ignoring interval.
ZERO length suplied to intervalList::add(), ignoring interval.
ZERO length suplied to intervalList::add(), ignoring interval.
ZERO length suplied to intervalList::add(), ignoring interval.
ZERO length suplied to intervalList::add(), ignoring interval.
ZERO length suplied to intervalList::add(), ignoring interval.
ZERO length suplied to intervalList::add(), ignoring interval.

-- Finished on Thu Jan 15 19:54:53 2026 (one second) with 4587550.046 GB free disk space
----------------------------------------
----------------------------------------
-- Starting command on Thu Jan 15 19:54:53 2026 with 4587550.046 GB free disk space

    cd .
    /share/org/YZWL/yzwl_lixg/miniforge3/envs/canu_v.2.3/bin/tgStoreDump \
      -S ./A3-55.seqStore \
      -T ./unitigging/A3-55.ctgStore 2 \
      -consensus -fasta \
      -contigs \
    > ./A3-55.contigs.fasta
    2> ./A3-55.contigs.err
ZERO length suplied to intervalList::add(), ignoring interval.
ZERO length suplied to intervalList::add(), ignoring interval.
ZERO length suplied to intervalList::add(), ignoring interval.
ZERO length suplied to intervalList::add(), ignoring interval.
ZERO length suplied to intervalList::add(), ignoring interval.
ZERO length suplied to intervalList::add(), ignoring interval.
ZERO length suplied to intervalList::add(), ignoring interval.
ZERO length suplied to intervalList::add(), ignoring interval.
ZERO length suplied to intervalList::add(), ignoring interval.

-- Finished on Thu Jan 15 19:54:54 2026 (one second) with 4587549.937 GB free disk space
----------------------------------------
-- Finished stage 'generateOutputs', reset canuIteration.
--
-- Assembly 'A3-55' finished in '/share/org/YZWL/yzwl_lixg/project/28.大豆疫霉菌三代基因组/03.hicanu/A3-55/01.raw_output'.
--
-- Summary saved in 'A3-55.report'.
--
-- Sequences saved:
--   Contigs       -> 'A3-55.contigs.fasta'
--   Unassembled   -> 'A3-55.unassembled.fasta'
--
-- Read layouts saved:
--   Contigs       -> 'A3-55.contigs.layout'.
--
-- Bye.

2026-01-15 19:54:54.178 - WARNING - 输出文件不存在|Output file does not exist: /share/org/YZWL/yzwl_lixg/project/28.大豆疫霉菌三代基因组/03.hicanu/A3-55/01.raw_output/A3-55.unitigs.fasta
Usage: biopytools ragtag [OPTIONS]
Try 'biopytools ragtag -h' for help.

Error: Invalid value for '-r' / '--reference': 文件不存在|File does not exist: /share/org/YZWL/yzwl_lixg/project/28.大豆疫霉菌三代基因组/04.ragtag/Psoja_T2T.fa
Usage: biopytools ragtag [OPTIONS]
Try 'biopytools ragtag -h' for help.

Error: Invalid value for '-r' / '--reference': 文件不存在|File does not exist: /share/org/YZWL/yzwl_lixg/project/28.大豆疫霉菌三代基因组/04.ragtag/Psoja_T2T.fa
mkdir: 无法创建目录 “04.ragtag/A3-55/hicanu/共线性”: No such file or directory
Usage: biopytools genomesyn [OPTIONS]
Try 'biopytools genomesyn -h' for help.

Error: Invalid value for '-i' / '--ref': Path '04.ragtag/A3-55/hifiasm/A3-55_RagTag_scaffolded.fa' does not exist.
Usage: biopytools genomesyn [OPTIONS]
Try 'biopytools genomesyn -h' for help.

Error: Invalid value for '-i' / '--ref': Path '04.ragtag/A3-55/hicanu/A3-55_RagTag_scaffolded.fa' does not exist.
Job 68882074 stderr output:

