2026-01-16 16:40:15.000 - WARNING - 命令错误输出|Command stderr:
-- canu master +27 changes (r10515 2a41e933b8de6ed66723d75d36dd071b46d2c347)
--
-- CITATIONS
--
-- For assemblies of PacBio HiFi reads:
--   Nurk S, Walenz BP, Rhiea A, Vollger MR, Logsdon GA, Grothe R, Miga KH, Eichler EE, Phillippy AM, Koren S.
--   HiCanu: accurate assembly of segmental duplications, satellites, and allelic variants from high-fidelity long reads.
--   biorXiv. 2020.
--   https://doi.org/10.1101/2020.03.14.992248
-- 
-- Read and contig alignments during correction and consensus use:
--   Šošic M, Šikic M.
--   Edlib: a C/C ++ library for fast, exact sequence alignment using edit distance.
--   Bioinformatics. 2017 May 1;33(9):1394-1395.
--   http://doi.org/10.1093/bioinformatics/btw753
-- 
-- Overlaps are generated using:
--   Berlin K, et al.
--   Assembling large genomes with single-molecule sequencing and locality-sensitive hashing.
--   Nat Biotechnol. 2015 Jun;33(6):623-30.
--   http://doi.org/10.1038/nbt.3238
-- 
--   Myers EW, et al.
--   A Whole-Genome Assembly of Drosophila.
--   Science. 2000 Mar 24;287(5461):2196-204.
--   http://doi.org/10.1126/science.287.5461.2196
-- 
-- Contig consensus sequences are generated using an algorithm derived from pbdagcon:
--   Chin CS, et al.
--   Nonhybrid, finished microbial genome assemblies from long-read SMRT sequencing data.
--   Nat Methods. 2013 Jun;10(6):563-9
--   http://doi.org/10.1038/nmeth.2474
-- 
-- CONFIGURE CANU
--
-- Detected Java(TM) Runtime Environment '25.0.1-internal' (from '/share/org/YZWL/yzwl_lixg/miniforge3/envs/telocomp/lib/jvm/bin/java') without -d64 support.
--
-- WARNING:
-- WARNING:  Failed to run gnuplot using command 'gnuplot'.
-- WARNING:  Plots will be disabled.
-- WARNING:
--
-- Detected samtools version '1.22' / htslib version 'htscodecs=1.6.3' (from 'samtools').
--
-- Detected 88 CPUs and 503 gigabytes of memory on the local machine.
--
-- Detected Slurm with 'sinfo' binary in /opt/skyformai/bin/sinfo.
--          Slurm disabled by useGrid=false
--
-- Detected  '' with 'pbsnodes' binary in /opt/skyformai/bin/pbsnodes.
--           disabled by useGrid=false
--
-- Detected LSF with 'bsub' binary in /opt/skyformai/bin/bsub.
--          LSF disabled by useGrid=false
--
-- Local machine mode enabled; grid support not detected or not allowed.
--
-- Found trimmed raw PacBio HiFi reads in the input files.
--
--                                (tag)Concurrency
--                         (tag)Threads          |
--                (tag)Memory         |          |
--        (tag)             |         |          |       total usage      algorithm
--        -------  ----------  --------   --------  --------------------  -----------------------------
-- Local: meryl     12.000 GB    4 CPUs x  22 jobs   264.000 GB  88 CPUs  (k-mer counting)
-- Local: cormhap   13.000 GB   11 CPUs x   8 jobs   104.000 GB  88 CPUs  (overlap detection with mhap)
-- Local: obtovl     8.000 GB    8 CPUs x  11 jobs    88.000 GB  88 CPUs  (overlap detection)
-- Local: utgovl     8.000 GB    8 CPUs x  11 jobs    88.000 GB  88 CPUs  (overlap detection)
-- Local: cor        -.--- GB    4 CPUs x   - jobs     -.--- GB   - CPUs  (read correction)
-- Local: ovb        4.000 GB    1 CPU  x  88 jobs   352.000 GB  88 CPUs  (overlap store bucketizer)
-- Local: ovs        8.000 GB    1 CPU  x  62 jobs   496.000 GB  62 CPUs  (overlap store sorting)
-- Local: red       16.000 GB    4 CPUs x  22 jobs   352.000 GB  88 CPUs  (read error detection)
-- Local: oea        8.000 GB    1 CPU  x  62 jobs   496.000 GB  62 CPUs  (overlap error adjustment)
-- Local: bat       32.000 GB    8 CPUs x   1 job     32.000 GB   8 CPUs  (contig construction with bogart)
-- Local: cns        -.--- GB    8 CPUs x   - jobs     -.--- GB   - CPUs  (consensus)
--
-- Generating assembly 'B4-18' in '/share/org/YZWL/yzwl_lixg/project/28.大豆疫霉菌三代基因组/03.hicanu/B4-18/01.raw_output':
--   genomeSize:
--     85000000
--
--   Overlap Generation Limits:
--     corOvlErrorRate 0.0000 (  0.00%)
--     obtOvlErrorRate 0.0250 (  2.50%)
--     utgOvlErrorRate 0.0100 (  1.00%)
--
--   Overlap Processing Limits:
--     corErrorRate    0.0000 (  0.00%)
--     obtErrorRate    0.0250 (  2.50%)
--     utgErrorRate    0.0003 (  0.03%)
--     cnsErrorRate    0.0500 (  5.00%)
--
--   Stages to run:
--     assemble HiFi reads.
--
--
-- BEGIN STORE CREATION
----------------------------------------
-- Starting command on Fri Jan 16 13:46:19 2026 with 4533050.468 GB free disk space

    cd .
    ./B4-18.seqStore.sh \
    > ./B4-18.seqStore.err 2>&1

-- Finished on Fri Jan 16 13:54:13 2026 (474 seconds) with 4532359.656 GB free disk space
----------------------------------------
--
-- In sequence store './B4-18.seqStore':
--   Found 258309 reads.
--   Found 4250008506 bases (50 times coverage).
--    Histogram of corrected reads:
--    
--    G=4250008506                       sum of  ||               length     num
--    NG         length     index       lengths  ||                range    seqs
--    ----- ------------ --------- ------------  ||  ------------------- -------
--    00010        24156     16067    425004151  ||       1252-2288         2985|------
--    00020        21822     34652    850014634  ||       2289-3325         4800|----------
--    00030        20234     54910   1275005503  ||       3326-4362         4677|----------
--    00040        19003     76606   1700004049  ||       4363-5399         4368|---------
--    00050        17969     99619   2125019076  ||       5400-6436         4120|---------
--    00060        17057    123904   2550006404  ||       6437-7473         3851|--------
--    00070        16213    149465   2975019871  ||       7474-8510         3805|--------
--    00080        15306    176420   3400016946  ||       8511-9547         3699|--------
--    00090        13824    205417   3825015279  ||       9548-10584        3321|-------
--    00100         1252    258309   4250008506  ||      10585-11621        3056|-------
--    001.000x              258309   4250008506  ||      11622-12658        4333|---------
--                                               ||      12659-13695        8386|-----------------
--                                               ||      13696-14732       16658|----------------------------------
--                                               ||      14733-15769       27302|-------------------------------------------------------
--                                               ||      15770-16806       31736|---------------------------------------------------------------
--                                               ||      16807-17843       28454|---------------------------------------------------------
--                                               ||      17844-18880       23670|-----------------------------------------------
--                                               ||      18881-19917       19229|---------------------------------------
--                                               ||      19918-20954       15087|------------------------------
--                                               ||      20955-21991       11903|------------------------
--                                               ||      21992-23028        9225|-------------------
--                                               ||      23029-24065        7060|---------------
--                                               ||      24066-25102        5339|-----------
--                                               ||      25103-26139        3831|--------
--                                               ||      26140-27176        2756|------
--                                               ||      27177-28213        1851|----
--                                               ||      28214-29250        1233|---
--                                               ||      29251-30287         729|--
--                                               ||      30288-31324         433|-
--                                               ||      31325-32361         241|-
--                                               ||      32362-33398         109|-
--                                               ||      33399-34435          44|-
--                                               ||      34436-35472          10|-
--                                               ||      35473-36509           4|-
--                                               ||      36510-37546           0|
--                                               ||      37547-38583           1|-
--                                               ||      38584-39620           1|-
--                                               ||      39621-40657           1|-
--                                               ||      40658-41694           0|
--                                               ||      41695-42731           1|-
--    
--
-- In sequence store './B4-18.seqStore':
--   Found 258309 reads.
--   Found 4250008506 bases (50 times coverage).
--    Histogram of corrected-trimmed reads:
--    
--    G=4250008506                       sum of  ||               length     num
--    NG         length     index       lengths  ||                range    seqs
--    ----- ------------ --------- ------------  ||  ------------------- -------
--    00010        24156     16067    425004151  ||       1252-2288         2985|------
--    00020        21822     34652    850014634  ||       2289-3325         4800|----------
--    00030        20234     54910   1275005503  ||       3326-4362         4677|----------
--    00040        19003     76606   1700004049  ||       4363-5399         4368|---------
--    00050        17969     99619   2125019076  ||       5400-6436         4120|---------
--    00060        17057    123904   2550006404  ||       6437-7473         3851|--------
--    00070        16213    149465   2975019871  ||       7474-8510         3805|--------
--    00080        15306    176420   3400016946  ||       8511-9547         3699|--------
--    00090        13824    205417   3825015279  ||       9548-10584        3321|-------
--    00100         1252    258309   4250008506  ||      10585-11621        3056|-------
--    001.000x              258309   4250008506  ||      11622-12658        4333|---------
--                                               ||      12659-13695        8386|-----------------
--                                               ||      13696-14732       16658|----------------------------------
--                                               ||      14733-15769       27302|-------------------------------------------------------
--                                               ||      15770-16806       31736|---------------------------------------------------------------
--                                               ||      16807-17843       28454|---------------------------------------------------------
--                                               ||      17844-18880       23670|-----------------------------------------------
--                                               ||      18881-19917       19229|---------------------------------------
--                                               ||      19918-20954       15087|------------------------------
--                                               ||      20955-21991       11903|------------------------
--                                               ||      21992-23028        9225|-------------------
--                                               ||      23029-24065        7060|---------------
--                                               ||      24066-25102        5339|-----------
--                                               ||      25103-26139        3831|--------
--                                               ||      26140-27176        2756|------
--                                               ||      27177-28213        1851|----
--                                               ||      28214-29250        1233|---
--                                               ||      29251-30287         729|--
--                                               ||      30288-31324         433|-
--                                               ||      31325-32361         241|-
--                                               ||      32362-33398         109|-
--                                               ||      33399-34435          44|-
--                                               ||      34436-35472          10|-
--                                               ||      35473-36509           4|-
--                                               ||      36510-37546           0|
--                                               ||      37547-38583           1|-
--                                               ||      38584-39620           1|-
--                                               ||      39621-40657           1|-
--                                               ||      40658-41694           0|
--                                               ||      41695-42731           1|-
--    
--
-- Correction skipped; not enabled.
--
-- Trimming skipped; not enabled.
--
-- BEGIN ASSEMBLY
----------------------------------------
-- Starting command on Fri Jan 16 13:54:14 2026 with 4532359.609 GB free disk space

    cd unitigging/0-mercounts
    ./meryl-configure.sh \
    > ./meryl-configure.err 2>&1

-- Finished on Fri Jan 16 13:54:15 2026 (one second) with 4532359.609 GB free disk space
----------------------------------------
--  segments   memory batches
--  -------- -------- -------
--        01 10.72 GB       2
--        02  5.69 GB       2
--        04  2.94 GB       2
--        06  2.12 GB       2
--        08  1.60 GB       2
--        12  1.06 GB       2
--        16  0.80 GB       2
--        20  0.64 GB       2
--        24  0.54 GB       2
--        32  0.40 GB       2
--        40  0.32 GB       2
--        48  -.-- GB       -  (segment size too small)
--        56  -.-- GB       -  (segment size too small)
--        64  -.-- GB       -  (segment size too small)
--        96  -.-- GB       -  (segment size too small)
--
--  For 258309 reads with 4250008506 bases, limit to 42 batches.
--  Will count kmers using 01 jobs, each using 12 GB and 4 threads.
--
-- Finished stage 'merylConfigure', reset canuIteration.
--
-- Running jobs.  First attempt out of 2.
----------------------------------------
-- Starting 'meryl' concurrent execution on Fri Jan 16 13:54:15 2026 with 4532359.578 GB free disk space (1 processes; 22 concurrently)

    cd unitigging/0-mercounts
    ./meryl-count.sh 1 > ./meryl-count.000001.out 2>&1

-- Finished on Fri Jan 16 13:57:40 2026 (205 seconds) with 4532289.406 GB free disk space
----------------------------------------
-- Found 1 Kmer counting (meryl) outputs.
-- Finished stage 'utg-merylCountCheck', reset canuIteration.
--
-- Running jobs.  First attempt out of 2.
----------------------------------------
-- Starting 'meryl' concurrent execution on Fri Jan 16 13:57:40 2026 with 4532289.375 GB free disk space (1 processes; 22 concurrently)

    cd unitigging/0-mercounts
    ./meryl-process.sh 1 > ./meryl-process.000001.out 2>&1

-- Finished on Fri Jan 16 13:57:44 2026 (4 seconds) with 4532289 GB free disk space
----------------------------------------
-- Meryl finished successfully.  Kmer frequency histogram:
--
-- WARNING: gnuplot failed.
--
----------------------------------------
--
--  22-mers                                                                                           Fraction
--    Occurrences   NumMers                                                                         Unique Total
--       1-     1         0                                                                        0.0000 0.0000
--       2-     2    235727                                                                        0.0052 0.0001
--       3-     4     90248                                                                        0.0066 0.0002
--       5-     7     30261                                                                        0.0076 0.0003
--       8-    11     11974                                                                        0.0080 0.0003
--      12-    16     21672                                                                        0.0083 0.0004
--      17-    22    126344                                                                        0.0089 0.0005
--      23-    29   1219266 ****                                                                   0.0128 0.0017
--      30-    37   8194658 *******************************                                        0.0487 0.0159
--      38-    46  18015473 ********************************************************************** 0.2621 0.1221
--      47-    56  10862494 ******************************************                             0.6603 0.3632
--      57-    67   1594131 ******                                                                 0.8703 0.5149
--      68-    79    738578 **                                                                     0.8989 0.5397
--      80-    92   1037032 ****                                                                   0.9160 0.5578
--      93-   106    579740 **                                                                     0.9388 0.5857
--     107-   121    284392 *                                                                      0.9507 0.6023
--     122-   137    292803 *                                                                      0.9569 0.6123
--     138-   154    216663                                                                        0.9633 0.6242
--     155-   172    149599                                                                        0.9681 0.6339
--     173-   191    148819                                                                        0.9713 0.6415
--     192-   211    117387                                                                        0.9746 0.6499
--     212-   232    113408                                                                        0.9772 0.6573
--     233-   254     93470                                                                        0.9797 0.6651
--     255-   277     80848                                                                        0.9817 0.6722
--     278-   301     76619                                                                        0.9835 0.6789
--     302-   326     65375                                                                        0.9852 0.6859
--     327-   352     51192                                                                        0.9867 0.6923
--     353-   379     48246                                                                        0.9878 0.6977
--     380-   407     42001                                                                        0.9889 0.7032
--     408-   436     35027                                                                        0.9898 0.7083
--     437-   466     29423                                                                        0.9906 0.7129
--     467-   497     24594                                                                        0.9912 0.7171
--     498-   529     21886                                                                        0.9918 0.7208
--     530-   562     20925                                                                        0.9922 0.7243
--     563-   596     18235                                                                        0.9927 0.7279
--     597-   631     17896                                                                        0.9931 0.7312
--     632-   667     17330                                                                        0.9935 0.7346
--     668-   704     15672                                                                        0.9939 0.7382
--     705-   742     12897                                                                        0.9942 0.7415
--     743-   781     12083                                                                        0.9945 0.7444
--     782-   821     16087                                                                        0.9948 0.7473
--
--           0 (max occurrences)
--  3190103421 (total mers, non-unique)
--    44999300 (distinct mers, non-unique)
--           0 (unique mers)
-- Finished stage 'meryl-process', reset canuIteration.
--
-- Removing meryl database 'unitigging/0-mercounts/B4-18.ms22'.
--
-- OVERLAPPER (normal) (assembly) erate=0.01
--
----------------------------------------
-- Starting command on Fri Jan 16 13:57:44 2026 with 4532290.078 GB free disk space

    cd unitigging/1-overlapper
    /share/org/YZWL/yzwl_lixg/miniforge3/envs/canu_v.2.3/bin/overlapInCorePartition \
     -S  ../../B4-18.seqStore \
     -hl 160000000 \
     -rl 5000000000 \
     -ol 500 \
     -o  ./B4-18.partition \
    > ./B4-18.partition.err 2>&1

-- Finished on Fri Jan 16 13:57:44 2026 (fast as lightning) with 4532290.062 GB free disk space
----------------------------------------
--
-- Configured 21 overlapInCore jobs.
-- Finished stage 'utg-overlapConfigure', reset canuIteration.
--
-- Running jobs.  First attempt out of 2.
----------------------------------------
-- Starting 'utgovl' concurrent execution on Fri Jan 16 13:57:44 2026 with 4532290.031 GB free disk space (21 processes; 11 concurrently)

    cd unitigging/1-overlapper
    ./overlap.sh 1 > ./overlap.000001.out 2>&1
    ./overlap.sh 2 > ./overlap.000002.out 2>&1
    ./overlap.sh 3 > ./overlap.000003.out 2>&1
    ./overlap.sh 4 > ./overlap.000004.out 2>&1
    ./overlap.sh 5 > ./overlap.000005.out 2>&1
    ./overlap.sh 6 > ./overlap.000006.out 2>&1
    ./overlap.sh 7 > ./overlap.000007.out 2>&1
    ./overlap.sh 8 > ./overlap.000008.out 2>&1
    ./overlap.sh 9 > ./overlap.000009.out 2>&1
    ./overlap.sh 10 > ./overlap.000010.out 2>&1
    ./overlap.sh 11 > ./overlap.000011.out 2>&1
    ./overlap.sh 12 > ./overlap.000012.out 2>&1
    ./overlap.sh 13 > ./overlap.000013.out 2>&1
    ./overlap.sh 14 > ./overlap.000014.out 2>&1
    ./overlap.sh 15 > ./overlap.000015.out 2>&1
    ./overlap.sh 16 > ./overlap.000016.out 2>&1
    ./overlap.sh 17 > ./overlap.000017.out 2>&1
    ./overlap.sh 18 > ./overlap.000018.out 2>&1
    ./overlap.sh 19 > ./overlap.000019.out 2>&1
    ./overlap.sh 20 > ./overlap.000020.out 2>&1
    ./overlap.sh 21 > ./overlap.000021.out 2>&1

-- Finished on Fri Jan 16 14:52:05 2026 (3261 seconds) with 4528827.187 GB free disk space
----------------------------------------
-- Found 21 overlapInCore output files.
--
-- overlapInCore compute 'unitigging/1-overlapper':
--   kmer hits
--     with no overlap       1284342105  47.8571429 +- 39052605.345
--     with an overlap         28154979  3.28571429 +- 894347.073
--
--   overlaps                  28154979  3.28571429 +- 894347.073
--     contained                5633996  .523809524 +- 177296.264
--     dovetail                22520983  7.76190476 +- 718021.774
--
--   overlaps rejected
--     multiple per pair              0           0 +- 0
--     bad short window               0           0 +- 0
--     bad long window                0           0 +- 0
-- Finished stage 'utg-overlapCheck', reset canuIteration.
----------------------------------------
-- Starting command on Fri Jan 16 14:52:05 2026 with 4528827.171 GB free disk space

    cd unitigging
    /share/org/YZWL/yzwl_lixg/miniforge3/envs/canu_v.2.3/bin/ovStoreConfig \
     -S ../B4-18.seqStore \
     -M 4-8 \
     -L ./1-overlapper/ovljob.files \
     -create ./B4-18.ovlStore.config \
     > ./B4-18.ovlStore.config.txt \
    2> ./B4-18.ovlStore.config.err

-- Finished on Fri Jan 16 14:52:05 2026 (furiously fast) with 4528827.156 GB free disk space
----------------------------------------
--
-- Creating overlap store unitigging/B4-18.ovlStore using:
--      1 bucket
--      1 slice
--        using at most 3 GB memory each
--
-- Running jobs.  First attempt out of 2.
----------------------------------------
-- Starting 'ovS' concurrent execution on Fri Jan 16 14:52:05 2026 with 4528827.14 GB free disk space (1 processes; 62 concurrently)

    cd unitigging
    ./B4-18.ovlStore.sh 1 > ./B4-18.ovlStore.000001.out 2>&1

-- Finished on Fri Jan 16 14:52:17 2026 (12 seconds) with 4528809.718 GB free disk space
----------------------------------------
-- Checking store.
----------------------------------------
-- Starting command on Fri Jan 16 14:52:17 2026 with 4528809.718 GB free disk space

    cd unitigging
    /share/org/YZWL/yzwl_lixg/miniforge3/envs/canu_v.2.3/bin/ovStoreDump \
     -S ../B4-18.seqStore \
     -O  ./B4-18.ovlStore \
     -counts \
     > ./B4-18.ovlStore/counts.dat 2> ./B4-18.ovlStore/counts.err

-- Finished on Fri Jan 16 14:52:17 2026 (furiously fast) with 4528810.187 GB free disk space
----------------------------------------
--
-- Overlap store 'unitigging/B4-18.ovlStore' successfully constructed.
-- Found 56309958 overlaps for 241612 reads; 1652132 reads have no overlaps.
--
--
-- Purged 0.644 GB in 63 overlap output files.
----------------------------------------
-- Starting command on Fri Jan 16 14:52:18 2026 with 4528810.187 GB free disk space

    cd unitigging
    /share/org/YZWL/yzwl_lixg/miniforge3/envs/canu_v.2.3/bin/ovStoreStats \
     -C 50 \
     -S ../B4-18.seqStore \
     -O  ./B4-18.ovlStore \
     -o  ./B4-18.ovlStore \
     > ./B4-18.ovlStore.summary.err 2>&1

-- Finished on Fri Jan 16 14:52:27 2026 (9 seconds) with 4528811.64 GB free disk space
----------------------------------------
--
-- Overlap store 'unitigging/B4-18.ovlStore' contains:
--
--   category            reads     %          read length        feature size or coverage  analysis
--   ----------------  -------  -------  ----------------------  ------------------------  --------------------
--   middle-missing        158    0.06    14024.68 +- 4888.69        967.27 +- 1287.11    (bad trimming)
--   middle-hump            60    0.02    12844.98 +- 2992.81       4491.25 +- 2613.23    (bad trimming)
--   no-5-prime            973    0.38    12113.05 +- 3423.28       2559.34 +- 2846.16    (bad trimming)
--   no-3-prime           1102    0.43    11838.16 +- 3916.48       2645.60 +- 2850.13    (bad trimming)
--   
--   low-coverage         3464    1.34    10409.08 +- 3550.20          5.72 +- 3.64       (easy to assemble, potential for lower quality consensus)
--   unique             194739   75.39    12664.23 +- 4230.97         43.07 +- 7.87       (easy to assemble, perfect, yay)
--   repeat-cont         15363    5.95    11323.88 +- 4216.57       1352.57 +- 1028.51    (potential for consensus errors, no impact on assembly)
--   repeat-dove           202    0.08    19981.07 +- 2123.68        750.65 +- 853.40     (hard to assemble, likely won't assemble correctly or even at all)
--   
--   span-repeat          2521    0.98    13096.52 +- 3676.63       3461.32 +- 3521.58    (read spans a large repeat, usually easy to assemble)
--   uniq-repeat-cont    14664    5.68    12313.52 +- 3329.66                             (should be uniquely placed, low potential for consensus errors, no impact on assembly)
--   uniq-repeat-dove     2934    1.14    17366.94 +- 2846.90                             (will end contigs, potential to misassemble)
--   uniq-anchor          5432    2.10    12890.73 +- 3495.49       7908.99 +- 4181.09    (repeat read, with unique section, probable bad read)
-- Finished stage 'utg-createOverlapStore', reset canuIteration.
--
-- Loading read lengths.
-- Loading number of overlaps per read.
--
-- Configure RED for 16gb memory.
--                   Batches of at most (unlimited) reads.
--                                      500000000 bases.
--                   Expecting evidence of at most 536870912 bases per iteration.
--
--           Total                                               Reads                 Olaps Evidence
--    Job   Memory      Read Range         Reads        Bases   Memory        Olaps   Memory   Memory  (Memory in MB)
--   ---- -------- ------------------- --------- ------------ -------- ------------ -------- --------
--      1 16384.39         1-43856          6000    108984980 13304.02       731224     8.37  1024.00
--      2 16384.43     43857-91028          6445    108892578 13292.75      1719353    19.68  1024.00
--      3 16385.33     91029-141083         6813    108929130 13297.23      1407452    16.11  1024.00
--      4 16385.97    141084-186366         6205    108955627 13300.44      1181772    13.52  1024.00
--      5 16384.93    186367-235990         6792    108890822 13292.55      1781001    20.38  1024.00
--      6 16384.53    235991-289462         7123    108897149 13293.33      1677330    19.20  1024.00
--      7 16384.89    289463-335092         6195    108978134 13303.19       847977     9.70  1024.00
--      8 16384.18    335093-384760         6796    108865448 13289.45      1985633    22.72  1024.00
--      9 16384.04    384761-437877         7385    108885424 13291.91      1759184    20.13  1024.00
--     10 16385.77    437878-483431         6182    108991158 13304.78       785993     8.99  1024.00
--     11 16385.60    483432-532607         6658    108888813 13292.30      1860897    21.30  1024.00
--     12 16386.15    532608-587104         7381    108908030 13294.67      1701834    19.48  1024.00
--     13 16384.34    587105-632716         6158    108984141 13303.92       735738     8.42  1024.00
--     14 16384.99    632717-681398         6595    108879583 13291.17      1906528    21.82  1024.00
--     15 16384.40    681399-734555         7303    108890909 13292.58      1731757    19.82  1024.00
--     16 16385.03    734556-778757         6148    108986284 13304.18       772791     8.84  1024.00
--     17 16385.07    778758-826576         6538    108888697 13292.28      1816684    20.79  1024.00
--     18 16385.95    826577-881594         7514    108909119 13294.81      1672417    19.14  1024.00
--     19 16384.94    881595-926879         6166    108981564 13303.61       815773     9.34  1024.00
--     20 16384.60    926880-974970         6517    108874239 13290.52      1929600    22.08  1024.00
--     21 16384.77    974971-1029781        7492    108895471 13293.14      1714904    19.63  1024.00
--     22 16386.24   1029782-1074349        6119    108995874 13305.35       776389     8.89  1024.00
--     23 16384.80   1074350-1121860        6492    108883933 13291.70      1843364    21.10  1024.00
--     24 16386.81   1121861-1175522        7365    108909328 13294.83      1745733    19.98  1024.00
--     25 16385.58   1175523-1220557        6074    109000071 13305.86       674596     7.72  1024.00
--     26 16384.62   1220558-1267505        6367    108881490 13291.40      1854452    21.22  1024.00
--     27 16385.75   1267506-1321903        7355    108907661 13294.62      1671116    19.12  1024.00
--     28 16384.70   1321904-1366194        6055    108991566 13304.83       687984     7.87  1024.00
--     29 16384.13   1366195-1413205        6332    108863832 13289.24      2000140    22.89  1024.00
--     30 16384.58   1413206-1466916        7314    108908389 13294.71      1560989    17.86  1024.00
--     31 16384.37   1466917-1510457        6002    108987040 13304.27       707976     8.10  1024.00
--     32 16384.72   1510458-1556585        6313    108871202 13290.14      1972684    22.58  1024.00
--     33 16384.77   1556586-1609099        7213    108900035 13293.69      1667213    19.08  1024.00
--     34 16385.31   1609100-1651618        5982    108994055 13305.13       714893     8.18  1024.00
--     35 16386.86   1651619-1697862        6220    108890423 13292.48      1955666    22.38  1024.00
--     36 16384.38   1697863-1750735        7220    108896285 13293.23      1673107    19.15  1024.00
--     37 16385.49   1750736-1795020        5955    108995104 13305.25       720054     8.24  1024.00
--     38 16385.19   1795021-1840450        6200    108880059 13291.22      1919531    21.97  1024.00
--     39 16385.01   1840451-1892670        7174    108910422 13294.96      1577374    18.05  1024.00
--     40  3314.83   1892671-1893744         151      1984437   242.25        50855     0.58  1024.00
--   ---- -------- ------------------- --------- ------------ -------- ------------ -------- --------
--                                                 4250008506              56309958
-- Finished stage 'readErrorDetectionConfigure', reset canuIteration.
--
-- Running jobs.  First attempt out of 2.
----------------------------------------
-- Starting 'red' concurrent execution on Fri Jan 16 14:52:34 2026 with 4528811.593 GB free disk space (40 processes; 22 concurrently)

    cd unitigging/3-overlapErrorAdjustment
    ./red.sh 1 > ./red.000001.out 2>&1
    ./red.sh 2 > ./red.000002.out 2>&1
    ./red.sh 3 > ./red.000003.out 2>&1
    ./red.sh 4 > ./red.000004.out 2>&1
    ./red.sh 5 > ./red.000005.out 2>&1
    ./red.sh 6 > ./red.000006.out 2>&1
    ./red.sh 7 > ./red.000007.out 2>&1
    ./red.sh 8 > ./red.000008.out 2>&1
    ./red.sh 9 > ./red.000009.out 2>&1
    ./red.sh 10 > ./red.000010.out 2>&1
    ./red.sh 11 > ./red.000011.out 2>&1
    ./red.sh 12 > ./red.000012.out 2>&1
    ./red.sh 13 > ./red.000013.out 2>&1
    ./red.sh 14 > ./red.000014.out 2>&1
    ./red.sh 15 > ./red.000015.out 2>&1
    ./red.sh 16 > ./red.000016.out 2>&1
    ./red.sh 17 > ./red.000017.out 2>&1
    ./red.sh 18 > ./red.000018.out 2>&1
    ./red.sh 19 > ./red.000019.out 2>&1
    ./red.sh 20 > ./red.000020.out 2>&1
    ./red.sh 21 > ./red.000021.out 2>&1
    ./red.sh 22 > ./red.000022.out 2>&1
    ./red.sh 23 > ./red.000023.out 2>&1
    ./red.sh 24 > ./red.000024.out 2>&1
    ./red.sh 25 > ./red.000025.out 2>&1
    ./red.sh 26 > ./red.000026.out 2>&1
    ./red.sh 27 > ./red.000027.out 2>&1
    ./red.sh 28 > ./red.000028.out 2>&1
    ./red.sh 29 > ./red.000029.out 2>&1
    ./red.sh 30 > ./red.000030.out 2>&1
    ./red.sh 31 > ./red.000031.out 2>&1
    ./red.sh 32 > ./red.000032.out 2>&1
    ./red.sh 33 > ./red.000033.out 2>&1
    ./red.sh 34 > ./red.000034.out 2>&1
    ./red.sh 35 > ./red.000035.out 2>&1
    ./red.sh 36 > ./red.000036.out 2>&1
    ./red.sh 37 > ./red.000037.out 2>&1
    ./red.sh 38 > ./red.000038.out 2>&1
    ./red.sh 39 > ./red.000039.out 2>&1
    ./red.sh 40 > ./red.000040.out 2>&1

-- Finished on Fri Jan 16 15:15:35 2026 (1381 seconds) with 4525078.562 GB free disk space
----------------------------------------
-- Found 40 read error detection output files.
-- Finished stage 'readErrorDetectionCheck', reset canuIteration.
--
-- Loading read lengths.
-- Loading number of overlaps per read.
--
-- Configure OEA for 8gb memory.
--                   Batches of at most (unlimited) reads.
--                                      300000000 bases.
--
--           Total                                               Reads                 Olaps  Adjusts
--    Job   Memory      Read Range         Reads        Bases   Memory        Olaps   Memory   Memory  (Memory in MB)
--   ---- -------- ------------------- --------- ------------ -------- ------------ -------- --------
--      1  2826.43         1-129919        17768    300003510   294.65      3692974   112.70   371.08
--      2  2848.69    129920-267010        18639    300009752   294.68      4421102   134.92   371.08
--      3  2831.44    267011-401432        18278    300015142   294.67      3856159   117.68   371.08
--      4  2829.23    401433-533647        18041    300001701   294.65      3784413   115.49   371.08
--      5  2840.73    533648-669747        18415    300000316   294.66      4160810   126.98   371.08
--      6  2839.27    669748-803771        18386    300009860   294.67      4112969   125.52   371.08
--      7  2831.49    803772-940141        18615    300003828   294.67      3857889   117.73   371.08
--      8  2819.17    940142-1075752       18598    300005837   294.68      3454254   105.42   371.08
--      9  2838.98   1075753-1210567       18396    300001819   294.67      4103705   125.24   371.08
--     10  2835.71   1210568-1346418       18315    300000838   294.66      3996374   121.96   371.08
--     11  2839.61   1346419-1479955       18203    300014476   294.67      4124070   125.86   371.08
--     12  2840.74   1479956-1611391       18057    300005454   294.66      4161544   127.00   371.08
--     13  2833.72   1611392-1740064       17683    300011247   294.65      3931641   119.98   371.08
--     14  2820.17   1740065-1867314       17322    300005638   294.64      3488114   106.45   371.08
--     15  2510.32   1867315-1893744        3593     49919088    55.72      1163940    35.52   371.08
--   ---- -------- ------------------- --------- ------------ -------- ------------ -------- --------
--                                                 4250008506              56309958
-- Finished stage 'overlapErrorAdjustmentConfigure', reset canuIteration.
--
-- Running jobs.  First attempt out of 2.
----------------------------------------
-- Starting 'oea' concurrent execution on Fri Jan 16 15:15:43 2026 with 4525078.375 GB free disk space (15 processes; 62 concurrently)

    cd unitigging/3-overlapErrorAdjustment
    ./oea.sh 1 > ./oea.000001.out 2>&1
    ./oea.sh 2 > ./oea.000002.out 2>&1
    ./oea.sh 3 > ./oea.000003.out 2>&1
    ./oea.sh 4 > ./oea.000004.out 2>&1
    ./oea.sh 5 > ./oea.000005.out 2>&1
    ./oea.sh 6 > ./oea.000006.out 2>&1
    ./oea.sh 7 > ./oea.000007.out 2>&1
    ./oea.sh 8 > ./oea.000008.out 2>&1
    ./oea.sh 9 > ./oea.000009.out 2>&1
    ./oea.sh 10 > ./oea.000010.out 2>&1
    ./oea.sh 11 > ./oea.000011.out 2>&1
    ./oea.sh 12 > ./oea.000012.out 2>&1
    ./oea.sh 13 > ./oea.000013.out 2>&1
    ./oea.sh 14 > ./oea.000014.out 2>&1
    ./oea.sh 15 > ./oea.000015.out 2>&1

-- Finished on Fri Jan 16 16:27:46 2026 (4323 seconds) with 4520358.171 GB free disk space
----------------------------------------
-- Found 15 overlap error adjustment output files.
-- Finished stage 'overlapErrorAdjustmentCheck', reset canuIteration.
----------------------------------------
-- Starting command on Fri Jan 16 16:27:46 2026 with 4520358.156 GB free disk space

    cd unitigging/3-overlapErrorAdjustment
    /share/org/YZWL/yzwl_lixg/miniforge3/envs/canu_v.2.3/bin/loadErates \
      -S ../../B4-18.seqStore \
      -O ../B4-18.ovlStore \
      -L ./oea.files \
    > ./oea.apply.err 2>&1

-- Finished on Fri Jan 16 16:27:46 2026 (fast as lightning) with 4520358.031 GB free disk space
----------------------------------------
-- No report available.
-- Finished stage 'updateOverlapStore', reset canuIteration.
-- Finished stage 'unitig', reset canuIteration.
--
-- Running jobs.  First attempt out of 2.
----------------------------------------
-- Starting 'bat' concurrent execution on Fri Jan 16 16:27:46 2026 with 4520357.984 GB free disk space (1 processes; 1 concurrently)

    cd unitigging/4-unitigger
    ./unitigger.sh 1 > ./unitigger.000001.out 2>&1

-- Finished on Fri Jan 16 16:27:59 2026 (13 seconds) with 4520357.796 GB free disk space
----------------------------------------
-- Unitigger finished successfully.
--  
--  ERROR RATES
--  -----------
--                                                   --------threshold------
--  272933                       fraction error      fraction        percent
--  samples                              (1e-5)         error          error
--                   --------------------------      --------       --------
--  command line (-eg)                           ->     30.00        0.0300%
--  command line (-ef)                           ->  -----.--      ---.----%
--  command line (-eM)                           ->     30.00        0.0300%
--  mean + std.dev       0.53 +-  12 *     3.37  ->     40.95        0.0410%
--  median + mad         0.00 +-  12 *     0.00  ->      0.00        0.0000%
--  90th percentile                              ->      1.00        0.0010%  (enabled)
--  
--  BEST EDGE FILTERING
--  -------------------
--  At graph threshold 0.0300%, reads:
--    available to have edges:        57528
--    with at least one edge:         38420
--  
--  At max threshold 0.0300%, reads:
--    available to have edges:        57528
--    with at least one edge:         38420
--  
--  At tight threshold 0.0010%, reads with:
--    both edges below error threshold:     32806  (80.00% minReadsBest threshold = 30736)
--    one  edge  above error threshold:      4196
--    both edges above error threshold:      1418
--    at least one edge:                    38420
--  
--  At loose threshold 0.0300%, reads with:
--    both edges below error threshold:     38420  (80.00% minReadsBest threshold = 30736)
--    one  edge  above error threshold:         0
--    both edges above error threshold:         0
--    at least one edge:                    38420
--  
--  
--  INITIAL EDGES
--  -------- ----------------------------------------
--    194927 reads are contained
--   1666887 reads have no best edges (singleton)
--       666 reads have only one best edge (spur) 
--                394 are mutual best
--     31264 reads have two best edges 
--                900 have one mutual best edge
--              29923 have two mutual best edges
--  
--  
--  FINAL EDGES
--  -------- ----------------------------------------
--    194927 reads are contained
--   1667314 reads have no best edges (singleton)
--       514 reads have only one best edge (spur) 
--                390 are mutual best
--     30989 reads have two best edges 
--                728 have one mutual best edge
--              29918 have two mutual best edges
--  
--  
--  EDGE FILTERING
--  -------- ------------------------------------------
--         0 reads are ignored
--     11570 reads have a gap in overlap coverage
--       174 reads have lopsided best edges
-- Found, in version 1, after unitig construction:
--   contigs:      152 sequences, total length 70028388 bp (including 141 repeats of total length 3304113 bp).
--   bubbles:      158 sequences, total length 3599068 bp.
--   unassembled:  32079 sequences, total length 351674105 bp.
--
-- Contig sizes based on genome size 85mbp:
--
--            NG (bp)  LG (contigs)    sum (bp)
--         ----------  ------------  ----------
--     10     8860465             1     8860465
--     20     6223648             3    21612478
--     30     4047919             4    25660397
--     40     3649116             7    37032415
--     50     3332215             9    43898876
--     60     2701245            12    52471217
--     70     1744182            16    60713196
--     80       31996            56    68021507
--
-- Finished stage 'unitigCheck', reset canuIteration.
----------------------------------------
-- Starting command on Fri Jan 16 16:27:59 2026 with 4520357.781 GB free disk space

    cd unitigging
    /share/org/YZWL/yzwl_lixg/miniforge3/envs/canu_v.2.3/bin/utgcns \
      -S ../B4-18.seqStore \
      -T  ./B4-18.ctgStore 1 \
      -partition 0.8 1.5 0.1 \
    > ./B4-18.ctgStore/partitioning.log 2>&1

-- Finished on Fri Jan 16 16:28:09 2026 (10 seconds) with 4520356.562 GB free disk space
----------------------------------------
-- Using slow alignment for consensus (iteration '0').
-- Configured 10 consensus jobs.
-- Finished stage 'consensusConfigure', reset canuIteration.
--
-- Local: cns       13.125 GB    8 CPUs x  11 jobs   144.375 GB  88 CPUs  (consensus)
--
--
-- Running jobs.  First attempt out of 2.
----------------------------------------
-- Starting 'cns' concurrent execution on Fri Jan 16 16:28:09 2026 with 4520356.531 GB free disk space (10 processes; 11 concurrently)

    cd unitigging/5-consensus
    ./consensus.sh 1 > ./consensus.000001.out 2>&1
    ./consensus.sh 2 > ./consensus.000002.out 2>&1
    ./consensus.sh 3 > ./consensus.000003.out 2>&1
    ./consensus.sh 4 > ./consensus.000004.out 2>&1
    ./consensus.sh 5 > ./consensus.000005.out 2>&1
    ./consensus.sh 6 > ./consensus.000006.out 2>&1
    ./consensus.sh 7 > ./consensus.000007.out 2>&1
    ./consensus.sh 8 > ./consensus.000008.out 2>&1
    ./consensus.sh 9 > ./consensus.000009.out 2>&1
    ./consensus.sh 10 > ./consensus.000010.out 2>&1

-- Finished on Fri Jan 16 16:36:03 2026 (474 seconds) with 4520296.796 GB free disk space
----------------------------------------
-- Using slow alignment for consensus (iteration '1').
-- Configured 10 consensus jobs.
-- All 10 consensus jobs finished successfully.
-- Finished stage 'consensusCheck', reset canuIteration.
-- Using slow alignment for consensus (iteration '0').
-- Configured 10 consensus jobs.
----------------------------------------
-- Starting command on Fri Jan 16 16:36:04 2026 with 4520296.734 GB free disk space

    cd unitigging
    /share/org/YZWL/yzwl_lixg/miniforge3/envs/canu_v.2.3/bin/tgStoreLoad \
      -S ../B4-18.seqStore \
      -T  ./B4-18.ctgStore 2 \
      -L ./5-consensus/ctgcns.files \
    > ./5-consensus/ctgcns.files.ctgStoreLoad.err 2>&1

-- Finished on Fri Jan 16 16:36:05 2026 (one second) with 4520295.5 GB free disk space
----------------------------------------
----------------------------------------
-- Starting command on Fri Jan 16 16:36:05 2026 with 4520295.5 GB free disk space

    cd unitigging
    /share/org/YZWL/yzwl_lixg/miniforge3/envs/canu_v.2.3/bin/tgTigDisplay \
      -S ../B4-18.seqStore \
      -b \
      -o ../B4-18.contigs.unsorted.bam \
      -L ./5-consensus/ctgcns.files \
    > ./5-consensus/ctgcns.files.contigs.bam.err 2>&1

-- Finished on Fri Jan 16 16:38:50 2026 (165 seconds) with 4520189.75 GB free disk space
----------------------------------------
----------------------------------------
-- Starting command on Fri Jan 16 16:38:50 2026 with 4520189.75 GB free disk space

    cd .
    samtools sort \
      --write-index \
      --threads 2 \
      -o ./B4-18.contigs.bam ./B4-18.contigs.unsorted.bam \
    > ./ctgcns.bam.err 2>&1

-- Finished on Fri Jan 16 16:39:59 2026 (69 seconds) with 4520158.421 GB free disk space
----------------------------------------
-- Purging consensus output after loading to ctgStore.
-- Purged 10 .cns outputs.
----------------------------------------
-- Starting command on Fri Jan 16 16:40:10 2026 with 4520161.5 GB free disk space

    cd unitigging
    /share/org/YZWL/yzwl_lixg/miniforge3/envs/canu_v.2.3/bin/tgStoreDump \
      -S ../B4-18.seqStore \
      -T ./B4-18.ctgStore 2 \
      -sizes -s 85000000 \
    > ./B4-18.ctgStore/seqDB.v002.sizes.txt
ZERO length suplied to intervalList::add(), ignoring interval.
ZERO length suplied to intervalList::add(), ignoring interval.
ZERO length suplied to intervalList::add(), ignoring interval.
ZERO length suplied to intervalList::add(), ignoring interval.
ZERO length suplied to intervalList::add(), ignoring interval.
ZERO length suplied to intervalList::add(), ignoring interval.
ZERO length suplied to intervalList::add(), ignoring interval.
ZERO length suplied to intervalList::add(), ignoring interval.
ZERO length suplied to intervalList::add(), ignoring interval.
ZERO length suplied to intervalList::add(), ignoring interval.
ZERO length suplied to intervalList::add(), ignoring interval.
ZERO length suplied to intervalList::add(), ignoring interval.
ZERO length suplied to intervalList::add(), ignoring interval.
ZERO length suplied to intervalList::add(), ignoring interval.
ZERO length suplied to intervalList::add(), ignoring interval.
ZERO length suplied to intervalList::add(), ignoring interval.
ZERO length suplied to intervalList::add(), ignoring interval.
ZERO length suplied to intervalList::add(), ignoring interval.
ZERO length suplied to intervalList::add(), ignoring interval.
ZERO length suplied to intervalList::add(), ignoring interval.
ZERO length suplied to intervalList::add(), ignoring interval.
ZERO length suplied to intervalList::add(), ignoring interval.
ZERO length suplied to intervalList::add(), ignoring interval.
ZERO length suplied to intervalList::add(), ignoring interval.
ZERO length suplied to intervalList::add(), ignoring interval.
ZERO length suplied to intervalList::add(), ignoring interval.
ZERO length suplied to intervalList::add(), ignoring interval.
ZERO length suplied to intervalList::add(), ignoring interval.
ZERO length suplied to intervalList::add(), ignoring interval.
ZERO length suplied to intervalList::add(), ignoring interval.
ZERO length suplied to intervalList::add(), ignoring interval.
ZERO length suplied to intervalList::add(), ignoring interval.
ZERO length suplied to intervalList::add(), ignoring interval.
ZERO length suplied to intervalList::add(), ignoring interval.
ZERO length suplied to intervalList::add(), ignoring interval.
ZERO length suplied to intervalList::add(), ignoring interval.
ZERO length suplied to intervalList::add(), ignoring interval.
ZERO length suplied to intervalList::add(), ignoring interval.
ZERO length suplied to intervalList::add(), ignoring interval.
ZERO length suplied to intervalList::add(), ignoring interval.
ZERO length suplied to intervalList::add(), ignoring interval.
ZERO length suplied to intervalList::add(), ignoring interval.
ZERO length suplied to intervalList::add(), ignoring interval.
ZERO length suplied to intervalList::add(), ignoring interval.
ZERO length suplied to intervalList::add(), ignoring interval.
ZERO length suplied to intervalList::add(), ignoring interval.
ZERO length suplied to intervalList::add(), ignoring interval.
ZERO length suplied to intervalList::add(), ignoring interval.
ZERO length suplied to intervalList::add(), ignoring interval.
ZERO length suplied to intervalList::add(), ignoring interval.
ZERO length suplied to intervalList::add(), ignoring interval.
ZERO length suplied to intervalList::add(), ignoring interval.
ZERO length suplied to intervalList::add(), ignoring interval.
ZERO length suplied to intervalList::add(), ignoring interval.
ZERO length suplied to intervalList::add(), ignoring interval.
ZERO length suplied to intervalList::add(), ignoring interval.
ZERO length suplied to intervalList::add(), ignoring interval.
ZERO length suplied to intervalList::add(), ignoring interval.
ZERO length suplied to intervalList::add(), ignoring interval.
ZERO length suplied to intervalList::add(), ignoring interval.
ZERO length suplied to intervalList::add(), ignoring interval.
ZERO length suplied to intervalList::add(), ignoring interval.
ZERO length suplied to intervalList::add(), ignoring interval.
ZERO length suplied to intervalList::add(), ignoring interval.

-- Finished on Fri Jan 16 16:40:11 2026 (one second) with 4520161.5 GB free disk space
----------------------------------------
-- Found, in version 2, after consensus generation:
--   contigs:      152 sequences, total length 91773971 bp (including 141 repeats of total length 4535348 bp).
--   bubbles:      158 sequences, total length 4921777 bp.
--   unassembled:  32079 sequences, total length 521213925 bp.
--
-- Contig sizes based on genome size 85mbp:
--
--            NG (bp)  LG (contigs)    sum (bp)
--         ----------  ------------  ----------
--     10    11515544             1    11515544
--     20     8483418             2    19998962
--     30     8081202             3    28080164
--     40     5123929             5    38490976
--     50     4922826             6    43413802
--     60     4614985             8    52782221
--     70     3849582            10    60981404
--     80     3524604            12    68311812
--     90     2463083            15    76771751
--    100     1021996            20    85069474
--
-- Finished stage 'consensusLoad', reset canuIteration.
----------------------------------------
-- Starting command on Fri Jan 16 16:40:11 2026 with 4520161.484 GB free disk space

    cd .
    /share/org/YZWL/yzwl_lixg/miniforge3/envs/canu_v.2.3/bin/tgStoreDump \
      -S ./B4-18.seqStore \
      -T ./unitigging/B4-18.ctgStore 2 \
      -o ./B4-18.contigs \
      -layout \
    > ./B4-18.contigs.layout.err 2>&1

-- Finished on Fri Jan 16 16:40:11 2026 (lickety-split) with 4520161.437 GB free disk space
----------------------------------------
----------------------------------------
-- Starting command on Fri Jan 16 16:40:11 2026 with 4520161.437 GB free disk space

    cd .
    /share/org/YZWL/yzwl_lixg/miniforge3/envs/canu_v.2.3/bin/tgStoreDump \
      -S ./B4-18.seqStore \
      -T ./unitigging/B4-18.ctgStore 2 \
      -consensus -fasta \
      -unassembled \
    > ./B4-18.unassembled.fasta
    2> ./B4-18.unassembled.err
ZERO length suplied to intervalList::add(), ignoring interval.
ZERO length suplied to intervalList::add(), ignoring interval.
ZERO length suplied to intervalList::add(), ignoring interval.
ZERO length suplied to intervalList::add(), ignoring interval.
ZERO length suplied to intervalList::add(), ignoring interval.
ZERO length suplied to intervalList::add(), ignoring interval.
ZERO length suplied to intervalList::add(), ignoring interval.
ZERO length suplied to intervalList::add(), ignoring interval.
ZERO length suplied to intervalList::add(), ignoring interval.
ZERO length suplied to intervalList::add(), ignoring interval.
ZERO length suplied to intervalList::add(), ignoring interval.
ZERO length suplied to intervalList::add(), ignoring interval.
ZERO length suplied to intervalList::add(), ignoring interval.
ZERO length suplied to intervalList::add(), ignoring interval.
ZERO length suplied to intervalList::add(), ignoring interval.
ZERO length suplied to intervalList::add(), ignoring interval.
ZERO length suplied to intervalList::add(), ignoring interval.
ZERO length suplied to intervalList::add(), ignoring interval.
ZERO length suplied to intervalList::add(), ignoring interval.
ZERO length suplied to intervalList::add(), ignoring interval.
ZERO length suplied to intervalList::add(), ignoring interval.
ZERO length suplied to intervalList::add(), ignoring interval.
ZERO length suplied to intervalList::add(), ignoring interval.
ZERO length suplied to intervalList::add(), ignoring interval.
ZERO length suplied to intervalList::add(), ignoring interval.
ZERO length suplied to intervalList::add(), ignoring interval.
ZERO length suplied to intervalList::add(), ignoring interval.
ZERO length suplied to intervalList::add(), ignoring interval.
ZERO length suplied to intervalList::add(), ignoring interval.
ZERO length suplied to intervalList::add(), ignoring interval.
ZERO length suplied to intervalList::add(), ignoring interval.
ZERO length suplied to intervalList::add(), ignoring interval.
ZERO length suplied to intervalList::add(), ignoring interval.
ZERO length suplied to intervalList::add(), ignoring interval.
ZERO length suplied to intervalList::add(), ignoring interval.
ZERO length suplied to intervalList::add(), ignoring interval.
ZERO length suplied to intervalList::add(), ignoring interval.
ZERO length suplied to intervalList::add(), ignoring interval.
ZERO length suplied to intervalList::add(), ignoring interval.
ZERO length suplied to intervalList::add(), ignoring interval.
ZERO length suplied to intervalList::add(), ignoring interval.
ZERO length suplied to intervalList::add(), ignoring interval.
ZERO length suplied to intervalList::add(), ignoring interval.
ZERO length suplied to intervalList::add(), ignoring interval.
ZERO length suplied to intervalList::add(), ignoring interval.
ZERO length suplied to intervalList::add(), ignoring interval.
ZERO length suplied to intervalList::add(), ignoring interval.
ZERO length suplied to intervalList::add(), ignoring interval.
ZERO length suplied to intervalList::add(), ignoring interval.
ZERO length suplied to intervalList::add(), ignoring interval.
ZERO length suplied to intervalList::add(), ignoring interval.
ZERO length suplied to intervalList::add(), ignoring interval.
ZERO length suplied to intervalList::add(), ignoring interval.
ZERO length suplied to intervalList::add(), ignoring interval.
ZERO length suplied to intervalList::add(), ignoring interval.
ZERO length suplied to intervalList::add(), ignoring interval.
ZERO length suplied to intervalList::add(), ignoring interval.
ZERO length suplied to intervalList::add(), ignoring interval.
ZERO length suplied to intervalList::add(), ignoring interval.
ZERO length suplied to intervalList::add(), ignoring interval.
ZERO length suplied to intervalList::add(), ignoring interval.
ZERO length suplied to intervalList::add(), ignoring interval.
ZERO length suplied to intervalList::add(), ignoring interval.
ZERO length suplied to intervalList::add(), ignoring interval.

-- Finished on Fri Jan 16 16:40:14 2026 (3 seconds) with 4520160.093 GB free disk space
----------------------------------------
----------------------------------------
-- Starting command on Fri Jan 16 16:40:14 2026 with 4520160.093 GB free disk space

    cd .
    /share/org/YZWL/yzwl_lixg/miniforge3/envs/canu_v.2.3/bin/tgStoreDump \
      -S ./B4-18.seqStore \
      -T ./unitigging/B4-18.ctgStore 2 \
      -consensus -fasta \
      -contigs \
    > ./B4-18.contigs.fasta
    2> ./B4-18.contigs.err
ZERO length suplied to intervalList::add(), ignoring interval.
ZERO length suplied to intervalList::add(), ignoring interval.
ZERO length suplied to intervalList::add(), ignoring interval.
ZERO length suplied to intervalList::add(), ignoring interval.
ZERO length suplied to intervalList::add(), ignoring interval.
ZERO length suplied to intervalList::add(), ignoring interval.
ZERO length suplied to intervalList::add(), ignoring interval.
ZERO length suplied to intervalList::add(), ignoring interval.
ZERO length suplied to intervalList::add(), ignoring interval.
ZERO length suplied to intervalList::add(), ignoring interval.
ZERO length suplied to intervalList::add(), ignoring interval.
ZERO length suplied to intervalList::add(), ignoring interval.
ZERO length suplied to intervalList::add(), ignoring interval.
ZERO length suplied to intervalList::add(), ignoring interval.
ZERO length suplied to intervalList::add(), ignoring interval.
ZERO length suplied to intervalList::add(), ignoring interval.
ZERO length suplied to intervalList::add(), ignoring interval.
ZERO length suplied to intervalList::add(), ignoring interval.
ZERO length suplied to intervalList::add(), ignoring interval.
ZERO length suplied to intervalList::add(), ignoring interval.
ZERO length suplied to intervalList::add(), ignoring interval.
ZERO length suplied to intervalList::add(), ignoring interval.
ZERO length suplied to intervalList::add(), ignoring interval.
ZERO length suplied to intervalList::add(), ignoring interval.
ZERO length suplied to intervalList::add(), ignoring interval.
ZERO length suplied to intervalList::add(), ignoring interval.
ZERO length suplied to intervalList::add(), ignoring interval.
ZERO length suplied to intervalList::add(), ignoring interval.
ZERO length suplied to intervalList::add(), ignoring interval.
ZERO length suplied to intervalList::add(), ignoring interval.
ZERO length suplied to intervalList::add(), ignoring interval.
ZERO length suplied to intervalList::add(), ignoring interval.
ZERO length suplied to intervalList::add(), ignoring interval.
ZERO length suplied to intervalList::add(), ignoring interval.
ZERO length suplied to intervalList::add(), ignoring interval.
ZERO length suplied to intervalList::add(), ignoring interval.
ZERO length suplied to intervalList::add(), ignoring interval.
ZERO length suplied to intervalList::add(), ignoring interval.
ZERO length suplied to intervalList::add(), ignoring interval.
ZERO length suplied to intervalList::add(), ignoring interval.
ZERO length suplied to intervalList::add(), ignoring interval.
ZERO length suplied to intervalList::add(), ignoring interval.
ZERO length suplied to intervalList::add(), ignoring interval.
ZERO length suplied to intervalList::add(), ignoring interval.
ZERO length suplied to intervalList::add(), ignoring interval.
ZERO length suplied to intervalList::add(), ignoring interval.
ZERO length suplied to intervalList::add(), ignoring interval.
ZERO length suplied to intervalList::add(), ignoring interval.
ZERO length suplied to intervalList::add(), ignoring interval.
ZERO length suplied to intervalList::add(), ignoring interval.
ZERO length suplied to intervalList::add(), ignoring interval.
ZERO length suplied to intervalList::add(), ignoring interval.
ZERO length suplied to intervalList::add(), ignoring interval.
ZERO length suplied to intervalList::add(), ignoring interval.
ZERO length suplied to intervalList::add(), ignoring interval.
ZERO length suplied to intervalList::add(), ignoring interval.
ZERO length suplied to intervalList::add(), ignoring interval.
ZERO length suplied to intervalList::add(), ignoring interval.
ZERO length suplied to intervalList::add(), ignoring interval.
ZERO length suplied to intervalList::add(), ignoring interval.
ZERO length suplied to intervalList::add(), ignoring interval.
ZERO length suplied to intervalList::add(), ignoring interval.
ZERO length suplied to intervalList::add(), ignoring interval.
ZERO length suplied to intervalList::add(), ignoring interval.

-- Finished on Fri Jan 16 16:40:14 2026 (like a bat out of hell) with 4520159.984 GB free disk space
----------------------------------------
-- Finished stage 'generateOutputs', reset canuIteration.
--
-- Assembly 'B4-18' finished in '/share/org/YZWL/yzwl_lixg/project/28.大豆疫霉菌三代基因组/03.hicanu/B4-18/01.raw_output'.
--
-- Summary saved in 'B4-18.report'.
--
-- Sequences saved:
--   Contigs       -> 'B4-18.contigs.fasta'
--   Unassembled   -> 'B4-18.unassembled.fasta'
--
-- Read layouts saved:
--   Contigs       -> 'B4-18.contigs.layout'.
--
-- Bye.

2026-01-16 16:40:15.002 - WARNING - 输出文件不存在|Output file does not exist: /share/org/YZWL/yzwl_lixg/project/28.大豆疫霉菌三代基因组/03.hicanu/B4-18/01.raw_output/B4-18.unitigs.fasta
Job 68889976 stderr output:

