Usage: biopytools ragtag [OPTIONS]
Try 'biopytools ragtag -h' for help.

Error: Invalid value for '-r' / '--reference': 文件不存在|File does not exist: /share/org/YZWL/yzwl_lixg/project/28.大豆疫霉菌三代基因组/04.ragtag/Psoja_T2T.fa
Usage: biopytools genomesyn [OPTIONS]
Try 'biopytools genomesyn -h' for help.

Error: Invalid value for '-i' / '--ref': Path '04.ragtag/A3-57/hifiasm/A3-57_RagTag_scaffolded.fa' does not exist.
2026-01-16 03:55:49.380 - WARNING - 命令错误输出|Command stderr:
-- canu master +27 changes (r10515 2a41e933b8de6ed66723d75d36dd071b46d2c347)
--
-- CITATIONS
--
-- For assemblies of PacBio HiFi reads:
--   Nurk S, Walenz BP, Rhiea A, Vollger MR, Logsdon GA, Grothe R, Miga KH, Eichler EE, Phillippy AM, Koren S.
--   HiCanu: accurate assembly of segmental duplications, satellites, and allelic variants from high-fidelity long reads.
--   biorXiv. 2020.
--   https://doi.org/10.1101/2020.03.14.992248
-- 
-- Read and contig alignments during correction and consensus use:
--   Šošic M, Šikic M.
--   Edlib: a C/C ++ library for fast, exact sequence alignment using edit distance.
--   Bioinformatics. 2017 May 1;33(9):1394-1395.
--   http://doi.org/10.1093/bioinformatics/btw753
-- 
-- Overlaps are generated using:
--   Berlin K, et al.
--   Assembling large genomes with single-molecule sequencing and locality-sensitive hashing.
--   Nat Biotechnol. 2015 Jun;33(6):623-30.
--   http://doi.org/10.1038/nbt.3238
-- 
--   Myers EW, et al.
--   A Whole-Genome Assembly of Drosophila.
--   Science. 2000 Mar 24;287(5461):2196-204.
--   http://doi.org/10.1126/science.287.5461.2196
-- 
-- Contig consensus sequences are generated using an algorithm derived from pbdagcon:
--   Chin CS, et al.
--   Nonhybrid, finished microbial genome assemblies from long-read SMRT sequencing data.
--   Nat Methods. 2013 Jun;10(6):563-9
--   http://doi.org/10.1038/nmeth.2474
-- 
-- CONFIGURE CANU
--
-- Detected Java(TM) Runtime Environment '17.0.15-internal' (from '/share/org/YZWL/yzwl_lixg/.local/bin/java') without -d64 support.
--
-- WARNING:
-- WARNING:  Failed to run gnuplot using command 'gnuplot'.
-- WARNING:  Plots will be disabled.
-- WARNING:
--
-- Detected samtools version '1.22' / htslib version 'htscodecs=1.6.3' (from 'samtools').
--
-- Detected 88 CPUs and 503 gigabytes of memory on the local machine.
--
-- Detected Slurm with 'sinfo' binary in /opt/skyformai/bin/sinfo.
--          Slurm disabled by useGrid=false
--
-- Detected  '' with 'pbsnodes' binary in /opt/skyformai/bin/pbsnodes.
--           disabled by useGrid=false
--
-- Detected LSF with 'bsub' binary in /opt/skyformai/bin/bsub.
--          LSF disabled by useGrid=false
--
-- Local machine mode enabled; grid support not detected or not allowed.
--
-- Found trimmed raw PacBio HiFi reads in the input files.
--
--                                (tag)Concurrency
--                         (tag)Threads          |
--                (tag)Memory         |          |
--        (tag)             |         |          |       total usage      algorithm
--        -------  ----------  --------   --------  --------------------  -----------------------------
-- Local: meryl     12.000 GB    4 CPUs x  22 jobs   264.000 GB  88 CPUs  (k-mer counting)
-- Local: cormhap   13.000 GB   11 CPUs x   8 jobs   104.000 GB  88 CPUs  (overlap detection with mhap)
-- Local: obtovl     8.000 GB    8 CPUs x  11 jobs    88.000 GB  88 CPUs  (overlap detection)
-- Local: utgovl     8.000 GB    8 CPUs x  11 jobs    88.000 GB  88 CPUs  (overlap detection)
-- Local: cor        -.--- GB    4 CPUs x   - jobs     -.--- GB   - CPUs  (read correction)
-- Local: ovb        4.000 GB    1 CPU  x  88 jobs   352.000 GB  88 CPUs  (overlap store bucketizer)
-- Local: ovs        8.000 GB    1 CPU  x  62 jobs   496.000 GB  62 CPUs  (overlap store sorting)
-- Local: red       16.000 GB    4 CPUs x  22 jobs   352.000 GB  88 CPUs  (read error detection)
-- Local: oea        8.000 GB    1 CPU  x  62 jobs   496.000 GB  62 CPUs  (overlap error adjustment)
-- Local: bat       32.000 GB    8 CPUs x   1 job     32.000 GB   8 CPUs  (contig construction with bogart)
-- Local: cns        -.--- GB    8 CPUs x   - jobs     -.--- GB   - CPUs  (consensus)
--
-- Generating assembly 'A3-57' in '/share/org/YZWL/yzwl_lixg/project/28.大豆疫霉菌三代基因组/03.hicanu/A3-57/01.raw_output':
--   genomeSize:
--     85000000
--
--   Overlap Generation Limits:
--     corOvlErrorRate 0.0000 (  0.00%)
--     obtOvlErrorRate 0.0250 (  2.50%)
--     utgOvlErrorRate 0.0100 (  1.00%)
--
--   Overlap Processing Limits:
--     corErrorRate    0.0000 (  0.00%)
--     obtErrorRate    0.0250 (  2.50%)
--     utgErrorRate    0.0003 (  0.03%)
--     cnsErrorRate    0.0500 (  5.00%)
--
--   Stages to run:
--     assemble HiFi reads.
--
--
-- BEGIN STORE CREATION
----------------------------------------
-- Starting command on Fri Jan 16 01:57:03 2026 with 4559133.812 GB free disk space

    cd .
    ./A3-57.seqStore.sh \
    > ./A3-57.seqStore.err 2>&1

-- Finished on Fri Jan 16 02:05:28 2026 (505 seconds) with 4558890.843 GB free disk space
----------------------------------------
--
-- In sequence store './A3-57.seqStore':
--   Found 254254 reads.
--   Found 4250014200 bases (50 times coverage).
--    Histogram of corrected reads:
--    
--    G=4250014200                       sum of  ||               length     num
--    NG         length     index       lengths  ||                range    seqs
--    ----- ------------ --------- ------------  ||  ------------------- -------
--    00010        25763     15110    425016584  ||       1267-2593         5361|-----------
--    00020        23418     32477    850013166  ||       2594-3920         9133|-------------------
--    00030        21845     51299   1275022136  ||       3921-5247         9194|-------------------
--    00040        20625     71340   1700022905  ||       5248-6574         8566|------------------
--    00050        19586     92497   2125022872  ||       6575-7901         7770|----------------
--    00060        18635    114744   2550014251  ||       7902-9228         7228|---------------
--    00070        17654    138159   2975014192  ||       9229-10555        6406|--------------
--    00080        16405    163067   3400019532  ||      10556-11882        5564|------------
--    00090        12906    191171   3825016481  ||      11883-13209        5058|-----------
--    00100         1267    254254   4250014200  ||      13210-14536        6447|--------------
--    001.000x              254254   4250014200  ||      14537-15863       12465|--------------------------
--                                               ||      15864-17190       22799|-----------------------------------------------
--                                               ||      17191-18517       30590|---------------------------------------------------------------
--                                               ||      18518-19844       30765|---------------------------------------------------------------
--                                               ||      19845-21171       25211|----------------------------------------------------
--                                               ||      21172-22498       19109|----------------------------------------
--                                               ||      22499-23825       13919|-----------------------------
--                                               ||      23826-25152       10068|---------------------
--                                               ||      25153-26479        6890|---------------
--                                               ||      26480-27806        4810|----------
--                                               ||      27807-29133        3031|-------
--                                               ||      29134-30460        1857|----
--                                               ||      30461-31787        1087|---
--                                               ||      31788-33114         545|--
--                                               ||      33115-34441         243|-
--                                               ||      34442-35768          82|-
--                                               ||      35769-37095          39|-
--                                               ||      37096-38422          10|-
--                                               ||      38423-39749           2|-
--                                               ||      39750-41076           1|-
--                                               ||      41077-42403           0|
--                                               ||      42404-43730           0|
--                                               ||      43731-45057           1|-
--                                               ||      45058-46384           2|-
--                                               ||      46385-47711           0|
--                                               ||      47712-49038           0|
--                                               ||      49039-50365           0|
--                                               ||      50366-51692           0|
--                                               ||      51693-53019           0|
--                                               ||      53020-54346           1|-
--    
--
-- In sequence store './A3-57.seqStore':
--   Found 254254 reads.
--   Found 4250014200 bases (50 times coverage).
--    Histogram of corrected-trimmed reads:
--    
--    G=4250014200                       sum of  ||               length     num
--    NG         length     index       lengths  ||                range    seqs
--    ----- ------------ --------- ------------  ||  ------------------- -------
--    00010        25763     15110    425016584  ||       1267-2593         5361|-----------
--    00020        23418     32477    850013166  ||       2594-3920         9133|-------------------
--    00030        21845     51299   1275022136  ||       3921-5247         9194|-------------------
--    00040        20625     71340   1700022905  ||       5248-6574         8566|------------------
--    00050        19586     92497   2125022872  ||       6575-7901         7770|----------------
--    00060        18635    114744   2550014251  ||       7902-9228         7228|---------------
--    00070        17654    138159   2975014192  ||       9229-10555        6406|--------------
--    00080        16405    163067   3400019532  ||      10556-11882        5564|------------
--    00090        12906    191171   3825016481  ||      11883-13209        5058|-----------
--    00100         1267    254254   4250014200  ||      13210-14536        6447|--------------
--    001.000x              254254   4250014200  ||      14537-15863       12465|--------------------------
--                                               ||      15864-17190       22799|-----------------------------------------------
--                                               ||      17191-18517       30590|---------------------------------------------------------------
--                                               ||      18518-19844       30765|---------------------------------------------------------------
--                                               ||      19845-21171       25211|----------------------------------------------------
--                                               ||      21172-22498       19109|----------------------------------------
--                                               ||      22499-23825       13919|-----------------------------
--                                               ||      23826-25152       10068|---------------------
--                                               ||      25153-26479        6890|---------------
--                                               ||      26480-27806        4810|----------
--                                               ||      27807-29133        3031|-------
--                                               ||      29134-30460        1857|----
--                                               ||      30461-31787        1087|---
--                                               ||      31788-33114         545|--
--                                               ||      33115-34441         243|-
--                                               ||      34442-35768          82|-
--                                               ||      35769-37095          39|-
--                                               ||      37096-38422          10|-
--                                               ||      38423-39749           2|-
--                                               ||      39750-41076           1|-
--                                               ||      41077-42403           0|
--                                               ||      42404-43730           0|
--                                               ||      43731-45057           1|-
--                                               ||      45058-46384           2|-
--                                               ||      46385-47711           0|
--                                               ||      47712-49038           0|
--                                               ||      49039-50365           0|
--                                               ||      50366-51692           0|
--                                               ||      51693-53019           0|
--                                               ||      53020-54346           1|-
--    
--
-- Correction skipped; not enabled.
--
-- Trimming skipped; not enabled.
--
-- BEGIN ASSEMBLY
----------------------------------------
-- Starting command on Fri Jan 16 02:05:28 2026 with 4558890.796 GB free disk space

    cd unitigging/0-mercounts
    ./meryl-configure.sh \
    > ./meryl-configure.err 2>&1

-- Finished on Fri Jan 16 02:05:29 2026 (one second) with 4558890.796 GB free disk space
----------------------------------------
--  segments   memory batches
--  -------- -------- -------
--        01 10.81 GB       2
--        02  5.75 GB       2
--        04  2.94 GB       2
--        06  2.14 GB       2
--        08  1.60 GB       2
--        12  1.07 GB       2
--        16  0.81 GB       2
--        20  0.65 GB       2
--        24  0.54 GB       2
--        32  0.41 GB       2
--        40  0.32 GB       2
--        48  -.-- GB       -  (segment size too small)
--        56  -.-- GB       -  (segment size too small)
--        64  -.-- GB       -  (segment size too small)
--        96  -.-- GB       -  (segment size too small)
--
--  For 254254 reads with 4250014200 bases, limit to 42 batches.
--  Will count kmers using 01 jobs, each using 12 GB and 4 threads.
--
-- Finished stage 'merylConfigure', reset canuIteration.
--
-- Running jobs.  First attempt out of 2.
----------------------------------------
-- Starting 'meryl' concurrent execution on Fri Jan 16 02:05:29 2026 with 4558890.765 GB free disk space (1 processes; 22 concurrently)

    cd unitigging/0-mercounts
    ./meryl-count.sh 1 > ./meryl-count.000001.out 2>&1

-- Finished on Fri Jan 16 02:08:55 2026 (206 seconds) with 4558970.531 GB free disk space
----------------------------------------
-- Found 1 Kmer counting (meryl) outputs.
-- Finished stage 'utg-merylCountCheck', reset canuIteration.
--
-- Running jobs.  First attempt out of 2.
----------------------------------------
-- Starting 'meryl' concurrent execution on Fri Jan 16 02:08:55 2026 with 4558970.5 GB free disk space (1 processes; 22 concurrently)

    cd unitigging/0-mercounts
    ./meryl-process.sh 1 > ./meryl-process.000001.out 2>&1

-- Finished on Fri Jan 16 02:09:01 2026 (6 seconds) with 4558971.109 GB free disk space
----------------------------------------
-- Meryl finished successfully.  Kmer frequency histogram:
--
-- WARNING: gnuplot failed.
--
----------------------------------------
--
--  22-mers                                                                                           Fraction
--    Occurrences   NumMers                                                                         Unique Total
--       1-     1         0                                                                        0.0000 0.0000
--       2-     2    231443                                                                        0.0051 0.0001
--       3-     4     84179                                                                        0.0063 0.0002
--       5-     7     45695                                                                        0.0073 0.0003
--       8-    11     72394                                                                        0.0082 0.0003
--      12-    16    177279                                                                        0.0101 0.0006
--      17-    22    375133 *                                                                      0.0145 0.0016
--      23-    29   1596219 ******                                                                 0.0240 0.0044
--      30-    37   8372451 **********************************                                     0.0684 0.0219
--      38-    46  16978325 ********************************************************************** 0.2793 0.1273
--      47-    56  10655546 *******************************************                            0.6512 0.3536
--      57-    67   2105502 ********                                                               0.8577 0.5040
--      68-    79    833454 ***                                                                    0.8965 0.5378
--      80-    92    981954 ****                                                                   0.9150 0.5575
--      93-   106    592813 **                                                                     0.9362 0.5835
--     107-   121    301891 *                                                                      0.9484 0.6007
--     122-   137    295763 *                                                                      0.9549 0.6113
--     138-   154    210189                                                                        0.9614 0.6233
--     155-   172    187376                                                                        0.9659 0.6326
--     173-   191    158577                                                                        0.9700 0.6421
--     192-   211    125030                                                                        0.9734 0.6510
--     212-   232    123870                                                                        0.9761 0.6588
--     233-   254     91072                                                                        0.9788 0.6673
--     255-   277     98960                                                                        0.9808 0.6742
--     278-   301     78778                                                                        0.9830 0.6824
--     302-   326     64484                                                                        0.9847 0.6894
--     327-   352     55042                                                                        0.9861 0.6957
--     353-   379     47008                                                                        0.9873 0.7015
--     380-   407     43683                                                                        0.9883 0.7069
--     408-   436     40550                                                                        0.9893 0.7122
--     437-   466     36371                                                                        0.9902 0.7176
--     467-   497     35188                                                                        0.9910 0.7226
--     498-   529     26932                                                                        0.9918 0.7279
--     530-   562     23813                                                                        0.9923 0.7322
--     563-   596     21159                                                                        0.9929 0.7363
--     597-   631     19329                                                                        0.9933 0.7400
--     632-   667     15835                                                                        0.9938 0.7438
--     668-   704     14251                                                                        0.9941 0.7469
--     705-   742     11531                                                                        0.9944 0.7500
--     743-   781     11490                                                                        0.9947 0.7526
--     782-   821     11027                                                                        0.9949 0.7553
--
--           0 (max occurrences)
--  3206434869 (total mers, non-unique)
--    45472180 (distinct mers, non-unique)
--           0 (unique mers)
-- Finished stage 'meryl-process', reset canuIteration.
--
-- Removing meryl database 'unitigging/0-mercounts/A3-57.ms22'.
--
-- OVERLAPPER (normal) (assembly) erate=0.01
--
----------------------------------------
-- Starting command on Fri Jan 16 02:09:01 2026 with 4558971.093 GB free disk space

    cd unitigging/1-overlapper
    /share/org/YZWL/yzwl_lixg/miniforge3/envs/canu_v.2.3/bin/overlapInCorePartition \
     -S  ../../A3-57.seqStore \
     -hl 160000000 \
     -rl 5000000000 \
     -ol 500 \
     -o  ./A3-57.partition \
    > ./A3-57.partition.err 2>&1

-- Finished on Fri Jan 16 02:09:01 2026 (fast as lightning) with 4558971.078 GB free disk space
----------------------------------------
--
-- Configured 21 overlapInCore jobs.
-- Finished stage 'utg-overlapConfigure', reset canuIteration.
--
-- Running jobs.  First attempt out of 2.
----------------------------------------
-- Starting 'utgovl' concurrent execution on Fri Jan 16 02:09:01 2026 with 4558971.046 GB free disk space (21 processes; 11 concurrently)

    cd unitigging/1-overlapper
    ./overlap.sh 1 > ./overlap.000001.out 2>&1
    ./overlap.sh 2 > ./overlap.000002.out 2>&1
    ./overlap.sh 3 > ./overlap.000003.out 2>&1
    ./overlap.sh 4 > ./overlap.000004.out 2>&1
    ./overlap.sh 5 > ./overlap.000005.out 2>&1
    ./overlap.sh 6 > ./overlap.000006.out 2>&1
    ./overlap.sh 7 > ./overlap.000007.out 2>&1
    ./overlap.sh 8 > ./overlap.000008.out 2>&1
    ./overlap.sh 9 > ./overlap.000009.out 2>&1
    ./overlap.sh 10 > ./overlap.000010.out 2>&1
    ./overlap.sh 11 > ./overlap.000011.out 2>&1
    ./overlap.sh 12 > ./overlap.000012.out 2>&1
    ./overlap.sh 13 > ./overlap.000013.out 2>&1
    ./overlap.sh 14 > ./overlap.000014.out 2>&1
    ./overlap.sh 15 > ./overlap.000015.out 2>&1
    ./overlap.sh 16 > ./overlap.000016.out 2>&1
    ./overlap.sh 17 > ./overlap.000017.out 2>&1
    ./overlap.sh 18 > ./overlap.000018.out 2>&1
    ./overlap.sh 19 > ./overlap.000019.out 2>&1
    ./overlap.sh 20 > ./overlap.000020.out 2>&1
    ./overlap.sh 21 > ./overlap.000021.out 2>&1

-- Finished on Fri Jan 16 02:35:58 2026 (1617 seconds) with 4559011.625 GB free disk space
----------------------------------------
-- Found 21 overlapInCore output files.
--
-- overlapInCore compute 'unitigging/1-overlapper':
--   kmer hits
--     with no overlap       1240976877    59094137 +- 37339211.673
--     with an overlap         44111468  46.0952381 +- 1197366.207
--
--   overlaps                  44111468  46.0952381 +- 1197366.207
--     contained                9335125  .761904762 +- 250467.203
--     dovetail                34776343  6.33333333 +- 949249.302
--
--   overlaps rejected
--     multiple per pair              0           0 +- 0
--     bad short window               0           0 +- 0
--     bad long window                0           0 +- 0
-- Finished stage 'utg-overlapCheck', reset canuIteration.
----------------------------------------
-- Starting command on Fri Jan 16 02:35:58 2026 with 4559011.609 GB free disk space

    cd unitigging
    /share/org/YZWL/yzwl_lixg/miniforge3/envs/canu_v.2.3/bin/ovStoreConfig \
     -S ../A3-57.seqStore \
     -M 4-8 \
     -L ./1-overlapper/ovljob.files \
     -create ./A3-57.ovlStore.config \
     > ./A3-57.ovlStore.config.txt \
    2> ./A3-57.ovlStore.config.err

-- Finished on Fri Jan 16 02:35:58 2026 (like a bat out of hell) with 4559011.593 GB free disk space
----------------------------------------
--
-- Creating overlap store unitigging/A3-57.ovlStore using:
--      1 bucket
--      1 slice
--        using at most 3 GB memory each
--
-- Running jobs.  First attempt out of 2.
----------------------------------------
-- Starting 'ovS' concurrent execution on Fri Jan 16 02:35:58 2026 with 4559011.578 GB free disk space (1 processes; 62 concurrently)

    cd unitigging
    ./A3-57.ovlStore.sh 1 > ./A3-57.ovlStore.000001.out 2>&1

-- Finished on Fri Jan 16 02:36:17 2026 (19 seconds) with 4559011.375 GB free disk space
----------------------------------------
-- Checking store.
----------------------------------------
-- Starting command on Fri Jan 16 02:36:17 2026 with 4559011.375 GB free disk space

    cd unitigging
    /share/org/YZWL/yzwl_lixg/miniforge3/envs/canu_v.2.3/bin/ovStoreDump \
     -S ../A3-57.seqStore \
     -O  ./A3-57.ovlStore \
     -counts \
     > ./A3-57.ovlStore/counts.dat 2> ./A3-57.ovlStore/counts.err

-- Finished on Fri Jan 16 02:36:17 2026 (fast as lightning) with 4559011.343 GB free disk space
----------------------------------------
--
-- Overlap store 'unitigging/A3-57.ovlStore' successfully constructed.
-- Found 88222936 overlaps for 246036 reads; 1749903 reads have no overlaps.
--
--
-- Purged 0.901 GB in 63 overlap output files.
----------------------------------------
-- Starting command on Fri Jan 16 02:36:18 2026 with 4559012.375 GB free disk space

    cd unitigging
    /share/org/YZWL/yzwl_lixg/miniforge3/envs/canu_v.2.3/bin/ovStoreStats \
     -C 50 \
     -S ../A3-57.seqStore \
     -O  ./A3-57.ovlStore \
     -o  ./A3-57.ovlStore \
     > ./A3-57.ovlStore.summary.err 2>&1

-- Finished on Fri Jan 16 02:36:32 2026 (14 seconds) with 4559012.359 GB free disk space
----------------------------------------
--
-- Overlap store 'unitigging/A3-57.ovlStore' contains:
--
--   category            reads     %          read length        feature size or coverage  analysis
--   ----------------  -------  -------  ----------------------  ------------------------  --------------------
--   middle-missing        132    0.05    14591.58 +- 6532.81        905.57 +- 1159.69    (bad trimming)
--   middle-hump            18    0.01    13502.83 +- 5234.97       4685.67 +- 3957.54    (bad trimming)
--   no-5-prime            542    0.21    13804.33 +- 4829.71       1635.69 +- 2580.59    (bad trimming)
--   no-3-prime            678    0.27    11869.60 +- 6112.32       1592.43 +- 2642.20    (bad trimming)
--   
--   low-coverage         1689    0.66    10587.03 +- 5302.11          6.68 +- 3.93       (easy to assemble, potential for lower quality consensus)
--   unique             190032   74.74    12783.86 +- 5207.08         42.80 +- 8.94       (easy to assemble, perfect, yay)
--   repeat-cont         23955    9.42    11347.52 +- 4529.73       1500.76 +- 1194.78    (potential for consensus errors, no impact on assembly)
--   repeat-dove           285    0.11    21154.01 +- 1999.54        635.46 +- 779.76     (hard to assemble, likely won't assemble correctly or even at all)
--   
--   span-repeat          5545    2.18    14345.47 +- 4393.05       3838.68 +- 3864.18    (read spans a large repeat, usually easy to assemble)
--   uniq-repeat-cont    15348    6.04    12576.80 +- 4281.92                             (should be uniquely placed, low potential for consensus errors, no impact on assembly)
--   uniq-repeat-dove     3552    1.40    18172.90 +- 3011.59                             (will end contigs, potential to misassemble)
--   uniq-anchor          4260    1.68    13602.08 +- 4305.37       7611.28 +- 4898.43    (repeat read, with unique section, probable bad read)
-- Finished stage 'utg-createOverlapStore', reset canuIteration.
--
-- Loading read lengths.
-- Loading number of overlaps per read.
--
-- Configure RED for 16gb memory.
--                   Batches of at most (unlimited) reads.
--                                      500000000 bases.
--                   Expecting evidence of at most 536870912 bases per iteration.
--
--           Total                                               Reads                 Olaps Evidence
--    Job   Memory      Read Range         Reads        Bases   Memory        Olaps   Memory   Memory  (Memory in MB)
--   ---- -------- ------------------- --------- ------------ -------- ------------ -------- --------
--      1 16385.34         1-46095          5947    108958797 13300.82      1093821    12.52  1024.00
--      2 16384.99     46096-91928          5940    108751188 13275.48      3277983    37.51  1024.00
--      3 16384.34     91929-148295         7087    108941605 13298.76      1186962    13.58  1024.00
--      4 16384.88    148296-204307         7008    108817196 13283.57      2561055    29.31  1024.00
--      5 16384.19    204308-251580         6015    108734632 13273.46      3384512    38.73  1024.00
--      6 16385.17    251581-307243         7103    108940068 13298.57      1275731    14.60  1024.00
--      7 16384.10    307244-362635         7066    108791182 13280.40      2770128    31.70  1024.00
--      8 16385.09    362636-410029         5974    108822931 13284.24      2521299    28.85  1024.00
--      9 16384.39    410030-466591         7224    108924505 13296.68      1373545    15.72  1024.00
--     10 16384.18    466592-518308         6716    108783174 13279.41      2863531    32.77  1024.00
--     11 16384.02    518309-564300         5926    108803089 13281.81      2639163    30.20  1024.00
--     12 16384.41    564301-618698         7016    108922946 13296.48      1392102    15.93  1024.00
--     13 16385.40    618699-671360         6712    108798462 13281.27      2807098    32.12  1024.00
--     14 16386.03    671361-717691         5922    108820301 13283.91      2631120    30.11  1024.00
--     15 16384.65    717692-772369         7011    108937094 13298.21      1261857    14.44  1024.00
--     16 16386.16    772370-825164         6660    108792262 13280.52      2940206    33.65  1024.00
--     17 16385.57    825165-871198         5891    108835189 13285.73      2432527    27.84  1024.00
--     18 16385.29    871199-926655         7051    108931653 13297.54      1376363    15.75  1024.00
--     19 16385.20    926656-978721         6544    108770892 13277.90      3084500    35.30  1024.00
--     20 16386.05    978722-1025287        5900    108843080 13286.69      2390542    27.36  1024.00
--     21 16385.48   1025288-1079882        7053    108935463 13298.01      1352287    15.48  1024.00
--     22 16384.39   1079883-1129782        6360    108778082 13278.77      2937255    33.61  1024.00
--     23 16385.23   1129783-1176488        5911    108827573 13284.80      2483824    28.43  1024.00
--     24 16384.29   1176489-1231238        7074    108933251 13297.74      1271517    14.55  1024.00
--     25 16384.26   1231239-1280865        6249    108781317 13279.17      2891750    33.09  1024.00
--     26 16386.23   1280866-1326936        5917    108824242 13284.40      2607334    29.84  1024.00
--     27 16385.11   1326937-1383818        7174    108921596 13296.32      1467539    16.79  1024.00
--     28 16385.85   1383819-1432177        6136    108827651 13284.82      2537244    29.04  1024.00
--     29 16384.61   1432178-1478494        5945    108828219 13284.88      2422536    27.72  1024.00
--     30 16384.97   1478495-1535717        7271    108912147 13295.17      1555532    17.80  1024.00
--     31 16384.17   1535718-1582931        6000    108806517 13282.23      2615831    29.94  1024.00
--     32 16386.08   1582932-1630003        5960    108839595 13286.27      2429878    27.81  1024.00
--     33 16385.68   1630004-1688008        7336    108862270 13289.08      2149493    24.60  1024.00
--     34 16384.56   1688009-1735283        5926    108882500 13291.51      1839326    21.05  1024.00
--     35 16384.65   1735284-1781077        5986    108818113 13283.65      2534389    29.00  1024.00
--     36 16385.92   1781078-1839999        7466    108824244 13284.44      2575752    29.48  1024.00
--     37 16384.56   1840000-1887293        5960    108892931 13292.78      1728495    19.78  1024.00
--     38 16386.12   1887294-1933385        5941    108827705 13284.82      2560272    29.30  1024.00
--     39 16385.81   1933386-1992698        7481    108792276 13280.54      2906975    33.27  1024.00
--     40  3680.76   1992699-1995939         395      4978262   607.71        91662     1.05  1024.00
--   ---- -------- ------------------- --------- ------------ -------- ------------ -------- --------
--                                                 4250014200              88222936
-- Finished stage 'readErrorDetectionConfigure', reset canuIteration.
--
-- Running jobs.  First attempt out of 2.
----------------------------------------
-- Starting 'red' concurrent execution on Fri Jan 16 02:36:39 2026 with 4559012.312 GB free disk space (40 processes; 22 concurrently)

    cd unitigging/3-overlapErrorAdjustment
    ./red.sh 1 > ./red.000001.out 2>&1
    ./red.sh 2 > ./red.000002.out 2>&1
    ./red.sh 3 > ./red.000003.out 2>&1
    ./red.sh 4 > ./red.000004.out 2>&1
    ./red.sh 5 > ./red.000005.out 2>&1
    ./red.sh 6 > ./red.000006.out 2>&1
    ./red.sh 7 > ./red.000007.out 2>&1
    ./red.sh 8 > ./red.000008.out 2>&1
    ./red.sh 9 > ./red.000009.out 2>&1
    ./red.sh 10 > ./red.000010.out 2>&1
    ./red.sh 11 > ./red.000011.out 2>&1
    ./red.sh 12 > ./red.000012.out 2>&1
    ./red.sh 13 > ./red.000013.out 2>&1
    ./red.sh 14 > ./red.000014.out 2>&1
    ./red.sh 15 > ./red.000015.out 2>&1
    ./red.sh 16 > ./red.000016.out 2>&1
    ./red.sh 17 > ./red.000017.out 2>&1
    ./red.sh 18 > ./red.000018.out 2>&1
    ./red.sh 19 > ./red.000019.out 2>&1
    ./red.sh 20 > ./red.000020.out 2>&1
    ./red.sh 21 > ./red.000021.out 2>&1
    ./red.sh 22 > ./red.000022.out 2>&1
    ./red.sh 23 > ./red.000023.out 2>&1
    ./red.sh 24 > ./red.000024.out 2>&1
    ./red.sh 25 > ./red.000025.out 2>&1
    ./red.sh 26 > ./red.000026.out 2>&1
    ./red.sh 27 > ./red.000027.out 2>&1
    ./red.sh 28 > ./red.000028.out 2>&1
    ./red.sh 29 > ./red.000029.out 2>&1
    ./red.sh 30 > ./red.000030.out 2>&1
    ./red.sh 31 > ./red.000031.out 2>&1
    ./red.sh 32 > ./red.000032.out 2>&1
    ./red.sh 33 > ./red.000033.out 2>&1
    ./red.sh 34 > ./red.000034.out 2>&1
    ./red.sh 35 > ./red.000035.out 2>&1
    ./red.sh 36 > ./red.000036.out 2>&1
    ./red.sh 37 > ./red.000037.out 2>&1
    ./red.sh 38 > ./red.000038.out 2>&1
    ./red.sh 39 > ./red.000039.out 2>&1
    ./red.sh 40 > ./red.000040.out 2>&1

-- Finished on Fri Jan 16 02:54:07 2026 (1048 seconds) with 4558409.359 GB free disk space
----------------------------------------
-- Found 40 read error detection output files.
-- Finished stage 'readErrorDetectionCheck', reset canuIteration.
--
-- Loading read lengths.
-- Loading number of overlaps per read.
--
-- Configure OEA for 8gb memory.
--                   Batches of at most (unlimited) reads.
--                                      300000000 bases.
--
--           Total                                               Reads                 Olaps  Adjusts
--    Job   Memory      Read Range         Reads        Bases   Memory        Olaps   Memory   Memory  (Memory in MB)
--   ---- -------- ------------------- --------- ------------ -------- ------------ -------- --------
--      1  2874.35         1-132337        16945    300000520   294.62      5214760   159.14   372.59
--      2  2922.24    132338-277839        18379    300031351   294.69      6781507   206.96   372.59
--      3  2909.88    277840-423714        18517    300010324   294.68      6377093   194.61   372.59
--      4  2916.46    423715-565449        18327    300015231   294.68      6592667   201.19   372.59
--      5  2903.46    565450-707082        18184    300008439   294.67      6167180   188.21   372.59
--      6  2898.44    707083-849353        18108    300005937   294.66      6002835   183.19   372.59
--      7  2917.26    849354-992167        18049    300002726   294.66      6619630   202.02   372.59
--      8  2893.11    992168-1131823       17897    300009756   294.66      5828262   177.86   372.59
--      9  2890.88   1131824-1271924       17849    300007492   294.65      5755066   175.63   372.59
--     10  2915.37   1271925-1412143       17830    300000174   294.65      6557823   200.13   372.59
--     11  2904.11   1412144-1552320       17849    300009037   294.66      6188555   188.86   372.59
--     12  2910.21   1552321-1693194       17809    300004961   294.65      6388804   194.97   372.59
--     13  2868.24   1693195-1826419       17035    300008692   294.63      5014181   153.02   372.59
--     14  2907.64   1826420-1964446       17541    300001563   294.64      6305004   192.41   372.59
--     15  2550.44   1964447-1995939        3935     49897997    55.71      2429569    74.14   372.59
--   ---- -------- ------------------- --------- ------------ -------- ------------ -------- --------
--                                                 4250014200              88222936
-- Finished stage 'overlapErrorAdjustmentConfigure', reset canuIteration.
--
-- Running jobs.  First attempt out of 2.
----------------------------------------
-- Starting 'oea' concurrent execution on Fri Jan 16 02:54:15 2026 with 4558409.281 GB free disk space (15 processes; 62 concurrently)

    cd unitigging/3-overlapErrorAdjustment
    ./oea.sh 1 > ./oea.000001.out 2>&1
    ./oea.sh 2 > ./oea.000002.out 2>&1
    ./oea.sh 3 > ./oea.000003.out 2>&1
    ./oea.sh 4 > ./oea.000004.out 2>&1
    ./oea.sh 5 > ./oea.000005.out 2>&1
    ./oea.sh 6 > ./oea.000006.out 2>&1
    ./oea.sh 7 > ./oea.000007.out 2>&1
    ./oea.sh 8 > ./oea.000008.out 2>&1
    ./oea.sh 9 > ./oea.000009.out 2>&1
    ./oea.sh 10 > ./oea.000010.out 2>&1
    ./oea.sh 11 > ./oea.000011.out 2>&1
    ./oea.sh 12 > ./oea.000012.out 2>&1
    ./oea.sh 13 > ./oea.000013.out 2>&1
    ./oea.sh 14 > ./oea.000014.out 2>&1
    ./oea.sh 15 > ./oea.000015.out 2>&1

-- Finished on Fri Jan 16 03:44:10 2026 (2995 seconds) with 4556540.375 GB free disk space
----------------------------------------
-- Found 15 overlap error adjustment output files.
-- Finished stage 'overlapErrorAdjustmentCheck', reset canuIteration.
----------------------------------------
-- Starting command on Fri Jan 16 03:44:10 2026 with 4556540.359 GB free disk space

    cd unitigging/3-overlapErrorAdjustment
    /share/org/YZWL/yzwl_lixg/miniforge3/envs/canu_v.2.3/bin/loadErates \
      -S ../../A3-57.seqStore \
      -O ../A3-57.ovlStore \
      -L ./oea.files \
    > ./oea.apply.err 2>&1

-- Finished on Fri Jan 16 03:44:11 2026 (one second) with 4556540.187 GB free disk space
----------------------------------------
-- No report available.
-- Finished stage 'updateOverlapStore', reset canuIteration.
-- Finished stage 'unitig', reset canuIteration.
--
-- Running jobs.  First attempt out of 2.
----------------------------------------
-- Starting 'bat' concurrent execution on Fri Jan 16 03:44:11 2026 with 4556540.14 GB free disk space (1 processes; 1 concurrently)

    cd unitigging/4-unitigger
    ./unitigger.sh 1 > ./unitigger.000001.out 2>&1

-- Finished on Fri Jan 16 03:44:32 2026 (21 seconds) with 4556539.937 GB free disk space
----------------------------------------
-- Unitigger finished successfully.
--  
--  ERROR RATES
--  -----------
--                                                   --------threshold------
--  281936                       fraction error      fraction        percent
--  samples                              (1e-5)         error          error
--                   --------------------------      --------       --------
--  command line (-eg)                           ->     30.00        0.0300%
--  command line (-ef)                           ->  -----.--      ---.----%
--  command line (-eM)                           ->     30.00        0.0300%
--  mean + std.dev       0.58 +-  12 *     3.40  ->     41.40        0.0414%
--  median + mad         0.00 +-  12 *     0.00  ->      0.00        0.0000%
--  90th percentile                              ->      1.00        0.0010%  (enabled)
--  
--  BEST EDGE FILTERING
--  -------------------
--  At graph threshold 0.0300%, reads:
--    available to have edges:        52120
--    with at least one edge:         41960
--  
--  At max threshold 0.0300%, reads:  (not computed)
--    available to have edges:            0
--    with at least one edge:             0
--  
--  At tight threshold 0.0010%, reads with:
--    both edges below error threshold:     34312  (80.00% minReadsBest threshold = 33568)
--    one  edge  above error threshold:      5702
--    both edges above error threshold:      1946
--    at least one edge:                    41960
--  
--  At loose threshold 0.0300%, reads with:
--    both edges below error threshold:     41960  (80.00% minReadsBest threshold = 33568)
--    one  edge  above error threshold:         0
--    both edges above error threshold:         0
--    at least one edge:                    41960
--  
--  
--  INITIAL EDGES
--  -------- ----------------------------------------
--    194082 reads are contained
--   1763668 reads have no best edges (singleton)
--       394 reads have only one best edge (spur) 
--                197 are mutual best
--     37795 reads have two best edges 
--               1547 have one mutual best edge
--              35760 have two mutual best edges
--  
--  
--  FINAL EDGES
--  -------- ----------------------------------------
--    194082 reads are contained
--   1764089 reads have no best edges (singleton)
--       275 reads have only one best edge (spur) 
--                220 are mutual best
--     37493 reads have two best edges 
--               1398 have one mutual best edge
--              35732 have two mutual best edges
--  
--  
--  EDGE FILTERING
--  -------- ------------------------------------------
--         0 reads are ignored
--     11523 reads have a gap in overlap coverage
--       198 reads have lopsided best edges
-- Found, in version 1, after unitig construction:
--   contigs:      156 sequences, total length 72622062 bp (including 276 repeats of total length 11190478 bp).
--   bubbles:      589 sequences, total length 31908649 bp.
--   unassembled:  22665 sequences, total length 275099684 bp.
--
-- Contig sizes based on genome size 85mbp:
--
--            NG (bp)  LG (contigs)    sum (bp)
--         ----------  ------------  ----------
--     10     8809660             1     8809660
--     20     6514360             3    22272555
--     30     3400634             4    25673189
--     40     2950967             7    34704637
--     50     2438539            10    42647816
--     60     2033606            14    51162400
--     70     1251802            19    59539162
--     80      258748            33    68254290
--
-- Finished stage 'unitigCheck', reset canuIteration.
----------------------------------------
-- Starting command on Fri Jan 16 03:44:32 2026 with 4556539.921 GB free disk space

    cd unitigging
    /share/org/YZWL/yzwl_lixg/miniforge3/envs/canu_v.2.3/bin/utgcns \
      -S ../A3-57.seqStore \
      -T  ./A3-57.ctgStore 1 \
      -partition 0.8 1.5 0.1 \
    > ./A3-57.ctgStore/partitioning.log 2>&1

-- Finished on Fri Jan 16 03:44:41 2026 (9 seconds) with 4556538.703 GB free disk space
----------------------------------------
-- Using slow alignment for consensus (iteration '0').
-- Configured 10 consensus jobs.
-- Finished stage 'consensusConfigure', reset canuIteration.
--
-- Local: cns       13.000 GB    8 CPUs x  11 jobs   143.000 GB  88 CPUs  (consensus)
--
--
-- Running jobs.  First attempt out of 2.
----------------------------------------
-- Starting 'cns' concurrent execution on Fri Jan 16 03:44:42 2026 with 4556538.671 GB free disk space (10 processes; 11 concurrently)

    cd unitigging/5-consensus
    ./consensus.sh 1 > ./consensus.000001.out 2>&1
    ./consensus.sh 2 > ./consensus.000002.out 2>&1
    ./consensus.sh 3 > ./consensus.000003.out 2>&1
    ./consensus.sh 4 > ./consensus.000004.out 2>&1
    ./consensus.sh 5 > ./consensus.000005.out 2>&1
    ./consensus.sh 6 > ./consensus.000006.out 2>&1
    ./consensus.sh 7 > ./consensus.000007.out 2>&1
    ./consensus.sh 8 > ./consensus.000008.out 2>&1
    ./consensus.sh 9 > ./consensus.000009.out 2>&1
    ./consensus.sh 10 > ./consensus.000010.out 2>&1

-- Finished on Fri Jan 16 03:52:06 2026 (444 seconds) with 4556235.656 GB free disk space
----------------------------------------
-- Using slow alignment for consensus (iteration '1').
-- Configured 10 consensus jobs.
-- All 10 consensus jobs finished successfully.
-- Finished stage 'consensusCheck', reset canuIteration.
-- Using slow alignment for consensus (iteration '0').
-- Configured 10 consensus jobs.
----------------------------------------
-- Starting command on Fri Jan 16 03:52:06 2026 with 4556235.609 GB free disk space

    cd unitigging
    /share/org/YZWL/yzwl_lixg/miniforge3/envs/canu_v.2.3/bin/tgStoreLoad \
      -S ../A3-57.seqStore \
      -T  ./A3-57.ctgStore 2 \
      -L ./5-consensus/ctgcns.files \
    > ./5-consensus/ctgcns.files.ctgStoreLoad.err 2>&1

-- Finished on Fri Jan 16 03:52:08 2026 (2 seconds) with 4556234.578 GB free disk space
----------------------------------------
----------------------------------------
-- Starting command on Fri Jan 16 03:52:08 2026 with 4556234.578 GB free disk space

    cd unitigging
    /share/org/YZWL/yzwl_lixg/miniforge3/envs/canu_v.2.3/bin/tgTigDisplay \
      -S ../A3-57.seqStore \
      -b \
      -o ../A3-57.contigs.unsorted.bam \
      -L ./5-consensus/ctgcns.files \
    > ./5-consensus/ctgcns.files.contigs.bam.err 2>&1

-- Finished on Fri Jan 16 03:54:51 2026 (163 seconds) with 4556043.468 GB free disk space
----------------------------------------
----------------------------------------
-- Starting command on Fri Jan 16 03:54:51 2026 with 4556043.468 GB free disk space

    cd .
    samtools sort \
      --write-index \
      --threads 2 \
      -o ./A3-57.contigs.bam ./A3-57.contigs.unsorted.bam \
    > ./ctgcns.bam.err 2>&1

-- Finished on Fri Jan 16 03:55:45 2026 (54 seconds) with 4555869.328 GB free disk space
----------------------------------------
-- Purging consensus output after loading to ctgStore.
-- Purged 10 .cns outputs.
----------------------------------------
-- Starting command on Fri Jan 16 03:55:45 2026 with 4555871.109 GB free disk space

    cd unitigging
    /share/org/YZWL/yzwl_lixg/miniforge3/envs/canu_v.2.3/bin/tgStoreDump \
      -S ../A3-57.seqStore \
      -T ./A3-57.ctgStore 2 \
      -sizes -s 85000000 \
    > ./A3-57.ctgStore/seqDB.v002.sizes.txt
ZERO length suplied to intervalList::add(), ignoring interval.
ZERO length suplied to intervalList::add(), ignoring interval.
ZERO length suplied to intervalList::add(), ignoring interval.
ZERO length suplied to intervalList::add(), ignoring interval.
ZERO length suplied to intervalList::add(), ignoring interval.
ZERO length suplied to intervalList::add(), ignoring interval.
ZERO length suplied to intervalList::add(), ignoring interval.
ZERO length suplied to intervalList::add(), ignoring interval.
ZERO length suplied to intervalList::add(), ignoring interval.
ZERO length suplied to intervalList::add(), ignoring interval.
ZERO length suplied to intervalList::add(), ignoring interval.
ZERO length suplied to intervalList::add(), ignoring interval.
ZERO length suplied to intervalList::add(), ignoring interval.
ZERO length suplied to intervalList::add(), ignoring interval.
ZERO length suplied to intervalList::add(), ignoring interval.
ZERO length suplied to intervalList::add(), ignoring interval.
ZERO length suplied to intervalList::add(), ignoring interval.
ZERO length suplied to intervalList::add(), ignoring interval.
ZERO length suplied to intervalList::add(), ignoring interval.
ZERO length suplied to intervalList::add(), ignoring interval.
ZERO length suplied to intervalList::add(), ignoring interval.
ZERO length suplied to intervalList::add(), ignoring interval.
ZERO length suplied to intervalList::add(), ignoring interval.
ZERO length suplied to intervalList::add(), ignoring interval.
ZERO length suplied to intervalList::add(), ignoring interval.
ZERO length suplied to intervalList::add(), ignoring interval.
ZERO length suplied to intervalList::add(), ignoring interval.
ZERO length suplied to intervalList::add(), ignoring interval.

-- Finished on Fri Jan 16 03:55:46 2026 (one second) with 4555871.109 GB free disk space
----------------------------------------
-- Found, in version 2, after consensus generation:
--   contigs:      156 sequences, total length 94837255 bp (including 276 repeats of total length 14888504 bp).
--   bubbles:      589 sequences, total length 41768654 bp.
--   unassembled:  22665 sequences, total length 380392246 bp.
--
-- Contig sizes based on genome size 85mbp:
--
--            NG (bp)  LG (contigs)    sum (bp)
--         ----------  ------------  ----------
--     10    11448948             1    11448948
--     20     9034791             2    20483739
--     30     8457192             3    28940931
--     40     4014068             5    37390414
--     50     3851463             7    45147239
--     60     3389852             9    52316070
--     70     2741862            12    61217413
--     80     2614054            15    69207339
--     90     1628514            19    77521794
--    100      681166            26    85501668
--    110       31432           102    93507291
--
-- Finished stage 'consensusLoad', reset canuIteration.
----------------------------------------
-- Starting command on Fri Jan 16 03:55:46 2026 with 4555871.093 GB free disk space

    cd .
    /share/org/YZWL/yzwl_lixg/miniforge3/envs/canu_v.2.3/bin/tgStoreDump \
      -S ./A3-57.seqStore \
      -T ./unitigging/A3-57.ctgStore 2 \
      -o ./A3-57.contigs \
      -layout \
    > ./A3-57.contigs.layout.err 2>&1

-- Finished on Fri Jan 16 03:55:46 2026 (like a bat out of hell) with 4555871.046 GB free disk space
----------------------------------------
----------------------------------------
-- Starting command on Fri Jan 16 03:55:46 2026 with 4555871.046 GB free disk space

    cd .
    /share/org/YZWL/yzwl_lixg/miniforge3/envs/canu_v.2.3/bin/tgStoreDump \
      -S ./A3-57.seqStore \
      -T ./unitigging/A3-57.ctgStore 2 \
      -consensus -fasta \
      -unassembled \
    > ./A3-57.unassembled.fasta
    2> ./A3-57.unassembled.err
ZERO length suplied to intervalList::add(), ignoring interval.
ZERO length suplied to intervalList::add(), ignoring interval.
ZERO length suplied to intervalList::add(), ignoring interval.
ZERO length suplied to intervalList::add(), ignoring interval.
ZERO length suplied to intervalList::add(), ignoring interval.
ZERO length suplied to intervalList::add(), ignoring interval.
ZERO length suplied to intervalList::add(), ignoring interval.
ZERO length suplied to intervalList::add(), ignoring interval.
ZERO length suplied to intervalList::add(), ignoring interval.
ZERO length suplied to intervalList::add(), ignoring interval.
ZERO length suplied to intervalList::add(), ignoring interval.
ZERO length suplied to intervalList::add(), ignoring interval.
ZERO length suplied to intervalList::add(), ignoring interval.
ZERO length suplied to intervalList::add(), ignoring interval.
ZERO length suplied to intervalList::add(), ignoring interval.
ZERO length suplied to intervalList::add(), ignoring interval.
ZERO length suplied to intervalList::add(), ignoring interval.
ZERO length suplied to intervalList::add(), ignoring interval.
ZERO length suplied to intervalList::add(), ignoring interval.
ZERO length suplied to intervalList::add(), ignoring interval.
ZERO length suplied to intervalList::add(), ignoring interval.
ZERO length suplied to intervalList::add(), ignoring interval.
ZERO length suplied to intervalList::add(), ignoring interval.
ZERO length suplied to intervalList::add(), ignoring interval.
ZERO length suplied to intervalList::add(), ignoring interval.
ZERO length suplied to intervalList::add(), ignoring interval.
ZERO length suplied to intervalList::add(), ignoring interval.
ZERO length suplied to intervalList::add(), ignoring interval.

-- Finished on Fri Jan 16 03:55:48 2026 (2 seconds) with 4555871.718 GB free disk space
----------------------------------------
----------------------------------------
-- Starting command on Fri Jan 16 03:55:48 2026 with 4555871.718 GB free disk space

    cd .
    /share/org/YZWL/yzwl_lixg/miniforge3/envs/canu_v.2.3/bin/tgStoreDump \
      -S ./A3-57.seqStore \
      -T ./unitigging/A3-57.ctgStore 2 \
      -consensus -fasta \
      -contigs \
    > ./A3-57.contigs.fasta
    2> ./A3-57.contigs.err
ZERO length suplied to intervalList::add(), ignoring interval.
ZERO length suplied to intervalList::add(), ignoring interval.
ZERO length suplied to intervalList::add(), ignoring interval.
ZERO length suplied to intervalList::add(), ignoring interval.
ZERO length suplied to intervalList::add(), ignoring interval.
ZERO length suplied to intervalList::add(), ignoring interval.
ZERO length suplied to intervalList::add(), ignoring interval.
ZERO length suplied to intervalList::add(), ignoring interval.
ZERO length suplied to intervalList::add(), ignoring interval.
ZERO length suplied to intervalList::add(), ignoring interval.
ZERO length suplied to intervalList::add(), ignoring interval.
ZERO length suplied to intervalList::add(), ignoring interval.
ZERO length suplied to intervalList::add(), ignoring interval.
ZERO length suplied to intervalList::add(), ignoring interval.
ZERO length suplied to intervalList::add(), ignoring interval.
ZERO length suplied to intervalList::add(), ignoring interval.
ZERO length suplied to intervalList::add(), ignoring interval.
ZERO length suplied to intervalList::add(), ignoring interval.
ZERO length suplied to intervalList::add(), ignoring interval.
ZERO length suplied to intervalList::add(), ignoring interval.
ZERO length suplied to intervalList::add(), ignoring interval.
ZERO length suplied to intervalList::add(), ignoring interval.
ZERO length suplied to intervalList::add(), ignoring interval.
ZERO length suplied to intervalList::add(), ignoring interval.
ZERO length suplied to intervalList::add(), ignoring interval.
ZERO length suplied to intervalList::add(), ignoring interval.
ZERO length suplied to intervalList::add(), ignoring interval.
ZERO length suplied to intervalList::add(), ignoring interval.

-- Finished on Fri Jan 16 03:55:49 2026 (one second) with 4555871.578 GB free disk space
----------------------------------------
-- Finished stage 'generateOutputs', reset canuIteration.
--
-- Assembly 'A3-57' finished in '/share/org/YZWL/yzwl_lixg/project/28.大豆疫霉菌三代基因组/03.hicanu/A3-57/01.raw_output'.
--
-- Summary saved in 'A3-57.report'.
--
-- Sequences saved:
--   Contigs       -> 'A3-57.contigs.fasta'
--   Unassembled   -> 'A3-57.unassembled.fasta'
--
-- Read layouts saved:
--   Contigs       -> 'A3-57.contigs.layout'.
--
-- Bye.

2026-01-16 03:55:49.396 - WARNING - 输出文件不存在|Output file does not exist: /share/org/YZWL/yzwl_lixg/project/28.大豆疫霉菌三代基因组/03.hicanu/A3-57/01.raw_output/A3-57.unitigs.fasta
Usage: biopytools ragtag [OPTIONS]
Try 'biopytools ragtag -h' for help.

Error: Invalid value for '-r' / '--reference': 文件不存在|File does not exist: /share/org/YZWL/yzwl_lixg/project/28.大豆疫霉菌三代基因组/04.ragtag/Psoja_T2T.fa
Usage: biopytools genomesyn [OPTIONS]
Try 'biopytools genomesyn -h' for help.

Error: Invalid value for '-i' / '--ref': Path '04.ragtag/A3-57/hicanu/A3-57_RagTag_scaffolded.fa' does not exist.
Job 68886823 stderr output:

