Usage: biopytools ragtag [OPTIONS]
Try 'biopytools ragtag -h' for help.

Error: Invalid value for '-r' / '--reference': 文件不存在|File does not exist: /share/org/YZWL/yzwl_lixg/project/28.大豆疫霉菌三代基因组/04.ragtag/Psoja_T2T.fa
Usage: biopytools genomesyn [OPTIONS]
Try 'biopytools genomesyn -h' for help.

Error: Invalid value for '-i' / '--ref': Path '04.ragtag/B3-5/hifiasm/B3-5_RagTag_scaffolded.fa' does not exist.
2026-01-16 01:27:39.524 - WARNING - 命令错误输出|Command stderr:
-- canu master +27 changes (r10515 2a41e933b8de6ed66723d75d36dd071b46d2c347)
--
-- CITATIONS
--
-- For assemblies of PacBio HiFi reads:
--   Nurk S, Walenz BP, Rhiea A, Vollger MR, Logsdon GA, Grothe R, Miga KH, Eichler EE, Phillippy AM, Koren S.
--   HiCanu: accurate assembly of segmental duplications, satellites, and allelic variants from high-fidelity long reads.
--   biorXiv. 2020.
--   https://doi.org/10.1101/2020.03.14.992248
-- 
-- Read and contig alignments during correction and consensus use:
--   Šošic M, Šikic M.
--   Edlib: a C/C ++ library for fast, exact sequence alignment using edit distance.
--   Bioinformatics. 2017 May 1;33(9):1394-1395.
--   http://doi.org/10.1093/bioinformatics/btw753
-- 
-- Overlaps are generated using:
--   Berlin K, et al.
--   Assembling large genomes with single-molecule sequencing and locality-sensitive hashing.
--   Nat Biotechnol. 2015 Jun;33(6):623-30.
--   http://doi.org/10.1038/nbt.3238
-- 
--   Myers EW, et al.
--   A Whole-Genome Assembly of Drosophila.
--   Science. 2000 Mar 24;287(5461):2196-204.
--   http://doi.org/10.1126/science.287.5461.2196
-- 
-- Contig consensus sequences are generated using an algorithm derived from pbdagcon:
--   Chin CS, et al.
--   Nonhybrid, finished microbial genome assemblies from long-read SMRT sequencing data.
--   Nat Methods. 2013 Jun;10(6):563-9
--   http://doi.org/10.1038/nmeth.2474
-- 
-- CONFIGURE CANU
--
-- Detected Java(TM) Runtime Environment '17.0.15-internal' (from '/share/org/YZWL/yzwl_lixg/.local/bin/java') without -d64 support.
--
-- WARNING:
-- WARNING:  Failed to run gnuplot using command 'gnuplot'.
-- WARNING:  Plots will be disabled.
-- WARNING:
--
-- Detected samtools version '1.22' / htslib version 'htscodecs=1.6.3' (from 'samtools').
--
-- Detected 88 CPUs and 503 gigabytes of memory on the local machine.
--
-- Detected Slurm with 'sinfo' binary in /opt/skyformai/bin/sinfo.
--          Slurm disabled by useGrid=false
--
-- Detected  '' with 'pbsnodes' binary in /opt/skyformai/bin/pbsnodes.
--           disabled by useGrid=false
--
-- Detected LSF with 'bsub' binary in /opt/skyformai/bin/bsub.
--          LSF disabled by useGrid=false
--
-- Local machine mode enabled; grid support not detected or not allowed.
--
-- Found trimmed raw PacBio HiFi reads in the input files.
--
--                                (tag)Concurrency
--                         (tag)Threads          |
--                (tag)Memory         |          |
--        (tag)             |         |          |       total usage      algorithm
--        -------  ----------  --------   --------  --------------------  -----------------------------
-- Local: meryl     12.000 GB    4 CPUs x  22 jobs   264.000 GB  88 CPUs  (k-mer counting)
-- Local: cormhap   13.000 GB   11 CPUs x   8 jobs   104.000 GB  88 CPUs  (overlap detection with mhap)
-- Local: obtovl     8.000 GB    8 CPUs x  11 jobs    88.000 GB  88 CPUs  (overlap detection)
-- Local: utgovl     8.000 GB    8 CPUs x  11 jobs    88.000 GB  88 CPUs  (overlap detection)
-- Local: cor        -.--- GB    4 CPUs x   - jobs     -.--- GB   - CPUs  (read correction)
-- Local: ovb        4.000 GB    1 CPU  x  88 jobs   352.000 GB  88 CPUs  (overlap store bucketizer)
-- Local: ovs        8.000 GB    1 CPU  x  62 jobs   496.000 GB  62 CPUs  (overlap store sorting)
-- Local: red       16.000 GB    4 CPUs x  22 jobs   352.000 GB  88 CPUs  (read error detection)
-- Local: oea        8.000 GB    1 CPU  x  62 jobs   496.000 GB  62 CPUs  (overlap error adjustment)
-- Local: bat       32.000 GB    8 CPUs x   1 job     32.000 GB   8 CPUs  (contig construction with bogart)
-- Local: cns        -.--- GB    8 CPUs x   - jobs     -.--- GB   - CPUs  (consensus)
--
-- Generating assembly 'B3-5' in '/share/org/YZWL/yzwl_lixg/project/28.大豆疫霉菌三代基因组/03.hicanu/B3-5/01.raw_output':
--   genomeSize:
--     85000000
--
--   Overlap Generation Limits:
--     corOvlErrorRate 0.0000 (  0.00%)
--     obtOvlErrorRate 0.0250 (  2.50%)
--     utgOvlErrorRate 0.0100 (  1.00%)
--
--   Overlap Processing Limits:
--     corErrorRate    0.0000 (  0.00%)
--     obtErrorRate    0.0250 (  2.50%)
--     utgErrorRate    0.0003 (  0.03%)
--     cnsErrorRate    0.0500 (  5.00%)
--
--   Stages to run:
--     assemble HiFi reads.
--
--
-- BEGIN STORE CREATION
----------------------------------------
-- Starting command on Thu Jan 15 23:46:12 2026 with 4567268.453 GB free disk space

    cd .
    ./B3-5.seqStore.sh \
    > ./B3-5.seqStore.err 2>&1

-- Finished on Thu Jan 15 23:52:48 2026 (396 seconds) with 4566607.312 GB free disk space
----------------------------------------
--
-- In sequence store './B3-5.seqStore':
--   Found 250614 reads.
--   Found 4250005994 bases (50 times coverage).
--    Histogram of corrected reads:
--    
--    G=4250005994                       sum of  ||               length     num
--    NG         length     index       lengths  ||                range    seqs
--    ----- ------------ --------- ------------  ||  ------------------- -------
--    00010        26668     14703    425023456  ||       1244-2404         6731|------------------
--    00020        24370     31429    850020869  ||       2405-3565         8805|------------------------
--    00030        22825     49477   1275022227  ||       3566-4726         7890|---------------------
--    00040        21611     68627   1700008360  ||       4727-5887         7154|-------------------
--    00050        20568     88795   2125008897  ||       5888-7048         6654|------------------
--    00060        19548    109982   2550018778  ||       7049-8209         6283|-----------------
--    00070        18372    132379   2975022030  ||       8210-9370         6217|-----------------
--    00080        16645    156556   3400010110  ||       9371-10531        6048|----------------
--    00090        12434    185291   3825008265  ||      10532-11692        5822|----------------
--    00100         1244    250614   4250005994  ||      11693-12853        5963|----------------
--    001.000x              250614   4250005994  ||      12854-14014        6388|-----------------
--                                               ||      14015-15175        7519|--------------------
--                                               ||      15176-16336        9488|-------------------------
--                                               ||      16337-17497       13545|------------------------------------
--                                               ||      17498-18658       18776|--------------------------------------------------
--                                               ||      18659-19819       22892|-------------------------------------------------------------
--                                               ||      19820-20980       24017|---------------------------------------------------------------
--                                               ||      20981-22141       20763|-------------------------------------------------------
--                                               ||      22142-23302       16477|--------------------------------------------
--                                               ||      23303-24463       12665|----------------------------------
--                                               ||      24464-25624        9369|-------------------------
--                                               ||      25625-26785        7083|-------------------
--                                               ||      26786-27946        5093|--------------
--                                               ||      27947-29107        3616|----------
--                                               ||      29108-30268        2289|-------
--                                               ||      30269-31429        1455|----
--                                               ||      31430-32590         836|---
--                                               ||      32591-33751         443|--
--                                               ||      33752-34912         189|-
--                                               ||      34913-36073         100|-
--                                               ||      36074-37234          22|-
--                                               ||      37235-38395          10|-
--                                               ||      38396-39556           3|-
--                                               ||      39557-40717           3|-
--                                               ||      40718-41878           1|-
--                                               ||      41879-43039           1|-
--                                               ||      43040-44200           1|-
--                                               ||      44201-45361           0|
--                                               ||      45362-46522           2|-
--                                               ||      46523-47683           1|-
--    
--
-- In sequence store './B3-5.seqStore':
--   Found 250614 reads.
--   Found 4250005994 bases (50 times coverage).
--    Histogram of corrected-trimmed reads:
--    
--    G=4250005994                       sum of  ||               length     num
--    NG         length     index       lengths  ||                range    seqs
--    ----- ------------ --------- ------------  ||  ------------------- -------
--    00010        26668     14703    425023456  ||       1244-2404         6731|------------------
--    00020        24370     31429    850020869  ||       2405-3565         8805|------------------------
--    00030        22825     49477   1275022227  ||       3566-4726         7890|---------------------
--    00040        21611     68627   1700008360  ||       4727-5887         7154|-------------------
--    00050        20568     88795   2125008897  ||       5888-7048         6654|------------------
--    00060        19548    109982   2550018778  ||       7049-8209         6283|-----------------
--    00070        18372    132379   2975022030  ||       8210-9370         6217|-----------------
--    00080        16645    156556   3400010110  ||       9371-10531        6048|----------------
--    00090        12434    185291   3825008265  ||      10532-11692        5822|----------------
--    00100         1244    250614   4250005994  ||      11693-12853        5963|----------------
--    001.000x              250614   4250005994  ||      12854-14014        6388|-----------------
--                                               ||      14015-15175        7519|--------------------
--                                               ||      15176-16336        9488|-------------------------
--                                               ||      16337-17497       13545|------------------------------------
--                                               ||      17498-18658       18776|--------------------------------------------------
--                                               ||      18659-19819       22892|-------------------------------------------------------------
--                                               ||      19820-20980       24017|---------------------------------------------------------------
--                                               ||      20981-22141       20763|-------------------------------------------------------
--                                               ||      22142-23302       16477|--------------------------------------------
--                                               ||      23303-24463       12665|----------------------------------
--                                               ||      24464-25624        9369|-------------------------
--                                               ||      25625-26785        7083|-------------------
--                                               ||      26786-27946        5093|--------------
--                                               ||      27947-29107        3616|----------
--                                               ||      29108-30268        2289|-------
--                                               ||      30269-31429        1455|----
--                                               ||      31430-32590         836|---
--                                               ||      32591-33751         443|--
--                                               ||      33752-34912         189|-
--                                               ||      34913-36073         100|-
--                                               ||      36074-37234          22|-
--                                               ||      37235-38395          10|-
--                                               ||      38396-39556           3|-
--                                               ||      39557-40717           3|-
--                                               ||      40718-41878           1|-
--                                               ||      41879-43039           1|-
--                                               ||      43040-44200           1|-
--                                               ||      44201-45361           0|
--                                               ||      45362-46522           2|-
--                                               ||      46523-47683           1|-
--    
--
-- Correction skipped; not enabled.
--
-- Trimming skipped; not enabled.
--
-- BEGIN ASSEMBLY
----------------------------------------
-- Starting command on Thu Jan 15 23:52:49 2026 with 4566607.25 GB free disk space

    cd unitigging/0-mercounts
    ./meryl-configure.sh \
    > ./meryl-configure.err 2>&1

-- Finished on Thu Jan 15 23:52:50 2026 (one second) with 4566607.25 GB free disk space
----------------------------------------
--  segments   memory batches
--  -------- -------- -------
--        01 10.81 GB       2
--        02  5.61 GB       2
--        04  2.97 GB       2
--        06  2.15 GB       2
--        08  1.61 GB       2
--        12  1.07 GB       2
--        16  0.81 GB       2
--        20  0.65 GB       2
--        24  0.54 GB       2
--        32  0.41 GB       2
--        40  0.33 GB       2
--        48  -.-- GB       -  (segment size too small)
--        56  -.-- GB       -  (segment size too small)
--        64  -.-- GB       -  (segment size too small)
--        96  -.-- GB       -  (segment size too small)
--
--  For 250614 reads with 4250005994 bases, limit to 42 batches.
--  Will count kmers using 01 jobs, each using 12 GB and 4 threads.
--
-- Finished stage 'merylConfigure', reset canuIteration.
--
-- Running jobs.  First attempt out of 2.
----------------------------------------
-- Starting 'meryl' concurrent execution on Thu Jan 15 23:52:50 2026 with 4566607.218 GB free disk space (1 processes; 22 concurrently)

    cd unitigging/0-mercounts
    ./meryl-count.sh 1 > ./meryl-count.000001.out 2>&1

-- Finished on Thu Jan 15 23:56:11 2026 (201 seconds) with 4566917.843 GB free disk space
----------------------------------------
-- Found 1 Kmer counting (meryl) outputs.
-- Finished stage 'utg-merylCountCheck', reset canuIteration.
--
-- Running jobs.  First attempt out of 2.
----------------------------------------
-- Starting 'meryl' concurrent execution on Thu Jan 15 23:56:11 2026 with 4566917.812 GB free disk space (1 processes; 22 concurrently)

    cd unitigging/0-mercounts
    ./meryl-process.sh 1 > ./meryl-process.000001.out 2>&1

-- Finished on Thu Jan 15 23:56:18 2026 (7 seconds) with 4566918.421 GB free disk space
----------------------------------------
-- Meryl finished successfully.  Kmer frequency histogram:
--
-- WARNING: gnuplot failed.
--
----------------------------------------
--
--  22-mers                                                                                           Fraction
--    Occurrences   NumMers                                                                         Unique Total
--       1-     1         0                                                                        0.0000 0.0000
--       2-     2    291299 *                                                                      0.0065 0.0002
--       3-     4     97067                                                                        0.0079 0.0003
--       5-     7     33307                                                                        0.0090 0.0003
--       8-    11     12960                                                                        0.0095 0.0004
--      12-    16     11511                                                                        0.0097 0.0004
--      17-    22     86887                                                                        0.0100 0.0004
--      23-    29    779857 ***                                                                    0.0128 0.0013
--      30-    37   4833654 **********************                                                 0.0346 0.0098
--      38-    46  14926819 ********************************************************************   0.1633 0.0735
--      47-    56  15194566 ********************************************************************** 0.5116 0.2844
--      57-    67   3903182 *****************                                                      0.8216 0.5084
--      68-    79    645768 **                                                                     0.8935 0.5698
--      80-    92    922615 ****                                                                   0.9072 0.5840
--      93-   106    892321 ****                                                                   0.9280 0.6095
--     107-   121    356654 *                                                                      0.9471 0.6360
--     122-   137    239892 *                                                                      0.9545 0.6477
--     138-   154    274794 *                                                                      0.9599 0.6576
--     155-   172    186400                                                                        0.9658 0.6698
--     173-   191    156012                                                                        0.9699 0.6791
--     192-   211    137356                                                                        0.9734 0.6880
--     212-   232    102776                                                                        0.9763 0.6964
--     233-   254     99972                                                                        0.9786 0.7034
--     255-   277     89888                                                                        0.9808 0.7110
--     278-   301     83101                                                                        0.9828 0.7183
--     302-   326     66434                                                                        0.9846 0.7257
--     327-   352     60906                                                                        0.9861 0.7323
--     353-   379     46011                                                                        0.9874 0.7386
--     380-   407     39776                                                                        0.9884 0.7438
--     408-   436     33087                                                                        0.9893 0.7486
--     437-   466     31948                                                                        0.9901 0.7529
--     467-   497     27403                                                                        0.9908 0.7574
--     498-   529     26819                                                                        0.9914 0.7615
--     530-   562     24843                                                                        0.9919 0.7657
--     563-   596     19630                                                                        0.9925 0.7699
--     597-   631     18495                                                                        0.9929 0.7734
--     632-   667     16254                                                                        0.9933 0.7769
--     668-   704     14561                                                                        0.9937 0.7802
--     705-   742     13614                                                                        0.9940 0.7833
--     743-   781     12811                                                                        0.9943 0.7864
--     782-   821     10774                                                                        0.9946 0.7894
--
--           0 (max occurrences)
--  3223189866 (total mers, non-unique)
--    45054394 (distinct mers, non-unique)
--           0 (unique mers)
-- Finished stage 'meryl-process', reset canuIteration.
--
-- Removing meryl database 'unitigging/0-mercounts/B3-5.ms22'.
--
-- OVERLAPPER (normal) (assembly) erate=0.01
--
----------------------------------------
-- Starting command on Thu Jan 15 23:56:18 2026 with 4566918.406 GB free disk space

    cd unitigging/1-overlapper
    /share/org/YZWL/yzwl_lixg/miniforge3/envs/canu_v.2.3/bin/overlapInCorePartition \
     -S  ../../B3-5.seqStore \
     -hl 160000000 \
     -rl 5000000000 \
     -ol 500 \
     -o  ./B3-5.partition \
    > ./B3-5.partition.err 2>&1

-- Finished on Thu Jan 15 23:56:18 2026 (fast as lightning) with 4566918.39 GB free disk space
----------------------------------------
--
-- Configured 21 overlapInCore jobs.
-- Finished stage 'utg-overlapConfigure', reset canuIteration.
--
-- Running jobs.  First attempt out of 2.
----------------------------------------
-- Starting 'utgovl' concurrent execution on Thu Jan 15 23:56:18 2026 with 4566918.359 GB free disk space (21 processes; 11 concurrently)

    cd unitigging/1-overlapper
    ./overlap.sh 1 > ./overlap.000001.out 2>&1
    ./overlap.sh 2 > ./overlap.000002.out 2>&1
    ./overlap.sh 3 > ./overlap.000003.out 2>&1
    ./overlap.sh 4 > ./overlap.000004.out 2>&1
    ./overlap.sh 5 > ./overlap.000005.out 2>&1
    ./overlap.sh 6 > ./overlap.000006.out 2>&1
    ./overlap.sh 7 > ./overlap.000007.out 2>&1
    ./overlap.sh 8 > ./overlap.000008.out 2>&1
    ./overlap.sh 9 > ./overlap.000009.out 2>&1
    ./overlap.sh 10 > ./overlap.000010.out 2>&1
    ./overlap.sh 11 > ./overlap.000011.out 2>&1
    ./overlap.sh 12 > ./overlap.000012.out 2>&1
    ./overlap.sh 13 > ./overlap.000013.out 2>&1
    ./overlap.sh 14 > ./overlap.000014.out 2>&1
    ./overlap.sh 15 > ./overlap.000015.out 2>&1
    ./overlap.sh 16 > ./overlap.000016.out 2>&1
    ./overlap.sh 17 > ./overlap.000017.out 2>&1
    ./overlap.sh 18 > ./overlap.000018.out 2>&1
    ./overlap.sh 19 > ./overlap.000019.out 2>&1
    ./overlap.sh 20 > ./overlap.000020.out 2>&1
    ./overlap.sh 21 > ./overlap.000021.out 2>&1

-- Finished on Fri Jan 16 00:23:13 2026 (1615 seconds) with 4564507.656 GB free disk space
----------------------------------------
-- Found 21 overlapInCore output files.
--
-- overlapInCore compute 'unitigging/1-overlapper':
--   kmer hits
--     with no overlap       1300584869  12.8095238 +- 38013709.784
--     with an overlap         24865540  3.33333333 +- 696169.329
--
--   overlaps                  24865540  3.33333333 +- 696169.329
--     contained                6334588  .047619048 +- 176382.384
--     dovetail                18530952  .285714286 +- 523856.429
--
--   overlaps rejected
--     multiple per pair              0           0 +- 0
--     bad short window               0           0 +- 0
--     bad long window                0           0 +- 0
-- Finished stage 'utg-overlapCheck', reset canuIteration.
----------------------------------------
-- Starting command on Fri Jan 16 00:23:13 2026 with 4564507.64 GB free disk space

    cd unitigging
    /share/org/YZWL/yzwl_lixg/miniforge3/envs/canu_v.2.3/bin/ovStoreConfig \
     -S ../B3-5.seqStore \
     -M 4-8 \
     -L ./1-overlapper/ovljob.files \
     -create ./B3-5.ovlStore.config \
     > ./B3-5.ovlStore.config.txt \
    2> ./B3-5.ovlStore.config.err

-- Finished on Fri Jan 16 00:23:13 2026 (like a bat out of hell) with 4564507.625 GB free disk space
----------------------------------------
--
-- Creating overlap store unitigging/B3-5.ovlStore using:
--      1 bucket
--      1 slice
--        using at most 2 GB memory each
--
-- Running jobs.  First attempt out of 2.
----------------------------------------
-- Starting 'ovS' concurrent execution on Fri Jan 16 00:23:13 2026 with 4564507.609 GB free disk space (1 processes; 62 concurrently)

    cd unitigging
    ./B3-5.ovlStore.sh 1 > ./B3-5.ovlStore.000001.out 2>&1

-- Finished on Fri Jan 16 00:23:24 2026 (11 seconds) with 4564420.625 GB free disk space
----------------------------------------
-- Checking store.
----------------------------------------
-- Starting command on Fri Jan 16 00:23:24 2026 with 4564420.625 GB free disk space

    cd unitigging
    /share/org/YZWL/yzwl_lixg/miniforge3/envs/canu_v.2.3/bin/ovStoreDump \
     -S ../B3-5.seqStore \
     -O  ./B3-5.ovlStore \
     -counts \
     > ./B3-5.ovlStore/counts.dat 2> ./B3-5.ovlStore/counts.err

-- Finished on Fri Jan 16 00:23:24 2026 (in the blink of an eye) with 4564420.593 GB free disk space
----------------------------------------
--
-- Overlap store 'unitigging/B3-5.ovlStore' successfully constructed.
-- Found 49731080 overlaps for 245486 reads; 1263702 reads have no overlaps.
--
--
-- Purged 0.552 GB in 63 overlap output files.
----------------------------------------
-- Starting command on Fri Jan 16 00:23:25 2026 with 4564420.593 GB free disk space

    cd unitigging
    /share/org/YZWL/yzwl_lixg/miniforge3/envs/canu_v.2.3/bin/ovStoreStats \
     -C 50 \
     -S ../B3-5.seqStore \
     -O  ./B3-5.ovlStore \
     -o  ./B3-5.ovlStore \
     > ./B3-5.ovlStore.summary.err 2>&1

-- Finished on Fri Jan 16 00:23:32 2026 (7 seconds) with 4564420.734 GB free disk space
----------------------------------------
--
-- Overlap store 'unitigging/B3-5.ovlStore' contains:
--
--   category            reads     %          read length        feature size or coverage  analysis
--   ----------------  -------  -------  ----------------------  ------------------------  --------------------
--   middle-missing        156    0.06    15171.87 +- 6732.13        671.92 +- 734.89     (bad trimming)
--   middle-hump            12    0.00    16766.92 +- 4418.41       6404.42 +- 5092.01    (bad trimming)
--   no-5-prime            362    0.14    13086.23 +- 5723.25       1450.15 +- 2368.06    (bad trimming)
--   no-3-prime            384    0.15    11998.35 +- 6474.96       1474.44 +- 2387.29    (bad trimming)
--   
--   low-coverage          993    0.40    10070.73 +- 5766.27          6.20 +- 3.73       (easy to assemble, potential for lower quality consensus)
--   unique             205234   81.89    13077.80 +- 5581.55         46.31 +- 8.49       (easy to assemble, perfect, yay)
--   repeat-cont         17634    7.04    11163.00 +- 5313.20        898.81 +- 553.77     (potential for consensus errors, no impact on assembly)
--   repeat-dove           318    0.13    21204.32 +- 1915.48        622.73 +- 502.96     (hard to assemble, likely won't assemble correctly or even at all)
--   
--   span-repeat          2318    0.92    14015.40 +- 4899.88       3563.07 +- 4013.84    (read spans a large repeat, usually easy to assemble)
--   uniq-repeat-cont    12638    5.04    12993.39 +- 4527.38                             (should be uniquely placed, low potential for consensus errors, no impact on assembly)
--   uniq-repeat-dove     2530    1.01    19248.57 +- 2732.20                             (will end contigs, potential to misassemble)
--   uniq-anchor          2907    1.16    13778.49 +- 4576.12       8216.58 +- 5081.47    (repeat read, with unique section, probable bad read)
-- Finished stage 'utg-createOverlapStore', reset canuIteration.
--
-- Loading read lengths.
-- Loading number of overlaps per read.
--
-- Configure RED for 16gb memory.
--                   Batches of at most (unlimited) reads.
--                                      500000000 bases.
--                   Expecting evidence of at most 536870912 bases per iteration.
--
--           Total                                               Reads                 Olaps Evidence
--    Job   Memory      Read Range         Reads        Bases   Memory        Olaps   Memory   Memory  (Memory in MB)
--   ---- -------- ------------------- --------- ------------ -------- ------------ -------- --------
--      1 16384.26         1-39235          6374    108933260 13297.72      1270459    14.54  1024.00
--      2 16385.35     39236-73148          5620    108994722 13305.20       712123     8.15  1024.00
--      3 16384.63     73149-108394         5898    108907168 13294.52      1582536    18.11  1024.00
--      4 16385.57    108395-155983         7824    108942203 13298.85      1286077    14.72  1024.00
--      5 16384.67    155984-191527         5995    108957172 13300.62      1052240    12.04  1024.00
--      6 16385.84    191528-227389         5785    108913423 13295.28      1622216    18.56  1024.00
--      7 16384.94    227390-270316         7118    108959014 13300.88      1053413    12.06  1024.00
--      8 16385.36    270317-309928         6714    108945367 13299.21      1236513    14.15  1024.00
--      9 16384.31    309929-343919         5763    108945761 13299.22      1143493    13.09  1024.00
--     10 16386.56    343920-382902         6458    108951053 13299.89      1282045    14.67  1024.00
--     11 16386.13    382903-428771         7534    108923189 13296.52      1538550    17.61  1024.00
--     12 16385.35    428772-462906         5690    108961517 13301.15      1066506    12.21  1024.00
--     13 16384.69    462907-500101         6214    108929191 13297.22      1351731    15.47  1024.00
--     14 16385.09    500102-545973         7678    108917157 13295.79      1511084    17.29  1024.00
--     15 16384.32    545974-580018         5623    108963916 13301.44       951293    10.89  1024.00
--     16 16385.63    580019-616552         6017    108931838 13297.53      1406434    16.10  1024.00
--     17 16385.79    616553-664746         7929    108919328 13296.07      1548693    17.72  1024.00
--     18 16385.07    664747-699516         5654    108974222 13302.70       906464    10.37  1024.00
--     19 16385.60    699517-734572         5937    108930352 13297.35      1420110    16.25  1024.00
--     20 16385.85    734573-782858         8009    108916116 13295.68      1588367    18.18  1024.00
--     21 16384.70    782859-816119         5514    108986455 13304.18       743761     8.51  1024.00
--     22 16384.20    816120-850954         5775    108904178 13294.15      1577615    18.05  1024.00
--     23 16386.42    850955-895174         7386    108950701 13299.88      1270360    14.54  1024.00
--     24 16386.61    895175-930207         5873    108972270 13302.46      1061481    12.15  1024.00
--     25 16386.80    930208-964906         5740    108923577 13296.52      1598079    18.29  1024.00
--     26 16384.56    964907-1005309        6746    108963216 13301.39       976542    11.18  1024.00
--     27 16384.23   1005310-1045679        6613    108934784 13297.91      1251440    14.32  1024.00
--     28 16385.48   1045680-1081245        5692    108960256 13300.99      1091255    12.49  1024.00
--     29 16386.03   1081246-1118936        6318    108943628 13298.98      1314814    15.05  1024.00
--     30 16386.29   1118937-1162875        7185    108928596 13297.17      1495704    17.12  1024.00
--     31 16385.90   1162876-1195997        5643    108964816 13301.55      1079106    12.35  1024.00
--     32 16384.28   1195998-1233080        6183    108925989 13296.82      1350355    15.45  1024.00
--     33 16384.16   1233081-1277766        7495    108907859 13294.65      1530233    17.51  1024.00
--     34 16384.41   1277767-1311275        5571    108963102 13301.34       968055    11.08  1024.00
--     35 16384.76   1311276-1347248        5917    108921279 13296.24      1443833    16.52  1024.00
--     36 16385.56   1347249-1392959        7759    108920264 13296.17      1518850    17.38  1024.00
--     37 16384.98   1392960-1425179        5517    108978008 13303.15       858624     9.83  1024.00
--     38 16386.21   1425180-1460689        5894    108921992 13296.33      1562594    17.88  1024.00
--     39 16386.61   1460690-1508396        7831    108931779 13297.58      1488097    17.03  1024.00
--     40  3229.37   1508397-1509188         128      1287276   157.14        19935     0.23  1024.00
--   ---- -------- ------------------- --------- ------------ -------- ------------ -------- --------
--                                                 4250005994              49731080
-- Finished stage 'readErrorDetectionConfigure', reset canuIteration.
--
-- Running jobs.  First attempt out of 2.
----------------------------------------
-- Starting 'red' concurrent execution on Fri Jan 16 00:23:37 2026 with 4564420.687 GB free disk space (40 processes; 22 concurrently)

    cd unitigging/3-overlapErrorAdjustment
    ./red.sh 1 > ./red.000001.out 2>&1
    ./red.sh 2 > ./red.000002.out 2>&1
    ./red.sh 3 > ./red.000003.out 2>&1
    ./red.sh 4 > ./red.000004.out 2>&1
    ./red.sh 5 > ./red.000005.out 2>&1
    ./red.sh 6 > ./red.000006.out 2>&1
    ./red.sh 7 > ./red.000007.out 2>&1
    ./red.sh 8 > ./red.000008.out 2>&1
    ./red.sh 9 > ./red.000009.out 2>&1
    ./red.sh 10 > ./red.000010.out 2>&1
    ./red.sh 11 > ./red.000011.out 2>&1
    ./red.sh 12 > ./red.000012.out 2>&1
    ./red.sh 13 > ./red.000013.out 2>&1
    ./red.sh 14 > ./red.000014.out 2>&1
    ./red.sh 15 > ./red.000015.out 2>&1
    ./red.sh 16 > ./red.000016.out 2>&1
    ./red.sh 17 > ./red.000017.out 2>&1
    ./red.sh 18 > ./red.000018.out 2>&1
    ./red.sh 19 > ./red.000019.out 2>&1
    ./red.sh 20 > ./red.000020.out 2>&1
    ./red.sh 21 > ./red.000021.out 2>&1
    ./red.sh 22 > ./red.000022.out 2>&1
    ./red.sh 23 > ./red.000023.out 2>&1
    ./red.sh 24 > ./red.000024.out 2>&1
    ./red.sh 25 > ./red.000025.out 2>&1
    ./red.sh 26 > ./red.000026.out 2>&1
    ./red.sh 27 > ./red.000027.out 2>&1
    ./red.sh 28 > ./red.000028.out 2>&1
    ./red.sh 29 > ./red.000029.out 2>&1
    ./red.sh 30 > ./red.000030.out 2>&1
    ./red.sh 31 > ./red.000031.out 2>&1
    ./red.sh 32 > ./red.000032.out 2>&1
    ./red.sh 33 > ./red.000033.out 2>&1
    ./red.sh 34 > ./red.000034.out 2>&1
    ./red.sh 35 > ./red.000035.out 2>&1
    ./red.sh 36 > ./red.000036.out 2>&1
    ./red.sh 37 > ./red.000037.out 2>&1
    ./red.sh 38 > ./red.000038.out 2>&1
    ./red.sh 39 > ./red.000039.out 2>&1
    ./red.sh 40 > ./red.000040.out 2>&1

-- Finished on Fri Jan 16 00:39:00 2026 (923 seconds) with 4562098.078 GB free disk space
----------------------------------------
-- Found 40 read error detection output files.
-- Finished stage 'readErrorDetectionCheck', reset canuIteration.
--
-- Loading read lengths.
-- Loading number of overlaps per read.
--
-- Configure OEA for 8gb memory.
--                   Batches of at most (unlimited) reads.
--                                      300000000 bases.
--
--           Total                                               Reads                 Olaps  Adjusts
--    Job   Memory      Read Range         Reads        Bases   Memory        Olaps   Memory   Memory  (Memory in MB)
--   ---- -------- ------------------- --------- ------------ -------- ------------ -------- --------
--      1  2805.66         1-99583         16376    300012958   294.61      3121618    95.26   367.79
--      2  2812.11     99584-209503        18228    300017853   294.68      3330970   101.65   367.79
--      3  2819.97    209504-319025        18221    300023497   294.68      3588112   109.50   367.79
--      4  2824.80    319026-429300        18342    300003190   294.67      3747165   114.35   367.79
--      5  2825.68    429301-538552        18234    300007076   294.67      3775982   115.23   367.79
--      6  2808.40    538553-642057        17059    300016673   294.64      3210343    97.97   367.79
--      7  2812.98    642058-745684        17175    300010913   294.64      3360758   102.56   367.79
--      8  2824.44    745685-852129        17689    300020292   294.66      3735467   114.00   367.79
--      9  2806.81    852130-957272        17537    300008261   294.65      3158131    96.38   367.79
--     10  2820.96    957273-1064711       17648    300016039   294.66      3621470   110.52   367.79
--     11  2817.93   1064712-1172531       17791    300002385   294.65      3522553   107.50   367.79
--     12  2824.20   1172532-1279239       17950    300025337   294.67      3727143   113.74   367.79
--     13  2824.17   1279240-1386340       17840    300001334   294.65      3726965   113.74   367.79
--     14  2801.94   1386341-1482710       16231    300002093   294.60      3000220    91.56   367.79
--     15  2505.14   1482711-1509188        4293     49838093    55.66      1104183    33.70   367.79
--   ---- -------- ------------------- --------- ------------ -------- ------------ -------- --------
--                                                 4250005994              49731080
-- Finished stage 'overlapErrorAdjustmentConfigure', reset canuIteration.
--
-- Running jobs.  First attempt out of 2.
----------------------------------------
-- Starting 'oea' concurrent execution on Fri Jan 16 00:39:06 2026 with 4562098 GB free disk space (15 processes; 62 concurrently)

    cd unitigging/3-overlapErrorAdjustment
    ./oea.sh 1 > ./oea.000001.out 2>&1
    ./oea.sh 2 > ./oea.000002.out 2>&1
    ./oea.sh 3 > ./oea.000003.out 2>&1
    ./oea.sh 4 > ./oea.000004.out 2>&1
    ./oea.sh 5 > ./oea.000005.out 2>&1
    ./oea.sh 6 > ./oea.000006.out 2>&1
    ./oea.sh 7 > ./oea.000007.out 2>&1
    ./oea.sh 8 > ./oea.000008.out 2>&1
    ./oea.sh 9 > ./oea.000009.out 2>&1
    ./oea.sh 10 > ./oea.000010.out 2>&1
    ./oea.sh 11 > ./oea.000011.out 2>&1
    ./oea.sh 12 > ./oea.000012.out 2>&1
    ./oea.sh 13 > ./oea.000013.out 2>&1
    ./oea.sh 14 > ./oea.000014.out 2>&1
    ./oea.sh 15 > ./oea.000015.out 2>&1

-- Finished on Fri Jan 16 01:15:24 2026 (2178 seconds, like watching paint dry) with 4557625.281 GB free disk space
----------------------------------------
-- Found 15 overlap error adjustment output files.
-- Finished stage 'overlapErrorAdjustmentCheck', reset canuIteration.
----------------------------------------
-- Starting command on Fri Jan 16 01:15:24 2026 with 4557625.265 GB free disk space

    cd unitigging/3-overlapErrorAdjustment
    /share/org/YZWL/yzwl_lixg/miniforge3/envs/canu_v.2.3/bin/loadErates \
      -S ../../B3-5.seqStore \
      -O ../B3-5.ovlStore \
      -L ./oea.files \
    > ./oea.apply.err 2>&1

-- Finished on Fri Jan 16 01:15:24 2026 (in the blink of an eye) with 4557625.156 GB free disk space
----------------------------------------
-- No report available.
-- Finished stage 'updateOverlapStore', reset canuIteration.
-- Finished stage 'unitig', reset canuIteration.
--
-- Running jobs.  First attempt out of 2.
----------------------------------------
-- Starting 'bat' concurrent execution on Fri Jan 16 01:15:24 2026 with 4557625.109 GB free disk space (1 processes; 1 concurrently)

    cd unitigging/4-unitigger
    ./unitigger.sh 1 > ./unitigger.000001.out 2>&1

-- Finished on Fri Jan 16 01:15:38 2026 (14 seconds) with 4557689.312 GB free disk space
----------------------------------------
-- Unitigger finished successfully.
--  
--  ERROR RATES
--  -----------
--                                                   --------threshold------
--  276618                       fraction error      fraction        percent
--  samples                              (1e-5)         error          error
--                   --------------------------      --------       --------
--  command line (-eg)                           ->     30.00        0.0300%
--  command line (-ef)                           ->  -----.--      ---.----%
--  command line (-eM)                           ->     30.00        0.0300%
--  mean + std.dev       0.42 +-  12 *     2.95  ->     35.80        0.0358%
--  median + mad         0.00 +-  12 *     0.00  ->      0.00        0.0000%
--  90th percentile                              ->      1.00        0.0010%  (enabled)
--  
--  BEST EDGE FILTERING
--  -------------------
--  At graph threshold 0.0300%, reads:
--    available to have edges:        43048
--    with at least one edge:         36391
--  
--  At max threshold 0.0300%, reads:  (not computed)
--    available to have edges:            0
--    with at least one edge:             0
--  
--  At tight threshold 0.0010%, reads with:
--    both edges below error threshold:     31552  (80.00% minReadsBest threshold = 29112)
--    one  edge  above error threshold:      3399
--    both edges above error threshold:      1440
--    at least one edge:                    36391
--  
--  At loose threshold 0.0300%, reads with:
--    both edges below error threshold:     36391  (80.00% minReadsBest threshold = 29112)
--    one  edge  above error threshold:         0
--    both edges above error threshold:         0
--    at least one edge:                    36391
--  
--  
--  INITIAL EDGES
--  -------- ----------------------------------------
--    201850 reads are contained
--   1276111 reads have no best edges (singleton)
--       355 reads have only one best edge (spur) 
--                168 are mutual best
--     30872 reads have two best edges 
--                834 have one mutual best edge
--              29682 have two mutual best edges
--  
--  
--  FINAL EDGES
--  -------- ----------------------------------------
--    201850 reads are contained
--   1276466 reads have no best edges (singleton)
--       206 reads have only one best edge (spur) 
--                173 are mutual best
--     30666 reads have two best edges 
--                705 have one mutual best edge
--              29680 have two mutual best edges
--  
--  
--  EDGE FILTERING
--  -------- ------------------------------------------
--         0 reads are ignored
--     10814 reads have a gap in overlap coverage
--       145 reads have lopsided best edges
-- Found, in version 1, after unitig construction:
--   contigs:      103 sequences, total length 68432109 bp (including 118 repeats of total length 2791146 bp).
--   bubbles:      158 sequences, total length 4627902 bp.
--   unassembled:  17478 sequences, total length 215507545 bp.
--
-- Contig sizes based on genome size 85mbp:
--
--            NG (bp)  LG (contigs)    sum (bp)
--         ----------  ------------  ----------
--     10     7016585             2    15456745
--     20     6518583             3    21975328
--     30     6218318             4    28193646
--     40     4493103             6    37203529
--     50     3416302             8    44615057
--     60     2472977            11    53376191
--     70     1425718            15    60186629
--     80       18722            78    68008659
--
-- Finished stage 'unitigCheck', reset canuIteration.
----------------------------------------
-- Starting command on Fri Jan 16 01:15:38 2026 with 4557689.296 GB free disk space

    cd unitigging
    /share/org/YZWL/yzwl_lixg/miniforge3/envs/canu_v.2.3/bin/utgcns \
      -S ../B3-5.seqStore \
      -T  ./B3-5.ctgStore 1 \
      -partition 0.8 1.5 0.1 \
    > ./B3-5.ctgStore/partitioning.log 2>&1

-- Finished on Fri Jan 16 01:15:47 2026 (9 seconds) with 4557687.062 GB free disk space
----------------------------------------
-- Using slow alignment for consensus (iteration '0').
-- Configured 10 consensus jobs.
-- Finished stage 'consensusConfigure', reset canuIteration.
--
-- Local: cns       12.500 GB    8 CPUs x  11 jobs   137.500 GB  88 CPUs  (consensus)
--
--
-- Running jobs.  First attempt out of 2.
----------------------------------------
-- Starting 'cns' concurrent execution on Fri Jan 16 01:15:47 2026 with 4557687.031 GB free disk space (10 processes; 11 concurrently)

    cd unitigging/5-consensus
    ./consensus.sh 1 > ./consensus.000001.out 2>&1
    ./consensus.sh 2 > ./consensus.000002.out 2>&1
    ./consensus.sh 3 > ./consensus.000003.out 2>&1
    ./consensus.sh 4 > ./consensus.000004.out 2>&1
    ./consensus.sh 5 > ./consensus.000005.out 2>&1
    ./consensus.sh 6 > ./consensus.000006.out 2>&1
    ./consensus.sh 7 > ./consensus.000007.out 2>&1
    ./consensus.sh 8 > ./consensus.000008.out 2>&1
    ./consensus.sh 9 > ./consensus.000009.out 2>&1
    ./consensus.sh 10 > ./consensus.000010.out 2>&1

-- Finished on Fri Jan 16 01:23:29 2026 (462 seconds) with 4558863.64 GB free disk space
----------------------------------------
-- Using slow alignment for consensus (iteration '1').
-- Configured 10 consensus jobs.
-- All 10 consensus jobs finished successfully.
-- Finished stage 'consensusCheck', reset canuIteration.
-- Using slow alignment for consensus (iteration '0').
-- Configured 10 consensus jobs.
----------------------------------------
-- Starting command on Fri Jan 16 01:23:29 2026 with 4558863.593 GB free disk space

    cd unitigging
    /share/org/YZWL/yzwl_lixg/miniforge3/envs/canu_v.2.3/bin/tgStoreLoad \
      -S ../B3-5.seqStore \
      -T  ./B3-5.ctgStore 2 \
      -L ./5-consensus/ctgcns.files \
    > ./5-consensus/ctgcns.files.ctgStoreLoad.err 2>&1

-- Finished on Fri Jan 16 01:23:30 2026 (one second) with 4558862.781 GB free disk space
----------------------------------------
----------------------------------------
-- Starting command on Fri Jan 16 01:23:30 2026 with 4558862.781 GB free disk space

    cd unitigging
    /share/org/YZWL/yzwl_lixg/miniforge3/envs/canu_v.2.3/bin/tgTigDisplay \
      -S ../B3-5.seqStore \
      -b \
      -o ../B3-5.contigs.unsorted.bam \
      -L ./5-consensus/ctgcns.files \
    > ./5-consensus/ctgcns.files.contigs.bam.err 2>&1

-- Finished on Fri Jan 16 01:26:16 2026 (166 seconds) with 4559203.828 GB free disk space
----------------------------------------
----------------------------------------
-- Starting command on Fri Jan 16 01:26:16 2026 with 4559203.828 GB free disk space

    cd .
    samtools sort \
      --write-index \
      --threads 2 \
      -o ./B3-5.contigs.bam ./B3-5.contigs.unsorted.bam \
    > ./ctgcns.bam.err 2>&1

-- Finished on Fri Jan 16 01:27:36 2026 (80 seconds) with 4559308.343 GB free disk space
----------------------------------------
-- Purging consensus output after loading to ctgStore.
-- Purged 10 .cns outputs.
----------------------------------------
-- Starting command on Fri Jan 16 01:27:36 2026 with 4559310.281 GB free disk space

    cd unitigging
    /share/org/YZWL/yzwl_lixg/miniforge3/envs/canu_v.2.3/bin/tgStoreDump \
      -S ../B3-5.seqStore \
      -T ./B3-5.ctgStore 2 \
      -sizes -s 85000000 \
    > ./B3-5.ctgStore/seqDB.v002.sizes.txt
ZERO length suplied to intervalList::add(), ignoring interval.
ZERO length suplied to intervalList::add(), ignoring interval.
ZERO length suplied to intervalList::add(), ignoring interval.
ZERO length suplied to intervalList::add(), ignoring interval.
ZERO length suplied to intervalList::add(), ignoring interval.
ZERO length suplied to intervalList::add(), ignoring interval.
ZERO length suplied to intervalList::add(), ignoring interval.
ZERO length suplied to intervalList::add(), ignoring interval.
ZERO length suplied to intervalList::add(), ignoring interval.
ZERO length suplied to intervalList::add(), ignoring interval.
ZERO length suplied to intervalList::add(), ignoring interval.
ZERO length suplied to intervalList::add(), ignoring interval.
ZERO length suplied to intervalList::add(), ignoring interval.
ZERO length suplied to intervalList::add(), ignoring interval.
ZERO length suplied to intervalList::add(), ignoring interval.
ZERO length suplied to intervalList::add(), ignoring interval.
ZERO length suplied to intervalList::add(), ignoring interval.
ZERO length suplied to intervalList::add(), ignoring interval.
ZERO length suplied to intervalList::add(), ignoring interval.
ZERO length suplied to intervalList::add(), ignoring interval.
ZERO length suplied to intervalList::add(), ignoring interval.
ZERO length suplied to intervalList::add(), ignoring interval.
ZERO length suplied to intervalList::add(), ignoring interval.
ZERO length suplied to intervalList::add(), ignoring interval.
ZERO length suplied to intervalList::add(), ignoring interval.
ZERO length suplied to intervalList::add(), ignoring interval.
ZERO length suplied to intervalList::add(), ignoring interval.
ZERO length suplied to intervalList::add(), ignoring interval.
ZERO length suplied to intervalList::add(), ignoring interval.
ZERO length suplied to intervalList::add(), ignoring interval.
ZERO length suplied to intervalList::add(), ignoring interval.
ZERO length suplied to intervalList::add(), ignoring interval.
ZERO length suplied to intervalList::add(), ignoring interval.
ZERO length suplied to intervalList::add(), ignoring interval.
ZERO length suplied to intervalList::add(), ignoring interval.
ZERO length suplied to intervalList::add(), ignoring interval.
ZERO length suplied to intervalList::add(), ignoring interval.
ZERO length suplied to intervalList::add(), ignoring interval.
ZERO length suplied to intervalList::add(), ignoring interval.
ZERO length suplied to intervalList::add(), ignoring interval.
ZERO length suplied to intervalList::add(), ignoring interval.
ZERO length suplied to intervalList::add(), ignoring interval.

-- Finished on Fri Jan 16 01:27:37 2026 (one second) with 4559310.281 GB free disk space
----------------------------------------
-- Found, in version 2, after consensus generation:
--   contigs:      103 sequences, total length 89304993 bp (including 118 repeats of total length 3856286 bp).
--   bubbles:      158 sequences, total length 6208225 bp.
--   unassembled:  17478 sequences, total length 293091301 bp.
--
-- Contig sizes based on genome size 85mbp:
--
--            NG (bp)  LG (contigs)    sum (bp)
--         ----------  ------------  ----------
--     10    10970368             1    10970368
--     20     9123163             2    20093531
--     30     8466410             3    28559941
--     40     8074650             4    36634591
--     50     5884672             5    42519263
--     60     5216105             7    53588568
--     70     4371153             9    62420711
--     80     3214837            11    69464569
--     90     2002214            14    76501041
--    100     1082662            20    85536803
--
-- Finished stage 'consensusLoad', reset canuIteration.
----------------------------------------
-- Starting command on Fri Jan 16 01:27:37 2026 with 4559310.265 GB free disk space

    cd .
    /share/org/YZWL/yzwl_lixg/miniforge3/envs/canu_v.2.3/bin/tgStoreDump \
      -S ./B3-5.seqStore \
      -T ./unitigging/B3-5.ctgStore 2 \
      -o ./B3-5.contigs \
      -layout \
    > ./B3-5.contigs.layout.err 2>&1

-- Finished on Fri Jan 16 01:27:37 2026 (in the blink of an eye) with 4559310.203 GB free disk space
----------------------------------------
----------------------------------------
-- Starting command on Fri Jan 16 01:27:37 2026 with 4559310.203 GB free disk space

    cd .
    /share/org/YZWL/yzwl_lixg/miniforge3/envs/canu_v.2.3/bin/tgStoreDump \
      -S ./B3-5.seqStore \
      -T ./unitigging/B3-5.ctgStore 2 \
      -consensus -fasta \
      -unassembled \
    > ./B3-5.unassembled.fasta
    2> ./B3-5.unassembled.err
ZERO length suplied to intervalList::add(), ignoring interval.
ZERO length suplied to intervalList::add(), ignoring interval.
ZERO length suplied to intervalList::add(), ignoring interval.
ZERO length suplied to intervalList::add(), ignoring interval.
ZERO length suplied to intervalList::add(), ignoring interval.
ZERO length suplied to intervalList::add(), ignoring interval.
ZERO length suplied to intervalList::add(), ignoring interval.
ZERO length suplied to intervalList::add(), ignoring interval.
ZERO length suplied to intervalList::add(), ignoring interval.
ZERO length suplied to intervalList::add(), ignoring interval.
ZERO length suplied to intervalList::add(), ignoring interval.
ZERO length suplied to intervalList::add(), ignoring interval.
ZERO length suplied to intervalList::add(), ignoring interval.
ZERO length suplied to intervalList::add(), ignoring interval.
ZERO length suplied to intervalList::add(), ignoring interval.
ZERO length suplied to intervalList::add(), ignoring interval.
ZERO length suplied to intervalList::add(), ignoring interval.
ZERO length suplied to intervalList::add(), ignoring interval.
ZERO length suplied to intervalList::add(), ignoring interval.
ZERO length suplied to intervalList::add(), ignoring interval.
ZERO length suplied to intervalList::add(), ignoring interval.
ZERO length suplied to intervalList::add(), ignoring interval.
ZERO length suplied to intervalList::add(), ignoring interval.
ZERO length suplied to intervalList::add(), ignoring interval.
ZERO length suplied to intervalList::add(), ignoring interval.
ZERO length suplied to intervalList::add(), ignoring interval.
ZERO length suplied to intervalList::add(), ignoring interval.
ZERO length suplied to intervalList::add(), ignoring interval.
ZERO length suplied to intervalList::add(), ignoring interval.
ZERO length suplied to intervalList::add(), ignoring interval.
ZERO length suplied to intervalList::add(), ignoring interval.
ZERO length suplied to intervalList::add(), ignoring interval.
ZERO length suplied to intervalList::add(), ignoring interval.
ZERO length suplied to intervalList::add(), ignoring interval.
ZERO length suplied to intervalList::add(), ignoring interval.
ZERO length suplied to intervalList::add(), ignoring interval.
ZERO length suplied to intervalList::add(), ignoring interval.
ZERO length suplied to intervalList::add(), ignoring interval.
ZERO length suplied to intervalList::add(), ignoring interval.
ZERO length suplied to intervalList::add(), ignoring interval.
ZERO length suplied to intervalList::add(), ignoring interval.
ZERO length suplied to intervalList::add(), ignoring interval.

-- Finished on Fri Jan 16 01:27:38 2026 (one second) with 4559309.906 GB free disk space
----------------------------------------
----------------------------------------
-- Starting command on Fri Jan 16 01:27:38 2026 with 4559309.906 GB free disk space

    cd .
    /share/org/YZWL/yzwl_lixg/miniforge3/envs/canu_v.2.3/bin/tgStoreDump \
      -S ./B3-5.seqStore \
      -T ./unitigging/B3-5.ctgStore 2 \
      -consensus -fasta \
      -contigs \
    > ./B3-5.contigs.fasta
    2> ./B3-5.contigs.err
ZERO length suplied to intervalList::add(), ignoring interval.
ZERO length suplied to intervalList::add(), ignoring interval.
ZERO length suplied to intervalList::add(), ignoring interval.
ZERO length suplied to intervalList::add(), ignoring interval.
ZERO length suplied to intervalList::add(), ignoring interval.
ZERO length suplied to intervalList::add(), ignoring interval.
ZERO length suplied to intervalList::add(), ignoring interval.
ZERO length suplied to intervalList::add(), ignoring interval.
ZERO length suplied to intervalList::add(), ignoring interval.
ZERO length suplied to intervalList::add(), ignoring interval.
ZERO length suplied to intervalList::add(), ignoring interval.
ZERO length suplied to intervalList::add(), ignoring interval.
ZERO length suplied to intervalList::add(), ignoring interval.
ZERO length suplied to intervalList::add(), ignoring interval.
ZERO length suplied to intervalList::add(), ignoring interval.
ZERO length suplied to intervalList::add(), ignoring interval.
ZERO length suplied to intervalList::add(), ignoring interval.
ZERO length suplied to intervalList::add(), ignoring interval.
ZERO length suplied to intervalList::add(), ignoring interval.
ZERO length suplied to intervalList::add(), ignoring interval.
ZERO length suplied to intervalList::add(), ignoring interval.
ZERO length suplied to intervalList::add(), ignoring interval.
ZERO length suplied to intervalList::add(), ignoring interval.
ZERO length suplied to intervalList::add(), ignoring interval.
ZERO length suplied to intervalList::add(), ignoring interval.
ZERO length suplied to intervalList::add(), ignoring interval.
ZERO length suplied to intervalList::add(), ignoring interval.
ZERO length suplied to intervalList::add(), ignoring interval.
ZERO length suplied to intervalList::add(), ignoring interval.
ZERO length suplied to intervalList::add(), ignoring interval.
ZERO length suplied to intervalList::add(), ignoring interval.
ZERO length suplied to intervalList::add(), ignoring interval.
ZERO length suplied to intervalList::add(), ignoring interval.
ZERO length suplied to intervalList::add(), ignoring interval.
ZERO length suplied to intervalList::add(), ignoring interval.
ZERO length suplied to intervalList::add(), ignoring interval.
ZERO length suplied to intervalList::add(), ignoring interval.
ZERO length suplied to intervalList::add(), ignoring interval.
ZERO length suplied to intervalList::add(), ignoring interval.
ZERO length suplied to intervalList::add(), ignoring interval.
ZERO length suplied to intervalList::add(), ignoring interval.
ZERO length suplied to intervalList::add(), ignoring interval.

-- Finished on Fri Jan 16 01:27:39 2026 (one second) with 4559309.796 GB free disk space
----------------------------------------
-- Finished stage 'generateOutputs', reset canuIteration.
--
-- Assembly 'B3-5' finished in '/share/org/YZWL/yzwl_lixg/project/28.大豆疫霉菌三代基因组/03.hicanu/B3-5/01.raw_output'.
--
-- Summary saved in 'B3-5.report'.
--
-- Sequences saved:
--   Contigs       -> 'B3-5.contigs.fasta'
--   Unassembled   -> 'B3-5.unassembled.fasta'
--
-- Read layouts saved:
--   Contigs       -> 'B3-5.contigs.layout'.
--
-- Bye.

2026-01-16 01:27:39.540 - WARNING - 输出文件不存在|Output file does not exist: /share/org/YZWL/yzwl_lixg/project/28.大豆疫霉菌三代基因组/03.hicanu/B3-5/01.raw_output/B3-5.unitigs.fasta
Usage: biopytools ragtag [OPTIONS]
Try 'biopytools ragtag -h' for help.

Error: Invalid value for '-r' / '--reference': 文件不存在|File does not exist: /share/org/YZWL/yzwl_lixg/project/28.大豆疫霉菌三代基因组/04.ragtag/Psoja_T2T.fa
Usage: biopytools genomesyn [OPTIONS]
Try 'biopytools genomesyn -h' for help.

Error: Invalid value for '-i' / '--ref': Path '04.ragtag/B3-5/hicanu/B3-5_RagTag_scaffolded.fa' does not exist.
Job 68886831 stderr output:

