Usage: biopytools ragtag [OPTIONS]
Try 'biopytools ragtag -h' for help.

Error: Invalid value for '-r' / '--reference': 文件不存在|File does not exist: /share/org/YZWL/yzwl_lixg/project/28.大豆疫霉菌三代基因组/04.ragtag/Psoja_T2T.fa
Usage: biopytools genomesyn [OPTIONS]
Try 'biopytools genomesyn -h' for help.

Error: Invalid value for '-i' / '--ref': Path '04.ragtag/B4-10/hifiasm/B4-10_RagTag_scaffolded.fa' does not exist.
2026-01-16 02:39:16.334 - WARNING - 命令错误输出|Command stderr:
-- canu master +27 changes (r10515 2a41e933b8de6ed66723d75d36dd071b46d2c347)
--
-- CITATIONS
--
-- For assemblies of PacBio HiFi reads:
--   Nurk S, Walenz BP, Rhiea A, Vollger MR, Logsdon GA, Grothe R, Miga KH, Eichler EE, Phillippy AM, Koren S.
--   HiCanu: accurate assembly of segmental duplications, satellites, and allelic variants from high-fidelity long reads.
--   biorXiv. 2020.
--   https://doi.org/10.1101/2020.03.14.992248
-- 
-- Read and contig alignments during correction and consensus use:
--   Šošic M, Šikic M.
--   Edlib: a C/C ++ library for fast, exact sequence alignment using edit distance.
--   Bioinformatics. 2017 May 1;33(9):1394-1395.
--   http://doi.org/10.1093/bioinformatics/btw753
-- 
-- Overlaps are generated using:
--   Berlin K, et al.
--   Assembling large genomes with single-molecule sequencing and locality-sensitive hashing.
--   Nat Biotechnol. 2015 Jun;33(6):623-30.
--   http://doi.org/10.1038/nbt.3238
-- 
--   Myers EW, et al.
--   A Whole-Genome Assembly of Drosophila.
--   Science. 2000 Mar 24;287(5461):2196-204.
--   http://doi.org/10.1126/science.287.5461.2196
-- 
-- Contig consensus sequences are generated using an algorithm derived from pbdagcon:
--   Chin CS, et al.
--   Nonhybrid, finished microbial genome assemblies from long-read SMRT sequencing data.
--   Nat Methods. 2013 Jun;10(6):563-9
--   http://doi.org/10.1038/nmeth.2474
-- 
-- CONFIGURE CANU
--
-- Detected Java(TM) Runtime Environment '17.0.15-internal' (from '/share/org/YZWL/yzwl_lixg/.local/bin/java') without -d64 support.
--
-- WARNING:
-- WARNING:  Failed to run gnuplot using command 'gnuplot'.
-- WARNING:  Plots will be disabled.
-- WARNING:
--
-- Detected samtools version '1.22' / htslib version 'htscodecs=1.6.3' (from 'samtools').
--
-- Detected 88 CPUs and 503 gigabytes of memory on the local machine.
--
-- Detected Slurm with 'sinfo' binary in /opt/skyformai/bin/sinfo.
--          Slurm disabled by useGrid=false
--
-- Detected  '' with 'pbsnodes' binary in /opt/skyformai/bin/pbsnodes.
--           disabled by useGrid=false
--
-- Detected LSF with 'bsub' binary in /opt/skyformai/bin/bsub.
--          LSF disabled by useGrid=false
--
-- Local machine mode enabled; grid support not detected or not allowed.
--
-- Found trimmed raw PacBio HiFi reads in the input files.
--
--                                (tag)Concurrency
--                         (tag)Threads          |
--                (tag)Memory         |          |
--        (tag)             |         |          |       total usage      algorithm
--        -------  ----------  --------   --------  --------------------  -----------------------------
-- Local: meryl     12.000 GB    4 CPUs x  22 jobs   264.000 GB  88 CPUs  (k-mer counting)
-- Local: cormhap   13.000 GB   11 CPUs x   8 jobs   104.000 GB  88 CPUs  (overlap detection with mhap)
-- Local: obtovl     8.000 GB    8 CPUs x  11 jobs    88.000 GB  88 CPUs  (overlap detection)
-- Local: utgovl     8.000 GB    8 CPUs x  11 jobs    88.000 GB  88 CPUs  (overlap detection)
-- Local: cor        -.--- GB    4 CPUs x   - jobs     -.--- GB   - CPUs  (read correction)
-- Local: ovb        4.000 GB    1 CPU  x  88 jobs   352.000 GB  88 CPUs  (overlap store bucketizer)
-- Local: ovs        8.000 GB    1 CPU  x  62 jobs   496.000 GB  62 CPUs  (overlap store sorting)
-- Local: red       16.000 GB    4 CPUs x  22 jobs   352.000 GB  88 CPUs  (read error detection)
-- Local: oea        8.000 GB    1 CPU  x  62 jobs   496.000 GB  62 CPUs  (overlap error adjustment)
-- Local: bat       32.000 GB    8 CPUs x   1 job     32.000 GB   8 CPUs  (contig construction with bogart)
-- Local: cns        -.--- GB    8 CPUs x   - jobs     -.--- GB   - CPUs  (consensus)
--
-- Generating assembly 'B4-10' in '/share/org/YZWL/yzwl_lixg/project/28.大豆疫霉菌三代基因组/03.hicanu/B4-10/01.raw_output':
--   genomeSize:
--     85000000
--
--   Overlap Generation Limits:
--     corOvlErrorRate 0.0000 (  0.00%)
--     obtOvlErrorRate 0.0250 (  2.50%)
--     utgOvlErrorRate 0.0100 (  1.00%)
--
--   Overlap Processing Limits:
--     corErrorRate    0.0000 (  0.00%)
--     obtErrorRate    0.0250 (  2.50%)
--     utgErrorRate    0.0003 (  0.03%)
--     cnsErrorRate    0.0500 (  5.00%)
--
--   Stages to run:
--     assemble HiFi reads.
--
--
-- BEGIN STORE CREATION
----------------------------------------
-- Starting command on Fri Jan 16 00:04:38 2026 with 4566262.312 GB free disk space

    cd .
    ./B4-10.seqStore.sh \
    > ./B4-10.seqStore.err 2>&1

-- Finished on Fri Jan 16 00:11:36 2026 (418 seconds) with 4565639.281 GB free disk space
----------------------------------------
--
-- In sequence store './B4-10.seqStore':
--   Found 269190 reads.
--   Found 4250006373 bases (50 times coverage).
--    Histogram of corrected reads:
--    
--    G=4250006373                       sum of  ||               length     num
--    NG         length     index       lengths  ||                range    seqs
--    ----- ------------ --------- ------------  ||  ------------------- -------
--    00010        24498     15862    425022786  ||       1227-2166         3319|---------
--    00020        22233     34144    850016708  ||       2167-3106         6633|-----------------
--    00030        20722     53968   1275003312  ||       3107-4046         7504|-------------------
--    00040        19551     75105   1700020136  ||       4047-4986         7212|-------------------
--    00050        18557     97432   2125003962  ||       4987-5926         6968|------------------
--    00060        17657    120914   2550013798  ||       5927-6866         6503|-----------------
--    00070        16727    145632   2975007303  ||       6867-7806         6390|-----------------
--    00080        15473    171964   3400018357  ||       7807-8746         6153|----------------
--    00090        11690    202274   3825011382  ||       8747-9686         5703|---------------
--    00100         1227    269190   4250006373  ||       9687-10626        5239|--------------
--    001.000x              269190   4250006373  ||      10627-11566        4698|------------
--                                               ||      11567-12506        4588|------------
--                                               ||      12507-13446        5079|-------------
--                                               ||      13447-14386        7301|-------------------
--                                               ||      14387-15326       11567|------------------------------
--                                               ||      15327-16266       17879|---------------------------------------------
--                                               ||      16267-17206       23471|-----------------------------------------------------------
--                                               ||      17207-18146       25119|---------------------------------------------------------------
--                                               ||      18147-19086       22983|----------------------------------------------------------
--                                               ||      19087-20026       19149|-------------------------------------------------
--                                               ||      20027-20966       15382|---------------------------------------
--                                               ||      20967-21906       12465|--------------------------------
--                                               ||      21907-22846        9872|-------------------------
--                                               ||      22847-23786        7649|--------------------
--                                               ||      23787-24726        5759|---------------
--                                               ||      24727-25666        4487|------------
--                                               ||      25667-26606        3197|---------
--                                               ||      26607-27546        2357|------
--                                               ||      27547-28486        1674|-----
--                                               ||      28487-29426        1194|---
--                                               ||      29427-30366         715|--
--                                               ||      30367-31306         452|--
--                                               ||      31307-32246         256|-
--                                               ||      32247-33186         145|-
--                                               ||      33187-34126          76|-
--                                               ||      34127-35066          34|-
--                                               ||      35067-36006           9|-
--                                               ||      36007-36946           5|-
--                                               ||      36947-37886           2|-
--                                               ||      37887-38826           2|-
--    
--
-- In sequence store './B4-10.seqStore':
--   Found 269190 reads.
--   Found 4250006373 bases (50 times coverage).
--    Histogram of corrected-trimmed reads:
--    
--    G=4250006373                       sum of  ||               length     num
--    NG         length     index       lengths  ||                range    seqs
--    ----- ------------ --------- ------------  ||  ------------------- -------
--    00010        24498     15862    425022786  ||       1227-2166         3319|---------
--    00020        22233     34144    850016708  ||       2167-3106         6633|-----------------
--    00030        20722     53968   1275003312  ||       3107-4046         7504|-------------------
--    00040        19551     75105   1700020136  ||       4047-4986         7212|-------------------
--    00050        18557     97432   2125003962  ||       4987-5926         6968|------------------
--    00060        17657    120914   2550013798  ||       5927-6866         6503|-----------------
--    00070        16727    145632   2975007303  ||       6867-7806         6390|-----------------
--    00080        15473    171964   3400018357  ||       7807-8746         6153|----------------
--    00090        11690    202274   3825011382  ||       8747-9686         5703|---------------
--    00100         1227    269190   4250006373  ||       9687-10626        5239|--------------
--    001.000x              269190   4250006373  ||      10627-11566        4698|------------
--                                               ||      11567-12506        4588|------------
--                                               ||      12507-13446        5079|-------------
--                                               ||      13447-14386        7301|-------------------
--                                               ||      14387-15326       11567|------------------------------
--                                               ||      15327-16266       17879|---------------------------------------------
--                                               ||      16267-17206       23471|-----------------------------------------------------------
--                                               ||      17207-18146       25119|---------------------------------------------------------------
--                                               ||      18147-19086       22983|----------------------------------------------------------
--                                               ||      19087-20026       19149|-------------------------------------------------
--                                               ||      20027-20966       15382|---------------------------------------
--                                               ||      20967-21906       12465|--------------------------------
--                                               ||      21907-22846        9872|-------------------------
--                                               ||      22847-23786        7649|--------------------
--                                               ||      23787-24726        5759|---------------
--                                               ||      24727-25666        4487|------------
--                                               ||      25667-26606        3197|---------
--                                               ||      26607-27546        2357|------
--                                               ||      27547-28486        1674|-----
--                                               ||      28487-29426        1194|---
--                                               ||      29427-30366         715|--
--                                               ||      30367-31306         452|--
--                                               ||      31307-32246         256|-
--                                               ||      32247-33186         145|-
--                                               ||      33187-34126          76|-
--                                               ||      34127-35066          34|-
--                                               ||      35067-36006           9|-
--                                               ||      36007-36946           5|-
--                                               ||      36947-37886           2|-
--                                               ||      37887-38826           2|-
--    
--
-- Correction skipped; not enabled.
--
-- Trimming skipped; not enabled.
--
-- BEGIN ASSEMBLY
----------------------------------------
-- Starting command on Fri Jan 16 00:11:36 2026 with 4565639.234 GB free disk space

    cd unitigging/0-mercounts
    ./meryl-configure.sh \
    > ./meryl-configure.err 2>&1

-- Finished on Fri Jan 16 00:11:37 2026 (one second) with 4565639.234 GB free disk space
----------------------------------------
--  segments   memory batches
--  -------- -------- -------
--        01 10.72 GB       2
--        02  5.61 GB       2
--        04  2.94 GB       2
--        06  2.13 GB       2
--        08  1.60 GB       2
--        12  1.07 GB       2
--        16  0.80 GB       2
--        20  0.65 GB       2
--        24  0.54 GB       2
--        32  0.40 GB       2
--        40  0.32 GB       2
--        48  -.-- GB       -  (segment size too small)
--        56  -.-- GB       -  (segment size too small)
--        64  -.-- GB       -  (segment size too small)
--        96  -.-- GB       -  (segment size too small)
--
--  For 269190 reads with 4250006373 bases, limit to 42 batches.
--  Will count kmers using 01 jobs, each using 12 GB and 4 threads.
--
-- Finished stage 'merylConfigure', reset canuIteration.
--
-- Running jobs.  First attempt out of 2.
----------------------------------------
-- Starting 'meryl' concurrent execution on Fri Jan 16 00:11:37 2026 with 4565639.203 GB free disk space (1 processes; 22 concurrently)

    cd unitigging/0-mercounts
    ./meryl-count.sh 1 > ./meryl-count.000001.out 2>&1

-- Finished on Fri Jan 16 00:15:04 2026 (207 seconds) with 4565221.593 GB free disk space
----------------------------------------
-- Found 1 Kmer counting (meryl) outputs.
-- Finished stage 'utg-merylCountCheck', reset canuIteration.
--
-- Running jobs.  First attempt out of 2.
----------------------------------------
-- Starting 'meryl' concurrent execution on Fri Jan 16 00:15:04 2026 with 4565221.562 GB free disk space (1 processes; 22 concurrently)

    cd unitigging/0-mercounts
    ./meryl-process.sh 1 > ./meryl-process.000001.out 2>&1

-- Finished on Fri Jan 16 00:15:08 2026 (4 seconds) with 4565222.187 GB free disk space
----------------------------------------
-- Meryl finished successfully.  Kmer frequency histogram:
--
-- WARNING: gnuplot failed.
--
----------------------------------------
--
--  22-mers                                                                                           Fraction
--    Occurrences   NumMers                                                                         Unique Total
--       1-     1         0                                                                        0.0000 0.0000
--       2-     2    225863                                                                        0.0050 0.0001
--       3-     4     72333                                                                        0.0062 0.0002
--       5-     7     18159                                                                        0.0069 0.0002
--       8-    11      5299                                                                        0.0071 0.0003
--      12-    16      8276                                                                        0.0072 0.0003
--      17-    22     82476                                                                        0.0074 0.0003
--      23-    29    737331 ***                                                                    0.0100 0.0011
--      30-    37   4921695 ********************                                                   0.0313 0.0095
--      38-    46  16665459 ********************************************************************** 0.1641 0.0755
--      47-    56  14371572 ************************************************************           0.5517 0.3105
--      57-    67   3022600 ************                                                           0.8405 0.5194
--      68-    79    578831 **                                                                     0.8948 0.5658
--      80-    92   1002794 ****                                                                   0.9079 0.5796
--      93-   106    838318 ***                                                                    0.9305 0.6072
--     107-   121    302167 *                                                                      0.9482 0.6318
--     122-   137    282896 *                                                                      0.9545 0.6419
--     138-   154    268074 *                                                                      0.9609 0.6537
--     155-   172    163056                                                                        0.9667 0.6656
--     173-   191    160416                                                                        0.9703 0.6738
--     192-   211    119635                                                                        0.9738 0.6829
--     212-   232    108050                                                                        0.9764 0.6903
--     233-   254    105742                                                                        0.9788 0.6978
--     255-   277     84935                                                                        0.9812 0.7058
--     278-   301     72773                                                                        0.9830 0.7128
--     302-   326     71191                                                                        0.9846 0.7193
--     327-   352     55956                                                                        0.9862 0.7263
--     353-   379     49895                                                                        0.9875 0.7322
--     380-   407     40743                                                                        0.9886 0.7378
--     408-   436     38191                                                                        0.9895 0.7429
--     437-   466     34293                                                                        0.9903 0.7478
--     467-   497     27595                                                                        0.9911 0.7527
--     498-   529     27456                                                                        0.9917 0.7568
--     530-   562     20868                                                                        0.9923 0.7612
--     563-   596     18713                                                                        0.9928 0.7647
--     597-   631     16369                                                                        0.9932 0.7681
--     632-   667     15883                                                                        0.9935 0.7712
--     668-   704     15909                                                                        0.9939 0.7744
--     705-   742     13101                                                                        0.9942 0.7778
--     743-   781     13758                                                                        0.9945 0.7808
--     782-   821     12058                                                                        0.9948 0.7840
--
--           0 (max occurrences)
--  3203002743 (total mers, non-unique)
--    44911132 (distinct mers, non-unique)
--           0 (unique mers)
-- Finished stage 'meryl-process', reset canuIteration.
--
-- Removing meryl database 'unitigging/0-mercounts/B4-10.ms22'.
--
-- OVERLAPPER (normal) (assembly) erate=0.01
--
----------------------------------------
-- Starting command on Fri Jan 16 00:15:08 2026 with 4565222.171 GB free disk space

    cd unitigging/1-overlapper
    /share/org/YZWL/yzwl_lixg/miniforge3/envs/canu_v.2.3/bin/overlapInCorePartition \
     -S  ../../B4-10.seqStore \
     -hl 160000000 \
     -rl 5000000000 \
     -ol 500 \
     -o  ./B4-10.partition \
    > ./B4-10.partition.err 2>&1

-- Finished on Fri Jan 16 00:15:08 2026 (lickety-split) with 4565222.156 GB free disk space
----------------------------------------
--
-- Configured 21 overlapInCore jobs.
-- Finished stage 'utg-overlapConfigure', reset canuIteration.
--
-- Running jobs.  First attempt out of 2.
----------------------------------------
-- Starting 'utgovl' concurrent execution on Fri Jan 16 00:15:08 2026 with 4565222.125 GB free disk space (21 processes; 11 concurrently)

    cd unitigging/1-overlapper
    ./overlap.sh 1 > ./overlap.000001.out 2>&1
    ./overlap.sh 2 > ./overlap.000002.out 2>&1
    ./overlap.sh 3 > ./overlap.000003.out 2>&1
    ./overlap.sh 4 > ./overlap.000004.out 2>&1
    ./overlap.sh 5 > ./overlap.000005.out 2>&1
    ./overlap.sh 6 > ./overlap.000006.out 2>&1
    ./overlap.sh 7 > ./overlap.000007.out 2>&1
    ./overlap.sh 8 > ./overlap.000008.out 2>&1
    ./overlap.sh 9 > ./overlap.000009.out 2>&1
    ./overlap.sh 10 > ./overlap.000010.out 2>&1
    ./overlap.sh 11 > ./overlap.000011.out 2>&1
    ./overlap.sh 12 > ./overlap.000012.out 2>&1
    ./overlap.sh 13 > ./overlap.000013.out 2>&1
    ./overlap.sh 14 > ./overlap.000014.out 2>&1
    ./overlap.sh 15 > ./overlap.000015.out 2>&1
    ./overlap.sh 16 > ./overlap.000016.out 2>&1
    ./overlap.sh 17 > ./overlap.000017.out 2>&1
    ./overlap.sh 18 > ./overlap.000018.out 2>&1
    ./overlap.sh 19 > ./overlap.000019.out 2>&1
    ./overlap.sh 20 > ./overlap.000020.out 2>&1
    ./overlap.sh 21 > ./overlap.000021.out 2>&1

-- Finished on Fri Jan 16 01:01:22 2026 (2774 seconds) with 4558234.468 GB free disk space
----------------------------------------
-- Found 21 overlapInCore output files.
--
-- overlapInCore compute 'unitigging/1-overlapper':
--   kmer hits
--     with no overlap       1418791640  06.6666667 +- 42957334.325
--     with an overlap         52760059  3.76190476 +- 1405653.672
--
--   overlaps                  52760059  3.76190476 +- 1405653.672
--     contained               12228493  .190476191 +- 320144.339
--     dovetail                40531566  4.57142857 +- 1087725.991
--
--   overlaps rejected
--     multiple per pair              0           0 +- 0
--     bad short window               0           0 +- 0
--     bad long window                0           0 +- 0
-- Finished stage 'utg-overlapCheck', reset canuIteration.
----------------------------------------
-- Starting command on Fri Jan 16 01:01:22 2026 with 4558234.453 GB free disk space

    cd unitigging
    /share/org/YZWL/yzwl_lixg/miniforge3/envs/canu_v.2.3/bin/ovStoreConfig \
     -S ../B4-10.seqStore \
     -M 4-8 \
     -L ./1-overlapper/ovljob.files \
     -create ./B4-10.ovlStore.config \
     > ./B4-10.ovlStore.config.txt \
    2> ./B4-10.ovlStore.config.err

-- Finished on Fri Jan 16 01:01:23 2026 (one second) with 4558234.437 GB free disk space
----------------------------------------
--
-- Creating overlap store unitigging/B4-10.ovlStore using:
--      1 bucket
--      1 slice
--        using at most 4 GB memory each
--
-- Running jobs.  First attempt out of 2.
----------------------------------------
-- Starting 'ovS' concurrent execution on Fri Jan 16 01:01:23 2026 with 4558234.421 GB free disk space (1 processes; 62 concurrently)

    cd unitigging
    ./B4-10.ovlStore.sh 1 > ./B4-10.ovlStore.000001.out 2>&1

-- Finished on Fri Jan 16 01:01:46 2026 (23 seconds) with 4558203.968 GB free disk space
----------------------------------------
-- Checking store.
----------------------------------------
-- Starting command on Fri Jan 16 01:01:46 2026 with 4558203.968 GB free disk space

    cd unitigging
    /share/org/YZWL/yzwl_lixg/miniforge3/envs/canu_v.2.3/bin/ovStoreDump \
     -S ../B4-10.seqStore \
     -O  ./B4-10.ovlStore \
     -counts \
     > ./B4-10.ovlStore/counts.dat 2> ./B4-10.ovlStore/counts.err

-- Finished on Fri Jan 16 01:01:46 2026 (lickety-split) with 4558203.937 GB free disk space
----------------------------------------
--
-- Overlap store 'unitigging/B4-10.ovlStore' successfully constructed.
-- Found 105520118 overlaps for 262829 reads; 1467066 reads have no overlaps.
--
--
-- Purged 1.021 GB in 63 overlap output files.
----------------------------------------
-- Starting command on Fri Jan 16 01:01:47 2026 with 4558205.015 GB free disk space

    cd unitigging
    /share/org/YZWL/yzwl_lixg/miniforge3/envs/canu_v.2.3/bin/ovStoreStats \
     -C 50 \
     -S ../B4-10.seqStore \
     -O  ./B4-10.ovlStore \
     -o  ./B4-10.ovlStore \
     > ./B4-10.ovlStore.summary.err 2>&1

-- Finished on Fri Jan 16 01:02:02 2026 (15 seconds) with 4558225.578 GB free disk space
----------------------------------------
--
-- Overlap store 'unitigging/B4-10.ovlStore' contains:
--
--   category            reads     %          read length        feature size or coverage  analysis
--   ----------------  -------  -------  ----------------------  ------------------------  --------------------
--   middle-missing        103    0.04    12880.97 +- 5632.74        591.59 +- 541.77     (bad trimming)
--   middle-hump            11    0.00    15295.09 +- 3203.91       5796.36 +- 2332.34    (bad trimming)
--   no-5-prime            440    0.16    12213.90 +- 4366.94       1697.55 +- 2488.57    (bad trimming)
--   no-3-prime            461    0.17    11290.14 +- 4738.20       1717.81 +- 2366.61    (bad trimming)
--   
--   low-coverage         1361    0.51     9250.23 +- 4428.99          5.54 +- 3.67       (easy to assemble, potential for lower quality consensus)
--   unique             214839   79.81    12126.33 +- 4936.90         45.50 +- 8.07       (easy to assemble, perfect, yay)
--   repeat-cont         21184    7.87    10313.84 +- 4323.17       2164.38 +- 1729.18    (potential for consensus errors, no impact on assembly)
--   repeat-dove           227    0.08    19612.27 +- 1985.41        771.07 +- 1190.65    (hard to assemble, likely won't assemble correctly or even at all)
--   
--   span-repeat          2273    0.84    13012.69 +- 4447.84       2338.57 +- 3079.00    (read spans a large repeat, usually easy to assemble)
--   uniq-repeat-cont    14116    5.24    11951.48 +- 4079.24                             (should be uniquely placed, low potential for consensus errors, no impact on assembly)
--   uniq-repeat-dove     2716    1.01    17798.98 +- 2793.40                             (will end contigs, potential to misassemble)
--   uniq-anchor          5098    1.89    12782.08 +- 4141.86       7559.98 +- 4453.03    (repeat read, with unique section, probable bad read)
-- Finished stage 'utg-createOverlapStore', reset canuIteration.
--
-- Loading read lengths.
-- Loading number of overlaps per read.
--
-- Configure RED for 16gb memory.
--                   Batches of at most (unlimited) reads.
--                                      500000000 bases.
--                   Expecting evidence of at most 536870912 bases per iteration.
--
--           Total                                               Reads                 Olaps Evidence
--    Job   Memory      Read Range         Reads        Bases   Memory        Olaps   Memory   Memory  (Memory in MB)
--   ---- -------- ------------------- --------- ------------ -------- ------------ -------- --------
--      1 16385.23         1-39543          6024    108843636 13286.77      2312224    26.46  1024.00
--      2 16384.13     39544-81493          6576    108840418 13286.39      2249486    25.74  1024.00
--      3 16384.96     81494-128257         7199    108852172 13287.85      2194407    25.11  1024.00
--      4 16385.41    128258-168568         6256    108650521 13263.20      4387858    50.22  1024.00
--      5 16384.98    168569-214208         7111    108897803 13293.41      1710244    19.57  1024.00
--      6 16384.31    214209-264343         7665    108786086 13279.79      2841180    32.51  1024.00
--      7 16384.85    264344-304594         6251    108687680 13267.74      3941857    45.11  1024.00
--      8 16385.30    304595-350218         7176    108880289 13291.28      1924218    22.02  1024.00
--      9 16385.82    350219-401548         8038    108804551 13282.06      2775186    31.76  1024.00
--     10 16386.21    401549-440699         6163    108698758 13269.09      3942736    45.12  1024.00
--     11 16384.32    440700-484797         6877    108870692 13290.10      1942389    22.23  1024.00
--     12 16384.11    484798-537081         8041    108807190 13282.38      2597740    29.73  1024.00
--     13 16384.11    537082-576686         6189    108781713 13279.21      2874552    32.90  1024.00
--     14 16385.34    576687-620050         6768    108780746 13279.11      2990457    34.22  1024.00
--     15 16385.29    620051-671459         8042    108803161 13281.89      2743492    31.40  1024.00
--     16 16385.77    671460-711202         6186    108787261 13279.89      2960438    33.88  1024.00
--     17 16385.18    711203-754810         6755    108798974 13281.34      2782087    31.84  1024.00
--     18 16384.77    754811-807221         8203    108799173 13281.41      2740561    31.36  1024.00
--     19 16384.36    807222-846994         6192    108787314 13279.90      2836437    32.46  1024.00
--     20 16385.61    846995-889345         6645    108807664 13282.39      2727981    31.22  1024.00
--     21 16385.21    889346-942388         8324    108800108 13281.53      2768320    31.68  1024.00
--     22 16385.75    942389-981531         6137    108819575 13283.83      2613887    29.91  1024.00
--     23 16384.63    981532-1024088        6567    108778279 13278.81      2955700    33.83  1024.00
--     24 16385.21   1024089-1076894        8151    108818601 13283.78      2572018    29.43  1024.00
--     25 16386.17   1076895-1115983        6136    108821374 13284.05      2631853    30.12  1024.00
--     26 16384.72   1115984-1157399        6487    108809191 13282.58      2634380    30.15  1024.00
--     27 16385.17   1157400-1210009        8105    108815035 13283.34      2606306    29.83  1024.00
--     28 16385.28   1210010-1248858        6021    108818893 13283.75      2580747    29.53  1024.00
--     29 16385.87   1248859-1290283        6451    108820052 13283.90      2618356    29.96  1024.00
--     30 16385.22   1290284-1341166        7979    108809106 13282.61      2674673    30.61  1024.00
--     31 16384.04   1341167-1379700        5988    108792269 13280.49      2756058    31.54  1024.00
--     32 16384.37   1379701-1420287        6292    108796787 13281.06      2736560    31.32  1024.00
--     33 16386.12   1420288-1469990        7826    108820806 13284.04      2628949    30.09  1024.00
--     34 16384.88   1469991-1507852        5961    108840497 13286.38      2315771    26.50  1024.00
--     35 16384.03   1507853-1547723        6209    108809598 13282.62      2570090    29.41  1024.00
--     36 16385.15   1547724-1597859        7762    108818725 13283.78      2566654    29.37  1024.00
--     37 16385.26   1597860-1636401        5955    108881017 13291.33      1916607    21.93  1024.00
--     38 16385.06   1636402-1676162        6214    108786756 13279.83      2904020    33.23  1024.00
--     39 16384.20   1676163-1726388        7742    108785610 13279.74      2836939    32.47  1024.00
--     40  3879.27   1726389-1729895         526      6598292   805.47       156700     1.79  1024.00
--   ---- -------- ------------------- --------- ------------ -------- ------------ -------- --------
--                                                 4250006373             105520118
-- Finished stage 'readErrorDetectionConfigure', reset canuIteration.
--
-- Running jobs.  First attempt out of 2.
----------------------------------------
-- Starting 'red' concurrent execution on Fri Jan 16 01:02:09 2026 with 4558225.531 GB free disk space (40 processes; 22 concurrently)

    cd unitigging/3-overlapErrorAdjustment
    ./red.sh 1 > ./red.000001.out 2>&1
    ./red.sh 2 > ./red.000002.out 2>&1
    ./red.sh 3 > ./red.000003.out 2>&1
    ./red.sh 4 > ./red.000004.out 2>&1
    ./red.sh 5 > ./red.000005.out 2>&1
    ./red.sh 6 > ./red.000006.out 2>&1
    ./red.sh 7 > ./red.000007.out 2>&1
    ./red.sh 8 > ./red.000008.out 2>&1
    ./red.sh 9 > ./red.000009.out 2>&1
    ./red.sh 10 > ./red.000010.out 2>&1
    ./red.sh 11 > ./red.000011.out 2>&1
    ./red.sh 12 > ./red.000012.out 2>&1
    ./red.sh 13 > ./red.000013.out 2>&1
    ./red.sh 14 > ./red.000014.out 2>&1
    ./red.sh 15 > ./red.000015.out 2>&1
    ./red.sh 16 > ./red.000016.out 2>&1
    ./red.sh 17 > ./red.000017.out 2>&1
    ./red.sh 18 > ./red.000018.out 2>&1
    ./red.sh 19 > ./red.000019.out 2>&1
    ./red.sh 20 > ./red.000020.out 2>&1
    ./red.sh 21 > ./red.000021.out 2>&1
    ./red.sh 22 > ./red.000022.out 2>&1
    ./red.sh 23 > ./red.000023.out 2>&1
    ./red.sh 24 > ./red.000024.out 2>&1
    ./red.sh 25 > ./red.000025.out 2>&1
    ./red.sh 26 > ./red.000026.out 2>&1
    ./red.sh 27 > ./red.000027.out 2>&1
    ./red.sh 28 > ./red.000028.out 2>&1
    ./red.sh 29 > ./red.000029.out 2>&1
    ./red.sh 30 > ./red.000030.out 2>&1
    ./red.sh 31 > ./red.000031.out 2>&1
    ./red.sh 32 > ./red.000032.out 2>&1
    ./red.sh 33 > ./red.000033.out 2>&1
    ./red.sh 34 > ./red.000034.out 2>&1
    ./red.sh 35 > ./red.000035.out 2>&1
    ./red.sh 36 > ./red.000036.out 2>&1
    ./red.sh 37 > ./red.000037.out 2>&1
    ./red.sh 38 > ./red.000038.out 2>&1
    ./red.sh 39 > ./red.000039.out 2>&1
    ./red.sh 40 > ./red.000040.out 2>&1

-- Finished on Fri Jan 16 01:21:21 2026 (1152 seconds) with 4558776.875 GB free disk space
----------------------------------------
-- Found 40 read error detection output files.
-- Finished stage 'readErrorDetectionCheck', reset canuIteration.
--
-- Loading read lengths.
-- Loading number of overlaps per read.
--
-- Configure OEA for 8gb memory.
--                   Batches of at most (unlimited) reads.
--                                      300000000 bases.
--
--           Total                                               Reads                 Olaps  Adjusts
--    Job   Memory      Read Range         Reads        Bases   Memory        Olaps   Memory   Memory  (Memory in MB)
--   ---- -------- ------------------- --------- ------------ -------- ------------ -------- --------
--      1  2912.06         1-118486        18295    300008013   294.67      6590794   201.14   368.25
--      2  2978.07    118487-245784        19603    300013431   294.71      8752518   267.11   368.25
--      3  2934.01    245785-367296        19072    300005786   294.69      7309480   223.07   368.25
--      4  2942.62    367297-486351        18609    300006299   294.68      7591999   231.69   368.25
--      5  2960.20    486352-610159        19185    300019094   294.71      8167145   249.24   368.25
--      6  2957.76    610160-734640        19347    300003253   294.70      8087517   246.81   368.25
--      7  2951.73    734641-859279        19510    300014189   294.71      7889396   240.77   368.25
--      8  2909.56    859280-984122        19581    300000946   294.70      6507977   198.61   368.25
--      9  2954.72    984123-1108444       19319    300001581   294.69      7988023   243.78   368.25
--     10  2925.40   1108445-1232779       19178    300002799   294.69      7027428   214.46   368.25
--     11  2908.00   1232780-1354038       18983    300004204   294.69      6457420   197.06   368.25
--     12  2953.12   1354039-1473367       18661    300000470   294.67      7936165   242.19   368.25
--     13  2902.13   1473368-1588337       17918    300019150   294.67      6265725   191.21   368.25
--     14  2919.35   1588338-1703673       17874    300014524   294.66      6830141   208.44   368.25
--     15  2536.61   1703674-1729895        4055     49892634    55.71      2118390    64.65   368.25
--   ---- -------- ------------------- --------- ------------ -------- ------------ -------- --------
--                                                 4250006373             105520118
-- Finished stage 'overlapErrorAdjustmentConfigure', reset canuIteration.
--
-- Running jobs.  First attempt out of 2.
----------------------------------------
-- Starting 'oea' concurrent execution on Fri Jan 16 01:21:28 2026 with 4558776.796 GB free disk space (15 processes; 62 concurrently)

    cd unitigging/3-overlapErrorAdjustment
    ./oea.sh 1 > ./oea.000001.out 2>&1
    ./oea.sh 2 > ./oea.000002.out 2>&1
    ./oea.sh 3 > ./oea.000003.out 2>&1
    ./oea.sh 4 > ./oea.000004.out 2>&1
    ./oea.sh 5 > ./oea.000005.out 2>&1
    ./oea.sh 6 > ./oea.000006.out 2>&1
    ./oea.sh 7 > ./oea.000007.out 2>&1
    ./oea.sh 8 > ./oea.000008.out 2>&1
    ./oea.sh 9 > ./oea.000009.out 2>&1
    ./oea.sh 10 > ./oea.000010.out 2>&1
    ./oea.sh 11 > ./oea.000011.out 2>&1
    ./oea.sh 12 > ./oea.000012.out 2>&1
    ./oea.sh 13 > ./oea.000013.out 2>&1
    ./oea.sh 14 > ./oea.000014.out 2>&1
    ./oea.sh 15 > ./oea.000015.out 2>&1

-- Finished on Fri Jan 16 02:27:44 2026 (3976 seconds) with 4559345.765 GB free disk space
----------------------------------------
-- Found 15 overlap error adjustment output files.
-- Finished stage 'overlapErrorAdjustmentCheck', reset canuIteration.
----------------------------------------
-- Starting command on Fri Jan 16 02:27:44 2026 with 4559345.75 GB free disk space

    cd unitigging/3-overlapErrorAdjustment
    /share/org/YZWL/yzwl_lixg/miniforge3/envs/canu_v.2.3/bin/loadErates \
      -S ../../B4-10.seqStore \
      -O ../B4-10.ovlStore \
      -L ./oea.files \
    > ./oea.apply.err 2>&1

-- Finished on Fri Jan 16 02:27:44 2026 (in the blink of an eye) with 4559345.531 GB free disk space
----------------------------------------
-- No report available.
-- Finished stage 'updateOverlapStore', reset canuIteration.
-- Finished stage 'unitig', reset canuIteration.
--
-- Running jobs.  First attempt out of 2.
----------------------------------------
-- Starting 'bat' concurrent execution on Fri Jan 16 02:27:44 2026 with 4559345.484 GB free disk space (1 processes; 1 concurrently)

    cd unitigging/4-unitigger
    ./unitigger.sh 1 > ./unitigger.000001.out 2>&1

-- Finished on Fri Jan 16 02:28:09 2026 (25 seconds) with 4559344.421 GB free disk space
----------------------------------------
-- Unitigger finished successfully.
--  
--  ERROR RATES
--  -----------
--                                                   --------threshold------
--  294458                       fraction error      fraction        percent
--  samples                              (1e-5)         error          error
--                   --------------------------      --------       --------
--  command line (-eg)                           ->     30.00        0.0300%
--  command line (-ef)                           ->  -----.--      ---.----%
--  command line (-eM)                           ->     30.00        0.0300%
--  mean + std.dev       0.33 +-  12 *     2.65  ->     32.16        0.0322%
--  median + mad         0.00 +-  12 *     0.00  ->      0.00        0.0000%
--  90th percentile                              ->      1.00        0.0010%  (enabled)
--  
--  BEST EDGE FILTERING
--  -------------------
--  At graph threshold 0.0300%, reads:
--    available to have edges:        44585
--    with at least one edge:         36709
--  
--  At max threshold 0.0300%, reads:  (not computed)
--    available to have edges:            0
--    with at least one edge:             0
--  
--  At tight threshold 0.0010%, reads with:
--    both edges below error threshold:     32625  (80.00% minReadsBest threshold = 29367)
--    one  edge  above error threshold:      3138
--    both edges above error threshold:       946
--    at least one edge:                    36709
--  
--  At loose threshold 0.0300%, reads with:
--    both edges below error threshold:     36709  (80.00% minReadsBest threshold = 29367)
--    one  edge  above error threshold:         0
--    both edges above error threshold:         0
--    at least one edge:                    36709
--  
--  
--  INITIAL EDGES
--  -------- ----------------------------------------
--    219149 reads are contained
--   1478908 reads have no best edges (singleton)
--       373 reads have only one best edge (spur) 
--                150 are mutual best
--     31465 reads have two best edges 
--                756 have one mutual best edge
--              30301 have two mutual best edges
--  
--  
--  FINAL EDGES
--  -------- ----------------------------------------
--    219149 reads are contained
--   1479357 reads have no best edges (singleton)
--       208 reads have only one best edge (spur) 
--                153 are mutual best
--     31181 reads have two best edges 
--                607 have one mutual best edge
--              30291 have two mutual best edges
--  
--  
--  EDGE FILTERING
--  -------- ------------------------------------------
--         0 reads are ignored
--     10394 reads have a gap in overlap coverage
--       185 reads have lopsided best edges
-- Found, in version 1, after unitig construction:
--   contigs:      53 sequences, total length 67228111 bp (including 71 repeats of total length 1550426 bp).
--   bubbles:      148 sequences, total length 3744271 bp.
--   unassembled:  18359 sequences, total length 200078379 bp.
--
-- Contig sizes based on genome size 85mbp:
--
--            NG (bp)  LG (contigs)    sum (bp)
--         ----------  ------------  ----------
--     10     6198536             2    14114796
--     20     4779645             3    18894441
--     30     4589375             5    28142417
--     40     4406525             7    37077435
--     50     3867547             9    45181921
--     60     2930435            11    51855274
--     70     1839768            15    60371535
--
-- Finished stage 'unitigCheck', reset canuIteration.
----------------------------------------
-- Starting command on Fri Jan 16 02:28:09 2026 with 4559344.406 GB free disk space

    cd unitigging
    /share/org/YZWL/yzwl_lixg/miniforge3/envs/canu_v.2.3/bin/utgcns \
      -S ../B4-10.seqStore \
      -T  ./B4-10.ctgStore 1 \
      -partition 0.8 1.5 0.1 \
    > ./B4-10.ctgStore/partitioning.log 2>&1

-- Finished on Fri Jan 16 02:28:18 2026 (9 seconds) with 4559343.203 GB free disk space
----------------------------------------
-- Using slow alignment for consensus (iteration '0').
-- Configured 10 consensus jobs.
-- Finished stage 'consensusConfigure', reset canuIteration.
--
-- Local: cns       11.750 GB    8 CPUs x  11 jobs   129.250 GB  88 CPUs  (consensus)
--
--
-- Running jobs.  First attempt out of 2.
----------------------------------------
-- Starting 'cns' concurrent execution on Fri Jan 16 02:28:18 2026 with 4559343.171 GB free disk space (10 processes; 11 concurrently)

    cd unitigging/5-consensus
    ./consensus.sh 1 > ./consensus.000001.out 2>&1
    ./consensus.sh 2 > ./consensus.000002.out 2>&1
    ./consensus.sh 3 > ./consensus.000003.out 2>&1
    ./consensus.sh 4 > ./consensus.000004.out 2>&1
    ./consensus.sh 5 > ./consensus.000005.out 2>&1
    ./consensus.sh 6 > ./consensus.000006.out 2>&1
    ./consensus.sh 7 > ./consensus.000007.out 2>&1
    ./consensus.sh 8 > ./consensus.000008.out 2>&1
    ./consensus.sh 9 > ./consensus.000009.out 2>&1
    ./consensus.sh 10 > ./consensus.000010.out 2>&1

-- Finished on Fri Jan 16 02:35:21 2026 (423 seconds) with 4559100.812 GB free disk space
----------------------------------------
-- Using slow alignment for consensus (iteration '1').
-- Configured 10 consensus jobs.
-- All 10 consensus jobs finished successfully.
-- Finished stage 'consensusCheck', reset canuIteration.
-- Using slow alignment for consensus (iteration '0').
-- Configured 10 consensus jobs.
----------------------------------------
-- Starting command on Fri Jan 16 02:35:21 2026 with 4559100.765 GB free disk space

    cd unitigging
    /share/org/YZWL/yzwl_lixg/miniforge3/envs/canu_v.2.3/bin/tgStoreLoad \
      -S ../B4-10.seqStore \
      -T  ./B4-10.ctgStore 2 \
      -L ./5-consensus/ctgcns.files \
    > ./5-consensus/ctgcns.files.ctgStoreLoad.err 2>&1

-- Finished on Fri Jan 16 02:35:22 2026 (one second) with 4559099.984 GB free disk space
----------------------------------------
----------------------------------------
-- Starting command on Fri Jan 16 02:35:22 2026 with 4559099.984 GB free disk space

    cd unitigging
    /share/org/YZWL/yzwl_lixg/miniforge3/envs/canu_v.2.3/bin/tgTigDisplay \
      -S ../B4-10.seqStore \
      -b \
      -o ../B4-10.contigs.unsorted.bam \
      -L ./5-consensus/ctgcns.files \
    > ./5-consensus/ctgcns.files.contigs.bam.err 2>&1

-- Finished on Fri Jan 16 02:38:07 2026 (165 seconds) with 4559192.875 GB free disk space
----------------------------------------
----------------------------------------
-- Starting command on Fri Jan 16 02:38:07 2026 with 4559192.875 GB free disk space

    cd .
    samtools sort \
      --write-index \
      --threads 2 \
      -o ./B4-10.contigs.bam ./B4-10.contigs.unsorted.bam \
    > ./ctgcns.bam.err 2>&1

-- Finished on Fri Jan 16 02:39:13 2026 (66 seconds) with 4559118.89 GB free disk space
----------------------------------------
-- Purging consensus output after loading to ctgStore.
-- Purged 10 .cns outputs.
----------------------------------------
-- Starting command on Fri Jan 16 02:39:13 2026 with 4559119.937 GB free disk space

    cd unitigging
    /share/org/YZWL/yzwl_lixg/miniforge3/envs/canu_v.2.3/bin/tgStoreDump \
      -S ../B4-10.seqStore \
      -T ./B4-10.ctgStore 2 \
      -sizes -s 85000000 \
    > ./B4-10.ctgStore/seqDB.v002.sizes.txt
ZERO length suplied to intervalList::add(), ignoring interval.
ZERO length suplied to intervalList::add(), ignoring interval.
ZERO length suplied to intervalList::add(), ignoring interval.
ZERO length suplied to intervalList::add(), ignoring interval.
ZERO length suplied to intervalList::add(), ignoring interval.
ZERO length suplied to intervalList::add(), ignoring interval.
ZERO length suplied to intervalList::add(), ignoring interval.
ZERO length suplied to intervalList::add(), ignoring interval.
ZERO length suplied to intervalList::add(), ignoring interval.

-- Finished on Fri Jan 16 02:39:13 2026 (like a bat out of hell) with 4559119.937 GB free disk space
----------------------------------------
-- Found, in version 2, after consensus generation:
--   contigs:      53 sequences, total length 87629140 bp (including 71 repeats of total length 2147014 bp).
--   bubbles:      148 sequences, total length 5139005 bp.
--   unassembled:  18359 sequences, total length 287007554 bp.
--
-- Contig sizes based on genome size 85mbp:
--
--            NG (bp)  LG (contigs)    sum (bp)
--         ----------  ------------  ----------
--     10    10323193             1    10323193
--     20     8047700             2    18370893
--     30     6064007             4    30643697
--     40     5955567             5    36599264
--     50     5924759             6    42524023
--     60     5514495             8    53757319
--     70     4872589            10    63680522
--     80     3472450            12    70975892
--     90     2402725            15    78596547
--    100     1045223            19    85540444
--
-- Finished stage 'consensusLoad', reset canuIteration.
----------------------------------------
-- Starting command on Fri Jan 16 02:39:13 2026 with 4559119.921 GB free disk space

    cd .
    /share/org/YZWL/yzwl_lixg/miniforge3/envs/canu_v.2.3/bin/tgStoreDump \
      -S ./B4-10.seqStore \
      -T ./unitigging/B4-10.ctgStore 2 \
      -o ./B4-10.contigs \
      -layout \
    > ./B4-10.contigs.layout.err 2>&1

-- Finished on Fri Jan 16 02:39:14 2026 (one second) with 4559119.875 GB free disk space
----------------------------------------
----------------------------------------
-- Starting command on Fri Jan 16 02:39:14 2026 with 4559119.875 GB free disk space

    cd .
    /share/org/YZWL/yzwl_lixg/miniforge3/envs/canu_v.2.3/bin/tgStoreDump \
      -S ./B4-10.seqStore \
      -T ./unitigging/B4-10.ctgStore 2 \
      -consensus -fasta \
      -unassembled \
    > ./B4-10.unassembled.fasta
    2> ./B4-10.unassembled.err
ZERO length suplied to intervalList::add(), ignoring interval.
ZERO length suplied to intervalList::add(), ignoring interval.
ZERO length suplied to intervalList::add(), ignoring interval.
ZERO length suplied to intervalList::add(), ignoring interval.
ZERO length suplied to intervalList::add(), ignoring interval.
ZERO length suplied to intervalList::add(), ignoring interval.
ZERO length suplied to intervalList::add(), ignoring interval.
ZERO length suplied to intervalList::add(), ignoring interval.
ZERO length suplied to intervalList::add(), ignoring interval.

-- Finished on Fri Jan 16 02:39:15 2026 (one second) with 4559119.593 GB free disk space
----------------------------------------
----------------------------------------
-- Starting command on Fri Jan 16 02:39:15 2026 with 4559119.593 GB free disk space

    cd .
    /share/org/YZWL/yzwl_lixg/miniforge3/envs/canu_v.2.3/bin/tgStoreDump \
      -S ./B4-10.seqStore \
      -T ./unitigging/B4-10.ctgStore 2 \
      -consensus -fasta \
      -contigs \
    > ./B4-10.contigs.fasta
    2> ./B4-10.contigs.err
ZERO length suplied to intervalList::add(), ignoring interval.
ZERO length suplied to intervalList::add(), ignoring interval.
ZERO length suplied to intervalList::add(), ignoring interval.
ZERO length suplied to intervalList::add(), ignoring interval.
ZERO length suplied to intervalList::add(), ignoring interval.
ZERO length suplied to intervalList::add(), ignoring interval.
ZERO length suplied to intervalList::add(), ignoring interval.
ZERO length suplied to intervalList::add(), ignoring interval.
ZERO length suplied to intervalList::add(), ignoring interval.

-- Finished on Fri Jan 16 02:39:16 2026 (one second) with 4559119.484 GB free disk space
----------------------------------------
-- Finished stage 'generateOutputs', reset canuIteration.
--
-- Assembly 'B4-10' finished in '/share/org/YZWL/yzwl_lixg/project/28.大豆疫霉菌三代基因组/03.hicanu/B4-10/01.raw_output'.
--
-- Summary saved in 'B4-10.report'.
--
-- Sequences saved:
--   Contigs       -> 'B4-10.contigs.fasta'
--   Unassembled   -> 'B4-10.unassembled.fasta'
--
-- Read layouts saved:
--   Contigs       -> 'B4-10.contigs.layout'.
--
-- Bye.

2026-01-16 02:39:16.338 - WARNING - 输出文件不存在|Output file does not exist: /share/org/YZWL/yzwl_lixg/project/28.大豆疫霉菌三代基因组/03.hicanu/B4-10/01.raw_output/B4-10.unitigs.fasta
Usage: biopytools ragtag [OPTIONS]
Try 'biopytools ragtag -h' for help.

Error: Invalid value for '-r' / '--reference': 文件不存在|File does not exist: /share/org/YZWL/yzwl_lixg/project/28.大豆疫霉菌三代基因组/04.ragtag/Psoja_T2T.fa
Usage: biopytools genomesyn [OPTIONS]
Try 'biopytools genomesyn -h' for help.

Error: Invalid value for '-i' / '--ref': Path '04.ragtag/B4-10/hicanu/B4-10_RagTag_scaffolded.fa' does not exist.
Job 68886857 stderr output:

