2026-01-16 14:44:08.200 - WARNING - 命令错误输出|Command stderr:
-- canu master +27 changes (r10515 2a41e933b8de6ed66723d75d36dd071b46d2c347)
--
-- CITATIONS
--
-- For assemblies of PacBio HiFi reads:
--   Nurk S, Walenz BP, Rhiea A, Vollger MR, Logsdon GA, Grothe R, Miga KH, Eichler EE, Phillippy AM, Koren S.
--   HiCanu: accurate assembly of segmental duplications, satellites, and allelic variants from high-fidelity long reads.
--   biorXiv. 2020.
--   https://doi.org/10.1101/2020.03.14.992248
-- 
-- Read and contig alignments during correction and consensus use:
--   Šošic M, Šikic M.
--   Edlib: a C/C ++ library for fast, exact sequence alignment using edit distance.
--   Bioinformatics. 2017 May 1;33(9):1394-1395.
--   http://doi.org/10.1093/bioinformatics/btw753
-- 
-- Overlaps are generated using:
--   Berlin K, et al.
--   Assembling large genomes with single-molecule sequencing and locality-sensitive hashing.
--   Nat Biotechnol. 2015 Jun;33(6):623-30.
--   http://doi.org/10.1038/nbt.3238
-- 
--   Myers EW, et al.
--   A Whole-Genome Assembly of Drosophila.
--   Science. 2000 Mar 24;287(5461):2196-204.
--   http://doi.org/10.1126/science.287.5461.2196
-- 
-- Contig consensus sequences are generated using an algorithm derived from pbdagcon:
--   Chin CS, et al.
--   Nonhybrid, finished microbial genome assemblies from long-read SMRT sequencing data.
--   Nat Methods. 2013 Jun;10(6):563-9
--   http://doi.org/10.1038/nmeth.2474
-- 
-- CONFIGURE CANU
--
-- Detected Java(TM) Runtime Environment '25.0.1-internal' (from '/share/org/YZWL/yzwl_lixg/miniforge3/envs/telocomp/lib/jvm/bin/java') without -d64 support.
--
-- WARNING:
-- WARNING:  Failed to run gnuplot using command 'gnuplot'.
-- WARNING:  Plots will be disabled.
-- WARNING:
--
-- Detected samtools version '1.22' / htslib version 'htscodecs=1.6.3' (from 'samtools').
--
-- Detected 88 CPUs and 503 gigabytes of memory on the local machine.
--
-- Detected Slurm with 'sinfo' binary in /opt/skyformai/bin/sinfo.
--          Slurm disabled by useGrid=false
--
-- Detected  '' with 'pbsnodes' binary in /opt/skyformai/bin/pbsnodes.
--           disabled by useGrid=false
--
-- Detected LSF with 'bsub' binary in /opt/skyformai/bin/bsub.
--          LSF disabled by useGrid=false
--
-- Local machine mode enabled; grid support not detected or not allowed.
--
-- Found trimmed raw PacBio HiFi reads in the input files.
--
--                                (tag)Concurrency
--                         (tag)Threads          |
--                (tag)Memory         |          |
--        (tag)             |         |          |       total usage      algorithm
--        -------  ----------  --------   --------  --------------------  -----------------------------
-- Local: meryl     12.000 GB    4 CPUs x  22 jobs   264.000 GB  88 CPUs  (k-mer counting)
-- Local: cormhap   13.000 GB   11 CPUs x   8 jobs   104.000 GB  88 CPUs  (overlap detection with mhap)
-- Local: obtovl     8.000 GB    8 CPUs x  11 jobs    88.000 GB  88 CPUs  (overlap detection)
-- Local: utgovl     8.000 GB    8 CPUs x  11 jobs    88.000 GB  88 CPUs  (overlap detection)
-- Local: cor        -.--- GB    4 CPUs x   - jobs     -.--- GB   - CPUs  (read correction)
-- Local: ovb        4.000 GB    1 CPU  x  88 jobs   352.000 GB  88 CPUs  (overlap store bucketizer)
-- Local: ovs        8.000 GB    1 CPU  x  62 jobs   496.000 GB  62 CPUs  (overlap store sorting)
-- Local: red       16.000 GB    4 CPUs x  22 jobs   352.000 GB  88 CPUs  (read error detection)
-- Local: oea        8.000 GB    1 CPU  x  62 jobs   496.000 GB  62 CPUs  (overlap error adjustment)
-- Local: bat       32.000 GB    8 CPUs x   1 job     32.000 GB   8 CPUs  (contig construction with bogart)
-- Local: cns        -.--- GB    8 CPUs x   - jobs     -.--- GB   - CPUs  (consensus)
--
-- Generating assembly 'A3-17' in '/share/org/YZWL/yzwl_lixg/project/28.大豆疫霉菌三代基因组/03.hicanu/A3-17/01.raw_output':
--   genomeSize:
--     85000000
--
--   Overlap Generation Limits:
--     corOvlErrorRate 0.0000 (  0.00%)
--     obtOvlErrorRate 0.0250 (  2.50%)
--     utgOvlErrorRate 0.0100 (  1.00%)
--
--   Overlap Processing Limits:
--     corErrorRate    0.0000 (  0.00%)
--     obtErrorRate    0.0250 (  2.50%)
--     utgErrorRate    0.0003 (  0.03%)
--     cnsErrorRate    0.0500 (  5.00%)
--
--   Stages to run:
--     assemble HiFi reads.
--
--
-- BEGIN STORE CREATION
----------------------------------------
-- Starting command on Fri Jan 16 13:24:14 2026 with 4532479.625 GB free disk space

    cd .
    ./A3-17.seqStore.sh \
    > ./A3-17.seqStore.err 2>&1

-- Finished on Fri Jan 16 13:31:06 2026 (412 seconds) with 4532260.171 GB free disk space
----------------------------------------
--
-- In sequence store './A3-17.seqStore':
--   Found 280630 reads.
--   Found 4250019983 bases (50 times coverage).
--    Histogram of corrected reads:
--    
--    G=4250019983                       sum of  ||               length     num
--    NG         length     index       lengths  ||                range    seqs
--    ----- ------------ --------- ------------  ||  ------------------- -------
--    00010        26509     14653    425020975  ||       1243-2672        14309|--------------------------------
--    00020        24026     31556    850006026  ||       2673-4102        19831|---------------------------------------------
--    00030        22361     49919   1275015714  ||       4103-5532        17382|---------------------------------------
--    00040        21025     69534   1700015426  ||       5533-6962        14436|---------------------------------
--    00050        19854     90342   2125023463  ||       6963-8392        12082|---------------------------
--    00060        18744    112369   2550015207  ||       8393-9822        10115|-----------------------
--    00070        17491    135805   2975024553  ||       9823-11252        8420|-------------------
--    00080        15488    161411   3400016475  ||      11253-12682        6987|----------------
--    00090         9351    195585   3825026384  ||      12683-14112        6586|---------------
--    00100         1243    280630   4250019983  ||      14113-15542        9562|----------------------
--    001.000x              280630   4250019983  ||      15543-16972       16892|--------------------------------------
--                                               ||      16973-18402       24995|--------------------------------------------------------
--                                               ||      18403-19832       28279|---------------------------------------------------------------
--                                               ||      19833-21262       24968|--------------------------------------------------------
--                                               ||      21263-22692       19998|---------------------------------------------
--                                               ||      22693-24122       15066|----------------------------------
--                                               ||      24123-25552       10796|-------------------------
--                                               ||      25553-26982        7436|-----------------
--                                               ||      26983-28412        5074|------------
--                                               ||      28413-29842        3276|--------
--                                               ||      29843-31272        1995|-----
--                                               ||      31273-32702        1148|---
--                                               ||      32703-34132         590|--
--                                               ||      34133-35562         256|-
--                                               ||      35563-36992         106|-
--                                               ||      36993-38422          30|-
--                                               ||      38423-39852           6|-
--                                               ||      39853-41282           1|-
--                                               ||      41283-42712           4|-
--                                               ||      42713-44142           0|
--                                               ||      44143-45572           0|
--                                               ||      45573-47002           1|-
--                                               ||      47003-48432           2|-
--                                               ||      48433-49862           0|
--                                               ||      49863-51292           0|
--                                               ||      51293-52722           0|
--                                               ||      52723-54152           0|
--                                               ||      54153-55582           0|
--                                               ||      55583-57012           0|
--                                               ||      57013-58442           1|-
--    
--
-- In sequence store './A3-17.seqStore':
--   Found 280630 reads.
--   Found 4250019983 bases (50 times coverage).
--    Histogram of corrected-trimmed reads:
--    
--    G=4250019983                       sum of  ||               length     num
--    NG         length     index       lengths  ||                range    seqs
--    ----- ------------ --------- ------------  ||  ------------------- -------
--    00010        26509     14653    425020975  ||       1243-2672        14309|--------------------------------
--    00020        24026     31556    850006026  ||       2673-4102        19831|---------------------------------------------
--    00030        22361     49919   1275015714  ||       4103-5532        17382|---------------------------------------
--    00040        21025     69534   1700015426  ||       5533-6962        14436|---------------------------------
--    00050        19854     90342   2125023463  ||       6963-8392        12082|---------------------------
--    00060        18744    112369   2550015207  ||       8393-9822        10115|-----------------------
--    00070        17491    135805   2975024553  ||       9823-11252        8420|-------------------
--    00080        15488    161411   3400016475  ||      11253-12682        6987|----------------
--    00090         9351    195585   3825026384  ||      12683-14112        6586|---------------
--    00100         1243    280630   4250019983  ||      14113-15542        9562|----------------------
--    001.000x              280630   4250019983  ||      15543-16972       16892|--------------------------------------
--                                               ||      16973-18402       24995|--------------------------------------------------------
--                                               ||      18403-19832       28279|---------------------------------------------------------------
--                                               ||      19833-21262       24968|--------------------------------------------------------
--                                               ||      21263-22692       19998|---------------------------------------------
--                                               ||      22693-24122       15066|----------------------------------
--                                               ||      24123-25552       10796|-------------------------
--                                               ||      25553-26982        7436|-----------------
--                                               ||      26983-28412        5074|------------
--                                               ||      28413-29842        3276|--------
--                                               ||      29843-31272        1995|-----
--                                               ||      31273-32702        1148|---
--                                               ||      32703-34132         590|--
--                                               ||      34133-35562         256|-
--                                               ||      35563-36992         106|-
--                                               ||      36993-38422          30|-
--                                               ||      38423-39852           6|-
--                                               ||      39853-41282           1|-
--                                               ||      41283-42712           4|-
--                                               ||      42713-44142           0|
--                                               ||      44143-45572           0|
--                                               ||      45573-47002           1|-
--                                               ||      47003-48432           2|-
--                                               ||      48433-49862           0|
--                                               ||      49863-51292           0|
--                                               ||      51293-52722           0|
--                                               ||      52723-54152           0|
--                                               ||      54153-55582           0|
--                                               ||      55583-57012           0|
--                                               ||      57013-58442           1|-
--    
--
-- Correction skipped; not enabled.
--
-- Trimming skipped; not enabled.
--
-- BEGIN ASSEMBLY
----------------------------------------
-- Starting command on Fri Jan 16 13:31:06 2026 with 4532260.093 GB free disk space

    cd unitigging/0-mercounts
    ./meryl-configure.sh \
    > ./meryl-configure.err 2>&1

-- Finished on Fri Jan 16 13:31:07 2026 (one second) with 4532260.093 GB free disk space
----------------------------------------
--  segments   memory batches
--  -------- -------- -------
--        01 10.81 GB       2
--        02  5.61 GB       2
--        04  2.97 GB       2
--        06  2.15 GB       2
--        08  1.61 GB       2
--        12  1.07 GB       2
--        16  0.81 GB       2
--        20  0.65 GB       2
--        24  0.54 GB       2
--        32  0.41 GB       2
--        40  0.33 GB       2
--        48  -.-- GB       -  (segment size too small)
--        56  -.-- GB       -  (segment size too small)
--        64  -.-- GB       -  (segment size too small)
--        96  -.-- GB       -  (segment size too small)
--
--  For 280630 reads with 4250019983 bases, limit to 42 batches.
--  Will count kmers using 01 jobs, each using 12 GB and 4 threads.
--
-- Finished stage 'merylConfigure', reset canuIteration.
--
-- Running jobs.  First attempt out of 2.
----------------------------------------
-- Starting 'meryl' concurrent execution on Fri Jan 16 13:31:07 2026 with 4532260.062 GB free disk space (1 processes; 22 concurrently)

    cd unitigging/0-mercounts
    ./meryl-count.sh 1 > ./meryl-count.000001.out 2>&1

-- Finished on Fri Jan 16 13:34:45 2026 (218 seconds) with 4532210.734 GB free disk space
----------------------------------------
-- Found 1 Kmer counting (meryl) outputs.
-- Finished stage 'utg-merylCountCheck', reset canuIteration.
--
-- Running jobs.  First attempt out of 2.
----------------------------------------
-- Starting 'meryl' concurrent execution on Fri Jan 16 13:34:45 2026 with 4532210.703 GB free disk space (1 processes; 22 concurrently)

    cd unitigging/0-mercounts
    ./meryl-process.sh 1 > ./meryl-process.000001.out 2>&1

-- Finished on Fri Jan 16 13:34:51 2026 (6 seconds) with 4532211.234 GB free disk space
----------------------------------------
-- Meryl finished successfully.  Kmer frequency histogram:
--
-- WARNING: gnuplot failed.
--
----------------------------------------
--
--  22-mers                                                                                           Fraction
--    Occurrences   NumMers                                                                         Unique Total
--       1-     1         0                                                                        0.0000 0.0000
--       2-     2    182992                                                                        0.0040 0.0001
--       3-     4     63394                                                                        0.0050 0.0002
--       5-     7     20192                                                                        0.0057 0.0002
--       8-    11     18994                                                                        0.0060 0.0003
--      12-    16    105784                                                                        0.0065 0.0003
--      17-    22    341060 *                                                                      0.0095 0.0009
--      23-    29    972680 ****                                                                   0.0178 0.0034
--      30-    37   5422953 ************************                                               0.0447 0.0139
--      38-    46  15610726 ********************************************************************** 0.1856 0.0840
--      47-    56  14376876 ****************************************************************       0.5456 0.3031
--      57-    67   3368130 ***************                                                        0.8330 0.5115
--      68-    79    656769 **                                                                     0.8945 0.5643
--      80-    92    992256 ****                                                                   0.9089 0.5794
--      93-   106    816593 ***                                                                    0.9309 0.6064
--     107-   121    317682 *                                                                      0.9480 0.6303
--     122-   137    298443 *                                                                      0.9546 0.6409
--     138-   154    259333 *                                                                      0.9613 0.6532
--     155-   172    166398                                                                        0.9668 0.6645
--     173-   191    163547                                                                        0.9704 0.6728
--     192-   211    124163                                                                        0.9740 0.6821
--     212-   232    110098                                                                        0.9767 0.6897
--     233-   254     98318                                                                        0.9791 0.6973
--     255-   277     89886                                                                        0.9813 0.7047
--     278-   301     73257                                                                        0.9832 0.7121
--     302-   326     64712                                                                        0.9848 0.7186
--     327-   352     54090                                                                        0.9862 0.7249
--     353-   379     47923                                                                        0.9874 0.7305
--     380-   407     39994                                                                        0.9885 0.7360
--     408-   436     36315                                                                        0.9894 0.7408
--     437-   466     33098                                                                        0.9902 0.7456
--     467-   497     31169                                                                        0.9909 0.7502
--     498-   529     27507                                                                        0.9916 0.7549
--     530-   562     23232                                                                        0.9922 0.7592
--     563-   596     22069                                                                        0.9927 0.7631
--     597-   631     17691                                                                        0.9932 0.7670
--     632-   667     14658                                                                        0.9936 0.7704
--     668-   704     13439                                                                        0.9939 0.7734
--     705-   742     13089                                                                        0.9942 0.7762
--     743-   781     14447                                                                        0.9945 0.7792
--     782-   821     10996                                                                        0.9948 0.7825
--
--           0 (max occurrences)
--  3224149509 (total mers, non-unique)
--    45340848 (distinct mers, non-unique)
--           0 (unique mers)
-- Finished stage 'meryl-process', reset canuIteration.
--
-- Removing meryl database 'unitigging/0-mercounts/A3-17.ms22'.
--
-- OVERLAPPER (normal) (assembly) erate=0.01
--
----------------------------------------
-- Starting command on Fri Jan 16 13:34:51 2026 with 4532211.218 GB free disk space

    cd unitigging/1-overlapper
    /share/org/YZWL/yzwl_lixg/miniforge3/envs/canu_v.2.3/bin/overlapInCorePartition \
     -S  ../../A3-17.seqStore \
     -hl 160000000 \
     -rl 5000000000 \
     -ol 500 \
     -o  ./A3-17.partition \
    > ./A3-17.partition.err 2>&1

-- Finished on Fri Jan 16 13:34:51 2026 (furiously fast) with 4532211.203 GB free disk space
----------------------------------------
--
-- Configured 21 overlapInCore jobs.
-- Finished stage 'utg-overlapConfigure', reset canuIteration.
--
-- Running jobs.  First attempt out of 2.
----------------------------------------
-- Starting 'utgovl' concurrent execution on Fri Jan 16 13:34:51 2026 with 4532211.171 GB free disk space (21 processes; 11 concurrently)

    cd unitigging/1-overlapper
    ./overlap.sh 1 > ./overlap.000001.out 2>&1
    ./overlap.sh 2 > ./overlap.000002.out 2>&1
    ./overlap.sh 3 > ./overlap.000003.out 2>&1
    ./overlap.sh 4 > ./overlap.000004.out 2>&1
    ./overlap.sh 5 > ./overlap.000005.out 2>&1
    ./overlap.sh 6 > ./overlap.000006.out 2>&1
    ./overlap.sh 7 > ./overlap.000007.out 2>&1
    ./overlap.sh 8 > ./overlap.000008.out 2>&1
    ./overlap.sh 9 > ./overlap.000009.out 2>&1
    ./overlap.sh 10 > ./overlap.000010.out 2>&1
    ./overlap.sh 11 > ./overlap.000011.out 2>&1
    ./overlap.sh 12 > ./overlap.000012.out 2>&1
    ./overlap.sh 13 > ./overlap.000013.out 2>&1
    ./overlap.sh 14 > ./overlap.000014.out 2>&1
    ./overlap.sh 15 > ./overlap.000015.out 2>&1
    ./overlap.sh 16 > ./overlap.000016.out 2>&1
    ./overlap.sh 17 > ./overlap.000017.out 2>&1
    ./overlap.sh 18 > ./overlap.000018.out 2>&1
    ./overlap.sh 19 > ./overlap.000019.out 2>&1
    ./overlap.sh 20 > ./overlap.000020.out 2>&1
    ./overlap.sh 21 > ./overlap.000021.out 2>&1

-- Finished on Fri Jan 16 14:00:29 2026 (1538 seconds) with 4532260.687 GB free disk space
----------------------------------------
-- Found 21 overlapInCore output files.
--
-- overlapInCore compute 'unitigging/1-overlapper':
--   kmer hits
--     with no overlap       1322376624  15.4285714 +- 38621651.893
--     with an overlap         22969951  7.19047619 +- 611300.033
--
--   overlaps                  22969951  7.19047619 +- 611300.033
--     contained                6669442  .476190476 +- 172726.462
--     dovetail                16300509  .714285714 +- 441403.658
--
--   overlaps rejected
--     multiple per pair              0           0 +- 0
--     bad short window               0           0 +- 0
--     bad long window                0           0 +- 0
-- Finished stage 'utg-overlapCheck', reset canuIteration.
----------------------------------------
-- Starting command on Fri Jan 16 14:00:29 2026 with 4532260.671 GB free disk space

    cd unitigging
    /share/org/YZWL/yzwl_lixg/miniforge3/envs/canu_v.2.3/bin/ovStoreConfig \
     -S ../A3-17.seqStore \
     -M 4-8 \
     -L ./1-overlapper/ovljob.files \
     -create ./A3-17.ovlStore.config \
     > ./A3-17.ovlStore.config.txt \
    2> ./A3-17.ovlStore.config.err

-- Finished on Fri Jan 16 14:00:30 2026 (one second) with 4532260.64 GB free disk space
----------------------------------------
--
-- Creating overlap store unitigging/A3-17.ovlStore using:
--      1 bucket
--      1 slice
--        using at most 2 GB memory each
--
-- Running jobs.  First attempt out of 2.
----------------------------------------
-- Starting 'ovS' concurrent execution on Fri Jan 16 14:00:30 2026 with 4532260.625 GB free disk space (1 processes; 62 concurrently)

    cd unitigging
    ./A3-17.ovlStore.sh 1 > ./A3-17.ovlStore.000001.out 2>&1

-- Finished on Fri Jan 16 14:00:39 2026 (9 seconds) with 4532133.14 GB free disk space
----------------------------------------
-- Checking store.
----------------------------------------
-- Starting command on Fri Jan 16 14:00:39 2026 with 4532133.14 GB free disk space

    cd unitigging
    /share/org/YZWL/yzwl_lixg/miniforge3/envs/canu_v.2.3/bin/ovStoreDump \
     -S ../A3-17.seqStore \
     -O  ./A3-17.ovlStore \
     -counts \
     > ./A3-17.ovlStore/counts.dat 2> ./A3-17.ovlStore/counts.err

-- Finished on Fri Jan 16 14:00:39 2026 (furiously fast) with 4532133.109 GB free disk space
----------------------------------------
--
-- Overlap store 'unitigging/A3-17.ovlStore' successfully constructed.
-- Found 45939902 overlaps for 271404 reads; 1538837 reads have no overlaps.
--
--
-- Purged 0.535 GB in 63 overlap output files.
----------------------------------------
-- Starting command on Fri Jan 16 14:00:40 2026 with 4532133.171 GB free disk space

    cd unitigging
    /share/org/YZWL/yzwl_lixg/miniforge3/envs/canu_v.2.3/bin/ovStoreStats \
     -C 50 \
     -S ../A3-17.seqStore \
     -O  ./A3-17.ovlStore \
     -o  ./A3-17.ovlStore \
     > ./A3-17.ovlStore.summary.err 2>&1

-- Finished on Fri Jan 16 14:00:47 2026 (7 seconds) with 4532133.156 GB free disk space
----------------------------------------
--
-- Overlap store 'unitigging/A3-17.ovlStore' contains:
--
--   category            reads     %          read length        feature size or coverage  analysis
--   ----------------  -------  -------  ----------------------  ------------------------  --------------------
--   middle-missing        142    0.05    14927.40 +- 7490.43        545.64 +- 574.55     (bad trimming)
--   middle-hump            15    0.01    16369.73 +- 5727.64       4839.27 +- 3217.14    (bad trimming)
--   no-5-prime            556    0.20    12920.26 +- 6197.79       1976.46 +- 2899.69    (bad trimming)
--   no-3-prime            563    0.20    11831.48 +- 6445.37       1835.35 +- 2935.08    (bad trimming)
--   
--   low-coverage         1633    0.58    10043.72 +- 5784.80          6.01 +- 3.89       (easy to assemble, potential for lower quality consensus)
--   unique             223286   79.57    11595.93 +- 6051.83         45.02 +- 8.87       (easy to assemble, perfect, yay)
--   repeat-cont         16237    5.79     9051.67 +- 5422.56        752.01 +- 629.03     (potential for consensus errors, no impact on assembly)
--   repeat-dove           191    0.07    20877.39 +- 2200.48        422.42 +- 471.55     (hard to assemble, likely won't assemble correctly or even at all)
--   
--   span-repeat          4866    1.73    13888.67 +- 5139.37       3140.04 +- 3661.92    (read spans a large repeat, usually easy to assemble)
--   uniq-repeat-cont    16070    5.73    12012.39 +- 4966.61                             (should be uniquely placed, low potential for consensus errors, no impact on assembly)
--   uniq-repeat-dove     3182    1.13    19056.13 +- 3100.46                             (will end contigs, potential to misassemble)
--   uniq-anchor          4663    1.66    13206.39 +- 4862.90       7600.45 +- 4974.83    (repeat read, with unique section, probable bad read)
-- Finished stage 'utg-createOverlapStore', reset canuIteration.
--
-- Loading read lengths.
-- Loading number of overlaps per read.
--
-- Configure RED for 16gb memory.
--                   Batches of at most (unlimited) reads.
--                                      500000000 bases.
--                   Expecting evidence of at most 536870912 bases per iteration.
--
--           Total                                               Reads                 Olaps Evidence
--    Job   Memory      Read Range         Reads        Bases   Memory        Olaps   Memory   Memory  (Memory in MB)
--   ---- -------- ------------------- --------- ------------ -------- ------------ -------- --------
--      1 16384.95         1-37632          5890    108975427 13302.85       882148    10.10  1024.00
--      2 16386.92     37633-78020          6278    108963809 13301.44      1177498    13.48  1024.00
--      3 16385.81     78021-135398         8908    108948061 13299.60      1241284    14.21  1024.00
--      4 16385.28    135399-177138         6554    108949893 13299.75      1182091    13.53  1024.00
--      5 16385.95    177139-217472         6268    108949872 13299.74      1241826    14.21  1024.00
--      6 16384.99    217473-270312         8184    108957407 13300.72      1071987    12.27  1024.00
--      7 16384.22    270313-323910         8415    108932466 13297.68      1270421    14.54  1024.00
--      8 16384.49    323911-363759         6180    108931638 13297.51      1308516    14.97  1024.00
--      9 16384.20    363760-409465         6972    108964892 13301.60       926105    10.60  1024.00
--     10 16385.67    409466-471557         9544    108915332 13295.63      1576082    18.04  1024.00
--     11 16384.24    471558-509989         6013    108947605 13299.46      1117180    12.79  1024.00
--     12 16385.65    509990-552704         6592    108963296 13301.39      1070935    12.26  1024.00
--     13 16385.46    552705-617507         9894    108917719 13295.93      1531723    17.53  1024.00
--     14 16386.72    617508-656733         5966    108990961 13304.75       871244     9.97  1024.00
--     15 16385.59    656734-697782         6388    108950357 13299.81      1204444    13.78  1024.00
--     16 16384.41    697783-758938         9332    108933029 13297.78      1278409    14.63  1024.00
--     17 16386.14    758939-803219         6919    108976699 13303.04       970341    11.10  1024.00
--     18 16385.73    803220-843720         6259    108930635 13297.39      1427392    16.34  1024.00
--     19 16384.02    843721-892562         7680    108959485 13300.96       966236    11.06  1024.00
--     20 16384.67    892563-950653         8938    108922864 13296.53      1410803    16.15  1024.00
--     21 16385.51    950654-990678         6112    108956794 13300.58      1129946    12.93  1024.00
--     22 16384.86    990679-1034745        6893    108964275 13301.52       990931    11.34  1024.00
--     23 16385.07   1034746-1097111        9697    108908440 13294.79      1596704    18.27  1024.00
--     24 16385.33   1097112-1135789        5864    108956902 13300.59      1113769    12.75  1024.00
--     25 16386.71   1135790-1177503        6435    108974317 13302.73      1046751    11.98  1024.00
--     26 16385.52   1177504-1236983        9157    108920860 13296.29      1505614    17.23  1024.00
--     27 16385.48   1236984-1274707        5767    108977720 13303.13       904820    10.35  1024.00
--     28 16387.03   1274708-1313589        6084    108959820 13300.95      1230229    14.08  1024.00
--     29 16384.21   1313590-1367396        8290    108936997 13298.23      1221262    13.98  1024.00
--     30 16385.34   1367397-1408812        6481    108971652 13302.41       955473    10.93  1024.00
--     31 16385.31   1408813-1447275        5984    108943421 13298.95      1255592    14.37  1024.00
--     32 16384.40   1447276-1492573        7079    108966118 13301.75       930169    10.64  1024.00
--     33 16384.24   1492574-1541582        7694    108934487 13297.91      1252168    14.33  1024.00
--     34 16385.48   1541583-1578876        5862    108960162 13300.99      1091390    12.49  1024.00
--     35 16384.68   1578877-1619036        6390    108955223 13300.40      1073208    12.28  1024.00
--     36 16385.44   1619037-1674863        8553    108932312 13297.67      1378230    15.77  1024.00
--     37 16384.18   1674864-1712438        5778    108948753 13299.59      1099997    12.59  1024.00
--     38 16384.34   1712439-1752355        6283    108961061 13301.11       980999    11.23  1024.00
--     39 16384.80   1752356-1809559        8958    108921984 13296.42      1430964    16.38  1024.00
--     40  3192.80   1809560-1810241          95       987238   120.52        25021     0.29  1024.00
--   ---- -------- ------------------- --------- ------------ -------- ------------ -------- --------
--                                                 4250019983              45939902
-- Finished stage 'readErrorDetectionConfigure', reset canuIteration.
--
-- Running jobs.  First attempt out of 2.
----------------------------------------
-- Starting 'red' concurrent execution on Fri Jan 16 14:00:54 2026 with 4532133.109 GB free disk space (40 processes; 22 concurrently)

    cd unitigging/3-overlapErrorAdjustment
    ./red.sh 1 > ./red.000001.out 2>&1
    ./red.sh 2 > ./red.000002.out 2>&1
    ./red.sh 3 > ./red.000003.out 2>&1
    ./red.sh 4 > ./red.000004.out 2>&1
    ./red.sh 5 > ./red.000005.out 2>&1
    ./red.sh 6 > ./red.000006.out 2>&1
    ./red.sh 7 > ./red.000007.out 2>&1
    ./red.sh 8 > ./red.000008.out 2>&1
    ./red.sh 9 > ./red.000009.out 2>&1
    ./red.sh 10 > ./red.000010.out 2>&1
    ./red.sh 11 > ./red.000011.out 2>&1
    ./red.sh 12 > ./red.000012.out 2>&1
    ./red.sh 13 > ./red.000013.out 2>&1
    ./red.sh 14 > ./red.000014.out 2>&1
    ./red.sh 15 > ./red.000015.out 2>&1
    ./red.sh 16 > ./red.000016.out 2>&1
    ./red.sh 17 > ./red.000017.out 2>&1
    ./red.sh 18 > ./red.000018.out 2>&1
    ./red.sh 19 > ./red.000019.out 2>&1
    ./red.sh 20 > ./red.000020.out 2>&1
    ./red.sh 21 > ./red.000021.out 2>&1
    ./red.sh 22 > ./red.000022.out 2>&1
    ./red.sh 23 > ./red.000023.out 2>&1
    ./red.sh 24 > ./red.000024.out 2>&1
    ./red.sh 25 > ./red.000025.out 2>&1
    ./red.sh 26 > ./red.000026.out 2>&1
    ./red.sh 27 > ./red.000027.out 2>&1
    ./red.sh 28 > ./red.000028.out 2>&1
    ./red.sh 29 > ./red.000029.out 2>&1
    ./red.sh 30 > ./red.000030.out 2>&1
    ./red.sh 31 > ./red.000031.out 2>&1
    ./red.sh 32 > ./red.000032.out 2>&1
    ./red.sh 33 > ./red.000033.out 2>&1
    ./red.sh 34 > ./red.000034.out 2>&1
    ./red.sh 35 > ./red.000035.out 2>&1
    ./red.sh 36 > ./red.000036.out 2>&1
    ./red.sh 37 > ./red.000037.out 2>&1
    ./red.sh 38 > ./red.000038.out 2>&1
    ./red.sh 39 > ./red.000039.out 2>&1
    ./red.sh 40 > ./red.000040.out 2>&1

-- Finished on Fri Jan 16 14:10:02 2026 (548 seconds) with 4531554.125 GB free disk space
----------------------------------------
-- Found 40 read error detection output files.
-- Finished stage 'readErrorDetectionCheck', reset canuIteration.
--
-- Loading read lengths.
-- Loading number of overlaps per read.
--
-- Configure OEA for 8gb memory.
--                   Batches of at most (unlimited) reads.
--                                      300000000 bases.
--
--           Total                                               Reads                 Olaps  Adjusts
--    Job   Memory      Read Range         Reads        Bases   Memory        Olaps   Memory   Memory  (Memory in MB)
--   ---- -------- ------------------- --------- ------------ -------- ------------ -------- --------
--      1  2798.67         1-117026        18199    300001964   294.66      2881878    87.95   368.06
--      2  2810.94    117027-240816        19299    300002511   294.69      3282720   100.18   368.06
--      3  2818.27    240817-374486        20843    300005631   294.74      3521284   107.46   368.06
--      4  2812.04    374487-510601        20951    300000292   294.74      3317131   101.23   368.06
--      5  2810.94    510602-647453        20947    300004787   294.75      3281135   100.13   368.06
--      6  2812.22    647454-785186        21216    300008999   294.76      3322472   101.39   368.06
--      7  2809.59    785187-914450        20162    300001358   294.72      3237620    98.80   368.06
--      8  2803.03    914451-1036220       18795    300007544   294.68      3024041    92.29   368.06
--      9  2817.96   1036221-1167736       20281    300018615   294.74      3511481   107.16   368.06
--     10  2814.17   1167737-1295306       19604    300003691   294.70      3388234   103.40   368.06
--     11  2803.07   1295307-1419675       19367    300023923   294.72      3024197    92.29   368.06
--     12  2805.33   1419676-1543173       19295    300002489   294.69      3098960    94.57   368.06
--     13  2813.72   1543174-1667101       19404    300006785   294.70      3373639   102.96   368.06
--     14  2794.68   1667102-1779629       17450    300008321   294.64      2751585    83.97   368.06
--     15  2500.01   1779630-1810241        4817     49923073    55.76       923525    28.18   368.06
--   ---- -------- ------------------- --------- ------------ -------- ------------ -------- --------
--                                                 4250019983              45939902
-- Finished stage 'overlapErrorAdjustmentConfigure', reset canuIteration.
--
-- Running jobs.  First attempt out of 2.
----------------------------------------
-- Starting 'oea' concurrent execution on Fri Jan 16 14:10:10 2026 with 4531554.046 GB free disk space (15 processes; 62 concurrently)

    cd unitigging/3-overlapErrorAdjustment
    ./oea.sh 1 > ./oea.000001.out 2>&1
    ./oea.sh 2 > ./oea.000002.out 2>&1
    ./oea.sh 3 > ./oea.000003.out 2>&1
    ./oea.sh 4 > ./oea.000004.out 2>&1
    ./oea.sh 5 > ./oea.000005.out 2>&1
    ./oea.sh 6 > ./oea.000006.out 2>&1
    ./oea.sh 7 > ./oea.000007.out 2>&1
    ./oea.sh 8 > ./oea.000008.out 2>&1
    ./oea.sh 9 > ./oea.000009.out 2>&1
    ./oea.sh 10 > ./oea.000010.out 2>&1
    ./oea.sh 11 > ./oea.000011.out 2>&1
    ./oea.sh 12 > ./oea.000012.out 2>&1
    ./oea.sh 13 > ./oea.000013.out 2>&1
    ./oea.sh 14 > ./oea.000014.out 2>&1
    ./oea.sh 15 > ./oea.000015.out 2>&1

-- Finished on Fri Jan 16 14:31:47 2026 (1297 seconds) with 4530341.062 GB free disk space
----------------------------------------
-- Found 15 overlap error adjustment output files.
-- Finished stage 'overlapErrorAdjustmentCheck', reset canuIteration.
----------------------------------------
-- Starting command on Fri Jan 16 14:31:47 2026 with 4530341.046 GB free disk space

    cd unitigging/3-overlapErrorAdjustment
    /share/org/YZWL/yzwl_lixg/miniforge3/envs/canu_v.2.3/bin/loadErates \
      -S ../../A3-17.seqStore \
      -O ../A3-17.ovlStore \
      -L ./oea.files \
    > ./oea.apply.err 2>&1

-- Finished on Fri Jan 16 14:31:47 2026 (fast as lightning) with 4530340.937 GB free disk space
----------------------------------------
-- No report available.
-- Finished stage 'updateOverlapStore', reset canuIteration.
-- Finished stage 'unitig', reset canuIteration.
--
-- Running jobs.  First attempt out of 2.
----------------------------------------
-- Starting 'bat' concurrent execution on Fri Jan 16 14:31:47 2026 with 4530340.89 GB free disk space (1 processes; 1 concurrently)

    cd unitigging/4-unitigger
    ./unitigger.sh 1 > ./unitigger.000001.out 2>&1

-- Finished on Fri Jan 16 14:32:02 2026 (15 seconds) with 4530183.109 GB free disk space
----------------------------------------
-- Unitigger finished successfully.
--  
--  ERROR RATES
--  -----------
--                                                   --------threshold------
--  303788                       fraction error      fraction        percent
--  samples                              (1e-5)         error          error
--                   --------------------------      --------       --------
--  command line (-eg)                           ->     30.00        0.0300%
--  command line (-ef)                           ->  -----.--      ---.----%
--  command line (-eM)                           ->     30.00        0.0300%
--  mean + std.dev       0.38 +-  12 *     2.70  ->     32.79        0.0328%
--  median + mad         0.00 +-  12 *     0.00  ->      0.00        0.0000%
--  90th percentile                              ->      1.00        0.0010%  (enabled)
--  
--  BEST EDGE FILTERING
--  -------------------
--  At graph threshold 0.0300%, reads:
--    available to have edges:        48713
--    with at least one edge:         37454
--  
--  At max threshold 0.0300%, reads:
--    available to have edges:        48713
--    with at least one edge:         37454
--  
--  At tight threshold 0.0010%, reads with:
--    both edges below error threshold:     31639  (80.00% minReadsBest threshold = 29963)
--    one  edge  above error threshold:      4383
--    both edges above error threshold:      1432
--    at least one edge:                    37454
--  
--  At loose threshold 0.0300%, reads with:
--    both edges below error threshold:     37454  (80.00% minReadsBest threshold = 29963)
--    one  edge  above error threshold:         0
--    both edges above error threshold:         0
--    at least one edge:                    37454
--  
--  
--  INITIAL EDGES
--  -------- ----------------------------------------
--    226023 reads are contained
--   1549363 reads have no best edges (singleton)
--       291 reads have only one best edge (spur) 
--                144 are mutual best
--     34564 reads have two best edges 
--               1304 have one mutual best edge
--              32921 have two mutual best edges
--  
--  
--  FINAL EDGES
--  -------- ----------------------------------------
--    226023 reads are contained
--   1549678 reads have no best edges (singleton)
--       203 reads have only one best edge (spur) 
--                159 are mutual best
--     34337 reads have two best edges 
--               1173 have one mutual best edge
--              32896 have two mutual best edges
--  
--  
--  EDGE FILTERING
--  -------- ------------------------------------------
--         0 reads are ignored
--      8421 reads have a gap in overlap coverage
--       167 reads have lopsided best edges
-- Found, in version 1, after unitig construction:
--   contigs:      115 sequences, total length 71369870 bp (including 194 repeats of total length 8795809 bp).
--   bubbles:      466 sequences, total length 26139794 bp.
--   unassembled:  20266 sequences, total length 227123031 bp.
--
-- Contig sizes based on genome size 85mbp:
--
--            NG (bp)  LG (contigs)    sum (bp)
--         ----------  ------------  ----------
--     10     8871066             1     8871066
--     20     8552188             2    17423254
--     30     6430323             4    30324715
--     40     5932726             5    36257441
--     50     2313222             7    42538867
--     60     2265666            11    51657802
--     70     1259095            17    60613722
--     80      312543            28    68152026
--
-- Finished stage 'unitigCheck', reset canuIteration.
----------------------------------------
-- Starting command on Fri Jan 16 14:32:02 2026 with 4530183.093 GB free disk space

    cd unitigging
    /share/org/YZWL/yzwl_lixg/miniforge3/envs/canu_v.2.3/bin/utgcns \
      -S ../A3-17.seqStore \
      -T  ./A3-17.ctgStore 1 \
      -partition 0.8 1.5 0.1 \
    > ./A3-17.ctgStore/partitioning.log 2>&1

-- Finished on Fri Jan 16 14:32:11 2026 (9 seconds) with 4530181.921 GB free disk space
----------------------------------------
-- Using slow alignment for consensus (iteration '0').
-- Configured 10 consensus jobs.
-- Finished stage 'consensusConfigure', reset canuIteration.
--
-- Local: cns       13.125 GB    8 CPUs x  11 jobs   144.375 GB  88 CPUs  (consensus)
--
--
-- Running jobs.  First attempt out of 2.
----------------------------------------
-- Starting 'cns' concurrent execution on Fri Jan 16 14:32:11 2026 with 4530181.89 GB free disk space (10 processes; 11 concurrently)

    cd unitigging/5-consensus
    ./consensus.sh 1 > ./consensus.000001.out 2>&1
    ./consensus.sh 2 > ./consensus.000002.out 2>&1
    ./consensus.sh 3 > ./consensus.000003.out 2>&1
    ./consensus.sh 4 > ./consensus.000004.out 2>&1
    ./consensus.sh 5 > ./consensus.000005.out 2>&1
    ./consensus.sh 6 > ./consensus.000006.out 2>&1
    ./consensus.sh 7 > ./consensus.000007.out 2>&1
    ./consensus.sh 8 > ./consensus.000008.out 2>&1
    ./consensus.sh 9 > ./consensus.000009.out 2>&1
    ./consensus.sh 10 > ./consensus.000010.out 2>&1

-- Finished on Fri Jan 16 14:39:48 2026 (457 seconds) with 4529233.015 GB free disk space
----------------------------------------
-- Using slow alignment for consensus (iteration '1').
-- Configured 10 consensus jobs.
-- All 10 consensus jobs finished successfully.
-- Finished stage 'consensusCheck', reset canuIteration.
-- Using slow alignment for consensus (iteration '0').
-- Configured 10 consensus jobs.
----------------------------------------
-- Starting command on Fri Jan 16 14:39:48 2026 with 4529232.953 GB free disk space

    cd unitigging
    /share/org/YZWL/yzwl_lixg/miniforge3/envs/canu_v.2.3/bin/tgStoreLoad \
      -S ../A3-17.seqStore \
      -T  ./A3-17.ctgStore 2 \
      -L ./5-consensus/ctgcns.files \
    > ./5-consensus/ctgcns.files.ctgStoreLoad.err 2>&1

-- Finished on Fri Jan 16 14:39:49 2026 (one second) with 4529232.062 GB free disk space
----------------------------------------
----------------------------------------
-- Starting command on Fri Jan 16 14:39:49 2026 with 4529232.062 GB free disk space

    cd unitigging
    /share/org/YZWL/yzwl_lixg/miniforge3/envs/canu_v.2.3/bin/tgTigDisplay \
      -S ../A3-17.seqStore \
      -b \
      -o ../A3-17.contigs.unsorted.bam \
      -L ./5-consensus/ctgcns.files \
    > ./5-consensus/ctgcns.files.contigs.bam.err 2>&1

-- Finished on Fri Jan 16 14:43:05 2026 (196 seconds) with 4529139.406 GB free disk space
----------------------------------------
----------------------------------------
-- Starting command on Fri Jan 16 14:43:05 2026 with 4529139.406 GB free disk space

    cd .
    samtools sort \
      --write-index \
      --threads 2 \
      -o ./A3-17.contigs.bam ./A3-17.contigs.unsorted.bam \
    > ./ctgcns.bam.err 2>&1

-- Finished on Fri Jan 16 14:44:03 2026 (58 seconds) with 4529097.734 GB free disk space
----------------------------------------
-- Purging consensus output after loading to ctgStore.
-- Purged 10 .cns outputs.
----------------------------------------
-- Starting command on Fri Jan 16 14:44:03 2026 with 4529098.828 GB free disk space

    cd unitigging
    /share/org/YZWL/yzwl_lixg/miniforge3/envs/canu_v.2.3/bin/tgStoreDump \
      -S ../A3-17.seqStore \
      -T ./A3-17.ctgStore 2 \
      -sizes -s 85000000 \
    > ./A3-17.ctgStore/seqDB.v002.sizes.txt
ZERO length suplied to intervalList::add(), ignoring interval.
ZERO length suplied to intervalList::add(), ignoring interval.
ZERO length suplied to intervalList::add(), ignoring interval.
ZERO length suplied to intervalList::add(), ignoring interval.
ZERO length suplied to intervalList::add(), ignoring interval.
ZERO length suplied to intervalList::add(), ignoring interval.
ZERO length suplied to intervalList::add(), ignoring interval.
ZERO length suplied to intervalList::add(), ignoring interval.
ZERO length suplied to intervalList::add(), ignoring interval.
ZERO length suplied to intervalList::add(), ignoring interval.
ZERO length suplied to intervalList::add(), ignoring interval.
ZERO length suplied to intervalList::add(), ignoring interval.
ZERO length suplied to intervalList::add(), ignoring interval.
ZERO length suplied to intervalList::add(), ignoring interval.
ZERO length suplied to intervalList::add(), ignoring interval.
ZERO length suplied to intervalList::add(), ignoring interval.
ZERO length suplied to intervalList::add(), ignoring interval.
ZERO length suplied to intervalList::add(), ignoring interval.
ZERO length suplied to intervalList::add(), ignoring interval.
ZERO length suplied to intervalList::add(), ignoring interval.
ZERO length suplied to intervalList::add(), ignoring interval.
ZERO length suplied to intervalList::add(), ignoring interval.
ZERO length suplied to intervalList::add(), ignoring interval.
ZERO length suplied to intervalList::add(), ignoring interval.
ZERO length suplied to intervalList::add(), ignoring interval.
ZERO length suplied to intervalList::add(), ignoring interval.

-- Finished on Fri Jan 16 14:44:05 2026 (2 seconds) with 4529098.828 GB free disk space
----------------------------------------
-- Found, in version 2, after consensus generation:
--   contigs:      115 sequences, total length 93143713 bp (including 194 repeats of total length 11669914 bp).
--   bubbles:      466 sequences, total length 34169476 bp.
--   unassembled:  20266 sequences, total length 309364165 bp.
--
-- Contig sizes based on genome size 85mbp:
--
--            NG (bp)  LG (contigs)    sum (bp)
--         ----------  ------------  ----------
--     10    11530583             1    11530583
--     20    11118188             2    22648771
--     30     8400351             3    31049122
--     40     8355090             4    39404212
--     50     7734108             5    47138320
--     60     5181427             6    52319747
--     70     2964322             9    61324190
--     80     2784045            12    70028526
--     90     1649047            16    77275451
--    100      987724            22    85368100
--
-- Finished stage 'consensusLoad', reset canuIteration.
----------------------------------------
-- Starting command on Fri Jan 16 14:44:05 2026 with 4529098.812 GB free disk space

    cd .
    /share/org/YZWL/yzwl_lixg/miniforge3/envs/canu_v.2.3/bin/tgStoreDump \
      -S ./A3-17.seqStore \
      -T ./unitigging/A3-17.ctgStore 2 \
      -o ./A3-17.contigs \
      -layout \
    > ./A3-17.contigs.layout.err 2>&1

-- Finished on Fri Jan 16 14:44:05 2026 (fast as lightning) with 4529098.781 GB free disk space
----------------------------------------
----------------------------------------
-- Starting command on Fri Jan 16 14:44:05 2026 with 4529098.781 GB free disk space

    cd .
    /share/org/YZWL/yzwl_lixg/miniforge3/envs/canu_v.2.3/bin/tgStoreDump \
      -S ./A3-17.seqStore \
      -T ./unitigging/A3-17.ctgStore 2 \
      -consensus -fasta \
      -unassembled \
    > ./A3-17.unassembled.fasta
    2> ./A3-17.unassembled.err
ZERO length suplied to intervalList::add(), ignoring interval.
ZERO length suplied to intervalList::add(), ignoring interval.
ZERO length suplied to intervalList::add(), ignoring interval.
ZERO length suplied to intervalList::add(), ignoring interval.
ZERO length suplied to intervalList::add(), ignoring interval.
ZERO length suplied to intervalList::add(), ignoring interval.
ZERO length suplied to intervalList::add(), ignoring interval.
ZERO length suplied to intervalList::add(), ignoring interval.
ZERO length suplied to intervalList::add(), ignoring interval.
ZERO length suplied to intervalList::add(), ignoring interval.
ZERO length suplied to intervalList::add(), ignoring interval.
ZERO length suplied to intervalList::add(), ignoring interval.
ZERO length suplied to intervalList::add(), ignoring interval.
ZERO length suplied to intervalList::add(), ignoring interval.
ZERO length suplied to intervalList::add(), ignoring interval.
ZERO length suplied to intervalList::add(), ignoring interval.
ZERO length suplied to intervalList::add(), ignoring interval.
ZERO length suplied to intervalList::add(), ignoring interval.
ZERO length suplied to intervalList::add(), ignoring interval.
ZERO length suplied to intervalList::add(), ignoring interval.
ZERO length suplied to intervalList::add(), ignoring interval.
ZERO length suplied to intervalList::add(), ignoring interval.
ZERO length suplied to intervalList::add(), ignoring interval.
ZERO length suplied to intervalList::add(), ignoring interval.
ZERO length suplied to intervalList::add(), ignoring interval.
ZERO length suplied to intervalList::add(), ignoring interval.

-- Finished on Fri Jan 16 14:44:07 2026 (2 seconds) with 4529098.484 GB free disk space
----------------------------------------
----------------------------------------
-- Starting command on Fri Jan 16 14:44:07 2026 with 4529098.484 GB free disk space

    cd .
    /share/org/YZWL/yzwl_lixg/miniforge3/envs/canu_v.2.3/bin/tgStoreDump \
      -S ./A3-17.seqStore \
      -T ./unitigging/A3-17.ctgStore 2 \
      -consensus -fasta \
      -contigs \
    > ./A3-17.contigs.fasta
    2> ./A3-17.contigs.err
ZERO length suplied to intervalList::add(), ignoring interval.
ZERO length suplied to intervalList::add(), ignoring interval.
ZERO length suplied to intervalList::add(), ignoring interval.
ZERO length suplied to intervalList::add(), ignoring interval.
ZERO length suplied to intervalList::add(), ignoring interval.
ZERO length suplied to intervalList::add(), ignoring interval.
ZERO length suplied to intervalList::add(), ignoring interval.
ZERO length suplied to intervalList::add(), ignoring interval.
ZERO length suplied to intervalList::add(), ignoring interval.
ZERO length suplied to intervalList::add(), ignoring interval.
ZERO length suplied to intervalList::add(), ignoring interval.
ZERO length suplied to intervalList::add(), ignoring interval.
ZERO length suplied to intervalList::add(), ignoring interval.
ZERO length suplied to intervalList::add(), ignoring interval.
ZERO length suplied to intervalList::add(), ignoring interval.
ZERO length suplied to intervalList::add(), ignoring interval.
ZERO length suplied to intervalList::add(), ignoring interval.
ZERO length suplied to intervalList::add(), ignoring interval.
ZERO length suplied to intervalList::add(), ignoring interval.
ZERO length suplied to intervalList::add(), ignoring interval.
ZERO length suplied to intervalList::add(), ignoring interval.
ZERO length suplied to intervalList::add(), ignoring interval.
ZERO length suplied to intervalList::add(), ignoring interval.
ZERO length suplied to intervalList::add(), ignoring interval.
ZERO length suplied to intervalList::add(), ignoring interval.
ZERO length suplied to intervalList::add(), ignoring interval.

-- Finished on Fri Jan 16 14:44:08 2026 (one second) with 4529098.359 GB free disk space
----------------------------------------
-- Finished stage 'generateOutputs', reset canuIteration.
--
-- Assembly 'A3-17' finished in '/share/org/YZWL/yzwl_lixg/project/28.大豆疫霉菌三代基因组/03.hicanu/A3-17/01.raw_output'.
--
-- Summary saved in 'A3-17.report'.
--
-- Sequences saved:
--   Contigs       -> 'A3-17.contigs.fasta'
--   Unassembled   -> 'A3-17.unassembled.fasta'
--
-- Read layouts saved:
--   Contigs       -> 'A3-17.contigs.layout'.
--
-- Bye.

2026-01-16 14:44:08.203 - WARNING - 输出文件不存在|Output file does not exist: /share/org/YZWL/yzwl_lixg/project/28.大豆疫霉菌三代基因组/03.hicanu/A3-17/01.raw_output/A3-17.unitigs.fasta
Job 68889953 stderr output:

