Usage: biopytools ragtag [OPTIONS]
Try 'biopytools ragtag -h' for help.

Error: Invalid value for '-r' / '--reference': 文件不存在|File does not exist: /share/org/YZWL/yzwl_lixg/project/28.大豆疫霉菌三代基因组/04.ragtag/Psoja_T2T.fa
Usage: biopytools genomesyn [OPTIONS]
Try 'biopytools genomesyn -h' for help.

Error: Invalid value for '-i' / '--ref': Path '04.ragtag/B4-18/hifiasm/B4-18_RagTag_scaffolded.fa' does not exist.
2026-01-16 03:54:57.061 - WARNING - 命令错误输出|Command stderr:
-- canu master +27 changes (r10515 2a41e933b8de6ed66723d75d36dd071b46d2c347)
--
-- CITATIONS
--
-- For assemblies of PacBio HiFi reads:
--   Nurk S, Walenz BP, Rhiea A, Vollger MR, Logsdon GA, Grothe R, Miga KH, Eichler EE, Phillippy AM, Koren S.
--   HiCanu: accurate assembly of segmental duplications, satellites, and allelic variants from high-fidelity long reads.
--   biorXiv. 2020.
--   https://doi.org/10.1101/2020.03.14.992248
-- 
-- Read and contig alignments during correction and consensus use:
--   Šošic M, Šikic M.
--   Edlib: a C/C ++ library for fast, exact sequence alignment using edit distance.
--   Bioinformatics. 2017 May 1;33(9):1394-1395.
--   http://doi.org/10.1093/bioinformatics/btw753
-- 
-- Overlaps are generated using:
--   Berlin K, et al.
--   Assembling large genomes with single-molecule sequencing and locality-sensitive hashing.
--   Nat Biotechnol. 2015 Jun;33(6):623-30.
--   http://doi.org/10.1038/nbt.3238
-- 
--   Myers EW, et al.
--   A Whole-Genome Assembly of Drosophila.
--   Science. 2000 Mar 24;287(5461):2196-204.
--   http://doi.org/10.1126/science.287.5461.2196
-- 
-- Contig consensus sequences are generated using an algorithm derived from pbdagcon:
--   Chin CS, et al.
--   Nonhybrid, finished microbial genome assemblies from long-read SMRT sequencing data.
--   Nat Methods. 2013 Jun;10(6):563-9
--   http://doi.org/10.1038/nmeth.2474
-- 
-- CONFIGURE CANU
--
-- Detected Java(TM) Runtime Environment '17.0.15-internal' (from '/share/org/YZWL/yzwl_lixg/.local/bin/java') without -d64 support.
--
-- WARNING:
-- WARNING:  Failed to run gnuplot using command 'gnuplot'.
-- WARNING:  Plots will be disabled.
-- WARNING:
--
-- Detected samtools version '1.22' / htslib version 'htscodecs=1.6.3' (from 'samtools').
--
-- Detected 88 CPUs and 503 gigabytes of memory on the local machine.
--
-- Detected Slurm with 'sinfo' binary in /opt/skyformai/bin/sinfo.
--          Slurm disabled by useGrid=false
--
-- Detected  '' with 'pbsnodes' binary in /opt/skyformai/bin/pbsnodes.
--           disabled by useGrid=false
--
-- Detected LSF with 'bsub' binary in /opt/skyformai/bin/bsub.
--          LSF disabled by useGrid=false
--
-- Local machine mode enabled; grid support not detected or not allowed.
--
-- Found trimmed raw PacBio HiFi reads in the input files.
--
--                                (tag)Concurrency
--                         (tag)Threads          |
--                (tag)Memory         |          |
--        (tag)             |         |          |       total usage      algorithm
--        -------  ----------  --------   --------  --------------------  -----------------------------
-- Local: meryl     12.000 GB    4 CPUs x  22 jobs   264.000 GB  88 CPUs  (k-mer counting)
-- Local: cormhap   13.000 GB   11 CPUs x   8 jobs   104.000 GB  88 CPUs  (overlap detection with mhap)
-- Local: obtovl     8.000 GB    8 CPUs x  11 jobs    88.000 GB  88 CPUs  (overlap detection)
-- Local: utgovl     8.000 GB    8 CPUs x  11 jobs    88.000 GB  88 CPUs  (overlap detection)
-- Local: cor        -.--- GB    4 CPUs x   - jobs     -.--- GB   - CPUs  (read correction)
-- Local: ovb        4.000 GB    1 CPU  x  88 jobs   352.000 GB  88 CPUs  (overlap store bucketizer)
-- Local: ovs        8.000 GB    1 CPU  x  62 jobs   496.000 GB  62 CPUs  (overlap store sorting)
-- Local: red       16.000 GB    4 CPUs x  22 jobs   352.000 GB  88 CPUs  (read error detection)
-- Local: oea        8.000 GB    1 CPU  x  62 jobs   496.000 GB  62 CPUs  (overlap error adjustment)
-- Local: bat       32.000 GB    8 CPUs x   1 job     32.000 GB   8 CPUs  (contig construction with bogart)
-- Local: cns        -.--- GB    8 CPUs x   - jobs     -.--- GB   - CPUs  (consensus)
--
-- Generating assembly 'B4-18' in '/share/org/YZWL/yzwl_lixg/project/28.大豆疫霉菌三代基因组/03.hicanu/B4-18/01.raw_output':
--   genomeSize:
--     85000000
--
--   Overlap Generation Limits:
--     corOvlErrorRate 0.0000 (  0.00%)
--     obtOvlErrorRate 0.0250 (  2.50%)
--     utgOvlErrorRate 0.0100 (  1.00%)
--
--   Overlap Processing Limits:
--     corErrorRate    0.0000 (  0.00%)
--     obtErrorRate    0.0250 (  2.50%)
--     utgErrorRate    0.0003 (  0.03%)
--     cnsErrorRate    0.0500 (  5.00%)
--
--   Stages to run:
--     assemble HiFi reads.
--
--
-- BEGIN STORE CREATION
----------------------------------------
-- Starting command on Fri Jan 16 00:50:54 2026 with 4560031.656 GB free disk space

    cd .
    ./B4-18.seqStore.sh \
    > ./B4-18.seqStore.err 2>&1

-- Finished on Fri Jan 16 00:58:55 2026 (481 seconds) with 4558667.031 GB free disk space
----------------------------------------
--
-- In sequence store './B4-18.seqStore':
--   Found 258139 reads.
--   Found 4250010476 bases (50 times coverage).
--    Histogram of corrected reads:
--    
--    G=4250010476                       sum of  ||               length     num
--    NG         length     index       lengths  ||                range    seqs
--    ----- ------------ --------- ------------  ||  ------------------- -------
--    00010        24148     16087    425016929  ||       1258-2212         2559|------
--    00020        21816     34679    850021401  ||       2213-3167         4274|----------
--    00030        20242     54940   1275020138  ||       3168-4122         4347|----------
--    00040        19015     76622   1700021800  ||       4123-5077         4126|---------
--    00050        17978     99618   2125008349  ||       5078-6032         3896|---------
--    00060        17063    123892   2550016104  ||       6033-6987         3656|--------
--    00070        16217    149443   2975016164  ||       6988-7942         3536|--------
--    00080        15314    176381   3400023408  ||       7943-8897         3476|--------
--    00090        13796    205382   3825010732  ||       8898-9852         3192|-------
--    00100         1258    258139   4250010476  ||       9853-10807        2936|-------
--    001.000x              258139   4250010476  ||      10808-11762        3018|-------
--                                               ||      11763-12717        4287|----------
--                                               ||      12718-13672        8002|------------------
--                                               ||      13673-14627       14482|--------------------------------
--                                               ||      14628-15582       23499|---------------------------------------------------
--                                               ||      15583-16537       29333|---------------------------------------------------------------
--                                               ||      16538-17492       27516|------------------------------------------------------------
--                                               ||      17493-18447       23286|---------------------------------------------------
--                                               ||      18448-19402       19541|------------------------------------------
--                                               ||      19403-20357       16011|-----------------------------------
--                                               ||      20358-21312       12863|----------------------------
--                                               ||      21313-22267       10225|----------------------
--                                               ||      22268-23222        8024|------------------
--                                               ||      23223-24177        6138|--------------
--                                               ||      24178-25132        4863|-----------
--                                               ||      25133-26087        3592|--------
--                                               ||      26088-27042        2571|------
--                                               ||      27043-27997        1811|----
--                                               ||      27998-28952        1266|---
--                                               ||      28953-29907         781|--
--                                               ||      29908-30862         508|--
--                                               ||      30863-31817         257|-
--                                               ||      31818-32772         149|-
--                                               ||      32773-33727          77|-
--                                               ||      33728-34682          30|-
--                                               ||      34683-35637           5|-
--                                               ||      35638-36592           2|-
--                                               ||      36593-37547           1|-
--                                               ||      37548-38502           2|-
--                                               ||      38503-39457           1|-
--    
--
-- In sequence store './B4-18.seqStore':
--   Found 258139 reads.
--   Found 4250010476 bases (50 times coverage).
--    Histogram of corrected-trimmed reads:
--    
--    G=4250010476                       sum of  ||               length     num
--    NG         length     index       lengths  ||                range    seqs
--    ----- ------------ --------- ------------  ||  ------------------- -------
--    00010        24148     16087    425016929  ||       1258-2212         2559|------
--    00020        21816     34679    850021401  ||       2213-3167         4274|----------
--    00030        20242     54940   1275020138  ||       3168-4122         4347|----------
--    00040        19015     76622   1700021800  ||       4123-5077         4126|---------
--    00050        17978     99618   2125008349  ||       5078-6032         3896|---------
--    00060        17063    123892   2550016104  ||       6033-6987         3656|--------
--    00070        16217    149443   2975016164  ||       6988-7942         3536|--------
--    00080        15314    176381   3400023408  ||       7943-8897         3476|--------
--    00090        13796    205382   3825010732  ||       8898-9852         3192|-------
--    00100         1258    258139   4250010476  ||       9853-10807        2936|-------
--    001.000x              258139   4250010476  ||      10808-11762        3018|-------
--                                               ||      11763-12717        4287|----------
--                                               ||      12718-13672        8002|------------------
--                                               ||      13673-14627       14482|--------------------------------
--                                               ||      14628-15582       23499|---------------------------------------------------
--                                               ||      15583-16537       29333|---------------------------------------------------------------
--                                               ||      16538-17492       27516|------------------------------------------------------------
--                                               ||      17493-18447       23286|---------------------------------------------------
--                                               ||      18448-19402       19541|------------------------------------------
--                                               ||      19403-20357       16011|-----------------------------------
--                                               ||      20358-21312       12863|----------------------------
--                                               ||      21313-22267       10225|----------------------
--                                               ||      22268-23222        8024|------------------
--                                               ||      23223-24177        6138|--------------
--                                               ||      24178-25132        4863|-----------
--                                               ||      25133-26087        3592|--------
--                                               ||      26088-27042        2571|------
--                                               ||      27043-27997        1811|----
--                                               ||      27998-28952        1266|---
--                                               ||      28953-29907         781|--
--                                               ||      29908-30862         508|--
--                                               ||      30863-31817         257|-
--                                               ||      31818-32772         149|-
--                                               ||      32773-33727          77|-
--                                               ||      33728-34682          30|-
--                                               ||      34683-35637           5|-
--                                               ||      35638-36592           2|-
--                                               ||      36593-37547           1|-
--                                               ||      37548-38502           2|-
--                                               ||      38503-39457           1|-
--    
--
-- Correction skipped; not enabled.
--
-- Trimming skipped; not enabled.
--
-- BEGIN ASSEMBLY
----------------------------------------
-- Starting command on Fri Jan 16 00:58:56 2026 with 4558666.984 GB free disk space

    cd unitigging/0-mercounts
    ./meryl-configure.sh \
    > ./meryl-configure.err 2>&1

-- Finished on Fri Jan 16 00:58:57 2026 (one second) with 4558666.984 GB free disk space
----------------------------------------
--  segments   memory batches
--  -------- -------- -------
--        01 10.72 GB       2
--        02  5.68 GB       2
--        04  2.94 GB       2
--        06  2.12 GB       2
--        08  1.60 GB       2
--        12  1.06 GB       2
--        16  0.80 GB       2
--        20  0.64 GB       2
--        24  0.54 GB       2
--        32  0.40 GB       2
--        40  0.32 GB       2
--        48  -.-- GB       -  (segment size too small)
--        56  -.-- GB       -  (segment size too small)
--        64  -.-- GB       -  (segment size too small)
--        96  -.-- GB       -  (segment size too small)
--
--  For 258139 reads with 4250010476 bases, limit to 42 batches.
--  Will count kmers using 01 jobs, each using 12 GB and 4 threads.
--
-- Finished stage 'merylConfigure', reset canuIteration.
--
-- Running jobs.  First attempt out of 2.
----------------------------------------
-- Starting 'meryl' concurrent execution on Fri Jan 16 00:58:57 2026 with 4558666.953 GB free disk space (1 processes; 22 concurrently)

    cd unitigging/0-mercounts
    ./meryl-count.sh 1 > ./meryl-count.000001.out 2>&1

-- Finished on Fri Jan 16 01:02:19 2026 (202 seconds) with 4558276.484 GB free disk space
----------------------------------------
-- Found 1 Kmer counting (meryl) outputs.
-- Finished stage 'utg-merylCountCheck', reset canuIteration.
--
-- Running jobs.  First attempt out of 2.
----------------------------------------
-- Starting 'meryl' concurrent execution on Fri Jan 16 01:02:19 2026 with 4558276.453 GB free disk space (1 processes; 22 concurrently)

    cd unitigging/0-mercounts
    ./meryl-process.sh 1 > ./meryl-process.000001.out 2>&1

-- Finished on Fri Jan 16 01:02:23 2026 (4 seconds) with 4558276.031 GB free disk space
----------------------------------------
-- Meryl finished successfully.  Kmer frequency histogram:
--
-- WARNING: gnuplot failed.
--
----------------------------------------
--
--  22-mers                                                                                           Fraction
--    Occurrences   NumMers                                                                         Unique Total
--       1-     1         0                                                                        0.0000 0.0000
--       2-     2    232631                                                                        0.0052 0.0001
--       3-     4     92782                                                                        0.0066 0.0002
--       5-     7     31182                                                                        0.0076 0.0003
--       8-    11     13176                                                                        0.0080 0.0003
--      12-    16     16806                                                                        0.0083 0.0004
--      17-    22    138062                                                                        0.0088 0.0005
--      23-    29   1373997 *****                                                                  0.0132 0.0018
--      30-    37   8165767 *******************************                                        0.0527 0.0174
--      38-    46  18137107 ********************************************************************** 0.2629 0.1220
--      47-    56  10549982 ****************************************                               0.6658 0.3660
--      57-    67   1597129 ******                                                                 0.8689 0.5128
--      68-    79    758069 **                                                                     0.8978 0.5376
--      80-    92   1033950 ***                                                                    0.9152 0.5561
--      93-   106    608982 **                                                                     0.9381 0.5841
--     107-   121    269993 *                                                                      0.9505 0.6015
--     122-   137    300506 *                                                                      0.9564 0.6111
--     138-   154    225423                                                                        0.9631 0.6233
--     155-   172    166180                                                                        0.9679 0.6332
--     173-   191    150951                                                                        0.9716 0.6418
--     192-   211    115411                                                                        0.9749 0.6502
--     212-   232    115961                                                                        0.9775 0.6577
--     233-   254     91784                                                                        0.9800 0.6656
--     255-   277     81187                                                                        0.9820 0.6725
--     278-   301     71949                                                                        0.9838 0.6793
--     302-   326     66212                                                                        0.9854 0.6858
--     327-   352     49813                                                                        0.9868 0.6922
--     353-   379     41977                                                                        0.9879 0.6975
--     380-   407     37362                                                                        0.9889 0.7023
--     408-   436     35480                                                                        0.9897 0.7069
--     437-   466     28878                                                                        0.9905 0.7116
--     467-   497     26284                                                                        0.9911 0.7156
--     498-   529     23173                                                                        0.9917 0.7196
--     530-   562     19731                                                                        0.9922 0.7233
--     563-   596     18243                                                                        0.9927 0.7267
--     597-   631     18401                                                                        0.9931 0.7300
--     632-   667     15981                                                                        0.9935 0.7335
--     668-   704     15476                                                                        0.9938 0.7368
--     705-   742     14642                                                                        0.9942 0.7401
--     743-   781     12676                                                                        0.9945 0.7434
--     782-   821     11761                                                                        0.9948 0.7464
--
--           0 (max occurrences)
--  3189534313 (total mers, non-unique)
--    44999301 (distinct mers, non-unique)
--           0 (unique mers)
-- Finished stage 'meryl-process', reset canuIteration.
--
-- Removing meryl database 'unitigging/0-mercounts/B4-18.ms22'.
--
-- OVERLAPPER (normal) (assembly) erate=0.01
--
----------------------------------------
-- Starting command on Fri Jan 16 01:02:23 2026 with 4558277.015 GB free disk space

    cd unitigging/1-overlapper
    /share/org/YZWL/yzwl_lixg/miniforge3/envs/canu_v.2.3/bin/overlapInCorePartition \
     -S  ../../B4-18.seqStore \
     -hl 160000000 \
     -rl 5000000000 \
     -ol 500 \
     -o  ./B4-18.partition \
    > ./B4-18.partition.err 2>&1

-- Finished on Fri Jan 16 01:02:23 2026 (furiously fast) with 4558277 GB free disk space
----------------------------------------
--
-- Configured 21 overlapInCore jobs.
-- Finished stage 'utg-overlapConfigure', reset canuIteration.
--
-- Running jobs.  First attempt out of 2.
----------------------------------------
-- Starting 'utgovl' concurrent execution on Fri Jan 16 01:02:23 2026 with 4558276.968 GB free disk space (21 processes; 11 concurrently)

    cd unitigging/1-overlapper
    ./overlap.sh 1 > ./overlap.000001.out 2>&1
    ./overlap.sh 2 > ./overlap.000002.out 2>&1
    ./overlap.sh 3 > ./overlap.000003.out 2>&1
    ./overlap.sh 4 > ./overlap.000004.out 2>&1
    ./overlap.sh 5 > ./overlap.000005.out 2>&1
    ./overlap.sh 6 > ./overlap.000006.out 2>&1
    ./overlap.sh 7 > ./overlap.000007.out 2>&1
    ./overlap.sh 8 > ./overlap.000008.out 2>&1
    ./overlap.sh 9 > ./overlap.000009.out 2>&1
    ./overlap.sh 10 > ./overlap.000010.out 2>&1
    ./overlap.sh 11 > ./overlap.000011.out 2>&1
    ./overlap.sh 12 > ./overlap.000012.out 2>&1
    ./overlap.sh 13 > ./overlap.000013.out 2>&1
    ./overlap.sh 14 > ./overlap.000014.out 2>&1
    ./overlap.sh 15 > ./overlap.000015.out 2>&1
    ./overlap.sh 16 > ./overlap.000016.out 2>&1
    ./overlap.sh 17 > ./overlap.000017.out 2>&1
    ./overlap.sh 18 > ./overlap.000018.out 2>&1
    ./overlap.sh 19 > ./overlap.000019.out 2>&1
    ./overlap.sh 20 > ./overlap.000020.out 2>&1
    ./overlap.sh 21 > ./overlap.000021.out 2>&1

-- Finished on Fri Jan 16 02:04:22 2026 (3719 seconds) with 4558958.718 GB free disk space
----------------------------------------
-- Found 21 overlapInCore output files.
--
-- overlapInCore compute 'unitigging/1-overlapper':
--   kmer hits
--     with no overlap       1280263160  12.3809524 +- 38805071.508
--     with an overlap         28478969  1.38095238 +- 934138.15
--
--   overlaps                  28478969  1.38095238 +- 934138.15
--     contained                5682068  .666666667 +- 183920.626
--     dovetail                22796901  6.71428571 +- 751389.054
--
--   overlaps rejected
--     multiple per pair              0           0 +- 0
--     bad short window               0           0 +- 0
--     bad long window                0           0 +- 0
-- Finished stage 'utg-overlapCheck', reset canuIteration.
----------------------------------------
-- Starting command on Fri Jan 16 02:04:22 2026 with 4558958.703 GB free disk space

    cd unitigging
    /share/org/YZWL/yzwl_lixg/miniforge3/envs/canu_v.2.3/bin/ovStoreConfig \
     -S ../B4-18.seqStore \
     -M 4-8 \
     -L ./1-overlapper/ovljob.files \
     -create ./B4-18.ovlStore.config \
     > ./B4-18.ovlStore.config.txt \
    2> ./B4-18.ovlStore.config.err

-- Finished on Fri Jan 16 02:04:22 2026 (fast as lightning) with 4558958.687 GB free disk space
----------------------------------------
--
-- Creating overlap store unitigging/B4-18.ovlStore using:
--      1 bucket
--      1 slice
--        using at most 3 GB memory each
--
-- Running jobs.  First attempt out of 2.
----------------------------------------
-- Starting 'ovS' concurrent execution on Fri Jan 16 02:04:22 2026 with 4558958.671 GB free disk space (1 processes; 62 concurrently)

    cd unitigging
    ./B4-18.ovlStore.sh 1 > ./B4-18.ovlStore.000001.out 2>&1

-- Finished on Fri Jan 16 02:04:35 2026 (13 seconds) with 4558910.75 GB free disk space
----------------------------------------
-- Checking store.
----------------------------------------
-- Starting command on Fri Jan 16 02:04:35 2026 with 4558910.75 GB free disk space

    cd unitigging
    /share/org/YZWL/yzwl_lixg/miniforge3/envs/canu_v.2.3/bin/ovStoreDump \
     -S ../B4-18.seqStore \
     -O  ./B4-18.ovlStore \
     -counts \
     > ./B4-18.ovlStore/counts.dat 2> ./B4-18.ovlStore/counts.err

-- Finished on Fri Jan 16 02:04:36 2026 (one second) with 4558910.718 GB free disk space
----------------------------------------
--
-- Overlap store 'unitigging/B4-18.ovlStore' successfully constructed.
-- Found 56957938 overlaps for 241423 reads; 1652321 reads have no overlaps.
--
--
-- Purged 0.65 GB in 63 overlap output files.
----------------------------------------
-- Starting command on Fri Jan 16 02:04:37 2026 with 4558910.718 GB free disk space

    cd unitigging
    /share/org/YZWL/yzwl_lixg/miniforge3/envs/canu_v.2.3/bin/ovStoreStats \
     -C 50 \
     -S ../B4-18.seqStore \
     -O  ./B4-18.ovlStore \
     -o  ./B4-18.ovlStore \
     > ./B4-18.ovlStore.summary.err 2>&1

-- Finished on Fri Jan 16 02:04:45 2026 (8 seconds) with 4558910.703 GB free disk space
----------------------------------------
--
-- Overlap store 'unitigging/B4-18.ovlStore' contains:
--
--   category            reads     %          read length        feature size or coverage  analysis
--   ----------------  -------  -------  ----------------------  ------------------------  --------------------
--   middle-missing        183    0.07    13568.93 +- 4997.17        906.84 +- 1206.23    (bad trimming)
--   middle-hump            82    0.03    14144.66 +- 2795.77       4716.52 +- 2810.57    (bad trimming)
--   no-5-prime            978    0.38    12362.29 +- 3360.35       2489.48 +- 2627.54    (bad trimming)
--   no-3-prime           1029    0.40    11717.38 +- 3740.65       2829.37 +- 2922.19    (bad trimming)
--   
--   low-coverage         3541    1.37    10439.44 +- 3497.00          5.78 +- 3.63       (easy to assemble, potential for lower quality consensus)
--   unique             194189   75.23    12669.15 +- 4217.14         43.01 +- 7.93       (easy to assemble, perfect, yay)
--   repeat-cont         15573    6.03    11398.06 +- 4187.99       1365.09 +- 1048.20    (potential for consensus errors, no impact on assembly)
--   repeat-dove           226    0.09    19884.18 +- 1961.25        704.65 +- 809.40     (hard to assemble, likely won't assemble correctly or even at all)
--   
--   span-repeat          2401    0.93    13180.51 +- 3540.27       3401.94 +- 3533.78    (read spans a large repeat, usually easy to assemble)
--   uniq-repeat-cont    14877    5.76    12295.10 +- 3343.02                             (should be uniquely placed, low potential for consensus errors, no impact on assembly)
--   uniq-repeat-dove     2965    1.15    17299.56 +- 2845.43                             (will end contigs, potential to misassemble)
--   uniq-anchor          5379    2.08    12907.84 +- 3480.96       8173.31 +- 4074.11    (repeat read, with unique section, probable bad read)
-- Finished stage 'utg-createOverlapStore', reset canuIteration.
--
-- Loading read lengths.
-- Loading number of overlaps per read.
--
-- Configure RED for 16gb memory.
--                   Batches of at most (unlimited) reads.
--                                      500000000 bases.
--                   Expecting evidence of at most 536870912 bases per iteration.
--
--           Total                                               Reads                 Olaps Evidence
--    Job   Memory      Read Range         Reads        Bases   Memory        Olaps   Memory   Memory  (Memory in MB)
--   ---- -------- ------------------- --------- ------------ -------- ------------ -------- --------
--      1 16385.16         1-44243          6029    108991078 13304.76       733713     8.40  1024.00
--      2 16385.36     44244-89995          6425    108900517 13293.72      1716070    19.64  1024.00
--      3 16385.74     89996-139353         6795    108939433 13298.48      1332733    15.25  1024.00
--      4 16384.48    139354-184296         6182    108983539 13303.85       754526     8.63  1024.00
--      5 16385.05    184297-233296         6712    108854451 13288.11      2179114    24.94  1024.00
--      6 16385.25    233297-287087         7284    108900773 13293.78      1701379    19.47  1024.00
--      7 16384.19    287088-332618         6214    108980764 13303.51       758585     8.68  1024.00
--      8 16386.04    332619-382046         6712    108872025 13290.25      2078625    23.79  1024.00
--      9 16385.31    382047-437000         7479    108897346 13293.37      1742314    19.94  1024.00
--     10 16385.28    437001-482314         6195    108988367 13304.44       772112     8.84  1024.00
--     11 16384.27    482315-531431         6596    108874502 13290.55      1897389    21.71  1024.00
--     12 16384.48    531432-585260         7427    108886458 13292.04      1786235    20.44  1024.00
--     13 16384.36    585261-630536         6136    108977723 13303.14       805844     9.22  1024.00
--     14 16385.48    630537-677836         6544    108883048 13291.59      1912877    21.89  1024.00
--     15 16384.16    677837-732050         7374    108890600 13292.54      1713853    19.61  1024.00
--     16 16384.84    732051-776846         6116    108984794 13304.00       772719     8.84  1024.00
--     17 16385.62    776847-825514         6563    108890480 13292.50      1845075    21.12  1024.00
--     18 16385.28    825515-880494         7425    108903782 13294.15      1671412    19.13  1024.00
--     19 16384.49    880495-924991         6131    108978794 13303.27       805856     9.22  1024.00
--     20 16385.30    924992-972354         6499    108884251 13291.74      1884068    21.56  1024.00
--     21 16386.17    972355-1027954        7564    108906403 13294.48      1721122    19.70  1024.00
--     22 16385.71   1027955-1073447        6108    109000705 13305.94       678742     7.77  1024.00
--     23 16384.70   1073448-1120393        6447    108871493 13290.18      1968072    22.52  1024.00
--     24 16384.03   1120394-1175597        7445    108886273 13292.02      1749107    20.02  1024.00
--     25 16384.18   1175598-1219384        6067    108988481 13304.45       675444     7.73  1024.00
--     26 16385.24   1219385-1266050        6358    108856728 13288.37      2172964    24.87  1024.00
--     27 16385.97   1266051-1320609        7408    108905866 13294.41      1709792    19.57  1024.00
--     28 16384.34   1320610-1366042        6021    108987727 13304.36       697921     7.99  1024.00
--     29 16384.88   1366043-1413263        6325    108872941 13290.35      1968352    22.53  1024.00
--     30 16386.26   1413264-1466547        7253    108908966 13294.78      1702301    19.48  1024.00
--     31 16384.68   1466548-1510477        5999    108993738 13305.09       663410     7.59  1024.00
--     32 16387.25   1510478-1556825        6284    108879934 13291.21      2101074    24.04  1024.00
--     33 16384.85   1556826-1610058        7121    108907440 13294.59      1595516    18.26  1024.00
--     34 16385.27   1610059-1653607        5996    108990646 13304.71       747782     8.56  1024.00
--     35 16385.66   1653608-1699619        6225    108882466 13291.51      1934883    22.14  1024.00
--     36 16384.19   1699620-1752204        7204    108895811 13293.17      1661631    19.02  1024.00
--     37 16384.89   1752205-1795516        5973    108986276 13304.18       761700     8.72  1024.00
--     38 16384.72   1795517-1840690        6171    108867383 13289.67      2013821    23.05  1024.00
--     39 16385.50   1840691-1892645        7183    108918437 13295.93      1535032    17.57  1024.00
--     40  3321.43   1892646-1893744         149      2040037   249.03        34773     0.40  1024.00
--   ---- -------- ------------------- --------- ------------ -------- ------------ -------- --------
--                                                 4250010476              56957938
-- Finished stage 'readErrorDetectionConfigure', reset canuIteration.
--
-- Running jobs.  First attempt out of 2.
----------------------------------------
-- Starting 'red' concurrent execution on Fri Jan 16 02:04:52 2026 with 4558910.656 GB free disk space (40 processes; 22 concurrently)

    cd unitigging/3-overlapErrorAdjustment
    ./red.sh 1 > ./red.000001.out 2>&1
    ./red.sh 2 > ./red.000002.out 2>&1
    ./red.sh 3 > ./red.000003.out 2>&1
    ./red.sh 4 > ./red.000004.out 2>&1
    ./red.sh 5 > ./red.000005.out 2>&1
    ./red.sh 6 > ./red.000006.out 2>&1
    ./red.sh 7 > ./red.000007.out 2>&1
    ./red.sh 8 > ./red.000008.out 2>&1
    ./red.sh 9 > ./red.000009.out 2>&1
    ./red.sh 10 > ./red.000010.out 2>&1
    ./red.sh 11 > ./red.000011.out 2>&1
    ./red.sh 12 > ./red.000012.out 2>&1
    ./red.sh 13 > ./red.000013.out 2>&1
    ./red.sh 14 > ./red.000014.out 2>&1
    ./red.sh 15 > ./red.000015.out 2>&1
    ./red.sh 16 > ./red.000016.out 2>&1
    ./red.sh 17 > ./red.000017.out 2>&1
    ./red.sh 18 > ./red.000018.out 2>&1
    ./red.sh 19 > ./red.000019.out 2>&1
    ./red.sh 20 > ./red.000020.out 2>&1
    ./red.sh 21 > ./red.000021.out 2>&1
    ./red.sh 22 > ./red.000022.out 2>&1
    ./red.sh 23 > ./red.000023.out 2>&1
    ./red.sh 24 > ./red.000024.out 2>&1
    ./red.sh 25 > ./red.000025.out 2>&1
    ./red.sh 26 > ./red.000026.out 2>&1
    ./red.sh 27 > ./red.000027.out 2>&1
    ./red.sh 28 > ./red.000028.out 2>&1
    ./red.sh 29 > ./red.000029.out 2>&1
    ./red.sh 30 > ./red.000030.out 2>&1
    ./red.sh 31 > ./red.000031.out 2>&1
    ./red.sh 32 > ./red.000032.out 2>&1
    ./red.sh 33 > ./red.000033.out 2>&1
    ./red.sh 34 > ./red.000034.out 2>&1
    ./red.sh 35 > ./red.000035.out 2>&1
    ./red.sh 36 > ./red.000036.out 2>&1
    ./red.sh 37 > ./red.000037.out 2>&1
    ./red.sh 38 > ./red.000038.out 2>&1
    ./red.sh 39 > ./red.000039.out 2>&1
    ./red.sh 40 > ./red.000040.out 2>&1

-- Finished on Fri Jan 16 02:28:47 2026 (1435 seconds) with 4559287.125 GB free disk space
----------------------------------------
-- Found 40 read error detection output files.
-- Finished stage 'readErrorDetectionCheck', reset canuIteration.
--
-- Loading read lengths.
-- Loading number of overlaps per read.
--
-- Configure OEA for 8gb memory.
--                   Batches of at most (unlimited) reads.
--                                      300000000 bases.
--
--           Total                                               Reads                 Olaps  Adjusts
--    Job   Memory      Read Range         Reads        Bases   Memory        Olaps   Memory   Memory  (Memory in MB)
--   ---- -------- ------------------- --------- ------------ -------- ------------ -------- --------
--      1  2824.14         1-128567        17776    300026898   294.67      3618074   110.41   371.05
--      2  2847.42    128568-264371        18662    300001289   294.67      4381069   133.70   371.05
--      3  2832.40    264372-398787        18185    300009287   294.67      3888918   118.68   371.05
--      4  2829.33    398788-532422        18124    300014350   294.67      3788323   115.61   371.05
--      5  2845.87    532423-666608        18440    300010210   294.67      4330226   132.15   371.05
--      6  2839.74    666609-802067        18386    300014937   294.68      4128999   126.01   371.05
--      7  2814.25    802068-937562        18521    300006461   294.67      3293966   100.52   371.05
--      8  2834.73    937563-1075020       18626    300023375   294.69      3964494   120.99   371.05
--      9  2840.05   1075021-1210223       18444    300008761   294.67      4139406   126.32   371.05
--     10  2846.50   1210224-1345246       18316    300014858   294.68      4350679   132.77   371.05
--     11  2842.90   1345247-1479840       18135    300017310   294.67      4232705   129.17   371.05
--     12  2841.27   1479841-1612305       17929    300007212   294.66      4179928   127.56   371.05
--     13  2832.75   1612306-1742250       17766    300001490   294.65      3901223   119.06   371.05
--     14  2826.36   1742251-1867825       17290    300013100   294.64      3691989   112.67   371.05
--     15  2507.28   1867826-1893744        3539     49840938    55.64      1067939    32.59   371.05
--   ---- -------- ------------------- --------- ------------ -------- ------------ -------- --------
--                                                 4250010476              56957938
-- Finished stage 'overlapErrorAdjustmentConfigure', reset canuIteration.
--
-- Running jobs.  First attempt out of 2.
----------------------------------------
-- Starting 'oea' concurrent execution on Fri Jan 16 02:28:55 2026 with 4559279.265 GB free disk space (15 processes; 62 concurrently)

    cd unitigging/3-overlapErrorAdjustment
    ./oea.sh 1 > ./oea.000001.out 2>&1
    ./oea.sh 2 > ./oea.000002.out 2>&1
    ./oea.sh 3 > ./oea.000003.out 2>&1
    ./oea.sh 4 > ./oea.000004.out 2>&1
    ./oea.sh 5 > ./oea.000005.out 2>&1
    ./oea.sh 6 > ./oea.000006.out 2>&1
    ./oea.sh 7 > ./oea.000007.out 2>&1
    ./oea.sh 8 > ./oea.000008.out 2>&1
    ./oea.sh 9 > ./oea.000009.out 2>&1
    ./oea.sh 10 > ./oea.000010.out 2>&1
    ./oea.sh 11 > ./oea.000011.out 2>&1
    ./oea.sh 12 > ./oea.000012.out 2>&1
    ./oea.sh 13 > ./oea.000013.out 2>&1
    ./oea.sh 14 > ./oea.000014.out 2>&1
    ./oea.sh 15 > ./oea.000015.out 2>&1

-- Finished on Fri Jan 16 03:42:09 2026 (4394 seconds) with 4556582.843 GB free disk space
----------------------------------------
-- Found 15 overlap error adjustment output files.
-- Finished stage 'overlapErrorAdjustmentCheck', reset canuIteration.
----------------------------------------
-- Starting command on Fri Jan 16 03:42:09 2026 with 4556582.828 GB free disk space

    cd unitigging/3-overlapErrorAdjustment
    /share/org/YZWL/yzwl_lixg/miniforge3/envs/canu_v.2.3/bin/loadErates \
      -S ../../B4-18.seqStore \
      -O ../B4-18.ovlStore \
      -L ./oea.files \
    > ./oea.apply.err 2>&1

-- Finished on Fri Jan 16 03:42:09 2026 (lickety-split) with 4556582.703 GB free disk space
----------------------------------------
-- No report available.
-- Finished stage 'updateOverlapStore', reset canuIteration.
-- Finished stage 'unitig', reset canuIteration.
--
-- Running jobs.  First attempt out of 2.
----------------------------------------
-- Starting 'bat' concurrent execution on Fri Jan 16 03:42:09 2026 with 4556582.656 GB free disk space (1 processes; 1 concurrently)

    cd unitigging/4-unitigger
    ./unitigger.sh 1 > ./unitigger.000001.out 2>&1

-- Finished on Fri Jan 16 03:42:23 2026 (14 seconds) with 4556555.875 GB free disk space
----------------------------------------
-- Unitigger finished successfully.
--  
--  ERROR RATES
--  -----------
--                                                   --------threshold------
--  273081                       fraction error      fraction        percent
--  samples                              (1e-5)         error          error
--                   --------------------------      --------       --------
--  command line (-eg)                           ->     30.00        0.0300%
--  command line (-ef)                           ->  -----.--      ---.----%
--  command line (-eM)                           ->     30.00        0.0300%
--  mean + std.dev       0.55 +-  12 *     3.41  ->     41.47        0.0415%
--  median + mad         0.00 +-  12 *     0.00  ->      0.00        0.0000%
--  90th percentile                              ->      1.00        0.0010%  (enabled)
--  
--  BEST EDGE FILTERING
--  -------------------
--  At graph threshold 0.0300%, reads:
--    available to have edges:        57889
--    with at least one edge:         38671
--  
--  At max threshold 0.0300%, reads:
--    available to have edges:        57889
--    with at least one edge:         38671
--  
--  At tight threshold 0.0010%, reads with:
--    both edges below error threshold:     32900  (80.00% minReadsBest threshold = 30936)
--    one  edge  above error threshold:      4328
--    both edges above error threshold:      1443
--    at least one edge:                    38671
--  
--  At loose threshold 0.0300%, reads with:
--    both edges below error threshold:     38671  (80.00% minReadsBest threshold = 30936)
--    one  edge  above error threshold:         0
--    both edges above error threshold:         0
--    at least one edge:                    38671
--  
--  
--  INITIAL EDGES
--  -------- ----------------------------------------
--    194421 reads are contained
--   1667141 reads have no best edges (singleton)
--       704 reads have only one best edge (spur) 
--                425 are mutual best
--     31478 reads have two best edges 
--                871 have one mutual best edge
--              30181 have two mutual best edges
--  
--  
--  FINAL EDGES
--  -------- ----------------------------------------
--    194421 reads are contained
--   1667533 reads have no best edges (singleton)
--       567 reads have only one best edge (spur) 
--                430 are mutual best
--     31223 reads have two best edges 
--                732 have one mutual best edge
--              30158 have two mutual best edges
--  
--  
--  EDGE FILTERING
--  -------- ------------------------------------------
--         0 reads are ignored
--     11499 reads have a gap in overlap coverage
--       138 reads have lopsided best edges
-- Found, in version 1, after unitig construction:
--   contigs:      102 sequences, total length 69023591 bp (including 102 repeats of total length 2624042 bp).
--   bubbles:      156 sequences, total length 3861342 bp.
--   unassembled:  32161 sequences, total length 353395493 bp.
--
-- Contig sizes based on genome size 85mbp:
--
--            NG (bp)  LG (contigs)    sum (bp)
--         ----------  ------------  ----------
--     10     9496693             1     9496693
--     20     4608198             3    19971172
--     30     4568656             5    29129793
--     40     4033901             7    37536780
--     50     3468196             9    44733411
--     60     3341038            11    51450354
--     70     1770576            15    60618270
--     80       28296            50    68006487
--
-- Finished stage 'unitigCheck', reset canuIteration.
----------------------------------------
-- Starting command on Fri Jan 16 03:42:23 2026 with 4556555.859 GB free disk space

    cd unitigging
    /share/org/YZWL/yzwl_lixg/miniforge3/envs/canu_v.2.3/bin/utgcns \
      -S ../B4-18.seqStore \
      -T  ./B4-18.ctgStore 1 \
      -partition 0.8 1.5 0.1 \
    > ./B4-18.ctgStore/partitioning.log 2>&1

-- Finished on Fri Jan 16 03:42:32 2026 (9 seconds) with 4556554.656 GB free disk space
----------------------------------------
-- Using slow alignment for consensus (iteration '0').
-- Configured 10 consensus jobs.
-- Finished stage 'consensusConfigure', reset canuIteration.
--
-- Local: cns       14.000 GB    8 CPUs x  11 jobs   154.000 GB  88 CPUs  (consensus)
--
--
-- Running jobs.  First attempt out of 2.
----------------------------------------
-- Starting 'cns' concurrent execution on Fri Jan 16 03:42:32 2026 with 4556554.625 GB free disk space (10 processes; 11 concurrently)

    cd unitigging/5-consensus
    ./consensus.sh 1 > ./consensus.000001.out 2>&1
    ./consensus.sh 2 > ./consensus.000002.out 2>&1
    ./consensus.sh 3 > ./consensus.000003.out 2>&1
    ./consensus.sh 4 > ./consensus.000004.out 2>&1
    ./consensus.sh 5 > ./consensus.000005.out 2>&1
    ./consensus.sh 6 > ./consensus.000006.out 2>&1
    ./consensus.sh 7 > ./consensus.000007.out 2>&1
    ./consensus.sh 8 > ./consensus.000008.out 2>&1
    ./consensus.sh 9 > ./consensus.000009.out 2>&1
    ./consensus.sh 10 > ./consensus.000010.out 2>&1

-- Finished on Fri Jan 16 03:51:05 2026 (513 seconds) with 4556277.296 GB free disk space
----------------------------------------
-- Using slow alignment for consensus (iteration '1').
-- Configured 10 consensus jobs.
-- All 10 consensus jobs finished successfully.
-- Finished stage 'consensusCheck', reset canuIteration.
-- Using slow alignment for consensus (iteration '0').
-- Configured 10 consensus jobs.
----------------------------------------
-- Starting command on Fri Jan 16 03:51:06 2026 with 4556277.25 GB free disk space

    cd unitigging
    /share/org/YZWL/yzwl_lixg/miniforge3/envs/canu_v.2.3/bin/tgStoreLoad \
      -S ../B4-18.seqStore \
      -T  ./B4-18.ctgStore 2 \
      -L ./5-consensus/ctgcns.files \
    > ./5-consensus/ctgcns.files.ctgStoreLoad.err 2>&1

-- Finished on Fri Jan 16 03:51:08 2026 (2 seconds) with 4556281.625 GB free disk space
----------------------------------------
----------------------------------------
-- Starting command on Fri Jan 16 03:51:08 2026 with 4556281.625 GB free disk space

    cd unitigging
    /share/org/YZWL/yzwl_lixg/miniforge3/envs/canu_v.2.3/bin/tgTigDisplay \
      -S ../B4-18.seqStore \
      -b \
      -o ../B4-18.contigs.unsorted.bam \
      -L ./5-consensus/ctgcns.files \
    > ./5-consensus/ctgcns.files.contigs.bam.err 2>&1

-- Finished on Fri Jan 16 03:53:49 2026 (161 seconds) with 4556040.031 GB free disk space
----------------------------------------
----------------------------------------
-- Starting command on Fri Jan 16 03:53:49 2026 with 4556040.031 GB free disk space

    cd .
    samtools sort \
      --write-index \
      --threads 2 \
      -o ./B4-18.contigs.bam ./B4-18.contigs.unsorted.bam \
    > ./ctgcns.bam.err 2>&1

-- Finished on Fri Jan 16 03:54:52 2026 (63 seconds) with 4555889.031 GB free disk space
----------------------------------------
-- Purging consensus output after loading to ctgStore.
-- Purged 10 .cns outputs.
----------------------------------------
-- Starting command on Fri Jan 16 03:54:52 2026 with 4555892.046 GB free disk space

    cd unitigging
    /share/org/YZWL/yzwl_lixg/miniforge3/envs/canu_v.2.3/bin/tgStoreDump \
      -S ../B4-18.seqStore \
      -T ./B4-18.ctgStore 2 \
      -sizes -s 85000000 \
    > ./B4-18.ctgStore/seqDB.v002.sizes.txt
ZERO length suplied to intervalList::add(), ignoring interval.
ZERO length suplied to intervalList::add(), ignoring interval.
ZERO length suplied to intervalList::add(), ignoring interval.
ZERO length suplied to intervalList::add(), ignoring interval.
ZERO length suplied to intervalList::add(), ignoring interval.
ZERO length suplied to intervalList::add(), ignoring interval.
ZERO length suplied to intervalList::add(), ignoring interval.
ZERO length suplied to intervalList::add(), ignoring interval.
ZERO length suplied to intervalList::add(), ignoring interval.
ZERO length suplied to intervalList::add(), ignoring interval.
ZERO length suplied to intervalList::add(), ignoring interval.
ZERO length suplied to intervalList::add(), ignoring interval.
ZERO length suplied to intervalList::add(), ignoring interval.
ZERO length suplied to intervalList::add(), ignoring interval.
ZERO length suplied to intervalList::add(), ignoring interval.
ZERO length suplied to intervalList::add(), ignoring interval.
ZERO length suplied to intervalList::add(), ignoring interval.
ZERO length suplied to intervalList::add(), ignoring interval.
ZERO length suplied to intervalList::add(), ignoring interval.
ZERO length suplied to intervalList::add(), ignoring interval.
ZERO length suplied to intervalList::add(), ignoring interval.
ZERO length suplied to intervalList::add(), ignoring interval.
ZERO length suplied to intervalList::add(), ignoring interval.
ZERO length suplied to intervalList::add(), ignoring interval.
ZERO length suplied to intervalList::add(), ignoring interval.
ZERO length suplied to intervalList::add(), ignoring interval.
ZERO length suplied to intervalList::add(), ignoring interval.
ZERO length suplied to intervalList::add(), ignoring interval.
ZERO length suplied to intervalList::add(), ignoring interval.
ZERO length suplied to intervalList::add(), ignoring interval.
ZERO length suplied to intervalList::add(), ignoring interval.
ZERO length suplied to intervalList::add(), ignoring interval.
ZERO length suplied to intervalList::add(), ignoring interval.
ZERO length suplied to intervalList::add(), ignoring interval.
ZERO length suplied to intervalList::add(), ignoring interval.
ZERO length suplied to intervalList::add(), ignoring interval.
ZERO length suplied to intervalList::add(), ignoring interval.
ZERO length suplied to intervalList::add(), ignoring interval.
ZERO length suplied to intervalList::add(), ignoring interval.
ZERO length suplied to intervalList::add(), ignoring interval.

-- Finished on Fri Jan 16 03:54:53 2026 (one second) with 4555892.046 GB free disk space
----------------------------------------
-- Found, in version 2, after consensus generation:
--   contigs:      102 sequences, total length 90357711 bp (including 102 repeats of total length 3560770 bp).
--   bubbles:      156 sequences, total length 5296196 bp.
--   unassembled:  32161 sequences, total length 523931744 bp.
--
-- Contig sizes based on genome size 85mbp:
--
--            NG (bp)  LG (contigs)    sum (bp)
--         ----------  ------------  ----------
--     10    12349094             1    12349094
--     20     7615698             2    19964792
--     30     5980507             3    25945299
--     40     5956895             5    37879888
--     50     5674910             6    43554798
--     60     4851333             8    53675797
--     70     4403950            10    62607433
--     80     3543482            12    70512694
--     90     2708099            14    76608737
--    100      824067            20    85199344
--
-- Finished stage 'consensusLoad', reset canuIteration.
----------------------------------------
-- Starting command on Fri Jan 16 03:54:53 2026 with 4555892.031 GB free disk space

    cd .
    /share/org/YZWL/yzwl_lixg/miniforge3/envs/canu_v.2.3/bin/tgStoreDump \
      -S ./B4-18.seqStore \
      -T ./unitigging/B4-18.ctgStore 2 \
      -o ./B4-18.contigs \
      -layout \
    > ./B4-18.contigs.layout.err 2>&1

-- Finished on Fri Jan 16 03:54:53 2026 (like a bat out of hell) with 4555891.968 GB free disk space
----------------------------------------
----------------------------------------
-- Starting command on Fri Jan 16 03:54:53 2026 with 4555891.968 GB free disk space

    cd .
    /share/org/YZWL/yzwl_lixg/miniforge3/envs/canu_v.2.3/bin/tgStoreDump \
      -S ./B4-18.seqStore \
      -T ./unitigging/B4-18.ctgStore 2 \
      -consensus -fasta \
      -unassembled \
    > ./B4-18.unassembled.fasta
    2> ./B4-18.unassembled.err
ZERO length suplied to intervalList::add(), ignoring interval.
ZERO length suplied to intervalList::add(), ignoring interval.
ZERO length suplied to intervalList::add(), ignoring interval.
ZERO length suplied to intervalList::add(), ignoring interval.
ZERO length suplied to intervalList::add(), ignoring interval.
ZERO length suplied to intervalList::add(), ignoring interval.
ZERO length suplied to intervalList::add(), ignoring interval.
ZERO length suplied to intervalList::add(), ignoring interval.
ZERO length suplied to intervalList::add(), ignoring interval.
ZERO length suplied to intervalList::add(), ignoring interval.
ZERO length suplied to intervalList::add(), ignoring interval.
ZERO length suplied to intervalList::add(), ignoring interval.
ZERO length suplied to intervalList::add(), ignoring interval.
ZERO length suplied to intervalList::add(), ignoring interval.
ZERO length suplied to intervalList::add(), ignoring interval.
ZERO length suplied to intervalList::add(), ignoring interval.
ZERO length suplied to intervalList::add(), ignoring interval.
ZERO length suplied to intervalList::add(), ignoring interval.
ZERO length suplied to intervalList::add(), ignoring interval.
ZERO length suplied to intervalList::add(), ignoring interval.
ZERO length suplied to intervalList::add(), ignoring interval.
ZERO length suplied to intervalList::add(), ignoring interval.
ZERO length suplied to intervalList::add(), ignoring interval.
ZERO length suplied to intervalList::add(), ignoring interval.
ZERO length suplied to intervalList::add(), ignoring interval.
ZERO length suplied to intervalList::add(), ignoring interval.
ZERO length suplied to intervalList::add(), ignoring interval.
ZERO length suplied to intervalList::add(), ignoring interval.
ZERO length suplied to intervalList::add(), ignoring interval.
ZERO length suplied to intervalList::add(), ignoring interval.
ZERO length suplied to intervalList::add(), ignoring interval.
ZERO length suplied to intervalList::add(), ignoring interval.
ZERO length suplied to intervalList::add(), ignoring interval.
ZERO length suplied to intervalList::add(), ignoring interval.
ZERO length suplied to intervalList::add(), ignoring interval.
ZERO length suplied to intervalList::add(), ignoring interval.
ZERO length suplied to intervalList::add(), ignoring interval.
ZERO length suplied to intervalList::add(), ignoring interval.
ZERO length suplied to intervalList::add(), ignoring interval.
ZERO length suplied to intervalList::add(), ignoring interval.

-- Finished on Fri Jan 16 03:54:56 2026 (3 seconds) with 4555891.453 GB free disk space
----------------------------------------
----------------------------------------
-- Starting command on Fri Jan 16 03:54:56 2026 with 4555891.453 GB free disk space

    cd .
    /share/org/YZWL/yzwl_lixg/miniforge3/envs/canu_v.2.3/bin/tgStoreDump \
      -S ./B4-18.seqStore \
      -T ./unitigging/B4-18.ctgStore 2 \
      -consensus -fasta \
      -contigs \
    > ./B4-18.contigs.fasta
    2> ./B4-18.contigs.err
ZERO length suplied to intervalList::add(), ignoring interval.
ZERO length suplied to intervalList::add(), ignoring interval.
ZERO length suplied to intervalList::add(), ignoring interval.
ZERO length suplied to intervalList::add(), ignoring interval.
ZERO length suplied to intervalList::add(), ignoring interval.
ZERO length suplied to intervalList::add(), ignoring interval.
ZERO length suplied to intervalList::add(), ignoring interval.
ZERO length suplied to intervalList::add(), ignoring interval.
ZERO length suplied to intervalList::add(), ignoring interval.
ZERO length suplied to intervalList::add(), ignoring interval.
ZERO length suplied to intervalList::add(), ignoring interval.
ZERO length suplied to intervalList::add(), ignoring interval.
ZERO length suplied to intervalList::add(), ignoring interval.
ZERO length suplied to intervalList::add(), ignoring interval.
ZERO length suplied to intervalList::add(), ignoring interval.
ZERO length suplied to intervalList::add(), ignoring interval.
ZERO length suplied to intervalList::add(), ignoring interval.
ZERO length suplied to intervalList::add(), ignoring interval.
ZERO length suplied to intervalList::add(), ignoring interval.
ZERO length suplied to intervalList::add(), ignoring interval.
ZERO length suplied to intervalList::add(), ignoring interval.
ZERO length suplied to intervalList::add(), ignoring interval.
ZERO length suplied to intervalList::add(), ignoring interval.
ZERO length suplied to intervalList::add(), ignoring interval.
ZERO length suplied to intervalList::add(), ignoring interval.
ZERO length suplied to intervalList::add(), ignoring interval.
ZERO length suplied to intervalList::add(), ignoring interval.
ZERO length suplied to intervalList::add(), ignoring interval.
ZERO length suplied to intervalList::add(), ignoring interval.
ZERO length suplied to intervalList::add(), ignoring interval.
ZERO length suplied to intervalList::add(), ignoring interval.
ZERO length suplied to intervalList::add(), ignoring interval.
ZERO length suplied to intervalList::add(), ignoring interval.
ZERO length suplied to intervalList::add(), ignoring interval.
ZERO length suplied to intervalList::add(), ignoring interval.
ZERO length suplied to intervalList::add(), ignoring interval.
ZERO length suplied to intervalList::add(), ignoring interval.
ZERO length suplied to intervalList::add(), ignoring interval.
ZERO length suplied to intervalList::add(), ignoring interval.
ZERO length suplied to intervalList::add(), ignoring interval.

-- Finished on Fri Jan 16 03:54:57 2026 (one second) with 4555891.343 GB free disk space
----------------------------------------
-- Finished stage 'generateOutputs', reset canuIteration.
--
-- Assembly 'B4-18' finished in '/share/org/YZWL/yzwl_lixg/project/28.大豆疫霉菌三代基因组/03.hicanu/B4-18/01.raw_output'.
--
-- Summary saved in 'B4-18.report'.
--
-- Sequences saved:
--   Contigs       -> 'B4-18.contigs.fasta'
--   Unassembled   -> 'B4-18.unassembled.fasta'
--
-- Read layouts saved:
--   Contigs       -> 'B4-18.contigs.layout'.
--
-- Bye.

2026-01-16 03:54:57.065 - WARNING - 输出文件不存在|Output file does not exist: /share/org/YZWL/yzwl_lixg/project/28.大豆疫霉菌三代基因组/03.hicanu/B4-18/01.raw_output/B4-18.unitigs.fasta
Usage: biopytools ragtag [OPTIONS]
Try 'biopytools ragtag -h' for help.

Error: Invalid value for '-r' / '--reference': 文件不存在|File does not exist: /share/org/YZWL/yzwl_lixg/project/28.大豆疫霉菌三代基因组/04.ragtag/Psoja_T2T.fa
Usage: biopytools genomesyn [OPTIONS]
Try 'biopytools genomesyn -h' for help.

Error: Invalid value for '-i' / '--ref': Path '04.ragtag/B4-18/hicanu/B4-18_RagTag_scaffolded.fa' does not exist.
Job 68886858 stderr output:

