2026-01-16 15:45:09.004 - WARNING - 命令错误输出|Command stderr:
-- canu master +27 changes (r10515 2a41e933b8de6ed66723d75d36dd071b46d2c347)
--
-- CITATIONS
--
-- For assemblies of PacBio HiFi reads:
--   Nurk S, Walenz BP, Rhiea A, Vollger MR, Logsdon GA, Grothe R, Miga KH, Eichler EE, Phillippy AM, Koren S.
--   HiCanu: accurate assembly of segmental duplications, satellites, and allelic variants from high-fidelity long reads.
--   biorXiv. 2020.
--   https://doi.org/10.1101/2020.03.14.992248
-- 
-- Read and contig alignments during correction and consensus use:
--   Šošic M, Šikic M.
--   Edlib: a C/C ++ library for fast, exact sequence alignment using edit distance.
--   Bioinformatics. 2017 May 1;33(9):1394-1395.
--   http://doi.org/10.1093/bioinformatics/btw753
-- 
-- Overlaps are generated using:
--   Berlin K, et al.
--   Assembling large genomes with single-molecule sequencing and locality-sensitive hashing.
--   Nat Biotechnol. 2015 Jun;33(6):623-30.
--   http://doi.org/10.1038/nbt.3238
-- 
--   Myers EW, et al.
--   A Whole-Genome Assembly of Drosophila.
--   Science. 2000 Mar 24;287(5461):2196-204.
--   http://doi.org/10.1126/science.287.5461.2196
-- 
-- Contig consensus sequences are generated using an algorithm derived from pbdagcon:
--   Chin CS, et al.
--   Nonhybrid, finished microbial genome assemblies from long-read SMRT sequencing data.
--   Nat Methods. 2013 Jun;10(6):563-9
--   http://doi.org/10.1038/nmeth.2474
-- 
-- CONFIGURE CANU
--
-- Detected Java(TM) Runtime Environment '25.0.1-internal' (from '/share/org/YZWL/yzwl_lixg/miniforge3/envs/telocomp/lib/jvm/bin/java') without -d64 support.
--
-- WARNING:
-- WARNING:  Failed to run gnuplot using command 'gnuplot'.
-- WARNING:  Plots will be disabled.
-- WARNING:
--
-- Detected samtools version '1.22' / htslib version 'htscodecs=1.6.3' (from 'samtools').
--
-- Detected 88 CPUs and 503 gigabytes of memory on the local machine.
--
-- Detected Slurm with 'sinfo' binary in /opt/skyformai/bin/sinfo.
--          Slurm disabled by useGrid=false
--
-- Detected  '' with 'pbsnodes' binary in /opt/skyformai/bin/pbsnodes.
--           disabled by useGrid=false
--
-- Detected LSF with 'bsub' binary in /opt/skyformai/bin/bsub.
--          LSF disabled by useGrid=false
--
-- Local machine mode enabled; grid support not detected or not allowed.
--
-- Found trimmed raw PacBio HiFi reads in the input files.
--
--                                (tag)Concurrency
--                         (tag)Threads          |
--                (tag)Memory         |          |
--        (tag)             |         |          |       total usage      algorithm
--        -------  ----------  --------   --------  --------------------  -----------------------------
-- Local: meryl     12.000 GB    4 CPUs x  22 jobs   264.000 GB  88 CPUs  (k-mer counting)
-- Local: cormhap   13.000 GB   11 CPUs x   8 jobs   104.000 GB  88 CPUs  (overlap detection with mhap)
-- Local: obtovl     8.000 GB    8 CPUs x  11 jobs    88.000 GB  88 CPUs  (overlap detection)
-- Local: utgovl     8.000 GB    8 CPUs x  11 jobs    88.000 GB  88 CPUs  (overlap detection)
-- Local: cor        -.--- GB    4 CPUs x   - jobs     -.--- GB   - CPUs  (read correction)
-- Local: ovb        4.000 GB    1 CPU  x  88 jobs   352.000 GB  88 CPUs  (overlap store bucketizer)
-- Local: ovs        8.000 GB    1 CPU  x  62 jobs   496.000 GB  62 CPUs  (overlap store sorting)
-- Local: red       16.000 GB    4 CPUs x  22 jobs   352.000 GB  88 CPUs  (read error detection)
-- Local: oea        8.000 GB    1 CPU  x  62 jobs   496.000 GB  62 CPUs  (overlap error adjustment)
-- Local: bat       32.000 GB    8 CPUs x   1 job     32.000 GB   8 CPUs  (contig construction with bogart)
-- Local: cns        -.--- GB    8 CPUs x   - jobs     -.--- GB   - CPUs  (consensus)
--
-- Generating assembly 'A3-52' in '/share/org/YZWL/yzwl_lixg/project/28.大豆疫霉菌三代基因组/03.hicanu/A3-52/01.raw_output':
--   genomeSize:
--     85000000
--
--   Overlap Generation Limits:
--     corOvlErrorRate 0.0000 (  0.00%)
--     obtOvlErrorRate 0.0250 (  2.50%)
--     utgOvlErrorRate 0.0100 (  1.00%)
--
--   Overlap Processing Limits:
--     corErrorRate    0.0000 (  0.00%)
--     obtErrorRate    0.0250 (  2.50%)
--     utgErrorRate    0.0003 (  0.03%)
--     cnsErrorRate    0.0500 (  5.00%)
--
--   Stages to run:
--     assemble HiFi reads.
--
--
-- BEGIN STORE CREATION
----------------------------------------
-- Starting command on Fri Jan 16 13:21:41 2026 with 4532498.812 GB free disk space

    cd .
    ./A3-52.seqStore.sh \
    > ./A3-52.seqStore.err 2>&1

-- Finished on Fri Jan 16 13:29:09 2026 (448 seconds) with 4532358.156 GB free disk space
----------------------------------------
--
-- In sequence store './A3-52.seqStore':
--   Found 264672 reads.
--   Found 4250007390 bases (50 times coverage).
--    Histogram of corrected reads:
--    
--    G=4250007390                       sum of  ||               length     num
--    NG         length     index       lengths  ||                range    seqs
--    ----- ------------ --------- ------------  ||  ------------------- -------
--    00010        24927     15486    425004397  ||       1244-2368         4247|---------
--    00020        22418     33541    850023433  ||       2369-3493         7524|----------------
--    00030        20751     53281   1275019403  ||       3494-4618         8063|------------------
--    00040        19468     74445   1700007984  ||       4619-5743         7523|----------------
--    00050        18380     96927   2125014489  ||       5744-6868         7006|---------------
--    00060        17435    120676   2550008568  ||       6869-7993         6346|--------------
--    00070        16516    145717   2975016863  ||       7994-9118         5818|-------------
--    00080        15424    172285   3400007506  ||       9119-10243        5248|------------
--    00090        13023    201628   3825017023  ||      10244-11368        4491|----------
--    00100         1244    264672   4250007390  ||      11369-12493        4348|----------
--    001.000x              264672   4250007390  ||      12494-13618        6365|--------------
--                                               ||      13619-14743       13017|----------------------------
--                                               ||      14744-15868       22270|------------------------------------------------
--                                               ||      15869-16993       29846|---------------------------------------------------------------
--                                               ||      16994-18118       29421|---------------------------------------------------------------
--                                               ||      18119-19243       24489|----------------------------------------------------
--                                               ||      19244-20368       19707|------------------------------------------
--                                               ||      20369-21493       15405|---------------------------------
--                                               ||      21494-22618       11830|-------------------------
--                                               ||      22619-23743        9149|--------------------
--                                               ||      23744-24868        6731|---------------
--                                               ||      24869-25993        5122|-----------
--                                               ||      25994-27118        3684|--------
--                                               ||      27119-28243        2611|------
--                                               ||      28244-29368        1732|----
--                                               ||      29369-30493        1121|---
--                                               ||      30494-31618         690|--
--                                               ||      31619-32743         424|-
--                                               ||      32744-33868         232|-
--                                               ||      33869-34993         130|-
--                                               ||      34994-36118          54|-
--                                               ||      36119-37243          11|-
--                                               ||      37244-38368           8|-
--                                               ||      38369-39493           2|-
--                                               ||      39494-40618           0|
--                                               ||      40619-41743           2|-
--                                               ||      41744-42868           1|-
--                                               ||      42869-43993           1|-
--                                               ||      43994-45118           0|
--                                               ||      45119-46243           3|-
--    
--
-- In sequence store './A3-52.seqStore':
--   Found 264672 reads.
--   Found 4250007390 bases (50 times coverage).
--    Histogram of corrected-trimmed reads:
--    
--    G=4250007390                       sum of  ||               length     num
--    NG         length     index       lengths  ||                range    seqs
--    ----- ------------ --------- ------------  ||  ------------------- -------
--    00010        24927     15486    425004397  ||       1244-2368         4247|---------
--    00020        22418     33541    850023433  ||       2369-3493         7524|----------------
--    00030        20751     53281   1275019403  ||       3494-4618         8063|------------------
--    00040        19468     74445   1700007984  ||       4619-5743         7523|----------------
--    00050        18380     96927   2125014489  ||       5744-6868         7006|---------------
--    00060        17435    120676   2550008568  ||       6869-7993         6346|--------------
--    00070        16516    145717   2975016863  ||       7994-9118         5818|-------------
--    00080        15424    172285   3400007506  ||       9119-10243        5248|------------
--    00090        13023    201628   3825017023  ||      10244-11368        4491|----------
--    00100         1244    264672   4250007390  ||      11369-12493        4348|----------
--    001.000x              264672   4250007390  ||      12494-13618        6365|--------------
--                                               ||      13619-14743       13017|----------------------------
--                                               ||      14744-15868       22270|------------------------------------------------
--                                               ||      15869-16993       29846|---------------------------------------------------------------
--                                               ||      16994-18118       29421|---------------------------------------------------------------
--                                               ||      18119-19243       24489|----------------------------------------------------
--                                               ||      19244-20368       19707|------------------------------------------
--                                               ||      20369-21493       15405|---------------------------------
--                                               ||      21494-22618       11830|-------------------------
--                                               ||      22619-23743        9149|--------------------
--                                               ||      23744-24868        6731|---------------
--                                               ||      24869-25993        5122|-----------
--                                               ||      25994-27118        3684|--------
--                                               ||      27119-28243        2611|------
--                                               ||      28244-29368        1732|----
--                                               ||      29369-30493        1121|---
--                                               ||      30494-31618         690|--
--                                               ||      31619-32743         424|-
--                                               ||      32744-33868         232|-
--                                               ||      33869-34993         130|-
--                                               ||      34994-36118          54|-
--                                               ||      36119-37243          11|-
--                                               ||      37244-38368           8|-
--                                               ||      38369-39493           2|-
--                                               ||      39494-40618           0|
--                                               ||      40619-41743           2|-
--                                               ||      41744-42868           1|-
--                                               ||      42869-43993           1|-
--                                               ||      43994-45118           0|
--                                               ||      45119-46243           3|-
--    
--
-- Correction skipped; not enabled.
--
-- Trimming skipped; not enabled.
--
-- BEGIN ASSEMBLY
----------------------------------------
-- Starting command on Fri Jan 16 13:29:09 2026 with 4532358.109 GB free disk space

    cd unitigging/0-mercounts
    ./meryl-configure.sh \
    > ./meryl-configure.err 2>&1

-- Finished on Fri Jan 16 13:29:10 2026 (one second) with 4532358.109 GB free disk space
----------------------------------------
--  segments   memory batches
--  -------- -------- -------
--        01 10.72 GB       2
--        02  5.61 GB       2
--        04  2.94 GB       2
--        06  2.13 GB       2
--        08  1.60 GB       2
--        12  1.07 GB       2
--        16  0.80 GB       2
--        20  0.64 GB       2
--        24  0.54 GB       2
--        32  0.40 GB       2
--        40  0.32 GB       2
--        48  -.-- GB       -  (segment size too small)
--        56  -.-- GB       -  (segment size too small)
--        64  -.-- GB       -  (segment size too small)
--        96  -.-- GB       -  (segment size too small)
--
--  For 264672 reads with 4250007390 bases, limit to 42 batches.
--  Will count kmers using 01 jobs, each using 12 GB and 4 threads.
--
-- Finished stage 'merylConfigure', reset canuIteration.
--
-- Running jobs.  First attempt out of 2.
----------------------------------------
-- Starting 'meryl' concurrent execution on Fri Jan 16 13:29:10 2026 with 4532358.078 GB free disk space (1 processes; 22 concurrently)

    cd unitigging/0-mercounts
    ./meryl-count.sh 1 > ./meryl-count.000001.out 2>&1

-- Finished on Fri Jan 16 13:32:34 2026 (204 seconds) with 4532196.078 GB free disk space
----------------------------------------
-- Found 1 Kmer counting (meryl) outputs.
-- Finished stage 'utg-merylCountCheck', reset canuIteration.
--
-- Running jobs.  First attempt out of 2.
----------------------------------------
-- Starting 'meryl' concurrent execution on Fri Jan 16 13:32:34 2026 with 4532196.046 GB free disk space (1 processes; 22 concurrently)

    cd unitigging/0-mercounts
    ./meryl-process.sh 1 > ./meryl-process.000001.out 2>&1

-- Finished on Fri Jan 16 13:32:38 2026 (4 seconds) with 4532195.609 GB free disk space
----------------------------------------
-- Meryl finished successfully.  Kmer frequency histogram:
--
-- WARNING: gnuplot failed.
--
----------------------------------------
--
--  22-mers                                                                                           Fraction
--    Occurrences   NumMers                                                                         Unique Total
--       1-     1         0                                                                        0.0000 0.0000
--       2-     2    418772 *                                                                      0.0093 0.0003
--       3-     4    113577                                                                        0.0111 0.0004
--       5-     7     34401                                                                        0.0122 0.0004
--       8-    11      8085                                                                        0.0126 0.0005
--      12-    16     15041                                                                        0.0127 0.0005
--      17-    22    160631                                                                        0.0132 0.0006
--      23-    29   1097568 ****                                                                   0.0178 0.0020
--      30-    37   6694042 ***************************                                            0.0494 0.0145
--      38-    46  17269549 ********************************************************************** 0.2236 0.1018
--      47-    56  12206819 *************************************************                      0.6108 0.3382
--      57-    67   2523866 **********                                                             0.8511 0.5134
--      68-    79    764292 ***                                                                    0.8976 0.5539
--      80-    92    966646 ***                                                                    0.9143 0.5715
--      93-   106    737006 **                                                                     0.9358 0.5981
--     107-   121    290544 *                                                                      0.9510 0.6195
--     122-   137    285536 *                                                                      0.9572 0.6295
--     138-   154    219623                                                                        0.9635 0.6412
--     155-   172    152927                                                                        0.9682 0.6509
--     173-   191    152860                                                                        0.9715 0.6587
--     192-   211    126057                                                                        0.9749 0.6674
--     212-   232    111988                                                                        0.9776 0.6753
--     233-   254     93320                                                                        0.9801 0.6831
--     255-   277     82381                                                                        0.9822 0.6902
--     278-   301     68750                                                                        0.9839 0.6970
--     302-   326     60181                                                                        0.9854 0.7031
--     327-   352     48537                                                                        0.9868 0.7090
--     353-   379     42248                                                                        0.9878 0.7142
--     380-   407     37084                                                                        0.9888 0.7190
--     408-   436     35567                                                                        0.9896 0.7236
--     437-   466     30498                                                                        0.9904 0.7282
--     467-   497     27431                                                                        0.9910 0.7326
--     498-   529     23221                                                                        0.9916 0.7367
--     530-   562     21913                                                                        0.9921 0.7404
--     563-   596     19635                                                                        0.9926 0.7441
--     597-   631     15936                                                                        0.9931 0.7477
--     632-   667     13998                                                                        0.9934 0.7507
--     668-   704     14014                                                                        0.9937 0.7536
--     705-   742     11975                                                                        0.9940 0.7566
--     743-   781     10986                                                                        0.9943 0.7593
--     782-   821     14627                                                                        0.9945 0.7619
--
--           0 (max occurrences)
--  3191945206 (total mers, non-unique)
--    45255239 (distinct mers, non-unique)
--           0 (unique mers)
-- Finished stage 'meryl-process', reset canuIteration.
--
-- Removing meryl database 'unitigging/0-mercounts/A3-52.ms22'.
--
-- OVERLAPPER (normal) (assembly) erate=0.01
--
----------------------------------------
-- Starting command on Fri Jan 16 13:32:38 2026 with 4532196.578 GB free disk space

    cd unitigging/1-overlapper
    /share/org/YZWL/yzwl_lixg/miniforge3/envs/canu_v.2.3/bin/overlapInCorePartition \
     -S  ../../A3-52.seqStore \
     -hl 160000000 \
     -rl 5000000000 \
     -ol 500 \
     -o  ./A3-52.partition \
    > ./A3-52.partition.err 2>&1

-- Finished on Fri Jan 16 13:32:39 2026 (one second) with 4532196.562 GB free disk space
----------------------------------------
--
-- Configured 21 overlapInCore jobs.
-- Finished stage 'utg-overlapConfigure', reset canuIteration.
--
-- Running jobs.  First attempt out of 2.
----------------------------------------
-- Starting 'utgovl' concurrent execution on Fri Jan 16 13:32:39 2026 with 4532196.531 GB free disk space (21 processes; 11 concurrently)

    cd unitigging/1-overlapper
    ./overlap.sh 1 > ./overlap.000001.out 2>&1
    ./overlap.sh 2 > ./overlap.000002.out 2>&1
    ./overlap.sh 3 > ./overlap.000003.out 2>&1
    ./overlap.sh 4 > ./overlap.000004.out 2>&1
    ./overlap.sh 5 > ./overlap.000005.out 2>&1
    ./overlap.sh 6 > ./overlap.000006.out 2>&1
    ./overlap.sh 7 > ./overlap.000007.out 2>&1
    ./overlap.sh 8 > ./overlap.000008.out 2>&1
    ./overlap.sh 9 > ./overlap.000009.out 2>&1
    ./overlap.sh 10 > ./overlap.000010.out 2>&1
    ./overlap.sh 11 > ./overlap.000011.out 2>&1
    ./overlap.sh 12 > ./overlap.000012.out 2>&1
    ./overlap.sh 13 > ./overlap.000013.out 2>&1
    ./overlap.sh 14 > ./overlap.000014.out 2>&1
    ./overlap.sh 15 > ./overlap.000015.out 2>&1
    ./overlap.sh 16 > ./overlap.000016.out 2>&1
    ./overlap.sh 17 > ./overlap.000017.out 2>&1
    ./overlap.sh 18 > ./overlap.000018.out 2>&1
    ./overlap.sh 19 > ./overlap.000019.out 2>&1
    ./overlap.sh 20 > ./overlap.000020.out 2>&1
    ./overlap.sh 21 > ./overlap.000021.out 2>&1

-- Finished on Fri Jan 16 14:17:39 2026 (2700 seconds) with 4531043.125 GB free disk space
----------------------------------------
-- Found 21 overlapInCore output files.
--
-- overlapInCore compute 'unitigging/1-overlapper':
--   kmer hits
--     with no overlap       1300324235  01.6666667 +- 39223020.498
--     with an overlap         42591838  2.76190476 +- 1293678.779
--
--   overlaps                  42591838  2.76190476 +- 1293678.779
--     contained                9690332  .380952381 +- 289857.203
--     dovetail                32901506  8.38095238 +- 1005025.652
--
--   overlaps rejected
--     multiple per pair              0           0 +- 0
--     bad short window               0           0 +- 0
--     bad long window                0           0 +- 0
-- Finished stage 'utg-overlapCheck', reset canuIteration.
----------------------------------------
-- Starting command on Fri Jan 16 14:17:39 2026 with 4531043.109 GB free disk space

    cd unitigging
    /share/org/YZWL/yzwl_lixg/miniforge3/envs/canu_v.2.3/bin/ovStoreConfig \
     -S ../A3-52.seqStore \
     -M 4-8 \
     -L ./1-overlapper/ovljob.files \
     -create ./A3-52.ovlStore.config \
     > ./A3-52.ovlStore.config.txt \
    2> ./A3-52.ovlStore.config.err

-- Finished on Fri Jan 16 14:17:39 2026 (lickety-split) with 4531043.093 GB free disk space
----------------------------------------
--
-- Creating overlap store unitigging/A3-52.ovlStore using:
--      1 bucket
--      1 slice
--        using at most 3 GB memory each
--
-- Running jobs.  First attempt out of 2.
----------------------------------------
-- Starting 'ovS' concurrent execution on Fri Jan 16 14:17:39 2026 with 4531043.078 GB free disk space (1 processes; 62 concurrently)

    cd unitigging
    ./A3-52.ovlStore.sh 1 > ./A3-52.ovlStore.000001.out 2>&1

-- Finished on Fri Jan 16 14:17:57 2026 (18 seconds) with 4531041.25 GB free disk space
----------------------------------------
-- Checking store.
----------------------------------------
-- Starting command on Fri Jan 16 14:17:57 2026 with 4531041.25 GB free disk space

    cd unitigging
    /share/org/YZWL/yzwl_lixg/miniforge3/envs/canu_v.2.3/bin/ovStoreDump \
     -S ../A3-52.seqStore \
     -O  ./A3-52.ovlStore \
     -counts \
     > ./A3-52.ovlStore/counts.dat 2> ./A3-52.ovlStore/counts.err

-- Finished on Fri Jan 16 14:17:57 2026 (fast as lightning) with 4531041.218 GB free disk space
----------------------------------------
--
-- Overlap store 'unitigging/A3-52.ovlStore' successfully constructed.
-- Found 85183676 overlaps for 254577 reads; 1574125 reads have no overlaps.
--
--
-- Purged 0.868 GB in 63 overlap output files.
----------------------------------------
-- Starting command on Fri Jan 16 14:17:58 2026 with 4531013.515 GB free disk space

    cd unitigging
    /share/org/YZWL/yzwl_lixg/miniforge3/envs/canu_v.2.3/bin/ovStoreStats \
     -C 50 \
     -S ../A3-52.seqStore \
     -O  ./A3-52.ovlStore \
     -o  ./A3-52.ovlStore \
     > ./A3-52.ovlStore.summary.err 2>&1

-- Finished on Fri Jan 16 14:18:10 2026 (12 seconds) with 4531013.5 GB free disk space
----------------------------------------
--
-- Overlap store 'unitigging/A3-52.ovlStore' contains:
--
--   category            reads     %          read length        feature size or coverage  analysis
--   ----------------  -------  -------  ----------------------  ------------------------  --------------------
--   middle-missing        225    0.09    13551.59 +- 6008.73       1257.92 +- 2154.34    (bad trimming)
--   middle-hump            36    0.01    12782.67 +- 3286.02       4532.56 +- 3509.85    (bad trimming)
--   no-5-prime            944    0.36    12154.75 +- 4443.62       1710.34 +- 2579.56    (bad trimming)
--   no-3-prime           1287    0.49    10097.08 +- 5484.25       1403.41 +- 2302.39    (bad trimming)
--   
--   low-coverage         1990    0.75     8992.63 +- 4206.43          5.69 +- 3.69       (easy to assemble, potential for lower quality consensus)
--   unique             203429   76.86    12315.26 +- 4864.87         44.09 +- 8.32       (easy to assemble, perfect, yay)
--   repeat-cont         22263    8.41    11310.17 +- 4182.97       1689.92 +- 1234.52    (potential for consensus errors, no impact on assembly)
--   repeat-dove           270    0.10    20634.99 +- 2602.04        767.39 +- 758.83     (hard to assemble, likely won't assemble correctly or even at all)
--   
--   span-repeat          2649    1.00    13149.07 +- 4239.95       2761.95 +- 3223.31    (read spans a large repeat, usually easy to assemble)
--   uniq-repeat-cont    14259    5.39    12100.52 +- 3924.54                             (should be uniquely placed, low potential for consensus errors, no impact on assembly)
--   uniq-repeat-dove     2850    1.08    17579.32 +- 3274.03                             (will end contigs, potential to misassemble)
--   uniq-anchor          4375    1.65    12639.03 +- 4104.95       8149.60 +- 4592.69    (repeat read, with unique section, probable bad read)
-- Finished stage 'utg-createOverlapStore', reset canuIteration.
--
-- Loading read lengths.
-- Loading number of overlaps per read.
--
-- Configure RED for 16gb memory.
--                   Batches of at most (unlimited) reads.
--                                      500000000 bases.
--                   Expecting evidence of at most 536870912 bases per iteration.
--
--           Total                                               Reads                 Olaps Evidence
--    Job   Memory      Read Range         Reads        Bases   Memory        Olaps   Memory   Memory  (Memory in MB)
--   ---- -------- ------------------- --------- ------------ -------- ------------ -------- --------
--      1 16384.38         1-43764          6185    108903317 13294.06      1601150    18.32  1024.00
--      2 16387.07     43765-86538          6266    108754368 13275.88      3424581    39.19  1024.00
--      3 16384.48     86539-139532         7632    108921182 13296.28      1415099    16.19  1024.00
--      4 16384.81    139533-188324         7002    108847798 13287.31      2228584    25.50  1024.00
--      5 16385.99    188325-231887         6254    108787021 13279.86      2982011    34.13  1024.00
--      6 16384.30    231888-285217         7766    108913925 13295.40      1476296    16.89  1024.00
--      7 16384.71    285218-332983         6866    108865597 13289.47      2030264    23.23  1024.00
--      8 16384.75    332984-376390         6250    108774777 13278.37      3004141    34.38  1024.00
--      9 16386.00    376391-431094         7780    108922902 13296.50      1529022    17.50  1024.00
--     10 16384.57    431095-475947         6603    108871223 13290.15      1959306    22.42  1024.00
--     11 16385.78    475948-518605         6225    108778627 13278.84      3053379    34.94  1024.00
--     12 16384.92    518606-572013         7652    108911599 13295.11      1556065    17.81  1024.00
--     13 16385.97    572014-616480         6514    108889957 13292.44      1882028    21.54  1024.00
--     14 16384.58    616481-659928         6205    108770653 13277.86      3034052    34.72  1024.00
--     15 16384.53    659929-711996         7625    108908967 13294.79      1549726    17.74  1024.00
--     16 16386.97    711997-756872         6541    108887961 13292.19      1990615    22.78  1024.00
--     17 16384.49    756873-799890         6248    108761076 13276.70      3127644    35.79  1024.00
--     18 16384.50    799891-851194         7605    108915795 13295.62      1474458    16.87  1024.00
--     19 16384.58    851195-897257         6608    108877121 13290.87      1896740    21.71  1024.00
--     20 16385.49    897258-939375         6196    108777922 13278.75      3035604    34.74  1024.00
--     21 16384.46    939376-989956         7402    108911546 13295.10      1516981    17.36  1024.00
--     22 16384.58    989957-1034426        6464    108881976 13291.46      1845746    21.12  1024.00
--     23 16385.65   1034427-1076570        6158    108750796 13275.44      3339069    38.21  1024.00
--     24 16384.53   1076571-1128366        7393    108913731 13295.37      1499529    17.16  1024.00
--     25 16387.75   1128367-1173085        6453    108900752 13293.75      1922087    22.00  1024.00
--     26 16386.75   1173086-1216082        6190    108783042 13279.37      3090744    35.37  1024.00
--     27 16385.73   1216083-1266760        7407    108920254 13296.16      1535365    17.57  1024.00
--     28 16387.14   1266761-1310244        6390    108914453 13295.42      1722997    19.72  1024.00
--     29 16385.40   1310245-1354016        6197    108771328 13277.95      3098324    35.46  1024.00
--     30 16384.19   1354017-1406767        7616    108900193 13293.72      1613554    18.47  1024.00
--     31 16384.61   1406768-1451151        6330    108898941 13293.53      1667321    19.08  1024.00
--     32 16385.99   1451152-1494334        6209    108780000 13279.00      3056879    34.98  1024.00
--     33 16385.01   1494335-1547877        7678    108894835 13293.07      1742531    19.94  1024.00
--     34 16386.46   1547878-1590074        6166    108916038 13295.61      1647199    18.85  1024.00
--     35 16384.79   1590075-1633990        6296    108767227 13277.45      3088418    35.34  1024.00
--     36 16384.63   1633991-1688492        7888    108874918 13290.64      1920970    21.98  1024.00
--     37 16387.12   1688493-1730471        6103    108916186 13295.62      1703841    19.50  1024.00
--     38 16384.41   1730472-1773078        6238    108777467 13278.70      2945847    33.71  1024.00
--     39 16384.63   1773079-1825948        7682    108881940 13291.49      1846553    21.13  1024.00
--     40  3636.23   1825949-1828702         389      4609979   562.75       128956     1.48  1024.00
--   ---- -------- ------------------- --------- ------------ -------- ------------ -------- --------
--                                                 4250007390              85183676
-- Finished stage 'readErrorDetectionConfigure', reset canuIteration.
--
-- Running jobs.  First attempt out of 2.
----------------------------------------
-- Starting 'red' concurrent execution on Fri Jan 16 14:18:18 2026 with 4531013.453 GB free disk space (40 processes; 22 concurrently)

    cd unitigging/3-overlapErrorAdjustment
    ./red.sh 1 > ./red.000001.out 2>&1
    ./red.sh 2 > ./red.000002.out 2>&1
    ./red.sh 3 > ./red.000003.out 2>&1
    ./red.sh 4 > ./red.000004.out 2>&1
    ./red.sh 5 > ./red.000005.out 2>&1
    ./red.sh 6 > ./red.000006.out 2>&1
    ./red.sh 7 > ./red.000007.out 2>&1
    ./red.sh 8 > ./red.000008.out 2>&1
    ./red.sh 9 > ./red.000009.out 2>&1
    ./red.sh 10 > ./red.000010.out 2>&1
    ./red.sh 11 > ./red.000011.out 2>&1
    ./red.sh 12 > ./red.000012.out 2>&1
    ./red.sh 13 > ./red.000013.out 2>&1
    ./red.sh 14 > ./red.000014.out 2>&1
    ./red.sh 15 > ./red.000015.out 2>&1
    ./red.sh 16 > ./red.000016.out 2>&1
    ./red.sh 17 > ./red.000017.out 2>&1
    ./red.sh 18 > ./red.000018.out 2>&1
    ./red.sh 19 > ./red.000019.out 2>&1
    ./red.sh 20 > ./red.000020.out 2>&1
    ./red.sh 21 > ./red.000021.out 2>&1
    ./red.sh 22 > ./red.000022.out 2>&1
    ./red.sh 23 > ./red.000023.out 2>&1
    ./red.sh 24 > ./red.000024.out 2>&1
    ./red.sh 25 > ./red.000025.out 2>&1
    ./red.sh 26 > ./red.000026.out 2>&1
    ./red.sh 27 > ./red.000027.out 2>&1
    ./red.sh 28 > ./red.000028.out 2>&1
    ./red.sh 29 > ./red.000029.out 2>&1
    ./red.sh 30 > ./red.000030.out 2>&1
    ./red.sh 31 > ./red.000031.out 2>&1
    ./red.sh 32 > ./red.000032.out 2>&1
    ./red.sh 33 > ./red.000033.out 2>&1
    ./red.sh 34 > ./red.000034.out 2>&1
    ./red.sh 35 > ./red.000035.out 2>&1
    ./red.sh 36 > ./red.000036.out 2>&1
    ./red.sh 37 > ./red.000037.out 2>&1
    ./red.sh 38 > ./red.000038.out 2>&1
    ./red.sh 39 > ./red.000039.out 2>&1
    ./red.sh 40 > ./red.000040.out 2>&1

-- Finished on Fri Jan 16 14:38:05 2026 (1187 seconds) with 4529256.109 GB free disk space
----------------------------------------
-- Found 40 read error detection output files.
-- Finished stage 'readErrorDetectionCheck', reset canuIteration.
--
-- Loading read lengths.
-- Loading number of overlaps per read.
--
-- Configure OEA for 8gb memory.
--                   Batches of at most (unlimited) reads.
--                                      300000000 bases.
--
--           Total                                               Reads                 Olaps  Adjusts
--    Job   Memory      Read Range         Reads        Bases   Memory        Olaps   Memory   Memory  (Memory in MB)
--   ---- -------- ------------------- --------- ------------ -------- ------------ -------- --------
--      1  2886.38         1-123539        17746    300016355   294.66      5728276   174.81   368.91
--      2  2905.35    123540-255834        19085    300021646   294.71      6348393   193.74   368.91
--      3  2904.38    255835-389299        19191    300001329   294.69      6317087   192.78   368.91
--      4  2904.62    389300-519627        18967    300013127   294.69      6324712   193.01   368.91
--      5  2880.80    519628-650194        18819    300002163   294.68      5544727   169.21   368.91
--      6  2878.13    650195-779238        18840    300016363   294.69      5456685   166.52   368.91
--      7  2896.69    779239-909228        18940    300004723   294.68      6065179   185.09   368.91
--      8  2890.37    909229-1036488       18601    300015623   294.68      5858214   178.78   368.91
--      9  2891.51   1036489-1164894       18531    300000344   294.67      5895948   179.93   368.91
--     10  2902.90   1164895-1292059       18517    300002095   294.67      6269142   191.32   368.91
--     11  2897.43   1292060-1422356       18681    300004041   294.68      6089907   185.85   368.91
--     12  2899.46   1422357-1551923       18588    300001100   294.67      6156578   187.88   368.91
--     13  2890.17   1551924-1677704       18183    300017542   294.67      5851855   178.58   368.91
--     14  2891.19   1677705-1800649       17958    300001396   294.65      5886013   179.63   368.91
--     15  2515.06   1800650-1828702        4025     49889543    55.70      1390960    42.45   368.91
--   ---- -------- ------------------- --------- ------------ -------- ------------ -------- --------
--                                                 4250007390              85183676
-- Finished stage 'overlapErrorAdjustmentConfigure', reset canuIteration.
--
-- Running jobs.  First attempt out of 2.
----------------------------------------
-- Starting 'oea' concurrent execution on Fri Jan 16 14:38:13 2026 with 4529260.656 GB free disk space (15 processes; 62 concurrently)

    cd unitigging/3-overlapErrorAdjustment
    ./oea.sh 1 > ./oea.000001.out 2>&1
    ./oea.sh 2 > ./oea.000002.out 2>&1
    ./oea.sh 3 > ./oea.000003.out 2>&1
    ./oea.sh 4 > ./oea.000004.out 2>&1
    ./oea.sh 5 > ./oea.000005.out 2>&1
    ./oea.sh 6 > ./oea.000006.out 2>&1
    ./oea.sh 7 > ./oea.000007.out 2>&1
    ./oea.sh 8 > ./oea.000008.out 2>&1
    ./oea.sh 9 > ./oea.000009.out 2>&1
    ./oea.sh 10 > ./oea.000010.out 2>&1
    ./oea.sh 11 > ./oea.000011.out 2>&1
    ./oea.sh 12 > ./oea.000012.out 2>&1
    ./oea.sh 13 > ./oea.000013.out 2>&1
    ./oea.sh 14 > ./oea.000014.out 2>&1
    ./oea.sh 15 > ./oea.000015.out 2>&1

-- Finished on Fri Jan 16 15:33:57 2026 (3344 seconds) with 4522999.437 GB free disk space
----------------------------------------
-- Found 15 overlap error adjustment output files.
-- Finished stage 'overlapErrorAdjustmentCheck', reset canuIteration.
----------------------------------------
-- Starting command on Fri Jan 16 15:33:57 2026 with 4522999.421 GB free disk space

    cd unitigging/3-overlapErrorAdjustment
    /share/org/YZWL/yzwl_lixg/miniforge3/envs/canu_v.2.3/bin/loadErates \
      -S ../../A3-52.seqStore \
      -O ../A3-52.ovlStore \
      -L ./oea.files \
    > ./oea.apply.err 2>&1

-- Finished on Fri Jan 16 15:33:57 2026 (furiously fast) with 4522999.25 GB free disk space
----------------------------------------
-- No report available.
-- Finished stage 'updateOverlapStore', reset canuIteration.
-- Finished stage 'unitig', reset canuIteration.
--
-- Running jobs.  First attempt out of 2.
----------------------------------------
-- Starting 'bat' concurrent execution on Fri Jan 16 15:33:57 2026 with 4522999.203 GB free disk space (1 processes; 1 concurrently)

    cd unitigging/4-unitigger
    ./unitigger.sh 1 > ./unitigger.000001.out 2>&1

-- Finished on Fri Jan 16 15:34:19 2026 (22 seconds) with 4522999.125 GB free disk space
----------------------------------------
-- Unitigger finished successfully.
--  
--  ERROR RATES
--  -----------
--                                                   --------threshold------
--  283757                       fraction error      fraction        percent
--  samples                              (1e-5)         error          error
--                   --------------------------      --------       --------
--  command line (-eg)                           ->     30.00        0.0300%
--  command line (-ef)                           ->  -----.--      ---.----%
--  command line (-eM)                           ->     30.00        0.0300%
--  mean + std.dev       0.38 +-  12 *     2.85  ->     34.58        0.0346%
--  median + mad         0.00 +-  12 *     0.00  ->      0.00        0.0000%
--  90th percentile                              ->      1.00        0.0010%  (enabled)
--  
--  BEST EDGE FILTERING
--  -------------------
--  At graph threshold 0.0300%, reads:
--    available to have edges:        48182
--    with at least one edge:         36092
--  
--  At max threshold 0.0300%, reads:
--    available to have edges:        48182
--    with at least one edge:         36092
--  
--  At tight threshold 0.0010%, reads with:
--    both edges below error threshold:     31720  (80.00% minReadsBest threshold = 28873)
--    one  edge  above error threshold:      3266
--    both edges above error threshold:      1106
--    at least one edge:                    36092
--  
--  At loose threshold 0.0300%, reads with:
--    both edges below error threshold:     36092  (80.00% minReadsBest threshold = 28873)
--    one  edge  above error threshold:         0
--    both edges above error threshold:         0
--    at least one edge:                    36092
--  
--  
--  INITIAL EDGES
--  -------- ----------------------------------------
--    210058 reads are contained
--   1588670 reads have no best edges (singleton)
--       484 reads have only one best edge (spur) 
--                254 are mutual best
--     29490 reads have two best edges 
--                866 have one mutual best edge
--              28185 have two mutual best edges
--  
--  
--  FINAL EDGES
--  -------- ----------------------------------------
--    210058 reads are contained
--   1589028 reads have no best edges (singleton)
--       364 reads have only one best edge (spur) 
--                276 are mutual best
--     29252 reads have two best edges 
--                724 have one mutual best edge
--              28179 have two mutual best edges
--  
--  
--  EDGE FILTERING
--  -------- ------------------------------------------
--         0 reads are ignored
--     12786 reads have a gap in overlap coverage
--       150 reads have lopsided best edges
-- Found, in version 1, after unitig construction:
--   contigs:      162 sequences, total length 69300308 bp (including 192 repeats of total length 4716636 bp).
--   bubbles:      183 sequences, total length 4606357 bp.
--   unassembled:  25209 sequences, total length 270904618 bp.
--
-- Contig sizes based on genome size 85mbp:
--
--            NG (bp)  LG (contigs)    sum (bp)
--         ----------  ------------  ----------
--     10     6285995             2    13307409
--     20     6239626             3    19547035
--     30     3415993             5    27497087
--     40     3051167             8    37037074
--     50     2713254            10    42719920
--     60     1719831            14    51744264
--     70      983909            20    59537974
--     80       21334            87    68005210
--
-- Finished stage 'unitigCheck', reset canuIteration.
----------------------------------------
-- Starting command on Fri Jan 16 15:34:19 2026 with 4522999.109 GB free disk space

    cd unitigging
    /share/org/YZWL/yzwl_lixg/miniforge3/envs/canu_v.2.3/bin/utgcns \
      -S ../A3-52.seqStore \
      -T  ./A3-52.ctgStore 1 \
      -partition 0.8 1.5 0.1 \
    > ./A3-52.ctgStore/partitioning.log 2>&1

-- Finished on Fri Jan 16 15:34:28 2026 (9 seconds) with 4522997.859 GB free disk space
----------------------------------------
-- Using slow alignment for consensus (iteration '0').
-- Configured 11 consensus jobs.
-- Finished stage 'consensusConfigure', reset canuIteration.
--
-- Local: cns       10.500 GB    8 CPUs x  11 jobs   115.500 GB  88 CPUs  (consensus)
--
--
-- Running jobs.  First attempt out of 2.
----------------------------------------
-- Starting 'cns' concurrent execution on Fri Jan 16 15:34:28 2026 with 4522997.828 GB free disk space (11 processes; 11 concurrently)

    cd unitigging/5-consensus
    ./consensus.sh 1 > ./consensus.000001.out 2>&1
    ./consensus.sh 2 > ./consensus.000002.out 2>&1
    ./consensus.sh 3 > ./consensus.000003.out 2>&1
    ./consensus.sh 4 > ./consensus.000004.out 2>&1
    ./consensus.sh 5 > ./consensus.000005.out 2>&1
    ./consensus.sh 6 > ./consensus.000006.out 2>&1
    ./consensus.sh 7 > ./consensus.000007.out 2>&1
    ./consensus.sh 8 > ./consensus.000008.out 2>&1
    ./consensus.sh 9 > ./consensus.000009.out 2>&1
    ./consensus.sh 10 > ./consensus.000010.out 2>&1
    ./consensus.sh 11 > ./consensus.000011.out 2>&1

-- Finished on Fri Jan 16 15:41:05 2026 (397 seconds) with 4521965.937 GB free disk space
----------------------------------------
-- Using slow alignment for consensus (iteration '1').
-- Configured 11 consensus jobs.
-- All 11 consensus jobs finished successfully.
-- Finished stage 'consensusCheck', reset canuIteration.
-- Using slow alignment for consensus (iteration '0').
-- Configured 11 consensus jobs.
----------------------------------------
-- Starting command on Fri Jan 16 15:41:06 2026 with 4521965.89 GB free disk space

    cd unitigging
    /share/org/YZWL/yzwl_lixg/miniforge3/envs/canu_v.2.3/bin/tgStoreLoad \
      -S ../A3-52.seqStore \
      -T  ./A3-52.ctgStore 2 \
      -L ./5-consensus/ctgcns.files \
    > ./5-consensus/ctgcns.files.ctgStoreLoad.err 2>&1

-- Finished on Fri Jan 16 15:41:06 2026 (like a bat out of hell) with 4521964.906 GB free disk space
----------------------------------------
----------------------------------------
-- Starting command on Fri Jan 16 15:41:06 2026 with 4521964.906 GB free disk space

    cd unitigging
    /share/org/YZWL/yzwl_lixg/miniforge3/envs/canu_v.2.3/bin/tgTigDisplay \
      -S ../A3-52.seqStore \
      -b \
      -o ../A3-52.contigs.unsorted.bam \
      -L ./5-consensus/ctgcns.files \
    > ./5-consensus/ctgcns.files.contigs.bam.err 2>&1

-- Finished on Fri Jan 16 15:44:10 2026 (184 seconds) with 4521730 GB free disk space
----------------------------------------
----------------------------------------
-- Starting command on Fri Jan 16 15:44:10 2026 with 4521730 GB free disk space

    cd .
    samtools sort \
      --write-index \
      --threads 2 \
      -o ./A3-52.contigs.bam ./A3-52.contigs.unsorted.bam \
    > ./ctgcns.bam.err 2>&1

-- Finished on Fri Jan 16 15:45:05 2026 (55 seconds) with 4521728.328 GB free disk space
----------------------------------------
-- Purging consensus output after loading to ctgStore.
-- Purged 11 .cns outputs.
----------------------------------------
-- Starting command on Fri Jan 16 15:45:05 2026 with 4521730.125 GB free disk space

    cd unitigging
    /share/org/YZWL/yzwl_lixg/miniforge3/envs/canu_v.2.3/bin/tgStoreDump \
      -S ../A3-52.seqStore \
      -T ./A3-52.ctgStore 2 \
      -sizes -s 85000000 \
    > ./A3-52.ctgStore/seqDB.v002.sizes.txt
ZERO length suplied to intervalList::add(), ignoring interval.
ZERO length suplied to intervalList::add(), ignoring interval.
ZERO length suplied to intervalList::add(), ignoring interval.
ZERO length suplied to intervalList::add(), ignoring interval.
ZERO length suplied to intervalList::add(), ignoring interval.
ZERO length suplied to intervalList::add(), ignoring interval.
ZERO length suplied to intervalList::add(), ignoring interval.
ZERO length suplied to intervalList::add(), ignoring interval.
ZERO length suplied to intervalList::add(), ignoring interval.
ZERO length suplied to intervalList::add(), ignoring interval.
ZERO length suplied to intervalList::add(), ignoring interval.
ZERO length suplied to intervalList::add(), ignoring interval.
ZERO length suplied to intervalList::add(), ignoring interval.
ZERO length suplied to intervalList::add(), ignoring interval.
ZERO length suplied to intervalList::add(), ignoring interval.
ZERO length suplied to intervalList::add(), ignoring interval.
ZERO length suplied to intervalList::add(), ignoring interval.
ZERO length suplied to intervalList::add(), ignoring interval.
ZERO length suplied to intervalList::add(), ignoring interval.
ZERO length suplied to intervalList::add(), ignoring interval.
ZERO length suplied to intervalList::add(), ignoring interval.
ZERO length suplied to intervalList::add(), ignoring interval.
ZERO length suplied to intervalList::add(), ignoring interval.
ZERO length suplied to intervalList::add(), ignoring interval.
ZERO length suplied to intervalList::add(), ignoring interval.
ZERO length suplied to intervalList::add(), ignoring interval.
ZERO length suplied to intervalList::add(), ignoring interval.
ZERO length suplied to intervalList::add(), ignoring interval.
ZERO length suplied to intervalList::add(), ignoring interval.
ZERO length suplied to intervalList::add(), ignoring interval.
ZERO length suplied to intervalList::add(), ignoring interval.
ZERO length suplied to intervalList::add(), ignoring interval.
ZERO length suplied to intervalList::add(), ignoring interval.
ZERO length suplied to intervalList::add(), ignoring interval.
ZERO length suplied to intervalList::add(), ignoring interval.
ZERO length suplied to intervalList::add(), ignoring interval.
ZERO length suplied to intervalList::add(), ignoring interval.
ZERO length suplied to intervalList::add(), ignoring interval.
ZERO length suplied to intervalList::add(), ignoring interval.
ZERO length suplied to intervalList::add(), ignoring interval.
ZERO length suplied to intervalList::add(), ignoring interval.
ZERO length suplied to intervalList::add(), ignoring interval.
ZERO length suplied to intervalList::add(), ignoring interval.
ZERO length suplied to intervalList::add(), ignoring interval.
ZERO length suplied to intervalList::add(), ignoring interval.
ZERO length suplied to intervalList::add(), ignoring interval.
ZERO length suplied to intervalList::add(), ignoring interval.
ZERO length suplied to intervalList::add(), ignoring interval.
ZERO length suplied to intervalList::add(), ignoring interval.
ZERO length suplied to intervalList::add(), ignoring interval.
ZERO length suplied to intervalList::add(), ignoring interval.
ZERO length suplied to intervalList::add(), ignoring interval.
ZERO length suplied to intervalList::add(), ignoring interval.
ZERO length suplied to intervalList::add(), ignoring interval.
ZERO length suplied to intervalList::add(), ignoring interval.
ZERO length suplied to intervalList::add(), ignoring interval.
ZERO length suplied to intervalList::add(), ignoring interval.
ZERO length suplied to intervalList::add(), ignoring interval.
ZERO length suplied to intervalList::add(), ignoring interval.
ZERO length suplied to intervalList::add(), ignoring interval.
ZERO length suplied to intervalList::add(), ignoring interval.
ZERO length suplied to intervalList::add(), ignoring interval.
ZERO length suplied to intervalList::add(), ignoring interval.
ZERO length suplied to intervalList::add(), ignoring interval.
ZERO length suplied to intervalList::add(), ignoring interval.
ZERO length suplied to intervalList::add(), ignoring interval.
ZERO length suplied to intervalList::add(), ignoring interval.
ZERO length suplied to intervalList::add(), ignoring interval.
ZERO length suplied to intervalList::add(), ignoring interval.
ZERO length suplied to intervalList::add(), ignoring interval.
ZERO length suplied to intervalList::add(), ignoring interval.
ZERO length suplied to intervalList::add(), ignoring interval.
ZERO length suplied to intervalList::add(), ignoring interval.
ZERO length suplied to intervalList::add(), ignoring interval.
ZERO length suplied to intervalList::add(), ignoring interval.
ZERO length suplied to intervalList::add(), ignoring interval.
ZERO length suplied to intervalList::add(), ignoring interval.
ZERO length suplied to intervalList::add(), ignoring interval.
ZERO length suplied to intervalList::add(), ignoring interval.
ZERO length suplied to intervalList::add(), ignoring interval.
ZERO length suplied to intervalList::add(), ignoring interval.
ZERO length suplied to intervalList::add(), ignoring interval.
ZERO length suplied to intervalList::add(), ignoring interval.
ZERO length suplied to intervalList::add(), ignoring interval.
ZERO length suplied to intervalList::add(), ignoring interval.
ZERO length suplied to intervalList::add(), ignoring interval.
ZERO length suplied to intervalList::add(), ignoring interval.
ZERO length suplied to intervalList::add(), ignoring interval.
ZERO length suplied to intervalList::add(), ignoring interval.
ZERO length suplied to intervalList::add(), ignoring interval.

-- Finished on Fri Jan 16 15:45:05 2026 (like a bat out of hell) with 4521730.125 GB free disk space
----------------------------------------
-- Found, in version 2, after consensus generation:
--   contigs:      162 sequences, total length 90601899 bp (including 192 repeats of total length 6407941 bp).
--   bubbles:      183 sequences, total length 6312888 bp.
--   unassembled:  25209 sequences, total length 394753885 bp.
--
-- Contig sizes based on genome size 85mbp:
--
--            NG (bp)  LG (contigs)    sum (bp)
--         ----------  ------------  ----------
--     10     9118027             1     9118027
--     20     8165053             2    17283080
--     30     5907726             4    31292186
--     40     4456073             5    35748259
--     50     4141298             7    44203313
--     60     3877574             9    52065072
--     70     3360050            12    62324547
--     80     2108093            15    69461663
--     90     1279224            20    77515016
--    100      560466            28    85017212
--
-- Finished stage 'consensusLoad', reset canuIteration.
----------------------------------------
-- Starting command on Fri Jan 16 15:45:05 2026 with 4521730.109 GB free disk space

    cd .
    /share/org/YZWL/yzwl_lixg/miniforge3/envs/canu_v.2.3/bin/tgStoreDump \
      -S ./A3-52.seqStore \
      -T ./unitigging/A3-52.ctgStore 2 \
      -o ./A3-52.contigs \
      -layout \
    > ./A3-52.contigs.layout.err 2>&1

-- Finished on Fri Jan 16 15:45:06 2026 (one second) with 4521731.078 GB free disk space
----------------------------------------
----------------------------------------
-- Starting command on Fri Jan 16 15:45:06 2026 with 4521731.078 GB free disk space

    cd .
    /share/org/YZWL/yzwl_lixg/miniforge3/envs/canu_v.2.3/bin/tgStoreDump \
      -S ./A3-52.seqStore \
      -T ./unitigging/A3-52.ctgStore 2 \
      -consensus -fasta \
      -unassembled \
    > ./A3-52.unassembled.fasta
    2> ./A3-52.unassembled.err
ZERO length suplied to intervalList::add(), ignoring interval.
ZERO length suplied to intervalList::add(), ignoring interval.
ZERO length suplied to intervalList::add(), ignoring interval.
ZERO length suplied to intervalList::add(), ignoring interval.
ZERO length suplied to intervalList::add(), ignoring interval.
ZERO length suplied to intervalList::add(), ignoring interval.
ZERO length suplied to intervalList::add(), ignoring interval.
ZERO length suplied to intervalList::add(), ignoring interval.
ZERO length suplied to intervalList::add(), ignoring interval.
ZERO length suplied to intervalList::add(), ignoring interval.
ZERO length suplied to intervalList::add(), ignoring interval.
ZERO length suplied to intervalList::add(), ignoring interval.
ZERO length suplied to intervalList::add(), ignoring interval.
ZERO length suplied to intervalList::add(), ignoring interval.
ZERO length suplied to intervalList::add(), ignoring interval.
ZERO length suplied to intervalList::add(), ignoring interval.
ZERO length suplied to intervalList::add(), ignoring interval.
ZERO length suplied to intervalList::add(), ignoring interval.
ZERO length suplied to intervalList::add(), ignoring interval.
ZERO length suplied to intervalList::add(), ignoring interval.
ZERO length suplied to intervalList::add(), ignoring interval.
ZERO length suplied to intervalList::add(), ignoring interval.
ZERO length suplied to intervalList::add(), ignoring interval.
ZERO length suplied to intervalList::add(), ignoring interval.
ZERO length suplied to intervalList::add(), ignoring interval.
ZERO length suplied to intervalList::add(), ignoring interval.
ZERO length suplied to intervalList::add(), ignoring interval.
ZERO length suplied to intervalList::add(), ignoring interval.
ZERO length suplied to intervalList::add(), ignoring interval.
ZERO length suplied to intervalList::add(), ignoring interval.
ZERO length suplied to intervalList::add(), ignoring interval.
ZERO length suplied to intervalList::add(), ignoring interval.
ZERO length suplied to intervalList::add(), ignoring interval.
ZERO length suplied to intervalList::add(), ignoring interval.
ZERO length suplied to intervalList::add(), ignoring interval.
ZERO length suplied to intervalList::add(), ignoring interval.
ZERO length suplied to intervalList::add(), ignoring interval.
ZERO length suplied to intervalList::add(), ignoring interval.
ZERO length suplied to intervalList::add(), ignoring interval.
ZERO length suplied to intervalList::add(), ignoring interval.
ZERO length suplied to intervalList::add(), ignoring interval.
ZERO length suplied to intervalList::add(), ignoring interval.
ZERO length suplied to intervalList::add(), ignoring interval.
ZERO length suplied to intervalList::add(), ignoring interval.
ZERO length suplied to intervalList::add(), ignoring interval.
ZERO length suplied to intervalList::add(), ignoring interval.
ZERO length suplied to intervalList::add(), ignoring interval.
ZERO length suplied to intervalList::add(), ignoring interval.
ZERO length suplied to intervalList::add(), ignoring interval.
ZERO length suplied to intervalList::add(), ignoring interval.
ZERO length suplied to intervalList::add(), ignoring interval.
ZERO length suplied to intervalList::add(), ignoring interval.
ZERO length suplied to intervalList::add(), ignoring interval.
ZERO length suplied to intervalList::add(), ignoring interval.
ZERO length suplied to intervalList::add(), ignoring interval.
ZERO length suplied to intervalList::add(), ignoring interval.
ZERO length suplied to intervalList::add(), ignoring interval.
ZERO length suplied to intervalList::add(), ignoring interval.
ZERO length suplied to intervalList::add(), ignoring interval.
ZERO length suplied to intervalList::add(), ignoring interval.
ZERO length suplied to intervalList::add(), ignoring interval.
ZERO length suplied to intervalList::add(), ignoring interval.
ZERO length suplied to intervalList::add(), ignoring interval.
ZERO length suplied to intervalList::add(), ignoring interval.
ZERO length suplied to intervalList::add(), ignoring interval.
ZERO length suplied to intervalList::add(), ignoring interval.
ZERO length suplied to intervalList::add(), ignoring interval.
ZERO length suplied to intervalList::add(), ignoring interval.
ZERO length suplied to intervalList::add(), ignoring interval.
ZERO length suplied to intervalList::add(), ignoring interval.
ZERO length suplied to intervalList::add(), ignoring interval.
ZERO length suplied to intervalList::add(), ignoring interval.
ZERO length suplied to intervalList::add(), ignoring interval.
ZERO length suplied to intervalList::add(), ignoring interval.
ZERO length suplied to intervalList::add(), ignoring interval.
ZERO length suplied to intervalList::add(), ignoring interval.
ZERO length suplied to intervalList::add(), ignoring interval.
ZERO length suplied to intervalList::add(), ignoring interval.
ZERO length suplied to intervalList::add(), ignoring interval.
ZERO length suplied to intervalList::add(), ignoring interval.
ZERO length suplied to intervalList::add(), ignoring interval.
ZERO length suplied to intervalList::add(), ignoring interval.
ZERO length suplied to intervalList::add(), ignoring interval.
ZERO length suplied to intervalList::add(), ignoring interval.
ZERO length suplied to intervalList::add(), ignoring interval.
ZERO length suplied to intervalList::add(), ignoring interval.
ZERO length suplied to intervalList::add(), ignoring interval.
ZERO length suplied to intervalList::add(), ignoring interval.
ZERO length suplied to intervalList::add(), ignoring interval.
ZERO length suplied to intervalList::add(), ignoring interval.

-- Finished on Fri Jan 16 15:45:08 2026 (2 seconds) with 4521709.359 GB free disk space
----------------------------------------
----------------------------------------
-- Starting command on Fri Jan 16 15:45:08 2026 with 4521709.359 GB free disk space

    cd .
    /share/org/YZWL/yzwl_lixg/miniforge3/envs/canu_v.2.3/bin/tgStoreDump \
      -S ./A3-52.seqStore \
      -T ./unitigging/A3-52.ctgStore 2 \
      -consensus -fasta \
      -contigs \
    > ./A3-52.contigs.fasta
    2> ./A3-52.contigs.err
ZERO length suplied to intervalList::add(), ignoring interval.
ZERO length suplied to intervalList::add(), ignoring interval.
ZERO length suplied to intervalList::add(), ignoring interval.
ZERO length suplied to intervalList::add(), ignoring interval.
ZERO length suplied to intervalList::add(), ignoring interval.
ZERO length suplied to intervalList::add(), ignoring interval.
ZERO length suplied to intervalList::add(), ignoring interval.
ZERO length suplied to intervalList::add(), ignoring interval.
ZERO length suplied to intervalList::add(), ignoring interval.
ZERO length suplied to intervalList::add(), ignoring interval.
ZERO length suplied to intervalList::add(), ignoring interval.
ZERO length suplied to intervalList::add(), ignoring interval.
ZERO length suplied to intervalList::add(), ignoring interval.
ZERO length suplied to intervalList::add(), ignoring interval.
ZERO length suplied to intervalList::add(), ignoring interval.
ZERO length suplied to intervalList::add(), ignoring interval.
ZERO length suplied to intervalList::add(), ignoring interval.
ZERO length suplied to intervalList::add(), ignoring interval.
ZERO length suplied to intervalList::add(), ignoring interval.
ZERO length suplied to intervalList::add(), ignoring interval.
ZERO length suplied to intervalList::add(), ignoring interval.
ZERO length suplied to intervalList::add(), ignoring interval.
ZERO length suplied to intervalList::add(), ignoring interval.
ZERO length suplied to intervalList::add(), ignoring interval.
ZERO length suplied to intervalList::add(), ignoring interval.
ZERO length suplied to intervalList::add(), ignoring interval.
ZERO length suplied to intervalList::add(), ignoring interval.
ZERO length suplied to intervalList::add(), ignoring interval.
ZERO length suplied to intervalList::add(), ignoring interval.
ZERO length suplied to intervalList::add(), ignoring interval.
ZERO length suplied to intervalList::add(), ignoring interval.
ZERO length suplied to intervalList::add(), ignoring interval.
ZERO length suplied to intervalList::add(), ignoring interval.
ZERO length suplied to intervalList::add(), ignoring interval.
ZERO length suplied to intervalList::add(), ignoring interval.
ZERO length suplied to intervalList::add(), ignoring interval.
ZERO length suplied to intervalList::add(), ignoring interval.
ZERO length suplied to intervalList::add(), ignoring interval.
ZERO length suplied to intervalList::add(), ignoring interval.
ZERO length suplied to intervalList::add(), ignoring interval.
ZERO length suplied to intervalList::add(), ignoring interval.
ZERO length suplied to intervalList::add(), ignoring interval.
ZERO length suplied to intervalList::add(), ignoring interval.
ZERO length suplied to intervalList::add(), ignoring interval.
ZERO length suplied to intervalList::add(), ignoring interval.
ZERO length suplied to intervalList::add(), ignoring interval.
ZERO length suplied to intervalList::add(), ignoring interval.
ZERO length suplied to intervalList::add(), ignoring interval.
ZERO length suplied to intervalList::add(), ignoring interval.
ZERO length suplied to intervalList::add(), ignoring interval.
ZERO length suplied to intervalList::add(), ignoring interval.
ZERO length suplied to intervalList::add(), ignoring interval.
ZERO length suplied to intervalList::add(), ignoring interval.
ZERO length suplied to intervalList::add(), ignoring interval.
ZERO length suplied to intervalList::add(), ignoring interval.
ZERO length suplied to intervalList::add(), ignoring interval.
ZERO length suplied to intervalList::add(), ignoring interval.
ZERO length suplied to intervalList::add(), ignoring interval.
ZERO length suplied to intervalList::add(), ignoring interval.
ZERO length suplied to intervalList::add(), ignoring interval.
ZERO length suplied to intervalList::add(), ignoring interval.
ZERO length suplied to intervalList::add(), ignoring interval.
ZERO length suplied to intervalList::add(), ignoring interval.
ZERO length suplied to intervalList::add(), ignoring interval.
ZERO length suplied to intervalList::add(), ignoring interval.
ZERO length suplied to intervalList::add(), ignoring interval.
ZERO length suplied to intervalList::add(), ignoring interval.
ZERO length suplied to intervalList::add(), ignoring interval.
ZERO length suplied to intervalList::add(), ignoring interval.
ZERO length suplied to intervalList::add(), ignoring interval.
ZERO length suplied to intervalList::add(), ignoring interval.
ZERO length suplied to intervalList::add(), ignoring interval.
ZERO length suplied to intervalList::add(), ignoring interval.
ZERO length suplied to intervalList::add(), ignoring interval.
ZERO length suplied to intervalList::add(), ignoring interval.
ZERO length suplied to intervalList::add(), ignoring interval.
ZERO length suplied to intervalList::add(), ignoring interval.
ZERO length suplied to intervalList::add(), ignoring interval.
ZERO length suplied to intervalList::add(), ignoring interval.
ZERO length suplied to intervalList::add(), ignoring interval.
ZERO length suplied to intervalList::add(), ignoring interval.
ZERO length suplied to intervalList::add(), ignoring interval.
ZERO length suplied to intervalList::add(), ignoring interval.
ZERO length suplied to intervalList::add(), ignoring interval.
ZERO length suplied to intervalList::add(), ignoring interval.
ZERO length suplied to intervalList::add(), ignoring interval.
ZERO length suplied to intervalList::add(), ignoring interval.
ZERO length suplied to intervalList::add(), ignoring interval.
ZERO length suplied to intervalList::add(), ignoring interval.
ZERO length suplied to intervalList::add(), ignoring interval.

-- Finished on Fri Jan 16 15:45:08 2026 (lickety-split) with 4521709.25 GB free disk space
----------------------------------------
-- Finished stage 'generateOutputs', reset canuIteration.
--
-- Assembly 'A3-52' finished in '/share/org/YZWL/yzwl_lixg/project/28.大豆疫霉菌三代基因组/03.hicanu/A3-52/01.raw_output'.
--
-- Summary saved in 'A3-52.report'.
--
-- Sequences saved:
--   Contigs       -> 'A3-52.contigs.fasta'
--   Unassembled   -> 'A3-52.unassembled.fasta'
--
-- Read layouts saved:
--   Contigs       -> 'A3-52.contigs.layout'.
--
-- Bye.

2026-01-16 15:45:09.007 - WARNING - 输出文件不存在|Output file does not exist: /share/org/YZWL/yzwl_lixg/project/28.大豆疫霉菌三代基因组/03.hicanu/A3-52/01.raw_output/A3-52.unitigs.fasta
Job 68889959 stderr output:

