Usage: biopytools ragtag [OPTIONS]
Try 'biopytools ragtag -h' for help.

Error: Invalid value for '-r' / '--reference': 文件不存在|File does not exist: /share/org/YZWL/yzwl_lixg/project/28.大豆疫霉菌三代基因组/04.ragtag/Psoja_T2T.fa
Usage: biopytools genomesyn [OPTIONS]
Try 'biopytools genomesyn -h' for help.

Error: Invalid value for '-i' / '--ref': Path '04.ragtag/A3-17/hifiasm/A3-17_RagTag_scaffolded.fa' does not exist.
2026-01-16 01:48:54.221 - WARNING - 命令错误输出|Command stderr:
-- canu master +27 changes (r10515 2a41e933b8de6ed66723d75d36dd071b46d2c347)
--
-- CITATIONS
--
-- For assemblies of PacBio HiFi reads:
--   Nurk S, Walenz BP, Rhiea A, Vollger MR, Logsdon GA, Grothe R, Miga KH, Eichler EE, Phillippy AM, Koren S.
--   HiCanu: accurate assembly of segmental duplications, satellites, and allelic variants from high-fidelity long reads.
--   biorXiv. 2020.
--   https://doi.org/10.1101/2020.03.14.992248
-- 
-- Read and contig alignments during correction and consensus use:
--   Šošic M, Šikic M.
--   Edlib: a C/C ++ library for fast, exact sequence alignment using edit distance.
--   Bioinformatics. 2017 May 1;33(9):1394-1395.
--   http://doi.org/10.1093/bioinformatics/btw753
-- 
-- Overlaps are generated using:
--   Berlin K, et al.
--   Assembling large genomes with single-molecule sequencing and locality-sensitive hashing.
--   Nat Biotechnol. 2015 Jun;33(6):623-30.
--   http://doi.org/10.1038/nbt.3238
-- 
--   Myers EW, et al.
--   A Whole-Genome Assembly of Drosophila.
--   Science. 2000 Mar 24;287(5461):2196-204.
--   http://doi.org/10.1126/science.287.5461.2196
-- 
-- Contig consensus sequences are generated using an algorithm derived from pbdagcon:
--   Chin CS, et al.
--   Nonhybrid, finished microbial genome assemblies from long-read SMRT sequencing data.
--   Nat Methods. 2013 Jun;10(6):563-9
--   http://doi.org/10.1038/nmeth.2474
-- 
-- CONFIGURE CANU
--
-- Detected Java(TM) Runtime Environment '17.0.15-internal' (from '/share/org/YZWL/yzwl_lixg/.local/bin/java') without -d64 support.
--
-- WARNING:
-- WARNING:  Failed to run gnuplot using command 'gnuplot'.
-- WARNING:  Plots will be disabled.
-- WARNING:
--
-- Detected samtools version '1.22' / htslib version 'htscodecs=1.6.3' (from 'samtools').
--
-- Detected 88 CPUs and 503 gigabytes of memory on the local machine.
--
-- Detected Slurm with 'sinfo' binary in /opt/skyformai/bin/sinfo.
--          Slurm disabled by useGrid=false
--
-- Detected  '' with 'pbsnodes' binary in /opt/skyformai/bin/pbsnodes.
--           disabled by useGrid=false
--
-- Detected LSF with 'bsub' binary in /opt/skyformai/bin/bsub.
--          LSF disabled by useGrid=false
--
-- Local machine mode enabled; grid support not detected or not allowed.
--
-- Found trimmed raw PacBio HiFi reads in the input files.
--
--                                (tag)Concurrency
--                         (tag)Threads          |
--                (tag)Memory         |          |
--        (tag)             |         |          |       total usage      algorithm
--        -------  ----------  --------   --------  --------------------  -----------------------------
-- Local: meryl     12.000 GB    4 CPUs x  22 jobs   264.000 GB  88 CPUs  (k-mer counting)
-- Local: cormhap   13.000 GB   11 CPUs x   8 jobs   104.000 GB  88 CPUs  (overlap detection with mhap)
-- Local: obtovl     8.000 GB    8 CPUs x  11 jobs    88.000 GB  88 CPUs  (overlap detection)
-- Local: utgovl     8.000 GB    8 CPUs x  11 jobs    88.000 GB  88 CPUs  (overlap detection)
-- Local: cor        -.--- GB    4 CPUs x   - jobs     -.--- GB   - CPUs  (read correction)
-- Local: ovb        4.000 GB    1 CPU  x  88 jobs   352.000 GB  88 CPUs  (overlap store bucketizer)
-- Local: ovs        8.000 GB    1 CPU  x  62 jobs   496.000 GB  62 CPUs  (overlap store sorting)
-- Local: red       16.000 GB    4 CPUs x  22 jobs   352.000 GB  88 CPUs  (read error detection)
-- Local: oea        8.000 GB    1 CPU  x  62 jobs   496.000 GB  62 CPUs  (overlap error adjustment)
-- Local: bat       32.000 GB    8 CPUs x   1 job     32.000 GB   8 CPUs  (contig construction with bogart)
-- Local: cns        -.--- GB    8 CPUs x   - jobs     -.--- GB   - CPUs  (consensus)
--
-- Generating assembly 'A3-17' in '/share/org/YZWL/yzwl_lixg/project/28.大豆疫霉菌三代基因组/03.hicanu/A3-17/01.raw_output':
--   genomeSize:
--     85000000
--
--   Overlap Generation Limits:
--     corOvlErrorRate 0.0000 (  0.00%)
--     obtOvlErrorRate 0.0250 (  2.50%)
--     utgOvlErrorRate 0.0100 (  1.00%)
--
--   Overlap Processing Limits:
--     corErrorRate    0.0000 (  0.00%)
--     obtErrorRate    0.0250 (  2.50%)
--     utgErrorRate    0.0003 (  0.03%)
--     cnsErrorRate    0.0500 (  5.00%)
--
--   Stages to run:
--     assemble HiFi reads.
--
--
-- BEGIN STORE CREATION
----------------------------------------
-- Starting command on Fri Jan 16 00:26:01 2026 with 4563934.875 GB free disk space

    cd .
    ./A3-17.seqStore.sh \
    > ./A3-17.seqStore.err 2>&1

-- Finished on Fri Jan 16 00:32:58 2026 (417 seconds) with 4562862.312 GB free disk space
----------------------------------------
--
-- In sequence store './A3-17.seqStore':
--   Found 281345 reads.
--   Found 4250012604 bases (50 times coverage).
--    Histogram of corrected reads:
--    
--    G=4250012604                       sum of  ||               length     num
--    NG         length     index       lengths  ||                range    seqs
--    ----- ------------ --------- ------------  ||  ------------------- -------
--    00010        26488     14656    425022403  ||       1245-2530        12641|--------------------------------
--    00020        24030     31561    850008716  ||       2531-3816        17832|--------------------------------------------
--    00030        22335     49929   1275020124  ||       3817-5102        16478|-----------------------------------------
--    00040        20994     69573   1700016727  ||       5103-6388        14001|-----------------------------------
--    00050        19821     90414   2125006491  ||       6389-7674        11877|------------------------------
--    00060        18716    112478   2550015723  ||       7675-8960        10068|-------------------------
--    00070        17470    135943   2975010140  ||       8961-10246        8690|----------------------
--    00080        15457    161587   3400012304  ||      10247-11532        7274|------------------
--    00090         9301    195954   3825014785  ||      11533-12818        6215|----------------
--    00100         1245    281345   4250012604  ||      12819-14104        5880|---------------
--    001.000x              281345   4250012604  ||      14105-15390        8239|---------------------
--                                               ||      15391-16676       14167|-----------------------------------
--                                               ||      16677-17962       20812|----------------------------------------------------
--                                               ||      17963-19248       25533|---------------------------------------------------------------
--                                               ||      19249-20534       24294|------------------------------------------------------------
--                                               ||      20535-21820       20437|---------------------------------------------------
--                                               ||      21821-23106       15993|----------------------------------------
--                                               ||      23107-24392       12468|-------------------------------
--                                               ||      24393-25678        9316|-----------------------
--                                               ||      25679-26964        6574|-----------------
--                                               ||      26965-28250        4655|------------
--                                               ||      28251-29536        3211|--------
--                                               ||      29537-30822        2048|------
--                                               ||      30823-32108        1241|----
--                                               ||      32109-33394         731|--
--                                               ||      33395-34680         372|-
--                                               ||      34681-35966         178|-
--                                               ||      35967-37252          83|-
--                                               ||      37253-38538          20|-
--                                               ||      38539-39824          10|-
--                                               ||      39825-41110           1|-
--                                               ||      41111-42396           2|-
--                                               ||      42397-43682           2|-
--                                               ||      43683-44968           0|
--                                               ||      44969-46254           0|
--                                               ||      46255-47540           0|
--                                               ||      47541-48826           1|-
--                                               ||      48827-50112           0|
--                                               ||      50113-51398           0|
--                                               ||      51399-52684           1|-
--    
--
-- In sequence store './A3-17.seqStore':
--   Found 281345 reads.
--   Found 4250012604 bases (50 times coverage).
--    Histogram of corrected-trimmed reads:
--    
--    G=4250012604                       sum of  ||               length     num
--    NG         length     index       lengths  ||                range    seqs
--    ----- ------------ --------- ------------  ||  ------------------- -------
--    00010        26488     14656    425022403  ||       1245-2530        12641|--------------------------------
--    00020        24030     31561    850008716  ||       2531-3816        17832|--------------------------------------------
--    00030        22335     49929   1275020124  ||       3817-5102        16478|-----------------------------------------
--    00040        20994     69573   1700016727  ||       5103-6388        14001|-----------------------------------
--    00050        19821     90414   2125006491  ||       6389-7674        11877|------------------------------
--    00060        18716    112478   2550015723  ||       7675-8960        10068|-------------------------
--    00070        17470    135943   2975010140  ||       8961-10246        8690|----------------------
--    00080        15457    161587   3400012304  ||      10247-11532        7274|------------------
--    00090         9301    195954   3825014785  ||      11533-12818        6215|----------------
--    00100         1245    281345   4250012604  ||      12819-14104        5880|---------------
--    001.000x              281345   4250012604  ||      14105-15390        8239|---------------------
--                                               ||      15391-16676       14167|-----------------------------------
--                                               ||      16677-17962       20812|----------------------------------------------------
--                                               ||      17963-19248       25533|---------------------------------------------------------------
--                                               ||      19249-20534       24294|------------------------------------------------------------
--                                               ||      20535-21820       20437|---------------------------------------------------
--                                               ||      21821-23106       15993|----------------------------------------
--                                               ||      23107-24392       12468|-------------------------------
--                                               ||      24393-25678        9316|-----------------------
--                                               ||      25679-26964        6574|-----------------
--                                               ||      26965-28250        4655|------------
--                                               ||      28251-29536        3211|--------
--                                               ||      29537-30822        2048|------
--                                               ||      30823-32108        1241|----
--                                               ||      32109-33394         731|--
--                                               ||      33395-34680         372|-
--                                               ||      34681-35966         178|-
--                                               ||      35967-37252          83|-
--                                               ||      37253-38538          20|-
--                                               ||      38539-39824          10|-
--                                               ||      39825-41110           1|-
--                                               ||      41111-42396           2|-
--                                               ||      42397-43682           2|-
--                                               ||      43683-44968           0|
--                                               ||      44969-46254           0|
--                                               ||      46255-47540           0|
--                                               ||      47541-48826           1|-
--                                               ||      48827-50112           0|
--                                               ||      50113-51398           0|
--                                               ||      51399-52684           1|-
--    
--
-- Correction skipped; not enabled.
--
-- Trimming skipped; not enabled.
--
-- BEGIN ASSEMBLY
----------------------------------------
-- Starting command on Fri Jan 16 00:32:58 2026 with 4562862.234 GB free disk space

    cd unitigging/0-mercounts
    ./meryl-configure.sh \
    > ./meryl-configure.err 2>&1

-- Finished on Fri Jan 16 00:32:59 2026 (one second) with 4562862.234 GB free disk space
----------------------------------------
--  segments   memory batches
--  -------- -------- -------
--        01 10.81 GB       2
--        02  5.61 GB       2
--        04  2.97 GB       2
--        06  2.15 GB       2
--        08  1.61 GB       2
--        12  1.07 GB       2
--        16  0.81 GB       2
--        20  0.65 GB       2
--        24  0.54 GB       2
--        32  0.41 GB       2
--        40  0.33 GB       2
--        48  -.-- GB       -  (segment size too small)
--        56  -.-- GB       -  (segment size too small)
--        64  -.-- GB       -  (segment size too small)
--        96  -.-- GB       -  (segment size too small)
--
--  For 281345 reads with 4250012604 bases, limit to 42 batches.
--  Will count kmers using 01 jobs, each using 12 GB and 4 threads.
--
-- Finished stage 'merylConfigure', reset canuIteration.
--
-- Running jobs.  First attempt out of 2.
----------------------------------------
-- Starting 'meryl' concurrent execution on Fri Jan 16 00:32:59 2026 with 4562862.187 GB free disk space (1 processes; 22 concurrently)

    cd unitigging/0-mercounts
    ./meryl-count.sh 1 > ./meryl-count.000001.out 2>&1

-- Finished on Fri Jan 16 00:36:28 2026 (209 seconds) with 4562340.703 GB free disk space
----------------------------------------
-- Found 1 Kmer counting (meryl) outputs.
-- Finished stage 'utg-merylCountCheck', reset canuIteration.
--
-- Running jobs.  First attempt out of 2.
----------------------------------------
-- Starting 'meryl' concurrent execution on Fri Jan 16 00:36:28 2026 with 4562340.671 GB free disk space (1 processes; 22 concurrently)

    cd unitigging/0-mercounts
    ./meryl-process.sh 1 > ./meryl-process.000001.out 2>&1

-- Finished on Fri Jan 16 00:36:34 2026 (6 seconds) with 4562341.375 GB free disk space
----------------------------------------
-- Meryl finished successfully.  Kmer frequency histogram:
--
-- WARNING: gnuplot failed.
--
----------------------------------------
--
--  22-mers                                                                                           Fraction
--    Occurrences   NumMers                                                                         Unique Total
--       1-     1         0                                                                        0.0000 0.0000
--       2-     2    184342                                                                        0.0041 0.0001
--       3-     4     60427                                                                        0.0050 0.0002
--       5-     7     21047                                                                        0.0056 0.0002
--       8-    11     21786                                                                        0.0059 0.0003
--      12-    16    106209                                                                        0.0066 0.0003
--      17-    22    348982 *                                                                      0.0095 0.0010
--      23-    29    935669 ****                                                                   0.0182 0.0035
--      30-    37   5185104 **********************                                                 0.0427 0.0130
--      38-    46  16048546 ********************************************************************** 0.1803 0.0816
--      47-    56  14331044 **************************************************************         0.5492 0.3058
--      57-    67   3245836 **************                                                         0.8361 0.5139
--      68-    79    634316 **                                                                     0.8943 0.5639
--      80-    92    991527 ****                                                                   0.9084 0.5787
--      93-   106    862399 ***                                                                    0.9306 0.6060
--     107-   121    288010 *                                                                      0.9487 0.6312
--     122-   137    276469 *                                                                      0.9546 0.6407
--     138-   154    281821 *                                                                      0.9608 0.6521
--     155-   172    172626                                                                        0.9669 0.6646
--     173-   191    151487                                                                        0.9706 0.6732
--     192-   211    117515                                                                        0.9739 0.6816
--     212-   232    116469                                                                        0.9764 0.6890
--     233-   254     97665                                                                        0.9790 0.6970
--     255-   277     85426                                                                        0.9811 0.7043
--     278-   301     74527                                                                        0.9830 0.7112
--     302-   326     74097                                                                        0.9846 0.7180
--     327-   352     53567                                                                        0.9862 0.7251
--     353-   379     42712                                                                        0.9874 0.7308
--     380-   407     36999                                                                        0.9884 0.7355
--     408-   436     37672                                                                        0.9892 0.7400
--     437-   466     38011                                                                        0.9900 0.7450
--     467-   497     32876                                                                        0.9908 0.7503
--     498-   529     28068                                                                        0.9915 0.7551
--     530-   562     23397                                                                        0.9922 0.7596
--     563-   596     20429                                                                        0.9927 0.7636
--     597-   631     18228                                                                        0.9931 0.7672
--     632-   667     14455                                                                        0.9935 0.7707
--     668-   704     14425                                                                        0.9938 0.7736
--     705-   742     12785                                                                        0.9942 0.7766
--     743-   781     12723                                                                        0.9944 0.7795
--     782-   821     11257                                                                        0.9947 0.7825
--
--           0 (max occurrences)
--  3224317003 (total mers, non-unique)
--    45338997 (distinct mers, non-unique)
--           0 (unique mers)
-- Finished stage 'meryl-process', reset canuIteration.
--
-- Removing meryl database 'unitigging/0-mercounts/A3-17.ms22'.
--
-- OVERLAPPER (normal) (assembly) erate=0.01
--
----------------------------------------
-- Starting command on Fri Jan 16 00:36:34 2026 with 4562341.359 GB free disk space

    cd unitigging/1-overlapper
    /share/org/YZWL/yzwl_lixg/miniforge3/envs/canu_v.2.3/bin/overlapInCorePartition \
     -S  ../../A3-17.seqStore \
     -hl 160000000 \
     -rl 5000000000 \
     -ol 500 \
     -o  ./A3-17.partition \
    > ./A3-17.partition.err 2>&1

-- Finished on Fri Jan 16 00:36:34 2026 (in the blink of an eye) with 4562341.343 GB free disk space
----------------------------------------
--
-- Configured 21 overlapInCore jobs.
-- Finished stage 'utg-overlapConfigure', reset canuIteration.
--
-- Running jobs.  First attempt out of 2.
----------------------------------------
-- Starting 'utgovl' concurrent execution on Fri Jan 16 00:36:34 2026 with 4562341.312 GB free disk space (21 processes; 11 concurrently)

    cd unitigging/1-overlapper
    ./overlap.sh 1 > ./overlap.000001.out 2>&1
    ./overlap.sh 2 > ./overlap.000002.out 2>&1
    ./overlap.sh 3 > ./overlap.000003.out 2>&1
    ./overlap.sh 4 > ./overlap.000004.out 2>&1
    ./overlap.sh 5 > ./overlap.000005.out 2>&1
    ./overlap.sh 6 > ./overlap.000006.out 2>&1
    ./overlap.sh 7 > ./overlap.000007.out 2>&1
    ./overlap.sh 8 > ./overlap.000008.out 2>&1
    ./overlap.sh 9 > ./overlap.000009.out 2>&1
    ./overlap.sh 10 > ./overlap.000010.out 2>&1
    ./overlap.sh 11 > ./overlap.000011.out 2>&1
    ./overlap.sh 12 > ./overlap.000012.out 2>&1
    ./overlap.sh 13 > ./overlap.000013.out 2>&1
    ./overlap.sh 14 > ./overlap.000014.out 2>&1
    ./overlap.sh 15 > ./overlap.000015.out 2>&1
    ./overlap.sh 16 > ./overlap.000016.out 2>&1
    ./overlap.sh 17 > ./overlap.000017.out 2>&1
    ./overlap.sh 18 > ./overlap.000018.out 2>&1
    ./overlap.sh 19 > ./overlap.000019.out 2>&1
    ./overlap.sh 20 > ./overlap.000020.out 2>&1
    ./overlap.sh 21 > ./overlap.000021.out 2>&1

-- Finished on Fri Jan 16 01:05:07 2026 (1713 seconds) with 4557885.921 GB free disk space
----------------------------------------
-- Found 21 overlapInCore output files.
--
-- overlapInCore compute 'unitigging/1-overlapper':
--   kmer hits
--     with no overlap       1330593773  08.2380952 +- 38977423.001
--     with an overlap         23078627  2.23809524 +- 601696.276
--
--   overlaps                  23078627  2.23809524 +- 601696.276
--     contained                6732205  1.19047619 +- 171300.649
--     dovetail                16346422  .047619048 +- 433395.224
--
--   overlaps rejected
--     multiple per pair              0           0 +- 0
--     bad short window               0           0 +- 0
--     bad long window                0           0 +- 0
-- Finished stage 'utg-overlapCheck', reset canuIteration.
----------------------------------------
-- Starting command on Fri Jan 16 01:05:07 2026 with 4557885.906 GB free disk space

    cd unitigging
    /share/org/YZWL/yzwl_lixg/miniforge3/envs/canu_v.2.3/bin/ovStoreConfig \
     -S ../A3-17.seqStore \
     -M 4-8 \
     -L ./1-overlapper/ovljob.files \
     -create ./A3-17.ovlStore.config \
     > ./A3-17.ovlStore.config.txt \
    2> ./A3-17.ovlStore.config.err

-- Finished on Fri Jan 16 01:05:07 2026 (furiously fast) with 4557885.89 GB free disk space
----------------------------------------
--
-- Creating overlap store unitigging/A3-17.ovlStore using:
--      1 bucket
--      1 slice
--        using at most 2 GB memory each
--
-- Running jobs.  First attempt out of 2.
----------------------------------------
-- Starting 'ovS' concurrent execution on Fri Jan 16 01:05:07 2026 with 4557885.875 GB free disk space (1 processes; 62 concurrently)

    cd unitigging
    ./A3-17.ovlStore.sh 1 > ./A3-17.ovlStore.000001.out 2>&1

-- Finished on Fri Jan 16 01:05:17 2026 (10 seconds) with 4557845.531 GB free disk space
----------------------------------------
-- Checking store.
----------------------------------------
-- Starting command on Fri Jan 16 01:05:17 2026 with 4557845.531 GB free disk space

    cd unitigging
    /share/org/YZWL/yzwl_lixg/miniforge3/envs/canu_v.2.3/bin/ovStoreDump \
     -S ../A3-17.seqStore \
     -O  ./A3-17.ovlStore \
     -counts \
     > ./A3-17.ovlStore/counts.dat 2> ./A3-17.ovlStore/counts.err

-- Finished on Fri Jan 16 01:05:17 2026 (in the blink of an eye) with 4557845.484 GB free disk space
----------------------------------------
--
-- Overlap store 'unitigging/A3-17.ovlStore' successfully constructed.
-- Found 46157254 overlaps for 271932 reads; 1538309 reads have no overlaps.
--
--
-- Purged 0.537 GB in 63 overlap output files.
----------------------------------------
-- Starting command on Fri Jan 16 01:05:18 2026 with 4557845.484 GB free disk space

    cd unitigging
    /share/org/YZWL/yzwl_lixg/miniforge3/envs/canu_v.2.3/bin/ovStoreStats \
     -C 50 \
     -S ../A3-17.seqStore \
     -O  ./A3-17.ovlStore \
     -o  ./A3-17.ovlStore \
     > ./A3-17.ovlStore.summary.err 2>&1

-- Finished on Fri Jan 16 01:05:25 2026 (7 seconds) with 4557845.468 GB free disk space
----------------------------------------
--
-- Overlap store 'unitigging/A3-17.ovlStore' contains:
--
--   category            reads     %          read length        feature size or coverage  analysis
--   ----------------  -------  -------  ----------------------  ------------------------  --------------------
--   middle-missing        146    0.05    15628.32 +- 7629.38        615.85 +- 645.27     (bad trimming)
--   middle-hump            22    0.01    15620.00 +- 4269.41       5559.55 +- 3534.35    (bad trimming)
--   no-5-prime            514    0.18    12842.21 +- 5952.03       2081.40 +- 3199.98    (bad trimming)
--   no-3-prime            544    0.19    12262.44 +- 6349.67       1993.50 +- 2932.82    (bad trimming)
--   
--   low-coverage         1673    0.59    10079.86 +- 5778.81          6.20 +- 3.78       (easy to assemble, potential for lower quality consensus)
--   unique             223774   79.54    11570.25 +- 6051.01         45.07 +- 8.77       (easy to assemble, perfect, yay)
--   repeat-cont         16325    5.80     9001.42 +- 5432.58        754.84 +- 626.65     (potential for consensus errors, no impact on assembly)
--   repeat-dove           235    0.08    20578.29 +- 2531.98        411.25 +- 442.10     (hard to assemble, likely won't assemble correctly or even at all)
--   
--   span-repeat          4949    1.76    13956.84 +- 5188.41       3276.45 +- 3727.35    (read spans a large repeat, usually easy to assemble)
--   uniq-repeat-cont    16090    5.72    12013.79 +- 4974.94                             (should be uniquely placed, low potential for consensus errors, no impact on assembly)
--   uniq-repeat-dove     3124    1.11    19020.31 +- 3107.97                             (will end contigs, potential to misassemble)
--   uniq-anchor          4536    1.61    13127.49 +- 4933.13       7497.73 +- 5052.01    (repeat read, with unique section, probable bad read)
-- Finished stage 'utg-createOverlapStore', reset canuIteration.
--
-- Loading read lengths.
-- Loading number of overlaps per read.
--
-- Configure RED for 16gb memory.
--                   Batches of at most (unlimited) reads.
--                                      500000000 bases.
--                   Expecting evidence of at most 536870912 bases per iteration.
--
--           Total                                               Reads                 Olaps Evidence
--    Job   Memory      Read Range         Reads        Bases   Memory        Olaps   Memory   Memory  (Memory in MB)
--   ---- -------- ------------------- --------- ------------ -------- ------------ -------- --------
--      1 16386.58         1-38314          5900    108986919 13304.25       901997    10.32  1024.00
--      2 16385.15     38315-78538          6279    108945723 13299.24      1215856    13.91  1024.00
--      3 16384.76     78539-136657         8969    108931493 13297.58      1326450    15.18  1024.00
--      4 16385.68    136658-177438         6408    108959709 13300.95      1112762    12.73  1024.00
--      5 16385.45    177439-218131         6314    108948684 13299.60      1209955    13.85  1024.00
--      6 16384.36    218132-270852         8216    108947437 13299.51      1123367    12.86  1024.00
--      7 16384.79    270853-323853         8410    108931775 13297.60      1327365    15.19  1024.00
--      8 16384.50    323854-362455         6058    108942334 13298.82      1196064    13.69  1024.00
--      9 16386.27    362456-407183         6861    108966328 13301.77      1092091    12.50  1024.00
--     10 16385.59    407184-470477         9673    108914783 13295.57      1575255    18.03  1024.00
--     11 16384.01    470478-509863         6055    108943921 13299.01      1136325    13.00  1024.00
--     12 16384.93    509864-552664         6653    108957642 13300.70      1068096    12.22  1024.00
--     13 16385.25    552665-616552        10074    108912886 13295.35      1564129    17.90  1024.00
--     14 16386.37    616553-655456         5942    108985697 13304.11       897361    10.27  1024.00
--     15 16385.72    655457-696173         6370    108951520 13299.95      1203113    13.77  1024.00
--     16 16385.76    696174-755822         9203    108941097 13298.76      1310666    15.00  1024.00
--     17 16385.00    755823-802021         7198    108960230 13301.04      1045309    11.96  1024.00
--     18 16386.31    802022-841964         6238    108945917 13299.26      1315357    15.05  1024.00
--     19 16385.82    841965-892534         7749    108969033 13302.13      1021532    11.69  1024.00
--     20 16384.47    892535-950103         9073    108920217 13296.21      1420566    16.26  1024.00
--     21 16385.77    950104-989730         6145    108956659 13300.57      1153994    13.21  1024.00
--     22 16385.06    989731-1034381        6944    108966079 13301.74       988928    11.32  1024.00
--     23 16384.23   1034382-1096836        9728    108900707 13293.85      1605694    18.38  1024.00
--     24 16384.45   1096837-1135020        5862    108945167 13299.16      1162137    13.30  1024.00
--     25 16384.03   1135021-1175801        6393    108951070 13299.89      1060964    12.14  1024.00
--     26 16384.06   1175802-1236111        9308    108908308 13294.76      1511676    17.30  1024.00
--     27 16384.26   1236112-1273307        5780    108970396 13302.23       876426    10.03  1024.00
--     28 16384.17   1273308-1311849        6072    108942330 13298.82      1167327    13.36  1024.00
--     29 16385.09   1311850-1364731        8144    108949189 13299.72      1168399    13.37  1024.00
--     30 16384.03   1364732-1407455        6645    108954688 13300.34      1021740    11.69  1024.00
--     31 16385.32   1407456-1445606        5924    108942226 13298.80      1269353    14.53  1024.00
--     32 16384.02   1445607-1490480        6989    108967716 13301.94       880290    10.07  1024.00
--     33 16384.14   1490481-1540927        7773    108928570 13297.19      1306072    14.95  1024.00
--     34 16384.57   1540928-1579414        5892    108959135 13300.86      1022795    11.70  1024.00
--     35 16384.74   1579415-1621409        6519    108962747 13301.32       997686    11.42  1024.00
--     36 16384.78   1621410-1675789        8449    108928914 13297.25      1357214    15.53  1024.00
--     37 16385.57   1675790-1713085        5811    108961878 13301.19      1081832    12.38  1024.00
--     38 16384.69   1713086-1752593        6258    108962740 13301.31       994027    11.38  1024.00
--     39 16384.60   1752594-1809623        8972    108920260 13296.21      1432109    16.39  1024.00
--     40  3203.08   1809624-1810241          94      1070480   130.68        34975     0.40  1024.00
--   ---- -------- ------------------- --------- ------------ -------- ------------ -------- --------
--                                                 4250012604              46157254
-- Finished stage 'readErrorDetectionConfigure', reset canuIteration.
--
-- Running jobs.  First attempt out of 2.
----------------------------------------
-- Starting 'red' concurrent execution on Fri Jan 16 01:05:32 2026 with 4557845.421 GB free disk space (40 processes; 22 concurrently)

    cd unitigging/3-overlapErrorAdjustment
    ./red.sh 1 > ./red.000001.out 2>&1
    ./red.sh 2 > ./red.000002.out 2>&1
    ./red.sh 3 > ./red.000003.out 2>&1
    ./red.sh 4 > ./red.000004.out 2>&1
    ./red.sh 5 > ./red.000005.out 2>&1
    ./red.sh 6 > ./red.000006.out 2>&1
    ./red.sh 7 > ./red.000007.out 2>&1
    ./red.sh 8 > ./red.000008.out 2>&1
    ./red.sh 9 > ./red.000009.out 2>&1
    ./red.sh 10 > ./red.000010.out 2>&1
    ./red.sh 11 > ./red.000011.out 2>&1
    ./red.sh 12 > ./red.000012.out 2>&1
    ./red.sh 13 > ./red.000013.out 2>&1
    ./red.sh 14 > ./red.000014.out 2>&1
    ./red.sh 15 > ./red.000015.out 2>&1
    ./red.sh 16 > ./red.000016.out 2>&1
    ./red.sh 17 > ./red.000017.out 2>&1
    ./red.sh 18 > ./red.000018.out 2>&1
    ./red.sh 19 > ./red.000019.out 2>&1
    ./red.sh 20 > ./red.000020.out 2>&1
    ./red.sh 21 > ./red.000021.out 2>&1
    ./red.sh 22 > ./red.000022.out 2>&1
    ./red.sh 23 > ./red.000023.out 2>&1
    ./red.sh 24 > ./red.000024.out 2>&1
    ./red.sh 25 > ./red.000025.out 2>&1
    ./red.sh 26 > ./red.000026.out 2>&1
    ./red.sh 27 > ./red.000027.out 2>&1
    ./red.sh 28 > ./red.000028.out 2>&1
    ./red.sh 29 > ./red.000029.out 2>&1
    ./red.sh 30 > ./red.000030.out 2>&1
    ./red.sh 31 > ./red.000031.out 2>&1
    ./red.sh 32 > ./red.000032.out 2>&1
    ./red.sh 33 > ./red.000033.out 2>&1
    ./red.sh 34 > ./red.000034.out 2>&1
    ./red.sh 35 > ./red.000035.out 2>&1
    ./red.sh 36 > ./red.000036.out 2>&1
    ./red.sh 37 > ./red.000037.out 2>&1
    ./red.sh 38 > ./red.000038.out 2>&1
    ./red.sh 39 > ./red.000039.out 2>&1
    ./red.sh 40 > ./red.000040.out 2>&1

-- Finished on Fri Jan 16 01:14:44 2026 (552 seconds) with 4557624.843 GB free disk space
----------------------------------------
-- Found 40 read error detection output files.
-- Finished stage 'readErrorDetectionCheck', reset canuIteration.
--
-- Loading read lengths.
-- Loading number of overlaps per read.
--
-- Configure OEA for 8gb memory.
--                   Batches of at most (unlimited) reads.
--                                      300000000 bases.
--
--           Total                                               Reads                 Olaps  Adjusts
--    Job   Memory      Read Range         Reads        Bases   Memory        Olaps   Memory   Memory  (Memory in MB)
--   ---- -------- ------------------- --------- ------------ -------- ------------ -------- --------
--      1  2801.91         1-118234        18311    300014323   294.67      2986963    91.15   368.08
--      2  2809.28    118235-241582        19159    300001239   294.69      3227887    98.51   368.08
--      3  2822.27    241583-373105        20731    300006895   294.74      3651980   111.45   368.08
--      4  2813.39    373106-510415        21036    300009046   294.75      3360578   102.56   368.08
--      5  2809.47    510416-646147        21180    300004969   294.75      3232268    98.64   368.08
--      6  2818.27    646148-783766        21340    300013163   294.77      3519962   107.42   368.08
--      7  2807.65    783767-914654        20335    300000913   294.72      3173363    96.84   368.08
--      8  2804.67    914655-1035979       18882    300015815   294.69      3076797    93.90   368.08
--      9  2820.21   1035980-1166460       20306    300007553   294.73      3584943   109.40   368.08
--     10  2808.35   1166461-1293985       19760    300015002   294.72      3196414    97.55   368.08
--     11  2807.50   1293986-1418325       19309    300009156   294.70      3169447    96.72   368.08
--     12  2804.92   1418326-1542591       19252    300000230   294.69      3085180    94.15   368.08
--     13  2808.94   1542592-1668290       19466    300006699   294.70      3216368    98.16   368.08
--     14  2794.41   1668291-1779112       17432    300001993   294.64      2742370    83.69   368.08
--     15  2500.29   1779113-1810241        4846     49905608    55.74       932734    28.46   368.08
--   ---- -------- ------------------- --------- ------------ -------- ------------ -------- --------
--                                                 4250012604              46157254
-- Finished stage 'overlapErrorAdjustmentConfigure', reset canuIteration.
--
-- Running jobs.  First attempt out of 2.
----------------------------------------
-- Starting 'oea' concurrent execution on Fri Jan 16 01:14:51 2026 with 4557624.765 GB free disk space (15 processes; 62 concurrently)

    cd unitigging/3-overlapErrorAdjustment
    ./oea.sh 1 > ./oea.000001.out 2>&1
    ./oea.sh 2 > ./oea.000002.out 2>&1
    ./oea.sh 3 > ./oea.000003.out 2>&1
    ./oea.sh 4 > ./oea.000004.out 2>&1
    ./oea.sh 5 > ./oea.000005.out 2>&1
    ./oea.sh 6 > ./oea.000006.out 2>&1
    ./oea.sh 7 > ./oea.000007.out 2>&1
    ./oea.sh 8 > ./oea.000008.out 2>&1
    ./oea.sh 9 > ./oea.000009.out 2>&1
    ./oea.sh 10 > ./oea.000010.out 2>&1
    ./oea.sh 11 > ./oea.000011.out 2>&1
    ./oea.sh 12 > ./oea.000012.out 2>&1
    ./oea.sh 13 > ./oea.000013.out 2>&1
    ./oea.sh 14 > ./oea.000014.out 2>&1
    ./oea.sh 15 > ./oea.000015.out 2>&1

-- Finished on Fri Jan 16 01:37:03 2026 (1332 seconds) with 4560087.25 GB free disk space
----------------------------------------
-- Found 15 overlap error adjustment output files.
-- Finished stage 'overlapErrorAdjustmentCheck', reset canuIteration.
----------------------------------------
-- Starting command on Fri Jan 16 01:37:03 2026 with 4560087.234 GB free disk space

    cd unitigging/3-overlapErrorAdjustment
    /share/org/YZWL/yzwl_lixg/miniforge3/envs/canu_v.2.3/bin/loadErates \
      -S ../../A3-17.seqStore \
      -O ../A3-17.ovlStore \
      -L ./oea.files \
    > ./oea.apply.err 2>&1

-- Finished on Fri Jan 16 01:37:03 2026 (fast as lightning) with 4560087.125 GB free disk space
----------------------------------------
-- No report available.
-- Finished stage 'updateOverlapStore', reset canuIteration.
-- Finished stage 'unitig', reset canuIteration.
--
-- Running jobs.  First attempt out of 2.
----------------------------------------
-- Starting 'bat' concurrent execution on Fri Jan 16 01:37:03 2026 with 4560087.078 GB free disk space (1 processes; 1 concurrently)

    cd unitigging/4-unitigger
    ./unitigger.sh 1 > ./unitigger.000001.out 2>&1

-- Finished on Fri Jan 16 01:37:17 2026 (14 seconds) with 4559972.671 GB free disk space
----------------------------------------
-- Unitigger finished successfully.
--  
--  ERROR RATES
--  -----------
--                                                   --------threshold------
--  304377                       fraction error      fraction        percent
--  samples                              (1e-5)         error          error
--                   --------------------------      --------       --------
--  command line (-eg)                           ->     30.00        0.0300%
--  command line (-ef)                           ->  -----.--      ---.----%
--  command line (-eM)                           ->     30.00        0.0300%
--  mean + std.dev       0.37 +-  12 *     2.66  ->     32.25        0.0323%
--  median + mad         0.00 +-  12 *     0.00  ->      0.00        0.0000%
--  90th percentile                              ->      1.00        0.0010%  (enabled)
--  
--  BEST EDGE FILTERING
--  -------------------
--  At graph threshold 0.0300%, reads:
--    available to have edges:        48995
--    with at least one edge:         37553
--  
--  At max threshold 0.0300%, reads:
--    available to have edges:        48995
--    with at least one edge:         37553
--  
--  At tight threshold 0.0010%, reads with:
--    both edges below error threshold:     31625  (80.00% minReadsBest threshold = 30042)
--    one  edge  above error threshold:      4454
--    both edges above error threshold:      1474
--    at least one edge:                    37553
--  
--  At loose threshold 0.0300%, reads with:
--    both edges below error threshold:     37553  (80.00% minReadsBest threshold = 30042)
--    one  edge  above error threshold:         0
--    both edges above error threshold:         0
--    at least one edge:                    37553
--  
--  
--  INITIAL EDGES
--  -------- ----------------------------------------
--    226527 reads are contained
--   1548819 reads have no best edges (singleton)
--       324 reads have only one best edge (spur) 
--                167 are mutual best
--     34571 reads have two best edges 
--               1335 have one mutual best edge
--              32902 have two mutual best edges
--  
--  
--  FINAL EDGES
--  -------- ----------------------------------------
--    226527 reads are contained
--   1549140 reads have no best edges (singleton)
--       237 reads have only one best edge (spur) 
--                204 are mutual best
--     34337 reads have two best edges 
--               1184 have one mutual best edge
--              32879 have two mutual best edges
--  
--  
--  EDGE FILTERING
--  -------- ------------------------------------------
--         0 reads are ignored
--      8397 reads have a gap in overlap coverage
--       163 reads have lopsided best edges
-- Found, in version 1, after unitig construction:
--   contigs:      117 sequences, total length 71330665 bp (including 179 repeats of total length 6569489 bp).
--   bubbles:      466 sequences, total length 26350421 bp.
--   unassembled:  20523 sequences, total length 228867012 bp.
--
-- Contig sizes based on genome size 85mbp:
--
--            NG (bp)  LG (contigs)    sum (bp)
--         ----------  ------------  ----------
--     10     8538543             1     8538543
--     20     6158163             3    21148366
--     30     6010728             4    27159094
--     40     3961904             6    36993144
--     50     3365911             8    43922504
--     60     2288607            11    51526748
--     70     1230760            16    59618225
--     80      234617            31    68060731
--
-- Finished stage 'unitigCheck', reset canuIteration.
----------------------------------------
-- Starting command on Fri Jan 16 01:37:17 2026 with 4559972.656 GB free disk space

    cd unitigging
    /share/org/YZWL/yzwl_lixg/miniforge3/envs/canu_v.2.3/bin/utgcns \
      -S ../A3-17.seqStore \
      -T  ./A3-17.ctgStore 1 \
      -partition 0.8 1.5 0.1 \
    > ./A3-17.ctgStore/partitioning.log 2>&1

-- Finished on Fri Jan 16 01:37:28 2026 (11 seconds) with 4559971.515 GB free disk space
----------------------------------------
-- Using slow alignment for consensus (iteration '0').
-- Configured 10 consensus jobs.
-- Finished stage 'consensusConfigure', reset canuIteration.
--
-- Local: cns       12.625 GB    8 CPUs x  11 jobs   138.875 GB  88 CPUs  (consensus)
--
--
-- Running jobs.  First attempt out of 2.
----------------------------------------
-- Starting 'cns' concurrent execution on Fri Jan 16 01:37:28 2026 with 4559971.484 GB free disk space (10 processes; 11 concurrently)

    cd unitigging/5-consensus
    ./consensus.sh 1 > ./consensus.000001.out 2>&1
    ./consensus.sh 2 > ./consensus.000002.out 2>&1
    ./consensus.sh 3 > ./consensus.000003.out 2>&1
    ./consensus.sh 4 > ./consensus.000004.out 2>&1
    ./consensus.sh 5 > ./consensus.000005.out 2>&1
    ./consensus.sh 6 > ./consensus.000006.out 2>&1
    ./consensus.sh 7 > ./consensus.000007.out 2>&1
    ./consensus.sh 8 > ./consensus.000008.out 2>&1
    ./consensus.sh 9 > ./consensus.000009.out 2>&1
    ./consensus.sh 10 > ./consensus.000010.out 2>&1

-- Finished on Fri Jan 16 01:44:54 2026 (446 seconds) with 4559739.609 GB free disk space
----------------------------------------
-- Using slow alignment for consensus (iteration '1').
-- Configured 10 consensus jobs.
-- All 10 consensus jobs finished successfully.
-- Finished stage 'consensusCheck', reset canuIteration.
-- Using slow alignment for consensus (iteration '0').
-- Configured 10 consensus jobs.
----------------------------------------
-- Starting command on Fri Jan 16 01:44:54 2026 with 4559739.562 GB free disk space

    cd unitigging
    /share/org/YZWL/yzwl_lixg/miniforge3/envs/canu_v.2.3/bin/tgStoreLoad \
      -S ../A3-17.seqStore \
      -T  ./A3-17.ctgStore 2 \
      -L ./5-consensus/ctgcns.files \
    > ./5-consensus/ctgcns.files.ctgStoreLoad.err 2>&1

-- Finished on Fri Jan 16 01:44:55 2026 (one second) with 4559738.671 GB free disk space
----------------------------------------
----------------------------------------
-- Starting command on Fri Jan 16 01:44:55 2026 with 4559738.671 GB free disk space

    cd unitigging
    /share/org/YZWL/yzwl_lixg/miniforge3/envs/canu_v.2.3/bin/tgTigDisplay \
      -S ../A3-17.seqStore \
      -b \
      -o ../A3-17.contigs.unsorted.bam \
      -L ./5-consensus/ctgcns.files \
    > ./5-consensus/ctgcns.files.contigs.bam.err 2>&1

-- Finished on Fri Jan 16 01:47:43 2026 (168 seconds) with 4559565.093 GB free disk space
----------------------------------------
----------------------------------------
-- Starting command on Fri Jan 16 01:47:43 2026 with 4559565.093 GB free disk space

    cd .
    samtools sort \
      --write-index \
      --threads 2 \
      -o ./A3-17.contigs.bam ./A3-17.contigs.unsorted.bam \
    > ./ctgcns.bam.err 2>&1

-- Finished on Fri Jan 16 01:48:51 2026 (68 seconds) with 4559620.687 GB free disk space
----------------------------------------
-- Purging consensus output after loading to ctgStore.
-- Purged 10 .cns outputs.
----------------------------------------
-- Starting command on Fri Jan 16 01:48:51 2026 with 4559621.75 GB free disk space

    cd unitigging
    /share/org/YZWL/yzwl_lixg/miniforge3/envs/canu_v.2.3/bin/tgStoreDump \
      -S ../A3-17.seqStore \
      -T ./A3-17.ctgStore 2 \
      -sizes -s 85000000 \
    > ./A3-17.ctgStore/seqDB.v002.sizes.txt
ZERO length suplied to intervalList::add(), ignoring interval.
ZERO length suplied to intervalList::add(), ignoring interval.
ZERO length suplied to intervalList::add(), ignoring interval.
ZERO length suplied to intervalList::add(), ignoring interval.
ZERO length suplied to intervalList::add(), ignoring interval.
ZERO length suplied to intervalList::add(), ignoring interval.
ZERO length suplied to intervalList::add(), ignoring interval.
ZERO length suplied to intervalList::add(), ignoring interval.
ZERO length suplied to intervalList::add(), ignoring interval.
ZERO length suplied to intervalList::add(), ignoring interval.
ZERO length suplied to intervalList::add(), ignoring interval.
ZERO length suplied to intervalList::add(), ignoring interval.
ZERO length suplied to intervalList::add(), ignoring interval.
ZERO length suplied to intervalList::add(), ignoring interval.

-- Finished on Fri Jan 16 01:48:51 2026 (fast as lightning) with 4559621.75 GB free disk space
----------------------------------------
-- Found, in version 2, after consensus generation:
--   contigs:      117 sequences, total length 93070155 bp (including 179 repeats of total length 8738307 bp).
--   bubbles:      466 sequences, total length 34425593 bp.
--   unassembled:  20523 sequences, total length 311068393 bp.
--
-- Contig sizes based on genome size 85mbp:
--
--            NG (bp)  LG (contigs)    sum (bp)
--         ----------  ------------  ----------
--     10    11098344             1    11098344
--     20     8381185             2    19479529
--     30     7990767             3    27470296
--     40     7809756             4    35280052
--     50     7651429             5    42931481
--     60     4645177             7    52749694
--     70     3615791             9    60753239
--     80     2767689            12    69830479
--     90     1601808            16    77618097
--    100      543269            23    85393695
--
-- Finished stage 'consensusLoad', reset canuIteration.
----------------------------------------
-- Starting command on Fri Jan 16 01:48:51 2026 with 4559621.734 GB free disk space

    cd .
    /share/org/YZWL/yzwl_lixg/miniforge3/envs/canu_v.2.3/bin/tgStoreDump \
      -S ./A3-17.seqStore \
      -T ./unitigging/A3-17.ctgStore 2 \
      -o ./A3-17.contigs \
      -layout \
    > ./A3-17.contigs.layout.err 2>&1

-- Finished on Fri Jan 16 01:48:51 2026 (lickety-split) with 4559621.703 GB free disk space
----------------------------------------
----------------------------------------
-- Starting command on Fri Jan 16 01:48:51 2026 with 4559621.703 GB free disk space

    cd .
    /share/org/YZWL/yzwl_lixg/miniforge3/envs/canu_v.2.3/bin/tgStoreDump \
      -S ./A3-17.seqStore \
      -T ./unitigging/A3-17.ctgStore 2 \
      -consensus -fasta \
      -unassembled \
    > ./A3-17.unassembled.fasta
    2> ./A3-17.unassembled.err
ZERO length suplied to intervalList::add(), ignoring interval.
ZERO length suplied to intervalList::add(), ignoring interval.
ZERO length suplied to intervalList::add(), ignoring interval.
ZERO length suplied to intervalList::add(), ignoring interval.
ZERO length suplied to intervalList::add(), ignoring interval.
ZERO length suplied to intervalList::add(), ignoring interval.
ZERO length suplied to intervalList::add(), ignoring interval.
ZERO length suplied to intervalList::add(), ignoring interval.
ZERO length suplied to intervalList::add(), ignoring interval.
ZERO length suplied to intervalList::add(), ignoring interval.
ZERO length suplied to intervalList::add(), ignoring interval.
ZERO length suplied to intervalList::add(), ignoring interval.
ZERO length suplied to intervalList::add(), ignoring interval.
ZERO length suplied to intervalList::add(), ignoring interval.

-- Finished on Fri Jan 16 01:48:53 2026 (2 seconds) with 4559621.39 GB free disk space
----------------------------------------
----------------------------------------
-- Starting command on Fri Jan 16 01:48:53 2026 with 4559621.39 GB free disk space

    cd .
    /share/org/YZWL/yzwl_lixg/miniforge3/envs/canu_v.2.3/bin/tgStoreDump \
      -S ./A3-17.seqStore \
      -T ./unitigging/A3-17.ctgStore 2 \
      -consensus -fasta \
      -contigs \
    > ./A3-17.contigs.fasta
    2> ./A3-17.contigs.err
ZERO length suplied to intervalList::add(), ignoring interval.
ZERO length suplied to intervalList::add(), ignoring interval.
ZERO length suplied to intervalList::add(), ignoring interval.
ZERO length suplied to intervalList::add(), ignoring interval.
ZERO length suplied to intervalList::add(), ignoring interval.
ZERO length suplied to intervalList::add(), ignoring interval.
ZERO length suplied to intervalList::add(), ignoring interval.
ZERO length suplied to intervalList::add(), ignoring interval.
ZERO length suplied to intervalList::add(), ignoring interval.
ZERO length suplied to intervalList::add(), ignoring interval.
ZERO length suplied to intervalList::add(), ignoring interval.
ZERO length suplied to intervalList::add(), ignoring interval.
ZERO length suplied to intervalList::add(), ignoring interval.
ZERO length suplied to intervalList::add(), ignoring interval.

-- Finished on Fri Jan 16 01:48:54 2026 (one second) with 4559621.265 GB free disk space
----------------------------------------
-- Finished stage 'generateOutputs', reset canuIteration.
--
-- Assembly 'A3-17' finished in '/share/org/YZWL/yzwl_lixg/project/28.大豆疫霉菌三代基因组/03.hicanu/A3-17/01.raw_output'.
--
-- Summary saved in 'A3-17.report'.
--
-- Sequences saved:
--   Contigs       -> 'A3-17.contigs.fasta'
--   Unassembled   -> 'A3-17.unassembled.fasta'
--
-- Read layouts saved:
--   Contigs       -> 'A3-17.contigs.layout'.
--
-- Bye.

2026-01-16 01:48:54.237 - WARNING - 输出文件不存在|Output file does not exist: /share/org/YZWL/yzwl_lixg/project/28.大豆疫霉菌三代基因组/03.hicanu/A3-17/01.raw_output/A3-17.unitigs.fasta
Usage: biopytools ragtag [OPTIONS]
Try 'biopytools ragtag -h' for help.

Error: Invalid value for '-r' / '--reference': 文件不存在|File does not exist: /share/org/YZWL/yzwl_lixg/project/28.大豆疫霉菌三代基因组/04.ragtag/Psoja_T2T.fa
Usage: biopytools genomesyn [OPTIONS]
Try 'biopytools genomesyn -h' for help.

Error: Invalid value for '-i' / '--ref': Path '04.ragtag/A3-17/hicanu/A3-17_RagTag_scaffolded.fa' does not exist.
Job 68886739 stderr output:

