Usage: biopytools ragtag [OPTIONS]
Try 'biopytools ragtag -h' for help.

Error: Invalid value for '-r' / '--reference': 文件不存在|File does not exist: /share/org/YZWL/yzwl_lixg/project/28.大豆疫霉菌三代基因组/04.ragtag/Psoja_T2T.fa
Usage: biopytools genomesyn [OPTIONS]
Try 'biopytools genomesyn -h' for help.

Error: Invalid value for '-i' / '--ref': Path '04.ragtag/B3-12/hifiasm/B3-12_RagTag_scaffolded.fa' does not exist.
2026-01-16 01:55:38.644 - WARNING - 命令错误输出|Command stderr:
-- canu master +27 changes (r10515 2a41e933b8de6ed66723d75d36dd071b46d2c347)
--
-- CITATIONS
--
-- For assemblies of PacBio HiFi reads:
--   Nurk S, Walenz BP, Rhiea A, Vollger MR, Logsdon GA, Grothe R, Miga KH, Eichler EE, Phillippy AM, Koren S.
--   HiCanu: accurate assembly of segmental duplications, satellites, and allelic variants from high-fidelity long reads.
--   biorXiv. 2020.
--   https://doi.org/10.1101/2020.03.14.992248
-- 
-- Read and contig alignments during correction and consensus use:
--   Šošic M, Šikic M.
--   Edlib: a C/C ++ library for fast, exact sequence alignment using edit distance.
--   Bioinformatics. 2017 May 1;33(9):1394-1395.
--   http://doi.org/10.1093/bioinformatics/btw753
-- 
-- Overlaps are generated using:
--   Berlin K, et al.
--   Assembling large genomes with single-molecule sequencing and locality-sensitive hashing.
--   Nat Biotechnol. 2015 Jun;33(6):623-30.
--   http://doi.org/10.1038/nbt.3238
-- 
--   Myers EW, et al.
--   A Whole-Genome Assembly of Drosophila.
--   Science. 2000 Mar 24;287(5461):2196-204.
--   http://doi.org/10.1126/science.287.5461.2196
-- 
-- Contig consensus sequences are generated using an algorithm derived from pbdagcon:
--   Chin CS, et al.
--   Nonhybrid, finished microbial genome assemblies from long-read SMRT sequencing data.
--   Nat Methods. 2013 Jun;10(6):563-9
--   http://doi.org/10.1038/nmeth.2474
-- 
-- CONFIGURE CANU
--
-- Detected Java(TM) Runtime Environment '17.0.15-internal' (from '/share/org/YZWL/yzwl_lixg/.local/bin/java') without -d64 support.
--
-- WARNING:
-- WARNING:  Failed to run gnuplot using command 'gnuplot'.
-- WARNING:  Plots will be disabled.
-- WARNING:
--
-- Detected samtools version '1.22' / htslib version 'htscodecs=1.6.3' (from 'samtools').
--
-- Detected 88 CPUs and 503 gigabytes of memory on the local machine.
--
-- Detected Slurm with 'sinfo' binary in /opt/skyformai/bin/sinfo.
--          Slurm disabled by useGrid=false
--
-- Detected  '' with 'pbsnodes' binary in /opt/skyformai/bin/pbsnodes.
--           disabled by useGrid=false
--
-- Detected LSF with 'bsub' binary in /opt/skyformai/bin/bsub.
--          LSF disabled by useGrid=false
--
-- Local machine mode enabled; grid support not detected or not allowed.
--
-- Found trimmed raw PacBio HiFi reads in the input files.
--
--                                (tag)Concurrency
--                         (tag)Threads          |
--                (tag)Memory         |          |
--        (tag)             |         |          |       total usage      algorithm
--        -------  ----------  --------   --------  --------------------  -----------------------------
-- Local: meryl     12.000 GB    4 CPUs x  22 jobs   264.000 GB  88 CPUs  (k-mer counting)
-- Local: cormhap   13.000 GB   11 CPUs x   8 jobs   104.000 GB  88 CPUs  (overlap detection with mhap)
-- Local: obtovl     8.000 GB    8 CPUs x  11 jobs    88.000 GB  88 CPUs  (overlap detection)
-- Local: utgovl     8.000 GB    8 CPUs x  11 jobs    88.000 GB  88 CPUs  (overlap detection)
-- Local: cor        -.--- GB    4 CPUs x   - jobs     -.--- GB   - CPUs  (read correction)
-- Local: ovb        4.000 GB    1 CPU  x  88 jobs   352.000 GB  88 CPUs  (overlap store bucketizer)
-- Local: ovs        8.000 GB    1 CPU  x  62 jobs   496.000 GB  62 CPUs  (overlap store sorting)
-- Local: red       16.000 GB    4 CPUs x  22 jobs   352.000 GB  88 CPUs  (read error detection)
-- Local: oea        8.000 GB    1 CPU  x  62 jobs   496.000 GB  62 CPUs  (overlap error adjustment)
-- Local: bat       32.000 GB    8 CPUs x   1 job     32.000 GB   8 CPUs  (contig construction with bogart)
-- Local: cns        -.--- GB    8 CPUs x   - jobs     -.--- GB   - CPUs  (consensus)
--
-- Generating assembly 'B3-12' in '/share/org/YZWL/yzwl_lixg/project/28.大豆疫霉菌三代基因组/03.hicanu/B3-12/01.raw_output':
--   genomeSize:
--     85000000
--
--   Overlap Generation Limits:
--     corOvlErrorRate 0.0000 (  0.00%)
--     obtOvlErrorRate 0.0250 (  2.50%)
--     utgOvlErrorRate 0.0100 (  1.00%)
--
--   Overlap Processing Limits:
--     corErrorRate    0.0000 (  0.00%)
--     obtErrorRate    0.0250 (  2.50%)
--     utgErrorRate    0.0003 (  0.03%)
--     cnsErrorRate    0.0500 (  5.00%)
--
--   Stages to run:
--     assemble HiFi reads.
--
--
-- BEGIN STORE CREATION
----------------------------------------
-- Starting command on Fri Jan 16 00:08:33 2026 with 4565778.234 GB free disk space

    cd .
    ./B3-12.seqStore.sh \
    > ./B3-12.seqStore.err 2>&1

-- Finished on Fri Jan 16 00:16:01 2026 (448 seconds) with 4565100.89 GB free disk space
----------------------------------------
--
-- In sequence store './B3-12.seqStore':
--   Found 240070 reads.
--   Found 4250020690 bases (50 times coverage).
--    Histogram of corrected reads:
--    
--    G=4250020690                       sum of  ||               length     num
--    NG         length     index       lengths  ||                range    seqs
--    ----- ------------ --------- ------------  ||  ------------------- -------
--    00010        25275     15412    425006315  ||       1264-2458         2231|-----
--    00020        22884     33153    850012645  ||       2459-3653         3268|-------
--    00030        21240     52461   1275020691  ||       3654-4848         3124|------
--    00040        19954     73122   1700009184  ||       4849-6043         2983|------
--    00050        18875     95038   2125027859  ||       6044-7238         2926|------
--    00060        17925    118152   2550019619  ||       7239-8433         2983|------
--    00070        17041    142469   2975016078  ||       8434-9628         3293|-------
--    00080        16104    168103   3400017439  ||       9629-10823        3104|------
--    00090        14738    195552   3825021086  ||      10824-12018        3068|------
--    00100         1264    240070   4250020690  ||      12019-13213        4016|--------
--    001.000x              240070   4250020690  ||      13214-14408        9253|------------------
--                                               ||      14409-15603       19955|---------------------------------------
--                                               ||      15604-16798       30589|-----------------------------------------------------------
--                                               ||      16799-17993       32909|---------------------------------------------------------------
--                                               ||      17994-19188       28193|------------------------------------------------------
--                                               ||      19189-20383       22492|--------------------------------------------
--                                               ||      20384-21578       17868|-----------------------------------
--                                               ||      21579-22773       13527|--------------------------
--                                               ||      22774-23968       10523|---------------------
--                                               ||      23969-25163        7725|---------------
--                                               ||      25164-26358        5653|-----------
--                                               ||      26359-27553        4043|--------
--                                               ||      27554-28748        2762|------
--                                               ||      28749-29943        1749|----
--                                               ||      29944-31138         956|--
--                                               ||      31139-32333         503|-
--                                               ||      32334-33528         241|-
--                                               ||      33529-34723          78|-
--                                               ||      34724-35918          30|-
--                                               ||      35919-37113           7|-
--                                               ||      37114-38308           4|-
--                                               ||      38309-39503           7|-
--                                               ||      39504-40698           2|-
--                                               ||      40699-41893           2|-
--                                               ||      41894-43088           1|-
--                                               ||      43089-44283           0|
--                                               ||      44284-45478           0|
--                                               ||      45479-46673           1|-
--                                               ||      46674-47868           0|
--                                               ||      47869-49063           1|-
--    
--
-- In sequence store './B3-12.seqStore':
--   Found 240070 reads.
--   Found 4250020690 bases (50 times coverage).
--    Histogram of corrected-trimmed reads:
--    
--    G=4250020690                       sum of  ||               length     num
--    NG         length     index       lengths  ||                range    seqs
--    ----- ------------ --------- ------------  ||  ------------------- -------
--    00010        25275     15412    425006315  ||       1264-2458         2231|-----
--    00020        22884     33153    850012645  ||       2459-3653         3268|-------
--    00030        21240     52461   1275020691  ||       3654-4848         3124|------
--    00040        19954     73122   1700009184  ||       4849-6043         2983|------
--    00050        18875     95038   2125027859  ||       6044-7238         2926|------
--    00060        17925    118152   2550019619  ||       7239-8433         2983|------
--    00070        17041    142469   2975016078  ||       8434-9628         3293|-------
--    00080        16104    168103   3400017439  ||       9629-10823        3104|------
--    00090        14738    195552   3825021086  ||      10824-12018        3068|------
--    00100         1264    240070   4250020690  ||      12019-13213        4016|--------
--    001.000x              240070   4250020690  ||      13214-14408        9253|------------------
--                                               ||      14409-15603       19955|---------------------------------------
--                                               ||      15604-16798       30589|-----------------------------------------------------------
--                                               ||      16799-17993       32909|---------------------------------------------------------------
--                                               ||      17994-19188       28193|------------------------------------------------------
--                                               ||      19189-20383       22492|--------------------------------------------
--                                               ||      20384-21578       17868|-----------------------------------
--                                               ||      21579-22773       13527|--------------------------
--                                               ||      22774-23968       10523|---------------------
--                                               ||      23969-25163        7725|---------------
--                                               ||      25164-26358        5653|-----------
--                                               ||      26359-27553        4043|--------
--                                               ||      27554-28748        2762|------
--                                               ||      28749-29943        1749|----
--                                               ||      29944-31138         956|--
--                                               ||      31139-32333         503|-
--                                               ||      32334-33528         241|-
--                                               ||      33529-34723          78|-
--                                               ||      34724-35918          30|-
--                                               ||      35919-37113           7|-
--                                               ||      37114-38308           4|-
--                                               ||      38309-39503           7|-
--                                               ||      39504-40698           2|-
--                                               ||      40699-41893           2|-
--                                               ||      41894-43088           1|-
--                                               ||      43089-44283           0|
--                                               ||      44284-45478           0|
--                                               ||      45479-46673           1|-
--                                               ||      46674-47868           0|
--                                               ||      47869-49063           1|-
--    
--
-- Correction skipped; not enabled.
--
-- Trimming skipped; not enabled.
--
-- BEGIN ASSEMBLY
----------------------------------------
-- Starting command on Fri Jan 16 00:16:02 2026 with 4565100.843 GB free disk space

    cd unitigging/0-mercounts
    ./meryl-configure.sh \
    > ./meryl-configure.err 2>&1

-- Finished on Fri Jan 16 00:16:02 2026 (fast as lightning) with 4565100.843 GB free disk space
----------------------------------------
--  segments   memory batches
--  -------- -------- -------
--        01 10.72 GB       2
--        02  5.46 GB       2
--        04  2.94 GB       2
--        06  2.12 GB       2
--        08  1.59 GB       2
--        12  1.06 GB       2
--        16  0.80 GB       2
--        20  0.64 GB       2
--        24  0.53 GB       2
--        32  0.40 GB       2
--        40  0.32 GB       2
--        48  -.-- GB       -  (segment size too small)
--        56  -.-- GB       -  (segment size too small)
--        64  -.-- GB       -  (segment size too small)
--        96  -.-- GB       -  (segment size too small)
--
--  For 240070 reads with 4250020690 bases, limit to 42 batches.
--  Will count kmers using 01 jobs, each using 12 GB and 4 threads.
--
-- Finished stage 'merylConfigure', reset canuIteration.
--
-- Running jobs.  First attempt out of 2.
----------------------------------------
-- Starting 'meryl' concurrent execution on Fri Jan 16 00:16:02 2026 with 4565100.812 GB free disk space (1 processes; 22 concurrently)

    cd unitigging/0-mercounts
    ./meryl-count.sh 1 > ./meryl-count.000001.out 2>&1

-- Finished on Fri Jan 16 00:19:21 2026 (199 seconds) with 4564814.265 GB free disk space
----------------------------------------
-- Found 1 Kmer counting (meryl) outputs.
-- Finished stage 'utg-merylCountCheck', reset canuIteration.
--
-- Running jobs.  First attempt out of 2.
----------------------------------------
-- Starting 'meryl' concurrent execution on Fri Jan 16 00:19:21 2026 with 4564814.234 GB free disk space (1 processes; 22 concurrently)

    cd unitigging/0-mercounts
    ./meryl-process.sh 1 > ./meryl-process.000001.out 2>&1

-- Finished on Fri Jan 16 00:19:24 2026 (3 seconds) with 4564813.843 GB free disk space
----------------------------------------
-- Meryl finished successfully.  Kmer frequency histogram:
--
-- WARNING: gnuplot failed.
--
----------------------------------------
--
--  22-mers                                                                                           Fraction
--    Occurrences   NumMers                                                                         Unique Total
--       1-     1         0                                                                        0.0000 0.0000
--       2-     2    236956                                                                        0.0053 0.0001
--       3-     4     85084                                                                        0.0066 0.0002
--       5-     7     23614                                                                        0.0074 0.0003
--       8-    11      7795                                                                        0.0077 0.0003
--      12-    16     11481                                                                        0.0079 0.0004
--      17-    22    187170                                                                        0.0083 0.0004
--      23-    29   1437172 *****                                                                  0.0140 0.0021
--      30-    37   7629215 *******************************                                        0.0549 0.0183
--      38-    46  16999701 ********************************************************************** 0.2515 0.1164
--      47-    56  11461033 ***********************************************                        0.6302 0.3468
--      57-    67   2323961 *********                                                              0.8557 0.5110
--      68-    79    745036 ***                                                                    0.8985 0.5481
--      80-    92    966216 ***                                                                    0.9154 0.5659
--      93-   106    694556 **                                                                     0.9367 0.5923
--     107-   121    293043 *                                                                      0.9513 0.6127
--     122-   137    272762 *                                                                      0.9575 0.6228
--     138-   154    206652                                                                        0.9635 0.6340
--     155-   172    163286                                                                        0.9680 0.6432
--     173-   191    155773                                                                        0.9716 0.6517
--     192-   211    127873                                                                        0.9750 0.6605
--     212-   232    103804                                                                        0.9779 0.6685
--     233-   254     97849                                                                        0.9801 0.6757
--     255-   277     78229                                                                        0.9823 0.6832
--     278-   301     68301                                                                        0.9840 0.6897
--     302-   326     59011                                                                        0.9855 0.6958
--     327-   352     49796                                                                        0.9868 0.7016
--     353-   379     45135                                                                        0.9879 0.7069
--     380-   407     34996                                                                        0.9889 0.7121
--     408-   436     35032                                                                        0.9897 0.7164
--     437-   466     30143                                                                        0.9905 0.7210
--     467-   497     26750                                                                        0.9911 0.7253
--     498-   529     23064                                                                        0.9917 0.7293
--     530-   562     19398                                                                        0.9922 0.7330
--     563-   596     18286                                                                        0.9926 0.7363
--     597-   631     17276                                                                        0.9931 0.7397
--     632-   667     13503                                                                        0.9934 0.7430
--     668-   704     14249                                                                        0.9937 0.7458
--     705-   742     12269                                                                        0.9940 0.7488
--     743-   781     11256                                                                        0.9943 0.7516
--     782-   821     15834                                                                        0.9946 0.7543
--
--           0 (max occurrences)
--  3179935059 (total mers, non-unique)
--    45031599 (distinct mers, non-unique)
--           0 (unique mers)
-- Finished stage 'meryl-process', reset canuIteration.
--
-- Removing meryl database 'unitigging/0-mercounts/B3-12.ms22'.
--
-- OVERLAPPER (normal) (assembly) erate=0.01
--
----------------------------------------
-- Starting command on Fri Jan 16 00:19:24 2026 with 4564814.859 GB free disk space

    cd unitigging/1-overlapper
    /share/org/YZWL/yzwl_lixg/miniforge3/envs/canu_v.2.3/bin/overlapInCorePartition \
     -S  ../../B3-12.seqStore \
     -hl 160000000 \
     -rl 5000000000 \
     -ol 500 \
     -o  ./B3-12.partition \
    > ./B3-12.partition.err 2>&1

-- Finished on Fri Jan 16 00:19:25 2026 (one second) with 4564814.843 GB free disk space
----------------------------------------
--
-- Configured 20 overlapInCore jobs.
-- Finished stage 'utg-overlapConfigure', reset canuIteration.
--
-- Running jobs.  First attempt out of 2.
----------------------------------------
-- Starting 'utgovl' concurrent execution on Fri Jan 16 00:19:25 2026 with 4564814.812 GB free disk space (20 processes; 11 concurrently)

    cd unitigging/1-overlapper
    ./overlap.sh 1 > ./overlap.000001.out 2>&1
    ./overlap.sh 2 > ./overlap.000002.out 2>&1
    ./overlap.sh 3 > ./overlap.000003.out 2>&1
    ./overlap.sh 4 > ./overlap.000004.out 2>&1
    ./overlap.sh 5 > ./overlap.000005.out 2>&1
    ./overlap.sh 6 > ./overlap.000006.out 2>&1
    ./overlap.sh 7 > ./overlap.000007.out 2>&1
    ./overlap.sh 8 > ./overlap.000008.out 2>&1
    ./overlap.sh 9 > ./overlap.000009.out 2>&1
    ./overlap.sh 10 > ./overlap.000010.out 2>&1
    ./overlap.sh 11 > ./overlap.000011.out 2>&1
    ./overlap.sh 12 > ./overlap.000012.out 2>&1
    ./overlap.sh 13 > ./overlap.000013.out 2>&1
    ./overlap.sh 14 > ./overlap.000014.out 2>&1
    ./overlap.sh 15 > ./overlap.000015.out 2>&1
    ./overlap.sh 16 > ./overlap.000016.out 2>&1
    ./overlap.sh 17 > ./overlap.000017.out 2>&1
    ./overlap.sh 18 > ./overlap.000018.out 2>&1
    ./overlap.sh 19 > ./overlap.000019.out 2>&1
    ./overlap.sh 20 > ./overlap.000020.out 2>&1

-- Finished on Fri Jan 16 01:11:26 2026 (3121 seconds) with 4557738.859 GB free disk space
----------------------------------------
-- Found 20 overlapInCore output files.
--
-- overlapInCore compute 'unitigging/1-overlapper':
--   kmer hits
--     with no overlap       1259680249  2984012.45 +- 36385418.914
--     with an overlap         17948749   897437.45 +- 550070.632
--
--   overlaps                  17948749   897437.45 +- 550070.632
--     contained                3006822    150341.1 +- 91853.454
--     dovetail                14941927   747096.35 +- 458558.288
--
--   overlaps rejected
--     multiple per pair              0           0 +- 0
--     bad short window               0           0 +- 0
--     bad long window                0           0 +- 0
-- Finished stage 'utg-overlapCheck', reset canuIteration.
----------------------------------------
-- Starting command on Fri Jan 16 01:11:26 2026 with 4557738.843 GB free disk space

    cd unitigging
    /share/org/YZWL/yzwl_lixg/miniforge3/envs/canu_v.2.3/bin/ovStoreConfig \
     -S ../B3-12.seqStore \
     -M 4-8 \
     -L ./1-overlapper/ovljob.files \
     -create ./B3-12.ovlStore.config \
     > ./B3-12.ovlStore.config.txt \
    2> ./B3-12.ovlStore.config.err

-- Finished on Fri Jan 16 01:11:26 2026 (in the blink of an eye) with 4557738.828 GB free disk space
----------------------------------------
--
-- Creating overlap store unitigging/B3-12.ovlStore using:
--      1 bucket
--      1 slice
--        using at most 2 GB memory each
--
-- Running jobs.  First attempt out of 2.
----------------------------------------
-- Starting 'ovS' concurrent execution on Fri Jan 16 01:11:26 2026 with 4557738.812 GB free disk space (1 processes; 62 concurrently)

    cd unitigging
    ./B3-12.ovlStore.sh 1 > ./B3-12.ovlStore.000001.out 2>&1

-- Finished on Fri Jan 16 01:11:34 2026 (8 seconds) with 4557898.593 GB free disk space
----------------------------------------
-- Checking store.
----------------------------------------
-- Starting command on Fri Jan 16 01:11:34 2026 with 4557898.593 GB free disk space

    cd unitigging
    /share/org/YZWL/yzwl_lixg/miniforge3/envs/canu_v.2.3/bin/ovStoreDump \
     -S ../B3-12.seqStore \
     -O  ./B3-12.ovlStore \
     -counts \
     > ./B3-12.ovlStore/counts.dat 2> ./B3-12.ovlStore/counts.err

-- Finished on Fri Jan 16 01:11:34 2026 (like a bat out of hell) with 4557898.562 GB free disk space
----------------------------------------
--
-- Overlap store 'unitigging/B3-12.ovlStore' successfully constructed.
-- Found 35897498 overlaps for 223531 reads; 1431011 reads have no overlaps.
--
--
-- Purged 0.437 GB in 60 overlap output files.
----------------------------------------
-- Starting command on Fri Jan 16 01:11:35 2026 with 4557898.562 GB free disk space

    cd unitigging
    /share/org/YZWL/yzwl_lixg/miniforge3/envs/canu_v.2.3/bin/ovStoreStats \
     -C 50 \
     -S ../B3-12.seqStore \
     -O  ./B3-12.ovlStore \
     -o  ./B3-12.ovlStore \
     > ./B3-12.ovlStore.summary.err 2>&1

-- Finished on Fri Jan 16 01:11:40 2026 (5 seconds) with 4557898.546 GB free disk space
----------------------------------------
--
-- Overlap store 'unitigging/B3-12.ovlStore' contains:
--
--   category            reads     %          read length        feature size or coverage  analysis
--   ----------------  -------  -------  ----------------------  ------------------------  --------------------
--   middle-missing        136    0.06    15694.68 +- 6647.46        877.10 +- 948.58     (bad trimming)
--   middle-hump            61    0.03    14687.69 +- 2807.57       4203.90 +- 2769.33    (bad trimming)
--   no-5-prime           1080    0.45    13086.69 +- 3464.22       2563.61 +- 2841.25    (bad trimming)
--   no-3-prime           1236    0.51    12341.59 +- 4105.39       2567.71 +- 2859.72    (bad trimming)
--   
--   low-coverage         3542    1.48    11069.30 +- 3328.39          5.72 +- 3.65       (easy to assemble, potential for lower quality consensus)
--   unique             183562   76.46    13594.96 +- 4085.18         43.73 +- 8.52       (easy to assemble, perfect, yay)
--   repeat-cont         10202    4.25    12178.76 +- 4040.43        847.55 +- 703.90     (potential for consensus errors, no impact on assembly)
--   repeat-dove           254    0.11    20211.59 +- 1964.64        667.77 +- 629.65     (hard to assemble, likely won't assemble correctly or even at all)
--   
--   span-repeat          2441    1.02    13762.42 +- 3609.91       3763.46 +- 3711.13    (read spans a large repeat, usually easy to assemble)
--   uniq-repeat-cont    14066    5.86    13004.84 +- 3247.16                             (should be uniquely placed, low potential for consensus errors, no impact on assembly)
--   uniq-repeat-dove     2952    1.23    17976.90 +- 2951.31                             (will end contigs, potential to misassemble)
--   uniq-anchor          3999    1.67    13506.33 +- 3604.39       8869.51 +- 4318.25    (repeat read, with unique section, probable bad read)
-- Finished stage 'utg-createOverlapStore', reset canuIteration.
--
-- Loading read lengths.
-- Loading number of overlaps per read.
--
-- Configure RED for 16gb memory.
--                   Batches of at most (unlimited) reads.
--                                      500000000 bases.
--                   Expecting evidence of at most 536870912 bases per iteration.
--
--           Total                                               Reads                 Olaps Evidence
--    Job   Memory      Read Range         Reads        Bases   Memory        Olaps   Memory   Memory  (Memory in MB)
--   ---- -------- ------------------- --------- ------------ -------- ------------ -------- --------
--      1 16384.41         1-38968          5712    108989006 13304.50       691270     7.91  1024.00
--      2 16384.35     38969-82129          6240    108946196 13299.29      1140942    13.06  1024.00
--      3 16384.11     82130-123017         5895    108996360 13305.41       585940     6.71  1024.00
--      4 16386.10    123018-163700         5958    108956333 13300.52      1186313    13.58  1024.00
--      5 16385.44    163701-211598         6926    108963030 13301.37      1055104    12.07  1024.00
--      6 16385.46    211599-252430         6040    109006235 13306.62       598253     6.85  1024.00
--      7 16385.02    252431-292582         5941    108949859 13299.73      1161165    13.29  1024.00
--      8 16385.18    292583-338228         6542    108965486 13301.66      1006865    11.52  1024.00
--      9 16385.69    338229-382574         6364    109002851 13306.21       653432     7.48  1024.00
--     10 16384.38    382575-424158         5924    108949703 13299.71      1107094    12.67  1024.00
--     11 16384.70    424159-469036         6420    108968783 13302.06       930129    10.64  1024.00
--     12 16384.15    469037-513569         6370    108980058 13303.43       762273     8.72  1024.00
--     13 16385.95    513570-554562         5832    108970165 13302.21      1026393    11.75  1024.00
--     14 16384.97    554563-598427         6416    108984479 13303.97       786391     9.00  1024.00
--     15 16385.04    598428-641934         6364    108970387 13302.25       943235    10.79  1024.00
--     16 16384.61    641935-682228         5843    108992099 13304.88       674942     7.72  1024.00
--     17 16386.16    682229-725545         6272    108967922 13301.95      1067324    12.21  1024.00
--     18 16385.82    725546-770353         6561    108966484 13301.78      1052156    12.04  1024.00
--     19 16385.20    770354-810128         5787    108993388 13305.04       712850     8.16  1024.00
--     20 16386.50    810129-852883         6193    108971755 13302.41      1056371    12.09  1024.00
--     21 16385.76    852884-897318         6539    108971031 13302.33       998778    11.43  1024.00
--     22 16386.90    897319-937351         5781    109008614 13306.90       699418     8.00  1024.00
--     23 16385.05    937352-979674         6116    108955799 13300.46      1100189    12.59  1024.00
--     24 16384.30    979675-1025627        6582    108958032 13300.75      1009070    11.55  1024.00
--     25 16384.80   1025628-1065228        5733    108985392 13304.06       763942     8.74  1024.00
--     26 16385.72   1065229-1106656        6056    108967368 13301.87      1034961    11.84  1024.00
--     27 16385.26   1106657-1152029        6575    108967925 13301.96       987527    11.30  1024.00
--     28 16385.79   1152030-1191535        5735    109002421 13306.14       668313     7.65  1024.00
--     29 16385.61   1191536-1232019        6012    108953715 13300.20      1171151    13.40  1024.00
--     30 16385.35   1232020-1277605        6591    108965211 13301.62      1024802    11.73  1024.00
--     31 16384.76   1277606-1316437        5733    108996504 13305.42       641693     7.34  1024.00
--     32 16384.16   1316438-1356858        5938    108943637 13298.97      1152484    13.19  1024.00
--     33 16385.38   1356859-1403024        6598    108972444 13302.51       950252    10.87  1024.00
--     34 16386.61   1403025-1441710        5689    109012067 13307.32       636966     7.29  1024.00
--     35 16386.57   1441711-1482567        5886    108965543 13301.64      1129363    12.92  1024.00
--     36 16384.19   1482568-1528736        6639    108959800 13300.97       980394    11.22  1024.00
--     37 16384.86   1528737-1567318        5683    108998519 13305.66       629281     7.20  1024.00
--     38 16384.37   1567319-1607997        5865    108949041 13299.63      1113616    12.74  1024.00
--     39 16384.19   1607998-1654530        6717    108957373 13300.67      1006582    11.52  1024.00
--     40  3076.85   1654531-1654542           2        39675     4.84          274     0.00  1024.00
--   ---- -------- ------------------- --------- ------------ -------- ------------ -------- --------
--                                                 4250020690              35897498
-- Finished stage 'readErrorDetectionConfigure', reset canuIteration.
--
-- Running jobs.  First attempt out of 2.
----------------------------------------
-- Starting 'red' concurrent execution on Fri Jan 16 01:11:46 2026 with 4557898.5 GB free disk space (40 processes; 22 concurrently)

    cd unitigging/3-overlapErrorAdjustment
    ./red.sh 1 > ./red.000001.out 2>&1
    ./red.sh 2 > ./red.000002.out 2>&1
    ./red.sh 3 > ./red.000003.out 2>&1
    ./red.sh 4 > ./red.000004.out 2>&1
    ./red.sh 5 > ./red.000005.out 2>&1
    ./red.sh 6 > ./red.000006.out 2>&1
    ./red.sh 7 > ./red.000007.out 2>&1
    ./red.sh 8 > ./red.000008.out 2>&1
    ./red.sh 9 > ./red.000009.out 2>&1
    ./red.sh 10 > ./red.000010.out 2>&1
    ./red.sh 11 > ./red.000011.out 2>&1
    ./red.sh 12 > ./red.000012.out 2>&1
    ./red.sh 13 > ./red.000013.out 2>&1
    ./red.sh 14 > ./red.000014.out 2>&1
    ./red.sh 15 > ./red.000015.out 2>&1
    ./red.sh 16 > ./red.000016.out 2>&1
    ./red.sh 17 > ./red.000017.out 2>&1
    ./red.sh 18 > ./red.000018.out 2>&1
    ./red.sh 19 > ./red.000019.out 2>&1
    ./red.sh 20 > ./red.000020.out 2>&1
    ./red.sh 21 > ./red.000021.out 2>&1
    ./red.sh 22 > ./red.000022.out 2>&1
    ./red.sh 23 > ./red.000023.out 2>&1
    ./red.sh 24 > ./red.000024.out 2>&1
    ./red.sh 25 > ./red.000025.out 2>&1
    ./red.sh 26 > ./red.000026.out 2>&1
    ./red.sh 27 > ./red.000027.out 2>&1
    ./red.sh 28 > ./red.000028.out 2>&1
    ./red.sh 29 > ./red.000029.out 2>&1
    ./red.sh 30 > ./red.000030.out 2>&1
    ./red.sh 31 > ./red.000031.out 2>&1
    ./red.sh 32 > ./red.000032.out 2>&1
    ./red.sh 33 > ./red.000033.out 2>&1
    ./red.sh 34 > ./red.000034.out 2>&1
    ./red.sh 35 > ./red.000035.out 2>&1
    ./red.sh 36 > ./red.000036.out 2>&1
    ./red.sh 37 > ./red.000037.out 2>&1
    ./red.sh 38 > ./red.000038.out 2>&1
    ./red.sh 39 > ./red.000039.out 2>&1
    ./red.sh 40 > ./red.000040.out 2>&1

-- Finished on Fri Jan 16 01:20:40 2026 (534 seconds) with 4558762.031 GB free disk space
----------------------------------------
-- Found 40 read error detection output files.
-- Finished stage 'readErrorDetectionCheck', reset canuIteration.
--
-- Loading read lengths.
-- Loading number of overlaps per read.
--
-- Configure OEA for 8gb memory.
--                   Batches of at most (unlimited) reads.
--                                      300000000 bases.
--
--           Total                                               Reads                 Olaps  Adjusts
--    Job   Memory      Read Range         Reads        Bases   Memory        Olaps   Memory   Memory  (Memory in MB)
--   ---- -------- ------------------- --------- ------------ -------- ------------ -------- --------
--      1  2779.52         1-113158        16413    300008414   294.61      2309516    70.48   366.43
--      2  2790.30    113159-233363        17518    300002242   294.64      2661952    81.24   366.43
--      3  2790.41    233364-352666        17428    300002300   294.64      2665472    81.34   366.43
--      4  2786.27    352667-469516        16680    300006647   294.62      2530628    77.23   366.43
--      5  2780.99    469517-587034        16883    300014075   294.63      2357172    71.94   366.43
--      6  2786.11    587035-704175        17013    300015936   294.64      2524672    77.05   366.43
--      7  2790.34    704176-821334        17116    300007870   294.63      2663519    81.28   366.43
--      8  2776.09    821335-938327        17011    300005855   294.63      2196781    67.04   366.43
--      9  2788.65    938328-1056560       16998    300005779   294.63      2608353    79.60   366.43
--     10  2787.65   1056561-1172710       16937    300005623   294.62      2575468    78.60   366.43
--     11  2793.70   1172711-1288304       16933    300000163   294.62      2774058    84.66   366.43
--     12  2786.95   1288305-1404418       16866    300005422   294.62      2552496    77.90   366.43
--     13  2787.83   1404419-1519661       16644    300016962   294.63      2581350    78.78   366.43
--     14  2778.35   1519662-1632167       16341    300010333   294.61      2271172    69.31   366.43
--     15  2489.20   1632168-1654542        3289     49913069    55.70       624889    19.07   366.43
--   ---- -------- ------------------- --------- ------------ -------- ------------ -------- --------
--                                                 4250020690              35897498
-- Finished stage 'overlapErrorAdjustmentConfigure', reset canuIteration.
--
-- Running jobs.  First attempt out of 2.
----------------------------------------
-- Starting 'oea' concurrent execution on Fri Jan 16 01:20:47 2026 with 4558761.953 GB free disk space (15 processes; 62 concurrently)

    cd unitigging/3-overlapErrorAdjustment
    ./oea.sh 1 > ./oea.000001.out 2>&1
    ./oea.sh 2 > ./oea.000002.out 2>&1
    ./oea.sh 3 > ./oea.000003.out 2>&1
    ./oea.sh 4 > ./oea.000004.out 2>&1
    ./oea.sh 5 > ./oea.000005.out 2>&1
    ./oea.sh 6 > ./oea.000006.out 2>&1
    ./oea.sh 7 > ./oea.000007.out 2>&1
    ./oea.sh 8 > ./oea.000008.out 2>&1
    ./oea.sh 9 > ./oea.000009.out 2>&1
    ./oea.sh 10 > ./oea.000010.out 2>&1
    ./oea.sh 11 > ./oea.000011.out 2>&1
    ./oea.sh 12 > ./oea.000012.out 2>&1
    ./oea.sh 13 > ./oea.000013.out 2>&1
    ./oea.sh 14 > ./oea.000014.out 2>&1
    ./oea.sh 15 > ./oea.000015.out 2>&1

-- Finished on Fri Jan 16 01:43:48 2026 (1381 seconds) with 4559742.109 GB free disk space
----------------------------------------
-- Found 15 overlap error adjustment output files.
-- Finished stage 'overlapErrorAdjustmentCheck', reset canuIteration.
----------------------------------------
-- Starting command on Fri Jan 16 01:43:48 2026 with 4559742.093 GB free disk space

    cd unitigging/3-overlapErrorAdjustment
    /share/org/YZWL/yzwl_lixg/miniforge3/envs/canu_v.2.3/bin/loadErates \
      -S ../../B3-12.seqStore \
      -O ../B3-12.ovlStore \
      -L ./oea.files \
    > ./oea.apply.err 2>&1

-- Finished on Fri Jan 16 01:43:48 2026 (fast as lightning) with 4559742.015 GB free disk space
----------------------------------------
-- No report available.
-- Finished stage 'updateOverlapStore', reset canuIteration.
-- Finished stage 'unitig', reset canuIteration.
--
-- Running jobs.  First attempt out of 2.
----------------------------------------
-- Starting 'bat' concurrent execution on Fri Jan 16 01:43:48 2026 with 4559741.968 GB free disk space (1 processes; 1 concurrently)

    cd unitigging/4-unitigger
    ./unitigger.sh 1 > ./unitigger.000001.out 2>&1

-- Finished on Fri Jan 16 01:44:00 2026 (12 seconds) with 4559741.796 GB free disk space
----------------------------------------
-- Unitigger finished successfully.
--  
--  ERROR RATES
--  -----------
--                                                   --------threshold------
--  253764                       fraction error      fraction        percent
--  samples                              (1e-5)         error          error
--                   --------------------------      --------       --------
--  command line (-eg)                           ->     30.00        0.0300%
--  command line (-ef)                           ->  -----.--      ---.----%
--  command line (-eM)                           ->     30.00        0.0300%
--  mean + std.dev       0.54 +-  12 *     3.35  ->     40.68        0.0407%
--  median + mad         0.00 +-  12 *     0.00  ->      0.00        0.0000%
--  90th percentile                              ->      1.00        0.0010%  (enabled)
--  
--  BEST EDGE FILTERING
--  -------------------
--  At graph threshold 0.0300%, reads:
--    available to have edges:        55504
--    with at least one edge:         36813
--  
--  At max threshold 0.0300%, reads:
--    available to have edges:        55504
--    with at least one edge:         36813
--  
--  At tight threshold 0.0010%, reads with:
--    both edges below error threshold:     31542  (80.00% minReadsBest threshold = 29450)
--    one  edge  above error threshold:      3785
--    both edges above error threshold:      1486
--    at least one edge:                    36813
--  
--  At loose threshold 0.0300%, reads with:
--    both edges below error threshold:     36813  (80.00% minReadsBest threshold = 29450)
--    one  edge  above error threshold:         0
--    both edges above error threshold:         0
--    at least one edge:                    36813
--  
--  
--  INITIAL EDGES
--  -------- ----------------------------------------
--    178930 reads are contained
--   1444445 reads have no best edges (singleton)
--       740 reads have only one best edge (spur) 
--                504 are mutual best
--     30427 reads have two best edges 
--                860 have one mutual best edge
--              29150 have two mutual best edges
--  
--  
--  FINAL EDGES
--  -------- ----------------------------------------
--    178930 reads are contained
--   1444782 reads have no best edges (singleton)
--       641 reads have only one best edge (spur) 
--                493 are mutual best
--     30189 reads have two best edges 
--                689 have one mutual best edge
--              29173 have two mutual best edges
--  
--  
--  EDGE FILTERING
--  -------- ------------------------------------------
--         0 reads are ignored
--     10376 reads have a gap in overlap coverage
--       146 reads have lopsided best edges
-- Found, in version 1, after unitig construction:
--   contigs:      219 sequences, total length 70907974 bp (including 213 repeats of total length 4667686 bp).
--   bubbles:      162 sequences, total length 3694948 bp.
--   unassembled:  31651 sequences, total length 367454744 bp.
--
-- Contig sizes based on genome size 85mbp:
--
--            NG (bp)  LG (contigs)    sum (bp)
--         ----------  ------------  ----------
--     10     8630179             1     8630179
--     20     4718241             3    19635170
--     30     3865953             5    28063385
--     40     3416903             7    35014270
--     50     3090726            10    44807993
--     60     2654677            13    52901119
--     70     1307155            17    60050726
--     80       27472            69    68008936
--
-- Finished stage 'unitigCheck', reset canuIteration.
----------------------------------------
-- Starting command on Fri Jan 16 01:44:00 2026 with 4559741.781 GB free disk space

    cd unitigging
    /share/org/YZWL/yzwl_lixg/miniforge3/envs/canu_v.2.3/bin/utgcns \
      -S ../B3-12.seqStore \
      -T  ./B3-12.ctgStore 1 \
      -partition 0.8 1.5 0.1 \
    > ./B3-12.ctgStore/partitioning.log 2>&1

-- Finished on Fri Jan 16 01:44:09 2026 (9 seconds) with 4559740.562 GB free disk space
----------------------------------------
-- Using slow alignment for consensus (iteration '0').
-- Configured 10 consensus jobs.
-- Finished stage 'consensusConfigure', reset canuIteration.
--
-- Local: cns       12.750 GB    8 CPUs x  11 jobs   140.250 GB  88 CPUs  (consensus)
--
--
-- Running jobs.  First attempt out of 2.
----------------------------------------
-- Starting 'cns' concurrent execution on Fri Jan 16 01:44:09 2026 with 4559740.531 GB free disk space (10 processes; 11 concurrently)

    cd unitigging/5-consensus
    ./consensus.sh 1 > ./consensus.000001.out 2>&1
    ./consensus.sh 2 > ./consensus.000002.out 2>&1
    ./consensus.sh 3 > ./consensus.000003.out 2>&1
    ./consensus.sh 4 > ./consensus.000004.out 2>&1
    ./consensus.sh 5 > ./consensus.000005.out 2>&1
    ./consensus.sh 6 > ./consensus.000006.out 2>&1
    ./consensus.sh 7 > ./consensus.000007.out 2>&1
    ./consensus.sh 8 > ./consensus.000008.out 2>&1
    ./consensus.sh 9 > ./consensus.000009.out 2>&1
    ./consensus.sh 10 > ./consensus.000010.out 2>&1

-- Finished on Fri Jan 16 01:51:52 2026 (463 seconds) with 4559518.859 GB free disk space
----------------------------------------
-- Using slow alignment for consensus (iteration '1').
-- Configured 10 consensus jobs.
-- All 10 consensus jobs finished successfully.
-- Finished stage 'consensusCheck', reset canuIteration.
-- Using slow alignment for consensus (iteration '0').
-- Configured 10 consensus jobs.
----------------------------------------
-- Starting command on Fri Jan 16 01:51:53 2026 with 4559518.812 GB free disk space

    cd unitigging
    /share/org/YZWL/yzwl_lixg/miniforge3/envs/canu_v.2.3/bin/tgStoreLoad \
      -S ../B3-12.seqStore \
      -T  ./B3-12.ctgStore 2 \
      -L ./5-consensus/ctgcns.files \
    > ./5-consensus/ctgcns.files.ctgStoreLoad.err 2>&1

-- Finished on Fri Jan 16 01:51:54 2026 (one second) with 4559518.687 GB free disk space
----------------------------------------
----------------------------------------
-- Starting command on Fri Jan 16 01:51:54 2026 with 4559518.687 GB free disk space

    cd unitigging
    /share/org/YZWL/yzwl_lixg/miniforge3/envs/canu_v.2.3/bin/tgTigDisplay \
      -S ../B3-12.seqStore \
      -b \
      -o ../B3-12.contigs.unsorted.bam \
      -L ./5-consensus/ctgcns.files \
    > ./5-consensus/ctgcns.files.contigs.bam.err 2>&1

-- Finished on Fri Jan 16 01:54:34 2026 (160 seconds) with 4559342.187 GB free disk space
----------------------------------------
----------------------------------------
-- Starting command on Fri Jan 16 01:54:34 2026 with 4559342.187 GB free disk space

    cd .
    samtools sort \
      --write-index \
      --threads 2 \
      -o ./B3-12.contigs.bam ./B3-12.contigs.unsorted.bam \
    > ./ctgcns.bam.err 2>&1

-- Finished on Fri Jan 16 01:55:34 2026 (60 seconds) with 4559217.531 GB free disk space
----------------------------------------
-- Purging consensus output after loading to ctgStore.
-- Purged 10 .cns outputs.
----------------------------------------
-- Starting command on Fri Jan 16 01:55:34 2026 with 4559220.421 GB free disk space

    cd unitigging
    /share/org/YZWL/yzwl_lixg/miniforge3/envs/canu_v.2.3/bin/tgStoreDump \
      -S ../B3-12.seqStore \
      -T ./B3-12.ctgStore 2 \
      -sizes -s 85000000 \
    > ./B3-12.ctgStore/seqDB.v002.sizes.txt
ZERO length suplied to intervalList::add(), ignoring interval.
ZERO length suplied to intervalList::add(), ignoring interval.
ZERO length suplied to intervalList::add(), ignoring interval.
ZERO length suplied to intervalList::add(), ignoring interval.
ZERO length suplied to intervalList::add(), ignoring interval.
ZERO length suplied to intervalList::add(), ignoring interval.
ZERO length suplied to intervalList::add(), ignoring interval.
ZERO length suplied to intervalList::add(), ignoring interval.
ZERO length suplied to intervalList::add(), ignoring interval.
ZERO length suplied to intervalList::add(), ignoring interval.
ZERO length suplied to intervalList::add(), ignoring interval.
ZERO length suplied to intervalList::add(), ignoring interval.
ZERO length suplied to intervalList::add(), ignoring interval.
ZERO length suplied to intervalList::add(), ignoring interval.
ZERO length suplied to intervalList::add(), ignoring interval.
ZERO length suplied to intervalList::add(), ignoring interval.
ZERO length suplied to intervalList::add(), ignoring interval.
ZERO length suplied to intervalList::add(), ignoring interval.
ZERO length suplied to intervalList::add(), ignoring interval.
ZERO length suplied to intervalList::add(), ignoring interval.
ZERO length suplied to intervalList::add(), ignoring interval.
ZERO length suplied to intervalList::add(), ignoring interval.
ZERO length suplied to intervalList::add(), ignoring interval.
ZERO length suplied to intervalList::add(), ignoring interval.
ZERO length suplied to intervalList::add(), ignoring interval.
ZERO length suplied to intervalList::add(), ignoring interval.
ZERO length suplied to intervalList::add(), ignoring interval.
ZERO length suplied to intervalList::add(), ignoring interval.
ZERO length suplied to intervalList::add(), ignoring interval.
ZERO length suplied to intervalList::add(), ignoring interval.
ZERO length suplied to intervalList::add(), ignoring interval.
ZERO length suplied to intervalList::add(), ignoring interval.
ZERO length suplied to intervalList::add(), ignoring interval.
ZERO length suplied to intervalList::add(), ignoring interval.
ZERO length suplied to intervalList::add(), ignoring interval.
ZERO length suplied to intervalList::add(), ignoring interval.
ZERO length suplied to intervalList::add(), ignoring interval.
ZERO length suplied to intervalList::add(), ignoring interval.
ZERO length suplied to intervalList::add(), ignoring interval.
ZERO length suplied to intervalList::add(), ignoring interval.
ZERO length suplied to intervalList::add(), ignoring interval.
ZERO length suplied to intervalList::add(), ignoring interval.
ZERO length suplied to intervalList::add(), ignoring interval.
ZERO length suplied to intervalList::add(), ignoring interval.
ZERO length suplied to intervalList::add(), ignoring interval.
ZERO length suplied to intervalList::add(), ignoring interval.
ZERO length suplied to intervalList::add(), ignoring interval.
ZERO length suplied to intervalList::add(), ignoring interval.
ZERO length suplied to intervalList::add(), ignoring interval.
ZERO length suplied to intervalList::add(), ignoring interval.
ZERO length suplied to intervalList::add(), ignoring interval.
ZERO length suplied to intervalList::add(), ignoring interval.
ZERO length suplied to intervalList::add(), ignoring interval.
ZERO length suplied to intervalList::add(), ignoring interval.
ZERO length suplied to intervalList::add(), ignoring interval.
ZERO length suplied to intervalList::add(), ignoring interval.
ZERO length suplied to intervalList::add(), ignoring interval.
ZERO length suplied to intervalList::add(), ignoring interval.
ZERO length suplied to intervalList::add(), ignoring interval.
ZERO length suplied to intervalList::add(), ignoring interval.
ZERO length suplied to intervalList::add(), ignoring interval.
ZERO length suplied to intervalList::add(), ignoring interval.
ZERO length suplied to intervalList::add(), ignoring interval.
ZERO length suplied to intervalList::add(), ignoring interval.
ZERO length suplied to intervalList::add(), ignoring interval.
ZERO length suplied to intervalList::add(), ignoring interval.
ZERO length suplied to intervalList::add(), ignoring interval.
ZERO length suplied to intervalList::add(), ignoring interval.
ZERO length suplied to intervalList::add(), ignoring interval.
ZERO length suplied to intervalList::add(), ignoring interval.
ZERO length suplied to intervalList::add(), ignoring interval.
ZERO length suplied to intervalList::add(), ignoring interval.
ZERO length suplied to intervalList::add(), ignoring interval.
ZERO length suplied to intervalList::add(), ignoring interval.
ZERO length suplied to intervalList::add(), ignoring interval.
ZERO length suplied to intervalList::add(), ignoring interval.
ZERO length suplied to intervalList::add(), ignoring interval.
ZERO length suplied to intervalList::add(), ignoring interval.
ZERO length suplied to intervalList::add(), ignoring interval.
ZERO length suplied to intervalList::add(), ignoring interval.
ZERO length suplied to intervalList::add(), ignoring interval.
ZERO length suplied to intervalList::add(), ignoring interval.
ZERO length suplied to intervalList::add(), ignoring interval.
ZERO length suplied to intervalList::add(), ignoring interval.
ZERO length suplied to intervalList::add(), ignoring interval.
ZERO length suplied to intervalList::add(), ignoring interval.
ZERO length suplied to intervalList::add(), ignoring interval.
ZERO length suplied to intervalList::add(), ignoring interval.
ZERO length suplied to intervalList::add(), ignoring interval.
ZERO length suplied to intervalList::add(), ignoring interval.
ZERO length suplied to intervalList::add(), ignoring interval.
ZERO length suplied to intervalList::add(), ignoring interval.
ZERO length suplied to intervalList::add(), ignoring interval.
ZERO length suplied to intervalList::add(), ignoring interval.
ZERO length suplied to intervalList::add(), ignoring interval.
ZERO length suplied to intervalList::add(), ignoring interval.
ZERO length suplied to intervalList::add(), ignoring interval.
ZERO length suplied to intervalList::add(), ignoring interval.
ZERO length suplied to intervalList::add(), ignoring interval.
ZERO length suplied to intervalList::add(), ignoring interval.
ZERO length suplied to intervalList::add(), ignoring interval.
ZERO length suplied to intervalList::add(), ignoring interval.
ZERO length suplied to intervalList::add(), ignoring interval.
ZERO length suplied to intervalList::add(), ignoring interval.
ZERO length suplied to intervalList::add(), ignoring interval.
ZERO length suplied to intervalList::add(), ignoring interval.
ZERO length suplied to intervalList::add(), ignoring interval.
ZERO length suplied to intervalList::add(), ignoring interval.
ZERO length suplied to intervalList::add(), ignoring interval.
ZERO length suplied to intervalList::add(), ignoring interval.
ZERO length suplied to intervalList::add(), ignoring interval.
ZERO length suplied to intervalList::add(), ignoring interval.
ZERO length suplied to intervalList::add(), ignoring interval.

-- Finished on Fri Jan 16 01:55:34 2026 (lickety-split) with 4559094.984 GB free disk space
----------------------------------------
-- Found, in version 2, after consensus generation:
--   contigs:      219 sequences, total length 93147108 bp (including 213 repeats of total length 6478819 bp).
--   bubbles:      162 sequences, total length 5028101 bp.
--   unassembled:  31651 sequences, total length 556693594 bp.
--
-- Contig sizes based on genome size 85mbp:
--
--            NG (bp)  LG (contigs)    sum (bp)
--         ----------  ------------  ----------
--     10    11214920             1    11214920
--     20     8166179             2    19381099
--     30     6154569             3    25535668
--     40     5047335             5    36528581
--     50     4457154             7    45560412
--     60     4315847             9    54287901
--     70     3546655            11    61864237
--     80     3456433            13    68863880
--     90     1707573            17    78179109
--    100      768311            24    85755273
--
-- Finished stage 'consensusLoad', reset canuIteration.
----------------------------------------
-- Starting command on Fri Jan 16 01:55:34 2026 with 4559094.968 GB free disk space

    cd .
    /share/org/YZWL/yzwl_lixg/miniforge3/envs/canu_v.2.3/bin/tgStoreDump \
      -S ./B3-12.seqStore \
      -T ./unitigging/B3-12.ctgStore 2 \
      -o ./B3-12.contigs \
      -layout \
    > ./B3-12.contigs.layout.err 2>&1

-- Finished on Fri Jan 16 01:55:35 2026 (one second) with 4559096.234 GB free disk space
----------------------------------------
----------------------------------------
-- Starting command on Fri Jan 16 01:55:35 2026 with 4559096.234 GB free disk space

    cd .
    /share/org/YZWL/yzwl_lixg/miniforge3/envs/canu_v.2.3/bin/tgStoreDump \
      -S ./B3-12.seqStore \
      -T ./unitigging/B3-12.ctgStore 2 \
      -consensus -fasta \
      -unassembled \
    > ./B3-12.unassembled.fasta
    2> ./B3-12.unassembled.err
ZERO length suplied to intervalList::add(), ignoring interval.
ZERO length suplied to intervalList::add(), ignoring interval.
ZERO length suplied to intervalList::add(), ignoring interval.
ZERO length suplied to intervalList::add(), ignoring interval.
ZERO length suplied to intervalList::add(), ignoring interval.
ZERO length suplied to intervalList::add(), ignoring interval.
ZERO length suplied to intervalList::add(), ignoring interval.
ZERO length suplied to intervalList::add(), ignoring interval.
ZERO length suplied to intervalList::add(), ignoring interval.
ZERO length suplied to intervalList::add(), ignoring interval.
ZERO length suplied to intervalList::add(), ignoring interval.
ZERO length suplied to intervalList::add(), ignoring interval.
ZERO length suplied to intervalList::add(), ignoring interval.
ZERO length suplied to intervalList::add(), ignoring interval.
ZERO length suplied to intervalList::add(), ignoring interval.
ZERO length suplied to intervalList::add(), ignoring interval.
ZERO length suplied to intervalList::add(), ignoring interval.
ZERO length suplied to intervalList::add(), ignoring interval.
ZERO length suplied to intervalList::add(), ignoring interval.
ZERO length suplied to intervalList::add(), ignoring interval.
ZERO length suplied to intervalList::add(), ignoring interval.
ZERO length suplied to intervalList::add(), ignoring interval.
ZERO length suplied to intervalList::add(), ignoring interval.
ZERO length suplied to intervalList::add(), ignoring interval.
ZERO length suplied to intervalList::add(), ignoring interval.
ZERO length suplied to intervalList::add(), ignoring interval.
ZERO length suplied to intervalList::add(), ignoring interval.
ZERO length suplied to intervalList::add(), ignoring interval.
ZERO length suplied to intervalList::add(), ignoring interval.
ZERO length suplied to intervalList::add(), ignoring interval.
ZERO length suplied to intervalList::add(), ignoring interval.
ZERO length suplied to intervalList::add(), ignoring interval.
ZERO length suplied to intervalList::add(), ignoring interval.
ZERO length suplied to intervalList::add(), ignoring interval.
ZERO length suplied to intervalList::add(), ignoring interval.
ZERO length suplied to intervalList::add(), ignoring interval.
ZERO length suplied to intervalList::add(), ignoring interval.
ZERO length suplied to intervalList::add(), ignoring interval.
ZERO length suplied to intervalList::add(), ignoring interval.
ZERO length suplied to intervalList::add(), ignoring interval.
ZERO length suplied to intervalList::add(), ignoring interval.
ZERO length suplied to intervalList::add(), ignoring interval.
ZERO length suplied to intervalList::add(), ignoring interval.
ZERO length suplied to intervalList::add(), ignoring interval.
ZERO length suplied to intervalList::add(), ignoring interval.
ZERO length suplied to intervalList::add(), ignoring interval.
ZERO length suplied to intervalList::add(), ignoring interval.
ZERO length suplied to intervalList::add(), ignoring interval.
ZERO length suplied to intervalList::add(), ignoring interval.
ZERO length suplied to intervalList::add(), ignoring interval.
ZERO length suplied to intervalList::add(), ignoring interval.
ZERO length suplied to intervalList::add(), ignoring interval.
ZERO length suplied to intervalList::add(), ignoring interval.
ZERO length suplied to intervalList::add(), ignoring interval.
ZERO length suplied to intervalList::add(), ignoring interval.
ZERO length suplied to intervalList::add(), ignoring interval.
ZERO length suplied to intervalList::add(), ignoring interval.
ZERO length suplied to intervalList::add(), ignoring interval.
ZERO length suplied to intervalList::add(), ignoring interval.
ZERO length suplied to intervalList::add(), ignoring interval.
ZERO length suplied to intervalList::add(), ignoring interval.
ZERO length suplied to intervalList::add(), ignoring interval.
ZERO length suplied to intervalList::add(), ignoring interval.
ZERO length suplied to intervalList::add(), ignoring interval.
ZERO length suplied to intervalList::add(), ignoring interval.
ZERO length suplied to intervalList::add(), ignoring interval.
ZERO length suplied to intervalList::add(), ignoring interval.
ZERO length suplied to intervalList::add(), ignoring interval.
ZERO length suplied to intervalList::add(), ignoring interval.
ZERO length suplied to intervalList::add(), ignoring interval.
ZERO length suplied to intervalList::add(), ignoring interval.
ZERO length suplied to intervalList::add(), ignoring interval.
ZERO length suplied to intervalList::add(), ignoring interval.
ZERO length suplied to intervalList::add(), ignoring interval.
ZERO length suplied to intervalList::add(), ignoring interval.
ZERO length suplied to intervalList::add(), ignoring interval.
ZERO length suplied to intervalList::add(), ignoring interval.
ZERO length suplied to intervalList::add(), ignoring interval.
ZERO length suplied to intervalList::add(), ignoring interval.
ZERO length suplied to intervalList::add(), ignoring interval.
ZERO length suplied to intervalList::add(), ignoring interval.
ZERO length suplied to intervalList::add(), ignoring interval.
ZERO length suplied to intervalList::add(), ignoring interval.
ZERO length suplied to intervalList::add(), ignoring interval.
ZERO length suplied to intervalList::add(), ignoring interval.
ZERO length suplied to intervalList::add(), ignoring interval.
ZERO length suplied to intervalList::add(), ignoring interval.
ZERO length suplied to intervalList::add(), ignoring interval.
ZERO length suplied to intervalList::add(), ignoring interval.
ZERO length suplied to intervalList::add(), ignoring interval.
ZERO length suplied to intervalList::add(), ignoring interval.
ZERO length suplied to intervalList::add(), ignoring interval.
ZERO length suplied to intervalList::add(), ignoring interval.
ZERO length suplied to intervalList::add(), ignoring interval.
ZERO length suplied to intervalList::add(), ignoring interval.
ZERO length suplied to intervalList::add(), ignoring interval.
ZERO length suplied to intervalList::add(), ignoring interval.
ZERO length suplied to intervalList::add(), ignoring interval.
ZERO length suplied to intervalList::add(), ignoring interval.
ZERO length suplied to intervalList::add(), ignoring interval.
ZERO length suplied to intervalList::add(), ignoring interval.
ZERO length suplied to intervalList::add(), ignoring interval.
ZERO length suplied to intervalList::add(), ignoring interval.
ZERO length suplied to intervalList::add(), ignoring interval.
ZERO length suplied to intervalList::add(), ignoring interval.
ZERO length suplied to intervalList::add(), ignoring interval.
ZERO length suplied to intervalList::add(), ignoring interval.
ZERO length suplied to intervalList::add(), ignoring interval.
ZERO length suplied to intervalList::add(), ignoring interval.
ZERO length suplied to intervalList::add(), ignoring interval.
ZERO length suplied to intervalList::add(), ignoring interval.
ZERO length suplied to intervalList::add(), ignoring interval.
ZERO length suplied to intervalList::add(), ignoring interval.

-- Finished on Fri Jan 16 01:55:37 2026 (2 seconds) with 4559095.953 GB free disk space
----------------------------------------
----------------------------------------
-- Starting command on Fri Jan 16 01:55:37 2026 with 4559095.953 GB free disk space

    cd .
    /share/org/YZWL/yzwl_lixg/miniforge3/envs/canu_v.2.3/bin/tgStoreDump \
      -S ./B3-12.seqStore \
      -T ./unitigging/B3-12.ctgStore 2 \
      -consensus -fasta \
      -contigs \
    > ./B3-12.contigs.fasta
    2> ./B3-12.contigs.err
ZERO length suplied to intervalList::add(), ignoring interval.
ZERO length suplied to intervalList::add(), ignoring interval.
ZERO length suplied to intervalList::add(), ignoring interval.
ZERO length suplied to intervalList::add(), ignoring interval.
ZERO length suplied to intervalList::add(), ignoring interval.
ZERO length suplied to intervalList::add(), ignoring interval.
ZERO length suplied to intervalList::add(), ignoring interval.
ZERO length suplied to intervalList::add(), ignoring interval.
ZERO length suplied to intervalList::add(), ignoring interval.
ZERO length suplied to intervalList::add(), ignoring interval.
ZERO length suplied to intervalList::add(), ignoring interval.
ZERO length suplied to intervalList::add(), ignoring interval.
ZERO length suplied to intervalList::add(), ignoring interval.
ZERO length suplied to intervalList::add(), ignoring interval.
ZERO length suplied to intervalList::add(), ignoring interval.
ZERO length suplied to intervalList::add(), ignoring interval.
ZERO length suplied to intervalList::add(), ignoring interval.
ZERO length suplied to intervalList::add(), ignoring interval.
ZERO length suplied to intervalList::add(), ignoring interval.
ZERO length suplied to intervalList::add(), ignoring interval.
ZERO length suplied to intervalList::add(), ignoring interval.
ZERO length suplied to intervalList::add(), ignoring interval.
ZERO length suplied to intervalList::add(), ignoring interval.
ZERO length suplied to intervalList::add(), ignoring interval.
ZERO length suplied to intervalList::add(), ignoring interval.
ZERO length suplied to intervalList::add(), ignoring interval.
ZERO length suplied to intervalList::add(), ignoring interval.
ZERO length suplied to intervalList::add(), ignoring interval.
ZERO length suplied to intervalList::add(), ignoring interval.
ZERO length suplied to intervalList::add(), ignoring interval.
ZERO length suplied to intervalList::add(), ignoring interval.
ZERO length suplied to intervalList::add(), ignoring interval.
ZERO length suplied to intervalList::add(), ignoring interval.
ZERO length suplied to intervalList::add(), ignoring interval.
ZERO length suplied to intervalList::add(), ignoring interval.
ZERO length suplied to intervalList::add(), ignoring interval.
ZERO length suplied to intervalList::add(), ignoring interval.
ZERO length suplied to intervalList::add(), ignoring interval.
ZERO length suplied to intervalList::add(), ignoring interval.
ZERO length suplied to intervalList::add(), ignoring interval.
ZERO length suplied to intervalList::add(), ignoring interval.
ZERO length suplied to intervalList::add(), ignoring interval.
ZERO length suplied to intervalList::add(), ignoring interval.
ZERO length suplied to intervalList::add(), ignoring interval.
ZERO length suplied to intervalList::add(), ignoring interval.
ZERO length suplied to intervalList::add(), ignoring interval.
ZERO length suplied to intervalList::add(), ignoring interval.
ZERO length suplied to intervalList::add(), ignoring interval.
ZERO length suplied to intervalList::add(), ignoring interval.
ZERO length suplied to intervalList::add(), ignoring interval.
ZERO length suplied to intervalList::add(), ignoring interval.
ZERO length suplied to intervalList::add(), ignoring interval.
ZERO length suplied to intervalList::add(), ignoring interval.
ZERO length suplied to intervalList::add(), ignoring interval.
ZERO length suplied to intervalList::add(), ignoring interval.
ZERO length suplied to intervalList::add(), ignoring interval.
ZERO length suplied to intervalList::add(), ignoring interval.
ZERO length suplied to intervalList::add(), ignoring interval.
ZERO length suplied to intervalList::add(), ignoring interval.
ZERO length suplied to intervalList::add(), ignoring interval.
ZERO length suplied to intervalList::add(), ignoring interval.
ZERO length suplied to intervalList::add(), ignoring interval.
ZERO length suplied to intervalList::add(), ignoring interval.
ZERO length suplied to intervalList::add(), ignoring interval.
ZERO length suplied to intervalList::add(), ignoring interval.
ZERO length suplied to intervalList::add(), ignoring interval.
ZERO length suplied to intervalList::add(), ignoring interval.
ZERO length suplied to intervalList::add(), ignoring interval.
ZERO length suplied to intervalList::add(), ignoring interval.
ZERO length suplied to intervalList::add(), ignoring interval.
ZERO length suplied to intervalList::add(), ignoring interval.
ZERO length suplied to intervalList::add(), ignoring interval.
ZERO length suplied to intervalList::add(), ignoring interval.
ZERO length suplied to intervalList::add(), ignoring interval.
ZERO length suplied to intervalList::add(), ignoring interval.
ZERO length suplied to intervalList::add(), ignoring interval.
ZERO length suplied to intervalList::add(), ignoring interval.
ZERO length suplied to intervalList::add(), ignoring interval.
ZERO length suplied to intervalList::add(), ignoring interval.
ZERO length suplied to intervalList::add(), ignoring interval.
ZERO length suplied to intervalList::add(), ignoring interval.
ZERO length suplied to intervalList::add(), ignoring interval.
ZERO length suplied to intervalList::add(), ignoring interval.
ZERO length suplied to intervalList::add(), ignoring interval.
ZERO length suplied to intervalList::add(), ignoring interval.
ZERO length suplied to intervalList::add(), ignoring interval.
ZERO length suplied to intervalList::add(), ignoring interval.
ZERO length suplied to intervalList::add(), ignoring interval.
ZERO length suplied to intervalList::add(), ignoring interval.
ZERO length suplied to intervalList::add(), ignoring interval.
ZERO length suplied to intervalList::add(), ignoring interval.
ZERO length suplied to intervalList::add(), ignoring interval.
ZERO length suplied to intervalList::add(), ignoring interval.
ZERO length suplied to intervalList::add(), ignoring interval.
ZERO length suplied to intervalList::add(), ignoring interval.
ZERO length suplied to intervalList::add(), ignoring interval.
ZERO length suplied to intervalList::add(), ignoring interval.
ZERO length suplied to intervalList::add(), ignoring interval.
ZERO length suplied to intervalList::add(), ignoring interval.
ZERO length suplied to intervalList::add(), ignoring interval.
ZERO length suplied to intervalList::add(), ignoring interval.
ZERO length suplied to intervalList::add(), ignoring interval.
ZERO length suplied to intervalList::add(), ignoring interval.
ZERO length suplied to intervalList::add(), ignoring interval.
ZERO length suplied to intervalList::add(), ignoring interval.
ZERO length suplied to intervalList::add(), ignoring interval.
ZERO length suplied to intervalList::add(), ignoring interval.
ZERO length suplied to intervalList::add(), ignoring interval.
ZERO length suplied to intervalList::add(), ignoring interval.
ZERO length suplied to intervalList::add(), ignoring interval.
ZERO length suplied to intervalList::add(), ignoring interval.
ZERO length suplied to intervalList::add(), ignoring interval.
ZERO length suplied to intervalList::add(), ignoring interval.

-- Finished on Fri Jan 16 01:55:38 2026 (one second) with 4559097.343 GB free disk space
----------------------------------------
-- Finished stage 'generateOutputs', reset canuIteration.
--
-- Assembly 'B3-12' finished in '/share/org/YZWL/yzwl_lixg/project/28.大豆疫霉菌三代基因组/03.hicanu/B3-12/01.raw_output'.
--
-- Summary saved in 'B3-12.report'.
--
-- Sequences saved:
--   Contigs       -> 'B3-12.contigs.fasta'
--   Unassembled   -> 'B3-12.unassembled.fasta'
--
-- Read layouts saved:
--   Contigs       -> 'B3-12.contigs.layout'.
--
-- Bye.

2026-01-16 01:55:38.662 - WARNING - 输出文件不存在|Output file does not exist: /share/org/YZWL/yzwl_lixg/project/28.大豆疫霉菌三代基因组/03.hicanu/B3-12/01.raw_output/B3-12.unitigs.fasta
Usage: biopytools ragtag [OPTIONS]
Try 'biopytools ragtag -h' for help.

Error: Invalid value for '-r' / '--reference': 文件不存在|File does not exist: /share/org/YZWL/yzwl_lixg/project/28.大豆疫霉菌三代基因组/04.ragtag/Psoja_T2T.fa
Usage: biopytools genomesyn [OPTIONS]
Try 'biopytools genomesyn -h' for help.

Error: Invalid value for '-i' / '--ref': Path '04.ragtag/B3-12/hicanu/B3-12_RagTag_scaffolded.fa' does not exist.
Job 68886833 stderr output:

