Usage: biopytools ragtag [OPTIONS]
Try 'biopytools ragtag -h' for help.

Error: Invalid value for '-r' / '--reference': 文件不存在|File does not exist: /share/org/YZWL/yzwl_lixg/project/28.大豆疫霉菌三代基因组/04.ragtag/Psoja_T2T.fa
Usage: biopytools genomesyn [OPTIONS]
Try 'biopytools genomesyn -h' for help.

Error: Invalid value for '-i' / '--ref': Path '04.ragtag/A1-3/hifiasm/A1-3_RagTag_scaffolded.fa' does not exist.
2026-01-16 02:34:51.653 - WARNING - 命令错误输出|Command stderr:
-- canu master +27 changes (r10515 2a41e933b8de6ed66723d75d36dd071b46d2c347)
--
-- CITATIONS
--
-- For assemblies of PacBio HiFi reads:
--   Nurk S, Walenz BP, Rhiea A, Vollger MR, Logsdon GA, Grothe R, Miga KH, Eichler EE, Phillippy AM, Koren S.
--   HiCanu: accurate assembly of segmental duplications, satellites, and allelic variants from high-fidelity long reads.
--   biorXiv. 2020.
--   https://doi.org/10.1101/2020.03.14.992248
-- 
-- Read and contig alignments during correction and consensus use:
--   Šošic M, Šikic M.
--   Edlib: a C/C ++ library for fast, exact sequence alignment using edit distance.
--   Bioinformatics. 2017 May 1;33(9):1394-1395.
--   http://doi.org/10.1093/bioinformatics/btw753
-- 
-- Overlaps are generated using:
--   Berlin K, et al.
--   Assembling large genomes with single-molecule sequencing and locality-sensitive hashing.
--   Nat Biotechnol. 2015 Jun;33(6):623-30.
--   http://doi.org/10.1038/nbt.3238
-- 
--   Myers EW, et al.
--   A Whole-Genome Assembly of Drosophila.
--   Science. 2000 Mar 24;287(5461):2196-204.
--   http://doi.org/10.1126/science.287.5461.2196
-- 
-- Contig consensus sequences are generated using an algorithm derived from pbdagcon:
--   Chin CS, et al.
--   Nonhybrid, finished microbial genome assemblies from long-read SMRT sequencing data.
--   Nat Methods. 2013 Jun;10(6):563-9
--   http://doi.org/10.1038/nmeth.2474
-- 
-- CONFIGURE CANU
--
-- Detected Java(TM) Runtime Environment '17.0.15-internal' (from '/share/org/YZWL/yzwl_lixg/.local/bin/java') without -d64 support.
--
-- WARNING:
-- WARNING:  Failed to run gnuplot using command 'gnuplot'.
-- WARNING:  Plots will be disabled.
-- WARNING:
--
-- Detected samtools version '1.22' / htslib version 'htscodecs=1.6.3' (from 'samtools').
--
-- Detected 88 CPUs and 503 gigabytes of memory on the local machine.
--
-- Detected Slurm with 'sinfo' binary in /opt/skyformai/bin/sinfo.
--          Slurm disabled by useGrid=false
--
-- Detected  '' with 'pbsnodes' binary in /opt/skyformai/bin/pbsnodes.
--           disabled by useGrid=false
--
-- Detected LSF with 'bsub' binary in /opt/skyformai/bin/bsub.
--          LSF disabled by useGrid=false
--
-- Local machine mode enabled; grid support not detected or not allowed.
--
-- Found trimmed raw PacBio HiFi reads in the input files.
--
--                                (tag)Concurrency
--                         (tag)Threads          |
--                (tag)Memory         |          |
--        (tag)             |         |          |       total usage      algorithm
--        -------  ----------  --------   --------  --------------------  -----------------------------
-- Local: meryl     12.000 GB    4 CPUs x  22 jobs   264.000 GB  88 CPUs  (k-mer counting)
-- Local: cormhap   13.000 GB   11 CPUs x   8 jobs   104.000 GB  88 CPUs  (overlap detection with mhap)
-- Local: obtovl     8.000 GB    8 CPUs x  11 jobs    88.000 GB  88 CPUs  (overlap detection)
-- Local: utgovl     8.000 GB    8 CPUs x  11 jobs    88.000 GB  88 CPUs  (overlap detection)
-- Local: cor        -.--- GB    4 CPUs x   - jobs     -.--- GB   - CPUs  (read correction)
-- Local: ovb        4.000 GB    1 CPU  x  88 jobs   352.000 GB  88 CPUs  (overlap store bucketizer)
-- Local: ovs        8.000 GB    1 CPU  x  62 jobs   496.000 GB  62 CPUs  (overlap store sorting)
-- Local: red       16.000 GB    4 CPUs x  22 jobs   352.000 GB  88 CPUs  (read error detection)
-- Local: oea        8.000 GB    1 CPU  x  62 jobs   496.000 GB  62 CPUs  (overlap error adjustment)
-- Local: bat       32.000 GB    8 CPUs x   1 job     32.000 GB   8 CPUs  (contig construction with bogart)
-- Local: cns        -.--- GB    8 CPUs x   - jobs     -.--- GB   - CPUs  (consensus)
--
-- Generating assembly 'A1-3' in '/share/org/YZWL/yzwl_lixg/project/28.大豆疫霉菌三代基因组/03.hicanu/A1-3/01.raw_output':
--   genomeSize:
--     85000000
--
--   Overlap Generation Limits:
--     corOvlErrorRate 0.0000 (  0.00%)
--     obtOvlErrorRate 0.0250 (  2.50%)
--     utgOvlErrorRate 0.0100 (  1.00%)
--
--   Overlap Processing Limits:
--     corErrorRate    0.0000 (  0.00%)
--     obtErrorRate    0.0250 (  2.50%)
--     utgErrorRate    0.0003 (  0.03%)
--     cnsErrorRate    0.0500 (  5.00%)
--
--   Stages to run:
--     assemble HiFi reads.
--
--
-- BEGIN STORE CREATION
----------------------------------------
-- Starting command on Thu Jan 15 23:54:15 2026 with 4566705.093 GB free disk space

    cd .
    ./A1-3.seqStore.sh \
    > ./A1-3.seqStore.err 2>&1

-- Finished on Fri Jan 16 00:01:23 2026 (428 seconds) with 4566522.687 GB free disk space
----------------------------------------
--
-- In sequence store './A1-3.seqStore':
--   Found 264451 reads.
--   Found 4250002812 bases (50 times coverage).
--    Histogram of corrected reads:
--    
--    G=4250002812                       sum of  ||               length     num
--    NG         length     index       lengths  ||                range    seqs
--    ----- ------------ --------- ------------  ||  ------------------- -------
--    00010        26995     14691    425015874  ||       1223-2498        11365|------------------------------
--    00020        25055     31075    850018323  ||       2499-3774        17008|--------------------------------------------
--    00030        23711     48527   1275017699  ||       3775-5050        14943|---------------------------------------
--    00040        22600     66897   1700022653  ||       5051-6326        12424|---------------------------------
--    00050        21591     86135   2125018417  ||       6327-7602        10369|---------------------------
--    00060        20541    106307   2550007674  ||       7603-8878         8850|-----------------------
--    00070        19283    127626   2975012651  ||       8879-10154        7736|--------------------
--    00080        17136    150791   3400014542  ||      10155-11430        6724|------------------
--    00090        10063    182292   3825010327  ||      11431-12706        5869|----------------
--    00100         1223    264451   4250002812  ||      12707-13982        5094|--------------
--    001.000x              264451   4250002812  ||      13983-15258        4664|-------------
--                                               ||      15259-16534        5196|--------------
--                                               ||      16535-17810        8860|-----------------------
--                                               ||      17811-19086       14795|---------------------------------------
--                                               ||      19087-20362       20907|------------------------------------------------------
--                                               ||      20363-21638       24450|---------------------------------------------------------------
--                                               ||      21639-22914       23883|--------------------------------------------------------------
--                                               ||      22915-24190       19526|---------------------------------------------------
--                                               ||      24191-25466       14954|---------------------------------------
--                                               ||      25467-26742       10485|----------------------------
--                                               ||      26743-28018        7000|-------------------
--                                               ||      28019-29294        4478|------------
--                                               ||      29295-30570        2632|-------
--                                               ||      30571-31846        1329|----
--                                               ||      31847-33122         613|--
--                                               ||      33123-34398         211|-
--                                               ||      34399-35674          56|-
--                                               ||      35675-36950          13|-
--                                               ||      36951-38226           2|-
--                                               ||      38227-39502           2|-
--                                               ||      39503-40778           4|-
--                                               ||      40779-42054           3|-
--                                               ||      42055-43330           2|-
--                                               ||      43331-44606           0|
--                                               ||      44607-45882           1|-
--                                               ||      45883-47158           2|-
--                                               ||      47159-48434           0|
--                                               ||      48435-49710           0|
--                                               ||      49711-50986           0|
--                                               ||      50987-52262           1|-
--    
--
-- In sequence store './A1-3.seqStore':
--   Found 264451 reads.
--   Found 4250002812 bases (50 times coverage).
--    Histogram of corrected-trimmed reads:
--    
--    G=4250002812                       sum of  ||               length     num
--    NG         length     index       lengths  ||                range    seqs
--    ----- ------------ --------- ------------  ||  ------------------- -------
--    00010        26995     14691    425015874  ||       1223-2498        11365|------------------------------
--    00020        25055     31075    850018323  ||       2499-3774        17008|--------------------------------------------
--    00030        23711     48527   1275017699  ||       3775-5050        14943|---------------------------------------
--    00040        22600     66897   1700022653  ||       5051-6326        12424|---------------------------------
--    00050        21591     86135   2125018417  ||       6327-7602        10369|---------------------------
--    00060        20541    106307   2550007674  ||       7603-8878         8850|-----------------------
--    00070        19283    127626   2975012651  ||       8879-10154        7736|--------------------
--    00080        17136    150791   3400014542  ||      10155-11430        6724|------------------
--    00090        10063    182292   3825010327  ||      11431-12706        5869|----------------
--    00100         1223    264451   4250002812  ||      12707-13982        5094|--------------
--    001.000x              264451   4250002812  ||      13983-15258        4664|-------------
--                                               ||      15259-16534        5196|--------------
--                                               ||      16535-17810        8860|-----------------------
--                                               ||      17811-19086       14795|---------------------------------------
--                                               ||      19087-20362       20907|------------------------------------------------------
--                                               ||      20363-21638       24450|---------------------------------------------------------------
--                                               ||      21639-22914       23883|--------------------------------------------------------------
--                                               ||      22915-24190       19526|---------------------------------------------------
--                                               ||      24191-25466       14954|---------------------------------------
--                                               ||      25467-26742       10485|----------------------------
--                                               ||      26743-28018        7000|-------------------
--                                               ||      28019-29294        4478|------------
--                                               ||      29295-30570        2632|-------
--                                               ||      30571-31846        1329|----
--                                               ||      31847-33122         613|--
--                                               ||      33123-34398         211|-
--                                               ||      34399-35674          56|-
--                                               ||      35675-36950          13|-
--                                               ||      36951-38226           2|-
--                                               ||      38227-39502           2|-
--                                               ||      39503-40778           4|-
--                                               ||      40779-42054           3|-
--                                               ||      42055-43330           2|-
--                                               ||      43331-44606           0|
--                                               ||      44607-45882           1|-
--                                               ||      45883-47158           2|-
--                                               ||      47159-48434           0|
--                                               ||      48435-49710           0|
--                                               ||      49711-50986           0|
--                                               ||      50987-52262           1|-
--    
--
-- Correction skipped; not enabled.
--
-- Trimming skipped; not enabled.
--
-- BEGIN ASSEMBLY
----------------------------------------
-- Starting command on Fri Jan 16 00:01:24 2026 with 4566522.64 GB free disk space

    cd unitigging/0-mercounts
    ./meryl-configure.sh \
    > ./meryl-configure.err 2>&1

-- Finished on Fri Jan 16 00:01:25 2026 (one second) with 4566522.64 GB free disk space
----------------------------------------
--  segments   memory batches
--  -------- -------- -------
--        01 10.72 GB       2
--        02  5.68 GB       2
--        04  2.94 GB       2
--        06  2.12 GB       2
--        08  1.59 GB       2
--        12  1.06 GB       2
--        16  0.80 GB       2
--        20  0.64 GB       2
--        24  0.54 GB       2
--        32  0.40 GB       2
--        40  0.32 GB       2
--        48  -.-- GB       -  (segment size too small)
--        56  -.-- GB       -  (segment size too small)
--        64  -.-- GB       -  (segment size too small)
--        96  -.-- GB       -  (segment size too small)
--
--  For 264451 reads with 4250002812 bases, limit to 42 batches.
--  Will count kmers using 01 jobs, each using 12 GB and 4 threads.
--
-- Finished stage 'merylConfigure', reset canuIteration.
--
-- Running jobs.  First attempt out of 2.
----------------------------------------
-- Starting 'meryl' concurrent execution on Fri Jan 16 00:01:25 2026 with 4566522.609 GB free disk space (1 processes; 22 concurrently)

    cd unitigging/0-mercounts
    ./meryl-count.sh 1 > ./meryl-count.000001.out 2>&1

-- Finished on Fri Jan 16 00:04:54 2026 (209 seconds) with 4566117.031 GB free disk space
----------------------------------------
-- Found 1 Kmer counting (meryl) outputs.
-- Finished stage 'utg-merylCountCheck', reset canuIteration.
--
-- Running jobs.  First attempt out of 2.
----------------------------------------
-- Starting 'meryl' concurrent execution on Fri Jan 16 00:04:54 2026 with 4566117 GB free disk space (1 processes; 22 concurrently)

    cd unitigging/0-mercounts
    ./meryl-process.sh 1 > ./meryl-process.000001.out 2>&1

-- Finished on Fri Jan 16 00:04:57 2026 (3 seconds) with 4566116.656 GB free disk space
----------------------------------------
-- Meryl finished successfully.  Kmer frequency histogram:
--
-- WARNING: gnuplot failed.
--
----------------------------------------
--
--  22-mers                                                                                           Fraction
--    Occurrences   NumMers                                                                         Unique Total
--       1-     1         0                                                                        0.0000 0.0000
--       2-     2    257705 *                                                                      0.0057 0.0002
--       3-     4     96152                                                                        0.0072 0.0003
--       5-     7     36044                                                                        0.0083 0.0003
--       8-    11     14312                                                                        0.0088 0.0004
--      12-    16     25201                                                                        0.0090 0.0004
--      17-    22    183954                                                                        0.0098 0.0005
--      23-    29   1548626 ******                                                                 0.0154 0.0022
--      30-    37   8397495 *********************************                                      0.0596 0.0197
--      38-    46  17430311 ********************************************************************** 0.2739 0.1262
--      47-    56  10368222 *****************************************                              0.6578 0.3588
--      57-    67   2009334 ********                                                               0.8611 0.5064
--      68-    79    804197 ***                                                                    0.8979 0.5383
--      80-    92    958115 ***                                                                    0.9161 0.5575
--      93-   106    608425 **                                                                     0.9371 0.5832
--     107-   121    291553 *                                                                      0.9497 0.6010
--     122-   137    295456 *                                                                      0.9561 0.6113
--     138-   154    230023                                                                        0.9626 0.6234
--     155-   172    164122                                                                        0.9675 0.6335
--     173-   191    161726                                                                        0.9712 0.6419
--     192-   211    124423                                                                        0.9747 0.6512
--     212-   232    109750                                                                        0.9774 0.6589
--     233-   254     93241                                                                        0.9799 0.6665
--     255-   277     82079                                                                        0.9819 0.6736
--     278-   301     67694                                                                        0.9837 0.6804
--     302-   326     68454                                                                        0.9852 0.6866
--     327-   352     51265                                                                        0.9867 0.6932
--     353-   379     48343                                                                        0.9879 0.6987
--     380-   407     42864                                                                        0.9889 0.7042
--     408-   436     34428                                                                        0.9899 0.7095
--     437-   466     31635                                                                        0.9906 0.7140
--     467-   497     27612                                                                        0.9913 0.7185
--     498-   529     25454                                                                        0.9919 0.7227
--     530-   562     21583                                                                        0.9925 0.7268
--     563-   596     19045                                                                        0.9930 0.7304
--     597-   631     16386                                                                        0.9934 0.7339
--     632-   667     15376                                                                        0.9938 0.7370
--     668-   704     13530                                                                        0.9941 0.7402
--     705-   742     12164                                                                        0.9944 0.7430
--     743-   781     13886                                                                        0.9947 0.7458
--     782-   821     11366                                                                        0.9950 0.7491
--
--           0 (max occurrences)
--  3187029390 (total mers, non-unique)
--    45026710 (distinct mers, non-unique)
--           0 (unique mers)
-- Finished stage 'meryl-process', reset canuIteration.
--
-- Removing meryl database 'unitigging/0-mercounts/A1-3.ms22'.
--
-- OVERLAPPER (normal) (assembly) erate=0.01
--
----------------------------------------
-- Starting command on Fri Jan 16 00:04:57 2026 with 4566117.64 GB free disk space

    cd unitigging/1-overlapper
    /share/org/YZWL/yzwl_lixg/miniforge3/envs/canu_v.2.3/bin/overlapInCorePartition \
     -S  ../../A1-3.seqStore \
     -hl 160000000 \
     -rl 5000000000 \
     -ol 500 \
     -o  ./A1-3.partition \
    > ./A1-3.partition.err 2>&1

-- Finished on Fri Jan 16 00:04:57 2026 (furiously fast) with 4566117.625 GB free disk space
----------------------------------------
--
-- Configured 21 overlapInCore jobs.
-- Finished stage 'utg-overlapConfigure', reset canuIteration.
--
-- Running jobs.  First attempt out of 2.
----------------------------------------
-- Starting 'utgovl' concurrent execution on Fri Jan 16 00:04:57 2026 with 4566117.593 GB free disk space (21 processes; 11 concurrently)

    cd unitigging/1-overlapper
    ./overlap.sh 1 > ./overlap.000001.out 2>&1
    ./overlap.sh 2 > ./overlap.000002.out 2>&1
    ./overlap.sh 3 > ./overlap.000003.out 2>&1
    ./overlap.sh 4 > ./overlap.000004.out 2>&1
    ./overlap.sh 5 > ./overlap.000005.out 2>&1
    ./overlap.sh 6 > ./overlap.000006.out 2>&1
    ./overlap.sh 7 > ./overlap.000007.out 2>&1
    ./overlap.sh 8 > ./overlap.000008.out 2>&1
    ./overlap.sh 9 > ./overlap.000009.out 2>&1
    ./overlap.sh 10 > ./overlap.000010.out 2>&1
    ./overlap.sh 11 > ./overlap.000011.out 2>&1
    ./overlap.sh 12 > ./overlap.000012.out 2>&1
    ./overlap.sh 13 > ./overlap.000013.out 2>&1
    ./overlap.sh 14 > ./overlap.000014.out 2>&1
    ./overlap.sh 15 > ./overlap.000015.out 2>&1
    ./overlap.sh 16 > ./overlap.000016.out 2>&1
    ./overlap.sh 17 > ./overlap.000017.out 2>&1
    ./overlap.sh 18 > ./overlap.000018.out 2>&1
    ./overlap.sh 19 > ./overlap.000019.out 2>&1
    ./overlap.sh 20 > ./overlap.000020.out 2>&1
    ./overlap.sh 21 > ./overlap.000021.out 2>&1

-- Finished on Fri Jan 16 00:52:25 2026 (2848 seconds) with 4559582.64 GB free disk space
----------------------------------------
-- Found 21 overlapInCore output files.
--
-- overlapInCore compute 'unitigging/1-overlapper':
--   kmer hits
--     with no overlap       1226282785  18.3333333 +- 37287977.465
--     with an overlap         23314513  14.9047619 +- 772886.683
--
--   overlaps                  23314513  14.9047619 +- 772886.683
--     contained                7053932  .523809524 +- 234970.485
--     dovetail                16260581  .380952381 +- 540820.423
--
--   overlaps rejected
--     multiple per pair              0           0 +- 0
--     bad short window               0           0 +- 0
--     bad long window                0           0 +- 0
-- Finished stage 'utg-overlapCheck', reset canuIteration.
----------------------------------------
-- Starting command on Fri Jan 16 00:52:25 2026 with 4559582.625 GB free disk space

    cd unitigging
    /share/org/YZWL/yzwl_lixg/miniforge3/envs/canu_v.2.3/bin/ovStoreConfig \
     -S ../A1-3.seqStore \
     -M 4-8 \
     -L ./1-overlapper/ovljob.files \
     -create ./A1-3.ovlStore.config \
     > ./A1-3.ovlStore.config.txt \
    2> ./A1-3.ovlStore.config.err

-- Finished on Fri Jan 16 00:52:25 2026 (like a bat out of hell) with 4559582.609 GB free disk space
----------------------------------------
--
-- Creating overlap store unitigging/A1-3.ovlStore using:
--      1 bucket
--      1 slice
--        using at most 2 GB memory each
--
-- Running jobs.  First attempt out of 2.
----------------------------------------
-- Starting 'ovS' concurrent execution on Fri Jan 16 00:52:25 2026 with 4559582.593 GB free disk space (1 processes; 62 concurrently)

    cd unitigging
    ./A1-3.ovlStore.sh 1 > ./A1-3.ovlStore.000001.out 2>&1

-- Finished on Fri Jan 16 00:52:35 2026 (10 seconds) with 4559581.5 GB free disk space
----------------------------------------
-- Checking store.
----------------------------------------
-- Starting command on Fri Jan 16 00:52:35 2026 with 4559581.5 GB free disk space

    cd unitigging
    /share/org/YZWL/yzwl_lixg/miniforge3/envs/canu_v.2.3/bin/ovStoreDump \
     -S ../A1-3.seqStore \
     -O  ./A1-3.ovlStore \
     -counts \
     > ./A1-3.ovlStore/counts.dat 2> ./A1-3.ovlStore/counts.err

-- Finished on Fri Jan 16 00:52:36 2026 (one second) with 4559581.468 GB free disk space
----------------------------------------
--
-- Overlap store 'unitigging/A1-3.ovlStore' successfully constructed.
-- Found 46629026 overlaps for 244415 reads; 1484109 reads have no overlaps.
--
--
-- Purged 0.54 GB in 63 overlap output files.
----------------------------------------
-- Starting command on Fri Jan 16 00:52:36 2026 with 4559581.468 GB free disk space

    cd unitigging
    /share/org/YZWL/yzwl_lixg/miniforge3/envs/canu_v.2.3/bin/ovStoreStats \
     -C 50 \
     -S ../A1-3.seqStore \
     -O  ./A1-3.ovlStore \
     -o  ./A1-3.ovlStore \
     > ./A1-3.ovlStore.summary.err 2>&1

-- Finished on Fri Jan 16 00:52:44 2026 (8 seconds) with 4559693.468 GB free disk space
----------------------------------------
--
-- Overlap store 'unitigging/A1-3.ovlStore' contains:
--
--   category            reads     %          read length        feature size or coverage  analysis
--   ----------------  -------  -------  ----------------------  ------------------------  --------------------
--   middle-missing        181    0.07    15132.28 +- 6940.44        885.78 +- 1106.16    (bad trimming)
--   middle-hump            59    0.02    14900.29 +- 3867.02       5411.97 +- 4285.41    (bad trimming)
--   no-5-prime           1234    0.47    13554.71 +- 4968.09       2427.23 +- 3069.85    (bad trimming)
--   no-3-prime           1645    0.62    11717.49 +- 5863.50       2155.56 +- 3018.98    (bad trimming)
--   
--   low-coverage         3950    1.49    10815.54 +- 5132.47          5.78 +- 3.62       (easy to assemble, potential for lower quality consensus)
--   unique             198127   74.92    12294.13 +- 6438.85         43.24 +- 8.63       (easy to assemble, perfect, yay)
--   repeat-cont         13129    4.96    10370.27 +- 6216.44       1167.62 +- 1014.56    (potential for consensus errors, no impact on assembly)
--   repeat-dove           205    0.08    21465.35 +- 1709.07        681.53 +- 791.36     (hard to assemble, likely won't assemble correctly or even at all)
--   
--   span-repeat          4295    1.62    14571.26 +- 5187.60       3490.89 +- 3783.88    (read spans a large repeat, usually easy to assemble)
--   uniq-repeat-cont    14489    5.48    12555.39 +- 5363.84                             (should be uniquely placed, low potential for consensus errors, no impact on assembly)
--   uniq-repeat-dove     3258    1.23    19172.04 +- 2771.02                             (will end contigs, potential to misassemble)
--   uniq-anchor          3843    1.45    13139.56 +- 5573.90       7957.28 +- 5601.07    (repeat read, with unique section, probable bad read)
-- Finished stage 'utg-createOverlapStore', reset canuIteration.
--
-- Loading read lengths.
-- Loading number of overlaps per read.
--
-- Configure RED for 16gb memory.
--                   Batches of at most (unlimited) reads.
--                                      500000000 bases.
--                   Expecting evidence of at most 536870912 bases per iteration.
--
--           Total                                               Reads                 Olaps Evidence
--    Job   Memory      Read Range         Reads        Bases   Memory        Olaps   Memory   Memory  (Memory in MB)
--   ---- -------- ------------------- --------- ------------ -------- ------------ -------- --------
--      1 16386.46         1-36088          5541    108999955 13305.83       753884     8.63  1024.00
--      2 16384.20     36089-83694          7339    108910648 13294.99      1503850    17.21  1024.00
--      3 16384.79     83695-119995         5558    108991670 13304.82       696333     7.97  1024.00
--      4 16384.26    119996-158525         5888    108904939 13294.25      1574124    18.01  1024.00
--      5 16385.86    158526-207998         7629    108933044 13297.73      1409352    16.13  1024.00
--      6 16385.55    207999-258815         7759    108974614 13302.81       938457    10.74  1024.00
--      7 16385.27    258816-296035         5733    108981114 13303.54       850035     9.73  1024.00
--      8 16384.68    296036-339495         6575    108918832 13295.96      1460676    16.72  1024.00
--      9 16384.25    339496-399057         9292    108908856 13294.83      1522515    17.42  1024.00
--     10 16386.00    399058-435569         5572    109001095 13305.97       701074     8.02  1024.00
--     11 16384.30    435570-475530         6104    108915433 13295.53      1465449    16.77  1024.00
--     12 16384.95    475531-538610         9678    108910102 13294.99      1568927    17.95  1024.00
--     13 16384.71    538611-574293         5523    109000445 13305.89       596082     6.82  1024.00
--     14 16384.14    574294-612308         5718    108905817 13294.35      1555070    17.80  1024.00
--     15 16384.64    612309-661844         7518    108970041 13302.24       908808    10.40  1024.00
--     16 16384.05    661845-715181         8151    108912443 13295.23      1469495    16.82  1024.00
--     17 16385.11    715182-752083         5652    108976739 13303.00       883200    10.11  1024.00
--     18 16385.91    752084-793713         6436    108930031 13297.33      1449557    16.59  1024.00
--     19 16385.45    793714-858021         9761    108909621 13294.94      1617807    18.51  1024.00
--     20 16384.25    858022-894560         5489    108983160 13303.78       739893     8.47  1024.00
--     21 16385.67    894561-933035         5884    108924755 13296.66      1486014    17.01  1024.00
--     22 16384.35    933036-986624         8049    108919336 13296.07      1422694    16.28  1024.00
--     23 16385.58    986625-1029830        6612    108993139 13305.03       746866     8.55  1024.00
--     24 16384.12   1029831-1066445        5681    108974095 13302.68       824917     9.44  1024.00
--     25 16385.35   1066446-1108130        6454    108907520 13294.58      1640735    18.78  1024.00
--     26 16386.39   1108131-1162820        8304    108935882 13298.10      1423248    16.29  1024.00
--     27 16385.50   1162821-1199143        5535    108995782 13305.32       714217     8.17  1024.00
--     28 16384.71   1199144-1238322        6022    108905545 13294.32      1606244    18.38  1024.00
--     29 16385.43   1238323-1295627        8835    108932006 13297.64      1379444    15.79  1024.00
--     30 16384.95   1295628-1331164        5441    109000904 13305.95       611914     7.00  1024.00
--     31 16384.13   1331165-1368585        5672    108901036 13293.76      1605377    18.37  1024.00
--     32 16385.80   1368586-1415920        7139    108948954 13299.66      1235715    14.14  1024.00
--     33 16386.17   1415921-1464225        7286    108983981 13303.94       893901    10.23  1024.00
--     34 16384.18   1464226-1500935        5614    108977059 13303.04       798822     9.14  1024.00
--     35 16384.04   1500936-1541311        6303    108927105 13296.96      1317318    15.08  1024.00
--     36 16386.01   1541312-1597091        8355    108932574 13297.70      1425458    16.31  1024.00
--     37 16385.09   1597092-1632766        5470    108998897 13305.70       645610     7.39  1024.00
--     38 16385.13   1632767-1671092        6006    108909913 13294.86      1596416    18.27  1024.00
--     39 16384.21   1671093-1727964        8779    108904002 13294.22      1572212    17.99  1024.00
--     40  3205.47   1727965-1728524          94      1091728   133.27        17316     0.20  1024.00
--   ---- -------- ------------------- --------- ------------ -------- ------------ -------- --------
--                                                 4250002812              46629026
-- Finished stage 'readErrorDetectionConfigure', reset canuIteration.
--
-- Running jobs.  First attempt out of 2.
----------------------------------------
-- Starting 'red' concurrent execution on Fri Jan 16 00:52:50 2026 with 4559693.421 GB free disk space (40 processes; 22 concurrently)

    cd unitigging/3-overlapErrorAdjustment
    ./red.sh 1 > ./red.000001.out 2>&1
    ./red.sh 2 > ./red.000002.out 2>&1
    ./red.sh 3 > ./red.000003.out 2>&1
    ./red.sh 4 > ./red.000004.out 2>&1
    ./red.sh 5 > ./red.000005.out 2>&1
    ./red.sh 6 > ./red.000006.out 2>&1
    ./red.sh 7 > ./red.000007.out 2>&1
    ./red.sh 8 > ./red.000008.out 2>&1
    ./red.sh 9 > ./red.000009.out 2>&1
    ./red.sh 10 > ./red.000010.out 2>&1
    ./red.sh 11 > ./red.000011.out 2>&1
    ./red.sh 12 > ./red.000012.out 2>&1
    ./red.sh 13 > ./red.000013.out 2>&1
    ./red.sh 14 > ./red.000014.out 2>&1
    ./red.sh 15 > ./red.000015.out 2>&1
    ./red.sh 16 > ./red.000016.out 2>&1
    ./red.sh 17 > ./red.000017.out 2>&1
    ./red.sh 18 > ./red.000018.out 2>&1
    ./red.sh 19 > ./red.000019.out 2>&1
    ./red.sh 20 > ./red.000020.out 2>&1
    ./red.sh 21 > ./red.000021.out 2>&1
    ./red.sh 22 > ./red.000022.out 2>&1
    ./red.sh 23 > ./red.000023.out 2>&1
    ./red.sh 24 > ./red.000024.out 2>&1
    ./red.sh 25 > ./red.000025.out 2>&1
    ./red.sh 26 > ./red.000026.out 2>&1
    ./red.sh 27 > ./red.000027.out 2>&1
    ./red.sh 28 > ./red.000028.out 2>&1
    ./red.sh 29 > ./red.000029.out 2>&1
    ./red.sh 30 > ./red.000030.out 2>&1
    ./red.sh 31 > ./red.000031.out 2>&1
    ./red.sh 32 > ./red.000032.out 2>&1
    ./red.sh 33 > ./red.000033.out 2>&1
    ./red.sh 34 > ./red.000034.out 2>&1
    ./red.sh 35 > ./red.000035.out 2>&1
    ./red.sh 36 > ./red.000036.out 2>&1
    ./red.sh 37 > ./red.000037.out 2>&1
    ./red.sh 38 > ./red.000038.out 2>&1
    ./red.sh 39 > ./red.000039.out 2>&1
    ./red.sh 40 > ./red.000040.out 2>&1

-- Finished on Fri Jan 16 01:15:13 2026 (1343 seconds) with 4557654.296 GB free disk space
----------------------------------------
-- Found 40 read error detection output files.
-- Finished stage 'readErrorDetectionCheck', reset canuIteration.
--
-- Loading read lengths.
-- Loading number of overlaps per read.
--
-- Configure OEA for 8gb memory.
--                   Batches of at most (unlimited) reads.
--                                      300000000 bases.
--
--           Total                                               Reads                 Olaps  Adjusts
--    Job   Memory      Read Range         Reads        Bases   Memory        Olaps   Memory   Memory  (Memory in MB)
--   ---- -------- ------------------- --------- ------------ -------- ------------ -------- --------
--      1  2794.16         1-111020        17064    300014485   294.64      2730678    83.33   368.19
--      2  2827.45    111021-241170        19913    300001120   294.71      3819158   116.55   368.19
--      3  2802.05    241171-356391        17689    300019847   294.66      2988436    91.20   368.19
--      4  2814.66    356392-476249        18429    300010112   294.67      3400989   103.79   368.19
--      5  2796.55    476250-602757        19447    300001747   294.70      2806976    85.66   368.19
--      6  2822.48    602758-734841        19964    300018011   294.73      3655642   111.56   368.19
--      7  2824.10    734842-868292        20439    300022034   294.75      3708220   113.17   368.19
--      8  2818.38    868293-989630        18353    300017506   294.68      3522951   107.51   368.19
--      9  2801.04    989631-1097684       16730    300007317   294.62      2956655    90.23   368.19
--     10  2817.45   1097685-1219016       18490    300007219   294.67      3492597   106.59   368.19
--     11  2794.22   1219017-1341910       18816    300003716   294.68      2731056    83.35   368.19
--     12  2816.77   1341911-1465756       18741    300019695   294.69      3469671   105.89   368.19
--     13  2814.07   1465757-1589817       18939    300013179   294.69      3381015   103.18   368.19
--     14  2798.07   1589818-1697312       16610    300016492   294.62      2859170    87.25   368.19
--     15  2505.61   1697313-1728524        4827     49830332    55.67      1105812    33.75   368.19
--   ---- -------- ------------------- --------- ------------ -------- ------------ -------- --------
--                                                 4250002812              46629026
-- Finished stage 'overlapErrorAdjustmentConfigure', reset canuIteration.
--
-- Running jobs.  First attempt out of 2.
----------------------------------------
-- Starting 'oea' concurrent execution on Fri Jan 16 01:15:20 2026 with 4557654.218 GB free disk space (15 processes; 62 concurrently)

    cd unitigging/3-overlapErrorAdjustment
    ./oea.sh 1 > ./oea.000001.out 2>&1
    ./oea.sh 2 > ./oea.000002.out 2>&1
    ./oea.sh 3 > ./oea.000003.out 2>&1
    ./oea.sh 4 > ./oea.000004.out 2>&1
    ./oea.sh 5 > ./oea.000005.out 2>&1
    ./oea.sh 6 > ./oea.000006.out 2>&1
    ./oea.sh 7 > ./oea.000007.out 2>&1
    ./oea.sh 8 > ./oea.000008.out 2>&1
    ./oea.sh 9 > ./oea.000009.out 2>&1
    ./oea.sh 10 > ./oea.000010.out 2>&1
    ./oea.sh 11 > ./oea.000011.out 2>&1
    ./oea.sh 12 > ./oea.000012.out 2>&1
    ./oea.sh 13 > ./oea.000013.out 2>&1
    ./oea.sh 14 > ./oea.000014.out 2>&1
    ./oea.sh 15 > ./oea.000015.out 2>&1

-- Finished on Fri Jan 16 02:21:48 2026 (3988 seconds) with 4559471.281 GB free disk space
----------------------------------------
-- Found 15 overlap error adjustment output files.
-- Finished stage 'overlapErrorAdjustmentCheck', reset canuIteration.
----------------------------------------
-- Starting command on Fri Jan 16 02:21:49 2026 with 4559471.265 GB free disk space

    cd unitigging/3-overlapErrorAdjustment
    /share/org/YZWL/yzwl_lixg/miniforge3/envs/canu_v.2.3/bin/loadErates \
      -S ../../A1-3.seqStore \
      -O ../A1-3.ovlStore \
      -L ./oea.files \
    > ./oea.apply.err 2>&1

-- Finished on Fri Jan 16 02:21:49 2026 (one second) with 4559471.171 GB free disk space
----------------------------------------
-- No report available.
-- Finished stage 'updateOverlapStore', reset canuIteration.
-- Finished stage 'unitig', reset canuIteration.
--
-- Running jobs.  First attempt out of 2.
----------------------------------------
-- Starting 'bat' concurrent execution on Fri Jan 16 02:21:49 2026 with 4559471.125 GB free disk space (1 processes; 1 concurrently)

    cd unitigging/4-unitigger
    ./unitigger.sh 1 > ./unitigger.000001.out 2>&1

-- Finished on Fri Jan 16 02:22:00 2026 (11 seconds) with 4559471.562 GB free disk space
----------------------------------------
-- Unitigger finished successfully.
--  
--  ERROR RATES
--  -----------
--                                                   --------threshold------
--  276580                       fraction error      fraction        percent
--  samples                              (1e-5)         error          error
--                   --------------------------      --------       --------
--  command line (-eg)                           ->     30.00        0.0300%
--  command line (-ef)                           ->  -----.--      ---.----%
--  command line (-eM)                           ->     30.00        0.0300%
--  mean + std.dev       0.53 +-  12 *     3.34  ->     40.56        0.0406%
--  median + mad         0.00 +-  12 *     0.00  ->      0.00        0.0000%
--  90th percentile                              ->      1.00        0.0010%  (enabled)
--  
--  BEST EDGE FILTERING
--  -------------------
--  At graph threshold 0.0300%, reads:
--    available to have edges:        64546
--    with at least one edge:         41186
--  
--  At max threshold 0.0300%, reads:
--    available to have edges:        64546
--    with at least one edge:         41186
--  
--  At tight threshold 0.0010%, reads with:
--    both edges below error threshold:     35272  (80.00% minReadsBest threshold = 32948)
--    one  edge  above error threshold:      4363
--    both edges above error threshold:      1551
--    at least one edge:                    41186
--  
--  At loose threshold 0.0300%, reads with:
--    both edges below error threshold:     41186  (80.00% minReadsBest threshold = 32948)
--    one  edge  above error threshold:         0
--    both edges above error threshold:         0
--    at least one edge:                    41186
--  
--  
--  INITIAL EDGES
--  -------- ----------------------------------------
--    194189 reads are contained
--   1500939 reads have no best edges (singleton)
--       664 reads have only one best edge (spur) 
--                431 are mutual best
--     32732 reads have two best edges 
--                827 have one mutual best edge
--              31564 have two mutual best edges
--  
--  
--  FINAL EDGES
--  -------- ----------------------------------------
--    194189 reads are contained
--   1501266 reads have no best edges (singleton)
--       575 reads have only one best edge (spur) 
--                456 are mutual best
--     32494 reads have two best edges 
--                670 have one mutual best edge
--              31560 have two mutual best edges
--  
--  
--  EDGE FILTERING
--  -------- ------------------------------------------
--         0 reads are ignored
--     12716 reads have a gap in overlap coverage
--       152 reads have lopsided best edges
-- Found, in version 1, after unitig construction:
--   contigs:      123 sequences, total length 68930626 bp (including 95 repeats of total length 2459735 bp).
--   bubbles:      143 sequences, total length 3883348 bp.
--   unassembled:  37795 sequences, total length 423661404 bp.
--
-- Contig sizes based on genome size 85mbp:
--
--            NG (bp)  LG (contigs)    sum (bp)
--         ----------  ------------  ----------
--     10     9455578             1     9455578
--     20     8604944             2    18060522
--     30     7823329             3    25883851
--     40     4604743             5    36215137
--     50     4383247             7    45043159
--     60     3372734             9    52323672
--     70     1527569            13    60002519
--     80       23691            76    68005190
--
-- Finished stage 'unitigCheck', reset canuIteration.
----------------------------------------
-- Starting command on Fri Jan 16 02:22:00 2026 with 4559471.546 GB free disk space

    cd unitigging
    /share/org/YZWL/yzwl_lixg/miniforge3/envs/canu_v.2.3/bin/utgcns \
      -S ../A1-3.seqStore \
      -T  ./A1-3.ctgStore 1 \
      -partition 0.8 1.5 0.1 \
    > ./A1-3.ctgStore/partitioning.log 2>&1

-- Finished on Fri Jan 16 02:22:08 2026 (8 seconds) with 4559470.359 GB free disk space
----------------------------------------
-- Using slow alignment for consensus (iteration '0').
-- Configured 10 consensus jobs.
-- Finished stage 'consensusConfigure', reset canuIteration.
--
-- Local: cns       14.000 GB    8 CPUs x  11 jobs   154.000 GB  88 CPUs  (consensus)
--
--
-- Running jobs.  First attempt out of 2.
----------------------------------------
-- Starting 'cns' concurrent execution on Fri Jan 16 02:22:09 2026 with 4559470.328 GB free disk space (10 processes; 11 concurrently)

    cd unitigging/5-consensus
    ./consensus.sh 1 > ./consensus.000001.out 2>&1
    ./consensus.sh 2 > ./consensus.000002.out 2>&1
    ./consensus.sh 3 > ./consensus.000003.out 2>&1
    ./consensus.sh 4 > ./consensus.000004.out 2>&1
    ./consensus.sh 5 > ./consensus.000005.out 2>&1
    ./consensus.sh 6 > ./consensus.000006.out 2>&1
    ./consensus.sh 7 > ./consensus.000007.out 2>&1
    ./consensus.sh 8 > ./consensus.000008.out 2>&1
    ./consensus.sh 9 > ./consensus.000009.out 2>&1
    ./consensus.sh 10 > ./consensus.000010.out 2>&1

-- Finished on Fri Jan 16 02:30:46 2026 (517 seconds) with 4559256.921 GB free disk space
----------------------------------------
-- Using slow alignment for consensus (iteration '1').
-- Configured 10 consensus jobs.
-- All 10 consensus jobs finished successfully.
-- Finished stage 'consensusCheck', reset canuIteration.
-- Using slow alignment for consensus (iteration '0').
-- Configured 10 consensus jobs.
----------------------------------------
-- Starting command on Fri Jan 16 02:30:46 2026 with 4559256.875 GB free disk space

    cd unitigging
    /share/org/YZWL/yzwl_lixg/miniforge3/envs/canu_v.2.3/bin/tgStoreLoad \
      -S ../A1-3.seqStore \
      -T  ./A1-3.ctgStore 2 \
      -L ./5-consensus/ctgcns.files \
    > ./5-consensus/ctgcns.files.ctgStoreLoad.err 2>&1

-- Finished on Fri Jan 16 02:30:49 2026 (3 seconds) with 4559255.468 GB free disk space
----------------------------------------
----------------------------------------
-- Starting command on Fri Jan 16 02:30:49 2026 with 4559255.468 GB free disk space

    cd unitigging
    /share/org/YZWL/yzwl_lixg/miniforge3/envs/canu_v.2.3/bin/tgTigDisplay \
      -S ../A1-3.seqStore \
      -b \
      -o ../A1-3.contigs.unsorted.bam \
      -L ./5-consensus/ctgcns.files \
    > ./5-consensus/ctgcns.files.contigs.bam.err 2>&1

-- Finished on Fri Jan 16 02:33:36 2026 (167 seconds) with 4559122.218 GB free disk space
----------------------------------------
----------------------------------------
-- Starting command on Fri Jan 16 02:33:36 2026 with 4559122.218 GB free disk space

    cd .
    samtools sort \
      --write-index \
      --threads 2 \
      -o ./A1-3.contigs.bam ./A1-3.contigs.unsorted.bam \
    > ./ctgcns.bam.err 2>&1

-- Finished on Fri Jan 16 02:34:46 2026 (70 seconds) with 4559118.562 GB free disk space
----------------------------------------
-- Purging consensus output after loading to ctgStore.
-- Purged 10 .cns outputs.
----------------------------------------
-- Starting command on Fri Jan 16 02:34:46 2026 with 4559120.984 GB free disk space

    cd unitigging
    /share/org/YZWL/yzwl_lixg/miniforge3/envs/canu_v.2.3/bin/tgStoreDump \
      -S ../A1-3.seqStore \
      -T ./A1-3.ctgStore 2 \
      -sizes -s 85000000 \
    > ./A1-3.ctgStore/seqDB.v002.sizes.txt
ZERO length suplied to intervalList::add(), ignoring interval.
ZERO length suplied to intervalList::add(), ignoring interval.
ZERO length suplied to intervalList::add(), ignoring interval.
ZERO length suplied to intervalList::add(), ignoring interval.
ZERO length suplied to intervalList::add(), ignoring interval.
ZERO length suplied to intervalList::add(), ignoring interval.
ZERO length suplied to intervalList::add(), ignoring interval.
ZERO length suplied to intervalList::add(), ignoring interval.
ZERO length suplied to intervalList::add(), ignoring interval.
ZERO length suplied to intervalList::add(), ignoring interval.
ZERO length suplied to intervalList::add(), ignoring interval.
ZERO length suplied to intervalList::add(), ignoring interval.
ZERO length suplied to intervalList::add(), ignoring interval.
ZERO length suplied to intervalList::add(), ignoring interval.
ZERO length suplied to intervalList::add(), ignoring interval.
ZERO length suplied to intervalList::add(), ignoring interval.
ZERO length suplied to intervalList::add(), ignoring interval.
ZERO length suplied to intervalList::add(), ignoring interval.
ZERO length suplied to intervalList::add(), ignoring interval.
ZERO length suplied to intervalList::add(), ignoring interval.
ZERO length suplied to intervalList::add(), ignoring interval.
ZERO length suplied to intervalList::add(), ignoring interval.
ZERO length suplied to intervalList::add(), ignoring interval.

-- Finished on Fri Jan 16 02:34:47 2026 (one second) with 4559120.984 GB free disk space
----------------------------------------
-- Found, in version 2, after consensus generation:
--   contigs:      123 sequences, total length 90370073 bp (including 95 repeats of total length 3481861 bp).
--   bubbles:      143 sequences, total length 5321058 bp.
--   unassembled:  37795 sequences, total length 618477900 bp.
--
-- Contig sizes based on genome size 85mbp:
--
--            NG (bp)  LG (contigs)    sum (bp)
--         ----------  ------------  ----------
--     10    12298224             1    12298224
--     20    11181864             2    23480088
--     30    10199974             3    33680062
--     40     7434390             4    41114452
--     50     5997054             5    47111506
--     60     5809533             6    52921039
--     70     5100449             8    63712453
--     80     4400323             9    68112776
--     90     1989491            13    78119498
--    100      486156            20    85199757
--
-- Finished stage 'consensusLoad', reset canuIteration.
----------------------------------------
-- Starting command on Fri Jan 16 02:34:47 2026 with 4559120.968 GB free disk space

    cd .
    /share/org/YZWL/yzwl_lixg/miniforge3/envs/canu_v.2.3/bin/tgStoreDump \
      -S ./A1-3.seqStore \
      -T ./unitigging/A1-3.ctgStore 2 \
      -o ./A1-3.contigs \
      -layout \
    > ./A1-3.contigs.layout.err 2>&1

-- Finished on Fri Jan 16 02:34:48 2026 (one second) with 4559120.921 GB free disk space
----------------------------------------
----------------------------------------
-- Starting command on Fri Jan 16 02:34:48 2026 with 4559120.921 GB free disk space

    cd .
    /share/org/YZWL/yzwl_lixg/miniforge3/envs/canu_v.2.3/bin/tgStoreDump \
      -S ./A1-3.seqStore \
      -T ./unitigging/A1-3.ctgStore 2 \
      -consensus -fasta \
      -unassembled \
    > ./A1-3.unassembled.fasta
    2> ./A1-3.unassembled.err
ZERO length suplied to intervalList::add(), ignoring interval.
ZERO length suplied to intervalList::add(), ignoring interval.
ZERO length suplied to intervalList::add(), ignoring interval.
ZERO length suplied to intervalList::add(), ignoring interval.
ZERO length suplied to intervalList::add(), ignoring interval.
ZERO length suplied to intervalList::add(), ignoring interval.
ZERO length suplied to intervalList::add(), ignoring interval.
ZERO length suplied to intervalList::add(), ignoring interval.
ZERO length suplied to intervalList::add(), ignoring interval.
ZERO length suplied to intervalList::add(), ignoring interval.
ZERO length suplied to intervalList::add(), ignoring interval.
ZERO length suplied to intervalList::add(), ignoring interval.
ZERO length suplied to intervalList::add(), ignoring interval.
ZERO length suplied to intervalList::add(), ignoring interval.
ZERO length suplied to intervalList::add(), ignoring interval.
ZERO length suplied to intervalList::add(), ignoring interval.
ZERO length suplied to intervalList::add(), ignoring interval.
ZERO length suplied to intervalList::add(), ignoring interval.
ZERO length suplied to intervalList::add(), ignoring interval.
ZERO length suplied to intervalList::add(), ignoring interval.
ZERO length suplied to intervalList::add(), ignoring interval.
ZERO length suplied to intervalList::add(), ignoring interval.
ZERO length suplied to intervalList::add(), ignoring interval.

-- Finished on Fri Jan 16 02:34:50 2026 (2 seconds) with 4559120.328 GB free disk space
----------------------------------------
----------------------------------------
-- Starting command on Fri Jan 16 02:34:50 2026 with 4559120.328 GB free disk space

    cd .
    /share/org/YZWL/yzwl_lixg/miniforge3/envs/canu_v.2.3/bin/tgStoreDump \
      -S ./A1-3.seqStore \
      -T ./unitigging/A1-3.ctgStore 2 \
      -consensus -fasta \
      -contigs \
    > ./A1-3.contigs.fasta
    2> ./A1-3.contigs.err
ZERO length suplied to intervalList::add(), ignoring interval.
ZERO length suplied to intervalList::add(), ignoring interval.
ZERO length suplied to intervalList::add(), ignoring interval.
ZERO length suplied to intervalList::add(), ignoring interval.
ZERO length suplied to intervalList::add(), ignoring interval.
ZERO length suplied to intervalList::add(), ignoring interval.
ZERO length suplied to intervalList::add(), ignoring interval.
ZERO length suplied to intervalList::add(), ignoring interval.
ZERO length suplied to intervalList::add(), ignoring interval.
ZERO length suplied to intervalList::add(), ignoring interval.
ZERO length suplied to intervalList::add(), ignoring interval.
ZERO length suplied to intervalList::add(), ignoring interval.
ZERO length suplied to intervalList::add(), ignoring interval.
ZERO length suplied to intervalList::add(), ignoring interval.
ZERO length suplied to intervalList::add(), ignoring interval.
ZERO length suplied to intervalList::add(), ignoring interval.
ZERO length suplied to intervalList::add(), ignoring interval.
ZERO length suplied to intervalList::add(), ignoring interval.
ZERO length suplied to intervalList::add(), ignoring interval.
ZERO length suplied to intervalList::add(), ignoring interval.
ZERO length suplied to intervalList::add(), ignoring interval.
ZERO length suplied to intervalList::add(), ignoring interval.
ZERO length suplied to intervalList::add(), ignoring interval.

-- Finished on Fri Jan 16 02:34:51 2026 (one second) with 4559120.218 GB free disk space
----------------------------------------
-- Finished stage 'generateOutputs', reset canuIteration.
--
-- Assembly 'A1-3' finished in '/share/org/YZWL/yzwl_lixg/project/28.大豆疫霉菌三代基因组/03.hicanu/A1-3/01.raw_output'.
--
-- Summary saved in 'A1-3.report'.
--
-- Sequences saved:
--   Contigs       -> 'A1-3.contigs.fasta'
--   Unassembled   -> 'A1-3.unassembled.fasta'
--
-- Read layouts saved:
--   Contigs       -> 'A1-3.contigs.layout'.
--
-- Bye.

2026-01-16 02:34:51.657 - WARNING - 输出文件不存在|Output file does not exist: /share/org/YZWL/yzwl_lixg/project/28.大豆疫霉菌三代基因组/03.hicanu/A1-3/01.raw_output/A1-3.unitigs.fasta
Usage: biopytools ragtag [OPTIONS]
Try 'biopytools ragtag -h' for help.

Error: Invalid value for '-r' / '--reference': 文件不存在|File does not exist: /share/org/YZWL/yzwl_lixg/project/28.大豆疫霉菌三代基因组/04.ragtag/Psoja_T2T.fa
Usage: biopytools genomesyn [OPTIONS]
Try 'biopytools genomesyn -h' for help.

Error: Invalid value for '-i' / '--ref': Path '04.ragtag/A1-3/hicanu/A1-3_RagTag_scaffolded.fa' does not exist.
Job 68886684 stderr output:

