Usage: biopytools ragtag [OPTIONS]
Try 'biopytools ragtag -h' for help.

Error: Invalid value for '-r' / '--reference': 文件不存在|File does not exist: /share/org/YZWL/yzwl_lixg/project/28.大豆疫霉菌三代基因组/04.ragtag/Psoja_T2T.fa
Usage: biopytools genomesyn [OPTIONS]
Try 'biopytools genomesyn -h' for help.

Error: Invalid value for '-i' / '--ref': Path '04.ragtag/A3-2/hifiasm/A3-2_RagTag_scaffolded.fa' does not exist.
2026-01-16 01:29:32.066 - WARNING - 命令错误输出|Command stderr:
-- canu master +27 changes (r10515 2a41e933b8de6ed66723d75d36dd071b46d2c347)
--
-- CITATIONS
--
-- For assemblies of PacBio HiFi reads:
--   Nurk S, Walenz BP, Rhiea A, Vollger MR, Logsdon GA, Grothe R, Miga KH, Eichler EE, Phillippy AM, Koren S.
--   HiCanu: accurate assembly of segmental duplications, satellites, and allelic variants from high-fidelity long reads.
--   biorXiv. 2020.
--   https://doi.org/10.1101/2020.03.14.992248
-- 
-- Read and contig alignments during correction and consensus use:
--   Šošic M, Šikic M.
--   Edlib: a C/C ++ library for fast, exact sequence alignment using edit distance.
--   Bioinformatics. 2017 May 1;33(9):1394-1395.
--   http://doi.org/10.1093/bioinformatics/btw753
-- 
-- Overlaps are generated using:
--   Berlin K, et al.
--   Assembling large genomes with single-molecule sequencing and locality-sensitive hashing.
--   Nat Biotechnol. 2015 Jun;33(6):623-30.
--   http://doi.org/10.1038/nbt.3238
-- 
--   Myers EW, et al.
--   A Whole-Genome Assembly of Drosophila.
--   Science. 2000 Mar 24;287(5461):2196-204.
--   http://doi.org/10.1126/science.287.5461.2196
-- 
-- Contig consensus sequences are generated using an algorithm derived from pbdagcon:
--   Chin CS, et al.
--   Nonhybrid, finished microbial genome assemblies from long-read SMRT sequencing data.
--   Nat Methods. 2013 Jun;10(6):563-9
--   http://doi.org/10.1038/nmeth.2474
-- 
-- CONFIGURE CANU
--
-- Detected Java(TM) Runtime Environment '17.0.15-internal' (from '/share/org/YZWL/yzwl_lixg/.local/bin/java') without -d64 support.
--
-- WARNING:
-- WARNING:  Failed to run gnuplot using command 'gnuplot'.
-- WARNING:  Plots will be disabled.
-- WARNING:
--
-- Detected samtools version '1.22' / htslib version 'htscodecs=1.6.3' (from 'samtools').
--
-- Detected 88 CPUs and 503 gigabytes of memory on the local machine.
--
-- Detected Slurm with 'sinfo' binary in /opt/skyformai/bin/sinfo.
--          Slurm disabled by useGrid=false
--
-- Detected  '' with 'pbsnodes' binary in /opt/skyformai/bin/pbsnodes.
--           disabled by useGrid=false
--
-- Detected LSF with 'bsub' binary in /opt/skyformai/bin/bsub.
--          LSF disabled by useGrid=false
--
-- Local machine mode enabled; grid support not detected or not allowed.
--
-- Found trimmed raw PacBio HiFi reads in the input files.
--
--                                (tag)Concurrency
--                         (tag)Threads          |
--                (tag)Memory         |          |
--        (tag)             |         |          |       total usage      algorithm
--        -------  ----------  --------   --------  --------------------  -----------------------------
-- Local: meryl     12.000 GB    4 CPUs x  22 jobs   264.000 GB  88 CPUs  (k-mer counting)
-- Local: cormhap   13.000 GB   11 CPUs x   8 jobs   104.000 GB  88 CPUs  (overlap detection with mhap)
-- Local: obtovl     8.000 GB    8 CPUs x  11 jobs    88.000 GB  88 CPUs  (overlap detection)
-- Local: utgovl     8.000 GB    8 CPUs x  11 jobs    88.000 GB  88 CPUs  (overlap detection)
-- Local: cor        -.--- GB    4 CPUs x   - jobs     -.--- GB   - CPUs  (read correction)
-- Local: ovb        4.000 GB    1 CPU  x  88 jobs   352.000 GB  88 CPUs  (overlap store bucketizer)
-- Local: ovs        8.000 GB    1 CPU  x  62 jobs   496.000 GB  62 CPUs  (overlap store sorting)
-- Local: red       16.000 GB    4 CPUs x  22 jobs   352.000 GB  88 CPUs  (read error detection)
-- Local: oea        8.000 GB    1 CPU  x  62 jobs   496.000 GB  62 CPUs  (overlap error adjustment)
-- Local: bat       32.000 GB    8 CPUs x   1 job     32.000 GB   8 CPUs  (contig construction with bogart)
-- Local: cns        -.--- GB    8 CPUs x   - jobs     -.--- GB   - CPUs  (consensus)
--
-- Generating assembly 'A3-2' in '/share/org/YZWL/yzwl_lixg/project/28.大豆疫霉菌三代基因组/03.hicanu/A3-2/01.raw_output':
--   genomeSize:
--     85000000
--
--   Overlap Generation Limits:
--     corOvlErrorRate 0.0000 (  0.00%)
--     obtOvlErrorRate 0.0250 (  2.50%)
--     utgOvlErrorRate 0.0100 (  1.00%)
--
--   Overlap Processing Limits:
--     corErrorRate    0.0000 (  0.00%)
--     obtErrorRate    0.0250 (  2.50%)
--     utgErrorRate    0.0003 (  0.03%)
--     cnsErrorRate    0.0500 (  5.00%)
--
--   Stages to run:
--     assemble HiFi reads.
--
--
-- BEGIN STORE CREATION
----------------------------------------
-- Starting command on Thu Jan 15 23:52:29 2026 with 4566608.093 GB free disk space

    cd .
    ./A3-2.seqStore.sh \
    > ./A3-2.seqStore.err 2>&1

-- Finished on Thu Jan 15 23:59:15 2026 (406 seconds) with 4566588.562 GB free disk space
----------------------------------------
--
-- In sequence store './A3-2.seqStore':
--   Found 240762 reads.
--   Found 4250005992 bases (50 times coverage).
--    Histogram of corrected reads:
--    
--    G=4250005992                       sum of  ||               length     num
--    NG         length     index       lengths  ||                range    seqs
--    ----- ------------ --------- ------------  ||  ------------------- -------
--    00010        25723     15164    425020911  ||       1247-2554         4551|----------
--    00020        23421     32540    850002660  ||       2555-3862         5736|------------
--    00030        21876     51347   1275023527  ||       3863-5170         4832|-----------
--    00040        20660     71353   1700017956  ||       5171-6478         4256|---------
--    00050        19606     92476   2125014466  ||       6479-7786         3862|---------
--    00060        18633    114709   2550014092  ||       7787-9094         4059|---------
--    00070        17631    138145   2975008361  ||       9095-10402        4142|---------
--    00080        16479    163044   3400008877  ||      10403-11710        3998|---------
--    00090        14644    190184   3825007878  ||      11711-13018        4403|----------
--    00100         1247    240762   4250005992  ||      13019-14326        7715|-----------------
--    001.000x              240762   4250005992  ||      14327-15634       15534|---------------------------------
--                                               ||      15635-16942       24249|---------------------------------------------------
--                                               ||      16943-18250       29739|---------------------------------------------------------------
--                                               ||      18251-19558       30175|---------------------------------------------------------------
--                                               ||      19559-20866       25922|-------------------------------------------------------
--                                               ||      20867-22174       20520|-------------------------------------------
--                                               ||      22175-23482       15135|--------------------------------
--                                               ||      23483-24790       10954|-----------------------
--                                               ||      24791-26098        7730|-----------------
--                                               ||      26099-27406        5237|-----------
--                                               ||      27407-28714        3504|--------
--                                               ||      28715-30022        2221|-----
--                                               ||      30023-31330        1218|---
--                                               ||      31331-32638         652|--
--                                               ||      32639-33946         289|-
--                                               ||      33947-35254          93|-
--                                               ||      35255-36562          20|-
--                                               ||      36563-37870           7|-
--                                               ||      37871-39178           0|
--                                               ||      39179-40486           3|-
--                                               ||      40487-41794           0|
--                                               ||      41795-43102           2|-
--                                               ||      43103-44410           1|-
--                                               ||      44411-45718           1|-
--                                               ||      45719-47026           1|-
--                                               ||      47027-48334           0|
--                                               ||      48335-49642           0|
--                                               ||      49643-50950           0|
--                                               ||      50951-52258           0|
--                                               ||      52259-53566           1|-
--    
--
-- In sequence store './A3-2.seqStore':
--   Found 240762 reads.
--   Found 4250005992 bases (50 times coverage).
--    Histogram of corrected-trimmed reads:
--    
--    G=4250005992                       sum of  ||               length     num
--    NG         length     index       lengths  ||                range    seqs
--    ----- ------------ --------- ------------  ||  ------------------- -------
--    00010        25723     15164    425020911  ||       1247-2554         4551|----------
--    00020        23421     32540    850002660  ||       2555-3862         5736|------------
--    00030        21876     51347   1275023527  ||       3863-5170         4832|-----------
--    00040        20660     71353   1700017956  ||       5171-6478         4256|---------
--    00050        19606     92476   2125014466  ||       6479-7786         3862|---------
--    00060        18633    114709   2550014092  ||       7787-9094         4059|---------
--    00070        17631    138145   2975008361  ||       9095-10402        4142|---------
--    00080        16479    163044   3400008877  ||      10403-11710        3998|---------
--    00090        14644    190184   3825007878  ||      11711-13018        4403|----------
--    00100         1247    240762   4250005992  ||      13019-14326        7715|-----------------
--    001.000x              240762   4250005992  ||      14327-15634       15534|---------------------------------
--                                               ||      15635-16942       24249|---------------------------------------------------
--                                               ||      16943-18250       29739|---------------------------------------------------------------
--                                               ||      18251-19558       30175|---------------------------------------------------------------
--                                               ||      19559-20866       25922|-------------------------------------------------------
--                                               ||      20867-22174       20520|-------------------------------------------
--                                               ||      22175-23482       15135|--------------------------------
--                                               ||      23483-24790       10954|-----------------------
--                                               ||      24791-26098        7730|-----------------
--                                               ||      26099-27406        5237|-----------
--                                               ||      27407-28714        3504|--------
--                                               ||      28715-30022        2221|-----
--                                               ||      30023-31330        1218|---
--                                               ||      31331-32638         652|--
--                                               ||      32639-33946         289|-
--                                               ||      33947-35254          93|-
--                                               ||      35255-36562          20|-
--                                               ||      36563-37870           7|-
--                                               ||      37871-39178           0|
--                                               ||      39179-40486           3|-
--                                               ||      40487-41794           0|
--                                               ||      41795-43102           2|-
--                                               ||      43103-44410           1|-
--                                               ||      44411-45718           1|-
--                                               ||      45719-47026           1|-
--                                               ||      47027-48334           0|
--                                               ||      48335-49642           0|
--                                               ||      49643-50950           0|
--                                               ||      50951-52258           0|
--                                               ||      52259-53566           1|-
--    
--
-- Correction skipped; not enabled.
--
-- Trimming skipped; not enabled.
--
-- BEGIN ASSEMBLY
----------------------------------------
-- Starting command on Thu Jan 15 23:59:15 2026 with 4566588.515 GB free disk space

    cd unitigging/0-mercounts
    ./meryl-configure.sh \
    > ./meryl-configure.err 2>&1

-- Finished on Thu Jan 15 23:59:16 2026 (one second) with 4566588.515 GB free disk space
----------------------------------------
--  segments   memory batches
--  -------- -------- -------
--        01 10.81 GB       2
--        02  5.61 GB       2
--        04  2.97 GB       2
--        06  2.15 GB       2
--        08  1.61 GB       2
--        12  1.07 GB       2
--        16  0.81 GB       2
--        20  0.65 GB       2
--        24  0.54 GB       2
--        32  0.41 GB       2
--        40  0.33 GB       2
--        48  -.-- GB       -  (segment size too small)
--        56  -.-- GB       -  (segment size too small)
--        64  -.-- GB       -  (segment size too small)
--        96  -.-- GB       -  (segment size too small)
--
--  For 240762 reads with 4250005992 bases, limit to 42 batches.
--  Will count kmers using 01 jobs, each using 12 GB and 4 threads.
--
-- Finished stage 'merylConfigure', reset canuIteration.
--
-- Running jobs.  First attempt out of 2.
----------------------------------------
-- Starting 'meryl' concurrent execution on Thu Jan 15 23:59:16 2026 with 4566588.484 GB free disk space (1 processes; 22 concurrently)

    cd unitigging/0-mercounts
    ./meryl-count.sh 1 > ./meryl-count.000001.out 2>&1

-- Finished on Fri Jan 16 00:02:40 2026 (204 seconds) with 4566374.968 GB free disk space
----------------------------------------
-- Found 1 Kmer counting (meryl) outputs.
-- Finished stage 'utg-merylCountCheck', reset canuIteration.
--
-- Running jobs.  First attempt out of 2.
----------------------------------------
-- Starting 'meryl' concurrent execution on Fri Jan 16 00:02:40 2026 with 4566374.937 GB free disk space (1 processes; 22 concurrently)

    cd unitigging/0-mercounts
    ./meryl-process.sh 1 > ./meryl-process.000001.out 2>&1

-- Finished on Fri Jan 16 00:02:45 2026 (5 seconds) with 4566375.562 GB free disk space
----------------------------------------
-- Meryl finished successfully.  Kmer frequency histogram:
--
-- WARNING: gnuplot failed.
--
----------------------------------------
--
--  22-mers                                                                                           Fraction
--    Occurrences   NumMers                                                                         Unique Total
--       1-     1         0                                                                        0.0000 0.0000
--       2-     2    309061 *                                                                      0.0068 0.0002
--       3-     4     91902                                                                        0.0083 0.0003
--       5-     7     26506                                                                        0.0092 0.0003
--       8-    11     18425                                                                        0.0096 0.0004
--      12-    16     50079                                                                        0.0100 0.0004
--      17-    22    154058                                                                        0.0113 0.0007
--      23-    29    663480 **                                                                     0.0154 0.0019
--      30-    37   3832436 ****************                                                       0.0336 0.0090
--      38-    46  14359461 **************************************************************         0.1355 0.0597
--      47-    56  16199851 ********************************************************************** 0.4757 0.2671
--      57-    67   4588251 *******************                                                    0.8093 0.5096
--      68-    79    631441 **                                                                     0.8928 0.5810
--      80-    92    919842 ***                                                                    0.9059 0.5947
--      93-   106    939394 ****                                                                   0.9269 0.6204
--     107-   121    355603 *                                                                      0.9467 0.6482
--     122-   137    274882 *                                                                      0.9541 0.6599
--     138-   154    267595 *                                                                      0.9602 0.6711
--     155-   172    160018                                                                        0.9659 0.6829
--     173-   191    175087                                                                        0.9694 0.6909
--     192-   211    128778                                                                        0.9733 0.7008
--     212-   232     99462                                                                        0.9761 0.7087
--     233-   254     94153                                                                        0.9782 0.7155
--     255-   277     86858                                                                        0.9803 0.7226
--     278-   301     83077                                                                        0.9822 0.7298
--     302-   326     70151                                                                        0.9840 0.7372
--     327-   352     59974                                                                        0.9856 0.7440
--     353-   379     47235                                                                        0.9869 0.7503
--     380-   407     45226                                                                        0.9879 0.7556
--     408-   436     34990                                                                        0.9889 0.7611
--     437-   466     34001                                                                        0.9897 0.7657
--     467-   497     26906                                                                        0.9904 0.7704
--     498-   529     26608                                                                        0.9910 0.7744
--     530-   562     23742                                                                        0.9916 0.7786
--     563-   596     21632                                                                        0.9921 0.7826
--     597-   631     17963                                                                        0.9926 0.7865
--     632-   667     17556                                                                        0.9930 0.7899
--     668-   704     16450                                                                        0.9934 0.7935
--     705-   742     13898                                                                        0.9938 0.7969
--     743-   781     13199                                                                        0.9941 0.8001
--     782-   821     11564                                                                        0.9944 0.8032
--
--           0 (max occurrences)
--  3223340895 (total mers, non-unique)
--    45234439 (distinct mers, non-unique)
--           0 (unique mers)
-- Finished stage 'meryl-process', reset canuIteration.
--
-- Removing meryl database 'unitigging/0-mercounts/A3-2.ms22'.
--
-- OVERLAPPER (normal) (assembly) erate=0.01
--
----------------------------------------
-- Starting command on Fri Jan 16 00:02:45 2026 with 4566375.546 GB free disk space

    cd unitigging/1-overlapper
    /share/org/YZWL/yzwl_lixg/miniforge3/envs/canu_v.2.3/bin/overlapInCorePartition \
     -S  ../../A3-2.seqStore \
     -hl 160000000 \
     -rl 5000000000 \
     -ol 500 \
     -o  ./A3-2.partition \
    > ./A3-2.partition.err 2>&1

-- Finished on Fri Jan 16 00:02:45 2026 (lickety-split) with 4566375.531 GB free disk space
----------------------------------------
--
-- Configured 21 overlapInCore jobs.
-- Finished stage 'utg-overlapConfigure', reset canuIteration.
--
-- Running jobs.  First attempt out of 2.
----------------------------------------
-- Starting 'utgovl' concurrent execution on Fri Jan 16 00:02:45 2026 with 4566375.5 GB free disk space (21 processes; 11 concurrently)

    cd unitigging/1-overlapper
    ./overlap.sh 1 > ./overlap.000001.out 2>&1
    ./overlap.sh 2 > ./overlap.000002.out 2>&1
    ./overlap.sh 3 > ./overlap.000003.out 2>&1
    ./overlap.sh 4 > ./overlap.000004.out 2>&1
    ./overlap.sh 5 > ./overlap.000005.out 2>&1
    ./overlap.sh 6 > ./overlap.000006.out 2>&1
    ./overlap.sh 7 > ./overlap.000007.out 2>&1
    ./overlap.sh 8 > ./overlap.000008.out 2>&1
    ./overlap.sh 9 > ./overlap.000009.out 2>&1
    ./overlap.sh 10 > ./overlap.000010.out 2>&1
    ./overlap.sh 11 > ./overlap.000011.out 2>&1
    ./overlap.sh 12 > ./overlap.000012.out 2>&1
    ./overlap.sh 13 > ./overlap.000013.out 2>&1
    ./overlap.sh 14 > ./overlap.000014.out 2>&1
    ./overlap.sh 15 > ./overlap.000015.out 2>&1
    ./overlap.sh 16 > ./overlap.000016.out 2>&1
    ./overlap.sh 17 > ./overlap.000017.out 2>&1
    ./overlap.sh 18 > ./overlap.000018.out 2>&1
    ./overlap.sh 19 > ./overlap.000019.out 2>&1
    ./overlap.sh 20 > ./overlap.000020.out 2>&1
    ./overlap.sh 21 > ./overlap.000021.out 2>&1

-- Finished on Fri Jan 16 00:29:31 2026 (1606 seconds) with 4563474.875 GB free disk space
----------------------------------------
-- Found 21 overlapInCore output files.
--
-- overlapInCore compute 'unitigging/1-overlapper':
--   kmer hits
--     with no overlap       1336198342  92.4761905 +- 39233206.143
--     with an overlap         24509599  3.76190476 +- 661175.572
--
--   overlaps                  24509599  3.76190476 +- 661175.572
--     contained                4717746  .571428571 +- 127621.485
--     dovetail                19791853  .190476191 +- 535197.852
--
--   overlaps rejected
--     multiple per pair              0           0 +- 0
--     bad short window               0           0 +- 0
--     bad long window                0           0 +- 0
-- Finished stage 'utg-overlapCheck', reset canuIteration.
----------------------------------------
-- Starting command on Fri Jan 16 00:29:31 2026 with 4563474.859 GB free disk space

    cd unitigging
    /share/org/YZWL/yzwl_lixg/miniforge3/envs/canu_v.2.3/bin/ovStoreConfig \
     -S ../A3-2.seqStore \
     -M 4-8 \
     -L ./1-overlapper/ovljob.files \
     -create ./A3-2.ovlStore.config \
     > ./A3-2.ovlStore.config.txt \
    2> ./A3-2.ovlStore.config.err

-- Finished on Fri Jan 16 00:29:31 2026 (lickety-split) with 4563474.843 GB free disk space
----------------------------------------
--
-- Creating overlap store unitigging/A3-2.ovlStore using:
--      1 bucket
--      1 slice
--        using at most 2 GB memory each
--
-- Running jobs.  First attempt out of 2.
----------------------------------------
-- Starting 'ovS' concurrent execution on Fri Jan 16 00:29:31 2026 with 4563474.828 GB free disk space (1 processes; 62 concurrently)

    cd unitigging
    ./A3-2.ovlStore.sh 1 > ./A3-2.ovlStore.000001.out 2>&1

-- Finished on Fri Jan 16 00:29:42 2026 (11 seconds) with 4563484.078 GB free disk space
----------------------------------------
-- Checking store.
----------------------------------------
-- Starting command on Fri Jan 16 00:29:42 2026 with 4563484.078 GB free disk space

    cd unitigging
    /share/org/YZWL/yzwl_lixg/miniforge3/envs/canu_v.2.3/bin/ovStoreDump \
     -S ../A3-2.seqStore \
     -O  ./A3-2.ovlStore \
     -counts \
     > ./A3-2.ovlStore/counts.dat 2> ./A3-2.ovlStore/counts.err

-- Finished on Fri Jan 16 00:29:42 2026 (fast as lightning) with 4563484.046 GB free disk space
----------------------------------------
--
-- Overlap store 'unitigging/A3-2.ovlStore' successfully constructed.
-- Found 49019198 overlaps for 238104 reads; 1241606 reads have no overlaps.
--
--
-- Purged 0.543 GB in 63 overlap output files.
----------------------------------------
-- Starting command on Fri Jan 16 00:29:43 2026 with 4563484.046 GB free disk space

    cd unitigging
    /share/org/YZWL/yzwl_lixg/miniforge3/envs/canu_v.2.3/bin/ovStoreStats \
     -C 50 \
     -S ../A3-2.seqStore \
     -O  ./A3-2.ovlStore \
     -o  ./A3-2.ovlStore \
     > ./A3-2.ovlStore.summary.err 2>&1

-- Finished on Fri Jan 16 00:29:50 2026 (7 seconds) with 4563484.031 GB free disk space
----------------------------------------
--
-- Overlap store 'unitigging/A3-2.ovlStore' contains:
--
--   category            reads     %          read length        feature size or coverage  analysis
--   ----------------  -------  -------  ----------------------  ------------------------  --------------------
--   middle-missing        136    0.06    15937.12 +- 6369.30        797.81 +- 1305.10    (bad trimming)
--   middle-hump             5    0.00    13710.20 +- 7120.83       4302.60 +- 2661.49    (bad trimming)
--   no-5-prime            347    0.14    13147.03 +- 4988.87       1223.45 +- 2193.17    (bad trimming)
--   no-3-prime            370    0.15    11215.68 +- 6113.51       1406.83 +- 2323.75    (bad trimming)
--   
--   low-coverage          767    0.32    10299.67 +- 5403.84          6.38 +- 3.83       (easy to assemble, potential for lower quality consensus)
--   unique             200263   83.18    13591.80 +- 4617.02         46.92 +- 8.54       (easy to assemble, perfect, yay)
--   repeat-cont         14029    5.83    11427.38 +- 4443.17       1087.00 +- 657.16     (potential for consensus errors, no impact on assembly)
--   repeat-dove           184    0.08    20500.33 +- 2509.87        662.47 +- 583.69     (hard to assemble, likely won't assemble correctly or even at all)
--   
--   span-repeat          2403    1.00    14293.74 +- 4107.52       3360.56 +- 3844.07    (read spans a large repeat, usually easy to assemble)
--   uniq-repeat-cont    13066    5.43    13124.74 +- 3677.04                             (should be uniquely placed, low potential for consensus errors, no impact on assembly)
--   uniq-repeat-dove     2877    1.19    18367.88 +- 3040.87                             (will end contigs, potential to misassemble)
--   uniq-anchor          3657    1.52    14003.86 +- 3695.97       8072.55 +- 4588.02    (repeat read, with unique section, probable bad read)
-- Finished stage 'utg-createOverlapStore', reset canuIteration.
--
-- Loading read lengths.
-- Loading number of overlaps per read.
--
-- Configure RED for 16gb memory.
--                   Batches of at most (unlimited) reads.
--                                      500000000 bases.
--                   Expecting evidence of at most 536870912 bases per iteration.
--
--           Total                                               Reads                 Olaps Evidence
--    Job   Memory      Read Range         Reads        Bases   Memory        Olaps   Memory   Memory  (Memory in MB)
--   ---- -------- ------------------- --------- ------------ -------- ------------ -------- --------
--      1 16384.52         1-34571          5612    108971758 13302.39       884623    10.12  1024.00
--      2 16384.01     34572-71803          6052    108946640 13299.34      1107096    12.67  1024.00
--      3 16385.16     71804-109416         6173    108946723 13299.35      1206153    13.80  1024.00
--      4 16385.21    109417-144974         5810    108937231 13298.18      1312653    15.02  1024.00
--      5 16385.27    144975-182861         6214    108944564 13299.09      1238435    14.17  1024.00
--      6 16384.89    182862-225946         7030    108910713 13294.99      1564224    17.90  1024.00
--      7 16385.96    225947-261201         5705    108955904 13300.46      1179679    13.50  1024.00
--      8 16385.66    261202-298358         6059    108937908 13298.28      1344652    15.39  1024.00
--      9 16385.82    298359-343856         7311    108929163 13297.25      1448304    16.57  1024.00
--     10 16384.78    343857-379067         5669    108974462 13302.73       878233    10.05  1024.00
--     11 16385.49    379068-414277         5846    108913342 13295.27      1592440    18.22  1024.00
--     12 16385.13    414278-456703         6772    108954711 13300.35      1116622    12.78  1024.00
--     13 16385.84    456704-494287         6080    108961638 13301.17      1106534    12.66  1024.00
--     14 16384.30    494288-529739         5724    108936783 13298.13      1238589    14.17  1024.00
--     15 16384.79    529740-568243         6185    108943513 13298.96      1208251    13.83  1024.00
--     16 16385.29    568244-609146         6739    108923972 13296.60      1458588    16.69  1024.00
--     17 16386.55    609147-643458         5640    108963980 13301.44      1145502    13.11  1024.00
--     18 16384.04    643459-680114         5934    108915808 13295.57      1438922    16.47  1024.00
--     19 16385.90    680115-723928         7158    108925689 13296.82      1492485    17.08  1024.00
--     20 16384.51    723929-758011         5633    108970891 13302.29       893286    10.22  1024.00
--     21 16385.14    758012-793891         5776    108916000 13295.59      1533166    17.55  1024.00
--     22 16384.81    793892-834553         6544    108955490 13300.44      1081498    12.38  1024.00
--     23 16385.15    834554-872427         6229    108951549 13299.95      1154116    13.21  1024.00
--     24 16384.30    872428-907968         5775    108928001 13297.06      1331790    15.24  1024.00
--     25 16384.68    907969-945809         6186    108943033 13298.90      1203338    13.77  1024.00
--     26 16385.84    945810-987429         6922    108920800 13296.21      1540066    17.62  1024.00
--     27 16385.95    987430-1022364        5681    108963981 13301.45      1092627    12.50  1024.00
--     28 16384.82   1022365-1059106        5943    108928680 13297.15      1369726    15.68  1024.00
--     29 16384.22   1059107-1103006        7131    108916989 13295.76      1438710    16.46  1024.00
--     30 16386.89   1103007-1137353        5567    108999880 13305.82       792359     9.07  1024.00
--     31 16384.92   1137354-1173211        5792    108905118 13294.26      1629754    18.65  1024.00
--     32 16384.20   1173212-1212450        6441    108980793 13303.52       757850     8.67  1024.00
--     33 16385.50   1212451-1251202        6277    108934319 13297.84      1368454    15.66  1024.00
--     34 16384.34   1251203-1285679        5700    108952350 13300.03      1075509    12.31  1024.00
--     35 16384.76   1285680-1322953        6042    108932384 13297.60      1324554    15.16  1024.00
--     36 16384.37   1322954-1365005        6788    108918148 13295.89      1440116    16.48  1024.00
--     37 16385.70   1365006-1399898        5668    108961937 13301.20      1092175    12.50  1024.00
--     38 16386.02   1399899-1436044        5848    108936972 13298.15      1386402    15.87  1024.00
--     39 16385.21   1436045-1479154        7018    108915505 13295.57      1541780    17.64  1024.00
--     40  3228.20   1479155-1479710          88      1278670   156.09         9937     0.11  1024.00
--   ---- -------- ------------------- --------- ------------ -------- ------------ -------- --------
--                                                 4250005992              49019198
-- Finished stage 'readErrorDetectionConfigure', reset canuIteration.
--
-- Running jobs.  First attempt out of 2.
----------------------------------------
-- Starting 'red' concurrent execution on Fri Jan 16 00:29:55 2026 with 4563483.984 GB free disk space (40 processes; 22 concurrently)

    cd unitigging/3-overlapErrorAdjustment
    ./red.sh 1 > ./red.000001.out 2>&1
    ./red.sh 2 > ./red.000002.out 2>&1
    ./red.sh 3 > ./red.000003.out 2>&1
    ./red.sh 4 > ./red.000004.out 2>&1
    ./red.sh 5 > ./red.000005.out 2>&1
    ./red.sh 6 > ./red.000006.out 2>&1
    ./red.sh 7 > ./red.000007.out 2>&1
    ./red.sh 8 > ./red.000008.out 2>&1
    ./red.sh 9 > ./red.000009.out 2>&1
    ./red.sh 10 > ./red.000010.out 2>&1
    ./red.sh 11 > ./red.000011.out 2>&1
    ./red.sh 12 > ./red.000012.out 2>&1
    ./red.sh 13 > ./red.000013.out 2>&1
    ./red.sh 14 > ./red.000014.out 2>&1
    ./red.sh 15 > ./red.000015.out 2>&1
    ./red.sh 16 > ./red.000016.out 2>&1
    ./red.sh 17 > ./red.000017.out 2>&1
    ./red.sh 18 > ./red.000018.out 2>&1
    ./red.sh 19 > ./red.000019.out 2>&1
    ./red.sh 20 > ./red.000020.out 2>&1
    ./red.sh 21 > ./red.000021.out 2>&1
    ./red.sh 22 > ./red.000022.out 2>&1
    ./red.sh 23 > ./red.000023.out 2>&1
    ./red.sh 24 > ./red.000024.out 2>&1
    ./red.sh 25 > ./red.000025.out 2>&1
    ./red.sh 26 > ./red.000026.out 2>&1
    ./red.sh 27 > ./red.000027.out 2>&1
    ./red.sh 28 > ./red.000028.out 2>&1
    ./red.sh 29 > ./red.000029.out 2>&1
    ./red.sh 30 > ./red.000030.out 2>&1
    ./red.sh 31 > ./red.000031.out 2>&1
    ./red.sh 32 > ./red.000032.out 2>&1
    ./red.sh 33 > ./red.000033.out 2>&1
    ./red.sh 34 > ./red.000034.out 2>&1
    ./red.sh 35 > ./red.000035.out 2>&1
    ./red.sh 36 > ./red.000036.out 2>&1
    ./red.sh 37 > ./red.000037.out 2>&1
    ./red.sh 38 > ./red.000038.out 2>&1
    ./red.sh 39 > ./red.000039.out 2>&1
    ./red.sh 40 > ./red.000040.out 2>&1

-- Finished on Fri Jan 16 00:43:31 2026 (816 seconds) with 4561165.906 GB free disk space
----------------------------------------
-- Found 40 read error detection output files.
-- Finished stage 'readErrorDetectionCheck', reset canuIteration.
--
-- Loading read lengths.
-- Loading number of overlaps per read.
--
-- Configure OEA for 8gb memory.
--                   Batches of at most (unlimited) reads.
--                                      300000000 bases.
--
--           Total                                               Reads                 Olaps  Adjusts
--    Job   Memory      Read Range         Reads        Bases   Memory        Olaps   Memory   Memory  (Memory in MB)
--   ---- -------- ------------------- --------- ------------ -------- ------------ -------- --------
--      1  2803.05         1-100905        16455    300017894   294.62      3044336    92.91   367.53
--      2  2830.80    100906-209093        17634    300005120   294.65      3952917   120.63   367.53
--      3  2801.78    209094-308973        16268    300001928   294.60      3003227    91.65   367.53
--      4  2825.06    308974-414882        17219    300008237   294.64      3765042   114.90   367.53
--      5  2807.77    414883-521272        17149    300000611   294.63      3198730    97.62   367.53
--      6  2815.40    521273-627340        17194    300015289   294.64      3448324   105.23   367.53
--      7  2823.78    627341-733146        17344    300002977   294.63      3723071   113.62   367.53
--      8  2812.74    733147-836431        16719    300007421   294.62      3361893   102.60   367.53
--      9  2817.12    836432-937131        16465    300010024   294.61      3505641   106.98   367.53
--     10  2826.37    937132-1041659       17169    300008437   294.63      3807915   116.21   367.53
--     11  2803.21   1041660-1147977       17149    300004469   294.63      3049248    93.06   367.53
--     12  2811.29   1147978-1252862       17098    300016685   294.64      3313728   101.13   367.53
--     13  2822.88   1252863-1357984       17172    300019524   294.64      3693377   112.71   367.53
--     14  2800.85   1357985-1456949       16110    300007162   294.60      2972826    90.72   367.53
--     15  2507.18   1456950-1479710        3617     49880214    55.68      1178923    35.98   367.53
--   ---- -------- ------------------- --------- ------------ -------- ------------ -------- --------
--                                                 4250005992              49019198
-- Finished stage 'overlapErrorAdjustmentConfigure', reset canuIteration.
--
-- Running jobs.  First attempt out of 2.
----------------------------------------
-- Starting 'oea' concurrent execution on Fri Jan 16 00:43:38 2026 with 4561162.578 GB free disk space (15 processes; 62 concurrently)

    cd unitigging/3-overlapErrorAdjustment
    ./oea.sh 1 > ./oea.000001.out 2>&1
    ./oea.sh 2 > ./oea.000002.out 2>&1
    ./oea.sh 3 > ./oea.000003.out 2>&1
    ./oea.sh 4 > ./oea.000004.out 2>&1
    ./oea.sh 5 > ./oea.000005.out 2>&1
    ./oea.sh 6 > ./oea.000006.out 2>&1
    ./oea.sh 7 > ./oea.000007.out 2>&1
    ./oea.sh 8 > ./oea.000008.out 2>&1
    ./oea.sh 9 > ./oea.000009.out 2>&1
    ./oea.sh 10 > ./oea.000010.out 2>&1
    ./oea.sh 11 > ./oea.000011.out 2>&1
    ./oea.sh 12 > ./oea.000012.out 2>&1
    ./oea.sh 13 > ./oea.000013.out 2>&1
    ./oea.sh 14 > ./oea.000014.out 2>&1
    ./oea.sh 15 > ./oea.000015.out 2>&1

-- Finished on Fri Jan 16 01:18:45 2026 (2107 seconds) with 4558439.296 GB free disk space
----------------------------------------
-- Found 15 overlap error adjustment output files.
-- Finished stage 'overlapErrorAdjustmentCheck', reset canuIteration.
----------------------------------------
-- Starting command on Fri Jan 16 01:18:45 2026 with 4558439.281 GB free disk space

    cd unitigging/3-overlapErrorAdjustment
    /share/org/YZWL/yzwl_lixg/miniforge3/envs/canu_v.2.3/bin/loadErates \
      -S ../../A3-2.seqStore \
      -O ../A3-2.ovlStore \
      -L ./oea.files \
    > ./oea.apply.err 2>&1

-- Finished on Fri Jan 16 01:18:45 2026 (like a bat out of hell) with 4558439.171 GB free disk space
----------------------------------------
-- No report available.
-- Finished stage 'updateOverlapStore', reset canuIteration.
-- Finished stage 'unitig', reset canuIteration.
--
-- Running jobs.  First attempt out of 2.
----------------------------------------
-- Starting 'bat' concurrent execution on Fri Jan 16 01:18:45 2026 with 4558439.125 GB free disk space (1 processes; 1 concurrently)

    cd unitigging/4-unitigger
    ./unitigger.sh 1 > ./unitigger.000001.out 2>&1

-- Finished on Fri Jan 16 01:18:58 2026 (13 seconds) with 4558438.937 GB free disk space
----------------------------------------
-- Unitigger finished successfully.
--  
--  ERROR RATES
--  -----------
--                                                   --------threshold------
--  270927                       fraction error      fraction        percent
--  samples                              (1e-5)         error          error
--                   --------------------------      --------       --------
--  command line (-eg)                           ->     30.00        0.0300%
--  command line (-ef)                           ->  -----.--      ---.----%
--  command line (-eM)                           ->     30.00        0.0300%
--  mean + std.dev       0.40 +-  12 *     2.87  ->     34.81        0.0348%
--  median + mad         0.00 +-  12 *     0.00  ->      0.00        0.0000%
--  90th percentile                              ->      1.00        0.0010%  (enabled)
--  
--  BEST EDGE FILTERING
--  -------------------
--  At graph threshold 0.0300%, reads:
--    available to have edges:        40952
--    with at least one edge:         37313
--  
--  At max threshold 0.0300%, reads:  (not computed)
--    available to have edges:            0
--    with at least one edge:             0
--  
--  At tight threshold 0.0010%, reads with:
--    both edges below error threshold:     32533  (80.00% minReadsBest threshold = 29850)
--    one  edge  above error threshold:      3405
--    both edges above error threshold:      1375
--    at least one edge:                    37313
--  
--  At loose threshold 0.0300%, reads with:
--    both edges below error threshold:     37313  (80.00% minReadsBest threshold = 29850)
--    one  edge  above error threshold:         0
--    both edges above error threshold:         0
--    at least one edge:                    37313
--  
--  
--  INITIAL EDGES
--  -------- ----------------------------------------
--    194546 reads are contained
--   1252576 reads have no best edges (singleton)
--       279 reads have only one best edge (spur) 
--                139 are mutual best
--     32309 reads have two best edges 
--                891 have one mutual best edge
--              31041 have two mutual best edges
--  
--  
--  FINAL EDGES
--  -------- ----------------------------------------
--    194546 reads are contained
--   1252898 reads have no best edges (singleton)
--       158 reads have only one best edge (spur) 
--                143 are mutual best
--     32108 reads have two best edges 
--                761 have one mutual best edge
--              31040 have two mutual best edges
--  
--  
--  EDGE FILTERING
--  -------- ------------------------------------------
--         0 reads are ignored
--      9936 reads have a gap in overlap coverage
--       164 reads have lopsided best edges
-- Found, in version 1, after unitig construction:
--   contigs:      91 sequences, total length 68598995 bp (including 135 repeats of total length 3268146 bp).
--   bubbles:      206 sequences, total length 8465438 bp.
--   unassembled:  13424 sequences, total length 172286504 bp.
--
-- Contig sizes based on genome size 85mbp:
--
--            NG (bp)  LG (contigs)    sum (bp)
--         ----------  ------------  ----------
--     10     4618261             2    11429008
--     20     4278264             4    20256003
--     30     3816817             6    28012534
--     40     3395055             8    34907709
--     50     3107582            11    44711008
--     60     2104079            14    52240311
--     70     1677673            18    59789229
--     80       24351            58    68007509
--
-- Finished stage 'unitigCheck', reset canuIteration.
----------------------------------------
-- Starting command on Fri Jan 16 01:18:58 2026 with 4558438.921 GB free disk space

    cd unitigging
    /share/org/YZWL/yzwl_lixg/miniforge3/envs/canu_v.2.3/bin/utgcns \
      -S ../A3-2.seqStore \
      -T  ./A3-2.ctgStore 1 \
      -partition 0.8 1.5 0.1 \
    > ./A3-2.ctgStore/partitioning.log 2>&1

-- Finished on Fri Jan 16 01:19:07 2026 (9 seconds) with 4558437.703 GB free disk space
----------------------------------------
-- Using slow alignment for consensus (iteration '0').
-- Configured 11 consensus jobs.
-- Finished stage 'consensusConfigure', reset canuIteration.
--
-- Local: cns       10.125 GB    8 CPUs x  11 jobs   111.375 GB  88 CPUs  (consensus)
--
--
-- Running jobs.  First attempt out of 2.
----------------------------------------
-- Starting 'cns' concurrent execution on Fri Jan 16 01:19:07 2026 with 4558437.671 GB free disk space (11 processes; 11 concurrently)

    cd unitigging/5-consensus
    ./consensus.sh 1 > ./consensus.000001.out 2>&1
    ./consensus.sh 2 > ./consensus.000002.out 2>&1
    ./consensus.sh 3 > ./consensus.000003.out 2>&1
    ./consensus.sh 4 > ./consensus.000004.out 2>&1
    ./consensus.sh 5 > ./consensus.000005.out 2>&1
    ./consensus.sh 6 > ./consensus.000006.out 2>&1
    ./consensus.sh 7 > ./consensus.000007.out 2>&1
    ./consensus.sh 8 > ./consensus.000008.out 2>&1
    ./consensus.sh 9 > ./consensus.000009.out 2>&1
    ./consensus.sh 10 > ./consensus.000010.out 2>&1
    ./consensus.sh 11 > ./consensus.000011.out 2>&1

-- Finished on Fri Jan 16 01:25:39 2026 (392 seconds) with 4559204.093 GB free disk space
----------------------------------------
-- Using slow alignment for consensus (iteration '1').
-- Configured 11 consensus jobs.
-- All 11 consensus jobs finished successfully.
-- Finished stage 'consensusCheck', reset canuIteration.
-- Using slow alignment for consensus (iteration '0').
-- Configured 11 consensus jobs.
----------------------------------------
-- Starting command on Fri Jan 16 01:25:40 2026 with 4559204.046 GB free disk space

    cd unitigging
    /share/org/YZWL/yzwl_lixg/miniforge3/envs/canu_v.2.3/bin/tgStoreLoad \
      -S ../A3-2.seqStore \
      -T  ./A3-2.ctgStore 2 \
      -L ./5-consensus/ctgcns.files \
    > ./5-consensus/ctgcns.files.ctgStoreLoad.err 2>&1

-- Finished on Fri Jan 16 01:25:40 2026 (one second) with 4559203.343 GB free disk space
----------------------------------------
----------------------------------------
-- Starting command on Fri Jan 16 01:25:40 2026 with 4559203.343 GB free disk space

    cd unitigging
    /share/org/YZWL/yzwl_lixg/miniforge3/envs/canu_v.2.3/bin/tgTigDisplay \
      -S ../A3-2.seqStore \
      -b \
      -o ../A3-2.contigs.unsorted.bam \
      -L ./5-consensus/ctgcns.files \
    > ./5-consensus/ctgcns.files.contigs.bam.err 2>&1

-- Finished on Fri Jan 16 01:28:18 2026 (158 seconds) with 4559299.281 GB free disk space
----------------------------------------
----------------------------------------
-- Starting command on Fri Jan 16 01:28:18 2026 with 4559299.281 GB free disk space

    cd .
    samtools sort \
      --write-index \
      --threads 2 \
      -o ./A3-2.contigs.bam ./A3-2.contigs.unsorted.bam \
    > ./ctgcns.bam.err 2>&1

-- Finished on Fri Jan 16 01:29:29 2026 (71 seconds) with 4559495.671 GB free disk space
----------------------------------------
-- Purging consensus output after loading to ctgStore.
-- Purged 11 .cns outputs.
----------------------------------------
-- Starting command on Fri Jan 16 01:29:29 2026 with 4559497.625 GB free disk space

    cd unitigging
    /share/org/YZWL/yzwl_lixg/miniforge3/envs/canu_v.2.3/bin/tgStoreDump \
      -S ../A3-2.seqStore \
      -T ./A3-2.ctgStore 2 \
      -sizes -s 85000000 \
    > ./A3-2.ctgStore/seqDB.v002.sizes.txt
ZERO length suplied to intervalList::add(), ignoring interval.
ZERO length suplied to intervalList::add(), ignoring interval.
ZERO length suplied to intervalList::add(), ignoring interval.
ZERO length suplied to intervalList::add(), ignoring interval.
ZERO length suplied to intervalList::add(), ignoring interval.
ZERO length suplied to intervalList::add(), ignoring interval.

-- Finished on Fri Jan 16 01:29:29 2026 (furiously fast) with 4559497.625 GB free disk space
----------------------------------------
-- Found, in version 2, after consensus generation:
--   contigs:      91 sequences, total length 89528267 bp (including 135 repeats of total length 4535081 bp).
--   bubbles:      206 sequences, total length 11230655 bp.
--   unassembled:  13424 sequences, total length 233344340 bp.
--
-- Contig sizes based on genome size 85mbp:
--
--            NG (bp)  LG (contigs)    sum (bp)
--         ----------  ------------  ----------
--     10     8860463             1     8860463
--     20     5925786             3    20780515
--     30     5555134             4    26335649
--     40     4964952             6    36447507
--     50     4418763             8    45399890
--     60     4312599            10    54127631
--     70     3541901            12    61726013
--     80     2733055            15    70727696
--     90     2186998            18    77840307
--    100      738920            24    85458282
--
-- Finished stage 'consensusLoad', reset canuIteration.
----------------------------------------
-- Starting command on Fri Jan 16 01:29:29 2026 with 4559497.609 GB free disk space

    cd .
    /share/org/YZWL/yzwl_lixg/miniforge3/envs/canu_v.2.3/bin/tgStoreDump \
      -S ./A3-2.seqStore \
      -T ./unitigging/A3-2.ctgStore 2 \
      -o ./A3-2.contigs \
      -layout \
    > ./A3-2.contigs.layout.err 2>&1

-- Finished on Fri Jan 16 01:29:30 2026 (one second) with 4559497.578 GB free disk space
----------------------------------------
----------------------------------------
-- Starting command on Fri Jan 16 01:29:30 2026 with 4559497.578 GB free disk space

    cd .
    /share/org/YZWL/yzwl_lixg/miniforge3/envs/canu_v.2.3/bin/tgStoreDump \
      -S ./A3-2.seqStore \
      -T ./unitigging/A3-2.ctgStore 2 \
      -consensus -fasta \
      -unassembled \
    > ./A3-2.unassembled.fasta
    2> ./A3-2.unassembled.err
ZERO length suplied to intervalList::add(), ignoring interval.
ZERO length suplied to intervalList::add(), ignoring interval.
ZERO length suplied to intervalList::add(), ignoring interval.
ZERO length suplied to intervalList::add(), ignoring interval.
ZERO length suplied to intervalList::add(), ignoring interval.
ZERO length suplied to intervalList::add(), ignoring interval.

-- Finished on Fri Jan 16 01:29:31 2026 (one second) with 4559497.343 GB free disk space
----------------------------------------
----------------------------------------
-- Starting command on Fri Jan 16 01:29:31 2026 with 4559497.343 GB free disk space

    cd .
    /share/org/YZWL/yzwl_lixg/miniforge3/envs/canu_v.2.3/bin/tgStoreDump \
      -S ./A3-2.seqStore \
      -T ./unitigging/A3-2.ctgStore 2 \
      -consensus -fasta \
      -contigs \
    > ./A3-2.contigs.fasta
    2> ./A3-2.contigs.err
ZERO length suplied to intervalList::add(), ignoring interval.
ZERO length suplied to intervalList::add(), ignoring interval.
ZERO length suplied to intervalList::add(), ignoring interval.
ZERO length suplied to intervalList::add(), ignoring interval.
ZERO length suplied to intervalList::add(), ignoring interval.
ZERO length suplied to intervalList::add(), ignoring interval.

-- Finished on Fri Jan 16 01:29:32 2026 (one second) with 4559497.234 GB free disk space
----------------------------------------
-- Finished stage 'generateOutputs', reset canuIteration.
--
-- Assembly 'A3-2' finished in '/share/org/YZWL/yzwl_lixg/project/28.大豆疫霉菌三代基因组/03.hicanu/A3-2/01.raw_output'.
--
-- Summary saved in 'A3-2.report'.
--
-- Sequences saved:
--   Contigs       -> 'A3-2.contigs.fasta'
--   Unassembled   -> 'A3-2.unassembled.fasta'
--
-- Read layouts saved:
--   Contigs       -> 'A3-2.contigs.layout'.
--
-- Bye.

2026-01-16 01:29:32.070 - WARNING - 输出文件不存在|Output file does not exist: /share/org/YZWL/yzwl_lixg/project/28.大豆疫霉菌三代基因组/03.hicanu/A3-2/01.raw_output/A3-2.unitigs.fasta
Usage: biopytools ragtag [OPTIONS]
Try 'biopytools ragtag -h' for help.

Error: Invalid value for '-r' / '--reference': 文件不存在|File does not exist: /share/org/YZWL/yzwl_lixg/project/28.大豆疫霉菌三代基因组/04.ragtag/Psoja_T2T.fa
Usage: biopytools genomesyn [OPTIONS]
Try 'biopytools genomesyn -h' for help.

Error: Invalid value for '-i' / '--ref': Path '04.ragtag/A3-2/hicanu/A3-2_RagTag_scaffolded.fa' does not exist.
Job 68886729 stderr output:

