Usage: biopytools ragtag [OPTIONS]
Try 'biopytools ragtag -h' for help.

Error: Invalid value for '-r' / '--reference': 文件不存在|File does not exist: /share/org/YZWL/yzwl_lixg/project/28.大豆疫霉菌三代基因组/04.ragtag/Psoja_T2T.fa
Usage: biopytools genomesyn [OPTIONS]
Try 'biopytools genomesyn -h' for help.

Error: Invalid value for '-i' / '--ref': Path '04.ragtag/A3-27/hifiasm/A3-27_RagTag_scaffolded.fa' does not exist.
2026-01-16 01:39:26.898 - WARNING - 命令错误输出|Command stderr:
-- canu master +27 changes (r10515 2a41e933b8de6ed66723d75d36dd071b46d2c347)
--
-- CITATIONS
--
-- For assemblies of PacBio HiFi reads:
--   Nurk S, Walenz BP, Rhiea A, Vollger MR, Logsdon GA, Grothe R, Miga KH, Eichler EE, Phillippy AM, Koren S.
--   HiCanu: accurate assembly of segmental duplications, satellites, and allelic variants from high-fidelity long reads.
--   biorXiv. 2020.
--   https://doi.org/10.1101/2020.03.14.992248
-- 
-- Read and contig alignments during correction and consensus use:
--   Šošic M, Šikic M.
--   Edlib: a C/C ++ library for fast, exact sequence alignment using edit distance.
--   Bioinformatics. 2017 May 1;33(9):1394-1395.
--   http://doi.org/10.1093/bioinformatics/btw753
-- 
-- Overlaps are generated using:
--   Berlin K, et al.
--   Assembling large genomes with single-molecule sequencing and locality-sensitive hashing.
--   Nat Biotechnol. 2015 Jun;33(6):623-30.
--   http://doi.org/10.1038/nbt.3238
-- 
--   Myers EW, et al.
--   A Whole-Genome Assembly of Drosophila.
--   Science. 2000 Mar 24;287(5461):2196-204.
--   http://doi.org/10.1126/science.287.5461.2196
-- 
-- Contig consensus sequences are generated using an algorithm derived from pbdagcon:
--   Chin CS, et al.
--   Nonhybrid, finished microbial genome assemblies from long-read SMRT sequencing data.
--   Nat Methods. 2013 Jun;10(6):563-9
--   http://doi.org/10.1038/nmeth.2474
-- 
-- CONFIGURE CANU
--
-- Detected Java(TM) Runtime Environment '17.0.15-internal' (from '/share/org/YZWL/yzwl_lixg/.local/bin/java') without -d64 support.
--
-- WARNING:
-- WARNING:  Failed to run gnuplot using command 'gnuplot'.
-- WARNING:  Plots will be disabled.
-- WARNING:
--
-- Detected samtools version '1.22' / htslib version 'htscodecs=1.6.3' (from 'samtools').
--
-- Detected 88 CPUs and 503 gigabytes of memory on the local machine.
--
-- Detected Slurm with 'sinfo' binary in /opt/skyformai/bin/sinfo.
--          Slurm disabled by useGrid=false
--
-- Detected  '' with 'pbsnodes' binary in /opt/skyformai/bin/pbsnodes.
--           disabled by useGrid=false
--
-- Detected LSF with 'bsub' binary in /opt/skyformai/bin/bsub.
--          LSF disabled by useGrid=false
--
-- Local machine mode enabled; grid support not detected or not allowed.
--
-- Found trimmed raw PacBio HiFi reads in the input files.
--
--                                (tag)Concurrency
--                         (tag)Threads          |
--                (tag)Memory         |          |
--        (tag)             |         |          |       total usage      algorithm
--        -------  ----------  --------   --------  --------------------  -----------------------------
-- Local: meryl     12.000 GB    4 CPUs x  22 jobs   264.000 GB  88 CPUs  (k-mer counting)
-- Local: cormhap   13.000 GB   11 CPUs x   8 jobs   104.000 GB  88 CPUs  (overlap detection with mhap)
-- Local: obtovl     8.000 GB    8 CPUs x  11 jobs    88.000 GB  88 CPUs  (overlap detection)
-- Local: utgovl     8.000 GB    8 CPUs x  11 jobs    88.000 GB  88 CPUs  (overlap detection)
-- Local: cor        -.--- GB    4 CPUs x   - jobs     -.--- GB   - CPUs  (read correction)
-- Local: ovb        4.000 GB    1 CPU  x  88 jobs   352.000 GB  88 CPUs  (overlap store bucketizer)
-- Local: ovs        8.000 GB    1 CPU  x  62 jobs   496.000 GB  62 CPUs  (overlap store sorting)
-- Local: red       16.000 GB    4 CPUs x  22 jobs   352.000 GB  88 CPUs  (read error detection)
-- Local: oea        8.000 GB    1 CPU  x  62 jobs   496.000 GB  62 CPUs  (overlap error adjustment)
-- Local: bat       32.000 GB    8 CPUs x   1 job     32.000 GB   8 CPUs  (contig construction with bogart)
-- Local: cns        -.--- GB    8 CPUs x   - jobs     -.--- GB   - CPUs  (consensus)
--
-- Generating assembly 'A3-27' in '/share/org/YZWL/yzwl_lixg/project/28.大豆疫霉菌三代基因组/03.hicanu/A3-27/01.raw_output':
--   genomeSize:
--     85000000
--
--   Overlap Generation Limits:
--     corOvlErrorRate 0.0000 (  0.00%)
--     obtOvlErrorRate 0.0250 (  2.50%)
--     utgOvlErrorRate 0.0100 (  1.00%)
--
--   Overlap Processing Limits:
--     corErrorRate    0.0000 (  0.00%)
--     obtErrorRate    0.0250 (  2.50%)
--     utgErrorRate    0.0003 (  0.03%)
--     cnsErrorRate    0.0500 (  5.00%)
--
--   Stages to run:
--     assemble HiFi reads.
--
--
-- BEGIN STORE CREATION
----------------------------------------
-- Starting command on Thu Jan 15 23:58:02 2026 with 4566715.421 GB free disk space

    cd .
    ./A3-27.seqStore.sh \
    > ./A3-27.seqStore.err 2>&1

-- Finished on Fri Jan 16 00:04:54 2026 (412 seconds) with 4566139.296 GB free disk space
----------------------------------------
--
-- In sequence store './A3-27.seqStore':
--   Found 261278 reads.
--   Found 4250023711 bases (50 times coverage).
--    Histogram of corrected reads:
--    
--    G=4250023711                       sum of  ||               length     num
--    NG         length     index       lengths  ||                range    seqs
--    ----- ------------ --------- ------------  ||  ------------------- -------
--    00010        24846     15772    425004609  ||       1196-2426         6243|-------------
--    00020        22814     33684    850010367  ||       2427-3657        10335|---------------------
--    00030        21475     52910   1275026946  ||       3658-4888         9807|--------------------
--    00040        20416     73221   1700018168  ||       4889-6119         8788|------------------
--    00050        19522     94519   2125014573  ||       6120-7350         7916|----------------
--    00060        18668    116777   2550014819  ||       7351-8581         7379|---------------
--    00070        17750    140108   2975020567  ||       8582-9812         6702|--------------
--    00080        16497    164868   3400031820  ||       9813-11043        5868|------------
--    00090        12191    193367   3825032320  ||      11044-12274        5212|-----------
--    00100         1196    261278   4250023711  ||      12275-13505        4738|----------
--    001.000x              261278   4250023711  ||      13506-14736        5831|------------
--                                               ||      14737-15967       10451|---------------------
--                                               ||      15968-17198       19695|---------------------------------------
--                                               ||      17199-18429       29353|----------------------------------------------------------
--                                               ||      18430-19660       32031|---------------------------------------------------------------
--                                               ||      19661-20891       27412|------------------------------------------------------
--                                               ||      20892-22122       20787|-----------------------------------------
--                                               ||      22123-23353       14845|------------------------------
--                                               ||      23354-24584       10399|---------------------
--                                               ||      24585-25815        7074|--------------
--                                               ||      25816-27046        4487|---------
--                                               ||      27047-28277        2718|------
--                                               ||      28278-29508        1601|----
--                                               ||      29509-30739         888|--
--                                               ||      30740-31970         424|-
--                                               ||      31971-33201         184|-
--                                               ||      33202-34432          72|-
--                                               ||      34433-35663          20|-
--                                               ||      35664-36894           5|-
--                                               ||      36895-38125           1|-
--                                               ||      38126-39356           1|-
--                                               ||      39357-40587           1|-
--                                               ||      40588-41818           3|-
--                                               ||      41819-43049           3|-
--                                               ||      43050-44280           1|-
--                                               ||      44281-45511           0|
--                                               ||      45512-46742           1|-
--                                               ||      46743-47973           0|
--                                               ||      47974-49204           1|-
--                                               ||      49205-50435           1|-
--    
--
-- In sequence store './A3-27.seqStore':
--   Found 261278 reads.
--   Found 4250023711 bases (50 times coverage).
--    Histogram of corrected-trimmed reads:
--    
--    G=4250023711                       sum of  ||               length     num
--    NG         length     index       lengths  ||                range    seqs
--    ----- ------------ --------- ------------  ||  ------------------- -------
--    00010        24846     15772    425004609  ||       1196-2426         6243|-------------
--    00020        22814     33684    850010367  ||       2427-3657        10335|---------------------
--    00030        21475     52910   1275026946  ||       3658-4888         9807|--------------------
--    00040        20416     73221   1700018168  ||       4889-6119         8788|------------------
--    00050        19522     94519   2125014573  ||       6120-7350         7916|----------------
--    00060        18668    116777   2550014819  ||       7351-8581         7379|---------------
--    00070        17750    140108   2975020567  ||       8582-9812         6702|--------------
--    00080        16497    164868   3400031820  ||       9813-11043        5868|------------
--    00090        12191    193367   3825032320  ||      11044-12274        5212|-----------
--    00100         1196    261278   4250023711  ||      12275-13505        4738|----------
--    001.000x              261278   4250023711  ||      13506-14736        5831|------------
--                                               ||      14737-15967       10451|---------------------
--                                               ||      15968-17198       19695|---------------------------------------
--                                               ||      17199-18429       29353|----------------------------------------------------------
--                                               ||      18430-19660       32031|---------------------------------------------------------------
--                                               ||      19661-20891       27412|------------------------------------------------------
--                                               ||      20892-22122       20787|-----------------------------------------
--                                               ||      22123-23353       14845|------------------------------
--                                               ||      23354-24584       10399|---------------------
--                                               ||      24585-25815        7074|--------------
--                                               ||      25816-27046        4487|---------
--                                               ||      27047-28277        2718|------
--                                               ||      28278-29508        1601|----
--                                               ||      29509-30739         888|--
--                                               ||      30740-31970         424|-
--                                               ||      31971-33201         184|-
--                                               ||      33202-34432          72|-
--                                               ||      34433-35663          20|-
--                                               ||      35664-36894           5|-
--                                               ||      36895-38125           1|-
--                                               ||      38126-39356           1|-
--                                               ||      39357-40587           1|-
--                                               ||      40588-41818           3|-
--                                               ||      41819-43049           3|-
--                                               ||      43050-44280           1|-
--                                               ||      44281-45511           0|
--                                               ||      45512-46742           1|-
--                                               ||      46743-47973           0|
--                                               ||      47974-49204           1|-
--                                               ||      49205-50435           1|-
--    
--
-- Correction skipped; not enabled.
--
-- Trimming skipped; not enabled.
--
-- BEGIN ASSEMBLY
----------------------------------------
-- Starting command on Fri Jan 16 00:04:56 2026 with 4566139.25 GB free disk space

    cd unitigging/0-mercounts
    ./meryl-configure.sh \
    > ./meryl-configure.err 2>&1

-- Finished on Fri Jan 16 00:04:57 2026 (one second) with 4566139.25 GB free disk space
----------------------------------------
--  segments   memory batches
--  -------- -------- -------
--        01 10.72 GB       2
--        02  5.68 GB       2
--        04  2.94 GB       2
--        06  2.13 GB       2
--        08  1.60 GB       2
--        12  1.07 GB       2
--        16  0.80 GB       2
--        20  0.64 GB       2
--        24  0.54 GB       2
--        32  0.40 GB       2
--        40  0.32 GB       2
--        48  -.-- GB       -  (segment size too small)
--        56  -.-- GB       -  (segment size too small)
--        64  -.-- GB       -  (segment size too small)
--        96  -.-- GB       -  (segment size too small)
--
--  For 261278 reads with 4250023711 bases, limit to 42 batches.
--  Will count kmers using 01 jobs, each using 12 GB and 4 threads.
--
-- Finished stage 'merylConfigure', reset canuIteration.
--
-- Running jobs.  First attempt out of 2.
----------------------------------------
-- Starting 'meryl' concurrent execution on Fri Jan 16 00:04:57 2026 with 4566139.218 GB free disk space (1 processes; 22 concurrently)

    cd unitigging/0-mercounts
    ./meryl-count.sh 1 > ./meryl-count.000001.out 2>&1

-- Finished on Fri Jan 16 00:08:29 2026 (212 seconds) with 4565779.703 GB free disk space
----------------------------------------
-- Found 1 Kmer counting (meryl) outputs.
-- Finished stage 'utg-merylCountCheck', reset canuIteration.
--
-- Running jobs.  First attempt out of 2.
----------------------------------------
-- Starting 'meryl' concurrent execution on Fri Jan 16 00:08:29 2026 with 4565779.671 GB free disk space (1 processes; 22 concurrently)

    cd unitigging/0-mercounts
    ./meryl-process.sh 1 > ./meryl-process.000001.out 2>&1

-- Finished on Fri Jan 16 00:08:33 2026 (4 seconds) with 4565780.312 GB free disk space
----------------------------------------
-- Meryl finished successfully.  Kmer frequency histogram:
--
-- WARNING: gnuplot failed.
--
----------------------------------------
--
--  22-mers                                                                                           Fraction
--    Occurrences   NumMers                                                                         Unique Total
--       1-     1         0                                                                        0.0000 0.0000
--       2-     2   6436940 **************************                                             0.1177 0.0040
--       3-     4   3057200 ************                                                           0.1600 0.0062
--       5-     7    368146 *                                                                      0.1783 0.0076
--       8-    11     66637                                                                        0.1807 0.0078
--      12-    16     48137                                                                        0.1817 0.0080
--      17-    22    158296                                                                        0.1827 0.0083
--      23-    29   1110349 ****                                                                   0.1865 0.0097
--      30-    37   6750548 ****************************                                           0.2126 0.0222
--      38-    46  16710743 ********************************************************************** 0.3572 0.1100
--      47-    56  12433641 ****************************************************                   0.6675 0.3398
--      57-    67   2730581 ***********                                                            0.8717 0.5205
--      68-    79    739136 ***                                                                    0.9130 0.5639
--      80-    92   1006266 ****                                                                   0.9266 0.5814
--      93-   106    732877 ***                                                                    0.9450 0.6089
--     107-   121    324353 *                                                                      0.9577 0.6305
--     122-   137    288880 *                                                                      0.9634 0.6417
--     138-   154    237293                                                                        0.9687 0.6536
--     155-   172    172286                                                                        0.9729 0.6641
--     173-   191    165269                                                                        0.9760 0.6730
--     192-   211    114646                                                                        0.9790 0.6823
--     212-   232    113209                                                                        0.9811 0.6896
--     233-   254     85234                                                                        0.9831 0.6974
--     255-   277     84053                                                                        0.9846 0.7039
--     278-   301     74726                                                                        0.9862 0.7108
--     302-   326     66873                                                                        0.9875 0.7177
--     327-   352     57417                                                                        0.9888 0.7242
--     353-   379     49615                                                                        0.9898 0.7303
--     380-   407     44614                                                                        0.9907 0.7360
--     408-   436     38311                                                                        0.9915 0.7415
--     437-   466     31038                                                                        0.9922 0.7465
--     467-   497     29535                                                                        0.9928 0.7509
--     498-   529     23201                                                                        0.9933 0.7554
--     530-   562     20319                                                                        0.9937 0.7591
--     563-   596     17597                                                                        0.9941 0.7625
--     597-   631     15868                                                                        0.9944 0.7658
--     632-   667     14396                                                                        0.9947 0.7688
--     668-   704     15395                                                                        0.9950 0.7717
--     705-   742     14506                                                                        0.9952 0.7751
--     743-   781     12452                                                                        0.9955 0.7783
--     782-   821     11588                                                                        0.9957 0.7813
--
--           0 (max occurrences)
--  3182670182 (total mers, non-unique)
--    54694142 (distinct mers, non-unique)
--           0 (unique mers)
-- Finished stage 'meryl-process', reset canuIteration.
--
-- Removing meryl database 'unitigging/0-mercounts/A3-27.ms22'.
--
-- OVERLAPPER (normal) (assembly) erate=0.01
--
----------------------------------------
-- Starting command on Fri Jan 16 00:08:33 2026 with 4565780.296 GB free disk space

    cd unitigging/1-overlapper
    /share/org/YZWL/yzwl_lixg/miniforge3/envs/canu_v.2.3/bin/overlapInCorePartition \
     -S  ../../A3-27.seqStore \
     -hl 160000000 \
     -rl 5000000000 \
     -ol 500 \
     -o  ./A3-27.partition \
    > ./A3-27.partition.err 2>&1

-- Finished on Fri Jan 16 00:08:33 2026 (in the blink of an eye) with 4565780.281 GB free disk space
----------------------------------------
--
-- Configured 21 overlapInCore jobs.
-- Finished stage 'utg-overlapConfigure', reset canuIteration.
--
-- Running jobs.  First attempt out of 2.
----------------------------------------
-- Starting 'utgovl' concurrent execution on Fri Jan 16 00:08:33 2026 with 4565780.25 GB free disk space (21 processes; 11 concurrently)

    cd unitigging/1-overlapper
    ./overlap.sh 1 > ./overlap.000001.out 2>&1
    ./overlap.sh 2 > ./overlap.000002.out 2>&1
    ./overlap.sh 3 > ./overlap.000003.out 2>&1
    ./overlap.sh 4 > ./overlap.000004.out 2>&1
    ./overlap.sh 5 > ./overlap.000005.out 2>&1
    ./overlap.sh 6 > ./overlap.000006.out 2>&1
    ./overlap.sh 7 > ./overlap.000007.out 2>&1
    ./overlap.sh 8 > ./overlap.000008.out 2>&1
    ./overlap.sh 9 > ./overlap.000009.out 2>&1
    ./overlap.sh 10 > ./overlap.000010.out 2>&1
    ./overlap.sh 11 > ./overlap.000011.out 2>&1
    ./overlap.sh 12 > ./overlap.000012.out 2>&1
    ./overlap.sh 13 > ./overlap.000013.out 2>&1
    ./overlap.sh 14 > ./overlap.000014.out 2>&1
    ./overlap.sh 15 > ./overlap.000015.out 2>&1
    ./overlap.sh 16 > ./overlap.000016.out 2>&1
    ./overlap.sh 17 > ./overlap.000017.out 2>&1
    ./overlap.sh 18 > ./overlap.000018.out 2>&1
    ./overlap.sh 19 > ./overlap.000019.out 2>&1
    ./overlap.sh 20 > ./overlap.000020.out 2>&1
    ./overlap.sh 21 > ./overlap.000021.out 2>&1

-- Finished on Fri Jan 16 00:49:47 2026 (2474 seconds) with 4560166.234 GB free disk space
----------------------------------------
-- Found 21 overlapInCore output files.
--
-- overlapInCore compute 'unitigging/1-overlapper':
--   kmer hits
--     with no overlap       1303839841  11.4761905 +- 39867881.246
--     with an overlap         20967419  .523809524 +- 669139.948
--
--   overlaps                  20967419  .523809524 +- 669139.948
--     contained                4969204  .761904762 +- 156551.06
--     dovetail                15998215  .761904762 +- 513776.167
--
--   overlaps rejected
--     multiple per pair              0           0 +- 0
--     bad short window               0           0 +- 0
--     bad long window                0           0 +- 0
-- Finished stage 'utg-overlapCheck', reset canuIteration.
----------------------------------------
-- Starting command on Fri Jan 16 00:49:47 2026 with 4560166.218 GB free disk space

    cd unitigging
    /share/org/YZWL/yzwl_lixg/miniforge3/envs/canu_v.2.3/bin/ovStoreConfig \
     -S ../A3-27.seqStore \
     -M 4-8 \
     -L ./1-overlapper/ovljob.files \
     -create ./A3-27.ovlStore.config \
     > ./A3-27.ovlStore.config.txt \
    2> ./A3-27.ovlStore.config.err

-- Finished on Fri Jan 16 00:49:47 2026 (lickety-split) with 4560166.203 GB free disk space
----------------------------------------
--
-- Creating overlap store unitigging/A3-27.ovlStore using:
--      1 bucket
--      1 slice
--        using at most 2 GB memory each
--
-- Running jobs.  First attempt out of 2.
----------------------------------------
-- Starting 'ovS' concurrent execution on Fri Jan 16 00:49:47 2026 with 4560166.187 GB free disk space (1 processes; 62 concurrently)

    cd unitigging
    ./A3-27.ovlStore.sh 1 > ./A3-27.ovlStore.000001.out 2>&1

-- Finished on Fri Jan 16 00:49:57 2026 (10 seconds) with 4560165.218 GB free disk space
----------------------------------------
-- Checking store.
----------------------------------------
-- Starting command on Fri Jan 16 00:49:57 2026 with 4560165.218 GB free disk space

    cd unitigging
    /share/org/YZWL/yzwl_lixg/miniforge3/envs/canu_v.2.3/bin/ovStoreDump \
     -S ../A3-27.seqStore \
     -O  ./A3-27.ovlStore \
     -counts \
     > ./A3-27.ovlStore/counts.dat 2> ./A3-27.ovlStore/counts.err

-- Finished on Fri Jan 16 00:49:57 2026 (furiously fast) with 4560056.359 GB free disk space
----------------------------------------
--
-- Overlap store 'unitigging/A3-27.ovlStore' successfully constructed.
-- Found 41934838 overlaps for 248331 reads; 1390656 reads have no overlaps.
--
--
-- Purged 0.492 GB in 63 overlap output files.
----------------------------------------
-- Starting command on Fri Jan 16 00:49:58 2026 with 4560056.359 GB free disk space

    cd unitigging
    /share/org/YZWL/yzwl_lixg/miniforge3/envs/canu_v.2.3/bin/ovStoreStats \
     -C 50 \
     -S ../A3-27.seqStore \
     -O  ./A3-27.ovlStore \
     -o  ./A3-27.ovlStore \
     > ./A3-27.ovlStore.summary.err 2>&1

-- Finished on Fri Jan 16 00:50:04 2026 (6 seconds) with 4560056.343 GB free disk space
----------------------------------------
--
-- Overlap store 'unitigging/A3-27.ovlStore' contains:
--
--   category            reads     %          read length        feature size or coverage  analysis
--   ----------------  -------  -------  ----------------------  ------------------------  --------------------
--   middle-missing        558    0.21    14943.43 +- 4372.86       3086.36 +- 3200.71    (bad trimming)
--   middle-hump           139    0.05    14288.27 +- 3591.36       6361.94 +- 3949.15    (bad trimming)
--   no-5-prime           1501    0.57    12863.48 +- 4079.77       3476.62 +- 3752.48    (bad trimming)
--   no-3-prime           1728    0.66    12348.63 +- 4644.79       3306.06 +- 3732.22    (bad trimming)
--   
--   low-coverage         4126    1.58    10212.15 +- 4483.24          4.77 +- 3.56       (easy to assemble, potential for lower quality consensus)
--   unique             203083   77.73    12469.51 +- 5233.86         44.59 +- 8.48       (easy to assemble, perfect, yay)
--   repeat-cont         11358    4.35    10225.27 +- 5325.11       1000.69 +- 894.09     (potential for consensus errors, no impact on assembly)
--   repeat-dove           214    0.08    19382.76 +- 1988.77        418.69 +- 465.36     (hard to assemble, likely won't assemble correctly or even at all)
--   
--   span-repeat          2869    1.10    13471.21 +- 4387.98       3146.67 +- 3461.03    (read spans a large repeat, usually easy to assemble)
--   uniq-repeat-cont    13974    5.35    12259.96 +- 4278.26                             (should be uniquely placed, low potential for consensus errors, no impact on assembly)
--   uniq-repeat-dove     3256    1.25    17669.18 +- 2668.55                             (will end contigs, potential to misassemble)
--   uniq-anchor          5525    2.11    13616.61 +- 4136.70       7912.87 +- 4669.33    (repeat read, with unique section, probable bad read)
-- Finished stage 'utg-createOverlapStore', reset canuIteration.
--
-- Loading read lengths.
-- Loading number of overlaps per read.
--
-- Configure RED for 16gb memory.
--                   Batches of at most (unlimited) reads.
--                                      500000000 bases.
--                   Expecting evidence of at most 536870912 bases per iteration.
--
--           Total                                               Reads                 Olaps Evidence
--    Job   Memory      Read Range         Reads        Bases   Memory        Olaps   Memory   Memory  (Memory in MB)
--   ---- -------- ------------------- --------- ------------ -------- ------------ -------- --------
--      1 16386.10         1-36272          5757    109010220 13307.09       612560     7.01  1024.00
--      2 16386.18     36273-76034          6307    108958707 13300.82      1167653    13.36  1024.00
--      3 16386.73     76035-119318         6980    108965308 13301.65      1143178    13.08  1024.00
--      4 16384.13    119319-157087         5994    108993497 13305.06       617661     7.07  1024.00
--      5 16385.90    157088-198973         6654    108942327 13298.83      1316805    15.07  1024.00
--      6 16386.20    198974-247897         7749    108944720 13299.16      1313793    15.04  1024.00
--      7 16384.52    247898-285833         6002    108996212 13305.39       623129     7.13  1024.00
--      8 16384.75    285834-326987         6675    108933558 13297.76      1309196    14.98  1024.00
--      9 16384.35    326988-376331         7908    108926045 13296.89      1351421    15.47  1024.00
--     10 16384.59    376332-413666         5934    108993731 13305.09       655613     7.50  1024.00
--     11 16385.33    413667-455200         6542    108939578 13298.49      1296080    14.83  1024.00
--     12 16385.72    455201-505011         8077    108935547 13298.05      1369474    15.67  1024.00
--     13 16384.06    505012-541841         5902    108989573 13304.58       653584     7.48  1024.00
--     14 16385.39    541842-582194         6447    108939549 13298.49      1302553    14.91  1024.00
--     15 16385.72    582195-633317         8139    108938409 13298.40      1338801    15.32  1024.00
--     16 16384.62    633318-670671         5971    108996634 13305.44       626896     7.17  1024.00
--     17 16386.02    670672-710610         6389    108945847 13299.25      1290120    14.76  1024.00
--     18 16385.55    710611-762707         8213    108944300 13299.12      1260755    14.43  1024.00
--     19 16386.09    762708-799048         5861    109007711 13306.79       637965     7.30  1024.00
--     20 16386.59    799049-838504         6313    108944882 13299.13      1350141    15.45  1024.00
--     21 16384.75    838505-889647         8079    108930400 13297.42      1339533    15.33  1024.00
--     22 16385.01    889648-925705         5855    108998893 13305.71       637513     7.30  1024.00
--     23 16384.05    925706-965202         6233    108928344 13297.11      1305622    14.94  1024.00
--     24 16385.52    965203-1014638        7813    108939230 13298.49      1313032    15.03  1024.00
--     25 16386.34   1014639-1051867        5851    109011213 13307.22       622141     7.12  1024.00
--     26 16385.51   1051868-1090987        6238    108942047 13298.79      1286984    14.73  1024.00
--     27 16384.16   1090988-1140841        7959    108925518 13296.82      1340234    15.34  1024.00
--     28 16384.40   1140842-1178079        5816    108994004 13305.12       636624     7.29  1024.00
--     29 16384.29   1178080-1215896        6169    108926493 13296.89      1346013    15.40  1024.00
--     30 16386.25   1215897-1265580        7951    108953134 13300.19      1228357    14.06  1024.00
--     31 16385.98   1265581-1301611        5780    109008742 13306.91       617849     7.07  1024.00
--     32 16386.27   1301612-1341021        6152    108944813 13299.12      1323896    15.15  1024.00
--     33 16386.31   1341022-1390342        7831    108945730 13299.29      1312699    15.02  1024.00
--     34 16386.22   1390343-1426476        5760    109009211 13306.97       633294     7.25  1024.00
--     35 16384.11   1426477-1464452        6184    108931186 13297.46      1280353    14.65  1024.00
--     36 16384.12   1464453-1514892        8050    108923693 13296.60      1355560    15.51  1024.00
--     37 16385.64   1514893-1550454        5771    109003687 13306.30       641904     7.35  1024.00
--     38 16384.89   1550455-1588864        6064    108948623 13299.58      1163173    13.31  1024.00
--     39 16386.66   1588865-1638691        7862    108949061 13299.69      1308116    14.97  1024.00
--     40  3140.82   1638692-1638987          46       563334    68.77         4563     0.05  1024.00
--   ---- -------- ------------------- --------- ------------ -------- ------------ -------- --------
--                                                 4250023711              41934838
-- Finished stage 'readErrorDetectionConfigure', reset canuIteration.
--
-- Running jobs.  First attempt out of 2.
----------------------------------------
-- Starting 'red' concurrent execution on Fri Jan 16 00:50:10 2026 with 4560056.296 GB free disk space (40 processes; 22 concurrently)

    cd unitigging/3-overlapErrorAdjustment
    ./red.sh 1 > ./red.000001.out 2>&1
    ./red.sh 2 > ./red.000002.out 2>&1
    ./red.sh 3 > ./red.000003.out 2>&1
    ./red.sh 4 > ./red.000004.out 2>&1
    ./red.sh 5 > ./red.000005.out 2>&1
    ./red.sh 6 > ./red.000006.out 2>&1
    ./red.sh 7 > ./red.000007.out 2>&1
    ./red.sh 8 > ./red.000008.out 2>&1
    ./red.sh 9 > ./red.000009.out 2>&1
    ./red.sh 10 > ./red.000010.out 2>&1
    ./red.sh 11 > ./red.000011.out 2>&1
    ./red.sh 12 > ./red.000012.out 2>&1
    ./red.sh 13 > ./red.000013.out 2>&1
    ./red.sh 14 > ./red.000014.out 2>&1
    ./red.sh 15 > ./red.000015.out 2>&1
    ./red.sh 16 > ./red.000016.out 2>&1
    ./red.sh 17 > ./red.000017.out 2>&1
    ./red.sh 18 > ./red.000018.out 2>&1
    ./red.sh 19 > ./red.000019.out 2>&1
    ./red.sh 20 > ./red.000020.out 2>&1
    ./red.sh 21 > ./red.000021.out 2>&1
    ./red.sh 22 > ./red.000022.out 2>&1
    ./red.sh 23 > ./red.000023.out 2>&1
    ./red.sh 24 > ./red.000024.out 2>&1
    ./red.sh 25 > ./red.000025.out 2>&1
    ./red.sh 26 > ./red.000026.out 2>&1
    ./red.sh 27 > ./red.000027.out 2>&1
    ./red.sh 28 > ./red.000028.out 2>&1
    ./red.sh 29 > ./red.000029.out 2>&1
    ./red.sh 30 > ./red.000030.out 2>&1
    ./red.sh 31 > ./red.000031.out 2>&1
    ./red.sh 32 > ./red.000032.out 2>&1
    ./red.sh 33 > ./red.000033.out 2>&1
    ./red.sh 34 > ./red.000034.out 2>&1
    ./red.sh 35 > ./red.000035.out 2>&1
    ./red.sh 36 > ./red.000036.out 2>&1
    ./red.sh 37 > ./red.000037.out 2>&1
    ./red.sh 38 > ./red.000038.out 2>&1
    ./red.sh 39 > ./red.000039.out 2>&1
    ./red.sh 40 > ./red.000040.out 2>&1

-- Finished on Fri Jan 16 01:00:34 2026 (624 seconds) with 4558243.281 GB free disk space
----------------------------------------
-- Found 40 read error detection output files.
-- Finished stage 'readErrorDetectionCheck', reset canuIteration.
--
-- Loading read lengths.
-- Loading number of overlaps per read.
--
-- Configure OEA for 8gb memory.
--                   Batches of at most (unlimited) reads.
--                                      300000000 bases.
--
--           Total                                               Reads                 Olaps  Adjusts
--    Job   Memory      Read Range         Reads        Bases   Memory        Olaps   Memory   Memory  (Memory in MB)
--   ---- -------- ------------------- --------- ------------ -------- ------------ -------- --------
--      1  2793.20         1-110597        17593    300016833   294.66      2741443    83.66   366.89
--      2  2804.40    110598-229562        18990    300010061   294.69      3107279    94.83   366.89
--      3  2796.12    229563-340109        17738    300002703   294.65      2837312    86.59   366.89
--      4  2792.88    340110-455857        18280    300011736   294.67      2730415    83.33   366.89
--      5  2806.00    455858-572039        18743    300018902   294.69      3159501    96.42   366.89
--      6  2801.33    572040-690918        18914    300015412   294.69      3006398    91.75   366.89
--      7  2785.61    690919-809833        18922    300014372   294.69      2491242    76.03   366.89
--      8  2805.95    809834-926591        18732    300012524   294.69      3158189    96.38   366.89
--      9  2804.48    926592-1043792       18434    300011368   294.68      3110191    94.92   366.89
--     10  2803.83   1043793-1160899       18584    300006546   294.68      3088998    94.27   366.89
--     11  2802.95   1160900-1275632       18500    300007831   294.67      3060368    93.40   366.89
--     12  2803.55   1275633-1391736       18341    300012440   294.67      3079990    93.99   366.89
--     13  2801.77   1391737-1503366       17847    300012513   294.66      3022182    92.23   366.89
--     14  2784.37   1503367-1612338       17487    300023510   294.66      2452071    74.83   366.89
--     15  2497.69   1612339-1638987        4173     49846960    55.67       889259    27.14   366.89
--   ---- -------- ------------------- --------- ------------ -------- ------------ -------- --------
--                                                 4250023711              41934838
-- Finished stage 'overlapErrorAdjustmentConfigure', reset canuIteration.
--
-- Running jobs.  First attempt out of 2.
----------------------------------------
-- Starting 'oea' concurrent execution on Fri Jan 16 01:00:41 2026 with 4558177.843 GB free disk space (15 processes; 62 concurrently)

    cd unitigging/3-overlapErrorAdjustment
    ./oea.sh 1 > ./oea.000001.out 2>&1
    ./oea.sh 2 > ./oea.000002.out 2>&1
    ./oea.sh 3 > ./oea.000003.out 2>&1
    ./oea.sh 4 > ./oea.000004.out 2>&1
    ./oea.sh 5 > ./oea.000005.out 2>&1
    ./oea.sh 6 > ./oea.000006.out 2>&1
    ./oea.sh 7 > ./oea.000007.out 2>&1
    ./oea.sh 8 > ./oea.000008.out 2>&1
    ./oea.sh 9 > ./oea.000009.out 2>&1
    ./oea.sh 10 > ./oea.000010.out 2>&1
    ./oea.sh 11 > ./oea.000011.out 2>&1
    ./oea.sh 12 > ./oea.000012.out 2>&1
    ./oea.sh 13 > ./oea.000013.out 2>&1
    ./oea.sh 14 > ./oea.000014.out 2>&1
    ./oea.sh 15 > ./oea.000015.out 2>&1

-- Finished on Fri Jan 16 01:26:34 2026 (1553 seconds) with 4559183.89 GB free disk space
----------------------------------------
-- Found 15 overlap error adjustment output files.
-- Finished stage 'overlapErrorAdjustmentCheck', reset canuIteration.
----------------------------------------
-- Starting command on Fri Jan 16 01:26:34 2026 with 4559183.875 GB free disk space

    cd unitigging/3-overlapErrorAdjustment
    /share/org/YZWL/yzwl_lixg/miniforge3/envs/canu_v.2.3/bin/loadErates \
      -S ../../A3-27.seqStore \
      -O ../A3-27.ovlStore \
      -L ./oea.files \
    > ./oea.apply.err 2>&1

-- Finished on Fri Jan 16 01:26:34 2026 (furiously fast) with 4559183.796 GB free disk space
----------------------------------------
-- No report available.
-- Finished stage 'updateOverlapStore', reset canuIteration.
-- Finished stage 'unitig', reset canuIteration.
--
-- Running jobs.  First attempt out of 2.
----------------------------------------
-- Starting 'bat' concurrent execution on Fri Jan 16 01:26:34 2026 with 4559183.75 GB free disk space (1 processes; 1 concurrently)

    cd unitigging/4-unitigger
    ./unitigger.sh 1 > ./unitigger.000001.out 2>&1

-- Finished on Fri Jan 16 01:26:46 2026 (12 seconds) with 4559183.562 GB free disk space
----------------------------------------
-- Unitigger finished successfully.
--  
--  ERROR RATES
--  -----------
--                                                   --------threshold------
--  282388                       fraction error      fraction        percent
--  samples                              (1e-5)         error          error
--                   --------------------------      --------       --------
--  command line (-eg)                           ->     30.00        0.0300%
--  command line (-ef)                           ->  -----.--      ---.----%
--  command line (-eM)                           ->     30.00        0.0300%
--  mean + std.dev       0.40 +-  12 *     2.87  ->     34.80        0.0348%
--  median + mad         0.00 +-  12 *     0.00  ->      0.00        0.0000%
--  90th percentile                              ->      1.00        0.0010%  (enabled)
--  
--  BEST EDGE FILTERING
--  -------------------
--  At graph threshold 0.0300%, reads:
--    available to have edges:        56890
--    with at least one edge:         41691
--  
--  At max threshold 0.0300%, reads:
--    available to have edges:        56890
--    with at least one edge:         41691
--  
--  At tight threshold 0.0010%, reads with:
--    both edges below error threshold:     36914  (80.00% minReadsBest threshold = 33352)
--    one  edge  above error threshold:      3593
--    both edges above error threshold:      1184
--    at least one edge:                    41691
--  
--  At loose threshold 0.0300%, reads with:
--    both edges below error threshold:     41691  (80.00% minReadsBest threshold = 33352)
--    one  edge  above error threshold:         0
--    both edges above error threshold:         0
--    at least one edge:                    41691
--  
--  
--  INITIAL EDGES
--  -------- ----------------------------------------
--    199257 reads are contained
--   1405182 reads have no best edges (singleton)
--       780 reads have only one best edge (spur) 
--                557 are mutual best
--     33768 reads have two best edges 
--                839 have one mutual best edge
--              32485 have two mutual best edges
--  
--  
--  FINAL EDGES
--  -------- ----------------------------------------
--    199257 reads are contained
--   1405504 reads have no best edges (singleton)
--       695 reads have only one best edge (spur) 
--                576 are mutual best
--     33531 reads have two best edges 
--                696 have one mutual best edge
--              32497 have two mutual best edges
--  
--  
--  EDGE FILTERING
--  -------- ------------------------------------------
--         0 reads are ignored
--     11603 reads have a gap in overlap coverage
--       155 reads have lopsided best edges
-- Found, in version 1, after unitig construction:
--   contigs:      162 sequences, total length 70166703 bp (including 159 repeats of total length 3461535 bp).
--   bubbles:      139 sequences, total length 3174520 bp.
--   unassembled:  28485 sequences, total length 314970009 bp.
--
-- Contig sizes based on genome size 85mbp:
--
--            NG (bp)  LG (contigs)    sum (bp)
--         ----------  ------------  ----------
--     10     9441430             1     9441430
--     20     8489186             2    17930616
--     30     6515764             4    30965133
--     40     6196624             5    37161757
--     50     3252184             7    44514176
--     60     2351798            10    52233041
--     70     1724279            14    60164216
--     80       29144            53    68022485
--
-- Finished stage 'unitigCheck', reset canuIteration.
----------------------------------------
-- Starting command on Fri Jan 16 01:26:46 2026 with 4559183.546 GB free disk space

    cd unitigging
    /share/org/YZWL/yzwl_lixg/miniforge3/envs/canu_v.2.3/bin/utgcns \
      -S ../A3-27.seqStore \
      -T  ./A3-27.ctgStore 1 \
      -partition 0.8 1.5 0.1 \
    > ./A3-27.ctgStore/partitioning.log 2>&1

-- Finished on Fri Jan 16 01:26:55 2026 (9 seconds) with 4559265.484 GB free disk space
----------------------------------------
-- Using slow alignment for consensus (iteration '0').
-- Configured 10 consensus jobs.
-- Finished stage 'consensusConfigure', reset canuIteration.
--
-- Local: cns       14.000 GB    8 CPUs x  11 jobs   154.000 GB  88 CPUs  (consensus)
--
--
-- Running jobs.  First attempt out of 2.
----------------------------------------
-- Starting 'cns' concurrent execution on Fri Jan 16 01:26:55 2026 with 4559265.453 GB free disk space (10 processes; 11 concurrently)

    cd unitigging/5-consensus
    ./consensus.sh 1 > ./consensus.000001.out 2>&1
    ./consensus.sh 2 > ./consensus.000002.out 2>&1
    ./consensus.sh 3 > ./consensus.000003.out 2>&1
    ./consensus.sh 4 > ./consensus.000004.out 2>&1
    ./consensus.sh 5 > ./consensus.000005.out 2>&1
    ./consensus.sh 6 > ./consensus.000006.out 2>&1
    ./consensus.sh 7 > ./consensus.000007.out 2>&1
    ./consensus.sh 8 > ./consensus.000008.out 2>&1
    ./consensus.sh 9 > ./consensus.000009.out 2>&1
    ./consensus.sh 10 > ./consensus.000010.out 2>&1

-- Finished on Fri Jan 16 01:35:31 2026 (516 seconds) with 4560243.703 GB free disk space
----------------------------------------
-- Using slow alignment for consensus (iteration '1').
-- Configured 10 consensus jobs.
-- All 10 consensus jobs finished successfully.
-- Finished stage 'consensusCheck', reset canuIteration.
-- Using slow alignment for consensus (iteration '0').
-- Configured 10 consensus jobs.
----------------------------------------
-- Starting command on Fri Jan 16 01:35:31 2026 with 4560243.656 GB free disk space

    cd unitigging
    /share/org/YZWL/yzwl_lixg/miniforge3/envs/canu_v.2.3/bin/tgStoreLoad \
      -S ../A3-27.seqStore \
      -T  ./A3-27.ctgStore 2 \
      -L ./5-consensus/ctgcns.files \
    > ./5-consensus/ctgcns.files.ctgStoreLoad.err 2>&1

-- Finished on Fri Jan 16 01:35:32 2026 (one second) with 4560242.531 GB free disk space
----------------------------------------
----------------------------------------
-- Starting command on Fri Jan 16 01:35:32 2026 with 4560242.531 GB free disk space

    cd unitigging
    /share/org/YZWL/yzwl_lixg/miniforge3/envs/canu_v.2.3/bin/tgTigDisplay \
      -S ../A3-27.seqStore \
      -b \
      -o ../A3-27.contigs.unsorted.bam \
      -L ./5-consensus/ctgcns.files \
    > ./5-consensus/ctgcns.files.contigs.bam.err 2>&1

-- Finished on Fri Jan 16 01:38:14 2026 (162 seconds) with 4560294.062 GB free disk space
----------------------------------------
----------------------------------------
-- Starting command on Fri Jan 16 01:38:14 2026 with 4560294.062 GB free disk space

    cd .
    samtools sort \
      --write-index \
      --threads 2 \
      -o ./A3-27.contigs.bam ./A3-27.contigs.unsorted.bam \
    > ./ctgcns.bam.err 2>&1

-- Finished on Fri Jan 16 01:39:22 2026 (68 seconds) with 4560180.875 GB free disk space
----------------------------------------
-- Purging consensus output after loading to ctgStore.
-- Purged 10 .cns outputs.
----------------------------------------
-- Starting command on Fri Jan 16 01:39:22 2026 with 4560183.906 GB free disk space

    cd unitigging
    /share/org/YZWL/yzwl_lixg/miniforge3/envs/canu_v.2.3/bin/tgStoreDump \
      -S ../A3-27.seqStore \
      -T ./A3-27.ctgStore 2 \
      -sizes -s 85000000 \
    > ./A3-27.ctgStore/seqDB.v002.sizes.txt
ZERO length suplied to intervalList::add(), ignoring interval.
ZERO length suplied to intervalList::add(), ignoring interval.
ZERO length suplied to intervalList::add(), ignoring interval.
ZERO length suplied to intervalList::add(), ignoring interval.
ZERO length suplied to intervalList::add(), ignoring interval.
ZERO length suplied to intervalList::add(), ignoring interval.
ZERO length suplied to intervalList::add(), ignoring interval.
ZERO length suplied to intervalList::add(), ignoring interval.
ZERO length suplied to intervalList::add(), ignoring interval.
ZERO length suplied to intervalList::add(), ignoring interval.
ZERO length suplied to intervalList::add(), ignoring interval.
ZERO length suplied to intervalList::add(), ignoring interval.
ZERO length suplied to intervalList::add(), ignoring interval.
ZERO length suplied to intervalList::add(), ignoring interval.
ZERO length suplied to intervalList::add(), ignoring interval.
ZERO length suplied to intervalList::add(), ignoring interval.
ZERO length suplied to intervalList::add(), ignoring interval.
ZERO length suplied to intervalList::add(), ignoring interval.
ZERO length suplied to intervalList::add(), ignoring interval.
ZERO length suplied to intervalList::add(), ignoring interval.
ZERO length suplied to intervalList::add(), ignoring interval.
ZERO length suplied to intervalList::add(), ignoring interval.
ZERO length suplied to intervalList::add(), ignoring interval.
ZERO length suplied to intervalList::add(), ignoring interval.
ZERO length suplied to intervalList::add(), ignoring interval.
ZERO length suplied to intervalList::add(), ignoring interval.
ZERO length suplied to intervalList::add(), ignoring interval.
ZERO length suplied to intervalList::add(), ignoring interval.
ZERO length suplied to intervalList::add(), ignoring interval.
ZERO length suplied to intervalList::add(), ignoring interval.
ZERO length suplied to intervalList::add(), ignoring interval.
ZERO length suplied to intervalList::add(), ignoring interval.
ZERO length suplied to intervalList::add(), ignoring interval.

-- Finished on Fri Jan 16 01:39:23 2026 (one second) with 4560183.906 GB free disk space
----------------------------------------
-- Found, in version 2, after consensus generation:
--   contigs:      162 sequences, total length 91894737 bp (including 159 repeats of total length 4781569 bp).
--   bubbles:      139 sequences, total length 4335772 bp.
--   unassembled:  28485 sequences, total length 466383152 bp.
--
-- Contig sizes based on genome size 85mbp:
--
--            NG (bp)  LG (contigs)    sum (bp)
--         ----------  ------------  ----------
--     10    12280649             1    12280649
--     20    11032925             2    23313574
--     30     8463007             3    31776581
--     40     8456436             4    40233017
--     50     8075913             5    48308930
--     60     5355832             6    53664762
--     70     3632147             8    61535086
--     80     2711999            11    70678931
--     90     2260873            14    78319732
--    100      774206            19    85542398
--
-- Finished stage 'consensusLoad', reset canuIteration.
----------------------------------------
-- Starting command on Fri Jan 16 01:39:23 2026 with 4560183.89 GB free disk space

    cd .
    /share/org/YZWL/yzwl_lixg/miniforge3/envs/canu_v.2.3/bin/tgStoreDump \
      -S ./A3-27.seqStore \
      -T ./unitigging/A3-27.ctgStore 2 \
      -o ./A3-27.contigs \
      -layout \
    > ./A3-27.contigs.layout.err 2>&1

-- Finished on Fri Jan 16 01:39:23 2026 (like a bat out of hell) with 4560183.843 GB free disk space
----------------------------------------
----------------------------------------
-- Starting command on Fri Jan 16 01:39:23 2026 with 4560183.843 GB free disk space

    cd .
    /share/org/YZWL/yzwl_lixg/miniforge3/envs/canu_v.2.3/bin/tgStoreDump \
      -S ./A3-27.seqStore \
      -T ./unitigging/A3-27.ctgStore 2 \
      -consensus -fasta \
      -unassembled \
    > ./A3-27.unassembled.fasta
    2> ./A3-27.unassembled.err
ZERO length suplied to intervalList::add(), ignoring interval.
ZERO length suplied to intervalList::add(), ignoring interval.
ZERO length suplied to intervalList::add(), ignoring interval.
ZERO length suplied to intervalList::add(), ignoring interval.
ZERO length suplied to intervalList::add(), ignoring interval.
ZERO length suplied to intervalList::add(), ignoring interval.
ZERO length suplied to intervalList::add(), ignoring interval.
ZERO length suplied to intervalList::add(), ignoring interval.
ZERO length suplied to intervalList::add(), ignoring interval.
ZERO length suplied to intervalList::add(), ignoring interval.
ZERO length suplied to intervalList::add(), ignoring interval.
ZERO length suplied to intervalList::add(), ignoring interval.
ZERO length suplied to intervalList::add(), ignoring interval.
ZERO length suplied to intervalList::add(), ignoring interval.
ZERO length suplied to intervalList::add(), ignoring interval.
ZERO length suplied to intervalList::add(), ignoring interval.
ZERO length suplied to intervalList::add(), ignoring interval.
ZERO length suplied to intervalList::add(), ignoring interval.
ZERO length suplied to intervalList::add(), ignoring interval.
ZERO length suplied to intervalList::add(), ignoring interval.
ZERO length suplied to intervalList::add(), ignoring interval.
ZERO length suplied to intervalList::add(), ignoring interval.
ZERO length suplied to intervalList::add(), ignoring interval.
ZERO length suplied to intervalList::add(), ignoring interval.
ZERO length suplied to intervalList::add(), ignoring interval.
ZERO length suplied to intervalList::add(), ignoring interval.
ZERO length suplied to intervalList::add(), ignoring interval.
ZERO length suplied to intervalList::add(), ignoring interval.
ZERO length suplied to intervalList::add(), ignoring interval.
ZERO length suplied to intervalList::add(), ignoring interval.
ZERO length suplied to intervalList::add(), ignoring interval.
ZERO length suplied to intervalList::add(), ignoring interval.
ZERO length suplied to intervalList::add(), ignoring interval.

-- Finished on Fri Jan 16 01:39:26 2026 (3 seconds) with 4560183.39 GB free disk space
----------------------------------------
----------------------------------------
-- Starting command on Fri Jan 16 01:39:26 2026 with 4560183.39 GB free disk space

    cd .
    /share/org/YZWL/yzwl_lixg/miniforge3/envs/canu_v.2.3/bin/tgStoreDump \
      -S ./A3-27.seqStore \
      -T ./unitigging/A3-27.ctgStore 2 \
      -consensus -fasta \
      -contigs \
    > ./A3-27.contigs.fasta
    2> ./A3-27.contigs.err
ZERO length suplied to intervalList::add(), ignoring interval.
ZERO length suplied to intervalList::add(), ignoring interval.
ZERO length suplied to intervalList::add(), ignoring interval.
ZERO length suplied to intervalList::add(), ignoring interval.
ZERO length suplied to intervalList::add(), ignoring interval.
ZERO length suplied to intervalList::add(), ignoring interval.
ZERO length suplied to intervalList::add(), ignoring interval.
ZERO length suplied to intervalList::add(), ignoring interval.
ZERO length suplied to intervalList::add(), ignoring interval.
ZERO length suplied to intervalList::add(), ignoring interval.
ZERO length suplied to intervalList::add(), ignoring interval.
ZERO length suplied to intervalList::add(), ignoring interval.
ZERO length suplied to intervalList::add(), ignoring interval.
ZERO length suplied to intervalList::add(), ignoring interval.
ZERO length suplied to intervalList::add(), ignoring interval.
ZERO length suplied to intervalList::add(), ignoring interval.
ZERO length suplied to intervalList::add(), ignoring interval.
ZERO length suplied to intervalList::add(), ignoring interval.
ZERO length suplied to intervalList::add(), ignoring interval.
ZERO length suplied to intervalList::add(), ignoring interval.
ZERO length suplied to intervalList::add(), ignoring interval.
ZERO length suplied to intervalList::add(), ignoring interval.
ZERO length suplied to intervalList::add(), ignoring interval.
ZERO length suplied to intervalList::add(), ignoring interval.
ZERO length suplied to intervalList::add(), ignoring interval.
ZERO length suplied to intervalList::add(), ignoring interval.
ZERO length suplied to intervalList::add(), ignoring interval.
ZERO length suplied to intervalList::add(), ignoring interval.
ZERO length suplied to intervalList::add(), ignoring interval.
ZERO length suplied to intervalList::add(), ignoring interval.
ZERO length suplied to intervalList::add(), ignoring interval.
ZERO length suplied to intervalList::add(), ignoring interval.
ZERO length suplied to intervalList::add(), ignoring interval.

-- Finished on Fri Jan 16 01:39:26 2026 (in the blink of an eye) with 4560183.281 GB free disk space
----------------------------------------
-- Finished stage 'generateOutputs', reset canuIteration.
--
-- Assembly 'A3-27' finished in '/share/org/YZWL/yzwl_lixg/project/28.大豆疫霉菌三代基因组/03.hicanu/A3-27/01.raw_output'.
--
-- Summary saved in 'A3-27.report'.
--
-- Sequences saved:
--   Contigs       -> 'A3-27.contigs.fasta'
--   Unassembled   -> 'A3-27.unassembled.fasta'
--
-- Read layouts saved:
--   Contigs       -> 'A3-27.contigs.layout'.
--
-- Bye.

2026-01-16 01:39:26.916 - WARNING - 输出文件不存在|Output file does not exist: /share/org/YZWL/yzwl_lixg/project/28.大豆疫霉菌三代基因组/03.hicanu/A3-27/01.raw_output/A3-27.unitigs.fasta
Usage: biopytools ragtag [OPTIONS]
Try 'biopytools ragtag -h' for help.

Error: Invalid value for '-r' / '--reference': 文件不存在|File does not exist: /share/org/YZWL/yzwl_lixg/project/28.大豆疫霉菌三代基因组/04.ragtag/Psoja_T2T.fa
Usage: biopytools genomesyn [OPTIONS]
Try 'biopytools genomesyn -h' for help.

Error: Invalid value for '-i' / '--ref': Path '04.ragtag/A3-27/hicanu/A3-27_RagTag_scaffolded.fa' does not exist.
Job 68886763 stderr output:

