2026-01-16 14:47:09.755 - WARNING - 命令错误输出|Command stderr:
-- canu master +27 changes (r10515 2a41e933b8de6ed66723d75d36dd071b46d2c347)
--
-- CITATIONS
--
-- For assemblies of PacBio HiFi reads:
--   Nurk S, Walenz BP, Rhiea A, Vollger MR, Logsdon GA, Grothe R, Miga KH, Eichler EE, Phillippy AM, Koren S.
--   HiCanu: accurate assembly of segmental duplications, satellites, and allelic variants from high-fidelity long reads.
--   biorXiv. 2020.
--   https://doi.org/10.1101/2020.03.14.992248
-- 
-- Read and contig alignments during correction and consensus use:
--   Šošic M, Šikic M.
--   Edlib: a C/C ++ library for fast, exact sequence alignment using edit distance.
--   Bioinformatics. 2017 May 1;33(9):1394-1395.
--   http://doi.org/10.1093/bioinformatics/btw753
-- 
-- Overlaps are generated using:
--   Berlin K, et al.
--   Assembling large genomes with single-molecule sequencing and locality-sensitive hashing.
--   Nat Biotechnol. 2015 Jun;33(6):623-30.
--   http://doi.org/10.1038/nbt.3238
-- 
--   Myers EW, et al.
--   A Whole-Genome Assembly of Drosophila.
--   Science. 2000 Mar 24;287(5461):2196-204.
--   http://doi.org/10.1126/science.287.5461.2196
-- 
-- Contig consensus sequences are generated using an algorithm derived from pbdagcon:
--   Chin CS, et al.
--   Nonhybrid, finished microbial genome assemblies from long-read SMRT sequencing data.
--   Nat Methods. 2013 Jun;10(6):563-9
--   http://doi.org/10.1038/nmeth.2474
-- 
-- CONFIGURE CANU
--
-- Detected Java(TM) Runtime Environment '25.0.1-internal' (from '/share/org/YZWL/yzwl_lixg/miniforge3/envs/telocomp/lib/jvm/bin/java') without -d64 support.
--
-- WARNING:
-- WARNING:  Failed to run gnuplot using command 'gnuplot'.
-- WARNING:  Plots will be disabled.
-- WARNING:
--
-- Detected samtools version '1.22' / htslib version 'htscodecs=1.6.3' (from 'samtools').
--
-- Detected 88 CPUs and 503 gigabytes of memory on the local machine.
--
-- Detected Slurm with 'sinfo' binary in /opt/skyformai/bin/sinfo.
--          Slurm disabled by useGrid=false
--
-- Detected  '' with 'pbsnodes' binary in /opt/skyformai/bin/pbsnodes.
--           disabled by useGrid=false
--
-- Detected LSF with 'bsub' binary in /opt/skyformai/bin/bsub.
--          LSF disabled by useGrid=false
--
-- Local machine mode enabled; grid support not detected or not allowed.
--
-- Found trimmed raw PacBio HiFi reads in the input files.
--
--                                (tag)Concurrency
--                         (tag)Threads          |
--                (tag)Memory         |          |
--        (tag)             |         |          |       total usage      algorithm
--        -------  ----------  --------   --------  --------------------  -----------------------------
-- Local: meryl     12.000 GB    4 CPUs x  22 jobs   264.000 GB  88 CPUs  (k-mer counting)
-- Local: cormhap   13.000 GB   11 CPUs x   8 jobs   104.000 GB  88 CPUs  (overlap detection with mhap)
-- Local: obtovl     8.000 GB    8 CPUs x  11 jobs    88.000 GB  88 CPUs  (overlap detection)
-- Local: utgovl     8.000 GB    8 CPUs x  11 jobs    88.000 GB  88 CPUs  (overlap detection)
-- Local: cor        -.--- GB    4 CPUs x   - jobs     -.--- GB   - CPUs  (read correction)
-- Local: ovb        4.000 GB    1 CPU  x  88 jobs   352.000 GB  88 CPUs  (overlap store bucketizer)
-- Local: ovs        8.000 GB    1 CPU  x  62 jobs   496.000 GB  62 CPUs  (overlap store sorting)
-- Local: red       16.000 GB    4 CPUs x  22 jobs   352.000 GB  88 CPUs  (read error detection)
-- Local: oea        8.000 GB    1 CPU  x  62 jobs   496.000 GB  62 CPUs  (overlap error adjustment)
-- Local: bat       32.000 GB    8 CPUs x   1 job     32.000 GB   8 CPUs  (contig construction with bogart)
-- Local: cns        -.--- GB    8 CPUs x   - jobs     -.--- GB   - CPUs  (consensus)
--
-- Generating assembly 'B3-12' in '/share/org/YZWL/yzwl_lixg/project/28.大豆疫霉菌三代基因组/03.hicanu/B3-12/01.raw_output':
--   genomeSize:
--     85000000
--
--   Overlap Generation Limits:
--     corOvlErrorRate 0.0000 (  0.00%)
--     obtOvlErrorRate 0.0250 (  2.50%)
--     utgOvlErrorRate 0.0100 (  1.00%)
--
--   Overlap Processing Limits:
--     corErrorRate    0.0000 (  0.00%)
--     obtErrorRate    0.0250 (  2.50%)
--     utgErrorRate    0.0003 (  0.03%)
--     cnsErrorRate    0.0500 (  5.00%)
--
--   Stages to run:
--     assemble HiFi reads.
--
--
-- BEGIN STORE CREATION
----------------------------------------
-- Starting command on Fri Jan 16 13:04:17 2026 with 4534161.281 GB free disk space

    cd .
    ./B3-12.seqStore.sh \
    > ./B3-12.seqStore.err 2>&1

-- Finished on Fri Jan 16 13:11:46 2026 (449 seconds) with 4533320.437 GB free disk space
----------------------------------------
--
-- In sequence store './B3-12.seqStore':
--   Found 240051 reads.
--   Found 4250015411 bases (50 times coverage).
--    Histogram of corrected reads:
--    
--    G=4250015411                       sum of  ||               length     num
--    NG         length     index       lengths  ||                range    seqs
--    ----- ------------ --------- ------------  ||  ------------------- -------
--    00010        25320     15384    425020829  ||       1237-2476         2331|-----
--    00020        22908     33091    850019518  ||       2477-3716         3425|-------
--    00030        21251     52384   1275022031  ||       3717-4956         3364|-------
--    00040        19971     73034   1700011696  ||       4957-6196         3008|------
--    00050        18880     94934   2125024667  ||       6197-7436         2884|------
--    00060        17923    118046   2550012635  ||       7437-8676         3204|------
--    00070        17038    142367   2975021492  ||       8677-9916         3398|-------
--    00080        16095    168010   3400012419  ||       9917-11156        3236|------
--    00090        14727    195470   3825018764  ||      11157-12396        3196|------
--    00100         1237    240051   4250015411  ||      12397-13636        5366|----------
--    001.000x              240051   4250015411  ||      13637-14876       13382|-------------------------
--                                               ||      14877-16116       25761|------------------------------------------------
--                                               ||      16117-17356       34056|---------------------------------------------------------------
--                                               ||      17357-18596       32042|------------------------------------------------------------
--                                               ||      18597-19836       25961|-------------------------------------------------
--                                               ||      19837-21076       20600|---------------------------------------
--                                               ||      21077-22316       15654|-----------------------------
--                                               ||      22317-23556       11902|-----------------------
--                                               ||      23557-24796        8836|-----------------
--                                               ||      24797-26036        6555|-------------
--                                               ||      26037-27276        4513|---------
--                                               ||      27277-28516        3224|------
--                                               ||      28517-29756        2041|----
--                                               ||      29757-30996        1120|---
--                                               ||      30997-32236         603|--
--                                               ||      32237-33476         247|-
--                                               ||      33477-34716          92|-
--                                               ||      34717-35956          25|-
--                                               ||      35957-37196           7|-
--                                               ||      37197-38436           4|-
--                                               ||      38437-39676           6|-
--                                               ||      39677-40916           1|-
--                                               ||      40917-42156           3|-
--                                               ||      42157-43396           1|-
--                                               ||      43397-44636           2|-
--                                               ||      44637-45876           0|
--                                               ||      45877-47116           0|
--                                               ||      47117-48356           0|
--                                               ||      48357-49596           0|
--                                               ||      49597-50836           1|-
--    
--
-- In sequence store './B3-12.seqStore':
--   Found 240051 reads.
--   Found 4250015411 bases (50 times coverage).
--    Histogram of corrected-trimmed reads:
--    
--    G=4250015411                       sum of  ||               length     num
--    NG         length     index       lengths  ||                range    seqs
--    ----- ------------ --------- ------------  ||  ------------------- -------
--    00010        25320     15384    425020829  ||       1237-2476         2331|-----
--    00020        22908     33091    850019518  ||       2477-3716         3425|-------
--    00030        21251     52384   1275022031  ||       3717-4956         3364|-------
--    00040        19971     73034   1700011696  ||       4957-6196         3008|------
--    00050        18880     94934   2125024667  ||       6197-7436         2884|------
--    00060        17923    118046   2550012635  ||       7437-8676         3204|------
--    00070        17038    142367   2975021492  ||       8677-9916         3398|-------
--    00080        16095    168010   3400012419  ||       9917-11156        3236|------
--    00090        14727    195470   3825018764  ||      11157-12396        3196|------
--    00100         1237    240051   4250015411  ||      12397-13636        5366|----------
--    001.000x              240051   4250015411  ||      13637-14876       13382|-------------------------
--                                               ||      14877-16116       25761|------------------------------------------------
--                                               ||      16117-17356       34056|---------------------------------------------------------------
--                                               ||      17357-18596       32042|------------------------------------------------------------
--                                               ||      18597-19836       25961|-------------------------------------------------
--                                               ||      19837-21076       20600|---------------------------------------
--                                               ||      21077-22316       15654|-----------------------------
--                                               ||      22317-23556       11902|-----------------------
--                                               ||      23557-24796        8836|-----------------
--                                               ||      24797-26036        6555|-------------
--                                               ||      26037-27276        4513|---------
--                                               ||      27277-28516        3224|------
--                                               ||      28517-29756        2041|----
--                                               ||      29757-30996        1120|---
--                                               ||      30997-32236         603|--
--                                               ||      32237-33476         247|-
--                                               ||      33477-34716          92|-
--                                               ||      34717-35956          25|-
--                                               ||      35957-37196           7|-
--                                               ||      37197-38436           4|-
--                                               ||      38437-39676           6|-
--                                               ||      39677-40916           1|-
--                                               ||      40917-42156           3|-
--                                               ||      42157-43396           1|-
--                                               ||      43397-44636           2|-
--                                               ||      44637-45876           0|
--                                               ||      45877-47116           0|
--                                               ||      47117-48356           0|
--                                               ||      48357-49596           0|
--                                               ||      49597-50836           1|-
--    
--
-- Correction skipped; not enabled.
--
-- Trimming skipped; not enabled.
--
-- BEGIN ASSEMBLY
----------------------------------------
-- Starting command on Fri Jan 16 13:11:46 2026 with 4533320.39 GB free disk space

    cd unitigging/0-mercounts
    ./meryl-configure.sh \
    > ./meryl-configure.err 2>&1

-- Finished on Fri Jan 16 13:11:47 2026 (one second) with 4533320.39 GB free disk space
----------------------------------------
--  segments   memory batches
--  -------- -------- -------
--        01 10.72 GB       2
--        02  5.69 GB       2
--        04  2.94 GB       2
--        06  2.12 GB       2
--        08  1.59 GB       2
--        12  1.06 GB       2
--        16  0.80 GB       2
--        20  0.64 GB       2
--        24  0.53 GB       2
--        32  0.40 GB       2
--        40  0.32 GB       2
--        48  -.-- GB       -  (segment size too small)
--        56  -.-- GB       -  (segment size too small)
--        64  -.-- GB       -  (segment size too small)
--        96  -.-- GB       -  (segment size too small)
--
--  For 240051 reads with 4250015411 bases, limit to 42 batches.
--  Will count kmers using 01 jobs, each using 12 GB and 4 threads.
--
-- Finished stage 'merylConfigure', reset canuIteration.
--
-- Running jobs.  First attempt out of 2.
----------------------------------------
-- Starting 'meryl' concurrent execution on Fri Jan 16 13:11:47 2026 with 4533320.359 GB free disk space (1 processes; 22 concurrently)

    cd unitigging/0-mercounts
    ./meryl-count.sh 1 > ./meryl-count.000001.out 2>&1

-- Finished on Fri Jan 16 13:15:11 2026 (204 seconds) with 4532917.39 GB free disk space
----------------------------------------
-- Found 1 Kmer counting (meryl) outputs.
-- Finished stage 'utg-merylCountCheck', reset canuIteration.
--
-- Running jobs.  First attempt out of 2.
----------------------------------------
-- Starting 'meryl' concurrent execution on Fri Jan 16 13:15:11 2026 with 4532917.359 GB free disk space (1 processes; 22 concurrently)

    cd unitigging/0-mercounts
    ./meryl-process.sh 1 > ./meryl-process.000001.out 2>&1

-- Finished on Fri Jan 16 13:15:14 2026 (3 seconds) with 4532916.921 GB free disk space
----------------------------------------
-- Meryl finished successfully.  Kmer frequency histogram:
--
-- WARNING: gnuplot failed.
--
----------------------------------------
--
--  22-mers                                                                                           Fraction
--    Occurrences   NumMers                                                                         Unique Total
--       1-     1         0                                                                        0.0000 0.0000
--       2-     2    235417                                                                        0.0052 0.0001
--       3-     4     83424                                                                        0.0065 0.0002
--       5-     7     24649                                                                        0.0074 0.0003
--       8-    11      8835                                                                        0.0077 0.0003
--      12-    16     23093                                                                        0.0079 0.0004
--      17-    22    132279                                                                        0.0086 0.0005
--      23-    29   1307459 *****                                                                  0.0126 0.0017
--      30-    37   7562217 ******************************                                         0.0500 0.0165
--      38-    46  17086754 ********************************************************************** 0.2444 0.1135
--      47-    56  11784379 ************************************************                       0.6280 0.3471
--      57-    67   2145489 ********                                                               0.8598 0.5158
--      68-    79    746280 ***                                                                    0.8983 0.5491
--      80-    92    986138 ****                                                                   0.9153 0.5672
--      93-   106    676080 **                                                                     0.9370 0.5939
--     107-   121    293129 *                                                                      0.9511 0.6138
--     122-   137    285404 *                                                                      0.9575 0.6240
--     138-   154    206683                                                                        0.9637 0.6356
--     155-   172    156330                                                                        0.9682 0.6448
--     173-   191    151609                                                                        0.9717 0.6530
--     192-   211    125400                                                                        0.9750 0.6616
--     212-   232    107160                                                                        0.9777 0.6694
--     233-   254     93116                                                                        0.9801 0.6767
--     255-   277     80862                                                                        0.9822 0.6839
--     278-   301     70440                                                                        0.9839 0.6906
--     302-   326     60656                                                                        0.9855 0.6969
--     327-   352     48589                                                                        0.9868 0.7029
--     353-   379     42350                                                                        0.9879 0.7081
--     380-   407     41596                                                                        0.9888 0.7129
--     408-   436     33318                                                                        0.9897 0.7181
--     437-   466     28570                                                                        0.9905 0.7225
--     467-   497     26460                                                                        0.9911 0.7265
--     498-   529     22739                                                                        0.9917 0.7305
--     530-   562     20202                                                                        0.9922 0.7342
--     563-   596     18450                                                                        0.9926 0.7376
--     597-   631     15741                                                                        0.9931 0.7410
--     632-   667     15901                                                                        0.9934 0.7440
--     668-   704     13568                                                                        0.9938 0.7472
--     705-   742     14785                                                                        0.9941 0.7502
--     743-   781     12622                                                                        0.9944 0.7535
--     782-   821     15071                                                                        0.9947 0.7566
--
--           0 (max occurrences)
--  3180966760 (total mers, non-unique)
--    45028987 (distinct mers, non-unique)
--           0 (unique mers)
-- Finished stage 'meryl-process', reset canuIteration.
--
-- Removing meryl database 'unitigging/0-mercounts/B3-12.ms22'.
--
-- OVERLAPPER (normal) (assembly) erate=0.01
--
----------------------------------------
-- Starting command on Fri Jan 16 13:15:14 2026 with 4532917.875 GB free disk space

    cd unitigging/1-overlapper
    /share/org/YZWL/yzwl_lixg/miniforge3/envs/canu_v.2.3/bin/overlapInCorePartition \
     -S  ../../B3-12.seqStore \
     -hl 160000000 \
     -rl 5000000000 \
     -ol 500 \
     -o  ./B3-12.partition \
    > ./B3-12.partition.err 2>&1

-- Finished on Fri Jan 16 13:15:15 2026 (one second) with 4532917.859 GB free disk space
----------------------------------------
--
-- Configured 20 overlapInCore jobs.
-- Finished stage 'utg-overlapConfigure', reset canuIteration.
--
-- Running jobs.  First attempt out of 2.
----------------------------------------
-- Starting 'utgovl' concurrent execution on Fri Jan 16 13:15:15 2026 with 4532917.828 GB free disk space (20 processes; 11 concurrently)

    cd unitigging/1-overlapper
    ./overlap.sh 1 > ./overlap.000001.out 2>&1
    ./overlap.sh 2 > ./overlap.000002.out 2>&1
    ./overlap.sh 3 > ./overlap.000003.out 2>&1
    ./overlap.sh 4 > ./overlap.000004.out 2>&1
    ./overlap.sh 5 > ./overlap.000005.out 2>&1
    ./overlap.sh 6 > ./overlap.000006.out 2>&1
    ./overlap.sh 7 > ./overlap.000007.out 2>&1
    ./overlap.sh 8 > ./overlap.000008.out 2>&1
    ./overlap.sh 9 > ./overlap.000009.out 2>&1
    ./overlap.sh 10 > ./overlap.000010.out 2>&1
    ./overlap.sh 11 > ./overlap.000011.out 2>&1
    ./overlap.sh 12 > ./overlap.000012.out 2>&1
    ./overlap.sh 13 > ./overlap.000013.out 2>&1
    ./overlap.sh 14 > ./overlap.000014.out 2>&1
    ./overlap.sh 15 > ./overlap.000015.out 2>&1
    ./overlap.sh 16 > ./overlap.000016.out 2>&1
    ./overlap.sh 17 > ./overlap.000017.out 2>&1
    ./overlap.sh 18 > ./overlap.000018.out 2>&1
    ./overlap.sh 19 > ./overlap.000019.out 2>&1
    ./overlap.sh 20 > ./overlap.000020.out 2>&1

-- Finished on Fri Jan 16 14:04:12 2026 (2937 seconds) with 4531898.703 GB free disk space
----------------------------------------
-- Found 20 overlapInCore output files.
--
-- overlapInCore compute 'unitigging/1-overlapper':
--   kmer hits
--     with no overlap       1268779175  3438958.75 +- 36733391.492
--     with an overlap         17981686    899084.3 +- 548527.854
--
--   overlaps                  17981686    899084.3 +- 548527.854
--     contained                2992265   149613.25 +- 88685.687
--     dovetail                14989421   749471.05 +- 460312.244
--
--   overlaps rejected
--     multiple per pair              0           0 +- 0
--     bad short window               0           0 +- 0
--     bad long window                0           0 +- 0
-- Finished stage 'utg-overlapCheck', reset canuIteration.
----------------------------------------
-- Starting command on Fri Jan 16 14:04:12 2026 with 4531898.687 GB free disk space

    cd unitigging
    /share/org/YZWL/yzwl_lixg/miniforge3/envs/canu_v.2.3/bin/ovStoreConfig \
     -S ../B3-12.seqStore \
     -M 4-8 \
     -L ./1-overlapper/ovljob.files \
     -create ./B3-12.ovlStore.config \
     > ./B3-12.ovlStore.config.txt \
    2> ./B3-12.ovlStore.config.err

-- Finished on Fri Jan 16 14:04:12 2026 (furiously fast) with 4531898.671 GB free disk space
----------------------------------------
--
-- Creating overlap store unitigging/B3-12.ovlStore using:
--      1 bucket
--      1 slice
--        using at most 2 GB memory each
--
-- Running jobs.  First attempt out of 2.
----------------------------------------
-- Starting 'ovS' concurrent execution on Fri Jan 16 14:04:12 2026 with 4531898.656 GB free disk space (1 processes; 62 concurrently)

    cd unitigging
    ./B3-12.ovlStore.sh 1 > ./B3-12.ovlStore.000001.out 2>&1

-- Finished on Fri Jan 16 14:04:19 2026 (7 seconds) with 4531888.156 GB free disk space
----------------------------------------
-- Checking store.
----------------------------------------
-- Starting command on Fri Jan 16 14:04:19 2026 with 4531888.156 GB free disk space

    cd unitigging
    /share/org/YZWL/yzwl_lixg/miniforge3/envs/canu_v.2.3/bin/ovStoreDump \
     -S ../B3-12.seqStore \
     -O  ./B3-12.ovlStore \
     -counts \
     > ./B3-12.ovlStore/counts.dat 2> ./B3-12.ovlStore/counts.err

-- Finished on Fri Jan 16 14:04:19 2026 (furiously fast) with 4531888.125 GB free disk space
----------------------------------------
--
-- Overlap store 'unitigging/B3-12.ovlStore' successfully constructed.
-- Found 35963372 overlaps for 223871 reads; 1430671 reads have no overlaps.
--
--
-- Purged 0.438 GB in 60 overlap output files.
----------------------------------------
-- Starting command on Fri Jan 16 14:04:20 2026 with 4531888.125 GB free disk space

    cd unitigging
    /share/org/YZWL/yzwl_lixg/miniforge3/envs/canu_v.2.3/bin/ovStoreStats \
     -C 50 \
     -S ../B3-12.seqStore \
     -O  ./B3-12.ovlStore \
     -o  ./B3-12.ovlStore \
     > ./B3-12.ovlStore.summary.err 2>&1

-- Finished on Fri Jan 16 14:04:25 2026 (5 seconds) with 4531888.109 GB free disk space
----------------------------------------
--
-- Overlap store 'unitigging/B3-12.ovlStore' contains:
--
--   category            reads     %          read length        feature size or coverage  analysis
--   ----------------  -------  -------  ----------------------  ------------------------  --------------------
--   middle-missing        164    0.07    15727.86 +- 6661.94        911.84 +- 1226.87    (bad trimming)
--   middle-hump            81    0.03    14098.07 +- 2889.65       4368.06 +- 2597.72    (bad trimming)
--   no-5-prime           1094    0.46    13118.22 +- 3608.02       2581.91 +- 2883.48    (bad trimming)
--   no-3-prime           1272    0.53    12292.77 +- 4265.98       2492.95 +- 2905.84    (bad trimming)
--   
--   low-coverage         3575    1.49    11020.59 +- 3402.65          5.69 +- 3.63       (easy to assemble, potential for lower quality consensus)
--   unique             184064   76.68    13596.96 +- 4104.31         43.70 +- 8.27       (easy to assemble, perfect, yay)
--   repeat-cont          9994    4.16    12163.03 +- 4025.01        853.62 +- 705.15     (potential for consensus errors, no impact on assembly)
--   repeat-dove           270    0.11    20188.54 +- 2281.16        670.25 +- 646.19     (hard to assemble, likely won't assemble correctly or even at all)
--   
--   span-repeat          2400    1.00    13716.33 +- 3463.12       3995.00 +- 3739.81    (read spans a large repeat, usually easy to assemble)
--   uniq-repeat-cont    13818    5.76    12984.91 +- 3230.25                             (should be uniquely placed, low potential for consensus errors, no impact on assembly)
--   uniq-repeat-dove     2873    1.20    17866.42 +- 2936.48                             (will end contigs, potential to misassemble)
--   uniq-anchor          4266    1.78    13653.94 +- 3583.13       8888.40 +- 4392.13    (repeat read, with unique section, probable bad read)
-- Finished stage 'utg-createOverlapStore', reset canuIteration.
--
-- Loading read lengths.
-- Loading number of overlaps per read.
--
-- Configure RED for 16gb memory.
--                   Batches of at most (unlimited) reads.
--                                      500000000 bases.
--                   Expecting evidence of at most 536870912 bases per iteration.
--
--           Total                                               Reads                 Olaps Evidence
--    Job   Memory      Read Range         Reads        Bases   Memory        Olaps   Memory   Memory  (Memory in MB)
--   ---- -------- ------------------- --------- ------------ -------- ------------ -------- --------
--      1 16384.20         1-39664          5669    108989171 13304.52       670835     7.68  1024.00
--      2 16384.90     39665-82861          6280    108950185 13299.78      1146239    13.12  1024.00
--      3 16385.37     82862-123246         5888    109004434 13306.39       609834     6.98  1024.00
--      4 16386.92    123247-164821         5999    108966811 13301.80      1146635    13.12  1024.00
--      5 16384.91    164822-212708         6901    108957503 13300.69      1067847    12.22  1024.00
--      6 16385.52    212709-254024         6015    109004680 13306.42       619837     7.09  1024.00
--      7 16385.31    254025-295303         5915    108957191 13300.62      1108197    12.68  1024.00
--      8 16385.38    295304-341434         6743    108962393 13301.29      1057019    12.10  1024.00
--      9 16385.12    341435-384107         6205    109001690 13306.07       616200     7.05  1024.00
--     10 16385.82    384108-424981         5890    108948912 13299.61      1241575    14.21  1024.00
--     11 16384.49    424982-468188         6458    108981358 13303.59       777155     8.89  1024.00
--     12 16384.99    468189-511672         6368    108975727 13302.90       881172    10.08  1024.00
--     13 16384.95    511673-552656         5835    108986052 13304.15       769101     8.80  1024.00
--     14 16386.54    552657-596838         6355    108978782 13303.27       984588    11.27  1024.00
--     15 16386.04    596839-641333         6467    108971877 13302.43      1013991    11.60  1024.00
--     16 16384.49    641334-681321         5825    108991642 13304.83       669441     7.66  1024.00
--     17 16385.34    681322-724900         6287    108958708 13300.82      1093697    12.52  1024.00
--     18 16385.63    724901-769809         6539    108970706 13302.29       990224    11.33  1024.00
--     19 16386.10    769810-809729         5822    109000199 13305.87       719151     8.23  1024.00
--     20 16384.88    809730-851893         6144    108956751 13300.58      1074610    12.30  1024.00
--     21 16385.89    851894-897465         6541    108973486 13302.63       983887    11.26  1024.00
--     22 16384.55    897466-937279         5776    108988212 13304.41       711707     8.14  1024.00
--     23 16384.93    937280-979000         6126    108954622 13300.32      1102117    12.61  1024.00
--     24 16386.23    979001-1024161        6539    108970769 13302.30      1042487    11.93  1024.00
--     25 16384.25   1024162-1063111        5761    108990548 13304.69       660549     7.56  1024.00
--     26 16384.47   1063112-1104533        6010    108944793 13299.11      1166951    13.35  1024.00
--     27 16384.61   1104534-1149917        6646    108964383 13301.53       968972    11.09  1024.00
--     28 16384.40   1149918-1188943        5694    108990972 13304.74       669212     7.66  1024.00
--     29 16384.59   1188944-1230438        5936    108945976 13299.26      1165561    13.34  1024.00
--     30 16385.22   1230439-1276523        6569    108968366 13302.01       979245    11.21  1024.00
--     31 16386.05   1276524-1315537        5664    109006681 13306.66       646271     7.40  1024.00
--     32 16385.15   1315538-1357664        5962    108954116 13300.25      1126875    12.90  1024.00
--     33 16384.09   1357665-1402497        6621    108956971 13300.62      1002073    11.47  1024.00
--     34 16385.36   1402498-1441663        5709    109001820 13306.07       637264     7.29  1024.00
--     35 16386.72   1441664-1482074        5947    108966657 13301.78      1131018    12.94  1024.00
--     36 16386.17   1482075-1528130        6666    108974762 13302.79       994498    11.38  1024.00
--     37 16384.72   1528131-1568084        5689    108995748 13305.32       646668     7.40  1024.00
--     38 16385.92   1568085-1608863        5875    108964545 13301.52      1083858    12.40  1024.00
--     39 16384.97   1608864-1654520        6714    108965627 13301.68       986683    11.29  1024.00
--     40  3074.64   1654521-1654542           1        21585     2.63          128     0.00  1024.00
--   ---- -------- ------------------- --------- ------------ -------- ------------ -------- --------
--                                                 4250015411              35963372
-- Finished stage 'readErrorDetectionConfigure', reset canuIteration.
--
-- Running jobs.  First attempt out of 2.
----------------------------------------
-- Starting 'red' concurrent execution on Fri Jan 16 14:04:32 2026 with 4531888.062 GB free disk space (40 processes; 22 concurrently)

    cd unitigging/3-overlapErrorAdjustment
    ./red.sh 1 > ./red.000001.out 2>&1
    ./red.sh 2 > ./red.000002.out 2>&1
    ./red.sh 3 > ./red.000003.out 2>&1
    ./red.sh 4 > ./red.000004.out 2>&1
    ./red.sh 5 > ./red.000005.out 2>&1
    ./red.sh 6 > ./red.000006.out 2>&1
    ./red.sh 7 > ./red.000007.out 2>&1
    ./red.sh 8 > ./red.000008.out 2>&1
    ./red.sh 9 > ./red.000009.out 2>&1
    ./red.sh 10 > ./red.000010.out 2>&1
    ./red.sh 11 > ./red.000011.out 2>&1
    ./red.sh 12 > ./red.000012.out 2>&1
    ./red.sh 13 > ./red.000013.out 2>&1
    ./red.sh 14 > ./red.000014.out 2>&1
    ./red.sh 15 > ./red.000015.out 2>&1
    ./red.sh 16 > ./red.000016.out 2>&1
    ./red.sh 17 > ./red.000017.out 2>&1
    ./red.sh 18 > ./red.000018.out 2>&1
    ./red.sh 19 > ./red.000019.out 2>&1
    ./red.sh 20 > ./red.000020.out 2>&1
    ./red.sh 21 > ./red.000021.out 2>&1
    ./red.sh 22 > ./red.000022.out 2>&1
    ./red.sh 23 > ./red.000023.out 2>&1
    ./red.sh 24 > ./red.000024.out 2>&1
    ./red.sh 25 > ./red.000025.out 2>&1
    ./red.sh 26 > ./red.000026.out 2>&1
    ./red.sh 27 > ./red.000027.out 2>&1
    ./red.sh 28 > ./red.000028.out 2>&1
    ./red.sh 29 > ./red.000029.out 2>&1
    ./red.sh 30 > ./red.000030.out 2>&1
    ./red.sh 31 > ./red.000031.out 2>&1
    ./red.sh 32 > ./red.000032.out 2>&1
    ./red.sh 33 > ./red.000033.out 2>&1
    ./red.sh 34 > ./red.000034.out 2>&1
    ./red.sh 35 > ./red.000035.out 2>&1
    ./red.sh 36 > ./red.000036.out 2>&1
    ./red.sh 37 > ./red.000037.out 2>&1
    ./red.sh 38 > ./red.000038.out 2>&1
    ./red.sh 39 > ./red.000039.out 2>&1
    ./red.sh 40 > ./red.000040.out 2>&1

-- Finished on Fri Jan 16 14:13:26 2026 (534 seconds) with 4531238.953 GB free disk space
----------------------------------------
-- Found 40 read error detection output files.
-- Finished stage 'readErrorDetectionCheck', reset canuIteration.
--
-- Loading read lengths.
-- Loading number of overlaps per read.
--
-- Configure OEA for 8gb memory.
--                   Batches of at most (unlimited) reads.
--                                      300000000 bases.
--
--           Total                                               Reads                 Olaps  Adjusts
--    Job   Memory      Read Range         Reads        Bases   Memory        Olaps   Memory   Memory  (Memory in MB)
--   ---- -------- ------------------- --------- ------------ -------- ------------ -------- --------
--      1  2779.74         1-113528        16403    300001119   294.60      2312636    70.58   366.56
--      2  2790.57    113529-234667        17495    300002375   294.64      2666221    81.37   366.56
--      3  2789.58    234668-354604        17437    300011994   294.65      2633548    80.37   366.56
--      4  2786.35    354605-468646        16699    300007886   294.62      2528799    77.17   366.56
--      5  2781.62    468647-585620        16871    300013896   294.63      2373272    72.43   366.56
--      6  2788.98    585621-703280        17052    300008784   294.63      2614599    79.79   366.56
--      7  2789.38    703281-820735        17114    300017253   294.64      2627391    80.18   366.56
--      8  2776.61    820736-938257        16989    300003048   294.62      2209268    67.42   366.56
--      9  2790.29    938258-1054342       16984    300003141   294.62      2657686    81.11   366.56
--     10  2788.13   1054343-1170670       16972    300010040   294.63      2586673    78.94   366.56
--     11  2791.50   1170671-1287288       16778    300013086   294.63      2697029    82.31   366.56
--     12  2788.38   1287289-1403904       16868    300006023   294.62      2595157    79.20   366.56
--     13  2788.67   1403905-1518347       16690    300005743   294.62      2604615    79.49   366.56
--     14  2778.22   1518348-1631746       16395    300004688   294.61      2262776    69.05   366.56
--     15  2488.38   1631747-1654542        3304     49906335    55.70       593702    18.12   366.56
--   ---- -------- ------------------- --------- ------------ -------- ------------ -------- --------
--                                                 4250015411              35963372
-- Finished stage 'overlapErrorAdjustmentConfigure', reset canuIteration.
--
-- Running jobs.  First attempt out of 2.
----------------------------------------
-- Starting 'oea' concurrent execution on Fri Jan 16 14:13:33 2026 with 4531231.281 GB free disk space (15 processes; 62 concurrently)

    cd unitigging/3-overlapErrorAdjustment
    ./oea.sh 1 > ./oea.000001.out 2>&1
    ./oea.sh 2 > ./oea.000002.out 2>&1
    ./oea.sh 3 > ./oea.000003.out 2>&1
    ./oea.sh 4 > ./oea.000004.out 2>&1
    ./oea.sh 5 > ./oea.000005.out 2>&1
    ./oea.sh 6 > ./oea.000006.out 2>&1
    ./oea.sh 7 > ./oea.000007.out 2>&1
    ./oea.sh 8 > ./oea.000008.out 2>&1
    ./oea.sh 9 > ./oea.000009.out 2>&1
    ./oea.sh 10 > ./oea.000010.out 2>&1
    ./oea.sh 11 > ./oea.000011.out 2>&1
    ./oea.sh 12 > ./oea.000012.out 2>&1
    ./oea.sh 13 > ./oea.000013.out 2>&1
    ./oea.sh 14 > ./oea.000014.out 2>&1
    ./oea.sh 15 > ./oea.000015.out 2>&1

-- Finished on Fri Jan 16 14:35:00 2026 (1287 seconds) with 4529110.984 GB free disk space
----------------------------------------
-- Found 15 overlap error adjustment output files.
-- Finished stage 'overlapErrorAdjustmentCheck', reset canuIteration.
----------------------------------------
-- Starting command on Fri Jan 16 14:35:00 2026 with 4529110.968 GB free disk space

    cd unitigging/3-overlapErrorAdjustment
    /share/org/YZWL/yzwl_lixg/miniforge3/envs/canu_v.2.3/bin/loadErates \
      -S ../../B3-12.seqStore \
      -O ../B3-12.ovlStore \
      -L ./oea.files \
    > ./oea.apply.err 2>&1

-- Finished on Fri Jan 16 14:35:00 2026 (furiously fast) with 4529110.89 GB free disk space
----------------------------------------
-- No report available.
-- Finished stage 'updateOverlapStore', reset canuIteration.
-- Finished stage 'unitig', reset canuIteration.
--
-- Running jobs.  First attempt out of 2.
----------------------------------------
-- Starting 'bat' concurrent execution on Fri Jan 16 14:35:00 2026 with 4529110.843 GB free disk space (1 processes; 1 concurrently)

    cd unitigging/4-unitigger
    ./unitigger.sh 1 > ./unitigger.000001.out 2>&1

-- Finished on Fri Jan 16 14:35:12 2026 (12 seconds) with 4529110.671 GB free disk space
----------------------------------------
-- Unitigger finished successfully.
--  
--  ERROR RATES
--  -----------
--                                                   --------threshold------
--  253930                       fraction error      fraction        percent
--  samples                              (1e-5)         error          error
--                   --------------------------      --------       --------
--  command line (-eg)                           ->     30.00        0.0300%
--  command line (-ef)                           ->  -----.--      ---.----%
--  command line (-eM)                           ->     30.00        0.0300%
--  mean + std.dev       0.53 +-  12 *     3.33  ->     40.54        0.0405%
--  median + mad         0.00 +-  12 *     0.00  ->      0.00        0.0000%
--  90th percentile                              ->      1.00        0.0010%  (enabled)
--  
--  BEST EDGE FILTERING
--  -------------------
--  At graph threshold 0.0300%, reads:
--    available to have edges:        55135
--    with at least one edge:         36693
--  
--  At max threshold 0.0300%, reads:
--    available to have edges:        55135
--    with at least one edge:         36693
--  
--  At tight threshold 0.0010%, reads with:
--    both edges below error threshold:     31441  (80.00% minReadsBest threshold = 29354)
--    one  edge  above error threshold:      3778
--    both edges above error threshold:      1474
--    at least one edge:                    36693
--  
--  At loose threshold 0.0300%, reads with:
--    both edges below error threshold:     36693  (80.00% minReadsBest threshold = 29354)
--    one  edge  above error threshold:         0
--    both edges above error threshold:         0
--    at least one edge:                    36693
--  
--  
--  INITIAL EDGES
--  -------- ----------------------------------------
--    179176 reads are contained
--   1444269 reads have no best edges (singleton)
--       747 reads have only one best edge (spur) 
--                499 are mutual best
--     30350 reads have two best edges 
--                883 have one mutual best edge
--              29048 have two mutual best edges
--  
--  
--  FINAL EDGES
--  -------- ----------------------------------------
--    179176 reads are contained
--   1444594 reads have no best edges (singleton)
--       648 reads have only one best edge (spur) 
--                490 are mutual best
--     30124 reads have two best edges 
--                740 have one mutual best edge
--              29042 have two mutual best edges
--  
--  
--  EDGE FILTERING
--  -------- ------------------------------------------
--         0 reads are ignored
--     10470 reads have a gap in overlap coverage
--       142 reads have lopsided best edges
-- Found, in version 1, after unitig construction:
--   contigs:      190 sequences, total length 70328102 bp (including 155 repeats of total length 3831905 bp).
--   bubbles:      143 sequences, total length 3523394 bp.
--   unassembled:  30479 sequences, total length 353680710 bp.
--
-- Contig sizes based on genome size 85mbp:
--
--            NG (bp)  LG (contigs)    sum (bp)
--         ----------  ------------  ----------
--     10     8684808             1     8684808
--     20     5882190             3    20807286
--     30     5041163             4    25848449
--     40     4532580             6    35093692
--     50     3865889             8    42948169
--     60     3157949            11    52585655
--     70     1319244            15    60004928
--     80       30444            71    68000403
--
-- Finished stage 'unitigCheck', reset canuIteration.
----------------------------------------
-- Starting command on Fri Jan 16 14:35:12 2026 with 4529110.656 GB free disk space

    cd unitigging
    /share/org/YZWL/yzwl_lixg/miniforge3/envs/canu_v.2.3/bin/utgcns \
      -S ../B3-12.seqStore \
      -T  ./B3-12.ctgStore 1 \
      -partition 0.8 1.5 0.1 \
    > ./B3-12.ctgStore/partitioning.log 2>&1

-- Finished on Fri Jan 16 14:35:21 2026 (9 seconds) with 4529109.5 GB free disk space
----------------------------------------
-- Using slow alignment for consensus (iteration '0').
-- Configured 10 consensus jobs.
-- Finished stage 'consensusConfigure', reset canuIteration.
--
-- Local: cns       12.875 GB    8 CPUs x  11 jobs   141.625 GB  88 CPUs  (consensus)
--
--
-- Running jobs.  First attempt out of 2.
----------------------------------------
-- Starting 'cns' concurrent execution on Fri Jan 16 14:35:22 2026 with 4529109.468 GB free disk space (10 processes; 11 concurrently)

    cd unitigging/5-consensus
    ./consensus.sh 1 > ./consensus.000001.out 2>&1
    ./consensus.sh 2 > ./consensus.000002.out 2>&1
    ./consensus.sh 3 > ./consensus.000003.out 2>&1
    ./consensus.sh 4 > ./consensus.000004.out 2>&1
    ./consensus.sh 5 > ./consensus.000005.out 2>&1
    ./consensus.sh 6 > ./consensus.000006.out 2>&1
    ./consensus.sh 7 > ./consensus.000007.out 2>&1
    ./consensus.sh 8 > ./consensus.000008.out 2>&1
    ./consensus.sh 9 > ./consensus.000009.out 2>&1
    ./consensus.sh 10 > ./consensus.000010.out 2>&1

-- Finished on Fri Jan 16 14:43:15 2026 (473 seconds) with 4529138.875 GB free disk space
----------------------------------------
-- Using slow alignment for consensus (iteration '1').
-- Configured 10 consensus jobs.
-- All 10 consensus jobs finished successfully.
-- Finished stage 'consensusCheck', reset canuIteration.
-- Using slow alignment for consensus (iteration '0').
-- Configured 10 consensus jobs.
----------------------------------------
-- Starting command on Fri Jan 16 14:43:15 2026 with 4529138.828 GB free disk space

    cd unitigging
    /share/org/YZWL/yzwl_lixg/miniforge3/envs/canu_v.2.3/bin/tgStoreLoad \
      -S ../B3-12.seqStore \
      -T  ./B3-12.ctgStore 2 \
      -L ./5-consensus/ctgcns.files \
    > ./5-consensus/ctgcns.files.ctgStoreLoad.err 2>&1

-- Finished on Fri Jan 16 14:43:16 2026 (one second) with 4529137.562 GB free disk space
----------------------------------------
----------------------------------------
-- Starting command on Fri Jan 16 14:43:16 2026 with 4529137.562 GB free disk space

    cd unitigging
    /share/org/YZWL/yzwl_lixg/miniforge3/envs/canu_v.2.3/bin/tgTigDisplay \
      -S ../B3-12.seqStore \
      -b \
      -o ../B3-12.contigs.unsorted.bam \
      -L ./5-consensus/ctgcns.files \
    > ./5-consensus/ctgcns.files.contigs.bam.err 2>&1

-- Finished on Fri Jan 16 14:46:13 2026 (177 seconds) with 4529044.953 GB free disk space
----------------------------------------
----------------------------------------
-- Starting command on Fri Jan 16 14:46:13 2026 with 4529044.953 GB free disk space

    cd .
    samtools sort \
      --write-index \
      --threads 2 \
      -o ./B3-12.contigs.bam ./B3-12.contigs.unsorted.bam \
    > ./ctgcns.bam.err 2>&1

-- Finished on Fri Jan 16 14:47:05 2026 (52 seconds) with 4528950.796 GB free disk space
----------------------------------------
-- Purging consensus output after loading to ctgStore.
-- Purged 10 .cns outputs.
----------------------------------------
-- Starting command on Fri Jan 16 14:47:05 2026 with 4528953.671 GB free disk space

    cd unitigging
    /share/org/YZWL/yzwl_lixg/miniforge3/envs/canu_v.2.3/bin/tgStoreDump \
      -S ../B3-12.seqStore \
      -T ./B3-12.ctgStore 2 \
      -sizes -s 85000000 \
    > ./B3-12.ctgStore/seqDB.v002.sizes.txt
ZERO length suplied to intervalList::add(), ignoring interval.
ZERO length suplied to intervalList::add(), ignoring interval.
ZERO length suplied to intervalList::add(), ignoring interval.
ZERO length suplied to intervalList::add(), ignoring interval.
ZERO length suplied to intervalList::add(), ignoring interval.
ZERO length suplied to intervalList::add(), ignoring interval.
ZERO length suplied to intervalList::add(), ignoring interval.
ZERO length suplied to intervalList::add(), ignoring interval.
ZERO length suplied to intervalList::add(), ignoring interval.
ZERO length suplied to intervalList::add(), ignoring interval.
ZERO length suplied to intervalList::add(), ignoring interval.
ZERO length suplied to intervalList::add(), ignoring interval.
ZERO length suplied to intervalList::add(), ignoring interval.
ZERO length suplied to intervalList::add(), ignoring interval.
ZERO length suplied to intervalList::add(), ignoring interval.
ZERO length suplied to intervalList::add(), ignoring interval.
ZERO length suplied to intervalList::add(), ignoring interval.
ZERO length suplied to intervalList::add(), ignoring interval.
ZERO length suplied to intervalList::add(), ignoring interval.
ZERO length suplied to intervalList::add(), ignoring interval.
ZERO length suplied to intervalList::add(), ignoring interval.
ZERO length suplied to intervalList::add(), ignoring interval.
ZERO length suplied to intervalList::add(), ignoring interval.
ZERO length suplied to intervalList::add(), ignoring interval.
ZERO length suplied to intervalList::add(), ignoring interval.
ZERO length suplied to intervalList::add(), ignoring interval.
ZERO length suplied to intervalList::add(), ignoring interval.
ZERO length suplied to intervalList::add(), ignoring interval.
ZERO length suplied to intervalList::add(), ignoring interval.
ZERO length suplied to intervalList::add(), ignoring interval.
ZERO length suplied to intervalList::add(), ignoring interval.
ZERO length suplied to intervalList::add(), ignoring interval.
ZERO length suplied to intervalList::add(), ignoring interval.
ZERO length suplied to intervalList::add(), ignoring interval.
ZERO length suplied to intervalList::add(), ignoring interval.
ZERO length suplied to intervalList::add(), ignoring interval.
ZERO length suplied to intervalList::add(), ignoring interval.
ZERO length suplied to intervalList::add(), ignoring interval.
ZERO length suplied to intervalList::add(), ignoring interval.
ZERO length suplied to intervalList::add(), ignoring interval.
ZERO length suplied to intervalList::add(), ignoring interval.
ZERO length suplied to intervalList::add(), ignoring interval.
ZERO length suplied to intervalList::add(), ignoring interval.
ZERO length suplied to intervalList::add(), ignoring interval.
ZERO length suplied to intervalList::add(), ignoring interval.
ZERO length suplied to intervalList::add(), ignoring interval.
ZERO length suplied to intervalList::add(), ignoring interval.
ZERO length suplied to intervalList::add(), ignoring interval.
ZERO length suplied to intervalList::add(), ignoring interval.

-- Finished on Fri Jan 16 14:47:05 2026 (in the blink of an eye) with 4528953.671 GB free disk space
----------------------------------------
-- Found, in version 2, after consensus generation:
--   contigs:      190 sequences, total length 92397914 bp (including 155 repeats of total length 5254885 bp).
--   bubbles:      143 sequences, total length 4828523 bp.
--   unassembled:  30479 sequences, total length 536724926 bp.
--
-- Contig sizes based on genome size 85mbp:
--
--            NG (bp)  LG (contigs)    sum (bp)
--         ----------  ------------  ----------
--     10    11286395             1    11286395
--     20     8102122             2    19388517
--     30     7640754             3    27029271
--     40     6145400             5    39724270
--     50     5904732             6    45629002
--     60     5047300             8    55890585
--     70     4313470             9    60204055
--     80     4109145            11    68452746
--     90     1719080            15    78125567
--    100      533498            23    85435943
--
-- Finished stage 'consensusLoad', reset canuIteration.
----------------------------------------
-- Starting command on Fri Jan 16 14:47:05 2026 with 4528953.656 GB free disk space

    cd .
    /share/org/YZWL/yzwl_lixg/miniforge3/envs/canu_v.2.3/bin/tgStoreDump \
      -S ./B3-12.seqStore \
      -T ./unitigging/B3-12.ctgStore 2 \
      -o ./B3-12.contigs \
      -layout \
    > ./B3-12.contigs.layout.err 2>&1

-- Finished on Fri Jan 16 14:47:06 2026 (one second) with 4528953.593 GB free disk space
----------------------------------------
----------------------------------------
-- Starting command on Fri Jan 16 14:47:06 2026 with 4528953.593 GB free disk space

    cd .
    /share/org/YZWL/yzwl_lixg/miniforge3/envs/canu_v.2.3/bin/tgStoreDump \
      -S ./B3-12.seqStore \
      -T ./unitigging/B3-12.ctgStore 2 \
      -consensus -fasta \
      -unassembled \
    > ./B3-12.unassembled.fasta
    2> ./B3-12.unassembled.err
ZERO length suplied to intervalList::add(), ignoring interval.
ZERO length suplied to intervalList::add(), ignoring interval.
ZERO length suplied to intervalList::add(), ignoring interval.
ZERO length suplied to intervalList::add(), ignoring interval.
ZERO length suplied to intervalList::add(), ignoring interval.
ZERO length suplied to intervalList::add(), ignoring interval.
ZERO length suplied to intervalList::add(), ignoring interval.
ZERO length suplied to intervalList::add(), ignoring interval.
ZERO length suplied to intervalList::add(), ignoring interval.
ZERO length suplied to intervalList::add(), ignoring interval.
ZERO length suplied to intervalList::add(), ignoring interval.
ZERO length suplied to intervalList::add(), ignoring interval.
ZERO length suplied to intervalList::add(), ignoring interval.
ZERO length suplied to intervalList::add(), ignoring interval.
ZERO length suplied to intervalList::add(), ignoring interval.
ZERO length suplied to intervalList::add(), ignoring interval.
ZERO length suplied to intervalList::add(), ignoring interval.
ZERO length suplied to intervalList::add(), ignoring interval.
ZERO length suplied to intervalList::add(), ignoring interval.
ZERO length suplied to intervalList::add(), ignoring interval.
ZERO length suplied to intervalList::add(), ignoring interval.
ZERO length suplied to intervalList::add(), ignoring interval.
ZERO length suplied to intervalList::add(), ignoring interval.
ZERO length suplied to intervalList::add(), ignoring interval.
ZERO length suplied to intervalList::add(), ignoring interval.
ZERO length suplied to intervalList::add(), ignoring interval.
ZERO length suplied to intervalList::add(), ignoring interval.
ZERO length suplied to intervalList::add(), ignoring interval.
ZERO length suplied to intervalList::add(), ignoring interval.
ZERO length suplied to intervalList::add(), ignoring interval.
ZERO length suplied to intervalList::add(), ignoring interval.
ZERO length suplied to intervalList::add(), ignoring interval.
ZERO length suplied to intervalList::add(), ignoring interval.
ZERO length suplied to intervalList::add(), ignoring interval.
ZERO length suplied to intervalList::add(), ignoring interval.
ZERO length suplied to intervalList::add(), ignoring interval.
ZERO length suplied to intervalList::add(), ignoring interval.
ZERO length suplied to intervalList::add(), ignoring interval.
ZERO length suplied to intervalList::add(), ignoring interval.
ZERO length suplied to intervalList::add(), ignoring interval.
ZERO length suplied to intervalList::add(), ignoring interval.
ZERO length suplied to intervalList::add(), ignoring interval.
ZERO length suplied to intervalList::add(), ignoring interval.
ZERO length suplied to intervalList::add(), ignoring interval.
ZERO length suplied to intervalList::add(), ignoring interval.
ZERO length suplied to intervalList::add(), ignoring interval.
ZERO length suplied to intervalList::add(), ignoring interval.
ZERO length suplied to intervalList::add(), ignoring interval.
ZERO length suplied to intervalList::add(), ignoring interval.

-- Finished on Fri Jan 16 14:47:08 2026 (2 seconds) with 4528953.062 GB free disk space
----------------------------------------
----------------------------------------
-- Starting command on Fri Jan 16 14:47:08 2026 with 4528953.062 GB free disk space

    cd .
    /share/org/YZWL/yzwl_lixg/miniforge3/envs/canu_v.2.3/bin/tgStoreDump \
      -S ./B3-12.seqStore \
      -T ./unitigging/B3-12.ctgStore 2 \
      -consensus -fasta \
      -contigs \
    > ./B3-12.contigs.fasta
    2> ./B3-12.contigs.err
ZERO length suplied to intervalList::add(), ignoring interval.
ZERO length suplied to intervalList::add(), ignoring interval.
ZERO length suplied to intervalList::add(), ignoring interval.
ZERO length suplied to intervalList::add(), ignoring interval.
ZERO length suplied to intervalList::add(), ignoring interval.
ZERO length suplied to intervalList::add(), ignoring interval.
ZERO length suplied to intervalList::add(), ignoring interval.
ZERO length suplied to intervalList::add(), ignoring interval.
ZERO length suplied to intervalList::add(), ignoring interval.
ZERO length suplied to intervalList::add(), ignoring interval.
ZERO length suplied to intervalList::add(), ignoring interval.
ZERO length suplied to intervalList::add(), ignoring interval.
ZERO length suplied to intervalList::add(), ignoring interval.
ZERO length suplied to intervalList::add(), ignoring interval.
ZERO length suplied to intervalList::add(), ignoring interval.
ZERO length suplied to intervalList::add(), ignoring interval.
ZERO length suplied to intervalList::add(), ignoring interval.
ZERO length suplied to intervalList::add(), ignoring interval.
ZERO length suplied to intervalList::add(), ignoring interval.
ZERO length suplied to intervalList::add(), ignoring interval.
ZERO length suplied to intervalList::add(), ignoring interval.
ZERO length suplied to intervalList::add(), ignoring interval.
ZERO length suplied to intervalList::add(), ignoring interval.
ZERO length suplied to intervalList::add(), ignoring interval.
ZERO length suplied to intervalList::add(), ignoring interval.
ZERO length suplied to intervalList::add(), ignoring interval.
ZERO length suplied to intervalList::add(), ignoring interval.
ZERO length suplied to intervalList::add(), ignoring interval.
ZERO length suplied to intervalList::add(), ignoring interval.
ZERO length suplied to intervalList::add(), ignoring interval.
ZERO length suplied to intervalList::add(), ignoring interval.
ZERO length suplied to intervalList::add(), ignoring interval.
ZERO length suplied to intervalList::add(), ignoring interval.
ZERO length suplied to intervalList::add(), ignoring interval.
ZERO length suplied to intervalList::add(), ignoring interval.
ZERO length suplied to intervalList::add(), ignoring interval.
ZERO length suplied to intervalList::add(), ignoring interval.
ZERO length suplied to intervalList::add(), ignoring interval.
ZERO length suplied to intervalList::add(), ignoring interval.
ZERO length suplied to intervalList::add(), ignoring interval.
ZERO length suplied to intervalList::add(), ignoring interval.
ZERO length suplied to intervalList::add(), ignoring interval.
ZERO length suplied to intervalList::add(), ignoring interval.
ZERO length suplied to intervalList::add(), ignoring interval.
ZERO length suplied to intervalList::add(), ignoring interval.
ZERO length suplied to intervalList::add(), ignoring interval.
ZERO length suplied to intervalList::add(), ignoring interval.
ZERO length suplied to intervalList::add(), ignoring interval.
ZERO length suplied to intervalList::add(), ignoring interval.

-- Finished on Fri Jan 16 14:47:09 2026 (one second) with 4528952.953 GB free disk space
----------------------------------------
-- Finished stage 'generateOutputs', reset canuIteration.
--
-- Assembly 'B3-12' finished in '/share/org/YZWL/yzwl_lixg/project/28.大豆疫霉菌三代基因组/03.hicanu/B3-12/01.raw_output'.
--
-- Summary saved in 'B3-12.report'.
--
-- Sequences saved:
--   Contigs       -> 'B3-12.contigs.fasta'
--   Unassembled   -> 'B3-12.unassembled.fasta'
--
-- Read layouts saved:
--   Contigs       -> 'B3-12.contigs.layout'.
--
-- Bye.

2026-01-16 14:47:09.757 - WARNING - 输出文件不存在|Output file does not exist: /share/org/YZWL/yzwl_lixg/project/28.大豆疫霉菌三代基因组/03.hicanu/B3-12/01.raw_output/B3-12.unitigs.fasta
Job 68889970 stderr output:

