Usage: biopytools ragtag [OPTIONS]
Try 'biopytools ragtag -h' for help.

Error: Invalid value for '-r' / '--reference': 文件不存在|File does not exist: /share/org/YZWL/yzwl_lixg/project/28.大豆疫霉菌三代基因组/04.ragtag/Psoja_T2T.fa
Usage: biopytools genomesyn [OPTIONS]
Try 'biopytools genomesyn -h' for help.

Error: Invalid value for '-i' / '--ref': Path '04.ragtag/A3-52/hifiasm/A3-52_RagTag_scaffolded.fa' does not exist.
2026-01-16 02:39:19.001 - WARNING - 命令错误输出|Command stderr:
-- canu master +27 changes (r10515 2a41e933b8de6ed66723d75d36dd071b46d2c347)
--
-- CITATIONS
--
-- For assemblies of PacBio HiFi reads:
--   Nurk S, Walenz BP, Rhiea A, Vollger MR, Logsdon GA, Grothe R, Miga KH, Eichler EE, Phillippy AM, Koren S.
--   HiCanu: accurate assembly of segmental duplications, satellites, and allelic variants from high-fidelity long reads.
--   biorXiv. 2020.
--   https://doi.org/10.1101/2020.03.14.992248
-- 
-- Read and contig alignments during correction and consensus use:
--   Šošic M, Šikic M.
--   Edlib: a C/C ++ library for fast, exact sequence alignment using edit distance.
--   Bioinformatics. 2017 May 1;33(9):1394-1395.
--   http://doi.org/10.1093/bioinformatics/btw753
-- 
-- Overlaps are generated using:
--   Berlin K, et al.
--   Assembling large genomes with single-molecule sequencing and locality-sensitive hashing.
--   Nat Biotechnol. 2015 Jun;33(6):623-30.
--   http://doi.org/10.1038/nbt.3238
-- 
--   Myers EW, et al.
--   A Whole-Genome Assembly of Drosophila.
--   Science. 2000 Mar 24;287(5461):2196-204.
--   http://doi.org/10.1126/science.287.5461.2196
-- 
-- Contig consensus sequences are generated using an algorithm derived from pbdagcon:
--   Chin CS, et al.
--   Nonhybrid, finished microbial genome assemblies from long-read SMRT sequencing data.
--   Nat Methods. 2013 Jun;10(6):563-9
--   http://doi.org/10.1038/nmeth.2474
-- 
-- CONFIGURE CANU
--
-- Detected Java(TM) Runtime Environment '17.0.15-internal' (from '/share/org/YZWL/yzwl_lixg/.local/bin/java') without -d64 support.
--
-- WARNING:
-- WARNING:  Failed to run gnuplot using command 'gnuplot'.
-- WARNING:  Plots will be disabled.
-- WARNING:
--
-- Detected samtools version '1.22' / htslib version 'htscodecs=1.6.3' (from 'samtools').
--
-- Detected 88 CPUs and 503 gigabytes of memory on the local machine.
--
-- Detected Slurm with 'sinfo' binary in /opt/skyformai/bin/sinfo.
--          Slurm disabled by useGrid=false
--
-- Detected  '' with 'pbsnodes' binary in /opt/skyformai/bin/pbsnodes.
--           disabled by useGrid=false
--
-- Detected LSF with 'bsub' binary in /opt/skyformai/bin/bsub.
--          LSF disabled by useGrid=false
--
-- Local machine mode enabled; grid support not detected or not allowed.
--
-- Found trimmed raw PacBio HiFi reads in the input files.
--
--                                (tag)Concurrency
--                         (tag)Threads          |
--                (tag)Memory         |          |
--        (tag)             |         |          |       total usage      algorithm
--        -------  ----------  --------   --------  --------------------  -----------------------------
-- Local: meryl     12.000 GB    4 CPUs x  22 jobs   264.000 GB  88 CPUs  (k-mer counting)
-- Local: cormhap   13.000 GB   11 CPUs x   8 jobs   104.000 GB  88 CPUs  (overlap detection with mhap)
-- Local: obtovl     8.000 GB    8 CPUs x  11 jobs    88.000 GB  88 CPUs  (overlap detection)
-- Local: utgovl     8.000 GB    8 CPUs x  11 jobs    88.000 GB  88 CPUs  (overlap detection)
-- Local: cor        -.--- GB    4 CPUs x   - jobs     -.--- GB   - CPUs  (read correction)
-- Local: ovb        4.000 GB    1 CPU  x  88 jobs   352.000 GB  88 CPUs  (overlap store bucketizer)
-- Local: ovs        8.000 GB    1 CPU  x  62 jobs   496.000 GB  62 CPUs  (overlap store sorting)
-- Local: red       16.000 GB    4 CPUs x  22 jobs   352.000 GB  88 CPUs  (read error detection)
-- Local: oea        8.000 GB    1 CPU  x  62 jobs   496.000 GB  62 CPUs  (overlap error adjustment)
-- Local: bat       32.000 GB    8 CPUs x   1 job     32.000 GB   8 CPUs  (contig construction with bogart)
-- Local: cns        -.--- GB    8 CPUs x   - jobs     -.--- GB   - CPUs  (consensus)
--
-- Generating assembly 'A3-52' in '/share/org/YZWL/yzwl_lixg/project/28.大豆疫霉菌三代基因组/03.hicanu/A3-52/01.raw_output':
--   genomeSize:
--     85000000
--
--   Overlap Generation Limits:
--     corOvlErrorRate 0.0000 (  0.00%)
--     obtOvlErrorRate 0.0250 (  2.50%)
--     utgOvlErrorRate 0.0100 (  1.00%)
--
--   Overlap Processing Limits:
--     corErrorRate    0.0000 (  0.00%)
--     obtErrorRate    0.0250 (  2.50%)
--     utgErrorRate    0.0003 (  0.03%)
--     cnsErrorRate    0.0500 (  5.00%)
--
--   Stages to run:
--     assemble HiFi reads.
--
--
-- BEGIN STORE CREATION
----------------------------------------
-- Starting command on Fri Jan 16 00:24:42 2026 with 4564384.781 GB free disk space

    cd .
    ./A3-52.seqStore.sh \
    > ./A3-52.seqStore.err 2>&1

-- Finished on Fri Jan 16 00:32:16 2026 (454 seconds) with 4562845.421 GB free disk space
----------------------------------------
--
-- In sequence store './A3-52.seqStore':
--   Found 264462 reads.
--   Found 4250014444 bases (50 times coverage).
--    Histogram of corrected reads:
--    
--    G=4250014444                       sum of  ||               length     num
--    NG         length     index       lengths  ||                range    seqs
--    ----- ------------ --------- ------------  ||  ------------------- -------
--    00010        24921     15491    425003500  ||       1211-2243         3640|---------
--    00020        22438     33539    850007571  ||       2244-3276         6685|----------------
--    00030        20738     53281   1275009964  ||       3277-4309         7405|-----------------
--    00040        19464     74454   1700009576  ||       4310-5342         7073|-----------------
--    00050        18389     96930   2125011987  ||       5343-6375         6445|---------------
--    00060        17439    120667   2550018329  ||       6376-7408         5835|--------------
--    00070        16515    145702   2975011300  ||       7409-8441         5564|-------------
--    00080        15427    172272   3400021357  ||       8442-9474         5018|------------
--    00090        13023    201605   3825017023  ||       9475-10507        4804|-----------
--    00100         1211    264462   4250014444  ||      10508-11540        4112|----------
--    001.000x              264462   4250014444  ||      11541-12573        4071|----------
--                                               ||      12574-13606        6014|--------------
--                                               ||      13607-14639       11435|---------------------------
--                                               ||      14640-15672       19350|---------------------------------------------
--                                               ||      15673-16705       26504|-------------------------------------------------------------
--                                               ||      16706-17738       27596|---------------------------------------------------------------
--                                               ||      17739-18771       24499|--------------------------------------------------------
--                                               ||      18772-19804       20128|----------------------------------------------
--                                               ||      19805-20837       16410|--------------------------------------
--                                               ||      20838-21870       12665|-----------------------------
--                                               ||      21871-22903       10011|-----------------------
--                                               ||      22904-23936        7895|-------------------
--                                               ||      23937-24969        6084|--------------
--                                               ||      24970-26002        4589|-----------
--                                               ||      26003-27035        3360|--------
--                                               ||      27036-28068        2475|------
--                                               ||      28069-29101        1772|-----
--                                               ||      29102-30134        1149|---
--                                               ||      30135-31167         789|--
--                                               ||      31168-32200         503|--
--                                               ||      32201-33233         279|-
--                                               ||      33234-34266         154|-
--                                               ||      34267-35299          83|-
--                                               ||      35300-36332          39|-
--                                               ||      36333-37365          12|-
--                                               ||      37366-38398           9|-
--                                               ||      38399-39431           2|-
--                                               ||      39432-40464           2|-
--                                               ||      40465-41497           0|
--                                               ||      41498-42530           2|-
--    
--
-- In sequence store './A3-52.seqStore':
--   Found 264462 reads.
--   Found 4250014444 bases (50 times coverage).
--    Histogram of corrected-trimmed reads:
--    
--    G=4250014444                       sum of  ||               length     num
--    NG         length     index       lengths  ||                range    seqs
--    ----- ------------ --------- ------------  ||  ------------------- -------
--    00010        24921     15491    425003500  ||       1211-2243         3640|---------
--    00020        22438     33539    850007571  ||       2244-3276         6685|----------------
--    00030        20738     53281   1275009964  ||       3277-4309         7405|-----------------
--    00040        19464     74454   1700009576  ||       4310-5342         7073|-----------------
--    00050        18389     96930   2125011987  ||       5343-6375         6445|---------------
--    00060        17439    120667   2550018329  ||       6376-7408         5835|--------------
--    00070        16515    145702   2975011300  ||       7409-8441         5564|-------------
--    00080        15427    172272   3400021357  ||       8442-9474         5018|------------
--    00090        13023    201605   3825017023  ||       9475-10507        4804|-----------
--    00100         1211    264462   4250014444  ||      10508-11540        4112|----------
--    001.000x              264462   4250014444  ||      11541-12573        4071|----------
--                                               ||      12574-13606        6014|--------------
--                                               ||      13607-14639       11435|---------------------------
--                                               ||      14640-15672       19350|---------------------------------------------
--                                               ||      15673-16705       26504|-------------------------------------------------------------
--                                               ||      16706-17738       27596|---------------------------------------------------------------
--                                               ||      17739-18771       24499|--------------------------------------------------------
--                                               ||      18772-19804       20128|----------------------------------------------
--                                               ||      19805-20837       16410|--------------------------------------
--                                               ||      20838-21870       12665|-----------------------------
--                                               ||      21871-22903       10011|-----------------------
--                                               ||      22904-23936        7895|-------------------
--                                               ||      23937-24969        6084|--------------
--                                               ||      24970-26002        4589|-----------
--                                               ||      26003-27035        3360|--------
--                                               ||      27036-28068        2475|------
--                                               ||      28069-29101        1772|-----
--                                               ||      29102-30134        1149|---
--                                               ||      30135-31167         789|--
--                                               ||      31168-32200         503|--
--                                               ||      32201-33233         279|-
--                                               ||      33234-34266         154|-
--                                               ||      34267-35299          83|-
--                                               ||      35300-36332          39|-
--                                               ||      36333-37365          12|-
--                                               ||      37366-38398           9|-
--                                               ||      38399-39431           2|-
--                                               ||      39432-40464           2|-
--                                               ||      40465-41497           0|
--                                               ||      41498-42530           2|-
--    
--
-- Correction skipped; not enabled.
--
-- Trimming skipped; not enabled.
--
-- BEGIN ASSEMBLY
----------------------------------------
-- Starting command on Fri Jan 16 00:32:17 2026 with 4562845.5 GB free disk space

    cd unitigging/0-mercounts
    ./meryl-configure.sh \
    > ./meryl-configure.err 2>&1

-- Finished on Fri Jan 16 00:32:18 2026 (one second) with 4562843.375 GB free disk space
----------------------------------------
--  segments   memory batches
--  -------- -------- -------
--        01 10.72 GB       2
--        02  5.61 GB       2
--        04  2.94 GB       2
--        06  2.13 GB       2
--        08  1.60 GB       2
--        12  1.07 GB       2
--        16  0.80 GB       2
--        20  0.64 GB       2
--        24  0.54 GB       2
--        32  0.40 GB       2
--        40  0.32 GB       2
--        48  -.-- GB       -  (segment size too small)
--        56  -.-- GB       -  (segment size too small)
--        64  -.-- GB       -  (segment size too small)
--        96  -.-- GB       -  (segment size too small)
--
--  For 264462 reads with 4250014444 bases, limit to 42 batches.
--  Will count kmers using 01 jobs, each using 12 GB and 4 threads.
--
-- Finished stage 'merylConfigure', reset canuIteration.
--
-- Running jobs.  First attempt out of 2.
----------------------------------------
-- Starting 'meryl' concurrent execution on Fri Jan 16 00:32:18 2026 with 4562843.343 GB free disk space (1 processes; 22 concurrently)

    cd unitigging/0-mercounts
    ./meryl-count.sh 1 > ./meryl-count.000001.out 2>&1

-- Finished on Fri Jan 16 00:35:41 2026 (203 seconds) with 4562350.546 GB free disk space
----------------------------------------
-- Found 1 Kmer counting (meryl) outputs.
-- Finished stage 'utg-merylCountCheck', reset canuIteration.
--
-- Running jobs.  First attempt out of 2.
----------------------------------------
-- Starting 'meryl' concurrent execution on Fri Jan 16 00:35:41 2026 with 4562350.515 GB free disk space (1 processes; 22 concurrently)

    cd unitigging/0-mercounts
    ./meryl-process.sh 1 > ./meryl-process.000001.out 2>&1

-- Finished on Fri Jan 16 00:35:45 2026 (4 seconds) with 4562351.203 GB free disk space
----------------------------------------
-- Meryl finished successfully.  Kmer frequency histogram:
--
-- WARNING: gnuplot failed.
--
----------------------------------------
--
--  22-mers                                                                                           Fraction
--    Occurrences   NumMers                                                                         Unique Total
--       1-     1         0                                                                        0.0000 0.0000
--       2-     2    459565 *                                                                      0.0102 0.0003
--       3-     4     86482                                                                        0.0115 0.0004
--       5-     7     36233                                                                        0.0124 0.0004
--       8-    11      8292                                                                        0.0129 0.0005
--      12-    16     20756                                                                        0.0131 0.0005
--      17-    22    119176                                                                        0.0137 0.0006
--      23-    29   1121130 ****                                                                   0.0173 0.0017
--      30-    37   6818669 ****************************                                           0.0495 0.0145
--      38-    46  16848624 ********************************************************************** 0.2255 0.1026
--      47-    56  12565167 ****************************************************                   0.6042 0.3340
--      57-    67   2529638 **********                                                             0.8530 0.5157
--      68-    79    686692 **                                                                     0.8983 0.5549
--      80-    92   1033962 ****                                                                   0.9140 0.5716
--      93-   106    672780 **                                                                     0.9365 0.5993
--     107-   121    304750 *                                                                      0.9506 0.6193
--     122-   137    292490 *                                                                      0.9571 0.6297
--     138-   154    216949                                                                        0.9636 0.6417
--     155-   172    154596                                                                        0.9682 0.6513
--     173-   191    157507                                                                        0.9716 0.6592
--     192-   211    119914                                                                        0.9750 0.6681
--     212-   232    109287                                                                        0.9776 0.6756
--     233-   254     93309                                                                        0.9800 0.6831
--     255-   277     85311                                                                        0.9821 0.6903
--     278-   301     70084                                                                        0.9839 0.6974
--     302-   326     60012                                                                        0.9855 0.7036
--     327-   352     50556                                                                        0.9868 0.7095
--     353-   379     45203                                                                        0.9879 0.7149
--     380-   407     36957                                                                        0.9889 0.7200
--     408-   436     31950                                                                        0.9897 0.7246
--     437-   466     31547                                                                        0.9904 0.7288
--     467-   497     25849                                                                        0.9911 0.7332
--     498-   529     24547                                                                        0.9917 0.7371
--     530-   562     20801                                                                        0.9922 0.7411
--     563-   596     17845                                                                        0.9927 0.7446
--     597-   631     15431                                                                        0.9931 0.7478
--     632-   667     15538                                                                        0.9934 0.7508
--     668-   704     15245                                                                        0.9937 0.7540
--     705-   742     12966                                                                        0.9941 0.7572
--     743-   781     15170                                                                        0.9944 0.7602
--     782-   821     14410                                                                        0.9947 0.7638
--
--           0 (max occurrences)
--  3191504074 (total mers, non-unique)
--    45271381 (distinct mers, non-unique)
--           0 (unique mers)
-- Finished stage 'meryl-process', reset canuIteration.
--
-- Removing meryl database 'unitigging/0-mercounts/A3-52.ms22'.
--
-- OVERLAPPER (normal) (assembly) erate=0.01
--
----------------------------------------
-- Starting command on Fri Jan 16 00:35:46 2026 with 4562351.187 GB free disk space

    cd unitigging/1-overlapper
    /share/org/YZWL/yzwl_lixg/miniforge3/envs/canu_v.2.3/bin/overlapInCorePartition \
     -S  ../../A3-52.seqStore \
     -hl 160000000 \
     -rl 5000000000 \
     -ol 500 \
     -o  ./A3-52.partition \
    > ./A3-52.partition.err 2>&1

-- Finished on Fri Jan 16 00:35:46 2026 (furiously fast) with 4562351.171 GB free disk space
----------------------------------------
--
-- Configured 21 overlapInCore jobs.
-- Finished stage 'utg-overlapConfigure', reset canuIteration.
--
-- Running jobs.  First attempt out of 2.
----------------------------------------
-- Starting 'utgovl' concurrent execution on Fri Jan 16 00:35:46 2026 with 4562351.14 GB free disk space (21 processes; 11 concurrently)

    cd unitigging/1-overlapper
    ./overlap.sh 1 > ./overlap.000001.out 2>&1
    ./overlap.sh 2 > ./overlap.000002.out 2>&1
    ./overlap.sh 3 > ./overlap.000003.out 2>&1
    ./overlap.sh 4 > ./overlap.000004.out 2>&1
    ./overlap.sh 5 > ./overlap.000005.out 2>&1
    ./overlap.sh 6 > ./overlap.000006.out 2>&1
    ./overlap.sh 7 > ./overlap.000007.out 2>&1
    ./overlap.sh 8 > ./overlap.000008.out 2>&1
    ./overlap.sh 9 > ./overlap.000009.out 2>&1
    ./overlap.sh 10 > ./overlap.000010.out 2>&1
    ./overlap.sh 11 > ./overlap.000011.out 2>&1
    ./overlap.sh 12 > ./overlap.000012.out 2>&1
    ./overlap.sh 13 > ./overlap.000013.out 2>&1
    ./overlap.sh 14 > ./overlap.000014.out 2>&1
    ./overlap.sh 15 > ./overlap.000015.out 2>&1
    ./overlap.sh 16 > ./overlap.000016.out 2>&1
    ./overlap.sh 17 > ./overlap.000017.out 2>&1
    ./overlap.sh 18 > ./overlap.000018.out 2>&1
    ./overlap.sh 19 > ./overlap.000019.out 2>&1
    ./overlap.sh 20 > ./overlap.000020.out 2>&1
    ./overlap.sh 21 > ./overlap.000021.out 2>&1

-- Finished on Fri Jan 16 01:19:13 2026 (2607 seconds) with 4558501.734 GB free disk space
----------------------------------------
-- Found 21 overlapInCore output files.
--
-- overlapInCore compute 'unitigging/1-overlapper':
--   kmer hits
--     with no overlap       1295306369  55.6666667 +- 39103358.315
--     with an overlap         30139708  4.19047619 +- 961163.543
--
--   overlaps                  30139708  4.19047619 +- 961163.543
--     contained                6818245  .333333333 +- 215418.527
--     dovetail                23321463  5.85714286 +- 746804.473
--
--   overlaps rejected
--     multiple per pair              0           0 +- 0
--     bad short window               0           0 +- 0
--     bad long window                0           0 +- 0
-- Finished stage 'utg-overlapCheck', reset canuIteration.
----------------------------------------
-- Starting command on Fri Jan 16 01:19:13 2026 with 4558501.718 GB free disk space

    cd unitigging
    /share/org/YZWL/yzwl_lixg/miniforge3/envs/canu_v.2.3/bin/ovStoreConfig \
     -S ../A3-52.seqStore \
     -M 4-8 \
     -L ./1-overlapper/ovljob.files \
     -create ./A3-52.ovlStore.config \
     > ./A3-52.ovlStore.config.txt \
    2> ./A3-52.ovlStore.config.err

-- Finished on Fri Jan 16 01:19:14 2026 (one second) with 4558501.703 GB free disk space
----------------------------------------
--
-- Creating overlap store unitigging/A3-52.ovlStore using:
--      1 bucket
--      1 slice
--        using at most 3 GB memory each
--
-- Running jobs.  First attempt out of 2.
----------------------------------------
-- Starting 'ovS' concurrent execution on Fri Jan 16 01:19:14 2026 with 4558501.687 GB free disk space (1 processes; 62 concurrently)

    cd unitigging
    ./A3-52.ovlStore.sh 1 > ./A3-52.ovlStore.000001.out 2>&1

-- Finished on Fri Jan 16 01:19:27 2026 (13 seconds) with 4558485.718 GB free disk space
----------------------------------------
-- Checking store.
----------------------------------------
-- Starting command on Fri Jan 16 01:19:27 2026 with 4558485.718 GB free disk space

    cd unitigging
    /share/org/YZWL/yzwl_lixg/miniforge3/envs/canu_v.2.3/bin/ovStoreDump \
     -S ../A3-52.seqStore \
     -O  ./A3-52.ovlStore \
     -counts \
     > ./A3-52.ovlStore/counts.dat 2> ./A3-52.ovlStore/counts.err

-- Finished on Fri Jan 16 01:19:27 2026 (in the blink of an eye) with 4558485.687 GB free disk space
----------------------------------------
--
-- Overlap store 'unitigging/A3-52.ovlStore' successfully constructed.
-- Found 60279416 overlaps for 250829 reads; 1577873 reads have no overlaps.
--
--
-- Purged 0.669 GB in 63 overlap output files.
----------------------------------------
-- Starting command on Fri Jan 16 01:19:28 2026 with 4558485.687 GB free disk space

    cd unitigging
    /share/org/YZWL/yzwl_lixg/miniforge3/envs/canu_v.2.3/bin/ovStoreStats \
     -C 50 \
     -S ../A3-52.seqStore \
     -O  ./A3-52.ovlStore \
     -o  ./A3-52.ovlStore \
     > ./A3-52.ovlStore.summary.err 2>&1

-- Finished on Fri Jan 16 01:19:36 2026 (8 seconds) with 4558485.671 GB free disk space
----------------------------------------
--
-- Overlap store 'unitigging/A3-52.ovlStore' contains:
--
--   category            reads     %          read length        feature size or coverage  analysis
--   ----------------  -------  -------  ----------------------  ------------------------  --------------------
--   middle-missing        216    0.08    14174.35 +- 5661.64       1087.06 +- 1645.28    (bad trimming)
--   middle-hump            59    0.02    13658.49 +- 3023.44       4682.90 +- 3106.94    (bad trimming)
--   no-5-prime           1132    0.43    12557.62 +- 4054.69       2175.31 +- 2941.29    (bad trimming)
--   no-3-prime           1545    0.58    10562.37 +- 5210.15       1712.15 +- 2515.30    (bad trimming)
--   
--   low-coverage         2732    1.03     9703.89 +- 4050.89          5.57 +- 3.63       (easy to assemble, potential for lower quality consensus)
--   unique             203096   76.80    12322.33 +- 4856.58         44.08 +- 8.23       (easy to assemble, perfect, yay)
--   repeat-cont         17615    6.66    11424.76 +- 4516.15       1269.46 +- 860.81     (potential for consensus errors, no impact on assembly)
--   repeat-dove           263    0.10    20848.68 +- 2521.66        800.35 +- 694.29     (hard to assemble, likely won't assemble correctly or even at all)
--   
--   span-repeat          2869    1.08    13213.73 +- 4244.24       2906.71 +- 3164.40    (read spans a large repeat, usually easy to assemble)
--   uniq-repeat-cont    14181    5.36    11959.01 +- 3926.97                             (should be uniquely placed, low potential for consensus errors, no impact on assembly)
--   uniq-repeat-dove     2880    1.09    17663.60 +- 3151.31                             (will end contigs, potential to misassemble)
--   uniq-anchor          4241    1.60    12665.30 +- 4073.55       7990.72 +- 4564.11    (repeat read, with unique section, probable bad read)
-- Finished stage 'utg-createOverlapStore', reset canuIteration.
--
-- Loading read lengths.
-- Loading number of overlaps per read.
--
-- Configure RED for 16gb memory.
--                   Batches of at most (unlimited) reads.
--                                      500000000 bases.
--                   Expecting evidence of at most 536870912 bases per iteration.
--
--           Total                                               Reads                 Olaps Evidence
--    Job   Memory      Read Range         Reads        Bases   Memory        Olaps   Memory   Memory  (Memory in MB)
--   ---- -------- ------------------- --------- ------------ -------- ------------ -------- --------
--      1 16384.73         1-43642          6232    108969459 13302.13       926376    10.60  1024.00
--      2 16385.72     43643-86708          6256    108852577 13287.86      2258812    25.85  1024.00
--      3 16384.37     86709-139193         7593    108934076 13297.86      1268078    14.51  1024.00
--      4 16385.70    139194-187539         7082    108932704 13297.67      1400963    16.03  1024.00
--      5 16386.47    187540-230401         6285    108864172 13289.28      2201164    25.19  1024.00
--      6 16385.40    230402-284156         7690    108941242 13298.73      1281757    14.67  1024.00
--      7 16385.31    284157-332209         6961    108940704 13298.64      1281024    14.66  1024.00
--      8 16384.96    332210-375009         6255    108854138 13288.06      2176355    24.91  1024.00
--      9 16385.30    375010-427824         7571    108944304 13299.10      1240897    14.20  1024.00
--     10 16384.08    427825-474375         6761    108937390 13298.23      1210203    13.85  1024.00
--     11 16384.51    474376-517550         6226    108858140 13288.54      2094078    23.96  1024.00
--     12 16384.72    517551-570365         7589    108928030 13297.12      1363279    15.60  1024.00
--     13 16384.78    570366-616144         6601    108950328 13299.81      1133787    12.98  1024.00
--     14 16384.15    616145-659142         6230    108859765 13288.74      2045126    23.40  1024.00
--     15 16384.36    659143-712373         7645    108921987 13296.38      1396124    15.98  1024.00
--     16 16384.16    712374-756817         6557    108953701 13300.22      1043244    11.94  1024.00
--     17 16384.20    756818-799810         6174    108858227 13288.55      2066170    23.65  1024.00
--     18 16385.66    799811-853098         7678    108930029 13297.36      1424237    16.30  1024.00
--     19 16385.08    853099-897869         6491    108965685 13301.68       996339    11.40  1024.00
--     20 16385.16    897870-940277         6199    108857369 13288.45      2159688    24.72  1024.00
--     21 16384.52    940278-990876         7456    108916872 13295.75      1464942    16.76  1024.00
--     22 16384.51    990877-1035102        6434    108954759 13300.34      1063344    12.17  1024.00
--     23 16385.74   1035103-1077691        6148    108866362 13289.54      2114437    24.20  1024.00
--     24 16384.10   1077692-1128107        7366    108918374 13295.93      1413028    16.17  1024.00
--     25 16386.41   1128108-1171878        6445    108968541 13302.03      1082309    12.39  1024.00
--     26 16384.13   1171879-1214742        6135    108848550 13287.37      2163930    24.76  1024.00
--     27 16385.09   1214743-1268012        7617    108931022 13297.48      1363859    15.61  1024.00
--     28 16385.96   1268013-1311954        6299    108979549 13303.37       926055    10.60  1024.00
--     29 16384.65   1311955-1354572        6184    108846493 13287.12      2231099    25.53  1024.00
--     30 16385.60   1354573-1407106        7597    108923522 13296.57      1488013    17.03  1024.00
--     31 16386.00   1407107-1450121        6252    108989698 13304.60       821460     9.40  1024.00
--     32 16384.01   1450122-1493631        6234    108847265 13287.22      2166496    24.79  1024.00
--     33 16384.68   1493632-1547361        7726    108908968 13294.79      1562466    17.88  1024.00
--     34 16385.91   1547362-1590127        6170    108976637 13303.01       952675    10.90  1024.00
--     35 16385.69   1590128-1634365        6247    108864728 13289.35      2126876    24.34  1024.00
--     36 16385.31   1634366-1688966        7821    108895720 13293.18      1759092    20.13  1024.00
--     37 16385.84   1688967-1730092        6052    108987620 13304.34       829848     9.50  1024.00
--     38 16385.23   1730093-1774019        6246    108876471 13290.78      1961209    22.44  1024.00
--     39 16384.04   1774020-1827359        7768    108886913 13292.10      1742467    19.94  1024.00
--     40  3362.49   1827360-1828702         189      2372353   289.60        78110     0.89  1024.00
--   ---- -------- ------------------- --------- ------------ -------- ------------ -------- --------
--                                                 4250014444              60279416
-- Finished stage 'readErrorDetectionConfigure', reset canuIteration.
--
-- Running jobs.  First attempt out of 2.
----------------------------------------
-- Starting 'red' concurrent execution on Fri Jan 16 01:19:43 2026 with 4558485.625 GB free disk space (40 processes; 22 concurrently)

    cd unitigging/3-overlapErrorAdjustment
    ./red.sh 1 > ./red.000001.out 2>&1
    ./red.sh 2 > ./red.000002.out 2>&1
    ./red.sh 3 > ./red.000003.out 2>&1
    ./red.sh 4 > ./red.000004.out 2>&1
    ./red.sh 5 > ./red.000005.out 2>&1
    ./red.sh 6 > ./red.000006.out 2>&1
    ./red.sh 7 > ./red.000007.out 2>&1
    ./red.sh 8 > ./red.000008.out 2>&1
    ./red.sh 9 > ./red.000009.out 2>&1
    ./red.sh 10 > ./red.000010.out 2>&1
    ./red.sh 11 > ./red.000011.out 2>&1
    ./red.sh 12 > ./red.000012.out 2>&1
    ./red.sh 13 > ./red.000013.out 2>&1
    ./red.sh 14 > ./red.000014.out 2>&1
    ./red.sh 15 > ./red.000015.out 2>&1
    ./red.sh 16 > ./red.000016.out 2>&1
    ./red.sh 17 > ./red.000017.out 2>&1
    ./red.sh 18 > ./red.000018.out 2>&1
    ./red.sh 19 > ./red.000019.out 2>&1
    ./red.sh 20 > ./red.000020.out 2>&1
    ./red.sh 21 > ./red.000021.out 2>&1
    ./red.sh 22 > ./red.000022.out 2>&1
    ./red.sh 23 > ./red.000023.out 2>&1
    ./red.sh 24 > ./red.000024.out 2>&1
    ./red.sh 25 > ./red.000025.out 2>&1
    ./red.sh 26 > ./red.000026.out 2>&1
    ./red.sh 27 > ./red.000027.out 2>&1
    ./red.sh 28 > ./red.000028.out 2>&1
    ./red.sh 29 > ./red.000029.out 2>&1
    ./red.sh 30 > ./red.000030.out 2>&1
    ./red.sh 31 > ./red.000031.out 2>&1
    ./red.sh 32 > ./red.000032.out 2>&1
    ./red.sh 33 > ./red.000033.out 2>&1
    ./red.sh 34 > ./red.000034.out 2>&1
    ./red.sh 35 > ./red.000035.out 2>&1
    ./red.sh 36 > ./red.000036.out 2>&1
    ./red.sh 37 > ./red.000037.out 2>&1
    ./red.sh 38 > ./red.000038.out 2>&1
    ./red.sh 39 > ./red.000039.out 2>&1
    ./red.sh 40 > ./red.000040.out 2>&1

-- Finished on Fri Jan 16 01:35:53 2026 (970 seconds) with 4560148.937 GB free disk space
----------------------------------------
-- Found 40 read error detection output files.
-- Finished stage 'readErrorDetectionCheck', reset canuIteration.
--
-- Loading read lengths.
-- Loading number of overlaps per read.
--
-- Configure OEA for 8gb memory.
--                   Batches of at most (unlimited) reads.
--                                      300000000 bases.
--
--           Total                                               Reads                 Olaps  Adjusts
--    Job   Memory      Read Range         Reads        Bases   Memory        Olaps   Memory   Memory  (Memory in MB)
--   ---- -------- ------------------- --------- ------------ -------- ------------ -------- --------
--      1  2827.70         1-123662        17785    300016764   294.66      3804883   116.12   368.93
--      2  2854.13    123663-254089        19103    300000060   294.69      4670130   142.52   368.93
--      3  2848.76    254090-386996        19202    300009029   294.70      4493718   137.14   368.93
--      4  2845.35    386997-518355        18937    300001689   294.68      4382387   133.74   368.93
--      5  2811.27    518356-648694        18856    300012538   294.69      3265329    99.65   368.93
--      6  2842.76    648695-779572        18855    300002353   294.68      4297702   131.16   368.93
--      7  2841.09    779573-909176        18839    300001663   294.68      4243025   129.49   368.93
--      8  2844.71    909177-1036403       18602    300007428   294.68      4361542   133.10   368.93
--      9  2848.16   1036404-1163556       18491    300018218   294.68      4474410   136.55   368.93
--     10  2842.48   1163557-1293165       18605    300003863   294.67      4288581   130.88   368.93
--     11  2844.76   1293166-1421708       18565    300006993   294.68      4363379   133.16   368.93
--     12  2844.52   1421709-1550942       18611    300006761   294.68      4355279   132.91   368.93
--     13  2835.43   1550943-1676683       18060    300000097   294.65      4058341   123.85   368.93
--     14  2831.38   1676684-1801299       17935    300007520   294.66      3925517   119.80   368.93
--     15  2512.18   1801300-1828702        4016     49919468    55.73      1295193    39.53   368.93
--   ---- -------- ------------------- --------- ------------ -------- ------------ -------- --------
--                                                 4250014444              60279416
-- Finished stage 'overlapErrorAdjustmentConfigure', reset canuIteration.
--
-- Running jobs.  First attempt out of 2.
----------------------------------------
-- Starting 'oea' concurrent execution on Fri Jan 16 01:36:01 2026 with 4560148.859 GB free disk space (15 processes; 62 concurrently)

    cd unitigging/3-overlapErrorAdjustment
    ./oea.sh 1 > ./oea.000001.out 2>&1
    ./oea.sh 2 > ./oea.000002.out 2>&1
    ./oea.sh 3 > ./oea.000003.out 2>&1
    ./oea.sh 4 > ./oea.000004.out 2>&1
    ./oea.sh 5 > ./oea.000005.out 2>&1
    ./oea.sh 6 > ./oea.000006.out 2>&1
    ./oea.sh 7 > ./oea.000007.out 2>&1
    ./oea.sh 8 > ./oea.000008.out 2>&1
    ./oea.sh 9 > ./oea.000009.out 2>&1
    ./oea.sh 10 > ./oea.000010.out 2>&1
    ./oea.sh 11 > ./oea.000011.out 2>&1
    ./oea.sh 12 > ./oea.000012.out 2>&1
    ./oea.sh 13 > ./oea.000013.out 2>&1
    ./oea.sh 14 > ./oea.000014.out 2>&1
    ./oea.sh 15 > ./oea.000015.out 2>&1

-- Finished on Fri Jan 16 02:27:31 2026 (3090 seconds) with 4559346.937 GB free disk space
----------------------------------------
-- Found 15 overlap error adjustment output files.
-- Finished stage 'overlapErrorAdjustmentCheck', reset canuIteration.
----------------------------------------
-- Starting command on Fri Jan 16 02:27:31 2026 with 4559346.921 GB free disk space

    cd unitigging/3-overlapErrorAdjustment
    /share/org/YZWL/yzwl_lixg/miniforge3/envs/canu_v.2.3/bin/loadErates \
      -S ../../A3-52.seqStore \
      -O ../A3-52.ovlStore \
      -L ./oea.files \
    > ./oea.apply.err 2>&1

-- Finished on Fri Jan 16 02:27:32 2026 (one second) with 4559346.796 GB free disk space
----------------------------------------
-- No report available.
-- Finished stage 'updateOverlapStore', reset canuIteration.
-- Finished stage 'unitig', reset canuIteration.
--
-- Running jobs.  First attempt out of 2.
----------------------------------------
-- Starting 'bat' concurrent execution on Fri Jan 16 02:27:32 2026 with 4559346.75 GB free disk space (1 processes; 1 concurrently)

    cd unitigging/4-unitigger
    ./unitigger.sh 1 > ./unitigger.000001.out 2>&1

-- Finished on Fri Jan 16 02:27:50 2026 (18 seconds) with 4559345.609 GB free disk space
----------------------------------------
-- Unitigger finished successfully.
--  
--  ERROR RATES
--  -----------
--                                                   --------threshold------
--  280476                       fraction error      fraction        percent
--  samples                              (1e-5)         error          error
--                   --------------------------      --------       --------
--  command line (-eg)                           ->     30.00        0.0300%
--  command line (-ef)                           ->  -----.--      ---.----%
--  command line (-eM)                           ->     30.00        0.0300%
--  mean + std.dev       0.41 +-  12 *     2.95  ->     35.86        0.0359%
--  median + mad         0.00 +-  12 *     0.00  ->      0.00        0.0000%
--  90th percentile                              ->      1.00        0.0010%  (enabled)
--  
--  BEST EDGE FILTERING
--  -------------------
--  At graph threshold 0.0300%, reads:
--    available to have edges:        52384
--    with at least one edge:         36758
--  
--  At max threshold 0.0300%, reads:
--    available to have edges:        52384
--    with at least one edge:         36758
--  
--  At tight threshold 0.0010%, reads with:
--    both edges below error threshold:     32083  (80.00% minReadsBest threshold = 29406)
--    one  edge  above error threshold:      3409
--    both edges above error threshold:      1266
--    at least one edge:                    36758
--  
--  At loose threshold 0.0300%, reads with:
--    both edges below error threshold:     36758  (80.00% minReadsBest threshold = 29406)
--    one  edge  above error threshold:         0
--    both edges above error threshold:         0
--    at least one edge:                    36758
--  
--  
--  INITIAL EDGES
--  -------- ----------------------------------------
--    206235 reads are contained
--   1592125 reads have no best edges (singleton)
--       584 reads have only one best edge (spur) 
--                341 are mutual best
--     29758 reads have two best edges 
--                917 have one mutual best edge
--              28374 have two mutual best edges
--  
--  
--  FINAL EDGES
--  -------- ----------------------------------------
--    206235 reads are contained
--   1592498 reads have no best edges (singleton)
--       465 reads have only one best edge (spur) 
--                338 are mutual best
--     29504 reads have two best edges 
--                770 have one mutual best edge
--              28359 have two mutual best edges
--  
--  
--  EDGE FILTERING
--  -------- ------------------------------------------
--         0 reads are ignored
--     12253 reads have a gap in overlap coverage
--       151 reads have lopsided best edges
-- Found, in version 1, after unitig construction:
--   contigs:      179 sequences, total length 69989164 bp (including 215 repeats of total length 5101416 bp).
--   bubbles:      187 sequences, total length 4629788 bp.
--   unassembled:  28152 sequences, total length 304287742 bp.
--
-- Contig sizes based on genome size 85mbp:
--
--            NG (bp)  LG (contigs)    sum (bp)
--         ----------  ------------  ----------
--     10     6288475             2    14667866
--     20     6238586             3    20906452
--     30     5086395             4    25992847
--     40     3510480             6    34049536
--     50     3347980             9    44191426
--     60     2687733            12    52895958
--     70     1386127            16    59740760
--     80       26215            76    68002598
--
-- Finished stage 'unitigCheck', reset canuIteration.
----------------------------------------
-- Starting command on Fri Jan 16 02:27:50 2026 with 4559345.593 GB free disk space

    cd unitigging
    /share/org/YZWL/yzwl_lixg/miniforge3/envs/canu_v.2.3/bin/utgcns \
      -S ../A3-52.seqStore \
      -T  ./A3-52.ctgStore 1 \
      -partition 0.8 1.5 0.1 \
    > ./A3-52.ctgStore/partitioning.log 2>&1

-- Finished on Fri Jan 16 02:27:59 2026 (9 seconds) with 4559344.406 GB free disk space
----------------------------------------
-- Using slow alignment for consensus (iteration '0').
-- Configured 10 consensus jobs.
-- Finished stage 'consensusConfigure', reset canuIteration.
--
-- Local: cns       12.375 GB    8 CPUs x  11 jobs   136.125 GB  88 CPUs  (consensus)
--
--
-- Running jobs.  First attempt out of 2.
----------------------------------------
-- Starting 'cns' concurrent execution on Fri Jan 16 02:27:59 2026 with 4559344.375 GB free disk space (10 processes; 11 concurrently)

    cd unitigging/5-consensus
    ./consensus.sh 1 > ./consensus.000001.out 2>&1
    ./consensus.sh 2 > ./consensus.000002.out 2>&1
    ./consensus.sh 3 > ./consensus.000003.out 2>&1
    ./consensus.sh 4 > ./consensus.000004.out 2>&1
    ./consensus.sh 5 > ./consensus.000005.out 2>&1
    ./consensus.sh 6 > ./consensus.000006.out 2>&1
    ./consensus.sh 7 > ./consensus.000007.out 2>&1
    ./consensus.sh 8 > ./consensus.000008.out 2>&1
    ./consensus.sh 9 > ./consensus.000009.out 2>&1
    ./consensus.sh 10 > ./consensus.000010.out 2>&1

-- Finished on Fri Jan 16 02:35:30 2026 (451 seconds) with 4559070.687 GB free disk space
----------------------------------------
-- Using slow alignment for consensus (iteration '1').
-- Configured 10 consensus jobs.
-- All 10 consensus jobs finished successfully.
-- Finished stage 'consensusCheck', reset canuIteration.
-- Using slow alignment for consensus (iteration '0').
-- Configured 10 consensus jobs.
----------------------------------------
-- Starting command on Fri Jan 16 02:35:30 2026 with 4559070.64 GB free disk space

    cd unitigging
    /share/org/YZWL/yzwl_lixg/miniforge3/envs/canu_v.2.3/bin/tgStoreLoad \
      -S ../A3-52.seqStore \
      -T  ./A3-52.ctgStore 2 \
      -L ./5-consensus/ctgcns.files \
    > ./5-consensus/ctgcns.files.ctgStoreLoad.err 2>&1

-- Finished on Fri Jan 16 02:35:32 2026 (2 seconds) with 4559069.546 GB free disk space
----------------------------------------
----------------------------------------
-- Starting command on Fri Jan 16 02:35:32 2026 with 4559069.546 GB free disk space

    cd unitigging
    /share/org/YZWL/yzwl_lixg/miniforge3/envs/canu_v.2.3/bin/tgTigDisplay \
      -S ../A3-52.seqStore \
      -b \
      -o ../A3-52.contigs.unsorted.bam \
      -L ./5-consensus/ctgcns.files \
    > ./5-consensus/ctgcns.files.contigs.bam.err 2>&1

-- Finished on Fri Jan 16 02:38:16 2026 (164 seconds) with 4559196.906 GB free disk space
----------------------------------------
----------------------------------------
-- Starting command on Fri Jan 16 02:38:16 2026 with 4559196.906 GB free disk space

    cd .
    samtools sort \
      --write-index \
      --threads 2 \
      -o ./A3-52.contigs.bam ./A3-52.contigs.unsorted.bam \
    > ./ctgcns.bam.err 2>&1

-- Finished on Fri Jan 16 02:39:15 2026 (59 seconds) with 4559119.078 GB free disk space
----------------------------------------
-- Purging consensus output after loading to ctgStore.
-- Purged 10 .cns outputs.
----------------------------------------
-- Starting command on Fri Jan 16 02:39:15 2026 with 4559121.937 GB free disk space

    cd unitigging
    /share/org/YZWL/yzwl_lixg/miniforge3/envs/canu_v.2.3/bin/tgStoreDump \
      -S ../A3-52.seqStore \
      -T ./A3-52.ctgStore 2 \
      -sizes -s 85000000 \
    > ./A3-52.ctgStore/seqDB.v002.sizes.txt
ZERO length suplied to intervalList::add(), ignoring interval.
ZERO length suplied to intervalList::add(), ignoring interval.
ZERO length suplied to intervalList::add(), ignoring interval.
ZERO length suplied to intervalList::add(), ignoring interval.
ZERO length suplied to intervalList::add(), ignoring interval.
ZERO length suplied to intervalList::add(), ignoring interval.
ZERO length suplied to intervalList::add(), ignoring interval.
ZERO length suplied to intervalList::add(), ignoring interval.
ZERO length suplied to intervalList::add(), ignoring interval.
ZERO length suplied to intervalList::add(), ignoring interval.
ZERO length suplied to intervalList::add(), ignoring interval.
ZERO length suplied to intervalList::add(), ignoring interval.
ZERO length suplied to intervalList::add(), ignoring interval.
ZERO length suplied to intervalList::add(), ignoring interval.
ZERO length suplied to intervalList::add(), ignoring interval.
ZERO length suplied to intervalList::add(), ignoring interval.
ZERO length suplied to intervalList::add(), ignoring interval.
ZERO length suplied to intervalList::add(), ignoring interval.
ZERO length suplied to intervalList::add(), ignoring interval.
ZERO length suplied to intervalList::add(), ignoring interval.
ZERO length suplied to intervalList::add(), ignoring interval.
ZERO length suplied to intervalList::add(), ignoring interval.
ZERO length suplied to intervalList::add(), ignoring interval.
ZERO length suplied to intervalList::add(), ignoring interval.
ZERO length suplied to intervalList::add(), ignoring interval.
ZERO length suplied to intervalList::add(), ignoring interval.
ZERO length suplied to intervalList::add(), ignoring interval.
ZERO length suplied to intervalList::add(), ignoring interval.
ZERO length suplied to intervalList::add(), ignoring interval.
ZERO length suplied to intervalList::add(), ignoring interval.

-- Finished on Fri Jan 16 02:39:15 2026 (like a bat out of hell) with 4559121.937 GB free disk space
----------------------------------------
-- Found, in version 2, after consensus generation:
--   contigs:      179 sequences, total length 91669840 bp (including 215 repeats of total length 7019602 bp).
--   bubbles:      187 sequences, total length 6340883 bp.
--   unassembled:  28152 sequences, total length 451850073 bp.
--
-- Contig sizes based on genome size 85mbp:
--
--            NG (bp)  LG (contigs)    sum (bp)
--         ----------  ------------  ----------
--     10    10889574             1    10889574
--     20     8168801             2    19058375
--     30     8099791             3    27158166
--     40     5923543             5    39691974
--     50     4582760             6    44274734
--     60     4393260             8    53133008
--     70     4312712            10    61800812
--     80     3501093            12    68832736
--     90     1812477            16    77764096
--    100      479050            24    85374889
--
-- Finished stage 'consensusLoad', reset canuIteration.
----------------------------------------
-- Starting command on Fri Jan 16 02:39:15 2026 with 4559121.921 GB free disk space

    cd .
    /share/org/YZWL/yzwl_lixg/miniforge3/envs/canu_v.2.3/bin/tgStoreDump \
      -S ./A3-52.seqStore \
      -T ./unitigging/A3-52.ctgStore 2 \
      -o ./A3-52.contigs \
      -layout \
    > ./A3-52.contigs.layout.err 2>&1

-- Finished on Fri Jan 16 02:39:16 2026 (one second) with 4559121.89 GB free disk space
----------------------------------------
----------------------------------------
-- Starting command on Fri Jan 16 02:39:16 2026 with 4559121.89 GB free disk space

    cd .
    /share/org/YZWL/yzwl_lixg/miniforge3/envs/canu_v.2.3/bin/tgStoreDump \
      -S ./A3-52.seqStore \
      -T ./unitigging/A3-52.ctgStore 2 \
      -consensus -fasta \
      -unassembled \
    > ./A3-52.unassembled.fasta
    2> ./A3-52.unassembled.err
ZERO length suplied to intervalList::add(), ignoring interval.
ZERO length suplied to intervalList::add(), ignoring interval.
ZERO length suplied to intervalList::add(), ignoring interval.
ZERO length suplied to intervalList::add(), ignoring interval.
ZERO length suplied to intervalList::add(), ignoring interval.
ZERO length suplied to intervalList::add(), ignoring interval.
ZERO length suplied to intervalList::add(), ignoring interval.
ZERO length suplied to intervalList::add(), ignoring interval.
ZERO length suplied to intervalList::add(), ignoring interval.
ZERO length suplied to intervalList::add(), ignoring interval.
ZERO length suplied to intervalList::add(), ignoring interval.
ZERO length suplied to intervalList::add(), ignoring interval.
ZERO length suplied to intervalList::add(), ignoring interval.
ZERO length suplied to intervalList::add(), ignoring interval.
ZERO length suplied to intervalList::add(), ignoring interval.
ZERO length suplied to intervalList::add(), ignoring interval.
ZERO length suplied to intervalList::add(), ignoring interval.
ZERO length suplied to intervalList::add(), ignoring interval.
ZERO length suplied to intervalList::add(), ignoring interval.
ZERO length suplied to intervalList::add(), ignoring interval.
ZERO length suplied to intervalList::add(), ignoring interval.
ZERO length suplied to intervalList::add(), ignoring interval.
ZERO length suplied to intervalList::add(), ignoring interval.
ZERO length suplied to intervalList::add(), ignoring interval.
ZERO length suplied to intervalList::add(), ignoring interval.
ZERO length suplied to intervalList::add(), ignoring interval.
ZERO length suplied to intervalList::add(), ignoring interval.
ZERO length suplied to intervalList::add(), ignoring interval.
ZERO length suplied to intervalList::add(), ignoring interval.
ZERO length suplied to intervalList::add(), ignoring interval.

-- Finished on Fri Jan 16 02:39:18 2026 (2 seconds) with 4559161.609 GB free disk space
----------------------------------------
----------------------------------------
-- Starting command on Fri Jan 16 02:39:18 2026 with 4559161.609 GB free disk space

    cd .
    /share/org/YZWL/yzwl_lixg/miniforge3/envs/canu_v.2.3/bin/tgStoreDump \
      -S ./A3-52.seqStore \
      -T ./unitigging/A3-52.ctgStore 2 \
      -consensus -fasta \
      -contigs \
    > ./A3-52.contigs.fasta
    2> ./A3-52.contigs.err
ZERO length suplied to intervalList::add(), ignoring interval.
ZERO length suplied to intervalList::add(), ignoring interval.
ZERO length suplied to intervalList::add(), ignoring interval.
ZERO length suplied to intervalList::add(), ignoring interval.
ZERO length suplied to intervalList::add(), ignoring interval.
ZERO length suplied to intervalList::add(), ignoring interval.
ZERO length suplied to intervalList::add(), ignoring interval.
ZERO length suplied to intervalList::add(), ignoring interval.
ZERO length suplied to intervalList::add(), ignoring interval.
ZERO length suplied to intervalList::add(), ignoring interval.
ZERO length suplied to intervalList::add(), ignoring interval.
ZERO length suplied to intervalList::add(), ignoring interval.
ZERO length suplied to intervalList::add(), ignoring interval.
ZERO length suplied to intervalList::add(), ignoring interval.
ZERO length suplied to intervalList::add(), ignoring interval.
ZERO length suplied to intervalList::add(), ignoring interval.
ZERO length suplied to intervalList::add(), ignoring interval.
ZERO length suplied to intervalList::add(), ignoring interval.
ZERO length suplied to intervalList::add(), ignoring interval.
ZERO length suplied to intervalList::add(), ignoring interval.
ZERO length suplied to intervalList::add(), ignoring interval.
ZERO length suplied to intervalList::add(), ignoring interval.
ZERO length suplied to intervalList::add(), ignoring interval.
ZERO length suplied to intervalList::add(), ignoring interval.
ZERO length suplied to intervalList::add(), ignoring interval.
ZERO length suplied to intervalList::add(), ignoring interval.
ZERO length suplied to intervalList::add(), ignoring interval.
ZERO length suplied to intervalList::add(), ignoring interval.
ZERO length suplied to intervalList::add(), ignoring interval.
ZERO length suplied to intervalList::add(), ignoring interval.

-- Finished on Fri Jan 16 02:39:18 2026 (lickety-split) with 4559161.5 GB free disk space
----------------------------------------
-- Finished stage 'generateOutputs', reset canuIteration.
--
-- Assembly 'A3-52' finished in '/share/org/YZWL/yzwl_lixg/project/28.大豆疫霉菌三代基因组/03.hicanu/A3-52/01.raw_output'.
--
-- Summary saved in 'A3-52.report'.
--
-- Sequences saved:
--   Contigs       -> 'A3-52.contigs.fasta'
--   Unassembled   -> 'A3-52.unassembled.fasta'
--
-- Read layouts saved:
--   Contigs       -> 'A3-52.contigs.layout'.
--
-- Bye.

2026-01-16 02:39:19.025 - WARNING - 输出文件不存在|Output file does not exist: /share/org/YZWL/yzwl_lixg/project/28.大豆疫霉菌三代基因组/03.hicanu/A3-52/01.raw_output/A3-52.unitigs.fasta
Usage: biopytools ragtag [OPTIONS]
Try 'biopytools ragtag -h' for help.

Error: Invalid value for '-r' / '--reference': 文件不存在|File does not exist: /share/org/YZWL/yzwl_lixg/project/28.大豆疫霉菌三代基因组/04.ragtag/Psoja_T2T.fa
Usage: biopytools genomesyn [OPTIONS]
Try 'biopytools genomesyn -h' for help.

Error: Invalid value for '-i' / '--ref': Path '04.ragtag/A3-52/hicanu/A3-52_RagTag_scaffolded.fa' does not exist.
Job 68886785 stderr output:

