Usage: biopytools ragtag [OPTIONS]
Try 'biopytools ragtag -h' for help.

Error: Invalid value for '-r' / '--reference': 文件不存在|File does not exist: /share/org/YZWL/yzwl_lixg/project/28.大豆疫霉菌三代基因组/04.ragtag/Psoja_T2T.fa
Usage: biopytools genomesyn [OPTIONS]
Try 'biopytools genomesyn -h' for help.

Error: Invalid value for '-i' / '--ref': Path '04.ragtag/A1-1/hifiasm/A1-1_RagTag_scaffolded.fa' does not exist.
2026-01-16 02:36:50.197 - WARNING - 命令错误输出|Command stderr:
-- canu master +27 changes (r10515 2a41e933b8de6ed66723d75d36dd071b46d2c347)
--
-- CITATIONS
--
-- For assemblies of PacBio HiFi reads:
--   Nurk S, Walenz BP, Rhiea A, Vollger MR, Logsdon GA, Grothe R, Miga KH, Eichler EE, Phillippy AM, Koren S.
--   HiCanu: accurate assembly of segmental duplications, satellites, and allelic variants from high-fidelity long reads.
--   biorXiv. 2020.
--   https://doi.org/10.1101/2020.03.14.992248
-- 
-- Read and contig alignments during correction and consensus use:
--   Šošic M, Šikic M.
--   Edlib: a C/C ++ library for fast, exact sequence alignment using edit distance.
--   Bioinformatics. 2017 May 1;33(9):1394-1395.
--   http://doi.org/10.1093/bioinformatics/btw753
-- 
-- Overlaps are generated using:
--   Berlin K, et al.
--   Assembling large genomes with single-molecule sequencing and locality-sensitive hashing.
--   Nat Biotechnol. 2015 Jun;33(6):623-30.
--   http://doi.org/10.1038/nbt.3238
-- 
--   Myers EW, et al.
--   A Whole-Genome Assembly of Drosophila.
--   Science. 2000 Mar 24;287(5461):2196-204.
--   http://doi.org/10.1126/science.287.5461.2196
-- 
-- Contig consensus sequences are generated using an algorithm derived from pbdagcon:
--   Chin CS, et al.
--   Nonhybrid, finished microbial genome assemblies from long-read SMRT sequencing data.
--   Nat Methods. 2013 Jun;10(6):563-9
--   http://doi.org/10.1038/nmeth.2474
-- 
-- CONFIGURE CANU
--
-- Detected Java(TM) Runtime Environment '17.0.15-internal' (from '/share/org/YZWL/yzwl_lixg/.local/bin/java') without -d64 support.
--
-- WARNING:
-- WARNING:  Failed to run gnuplot using command 'gnuplot'.
-- WARNING:  Plots will be disabled.
-- WARNING:
--
-- Detected samtools version '1.22' / htslib version 'htscodecs=1.6.3' (from 'samtools').
--
-- Detected 88 CPUs and 503 gigabytes of memory on the local machine.
--
-- Detected Slurm with 'sinfo' binary in /opt/skyformai/bin/sinfo.
--          Slurm disabled by useGrid=false
--
-- Detected  '' with 'pbsnodes' binary in /opt/skyformai/bin/pbsnodes.
--           disabled by useGrid=false
--
-- Detected LSF with 'bsub' binary in /opt/skyformai/bin/bsub.
--          LSF disabled by useGrid=false
--
-- Local machine mode enabled; grid support not detected or not allowed.
--
-- Found trimmed raw PacBio HiFi reads in the input files.
--
--                                (tag)Concurrency
--                         (tag)Threads          |
--                (tag)Memory         |          |
--        (tag)             |         |          |       total usage      algorithm
--        -------  ----------  --------   --------  --------------------  -----------------------------
-- Local: meryl     12.000 GB    4 CPUs x  22 jobs   264.000 GB  88 CPUs  (k-mer counting)
-- Local: cormhap   13.000 GB   11 CPUs x   8 jobs   104.000 GB  88 CPUs  (overlap detection with mhap)
-- Local: obtovl     8.000 GB    8 CPUs x  11 jobs    88.000 GB  88 CPUs  (overlap detection)
-- Local: utgovl     8.000 GB    8 CPUs x  11 jobs    88.000 GB  88 CPUs  (overlap detection)
-- Local: cor        -.--- GB    4 CPUs x   - jobs     -.--- GB   - CPUs  (read correction)
-- Local: ovb        4.000 GB    1 CPU  x  88 jobs   352.000 GB  88 CPUs  (overlap store bucketizer)
-- Local: ovs        8.000 GB    1 CPU  x  62 jobs   496.000 GB  62 CPUs  (overlap store sorting)
-- Local: red       16.000 GB    4 CPUs x  22 jobs   352.000 GB  88 CPUs  (read error detection)
-- Local: oea        8.000 GB    1 CPU  x  62 jobs   496.000 GB  62 CPUs  (overlap error adjustment)
-- Local: bat       32.000 GB    8 CPUs x   1 job     32.000 GB   8 CPUs  (contig construction with bogart)
-- Local: cns        -.--- GB    8 CPUs x   - jobs     -.--- GB   - CPUs  (consensus)
--
-- Generating assembly 'A1-1' in '/share/org/YZWL/yzwl_lixg/project/28.大豆疫霉菌三代基因组/03.hicanu/A1-1/01.raw_output':
--   genomeSize:
--     85000000
--
--   Overlap Generation Limits:
--     corOvlErrorRate 0.0000 (  0.00%)
--     obtOvlErrorRate 0.0250 (  2.50%)
--     utgOvlErrorRate 0.0100 (  1.00%)
--
--   Overlap Processing Limits:
--     corErrorRate    0.0000 (  0.00%)
--     obtErrorRate    0.0250 (  2.50%)
--     utgErrorRate    0.0003 (  0.03%)
--     cnsErrorRate    0.0500 (  5.00%)
--
--   Stages to run:
--     assemble HiFi reads.
--
--
-- BEGIN STORE CREATION
----------------------------------------
-- Starting command on Fri Jan 16 00:43:21 2026 with 4561310.796 GB free disk space

    cd .
    ./A1-1.seqStore.sh \
    > ./A1-1.seqStore.err 2>&1

-- Finished on Fri Jan 16 00:50:45 2026 (444 seconds) with 4560031.531 GB free disk space
----------------------------------------
--
-- In sequence store './A1-1.seqStore':
--   Found 259341 reads.
--   Found 4250015130 bases (50 times coverage).
--    Histogram of corrected reads:
--    
--    G=4250015130                       sum of  ||               length     num
--    NG         length     index       lengths  ||                range    seqs
--    ----- ------------ --------- ------------  ||  ------------------- -------
--    00010        26146     15133    425006018  ||       1238-2622        10504|-----------------------
--    00020        24129     32102    850022805  ||       2623-4007        14663|-------------------------------
--    00030        22728     50276   1275004774  ||       4008-5392        12482|---------------------------
--    00040        21607     69466   1700009119  ||       5393-6777        10469|-----------------------
--    00050        20604     89611   2125016475  ||       6778-8162         8646|-------------------
--    00060        19632    110737   2550024651  ||       8163-9547         7535|----------------
--    00070        18534    132993   2975011020  ||       9548-10932        6663|---------------
--    00080        16990    156846   3400014567  ||      10933-12317        5620|------------
--    00090        11638    185395   3825022584  ||      12318-13702        5000|-----------
--    00100         1238    259341   4250015130  ||      13703-15087        5636|------------
--    001.000x              259341   4250015130  ||      15088-16472        9735|---------------------
--                                               ||      16473-17857       17701|--------------------------------------
--                                               ||      17858-19242       25693|-------------------------------------------------------
--                                               ||      19243-20627       29869|---------------------------------------------------------------
--                                               ||      20628-22012       27114|----------------------------------------------------------
--                                               ||      22013-23397       21231|---------------------------------------------
--                                               ||      23398-24782       15269|---------------------------------
--                                               ||      24783-26167       10511|-----------------------
--                                               ||      26168-27552        7042|---------------
--                                               ||      27553-28937        4131|---------
--                                               ||      28938-30322        2286|-----
--                                               ||      30323-31707        1017|---
--                                               ||      31708-33092         383|-
--                                               ||      33093-34477         102|-
--                                               ||      34478-35862          20|-
--                                               ||      35863-37247           6|-
--                                               ||      37248-38632           1|-
--                                               ||      38633-40017           1|-
--                                               ||      40018-41402           1|-
--                                               ||      41403-42787           3|-
--                                               ||      42788-44172           1|-
--                                               ||      44173-45557           1|-
--                                               ||      45558-46942           1|-
--                                               ||      46943-48327           2|-
--                                               ||      48328-49712           1|-
--                                               ||      49713-51097           0|
--                                               ||      51098-52482           0|
--                                               ||      52483-53867           0|
--                                               ||      53868-55252           0|
--                                               ||      55253-56637           1|-
--    
--
-- In sequence store './A1-1.seqStore':
--   Found 259341 reads.
--   Found 4250015130 bases (50 times coverage).
--    Histogram of corrected-trimmed reads:
--    
--    G=4250015130                       sum of  ||               length     num
--    NG         length     index       lengths  ||                range    seqs
--    ----- ------------ --------- ------------  ||  ------------------- -------
--    00010        26146     15133    425006018  ||       1238-2622        10504|-----------------------
--    00020        24129     32102    850022805  ||       2623-4007        14663|-------------------------------
--    00030        22728     50276   1275004774  ||       4008-5392        12482|---------------------------
--    00040        21607     69466   1700009119  ||       5393-6777        10469|-----------------------
--    00050        20604     89611   2125016475  ||       6778-8162         8646|-------------------
--    00060        19632    110737   2550024651  ||       8163-9547         7535|----------------
--    00070        18534    132993   2975011020  ||       9548-10932        6663|---------------
--    00080        16990    156846   3400014567  ||      10933-12317        5620|------------
--    00090        11638    185395   3825022584  ||      12318-13702        5000|-----------
--    00100         1238    259341   4250015130  ||      13703-15087        5636|------------
--    001.000x              259341   4250015130  ||      15088-16472        9735|---------------------
--                                               ||      16473-17857       17701|--------------------------------------
--                                               ||      17858-19242       25693|-------------------------------------------------------
--                                               ||      19243-20627       29869|---------------------------------------------------------------
--                                               ||      20628-22012       27114|----------------------------------------------------------
--                                               ||      22013-23397       21231|---------------------------------------------
--                                               ||      23398-24782       15269|---------------------------------
--                                               ||      24783-26167       10511|-----------------------
--                                               ||      26168-27552        7042|---------------
--                                               ||      27553-28937        4131|---------
--                                               ||      28938-30322        2286|-----
--                                               ||      30323-31707        1017|---
--                                               ||      31708-33092         383|-
--                                               ||      33093-34477         102|-
--                                               ||      34478-35862          20|-
--                                               ||      35863-37247           6|-
--                                               ||      37248-38632           1|-
--                                               ||      38633-40017           1|-
--                                               ||      40018-41402           1|-
--                                               ||      41403-42787           3|-
--                                               ||      42788-44172           1|-
--                                               ||      44173-45557           1|-
--                                               ||      45558-46942           1|-
--                                               ||      46943-48327           2|-
--                                               ||      48328-49712           1|-
--                                               ||      49713-51097           0|
--                                               ||      51098-52482           0|
--                                               ||      52483-53867           0|
--                                               ||      53868-55252           0|
--                                               ||      55253-56637           1|-
--    
--
-- Correction skipped; not enabled.
--
-- Trimming skipped; not enabled.
--
-- BEGIN ASSEMBLY
----------------------------------------
-- Starting command on Fri Jan 16 00:50:46 2026 with 4560031.484 GB free disk space

    cd unitigging/0-mercounts
    ./meryl-configure.sh \
    > ./meryl-configure.err 2>&1

-- Finished on Fri Jan 16 00:50:47 2026 (one second) with 4560031.484 GB free disk space
----------------------------------------
--  segments   memory batches
--  -------- -------- -------
--        01 10.81 GB       2
--        02  5.75 GB       2
--        04  2.97 GB       2
--        06  2.14 GB       2
--        08  1.61 GB       2
--        12  1.07 GB       2
--        16  0.81 GB       2
--        20  0.65 GB       2
--        24  0.54 GB       2
--        32  0.41 GB       2
--        40  0.32 GB       2
--        48  -.-- GB       -  (segment size too small)
--        56  -.-- GB       -  (segment size too small)
--        64  -.-- GB       -  (segment size too small)
--        96  -.-- GB       -  (segment size too small)
--
--  For 259341 reads with 4250015130 bases, limit to 42 batches.
--  Will count kmers using 01 jobs, each using 12 GB and 4 threads.
--
-- Finished stage 'merylConfigure', reset canuIteration.
--
-- Running jobs.  First attempt out of 2.
----------------------------------------
-- Starting 'meryl' concurrent execution on Fri Jan 16 00:50:47 2026 with 4560031.453 GB free disk space (1 processes; 22 concurrently)

    cd unitigging/0-mercounts
    ./meryl-count.sh 1 > ./meryl-count.000001.out 2>&1

-- Finished on Fri Jan 16 00:54:10 2026 (203 seconds) with 4559396.437 GB free disk space
----------------------------------------
-- Found 1 Kmer counting (meryl) outputs.
-- Finished stage 'utg-merylCountCheck', reset canuIteration.
--
-- Running jobs.  First attempt out of 2.
----------------------------------------
-- Starting 'meryl' concurrent execution on Fri Jan 16 00:54:10 2026 with 4559396.406 GB free disk space (1 processes; 22 concurrently)

    cd unitigging/0-mercounts
    ./meryl-process.sh 1 > ./meryl-process.000001.out 2>&1

-- Finished on Fri Jan 16 00:54:15 2026 (5 seconds) with 4559395.921 GB free disk space
----------------------------------------
-- Meryl finished successfully.  Kmer frequency histogram:
--
-- WARNING: gnuplot failed.
--
----------------------------------------
--
--  22-mers                                                                                           Fraction
--    Occurrences   NumMers                                                                         Unique Total
--       1-     1         0                                                                        0.0000 0.0000
--       2-     2    225925 *                                                                      0.0050 0.0001
--       3-     4     70677                                                                        0.0061 0.0002
--       5-     7     19415                                                                        0.0068 0.0002
--       8-    11      5483                                                                        0.0071 0.0003
--      12-    16      7809                                                                        0.0072 0.0003
--      17-    22     63398                                                                        0.0074 0.0003
--      23-    29    737073 ***                                                                    0.0095 0.0009
--      30-    37   5063716 **********************                                                 0.0312 0.0094
--      38-    46  15632999 ********************************************************************** 0.1658 0.0762
--      47-    56  14396804 ****************************************************************       0.5286 0.2958
--      57-    67   3820387 *****************                                                      0.8221 0.5081
--      68-    79    733850 ***                                                                    0.8926 0.5685
--      80-    92    948270 ****                                                                   0.9084 0.5849
--      93-   106    807976 ***                                                                    0.9297 0.6108
--     107-   121    344746 *                                                                      0.9468 0.6348
--     122-   137    296663 *                                                                      0.9542 0.6465
--     138-   154    263491 *                                                                      0.9607 0.6584
--     155-   172    171587                                                                        0.9665 0.6702
--     173-   191    161024                                                                        0.9702 0.6788
--     192-   211    136174                                                                        0.9738 0.6879
--     212-   232    100287                                                                        0.9767 0.6963
--     233-   254     97317                                                                        0.9790 0.7032
--     255-   277     80695                                                                        0.9811 0.7105
--     278-   301     75850                                                                        0.9829 0.7172
--     302-   326     71517                                                                        0.9846 0.7241
--     327-   352     56469                                                                        0.9862 0.7310
--     353-   379     51724                                                                        0.9874 0.7369
--     380-   407     42563                                                                        0.9885 0.7428
--     408-   436     33667                                                                        0.9895 0.7480
--     437-   466     29927                                                                        0.9902 0.7523
--     467-   497     25854                                                                        0.9909 0.7565
--     498-   529     26156                                                                        0.9915 0.7604
--     530-   562     21741                                                                        0.9920 0.7646
--     563-   596     19561                                                                        0.9925 0.7683
--     597-   631     17255                                                                        0.9930 0.7718
--     632-   667     16366                                                                        0.9933 0.7751
--     668-   704     16387                                                                        0.9937 0.7784
--     705-   742     13690                                                                        0.9941 0.7819
--     743-   781     13963                                                                        0.9944 0.7850
--     782-   821     13988                                                                        0.9947 0.7883
--
--           0 (max occurrences)
--  3212031402 (total mers, non-unique)
--    44958213 (distinct mers, non-unique)
--           0 (unique mers)
-- Finished stage 'meryl-process', reset canuIteration.
--
-- Removing meryl database 'unitigging/0-mercounts/A1-1.ms22'.
--
-- OVERLAPPER (normal) (assembly) erate=0.01
--
----------------------------------------
-- Starting command on Fri Jan 16 00:54:15 2026 with 4559396.968 GB free disk space

    cd unitigging/1-overlapper
    /share/org/YZWL/yzwl_lixg/miniforge3/envs/canu_v.2.3/bin/overlapInCorePartition \
     -S  ../../A1-1.seqStore \
     -hl 160000000 \
     -rl 5000000000 \
     -ol 500 \
     -o  ./A1-1.partition \
    > ./A1-1.partition.err 2>&1

-- Finished on Fri Jan 16 00:54:16 2026 (one second) with 4559396.953 GB free disk space
----------------------------------------
--
-- Configured 21 overlapInCore jobs.
-- Finished stage 'utg-overlapConfigure', reset canuIteration.
--
-- Running jobs.  First attempt out of 2.
----------------------------------------
-- Starting 'utgovl' concurrent execution on Fri Jan 16 00:54:16 2026 with 4559396.921 GB free disk space (21 processes; 11 concurrently)

    cd unitigging/1-overlapper
    ./overlap.sh 1 > ./overlap.000001.out 2>&1
    ./overlap.sh 2 > ./overlap.000002.out 2>&1
    ./overlap.sh 3 > ./overlap.000003.out 2>&1
    ./overlap.sh 4 > ./overlap.000004.out 2>&1
    ./overlap.sh 5 > ./overlap.000005.out 2>&1
    ./overlap.sh 6 > ./overlap.000006.out 2>&1
    ./overlap.sh 7 > ./overlap.000007.out 2>&1
    ./overlap.sh 8 > ./overlap.000008.out 2>&1
    ./overlap.sh 9 > ./overlap.000009.out 2>&1
    ./overlap.sh 10 > ./overlap.000010.out 2>&1
    ./overlap.sh 11 > ./overlap.000011.out 2>&1
    ./overlap.sh 12 > ./overlap.000012.out 2>&1
    ./overlap.sh 13 > ./overlap.000013.out 2>&1
    ./overlap.sh 14 > ./overlap.000014.out 2>&1
    ./overlap.sh 15 > ./overlap.000015.out 2>&1
    ./overlap.sh 16 > ./overlap.000016.out 2>&1
    ./overlap.sh 17 > ./overlap.000017.out 2>&1
    ./overlap.sh 18 > ./overlap.000018.out 2>&1
    ./overlap.sh 19 > ./overlap.000019.out 2>&1
    ./overlap.sh 20 > ./overlap.000020.out 2>&1
    ./overlap.sh 21 > ./overlap.000021.out 2>&1

-- Finished on Fri Jan 16 01:30:31 2026 (2175 seconds) with 4559606.359 GB free disk space
----------------------------------------
-- Found 21 overlapInCore output files.
--
-- overlapInCore compute 'unitigging/1-overlapper':
--   kmer hits
--     with no overlap       1370860837  87.4761905 +- 41043651.294
--     with an overlap         43318911  5.28571429 +- 1147103.217
--
--   overlaps                  43318911  5.28571429 +- 1147103.217
--     contained               10421411  .666666667 +- 273701.057
--     dovetail                32897500  7.61904762 +- 883675.236
--
--   overlaps rejected
--     multiple per pair              0           0 +- 0
--     bad short window               0           0 +- 0
--     bad long window                0           0 +- 0
-- Finished stage 'utg-overlapCheck', reset canuIteration.
----------------------------------------
-- Starting command on Fri Jan 16 01:30:31 2026 with 4559606.343 GB free disk space

    cd unitigging
    /share/org/YZWL/yzwl_lixg/miniforge3/envs/canu_v.2.3/bin/ovStoreConfig \
     -S ../A1-1.seqStore \
     -M 4-8 \
     -L ./1-overlapper/ovljob.files \
     -create ./A1-1.ovlStore.config \
     > ./A1-1.ovlStore.config.txt \
    2> ./A1-1.ovlStore.config.err

-- Finished on Fri Jan 16 01:30:31 2026 (in the blink of an eye) with 4559606.328 GB free disk space
----------------------------------------
--
-- Creating overlap store unitigging/A1-1.ovlStore using:
--      1 bucket
--      1 slice
--        using at most 3 GB memory each
--
-- Running jobs.  First attempt out of 2.
----------------------------------------
-- Starting 'ovS' concurrent execution on Fri Jan 16 01:30:31 2026 with 4559606.312 GB free disk space (1 processes; 62 concurrently)

    cd unitigging
    ./A1-1.ovlStore.sh 1 > ./A1-1.ovlStore.000001.out 2>&1

-- Finished on Fri Jan 16 01:30:49 2026 (18 seconds) with 4559629.796 GB free disk space
----------------------------------------
-- Checking store.
----------------------------------------
-- Starting command on Fri Jan 16 01:30:49 2026 with 4559629.796 GB free disk space

    cd unitigging
    /share/org/YZWL/yzwl_lixg/miniforge3/envs/canu_v.2.3/bin/ovStoreDump \
     -S ../A1-1.seqStore \
     -O  ./A1-1.ovlStore \
     -counts \
     > ./A1-1.ovlStore/counts.dat 2> ./A1-1.ovlStore/counts.err

-- Finished on Fri Jan 16 01:30:50 2026 (one second) with 4559629.765 GB free disk space
----------------------------------------
--
-- Overlap store 'unitigging/A1-1.ovlStore' successfully constructed.
-- Found 86637822 overlaps for 254672 reads; 1510125 reads have no overlaps.
--
--
-- Purged 0.861 GB in 63 overlap output files.
----------------------------------------
-- Starting command on Fri Jan 16 01:30:51 2026 with 4559629.765 GB free disk space

    cd unitigging
    /share/org/YZWL/yzwl_lixg/miniforge3/envs/canu_v.2.3/bin/ovStoreStats \
     -C 50 \
     -S ../A1-1.seqStore \
     -O  ./A1-1.ovlStore \
     -o  ./A1-1.ovlStore \
     > ./A1-1.ovlStore.summary.err 2>&1

-- Finished on Fri Jan 16 01:31:04 2026 (13 seconds) with 4559629.75 GB free disk space
----------------------------------------
--
-- Overlap store 'unitigging/A1-1.ovlStore' contains:
--
--   category            reads     %          read length        feature size or coverage  analysis
--   ----------------  -------  -------  ----------------------  ------------------------  --------------------
--   middle-missing        125    0.05    15493.21 +- 8198.50        512.01 +- 610.48     (bad trimming)
--   middle-hump            14    0.01    15016.14 +- 4058.76       7890.21 +- 5371.47    (bad trimming)
--   no-5-prime            440    0.17    13210.97 +- 5738.80       1676.58 +- 2834.16    (bad trimming)
--   no-3-prime            497    0.19    11849.04 +- 6394.31       1509.36 +- 2696.67    (bad trimming)
--   
--   low-coverage          892    0.34     9630.03 +- 5839.63          5.87 +- 3.54       (easy to assemble, potential for lower quality consensus)
--   unique             209807   80.90    12585.68 +- 5849.78         46.19 +- 8.60       (easy to assemble, perfect, yay)
--   repeat-cont         19341    7.46    10140.73 +- 5054.01       1823.55 +- 1488.60    (potential for consensus errors, no impact on assembly)
--   repeat-dove           303    0.12    20163.17 +- 1720.09        698.36 +- 890.44     (hard to assemble, likely won't assemble correctly or even at all)
--   
--   span-repeat          2944    1.14    14175.59 +- 4977.68       3038.83 +- 3786.11    (read spans a large repeat, usually easy to assemble)
--   uniq-repeat-cont    13847    5.34    12749.76 +- 4781.15                             (should be uniquely placed, low potential for consensus errors, no impact on assembly)
--   uniq-repeat-dove     2782    1.07    18909.24 +- 2599.26                             (will end contigs, potential to misassemble)
--   uniq-anchor          3680    1.42    13801.64 +- 4851.80       8139.96 +- 5123.58    (repeat read, with unique section, probable bad read)
-- Finished stage 'utg-createOverlapStore', reset canuIteration.
--
-- Loading read lengths.
-- Loading number of overlaps per read.
--
-- Configure RED for 16gb memory.
--                   Batches of at most (unlimited) reads.
--                                      500000000 bases.
--                   Expecting evidence of at most 536870912 bases per iteration.
--
--           Total                                               Reads                 Olaps Evidence
--    Job   Memory      Read Range         Reads        Bases   Memory        Olaps   Memory   Memory  (Memory in MB)
--   ---- -------- ------------------- --------- ------------ -------- ------------ -------- --------
--      1 16384.93         1-38750          5613    108862277 13289.03      2088527    23.90  1024.00
--      2 16384.52     38751-87293          7033    108878263 13291.02      1878632    21.50  1024.00
--      3 16385.09     87294-124928         5598    108902656 13293.96      1671686    19.13  1024.00
--      4 16384.03    124929-166527         5985    108808066 13282.42      2586967    29.61  1024.00
--      5 16384.15    166528-217268         7469    108933253 13297.75      1258573    14.40  1024.00
--      6 16386.32    217269-266372         7243    108807019 13282.33      2795289    31.99  1024.00
--      7 16384.53    266373-306293         5830    108746324 13274.88      3290232    37.65  1024.00
--      8 16385.62    306294-350587         6510    108940729 13298.63      1309215    14.98  1024.00
--      9 16386.30    350588-408599         8524    108823789 13284.42      2611144    29.88  1024.00
--     10 16384.79    408600-447115         5719    108806630 13282.24      2669367    30.55  1024.00
--     11 16386.11    447116-488059         6062    108906773 13294.47      1715965    19.64  1024.00
--     12 16385.02    488060-549954         9096    108778366 13278.90      2982199    34.13  1024.00
--     13 16385.82    549955-588175         5602    108908031 13294.61      1678544    19.21  1024.00
--     14 16385.41    588176-628639         5931    108824416 13284.42      2533003    28.99  1024.00
--     15 16386.11    628640-679146         7315    108961532 13301.20      1128575    12.92  1024.00
--     16 16384.83    679147-731207         7535    108798201 13281.27      2758115    31.56  1024.00
--     17 16385.92    731208-770813         5796    108780437 13279.04      3047104    34.87  1024.00
--     18 16386.23    770814-815908         6483    108900066 13293.67      1796892    20.56  1024.00
--     19 16384.85    815909-875135         8794    108754768 13276.01      3219521    36.84  1024.00
--     20 16385.74    875136-913861         5629    108787155 13279.86      2960450    33.88  1024.00
--     21 16384.98    913862-954893         6043    108890907 13292.54      1785995    20.44  1024.00
--     22 16384.73    954894-1012477        8461    108781359 13279.24      2926302    33.49  1024.00
--     23 16385.69   1012478-1050462        5633    108906687 13294.45      1681220    19.24  1024.00
--     24 16386.05   1050463-1089567        5800    108864839 13289.35      2158744    24.70  1024.00
--     25 16387.30   1089568-1136142        6740    108974896 13302.81      1091590    12.49  1024.00
--     26 16384.89   1136143-1187091        7547    108822697 13284.26      2502132    28.63  1024.00
--     27 16385.83   1187092-1225743        5656    108834418 13285.63      2464385    28.20  1024.00
--     28 16386.50   1225744-1267286        6118    108909260 13294.78      1723427    19.72  1024.00
--     29 16385.83   1267287-1322302        8159    108816969 13283.58      2643216    30.25  1024.00
--     30 16385.14   1322303-1359967        5524    108911428 13295.03      1582920    18.12  1024.00
--     31 16384.43   1359968-1398746        5772    108813307 13283.06      2567004    29.38  1024.00
--     32 16385.11   1398747-1447075        7141    108951762 13300.00      1145223    13.11  1024.00
--     33 16386.03   1447076-1494037        6867    108853143 13287.95      2278791    26.08  1024.00
--     34 16384.07   1494038-1532870        5705    108768923 13277.64      3008531    34.43  1024.00
--     35 16384.13   1532871-1575532        6285    108946187 13299.29      1121709    12.84  1024.00
--     36 16385.03   1575533-1629038        7915    108820452 13284.00      2537291    29.04  1024.00
--     37 16386.77   1629039-1667392        5611    108809869 13282.63      2808023    32.14  1024.00
--     38 16386.53   1667393-1707908        5968    108901411 13293.82      1809651    20.71  1024.00
--     39 16384.31   1707909-1762428        8266    108794505 13280.84      2750007    31.47  1024.00
--     40  3650.63   1762429-1764797         363      4733360   577.81        71661     0.82  1024.00
--   ---- -------- ------------------- --------- ------------ -------- ------------ -------- --------
--                                                 4250015130              86637822
-- Finished stage 'readErrorDetectionConfigure', reset canuIteration.
--
-- Running jobs.  First attempt out of 2.
----------------------------------------
-- Starting 'red' concurrent execution on Fri Jan 16 01:31:10 2026 with 4559630.765 GB free disk space (40 processes; 22 concurrently)

    cd unitigging/3-overlapErrorAdjustment
    ./red.sh 1 > ./red.000001.out 2>&1
    ./red.sh 2 > ./red.000002.out 2>&1
    ./red.sh 3 > ./red.000003.out 2>&1
    ./red.sh 4 > ./red.000004.out 2>&1
    ./red.sh 5 > ./red.000005.out 2>&1
    ./red.sh 6 > ./red.000006.out 2>&1
    ./red.sh 7 > ./red.000007.out 2>&1
    ./red.sh 8 > ./red.000008.out 2>&1
    ./red.sh 9 > ./red.000009.out 2>&1
    ./red.sh 10 > ./red.000010.out 2>&1
    ./red.sh 11 > ./red.000011.out 2>&1
    ./red.sh 12 > ./red.000012.out 2>&1
    ./red.sh 13 > ./red.000013.out 2>&1
    ./red.sh 14 > ./red.000014.out 2>&1
    ./red.sh 15 > ./red.000015.out 2>&1
    ./red.sh 16 > ./red.000016.out 2>&1
    ./red.sh 17 > ./red.000017.out 2>&1
    ./red.sh 18 > ./red.000018.out 2>&1
    ./red.sh 19 > ./red.000019.out 2>&1
    ./red.sh 20 > ./red.000020.out 2>&1
    ./red.sh 21 > ./red.000021.out 2>&1
    ./red.sh 22 > ./red.000022.out 2>&1
    ./red.sh 23 > ./red.000023.out 2>&1
    ./red.sh 24 > ./red.000024.out 2>&1
    ./red.sh 25 > ./red.000025.out 2>&1
    ./red.sh 26 > ./red.000026.out 2>&1
    ./red.sh 27 > ./red.000027.out 2>&1
    ./red.sh 28 > ./red.000028.out 2>&1
    ./red.sh 29 > ./red.000029.out 2>&1
    ./red.sh 30 > ./red.000030.out 2>&1
    ./red.sh 31 > ./red.000031.out 2>&1
    ./red.sh 32 > ./red.000032.out 2>&1
    ./red.sh 33 > ./red.000033.out 2>&1
    ./red.sh 34 > ./red.000034.out 2>&1
    ./red.sh 35 > ./red.000035.out 2>&1
    ./red.sh 36 > ./red.000036.out 2>&1
    ./red.sh 37 > ./red.000037.out 2>&1
    ./red.sh 38 > ./red.000038.out 2>&1
    ./red.sh 39 > ./red.000039.out 2>&1
    ./red.sh 40 > ./red.000040.out 2>&1

-- Finished on Fri Jan 16 01:44:20 2026 (790 seconds) with 4559739.437 GB free disk space
----------------------------------------
-- Found 40 read error detection output files.
-- Finished stage 'readErrorDetectionCheck', reset canuIteration.
--
-- Loading read lengths.
-- Loading number of overlaps per read.
--
-- Configure OEA for 8gb memory.
--                   Batches of at most (unlimited) reads.
--                                      300000000 bases.
--
--           Total                                               Reads                 Olaps  Adjusts
--    Job   Memory      Read Range         Reads        Bases   Memory        Olaps   Memory   Memory  (Memory in MB)
--   ---- -------- ------------------- --------- ------------ -------- ------------ -------- --------
--      1  2847.11         1-115623        16862    300002452   294.62      4450785   135.83   368.66
--      2  2939.91    115624-247990        19359    300013317   294.71      7488983   228.55   368.66
--      3  2869.82    247991-366496        17453    300017048   294.65      5193881   158.50   368.66
--      4  2918.57    366497-489193        18071    300008639   294.66      6791216   207.25   368.66
--      5  2917.45    489194-619582        19133    300019587   294.70      6752949   206.08   368.66
--      6  2917.85    619583-751940        19231    300002022   294.69      6766648   206.50   368.66
--      7  2887.75    751941-886344        19662    300012784   294.71      5779625   176.38   368.66
--      8  2940.80    886345-1014976       18871    300001381   294.68      7519030   229.46   368.66
--      9  2853.11   1014977-1125330       16227    300017499   294.61      4647557   141.83   368.66
--     10  2906.46   1125331-1248138       18081    300012427   294.67      6394055   195.13   368.66
--     11  2895.23   1248139-1371765       18285    300003570   294.66      6026429   183.91   368.66
--     12  2856.70   1371766-1496867       18408    300012066   294.68      4763353   145.37   368.66
--     13  2909.72   1496868-1622509       18529    300015835   294.68      6500323   198.37   368.66
--     14  2872.90   1622510-1734295       16593    300010139   294.62      5295976   161.62   368.66
--     15  2541.54   1734296-1764797        4576     49866364    55.70      2267012    69.18   368.66
--   ---- -------- ------------------- --------- ------------ -------- ------------ -------- --------
--                                                 4250015130              86637822
-- Finished stage 'overlapErrorAdjustmentConfigure', reset canuIteration.
--
-- Running jobs.  First attempt out of 2.
----------------------------------------
-- Starting 'oea' concurrent execution on Fri Jan 16 01:44:27 2026 with 4559739.359 GB free disk space (15 processes; 62 concurrently)

    cd unitigging/3-overlapErrorAdjustment
    ./oea.sh 1 > ./oea.000001.out 2>&1
    ./oea.sh 2 > ./oea.000002.out 2>&1
    ./oea.sh 3 > ./oea.000003.out 2>&1
    ./oea.sh 4 > ./oea.000004.out 2>&1
    ./oea.sh 5 > ./oea.000005.out 2>&1
    ./oea.sh 6 > ./oea.000006.out 2>&1
    ./oea.sh 7 > ./oea.000007.out 2>&1
    ./oea.sh 8 > ./oea.000008.out 2>&1
    ./oea.sh 9 > ./oea.000009.out 2>&1
    ./oea.sh 10 > ./oea.000010.out 2>&1
    ./oea.sh 11 > ./oea.000011.out 2>&1
    ./oea.sh 12 > ./oea.000012.out 2>&1
    ./oea.sh 13 > ./oea.000013.out 2>&1
    ./oea.sh 14 > ./oea.000014.out 2>&1
    ./oea.sh 15 > ./oea.000015.out 2>&1

-- Finished on Fri Jan 16 02:24:40 2026 (2413 seconds) with 4559482.296 GB free disk space
----------------------------------------
-- Found 15 overlap error adjustment output files.
-- Finished stage 'overlapErrorAdjustmentCheck', reset canuIteration.
----------------------------------------
-- Starting command on Fri Jan 16 02:24:40 2026 with 4559482.281 GB free disk space

    cd unitigging/3-overlapErrorAdjustment
    /share/org/YZWL/yzwl_lixg/miniforge3/envs/canu_v.2.3/bin/loadErates \
      -S ../../A1-1.seqStore \
      -O ../A1-1.ovlStore \
      -L ./oea.files \
    > ./oea.apply.err 2>&1

-- Finished on Fri Jan 16 02:24:40 2026 (lickety-split) with 4559482.093 GB free disk space
----------------------------------------
-- No report available.
-- Finished stage 'updateOverlapStore', reset canuIteration.
-- Finished stage 'unitig', reset canuIteration.
--
-- Running jobs.  First attempt out of 2.
----------------------------------------
-- Starting 'bat' concurrent execution on Fri Jan 16 02:24:40 2026 with 4559482.046 GB free disk space (1 processes; 1 concurrently)

    cd unitigging/4-unitigger
    ./unitigger.sh 1 > ./unitigger.000001.out 2>&1

-- Finished on Fri Jan 16 02:25:01 2026 (21 seconds) with 4559471.625 GB free disk space
----------------------------------------
-- Unitigger finished successfully.
--  
--  ERROR RATES
--  -----------
--                                                   --------threshold------
--  288811                       fraction error      fraction        percent
--  samples                              (1e-5)         error          error
--                   --------------------------      --------       --------
--  command line (-eg)                           ->     30.00        0.0300%
--  command line (-ef)                           ->  -----.--      ---.----%
--  command line (-eM)                           ->     30.00        0.0300%
--  mean + std.dev       0.34 +-  12 *     2.66  ->     32.27        0.0323%
--  median + mad         0.00 +-  12 *     0.00  ->      0.00        0.0000%
--  90th percentile                              ->      1.00        0.0010%  (enabled)
--  
--  BEST EDGE FILTERING
--  -------------------
--  At graph threshold 0.0300%, reads:
--    available to have edges:        44076
--    with at least one edge:         38349
--  
--  At max threshold 0.0300%, reads:  (not computed)
--    available to have edges:            0
--    with at least one edge:             0
--  
--  At tight threshold 0.0010%, reads with:
--    both edges below error threshold:     34361  (80.00% minReadsBest threshold = 30679)
--    one  edge  above error threshold:      2841
--    both edges above error threshold:      1147
--    at least one edge:                    38349
--  
--  At loose threshold 0.0300%, reads with:
--    both edges below error threshold:     38349  (80.00% minReadsBest threshold = 30679)
--    one  edge  above error threshold:         0
--    both edges above error threshold:         0
--    at least one edge:                    38349
--  
--  
--  INITIAL EDGES
--  -------- ----------------------------------------
--    210284 reads are contained
--   1520803 reads have no best edges (singleton)
--       308 reads have only one best edge (spur) 
--                147 are mutual best
--     33402 reads have two best edges 
--                679 have one mutual best edge
--              32336 have two mutual best edges
--  
--  
--  FINAL EDGES
--  -------- ----------------------------------------
--    210284 reads are contained
--   1521155 reads have no best edges (singleton)
--       192 reads have only one best edge (spur) 
--                160 are mutual best
--     33166 reads have two best edges 
--                550 have one mutual best edge
--              32336 have two mutual best edges
--  
--  
--  EDGE FILTERING
--  -------- ------------------------------------------
--         0 reads are ignored
--      9606 reads have a gap in overlap coverage
--       182 reads have lopsided best edges
-- Found, in version 1, after unitig construction:
--   contigs:      109 sequences, total length 68660047 bp (including 123 repeats of total length 2822279 bp).
--   bubbles:      117 sequences, total length 3001953 bp.
--   unassembled:  15888 sequences, total length 187065629 bp.
--
-- Contig sizes based on genome size 85mbp:
--
--            NG (bp)  LG (contigs)    sum (bp)
--         ----------  ------------  ----------
--     10     8551422             1     8551422
--     20     6474218             3    21962659
--     30     5374598             4    27337257
--     40     4359722             6    36240702
--     50     3638523             8    44003707
--     60     3314673            11    54159546
--     70     2504033            13    59732440
--     80       20044            72    68012079
--
-- Finished stage 'unitigCheck', reset canuIteration.
----------------------------------------
-- Starting command on Fri Jan 16 02:25:01 2026 with 4559471.609 GB free disk space

    cd unitigging
    /share/org/YZWL/yzwl_lixg/miniforge3/envs/canu_v.2.3/bin/utgcns \
      -S ../A1-1.seqStore \
      -T  ./A1-1.ctgStore 1 \
      -partition 0.8 1.5 0.1 \
    > ./A1-1.ctgStore/partitioning.log 2>&1

-- Finished on Fri Jan 16 02:25:10 2026 (9 seconds) with 4559470.359 GB free disk space
----------------------------------------
-- Using slow alignment for consensus (iteration '0').
-- Configured 10 consensus jobs.
-- Finished stage 'consensusConfigure', reset canuIteration.
--
-- Local: cns       12.625 GB    8 CPUs x  11 jobs   138.875 GB  88 CPUs  (consensus)
--
--
-- Running jobs.  First attempt out of 2.
----------------------------------------
-- Starting 'cns' concurrent execution on Fri Jan 16 02:25:10 2026 with 4559470.328 GB free disk space (10 processes; 11 concurrently)

    cd unitigging/5-consensus
    ./consensus.sh 1 > ./consensus.000001.out 2>&1
    ./consensus.sh 2 > ./consensus.000002.out 2>&1
    ./consensus.sh 3 > ./consensus.000003.out 2>&1
    ./consensus.sh 4 > ./consensus.000004.out 2>&1
    ./consensus.sh 5 > ./consensus.000005.out 2>&1
    ./consensus.sh 6 > ./consensus.000006.out 2>&1
    ./consensus.sh 7 > ./consensus.000007.out 2>&1
    ./consensus.sh 8 > ./consensus.000008.out 2>&1
    ./consensus.sh 9 > ./consensus.000009.out 2>&1
    ./consensus.sh 10 > ./consensus.000010.out 2>&1

-- Finished on Fri Jan 16 02:32:56 2026 (466 seconds) with 4559179.046 GB free disk space
----------------------------------------
-- Using slow alignment for consensus (iteration '1').
-- Configured 10 consensus jobs.
-- All 10 consensus jobs finished successfully.
-- Finished stage 'consensusCheck', reset canuIteration.
-- Using slow alignment for consensus (iteration '0').
-- Configured 10 consensus jobs.
----------------------------------------
-- Starting command on Fri Jan 16 02:32:56 2026 with 4559179 GB free disk space

    cd unitigging
    /share/org/YZWL/yzwl_lixg/miniforge3/envs/canu_v.2.3/bin/tgStoreLoad \
      -S ../A1-1.seqStore \
      -T  ./A1-1.ctgStore 2 \
      -L ./5-consensus/ctgcns.files \
    > ./5-consensus/ctgcns.files.ctgStoreLoad.err 2>&1

-- Finished on Fri Jan 16 02:32:57 2026 (one second) with 4559178.265 GB free disk space
----------------------------------------
----------------------------------------
-- Starting command on Fri Jan 16 02:32:57 2026 with 4559178.265 GB free disk space

    cd unitigging
    /share/org/YZWL/yzwl_lixg/miniforge3/envs/canu_v.2.3/bin/tgTigDisplay \
      -S ../A1-1.seqStore \
      -b \
      -o ../A1-1.contigs.unsorted.bam \
      -L ./5-consensus/ctgcns.files \
    > ./5-consensus/ctgcns.files.contigs.bam.err 2>&1

-- Finished on Fri Jan 16 02:35:43 2026 (166 seconds) with 4559028.937 GB free disk space
----------------------------------------
----------------------------------------
-- Starting command on Fri Jan 16 02:35:43 2026 with 4559028.937 GB free disk space

    cd .
    samtools sort \
      --write-index \
      --threads 2 \
      -o ./A1-1.contigs.bam ./A1-1.contigs.unsorted.bam \
    > ./ctgcns.bam.err 2>&1

-- Finished on Fri Jan 16 02:36:47 2026 (64 seconds) with 4559014.484 GB free disk space
----------------------------------------
-- Purging consensus output after loading to ctgStore.
-- Purged 10 .cns outputs.
----------------------------------------
-- Starting command on Fri Jan 16 02:36:47 2026 with 4559015.671 GB free disk space

    cd unitigging
    /share/org/YZWL/yzwl_lixg/miniforge3/envs/canu_v.2.3/bin/tgStoreDump \
      -S ../A1-1.seqStore \
      -T ./A1-1.ctgStore 2 \
      -sizes -s 85000000 \
    > ./A1-1.ctgStore/seqDB.v002.sizes.txt
ZERO length suplied to intervalList::add(), ignoring interval.
ZERO length suplied to intervalList::add(), ignoring interval.
ZERO length suplied to intervalList::add(), ignoring interval.

-- Finished on Fri Jan 16 02:36:48 2026 (one second) with 4559015.671 GB free disk space
----------------------------------------
-- Found, in version 2, after consensus generation:
--   contigs:      109 sequences, total length 89641411 bp (including 123 repeats of total length 4008465 bp).
--   bubbles:      117 sequences, total length 4116699 bp.
--   unassembled:  15888 sequences, total length 259896530 bp.
--
-- Contig sizes based on genome size 85mbp:
--
--            NG (bp)  LG (contigs)    sum (bp)
--         ----------  ------------  ----------
--     10    11114943             1    11114943
--     20     9017261             2    20132204
--     30     8408041             3    28540245
--     40     6973711             4    35513956
--     50     5678486             6    47134810
--     60     5385253             7    52520063
--     70     4457903             9    61715617
--     80     4322323            11    70490620
--     90     3259432            13    77753840
--    100      492816            19    85287217
--
-- Finished stage 'consensusLoad', reset canuIteration.
----------------------------------------
-- Starting command on Fri Jan 16 02:36:48 2026 with 4559015.656 GB free disk space

    cd .
    /share/org/YZWL/yzwl_lixg/miniforge3/envs/canu_v.2.3/bin/tgStoreDump \
      -S ./A1-1.seqStore \
      -T ./unitigging/A1-1.ctgStore 2 \
      -o ./A1-1.contigs \
      -layout \
    > ./A1-1.contigs.layout.err 2>&1

-- Finished on Fri Jan 16 02:36:48 2026 (in the blink of an eye) with 4559194.937 GB free disk space
----------------------------------------
----------------------------------------
-- Starting command on Fri Jan 16 02:36:48 2026 with 4559194.937 GB free disk space

    cd .
    /share/org/YZWL/yzwl_lixg/miniforge3/envs/canu_v.2.3/bin/tgStoreDump \
      -S ./A1-1.seqStore \
      -T ./unitigging/A1-1.ctgStore 2 \
      -consensus -fasta \
      -unassembled \
    > ./A1-1.unassembled.fasta
    2> ./A1-1.unassembled.err
ZERO length suplied to intervalList::add(), ignoring interval.
ZERO length suplied to intervalList::add(), ignoring interval.
ZERO length suplied to intervalList::add(), ignoring interval.

-- Finished on Fri Jan 16 02:36:49 2026 (one second) with 4559194.812 GB free disk space
----------------------------------------
----------------------------------------
-- Starting command on Fri Jan 16 02:36:49 2026 with 4559194.812 GB free disk space

    cd .
    /share/org/YZWL/yzwl_lixg/miniforge3/envs/canu_v.2.3/bin/tgStoreDump \
      -S ./A1-1.seqStore \
      -T ./unitigging/A1-1.ctgStore 2 \
      -consensus -fasta \
      -contigs \
    > ./A1-1.contigs.fasta
    2> ./A1-1.contigs.err
ZERO length suplied to intervalList::add(), ignoring interval.
ZERO length suplied to intervalList::add(), ignoring interval.
ZERO length suplied to intervalList::add(), ignoring interval.

-- Finished on Fri Jan 16 02:36:50 2026 (one second) with 4559194.703 GB free disk space
----------------------------------------
-- Finished stage 'generateOutputs', reset canuIteration.
--
-- Assembly 'A1-1' finished in '/share/org/YZWL/yzwl_lixg/project/28.大豆疫霉菌三代基因组/03.hicanu/A1-1/01.raw_output'.
--
-- Summary saved in 'A1-1.report'.
--
-- Sequences saved:
--   Contigs       -> 'A1-1.contigs.fasta'
--   Unassembled   -> 'A1-1.unassembled.fasta'
--
-- Read layouts saved:
--   Contigs       -> 'A1-1.contigs.layout'.
--
-- Bye.

2026-01-16 02:36:50.201 - WARNING - 输出文件不存在|Output file does not exist: /share/org/YZWL/yzwl_lixg/project/28.大豆疫霉菌三代基因组/03.hicanu/A1-1/01.raw_output/A1-1.unitigs.fasta
Usage: biopytools ragtag [OPTIONS]
Try 'biopytools ragtag -h' for help.

Error: Invalid value for '-r' / '--reference': 文件不存在|File does not exist: /share/org/YZWL/yzwl_lixg/project/28.大豆疫霉菌三代基因组/04.ragtag/Psoja_T2T.fa
Usage: biopytools genomesyn [OPTIONS]
Try 'biopytools genomesyn -h' for help.

Error: Invalid value for '-i' / '--ref': Path '04.ragtag/A1-1/hicanu/A1-1_RagTag_scaffolded.fa' does not exist.
Job 68886682 stderr output:

