Usage: biopytools ragtag [OPTIONS]
Try 'biopytools ragtag -h' for help.

Error: Invalid value for '-r' / '--reference': 文件不存在|File does not exist: /share/org/YZWL/yzwl_lixg/project/28.大豆疫霉菌三代基因组/04.ragtag/Psoja_T2T.fa
Usage: biopytools genomesyn [OPTIONS]
Try 'biopytools genomesyn -h' for help.

Error: Invalid value for '-i' / '--ref': Path '04.ragtag/A1-18/hifiasm/A1-18_RagTag_scaffolded.fa' does not exist.
2026-01-16 02:24:07.407 - WARNING - 命令错误输出|Command stderr:
-- canu master +27 changes (r10515 2a41e933b8de6ed66723d75d36dd071b46d2c347)
--
-- CITATIONS
--
-- For assemblies of PacBio HiFi reads:
--   Nurk S, Walenz BP, Rhiea A, Vollger MR, Logsdon GA, Grothe R, Miga KH, Eichler EE, Phillippy AM, Koren S.
--   HiCanu: accurate assembly of segmental duplications, satellites, and allelic variants from high-fidelity long reads.
--   biorXiv. 2020.
--   https://doi.org/10.1101/2020.03.14.992248
-- 
-- Read and contig alignments during correction and consensus use:
--   Šošic M, Šikic M.
--   Edlib: a C/C ++ library for fast, exact sequence alignment using edit distance.
--   Bioinformatics. 2017 May 1;33(9):1394-1395.
--   http://doi.org/10.1093/bioinformatics/btw753
-- 
-- Overlaps are generated using:
--   Berlin K, et al.
--   Assembling large genomes with single-molecule sequencing and locality-sensitive hashing.
--   Nat Biotechnol. 2015 Jun;33(6):623-30.
--   http://doi.org/10.1038/nbt.3238
-- 
--   Myers EW, et al.
--   A Whole-Genome Assembly of Drosophila.
--   Science. 2000 Mar 24;287(5461):2196-204.
--   http://doi.org/10.1126/science.287.5461.2196
-- 
-- Contig consensus sequences are generated using an algorithm derived from pbdagcon:
--   Chin CS, et al.
--   Nonhybrid, finished microbial genome assemblies from long-read SMRT sequencing data.
--   Nat Methods. 2013 Jun;10(6):563-9
--   http://doi.org/10.1038/nmeth.2474
-- 
-- CONFIGURE CANU
--
-- Detected Java(TM) Runtime Environment '17.0.15-internal' (from '/share/org/YZWL/yzwl_lixg/.local/bin/java') without -d64 support.
--
-- WARNING:
-- WARNING:  Failed to run gnuplot using command 'gnuplot'.
-- WARNING:  Plots will be disabled.
-- WARNING:
--
-- Detected samtools version '1.22' / htslib version 'htscodecs=1.6.3' (from 'samtools').
--
-- Detected 88 CPUs and 503 gigabytes of memory on the local machine.
--
-- Detected Slurm with 'sinfo' binary in /opt/skyformai/bin/sinfo.
--          Slurm disabled by useGrid=false
--
-- Detected  '' with 'pbsnodes' binary in /opt/skyformai/bin/pbsnodes.
--           disabled by useGrid=false
--
-- Detected LSF with 'bsub' binary in /opt/skyformai/bin/bsub.
--          LSF disabled by useGrid=false
--
-- Local machine mode enabled; grid support not detected or not allowed.
--
-- Found trimmed raw PacBio HiFi reads in the input files.
--
--                                (tag)Concurrency
--                         (tag)Threads          |
--                (tag)Memory         |          |
--        (tag)             |         |          |       total usage      algorithm
--        -------  ----------  --------   --------  --------------------  -----------------------------
-- Local: meryl     12.000 GB    4 CPUs x  22 jobs   264.000 GB  88 CPUs  (k-mer counting)
-- Local: cormhap   13.000 GB   11 CPUs x   8 jobs   104.000 GB  88 CPUs  (overlap detection with mhap)
-- Local: obtovl     8.000 GB    8 CPUs x  11 jobs    88.000 GB  88 CPUs  (overlap detection)
-- Local: utgovl     8.000 GB    8 CPUs x  11 jobs    88.000 GB  88 CPUs  (overlap detection)
-- Local: cor        -.--- GB    4 CPUs x   - jobs     -.--- GB   - CPUs  (read correction)
-- Local: ovb        4.000 GB    1 CPU  x  88 jobs   352.000 GB  88 CPUs  (overlap store bucketizer)
-- Local: ovs        8.000 GB    1 CPU  x  62 jobs   496.000 GB  62 CPUs  (overlap store sorting)
-- Local: red       16.000 GB    4 CPUs x  22 jobs   352.000 GB  88 CPUs  (read error detection)
-- Local: oea        8.000 GB    1 CPU  x  62 jobs   496.000 GB  62 CPUs  (overlap error adjustment)
-- Local: bat       32.000 GB    8 CPUs x   1 job     32.000 GB   8 CPUs  (contig construction with bogart)
-- Local: cns        -.--- GB    8 CPUs x   - jobs     -.--- GB   - CPUs  (consensus)
--
-- Generating assembly 'A1-18' in '/share/org/YZWL/yzwl_lixg/project/28.大豆疫霉菌三代基因组/03.hicanu/A1-18/01.raw_output':
--   genomeSize:
--     85000000
--
--   Overlap Generation Limits:
--     corOvlErrorRate 0.0000 (  0.00%)
--     obtOvlErrorRate 0.0250 (  2.50%)
--     utgOvlErrorRate 0.0100 (  1.00%)
--
--   Overlap Processing Limits:
--     corErrorRate    0.0000 (  0.00%)
--     obtErrorRate    0.0250 (  2.50%)
--     utgErrorRate    0.0003 (  0.03%)
--     cnsErrorRate    0.0500 (  5.00%)
--
--   Stages to run:
--     assemble HiFi reads.
--
--
-- BEGIN STORE CREATION
----------------------------------------
-- Starting command on Fri Jan 16 00:27:35 2026 with 4563809.937 GB free disk space

    cd .
    ./A1-18.seqStore.sh \
    > ./A1-18.seqStore.err 2>&1

-- Finished on Fri Jan 16 00:34:48 2026 (433 seconds) with 4562660.578 GB free disk space
----------------------------------------
--
-- In sequence store './A1-18.seqStore':
--   Found 249984 reads.
--   Found 4250003984 bases (50 times coverage).
--    Histogram of corrected reads:
--    
--    G=4250003984                       sum of  ||               length     num
--    NG         length     index       lengths  ||                range    seqs
--    ----- ------------ --------- ------------  ||  ------------------- -------
--    00010        26864     14723    425023822  ||       1237-2441         7555|----------------------
--    00020        24832     31224    850001291  ||       2442-3646        11097|--------------------------------
--    00030        23401     48875   1275002912  ||       3647-4851         9760|----------------------------
--    00040        22216     67522   1700020743  ||       4852-6056         8420|------------------------
--    00050        21120     87144   2125005746  ||       6057-7261         7202|---------------------
--    00060        19980    107822   2550014244  ||       7262-8466         6256|------------------
--    00070        18693    129789   2975012166  ||       8467-9671         5571|----------------
--    00080        16927    153591   3400015357  ||       9672-10876        5032|---------------
--    00090        12838    181480   3825009562  ||      10877-12081        4693|--------------
--    00100         1237    249984   4250003984  ||      12082-13286        4771|--------------
--    001.000x              249984   4250003984  ||      13287-14491        6136|------------------
--                                               ||      14492-15696        8182|------------------------
--                                               ||      15697-16901       11442|---------------------------------
--                                               ||      16902-18106       15344|--------------------------------------------
--                                               ||      18107-19311       19048|-------------------------------------------------------
--                                               ||      19312-20516       21280|-------------------------------------------------------------
--                                               ||      20517-21721       22134|---------------------------------------------------------------
--                                               ||      21722-22926       20109|----------------------------------------------------------
--                                               ||      22927-24131       16796|------------------------------------------------
--                                               ||      24132-25336       12913|-------------------------------------
--                                               ||      25337-26541        9483|---------------------------
--                                               ||      26542-27746        6573|-------------------
--                                               ||      27747-28951        4504|-------------
--                                               ||      28952-30156        2775|--------
--                                               ||      30157-31361        1552|-----
--                                               ||      31362-32566         797|---
--                                               ||      32567-33771         369|--
--                                               ||      33772-34976         144|-
--                                               ||      34977-36181          30|-
--                                               ||      36182-37386          10|-
--                                               ||      37387-38591           3|-
--                                               ||      38592-39796           1|-
--                                               ||      39797-41001           0|
--                                               ||      41002-42206           0|
--                                               ||      42207-43411           0|
--                                               ||      43412-44616           0|
--                                               ||      44617-45821           0|
--                                               ||      45822-47026           1|-
--                                               ||      47027-48231           0|
--                                               ||      48232-49436           1|-
--    
--
-- In sequence store './A1-18.seqStore':
--   Found 249984 reads.
--   Found 4250003984 bases (50 times coverage).
--    Histogram of corrected-trimmed reads:
--    
--    G=4250003984                       sum of  ||               length     num
--    NG         length     index       lengths  ||                range    seqs
--    ----- ------------ --------- ------------  ||  ------------------- -------
--    00010        26864     14723    425023822  ||       1237-2441         7555|----------------------
--    00020        24832     31224    850001291  ||       2442-3646        11097|--------------------------------
--    00030        23401     48875   1275002912  ||       3647-4851         9760|----------------------------
--    00040        22216     67522   1700020743  ||       4852-6056         8420|------------------------
--    00050        21120     87144   2125005746  ||       6057-7261         7202|---------------------
--    00060        19980    107822   2550014244  ||       7262-8466         6256|------------------
--    00070        18693    129789   2975012166  ||       8467-9671         5571|----------------
--    00080        16927    153591   3400015357  ||       9672-10876        5032|---------------
--    00090        12838    181480   3825009562  ||      10877-12081        4693|--------------
--    00100         1237    249984   4250003984  ||      12082-13286        4771|--------------
--    001.000x              249984   4250003984  ||      13287-14491        6136|------------------
--                                               ||      14492-15696        8182|------------------------
--                                               ||      15697-16901       11442|---------------------------------
--                                               ||      16902-18106       15344|--------------------------------------------
--                                               ||      18107-19311       19048|-------------------------------------------------------
--                                               ||      19312-20516       21280|-------------------------------------------------------------
--                                               ||      20517-21721       22134|---------------------------------------------------------------
--                                               ||      21722-22926       20109|----------------------------------------------------------
--                                               ||      22927-24131       16796|------------------------------------------------
--                                               ||      24132-25336       12913|-------------------------------------
--                                               ||      25337-26541        9483|---------------------------
--                                               ||      26542-27746        6573|-------------------
--                                               ||      27747-28951        4504|-------------
--                                               ||      28952-30156        2775|--------
--                                               ||      30157-31361        1552|-----
--                                               ||      31362-32566         797|---
--                                               ||      32567-33771         369|--
--                                               ||      33772-34976         144|-
--                                               ||      34977-36181          30|-
--                                               ||      36182-37386          10|-
--                                               ||      37387-38591           3|-
--                                               ||      38592-39796           1|-
--                                               ||      39797-41001           0|
--                                               ||      41002-42206           0|
--                                               ||      42207-43411           0|
--                                               ||      43412-44616           0|
--                                               ||      44617-45821           0|
--                                               ||      45822-47026           1|-
--                                               ||      47027-48231           0|
--                                               ||      48232-49436           1|-
--    
--
-- Correction skipped; not enabled.
--
-- Trimming skipped; not enabled.
--
-- BEGIN ASSEMBLY
----------------------------------------
-- Starting command on Fri Jan 16 00:34:48 2026 with 4562660.531 GB free disk space

    cd unitigging/0-mercounts
    ./meryl-configure.sh \
    > ./meryl-configure.err 2>&1

-- Finished on Fri Jan 16 00:34:49 2026 (one second) with 4562660.531 GB free disk space
----------------------------------------
--  segments   memory batches
--  -------- -------- -------
--        01 10.81 GB       2
--        02  5.61 GB       2
--        04  2.97 GB       2
--        06  2.14 GB       2
--        08  1.61 GB       2
--        12  1.07 GB       2
--        16  0.81 GB       2
--        20  0.65 GB       2
--        24  0.54 GB       2
--        32  0.41 GB       2
--        40  0.32 GB       2
--        48  -.-- GB       -  (segment size too small)
--        56  -.-- GB       -  (segment size too small)
--        64  -.-- GB       -  (segment size too small)
--        96  -.-- GB       -  (segment size too small)
--
--  For 249984 reads with 4250003984 bases, limit to 42 batches.
--  Will count kmers using 01 jobs, each using 12 GB and 4 threads.
--
-- Finished stage 'merylConfigure', reset canuIteration.
--
-- Running jobs.  First attempt out of 2.
----------------------------------------
-- Starting 'meryl' concurrent execution on Fri Jan 16 00:34:49 2026 with 4562660.5 GB free disk space (1 processes; 22 concurrently)

    cd unitigging/0-mercounts
    ./meryl-count.sh 1 > ./meryl-count.000001.out 2>&1

-- Finished on Fri Jan 16 00:38:18 2026 (209 seconds) with 4562313.859 GB free disk space
----------------------------------------
-- Found 1 Kmer counting (meryl) outputs.
-- Finished stage 'utg-merylCountCheck', reset canuIteration.
--
-- Running jobs.  First attempt out of 2.
----------------------------------------
-- Starting 'meryl' concurrent execution on Fri Jan 16 00:38:18 2026 with 4562313.828 GB free disk space (1 processes; 22 concurrently)

    cd unitigging/0-mercounts
    ./meryl-process.sh 1 > ./meryl-process.000001.out 2>&1

-- Finished on Fri Jan 16 00:38:24 2026 (6 seconds) with 4562314.421 GB free disk space
----------------------------------------
-- Meryl finished successfully.  Kmer frequency histogram:
--
-- WARNING: gnuplot failed.
--
----------------------------------------
--
--  22-mers                                                                                           Fraction
--    Occurrences   NumMers                                                                         Unique Total
--       1-     1         0                                                                        0.0000 0.0000
--       2-     2    247047 *                                                                      0.0055 0.0002
--       3-     4     73266                                                                        0.0067 0.0002
--       5-     7     19592                                                                        0.0073 0.0003
--       8-    11     10345                                                                        0.0076 0.0003
--      12-    16     26327                                                                        0.0079 0.0003
--      17-    22    134707                                                                        0.0086 0.0005
--      23-    29    872075 ***                                                                    0.0124 0.0016
--      30-    37   5265690 ***********************                                                0.0368 0.0111
--      38-    46  15377511 ********************************************************************** 0.1761 0.0803
--      47-    56  14354152 *****************************************************************      0.5304 0.2948
--      57-    67   3778541 *****************                                                      0.8233 0.5069
--      68-    79    673779 ***                                                                    0.8930 0.5667
--      80-    92    963758 ****                                                                   0.9073 0.5815
--      93-   106    862324 ***                                                                    0.9292 0.6084
--     107-   121    323369 *                                                                      0.9473 0.6336
--     122-   137    296841 *                                                                      0.9540 0.6443
--     138-   154    278251 *                                                                      0.9607 0.6565
--     155-   172    163407                                                                        0.9667 0.6688
--     173-   191    154449                                                                        0.9703 0.6770
--     192-   211    117637                                                                        0.9737 0.6857
--     212-   232     98380                                                                        0.9762 0.6930
--     233-   254     94332                                                                        0.9784 0.6997
--     255-   277     95839                                                                        0.9805 0.7069
--     278-   301     74237                                                                        0.9826 0.7148
--     302-   326     74760                                                                        0.9842 0.7215
--     327-   352     57529                                                                        0.9859 0.7287
--     353-   379     48198                                                                        0.9871 0.7347
--     380-   407     38534                                                                        0.9882 0.7402
--     408-   436     35620                                                                        0.9891 0.7449
--     437-   466     35309                                                                        0.9898 0.7495
--     467-   497     29963                                                                        0.9906 0.7545
--     498-   529     28700                                                                        0.9913 0.7589
--     530-   562     24235                                                                        0.9919 0.7636
--     563-   596     20773                                                                        0.9925 0.7676
--     597-   631     20779                                                                        0.9929 0.7713
--     632-   667     16979                                                                        0.9934 0.7753
--     668-   704     14515                                                                        0.9937 0.7787
--     705-   742     13299                                                                        0.9941 0.7818
--     743-   781     11832                                                                        0.9944 0.7848
--     782-   821     12545                                                                        0.9946 0.7876
--
--           0 (max occurrences)
--  3216703689 (total mers, non-unique)
--    45069656 (distinct mers, non-unique)
--           0 (unique mers)
-- Finished stage 'meryl-process', reset canuIteration.
--
-- Removing meryl database 'unitigging/0-mercounts/A1-18.ms22'.
--
-- OVERLAPPER (normal) (assembly) erate=0.01
--
----------------------------------------
-- Starting command on Fri Jan 16 00:38:25 2026 with 4562314.406 GB free disk space

    cd unitigging/1-overlapper
    /share/org/YZWL/yzwl_lixg/miniforge3/envs/canu_v.2.3/bin/overlapInCorePartition \
     -S  ../../A1-18.seqStore \
     -hl 160000000 \
     -rl 5000000000 \
     -ol 500 \
     -o  ./A1-18.partition \
    > ./A1-18.partition.err 2>&1

-- Finished on Fri Jan 16 00:38:25 2026 (lickety-split) with 4562314.39 GB free disk space
----------------------------------------
--
-- Configured 21 overlapInCore jobs.
-- Finished stage 'utg-overlapConfigure', reset canuIteration.
--
-- Running jobs.  First attempt out of 2.
----------------------------------------
-- Starting 'utgovl' concurrent execution on Fri Jan 16 00:38:25 2026 with 4562314.359 GB free disk space (21 processes; 11 concurrently)

    cd unitigging/1-overlapper
    ./overlap.sh 1 > ./overlap.000001.out 2>&1
    ./overlap.sh 2 > ./overlap.000002.out 2>&1
    ./overlap.sh 3 > ./overlap.000003.out 2>&1
    ./overlap.sh 4 > ./overlap.000004.out 2>&1
    ./overlap.sh 5 > ./overlap.000005.out 2>&1
    ./overlap.sh 6 > ./overlap.000006.out 2>&1
    ./overlap.sh 7 > ./overlap.000007.out 2>&1
    ./overlap.sh 8 > ./overlap.000008.out 2>&1
    ./overlap.sh 9 > ./overlap.000009.out 2>&1
    ./overlap.sh 10 > ./overlap.000010.out 2>&1
    ./overlap.sh 11 > ./overlap.000011.out 2>&1
    ./overlap.sh 12 > ./overlap.000012.out 2>&1
    ./overlap.sh 13 > ./overlap.000013.out 2>&1
    ./overlap.sh 14 > ./overlap.000014.out 2>&1
    ./overlap.sh 15 > ./overlap.000015.out 2>&1
    ./overlap.sh 16 > ./overlap.000016.out 2>&1
    ./overlap.sh 17 > ./overlap.000017.out 2>&1
    ./overlap.sh 18 > ./overlap.000018.out 2>&1
    ./overlap.sh 19 > ./overlap.000019.out 2>&1
    ./overlap.sh 20 > ./overlap.000020.out 2>&1
    ./overlap.sh 21 > ./overlap.000021.out 2>&1

-- Finished on Fri Jan 16 01:08:27 2026 (1802 seconds) with 4557799.609 GB free disk space
----------------------------------------
-- Found 21 overlapInCore output files.
--
-- overlapInCore compute 'unitigging/1-overlapper':
--   kmer hits
--     with no overlap       1326945257  69.3809524 +- 39415855.709
--     with an overlap         32975066  1.23809524 +- 900697.611
--
--   overlaps                  32975066  1.23809524 +- 900697.611
--     contained                7997133  .857142857 +- 217327.635
--     dovetail                24977933  5.38095238 +- 690537.07
--
--   overlaps rejected
--     multiple per pair              0           0 +- 0
--     bad short window               0           0 +- 0
--     bad long window                0           0 +- 0
-- Finished stage 'utg-overlapCheck', reset canuIteration.
----------------------------------------
-- Starting command on Fri Jan 16 01:08:27 2026 with 4557799.593 GB free disk space

    cd unitigging
    /share/org/YZWL/yzwl_lixg/miniforge3/envs/canu_v.2.3/bin/ovStoreConfig \
     -S ../A1-18.seqStore \
     -M 4-8 \
     -L ./1-overlapper/ovljob.files \
     -create ./A1-18.ovlStore.config \
     > ./A1-18.ovlStore.config.txt \
    2> ./A1-18.ovlStore.config.err

-- Finished on Fri Jan 16 01:08:27 2026 (in the blink of an eye) with 4557799.578 GB free disk space
----------------------------------------
--
-- Creating overlap store unitigging/A1-18.ovlStore using:
--      1 bucket
--      1 slice
--        using at most 3 GB memory each
--
-- Running jobs.  First attempt out of 2.
----------------------------------------
-- Starting 'ovS' concurrent execution on Fri Jan 16 01:08:27 2026 with 4557799.562 GB free disk space (1 processes; 62 concurrently)

    cd unitigging
    ./A1-18.ovlStore.sh 1 > ./A1-18.ovlStore.000001.out 2>&1

-- Finished on Fri Jan 16 01:08:41 2026 (14 seconds) with 4557798.14 GB free disk space
----------------------------------------
-- Checking store.
----------------------------------------
-- Starting command on Fri Jan 16 01:08:41 2026 with 4557798.14 GB free disk space

    cd unitigging
    /share/org/YZWL/yzwl_lixg/miniforge3/envs/canu_v.2.3/bin/ovStoreDump \
     -S ../A1-18.seqStore \
     -O  ./A1-18.ovlStore \
     -counts \
     > ./A1-18.ovlStore/counts.dat 2> ./A1-18.ovlStore/counts.err

-- Finished on Fri Jan 16 01:08:41 2026 (lickety-split) with 4557798.109 GB free disk space
----------------------------------------
--
-- Overlap store 'unitigging/A1-18.ovlStore' successfully constructed.
-- Found 65950132 overlaps for 244752 reads; 1416573 reads have no overlaps.
--
--
-- Purged 0.689 GB in 63 overlap output files.
----------------------------------------
-- Starting command on Fri Jan 16 01:08:42 2026 with 4557798.109 GB free disk space

    cd unitigging
    /share/org/YZWL/yzwl_lixg/miniforge3/envs/canu_v.2.3/bin/ovStoreStats \
     -C 50 \
     -S ../A1-18.seqStore \
     -O  ./A1-18.ovlStore \
     -o  ./A1-18.ovlStore \
     > ./A1-18.ovlStore.summary.err 2>&1

-- Finished on Fri Jan 16 01:08:52 2026 (10 seconds) with 4557798.078 GB free disk space
----------------------------------------
--
-- Overlap store 'unitigging/A1-18.ovlStore' contains:
--
--   category            reads     %          read length        feature size or coverage  analysis
--   ----------------  -------  -------  ----------------------  ------------------------  --------------------
--   middle-missing        173    0.07    15205.79 +- 5507.91       1272.89 +- 1655.90    (bad trimming)
--   middle-hump            17    0.01    15772.88 +- 4259.31       5642.94 +- 3872.15    (bad trimming)
--   no-5-prime            512    0.20    13803.43 +- 5415.31       1549.77 +- 2793.62    (bad trimming)
--   no-3-prime            563    0.23    11743.83 +- 6573.26       1654.15 +- 2843.22    (bad trimming)
--   
--   low-coverage         1097    0.44    10626.95 +- 5897.93          5.89 +- 3.67       (easy to assemble, potential for lower quality consensus)
--   unique             202699   81.08    13061.75 +- 5865.18         45.86 +- 8.64       (easy to assemble, perfect, yay)
--   repeat-cont         17581    7.03    10746.16 +- 5305.60       1413.04 +- 992.09     (potential for consensus errors, no impact on assembly)
--   repeat-dove           247    0.10    20444.57 +- 2042.92        765.44 +- 777.07     (hard to assemble, likely won't assemble correctly or even at all)
--   
--   span-repeat          2380    0.95    14624.72 +- 5086.05       3038.90 +- 3699.44    (read spans a large repeat, usually easy to assemble)
--   uniq-repeat-cont    13127    5.25    13153.69 +- 4706.53                             (should be uniquely placed, low potential for consensus errors, no impact on assembly)
--   uniq-repeat-dove     2924    1.17    19356.91 +- 2657.61                             (will end contigs, potential to misassemble)
--   uniq-anchor          3432    1.37    14128.57 +- 4754.66       8290.98 +- 5114.68    (repeat read, with unique section, probable bad read)
-- Finished stage 'utg-createOverlapStore', reset canuIteration.
--
-- Loading read lengths.
-- Loading number of overlaps per read.
--
-- Configure RED for 16gb memory.
--                   Batches of at most (unlimited) reads.
--                                      500000000 bases.
--                   Expecting evidence of at most 536870912 bases per iteration.
--
--           Total                                               Reads                 Olaps Evidence
--    Job   Memory      Read Range         Reads        Bases   Memory        Olaps   Memory   Memory  (Memory in MB)
--   ---- -------- ------------------- --------- ------------ -------- ------------ -------- --------
--      1 16386.14         1-36549          5473    108955099 13300.36      1204268    13.78  1024.00
--      2 16384.11     36550-76410          6086    108918478 13295.90      1416481    16.21  1024.00
--      3 16385.41     76411-120616         6591    108927523 13297.02      1432218    16.39  1024.00
--      4 16385.76    120617-159359         5723    108881975 13291.44      1950656    22.32  1024.00
--      5 16385.27    159360-201871         6358    108916376 13295.66      1539282    17.62  1024.00
--      6 16384.92    201872-255628         8224    108858938 13288.70      2116440    24.22  1024.00
--      7 16385.65    255629-293358         5561    108883862 13291.66      1921620    21.99  1024.00
--      8 16384.26    293359-332213         5972    108902767 13293.98      1597332    18.28  1024.00
--      9 16384.73    332214-388912         8532    108864414 13289.38      2040446    23.35  1024.00
--     10 16385.81    388913-424164         5398    108965323 13301.60      1066953    12.21  1024.00
--     11 16385.89    424165-460992         5752    108869944 13289.97      2090217    23.92  1024.00
--     12 16384.21    460993-506772         6802    108971593 13302.41       856418     9.80  1024.00
--     13 16386.27    506773-553141         7101    108888629 13292.29      1920784    21.98  1024.00
--     14 16385.47    553142-590272         5616    108889458 13292.35      1845586    21.12  1024.00
--     15 16386.37    590273-630396         6077    108914558 13295.43      1655617    18.95  1024.00
--     16 16384.87    630397-683512         7977    108856397 13288.39      2139197    24.48  1024.00
--     17 16385.86    683513-720553         5510    108894959 13293.02      1821244    20.84  1024.00
--     18 16384.49    720554-759729         5870    108913330 13295.27      1504921    17.22  1024.00
--     19 16384.82    759730-814693         8261    108868391 13289.86      2006749    22.97  1024.00
--     20 16384.84    814694-852623         5530    108945686 13299.21      1191304    13.63  1024.00
--     21 16384.50    852624-889567         5645    108855517 13288.20      2122605    24.29  1024.00
--     22 16385.56    889568-934659         6705    108984345 13303.96       838579     9.60  1024.00
--     23 16386.29    934660-981501         7141    108888303 13292.25      1925160    22.03  1024.00
--     24 16385.76    981502-1019174        5623    108878728 13291.04      1985953    22.73  1024.00
--     25 16384.98   1019175-1061117        6241    108912258 13295.15      1558171    17.83  1024.00
--     26 16386.76   1061118-1114226        7856    108876066 13290.78      2094981    23.98  1024.00
--     27 16385.45   1114227-1150563        5448    108895343 13293.06      1781888    20.39  1024.00
--     28 16386.09   1150564-1189729        5828    108927182 13296.96      1497380    17.14  1024.00
--     29 16385.90   1189730-1242742        8032    108876262 13290.81      2017585    23.09  1024.00
--     30 16386.31   1242743-1278157        5329    108964328 13301.48      1121773    12.84  1024.00
--     31 16384.81   1278158-1315688        5558    108865973 13289.48      2038955    23.33  1024.00
--     32 16385.22   1315689-1358020        6517    108983795 13303.89       815361     9.33  1024.00
--     33 16385.05   1358021-1401936        6694    108886429 13292.01      1838315    21.04  1024.00
--     34 16386.18   1401937-1438868        5591    108895281 13293.06      1845473    21.12  1024.00
--     35 16386.25   1438869-1478418        5979    108921738 13296.30      1568647    17.95  1024.00
--     36 16385.90   1478419-1529424        7658    108864123 13289.32      2148395    24.59  1024.00
--     37 16385.74   1529425-1566647        5476    108908930 13294.72      1662133    19.02  1024.00
--     38 16386.12   1566648-1605825        5876    108922853 13296.43      1545950    17.69  1024.00
--     39 16386.84   1605826-1660056        8175    108867258 13289.72      2194825    25.12  1024.00
--     40  3407.02   1660057-1661325         198      2741572   334.67        30270     0.35  1024.00
--   ---- -------- ------------------- --------- ------------ -------- ------------ -------- --------
--                                                 4250003984              65950132
-- Finished stage 'readErrorDetectionConfigure', reset canuIteration.
--
-- Running jobs.  First attempt out of 2.
----------------------------------------
-- Starting 'red' concurrent execution on Fri Jan 16 01:08:58 2026 with 4557798.031 GB free disk space (40 processes; 22 concurrently)

    cd unitigging/3-overlapErrorAdjustment
    ./red.sh 1 > ./red.000001.out 2>&1
    ./red.sh 2 > ./red.000002.out 2>&1
    ./red.sh 3 > ./red.000003.out 2>&1
    ./red.sh 4 > ./red.000004.out 2>&1
    ./red.sh 5 > ./red.000005.out 2>&1
    ./red.sh 6 > ./red.000006.out 2>&1
    ./red.sh 7 > ./red.000007.out 2>&1
    ./red.sh 8 > ./red.000008.out 2>&1
    ./red.sh 9 > ./red.000009.out 2>&1
    ./red.sh 10 > ./red.000010.out 2>&1
    ./red.sh 11 > ./red.000011.out 2>&1
    ./red.sh 12 > ./red.000012.out 2>&1
    ./red.sh 13 > ./red.000013.out 2>&1
    ./red.sh 14 > ./red.000014.out 2>&1
    ./red.sh 15 > ./red.000015.out 2>&1
    ./red.sh 16 > ./red.000016.out 2>&1
    ./red.sh 17 > ./red.000017.out 2>&1
    ./red.sh 18 > ./red.000018.out 2>&1
    ./red.sh 19 > ./red.000019.out 2>&1
    ./red.sh 20 > ./red.000020.out 2>&1
    ./red.sh 21 > ./red.000021.out 2>&1
    ./red.sh 22 > ./red.000022.out 2>&1
    ./red.sh 23 > ./red.000023.out 2>&1
    ./red.sh 24 > ./red.000024.out 2>&1
    ./red.sh 25 > ./red.000025.out 2>&1
    ./red.sh 26 > ./red.000026.out 2>&1
    ./red.sh 27 > ./red.000027.out 2>&1
    ./red.sh 28 > ./red.000028.out 2>&1
    ./red.sh 29 > ./red.000029.out 2>&1
    ./red.sh 30 > ./red.000030.out 2>&1
    ./red.sh 31 > ./red.000031.out 2>&1
    ./red.sh 32 > ./red.000032.out 2>&1
    ./red.sh 33 > ./red.000033.out 2>&1
    ./red.sh 34 > ./red.000034.out 2>&1
    ./red.sh 35 > ./red.000035.out 2>&1
    ./red.sh 36 > ./red.000036.out 2>&1
    ./red.sh 37 > ./red.000037.out 2>&1
    ./red.sh 38 > ./red.000038.out 2>&1
    ./red.sh 39 > ./red.000039.out 2>&1
    ./red.sh 40 > ./red.000040.out 2>&1

-- Finished on Fri Jan 16 01:24:34 2026 (936 seconds) with 4558910.687 GB free disk space
----------------------------------------
-- Found 40 read error detection output files.
-- Finished stage 'readErrorDetectionCheck', reset canuIteration.
--
-- Loading read lengths.
-- Loading number of overlaps per read.
--
-- Configure OEA for 8gb memory.
--                   Batches of at most (unlimited) reads.
--                                      300000000 bases.
--
--           Total                                               Reads                 Olaps  Adjusts
--    Job   Memory      Read Range         Reads        Bases   Memory        Olaps   Memory   Memory  (Memory in MB)
--   ---- -------- ------------------- --------- ------------ -------- ------------ -------- --------
--      1  2827.99         1-111778        16805    300021819   294.64      3908985   119.29   366.06
--      2  2857.24    111779-234184        18382    300005237   294.67      4866426   148.51   366.06
--      3  2848.37    234185-344006        16587    300004871   294.61      4577607   139.70   366.06
--      4  2862.32    344007-461778        18010    300007623   294.66      5033141   153.60   366.06
--      5  2843.99    461779-581709        18106    300022226   294.68      4431916   135.25   366.06
--      6  2839.75    581710-702839        18250    300014075   294.67      4292908   131.01   366.06
--      7  2867.50    702840-826063        18389    300006393   294.67      5202418   158.77   366.06
--      8  2830.93    826064-937022        16618    300000522   294.61      4006110   122.26   366.06
--      9  2870.36    937023-1051686       17208    300011605   294.64      5297197   161.66   366.06
--     10  2859.64   1051687-1171427       17846    300008742   294.66      4945534   150.93   366.06
--     11  2846.61   1171428-1289129       17720    300010034   294.65      4518451   137.89   366.06
--     12  2827.89   1289130-1403962       17421    300019002   294.65      3905102   119.17   366.06
--     13  2873.73   1403963-1522768       17917    300009262   294.66      5407144   165.01   366.06
--     14  2824.04   1522769-1631377       16216    300011482   294.61      3780372   115.37   366.06
--     15  2523.97   1631378-1661325        4509     49851091    55.68      1776821    54.22   366.06
--   ---- -------- ------------------- --------- ------------ -------- ------------ -------- --------
--                                                 4250003984              65950132
-- Finished stage 'overlapErrorAdjustmentConfigure', reset canuIteration.
--
-- Running jobs.  First attempt out of 2.
----------------------------------------
-- Starting 'oea' concurrent execution on Fri Jan 16 01:24:40 2026 with 4558910.609 GB free disk space (15 processes; 62 concurrently)

    cd unitigging/3-overlapErrorAdjustment
    ./oea.sh 1 > ./oea.000001.out 2>&1
    ./oea.sh 2 > ./oea.000002.out 2>&1
    ./oea.sh 3 > ./oea.000003.out 2>&1
    ./oea.sh 4 > ./oea.000004.out 2>&1
    ./oea.sh 5 > ./oea.000005.out 2>&1
    ./oea.sh 6 > ./oea.000006.out 2>&1
    ./oea.sh 7 > ./oea.000007.out 2>&1
    ./oea.sh 8 > ./oea.000008.out 2>&1
    ./oea.sh 9 > ./oea.000009.out 2>&1
    ./oea.sh 10 > ./oea.000010.out 2>&1
    ./oea.sh 11 > ./oea.000011.out 2>&1
    ./oea.sh 12 > ./oea.000012.out 2>&1
    ./oea.sh 13 > ./oea.000013.out 2>&1
    ./oea.sh 14 > ./oea.000014.out 2>&1
    ./oea.sh 15 > ./oea.000015.out 2>&1

-- Finished on Fri Jan 16 02:11:43 2026 (2823 seconds) with 4559030.156 GB free disk space
----------------------------------------
-- Found 15 overlap error adjustment output files.
-- Finished stage 'overlapErrorAdjustmentCheck', reset canuIteration.
----------------------------------------
-- Starting command on Fri Jan 16 02:11:43 2026 with 4559030.14 GB free disk space

    cd unitigging/3-overlapErrorAdjustment
    /share/org/YZWL/yzwl_lixg/miniforge3/envs/canu_v.2.3/bin/loadErates \
      -S ../../A1-18.seqStore \
      -O ../A1-18.ovlStore \
      -L ./oea.files \
    > ./oea.apply.err 2>&1

-- Finished on Fri Jan 16 02:11:44 2026 (one second) with 4559030 GB free disk space
----------------------------------------
-- No report available.
-- Finished stage 'updateOverlapStore', reset canuIteration.
-- Finished stage 'unitig', reset canuIteration.
--
-- Running jobs.  First attempt out of 2.
----------------------------------------
-- Starting 'bat' concurrent execution on Fri Jan 16 02:11:44 2026 with 4559029.953 GB free disk space (1 processes; 1 concurrently)

    cd unitigging/4-unitigger
    ./unitigger.sh 1 > ./unitigger.000001.out 2>&1

-- Finished on Fri Jan 16 02:12:02 2026 (18 seconds) with 4558965.828 GB free disk space
----------------------------------------
-- Unitigger finished successfully.
--  
--  ERROR RATES
--  -----------
--                                                   --------threshold------
--  278316                       fraction error      fraction        percent
--  samples                              (1e-5)         error          error
--                   --------------------------      --------       --------
--  command line (-eg)                           ->     30.00        0.0300%
--  command line (-ef)                           ->  -----.--      ---.----%
--  command line (-eM)                           ->     30.00        0.0300%
--  mean + std.dev       0.36 +-  12 *     2.73  ->     33.11        0.0331%
--  median + mad         0.00 +-  12 *     0.00  ->      0.00        0.0000%
--  90th percentile                              ->      1.00        0.0010%  (enabled)
--  
--  BEST EDGE FILTERING
--  -------------------
--  At graph threshold 0.0300%, reads:
--    available to have edges:        45252
--    with at least one edge:         38496
--  
--  At max threshold 0.0300%, reads:  (not computed)
--    available to have edges:            0
--    with at least one edge:             0
--  
--  At tight threshold 0.0010%, reads with:
--    both edges below error threshold:     33992  (80.00% minReadsBest threshold = 30796)
--    one  edge  above error threshold:      3296
--    both edges above error threshold:      1208
--    at least one edge:                    38496
--  
--  At loose threshold 0.0300%, reads with:
--    both edges below error threshold:     38496  (80.00% minReadsBest threshold = 30796)
--    one  edge  above error threshold:         0
--    both edges above error threshold:         0
--    at least one edge:                    38496
--  
--  
--  INITIAL EDGES
--  -------- ----------------------------------------
--    199725 reads are contained
--   1427630 reads have no best edges (singleton)
--       258 reads have only one best edge (spur) 
--                132 are mutual best
--     33712 reads have two best edges 
--                846 have one mutual best edge
--              32490 have two mutual best edges
--  
--  
--  FINAL EDGES
--  -------- ----------------------------------------
--    199725 reads are contained
--   1427934 reads have no best edges (singleton)
--       164 reads have only one best edge (spur) 
--                139 are mutual best
--     33502 reads have two best edges 
--                723 have one mutual best edge
--              32481 have two mutual best edges
--  
--  
--  EDGE FILTERING
--  -------- ------------------------------------------
--         0 reads are ignored
--      9537 reads have a gap in overlap coverage
--       140 reads have lopsided best edges
-- Found, in version 1, after unitig construction:
--   contigs:      114 sequences, total length 69117066 bp (including 166 repeats of total length 5004859 bp).
--   bubbles:      212 sequences, total length 8994242 bp.
--   unassembled:  16560 sequences, total length 202836942 bp.
--
-- Contig sizes based on genome size 85mbp:
--
--            NG (bp)  LG (contigs)    sum (bp)
--         ----------  ------------  ----------
--     10     8747749             1     8747749
--     20     4618257             3    19113364
--     30     4153309             5    27845179
--     40     3612817             7    35418893
--     50     3380076            10    45771788
--     60     3299321            12    52447257
--     70     2084927            15    60041538
--     80       24119            57    68015798
--
-- Finished stage 'unitigCheck', reset canuIteration.
----------------------------------------
-- Starting command on Fri Jan 16 02:12:02 2026 with 4558965.812 GB free disk space

    cd unitigging
    /share/org/YZWL/yzwl_lixg/miniforge3/envs/canu_v.2.3/bin/utgcns \
      -S ../A1-18.seqStore \
      -T  ./A1-18.ctgStore 1 \
      -partition 0.8 1.5 0.1 \
    > ./A1-18.ctgStore/partitioning.log 2>&1

-- Finished on Fri Jan 16 02:12:11 2026 (9 seconds) with 4558964.593 GB free disk space
----------------------------------------
-- Using slow alignment for consensus (iteration '0').
-- Configured 10 consensus jobs.
-- Finished stage 'consensusConfigure', reset canuIteration.
--
-- Local: cns       13.000 GB    8 CPUs x  11 jobs   143.000 GB  88 CPUs  (consensus)
--
--
-- Running jobs.  First attempt out of 2.
----------------------------------------
-- Starting 'cns' concurrent execution on Fri Jan 16 02:12:11 2026 with 4558964.562 GB free disk space (10 processes; 11 concurrently)

    cd unitigging/5-consensus
    ./consensus.sh 1 > ./consensus.000001.out 2>&1
    ./consensus.sh 2 > ./consensus.000002.out 2>&1
    ./consensus.sh 3 > ./consensus.000003.out 2>&1
    ./consensus.sh 4 > ./consensus.000004.out 2>&1
    ./consensus.sh 5 > ./consensus.000005.out 2>&1
    ./consensus.sh 6 > ./consensus.000006.out 2>&1
    ./consensus.sh 7 > ./consensus.000007.out 2>&1
    ./consensus.sh 8 > ./consensus.000008.out 2>&1
    ./consensus.sh 9 > ./consensus.000009.out 2>&1
    ./consensus.sh 10 > ./consensus.000010.out 2>&1

-- Finished on Fri Jan 16 02:20:12 2026 (481 seconds) with 4559481.656 GB free disk space
----------------------------------------
-- Using slow alignment for consensus (iteration '1').
-- Configured 10 consensus jobs.
-- All 10 consensus jobs finished successfully.
-- Finished stage 'consensusCheck', reset canuIteration.
-- Using slow alignment for consensus (iteration '0').
-- Configured 10 consensus jobs.
----------------------------------------
-- Starting command on Fri Jan 16 02:20:13 2026 with 4559481.609 GB free disk space

    cd unitigging
    /share/org/YZWL/yzwl_lixg/miniforge3/envs/canu_v.2.3/bin/tgStoreLoad \
      -S ../A1-18.seqStore \
      -T  ./A1-18.ctgStore 2 \
      -L ./5-consensus/ctgcns.files \
    > ./5-consensus/ctgcns.files.ctgStoreLoad.err 2>&1

-- Finished on Fri Jan 16 02:20:13 2026 (lickety-split) with 4559480.828 GB free disk space
----------------------------------------
----------------------------------------
-- Starting command on Fri Jan 16 02:20:13 2026 with 4559480.828 GB free disk space

    cd unitigging
    /share/org/YZWL/yzwl_lixg/miniforge3/envs/canu_v.2.3/bin/tgTigDisplay \
      -S ../A1-18.seqStore \
      -b \
      -o ../A1-18.contigs.unsorted.bam \
      -L ./5-consensus/ctgcns.files \
    > ./5-consensus/ctgcns.files.contigs.bam.err 2>&1

-- Finished on Fri Jan 16 02:22:55 2026 (162 seconds) with 4559454.421 GB free disk space
----------------------------------------
----------------------------------------
-- Starting command on Fri Jan 16 02:22:55 2026 with 4559454.421 GB free disk space

    cd .
    samtools sort \
      --write-index \
      --threads 2 \
      -o ./A1-18.contigs.bam ./A1-18.contigs.unsorted.bam \
    > ./ctgcns.bam.err 2>&1

-- Finished on Fri Jan 16 02:24:04 2026 (69 seconds) with 4559481.921 GB free disk space
----------------------------------------
-- Purging consensus output after loading to ctgStore.
-- Purged 10 .cns outputs.
----------------------------------------
-- Starting command on Fri Jan 16 02:24:04 2026 with 4559483.89 GB free disk space

    cd unitigging
    /share/org/YZWL/yzwl_lixg/miniforge3/envs/canu_v.2.3/bin/tgStoreDump \
      -S ../A1-18.seqStore \
      -T ./A1-18.ctgStore 2 \
      -sizes -s 85000000 \
    > ./A1-18.ctgStore/seqDB.v002.sizes.txt
ZERO length suplied to intervalList::add(), ignoring interval.
ZERO length suplied to intervalList::add(), ignoring interval.
ZERO length suplied to intervalList::add(), ignoring interval.
ZERO length suplied to intervalList::add(), ignoring interval.
ZERO length suplied to intervalList::add(), ignoring interval.
ZERO length suplied to intervalList::add(), ignoring interval.
ZERO length suplied to intervalList::add(), ignoring interval.
ZERO length suplied to intervalList::add(), ignoring interval.
ZERO length suplied to intervalList::add(), ignoring interval.
ZERO length suplied to intervalList::add(), ignoring interval.
ZERO length suplied to intervalList::add(), ignoring interval.
ZERO length suplied to intervalList::add(), ignoring interval.
ZERO length suplied to intervalList::add(), ignoring interval.

-- Finished on Fri Jan 16 02:24:05 2026 (one second) with 4559483.89 GB free disk space
----------------------------------------
-- Found, in version 2, after consensus generation:
--   contigs:      114 sequences, total length 90217081 bp (including 166 repeats of total length 6801494 bp).
--   bubbles:      212 sequences, total length 11923601 bp.
--   unassembled:  16560 sequences, total length 276983623 bp.
--
-- Contig sizes based on genome size 85mbp:
--
--            NG (bp)  LG (contigs)    sum (bp)
--         ----------  ------------  ----------
--     10    11369353             1    11369353
--     20     7463119             2    18832472
--     30     5962887             4    30838876
--     40     5391491             5    36230367
--     50     4692269             7    46093947
--     60     4415792             9    55184457
--     70     4409704            10    59594161
--     80     4300697            12    68295428
--     90     2713563            15    78185746
--    100     1395811            19    85204325
--
-- Finished stage 'consensusLoad', reset canuIteration.
----------------------------------------
-- Starting command on Fri Jan 16 02:24:05 2026 with 4559483.875 GB free disk space

    cd .
    /share/org/YZWL/yzwl_lixg/miniforge3/envs/canu_v.2.3/bin/tgStoreDump \
      -S ./A1-18.seqStore \
      -T ./unitigging/A1-18.ctgStore 2 \
      -o ./A1-18.contigs \
      -layout \
    > ./A1-18.contigs.layout.err 2>&1

-- Finished on Fri Jan 16 02:24:05 2026 (furiously fast) with 4559483.843 GB free disk space
----------------------------------------
----------------------------------------
-- Starting command on Fri Jan 16 02:24:05 2026 with 4559483.843 GB free disk space

    cd .
    /share/org/YZWL/yzwl_lixg/miniforge3/envs/canu_v.2.3/bin/tgStoreDump \
      -S ./A1-18.seqStore \
      -T ./unitigging/A1-18.ctgStore 2 \
      -consensus -fasta \
      -unassembled \
    > ./A1-18.unassembled.fasta
    2> ./A1-18.unassembled.err
ZERO length suplied to intervalList::add(), ignoring interval.
ZERO length suplied to intervalList::add(), ignoring interval.
ZERO length suplied to intervalList::add(), ignoring interval.
ZERO length suplied to intervalList::add(), ignoring interval.
ZERO length suplied to intervalList::add(), ignoring interval.
ZERO length suplied to intervalList::add(), ignoring interval.
ZERO length suplied to intervalList::add(), ignoring interval.
ZERO length suplied to intervalList::add(), ignoring interval.
ZERO length suplied to intervalList::add(), ignoring interval.
ZERO length suplied to intervalList::add(), ignoring interval.
ZERO length suplied to intervalList::add(), ignoring interval.
ZERO length suplied to intervalList::add(), ignoring interval.
ZERO length suplied to intervalList::add(), ignoring interval.

-- Finished on Fri Jan 16 02:24:06 2026 (one second) with 4559483.562 GB free disk space
----------------------------------------
----------------------------------------
-- Starting command on Fri Jan 16 02:24:06 2026 with 4559483.562 GB free disk space

    cd .
    /share/org/YZWL/yzwl_lixg/miniforge3/envs/canu_v.2.3/bin/tgStoreDump \
      -S ./A1-18.seqStore \
      -T ./unitigging/A1-18.ctgStore 2 \
      -consensus -fasta \
      -contigs \
    > ./A1-18.contigs.fasta
    2> ./A1-18.contigs.err
ZERO length suplied to intervalList::add(), ignoring interval.
ZERO length suplied to intervalList::add(), ignoring interval.
ZERO length suplied to intervalList::add(), ignoring interval.
ZERO length suplied to intervalList::add(), ignoring interval.
ZERO length suplied to intervalList::add(), ignoring interval.
ZERO length suplied to intervalList::add(), ignoring interval.
ZERO length suplied to intervalList::add(), ignoring interval.
ZERO length suplied to intervalList::add(), ignoring interval.
ZERO length suplied to intervalList::add(), ignoring interval.
ZERO length suplied to intervalList::add(), ignoring interval.
ZERO length suplied to intervalList::add(), ignoring interval.
ZERO length suplied to intervalList::add(), ignoring interval.
ZERO length suplied to intervalList::add(), ignoring interval.

-- Finished on Fri Jan 16 02:24:07 2026 (one second) with 4559483.453 GB free disk space
----------------------------------------
-- Finished stage 'generateOutputs', reset canuIteration.
--
-- Assembly 'A1-18' finished in '/share/org/YZWL/yzwl_lixg/project/28.大豆疫霉菌三代基因组/03.hicanu/A1-18/01.raw_output'.
--
-- Summary saved in 'A1-18.report'.
--
-- Sequences saved:
--   Contigs       -> 'A1-18.contigs.fasta'
--   Unassembled   -> 'A1-18.unassembled.fasta'
--
-- Read layouts saved:
--   Contigs       -> 'A1-18.contigs.layout'.
--
-- Bye.

2026-01-16 02:24:07.420 - WARNING - 输出文件不存在|Output file does not exist: /share/org/YZWL/yzwl_lixg/project/28.大豆疫霉菌三代基因组/03.hicanu/A1-18/01.raw_output/A1-18.unitigs.fasta
Usage: biopytools ragtag [OPTIONS]
Try 'biopytools ragtag -h' for help.

Error: Invalid value for '-r' / '--reference': 文件不存在|File does not exist: /share/org/YZWL/yzwl_lixg/project/28.大豆疫霉菌三代基因组/04.ragtag/Psoja_T2T.fa
Usage: biopytools genomesyn [OPTIONS]
Try 'biopytools genomesyn -h' for help.

Error: Invalid value for '-i' / '--ref': Path '04.ragtag/A1-18/hicanu/A1-18_RagTag_scaffolded.fa' does not exist.
Job 68886709 stderr output:

