2026-01-16 14:35:50.120 - WARNING - 命令错误输出|Command stderr:
-- canu master +27 changes (r10515 2a41e933b8de6ed66723d75d36dd071b46d2c347)
--
-- CITATIONS
--
-- For assemblies of PacBio HiFi reads:
--   Nurk S, Walenz BP, Rhiea A, Vollger MR, Logsdon GA, Grothe R, Miga KH, Eichler EE, Phillippy AM, Koren S.
--   HiCanu: accurate assembly of segmental duplications, satellites, and allelic variants from high-fidelity long reads.
--   biorXiv. 2020.
--   https://doi.org/10.1101/2020.03.14.992248
-- 
-- Read and contig alignments during correction and consensus use:
--   Šošic M, Šikic M.
--   Edlib: a C/C ++ library for fast, exact sequence alignment using edit distance.
--   Bioinformatics. 2017 May 1;33(9):1394-1395.
--   http://doi.org/10.1093/bioinformatics/btw753
-- 
-- Overlaps are generated using:
--   Berlin K, et al.
--   Assembling large genomes with single-molecule sequencing and locality-sensitive hashing.
--   Nat Biotechnol. 2015 Jun;33(6):623-30.
--   http://doi.org/10.1038/nbt.3238
-- 
--   Myers EW, et al.
--   A Whole-Genome Assembly of Drosophila.
--   Science. 2000 Mar 24;287(5461):2196-204.
--   http://doi.org/10.1126/science.287.5461.2196
-- 
-- Contig consensus sequences are generated using an algorithm derived from pbdagcon:
--   Chin CS, et al.
--   Nonhybrid, finished microbial genome assemblies from long-read SMRT sequencing data.
--   Nat Methods. 2013 Jun;10(6):563-9
--   http://doi.org/10.1038/nmeth.2474
-- 
-- CONFIGURE CANU
--
-- Detected Java(TM) Runtime Environment '25.0.1-internal' (from '/share/org/YZWL/yzwl_lixg/miniforge3/envs/telocomp/lib/jvm/bin/java') without -d64 support.
--
-- WARNING:
-- WARNING:  Failed to run gnuplot using command 'gnuplot'.
-- WARNING:  Plots will be disabled.
-- WARNING:
--
-- Detected samtools version '1.22' / htslib version 'htscodecs=1.6.3' (from 'samtools').
--
-- Detected 88 CPUs and 503 gigabytes of memory on the local machine.
--
-- Detected Slurm with 'sinfo' binary in /opt/skyformai/bin/sinfo.
--          Slurm disabled by useGrid=false
--
-- Detected  '' with 'pbsnodes' binary in /opt/skyformai/bin/pbsnodes.
--           disabled by useGrid=false
--
-- Detected LSF with 'bsub' binary in /opt/skyformai/bin/bsub.
--          LSF disabled by useGrid=false
--
-- Local machine mode enabled; grid support not detected or not allowed.
--
-- Found trimmed raw PacBio HiFi reads in the input files.
--
--                                (tag)Concurrency
--                         (tag)Threads          |
--                (tag)Memory         |          |
--        (tag)             |         |          |       total usage      algorithm
--        -------  ----------  --------   --------  --------------------  -----------------------------
-- Local: meryl     12.000 GB    4 CPUs x  22 jobs   264.000 GB  88 CPUs  (k-mer counting)
-- Local: cormhap   13.000 GB   11 CPUs x   8 jobs   104.000 GB  88 CPUs  (overlap detection with mhap)
-- Local: obtovl     8.000 GB    8 CPUs x  11 jobs    88.000 GB  88 CPUs  (overlap detection)
-- Local: utgovl     8.000 GB    8 CPUs x  11 jobs    88.000 GB  88 CPUs  (overlap detection)
-- Local: cor        -.--- GB    4 CPUs x   - jobs     -.--- GB   - CPUs  (read correction)
-- Local: ovb        4.000 GB    1 CPU  x  88 jobs   352.000 GB  88 CPUs  (overlap store bucketizer)
-- Local: ovs        8.000 GB    1 CPU  x  62 jobs   496.000 GB  62 CPUs  (overlap store sorting)
-- Local: red       16.000 GB    4 CPUs x  22 jobs   352.000 GB  88 CPUs  (read error detection)
-- Local: oea        8.000 GB    1 CPU  x  62 jobs   496.000 GB  62 CPUs  (overlap error adjustment)
-- Local: bat       32.000 GB    8 CPUs x   1 job     32.000 GB   8 CPUs  (contig construction with bogart)
-- Local: cns        -.--- GB    8 CPUs x   - jobs     -.--- GB   - CPUs  (consensus)
--
-- Generating assembly 'A1-17' in '/share/org/YZWL/yzwl_lixg/project/28.大豆疫霉菌三代基因组/03.hicanu/A1-17/01.raw_output':
--   genomeSize:
--     85000000
--
--   Overlap Generation Limits:
--     corOvlErrorRate 0.0000 (  0.00%)
--     obtOvlErrorRate 0.0250 (  2.50%)
--     utgOvlErrorRate 0.0100 (  1.00%)
--
--   Overlap Processing Limits:
--     corErrorRate    0.0000 (  0.00%)
--     obtErrorRate    0.0250 (  2.50%)
--     utgErrorRate    0.0003 (  0.03%)
--     cnsErrorRate    0.0500 (  5.00%)
--
--   Stages to run:
--     assemble HiFi reads.
--
--
-- BEGIN STORE CREATION
----------------------------------------
-- Starting command on Fri Jan 16 12:31:15 2026 with 4530324.796 GB free disk space

    cd .
    ./A1-17.seqStore.sh \
    > ./A1-17.seqStore.err 2>&1

-- Finished on Fri Jan 16 12:37:36 2026 (381 seconds) with 4530690.984 GB free disk space
----------------------------------------
--
-- In sequence store './A1-17.seqStore':
--   Found 256802 reads.
--   Found 4250005305 bases (50 times coverage).
--    Histogram of corrected reads:
--    
--    G=4250005305                       sum of  ||               length     num
--    NG         length     index       lengths  ||                range    seqs
--    ----- ------------ --------- ------------  ||  ------------------- -------
--    00010        26530     14897    425017570  ||       1199-2321         7147|---------------------
--    00020        24530     31607    850011649  ||       2322-3444        11583|----------------------------------
--    00030        23147     49460   1275015525  ||       3445-4567        10823|--------------------------------
--    00040        22001     68300   1700003731  ||       4568-5690         9501|----------------------------
--    00050        20950     88098   2125007724  ||       5691-6813         8038|------------------------
--    00060        19881    108915   2550007247  ||       6814-7936         7322|----------------------
--    00070        18663    130952   2975007406  ||       7937-9059         6423|-------------------
--    00080        16916    154754   3400013577  ||       9060-10182        5817|-----------------
--    00090        11620    183568   3825016008  ||      10183-11305        5195|----------------
--    00100         1199    256802   4250005305  ||      11306-12428        4627|--------------
--    001.000x              256802   4250005305  ||      12429-13551        4403|-------------
--                                               ||      13552-14674        4794|--------------
--                                               ||      14675-15797        6533|-------------------
--                                               ||      15798-16920        9886|-----------------------------
--                                               ||      16921-18043       14044|-----------------------------------------
--                                               ||      18044-19166       18452|------------------------------------------------------
--                                               ||      19167-20289       21201|--------------------------------------------------------------
--                                               ||      20290-21412       21805|---------------------------------------------------------------
--                                               ||      21413-22535       20090|-----------------------------------------------------------
--                                               ||      22536-23658       16816|-------------------------------------------------
--                                               ||      23659-24781       13321|---------------------------------------
--                                               ||      24782-25904        9857|-----------------------------
--                                               ||      25905-27027        7044|---------------------
--                                               ||      27028-28150        4831|--------------
--                                               ||      28151-29273        3186|----------
--                                               ||      29274-30396        1952|------
--                                               ||      30397-31519        1109|----
--                                               ||      31520-32642         590|--
--                                               ||      32643-33765         279|-
--                                               ||      33766-34888          95|-
--                                               ||      34889-36011          28|-
--                                               ||      36012-37134           1|-
--                                               ||      37135-38257           3|-
--                                               ||      38258-39380           0|
--                                               ||      39381-40503           2|-
--                                               ||      40504-41626           0|
--                                               ||      41627-42749           0|
--                                               ||      42750-43872           1|-
--                                               ||      43873-44995           0|
--                                               ||      44996-46118           3|-
--    
--
-- In sequence store './A1-17.seqStore':
--   Found 256802 reads.
--   Found 4250005305 bases (50 times coverage).
--    Histogram of corrected-trimmed reads:
--    
--    G=4250005305                       sum of  ||               length     num
--    NG         length     index       lengths  ||                range    seqs
--    ----- ------------ --------- ------------  ||  ------------------- -------
--    00010        26530     14897    425017570  ||       1199-2321         7147|---------------------
--    00020        24530     31607    850011649  ||       2322-3444        11583|----------------------------------
--    00030        23147     49460   1275015525  ||       3445-4567        10823|--------------------------------
--    00040        22001     68300   1700003731  ||       4568-5690         9501|----------------------------
--    00050        20950     88098   2125007724  ||       5691-6813         8038|------------------------
--    00060        19881    108915   2550007247  ||       6814-7936         7322|----------------------
--    00070        18663    130952   2975007406  ||       7937-9059         6423|-------------------
--    00080        16916    154754   3400013577  ||       9060-10182        5817|-----------------
--    00090        11620    183568   3825016008  ||      10183-11305        5195|----------------
--    00100         1199    256802   4250005305  ||      11306-12428        4627|--------------
--    001.000x              256802   4250005305  ||      12429-13551        4403|-------------
--                                               ||      13552-14674        4794|--------------
--                                               ||      14675-15797        6533|-------------------
--                                               ||      15798-16920        9886|-----------------------------
--                                               ||      16921-18043       14044|-----------------------------------------
--                                               ||      18044-19166       18452|------------------------------------------------------
--                                               ||      19167-20289       21201|--------------------------------------------------------------
--                                               ||      20290-21412       21805|---------------------------------------------------------------
--                                               ||      21413-22535       20090|-----------------------------------------------------------
--                                               ||      22536-23658       16816|-------------------------------------------------
--                                               ||      23659-24781       13321|---------------------------------------
--                                               ||      24782-25904        9857|-----------------------------
--                                               ||      25905-27027        7044|---------------------
--                                               ||      27028-28150        4831|--------------
--                                               ||      28151-29273        3186|----------
--                                               ||      29274-30396        1952|------
--                                               ||      30397-31519        1109|----
--                                               ||      31520-32642         590|--
--                                               ||      32643-33765         279|-
--                                               ||      33766-34888          95|-
--                                               ||      34889-36011          28|-
--                                               ||      36012-37134           1|-
--                                               ||      37135-38257           3|-
--                                               ||      38258-39380           0|
--                                               ||      39381-40503           2|-
--                                               ||      40504-41626           0|
--                                               ||      41627-42749           0|
--                                               ||      42750-43872           1|-
--                                               ||      43873-44995           0|
--                                               ||      44996-46118           3|-
--    
--
-- Correction skipped; not enabled.
--
-- Trimming skipped; not enabled.
--
-- BEGIN ASSEMBLY
----------------------------------------
-- Starting command on Fri Jan 16 12:37:36 2026 with 4530690.937 GB free disk space

    cd unitigging/0-mercounts
    ./meryl-configure.sh \
    > ./meryl-configure.err 2>&1

-- Finished on Fri Jan 16 12:37:37 2026 (one second) with 4530690.937 GB free disk space
----------------------------------------
--  segments   memory batches
--  -------- -------- -------
--        01 10.81 GB       2
--        02  5.75 GB       2
--        04  2.97 GB       2
--        06  2.14 GB       2
--        08  1.60 GB       2
--        12  1.07 GB       2
--        16  0.81 GB       2
--        20  0.65 GB       2
--        24  0.54 GB       2
--        32  0.41 GB       2
--        40  0.32 GB       2
--        48  -.-- GB       -  (segment size too small)
--        56  -.-- GB       -  (segment size too small)
--        64  -.-- GB       -  (segment size too small)
--        96  -.-- GB       -  (segment size too small)
--
--  For 256802 reads with 4250005305 bases, limit to 42 batches.
--  Will count kmers using 01 jobs, each using 12 GB and 4 threads.
--
-- Finished stage 'merylConfigure', reset canuIteration.
--
-- Running jobs.  First attempt out of 2.
----------------------------------------
-- Starting 'meryl' concurrent execution on Fri Jan 16 12:37:37 2026 with 4530690.906 GB free disk space (1 processes; 22 concurrently)

    cd unitigging/0-mercounts
    ./meryl-count.sh 1 > ./meryl-count.000001.out 2>&1

-- Finished on Fri Jan 16 12:41:18 2026 (221 seconds) with 4530900.078 GB free disk space
----------------------------------------
-- Found 1 Kmer counting (meryl) outputs.
-- Finished stage 'utg-merylCountCheck', reset canuIteration.
--
-- Running jobs.  First attempt out of 2.
----------------------------------------
-- Starting 'meryl' concurrent execution on Fri Jan 16 12:41:18 2026 with 4530900.046 GB free disk space (1 processes; 22 concurrently)

    cd unitigging/0-mercounts
    ./meryl-process.sh 1 > ./meryl-process.000001.out 2>&1

-- Finished on Fri Jan 16 12:41:24 2026 (6 seconds) with 4530899.687 GB free disk space
----------------------------------------
-- Meryl finished successfully.  Kmer frequency histogram:
--
-- WARNING: gnuplot failed.
--
----------------------------------------
--
--  22-mers                                                                                           Fraction
--    Occurrences   NumMers                                                                         Unique Total
--       1-     1         0                                                                        0.0000 0.0000
--       2-     2    219936 *                                                                      0.0049 0.0001
--       3-     4     60711                                                                        0.0059 0.0002
--       5-     7     14387                                                                        0.0064 0.0002
--       8-    11      7870                                                                        0.0066 0.0002
--      12-    16     16150                                                                        0.0068 0.0003
--      17-    22    103409                                                                        0.0073 0.0004
--      23-    29    794005 ***                                                                    0.0104 0.0013
--      30-    37   5113623 ***********************                                                0.0331 0.0102
--      38-    46  15061664 ********************************************************************** 0.1702 0.0782
--      47-    56  14479192 *******************************************************************    0.5164 0.2874
--      57-    67   4112485 *******************                                                    0.8165 0.5050
--      68-    79    735508 ***                                                                    0.8922 0.5698
--      80-    92    890531 ****                                                                   0.9077 0.5857
--      93-   106    823986 ***                                                                    0.9278 0.6102
--     107-   121    392173 *                                                                      0.9454 0.6349
--     122-   137    257573 *                                                                      0.9536 0.6480
--     138-   154    257907 *                                                                      0.9594 0.6585
--     155-   172    185877                                                                        0.9651 0.6702
--     173-   191    137819                                                                        0.9691 0.6793
--     192-   211    137187                                                                        0.9721 0.6872
--     212-   232    102138                                                                        0.9751 0.6957
--     233-   254    109161                                                                        0.9774 0.7027
--     255-   277     90135                                                                        0.9798 0.7110
--     278-   301     86084                                                                        0.9818 0.7184
--     302-   326     73818                                                                        0.9837 0.7262
--     327-   352     59832                                                                        0.9853 0.7333
--     353-   379     56014                                                                        0.9867 0.7396
--     380-   407     41465                                                                        0.9879 0.7459
--     408-   436     43558                                                                        0.9888 0.7510
--     437-   466     38324                                                                        0.9898 0.7567
--     467-   497     31968                                                                        0.9906 0.7621
--     498-   529     27619                                                                        0.9913 0.7669
--     530-   562     26345                                                                        0.9919 0.7713
--     563-   596     17619                                                                        0.9925 0.7757
--     597-   631     16411                                                                        0.9929 0.7789
--     632-   667     15249                                                                        0.9933 0.7820
--     668-   704     14662                                                                        0.9936 0.7851
--     705-   742     13940                                                                        0.9939 0.7882
--     743-   781     13099                                                                        0.9943 0.7914
--     782-   821     12429                                                                        0.9945 0.7945
--
--           0 (max occurrences)
--  3211017284 (total mers, non-unique)
--    44924724 (distinct mers, non-unique)
--           0 (unique mers)
-- Finished stage 'meryl-process', reset canuIteration.
--
-- Removing meryl database 'unitigging/0-mercounts/A1-17.ms22'.
--
-- OVERLAPPER (normal) (assembly) erate=0.01
--
----------------------------------------
-- Starting command on Fri Jan 16 12:41:24 2026 with 4530900.656 GB free disk space

    cd unitigging/1-overlapper
    /share/org/YZWL/yzwl_lixg/miniforge3/envs/canu_v.2.3/bin/overlapInCorePartition \
     -S  ../../A1-17.seqStore \
     -hl 160000000 \
     -rl 5000000000 \
     -ol 500 \
     -o  ./A1-17.partition \
    > ./A1-17.partition.err 2>&1

-- Finished on Fri Jan 16 12:41:24 2026 (fast as lightning) with 4530900.64 GB free disk space
----------------------------------------
--
-- Configured 21 overlapInCore jobs.
-- Finished stage 'utg-overlapConfigure', reset canuIteration.
--
-- Running jobs.  First attempt out of 2.
----------------------------------------
-- Starting 'utgovl' concurrent execution on Fri Jan 16 12:41:24 2026 with 4530900.609 GB free disk space (21 processes; 11 concurrently)

    cd unitigging/1-overlapper
    ./overlap.sh 1 > ./overlap.000001.out 2>&1
    ./overlap.sh 2 > ./overlap.000002.out 2>&1
    ./overlap.sh 3 > ./overlap.000003.out 2>&1
    ./overlap.sh 4 > ./overlap.000004.out 2>&1
    ./overlap.sh 5 > ./overlap.000005.out 2>&1
    ./overlap.sh 6 > ./overlap.000006.out 2>&1
    ./overlap.sh 7 > ./overlap.000007.out 2>&1
    ./overlap.sh 8 > ./overlap.000008.out 2>&1
    ./overlap.sh 9 > ./overlap.000009.out 2>&1
    ./overlap.sh 10 > ./overlap.000010.out 2>&1
    ./overlap.sh 11 > ./overlap.000011.out 2>&1
    ./overlap.sh 12 > ./overlap.000012.out 2>&1
    ./overlap.sh 13 > ./overlap.000013.out 2>&1
    ./overlap.sh 14 > ./overlap.000014.out 2>&1
    ./overlap.sh 15 > ./overlap.000015.out 2>&1
    ./overlap.sh 16 > ./overlap.000016.out 2>&1
    ./overlap.sh 17 > ./overlap.000017.out 2>&1
    ./overlap.sh 18 > ./overlap.000018.out 2>&1
    ./overlap.sh 19 > ./overlap.000019.out 2>&1
    ./overlap.sh 20 > ./overlap.000020.out 2>&1
    ./overlap.sh 21 > ./overlap.000021.out 2>&1

-- Finished on Fri Jan 16 13:17:44 2026 (2180 seconds) with 4532688.531 GB free disk space
----------------------------------------
-- Found 21 overlapInCore output files.
--
-- overlapInCore compute 'unitigging/1-overlapper':
--   kmer hits
--     with no overlap       1399714111  52.9047619 +- 41917573.46
--     with an overlap         51045252  6.28571429 +- 1393221.967
--
--   overlaps                  51045252  6.28571429 +- 1393221.967
--     contained               12460063  .333333333 +- 339564.718
--     dovetail                38585189  9.95238095 +- 1063658.205
--
--   overlaps rejected
--     multiple per pair              0           0 +- 0
--     bad short window               0           0 +- 0
--     bad long window                0           0 +- 0
-- Finished stage 'utg-overlapCheck', reset canuIteration.
----------------------------------------
-- Starting command on Fri Jan 16 13:17:44 2026 with 4532688.515 GB free disk space

    cd unitigging
    /share/org/YZWL/yzwl_lixg/miniforge3/envs/canu_v.2.3/bin/ovStoreConfig \
     -S ../A1-17.seqStore \
     -M 4-8 \
     -L ./1-overlapper/ovljob.files \
     -create ./A1-17.ovlStore.config \
     > ./A1-17.ovlStore.config.txt \
    2> ./A1-17.ovlStore.config.err

-- Finished on Fri Jan 16 13:17:44 2026 (lickety-split) with 4532688.5 GB free disk space
----------------------------------------
--
-- Creating overlap store unitigging/A1-17.ovlStore using:
--      1 bucket
--      1 slice
--        using at most 4 GB memory each
--
-- Running jobs.  First attempt out of 2.
----------------------------------------
-- Starting 'ovS' concurrent execution on Fri Jan 16 13:17:44 2026 with 4532688.484 GB free disk space (1 processes; 62 concurrently)

    cd unitigging
    ./A1-17.ovlStore.sh 1 > ./A1-17.ovlStore.000001.out 2>&1

-- Finished on Fri Jan 16 13:18:05 2026 (21 seconds) with 4532662.921 GB free disk space
----------------------------------------
-- Checking store.
----------------------------------------
-- Starting command on Fri Jan 16 13:18:05 2026 with 4532662.921 GB free disk space

    cd unitigging
    /share/org/YZWL/yzwl_lixg/miniforge3/envs/canu_v.2.3/bin/ovStoreDump \
     -S ../A1-17.seqStore \
     -O  ./A1-17.ovlStore \
     -counts \
     > ./A1-17.ovlStore/counts.dat 2> ./A1-17.ovlStore/counts.err

-- Finished on Fri Jan 16 13:18:05 2026 (in the blink of an eye) with 4532662.89 GB free disk space
----------------------------------------
--
-- Overlap store 'unitigging/A1-17.ovlStore' successfully constructed.
-- Found 102090504 overlaps for 254370 reads; 1235351 reads have no overlaps.
--
--
-- Purged 0.966 GB in 63 overlap output files.
----------------------------------------
-- Starting command on Fri Jan 16 13:18:06 2026 with 4532663.875 GB free disk space

    cd unitigging
    /share/org/YZWL/yzwl_lixg/miniforge3/envs/canu_v.2.3/bin/ovStoreStats \
     -C 50 \
     -S ../A1-17.seqStore \
     -O  ./A1-17.ovlStore \
     -o  ./A1-17.ovlStore \
     > ./A1-17.ovlStore.summary.err 2>&1

-- Finished on Fri Jan 16 13:18:20 2026 (14 seconds) with 4532663.859 GB free disk space
----------------------------------------
--
-- Overlap store 'unitigging/A1-17.ovlStore' contains:
--
--   category            reads     %          read length        feature size or coverage  analysis
--   ----------------  -------  -------  ----------------------  ------------------------  --------------------
--   middle-missing        103    0.04    14906.33 +- 7193.47        555.61 +- 580.06     (bad trimming)
--   middle-hump             6    0.00    14943.33 +- 2329.71       9730.17 +- 2780.68    (bad trimming)
--   no-5-prime            350    0.14    12598.90 +- 5735.31        858.72 +- 1746.53    (bad trimming)
--   no-3-prime            407    0.16    10579.33 +- 6729.41        889.26 +- 1999.38    (bad trimming)
--   
--   low-coverage          503    0.20     6997.75 +- 5473.12          5.79 +- 3.70       (easy to assemble, potential for lower quality consensus)
--   unique             207123   80.65    12688.35 +- 5953.75         46.38 +- 8.72       (easy to assemble, perfect, yay)
--   repeat-cont         22720    8.85    10662.30 +- 5243.96       1986.63 +- 1508.62    (potential for consensus errors, no impact on assembly)
--   repeat-dove           305    0.12    20854.96 +- 1838.01        841.79 +- 1108.41    (hard to assemble, likely won't assemble correctly or even at all)
--   
--   span-repeat          2349    0.91    14239.41 +- 5258.68       2690.35 +- 3514.52    (read spans a large repeat, usually easy to assemble)
--   uniq-repeat-cont    13381    5.21    12817.09 +- 4828.69                             (should be uniquely placed, low potential for consensus errors, no impact on assembly)
--   uniq-repeat-dove     2883    1.12    19256.96 +- 2585.86                             (will end contigs, potential to misassemble)
--   uniq-anchor          4240    1.65    13792.63 +- 4810.43       8417.05 +- 5137.01    (repeat read, with unique section, probable bad read)
-- Finished stage 'utg-createOverlapStore', reset canuIteration.
--
-- Loading read lengths.
-- Loading number of overlaps per read.
--
-- Configure RED for 16gb memory.
--                   Batches of at most (unlimited) reads.
--                                      500000000 bases.
--                   Expecting evidence of at most 536870912 bases per iteration.
--
--           Total                                               Reads                 Olaps Evidence
--    Job   Memory      Read Range         Reads        Bases   Memory        Olaps   Memory   Memory  (Memory in MB)
--   ---- -------- ------------------- --------- ------------ -------- ------------ -------- --------
--      1 16385.75         1-31311          5486    108853575 13287.96      2253663    25.79  1024.00
--      2 16385.70     31312-66526          6127    108899399 13293.58      1758337    20.12  1024.00
--      3 16386.50     66527-106340         6875    108834204 13285.64      2521608    28.86  1024.00
--      4 16386.79    106341-140374         5780    108779183 13278.89      3136722    35.90  1024.00
--      5 16385.42    140375-178043         6441    108871931 13290.23      2025686    23.18  1024.00
--      6 16384.77    178044-228704         8684    108727699 13272.70      3501596    40.07  1024.00
--      7 16386.34    228705-261473         5567    108779031 13278.87      3099929    35.48  1024.00
--      8 16384.51    261474-296893         6081    108853411 13287.96      2145054    24.55  1024.00
--      9 16384.32    296894-349184         8994    108742225 13274.48      3306066    37.83  1024.00
--     10 16384.12    349185-380145         5486    108865071 13289.37      1988143    22.75  1024.00
--     11 16384.20    380146-413041         5808    108734779 13273.47      3384069    38.73  1024.00
--     12 16384.22    413042-454205         7039    108955361 13300.44      1029672    11.78  1024.00
--     13 16384.43    454206-496931         7325    108751304 13275.54      3224174    36.90  1024.00
--     14 16384.13    496932-529737         5670    108767447 13277.45      3029746    34.67  1024.00
--     15 16385.11    529738-566861         6347    108848853 13287.41      2245675    25.70  1024.00
--     16 16385.32    566862-614472         8221    108740696 13274.27      3412106    39.05  1024.00
--     17 16386.54    614473-647961         5585    108804025 13281.92      2850601    32.62  1024.00
--     18 16387.64    647962-682682         6049    108880818 13291.31      2126751    24.34  1024.00
--     19 16386.33    682683-733628         8840    108748882 13275.29      3411339    39.04  1024.00
--     20 16385.89    733629-765377         5478    108895810 13293.12      1814805    20.77  1024.00
--     21 16384.85    765378-799343         5816    108766863 13277.39      3098811    35.46  1024.00
--     22 16384.61    799344-839926         7084    108964478 13301.55       966504    11.06  1024.00
--     23 16384.09    839927-881223         7135    108763529 13277.02      3064104    35.07  1024.00
--     24 16386.42    881224-914014         5717    108783082 13279.36      3063362    35.06  1024.00
--     25 16385.77    914015-950039         6271    108856537 13288.35      2221658    25.42  1024.00
--     26 16385.07    950040-998349         8289    108735872 13273.68      3442045    39.39  1024.00
--     27 16385.15    998350-1030215        5514    108798535 13281.24      2787591    31.90  1024.00
--     28 16385.30   1030216-1064100        5894    108870324 13290.02      2034343    23.28  1024.00
--     29 16385.68   1064101-1112217        8328    108758212 13276.41      3257039    37.27  1024.00
--     30 16386.15   1112218-1144851        5560    108895065 13293.03      1845181    21.12  1024.00
--     31 16384.12   1144852-1178100        5640    108757197 13276.20      3138230    35.91  1024.00
--     32 16385.36   1178101-1216353        6607    108962730 13301.32      1052076    12.04  1024.00
--     33 16385.32   1216354-1256547        6964    108778329 13278.82      3014462    34.50  1024.00
--     34 16385.53   1256548-1288776        5647    108779800 13278.96      3020564    34.57  1024.00
--     35 16384.90   1288777-1324520        6143    108846284 13287.09      2255303    25.81  1024.00
--     36 16385.79   1324521-1371267        8023    108760233 13276.65      3245328    37.14  1024.00
--     37 16384.55   1371268-1402878        5518    108765812 13277.25      3084122    35.29  1024.00
--     38 16385.92   1402879-1437365        5972    108869886 13289.97      2092846    23.95  1024.00
--     39 16385.58   1437366-1486777        8305    108782035 13279.32      2993785    34.26  1024.00
--     40  3827.71   1486778-1489721         492      6176798   754.02       147408     1.69  1024.00
--   ---- -------- ------------------- --------- ------------ -------- ------------ -------- --------
--                                                 4250005305             102090504
-- Finished stage 'readErrorDetectionConfigure', reset canuIteration.
--
-- Running jobs.  First attempt out of 2.
----------------------------------------
-- Starting 'red' concurrent execution on Fri Jan 16 13:18:26 2026 with 4532616.796 GB free disk space (40 processes; 22 concurrently)

    cd unitigging/3-overlapErrorAdjustment
    ./red.sh 1 > ./red.000001.out 2>&1
    ./red.sh 2 > ./red.000002.out 2>&1
    ./red.sh 3 > ./red.000003.out 2>&1
    ./red.sh 4 > ./red.000004.out 2>&1
    ./red.sh 5 > ./red.000005.out 2>&1
    ./red.sh 6 > ./red.000006.out 2>&1
    ./red.sh 7 > ./red.000007.out 2>&1
    ./red.sh 8 > ./red.000008.out 2>&1
    ./red.sh 9 > ./red.000009.out 2>&1
    ./red.sh 10 > ./red.000010.out 2>&1
    ./red.sh 11 > ./red.000011.out 2>&1
    ./red.sh 12 > ./red.000012.out 2>&1
    ./red.sh 13 > ./red.000013.out 2>&1
    ./red.sh 14 > ./red.000014.out 2>&1
    ./red.sh 15 > ./red.000015.out 2>&1
    ./red.sh 16 > ./red.000016.out 2>&1
    ./red.sh 17 > ./red.000017.out 2>&1
    ./red.sh 18 > ./red.000018.out 2>&1
    ./red.sh 19 > ./red.000019.out 2>&1
    ./red.sh 20 > ./red.000020.out 2>&1
    ./red.sh 21 > ./red.000021.out 2>&1
    ./red.sh 22 > ./red.000022.out 2>&1
    ./red.sh 23 > ./red.000023.out 2>&1
    ./red.sh 24 > ./red.000024.out 2>&1
    ./red.sh 25 > ./red.000025.out 2>&1
    ./red.sh 26 > ./red.000026.out 2>&1
    ./red.sh 27 > ./red.000027.out 2>&1
    ./red.sh 28 > ./red.000028.out 2>&1
    ./red.sh 29 > ./red.000029.out 2>&1
    ./red.sh 30 > ./red.000030.out 2>&1
    ./red.sh 31 > ./red.000031.out 2>&1
    ./red.sh 32 > ./red.000032.out 2>&1
    ./red.sh 33 > ./red.000033.out 2>&1
    ./red.sh 34 > ./red.000034.out 2>&1
    ./red.sh 35 > ./red.000035.out 2>&1
    ./red.sh 36 > ./red.000036.out 2>&1
    ./red.sh 37 > ./red.000037.out 2>&1
    ./red.sh 38 > ./red.000038.out 2>&1
    ./red.sh 39 > ./red.000039.out 2>&1
    ./red.sh 40 > ./red.000040.out 2>&1

-- Finished on Fri Jan 16 13:34:18 2026 (952 seconds) with 4532211.296 GB free disk space
----------------------------------------
-- Found 40 read error detection output files.
-- Finished stage 'readErrorDetectionCheck', reset canuIteration.
--
-- Loading read lengths.
-- Loading number of overlaps per read.
--
-- Configure OEA for 8gb memory.
--                   Batches of at most (unlimited) reads.
--                                      300000000 bases.
--
--           Total                                               Reads                 Olaps  Adjusts
--    Job   Memory      Read Range         Reads        Bases   Memory        Olaps   Memory   Memory  (Memory in MB)
--   ---- -------- ------------------- --------- ------------ -------- ------------ -------- --------
--      1  2899.26         1-98210         17115    300013046   294.64      6366214   194.28   362.34
--      2  2909.53     98211-207336        18623    300016879   294.69      6701303   204.51   362.34
--      3  2937.01    207337-307565        17162    300016766   294.64      7603087   232.03   362.34
--      4  2963.44    307566-414050        18604    300015975   294.69      8467673   258.41   362.34
--      5  2921.83    414051-522209        18622    300005501   294.68      7104644   216.82   362.34
--      6  2899.17    522210-632364        18802    300013050   294.69      6361729   194.14   362.34
--      7  2950.60    632365-742936        19112    300009151   294.69      8046664   245.56   362.34
--      8  2891.18    742937-842302        17145    300000298   294.63      6102007   186.22   362.34
--      9  2943.18    842303-942533        17429    300012149   294.65      7805087   238.19   362.34
--     10  2928.09    942534-1049191       18372    300001666   294.66      7310008   223.08   362.34
--     11  2937.86   1049192-1155084       18308    300015448   294.68      7629924   232.85   362.34
--     12  2882.07   1155085-1259218       17880    300008192   294.66      5802316   177.07   362.34
--     13  2960.37   1259219-1366287       18485    300009425   294.68      8367480   255.36   362.34
--     14  2886.17   1366288-1462049       16463    300004921   294.61      5938445   181.23   362.34
--     15  2541.84   1462050-1489721        4680     49862838    55.70      2483923    75.80   362.34
--   ---- -------- ------------------- --------- ------------ -------- ------------ -------- --------
--                                                 4250005305             102090504
-- Finished stage 'overlapErrorAdjustmentConfigure', reset canuIteration.
--
-- Running jobs.  First attempt out of 2.
----------------------------------------
-- Starting 'oea' concurrent execution on Fri Jan 16 13:34:25 2026 with 4532211.218 GB free disk space (15 processes; 62 concurrently)

    cd unitigging/3-overlapErrorAdjustment
    ./oea.sh 1 > ./oea.000001.out 2>&1
    ./oea.sh 2 > ./oea.000002.out 2>&1
    ./oea.sh 3 > ./oea.000003.out 2>&1
    ./oea.sh 4 > ./oea.000004.out 2>&1
    ./oea.sh 5 > ./oea.000005.out 2>&1
    ./oea.sh 6 > ./oea.000006.out 2>&1
    ./oea.sh 7 > ./oea.000007.out 2>&1
    ./oea.sh 8 > ./oea.000008.out 2>&1
    ./oea.sh 9 > ./oea.000009.out 2>&1
    ./oea.sh 10 > ./oea.000010.out 2>&1
    ./oea.sh 11 > ./oea.000011.out 2>&1
    ./oea.sh 12 > ./oea.000012.out 2>&1
    ./oea.sh 13 > ./oea.000013.out 2>&1
    ./oea.sh 14 > ./oea.000014.out 2>&1
    ./oea.sh 15 > ./oea.000015.out 2>&1

-- Finished on Fri Jan 16 14:22:45 2026 (2900 seconds) with 4530758.218 GB free disk space
----------------------------------------
-- Found 15 overlap error adjustment output files.
-- Finished stage 'overlapErrorAdjustmentCheck', reset canuIteration.
----------------------------------------
-- Starting command on Fri Jan 16 14:22:45 2026 with 4530758.203 GB free disk space

    cd unitigging/3-overlapErrorAdjustment
    /share/org/YZWL/yzwl_lixg/miniforge3/envs/canu_v.2.3/bin/loadErates \
      -S ../../A1-17.seqStore \
      -O ../A1-17.ovlStore \
      -L ./oea.files \
    > ./oea.apply.err 2>&1

-- Finished on Fri Jan 16 14:22:45 2026 (fast as lightning) with 4530758 GB free disk space
----------------------------------------
-- No report available.
-- Finished stage 'updateOverlapStore', reset canuIteration.
-- Finished stage 'unitig', reset canuIteration.
--
-- Running jobs.  First attempt out of 2.
----------------------------------------
-- Starting 'bat' concurrent execution on Fri Jan 16 14:22:45 2026 with 4530757.953 GB free disk space (1 processes; 1 concurrently)

    cd unitigging/4-unitigger
    ./unitigger.sh 1 > ./unitigger.000001.out 2>&1

-- Finished on Fri Jan 16 14:23:11 2026 (26 seconds) with 4530753.75 GB free disk space
----------------------------------------
-- Unitigger finished successfully.
--  
--  ERROR RATES
--  -----------
--                                                   --------threshold------
--  288065                       fraction error      fraction        percent
--  samples                              (1e-5)         error          error
--                   --------------------------      --------       --------
--  command line (-eg)                           ->     30.00        0.0300%
--  command line (-ef)                           ->  -----.--      ---.----%
--  command line (-eM)                           ->     30.00        0.0300%
--  mean + std.dev       0.30 +-  12 *     2.50  ->     30.34        0.0303%
--  median + mad         0.00 +-  12 *     0.00  ->      0.00        0.0000%
--  90th percentile                              ->      1.00        0.0010%  (enabled)
--  
--  BEST EDGE FILTERING
--  -------------------
--  At graph threshold 0.0300%, reads:
--    available to have edges:        40604
--    with at least one edge:         37430
--  
--  At max threshold 0.0300%, reads:  (not computed)
--    available to have edges:            0
--    with at least one edge:             0
--  
--  At tight threshold 0.0010%, reads with:
--    both edges below error threshold:     33671  (80.00% minReadsBest threshold = 29944)
--    one  edge  above error threshold:      2660
--    both edges above error threshold:      1099
--    at least one edge:                    37430
--  
--  At loose threshold 0.0300%, reads with:
--    both edges below error threshold:     37430  (80.00% minReadsBest threshold = 29944)
--    one  edge  above error threshold:         0
--    both edges above error threshold:         0
--    at least one edge:                    37430
--  
--  
--  INITIAL EDGES
--  -------- ----------------------------------------
--    211324 reads are contained
--   1245324 reads have no best edges (singleton)
--       243 reads have only one best edge (spur) 
--                 81 are mutual best
--     32830 reads have two best edges 
--                677 have one mutual best edge
--              31732 have two mutual best edges
--  
--  
--  FINAL EDGES
--  -------- ----------------------------------------
--    211324 reads are contained
--   1245698 reads have no best edges (singleton)
--       106 reads have only one best edge (spur) 
--                 82 are mutual best
--     32593 reads have two best edges 
--                530 have one mutual best edge
--              31740 have two mutual best edges
--  
--  
--  EDGE FILTERING
--  -------- ------------------------------------------
--         0 reads are ignored
--      9469 reads have a gap in overlap coverage
--       188 reads have lopsided best edges
-- Found, in version 1, after unitig construction:
--   contigs:      102 sequences, total length 68701758 bp (including 123 repeats of total length 3141637 bp).
--   bubbles:      83 sequences, total length 2266964 bp.
--   unassembled:  11594 sequences, total length 137597246 bp.
--
-- Contig sizes based on genome size 85mbp:
--
--            NG (bp)  LG (contigs)    sum (bp)
--         ----------  ------------  ----------
--     10     8764220             1     8764220
--     20     6428972             3    22186434
--     30     6251888             4    28438322
--     40     3402753             6    36781181
--     50     2511579             9    44673698
--     60     2005142            12    51433706
--     70     1522481            17    60127162
--     80       20433            64    68011667
--
-- Finished stage 'unitigCheck', reset canuIteration.
----------------------------------------
-- Starting command on Fri Jan 16 14:23:11 2026 with 4530753.734 GB free disk space

    cd unitigging
    /share/org/YZWL/yzwl_lixg/miniforge3/envs/canu_v.2.3/bin/utgcns \
      -S ../A1-17.seqStore \
      -T  ./A1-17.ctgStore 1 \
      -partition 0.8 1.5 0.1 \
    > ./A1-17.ctgStore/partitioning.log 2>&1

-- Finished on Fri Jan 16 14:23:20 2026 (9 seconds) with 4530752.484 GB free disk space
----------------------------------------
-- Using slow alignment for consensus (iteration '0').
-- Configured 10 consensus jobs.
-- Finished stage 'consensusConfigure', reset canuIteration.
--
-- Local: cns       13.000 GB    8 CPUs x  11 jobs   143.000 GB  88 CPUs  (consensus)
--
--
-- Running jobs.  First attempt out of 2.
----------------------------------------
-- Starting 'cns' concurrent execution on Fri Jan 16 14:23:20 2026 with 4530752.453 GB free disk space (10 processes; 11 concurrently)

    cd unitigging/5-consensus
    ./consensus.sh 1 > ./consensus.000001.out 2>&1
    ./consensus.sh 2 > ./consensus.000002.out 2>&1
    ./consensus.sh 3 > ./consensus.000003.out 2>&1
    ./consensus.sh 4 > ./consensus.000004.out 2>&1
    ./consensus.sh 5 > ./consensus.000005.out 2>&1
    ./consensus.sh 6 > ./consensus.000006.out 2>&1
    ./consensus.sh 7 > ./consensus.000007.out 2>&1
    ./consensus.sh 8 > ./consensus.000008.out 2>&1
    ./consensus.sh 9 > ./consensus.000009.out 2>&1
    ./consensus.sh 10 > ./consensus.000010.out 2>&1

-- Finished on Fri Jan 16 14:31:23 2026 (483 seconds) with 4530338.734 GB free disk space
----------------------------------------
-- Using slow alignment for consensus (iteration '1').
-- Configured 10 consensus jobs.
-- All 10 consensus jobs finished successfully.
-- Finished stage 'consensusCheck', reset canuIteration.
-- Using slow alignment for consensus (iteration '0').
-- Configured 10 consensus jobs.
----------------------------------------
-- Starting command on Fri Jan 16 14:31:23 2026 with 4530338.687 GB free disk space

    cd unitigging
    /share/org/YZWL/yzwl_lixg/miniforge3/envs/canu_v.2.3/bin/tgStoreLoad \
      -S ../A1-17.seqStore \
      -T  ./A1-17.ctgStore 2 \
      -L ./5-consensus/ctgcns.files \
    > ./5-consensus/ctgcns.files.ctgStoreLoad.err 2>&1

-- Finished on Fri Jan 16 14:31:24 2026 (one second) with 4530338.093 GB free disk space
----------------------------------------
----------------------------------------
-- Starting command on Fri Jan 16 14:31:24 2026 with 4530338.093 GB free disk space

    cd unitigging
    /share/org/YZWL/yzwl_lixg/miniforge3/envs/canu_v.2.3/bin/tgTigDisplay \
      -S ../A1-17.seqStore \
      -b \
      -o ../A1-17.contigs.unsorted.bam \
      -L ./5-consensus/ctgcns.files \
    > ./5-consensus/ctgcns.files.contigs.bam.err 2>&1

-- Finished on Fri Jan 16 14:34:42 2026 (198 seconds) with 4529130.531 GB free disk space
----------------------------------------
----------------------------------------
-- Starting command on Fri Jan 16 14:34:45 2026 with 4529130.531 GB free disk space

    cd .
    samtools sort \
      --write-index \
      --threads 2 \
      -o ./A1-17.contigs.bam ./A1-17.contigs.unsorted.bam \
    > ./ctgcns.bam.err 2>&1

-- Finished on Fri Jan 16 14:35:47 2026 (62 seconds) with 4529104 GB free disk space
----------------------------------------
-- Purging consensus output after loading to ctgStore.
-- Purged 10 .cns outputs.
----------------------------------------
-- Starting command on Fri Jan 16 14:35:47 2026 with 4529105.109 GB free disk space

    cd unitigging
    /share/org/YZWL/yzwl_lixg/miniforge3/envs/canu_v.2.3/bin/tgStoreDump \
      -S ../A1-17.seqStore \
      -T ./A1-17.ctgStore 2 \
      -sizes -s 85000000 \
    > ./A1-17.ctgStore/seqDB.v002.sizes.txt
ZERO length suplied to intervalList::add(), ignoring interval.
ZERO length suplied to intervalList::add(), ignoring interval.
ZERO length suplied to intervalList::add(), ignoring interval.
ZERO length suplied to intervalList::add(), ignoring interval.
ZERO length suplied to intervalList::add(), ignoring interval.
ZERO length suplied to intervalList::add(), ignoring interval.
ZERO length suplied to intervalList::add(), ignoring interval.
ZERO length suplied to intervalList::add(), ignoring interval.
ZERO length suplied to intervalList::add(), ignoring interval.
ZERO length suplied to intervalList::add(), ignoring interval.
ZERO length suplied to intervalList::add(), ignoring interval.
ZERO length suplied to intervalList::add(), ignoring interval.
ZERO length suplied to intervalList::add(), ignoring interval.
ZERO length suplied to intervalList::add(), ignoring interval.
ZERO length suplied to intervalList::add(), ignoring interval.
ZERO length suplied to intervalList::add(), ignoring interval.
ZERO length suplied to intervalList::add(), ignoring interval.
ZERO length suplied to intervalList::add(), ignoring interval.
ZERO length suplied to intervalList::add(), ignoring interval.
ZERO length suplied to intervalList::add(), ignoring interval.
ZERO length suplied to intervalList::add(), ignoring interval.
ZERO length suplied to intervalList::add(), ignoring interval.
ZERO length suplied to intervalList::add(), ignoring interval.
ZERO length suplied to intervalList::add(), ignoring interval.
ZERO length suplied to intervalList::add(), ignoring interval.
ZERO length suplied to intervalList::add(), ignoring interval.

-- Finished on Fri Jan 16 14:35:48 2026 (one second) with 4529105.109 GB free disk space
----------------------------------------
-- Found, in version 2, after consensus generation:
--   contigs:      102 sequences, total length 89674368 bp (including 123 repeats of total length 4367519 bp).
--   bubbles:      83 sequences, total length 3087308 bp.
--   unassembled:  11594 sequences, total length 188075329 bp.
--
-- Contig sizes based on genome size 85mbp:
--
--            NG (bp)  LG (contigs)    sum (bp)
--         ----------  ------------  ----------
--     10    11389598             1    11389598
--     20     9096912             2    20486510
--     30     8380016             3    28866526
--     40     8119095             4    36985621
--     50     6412815             5    43398436
--     60     3615825             7    51457558
--     70     3193754            10    61320248
--     80     2596643            13    69544287
--     90     1981953            17    78295651
--    100     1575629            21    85319969
--
-- Finished stage 'consensusLoad', reset canuIteration.
----------------------------------------
-- Starting command on Fri Jan 16 14:35:48 2026 with 4529105.093 GB free disk space

    cd .
    /share/org/YZWL/yzwl_lixg/miniforge3/envs/canu_v.2.3/bin/tgStoreDump \
      -S ./A1-17.seqStore \
      -T ./unitigging/A1-17.ctgStore 2 \
      -o ./A1-17.contigs \
      -layout \
    > ./A1-17.contigs.layout.err 2>&1

-- Finished on Fri Jan 16 14:35:48 2026 (in the blink of an eye) with 4529105.062 GB free disk space
----------------------------------------
----------------------------------------
-- Starting command on Fri Jan 16 14:35:48 2026 with 4529105.062 GB free disk space

    cd .
    /share/org/YZWL/yzwl_lixg/miniforge3/envs/canu_v.2.3/bin/tgStoreDump \
      -S ./A1-17.seqStore \
      -T ./unitigging/A1-17.ctgStore 2 \
      -consensus -fasta \
      -unassembled \
    > ./A1-17.unassembled.fasta
    2> ./A1-17.unassembled.err
ZERO length suplied to intervalList::add(), ignoring interval.
ZERO length suplied to intervalList::add(), ignoring interval.
ZERO length suplied to intervalList::add(), ignoring interval.
ZERO length suplied to intervalList::add(), ignoring interval.
ZERO length suplied to intervalList::add(), ignoring interval.
ZERO length suplied to intervalList::add(), ignoring interval.
ZERO length suplied to intervalList::add(), ignoring interval.
ZERO length suplied to intervalList::add(), ignoring interval.
ZERO length suplied to intervalList::add(), ignoring interval.
ZERO length suplied to intervalList::add(), ignoring interval.
ZERO length suplied to intervalList::add(), ignoring interval.
ZERO length suplied to intervalList::add(), ignoring interval.
ZERO length suplied to intervalList::add(), ignoring interval.
ZERO length suplied to intervalList::add(), ignoring interval.
ZERO length suplied to intervalList::add(), ignoring interval.
ZERO length suplied to intervalList::add(), ignoring interval.
ZERO length suplied to intervalList::add(), ignoring interval.
ZERO length suplied to intervalList::add(), ignoring interval.
ZERO length suplied to intervalList::add(), ignoring interval.
ZERO length suplied to intervalList::add(), ignoring interval.
ZERO length suplied to intervalList::add(), ignoring interval.
ZERO length suplied to intervalList::add(), ignoring interval.
ZERO length suplied to intervalList::add(), ignoring interval.
ZERO length suplied to intervalList::add(), ignoring interval.
ZERO length suplied to intervalList::add(), ignoring interval.
ZERO length suplied to intervalList::add(), ignoring interval.

-- Finished on Fri Jan 16 14:35:49 2026 (one second) with 4529104.875 GB free disk space
----------------------------------------
----------------------------------------
-- Starting command on Fri Jan 16 14:35:49 2026 with 4529104.875 GB free disk space

    cd .
    /share/org/YZWL/yzwl_lixg/miniforge3/envs/canu_v.2.3/bin/tgStoreDump \
      -S ./A1-17.seqStore \
      -T ./unitigging/A1-17.ctgStore 2 \
      -consensus -fasta \
      -contigs \
    > ./A1-17.contigs.fasta
    2> ./A1-17.contigs.err
ZERO length suplied to intervalList::add(), ignoring interval.
ZERO length suplied to intervalList::add(), ignoring interval.
ZERO length suplied to intervalList::add(), ignoring interval.
ZERO length suplied to intervalList::add(), ignoring interval.
ZERO length suplied to intervalList::add(), ignoring interval.
ZERO length suplied to intervalList::add(), ignoring interval.
ZERO length suplied to intervalList::add(), ignoring interval.
ZERO length suplied to intervalList::add(), ignoring interval.
ZERO length suplied to intervalList::add(), ignoring interval.
ZERO length suplied to intervalList::add(), ignoring interval.
ZERO length suplied to intervalList::add(), ignoring interval.
ZERO length suplied to intervalList::add(), ignoring interval.
ZERO length suplied to intervalList::add(), ignoring interval.
ZERO length suplied to intervalList::add(), ignoring interval.
ZERO length suplied to intervalList::add(), ignoring interval.
ZERO length suplied to intervalList::add(), ignoring interval.
ZERO length suplied to intervalList::add(), ignoring interval.
ZERO length suplied to intervalList::add(), ignoring interval.
ZERO length suplied to intervalList::add(), ignoring interval.
ZERO length suplied to intervalList::add(), ignoring interval.
ZERO length suplied to intervalList::add(), ignoring interval.
ZERO length suplied to intervalList::add(), ignoring interval.
ZERO length suplied to intervalList::add(), ignoring interval.
ZERO length suplied to intervalList::add(), ignoring interval.
ZERO length suplied to intervalList::add(), ignoring interval.
ZERO length suplied to intervalList::add(), ignoring interval.

-- Finished on Fri Jan 16 14:35:50 2026 (one second) with 4529104.765 GB free disk space
----------------------------------------
-- Finished stage 'generateOutputs', reset canuIteration.
--
-- Assembly 'A1-17' finished in '/share/org/YZWL/yzwl_lixg/project/28.大豆疫霉菌三代基因组/03.hicanu/A1-17/01.raw_output'.
--
-- Summary saved in 'A1-17.report'.
--
-- Sequences saved:
--   Contigs       -> 'A1-17.contigs.fasta'
--   Unassembled   -> 'A1-17.unassembled.fasta'
--
-- Read layouts saved:
--   Contigs       -> 'A1-17.contigs.layout'.
--
-- Bye.

2026-01-16 14:35:50.122 - WARNING - 输出文件不存在|Output file does not exist: /share/org/YZWL/yzwl_lixg/project/28.大豆疫霉菌三代基因组/03.hicanu/A1-17/01.raw_output/A1-17.unitigs.fasta
Job 68889943 stderr output:

