2026-01-15 19:51:37.947 - WARNING - 命令错误输出|Command stderr:
-- canu master +27 changes (r10515 2a41e933b8de6ed66723d75d36dd071b46d2c347)
--
-- CITATIONS
--
-- For assemblies of PacBio HiFi reads:
--   Nurk S, Walenz BP, Rhiea A, Vollger MR, Logsdon GA, Grothe R, Miga KH, Eichler EE, Phillippy AM, Koren S.
--   HiCanu: accurate assembly of segmental duplications, satellites, and allelic variants from high-fidelity long reads.
--   biorXiv. 2020.
--   https://doi.org/10.1101/2020.03.14.992248
-- 
-- Read and contig alignments during correction and consensus use:
--   Šošic M, Šikic M.
--   Edlib: a C/C ++ library for fast, exact sequence alignment using edit distance.
--   Bioinformatics. 2017 May 1;33(9):1394-1395.
--   http://doi.org/10.1093/bioinformatics/btw753
-- 
-- Overlaps are generated using:
--   Berlin K, et al.
--   Assembling large genomes with single-molecule sequencing and locality-sensitive hashing.
--   Nat Biotechnol. 2015 Jun;33(6):623-30.
--   http://doi.org/10.1038/nbt.3238
-- 
--   Myers EW, et al.
--   A Whole-Genome Assembly of Drosophila.
--   Science. 2000 Mar 24;287(5461):2196-204.
--   http://doi.org/10.1126/science.287.5461.2196
-- 
-- Contig consensus sequences are generated using an algorithm derived from pbdagcon:
--   Chin CS, et al.
--   Nonhybrid, finished microbial genome assemblies from long-read SMRT sequencing data.
--   Nat Methods. 2013 Jun;10(6):563-9
--   http://doi.org/10.1038/nmeth.2474
-- 
-- CONFIGURE CANU
--
-- Detected Java(TM) Runtime Environment '17.0.15-internal' (from '/share/org/YZWL/yzwl_lixg/.local/bin/java') without -d64 support.
--
-- WARNING:
-- WARNING:  Failed to run gnuplot using command 'gnuplot'.
-- WARNING:  Plots will be disabled.
-- WARNING:
--
-- Detected samtools version '1.22' / htslib version 'htscodecs=1.6.3' (from 'samtools').
--
-- Detected 88 CPUs and 503 gigabytes of memory on the local machine.
--
-- Detected Slurm with 'sinfo' binary in /opt/skyformai/bin/sinfo.
--          Slurm disabled by useGrid=false
--
-- Detected  '' with 'pbsnodes' binary in /opt/skyformai/bin/pbsnodes.
--           disabled by useGrid=false
--
-- Detected LSF with 'bsub' binary in /opt/skyformai/bin/bsub.
--          LSF disabled by useGrid=false
--
-- Local machine mode enabled; grid support not detected or not allowed.
--
-- Found trimmed raw PacBio HiFi reads in the input files.
--
--                                (tag)Concurrency
--                         (tag)Threads          |
--                (tag)Memory         |          |
--        (tag)             |         |          |       total usage      algorithm
--        -------  ----------  --------   --------  --------------------  -----------------------------
-- Local: meryl     12.000 GB    4 CPUs x  22 jobs   264.000 GB  88 CPUs  (k-mer counting)
-- Local: cormhap   13.000 GB   11 CPUs x   8 jobs   104.000 GB  88 CPUs  (overlap detection with mhap)
-- Local: obtovl     8.000 GB    8 CPUs x  11 jobs    88.000 GB  88 CPUs  (overlap detection)
-- Local: utgovl     8.000 GB    8 CPUs x  11 jobs    88.000 GB  88 CPUs  (overlap detection)
-- Local: cor        -.--- GB    4 CPUs x   - jobs     -.--- GB   - CPUs  (read correction)
-- Local: ovb        4.000 GB    1 CPU  x  88 jobs   352.000 GB  88 CPUs  (overlap store bucketizer)
-- Local: ovs        8.000 GB    1 CPU  x  62 jobs   496.000 GB  62 CPUs  (overlap store sorting)
-- Local: red       16.000 GB    4 CPUs x  22 jobs   352.000 GB  88 CPUs  (read error detection)
-- Local: oea        8.000 GB    1 CPU  x  62 jobs   496.000 GB  62 CPUs  (overlap error adjustment)
-- Local: bat       32.000 GB    8 CPUs x   1 job     32.000 GB   8 CPUs  (contig construction with bogart)
-- Local: cns        -.--- GB    8 CPUs x   - jobs     -.--- GB   - CPUs  (consensus)
--
-- Generating assembly 'A2-1' in '/share/org/YZWL/yzwl_lixg/project/28.大豆疫霉菌三代基因组/03.hicanu/A2-1/01.raw_output':
--   genomeSize:
--     85000000
--
--   Overlap Generation Limits:
--     corOvlErrorRate 0.0000 (  0.00%)
--     obtOvlErrorRate 0.0250 (  2.50%)
--     utgOvlErrorRate 0.0100 (  1.00%)
--
--   Overlap Processing Limits:
--     corErrorRate    0.0000 (  0.00%)
--     obtErrorRate    0.0250 (  2.50%)
--     utgErrorRate    0.0003 (  0.03%)
--     cnsErrorRate    0.0500 (  5.00%)
--
--   Stages to run:
--     assemble HiFi reads.
--
--
-- BEGIN STORE CREATION
----------------------------------------
-- Starting command on Thu Jan 15 18:28:20 2026 with 4585837.093 GB free disk space

    cd .
    ./A2-1.seqStore.sh \
    > ./A2-1.seqStore.err 2>&1

-- Finished on Thu Jan 15 18:34:51 2026 (391 seconds) with 4584702.859 GB free disk space
----------------------------------------
--
-- In sequence store './A2-1.seqStore':
--   Found 252228 reads.
--   Found 4250001127 bases (50 times coverage).
--    Histogram of corrected reads:
--    
--    G=4250001127                       sum of  ||               length     num
--    NG         length     index       lengths  ||                range    seqs
--    ----- ------------ --------- ------------  ||  ------------------- -------
--    00010        27007     14664    425000761  ||       1226-2340         8367|------------------------
--    00020        25041     31055    850025229  ||       2341-3455        11944|----------------------------------
--    00030        23660     48533   1275014301  ||       3456-4570        10770|-------------------------------
--    00040        22541     66947   1700010815  ||       4571-5685         9135|--------------------------
--    00050        21533     86242   2125007336  ||       5686-6800         8045|-----------------------
--    00060        20540    106445   2550020952  ||       6801-7915         6957|--------------------
--    00070        19430    127699   2975016225  ||       7916-9030         6059|-----------------
--    00080        17793    150458   3400014367  ||       9031-10145        5378|----------------
--    00090        11849    178205   3825003475  ||      10146-11260        4990|--------------
--    00100         1226    252228   4250001127  ||      11261-12375        4478|-------------
--    001.000x              252228   4250001127  ||      12376-13490        4064|------------
--                                               ||      13491-14605        3726|-----------
--                                               ||      14606-15720        4248|------------
--                                               ||      15721-16835        5746|-----------------
--                                               ||      16836-17950        9595|---------------------------
--                                               ||      17951-19065       15099|-------------------------------------------
--                                               ||      19066-20180       20082|---------------------------------------------------------
--                                               ||      20181-21295       22476|---------------------------------------------------------------
--                                               ||      21296-22410       21790|--------------------------------------------------------------
--                                               ||      22411-23525       18702|-----------------------------------------------------
--                                               ||      23526-24640       15011|-------------------------------------------
--                                               ||      24641-25755       11582|---------------------------------
--                                               ||      25756-26870        8458|------------------------
--                                               ||      26871-27985        5966|-----------------
--                                               ||      27986-29100        3983|------------
--                                               ||      29101-30215        2589|--------
--                                               ||      30216-31330        1520|-----
--                                               ||      31331-32445         809|---
--                                               ||      32446-33560         382|--
--                                               ||      33561-34675         179|-
--                                               ||      34676-35790          73|-
--                                               ||      35791-36905          10|-
--                                               ||      36906-38020           3|-
--                                               ||      38021-39135           4|-
--                                               ||      39136-40250           1|-
--                                               ||      40251-41365           2|-
--                                               ||      41366-42480           1|-
--                                               ||      42481-43595           1|-
--                                               ||      43596-44710           1|-
--                                               ||      44711-45825           2|-
--    
--
-- In sequence store './A2-1.seqStore':
--   Found 252228 reads.
--   Found 4250001127 bases (50 times coverage).
--    Histogram of corrected-trimmed reads:
--    
--    G=4250001127                       sum of  ||               length     num
--    NG         length     index       lengths  ||                range    seqs
--    ----- ------------ --------- ------------  ||  ------------------- -------
--    00010        27007     14664    425000761  ||       1226-2340         8367|------------------------
--    00020        25041     31055    850025229  ||       2341-3455        11944|----------------------------------
--    00030        23660     48533   1275014301  ||       3456-4570        10770|-------------------------------
--    00040        22541     66947   1700010815  ||       4571-5685         9135|--------------------------
--    00050        21533     86242   2125007336  ||       5686-6800         8045|-----------------------
--    00060        20540    106445   2550020952  ||       6801-7915         6957|--------------------
--    00070        19430    127699   2975016225  ||       7916-9030         6059|-----------------
--    00080        17793    150458   3400014367  ||       9031-10145        5378|----------------
--    00090        11849    178205   3825003475  ||      10146-11260        4990|--------------
--    00100         1226    252228   4250001127  ||      11261-12375        4478|-------------
--    001.000x              252228   4250001127  ||      12376-13490        4064|------------
--                                               ||      13491-14605        3726|-----------
--                                               ||      14606-15720        4248|------------
--                                               ||      15721-16835        5746|-----------------
--                                               ||      16836-17950        9595|---------------------------
--                                               ||      17951-19065       15099|-------------------------------------------
--                                               ||      19066-20180       20082|---------------------------------------------------------
--                                               ||      20181-21295       22476|---------------------------------------------------------------
--                                               ||      21296-22410       21790|--------------------------------------------------------------
--                                               ||      22411-23525       18702|-----------------------------------------------------
--                                               ||      23526-24640       15011|-------------------------------------------
--                                               ||      24641-25755       11582|---------------------------------
--                                               ||      25756-26870        8458|------------------------
--                                               ||      26871-27985        5966|-----------------
--                                               ||      27986-29100        3983|------------
--                                               ||      29101-30215        2589|--------
--                                               ||      30216-31330        1520|-----
--                                               ||      31331-32445         809|---
--                                               ||      32446-33560         382|--
--                                               ||      33561-34675         179|-
--                                               ||      34676-35790          73|-
--                                               ||      35791-36905          10|-
--                                               ||      36906-38020           3|-
--                                               ||      38021-39135           4|-
--                                               ||      39136-40250           1|-
--                                               ||      40251-41365           2|-
--                                               ||      41366-42480           1|-
--                                               ||      42481-43595           1|-
--                                               ||      43596-44710           1|-
--                                               ||      44711-45825           2|-
--    
--
-- Correction skipped; not enabled.
--
-- Trimming skipped; not enabled.
--
-- BEGIN ASSEMBLY
----------------------------------------
-- Starting command on Thu Jan 15 18:34:52 2026 with 4584702.812 GB free disk space

    cd unitigging/0-mercounts
    ./meryl-configure.sh \
    > ./meryl-configure.err 2>&1

-- Finished on Thu Jan 15 18:34:53 2026 (one second) with 4584702.812 GB free disk space
----------------------------------------
--  segments   memory batches
--  -------- -------- -------
--        01 10.81 GB       2
--        02  5.61 GB       2
--        04  2.97 GB       2
--        06  2.15 GB       2
--        08  1.61 GB       2
--        12  1.07 GB       2
--        16  0.81 GB       2
--        20  0.65 GB       2
--        24  0.54 GB       2
--        32  0.41 GB       2
--        40  0.33 GB       2
--        48  -.-- GB       -  (segment size too small)
--        56  -.-- GB       -  (segment size too small)
--        64  -.-- GB       -  (segment size too small)
--        96  -.-- GB       -  (segment size too small)
--
--  For 252228 reads with 4250001127 bases, limit to 42 batches.
--  Will count kmers using 01 jobs, each using 12 GB and 4 threads.
--
-- Finished stage 'merylConfigure', reset canuIteration.
--
-- Running jobs.  First attempt out of 2.
----------------------------------------
-- Starting 'meryl' concurrent execution on Thu Jan 15 18:34:53 2026 with 4584702.781 GB free disk space (1 processes; 22 concurrently)

    cd unitigging/0-mercounts
    ./meryl-count.sh 1 > ./meryl-count.000001.out 2>&1

-- Finished on Thu Jan 15 18:38:25 2026 (212 seconds) with 4584095.015 GB free disk space
----------------------------------------
-- Found 1 Kmer counting (meryl) outputs.
-- Finished stage 'utg-merylCountCheck', reset canuIteration.
--
-- Running jobs.  First attempt out of 2.
----------------------------------------
-- Starting 'meryl' concurrent execution on Thu Jan 15 18:38:25 2026 with 4584094.984 GB free disk space (1 processes; 22 concurrently)

    cd unitigging/0-mercounts
    ./meryl-process.sh 1 > ./meryl-process.000001.out 2>&1

-- Finished on Thu Jan 15 18:38:32 2026 (7 seconds) with 4583885.421 GB free disk space
----------------------------------------
-- Meryl finished successfully.  Kmer frequency histogram:
--
-- WARNING: gnuplot failed.
--
----------------------------------------
--
--  22-mers                                                                                           Fraction
--    Occurrences   NumMers                                                                         Unique Total
--       1-     1         0                                                                        0.0000 0.0000
--       2-     2    347899 *                                                                      0.0077 0.0002
--       3-     4    101841                                                                        0.0093 0.0003
--       5-     7     30987                                                                        0.0103 0.0004
--       8-    11     10716                                                                        0.0108 0.0004
--      12-    16     14225                                                                        0.0109 0.0004
--      17-    22     90423                                                                        0.0113 0.0005
--      23-    29    543004 **                                                                     0.0140 0.0013
--      30-    37   3815199 ****************                                                       0.0296 0.0074
--      38-    46  13976694 ************************************************************           0.1323 0.0584
--      47-    56  16126586 ********************************************************************** 0.4639 0.2598
--      57-    67   5019797 *********************                                                  0.7981 0.5023
--      68-    79    730880 ***                                                                    0.8916 0.5823
--      80-    92    923505 ****                                                                   0.9069 0.5981
--      93-   106    895053 ***                                                                    0.9280 0.6239
--     107-   121    368835 *                                                                      0.9469 0.6503
--     122-   137    267118 *                                                                      0.9545 0.6625
--     138-   154    266282 *                                                                      0.9605 0.6734
--     155-   172    166705                                                                        0.9663 0.6853
--     173-   191    152777                                                                        0.9699 0.6935
--     192-   211    139619                                                                        0.9733 0.7022
--     212-   232    105699                                                                        0.9764 0.7109
--     233-   254     99277                                                                        0.9787 0.7180
--     255-   277     89343                                                                        0.9809 0.7256
--     278-   301     69645                                                                        0.9828 0.7329
--     302-   326     62037                                                                        0.9844 0.7391
--     327-   352     52114                                                                        0.9857 0.7451
--     353-   379     47998                                                                        0.9869 0.7506
--     380-   407     48592                                                                        0.9879 0.7560
--     408-   436     40512                                                                        0.9890 0.7619
--     437-   466     31792                                                                        0.9899 0.7672
--     467-   497     29318                                                                        0.9906 0.7717
--     498-   529     27256                                                                        0.9913 0.7760
--     530-   562     21577                                                                        0.9919 0.7804
--     563-   596     21296                                                                        0.9923 0.7840
--     597-   631     20411                                                                        0.9928 0.7878
--     632-   667     19722                                                                        0.9933 0.7917
--     668-   704     22634                                                                        0.9937 0.7957
--     705-   742     15847                                                                        0.9942 0.8005
--     743-   781     12116                                                                        0.9945 0.8041
--     782-   821     11250                                                                        0.9948 0.8069
--
--           0 (max occurrences)
--  3219221190 (total mers, non-unique)
--    45059283 (distinct mers, non-unique)
--           0 (unique mers)
-- Finished stage 'meryl-process', reset canuIteration.
--
-- Removing meryl database 'unitigging/0-mercounts/A2-1.ms22'.
--
-- OVERLAPPER (normal) (assembly) erate=0.01
--
----------------------------------------
-- Starting command on Thu Jan 15 18:38:32 2026 with 4583885.406 GB free disk space

    cd unitigging/1-overlapper
    /share/org/YZWL/yzwl_lixg/miniforge3/envs/canu_v.2.3/bin/overlapInCorePartition \
     -S  ../../A2-1.seqStore \
     -hl 160000000 \
     -rl 5000000000 \
     -ol 500 \
     -o  ./A2-1.partition \
    > ./A2-1.partition.err 2>&1

-- Finished on Thu Jan 15 18:38:32 2026 (lickety-split) with 4583885.39 GB free disk space
----------------------------------------
--
-- Configured 21 overlapInCore jobs.
-- Finished stage 'utg-overlapConfigure', reset canuIteration.
--
-- Running jobs.  First attempt out of 2.
----------------------------------------
-- Starting 'utgovl' concurrent execution on Thu Jan 15 18:38:32 2026 with 4583885.359 GB free disk space (21 processes; 11 concurrently)

    cd unitigging/1-overlapper
    ./overlap.sh 1 > ./overlap.000001.out 2>&1
    ./overlap.sh 2 > ./overlap.000002.out 2>&1
    ./overlap.sh 3 > ./overlap.000003.out 2>&1
    ./overlap.sh 4 > ./overlap.000004.out 2>&1
    ./overlap.sh 5 > ./overlap.000005.out 2>&1
    ./overlap.sh 6 > ./overlap.000006.out 2>&1
    ./overlap.sh 7 > ./overlap.000007.out 2>&1
    ./overlap.sh 8 > ./overlap.000008.out 2>&1
    ./overlap.sh 9 > ./overlap.000009.out 2>&1
    ./overlap.sh 10 > ./overlap.000010.out 2>&1
    ./overlap.sh 11 > ./overlap.000011.out 2>&1
    ./overlap.sh 12 > ./overlap.000012.out 2>&1
    ./overlap.sh 13 > ./overlap.000013.out 2>&1
    ./overlap.sh 14 > ./overlap.000014.out 2>&1
    ./overlap.sh 15 > ./overlap.000015.out 2>&1
    ./overlap.sh 16 > ./overlap.000016.out 2>&1
    ./overlap.sh 17 > ./overlap.000017.out 2>&1
    ./overlap.sh 18 > ./overlap.000018.out 2>&1
    ./overlap.sh 19 > ./overlap.000019.out 2>&1
    ./overlap.sh 20 > ./overlap.000020.out 2>&1
    ./overlap.sh 21 > ./overlap.000021.out 2>&1

-- Finished on Thu Jan 15 19:03:15 2026 (1483 seconds) with 4581135.468 GB free disk space
----------------------------------------
-- Found 21 overlapInCore output files.
--
-- overlapInCore compute 'unitigging/1-overlapper':
--   kmer hits
--     with no overlap       1326495512  452.952381 +- 38845522.75
--     with an overlap         26274010  3.33333333 +- 710401.051
--
--   overlaps                  26274010  3.33333333 +- 710401.051
--     contained                6859301  .380952381 +- 189696.078
--     dovetail                19414709  .952380952 +- 528661.029
--
--   overlaps rejected
--     multiple per pair              0           0 +- 0
--     bad short window               0           0 +- 0
--     bad long window                0           0 +- 0
-- Finished stage 'utg-overlapCheck', reset canuIteration.
----------------------------------------
-- Starting command on Thu Jan 15 19:03:15 2026 with 4581135.453 GB free disk space

    cd unitigging
    /share/org/YZWL/yzwl_lixg/miniforge3/envs/canu_v.2.3/bin/ovStoreConfig \
     -S ../A2-1.seqStore \
     -M 4-8 \
     -L ./1-overlapper/ovljob.files \
     -create ./A2-1.ovlStore.config \
     > ./A2-1.ovlStore.config.txt \
    2> ./A2-1.ovlStore.config.err

-- Finished on Thu Jan 15 19:03:16 2026 (one second) with 4581135.437 GB free disk space
----------------------------------------
--
-- Creating overlap store unitigging/A2-1.ovlStore using:
--      1 bucket
--      1 slice
--        using at most 2 GB memory each
--
-- Running jobs.  First attempt out of 2.
----------------------------------------
-- Starting 'ovS' concurrent execution on Thu Jan 15 19:03:16 2026 with 4581135.421 GB free disk space (1 processes; 62 concurrently)

    cd unitigging
    ./A2-1.ovlStore.sh 1 > ./A2-1.ovlStore.000001.out 2>&1

-- Finished on Thu Jan 15 19:03:27 2026 (11 seconds) with 4580935.687 GB free disk space
----------------------------------------
-- Checking store.
----------------------------------------
-- Starting command on Thu Jan 15 19:03:27 2026 with 4580935.687 GB free disk space

    cd unitigging
    /share/org/YZWL/yzwl_lixg/miniforge3/envs/canu_v.2.3/bin/ovStoreDump \
     -S ../A2-1.seqStore \
     -O  ./A2-1.ovlStore \
     -counts \
     > ./A2-1.ovlStore/counts.dat 2> ./A2-1.ovlStore/counts.err

-- Finished on Thu Jan 15 19:03:27 2026 (lickety-split) with 4580935.656 GB free disk space
----------------------------------------
--
-- Overlap store 'unitigging/A2-1.ovlStore' successfully constructed.
-- Found 52548020 overlaps for 248414 reads; 1235549 reads have no overlaps.
--
--
-- Purged 0.567 GB in 63 overlap output files.
----------------------------------------
-- Starting command on Thu Jan 15 19:03:28 2026 with 4580935.656 GB free disk space

    cd unitigging
    /share/org/YZWL/yzwl_lixg/miniforge3/envs/canu_v.2.3/bin/ovStoreStats \
     -C 50 \
     -S ../A2-1.seqStore \
     -O  ./A2-1.ovlStore \
     -o  ./A2-1.ovlStore \
     > ./A2-1.ovlStore.summary.err 2>&1

-- Finished on Thu Jan 15 19:03:35 2026 (7 seconds) with 4580933.5 GB free disk space
----------------------------------------
--
-- Overlap store 'unitigging/A2-1.ovlStore' contains:
--
--   category            reads     %          read length        feature size or coverage  analysis
--   ----------------  -------  -------  ----------------------  ------------------------  --------------------
--   middle-missing        133    0.05    15201.39 +- 7060.37        685.32 +- 633.56     (bad trimming)
--   middle-hump            10    0.00    14292.80 +- 6595.08       8235.70 +- 4807.95    (bad trimming)
--   no-5-prime            466    0.18    12316.56 +- 6269.35       1326.32 +- 2429.10    (bad trimming)
--   no-3-prime            574    0.23    10345.05 +- 6671.11       1090.35 +- 2288.86    (bad trimming)
--   
--   low-coverage          964    0.38     9483.87 +- 6256.95          6.23 +- 3.76       (easy to assemble, potential for lower quality consensus)
--   unique             209587   83.09    12978.94 +- 6167.97         47.23 +- 8.45       (easy to assemble, perfect, yay)
--   repeat-cont         16111    6.39    10481.44 +- 5667.23       1036.97 +- 774.05     (potential for consensus errors, no impact on assembly)
--   repeat-dove           266    0.11    20812.48 +- 1667.99        564.45 +- 559.14     (hard to assemble, likely won't assemble correctly or even at all)
--   
--   span-repeat          2240    0.89    14454.76 +- 5280.73       3161.69 +- 3905.15    (read spans a large repeat, usually easy to assemble)
--   uniq-repeat-cont    12137    4.81    13122.14 +- 5071.21                             (should be uniquely placed, low potential for consensus errors, no impact on assembly)
--   uniq-repeat-dove     2814    1.12    19419.49 +- 2830.66                             (will end contigs, potential to misassemble)
--   uniq-anchor          3112    1.23    14159.89 +- 5163.17       8363.31 +- 5396.74    (repeat read, with unique section, probable bad read)
-- Finished stage 'utg-createOverlapStore', reset canuIteration.
--
-- Loading read lengths.
-- Loading number of overlaps per read.
--
-- Configure RED for 16gb memory.
--                   Batches of at most (unlimited) reads.
--                                      500000000 bases.
--                   Expecting evidence of at most 536870912 bases per iteration.
--
--           Total                                               Reads                 Olaps Evidence
--    Job   Memory      Read Range         Reads        Bases   Memory        Olaps   Memory   Memory  (Memory in MB)
--   ---- -------- ------------------- --------- ------------ -------- ------------ -------- --------
--      1 16385.38         1-31355          5353    108959085 13300.84      1095591    12.54  1024.00
--      2 16385.19     31356-67113          6060    108958073 13300.74      1088169    12.45  1024.00
--      3 16385.09     67114-105984         6532    108946338 13299.32      1202965    13.77  1024.00
--      4 16384.54    105985-139038         5669    108904658 13294.20      1602343    18.34  1024.00
--      5 16384.92    139039-176807         6437    108955770 13300.47      1087918    12.45  1024.00
--      6 16385.53    176808-227265         8512    108898368 13293.53      1747784    20.00  1024.00
--      7 16384.03    227266-260109         5553    108922980 13296.44      1362329    15.59  1024.00
--      8 16384.60    260110-295375         6081    108936388 13298.09      1268022    14.51  1024.00
--      9 16386.29    295376-348099         8949    108909856 13294.94      1690819    19.35  1024.00
--     10 16387.04    348100-379881         5381    108980703 13303.48      1010698    11.57  1024.00
--     11 16384.19    379882-413824         5741    108915490 13295.53      1456150    16.66  1024.00
--     12 16384.01    413825-457484         7447    108946377 13299.35      1106052    12.66  1024.00
--     13 16385.03    457485-496830         6687    108934364 13297.86      1325609    15.17  1024.00
--     14 16384.20    496831-530373         5536    108900885 13293.74      1612999    18.46  1024.00
--     15 16385.58    530374-567664         6290    108960331 13301.02      1097591    12.56  1024.00
--     16 16385.27    567665-613511         7931    108901853 13293.93      1689914    19.34  1024.00
--     17 16385.29    613512-646178         5449    108933145 13297.67      1364324    15.61  1024.00
--     18 16384.78    646179-680897         5890    108933727 13297.76      1312270    15.02  1024.00
--     19 16387.04    680898-731232         8532    108918747 13296.01      1662180    19.02  1024.00
--     20 16386.31    731233-763169         5361    108983718 13303.85       914217    10.46  1024.00
--     21 16385.12    763170-797378         5688    108914911 13295.46      1543607    17.67  1024.00
--     22 16384.31    797379-838405         6964    108954698 13300.35      1045027    11.96  1024.00
--     23 16384.15    838406-877507         6791    108922597 13296.43      1373338    15.72  1024.00
--     24 16385.16    877508-910322         5645    108908714 13294.70      1613564    18.47  1024.00
--     25 16384.25    910323-948411         6414    108948763 13299.61      1104520    12.64  1024.00
--     26 16386.07    948412-996348         8158    108908782 13294.79      1685150    19.29  1024.00
--     27 16385.65    996349-1028608        5499    108940037 13298.52      1322075    15.13  1024.00
--     28 16384.70   1028609-1062902        5871    108935293 13297.95      1289168    14.75  1024.00
--     29 16385.82   1062903-1112153        8482    108908207 13294.73      1668569    19.10  1024.00
--     30 16385.12   1112154-1143763        5344    108970321 13302.21       953645    10.91  1024.00
--     31 16384.08   1143764-1177382        5625    108909166 13294.75      1513950    17.33  1024.00
--     32 16384.90   1177383-1218371        6907    108962304 13301.28      1015752    11.62  1024.00
--     33 16385.90   1218372-1258687        6892    108943735 13299.01      1300725    14.89  1024.00
--     34 16384.70   1258688-1290493        5498    108933522 13297.72      1309215    14.98  1024.00
--     35 16384.65   1290494-1325477        6015    108938579 13298.36      1248768    14.29  1024.00
--     36 16385.63   1325478-1371011        7773    108908913 13294.79      1646027    18.84  1024.00
--     37 16385.44   1371012-1402211        5403    108940547 13298.58      1298472    14.86  1024.00
--     38 16384.13   1402212-1435784        5725    108936398 13298.08      1227734    14.05  1024.00
--     39 16386.25   1435785-1483256        8021    108910879 13295.04      1678948    19.21  1024.00
--     40  3267.93   1483257-1483963         122      1603905   195.79        11822     0.14  1024.00
--   ---- -------- ------------------- --------- ------------ -------- ------------ -------- --------
--                                                 4250001127              52548020
-- Finished stage 'readErrorDetectionConfigure', reset canuIteration.
--
-- Running jobs.  First attempt out of 2.
----------------------------------------
-- Starting 'red' concurrent execution on Thu Jan 15 19:03:41 2026 with 4580933.453 GB free disk space (40 processes; 22 concurrently)

    cd unitigging/3-overlapErrorAdjustment
    ./red.sh 1 > ./red.000001.out 2>&1
    ./red.sh 2 > ./red.000002.out 2>&1
    ./red.sh 3 > ./red.000003.out 2>&1
    ./red.sh 4 > ./red.000004.out 2>&1
    ./red.sh 5 > ./red.000005.out 2>&1
    ./red.sh 6 > ./red.000006.out 2>&1
    ./red.sh 7 > ./red.000007.out 2>&1
    ./red.sh 8 > ./red.000008.out 2>&1
    ./red.sh 9 > ./red.000009.out 2>&1
    ./red.sh 10 > ./red.000010.out 2>&1
    ./red.sh 11 > ./red.000011.out 2>&1
    ./red.sh 12 > ./red.000012.out 2>&1
    ./red.sh 13 > ./red.000013.out 2>&1
    ./red.sh 14 > ./red.000014.out 2>&1
    ./red.sh 15 > ./red.000015.out 2>&1
    ./red.sh 16 > ./red.000016.out 2>&1
    ./red.sh 17 > ./red.000017.out 2>&1
    ./red.sh 18 > ./red.000018.out 2>&1
    ./red.sh 19 > ./red.000019.out 2>&1
    ./red.sh 20 > ./red.000020.out 2>&1
    ./red.sh 21 > ./red.000021.out 2>&1
    ./red.sh 22 > ./red.000022.out 2>&1
    ./red.sh 23 > ./red.000023.out 2>&1
    ./red.sh 24 > ./red.000024.out 2>&1
    ./red.sh 25 > ./red.000025.out 2>&1
    ./red.sh 26 > ./red.000026.out 2>&1
    ./red.sh 27 > ./red.000027.out 2>&1
    ./red.sh 28 > ./red.000028.out 2>&1
    ./red.sh 29 > ./red.000029.out 2>&1
    ./red.sh 30 > ./red.000030.out 2>&1
    ./red.sh 31 > ./red.000031.out 2>&1
    ./red.sh 32 > ./red.000032.out 2>&1
    ./red.sh 33 > ./red.000033.out 2>&1
    ./red.sh 34 > ./red.000034.out 2>&1
    ./red.sh 35 > ./red.000035.out 2>&1
    ./red.sh 36 > ./red.000036.out 2>&1
    ./red.sh 37 > ./red.000037.out 2>&1
    ./red.sh 38 > ./red.000038.out 2>&1
    ./red.sh 39 > ./red.000039.out 2>&1
    ./red.sh 40 > ./red.000040.out 2>&1

-- Finished on Thu Jan 15 19:14:58 2026 (677 seconds) with 4580894 GB free disk space
----------------------------------------
-- Found 40 read error detection output files.
-- Finished stage 'readErrorDetectionCheck', reset canuIteration.
--
-- Loading read lengths.
-- Loading number of overlaps per read.
--
-- Configure OEA for 8gb memory.
--                   Batches of at most (unlimited) reads.
--                                      300000000 bases.
--
--           Total                                               Reads                 Olaps  Adjusts
--    Job   Memory      Read Range         Reads        Bases   Memory        Olaps   Memory   Memory  (Memory in MB)
--   ---- -------- ------------------- --------- ------------ -------- ------------ -------- --------
--      1  2809.75         1-98075         16605    300022627   294.63      3231823    98.63   368.49
--      2  2839.86     98076-209851        19007    300007218   294.69      4216557   128.68   368.49
--      3  2808.19    209852-306263        16410    300003107   294.61      3181672    97.10   368.49
--      4  2833.00    306264-414445        18346    300006467   294.67      3992382   121.84   368.49
--      5  2821.59    414446-522325        18266    300004664   294.66      3618841   110.44   368.49
--      6  2828.45    522326-630713        18355    300021273   294.68      3842832   117.27   368.49
--      7  2829.61    630714-740193        18515    300022261   294.69      3880920   118.44   368.49
--      8  2813.55    740194-841028        17008    300008891   294.63      3356564   102.43   368.49
--      9  2829.23    841029-939279        16849    300001938   294.62      3870663   118.12   368.49
--     10  2835.68    939280-1046307       18250    300009916   294.67      4080178   124.52   368.49
--     11  2820.84   1046308-1153506       18259    300007145   294.67      3594260   109.69   368.49
--     12  2811.51   1153507-1260228       18056    300009597   294.66      3288569   100.36   368.49
--     13  2834.94   1260229-1364620       17967    300005340   294.66      4056425   123.79   368.49
--     14  2804.47   1364621-1456723       15751    300022787   294.60      3059835    93.38   368.49
--     15  2511.12   1456724-1483963        4584     49847896    55.68      1276499    38.96   368.49
--   ---- -------- ------------------- --------- ------------ -------- ------------ -------- --------
--                                                 4250001127              52548020
-- Finished stage 'overlapErrorAdjustmentConfigure', reset canuIteration.
--
-- Running jobs.  First attempt out of 2.
----------------------------------------
-- Starting 'oea' concurrent execution on Thu Jan 15 19:15:05 2026 with 4580893.906 GB free disk space (15 processes; 62 concurrently)

    cd unitigging/3-overlapErrorAdjustment
    ./oea.sh 1 > ./oea.000001.out 2>&1
    ./oea.sh 2 > ./oea.000002.out 2>&1
    ./oea.sh 3 > ./oea.000003.out 2>&1
    ./oea.sh 4 > ./oea.000004.out 2>&1
    ./oea.sh 5 > ./oea.000005.out 2>&1
    ./oea.sh 6 > ./oea.000006.out 2>&1
    ./oea.sh 7 > ./oea.000007.out 2>&1
    ./oea.sh 8 > ./oea.000008.out 2>&1
    ./oea.sh 9 > ./oea.000009.out 2>&1
    ./oea.sh 10 > ./oea.000010.out 2>&1
    ./oea.sh 11 > ./oea.000011.out 2>&1
    ./oea.sh 12 > ./oea.000012.out 2>&1
    ./oea.sh 13 > ./oea.000013.out 2>&1
    ./oea.sh 14 > ./oea.000014.out 2>&1
    ./oea.sh 15 > ./oea.000015.out 2>&1

-- Finished on Thu Jan 15 19:39:21 2026 (1456 seconds) with 4586210.218 GB free disk space
----------------------------------------
-- Found 15 overlap error adjustment output files.
-- Finished stage 'overlapErrorAdjustmentCheck', reset canuIteration.
----------------------------------------
-- Starting command on Thu Jan 15 19:39:21 2026 with 4586210.203 GB free disk space

    cd unitigging/3-overlapErrorAdjustment
    /share/org/YZWL/yzwl_lixg/miniforge3/envs/canu_v.2.3/bin/loadErates \
      -S ../../A2-1.seqStore \
      -O ../A2-1.ovlStore \
      -L ./oea.files \
    > ./oea.apply.err 2>&1

-- Finished on Thu Jan 15 19:39:21 2026 (in the blink of an eye) with 4586210.078 GB free disk space
----------------------------------------
-- No report available.
-- Finished stage 'updateOverlapStore', reset canuIteration.
-- Finished stage 'unitig', reset canuIteration.
--
-- Running jobs.  First attempt out of 2.
----------------------------------------
-- Starting 'bat' concurrent execution on Thu Jan 15 19:39:21 2026 with 4586210.031 GB free disk space (1 processes; 1 concurrently)

    cd unitigging/4-unitigger
    ./unitigger.sh 1 > ./unitigger.000001.out 2>&1

-- Finished on Thu Jan 15 19:39:37 2026 (16 seconds) with 4586209.875 GB free disk space
----------------------------------------
-- Unitigger finished successfully.
--  
--  ERROR RATES
--  -----------
--                                                   --------threshold------
--  282529                       fraction error      fraction        percent
--  samples                              (1e-5)         error          error
--                   --------------------------      --------       --------
--  command line (-eg)                           ->     30.00        0.0300%
--  command line (-ef)                           ->  -----.--      ---.----%
--  command line (-eM)                           ->     30.00        0.0300%
--  mean + std.dev       0.39 +-  12 *     2.86  ->     34.71        0.0347%
--  median + mad         0.00 +-  12 *     0.00  ->      0.00        0.0000%
--  90th percentile                              ->      1.00        0.0010%  (enabled)
--  
--  BEST EDGE FILTERING
--  -------------------
--  At graph threshold 0.0300%, reads:
--    available to have edges:        44505
--    with at least one edge:         39345
--  
--  At max threshold 0.0300%, reads:  (not computed)
--    available to have edges:            0
--    with at least one edge:             0
--  
--  At tight threshold 0.0010%, reads with:
--    both edges below error threshold:     34730  (80.00% minReadsBest threshold = 31476)
--    one  edge  above error threshold:      3281
--    both edges above error threshold:      1334
--    at least one edge:                    39345
--  
--  At loose threshold 0.0300%, reads with:
--    both edges below error threshold:     39345  (80.00% minReadsBest threshold = 31476)
--    one  edge  above error threshold:         0
--    both edges above error threshold:         0
--    at least one edge:                    39345
--  
--  
--  INITIAL EDGES
--  -------- ----------------------------------------
--    202440 reads are contained
--   1247942 reads have no best edges (singleton)
--       280 reads have only one best edge (spur) 
--                138 are mutual best
--     33301 reads have two best edges 
--                826 have one mutual best edge
--              32035 have two mutual best edges
--  
--  
--  FINAL EDGES
--  -------- ----------------------------------------
--    202440 reads are contained
--   1248263 reads have no best edges (singleton)
--       152 reads have only one best edge (spur) 
--                135 are mutual best
--     33108 reads have two best edges 
--                713 have one mutual best edge
--              32048 have two mutual best edges
--  
--  
--  EDGE FILTERING
--  -------- ------------------------------------------
--         0 reads are ignored
--     11093 reads have a gap in overlap coverage
--       161 reads have lopsided best edges
-- Found, in version 1, after unitig construction:
--   contigs:      128 sequences, total length 68558915 bp (including 193 repeats of total length 4303601 bp).
--   bubbles:      177 sequences, total length 4305252 bp.
--   unassembled:  15605 sequences, total length 191369105 bp.
--
-- Contig sizes based on genome size 85mbp:
--
--            NG (bp)  LG (contigs)    sum (bp)
--         ----------  ------------  ----------
--     10     6919036             2    14703855
--     20     6529169             3    21233024
--     30     6325747             4    27558771
--     40     3692870             6    35852400
--     50     2986585             9    45450256
--     60     2062021            12    52278570
--     70     1188990            18    60623320
--     80       18907            95    68014439
--
-- Finished stage 'unitigCheck', reset canuIteration.
----------------------------------------
-- Starting command on Thu Jan 15 19:39:37 2026 with 4586209.859 GB free disk space

    cd unitigging
    /share/org/YZWL/yzwl_lixg/miniforge3/envs/canu_v.2.3/bin/utgcns \
      -S ../A2-1.seqStore \
      -T  ./A2-1.ctgStore 1 \
      -partition 0.8 1.5 0.1 \
    > ./A2-1.ctgStore/partitioning.log 2>&1

-- Finished on Thu Jan 15 19:39:46 2026 (9 seconds) with 4586208.671 GB free disk space
----------------------------------------
-- Using slow alignment for consensus (iteration '0').
-- Configured 10 consensus jobs.
-- Finished stage 'consensusConfigure', reset canuIteration.
--
-- Local: cns       11.625 GB    8 CPUs x  11 jobs   127.875 GB  88 CPUs  (consensus)
--
--
-- Running jobs.  First attempt out of 2.
----------------------------------------
-- Starting 'cns' concurrent execution on Thu Jan 15 19:39:46 2026 with 4586208.64 GB free disk space (10 processes; 11 concurrently)

    cd unitigging/5-consensus
    ./consensus.sh 1 > ./consensus.000001.out 2>&1
    ./consensus.sh 2 > ./consensus.000002.out 2>&1
    ./consensus.sh 3 > ./consensus.000003.out 2>&1
    ./consensus.sh 4 > ./consensus.000004.out 2>&1
    ./consensus.sh 5 > ./consensus.000005.out 2>&1
    ./consensus.sh 6 > ./consensus.000006.out 2>&1
    ./consensus.sh 7 > ./consensus.000007.out 2>&1
    ./consensus.sh 8 > ./consensus.000008.out 2>&1
    ./consensus.sh 9 > ./consensus.000009.out 2>&1
    ./consensus.sh 10 > ./consensus.000010.out 2>&1

-- Finished on Thu Jan 15 19:46:57 2026 (431 seconds) with 4587092.812 GB free disk space
----------------------------------------
-- Using slow alignment for consensus (iteration '1').
-- Configured 10 consensus jobs.
-- All 10 consensus jobs finished successfully.
-- Finished stage 'consensusCheck', reset canuIteration.
-- Using slow alignment for consensus (iteration '0').
-- Configured 10 consensus jobs.
----------------------------------------
-- Starting command on Thu Jan 15 19:46:57 2026 with 4587092.765 GB free disk space

    cd unitigging
    /share/org/YZWL/yzwl_lixg/miniforge3/envs/canu_v.2.3/bin/tgStoreLoad \
      -S ../A2-1.seqStore \
      -T  ./A2-1.ctgStore 2 \
      -L ./5-consensus/ctgcns.files \
    > ./5-consensus/ctgcns.files.ctgStoreLoad.err 2>&1

-- Finished on Thu Jan 15 19:46:57 2026 (like a bat out of hell) with 4587092.031 GB free disk space
----------------------------------------
----------------------------------------
-- Starting command on Thu Jan 15 19:46:57 2026 with 4587092.031 GB free disk space

    cd unitigging
    /share/org/YZWL/yzwl_lixg/miniforge3/envs/canu_v.2.3/bin/tgTigDisplay \
      -S ../A2-1.seqStore \
      -b \
      -o ../A2-1.contigs.unsorted.bam \
      -L ./5-consensus/ctgcns.files \
    > ./5-consensus/ctgcns.files.contigs.bam.err 2>&1

-- Finished on Thu Jan 15 19:50:02 2026 (185 seconds) with 4587377.281 GB free disk space
----------------------------------------
----------------------------------------
-- Starting command on Thu Jan 15 19:50:02 2026 with 4587377.281 GB free disk space

    cd .
    samtools sort \
      --write-index \
      --threads 2 \
      -o ./A2-1.contigs.bam ./A2-1.contigs.unsorted.bam \
    > ./ctgcns.bam.err 2>&1

-- Finished on Thu Jan 15 19:51:35 2026 (93 seconds) with 4587445.984 GB free disk space
----------------------------------------
-- Purging consensus output after loading to ctgStore.
-- Purged 10 .cns outputs.
----------------------------------------
-- Starting command on Thu Jan 15 19:51:35 2026 with 4587447.984 GB free disk space

    cd unitigging
    /share/org/YZWL/yzwl_lixg/miniforge3/envs/canu_v.2.3/bin/tgStoreDump \
      -S ../A2-1.seqStore \
      -T ./A2-1.ctgStore 2 \
      -sizes -s 85000000 \
    > ./A2-1.ctgStore/seqDB.v002.sizes.txt
ZERO length suplied to intervalList::add(), ignoring interval.
ZERO length suplied to intervalList::add(), ignoring interval.
ZERO length suplied to intervalList::add(), ignoring interval.
ZERO length suplied to intervalList::add(), ignoring interval.
ZERO length suplied to intervalList::add(), ignoring interval.
ZERO length suplied to intervalList::add(), ignoring interval.
ZERO length suplied to intervalList::add(), ignoring interval.

-- Finished on Thu Jan 15 19:51:35 2026 (like a bat out of hell) with 4587447.984 GB free disk space
----------------------------------------
-- Found, in version 2, after consensus generation:
--   contigs:      128 sequences, total length 89499580 bp (including 193 repeats of total length 5925003 bp).
--   bubbles:      177 sequences, total length 5783051 bp.
--   unassembled:  15605 sequences, total length 258704148 bp.
--
-- Contig sizes based on genome size 85mbp:
--
--            NG (bp)  LG (contigs)    sum (bp)
--         ----------  ------------  ----------
--     10    10151281             1    10151281
--     20     8997038             2    19148319
--     30     8474869             3    27623188
--     40     8218052             4    35841240
--     50     4805333             6    46618714
--     60     4299935             8    55225042
--     70     3251225            10    62378223
--     80     2693430            12    68024899
--     90     1678312            17    77370428
--    100      684425            24    85028439
--
-- Finished stage 'consensusLoad', reset canuIteration.
----------------------------------------
-- Starting command on Thu Jan 15 19:51:35 2026 with 4587447.968 GB free disk space

    cd .
    /share/org/YZWL/yzwl_lixg/miniforge3/envs/canu_v.2.3/bin/tgStoreDump \
      -S ./A2-1.seqStore \
      -T ./unitigging/A2-1.ctgStore 2 \
      -o ./A2-1.contigs \
      -layout \
    > ./A2-1.contigs.layout.err 2>&1

-- Finished on Thu Jan 15 19:51:36 2026 (one second) with 4587447.937 GB free disk space
----------------------------------------
----------------------------------------
-- Starting command on Thu Jan 15 19:51:36 2026 with 4587447.937 GB free disk space

    cd .
    /share/org/YZWL/yzwl_lixg/miniforge3/envs/canu_v.2.3/bin/tgStoreDump \
      -S ./A2-1.seqStore \
      -T ./unitigging/A2-1.ctgStore 2 \
      -consensus -fasta \
      -unassembled \
    > ./A2-1.unassembled.fasta
    2> ./A2-1.unassembled.err
ZERO length suplied to intervalList::add(), ignoring interval.
ZERO length suplied to intervalList::add(), ignoring interval.
ZERO length suplied to intervalList::add(), ignoring interval.
ZERO length suplied to intervalList::add(), ignoring interval.
ZERO length suplied to intervalList::add(), ignoring interval.
ZERO length suplied to intervalList::add(), ignoring interval.
ZERO length suplied to intervalList::add(), ignoring interval.

-- Finished on Thu Jan 15 19:51:37 2026 (one second) with 4587447.671 GB free disk space
----------------------------------------
----------------------------------------
-- Starting command on Thu Jan 15 19:51:37 2026 with 4587447.671 GB free disk space

    cd .
    /share/org/YZWL/yzwl_lixg/miniforge3/envs/canu_v.2.3/bin/tgStoreDump \
      -S ./A2-1.seqStore \
      -T ./unitigging/A2-1.ctgStore 2 \
      -consensus -fasta \
      -contigs \
    > ./A2-1.contigs.fasta
    2> ./A2-1.contigs.err
ZERO length suplied to intervalList::add(), ignoring interval.
ZERO length suplied to intervalList::add(), ignoring interval.
ZERO length suplied to intervalList::add(), ignoring interval.
ZERO length suplied to intervalList::add(), ignoring interval.
ZERO length suplied to intervalList::add(), ignoring interval.
ZERO length suplied to intervalList::add(), ignoring interval.
ZERO length suplied to intervalList::add(), ignoring interval.

-- Finished on Thu Jan 15 19:51:37 2026 (in the blink of an eye) with 4587447.562 GB free disk space
----------------------------------------
-- Finished stage 'generateOutputs', reset canuIteration.
--
-- Assembly 'A2-1' finished in '/share/org/YZWL/yzwl_lixg/project/28.大豆疫霉菌三代基因组/03.hicanu/A2-1/01.raw_output'.
--
-- Summary saved in 'A2-1.report'.
--
-- Sequences saved:
--   Contigs       -> 'A2-1.contigs.fasta'
--   Unassembled   -> 'A2-1.unassembled.fasta'
--
-- Read layouts saved:
--   Contigs       -> 'A2-1.contigs.layout'.
--
-- Bye.

2026-01-15 19:51:37.949 - WARNING - 输出文件不存在|Output file does not exist: /share/org/YZWL/yzwl_lixg/project/28.大豆疫霉菌三代基因组/03.hicanu/A2-1/01.raw_output/A2-1.unitigs.fasta
Usage: biopytools ragtag [OPTIONS]
Try 'biopytools ragtag -h' for help.

Error: Invalid value for '-r' / '--reference': 文件不存在|File does not exist: /share/org/YZWL/yzwl_lixg/project/28.大豆疫霉菌三代基因组/04.ragtag/Psoja_T2T.fa
Usage: biopytools ragtag [OPTIONS]
Try 'biopytools ragtag -h' for help.

Error: Invalid value for '-r' / '--reference': 文件不存在|File does not exist: /share/org/YZWL/yzwl_lixg/project/28.大豆疫霉菌三代基因组/04.ragtag/Psoja_T2T.fa
mkdir: 无法创建目录 “04.ragtag/A2-1/hicanu/共线性”: No such file or directory
Usage: biopytools genomesyn [OPTIONS]
Try 'biopytools genomesyn -h' for help.

Error: Invalid value for '-i' / '--ref': Path '04.ragtag/A2-1/hifiasm/A2-1_RagTag_scaffolded.fa' does not exist.
Usage: biopytools genomesyn [OPTIONS]
Try 'biopytools genomesyn -h' for help.

Error: Invalid value for '-i' / '--ref': Path '04.ragtag/A2-1/hicanu/A2-1_RagTag_scaffolded.fa' does not exist.
Job 68882059 stderr output:

