Usage: biopytools ragtag [OPTIONS]
Try 'biopytools ragtag -h' for help.

Error: Invalid value for '-r' / '--reference': 文件不存在|File does not exist: /share/org/YZWL/yzwl_lixg/project/28.大豆疫霉菌三代基因组/04.ragtag/Psoja_T2T.fa
Usage: biopytools genomesyn [OPTIONS]
Try 'biopytools genomesyn -h' for help.

Error: Invalid value for '-i' / '--ref': Path '04.ragtag/A1-10/hifiasm/A1-10_RagTag_scaffolded.fa' does not exist.
2026-01-16 01:30:40.065 - WARNING - 命令错误输出|Command stderr:
-- canu master +27 changes (r10515 2a41e933b8de6ed66723d75d36dd071b46d2c347)
--
-- CITATIONS
--
-- For assemblies of PacBio HiFi reads:
--   Nurk S, Walenz BP, Rhiea A, Vollger MR, Logsdon GA, Grothe R, Miga KH, Eichler EE, Phillippy AM, Koren S.
--   HiCanu: accurate assembly of segmental duplications, satellites, and allelic variants from high-fidelity long reads.
--   biorXiv. 2020.
--   https://doi.org/10.1101/2020.03.14.992248
-- 
-- Read and contig alignments during correction and consensus use:
--   Šošic M, Šikic M.
--   Edlib: a C/C ++ library for fast, exact sequence alignment using edit distance.
--   Bioinformatics. 2017 May 1;33(9):1394-1395.
--   http://doi.org/10.1093/bioinformatics/btw753
-- 
-- Overlaps are generated using:
--   Berlin K, et al.
--   Assembling large genomes with single-molecule sequencing and locality-sensitive hashing.
--   Nat Biotechnol. 2015 Jun;33(6):623-30.
--   http://doi.org/10.1038/nbt.3238
-- 
--   Myers EW, et al.
--   A Whole-Genome Assembly of Drosophila.
--   Science. 2000 Mar 24;287(5461):2196-204.
--   http://doi.org/10.1126/science.287.5461.2196
-- 
-- Contig consensus sequences are generated using an algorithm derived from pbdagcon:
--   Chin CS, et al.
--   Nonhybrid, finished microbial genome assemblies from long-read SMRT sequencing data.
--   Nat Methods. 2013 Jun;10(6):563-9
--   http://doi.org/10.1038/nmeth.2474
-- 
-- CONFIGURE CANU
--
-- Detected Java(TM) Runtime Environment '17.0.15-internal' (from '/share/org/YZWL/yzwl_lixg/.local/bin/java') without -d64 support.
--
-- WARNING:
-- WARNING:  Failed to run gnuplot using command 'gnuplot'.
-- WARNING:  Plots will be disabled.
-- WARNING:
--
-- Detected samtools version '1.22' / htslib version 'htscodecs=1.6.3' (from 'samtools').
--
-- Detected 88 CPUs and 503 gigabytes of memory on the local machine.
--
-- Detected Slurm with 'sinfo' binary in /opt/skyformai/bin/sinfo.
--          Slurm disabled by useGrid=false
--
-- Detected  '' with 'pbsnodes' binary in /opt/skyformai/bin/pbsnodes.
--           disabled by useGrid=false
--
-- Detected LSF with 'bsub' binary in /opt/skyformai/bin/bsub.
--          LSF disabled by useGrid=false
--
-- Local machine mode enabled; grid support not detected or not allowed.
--
-- Found trimmed raw PacBio HiFi reads in the input files.
--
--                                (tag)Concurrency
--                         (tag)Threads          |
--                (tag)Memory         |          |
--        (tag)             |         |          |       total usage      algorithm
--        -------  ----------  --------   --------  --------------------  -----------------------------
-- Local: meryl     12.000 GB    4 CPUs x  22 jobs   264.000 GB  88 CPUs  (k-mer counting)
-- Local: cormhap   13.000 GB   11 CPUs x   8 jobs   104.000 GB  88 CPUs  (overlap detection with mhap)
-- Local: obtovl     8.000 GB    8 CPUs x  11 jobs    88.000 GB  88 CPUs  (overlap detection)
-- Local: utgovl     8.000 GB    8 CPUs x  11 jobs    88.000 GB  88 CPUs  (overlap detection)
-- Local: cor        -.--- GB    4 CPUs x   - jobs     -.--- GB   - CPUs  (read correction)
-- Local: ovb        4.000 GB    1 CPU  x  88 jobs   352.000 GB  88 CPUs  (overlap store bucketizer)
-- Local: ovs        8.000 GB    1 CPU  x  62 jobs   496.000 GB  62 CPUs  (overlap store sorting)
-- Local: red       16.000 GB    4 CPUs x  22 jobs   352.000 GB  88 CPUs  (read error detection)
-- Local: oea        8.000 GB    1 CPU  x  62 jobs   496.000 GB  62 CPUs  (overlap error adjustment)
-- Local: bat       32.000 GB    8 CPUs x   1 job     32.000 GB   8 CPUs  (contig construction with bogart)
-- Local: cns        -.--- GB    8 CPUs x   - jobs     -.--- GB   - CPUs  (consensus)
--
-- Generating assembly 'A1-10' in '/share/org/YZWL/yzwl_lixg/project/28.大豆疫霉菌三代基因组/03.hicanu/A1-10/01.raw_output':
--   genomeSize:
--     85000000
--
--   Overlap Generation Limits:
--     corOvlErrorRate 0.0000 (  0.00%)
--     obtOvlErrorRate 0.0250 (  2.50%)
--     utgOvlErrorRate 0.0100 (  1.00%)
--
--   Overlap Processing Limits:
--     corErrorRate    0.0000 (  0.00%)
--     obtErrorRate    0.0250 (  2.50%)
--     utgErrorRate    0.0003 (  0.03%)
--     cnsErrorRate    0.0500 (  5.00%)
--
--   Stages to run:
--     assemble HiFi reads.
--
--
-- BEGIN STORE CREATION
----------------------------------------
-- Starting command on Thu Jan 15 23:42:32 2026 with 4567996.703 GB free disk space

    cd .
    ./A1-10.seqStore.sh \
    > ./A1-10.seqStore.err 2>&1

-- Finished on Thu Jan 15 23:49:12 2026 (400 seconds) with 4567007.171 GB free disk space
----------------------------------------
--
-- In sequence store './A1-10.seqStore':
--   Found 243120 reads.
--   Found 4250008168 bases (50 times coverage).
--    Histogram of corrected reads:
--    
--    G=4250008168                       sum of  ||               length     num
--    NG         length     index       lengths  ||                range    seqs
--    ----- ------------ --------- ------------  ||  ------------------- -------
--    00010        27476     14349    425027182  ||       1252-2455         7504|---------------------
--    00020        25330     30508    850015261  ||       2456-3659        10514|-----------------------------
--    00030        23852     47818   1275017882  ||       3660-4863         9488|--------------------------
--    00040        22645     66119   1700012483  ||       4864-6067         8194|-----------------------
--    00050        21573     85351   2125015693  ||       6068-7271         7073|--------------------
--    00060        20541    105534   2550018014  ||       7272-8475         6250|-----------------
--    00070        19412    126802   2975023462  ||       8476-9679         5544|---------------
--    00080        17954    149507   3400009709  ||       9680-10883        5028|--------------
--    00090        13202    175585   3825008304  ||      10884-12087        4388|------------
--    00100         1252    243120   4250008168  ||      12088-13291        3816|-----------
--    001.000x              243120   4250008168  ||      13292-14495        3320|---------
--                                               ||      14496-15699        4085|------------
--                                               ||      15700-16903        7240|--------------------
--                                               ||      16904-18107       13274|------------------------------------
--                                               ||      18108-19311       18850|---------------------------------------------------
--                                               ||      19312-20515       22570|-------------------------------------------------------------
--                                               ||      20516-21719       23359|---------------------------------------------------------------
--                                               ||      21720-22923       21063|---------------------------------------------------------
--                                               ||      22924-24127       17395|-----------------------------------------------
--                                               ||      24128-25331       13668|-------------------------------------
--                                               ||      25332-26535       10199|----------------------------
--                                               ||      26536-27739        7342|--------------------
--                                               ||      27740-28943        5124|--------------
--                                               ||      28944-30147        3303|---------
--                                               ||      30148-31351        2155|------
--                                               ||      31352-32555        1231|----
--                                               ||      32556-33759         686|--
--                                               ||      33760-34963         287|-
--                                               ||      34964-36167         112|-
--                                               ||      36168-37371          42|-
--                                               ||      37372-38575           8|-
--                                               ||      38576-39779           0|
--                                               ||      39780-40983           1|-
--                                               ||      40984-42187           2|-
--                                               ||      42188-43391           2|-
--                                               ||      43392-44595           2|-
--                                               ||      44596-45799           0|
--                                               ||      45800-47003           0|
--                                               ||      47004-48207           0|
--                                               ||      48208-49411           1|-
--    
--
-- In sequence store './A1-10.seqStore':
--   Found 243120 reads.
--   Found 4250008168 bases (50 times coverage).
--    Histogram of corrected-trimmed reads:
--    
--    G=4250008168                       sum of  ||               length     num
--    NG         length     index       lengths  ||                range    seqs
--    ----- ------------ --------- ------------  ||  ------------------- -------
--    00010        27476     14349    425027182  ||       1252-2455         7504|---------------------
--    00020        25330     30508    850015261  ||       2456-3659        10514|-----------------------------
--    00030        23852     47818   1275017882  ||       3660-4863         9488|--------------------------
--    00040        22645     66119   1700012483  ||       4864-6067         8194|-----------------------
--    00050        21573     85351   2125015693  ||       6068-7271         7073|--------------------
--    00060        20541    105534   2550018014  ||       7272-8475         6250|-----------------
--    00070        19412    126802   2975023462  ||       8476-9679         5544|---------------
--    00080        17954    149507   3400009709  ||       9680-10883        5028|--------------
--    00090        13202    175585   3825008304  ||      10884-12087        4388|------------
--    00100         1252    243120   4250008168  ||      12088-13291        3816|-----------
--    001.000x              243120   4250008168  ||      13292-14495        3320|---------
--                                               ||      14496-15699        4085|------------
--                                               ||      15700-16903        7240|--------------------
--                                               ||      16904-18107       13274|------------------------------------
--                                               ||      18108-19311       18850|---------------------------------------------------
--                                               ||      19312-20515       22570|-------------------------------------------------------------
--                                               ||      20516-21719       23359|---------------------------------------------------------------
--                                               ||      21720-22923       21063|---------------------------------------------------------
--                                               ||      22924-24127       17395|-----------------------------------------------
--                                               ||      24128-25331       13668|-------------------------------------
--                                               ||      25332-26535       10199|----------------------------
--                                               ||      26536-27739        7342|--------------------
--                                               ||      27740-28943        5124|--------------
--                                               ||      28944-30147        3303|---------
--                                               ||      30148-31351        2155|------
--                                               ||      31352-32555        1231|----
--                                               ||      32556-33759         686|--
--                                               ||      33760-34963         287|-
--                                               ||      34964-36167         112|-
--                                               ||      36168-37371          42|-
--                                               ||      37372-38575           8|-
--                                               ||      38576-39779           0|
--                                               ||      39780-40983           1|-
--                                               ||      40984-42187           2|-
--                                               ||      42188-43391           2|-
--                                               ||      43392-44595           2|-
--                                               ||      44596-45799           0|
--                                               ||      45800-47003           0|
--                                               ||      47004-48207           0|
--                                               ||      48208-49411           1|-
--    
--
-- Correction skipped; not enabled.
--
-- Trimming skipped; not enabled.
--
-- BEGIN ASSEMBLY
----------------------------------------
-- Starting command on Thu Jan 15 23:49:13 2026 with 4567007.125 GB free disk space

    cd unitigging/0-mercounts
    ./meryl-configure.sh \
    > ./meryl-configure.err 2>&1

-- Finished on Thu Jan 15 23:49:15 2026 (2 seconds) with 4567007.125 GB free disk space
----------------------------------------
--  segments   memory batches
--  -------- -------- -------
--        01 10.81 GB       2
--        02  5.75 GB       2
--        04  2.97 GB       2
--        06  2.14 GB       2
--        08  1.61 GB       2
--        12  1.07 GB       2
--        16  0.81 GB       2
--        20  0.65 GB       2
--        24  0.54 GB       2
--        32  0.41 GB       2
--        40  0.32 GB       2
--        48  -.-- GB       -  (segment size too small)
--        56  -.-- GB       -  (segment size too small)
--        64  -.-- GB       -  (segment size too small)
--        96  -.-- GB       -  (segment size too small)
--
--  For 243120 reads with 4250008168 bases, limit to 42 batches.
--  Will count kmers using 01 jobs, each using 12 GB and 4 threads.
--
-- Finished stage 'merylConfigure', reset canuIteration.
--
-- Running jobs.  First attempt out of 2.
----------------------------------------
-- Starting 'meryl' concurrent execution on Thu Jan 15 23:49:15 2026 with 4567007.093 GB free disk space (1 processes; 22 concurrently)

    cd unitigging/0-mercounts
    ./meryl-count.sh 1 > ./meryl-count.000001.out 2>&1

-- Finished on Thu Jan 15 23:52:39 2026 (204 seconds) with 4566609.218 GB free disk space
----------------------------------------
-- Found 1 Kmer counting (meryl) outputs.
-- Finished stage 'utg-merylCountCheck', reset canuIteration.
--
-- Running jobs.  First attempt out of 2.
----------------------------------------
-- Starting 'meryl' concurrent execution on Thu Jan 15 23:52:39 2026 with 4566609.187 GB free disk space (1 processes; 22 concurrently)

    cd unitigging/0-mercounts
    ./meryl-process.sh 1 > ./meryl-process.000001.out 2>&1

-- Finished on Thu Jan 15 23:52:45 2026 (6 seconds) with 4566609.781 GB free disk space
----------------------------------------
-- Meryl finished successfully.  Kmer frequency histogram:
--
-- WARNING: gnuplot failed.
--
----------------------------------------
--
--  22-mers                                                                                           Fraction
--    Occurrences   NumMers                                                                         Unique Total
--       1-     1         0                                                                        0.0000 0.0000
--       2-     2    205038                                                                        0.0046 0.0001
--       3-     4     62791                                                                        0.0055 0.0002
--       5-     7     17398                                                                        0.0062 0.0002
--       8-    11      8184                                                                        0.0064 0.0002
--      12-    16     26011                                                                        0.0066 0.0003
--      17-    22    168800                                                                        0.0074 0.0004
--      23-    29    933271 ****                                                                   0.0122 0.0019
--      30-    37   4841481 **********************                                                 0.0378 0.0118
--      38-    46  15314576 ********************************************************************** 0.1648 0.0747
--      47-    56  14575320 ******************************************************************     0.5227 0.2918
--      57-    67   3920880 *****************                                                      0.8197 0.5068
--      68-    79    718708 ***                                                                    0.8924 0.5692
--      80-    92    972778 ****                                                                   0.9076 0.5850
--      93-   106    832580 ***                                                                    0.9295 0.6118
--     107-   121    371200 *                                                                      0.9470 0.6363
--     122-   137    292251 *                                                                      0.9549 0.6488
--     138-   154    266586 *                                                                      0.9613 0.6607
--     155-   172    155871                                                                        0.9671 0.6725
--     173-   191    166115                                                                        0.9705 0.6804
--     192-   211    122681                                                                        0.9741 0.6896
--     212-   232    101171                                                                        0.9768 0.6972
--     233-   254     98319                                                                        0.9791 0.7042
--     255-   277     81705                                                                        0.9812 0.7116
--     278-   301     75101                                                                        0.9830 0.7184
--     302-   326     71473                                                                        0.9847 0.7251
--     327-   352     59232                                                                        0.9863 0.7321
--     353-   379     48581                                                                        0.9876 0.7383
--     380-   407     40601                                                                        0.9886 0.7437
--     408-   436     33947                                                                        0.9895 0.7487
--     437-   466     34529                                                                        0.9903 0.7531
--     467-   497     29753                                                                        0.9911 0.7580
--     498-   529     26240                                                                        0.9917 0.7624
--     530-   562     22462                                                                        0.9923 0.7666
--     563-   596     19872                                                                        0.9928 0.7704
--     597-   631     17445                                                                        0.9932 0.7739
--     632-   667     14418                                                                        0.9936 0.7773
--     668-   704     15139                                                                        0.9939 0.7802
--     705-   742     12363                                                                        0.9943 0.7834
--     743-   781     11956                                                                        0.9945 0.7862
--     782-   821     10937                                                                        0.9948 0.7890
--
--           0 (max occurrences)
--  3214000422 (total mers, non-unique)
--    45020835 (distinct mers, non-unique)
--           0 (unique mers)
-- Finished stage 'meryl-process', reset canuIteration.
--
-- Removing meryl database 'unitigging/0-mercounts/A1-10.ms22'.
--
-- OVERLAPPER (normal) (assembly) erate=0.01
--
----------------------------------------
-- Starting command on Thu Jan 15 23:52:45 2026 with 4566609.765 GB free disk space

    cd unitigging/1-overlapper
    /share/org/YZWL/yzwl_lixg/miniforge3/envs/canu_v.2.3/bin/overlapInCorePartition \
     -S  ../../A1-10.seqStore \
     -hl 160000000 \
     -rl 5000000000 \
     -ol 500 \
     -o  ./A1-10.partition \
    > ./A1-10.partition.err 2>&1

-- Finished on Thu Jan 15 23:52:45 2026 (like a bat out of hell) with 4566609.75 GB free disk space
----------------------------------------
--
-- Configured 21 overlapInCore jobs.
-- Finished stage 'utg-overlapConfigure', reset canuIteration.
--
-- Running jobs.  First attempt out of 2.
----------------------------------------
-- Starting 'utgovl' concurrent execution on Thu Jan 15 23:52:45 2026 with 4566609.718 GB free disk space (21 processes; 11 concurrently)

    cd unitigging/1-overlapper
    ./overlap.sh 1 > ./overlap.000001.out 2>&1
    ./overlap.sh 2 > ./overlap.000002.out 2>&1
    ./overlap.sh 3 > ./overlap.000003.out 2>&1
    ./overlap.sh 4 > ./overlap.000004.out 2>&1
    ./overlap.sh 5 > ./overlap.000005.out 2>&1
    ./overlap.sh 6 > ./overlap.000006.out 2>&1
    ./overlap.sh 7 > ./overlap.000007.out 2>&1
    ./overlap.sh 8 > ./overlap.000008.out 2>&1
    ./overlap.sh 9 > ./overlap.000009.out 2>&1
    ./overlap.sh 10 > ./overlap.000010.out 2>&1
    ./overlap.sh 11 > ./overlap.000011.out 2>&1
    ./overlap.sh 12 > ./overlap.000012.out 2>&1
    ./overlap.sh 13 > ./overlap.000013.out 2>&1
    ./overlap.sh 14 > ./overlap.000014.out 2>&1
    ./overlap.sh 15 > ./overlap.000015.out 2>&1
    ./overlap.sh 16 > ./overlap.000016.out 2>&1
    ./overlap.sh 17 > ./overlap.000017.out 2>&1
    ./overlap.sh 18 > ./overlap.000018.out 2>&1
    ./overlap.sh 19 > ./overlap.000019.out 2>&1
    ./overlap.sh 20 > ./overlap.000020.out 2>&1
    ./overlap.sh 21 > ./overlap.000021.out 2>&1

-- Finished on Fri Jan 16 00:19:27 2026 (1602 seconds) with 4564832.109 GB free disk space
----------------------------------------
-- Found 21 overlapInCore output files.
--
-- overlapInCore compute 'unitigging/1-overlapper':
--   kmer hits
--     with no overlap       1298696020  67.6190476 +- 38838265.983
--     with an overlap         39403909  6.61904762 +- 1085688.64
--
--   overlaps                  39403909  6.61904762 +- 1085688.64
--     contained                9000912  .857142857 +- 243591.982
--     dovetail                30402997  1.76190476 +- 849012.174
--
--   overlaps rejected
--     multiple per pair              0           0 +- 0
--     bad short window               0           0 +- 0
--     bad long window                0           0 +- 0
-- Finished stage 'utg-overlapCheck', reset canuIteration.
----------------------------------------
-- Starting command on Fri Jan 16 00:19:27 2026 with 4564832.093 GB free disk space

    cd unitigging
    /share/org/YZWL/yzwl_lixg/miniforge3/envs/canu_v.2.3/bin/ovStoreConfig \
     -S ../A1-10.seqStore \
     -M 4-8 \
     -L ./1-overlapper/ovljob.files \
     -create ./A1-10.ovlStore.config \
     > ./A1-10.ovlStore.config.txt \
    2> ./A1-10.ovlStore.config.err

-- Finished on Fri Jan 16 00:19:27 2026 (lickety-split) with 4564832.078 GB free disk space
----------------------------------------
--
-- Creating overlap store unitigging/A1-10.ovlStore using:
--      1 bucket
--      1 slice
--        using at most 3 GB memory each
--
-- Running jobs.  First attempt out of 2.
----------------------------------------
-- Starting 'ovS' concurrent execution on Fri Jan 16 00:19:27 2026 with 4564832.062 GB free disk space (1 processes; 62 concurrently)

    cd unitigging
    ./A1-10.ovlStore.sh 1 > ./A1-10.ovlStore.000001.out 2>&1

-- Finished on Fri Jan 16 00:19:45 2026 (18 seconds) with 4564830.39 GB free disk space
----------------------------------------
-- Checking store.
----------------------------------------
-- Starting command on Fri Jan 16 00:19:45 2026 with 4564830.39 GB free disk space

    cd unitigging
    /share/org/YZWL/yzwl_lixg/miniforge3/envs/canu_v.2.3/bin/ovStoreDump \
     -S ../A1-10.seqStore \
     -O  ./A1-10.ovlStore \
     -counts \
     > ./A1-10.ovlStore/counts.dat 2> ./A1-10.ovlStore/counts.err

-- Finished on Fri Jan 16 00:19:45 2026 (lickety-split) with 4564830.359 GB free disk space
----------------------------------------
--
-- Overlap store 'unitigging/A1-10.ovlStore' successfully constructed.
-- Found 78807818 overlaps for 239012 reads; 1244542 reads have no overlaps.
--
--
-- Purged 0.778 GB in 63 overlap output files.
----------------------------------------
-- Starting command on Fri Jan 16 00:19:46 2026 with 4564830.359 GB free disk space

    cd unitigging
    /share/org/YZWL/yzwl_lixg/miniforge3/envs/canu_v.2.3/bin/ovStoreStats \
     -C 50 \
     -S ../A1-10.seqStore \
     -O  ./A1-10.ovlStore \
     -o  ./A1-10.ovlStore \
     > ./A1-10.ovlStore.summary.err 2>&1

-- Finished on Fri Jan 16 00:19:58 2026 (12 seconds) with 4564729.578 GB free disk space
----------------------------------------
--
-- Overlap store 'unitigging/A1-10.ovlStore' contains:
--
--   category            reads     %          read length        feature size or coverage  analysis
--   ----------------  -------  -------  ----------------------  ------------------------  --------------------
--   middle-missing        141    0.06    16181.67 +- 6506.82       1084.21 +- 1425.38    (bad trimming)
--   middle-hump            11    0.00    16661.27 +- 2505.67       7961.36 +- 5274.36    (bad trimming)
--   no-5-prime            468    0.19    14229.18 +- 5523.26       1696.31 +- 2860.58    (bad trimming)
--   no-3-prime            486    0.20    11835.25 +- 6540.90       1574.65 +- 2743.64    (bad trimming)
--   
--   low-coverage          853    0.35    11417.80 +- 6061.31          5.56 +- 3.61       (easy to assemble, potential for lower quality consensus)
--   unique             196961   81.01    13408.19 +- 6054.81         45.98 +- 8.80       (easy to assemble, perfect, yay)
--   repeat-cont         18536    7.62    11206.23 +- 5310.11       1687.30 +- 1268.64    (potential for consensus errors, no impact on assembly)
--   repeat-dove           294    0.12    21079.27 +- 2006.45        635.70 +- 641.13     (hard to assemble, likely won't assemble correctly or even at all)
--   
--   span-repeat          2961    1.22    15044.46 +- 4895.79       3300.39 +- 3759.06    (read spans a large repeat, usually easy to assemble)
--   uniq-repeat-cont    12463    5.13    13311.23 +- 4976.87                             (should be uniquely placed, low potential for consensus errors, no impact on assembly)
--   uniq-repeat-dove     2707    1.11    19812.96 +- 2787.45                             (will end contigs, potential to misassemble)
--   uniq-anchor          3131    1.29    14376.28 +- 4845.19       8361.94 +- 5211.56    (repeat read, with unique section, probable bad read)
-- Finished stage 'utg-createOverlapStore', reset canuIteration.
--
-- Loading read lengths.
-- Loading number of overlaps per read.
--
-- Configure RED for 16gb memory.
--                   Batches of at most (unlimited) reads.
--                                      500000000 bases.
--                   Expecting evidence of at most 536870912 bases per iteration.
--
--           Total                                               Reads                 Olaps Evidence
--    Job   Memory      Read Range         Reads        Bases   Memory        Olaps   Memory   Memory  (Memory in MB)
--   ---- -------- ------------------- --------- ------------ -------- ------------ -------- --------
--      1 16384.71         1-32704          5259    108887416 13292.09      1801974    20.62  1024.00
--      2 16384.51     32705-69245          5915    108930251 13297.34      1326316    15.18  1024.00
--      3 16384.59     69246-108218         6418    108891403 13292.61      1746124    19.98  1024.00
--      4 16384.62    108219-142055         5534    108817431 13283.55      2540257    29.07  1024.00
--      5 16384.09    142056-180222         6105    108898712 13293.49      1624689    18.59  1024.00
--      6 16384.43    180223-229152         8011    108823079 13284.32      2456102    28.11  1024.00
--      7 16385.17    229153-262184         5376    108833941 13285.56      2412763    27.61  1024.00
--      8 16384.77    262185-298358         5841    108903421 13294.06      1635089    18.71  1024.00
--      9 16385.08    298359-349322         8330    108817510 13283.65      2571455    29.43  1024.00
--     10 16385.40    349323-381369         5296    108931575 13297.48      1391623    15.93  1024.00
--     11 16384.36    381370-415031         5533    108825625 13284.55      2429917    27.81  1024.00
--     12 16385.11    415032-455973         6783    108962639 13301.32      1030294    11.79  1024.00
--     13 16384.23    455974-497113         6851    108847253 13287.23      2184062    24.99  1024.00
--     14 16386.82    497114-529737         5408    108848031 13287.28      2406531    27.54  1024.00
--     15 16385.28    529738-566942         6006    108900663 13293.73      1708188    19.55  1024.00
--     16 16384.07    566943-613866         7669    108812438 13283.01      2539760    29.07  1024.00
--     17 16384.52    613867-646243         5385    108830245 13285.11      2394566    27.40  1024.00
--     18 16385.26    646244-681466         5746    108887800 13292.15      1845158    21.12  1024.00
--     19 16386.10    681467-730613         8162    108826179 13284.70      2568893    29.40  1024.00
--     20 16385.04    730614-763394         5244    108936971 13298.14      1302652    14.91  1024.00
--     21 16384.02    763395-796867         5520    108811655 13282.85      2549350    29.17  1024.00
--     22 16384.19    796868-836493         6568    108969629 13302.16       876382    10.03  1024.00
--     23 16384.80    836494-878255         6860    108846834 13287.18      2238334    25.62  1024.00
--     24 16386.43    878256-911670         5493    108834385 13285.62      2517725    28.81  1024.00
--     25 16386.37    911671-947858         6006    108898037 13293.41      1831765    20.96  1024.00
--     26 16384.14    947859-994818         7836    108829451 13285.09      2363331    27.05  1024.00
--     27 16385.90    994819-1027435        5315    108837583 13286.01      2437361    27.89  1024.00
--     28 16386.20   1027436-1061765        5647    108902820 13293.98      1766692    20.22  1024.00
--     29 16384.52   1061766-1109428        7828    108833218 13285.55      2356910    26.97  1024.00
--     30 16385.38   1109429-1141031        5206    108933451 13297.70      1369452    15.67  1024.00
--     31 16385.44   1141032-1174738        5393    108847643 13287.24      2289384    26.20  1024.00
--     32 16385.03   1174739-1213238        6270    108974848 13302.79       894834    10.24  1024.00
--     33 16384.53   1213239-1252218        6509    108834549 13285.67      2346973    26.86  1024.00
--     34 16384.71   1252219-1285084        5364    108828250 13284.87      2433225    27.85  1024.00
--     35 16384.04   1285085-1321090        5817    108897491 13293.33      1634204    18.70  1024.00
--     36 16385.77   1321091-1366276        7474    108835107 13285.77      2446993    28.00  1024.00
--     37 16384.61   1366277-1399229        5321    108839958 13286.30      2299327    26.31  1024.00
--     38 16384.95   1399230-1433457        5631    108903046 13294.01      1655343    18.94  1024.00
--     39 16384.55   1433458-1481703        7894    108817243 13283.60      2529458    28.95  1024.00
--     40  3575.61   1481704-1483554         296      4120387   502.99        54362     0.62  1024.00
--   ---- -------- ------------------- --------- ------------ -------- ------------ -------- --------
--                                                 4250008168              78807818
-- Finished stage 'readErrorDetectionConfigure', reset canuIteration.
--
-- Running jobs.  First attempt out of 2.
----------------------------------------
-- Starting 'red' concurrent execution on Fri Jan 16 00:20:03 2026 with 4564729.531 GB free disk space (40 processes; 22 concurrently)

    cd unitigging/3-overlapErrorAdjustment
    ./red.sh 1 > ./red.000001.out 2>&1
    ./red.sh 2 > ./red.000002.out 2>&1
    ./red.sh 3 > ./red.000003.out 2>&1
    ./red.sh 4 > ./red.000004.out 2>&1
    ./red.sh 5 > ./red.000005.out 2>&1
    ./red.sh 6 > ./red.000006.out 2>&1
    ./red.sh 7 > ./red.000007.out 2>&1
    ./red.sh 8 > ./red.000008.out 2>&1
    ./red.sh 9 > ./red.000009.out 2>&1
    ./red.sh 10 > ./red.000010.out 2>&1
    ./red.sh 11 > ./red.000011.out 2>&1
    ./red.sh 12 > ./red.000012.out 2>&1
    ./red.sh 13 > ./red.000013.out 2>&1
    ./red.sh 14 > ./red.000014.out 2>&1
    ./red.sh 15 > ./red.000015.out 2>&1
    ./red.sh 16 > ./red.000016.out 2>&1
    ./red.sh 17 > ./red.000017.out 2>&1
    ./red.sh 18 > ./red.000018.out 2>&1
    ./red.sh 19 > ./red.000019.out 2>&1
    ./red.sh 20 > ./red.000020.out 2>&1
    ./red.sh 21 > ./red.000021.out 2>&1
    ./red.sh 22 > ./red.000022.out 2>&1
    ./red.sh 23 > ./red.000023.out 2>&1
    ./red.sh 24 > ./red.000024.out 2>&1
    ./red.sh 25 > ./red.000025.out 2>&1
    ./red.sh 26 > ./red.000026.out 2>&1
    ./red.sh 27 > ./red.000027.out 2>&1
    ./red.sh 28 > ./red.000028.out 2>&1
    ./red.sh 29 > ./red.000029.out 2>&1
    ./red.sh 30 > ./red.000030.out 2>&1
    ./red.sh 31 > ./red.000031.out 2>&1
    ./red.sh 32 > ./red.000032.out 2>&1
    ./red.sh 33 > ./red.000033.out 2>&1
    ./red.sh 34 > ./red.000034.out 2>&1
    ./red.sh 35 > ./red.000035.out 2>&1
    ./red.sh 36 > ./red.000036.out 2>&1
    ./red.sh 37 > ./red.000037.out 2>&1
    ./red.sh 38 > ./red.000038.out 2>&1
    ./red.sh 39 > ./red.000039.out 2>&1
    ./red.sh 40 > ./red.000040.out 2>&1

-- Finished on Fri Jan 16 00:34:02 2026 (839 seconds) with 4562663.078 GB free disk space
----------------------------------------
-- Found 40 read error detection output files.
-- Finished stage 'readErrorDetectionCheck', reset canuIteration.
--
-- Loading read lengths.
-- Loading number of overlaps per read.
--
-- Configure OEA for 8gb memory.
--                   Batches of at most (unlimited) reads.
--                                      300000000 bases.
--
--           Total                                               Reads                 Olaps  Adjusts
--    Job   Memory      Read Range         Reads        Bases   Memory        Olaps   Memory   Memory  (Memory in MB)
--   ---- -------- ------------------- --------- ------------ -------- ------------ -------- --------
--      1  2849.24         1-100317        16295    300015016   294.61      4730970   144.38   362.25
--      2  2874.30    100318-209728        17787    300008671   294.65      5550809   169.40   362.25
--      3  2870.67    209729-308942        16107    300009958   294.60      5433556   165.82   362.25
--      4  2895.22    308943-415804        17560    300005550   294.64      6236814   190.33   362.25
--      5  2868.60    415805-522249        17674    300020540   294.66      5363741   163.69   362.25
--      6  2851.49    522250-630876        17774    300001102   294.65      4803533   146.59   362.25
--      7  2908.14    630877-740173        17939    300013149   294.66      6659437   203.23   362.25
--      8  2846.95    740174-838964        16220    300006953   294.60      4656312   142.10   362.25
--      9  2899.40    838965-940159        16668    300003763   294.61      6374475   194.53   362.25
--     10  2883.65    940160-1046178       17540    300023159   294.66      5857129   178.75   362.25
--     11  2874.19   1046179-1151469       17240    300014134   294.64      5547520   169.30   362.25
--     12  2844.52   1151470-1254395       16871    300008538   294.63      4575968   139.65   362.25
--     13  2899.39   1254396-1360713       17377    300004173   294.64      6373636   194.51   362.25
--     14  2845.24   1360714-1457221       15716    300001828   294.58      4600760   140.40   362.25
--     15  2528.29   1457222-1483554        4352     49871634    55.69      2043158    62.35   362.25
--   ---- -------- ------------------- --------- ------------ -------- ------------ -------- --------
--                                                 4250008168              78807818
-- Finished stage 'overlapErrorAdjustmentConfigure', reset canuIteration.
--
-- Running jobs.  First attempt out of 2.
----------------------------------------
-- Starting 'oea' concurrent execution on Fri Jan 16 00:34:09 2026 with 4562663 GB free disk space (15 processes; 62 concurrently)

    cd unitigging/3-overlapErrorAdjustment
    ./oea.sh 1 > ./oea.000001.out 2>&1
    ./oea.sh 2 > ./oea.000002.out 2>&1
    ./oea.sh 3 > ./oea.000003.out 2>&1
    ./oea.sh 4 > ./oea.000004.out 2>&1
    ./oea.sh 5 > ./oea.000005.out 2>&1
    ./oea.sh 6 > ./oea.000006.out 2>&1
    ./oea.sh 7 > ./oea.000007.out 2>&1
    ./oea.sh 8 > ./oea.000008.out 2>&1
    ./oea.sh 9 > ./oea.000009.out 2>&1
    ./oea.sh 10 > ./oea.000010.out 2>&1
    ./oea.sh 11 > ./oea.000011.out 2>&1
    ./oea.sh 12 > ./oea.000012.out 2>&1
    ./oea.sh 13 > ./oea.000013.out 2>&1
    ./oea.sh 14 > ./oea.000014.out 2>&1
    ./oea.sh 15 > ./oea.000015.out 2>&1

-- Finished on Fri Jan 16 01:18:51 2026 (2682 seconds) with 4558448.937 GB free disk space
----------------------------------------
-- Found 15 overlap error adjustment output files.
-- Finished stage 'overlapErrorAdjustmentCheck', reset canuIteration.
----------------------------------------
-- Starting command on Fri Jan 16 01:18:51 2026 with 4558448.921 GB free disk space

    cd unitigging/3-overlapErrorAdjustment
    /share/org/YZWL/yzwl_lixg/miniforge3/envs/canu_v.2.3/bin/loadErates \
      -S ../../A1-10.seqStore \
      -O ../A1-10.ovlStore \
      -L ./oea.files \
    > ./oea.apply.err 2>&1

-- Finished on Fri Jan 16 01:18:51 2026 (in the blink of an eye) with 4558448.765 GB free disk space
----------------------------------------
-- No report available.
-- Finished stage 'updateOverlapStore', reset canuIteration.
-- Finished stage 'unitig', reset canuIteration.
--
-- Running jobs.  First attempt out of 2.
----------------------------------------
-- Starting 'bat' concurrent execution on Fri Jan 16 01:18:51 2026 with 4558448.718 GB free disk space (1 processes; 1 concurrently)

    cd unitigging/4-unitigger
    ./unitigger.sh 1 > ./unitigger.000001.out 2>&1

-- Finished on Fri Jan 16 01:19:12 2026 (21 seconds) with 4558506.734 GB free disk space
----------------------------------------
-- Unitigger finished successfully.
--  
--  ERROR RATES
--  -----------
--                                                   --------threshold------
--  272182                       fraction error      fraction        percent
--  samples                              (1e-5)         error          error
--                   --------------------------      --------       --------
--  command line (-eg)                           ->     30.00        0.0300%
--  command line (-ef)                           ->  -----.--      ---.----%
--  command line (-eM)                           ->     30.00        0.0300%
--  mean + std.dev       0.37 +-  12 *     2.72  ->     32.97        0.0330%
--  median + mad         0.00 +-  12 *     0.00  ->      0.00        0.0000%
--  90th percentile                              ->      1.00        0.0010%  (enabled)
--  
--  BEST EDGE FILTERING
--  -------------------
--  At graph threshold 0.0300%, reads:
--    available to have edges:        42208
--    with at least one edge:         37046
--  
--  At max threshold 0.0300%, reads:  (not computed)
--    available to have edges:            0
--    with at least one edge:             0
--  
--  At tight threshold 0.0010%, reads with:
--    both edges below error threshold:     32546  (80.00% minReadsBest threshold = 29636)
--    one  edge  above error threshold:      3086
--    both edges above error threshold:      1414
--    at least one edge:                    37046
--  
--  At loose threshold 0.0300%, reads with:
--    both edges below error threshold:     37046  (80.00% minReadsBest threshold = 29636)
--    one  edge  above error threshold:         0
--    both edges above error threshold:         0
--    at least one edge:                    37046
--  
--  
--  INITIAL EDGES
--  -------- ----------------------------------------
--    195647 reads are contained
--   1254409 reads have no best edges (singleton)
--       275 reads have only one best edge (spur) 
--                126 are mutual best
--     33223 reads have two best edges 
--               1014 have one mutual best edge
--              31743 have two mutual best edges
--  
--  
--  FINAL EDGES
--  -------- ----------------------------------------
--    195647 reads are contained
--   1254753 reads have no best edges (singleton)
--       163 reads have only one best edge (spur) 
--                126 are mutual best
--     32991 reads have two best edges 
--                896 have one mutual best edge
--              31737 have two mutual best edges
--  
--  
--  EDGE FILTERING
--  -------- ------------------------------------------
--         0 reads are ignored
--      8801 reads have a gap in overlap coverage
--       165 reads have lopsided best edges
-- Found, in version 1, after unitig construction:
--   contigs:      154 sequences, total length 69923481 bp (including 224 repeats of total length 6758916 bp).
--   bubbles:      259 sequences, total length 11609560 bp.
--   unassembled:  14154 sequences, total length 178883258 bp.
--
-- Contig sizes based on genome size 85mbp:
--
--            NG (bp)  LG (contigs)    sum (bp)
--         ----------  ------------  ----------
--     10     6952229             2    14866995
--     20     6400618             3    21267613
--     30     6185123             4    27452736
--     40     4251710             6    36314254
--     50     3540450             8    43753635
--     60     2329082            11    51291408
--     70     1364897            16    60212176
--     80       27944            59    68003354
--
-- Finished stage 'unitigCheck', reset canuIteration.
----------------------------------------
-- Starting command on Fri Jan 16 01:19:12 2026 with 4558506.718 GB free disk space

    cd unitigging
    /share/org/YZWL/yzwl_lixg/miniforge3/envs/canu_v.2.3/bin/utgcns \
      -S ../A1-10.seqStore \
      -T  ./A1-10.ctgStore 1 \
      -partition 0.8 1.5 0.1 \
    > ./A1-10.ctgStore/partitioning.log 2>&1

-- Finished on Fri Jan 16 01:19:21 2026 (9 seconds) with 4558505.5 GB free disk space
----------------------------------------
-- Using slow alignment for consensus (iteration '0').
-- Configured 10 consensus jobs.
-- Finished stage 'consensusConfigure', reset canuIteration.
--
-- Local: cns       11.750 GB    8 CPUs x  11 jobs   129.250 GB  88 CPUs  (consensus)
--
--
-- Running jobs.  First attempt out of 2.
----------------------------------------
-- Starting 'cns' concurrent execution on Fri Jan 16 01:19:21 2026 with 4558505.468 GB free disk space (10 processes; 11 concurrently)

    cd unitigging/5-consensus
    ./consensus.sh 1 > ./consensus.000001.out 2>&1
    ./consensus.sh 2 > ./consensus.000002.out 2>&1
    ./consensus.sh 3 > ./consensus.000003.out 2>&1
    ./consensus.sh 4 > ./consensus.000004.out 2>&1
    ./consensus.sh 5 > ./consensus.000005.out 2>&1
    ./consensus.sh 6 > ./consensus.000006.out 2>&1
    ./consensus.sh 7 > ./consensus.000007.out 2>&1
    ./consensus.sh 8 > ./consensus.000008.out 2>&1
    ./consensus.sh 9 > ./consensus.000009.out 2>&1
    ./consensus.sh 10 > ./consensus.000010.out 2>&1

-- Finished on Fri Jan 16 01:26:36 2026 (435 seconds) with 4559179.89 GB free disk space
----------------------------------------
-- Using slow alignment for consensus (iteration '1').
-- Configured 10 consensus jobs.
-- All 10 consensus jobs finished successfully.
-- Finished stage 'consensusCheck', reset canuIteration.
-- Using slow alignment for consensus (iteration '0').
-- Configured 10 consensus jobs.
----------------------------------------
-- Starting command on Fri Jan 16 01:26:36 2026 with 4559179.843 GB free disk space

    cd unitigging
    /share/org/YZWL/yzwl_lixg/miniforge3/envs/canu_v.2.3/bin/tgStoreLoad \
      -S ../A1-10.seqStore \
      -T  ./A1-10.ctgStore 2 \
      -L ./5-consensus/ctgcns.files \
    > ./5-consensus/ctgcns.files.ctgStoreLoad.err 2>&1

-- Finished on Fri Jan 16 01:26:37 2026 (one second) with 4559179.109 GB free disk space
----------------------------------------
----------------------------------------
-- Starting command on Fri Jan 16 01:26:37 2026 with 4559179.109 GB free disk space

    cd unitigging
    /share/org/YZWL/yzwl_lixg/miniforge3/envs/canu_v.2.3/bin/tgTigDisplay \
      -S ../A1-10.seqStore \
      -b \
      -o ../A1-10.contigs.unsorted.bam \
      -L ./5-consensus/ctgcns.files \
    > ./5-consensus/ctgcns.files.contigs.bam.err 2>&1

-- Finished on Fri Jan 16 01:29:20 2026 (163 seconds) with 4559539.531 GB free disk space
----------------------------------------
----------------------------------------
-- Starting command on Fri Jan 16 01:29:20 2026 with 4559539.531 GB free disk space

    cd .
    samtools sort \
      --write-index \
      --threads 2 \
      -o ./A1-10.contigs.bam ./A1-10.contigs.unsorted.bam \
    > ./ctgcns.bam.err 2>&1

-- Finished on Fri Jan 16 01:30:37 2026 (77 seconds) with 4559701.562 GB free disk space
----------------------------------------
-- Purging consensus output after loading to ctgStore.
-- Purged 10 .cns outputs.
----------------------------------------
-- Starting command on Fri Jan 16 01:30:37 2026 with 4559703.5 GB free disk space

    cd unitigging
    /share/org/YZWL/yzwl_lixg/miniforge3/envs/canu_v.2.3/bin/tgStoreDump \
      -S ../A1-10.seqStore \
      -T ./A1-10.ctgStore 2 \
      -sizes -s 85000000 \
    > ./A1-10.ctgStore/seqDB.v002.sizes.txt
ZERO length suplied to intervalList::add(), ignoring interval.
ZERO length suplied to intervalList::add(), ignoring interval.
ZERO length suplied to intervalList::add(), ignoring interval.
ZERO length suplied to intervalList::add(), ignoring interval.
ZERO length suplied to intervalList::add(), ignoring interval.
ZERO length suplied to intervalList::add(), ignoring interval.
ZERO length suplied to intervalList::add(), ignoring interval.
ZERO length suplied to intervalList::add(), ignoring interval.
ZERO length suplied to intervalList::add(), ignoring interval.
ZERO length suplied to intervalList::add(), ignoring interval.
ZERO length suplied to intervalList::add(), ignoring interval.
ZERO length suplied to intervalList::add(), ignoring interval.
ZERO length suplied to intervalList::add(), ignoring interval.
ZERO length suplied to intervalList::add(), ignoring interval.
ZERO length suplied to intervalList::add(), ignoring interval.
ZERO length suplied to intervalList::add(), ignoring interval.
ZERO length suplied to intervalList::add(), ignoring interval.
ZERO length suplied to intervalList::add(), ignoring interval.
ZERO length suplied to intervalList::add(), ignoring interval.
ZERO length suplied to intervalList::add(), ignoring interval.
ZERO length suplied to intervalList::add(), ignoring interval.
ZERO length suplied to intervalList::add(), ignoring interval.
ZERO length suplied to intervalList::add(), ignoring interval.
ZERO length suplied to intervalList::add(), ignoring interval.
ZERO length suplied to intervalList::add(), ignoring interval.
ZERO length suplied to intervalList::add(), ignoring interval.
ZERO length suplied to intervalList::add(), ignoring interval.
ZERO length suplied to intervalList::add(), ignoring interval.
ZERO length suplied to intervalList::add(), ignoring interval.
ZERO length suplied to intervalList::add(), ignoring interval.
ZERO length suplied to intervalList::add(), ignoring interval.
ZERO length suplied to intervalList::add(), ignoring interval.
ZERO length suplied to intervalList::add(), ignoring interval.
ZERO length suplied to intervalList::add(), ignoring interval.
ZERO length suplied to intervalList::add(), ignoring interval.
ZERO length suplied to intervalList::add(), ignoring interval.
ZERO length suplied to intervalList::add(), ignoring interval.
ZERO length suplied to intervalList::add(), ignoring interval.
ZERO length suplied to intervalList::add(), ignoring interval.
ZERO length suplied to intervalList::add(), ignoring interval.
ZERO length suplied to intervalList::add(), ignoring interval.
ZERO length suplied to intervalList::add(), ignoring interval.
ZERO length suplied to intervalList::add(), ignoring interval.

-- Finished on Fri Jan 16 01:30:37 2026 (like a bat out of hell) with 4559703.5 GB free disk space
----------------------------------------
-- Found, in version 2, after consensus generation:
--   contigs:      154 sequences, total length 91376795 bp (including 224 repeats of total length 9210068 bp).
--   bubbles:      259 sequences, total length 15312792 bp.
--   unassembled:  14154 sequences, total length 246636852 bp.
--
-- Contig sizes based on genome size 85mbp:
--
--            NG (bp)  LG (contigs)    sum (bp)
--         ----------  ------------  ----------
--     10    10315686             1    10315686
--     20     9042896             2    19358582
--     30     8313303             3    27671885
--     40     8032030             4    35703915
--     50     5536197             6    47224818
--     60     5074583             7    52299401
--     70     3527651             9    60437669
--     80     2954717            12    69682581
--     90     2041351            15    76594819
--    100      656858            22    85527025
--
-- Finished stage 'consensusLoad', reset canuIteration.
----------------------------------------
-- Starting command on Fri Jan 16 01:30:37 2026 with 4559703.484 GB free disk space

    cd .
    /share/org/YZWL/yzwl_lixg/miniforge3/envs/canu_v.2.3/bin/tgStoreDump \
      -S ./A1-10.seqStore \
      -T ./unitigging/A1-10.ctgStore 2 \
      -o ./A1-10.contigs \
      -layout \
    > ./A1-10.contigs.layout.err 2>&1

-- Finished on Fri Jan 16 01:30:37 2026 (fast as lightning) with 4559633.968 GB free disk space
----------------------------------------
----------------------------------------
-- Starting command on Fri Jan 16 01:30:37 2026 with 4559633.968 GB free disk space

    cd .
    /share/org/YZWL/yzwl_lixg/miniforge3/envs/canu_v.2.3/bin/tgStoreDump \
      -S ./A1-10.seqStore \
      -T ./unitigging/A1-10.ctgStore 2 \
      -consensus -fasta \
      -unassembled \
    > ./A1-10.unassembled.fasta
    2> ./A1-10.unassembled.err
ZERO length suplied to intervalList::add(), ignoring interval.
ZERO length suplied to intervalList::add(), ignoring interval.
ZERO length suplied to intervalList::add(), ignoring interval.
ZERO length suplied to intervalList::add(), ignoring interval.
ZERO length suplied to intervalList::add(), ignoring interval.
ZERO length suplied to intervalList::add(), ignoring interval.
ZERO length suplied to intervalList::add(), ignoring interval.
ZERO length suplied to intervalList::add(), ignoring interval.
ZERO length suplied to intervalList::add(), ignoring interval.
ZERO length suplied to intervalList::add(), ignoring interval.
ZERO length suplied to intervalList::add(), ignoring interval.
ZERO length suplied to intervalList::add(), ignoring interval.
ZERO length suplied to intervalList::add(), ignoring interval.
ZERO length suplied to intervalList::add(), ignoring interval.
ZERO length suplied to intervalList::add(), ignoring interval.
ZERO length suplied to intervalList::add(), ignoring interval.
ZERO length suplied to intervalList::add(), ignoring interval.
ZERO length suplied to intervalList::add(), ignoring interval.
ZERO length suplied to intervalList::add(), ignoring interval.
ZERO length suplied to intervalList::add(), ignoring interval.
ZERO length suplied to intervalList::add(), ignoring interval.
ZERO length suplied to intervalList::add(), ignoring interval.
ZERO length suplied to intervalList::add(), ignoring interval.
ZERO length suplied to intervalList::add(), ignoring interval.
ZERO length suplied to intervalList::add(), ignoring interval.
ZERO length suplied to intervalList::add(), ignoring interval.
ZERO length suplied to intervalList::add(), ignoring interval.
ZERO length suplied to intervalList::add(), ignoring interval.
ZERO length suplied to intervalList::add(), ignoring interval.
ZERO length suplied to intervalList::add(), ignoring interval.
ZERO length suplied to intervalList::add(), ignoring interval.
ZERO length suplied to intervalList::add(), ignoring interval.
ZERO length suplied to intervalList::add(), ignoring interval.
ZERO length suplied to intervalList::add(), ignoring interval.
ZERO length suplied to intervalList::add(), ignoring interval.
ZERO length suplied to intervalList::add(), ignoring interval.
ZERO length suplied to intervalList::add(), ignoring interval.
ZERO length suplied to intervalList::add(), ignoring interval.
ZERO length suplied to intervalList::add(), ignoring interval.
ZERO length suplied to intervalList::add(), ignoring interval.
ZERO length suplied to intervalList::add(), ignoring interval.
ZERO length suplied to intervalList::add(), ignoring interval.
ZERO length suplied to intervalList::add(), ignoring interval.

-- Finished on Fri Jan 16 01:30:38 2026 (one second) with 4559633.843 GB free disk space
----------------------------------------
----------------------------------------
-- Starting command on Fri Jan 16 01:30:38 2026 with 4559633.843 GB free disk space

    cd .
    /share/org/YZWL/yzwl_lixg/miniforge3/envs/canu_v.2.3/bin/tgStoreDump \
      -S ./A1-10.seqStore \
      -T ./unitigging/A1-10.ctgStore 2 \
      -consensus -fasta \
      -contigs \
    > ./A1-10.contigs.fasta
    2> ./A1-10.contigs.err
ZERO length suplied to intervalList::add(), ignoring interval.
ZERO length suplied to intervalList::add(), ignoring interval.
ZERO length suplied to intervalList::add(), ignoring interval.
ZERO length suplied to intervalList::add(), ignoring interval.
ZERO length suplied to intervalList::add(), ignoring interval.
ZERO length suplied to intervalList::add(), ignoring interval.
ZERO length suplied to intervalList::add(), ignoring interval.
ZERO length suplied to intervalList::add(), ignoring interval.
ZERO length suplied to intervalList::add(), ignoring interval.
ZERO length suplied to intervalList::add(), ignoring interval.
ZERO length suplied to intervalList::add(), ignoring interval.
ZERO length suplied to intervalList::add(), ignoring interval.
ZERO length suplied to intervalList::add(), ignoring interval.
ZERO length suplied to intervalList::add(), ignoring interval.
ZERO length suplied to intervalList::add(), ignoring interval.
ZERO length suplied to intervalList::add(), ignoring interval.
ZERO length suplied to intervalList::add(), ignoring interval.
ZERO length suplied to intervalList::add(), ignoring interval.
ZERO length suplied to intervalList::add(), ignoring interval.
ZERO length suplied to intervalList::add(), ignoring interval.
ZERO length suplied to intervalList::add(), ignoring interval.
ZERO length suplied to intervalList::add(), ignoring interval.
ZERO length suplied to intervalList::add(), ignoring interval.
ZERO length suplied to intervalList::add(), ignoring interval.
ZERO length suplied to intervalList::add(), ignoring interval.
ZERO length suplied to intervalList::add(), ignoring interval.
ZERO length suplied to intervalList::add(), ignoring interval.
ZERO length suplied to intervalList::add(), ignoring interval.
ZERO length suplied to intervalList::add(), ignoring interval.
ZERO length suplied to intervalList::add(), ignoring interval.
ZERO length suplied to intervalList::add(), ignoring interval.
ZERO length suplied to intervalList::add(), ignoring interval.
ZERO length suplied to intervalList::add(), ignoring interval.
ZERO length suplied to intervalList::add(), ignoring interval.
ZERO length suplied to intervalList::add(), ignoring interval.
ZERO length suplied to intervalList::add(), ignoring interval.
ZERO length suplied to intervalList::add(), ignoring interval.
ZERO length suplied to intervalList::add(), ignoring interval.
ZERO length suplied to intervalList::add(), ignoring interval.
ZERO length suplied to intervalList::add(), ignoring interval.
ZERO length suplied to intervalList::add(), ignoring interval.
ZERO length suplied to intervalList::add(), ignoring interval.
ZERO length suplied to intervalList::add(), ignoring interval.

-- Finished on Fri Jan 16 01:30:40 2026 (2 seconds) with 4559633.796 GB free disk space
----------------------------------------
-- Finished stage 'generateOutputs', reset canuIteration.
--
-- Assembly 'A1-10' finished in '/share/org/YZWL/yzwl_lixg/project/28.大豆疫霉菌三代基因组/03.hicanu/A1-10/01.raw_output'.
--
-- Summary saved in 'A1-10.report'.
--
-- Sequences saved:
--   Contigs       -> 'A1-10.contigs.fasta'
--   Unassembled   -> 'A1-10.unassembled.fasta'
--
-- Read layouts saved:
--   Contigs       -> 'A1-10.contigs.layout'.
--
-- Bye.

2026-01-16 01:30:40.069 - WARNING - 输出文件不存在|Output file does not exist: /share/org/YZWL/yzwl_lixg/project/28.大豆疫霉菌三代基因组/03.hicanu/A1-10/01.raw_output/A1-10.unitigs.fasta
Usage: biopytools ragtag [OPTIONS]
Try 'biopytools ragtag -h' for help.

Error: Invalid value for '-r' / '--reference': 文件不存在|File does not exist: /share/org/YZWL/yzwl_lixg/project/28.大豆疫霉菌三代基因组/04.ragtag/Psoja_T2T.fa
Usage: biopytools genomesyn [OPTIONS]
Try 'biopytools genomesyn -h' for help.

Error: Invalid value for '-i' / '--ref': Path '04.ragtag/A1-10/hicanu/A1-10_RagTag_scaffolded.fa' does not exist.
Job 68886687 stderr output:

