2026-01-16 16:30:44.258 - WARNING - 命令错误输出|Command stderr:
-- canu master +27 changes (r10515 2a41e933b8de6ed66723d75d36dd071b46d2c347)
--
-- CITATIONS
--
-- For assemblies of PacBio HiFi reads:
--   Nurk S, Walenz BP, Rhiea A, Vollger MR, Logsdon GA, Grothe R, Miga KH, Eichler EE, Phillippy AM, Koren S.
--   HiCanu: accurate assembly of segmental duplications, satellites, and allelic variants from high-fidelity long reads.
--   biorXiv. 2020.
--   https://doi.org/10.1101/2020.03.14.992248
-- 
-- Read and contig alignments during correction and consensus use:
--   Šošic M, Šikic M.
--   Edlib: a C/C ++ library for fast, exact sequence alignment using edit distance.
--   Bioinformatics. 2017 May 1;33(9):1394-1395.
--   http://doi.org/10.1093/bioinformatics/btw753
-- 
-- Overlaps are generated using:
--   Berlin K, et al.
--   Assembling large genomes with single-molecule sequencing and locality-sensitive hashing.
--   Nat Biotechnol. 2015 Jun;33(6):623-30.
--   http://doi.org/10.1038/nbt.3238
-- 
--   Myers EW, et al.
--   A Whole-Genome Assembly of Drosophila.
--   Science. 2000 Mar 24;287(5461):2196-204.
--   http://doi.org/10.1126/science.287.5461.2196
-- 
-- Contig consensus sequences are generated using an algorithm derived from pbdagcon:
--   Chin CS, et al.
--   Nonhybrid, finished microbial genome assemblies from long-read SMRT sequencing data.
--   Nat Methods. 2013 Jun;10(6):563-9
--   http://doi.org/10.1038/nmeth.2474
-- 
-- CONFIGURE CANU
--
-- Detected Java(TM) Runtime Environment '25.0.1-internal' (from '/share/org/YZWL/yzwl_lixg/miniforge3/envs/telocomp/lib/jvm/bin/java') without -d64 support.
--
-- WARNING:
-- WARNING:  Failed to run gnuplot using command 'gnuplot'.
-- WARNING:  Plots will be disabled.
-- WARNING:
--
-- Detected samtools version '1.22' / htslib version 'htscodecs=1.6.3' (from 'samtools').
--
-- Detected 88 CPUs and 503 gigabytes of memory on the local machine.
--
-- Detected Slurm with 'sinfo' binary in /opt/skyformai/bin/sinfo.
--          Slurm disabled by useGrid=false
--
-- Detected  '' with 'pbsnodes' binary in /opt/skyformai/bin/pbsnodes.
--           disabled by useGrid=false
--
-- Detected LSF with 'bsub' binary in /opt/skyformai/bin/bsub.
--          LSF disabled by useGrid=false
--
-- Local machine mode enabled; grid support not detected or not allowed.
--
-- Found trimmed raw PacBio HiFi reads in the input files.
--
--                                (tag)Concurrency
--                         (tag)Threads          |
--                (tag)Memory         |          |
--        (tag)             |         |          |       total usage      algorithm
--        -------  ----------  --------   --------  --------------------  -----------------------------
-- Local: meryl     12.000 GB    4 CPUs x  22 jobs   264.000 GB  88 CPUs  (k-mer counting)
-- Local: cormhap   13.000 GB   11 CPUs x   8 jobs   104.000 GB  88 CPUs  (overlap detection with mhap)
-- Local: obtovl     8.000 GB    8 CPUs x  11 jobs    88.000 GB  88 CPUs  (overlap detection)
-- Local: utgovl     8.000 GB    8 CPUs x  11 jobs    88.000 GB  88 CPUs  (overlap detection)
-- Local: cor        -.--- GB    4 CPUs x   - jobs     -.--- GB   - CPUs  (read correction)
-- Local: ovb        4.000 GB    1 CPU  x  88 jobs   352.000 GB  88 CPUs  (overlap store bucketizer)
-- Local: ovs        8.000 GB    1 CPU  x  62 jobs   496.000 GB  62 CPUs  (overlap store sorting)
-- Local: red       16.000 GB    4 CPUs x  22 jobs   352.000 GB  88 CPUs  (read error detection)
-- Local: oea        8.000 GB    1 CPU  x  62 jobs   496.000 GB  62 CPUs  (overlap error adjustment)
-- Local: bat       32.000 GB    8 CPUs x   1 job     32.000 GB   8 CPUs  (contig construction with bogart)
-- Local: cns        -.--- GB    8 CPUs x   - jobs     -.--- GB   - CPUs  (consensus)
--
-- Generating assembly 'A3-54' in '/share/org/YZWL/yzwl_lixg/project/28.大豆疫霉菌三代基因组/03.hicanu/A3-54/01.raw_output':
--   genomeSize:
--     85000000
--
--   Overlap Generation Limits:
--     corOvlErrorRate 0.0000 (  0.00%)
--     obtOvlErrorRate 0.0250 (  2.50%)
--     utgOvlErrorRate 0.0100 (  1.00%)
--
--   Overlap Processing Limits:
--     corErrorRate    0.0000 (  0.00%)
--     obtErrorRate    0.0250 (  2.50%)
--     utgErrorRate    0.0003 (  0.03%)
--     cnsErrorRate    0.0500 (  5.00%)
--
--   Stages to run:
--     assemble HiFi reads.
--
--
-- BEGIN STORE CREATION
----------------------------------------
-- Starting command on Fri Jan 16 14:34:51 2026 with 4529129.109 GB free disk space

    cd .
    ./A3-54.seqStore.sh \
    > ./A3-54.seqStore.err 2>&1

-- Finished on Fri Jan 16 14:43:16 2026 (505 seconds) with 4529137.546 GB free disk space
----------------------------------------
--
-- In sequence store './A3-54.seqStore':
--   Found 238506 reads.
--   Found 4250015619 bases (50 times coverage).
--    Histogram of corrected reads:
--    
--    G=4250015619                       sum of  ||               length     num
--    NG         length     index       lengths  ||                range    seqs
--    ----- ------------ --------- ------------  ||  ------------------- -------
--    00010        26532     14647    425021901  ||       1259-2569         3360|-------
--    00020        23941     31573    850024640  ||       2570-3880         5482|------------
--    00030        22162     50065   1275024759  ||       3881-5191         5434|------------
--    00040        20824     69863   1700012665  ||       5192-6502         4900|-----------
--    00050        19691     90866   2125014484  ||       6503-7813         4671|----------
--    00060        18675    113034   2550011964  ||       7814-9124         4294|---------
--    00070        17697    136408   2975023601  ||       9125-10435        4116|---------
--    00080        16582    161175   3400025929  ||      10436-11746        3868|--------
--    00090        14775    188102   3825016731  ||      11747-13057        3898|--------
--    00100         1259    238506   4250015619  ||      13058-14368        6880|---------------
--    001.000x              238506   4250015619  ||      14369-15679       14586|------------------------------
--                                               ||      15680-16990       24291|--------------------------------------------------
--                                               ||      16991-18301       30821|---------------------------------------------------------------
--                                               ||      18302-19612       29469|-------------------------------------------------------------
--                                               ||      19613-20923       24228|--------------------------------------------------
--                                               ||      20924-22234       19056|---------------------------------------
--                                               ||      22235-23545       14186|-----------------------------
--                                               ||      23546-24856       10514|----------------------
--                                               ||      24857-26167        8024|-----------------
--                                               ||      26168-27478        5767|------------
--                                               ||      27479-28789        4116|---------
--                                               ||      28790-30100        2822|------
--                                               ||      30101-31411        1793|----
--                                               ||      31412-32722        1026|---
--                                               ||      32723-34033         523|--
--                                               ||      34034-35344         242|-
--                                               ||      35345-36655         105|-
--                                               ||      36656-37966          18|-
--                                               ||      37967-39277           4|-
--                                               ||      39278-40588           5|-
--                                               ||      40589-41899           3|-
--                                               ||      41900-43210           0|
--                                               ||      43211-44521           0|
--                                               ||      44522-45832           1|-
--                                               ||      45833-47143           0|
--                                               ||      47144-48454           1|-
--                                               ||      48455-49765           0|
--                                               ||      49766-51076           0|
--                                               ||      51077-52387           1|-
--                                               ||      52388-53698           1|-
--    
--
-- In sequence store './A3-54.seqStore':
--   Found 238506 reads.
--   Found 4250015619 bases (50 times coverage).
--    Histogram of corrected-trimmed reads:
--    
--    G=4250015619                       sum of  ||               length     num
--    NG         length     index       lengths  ||                range    seqs
--    ----- ------------ --------- ------------  ||  ------------------- -------
--    00010        26532     14647    425021901  ||       1259-2569         3360|-------
--    00020        23941     31573    850024640  ||       2570-3880         5482|------------
--    00030        22162     50065   1275024759  ||       3881-5191         5434|------------
--    00040        20824     69863   1700012665  ||       5192-6502         4900|-----------
--    00050        19691     90866   2125014484  ||       6503-7813         4671|----------
--    00060        18675    113034   2550011964  ||       7814-9124         4294|---------
--    00070        17697    136408   2975023601  ||       9125-10435        4116|---------
--    00080        16582    161175   3400025929  ||      10436-11746        3868|--------
--    00090        14775    188102   3825016731  ||      11747-13057        3898|--------
--    00100         1259    238506   4250015619  ||      13058-14368        6880|---------------
--    001.000x              238506   4250015619  ||      14369-15679       14586|------------------------------
--                                               ||      15680-16990       24291|--------------------------------------------------
--                                               ||      16991-18301       30821|---------------------------------------------------------------
--                                               ||      18302-19612       29469|-------------------------------------------------------------
--                                               ||      19613-20923       24228|--------------------------------------------------
--                                               ||      20924-22234       19056|---------------------------------------
--                                               ||      22235-23545       14186|-----------------------------
--                                               ||      23546-24856       10514|----------------------
--                                               ||      24857-26167        8024|-----------------
--                                               ||      26168-27478        5767|------------
--                                               ||      27479-28789        4116|---------
--                                               ||      28790-30100        2822|------
--                                               ||      30101-31411        1793|----
--                                               ||      31412-32722        1026|---
--                                               ||      32723-34033         523|--
--                                               ||      34034-35344         242|-
--                                               ||      35345-36655         105|-
--                                               ||      36656-37966          18|-
--                                               ||      37967-39277           4|-
--                                               ||      39278-40588           5|-
--                                               ||      40589-41899           3|-
--                                               ||      41900-43210           0|
--                                               ||      43211-44521           0|
--                                               ||      44522-45832           1|-
--                                               ||      45833-47143           0|
--                                               ||      47144-48454           1|-
--                                               ||      48455-49765           0|
--                                               ||      49766-51076           0|
--                                               ||      51077-52387           1|-
--                                               ||      52388-53698           1|-
--    
--
-- Correction skipped; not enabled.
--
-- Trimming skipped; not enabled.
--
-- BEGIN ASSEMBLY
----------------------------------------
-- Starting command on Fri Jan 16 14:43:16 2026 with 4529137.5 GB free disk space

    cd unitigging/0-mercounts
    ./meryl-configure.sh \
    > ./meryl-configure.err 2>&1

-- Finished on Fri Jan 16 14:43:17 2026 (one second) with 4529137.5 GB free disk space
----------------------------------------
--  segments   memory batches
--  -------- -------- -------
--        01 10.81 GB       2
--        02  5.61 GB       2
--        04  2.97 GB       2
--        06  2.14 GB       2
--        08  1.60 GB       2
--        12  1.07 GB       2
--        16  0.81 GB       2
--        20  0.65 GB       2
--        24  0.54 GB       2
--        32  0.41 GB       2
--        40  0.32 GB       2
--        48  -.-- GB       -  (segment size too small)
--        56  -.-- GB       -  (segment size too small)
--        64  -.-- GB       -  (segment size too small)
--        96  -.-- GB       -  (segment size too small)
--
--  For 238506 reads with 4250015619 bases, limit to 42 batches.
--  Will count kmers using 01 jobs, each using 12 GB and 4 threads.
--
-- Finished stage 'merylConfigure', reset canuIteration.
--
-- Running jobs.  First attempt out of 2.
----------------------------------------
-- Starting 'meryl' concurrent execution on Fri Jan 16 14:43:17 2026 with 4529137.468 GB free disk space (1 processes; 22 concurrently)

    cd unitigging/0-mercounts
    ./meryl-count.sh 1 > ./meryl-count.000001.out 2>&1

-- Finished on Fri Jan 16 14:46:40 2026 (203 seconds) with 4529010.953 GB free disk space
----------------------------------------
-- Found 1 Kmer counting (meryl) outputs.
-- Finished stage 'utg-merylCountCheck', reset canuIteration.
--
-- Running jobs.  First attempt out of 2.
----------------------------------------
-- Starting 'meryl' concurrent execution on Fri Jan 16 14:46:40 2026 with 4529010.921 GB free disk space (1 processes; 22 concurrently)

    cd unitigging/0-mercounts
    ./meryl-process.sh 1 > ./meryl-process.000001.out 2>&1

-- Finished on Fri Jan 16 14:46:46 2026 (6 seconds) with 4529011.484 GB free disk space
----------------------------------------
-- Meryl finished successfully.  Kmer frequency histogram:
--
-- WARNING: gnuplot failed.
--
----------------------------------------
--
--  22-mers                                                                                           Fraction
--    Occurrences   NumMers                                                                         Unique Total
--       1-     1         0                                                                        0.0000 0.0000
--       2-     2    229478                                                                        0.0051 0.0001
--       3-     4     86860                                                                        0.0064 0.0002
--       5-     7     38116                                                                        0.0074 0.0003
--       8-    11     16813                                                                        0.0080 0.0003
--      12-    16     21307                                                                        0.0083 0.0004
--      17-    22    209799                                                                        0.0089 0.0005
--      23-    29   1527633 ******                                                                 0.0155 0.0025
--      30-    37   8765714 **********************************                                     0.0586 0.0194
--      38-    46  17761986 ********************************************************************** 0.2831 0.1305
--      47-    56  10260857 ****************************************                               0.6726 0.3652
--      57-    67   1499282 *****                                                                  0.8700 0.5071
--      68-    79    860762 ***                                                                    0.8974 0.5307
--      80-    92   1011518 ***                                                                    0.9170 0.5514
--      93-   106    530014 **                                                                     0.9389 0.5780
--     107-   121    283352 *                                                                      0.9497 0.5930
--     122-   137    304295 *                                                                      0.9560 0.6033
--     138-   154    189538                                                                        0.9627 0.6154
--     155-   172    181986                                                                        0.9667 0.6237
--     173-   191    147166                                                                        0.9708 0.6331
--     192-   211    125301                                                                        0.9740 0.6413
--     212-   232    113162                                                                        0.9767 0.6491
--     233-   254     94471                                                                        0.9792 0.6569
--     255-   277     80383                                                                        0.9813 0.6639
--     278-   301     70009                                                                        0.9830 0.6706
--     302-   326     63641                                                                        0.9846 0.6768
--     327-   352     53788                                                                        0.9860 0.6831
--     353-   379     47885                                                                        0.9872 0.6888
--     380-   407     38807                                                                        0.9882 0.6941
--     408-   436     34441                                                                        0.9891 0.6989
--     437-   466     32289                                                                        0.9898 0.7034
--     467-   497     30725                                                                        0.9905 0.7079
--     498-   529     27535                                                                        0.9912 0.7125
--     530-   562     24967                                                                        0.9918 0.7169
--     563-   596     20786                                                                        0.9924 0.7212
--     597-   631     21079                                                                        0.9928 0.7249
--     632-   667     22507                                                                        0.9933 0.7289
--     668-   704     19000                                                                        0.9938 0.7335
--     705-   742     15415                                                                        0.9942 0.7375
--     743-   781     12307                                                                        0.9946 0.7409
--     782-   821     10821                                                                        0.9948 0.7438
--
--           0 (max occurrences)
--  3211426656 (total mers, non-unique)
--    45108065 (distinct mers, non-unique)
--           0 (unique mers)
-- Finished stage 'meryl-process', reset canuIteration.
--
-- Removing meryl database 'unitigging/0-mercounts/A3-54.ms22'.
--
-- OVERLAPPER (normal) (assembly) erate=0.01
--
----------------------------------------
-- Starting command on Fri Jan 16 14:46:46 2026 with 4529011.468 GB free disk space

    cd unitigging/1-overlapper
    /share/org/YZWL/yzwl_lixg/miniforge3/envs/canu_v.2.3/bin/overlapInCorePartition \
     -S  ../../A3-54.seqStore \
     -hl 160000000 \
     -rl 5000000000 \
     -ol 500 \
     -o  ./A3-54.partition \
    > ./A3-54.partition.err 2>&1

-- Finished on Fri Jan 16 14:46:46 2026 (furiously fast) with 4529011.453 GB free disk space
----------------------------------------
--
-- Configured 21 overlapInCore jobs.
-- Finished stage 'utg-overlapConfigure', reset canuIteration.
--
-- Running jobs.  First attempt out of 2.
----------------------------------------
-- Starting 'utgovl' concurrent execution on Fri Jan 16 14:46:46 2026 with 4529011.421 GB free disk space (21 processes; 11 concurrently)

    cd unitigging/1-overlapper
    ./overlap.sh 1 > ./overlap.000001.out 2>&1
    ./overlap.sh 2 > ./overlap.000002.out 2>&1
    ./overlap.sh 3 > ./overlap.000003.out 2>&1
    ./overlap.sh 4 > ./overlap.000004.out 2>&1
    ./overlap.sh 5 > ./overlap.000005.out 2>&1
    ./overlap.sh 6 > ./overlap.000006.out 2>&1
    ./overlap.sh 7 > ./overlap.000007.out 2>&1
    ./overlap.sh 8 > ./overlap.000008.out 2>&1
    ./overlap.sh 9 > ./overlap.000009.out 2>&1
    ./overlap.sh 10 > ./overlap.000010.out 2>&1
    ./overlap.sh 11 > ./overlap.000011.out 2>&1
    ./overlap.sh 12 > ./overlap.000012.out 2>&1
    ./overlap.sh 13 > ./overlap.000013.out 2>&1
    ./overlap.sh 14 > ./overlap.000014.out 2>&1
    ./overlap.sh 15 > ./overlap.000015.out 2>&1
    ./overlap.sh 16 > ./overlap.000016.out 2>&1
    ./overlap.sh 17 > ./overlap.000017.out 2>&1
    ./overlap.sh 18 > ./overlap.000018.out 2>&1
    ./overlap.sh 19 > ./overlap.000019.out 2>&1
    ./overlap.sh 20 > ./overlap.000020.out 2>&1
    ./overlap.sh 21 > ./overlap.000021.out 2>&1

-- Finished on Fri Jan 16 15:14:02 2026 (1636 seconds) with 4525333.015 GB free disk space
----------------------------------------
-- Found 21 overlapInCore output files.
--
-- overlapInCore compute 'unitigging/1-overlapper':
--   kmer hits
--     with no overlap       1145377526  786.952381 +- 34621898.574
--     with an overlap         27384169  8.04761905 +- 766108.508
--
--   overlaps                  27384169  8.04761905 +- 766108.508
--     contained                5401933  .904761905 +- 146675.511
--     dovetail                21982236  3.14285714 +- 620321.759
--
--   overlaps rejected
--     multiple per pair              0           0 +- 0
--     bad short window               0           0 +- 0
--     bad long window                0           0 +- 0
-- Finished stage 'utg-overlapCheck', reset canuIteration.
----------------------------------------
-- Starting command on Fri Jan 16 15:14:02 2026 with 4525333 GB free disk space

    cd unitigging
    /share/org/YZWL/yzwl_lixg/miniforge3/envs/canu_v.2.3/bin/ovStoreConfig \
     -S ../A3-54.seqStore \
     -M 4-8 \
     -L ./1-overlapper/ovljob.files \
     -create ./A3-54.ovlStore.config \
     > ./A3-54.ovlStore.config.txt \
    2> ./A3-54.ovlStore.config.err

-- Finished on Fri Jan 16 15:14:03 2026 (one second) with 4525332.984 GB free disk space
----------------------------------------
--
-- Creating overlap store unitigging/A3-54.ovlStore using:
--      1 bucket
--      1 slice
--        using at most 2 GB memory each
--
-- Running jobs.  First attempt out of 2.
----------------------------------------
-- Starting 'ovS' concurrent execution on Fri Jan 16 15:14:03 2026 with 4525332.968 GB free disk space (1 processes; 62 concurrently)

    cd unitigging
    ./A3-54.ovlStore.sh 1 > ./A3-54.ovlStore.000001.out 2>&1

-- Finished on Fri Jan 16 15:14:14 2026 (11 seconds) with 4525275.312 GB free disk space
----------------------------------------
-- Checking store.
----------------------------------------
-- Starting command on Fri Jan 16 15:14:14 2026 with 4525275.312 GB free disk space

    cd unitigging
    /share/org/YZWL/yzwl_lixg/miniforge3/envs/canu_v.2.3/bin/ovStoreDump \
     -S ../A3-54.seqStore \
     -O  ./A3-54.ovlStore \
     -counts \
     > ./A3-54.ovlStore/counts.dat 2> ./A3-54.ovlStore/counts.err

-- Finished on Fri Jan 16 15:14:14 2026 (like a bat out of hell) with 4525275.281 GB free disk space
----------------------------------------
--
-- Overlap store 'unitigging/A3-54.ovlStore' successfully constructed.
-- Found 54768338 overlaps for 226469 reads; 1656005 reads have no overlaps.
--
--
-- Purged 0.619 GB in 63 overlap output files.
----------------------------------------
-- Starting command on Fri Jan 16 15:14:15 2026 with 4525275.281 GB free disk space

    cd unitigging
    /share/org/YZWL/yzwl_lixg/miniforge3/envs/canu_v.2.3/bin/ovStoreStats \
     -C 50 \
     -S ../A3-54.seqStore \
     -O  ./A3-54.ovlStore \
     -o  ./A3-54.ovlStore \
     > ./A3-54.ovlStore.summary.err 2>&1

-- Finished on Fri Jan 16 15:14:23 2026 (8 seconds) with 4525275.265 GB free disk space
----------------------------------------
--
-- Overlap store 'unitigging/A3-54.ovlStore' contains:
--
--   category            reads     %          read length        feature size or coverage  analysis
--   ----------------  -------  -------  ----------------------  ------------------------  --------------------
--   middle-missing        110    0.05    16109.06 +- 7388.68       1015.24 +- 1686.83    (bad trimming)
--   middle-hump            18    0.01    14893.83 +- 3777.44       5559.89 +- 3758.30    (bad trimming)
--   no-5-prime            464    0.19    14401.90 +- 4699.79       2071.62 +- 2723.61    (bad trimming)
--   no-3-prime            563    0.24    13421.88 +- 5696.51       2312.87 +- 3344.37    (bad trimming)
--   
--   low-coverage         1671    0.70    12307.69 +- 4570.22          6.32 +- 3.76       (easy to assemble, potential for lower quality consensus)
--   unique             181562   76.12    13700.11 +- 4758.03         42.65 +- 8.21       (easy to assemble, perfect, yay)
--   repeat-cont         18941    7.94    12149.75 +- 4286.02       1034.65 +- 718.10     (potential for consensus errors, no impact on assembly)
--   repeat-dove           286    0.12    21201.91 +- 2437.96        587.39 +- 605.79     (hard to assemble, likely won't assemble correctly or even at all)
--   
--   span-repeat          3104    1.30    14674.32 +- 4023.02       3993.82 +- 4195.94    (read spans a large repeat, usually easy to assemble)
--   uniq-repeat-cont    14222    5.96    13578.91 +- 3838.98                             (should be uniquely placed, low potential for consensus errors, no impact on assembly)
--   uniq-repeat-dove     2515    1.05    19201.22 +- 3122.29                             (will end contigs, potential to misassemble)
--   uniq-anchor          3013    1.26    14372.92 +- 4055.36       7380.25 +- 4794.67    (repeat read, with unique section, probable bad read)
-- Finished stage 'utg-createOverlapStore', reset canuIteration.
--
-- Loading read lengths.
-- Loading number of overlaps per read.
--
-- Configure RED for 16gb memory.
--                   Batches of at most (unlimited) reads.
--                                      500000000 bases.
--                   Expecting evidence of at most 536870912 bases per iteration.
--
--           Total                                               Reads                 Olaps Evidence
--    Job   Memory      Read Range         Reads        Bases   Memory        Olaps   Memory   Memory  (Memory in MB)
--   ---- -------- ------------------- --------- ------------ -------- ------------ -------- --------
--      1 16384.32         1-44115          5694    108973919 13302.66       843964     9.66  1024.00
--      2 16384.53     44116-89420          5710    108856428 13288.32      2115425    24.21  1024.00
--      3 16384.71     89421-142040         6618    108974646 13302.78       867726     9.93  1024.00
--      4 16385.97    142041-192749         6361    108918021 13295.86      1582743    18.11  1024.00
--      5 16385.78    192750-237837         5786    108889206 13292.32      1874665    21.45  1024.00
--      6 16385.65    237838-289439         6541    108980532 13303.49       887226    10.15  1024.00
--      7 16385.88    289440-340156         6389    108925956 13296.83      1490369    17.06  1024.00
--      8 16386.24    340157-385449         5738    108893318 13292.82      1871175    21.41  1024.00
--      9 16385.07    385450-436167         6496    108977594 13303.13       868710     9.94  1024.00
--     10 16385.15    436168-486908         6294    108920843 13296.20      1481281    16.95  1024.00
--     11 16384.38    486909-531709         5735    108890429 13292.47      1739718    19.91  1024.00
--     12 16385.00    531710-582793         6412    108968180 13301.98       962856    11.02  1024.00
--     13 16384.59    582794-632071         6246    108925150 13296.72      1386789    15.87  1024.00
--     14 16384.61    632072-677643         5730    108889335 13292.34      1771598    20.27  1024.00
--     15 16386.85    677644-728396         6521    108983325 13303.83       962749    11.02  1024.00
--     16 16384.42    728397-776054         6217    108917357 13295.77      1454428    16.64  1024.00
--     17 16384.64    776055-822038         5719    108884597 13291.76      1825236    20.89  1024.00
--     18 16384.54    822039-873615         6536    108958649 13300.82      1024143    11.72  1024.00
--     19 16385.77    873616-921218         6132    108935550 13297.99      1378856    15.78  1024.00
--     20 16385.15    921219-967057         5745    108889014 13292.30      1822284    20.85  1024.00
--     21 16386.15    967058-1018324        6522    108971190 13302.35      1030696    11.80  1024.00
--     22 16384.75   1018325-1064600        5899    108929389 13297.23      1356484    15.52  1024.00
--     23 16384.18   1064601-1110522        5721    108886572 13292.00      1763537    20.18  1024.00
--     24 16385.14   1110523-1164174        6668    108957142 13300.64      1092076    12.50  1024.00
--     25 16386.71   1164175-1208454        5739    108961585 13301.16      1184387    13.55  1024.00
--     26 16385.23   1208455-1253744        5733    108886273 13291.96      1858545    21.27  1024.00
--     27 16384.06   1253745-1307391        6693    108914104 13295.39      1456629    16.67  1024.00
--     28 16384.86   1307392-1352546        5622    108954894 13300.33      1094611    12.53  1024.00
--     29 16384.16   1352547-1397668        5719    108894183 13292.93      1680981    19.24  1024.00
--     30 16384.86   1397669-1452482        6873    108918859 13295.98      1475035    16.88  1024.00
--     31 16384.35   1452483-1495472        5573    108952915 13300.09      1071003    12.26  1024.00
--     32 16385.45   1495473-1540408        5739    108903373 13294.05      1695432    19.40  1024.00
--     33 16384.07   1540409-1593385        6747    108915490 13295.56      1442647    16.51  1024.00
--     34 16385.17   1593386-1638028        5615    108958754 13300.81      1079990    12.36  1024.00
--     35 16386.28   1638029-1683264        5822    108913432 13295.28      1660279    19.00  1024.00
--     36 16384.02   1683265-1736771        6871    108909594 13294.84      1500857    17.18  1024.00
--     37 16384.85   1736772-1781273        5613    108956633 13300.55      1075000    12.30  1024.00
--     38 16385.52   1781274-1827366        5787    108920116 13296.09      1522244    17.42  1024.00
--     39 16385.69   1827367-1881432        6817    108923254 13296.51      1501561    17.18  1024.00
--     40  3296.27   1881433-1882474         113      1835818   224.10        14403     0.16  1024.00
--   ---- -------- ------------------- --------- ------------ -------- ------------ -------- --------
--                                                 4250015619              54768338
-- Finished stage 'readErrorDetectionConfigure', reset canuIteration.
--
-- Running jobs.  First attempt out of 2.
----------------------------------------
-- Starting 'red' concurrent execution on Fri Jan 16 15:14:30 2026 with 4525275.218 GB free disk space (40 processes; 22 concurrently)

    cd unitigging/3-overlapErrorAdjustment
    ./red.sh 1 > ./red.000001.out 2>&1
    ./red.sh 2 > ./red.000002.out 2>&1
    ./red.sh 3 > ./red.000003.out 2>&1
    ./red.sh 4 > ./red.000004.out 2>&1
    ./red.sh 5 > ./red.000005.out 2>&1
    ./red.sh 6 > ./red.000006.out 2>&1
    ./red.sh 7 > ./red.000007.out 2>&1
    ./red.sh 8 > ./red.000008.out 2>&1
    ./red.sh 9 > ./red.000009.out 2>&1
    ./red.sh 10 > ./red.000010.out 2>&1
    ./red.sh 11 > ./red.000011.out 2>&1
    ./red.sh 12 > ./red.000012.out 2>&1
    ./red.sh 13 > ./red.000013.out 2>&1
    ./red.sh 14 > ./red.000014.out 2>&1
    ./red.sh 15 > ./red.000015.out 2>&1
    ./red.sh 16 > ./red.000016.out 2>&1
    ./red.sh 17 > ./red.000017.out 2>&1
    ./red.sh 18 > ./red.000018.out 2>&1
    ./red.sh 19 > ./red.000019.out 2>&1
    ./red.sh 20 > ./red.000020.out 2>&1
    ./red.sh 21 > ./red.000021.out 2>&1
    ./red.sh 22 > ./red.000022.out 2>&1
    ./red.sh 23 > ./red.000023.out 2>&1
    ./red.sh 24 > ./red.000024.out 2>&1
    ./red.sh 25 > ./red.000025.out 2>&1
    ./red.sh 26 > ./red.000026.out 2>&1
    ./red.sh 27 > ./red.000027.out 2>&1
    ./red.sh 28 > ./red.000028.out 2>&1
    ./red.sh 29 > ./red.000029.out 2>&1
    ./red.sh 30 > ./red.000030.out 2>&1
    ./red.sh 31 > ./red.000031.out 2>&1
    ./red.sh 32 > ./red.000032.out 2>&1
    ./red.sh 33 > ./red.000033.out 2>&1
    ./red.sh 34 > ./red.000034.out 2>&1
    ./red.sh 35 > ./red.000035.out 2>&1
    ./red.sh 36 > ./red.000036.out 2>&1
    ./red.sh 37 > ./red.000037.out 2>&1
    ./red.sh 38 > ./red.000038.out 2>&1
    ./red.sh 39 > ./red.000039.out 2>&1
    ./red.sh 40 > ./red.000040.out 2>&1

-- Finished on Fri Jan 16 15:30:49 2026 (979 seconds) with 4523547.781 GB free disk space
----------------------------------------
-- Found 40 read error detection output files.
-- Finished stage 'readErrorDetectionCheck', reset canuIteration.
--
-- Loading read lengths.
-- Loading number of overlaps per read.
--
-- Configure OEA for 8gb memory.
--                   Batches of at most (unlimited) reads.
--                                      300000000 bases.
--
--           Total                                               Reads                 Olaps  Adjusts
--    Job   Memory      Read Range         Reads        Bases   Memory        Olaps   Memory   Memory  (Memory in MB)
--   ---- -------- ------------------- --------- ------------ -------- ------------ -------- --------
--      1  2821.19         1-127771        16193    300012018   294.61      3539616   108.02   370.57
--      2  2838.07    127772-262863        17103    300012002   294.64      4091726   124.87   370.57
--      3  2838.11    262864-397832        17125    300003659   294.63      4093326   124.92   370.57
--      4  2832.41    397833-532308        17040    300000593   294.62      3906677   119.22   370.57
--      5  2826.68    532309-667144        16935    300010318   294.63      3718630   113.48   370.57
--      6  2830.16    667145-799844        17041    300009964   294.63      3832619   116.96   370.57
--      7  2830.64    799845-933896        17016    300000438   294.62      3848638   117.45   370.57
--      8  2822.59    933897-1065883       16772    300004497   294.62      3585071   109.41   370.57
--      9  2825.00   1065884-1199488       16760    300027834   294.64      3663349   111.80   370.57
--     10  2837.63   1199489-1332285       16689    300017816   294.63      4077593   124.44   370.57
--     11  2835.66   1332286-1465084       16790    300022543   294.64      4012835   122.46   370.57
--     12  2838.58   1465085-1596346       16783    300000071   294.61      4109110   125.40   370.57
--     13  2816.32   1596347-1724196       16315    300008216   294.61      3379990   103.15   370.57
--     14  2828.76   1724197-1855316       16525    300021844   294.63      3787031   115.57   370.57
--     15  2508.47   1855317-1882474        3419     49863806    55.66      1122127    34.24   370.57
--   ---- -------- ------------------- --------- ------------ -------- ------------ -------- --------
--                                                 4250015619              54768338
-- Finished stage 'overlapErrorAdjustmentConfigure', reset canuIteration.
--
-- Running jobs.  First attempt out of 2.
----------------------------------------
-- Starting 'oea' concurrent execution on Fri Jan 16 15:30:57 2026 with 4523547.703 GB free disk space (15 processes; 62 concurrently)

    cd unitigging/3-overlapErrorAdjustment
    ./oea.sh 1 > ./oea.000001.out 2>&1
    ./oea.sh 2 > ./oea.000002.out 2>&1
    ./oea.sh 3 > ./oea.000003.out 2>&1
    ./oea.sh 4 > ./oea.000004.out 2>&1
    ./oea.sh 5 > ./oea.000005.out 2>&1
    ./oea.sh 6 > ./oea.000006.out 2>&1
    ./oea.sh 7 > ./oea.000007.out 2>&1
    ./oea.sh 8 > ./oea.000008.out 2>&1
    ./oea.sh 9 > ./oea.000009.out 2>&1
    ./oea.sh 10 > ./oea.000010.out 2>&1
    ./oea.sh 11 > ./oea.000011.out 2>&1
    ./oea.sh 12 > ./oea.000012.out 2>&1
    ./oea.sh 13 > ./oea.000013.out 2>&1
    ./oea.sh 14 > ./oea.000014.out 2>&1
    ./oea.sh 15 > ./oea.000015.out 2>&1

-- Finished on Fri Jan 16 16:19:42 2026 (2925 seconds) with 4520418.578 GB free disk space
----------------------------------------
-- Found 15 overlap error adjustment output files.
-- Finished stage 'overlapErrorAdjustmentCheck', reset canuIteration.
----------------------------------------
-- Starting command on Fri Jan 16 16:19:42 2026 with 4520418.562 GB free disk space

    cd unitigging/3-overlapErrorAdjustment
    /share/org/YZWL/yzwl_lixg/miniforge3/envs/canu_v.2.3/bin/loadErates \
      -S ../../A3-54.seqStore \
      -O ../A3-54.ovlStore \
      -L ./oea.files \
    > ./oea.apply.err 2>&1

-- Finished on Fri Jan 16 16:19:42 2026 (lickety-split) with 4520418.437 GB free disk space
----------------------------------------
-- No report available.
-- Finished stage 'updateOverlapStore', reset canuIteration.
-- Finished stage 'unitig', reset canuIteration.
--
-- Running jobs.  First attempt out of 2.
----------------------------------------
-- Starting 'bat' concurrent execution on Fri Jan 16 16:19:42 2026 with 4520418.39 GB free disk space (1 processes; 1 concurrently)

    cd unitigging/4-unitigger
    ./unitigger.sh 1 > ./unitigger.000001.out 2>&1

-- Finished on Fri Jan 16 16:19:56 2026 (14 seconds) with 4520418.234 GB free disk space
----------------------------------------
-- Unitigger finished successfully.
--  
--  ERROR RATES
--  -----------
--                                                   --------threshold------
--  253458                       fraction error      fraction        percent
--  samples                              (1e-5)         error          error
--                   --------------------------      --------       --------
--  command line (-eg)                           ->     30.00        0.0300%
--  command line (-ef)                           ->  -----.--      ---.----%
--  command line (-eM)                           ->     30.00        0.0300%
--  mean + std.dev       0.47 +-  12 *     3.18  ->     38.69        0.0387%
--  median + mad         0.00 +-  12 *     0.00  ->      0.00        0.0000%
--  90th percentile                              ->      1.00        0.0010%  (enabled)
--  
--  BEST EDGE FILTERING
--  -------------------
--  At graph threshold 0.0300%, reads:
--    available to have edges:        49421
--    with at least one edge:         34188
--  
--  At max threshold 0.0300%, reads:
--    available to have edges:        49421
--    with at least one edge:         34188
--  
--  At tight threshold 0.0010%, reads with:
--    both edges below error threshold:     29407  (80.00% minReadsBest threshold = 27350)
--    one  edge  above error threshold:      3678
--    both edges above error threshold:      1103
--    at least one edge:                    34188
--  
--  At loose threshold 0.0300%, reads with:
--    both edges below error threshold:     34188  (80.00% minReadsBest threshold = 27350)
--    one  edge  above error threshold:         0
--    both edges above error threshold:         0
--    at least one edge:                    34188
--  
--  
--  INITIAL EDGES
--  -------- ----------------------------------------
--    183622 reads are contained
--   1670076 reads have no best edges (singleton)
--       358 reads have only one best edge (spur) 
--                204 are mutual best
--     28418 reads have two best edges 
--                696 have one mutual best edge
--              27418 have two mutual best edges
--  
--  
--  FINAL EDGES
--  -------- ----------------------------------------
--    183622 reads are contained
--   1670390 reads have no best edges (singleton)
--       240 reads have only one best edge (spur) 
--                203 are mutual best
--     28222 reads have two best edges 
--                607 have one mutual best edge
--              27391 have two mutual best edges
--  
--  
--  EDGE FILTERING
--  -------- ------------------------------------------
--         0 reads are ignored
--     10109 reads have a gap in overlap coverage
--       139 reads have lopsided best edges
-- Found, in version 1, after unitig construction:
--   contigs:      128 sequences, total length 69885787 bp (including 130 repeats of total length 3356508 bp).
--   bubbles:      158 sequences, total length 4748349 bp.
--   unassembled:  25996 sequences, total length 331124784 bp.
--
-- Contig sizes based on genome size 85mbp:
--
--            NG (bp)  LG (contigs)    sum (bp)
--         ----------  ------------  ----------
--     10     6288390             2    13672060
--     20     6024351             3    19696411
--     30     4583959             5    28905212
--     40     4434814             7    37878585
--     50     3324810             9    44551092
--     60     2559733            12    52792812
--     70     1309559            16    60236260
--     80       39660            49    68009616
--
-- Finished stage 'unitigCheck', reset canuIteration.
----------------------------------------
-- Starting command on Fri Jan 16 16:19:56 2026 with 4520418.218 GB free disk space

    cd unitigging
    /share/org/YZWL/yzwl_lixg/miniforge3/envs/canu_v.2.3/bin/utgcns \
      -S ../A3-54.seqStore \
      -T  ./A3-54.ctgStore 1 \
      -partition 0.8 1.5 0.1 \
    > ./A3-54.ctgStore/partitioning.log 2>&1

-- Finished on Fri Jan 16 16:20:06 2026 (10 seconds) with 4520416.984 GB free disk space
----------------------------------------
-- Using slow alignment for consensus (iteration '0').
-- Configured 11 consensus jobs.
-- Finished stage 'consensusConfigure', reset canuIteration.
--
-- Local: cns       11.000 GB    8 CPUs x  11 jobs   121.000 GB  88 CPUs  (consensus)
--
--
-- Running jobs.  First attempt out of 2.
----------------------------------------
-- Starting 'cns' concurrent execution on Fri Jan 16 16:20:06 2026 with 4520416.953 GB free disk space (11 processes; 11 concurrently)

    cd unitigging/5-consensus
    ./consensus.sh 1 > ./consensus.000001.out 2>&1
    ./consensus.sh 2 > ./consensus.000002.out 2>&1
    ./consensus.sh 3 > ./consensus.000003.out 2>&1
    ./consensus.sh 4 > ./consensus.000004.out 2>&1
    ./consensus.sh 5 > ./consensus.000005.out 2>&1
    ./consensus.sh 6 > ./consensus.000006.out 2>&1
    ./consensus.sh 7 > ./consensus.000007.out 2>&1
    ./consensus.sh 8 > ./consensus.000008.out 2>&1
    ./consensus.sh 9 > ./consensus.000009.out 2>&1
    ./consensus.sh 10 > ./consensus.000010.out 2>&1
    ./consensus.sh 11 > ./consensus.000011.out 2>&1

-- Finished on Fri Jan 16 16:27:05 2026 (419 seconds) with 4520376.531 GB free disk space
----------------------------------------
-- Using slow alignment for consensus (iteration '1').
-- Configured 11 consensus jobs.
-- All 11 consensus jobs finished successfully.
-- Finished stage 'consensusCheck', reset canuIteration.
-- Using slow alignment for consensus (iteration '0').
-- Configured 11 consensus jobs.
----------------------------------------
-- Starting command on Fri Jan 16 16:27:05 2026 with 4520376.484 GB free disk space

    cd unitigging
    /share/org/YZWL/yzwl_lixg/miniforge3/envs/canu_v.2.3/bin/tgStoreLoad \
      -S ../A3-54.seqStore \
      -T  ./A3-54.ctgStore 2 \
      -L ./5-consensus/ctgcns.files \
    > ./5-consensus/ctgcns.files.ctgStoreLoad.err 2>&1

-- Finished on Fri Jan 16 16:27:06 2026 (one second) with 4520375.375 GB free disk space
----------------------------------------
----------------------------------------
-- Starting command on Fri Jan 16 16:27:06 2026 with 4520375.375 GB free disk space

    cd unitigging
    /share/org/YZWL/yzwl_lixg/miniforge3/envs/canu_v.2.3/bin/tgTigDisplay \
      -S ../A3-54.seqStore \
      -b \
      -o ../A3-54.contigs.unsorted.bam \
      -L ./5-consensus/ctgcns.files \
    > ./5-consensus/ctgcns.files.contigs.bam.err 2>&1

-- Finished on Fri Jan 16 16:29:48 2026 (162 seconds) with 4520317.843 GB free disk space
----------------------------------------
----------------------------------------
-- Starting command on Fri Jan 16 16:29:48 2026 with 4520317.843 GB free disk space

    cd .
    samtools sort \
      --write-index \
      --threads 2 \
      -o ./A3-54.contigs.bam ./A3-54.contigs.unsorted.bam \
    > ./ctgcns.bam.err 2>&1

-- Finished on Fri Jan 16 16:30:40 2026 (52 seconds) with 4520280.531 GB free disk space
----------------------------------------
-- Purging consensus output after loading to ctgStore.
-- Purged 11 .cns outputs.
----------------------------------------
-- Starting command on Fri Jan 16 16:30:40 2026 with 4520283.296 GB free disk space

    cd unitigging
    /share/org/YZWL/yzwl_lixg/miniforge3/envs/canu_v.2.3/bin/tgStoreDump \
      -S ../A3-54.seqStore \
      -T ./A3-54.ctgStore 2 \
      -sizes -s 85000000 \
    > ./A3-54.ctgStore/seqDB.v002.sizes.txt
ZERO length suplied to intervalList::add(), ignoring interval.
ZERO length suplied to intervalList::add(), ignoring interval.
ZERO length suplied to intervalList::add(), ignoring interval.
ZERO length suplied to intervalList::add(), ignoring interval.
ZERO length suplied to intervalList::add(), ignoring interval.
ZERO length suplied to intervalList::add(), ignoring interval.
ZERO length suplied to intervalList::add(), ignoring interval.
ZERO length suplied to intervalList::add(), ignoring interval.
ZERO length suplied to intervalList::add(), ignoring interval.
ZERO length suplied to intervalList::add(), ignoring interval.
ZERO length suplied to intervalList::add(), ignoring interval.
ZERO length suplied to intervalList::add(), ignoring interval.

-- Finished on Fri Jan 16 16:30:40 2026 (in the blink of an eye) with 4520283.296 GB free disk space
----------------------------------------
-- Found, in version 2, after consensus generation:
--   contigs:      128 sequences, total length 91281029 bp (including 130 repeats of total length 4635933 bp).
--   bubbles:      158 sequences, total length 6350021 bp.
--   unassembled:  25996 sequences, total length 454166290 bp.
--
-- Contig sizes based on genome size 85mbp:
--
--            NG (bp)  LG (contigs)    sum (bp)
--         ----------  ------------  ----------
--     10     9591527             1     9591527
--     20     8168915             2    17760442
--     30     7817654             3    25578096
--     40     5971797             5    37573931
--     50     5915902             6    43489833
--     60     4367955             8    53649199
--     70     4061244            10    62044837
--     80     3320863            12    68712557
--     90     2023628            15    76710227
--    100      685700            22    85170245
--
-- Finished stage 'consensusLoad', reset canuIteration.
----------------------------------------
-- Starting command on Fri Jan 16 16:30:40 2026 with 4520283.281 GB free disk space

    cd .
    /share/org/YZWL/yzwl_lixg/miniforge3/envs/canu_v.2.3/bin/tgStoreDump \
      -S ./A3-54.seqStore \
      -T ./unitigging/A3-54.ctgStore 2 \
      -o ./A3-54.contigs \
      -layout \
    > ./A3-54.contigs.layout.err 2>&1

-- Finished on Fri Jan 16 16:30:41 2026 (one second) with 4520283.234 GB free disk space
----------------------------------------
----------------------------------------
-- Starting command on Fri Jan 16 16:30:41 2026 with 4520283.234 GB free disk space

    cd .
    /share/org/YZWL/yzwl_lixg/miniforge3/envs/canu_v.2.3/bin/tgStoreDump \
      -S ./A3-54.seqStore \
      -T ./unitigging/A3-54.ctgStore 2 \
      -consensus -fasta \
      -unassembled \
    > ./A3-54.unassembled.fasta
    2> ./A3-54.unassembled.err
ZERO length suplied to intervalList::add(), ignoring interval.
ZERO length suplied to intervalList::add(), ignoring interval.
ZERO length suplied to intervalList::add(), ignoring interval.
ZERO length suplied to intervalList::add(), ignoring interval.
ZERO length suplied to intervalList::add(), ignoring interval.
ZERO length suplied to intervalList::add(), ignoring interval.
ZERO length suplied to intervalList::add(), ignoring interval.
ZERO length suplied to intervalList::add(), ignoring interval.
ZERO length suplied to intervalList::add(), ignoring interval.
ZERO length suplied to intervalList::add(), ignoring interval.
ZERO length suplied to intervalList::add(), ignoring interval.
ZERO length suplied to intervalList::add(), ignoring interval.

-- Finished on Fri Jan 16 16:30:43 2026 (2 seconds) with 4520282.781 GB free disk space
----------------------------------------
----------------------------------------
-- Starting command on Fri Jan 16 16:30:43 2026 with 4520282.781 GB free disk space

    cd .
    /share/org/YZWL/yzwl_lixg/miniforge3/envs/canu_v.2.3/bin/tgStoreDump \
      -S ./A3-54.seqStore \
      -T ./unitigging/A3-54.ctgStore 2 \
      -consensus -fasta \
      -contigs \
    > ./A3-54.contigs.fasta
    2> ./A3-54.contigs.err
ZERO length suplied to intervalList::add(), ignoring interval.
ZERO length suplied to intervalList::add(), ignoring interval.
ZERO length suplied to intervalList::add(), ignoring interval.
ZERO length suplied to intervalList::add(), ignoring interval.
ZERO length suplied to intervalList::add(), ignoring interval.
ZERO length suplied to intervalList::add(), ignoring interval.
ZERO length suplied to intervalList::add(), ignoring interval.
ZERO length suplied to intervalList::add(), ignoring interval.
ZERO length suplied to intervalList::add(), ignoring interval.
ZERO length suplied to intervalList::add(), ignoring interval.
ZERO length suplied to intervalList::add(), ignoring interval.
ZERO length suplied to intervalList::add(), ignoring interval.

-- Finished on Fri Jan 16 16:30:44 2026 (one second) with 4520282.671 GB free disk space
----------------------------------------
-- Finished stage 'generateOutputs', reset canuIteration.
--
-- Assembly 'A3-54' finished in '/share/org/YZWL/yzwl_lixg/project/28.大豆疫霉菌三代基因组/03.hicanu/A3-54/01.raw_output'.
--
-- Summary saved in 'A3-54.report'.
--
-- Sequences saved:
--   Contigs       -> 'A3-54.contigs.fasta'
--   Unassembled   -> 'A3-54.unassembled.fasta'
--
-- Read layouts saved:
--   Contigs       -> 'A3-54.contigs.layout'.
--
-- Bye.

2026-01-16 16:30:44.261 - WARNING - 输出文件不存在|Output file does not exist: /share/org/YZWL/yzwl_lixg/project/28.大豆疫霉菌三代基因组/03.hicanu/A3-54/01.raw_output/A3-54.unitigs.fasta
Job 68889961 stderr output:

