Usage: biopytools ragtag [OPTIONS]
Try 'biopytools ragtag -h' for help.

Error: Invalid value for '-r' / '--reference': 文件不存在|File does not exist: /share/org/YZWL/yzwl_lixg/project/28.大豆疫霉菌三代基因组/04.ragtag/Psoja_T2T.fa
Usage: biopytools genomesyn [OPTIONS]
Try 'biopytools genomesyn -h' for help.

Error: Invalid value for '-i' / '--ref': Path '04.ragtag/A3-22/hifiasm/A3-22_RagTag_scaffolded.fa' does not exist.
2026-01-16 01:44:08.054 - WARNING - 命令错误输出|Command stderr:
-- canu master +27 changes (r10515 2a41e933b8de6ed66723d75d36dd071b46d2c347)
--
-- CITATIONS
--
-- For assemblies of PacBio HiFi reads:
--   Nurk S, Walenz BP, Rhiea A, Vollger MR, Logsdon GA, Grothe R, Miga KH, Eichler EE, Phillippy AM, Koren S.
--   HiCanu: accurate assembly of segmental duplications, satellites, and allelic variants from high-fidelity long reads.
--   biorXiv. 2020.
--   https://doi.org/10.1101/2020.03.14.992248
-- 
-- Read and contig alignments during correction and consensus use:
--   Šošic M, Šikic M.
--   Edlib: a C/C ++ library for fast, exact sequence alignment using edit distance.
--   Bioinformatics. 2017 May 1;33(9):1394-1395.
--   http://doi.org/10.1093/bioinformatics/btw753
-- 
-- Overlaps are generated using:
--   Berlin K, et al.
--   Assembling large genomes with single-molecule sequencing and locality-sensitive hashing.
--   Nat Biotechnol. 2015 Jun;33(6):623-30.
--   http://doi.org/10.1038/nbt.3238
-- 
--   Myers EW, et al.
--   A Whole-Genome Assembly of Drosophila.
--   Science. 2000 Mar 24;287(5461):2196-204.
--   http://doi.org/10.1126/science.287.5461.2196
-- 
-- Contig consensus sequences are generated using an algorithm derived from pbdagcon:
--   Chin CS, et al.
--   Nonhybrid, finished microbial genome assemblies from long-read SMRT sequencing data.
--   Nat Methods. 2013 Jun;10(6):563-9
--   http://doi.org/10.1038/nmeth.2474
-- 
-- CONFIGURE CANU
--
-- Detected Java(TM) Runtime Environment '17.0.15-internal' (from '/share/org/YZWL/yzwl_lixg/.local/bin/java') without -d64 support.
--
-- WARNING:
-- WARNING:  Failed to run gnuplot using command 'gnuplot'.
-- WARNING:  Plots will be disabled.
-- WARNING:
--
-- Detected samtools version '1.22' / htslib version 'htscodecs=1.6.3' (from 'samtools').
--
-- Detected 88 CPUs and 503 gigabytes of memory on the local machine.
--
-- Detected Slurm with 'sinfo' binary in /opt/skyformai/bin/sinfo.
--          Slurm disabled by useGrid=false
--
-- Detected  '' with 'pbsnodes' binary in /opt/skyformai/bin/pbsnodes.
--           disabled by useGrid=false
--
-- Detected LSF with 'bsub' binary in /opt/skyformai/bin/bsub.
--          LSF disabled by useGrid=false
--
-- Local machine mode enabled; grid support not detected or not allowed.
--
-- Found trimmed raw PacBio HiFi reads in the input files.
--
--                                (tag)Concurrency
--                         (tag)Threads          |
--                (tag)Memory         |          |
--        (tag)             |         |          |       total usage      algorithm
--        -------  ----------  --------   --------  --------------------  -----------------------------
-- Local: meryl     12.000 GB    4 CPUs x  22 jobs   264.000 GB  88 CPUs  (k-mer counting)
-- Local: cormhap   13.000 GB   11 CPUs x   8 jobs   104.000 GB  88 CPUs  (overlap detection with mhap)
-- Local: obtovl     8.000 GB    8 CPUs x  11 jobs    88.000 GB  88 CPUs  (overlap detection)
-- Local: utgovl     8.000 GB    8 CPUs x  11 jobs    88.000 GB  88 CPUs  (overlap detection)
-- Local: cor        -.--- GB    4 CPUs x   - jobs     -.--- GB   - CPUs  (read correction)
-- Local: ovb        4.000 GB    1 CPU  x  88 jobs   352.000 GB  88 CPUs  (overlap store bucketizer)
-- Local: ovs        8.000 GB    1 CPU  x  62 jobs   496.000 GB  62 CPUs  (overlap store sorting)
-- Local: red       16.000 GB    4 CPUs x  22 jobs   352.000 GB  88 CPUs  (read error detection)
-- Local: oea        8.000 GB    1 CPU  x  62 jobs   496.000 GB  62 CPUs  (overlap error adjustment)
-- Local: bat       32.000 GB    8 CPUs x   1 job     32.000 GB   8 CPUs  (contig construction with bogart)
-- Local: cns        -.--- GB    8 CPUs x   - jobs     -.--- GB   - CPUs  (consensus)
--
-- Generating assembly 'A3-22' in '/share/org/YZWL/yzwl_lixg/project/28.大豆疫霉菌三代基因组/03.hicanu/A3-22/01.raw_output':
--   genomeSize:
--     85000000
--
--   Overlap Generation Limits:
--     corOvlErrorRate 0.0000 (  0.00%)
--     obtOvlErrorRate 0.0250 (  2.50%)
--     utgOvlErrorRate 0.0100 (  1.00%)
--
--   Overlap Processing Limits:
--     corErrorRate    0.0000 (  0.00%)
--     obtErrorRate    0.0250 (  2.50%)
--     utgErrorRate    0.0003 (  0.03%)
--     cnsErrorRate    0.0500 (  5.00%)
--
--   Stages to run:
--     assemble HiFi reads.
--
--
-- BEGIN STORE CREATION
----------------------------------------
-- Starting command on Fri Jan 16 00:26:21 2026 with 4563922.156 GB free disk space

    cd .
    ./A3-22.seqStore.sh \
    > ./A3-22.seqStore.err 2>&1

-- Finished on Fri Jan 16 00:33:31 2026 (430 seconds) with 4562694.843 GB free disk space
----------------------------------------
--
-- In sequence store './A3-22.seqStore':
--   Found 233839 reads.
--   Found 4250026417 bases (50 times coverage).
--    Histogram of corrected reads:
--    
--    G=4250026417                       sum of  ||               length     num
--    NG         length     index       lengths  ||                range    seqs
--    ----- ------------ --------- ------------  ||  ------------------- -------
--    00010        27884     14040    425002970  ||       1210-2540         5766|--------------
--    00020        25449     30053    850018520  ||       2541-3871         8731|---------------------
--    00030        23818     47340   1275008679  ||       3872-5202         7805|-------------------
--    00040        22551     65691   1700023264  ||       5203-6533         6910|-----------------
--    00050        21446     85024   2125028809  ||       6534-7864         5933|---------------
--    00060        20405    105341   2550019364  ||       7865-9195         5316|-------------
--    00070        19319    126731   2975019261  ||       9196-10526        4849|------------
--    00080        17942    149510   3400028406  ||      10527-11857        4341|-----------
--    00090        14935    174872   3825034217  ||      11858-13188        3826|----------
--    00100         1210    233839   4250026417  ||      13189-14519        3999|----------
--    001.000x              233839   4250026417  ||      14520-15850        5983|---------------
--                                               ||      15851-17181       11205|---------------------------
--                                               ||      17182-18512       18462|--------------------------------------------
--                                               ||      18513-19843       24127|----------------------------------------------------------
--                                               ||      19844-21174       26439|---------------------------------------------------------------
--                                               ||      21175-22505       23737|---------------------------------------------------------
--                                               ||      22506-23836       19313|-----------------------------------------------
--                                               ||      23837-25167       14584|-----------------------------------
--                                               ||      25168-26498       10613|--------------------------
--                                               ||      26499-27829        7583|-------------------
--                                               ||      27830-29160        5478|--------------
--                                               ||      29161-30491        3712|---------
--                                               ||      30492-31822        2304|------
--                                               ||      31823-33153        1461|----
--                                               ||      33154-34484         785|--
--                                               ||      34485-35815         344|-
--                                               ||      35816-37146         148|-
--                                               ||      37147-38477          51|-
--                                               ||      38478-39808          20|-
--                                               ||      39809-41139           7|-
--                                               ||      41140-42470           2|-
--                                               ||      42471-43801           2|-
--                                               ||      43802-45132           0|
--                                               ||      45133-46463           0|
--                                               ||      46464-47794           2|-
--                                               ||      47795-49125           0|
--                                               ||      49126-50456           0|
--                                               ||      50457-51787           0|
--                                               ||      51788-53118           0|
--                                               ||      53119-54449           1|-
--    
--
-- In sequence store './A3-22.seqStore':
--   Found 233839 reads.
--   Found 4250026417 bases (50 times coverage).
--    Histogram of corrected-trimmed reads:
--    
--    G=4250026417                       sum of  ||               length     num
--    NG         length     index       lengths  ||                range    seqs
--    ----- ------------ --------- ------------  ||  ------------------- -------
--    00010        27884     14040    425002970  ||       1210-2540         5766|--------------
--    00020        25449     30053    850018520  ||       2541-3871         8731|---------------------
--    00030        23818     47340   1275008679  ||       3872-5202         7805|-------------------
--    00040        22551     65691   1700023264  ||       5203-6533         6910|-----------------
--    00050        21446     85024   2125028809  ||       6534-7864         5933|---------------
--    00060        20405    105341   2550019364  ||       7865-9195         5316|-------------
--    00070        19319    126731   2975019261  ||       9196-10526        4849|------------
--    00080        17942    149510   3400028406  ||      10527-11857        4341|-----------
--    00090        14935    174872   3825034217  ||      11858-13188        3826|----------
--    00100         1210    233839   4250026417  ||      13189-14519        3999|----------
--    001.000x              233839   4250026417  ||      14520-15850        5983|---------------
--                                               ||      15851-17181       11205|---------------------------
--                                               ||      17182-18512       18462|--------------------------------------------
--                                               ||      18513-19843       24127|----------------------------------------------------------
--                                               ||      19844-21174       26439|---------------------------------------------------------------
--                                               ||      21175-22505       23737|---------------------------------------------------------
--                                               ||      22506-23836       19313|-----------------------------------------------
--                                               ||      23837-25167       14584|-----------------------------------
--                                               ||      25168-26498       10613|--------------------------
--                                               ||      26499-27829        7583|-------------------
--                                               ||      27830-29160        5478|--------------
--                                               ||      29161-30491        3712|---------
--                                               ||      30492-31822        2304|------
--                                               ||      31823-33153        1461|----
--                                               ||      33154-34484         785|--
--                                               ||      34485-35815         344|-
--                                               ||      35816-37146         148|-
--                                               ||      37147-38477          51|-
--                                               ||      38478-39808          20|-
--                                               ||      39809-41139           7|-
--                                               ||      41140-42470           2|-
--                                               ||      42471-43801           2|-
--                                               ||      43802-45132           0|
--                                               ||      45133-46463           0|
--                                               ||      46464-47794           2|-
--                                               ||      47795-49125           0|
--                                               ||      49126-50456           0|
--                                               ||      50457-51787           0|
--                                               ||      51788-53118           0|
--                                               ||      53119-54449           1|-
--    
--
-- Correction skipped; not enabled.
--
-- Trimming skipped; not enabled.
--
-- BEGIN ASSEMBLY
----------------------------------------
-- Starting command on Fri Jan 16 00:33:32 2026 with 4562693.39 GB free disk space

    cd unitigging/0-mercounts
    ./meryl-configure.sh \
    > ./meryl-configure.err 2>&1

-- Finished on Fri Jan 16 00:33:32 2026 (furiously fast) with 4562693.39 GB free disk space
----------------------------------------
--  segments   memory batches
--  -------- -------- -------
--        01 10.81 GB       2
--        02  5.61 GB       2
--        04  2.97 GB       2
--        06  2.15 GB       2
--        08  1.61 GB       2
--        12  1.07 GB       2
--        16  0.81 GB       2
--        20  0.65 GB       2
--        24  0.54 GB       2
--        32  0.41 GB       2
--        40  0.33 GB       2
--        48  -.-- GB       -  (segment size too small)
--        56  -.-- GB       -  (segment size too small)
--        64  -.-- GB       -  (segment size too small)
--        96  -.-- GB       -  (segment size too small)
--
--  For 233839 reads with 4250026417 bases, limit to 42 batches.
--  Will count kmers using 01 jobs, each using 12 GB and 4 threads.
--
-- Finished stage 'merylConfigure', reset canuIteration.
--
-- Running jobs.  First attempt out of 2.
----------------------------------------
-- Starting 'meryl' concurrent execution on Fri Jan 16 00:33:32 2026 with 4562693.359 GB free disk space (1 processes; 22 concurrently)

    cd unitigging/0-mercounts
    ./meryl-count.sh 1 > ./meryl-count.000001.out 2>&1

-- Finished on Fri Jan 16 00:37:02 2026 (210 seconds) with 4562371.375 GB free disk space
----------------------------------------
-- Found 1 Kmer counting (meryl) outputs.
-- Finished stage 'utg-merylCountCheck', reset canuIteration.
--
-- Running jobs.  First attempt out of 2.
----------------------------------------
-- Starting 'meryl' concurrent execution on Fri Jan 16 00:37:02 2026 with 4562371.343 GB free disk space (1 processes; 22 concurrently)

    cd unitigging/0-mercounts
    ./meryl-process.sh 1 > ./meryl-process.000001.out 2>&1

-- Finished on Fri Jan 16 00:37:08 2026 (6 seconds) with 4562370.906 GB free disk space
----------------------------------------
-- Meryl finished successfully.  Kmer frequency histogram:
--
-- WARNING: gnuplot failed.
--
----------------------------------------
--
--  22-mers                                                                                           Fraction
--    Occurrences   NumMers                                                                         Unique Total
--       1-     1         0                                                                        0.0000 0.0000
--       2-     2    260457 *                                                                      0.0058 0.0002
--       3-     4     74961                                                                        0.0070 0.0002
--       5-     7     20537                                                                        0.0077 0.0003
--       8-    11     10355                                                                        0.0080 0.0003
--      12-    16     15467                                                                        0.0082 0.0004
--      17-    22     92274                                                                        0.0086 0.0004
--      23-    29    660824 **                                                                     0.0113 0.0012
--      30-    37   4361929 *******************                                                    0.0305 0.0087
--      38-    46  14008329 **************************************************************         0.1459 0.0658
--      47-    56  15624234 ********************************************************************** 0.4755 0.2656
--      57-    67   4921751 **********************                                                 0.7999 0.5007
--      68-    79    690925 ***                                                                    0.8912 0.5786
--      80-    92    965183 ****                                                                   0.9053 0.5933
--      93-   106    893962 ****                                                                   0.9273 0.6201
--     107-   121    365175 *                                                                      0.9463 0.6466
--     122-   137    256944 *                                                                      0.9538 0.6586
--     138-   154    284111 *                                                                      0.9596 0.6691
--     155-   172    181635                                                                        0.9657 0.6818
--     173-   191    144199                                                                        0.9697 0.6908
--     192-   211    132962                                                                        0.9729 0.6989
--     212-   232    114602                                                                        0.9758 0.7072
--     233-   254     99769                                                                        0.9783 0.7150
--     255-   277     94327                                                                        0.9805 0.7225
--     278-   301     80590                                                                        0.9826 0.7303
--     302-   326     70281                                                                        0.9844 0.7375
--     327-   352     56259                                                                        0.9859 0.7443
--     353-   379     50497                                                                        0.9871 0.7501
--     380-   407     40277                                                                        0.9883 0.7559
--     408-   436     41126                                                                        0.9891 0.7607
--     437-   466     31595                                                                        0.9900 0.7661
--     467-   497     30227                                                                        0.9907 0.7705
--     498-   529     23978                                                                        0.9914 0.7750
--     530-   562     22103                                                                        0.9919 0.7789
--     563-   596     19299                                                                        0.9924 0.7826
--     597-   631     17895                                                                        0.9929 0.7860
--     632-   667     16601                                                                        0.9932 0.7894
--     668-   704     14657                                                                        0.9936 0.7928
--     705-   742     13332                                                                        0.9939 0.7959
--     743-   781     13997                                                                        0.9942 0.7989
--     782-   821     14317                                                                        0.9945 0.8022
--
--           0 (max occurrences)
--  3223411747 (total mers, non-unique)
--    45063767 (distinct mers, non-unique)
--           0 (unique mers)
-- Finished stage 'meryl-process', reset canuIteration.
--
-- Removing meryl database 'unitigging/0-mercounts/A3-22.ms22'.
--
-- OVERLAPPER (normal) (assembly) erate=0.01
--
----------------------------------------
-- Starting command on Fri Jan 16 00:37:08 2026 with 4562371.906 GB free disk space

    cd unitigging/1-overlapper
    /share/org/YZWL/yzwl_lixg/miniforge3/envs/canu_v.2.3/bin/overlapInCorePartition \
     -S  ../../A3-22.seqStore \
     -hl 160000000 \
     -rl 5000000000 \
     -ol 500 \
     -o  ./A3-22.partition \
    > ./A3-22.partition.err 2>&1

-- Finished on Fri Jan 16 00:37:08 2026 (like a bat out of hell) with 4562371.89 GB free disk space
----------------------------------------
--
-- Configured 21 overlapInCore jobs.
-- Finished stage 'utg-overlapConfigure', reset canuIteration.
--
-- Running jobs.  First attempt out of 2.
----------------------------------------
-- Starting 'utgovl' concurrent execution on Fri Jan 16 00:37:08 2026 with 4562371.859 GB free disk space (21 processes; 11 concurrently)

    cd unitigging/1-overlapper
    ./overlap.sh 1 > ./overlap.000001.out 2>&1
    ./overlap.sh 2 > ./overlap.000002.out 2>&1
    ./overlap.sh 3 > ./overlap.000003.out 2>&1
    ./overlap.sh 4 > ./overlap.000004.out 2>&1
    ./overlap.sh 5 > ./overlap.000005.out 2>&1
    ./overlap.sh 6 > ./overlap.000006.out 2>&1
    ./overlap.sh 7 > ./overlap.000007.out 2>&1
    ./overlap.sh 8 > ./overlap.000008.out 2>&1
    ./overlap.sh 9 > ./overlap.000009.out 2>&1
    ./overlap.sh 10 > ./overlap.000010.out 2>&1
    ./overlap.sh 11 > ./overlap.000011.out 2>&1
    ./overlap.sh 12 > ./overlap.000012.out 2>&1
    ./overlap.sh 13 > ./overlap.000013.out 2>&1
    ./overlap.sh 14 > ./overlap.000014.out 2>&1
    ./overlap.sh 15 > ./overlap.000015.out 2>&1
    ./overlap.sh 16 > ./overlap.000016.out 2>&1
    ./overlap.sh 17 > ./overlap.000017.out 2>&1
    ./overlap.sh 18 > ./overlap.000018.out 2>&1
    ./overlap.sh 19 > ./overlap.000019.out 2>&1
    ./overlap.sh 20 > ./overlap.000020.out 2>&1
    ./overlap.sh 21 > ./overlap.000021.out 2>&1

-- Finished on Fri Jan 16 01:04:27 2026 (1639 seconds) with 4557941.765 GB free disk space
----------------------------------------
-- Found 21 overlapInCore output files.
--
-- overlapInCore compute 'unitigging/1-overlapper':
--   kmer hits
--     with no overlap       1318562574    62788694 +- 38454251.874
--     with an overlap         21008178  9.42857143 +- 590044.663
--
--   overlaps                  21008178  9.42857143 +- 590044.663
--     contained                4538996  .666666667 +- 124311.814
--     dovetail                16469182  .761904762 +- 467565.035
--
--   overlaps rejected
--     multiple per pair              0           0 +- 0
--     bad short window               0           0 +- 0
--     bad long window                0           0 +- 0
-- Finished stage 'utg-overlapCheck', reset canuIteration.
----------------------------------------
-- Starting command on Fri Jan 16 01:04:27 2026 with 4557941.75 GB free disk space

    cd unitigging
    /share/org/YZWL/yzwl_lixg/miniforge3/envs/canu_v.2.3/bin/ovStoreConfig \
     -S ../A3-22.seqStore \
     -M 4-8 \
     -L ./1-overlapper/ovljob.files \
     -create ./A3-22.ovlStore.config \
     > ./A3-22.ovlStore.config.txt \
    2> ./A3-22.ovlStore.config.err

-- Finished on Fri Jan 16 01:04:27 2026 (fast as lightning) with 4557941.734 GB free disk space
----------------------------------------
--
-- Creating overlap store unitigging/A3-22.ovlStore using:
--      1 bucket
--      1 slice
--        using at most 2 GB memory each
--
-- Running jobs.  First attempt out of 2.
----------------------------------------
-- Starting 'ovS' concurrent execution on Fri Jan 16 01:04:27 2026 with 4557941.718 GB free disk space (1 processes; 62 concurrently)

    cd unitigging
    ./A3-22.ovlStore.sh 1 > ./A3-22.ovlStore.000001.out 2>&1

-- Finished on Fri Jan 16 01:04:37 2026 (10 seconds) with 4557872.078 GB free disk space
----------------------------------------
-- Checking store.
----------------------------------------
-- Starting command on Fri Jan 16 01:04:37 2026 with 4557872.078 GB free disk space

    cd unitigging
    /share/org/YZWL/yzwl_lixg/miniforge3/envs/canu_v.2.3/bin/ovStoreDump \
     -S ../A3-22.seqStore \
     -O  ./A3-22.ovlStore \
     -counts \
     > ./A3-22.ovlStore/counts.dat 2> ./A3-22.ovlStore/counts.err

-- Finished on Fri Jan 16 01:04:37 2026 (fast as lightning) with 4557872.046 GB free disk space
----------------------------------------
--
-- Overlap store 'unitigging/A3-22.ovlStore' successfully constructed.
-- Found 42016356 overlaps for 229466 reads; 1304166 reads have no overlaps.
--
--
-- Purged 0.483 GB in 63 overlap output files.
----------------------------------------
-- Starting command on Fri Jan 16 01:04:38 2026 with 4557872.046 GB free disk space

    cd unitigging
    /share/org/YZWL/yzwl_lixg/miniforge3/envs/canu_v.2.3/bin/ovStoreStats \
     -C 50 \
     -S ../A3-22.seqStore \
     -O  ./A3-22.ovlStore \
     -o  ./A3-22.ovlStore \
     > ./A3-22.ovlStore.summary.err 2>&1

-- Finished on Fri Jan 16 01:04:43 2026 (5 seconds) with 4557921.625 GB free disk space
----------------------------------------
--
-- Overlap store 'unitigging/A3-22.ovlStore' contains:
--
--   category            reads     %          read length        feature size or coverage  analysis
--   ----------------  -------  -------  ----------------------  ------------------------  --------------------
--   middle-missing        105    0.04    16521.26 +- 7509.70        801.66 +- 989.59     (bad trimming)
--   middle-hump             6    0.00    17822.33 +- 2884.17       7110.17 +- 6474.01    (bad trimming)
--   no-5-prime            462    0.20    14800.68 +- 5005.68       2137.23 +- 2912.67    (bad trimming)
--   no-3-prime            470    0.20    13004.46 +- 6335.57       1891.14 +- 2929.86    (bad trimming)
--   
--   low-coverage         1054    0.45    12473.84 +- 5426.75          5.88 +- 3.58       (easy to assemble, potential for lower quality consensus)
--   unique             195001   83.39    13970.61 +- 5718.88         46.98 +- 8.67       (easy to assemble, perfect, yay)
--   repeat-cont         12423    5.31    11401.46 +- 5296.68        916.01 +- 687.81     (potential for consensus errors, no impact on assembly)
--   repeat-dove           218    0.09    21408.94 +- 2430.21        418.57 +- 454.24     (hard to assemble, likely won't assemble correctly or even at all)
--   
--   span-repeat          2231    0.95    14832.93 +- 5055.64       3483.29 +- 3963.76    (read spans a large repeat, usually easy to assemble)
--   uniq-repeat-cont    11918    5.10    13972.28 +- 4590.26                             (should be uniquely placed, low potential for consensus errors, no impact on assembly)
--   uniq-repeat-dove     2539    1.09    20029.24 +- 3023.53                             (will end contigs, potential to misassemble)
--   uniq-anchor          3039    1.30    14773.51 +- 4551.30       8357.62 +- 5188.33    (repeat read, with unique section, probable bad read)
-- Finished stage 'utg-createOverlapStore', reset canuIteration.
--
-- Loading read lengths.
-- Loading number of overlaps per read.
--
-- Configure RED for 16gb memory.
--                   Batches of at most (unlimited) reads.
--                                      500000000 bases.
--                   Expecting evidence of at most 536870912 bases per iteration.
--
--           Total                                               Reads                 Olaps Evidence
--    Job   Memory      Read Range         Reads        Bases   Memory        Olaps   Memory   Memory  (Memory in MB)
--   ---- -------- ------------------- --------- ------------ -------- ------------ -------- --------
--      1 16386.22         1-34421          5232    108977844 13303.12       969800    11.10  1024.00
--      2 16384.17     34422-71210          5569    108969577 13302.13       877289    10.04  1024.00
--      3 16385.11     71211-112347         6266    108968661 13302.04       967316    11.07  1024.00
--      4 16386.11    112348-147933         5422    108960696 13301.04      1141943    13.07  1024.00
--      5 16384.95    147934-186828         5895    108973870 13302.66       899576    10.29  1024.00
--      6 16386.15    186829-231779         6894    108951839 13300.00      1236328    14.15  1024.00
--      7 16384.17    231780-266708         5388    108939350 13298.43      1201018    13.74  1024.00
--      8 16385.88    266709-304729         5864    108978560 13303.23       930610    10.65  1024.00
--      9 16384.98    304730-351607         7058    108943646 13299.01      1220825    13.97  1024.00
--     10 16386.84    351608-386393         5317    108973126 13302.55      1074194    12.29  1024.00
--     11 16384.76    386394-424670         5812    108966987 13301.82       956220    10.94  1024.00
--     12 16384.32    424671-471169         7069    108943547 13299.00      1164201    13.32  1024.00
--     13 16384.94    471170-506371         5323    108954995 13300.34      1101346    12.60  1024.00
--     14 16384.16    506372-544169         5787    108958614 13300.79       993442    11.37  1024.00
--     15 16385.03    544170-591877         7178    108937978 13298.32      1285368    14.71  1024.00
--     16 16385.83    591878-627545         5328    108965767 13301.65      1064076    12.18  1024.00
--     17 16386.44    627546-665791         5750    108984054 13303.90       920940    10.54  1024.00
--     18 16384.67    665792-713556         7340    108934233 13297.87      1293942    14.81  1024.00
--     19 16386.50    713557-747929         5279    108966500 13301.74      1115053    12.76  1024.00
--     20 16386.43    747930-785092         5668    108977397 13303.08       991490    11.35  1024.00
--     21 16386.90    785093-831862         7155    108959736 13300.97      1216655    13.92  1024.00
--     22 16385.35    831863-866264         5268    108963578 13301.38      1045759    11.97  1024.00
--     23 16385.67    866265-903319         5656    108975984 13302.91       940107    10.76  1024.00
--     24 16384.01    903320-948425         7041    108941831 13298.78      1155288    13.22  1024.00
--     25 16385.30    948426-982897         5289    108955751 13300.43      1124756    12.87  1024.00
--     26 16384.42    982898-1020518        5633    108966317 13301.73       933750    10.69  1024.00
--     27 16385.27   1020519-1066131        7104    108952503 13300.09      1151831    13.18  1024.00
--     28 16385.94   1066132-1100620        5256    108961868 13301.17      1115522    12.77  1024.00
--     29 16384.29   1100621-1137702        5567    108965175 13301.59       934977    10.70  1024.00
--     30 16385.14   1137703-1184150        7027    108945976 13299.29      1210156    13.85  1024.00
--     31 16386.45   1184151-1218856        5238    108970668 13302.25      1065819    12.20  1024.00
--     32 16384.20   1218857-1255035        5541    108965280 13301.60       926281    10.60  1024.00
--     33 16385.96   1255036-1300413        7040    108945763 13299.26      1284227    14.70  1024.00
--     34 16385.43   1300414-1334772        5239    108980449 13303.44       872460     9.98  1024.00
--     35 16385.54   1334773-1371122        5535    108957799 13300.69      1123205    12.85  1024.00
--     36 16385.74   1371123-1417865        7063    108948995 13299.66      1230497    14.08  1024.00
--     37 16385.37   1417866-1451216        5187    108984010 13303.88       829371     9.49  1024.00
--     38 16384.25   1451217-1487223        5448    108939596 13298.46      1204487    13.78  1024.00
--     39 16384.60   1487224-1533303        7065    108938572 13298.39      1241588    14.21  1024.00
--     40  3142.77   1533304-1533632          48       579325    70.72         4643     0.05  1024.00
--   ---- -------- ------------------- --------- ------------ -------- ------------ -------- --------
--                                                 4250026417              42016356
-- Finished stage 'readErrorDetectionConfigure', reset canuIteration.
--
-- Running jobs.  First attempt out of 2.
----------------------------------------
-- Starting 'red' concurrent execution on Fri Jan 16 01:04:49 2026 with 4557921.578 GB free disk space (40 processes; 22 concurrently)

    cd unitigging/3-overlapErrorAdjustment
    ./red.sh 1 > ./red.000001.out 2>&1
    ./red.sh 2 > ./red.000002.out 2>&1
    ./red.sh 3 > ./red.000003.out 2>&1
    ./red.sh 4 > ./red.000004.out 2>&1
    ./red.sh 5 > ./red.000005.out 2>&1
    ./red.sh 6 > ./red.000006.out 2>&1
    ./red.sh 7 > ./red.000007.out 2>&1
    ./red.sh 8 > ./red.000008.out 2>&1
    ./red.sh 9 > ./red.000009.out 2>&1
    ./red.sh 10 > ./red.000010.out 2>&1
    ./red.sh 11 > ./red.000011.out 2>&1
    ./red.sh 12 > ./red.000012.out 2>&1
    ./red.sh 13 > ./red.000013.out 2>&1
    ./red.sh 14 > ./red.000014.out 2>&1
    ./red.sh 15 > ./red.000015.out 2>&1
    ./red.sh 16 > ./red.000016.out 2>&1
    ./red.sh 17 > ./red.000017.out 2>&1
    ./red.sh 18 > ./red.000018.out 2>&1
    ./red.sh 19 > ./red.000019.out 2>&1
    ./red.sh 20 > ./red.000020.out 2>&1
    ./red.sh 21 > ./red.000021.out 2>&1
    ./red.sh 22 > ./red.000022.out 2>&1
    ./red.sh 23 > ./red.000023.out 2>&1
    ./red.sh 24 > ./red.000024.out 2>&1
    ./red.sh 25 > ./red.000025.out 2>&1
    ./red.sh 26 > ./red.000026.out 2>&1
    ./red.sh 27 > ./red.000027.out 2>&1
    ./red.sh 28 > ./red.000028.out 2>&1
    ./red.sh 29 > ./red.000029.out 2>&1
    ./red.sh 30 > ./red.000030.out 2>&1
    ./red.sh 31 > ./red.000031.out 2>&1
    ./red.sh 32 > ./red.000032.out 2>&1
    ./red.sh 33 > ./red.000033.out 2>&1
    ./red.sh 34 > ./red.000034.out 2>&1
    ./red.sh 35 > ./red.000035.out 2>&1
    ./red.sh 36 > ./red.000036.out 2>&1
    ./red.sh 37 > ./red.000037.out 2>&1
    ./red.sh 38 > ./red.000038.out 2>&1
    ./red.sh 39 > ./red.000039.out 2>&1
    ./red.sh 40 > ./red.000040.out 2>&1

-- Finished on Fri Jan 16 01:14:11 2026 (562 seconds) with 4557688.812 GB free disk space
----------------------------------------
-- Found 40 read error detection output files.
-- Finished stage 'readErrorDetectionCheck', reset canuIteration.
--
-- Loading read lengths.
-- Loading number of overlaps per read.
--
-- Configure OEA for 8gb memory.
--                   Batches of at most (unlimited) reads.
--                                      300000000 bases.
--
--           Total                                               Reads                 Olaps  Adjusts
--    Job   Memory      Read Range         Reads        Bases   Memory        Olaps   Memory   Memory  (Memory in MB)
--   ---- -------- ------------------- --------- ------------ -------- ------------ -------- --------
--      1  2790.19         1-103774        15788    300006428   294.59      2661678    81.23   366.37
--      2  2804.67    103775-214753        16908    300009672   294.63      3135145    95.68   366.37
--      3  2789.37    214754-317856        15803    300012354   294.60      2634731    80.41   366.37
--      4  2802.09    317857-425178        16299    300003974   294.60      3051295    93.12   366.37
--      5  2803.34    425179-534801        16664    300012136   294.62      3091639    94.35   366.37
--      6  2803.22    534802-646695        16830    300016480   294.63      3087444    94.22   366.37
--      7  2800.06    646696-757805        16959    300020153   294.64      2983583    91.05   366.37
--      8  2801.66    757806-867226        16753    300004444   294.62      3036566    92.67   366.37
--      9  2793.83    867227-975269        16658    300004519   294.61      2780133    84.84   366.37
--     10  2795.31    975270-1084334       16697    300015687   294.63      2828345    86.31   366.37
--     11  2804.08   1084335-1194066       16569    300018578   294.63      3115834    95.09   366.37
--     12  2804.31   1194067-1301768       16525    300001188   294.61      3123849    95.33   366.37
--     13  2790.26   1301769-1407211       16015    300021426   294.61      2663471    81.28   366.37
--     14  2800.11   1407212-1509002       15578    300010633   294.59      2986923    91.15   366.37
--     15  2495.55   1509003-1533632        3793     49868745    55.67       835720    25.50   366.37
--   ---- -------- ------------------- --------- ------------ -------- ------------ -------- --------
--                                                 4250026417              42016356
-- Finished stage 'overlapErrorAdjustmentConfigure', reset canuIteration.
--
-- Running jobs.  First attempt out of 2.
----------------------------------------
-- Starting 'oea' concurrent execution on Fri Jan 16 01:14:18 2026 with 4557688.734 GB free disk space (15 processes; 62 concurrently)

    cd unitigging/3-overlapErrorAdjustment
    ./oea.sh 1 > ./oea.000001.out 2>&1
    ./oea.sh 2 > ./oea.000002.out 2>&1
    ./oea.sh 3 > ./oea.000003.out 2>&1
    ./oea.sh 4 > ./oea.000004.out 2>&1
    ./oea.sh 5 > ./oea.000005.out 2>&1
    ./oea.sh 6 > ./oea.000006.out 2>&1
    ./oea.sh 7 > ./oea.000007.out 2>&1
    ./oea.sh 8 > ./oea.000008.out 2>&1
    ./oea.sh 9 > ./oea.000009.out 2>&1
    ./oea.sh 10 > ./oea.000010.out 2>&1
    ./oea.sh 11 > ./oea.000011.out 2>&1
    ./oea.sh 12 > ./oea.000012.out 2>&1
    ./oea.sh 13 > ./oea.000013.out 2>&1
    ./oea.sh 14 > ./oea.000014.out 2>&1
    ./oea.sh 15 > ./oea.000015.out 2>&1

-- Finished on Fri Jan 16 01:31:30 2026 (1032 seconds) with 4559631.046 GB free disk space
----------------------------------------
-- Found 15 overlap error adjustment output files.
-- Finished stage 'overlapErrorAdjustmentCheck', reset canuIteration.
----------------------------------------
-- Starting command on Fri Jan 16 01:31:30 2026 with 4559631.031 GB free disk space

    cd unitigging/3-overlapErrorAdjustment
    /share/org/YZWL/yzwl_lixg/miniforge3/envs/canu_v.2.3/bin/loadErates \
      -S ../../A3-22.seqStore \
      -O ../A3-22.ovlStore \
      -L ./oea.files \
    > ./oea.apply.err 2>&1

-- Finished on Fri Jan 16 01:31:30 2026 (furiously fast) with 4559630.937 GB free disk space
----------------------------------------
-- No report available.
-- Finished stage 'updateOverlapStore', reset canuIteration.
-- Finished stage 'unitig', reset canuIteration.
--
-- Running jobs.  First attempt out of 2.
----------------------------------------
-- Starting 'bat' concurrent execution on Fri Jan 16 01:31:30 2026 with 4559630.89 GB free disk space (1 processes; 1 concurrently)

    cd unitigging/4-unitigger
    ./unitigger.sh 1 > ./unitigger.000001.out 2>&1

-- Finished on Fri Jan 16 01:31:42 2026 (12 seconds) with 4559656.593 GB free disk space
----------------------------------------
-- Unitigger finished successfully.
--  
--  ERROR RATES
--  -----------
--                                                   --------threshold------
--  258839                       fraction error      fraction        percent
--  samples                              (1e-5)         error          error
--                   --------------------------      --------       --------
--  command line (-eg)                           ->     30.00        0.0300%
--  command line (-ef)                           ->  -----.--      ---.----%
--  command line (-eM)                           ->     30.00        0.0300%
--  mean + std.dev       0.33 +-  12 *     2.59  ->     31.45        0.0315%
--  median + mad         0.00 +-  12 *     0.00  ->      0.00        0.0000%
--  90th percentile                              ->      1.00        0.0010%  (enabled)
--  
--  BEST EDGE FILTERING
--  -------------------
--  At graph threshold 0.0300%, reads:
--    available to have edges:        38965
--    with at least one edge:         33527
--  
--  At max threshold 0.0300%, reads:  (not computed)
--    available to have edges:            0
--    with at least one edge:             0
--  
--  At tight threshold 0.0010%, reads with:
--    both edges below error threshold:     29754  (80.00% minReadsBest threshold = 26821)
--    one  edge  above error threshold:      2746
--    both edges above error threshold:      1027
--    at least one edge:                    33527
--  
--  At loose threshold 0.0300%, reads with:
--    both edges below error threshold:     33527  (80.00% minReadsBest threshold = 26821)
--    one  edge  above error threshold:         0
--    both edges above error threshold:         0
--    at least one edge:                    33527
--  
--  
--  INITIAL EDGES
--  -------- ----------------------------------------
--    190487 reads are contained
--   1313709 reads have no best edges (singleton)
--       287 reads have only one best edge (spur) 
--                142 are mutual best
--     29149 reads have two best edges 
--                690 have one mutual best edge
--              28177 have two mutual best edges
--  
--  
--  FINAL EDGES
--  -------- ----------------------------------------
--    190487 reads are contained
--   1313986 reads have no best edges (singleton)
--       188 reads have only one best edge (spur) 
--                140 are mutual best
--     28971 reads have two best edges 
--                586 have one mutual best edge
--              28157 have two mutual best edges
--  
--  
--  EDGE FILTERING
--  -------- ------------------------------------------
--         0 reads are ignored
--      8170 reads have a gap in overlap coverage
--       113 reads have lopsided best edges
-- Found, in version 1, after unitig construction:
--   contigs:      83 sequences, total length 68376705 bp (including 88 repeats of total length 2170890 bp).
--   bubbles:      127 sequences, total length 3651400 bp.
--   unassembled:  14094 sequences, total length 185096668 bp.
--
-- Contig sizes based on genome size 85mbp:
--
--            NG (bp)  LG (contigs)    sum (bp)
--         ----------  ------------  ----------
--     10     8825792             1     8825792
--     20     6111371             3    21094270
--     30     5354179             4    26448449
--     40     3283885             7    36400178
--     50     2407047            10    44825776
--     60     2212205            13    51684091
--     70     1273892            18    60355880
--     80       19925            63    68005435
--
-- Finished stage 'unitigCheck', reset canuIteration.
----------------------------------------
-- Starting command on Fri Jan 16 01:31:42 2026 with 4559656.578 GB free disk space

    cd unitigging
    /share/org/YZWL/yzwl_lixg/miniforge3/envs/canu_v.2.3/bin/utgcns \
      -S ../A3-22.seqStore \
      -T  ./A3-22.ctgStore 1 \
      -partition 0.8 1.5 0.1 \
    > ./A3-22.ctgStore/partitioning.log 2>&1

-- Finished on Fri Jan 16 01:31:51 2026 (9 seconds) with 4559945.218 GB free disk space
----------------------------------------
-- Using slow alignment for consensus (iteration '0').
-- Configured 10 consensus jobs.
-- Finished stage 'consensusConfigure', reset canuIteration.
--
-- Local: cns       13.125 GB    8 CPUs x  11 jobs   144.375 GB  88 CPUs  (consensus)
--
--
-- Running jobs.  First attempt out of 2.
----------------------------------------
-- Starting 'cns' concurrent execution on Fri Jan 16 01:31:51 2026 with 4559945.531 GB free disk space (10 processes; 11 concurrently)

    cd unitigging/5-consensus
    ./consensus.sh 1 > ./consensus.000001.out 2>&1
    ./consensus.sh 2 > ./consensus.000002.out 2>&1
    ./consensus.sh 3 > ./consensus.000003.out 2>&1
    ./consensus.sh 4 > ./consensus.000004.out 2>&1
    ./consensus.sh 5 > ./consensus.000005.out 2>&1
    ./consensus.sh 6 > ./consensus.000006.out 2>&1
    ./consensus.sh 7 > ./consensus.000007.out 2>&1
    ./consensus.sh 8 > ./consensus.000008.out 2>&1
    ./consensus.sh 9 > ./consensus.000009.out 2>&1
    ./consensus.sh 10 > ./consensus.000010.out 2>&1

-- Finished on Fri Jan 16 01:40:06 2026 (495 seconds) with 4560094.218 GB free disk space
----------------------------------------
-- Using slow alignment for consensus (iteration '1').
-- Configured 10 consensus jobs.
-- All 10 consensus jobs finished successfully.
-- Finished stage 'consensusCheck', reset canuIteration.
-- Using slow alignment for consensus (iteration '0').
-- Configured 10 consensus jobs.
----------------------------------------
-- Starting command on Fri Jan 16 01:40:06 2026 with 4560094.171 GB free disk space

    cd unitigging
    /share/org/YZWL/yzwl_lixg/miniforge3/envs/canu_v.2.3/bin/tgStoreLoad \
      -S ../A3-22.seqStore \
      -T  ./A3-22.ctgStore 2 \
      -L ./5-consensus/ctgcns.files \
    > ./5-consensus/ctgcns.files.ctgStoreLoad.err 2>&1

-- Finished on Fri Jan 16 01:40:07 2026 (one second) with 4560093.453 GB free disk space
----------------------------------------
----------------------------------------
-- Starting command on Fri Jan 16 01:40:07 2026 with 4560093.453 GB free disk space

    cd unitigging
    /share/org/YZWL/yzwl_lixg/miniforge3/envs/canu_v.2.3/bin/tgTigDisplay \
      -S ../A3-22.seqStore \
      -b \
      -o ../A3-22.contigs.unsorted.bam \
      -L ./5-consensus/ctgcns.files \
    > ./5-consensus/ctgcns.files.contigs.bam.err 2>&1

-- Finished on Fri Jan 16 01:42:51 2026 (164 seconds) with 4559857.015 GB free disk space
----------------------------------------
----------------------------------------
-- Starting command on Fri Jan 16 01:42:51 2026 with 4559857.015 GB free disk space

    cd .
    samtools sort \
      --write-index \
      --threads 2 \
      -o ./A3-22.contigs.bam ./A3-22.contigs.unsorted.bam \
    > ./ctgcns.bam.err 2>&1

-- Finished on Fri Jan 16 01:44:05 2026 (74 seconds) with 4559742.5 GB free disk space
----------------------------------------
-- Purging consensus output after loading to ctgStore.
-- Purged 10 .cns outputs.
----------------------------------------
-- Starting command on Fri Jan 16 01:44:05 2026 with 4559744.453 GB free disk space

    cd unitigging
    /share/org/YZWL/yzwl_lixg/miniforge3/envs/canu_v.2.3/bin/tgStoreDump \
      -S ../A3-22.seqStore \
      -T ./A3-22.ctgStore 2 \
      -sizes -s 85000000 \
    > ./A3-22.ctgStore/seqDB.v002.sizes.txt
ZERO length suplied to intervalList::add(), ignoring interval.
ZERO length suplied to intervalList::add(), ignoring interval.
ZERO length suplied to intervalList::add(), ignoring interval.
ZERO length suplied to intervalList::add(), ignoring interval.
ZERO length suplied to intervalList::add(), ignoring interval.
ZERO length suplied to intervalList::add(), ignoring interval.
ZERO length suplied to intervalList::add(), ignoring interval.
ZERO length suplied to intervalList::add(), ignoring interval.
ZERO length suplied to intervalList::add(), ignoring interval.
ZERO length suplied to intervalList::add(), ignoring interval.
ZERO length suplied to intervalList::add(), ignoring interval.
ZERO length suplied to intervalList::add(), ignoring interval.
ZERO length suplied to intervalList::add(), ignoring interval.
ZERO length suplied to intervalList::add(), ignoring interval.
ZERO length suplied to intervalList::add(), ignoring interval.
ZERO length suplied to intervalList::add(), ignoring interval.
ZERO length suplied to intervalList::add(), ignoring interval.
ZERO length suplied to intervalList::add(), ignoring interval.
ZERO length suplied to intervalList::add(), ignoring interval.
ZERO length suplied to intervalList::add(), ignoring interval.
ZERO length suplied to intervalList::add(), ignoring interval.
ZERO length suplied to intervalList::add(), ignoring interval.
ZERO length suplied to intervalList::add(), ignoring interval.
ZERO length suplied to intervalList::add(), ignoring interval.
ZERO length suplied to intervalList::add(), ignoring interval.
ZERO length suplied to intervalList::add(), ignoring interval.
ZERO length suplied to intervalList::add(), ignoring interval.
ZERO length suplied to intervalList::add(), ignoring interval.
ZERO length suplied to intervalList::add(), ignoring interval.
ZERO length suplied to intervalList::add(), ignoring interval.
ZERO length suplied to intervalList::add(), ignoring interval.
ZERO length suplied to intervalList::add(), ignoring interval.
ZERO length suplied to intervalList::add(), ignoring interval.
ZERO length suplied to intervalList::add(), ignoring interval.
ZERO length suplied to intervalList::add(), ignoring interval.
ZERO length suplied to intervalList::add(), ignoring interval.
ZERO length suplied to intervalList::add(), ignoring interval.
ZERO length suplied to intervalList::add(), ignoring interval.
ZERO length suplied to intervalList::add(), ignoring interval.
ZERO length suplied to intervalList::add(), ignoring interval.
ZERO length suplied to intervalList::add(), ignoring interval.
ZERO length suplied to intervalList::add(), ignoring interval.

-- Finished on Fri Jan 16 01:44:05 2026 (like a bat out of hell) with 4559744.453 GB free disk space
----------------------------------------
-- Found, in version 2, after consensus generation:
--   contigs:      83 sequences, total length 89223710 bp (including 88 repeats of total length 3033616 bp).
--   bubbles:      127 sequences, total length 4855200 bp.
--   unassembled:  14094 sequences, total length 251488282 bp.
--
-- Contig sizes based on genome size 85mbp:
--
--            NG (bp)  LG (contigs)    sum (bp)
--         ----------  ------------  ----------
--     10    11469960             1    11469960
--     20     7989361             2    19459321
--     30     7942429             3    27401750
--     40     6954231             4    34355981
--     50     4286067             6    43038631
--     60     4074082             8    51394322
--     70     3065768            11    61367707
--     80     2703089            14    69963914
--     90     2016371            17    76908830
--    100      610679            24    85258232
--
-- Finished stage 'consensusLoad', reset canuIteration.
----------------------------------------
-- Starting command on Fri Jan 16 01:44:05 2026 with 4559744.437 GB free disk space

    cd .
    /share/org/YZWL/yzwl_lixg/miniforge3/envs/canu_v.2.3/bin/tgStoreDump \
      -S ./A3-22.seqStore \
      -T ./unitigging/A3-22.ctgStore 2 \
      -o ./A3-22.contigs \
      -layout \
    > ./A3-22.contigs.layout.err 2>&1

-- Finished on Fri Jan 16 01:44:06 2026 (one second) with 4559744.39 GB free disk space
----------------------------------------
----------------------------------------
-- Starting command on Fri Jan 16 01:44:06 2026 with 4559744.39 GB free disk space

    cd .
    /share/org/YZWL/yzwl_lixg/miniforge3/envs/canu_v.2.3/bin/tgStoreDump \
      -S ./A3-22.seqStore \
      -T ./unitigging/A3-22.ctgStore 2 \
      -consensus -fasta \
      -unassembled \
    > ./A3-22.unassembled.fasta
    2> ./A3-22.unassembled.err
ZERO length suplied to intervalList::add(), ignoring interval.
ZERO length suplied to intervalList::add(), ignoring interval.
ZERO length suplied to intervalList::add(), ignoring interval.
ZERO length suplied to intervalList::add(), ignoring interval.
ZERO length suplied to intervalList::add(), ignoring interval.
ZERO length suplied to intervalList::add(), ignoring interval.
ZERO length suplied to intervalList::add(), ignoring interval.
ZERO length suplied to intervalList::add(), ignoring interval.
ZERO length suplied to intervalList::add(), ignoring interval.
ZERO length suplied to intervalList::add(), ignoring interval.
ZERO length suplied to intervalList::add(), ignoring interval.
ZERO length suplied to intervalList::add(), ignoring interval.
ZERO length suplied to intervalList::add(), ignoring interval.
ZERO length suplied to intervalList::add(), ignoring interval.
ZERO length suplied to intervalList::add(), ignoring interval.
ZERO length suplied to intervalList::add(), ignoring interval.
ZERO length suplied to intervalList::add(), ignoring interval.
ZERO length suplied to intervalList::add(), ignoring interval.
ZERO length suplied to intervalList::add(), ignoring interval.
ZERO length suplied to intervalList::add(), ignoring interval.
ZERO length suplied to intervalList::add(), ignoring interval.
ZERO length suplied to intervalList::add(), ignoring interval.
ZERO length suplied to intervalList::add(), ignoring interval.
ZERO length suplied to intervalList::add(), ignoring interval.
ZERO length suplied to intervalList::add(), ignoring interval.
ZERO length suplied to intervalList::add(), ignoring interval.
ZERO length suplied to intervalList::add(), ignoring interval.
ZERO length suplied to intervalList::add(), ignoring interval.
ZERO length suplied to intervalList::add(), ignoring interval.
ZERO length suplied to intervalList::add(), ignoring interval.
ZERO length suplied to intervalList::add(), ignoring interval.
ZERO length suplied to intervalList::add(), ignoring interval.
ZERO length suplied to intervalList::add(), ignoring interval.
ZERO length suplied to intervalList::add(), ignoring interval.
ZERO length suplied to intervalList::add(), ignoring interval.
ZERO length suplied to intervalList::add(), ignoring interval.
ZERO length suplied to intervalList::add(), ignoring interval.
ZERO length suplied to intervalList::add(), ignoring interval.
ZERO length suplied to intervalList::add(), ignoring interval.
ZERO length suplied to intervalList::add(), ignoring interval.
ZERO length suplied to intervalList::add(), ignoring interval.
ZERO length suplied to intervalList::add(), ignoring interval.

-- Finished on Fri Jan 16 01:44:07 2026 (one second) with 4559744.14 GB free disk space
----------------------------------------
----------------------------------------
-- Starting command on Fri Jan 16 01:44:07 2026 with 4559744.14 GB free disk space

    cd .
    /share/org/YZWL/yzwl_lixg/miniforge3/envs/canu_v.2.3/bin/tgStoreDump \
      -S ./A3-22.seqStore \
      -T ./unitigging/A3-22.ctgStore 2 \
      -consensus -fasta \
      -contigs \
    > ./A3-22.contigs.fasta
    2> ./A3-22.contigs.err
ZERO length suplied to intervalList::add(), ignoring interval.
ZERO length suplied to intervalList::add(), ignoring interval.
ZERO length suplied to intervalList::add(), ignoring interval.
ZERO length suplied to intervalList::add(), ignoring interval.
ZERO length suplied to intervalList::add(), ignoring interval.
ZERO length suplied to intervalList::add(), ignoring interval.
ZERO length suplied to intervalList::add(), ignoring interval.
ZERO length suplied to intervalList::add(), ignoring interval.
ZERO length suplied to intervalList::add(), ignoring interval.
ZERO length suplied to intervalList::add(), ignoring interval.
ZERO length suplied to intervalList::add(), ignoring interval.
ZERO length suplied to intervalList::add(), ignoring interval.
ZERO length suplied to intervalList::add(), ignoring interval.
ZERO length suplied to intervalList::add(), ignoring interval.
ZERO length suplied to intervalList::add(), ignoring interval.
ZERO length suplied to intervalList::add(), ignoring interval.
ZERO length suplied to intervalList::add(), ignoring interval.
ZERO length suplied to intervalList::add(), ignoring interval.
ZERO length suplied to intervalList::add(), ignoring interval.
ZERO length suplied to intervalList::add(), ignoring interval.
ZERO length suplied to intervalList::add(), ignoring interval.
ZERO length suplied to intervalList::add(), ignoring interval.
ZERO length suplied to intervalList::add(), ignoring interval.
ZERO length suplied to intervalList::add(), ignoring interval.
ZERO length suplied to intervalList::add(), ignoring interval.
ZERO length suplied to intervalList::add(), ignoring interval.
ZERO length suplied to intervalList::add(), ignoring interval.
ZERO length suplied to intervalList::add(), ignoring interval.
ZERO length suplied to intervalList::add(), ignoring interval.
ZERO length suplied to intervalList::add(), ignoring interval.
ZERO length suplied to intervalList::add(), ignoring interval.
ZERO length suplied to intervalList::add(), ignoring interval.
ZERO length suplied to intervalList::add(), ignoring interval.
ZERO length suplied to intervalList::add(), ignoring interval.
ZERO length suplied to intervalList::add(), ignoring interval.
ZERO length suplied to intervalList::add(), ignoring interval.
ZERO length suplied to intervalList::add(), ignoring interval.
ZERO length suplied to intervalList::add(), ignoring interval.
ZERO length suplied to intervalList::add(), ignoring interval.
ZERO length suplied to intervalList::add(), ignoring interval.
ZERO length suplied to intervalList::add(), ignoring interval.
ZERO length suplied to intervalList::add(), ignoring interval.

-- Finished on Fri Jan 16 01:44:08 2026 (one second) with 4559744.031 GB free disk space
----------------------------------------
-- Finished stage 'generateOutputs', reset canuIteration.
--
-- Assembly 'A3-22' finished in '/share/org/YZWL/yzwl_lixg/project/28.大豆疫霉菌三代基因组/03.hicanu/A3-22/01.raw_output'.
--
-- Summary saved in 'A3-22.report'.
--
-- Sequences saved:
--   Contigs       -> 'A3-22.contigs.fasta'
--   Unassembled   -> 'A3-22.unassembled.fasta'
--
-- Read layouts saved:
--   Contigs       -> 'A3-22.contigs.layout'.
--
-- Bye.

2026-01-16 01:44:08.058 - WARNING - 输出文件不存在|Output file does not exist: /share/org/YZWL/yzwl_lixg/project/28.大豆疫霉菌三代基因组/03.hicanu/A3-22/01.raw_output/A3-22.unitigs.fasta
Usage: biopytools ragtag [OPTIONS]
Try 'biopytools ragtag -h' for help.

Error: Invalid value for '-r' / '--reference': 文件不存在|File does not exist: /share/org/YZWL/yzwl_lixg/project/28.大豆疫霉菌三代基因组/04.ragtag/Psoja_T2T.fa
Usage: biopytools genomesyn [OPTIONS]
Try 'biopytools genomesyn -h' for help.

Error: Invalid value for '-i' / '--ref': Path '04.ragtag/A3-22/hicanu/A3-22_RagTag_scaffolded.fa' does not exist.
Job 68886761 stderr output:

