Usage: biopytools ragtag [OPTIONS]
Try 'biopytools ragtag -h' for help.

Error: Invalid value for '-r' / '--reference': 文件不存在|File does not exist: /share/org/YZWL/yzwl_lixg/project/28.大豆疫霉菌三代基因组/04.ragtag/Psoja_T2T.fa
Usage: biopytools genomesyn [OPTIONS]
Try 'biopytools genomesyn -h' for help.

Error: Invalid value for '-i' / '--ref': Path '04.ragtag/A3-16/hifiasm/A3-16_RagTag_scaffolded.fa' does not exist.
2026-01-16 01:54:52.997 - WARNING - 命令错误输出|Command stderr:
-- canu master +27 changes (r10515 2a41e933b8de6ed66723d75d36dd071b46d2c347)
--
-- CITATIONS
--
-- For assemblies of PacBio HiFi reads:
--   Nurk S, Walenz BP, Rhiea A, Vollger MR, Logsdon GA, Grothe R, Miga KH, Eichler EE, Phillippy AM, Koren S.
--   HiCanu: accurate assembly of segmental duplications, satellites, and allelic variants from high-fidelity long reads.
--   biorXiv. 2020.
--   https://doi.org/10.1101/2020.03.14.992248
-- 
-- Read and contig alignments during correction and consensus use:
--   Šošic M, Šikic M.
--   Edlib: a C/C ++ library for fast, exact sequence alignment using edit distance.
--   Bioinformatics. 2017 May 1;33(9):1394-1395.
--   http://doi.org/10.1093/bioinformatics/btw753
-- 
-- Overlaps are generated using:
--   Berlin K, et al.
--   Assembling large genomes with single-molecule sequencing and locality-sensitive hashing.
--   Nat Biotechnol. 2015 Jun;33(6):623-30.
--   http://doi.org/10.1038/nbt.3238
-- 
--   Myers EW, et al.
--   A Whole-Genome Assembly of Drosophila.
--   Science. 2000 Mar 24;287(5461):2196-204.
--   http://doi.org/10.1126/science.287.5461.2196
-- 
-- Contig consensus sequences are generated using an algorithm derived from pbdagcon:
--   Chin CS, et al.
--   Nonhybrid, finished microbial genome assemblies from long-read SMRT sequencing data.
--   Nat Methods. 2013 Jun;10(6):563-9
--   http://doi.org/10.1038/nmeth.2474
-- 
-- CONFIGURE CANU
--
-- Detected Java(TM) Runtime Environment '17.0.15-internal' (from '/share/org/YZWL/yzwl_lixg/.local/bin/java') without -d64 support.
--
-- WARNING:
-- WARNING:  Failed to run gnuplot using command 'gnuplot'.
-- WARNING:  Plots will be disabled.
-- WARNING:
--
-- Detected samtools version '1.22' / htslib version 'htscodecs=1.6.3' (from 'samtools').
--
-- Detected 88 CPUs and 503 gigabytes of memory on the local machine.
--
-- Detected Slurm with 'sinfo' binary in /opt/skyformai/bin/sinfo.
--          Slurm disabled by useGrid=false
--
-- Detected  '' with 'pbsnodes' binary in /opt/skyformai/bin/pbsnodes.
--           disabled by useGrid=false
--
-- Detected LSF with 'bsub' binary in /opt/skyformai/bin/bsub.
--          LSF disabled by useGrid=false
--
-- Local machine mode enabled; grid support not detected or not allowed.
--
-- Found trimmed raw PacBio HiFi reads in the input files.
--
--                                (tag)Concurrency
--                         (tag)Threads          |
--                (tag)Memory         |          |
--        (tag)             |         |          |       total usage      algorithm
--        -------  ----------  --------   --------  --------------------  -----------------------------
-- Local: meryl     12.000 GB    4 CPUs x  22 jobs   264.000 GB  88 CPUs  (k-mer counting)
-- Local: cormhap   13.000 GB   11 CPUs x   8 jobs   104.000 GB  88 CPUs  (overlap detection with mhap)
-- Local: obtovl     8.000 GB    8 CPUs x  11 jobs    88.000 GB  88 CPUs  (overlap detection)
-- Local: utgovl     8.000 GB    8 CPUs x  11 jobs    88.000 GB  88 CPUs  (overlap detection)
-- Local: cor        -.--- GB    4 CPUs x   - jobs     -.--- GB   - CPUs  (read correction)
-- Local: ovb        4.000 GB    1 CPU  x  88 jobs   352.000 GB  88 CPUs  (overlap store bucketizer)
-- Local: ovs        8.000 GB    1 CPU  x  62 jobs   496.000 GB  62 CPUs  (overlap store sorting)
-- Local: red       16.000 GB    4 CPUs x  22 jobs   352.000 GB  88 CPUs  (read error detection)
-- Local: oea        8.000 GB    1 CPU  x  62 jobs   496.000 GB  62 CPUs  (overlap error adjustment)
-- Local: bat       32.000 GB    8 CPUs x   1 job     32.000 GB   8 CPUs  (contig construction with bogart)
-- Local: cns        -.--- GB    8 CPUs x   - jobs     -.--- GB   - CPUs  (consensus)
--
-- Generating assembly 'A3-16' in '/share/org/YZWL/yzwl_lixg/project/28.大豆疫霉菌三代基因组/03.hicanu/A3-16/01.raw_output':
--   genomeSize:
--     85000000
--
--   Overlap Generation Limits:
--     corOvlErrorRate 0.0000 (  0.00%)
--     obtOvlErrorRate 0.0250 (  2.50%)
--     utgOvlErrorRate 0.0100 (  1.00%)
--
--   Overlap Processing Limits:
--     corErrorRate    0.0000 (  0.00%)
--     obtErrorRate    0.0250 (  2.50%)
--     utgErrorRate    0.0003 (  0.03%)
--     cnsErrorRate    0.0500 (  5.00%)
--
--   Stages to run:
--     assemble HiFi reads.
--
--
-- BEGIN STORE CREATION
----------------------------------------
-- Starting command on Fri Jan 16 00:28:31 2026 with 4563544.765 GB free disk space

    cd .
    ./A3-16.seqStore.sh \
    > ./A3-16.seqStore.err 2>&1

-- Finished on Fri Jan 16 00:35:44 2026 (433 seconds) with 4562349.625 GB free disk space
----------------------------------------
--
-- In sequence store './A3-16.seqStore':
--   Found 255821 reads.
--   Found 4250017435 bases (50 times coverage).
--    Histogram of corrected reads:
--    
--    G=4250017435                       sum of  ||               length     num
--    NG         length     index       lengths  ||                range    seqs
--    ----- ------------ --------- ------------  ||  ------------------- -------
--    00010        26484     14825    425004837  ||       1234-2509         5830|---------------
--    00020        24293     31636    850018622  ||       2510-3785        10049|-------------------------
--    00030        22789     49729   1275015370  ||       3786-5061        10358|--------------------------
--    00040        21609     68890   1700027572  ||       5062-6337         9998|-------------------------
--    00050        20547     89060   2125019811  ||       6338-7613         9282|-----------------------
--    00060        19497    110287   2550027527  ||       7614-8889         8760|----------------------
--    00070        18290    132761   2975020629  ||       8890-10165        8192|---------------------
--    00080        16469    157094   3400026299  ||      10166-11441        7366|-------------------
--    00090        11190    187363   3825019978  ||      11442-12717        6639|-----------------
--    00100         1234    255821   4250017435  ||      12718-13993        6378|----------------
--    001.000x              255821   4250017435  ||      13994-15269        6788|-----------------
--                                               ||      15270-16545        9853|-------------------------
--                                               ||      16546-17821       15885|----------------------------------------
--                                               ||      17822-19097       22303|-------------------------------------------------------
--                                               ||      19098-20373       25579|---------------------------------------------------------------
--                                               ||      20374-21649       24336|------------------------------------------------------------
--                                               ||      21650-22925       20480|---------------------------------------------------
--                                               ||      22926-24201       15205|--------------------------------------
--                                               ||      24202-25477       11205|----------------------------
--                                               ||      25478-26753        7952|--------------------
--                                               ||      26754-28029        5381|--------------
--                                               ||      28030-29305        3598|---------
--                                               ||      29306-30581        2216|------
--                                               ||      30582-31857        1197|---
--                                               ||      31858-33133         586|--
--                                               ||      33134-34409         266|-
--                                               ||      34410-35685         104|-
--                                               ||      35686-36961          25|-
--                                               ||      36962-38237           4|-
--                                               ||      38238-39513           2|-
--                                               ||      39514-40789           0|
--                                               ||      40790-42065           1|-
--                                               ||      42066-43341           0|
--                                               ||      43342-44617           1|-
--                                               ||      44618-45893           0|
--                                               ||      45894-47169           1|-
--                                               ||      47170-48445           0|
--                                               ||      48446-49721           0|
--                                               ||      49722-50997           0|
--                                               ||      50998-52273           1|-
--    
--
-- In sequence store './A3-16.seqStore':
--   Found 255821 reads.
--   Found 4250017435 bases (50 times coverage).
--    Histogram of corrected-trimmed reads:
--    
--    G=4250017435                       sum of  ||               length     num
--    NG         length     index       lengths  ||                range    seqs
--    ----- ------------ --------- ------------  ||  ------------------- -------
--    00010        26484     14825    425004837  ||       1234-2509         5830|---------------
--    00020        24293     31636    850018622  ||       2510-3785        10049|-------------------------
--    00030        22789     49729   1275015370  ||       3786-5061        10358|--------------------------
--    00040        21609     68890   1700027572  ||       5062-6337         9998|-------------------------
--    00050        20547     89060   2125019811  ||       6338-7613         9282|-----------------------
--    00060        19497    110287   2550027527  ||       7614-8889         8760|----------------------
--    00070        18290    132761   2975020629  ||       8890-10165        8192|---------------------
--    00080        16469    157094   3400026299  ||      10166-11441        7366|-------------------
--    00090        11190    187363   3825019978  ||      11442-12717        6639|-----------------
--    00100         1234    255821   4250017435  ||      12718-13993        6378|----------------
--    001.000x              255821   4250017435  ||      13994-15269        6788|-----------------
--                                               ||      15270-16545        9853|-------------------------
--                                               ||      16546-17821       15885|----------------------------------------
--                                               ||      17822-19097       22303|-------------------------------------------------------
--                                               ||      19098-20373       25579|---------------------------------------------------------------
--                                               ||      20374-21649       24336|------------------------------------------------------------
--                                               ||      21650-22925       20480|---------------------------------------------------
--                                               ||      22926-24201       15205|--------------------------------------
--                                               ||      24202-25477       11205|----------------------------
--                                               ||      25478-26753        7952|--------------------
--                                               ||      26754-28029        5381|--------------
--                                               ||      28030-29305        3598|---------
--                                               ||      29306-30581        2216|------
--                                               ||      30582-31857        1197|---
--                                               ||      31858-33133         586|--
--                                               ||      33134-34409         266|-
--                                               ||      34410-35685         104|-
--                                               ||      35686-36961          25|-
--                                               ||      36962-38237           4|-
--                                               ||      38238-39513           2|-
--                                               ||      39514-40789           0|
--                                               ||      40790-42065           1|-
--                                               ||      42066-43341           0|
--                                               ||      43342-44617           1|-
--                                               ||      44618-45893           0|
--                                               ||      45894-47169           1|-
--                                               ||      47170-48445           0|
--                                               ||      48446-49721           0|
--                                               ||      49722-50997           0|
--                                               ||      50998-52273           1|-
--    
--
-- Correction skipped; not enabled.
--
-- Trimming skipped; not enabled.
--
-- BEGIN ASSEMBLY
----------------------------------------
-- Starting command on Fri Jan 16 00:35:46 2026 with 4562349.578 GB free disk space

    cd unitigging/0-mercounts
    ./meryl-configure.sh \
    > ./meryl-configure.err 2>&1

-- Finished on Fri Jan 16 00:35:47 2026 (one second) with 4562349.578 GB free disk space
----------------------------------------
--  segments   memory batches
--  -------- -------- -------
--        01 10.81 GB       2
--        02  5.75 GB       2
--        04  2.97 GB       2
--        06  2.15 GB       2
--        08  1.61 GB       2
--        12  1.07 GB       2
--        16  0.81 GB       2
--        20  0.65 GB       2
--        24  0.54 GB       2
--        32  0.41 GB       2
--        40  0.33 GB       2
--        48  -.-- GB       -  (segment size too small)
--        56  -.-- GB       -  (segment size too small)
--        64  -.-- GB       -  (segment size too small)
--        96  -.-- GB       -  (segment size too small)
--
--  For 255821 reads with 4250017435 bases, limit to 42 batches.
--  Will count kmers using 01 jobs, each using 12 GB and 4 threads.
--
-- Finished stage 'merylConfigure', reset canuIteration.
--
-- Running jobs.  First attempt out of 2.
----------------------------------------
-- Starting 'meryl' concurrent execution on Fri Jan 16 00:35:47 2026 with 4562349.546 GB free disk space (1 processes; 22 concurrently)

    cd unitigging/0-mercounts
    ./meryl-count.sh 1 > ./meryl-count.000001.out 2>&1

-- Finished on Fri Jan 16 00:39:20 2026 (213 seconds) with 4562064.484 GB free disk space
----------------------------------------
-- Found 1 Kmer counting (meryl) outputs.
-- Finished stage 'utg-merylCountCheck', reset canuIteration.
--
-- Running jobs.  First attempt out of 2.
----------------------------------------
-- Starting 'meryl' concurrent execution on Fri Jan 16 00:39:20 2026 with 4562064.453 GB free disk space (1 processes; 22 concurrently)

    cd unitigging/0-mercounts
    ./meryl-process.sh 1 > ./meryl-process.000001.out 2>&1

-- Finished on Fri Jan 16 00:39:27 2026 (7 seconds) with 4562065.125 GB free disk space
----------------------------------------
-- Meryl finished successfully.  Kmer frequency histogram:
--
-- WARNING: gnuplot failed.
--
----------------------------------------
--
--  22-mers                                                                                           Fraction
--    Occurrences   NumMers                                                                         Unique Total
--       1-     1         0                                                                        0.0000 0.0000
--       2-     2    182325                                                                        0.0041 0.0001
--       3-     4     62892                                                                        0.0050 0.0002
--       5-     7     20031                                                                        0.0057 0.0002
--       8-    11      6374                                                                        0.0060 0.0002
--      12-    16      7232                                                                        0.0061 0.0003
--      17-    22     98144                                                                        0.0063 0.0003
--      23-    29    641421 **                                                                     0.0093 0.0012
--      30-    37   4696498 *********************                                                  0.0281 0.0085
--      38-    46  15307846 ********************************************************************** 0.1537 0.0705
--      47-    56  15154405 *********************************************************************  0.5132 0.2873
--      57-    67   3817582 *****************                                                      0.8232 0.5103
--      68-    79    636167 **                                                                     0.8925 0.5691
--      80-    92    959803 ****                                                                   0.9065 0.5837
--      93-   106    865282 ***                                                                    0.9283 0.6101
--     107-   121    347631 *                                                                      0.9467 0.6356
--     122-   137    279281 *                                                                      0.9539 0.6470
--     138-   154    285799 *                                                                      0.9601 0.6585
--     155-   172    181900                                                                        0.9664 0.6712
--     173-   191    162172                                                                        0.9704 0.6803
--     192-   211    129149                                                                        0.9739 0.6894
--     212-   232    103492                                                                        0.9768 0.6973
--     233-   254     92332                                                                        0.9791 0.7044
--     255-   277     76200                                                                        0.9811 0.7114
--     278-   301     80128                                                                        0.9828 0.7177
--     302-   326     64372                                                                        0.9846 0.7248
--     327-   352     55050                                                                        0.9860 0.7310
--     353-   379     51536                                                                        0.9872 0.7368
--     380-   407     39206                                                                        0.9883 0.7426
--     408-   436     36487                                                                        0.9892 0.7474
--     437-   466     31226                                                                        0.9900 0.7522
--     467-   497     28553                                                                        0.9907 0.7565
--     498-   529     27500                                                                        0.9913 0.7608
--     530-   562     24592                                                                        0.9920 0.7651
--     563-   596     21037                                                                        0.9925 0.7693
--     597-   631     17617                                                                        0.9930 0.7731
--     632-   667     16567                                                                        0.9934 0.7764
--     668-   704     14928                                                                        0.9937 0.7797
--     705-   742     13724                                                                        0.9941 0.7829
--     743-   781     11814                                                                        0.9944 0.7860
--     782-   821     13269                                                                        0.9946 0.7887
--
--           0 (max occurrences)
--  3224120352 (total mers, non-unique)
--    44889987 (distinct mers, non-unique)
--           0 (unique mers)
-- Finished stage 'meryl-process', reset canuIteration.
--
-- Removing meryl database 'unitigging/0-mercounts/A3-16.ms22'.
--
-- OVERLAPPER (normal) (assembly) erate=0.01
--
----------------------------------------
-- Starting command on Fri Jan 16 00:39:28 2026 with 4562065.109 GB free disk space

    cd unitigging/1-overlapper
    /share/org/YZWL/yzwl_lixg/miniforge3/envs/canu_v.2.3/bin/overlapInCorePartition \
     -S  ../../A3-16.seqStore \
     -hl 160000000 \
     -rl 5000000000 \
     -ol 500 \
     -o  ./A3-16.partition \
    > ./A3-16.partition.err 2>&1

-- Finished on Fri Jan 16 00:39:29 2026 (one second) with 4562065.093 GB free disk space
----------------------------------------
--
-- Configured 21 overlapInCore jobs.
-- Finished stage 'utg-overlapConfigure', reset canuIteration.
--
-- Running jobs.  First attempt out of 2.
----------------------------------------
-- Starting 'utgovl' concurrent execution on Fri Jan 16 00:39:29 2026 with 4562065.062 GB free disk space (21 processes; 11 concurrently)

    cd unitigging/1-overlapper
    ./overlap.sh 1 > ./overlap.000001.out 2>&1
    ./overlap.sh 2 > ./overlap.000002.out 2>&1
    ./overlap.sh 3 > ./overlap.000003.out 2>&1
    ./overlap.sh 4 > ./overlap.000004.out 2>&1
    ./overlap.sh 5 > ./overlap.000005.out 2>&1
    ./overlap.sh 6 > ./overlap.000006.out 2>&1
    ./overlap.sh 7 > ./overlap.000007.out 2>&1
    ./overlap.sh 8 > ./overlap.000008.out 2>&1
    ./overlap.sh 9 > ./overlap.000009.out 2>&1
    ./overlap.sh 10 > ./overlap.000010.out 2>&1
    ./overlap.sh 11 > ./overlap.000011.out 2>&1
    ./overlap.sh 12 > ./overlap.000012.out 2>&1
    ./overlap.sh 13 > ./overlap.000013.out 2>&1
    ./overlap.sh 14 > ./overlap.000014.out 2>&1
    ./overlap.sh 15 > ./overlap.000015.out 2>&1
    ./overlap.sh 16 > ./overlap.000016.out 2>&1
    ./overlap.sh 17 > ./overlap.000017.out 2>&1
    ./overlap.sh 18 > ./overlap.000018.out 2>&1
    ./overlap.sh 19 > ./overlap.000019.out 2>&1
    ./overlap.sh 20 > ./overlap.000020.out 2>&1
    ./overlap.sh 21 > ./overlap.000021.out 2>&1

-- Finished on Fri Jan 16 01:07:54 2026 (1705 seconds) with 4557522.89 GB free disk space
----------------------------------------
-- Found 21 overlapInCore output files.
--
-- overlapInCore compute 'unitigging/1-overlapper':
--   kmer hits
--     with no overlap       1309800378  46.5714286 +- 38402265.751
--     with an overlap         23527184  42.0952381 +- 621692.165
--
--   overlaps                  23527184  42.0952381 +- 621692.165
--     contained                5781694  .761904762 +- 148465.919
--     dovetail                17745490  .333333333 +- 476072.835
--
--   overlaps rejected
--     multiple per pair              0           0 +- 0
--     bad short window               0           0 +- 0
--     bad long window                0           0 +- 0
-- Finished stage 'utg-overlapCheck', reset canuIteration.
----------------------------------------
-- Starting command on Fri Jan 16 01:07:54 2026 with 4557522.875 GB free disk space

    cd unitigging
    /share/org/YZWL/yzwl_lixg/miniforge3/envs/canu_v.2.3/bin/ovStoreConfig \
     -S ../A3-16.seqStore \
     -M 4-8 \
     -L ./1-overlapper/ovljob.files \
     -create ./A3-16.ovlStore.config \
     > ./A3-16.ovlStore.config.txt \
    2> ./A3-16.ovlStore.config.err

-- Finished on Fri Jan 16 01:07:54 2026 (like a bat out of hell) with 4557522.859 GB free disk space
----------------------------------------
--
-- Creating overlap store unitigging/A3-16.ovlStore using:
--      1 bucket
--      1 slice
--        using at most 2 GB memory each
--
-- Running jobs.  First attempt out of 2.
----------------------------------------
-- Starting 'ovS' concurrent execution on Fri Jan 16 01:07:54 2026 with 4557522.843 GB free disk space (1 processes; 62 concurrently)

    cd unitigging
    ./A3-16.ovlStore.sh 1 > ./A3-16.ovlStore.000001.out 2>&1

-- Finished on Fri Jan 16 01:08:04 2026 (10 seconds) with 4557745.109 GB free disk space
----------------------------------------
-- Checking store.
----------------------------------------
-- Starting command on Fri Jan 16 01:08:04 2026 with 4557745.109 GB free disk space

    cd unitigging
    /share/org/YZWL/yzwl_lixg/miniforge3/envs/canu_v.2.3/bin/ovStoreDump \
     -S ../A3-16.seqStore \
     -O  ./A3-16.ovlStore \
     -counts \
     > ./A3-16.ovlStore/counts.dat 2> ./A3-16.ovlStore/counts.err

-- Finished on Fri Jan 16 01:08:04 2026 (furiously fast) with 4557745.078 GB free disk space
----------------------------------------
--
-- Overlap store 'unitigging/A3-16.ovlStore' successfully constructed.
-- Found 47054368 overlaps for 249280 reads; 1456803 reads have no overlaps.
--
--
-- Purged 0.537 GB in 63 overlap output files.
----------------------------------------
-- Starting command on Fri Jan 16 01:08:05 2026 with 4557745.078 GB free disk space

    cd unitigging
    /share/org/YZWL/yzwl_lixg/miniforge3/envs/canu_v.2.3/bin/ovStoreStats \
     -C 50 \
     -S ../A3-16.seqStore \
     -O  ./A3-16.ovlStore \
     -o  ./A3-16.ovlStore \
     > ./A3-16.ovlStore.summary.err 2>&1

-- Finished on Fri Jan 16 01:08:11 2026 (6 seconds) with 4557745.062 GB free disk space
----------------------------------------
--
-- Overlap store 'unitigging/A3-16.ovlStore' contains:
--
--   category            reads     %          read length        feature size or coverage  analysis
--   ----------------  -------  -------  ----------------------  ------------------------  --------------------
--   middle-missing        118    0.05    14294.02 +- 7183.65        742.02 +- 934.98     (bad trimming)
--   middle-hump             7    0.00    15078.43 +- 4638.01       8485.43 +- 4108.53    (bad trimming)
--   no-5-prime            469    0.18    13961.64 +- 5372.14       1892.35 +- 2726.92    (bad trimming)
--   no-3-prime            460    0.18    12233.35 +- 6083.45       1890.93 +- 2928.79    (bad trimming)
--   
--   low-coverage         1086    0.42    11067.84 +- 5701.73          5.78 +- 3.63       (easy to assemble, potential for lower quality consensus)
--   unique             209105   81.74    12760.70 +- 5678.36         46.32 +- 8.39       (easy to assemble, perfect, yay)
--   repeat-cont         15494    6.06    10512.97 +- 5118.63        854.60 +- 656.56     (potential for consensus errors, no impact on assembly)
--   repeat-dove           232    0.09    20740.34 +- 1888.45        459.07 +- 453.17     (hard to assemble, likely won't assemble correctly or even at all)
--   
--   span-repeat          2284    0.89    14125.88 +- 4940.24       3231.01 +- 3905.95    (read spans a large repeat, usually easy to assemble)
--   uniq-repeat-cont    13636    5.33    12865.92 +- 4574.79                             (should be uniquely placed, low potential for consensus errors, no impact on assembly)
--   uniq-repeat-dove     2773    1.08    19116.66 +- 2798.59                             (will end contigs, potential to misassemble)
--   uniq-anchor          3616    1.41    13858.35 +- 4701.29       7607.85 +- 5090.13    (repeat read, with unique section, probable bad read)
-- Finished stage 'utg-createOverlapStore', reset canuIteration.
--
-- Loading read lengths.
-- Loading number of overlaps per read.
--
-- Configure RED for 16gb memory.
--                   Batches of at most (unlimited) reads.
--                                      500000000 bases.
--                   Expecting evidence of at most 536870912 bases per iteration.
--
--           Total                                               Reads                 Olaps Evidence
--    Job   Memory      Read Range         Reads        Bases   Memory        Olaps   Memory   Memory  (Memory in MB)
--   ---- -------- ------------------- --------- ------------ -------- ------------ -------- --------
--      1 16385.19         1-36685          5595    108981140 13303.54       843320     9.65  1024.00
--      2 16384.08     36686-75581          5951    108914342 13295.40      1457894    16.68  1024.00
--      3 16386.00     75582-126404         7645    108958952 13300.89      1144946    13.10  1024.00
--      4 16385.27    126405-167127         6251    108973864 13302.67       926038    10.60  1024.00
--      5 16385.55    167128-206936         5901    108912353 13295.15      1607819    18.40  1024.00
--      6 16384.75    206937-252984         6913    108967124 13301.87       950466    10.88  1024.00
--      7 16384.08    252985-303416         7543    108921076 13296.27      1381635    15.81  1024.00
--      8 16384.65    303417-341771         5731    108935108 13297.92      1286701    14.73  1024.00
--      9 16386.58    341772-384251         6374    108966704 13301.80      1116545    12.78  1024.00
--     10 16384.86    384252-439627         8221    108915744 13295.64      1504583    17.22  1024.00
--     11 16385.39    439628-477274         5700    108947750 13299.47      1216715    13.92  1024.00
--     12 16387.12    477275-518181         6139    108964991 13301.58      1182413    13.53  1024.00
--     13 16384.68    518182-575068         8456    108908368 13294.74      1566930    17.93  1024.00
--     14 16385.66    575069-613027         5677    108985807 13304.11       834736     9.55  1024.00
--     15 16386.81    613028-652224         5975    108938209 13298.31      1442074    16.50  1024.00
--     16 16385.83    652225-701585         7632    108960003 13301.02      1119167    12.81  1024.00
--     17 16385.72    701586-746913         6769    108969152 13302.11      1014509    11.61  1024.00
--     18 16384.14    746914-786529         5941    108926935 13296.93      1329200    15.21  1024.00
--     19 16386.00    786530-831474         6716    108974422 13302.75       982371    11.24  1024.00
--     20 16385.31    831475-884380         7886    108926876 13296.99      1426261    16.32  1024.00
--     21 16384.68    884381-923292         5775    108944905 13299.12      1184430    13.55  1024.00
--     22 16384.97    923293-965384         6345    108959205 13300.88      1056255    12.09  1024.00
--     23 16384.25    965385-1021564        8365    108916052 13295.68      1448362    16.58  1024.00
--     24 16385.38   1021565-1059373        5654    108943720 13298.97      1259167    14.41  1024.00
--     25 16384.90   1059374-1098865        6021    108942791 13298.87      1225551    14.03  1024.00
--     26 16385.34   1098866-1153450        8037    108922204 13296.42      1478240    16.92  1024.00
--     27 16384.60   1153451-1190588        5559    108974557 13302.73       861964     9.86  1024.00
--     28 16384.34   1190589-1228623        5782    108917323 13295.75      1449062    16.58  1024.00
--     29 16384.18   1228624-1276973        7150    108954217 13300.30      1038055    11.88  1024.00
--     30 16386.14   1276974-1318736        6332    108974337 13302.73       996743    11.41  1024.00
--     31 16385.06   1318737-1356839        5708    108938815 13298.37      1283516    14.69  1024.00
--     32 16384.79   1356840-1398937        6281    108963836 13301.45       991077    11.34  1024.00
--     33 16384.92   1398938-1446264        7073    108933263 13297.74      1326636    15.18  1024.00
--     34 16386.58   1446265-1485215        5646    108968209 13301.96      1102531    12.62  1024.00
--     35 16384.35   1485216-1525705        6047    108953193 13300.14      1066758    12.21  1024.00
--     36 16385.08   1525706-1576180        7547    108936005 13298.09      1309681    14.99  1024.00
--     37 16385.41   1576181-1613723        5589    108955583 13300.42      1135635    13.00  1024.00
--     38 16385.66   1613724-1652347        5917    108958576 13300.79      1124315    12.87  1024.00
--     39 16384.50   1652348-1705509        7896    108928721 13297.21      1336257    15.29  1024.00
--     40  3204.73   1705510-1706083          81      1083003   132.21        45810     0.52  1024.00
--   ---- -------- ------------------- --------- ------------ -------- ------------ -------- --------
--                                                 4250017435              47054368
-- Finished stage 'readErrorDetectionConfigure', reset canuIteration.
--
-- Running jobs.  First attempt out of 2.
----------------------------------------
-- Starting 'red' concurrent execution on Fri Jan 16 01:08:18 2026 with 4557745.015 GB free disk space (40 processes; 22 concurrently)

    cd unitigging/3-overlapErrorAdjustment
    ./red.sh 1 > ./red.000001.out 2>&1
    ./red.sh 2 > ./red.000002.out 2>&1
    ./red.sh 3 > ./red.000003.out 2>&1
    ./red.sh 4 > ./red.000004.out 2>&1
    ./red.sh 5 > ./red.000005.out 2>&1
    ./red.sh 6 > ./red.000006.out 2>&1
    ./red.sh 7 > ./red.000007.out 2>&1
    ./red.sh 8 > ./red.000008.out 2>&1
    ./red.sh 9 > ./red.000009.out 2>&1
    ./red.sh 10 > ./red.000010.out 2>&1
    ./red.sh 11 > ./red.000011.out 2>&1
    ./red.sh 12 > ./red.000012.out 2>&1
    ./red.sh 13 > ./red.000013.out 2>&1
    ./red.sh 14 > ./red.000014.out 2>&1
    ./red.sh 15 > ./red.000015.out 2>&1
    ./red.sh 16 > ./red.000016.out 2>&1
    ./red.sh 17 > ./red.000017.out 2>&1
    ./red.sh 18 > ./red.000018.out 2>&1
    ./red.sh 19 > ./red.000019.out 2>&1
    ./red.sh 20 > ./red.000020.out 2>&1
    ./red.sh 21 > ./red.000021.out 2>&1
    ./red.sh 22 > ./red.000022.out 2>&1
    ./red.sh 23 > ./red.000023.out 2>&1
    ./red.sh 24 > ./red.000024.out 2>&1
    ./red.sh 25 > ./red.000025.out 2>&1
    ./red.sh 26 > ./red.000026.out 2>&1
    ./red.sh 27 > ./red.000027.out 2>&1
    ./red.sh 28 > ./red.000028.out 2>&1
    ./red.sh 29 > ./red.000029.out 2>&1
    ./red.sh 30 > ./red.000030.out 2>&1
    ./red.sh 31 > ./red.000031.out 2>&1
    ./red.sh 32 > ./red.000032.out 2>&1
    ./red.sh 33 > ./red.000033.out 2>&1
    ./red.sh 34 > ./red.000034.out 2>&1
    ./red.sh 35 > ./red.000035.out 2>&1
    ./red.sh 36 > ./red.000036.out 2>&1
    ./red.sh 37 > ./red.000037.out 2>&1
    ./red.sh 38 > ./red.000038.out 2>&1
    ./red.sh 39 > ./red.000039.out 2>&1
    ./red.sh 40 > ./red.000040.out 2>&1

-- Finished on Fri Jan 16 01:17:31 2026 (553 seconds) with 4558065.515 GB free disk space
----------------------------------------
-- Found 40 read error detection output files.
-- Finished stage 'readErrorDetectionCheck', reset canuIteration.
--
-- Loading read lengths.
-- Loading number of overlaps per read.
--
-- Configure OEA for 8gb memory.
--                   Batches of at most (unlimited) reads.
--                                      300000000 bases.
--
--           Total                                               Reads                 Olaps  Adjusts
--    Job   Memory      Read Range         Reads        Bases   Memory        Olaps   Memory   Memory  (Memory in MB)
--   ---- -------- ------------------- --------- ------------ -------- ------------ -------- --------
--      1  2800.85         1-110732        16807    300017236   294.63      3012700    91.94   366.28
--      2  2814.99    110733-228692        17788    300009586   294.65      3475399   106.06   366.28
--      3  2816.92    228693-351929        18492    300012158   294.68      3537766   107.96   366.28
--      4  2813.30    351930-477903        18824    300003544   294.68      3418997   104.34   366.28
--      5  2807.32    477904-604056        18842    300001922   294.68      3223280    98.37   366.28
--      6  2819.63    604057-729429        19021    300005961   294.69      3626300   110.67   366.28
--      7  2805.42    729430-849906        18109    300008972   294.66      3161503    96.48   366.28
--      8  2804.74    849907-966963        17472    300008348   294.64      3139716    95.82   366.28
--      9  2822.50    966964-1090021       18464    300012519   294.68      3720484   113.54   366.28
--     10  2807.42   1090022-1210469       18014    300007518   294.66      3227134    98.48   366.28
--     11  2805.29   1210470-1329423       17843    300016726   294.66      3157008    96.34   366.28
--     12  2808.48   1329424-1448120       17675    300018044   294.66      3261646    99.54   366.28
--     13  2810.58   1448121-1569300       17907    300010475   294.66      3330482   101.64   366.28
--     14  2794.64   1569301-1677489       16348    300021488   294.62      2809351    85.73   366.28
--     15  2499.03   1677490-1706083        4215     49862938    55.68       952602    29.07   366.28
--   ---- -------- ------------------- --------- ------------ -------- ------------ -------- --------
--                                                 4250017435              47054368
-- Finished stage 'overlapErrorAdjustmentConfigure', reset canuIteration.
--
-- Running jobs.  First attempt out of 2.
----------------------------------------
-- Starting 'oea' concurrent execution on Fri Jan 16 01:17:38 2026 with 4558065.437 GB free disk space (15 processes; 62 concurrently)

    cd unitigging/3-overlapErrorAdjustment
    ./oea.sh 1 > ./oea.000001.out 2>&1
    ./oea.sh 2 > ./oea.000002.out 2>&1
    ./oea.sh 3 > ./oea.000003.out 2>&1
    ./oea.sh 4 > ./oea.000004.out 2>&1
    ./oea.sh 5 > ./oea.000005.out 2>&1
    ./oea.sh 6 > ./oea.000006.out 2>&1
    ./oea.sh 7 > ./oea.000007.out 2>&1
    ./oea.sh 8 > ./oea.000008.out 2>&1
    ./oea.sh 9 > ./oea.000009.out 2>&1
    ./oea.sh 10 > ./oea.000010.out 2>&1
    ./oea.sh 11 > ./oea.000011.out 2>&1
    ./oea.sh 12 > ./oea.000012.out 2>&1
    ./oea.sh 13 > ./oea.000013.out 2>&1
    ./oea.sh 14 > ./oea.000014.out 2>&1
    ./oea.sh 15 > ./oea.000015.out 2>&1

-- Finished on Fri Jan 16 01:42:19 2026 (1481 seconds) with 4559867.687 GB free disk space
----------------------------------------
-- Found 15 overlap error adjustment output files.
-- Finished stage 'overlapErrorAdjustmentCheck', reset canuIteration.
----------------------------------------
-- Starting command on Fri Jan 16 01:42:19 2026 with 4559867.671 GB free disk space

    cd unitigging/3-overlapErrorAdjustment
    /share/org/YZWL/yzwl_lixg/miniforge3/envs/canu_v.2.3/bin/loadErates \
      -S ../../A3-16.seqStore \
      -O ../A3-16.ovlStore \
      -L ./oea.files \
    > ./oea.apply.err 2>&1

-- Finished on Fri Jan 16 01:42:19 2026 (fast as lightning) with 4559867.562 GB free disk space
----------------------------------------
-- No report available.
-- Finished stage 'updateOverlapStore', reset canuIteration.
-- Finished stage 'unitig', reset canuIteration.
--
-- Running jobs.  First attempt out of 2.
----------------------------------------
-- Starting 'bat' concurrent execution on Fri Jan 16 01:42:19 2026 with 4559867.515 GB free disk space (1 processes; 1 concurrently)

    cd unitigging/4-unitigger
    ./unitigger.sh 1 > ./unitigger.000001.out 2>&1

-- Finished on Fri Jan 16 01:42:32 2026 (13 seconds) with 4559867.515 GB free disk space
----------------------------------------
-- Unitigger finished successfully.
--  
--  ERROR RATES
--  -----------
--                                                   --------threshold------
--  280697                       fraction error      fraction        percent
--  samples                              (1e-5)         error          error
--                   --------------------------      --------       --------
--  command line (-eg)                           ->     30.00        0.0300%
--  command line (-ef)                           ->  -----.--      ---.----%
--  command line (-eM)                           ->     30.00        0.0300%
--  mean + std.dev       0.30 +-  12 *     2.49  ->     30.21        0.0302%
--  median + mad         0.00 +-  12 *     0.00  ->      0.00        0.0000%
--  90th percentile                              ->      1.00        0.0010%  (enabled)
--  
--  BEST EDGE FILTERING
--  -------------------
--  At graph threshold 0.0300%, reads:
--    available to have edges:        43676
--    with at least one edge:         35761
--  
--  At max threshold 0.0300%, reads:  (not computed)
--    available to have edges:            0
--    with at least one edge:             0
--  
--  At tight threshold 0.0010%, reads with:
--    both edges below error threshold:     32042  (80.00% minReadsBest threshold = 28608)
--    one  edge  above error threshold:      2667
--    both edges above error threshold:      1052
--    at least one edge:                    35761
--  
--  At loose threshold 0.0300%, reads with:
--    both edges below error threshold:     35761  (80.00% minReadsBest threshold = 28608)
--    one  edge  above error threshold:         0
--    both edges above error threshold:         0
--    at least one edge:                    35761
--  
--  
--  INITIAL EDGES
--  -------- ----------------------------------------
--    207981 reads are contained
--   1466544 reads have no best edges (singleton)
--       306 reads have only one best edge (spur) 
--                145 are mutual best
--     31252 reads have two best edges 
--                721 have one mutual best edge
--              30176 have two mutual best edges
--  
--  
--  FINAL EDGES
--  -------- ----------------------------------------
--    207981 reads are contained
--   1466878 reads have no best edges (singleton)
--       181 reads have only one best edge (spur) 
--                149 are mutual best
--     31043 reads have two best edges 
--                619 have one mutual best edge
--              30160 have two mutual best edges
--  
--  
--  EDGE FILTERING
--  -------- ------------------------------------------
--         0 reads are ignored
--      8193 reads have a gap in overlap coverage
--       144 reads have lopsided best edges
-- Found, in version 1, after unitig construction:
--   contigs:      92 sequences, total length 68269598 bp (including 87 repeats of total length 2194885 bp).
--   bubbles:      132 sequences, total length 3849150 bp.
--   unassembled:  17076 sequences, total length 205215040 bp.
--
-- Contig sizes based on genome size 85mbp:
--
--            NG (bp)  LG (contigs)    sum (bp)
--         ----------  ------------  ----------
--     10     8869402             1     8869402
--     20     5428849             3    20516893
--     30     3972300             5    28939692
--     40     3402139             7    35927115
--     50     3365509             9    42680663
--     60     2976488            12    51925837
--     70     1779610            16    60881306
--     80       17331            75    68004867
--
-- Finished stage 'unitigCheck', reset canuIteration.
----------------------------------------
-- Starting command on Fri Jan 16 01:42:32 2026 with 4559867.5 GB free disk space

    cd unitigging
    /share/org/YZWL/yzwl_lixg/miniforge3/envs/canu_v.2.3/bin/utgcns \
      -S ../A3-16.seqStore \
      -T  ./A3-16.ctgStore 1 \
      -partition 0.8 1.5 0.1 \
    > ./A3-16.ctgStore/partitioning.log 2>&1

-- Finished on Fri Jan 16 01:42:42 2026 (10 seconds) with 4559866.312 GB free disk space
----------------------------------------
-- Using slow alignment for consensus (iteration '0').
-- Configured 10 consensus jobs.
-- Finished stage 'consensusConfigure', reset canuIteration.
--
-- Local: cns       13.125 GB    8 CPUs x  11 jobs   144.375 GB  88 CPUs  (consensus)
--
--
-- Running jobs.  First attempt out of 2.
----------------------------------------
-- Starting 'cns' concurrent execution on Fri Jan 16 01:42:42 2026 with 4559866.281 GB free disk space (10 processes; 11 concurrently)

    cd unitigging/5-consensus
    ./consensus.sh 1 > ./consensus.000001.out 2>&1
    ./consensus.sh 2 > ./consensus.000002.out 2>&1
    ./consensus.sh 3 > ./consensus.000003.out 2>&1
    ./consensus.sh 4 > ./consensus.000004.out 2>&1
    ./consensus.sh 5 > ./consensus.000005.out 2>&1
    ./consensus.sh 6 > ./consensus.000006.out 2>&1
    ./consensus.sh 7 > ./consensus.000007.out 2>&1
    ./consensus.sh 8 > ./consensus.000008.out 2>&1
    ./consensus.sh 9 > ./consensus.000009.out 2>&1
    ./consensus.sh 10 > ./consensus.000010.out 2>&1

-- Finished on Fri Jan 16 01:50:51 2026 (489 seconds) with 4559371.812 GB free disk space
----------------------------------------
-- Using slow alignment for consensus (iteration '1').
-- Configured 10 consensus jobs.
-- All 10 consensus jobs finished successfully.
-- Finished stage 'consensusCheck', reset canuIteration.
-- Using slow alignment for consensus (iteration '0').
-- Configured 10 consensus jobs.
----------------------------------------
-- Starting command on Fri Jan 16 01:50:51 2026 with 4559371.765 GB free disk space

    cd unitigging
    /share/org/YZWL/yzwl_lixg/miniforge3/envs/canu_v.2.3/bin/tgStoreLoad \
      -S ../A3-16.seqStore \
      -T  ./A3-16.ctgStore 2 \
      -L ./5-consensus/ctgcns.files \
    > ./5-consensus/ctgcns.files.ctgStoreLoad.err 2>&1

-- Finished on Fri Jan 16 01:50:51 2026 (furiously fast) with 4559371 GB free disk space
----------------------------------------
----------------------------------------
-- Starting command on Fri Jan 16 01:50:51 2026 with 4559371 GB free disk space

    cd unitigging
    /share/org/YZWL/yzwl_lixg/miniforge3/envs/canu_v.2.3/bin/tgTigDisplay \
      -S ../A3-16.seqStore \
      -b \
      -o ../A3-16.contigs.unsorted.bam \
      -L ./5-consensus/ctgcns.files \
    > ./5-consensus/ctgcns.files.contigs.bam.err 2>&1

-- Finished on Fri Jan 16 01:53:37 2026 (166 seconds) with 4559339.859 GB free disk space
----------------------------------------
----------------------------------------
-- Starting command on Fri Jan 16 01:53:37 2026 with 4559339.859 GB free disk space

    cd .
    samtools sort \
      --write-index \
      --threads 2 \
      -o ./A3-16.contigs.bam ./A3-16.contigs.unsorted.bam \
    > ./ctgcns.bam.err 2>&1

-- Finished on Fri Jan 16 01:54:50 2026 (73 seconds) with 4559257.656 GB free disk space
----------------------------------------
-- Purging consensus output after loading to ctgStore.
-- Purged 10 .cns outputs.
----------------------------------------
-- Starting command on Fri Jan 16 01:54:50 2026 with 4559259.578 GB free disk space

    cd unitigging
    /share/org/YZWL/yzwl_lixg/miniforge3/envs/canu_v.2.3/bin/tgStoreDump \
      -S ../A3-16.seqStore \
      -T ./A3-16.ctgStore 2 \
      -sizes -s 85000000 \
    > ./A3-16.ctgStore/seqDB.v002.sizes.txt
ZERO length suplied to intervalList::add(), ignoring interval.
ZERO length suplied to intervalList::add(), ignoring interval.
ZERO length suplied to intervalList::add(), ignoring interval.
ZERO length suplied to intervalList::add(), ignoring interval.
ZERO length suplied to intervalList::add(), ignoring interval.
ZERO length suplied to intervalList::add(), ignoring interval.
ZERO length suplied to intervalList::add(), ignoring interval.
ZERO length suplied to intervalList::add(), ignoring interval.
ZERO length suplied to intervalList::add(), ignoring interval.
ZERO length suplied to intervalList::add(), ignoring interval.
ZERO length suplied to intervalList::add(), ignoring interval.
ZERO length suplied to intervalList::add(), ignoring interval.
ZERO length suplied to intervalList::add(), ignoring interval.
ZERO length suplied to intervalList::add(), ignoring interval.
ZERO length suplied to intervalList::add(), ignoring interval.
ZERO length suplied to intervalList::add(), ignoring interval.
ZERO length suplied to intervalList::add(), ignoring interval.
ZERO length suplied to intervalList::add(), ignoring interval.
ZERO length suplied to intervalList::add(), ignoring interval.
ZERO length suplied to intervalList::add(), ignoring interval.
ZERO length suplied to intervalList::add(), ignoring interval.
ZERO length suplied to intervalList::add(), ignoring interval.
ZERO length suplied to intervalList::add(), ignoring interval.
ZERO length suplied to intervalList::add(), ignoring interval.
ZERO length suplied to intervalList::add(), ignoring interval.
ZERO length suplied to intervalList::add(), ignoring interval.
ZERO length suplied to intervalList::add(), ignoring interval.
ZERO length suplied to intervalList::add(), ignoring interval.
ZERO length suplied to intervalList::add(), ignoring interval.
ZERO length suplied to intervalList::add(), ignoring interval.
ZERO length suplied to intervalList::add(), ignoring interval.
ZERO length suplied to intervalList::add(), ignoring interval.
ZERO length suplied to intervalList::add(), ignoring interval.
ZERO length suplied to intervalList::add(), ignoring interval.
ZERO length suplied to intervalList::add(), ignoring interval.
ZERO length suplied to intervalList::add(), ignoring interval.
ZERO length suplied to intervalList::add(), ignoring interval.
ZERO length suplied to intervalList::add(), ignoring interval.
ZERO length suplied to intervalList::add(), ignoring interval.
ZERO length suplied to intervalList::add(), ignoring interval.
ZERO length suplied to intervalList::add(), ignoring interval.
ZERO length suplied to intervalList::add(), ignoring interval.
ZERO length suplied to intervalList::add(), ignoring interval.
ZERO length suplied to intervalList::add(), ignoring interval.
ZERO length suplied to intervalList::add(), ignoring interval.
ZERO length suplied to intervalList::add(), ignoring interval.
ZERO length suplied to intervalList::add(), ignoring interval.
ZERO length suplied to intervalList::add(), ignoring interval.
ZERO length suplied to intervalList::add(), ignoring interval.
ZERO length suplied to intervalList::add(), ignoring interval.
ZERO length suplied to intervalList::add(), ignoring interval.
ZERO length suplied to intervalList::add(), ignoring interval.
ZERO length suplied to intervalList::add(), ignoring interval.
ZERO length suplied to intervalList::add(), ignoring interval.
ZERO length suplied to intervalList::add(), ignoring interval.
ZERO length suplied to intervalList::add(), ignoring interval.
ZERO length suplied to intervalList::add(), ignoring interval.
ZERO length suplied to intervalList::add(), ignoring interval.
ZERO length suplied to intervalList::add(), ignoring interval.
ZERO length suplied to intervalList::add(), ignoring interval.
ZERO length suplied to intervalList::add(), ignoring interval.
ZERO length suplied to intervalList::add(), ignoring interval.
ZERO length suplied to intervalList::add(), ignoring interval.
ZERO length suplied to intervalList::add(), ignoring interval.
ZERO length suplied to intervalList::add(), ignoring interval.
ZERO length suplied to intervalList::add(), ignoring interval.
ZERO length suplied to intervalList::add(), ignoring interval.
ZERO length suplied to intervalList::add(), ignoring interval.
ZERO length suplied to intervalList::add(), ignoring interval.
ZERO length suplied to intervalList::add(), ignoring interval.

-- Finished on Fri Jan 16 01:54:50 2026 (in the blink of an eye) with 4559259.578 GB free disk space
----------------------------------------
-- Found, in version 2, after consensus generation:
--   contigs:      92 sequences, total length 89136449 bp (including 87 repeats of total length 3079374 bp).
--   bubbles:      132 sequences, total length 5123043 bp.
--   unassembled:  17076 sequences, total length 280201109 bp.
--
-- Contig sizes based on genome size 85mbp:
--
--            NG (bp)  LG (contigs)    sum (bp)
--         ----------  ------------  ----------
--     10    11529399             1    11529399
--     20     8076200             2    19605599
--     30     7050280             3    26655879
--     40     5155978             5    37611478
--     50     4439120             7    46718536
--     60     4419975             8    51138511
--     70     4217426            10    59730619
--     80     3556204            13    71133879
--     90     2574296            15    76921798
--    100     1206897            21    85980994
--
-- Finished stage 'consensusLoad', reset canuIteration.
----------------------------------------
-- Starting command on Fri Jan 16 01:54:50 2026 with 4559259.562 GB free disk space

    cd .
    /share/org/YZWL/yzwl_lixg/miniforge3/envs/canu_v.2.3/bin/tgStoreDump \
      -S ./A3-16.seqStore \
      -T ./unitigging/A3-16.ctgStore 2 \
      -o ./A3-16.contigs \
      -layout \
    > ./A3-16.contigs.layout.err 2>&1

-- Finished on Fri Jan 16 01:54:51 2026 (one second) with 4559259.515 GB free disk space
----------------------------------------
----------------------------------------
-- Starting command on Fri Jan 16 01:54:51 2026 with 4559259.515 GB free disk space

    cd .
    /share/org/YZWL/yzwl_lixg/miniforge3/envs/canu_v.2.3/bin/tgStoreDump \
      -S ./A3-16.seqStore \
      -T ./unitigging/A3-16.ctgStore 2 \
      -consensus -fasta \
      -unassembled \
    > ./A3-16.unassembled.fasta
    2> ./A3-16.unassembled.err
ZERO length suplied to intervalList::add(), ignoring interval.
ZERO length suplied to intervalList::add(), ignoring interval.
ZERO length suplied to intervalList::add(), ignoring interval.
ZERO length suplied to intervalList::add(), ignoring interval.
ZERO length suplied to intervalList::add(), ignoring interval.
ZERO length suplied to intervalList::add(), ignoring interval.
ZERO length suplied to intervalList::add(), ignoring interval.
ZERO length suplied to intervalList::add(), ignoring interval.
ZERO length suplied to intervalList::add(), ignoring interval.
ZERO length suplied to intervalList::add(), ignoring interval.
ZERO length suplied to intervalList::add(), ignoring interval.
ZERO length suplied to intervalList::add(), ignoring interval.
ZERO length suplied to intervalList::add(), ignoring interval.
ZERO length suplied to intervalList::add(), ignoring interval.
ZERO length suplied to intervalList::add(), ignoring interval.
ZERO length suplied to intervalList::add(), ignoring interval.
ZERO length suplied to intervalList::add(), ignoring interval.
ZERO length suplied to intervalList::add(), ignoring interval.
ZERO length suplied to intervalList::add(), ignoring interval.
ZERO length suplied to intervalList::add(), ignoring interval.
ZERO length suplied to intervalList::add(), ignoring interval.
ZERO length suplied to intervalList::add(), ignoring interval.
ZERO length suplied to intervalList::add(), ignoring interval.
ZERO length suplied to intervalList::add(), ignoring interval.
ZERO length suplied to intervalList::add(), ignoring interval.
ZERO length suplied to intervalList::add(), ignoring interval.
ZERO length suplied to intervalList::add(), ignoring interval.
ZERO length suplied to intervalList::add(), ignoring interval.
ZERO length suplied to intervalList::add(), ignoring interval.
ZERO length suplied to intervalList::add(), ignoring interval.
ZERO length suplied to intervalList::add(), ignoring interval.
ZERO length suplied to intervalList::add(), ignoring interval.
ZERO length suplied to intervalList::add(), ignoring interval.
ZERO length suplied to intervalList::add(), ignoring interval.
ZERO length suplied to intervalList::add(), ignoring interval.
ZERO length suplied to intervalList::add(), ignoring interval.
ZERO length suplied to intervalList::add(), ignoring interval.
ZERO length suplied to intervalList::add(), ignoring interval.
ZERO length suplied to intervalList::add(), ignoring interval.
ZERO length suplied to intervalList::add(), ignoring interval.
ZERO length suplied to intervalList::add(), ignoring interval.
ZERO length suplied to intervalList::add(), ignoring interval.
ZERO length suplied to intervalList::add(), ignoring interval.
ZERO length suplied to intervalList::add(), ignoring interval.
ZERO length suplied to intervalList::add(), ignoring interval.
ZERO length suplied to intervalList::add(), ignoring interval.
ZERO length suplied to intervalList::add(), ignoring interval.
ZERO length suplied to intervalList::add(), ignoring interval.
ZERO length suplied to intervalList::add(), ignoring interval.
ZERO length suplied to intervalList::add(), ignoring interval.
ZERO length suplied to intervalList::add(), ignoring interval.
ZERO length suplied to intervalList::add(), ignoring interval.
ZERO length suplied to intervalList::add(), ignoring interval.
ZERO length suplied to intervalList::add(), ignoring interval.
ZERO length suplied to intervalList::add(), ignoring interval.
ZERO length suplied to intervalList::add(), ignoring interval.
ZERO length suplied to intervalList::add(), ignoring interval.
ZERO length suplied to intervalList::add(), ignoring interval.
ZERO length suplied to intervalList::add(), ignoring interval.
ZERO length suplied to intervalList::add(), ignoring interval.
ZERO length suplied to intervalList::add(), ignoring interval.
ZERO length suplied to intervalList::add(), ignoring interval.
ZERO length suplied to intervalList::add(), ignoring interval.
ZERO length suplied to intervalList::add(), ignoring interval.
ZERO length suplied to intervalList::add(), ignoring interval.
ZERO length suplied to intervalList::add(), ignoring interval.
ZERO length suplied to intervalList::add(), ignoring interval.
ZERO length suplied to intervalList::add(), ignoring interval.
ZERO length suplied to intervalList::add(), ignoring interval.
ZERO length suplied to intervalList::add(), ignoring interval.

-- Finished on Fri Jan 16 01:54:52 2026 (one second) with 4559259.234 GB free disk space
----------------------------------------
----------------------------------------
-- Starting command on Fri Jan 16 01:54:52 2026 with 4559259.234 GB free disk space

    cd .
    /share/org/YZWL/yzwl_lixg/miniforge3/envs/canu_v.2.3/bin/tgStoreDump \
      -S ./A3-16.seqStore \
      -T ./unitigging/A3-16.ctgStore 2 \
      -consensus -fasta \
      -contigs \
    > ./A3-16.contigs.fasta
    2> ./A3-16.contigs.err
ZERO length suplied to intervalList::add(), ignoring interval.
ZERO length suplied to intervalList::add(), ignoring interval.
ZERO length suplied to intervalList::add(), ignoring interval.
ZERO length suplied to intervalList::add(), ignoring interval.
ZERO length suplied to intervalList::add(), ignoring interval.
ZERO length suplied to intervalList::add(), ignoring interval.
ZERO length suplied to intervalList::add(), ignoring interval.
ZERO length suplied to intervalList::add(), ignoring interval.
ZERO length suplied to intervalList::add(), ignoring interval.
ZERO length suplied to intervalList::add(), ignoring interval.
ZERO length suplied to intervalList::add(), ignoring interval.
ZERO length suplied to intervalList::add(), ignoring interval.
ZERO length suplied to intervalList::add(), ignoring interval.
ZERO length suplied to intervalList::add(), ignoring interval.
ZERO length suplied to intervalList::add(), ignoring interval.
ZERO length suplied to intervalList::add(), ignoring interval.
ZERO length suplied to intervalList::add(), ignoring interval.
ZERO length suplied to intervalList::add(), ignoring interval.
ZERO length suplied to intervalList::add(), ignoring interval.
ZERO length suplied to intervalList::add(), ignoring interval.
ZERO length suplied to intervalList::add(), ignoring interval.
ZERO length suplied to intervalList::add(), ignoring interval.
ZERO length suplied to intervalList::add(), ignoring interval.
ZERO length suplied to intervalList::add(), ignoring interval.
ZERO length suplied to intervalList::add(), ignoring interval.
ZERO length suplied to intervalList::add(), ignoring interval.
ZERO length suplied to intervalList::add(), ignoring interval.
ZERO length suplied to intervalList::add(), ignoring interval.
ZERO length suplied to intervalList::add(), ignoring interval.
ZERO length suplied to intervalList::add(), ignoring interval.
ZERO length suplied to intervalList::add(), ignoring interval.
ZERO length suplied to intervalList::add(), ignoring interval.
ZERO length suplied to intervalList::add(), ignoring interval.
ZERO length suplied to intervalList::add(), ignoring interval.
ZERO length suplied to intervalList::add(), ignoring interval.
ZERO length suplied to intervalList::add(), ignoring interval.
ZERO length suplied to intervalList::add(), ignoring interval.
ZERO length suplied to intervalList::add(), ignoring interval.
ZERO length suplied to intervalList::add(), ignoring interval.
ZERO length suplied to intervalList::add(), ignoring interval.
ZERO length suplied to intervalList::add(), ignoring interval.
ZERO length suplied to intervalList::add(), ignoring interval.
ZERO length suplied to intervalList::add(), ignoring interval.
ZERO length suplied to intervalList::add(), ignoring interval.
ZERO length suplied to intervalList::add(), ignoring interval.
ZERO length suplied to intervalList::add(), ignoring interval.
ZERO length suplied to intervalList::add(), ignoring interval.
ZERO length suplied to intervalList::add(), ignoring interval.
ZERO length suplied to intervalList::add(), ignoring interval.
ZERO length suplied to intervalList::add(), ignoring interval.
ZERO length suplied to intervalList::add(), ignoring interval.
ZERO length suplied to intervalList::add(), ignoring interval.
ZERO length suplied to intervalList::add(), ignoring interval.
ZERO length suplied to intervalList::add(), ignoring interval.
ZERO length suplied to intervalList::add(), ignoring interval.
ZERO length suplied to intervalList::add(), ignoring interval.
ZERO length suplied to intervalList::add(), ignoring interval.
ZERO length suplied to intervalList::add(), ignoring interval.
ZERO length suplied to intervalList::add(), ignoring interval.
ZERO length suplied to intervalList::add(), ignoring interval.
ZERO length suplied to intervalList::add(), ignoring interval.
ZERO length suplied to intervalList::add(), ignoring interval.
ZERO length suplied to intervalList::add(), ignoring interval.
ZERO length suplied to intervalList::add(), ignoring interval.
ZERO length suplied to intervalList::add(), ignoring interval.
ZERO length suplied to intervalList::add(), ignoring interval.
ZERO length suplied to intervalList::add(), ignoring interval.
ZERO length suplied to intervalList::add(), ignoring interval.
ZERO length suplied to intervalList::add(), ignoring interval.
ZERO length suplied to intervalList::add(), ignoring interval.

-- Finished on Fri Jan 16 01:54:52 2026 (fast as lightning) with 4559259.125 GB free disk space
----------------------------------------
-- Finished stage 'generateOutputs', reset canuIteration.
--
-- Assembly 'A3-16' finished in '/share/org/YZWL/yzwl_lixg/project/28.大豆疫霉菌三代基因组/03.hicanu/A3-16/01.raw_output'.
--
-- Summary saved in 'A3-16.report'.
--
-- Sequences saved:
--   Contigs       -> 'A3-16.contigs.fasta'
--   Unassembled   -> 'A3-16.unassembled.fasta'
--
-- Read layouts saved:
--   Contigs       -> 'A3-16.contigs.layout'.
--
-- Bye.

2026-01-16 01:54:53.001 - WARNING - 输出文件不存在|Output file does not exist: /share/org/YZWL/yzwl_lixg/project/28.大豆疫霉菌三代基因组/03.hicanu/A3-16/01.raw_output/A3-16.unitigs.fasta
Usage: biopytools ragtag [OPTIONS]
Try 'biopytools ragtag -h' for help.

Error: Invalid value for '-r' / '--reference': 文件不存在|File does not exist: /share/org/YZWL/yzwl_lixg/project/28.大豆疫霉菌三代基因组/04.ragtag/Psoja_T2T.fa
Usage: biopytools genomesyn [OPTIONS]
Try 'biopytools genomesyn -h' for help.

Error: Invalid value for '-i' / '--ref': Path '04.ragtag/A3-16/hicanu/A3-16_RagTag_scaffolded.fa' does not exist.
Job 68886738 stderr output:

