Usage: biopytools ragtag [OPTIONS]
Try 'biopytools ragtag -h' for help.

Error: Invalid value for '-r' / '--reference': 文件不存在|File does not exist: /share/org/YZWL/yzwl_lixg/project/28.大豆疫霉菌三代基因组/04.ragtag/Psoja_T2T.fa
Usage: biopytools genomesyn [OPTIONS]
Try 'biopytools genomesyn -h' for help.

Error: Invalid value for '-i' / '--ref': Path '04.ragtag/B3-2/hifiasm/B3-2_RagTag_scaffolded.fa' does not exist.
2026-01-16 02:44:57.318 - WARNING - 命令错误输出|Command stderr:
-- canu master +27 changes (r10515 2a41e933b8de6ed66723d75d36dd071b46d2c347)
--
-- CITATIONS
--
-- For assemblies of PacBio HiFi reads:
--   Nurk S, Walenz BP, Rhiea A, Vollger MR, Logsdon GA, Grothe R, Miga KH, Eichler EE, Phillippy AM, Koren S.
--   HiCanu: accurate assembly of segmental duplications, satellites, and allelic variants from high-fidelity long reads.
--   biorXiv. 2020.
--   https://doi.org/10.1101/2020.03.14.992248
-- 
-- Read and contig alignments during correction and consensus use:
--   Šošic M, Šikic M.
--   Edlib: a C/C ++ library for fast, exact sequence alignment using edit distance.
--   Bioinformatics. 2017 May 1;33(9):1394-1395.
--   http://doi.org/10.1093/bioinformatics/btw753
-- 
-- Overlaps are generated using:
--   Berlin K, et al.
--   Assembling large genomes with single-molecule sequencing and locality-sensitive hashing.
--   Nat Biotechnol. 2015 Jun;33(6):623-30.
--   http://doi.org/10.1038/nbt.3238
-- 
--   Myers EW, et al.
--   A Whole-Genome Assembly of Drosophila.
--   Science. 2000 Mar 24;287(5461):2196-204.
--   http://doi.org/10.1126/science.287.5461.2196
-- 
-- Contig consensus sequences are generated using an algorithm derived from pbdagcon:
--   Chin CS, et al.
--   Nonhybrid, finished microbial genome assemblies from long-read SMRT sequencing data.
--   Nat Methods. 2013 Jun;10(6):563-9
--   http://doi.org/10.1038/nmeth.2474
-- 
-- CONFIGURE CANU
--
-- Detected Java(TM) Runtime Environment '17.0.15-internal' (from '/share/org/YZWL/yzwl_lixg/.local/bin/java') without -d64 support.
--
-- WARNING:
-- WARNING:  Failed to run gnuplot using command 'gnuplot'.
-- WARNING:  Plots will be disabled.
-- WARNING:
--
-- Detected samtools version '1.22' / htslib version 'htscodecs=1.6.3' (from 'samtools').
--
-- Detected 88 CPUs and 503 gigabytes of memory on the local machine.
--
-- Detected Slurm with 'sinfo' binary in /opt/skyformai/bin/sinfo.
--          Slurm disabled by useGrid=false
--
-- Detected  '' with 'pbsnodes' binary in /opt/skyformai/bin/pbsnodes.
--           disabled by useGrid=false
--
-- Detected LSF with 'bsub' binary in /opt/skyformai/bin/bsub.
--          LSF disabled by useGrid=false
--
-- Local machine mode enabled; grid support not detected or not allowed.
--
-- Found trimmed raw PacBio HiFi reads in the input files.
--
--                                (tag)Concurrency
--                         (tag)Threads          |
--                (tag)Memory         |          |
--        (tag)             |         |          |       total usage      algorithm
--        -------  ----------  --------   --------  --------------------  -----------------------------
-- Local: meryl     12.000 GB    4 CPUs x  22 jobs   264.000 GB  88 CPUs  (k-mer counting)
-- Local: cormhap   13.000 GB   11 CPUs x   8 jobs   104.000 GB  88 CPUs  (overlap detection with mhap)
-- Local: obtovl     8.000 GB    8 CPUs x  11 jobs    88.000 GB  88 CPUs  (overlap detection)
-- Local: utgovl     8.000 GB    8 CPUs x  11 jobs    88.000 GB  88 CPUs  (overlap detection)
-- Local: cor        -.--- GB    4 CPUs x   - jobs     -.--- GB   - CPUs  (read correction)
-- Local: ovb        4.000 GB    1 CPU  x  88 jobs   352.000 GB  88 CPUs  (overlap store bucketizer)
-- Local: ovs        8.000 GB    1 CPU  x  62 jobs   496.000 GB  62 CPUs  (overlap store sorting)
-- Local: red       16.000 GB    4 CPUs x  22 jobs   352.000 GB  88 CPUs  (read error detection)
-- Local: oea        8.000 GB    1 CPU  x  62 jobs   496.000 GB  62 CPUs  (overlap error adjustment)
-- Local: bat       32.000 GB    8 CPUs x   1 job     32.000 GB   8 CPUs  (contig construction with bogart)
-- Local: cns        -.--- GB    8 CPUs x   - jobs     -.--- GB   - CPUs  (consensus)
--
-- Generating assembly 'B3-2' in '/share/org/YZWL/yzwl_lixg/project/28.大豆疫霉菌三代基因组/03.hicanu/B3-2/01.raw_output':
--   genomeSize:
--     85000000
--
--   Overlap Generation Limits:
--     corOvlErrorRate 0.0000 (  0.00%)
--     obtOvlErrorRate 0.0250 (  2.50%)
--     utgOvlErrorRate 0.0100 (  1.00%)
--
--   Overlap Processing Limits:
--     corErrorRate    0.0000 (  0.00%)
--     obtErrorRate    0.0250 (  2.50%)
--     utgErrorRate    0.0003 (  0.03%)
--     cnsErrorRate    0.0500 (  5.00%)
--
--   Stages to run:
--     assemble HiFi reads.
--
--
-- BEGIN STORE CREATION
----------------------------------------
-- Starting command on Fri Jan 16 01:05:35 2026 with 4557558.984 GB free disk space

    cd .
    ./B3-2.seqStore.sh \
    > ./B3-2.seqStore.err 2>&1

-- Finished on Fri Jan 16 01:13:12 2026 (457 seconds) with 4557848.562 GB free disk space
----------------------------------------
--
-- In sequence store './B3-2.seqStore':
--   Found 277012 reads.
--   Found 4250004113 bases (50 times coverage).
--    Histogram of corrected reads:
--    
--    G=4250004113                       sum of  ||               length     num
--    NG         length     index       lengths  ||                range    seqs
--    ----- ------------ --------- ------------  ||  ------------------- -------
--    00010        25762     15266    425011483  ||       1181-2230        10038|-----------------------------
--    00020        23685     32528    850017137  ||       2231-3280        14932|-------------------------------------------
--    00030        22301     51044   1275021587  ||       3281-4330        13047|--------------------------------------
--    00040        21195     70603   1700019607  ||       4331-5380        11006|--------------------------------
--    00050        20195     91147   2125014112  ||       5381-6430         9397|---------------------------
--    00060        19181    112728   2550006256  ||       6431-7480         8031|-----------------------
--    00070        17955    135584   2975007693  ||       7481-8530         7296|---------------------
--    00080        15753    160593   3400009740  ||       8531-9580         6561|-------------------
--    00090        10155    193254   3825008196  ||       9581-10630        6365|-------------------
--    00100         1181    277012   4250004113  ||      10631-11680        6026|------------------
--    001.000x              277012   4250004113  ||      11681-12730        5865|-----------------
--                                               ||      12731-13780        5582|----------------
--                                               ||      13781-14830        6009|------------------
--                                               ||      14831-15880        7181|---------------------
--                                               ||      15881-16930       10157|-----------------------------
--                                               ||      16931-17980       14366|-----------------------------------------
--                                               ||      17981-19030       19313|-------------------------------------------------------
--                                               ||      19031-20080       22151|---------------------------------------------------------------
--                                               ||      20081-21130       21835|---------------------------------------------------------------
--                                               ||      21131-22180       18877|------------------------------------------------------
--                                               ||      22181-23230       15014|-------------------------------------------
--                                               ||      23231-24280       11441|---------------------------------
--                                               ||      24281-25330        8552|-------------------------
--                                               ||      25331-26380        6133|------------------
--                                               ||      26381-27430        4452|-------------
--                                               ||      27431-28480        2931|---------
--                                               ||      28481-29530        1876|------
--                                               ||      29531-30580        1277|----
--                                               ||      30581-31630         675|--
--                                               ||      31631-32680         363|--
--                                               ||      32681-33730         166|-
--                                               ||      33731-34780          68|-
--                                               ||      34781-35830          15|-
--                                               ||      35831-36880           6|-
--                                               ||      36881-37930           3|-
--                                               ||      37931-38980           0|
--                                               ||      38981-40030           2|-
--                                               ||      40031-41080           0|
--                                               ||      41081-42130           1|-
--                                               ||      42131-43180           2|-
--    
--
-- In sequence store './B3-2.seqStore':
--   Found 277012 reads.
--   Found 4250004113 bases (50 times coverage).
--    Histogram of corrected-trimmed reads:
--    
--    G=4250004113                       sum of  ||               length     num
--    NG         length     index       lengths  ||                range    seqs
--    ----- ------------ --------- ------------  ||  ------------------- -------
--    00010        25762     15266    425011483  ||       1181-2230        10038|-----------------------------
--    00020        23685     32528    850017137  ||       2231-3280        14932|-------------------------------------------
--    00030        22301     51044   1275021587  ||       3281-4330        13047|--------------------------------------
--    00040        21195     70603   1700019607  ||       4331-5380        11006|--------------------------------
--    00050        20195     91147   2125014112  ||       5381-6430         9397|---------------------------
--    00060        19181    112728   2550006256  ||       6431-7480         8031|-----------------------
--    00070        17955    135584   2975007693  ||       7481-8530         7296|---------------------
--    00080        15753    160593   3400009740  ||       8531-9580         6561|-------------------
--    00090        10155    193254   3825008196  ||       9581-10630        6365|-------------------
--    00100         1181    277012   4250004113  ||      10631-11680        6026|------------------
--    001.000x              277012   4250004113  ||      11681-12730        5865|-----------------
--                                               ||      12731-13780        5582|----------------
--                                               ||      13781-14830        6009|------------------
--                                               ||      14831-15880        7181|---------------------
--                                               ||      15881-16930       10157|-----------------------------
--                                               ||      16931-17980       14366|-----------------------------------------
--                                               ||      17981-19030       19313|-------------------------------------------------------
--                                               ||      19031-20080       22151|---------------------------------------------------------------
--                                               ||      20081-21130       21835|---------------------------------------------------------------
--                                               ||      21131-22180       18877|------------------------------------------------------
--                                               ||      22181-23230       15014|-------------------------------------------
--                                               ||      23231-24280       11441|---------------------------------
--                                               ||      24281-25330        8552|-------------------------
--                                               ||      25331-26380        6133|------------------
--                                               ||      26381-27430        4452|-------------
--                                               ||      27431-28480        2931|---------
--                                               ||      28481-29530        1876|------
--                                               ||      29531-30580        1277|----
--                                               ||      30581-31630         675|--
--                                               ||      31631-32680         363|--
--                                               ||      32681-33730         166|-
--                                               ||      33731-34780          68|-
--                                               ||      34781-35830          15|-
--                                               ||      35831-36880           6|-
--                                               ||      36881-37930           3|-
--                                               ||      37931-38980           0|
--                                               ||      38981-40030           2|-
--                                               ||      40031-41080           0|
--                                               ||      41081-42130           1|-
--                                               ||      42131-43180           2|-
--    
--
-- Correction skipped; not enabled.
--
-- Trimming skipped; not enabled.
--
-- BEGIN ASSEMBLY
----------------------------------------
-- Starting command on Fri Jan 16 01:13:12 2026 with 4557848.515 GB free disk space

    cd unitigging/0-mercounts
    ./meryl-configure.sh \
    > ./meryl-configure.err 2>&1

-- Finished on Fri Jan 16 01:13:13 2026 (one second) with 4557848.515 GB free disk space
----------------------------------------
--  segments   memory batches
--  -------- -------- -------
--        01 10.81 GB       2
--        02  5.61 GB       2
--        04  2.97 GB       2
--        06  2.14 GB       2
--        08  1.61 GB       2
--        12  1.07 GB       2
--        16  0.81 GB       2
--        20  0.65 GB       2
--        24  0.54 GB       2
--        32  0.41 GB       2
--        40  0.32 GB       2
--        48  -.-- GB       -  (segment size too small)
--        56  -.-- GB       -  (segment size too small)
--        64  -.-- GB       -  (segment size too small)
--        96  -.-- GB       -  (segment size too small)
--
--  For 277012 reads with 4250004113 bases, limit to 42 batches.
--  Will count kmers using 01 jobs, each using 12 GB and 4 threads.
--
-- Finished stage 'merylConfigure', reset canuIteration.
--
-- Running jobs.  First attempt out of 2.
----------------------------------------
-- Starting 'meryl' concurrent execution on Fri Jan 16 01:13:13 2026 with 4557848.484 GB free disk space (1 processes; 22 concurrently)

    cd unitigging/0-mercounts
    ./meryl-count.sh 1 > ./meryl-count.000001.out 2>&1

-- Finished on Fri Jan 16 01:16:42 2026 (209 seconds) with 4557664.296 GB free disk space
----------------------------------------
-- Found 1 Kmer counting (meryl) outputs.
-- Finished stage 'utg-merylCountCheck', reset canuIteration.
--
-- Running jobs.  First attempt out of 2.
----------------------------------------
-- Starting 'meryl' concurrent execution on Fri Jan 16 01:16:42 2026 with 4557664.265 GB free disk space (1 processes; 22 concurrently)

    cd unitigging/0-mercounts
    ./meryl-process.sh 1 > ./meryl-process.000001.out 2>&1

-- Finished on Fri Jan 16 01:16:48 2026 (6 seconds) with 4557633.218 GB free disk space
----------------------------------------
-- Meryl finished successfully.  Kmer frequency histogram:
--
-- WARNING: gnuplot failed.
--
----------------------------------------
--
--  22-mers                                                                                           Fraction
--    Occurrences   NumMers                                                                         Unique Total
--       1-     1         0                                                                        0.0000 0.0000
--       2-     2    282911 *                                                                      0.0063 0.0002
--       3-     4     97878                                                                        0.0078 0.0003
--       5-     7     33841                                                                        0.0088 0.0003
--       8-    11     18403                                                                        0.0093 0.0004
--      12-    16     25988                                                                        0.0097 0.0004
--      17-    22    140840                                                                        0.0105 0.0006
--      23-    29    730701 ***                                                                    0.0143 0.0017
--      30-    37   5220691 **********************                                                 0.0354 0.0100
--      38-    46  15951236 ********************************************************************** 0.1739 0.0788
--      47-    56  14715038 ****************************************************************       0.5424 0.3022
--      57-    67   3087249 *************                                                          0.8395 0.5173
--      68-    79    634634 **                                                                     0.8948 0.5647
--      80-    92    946738 ****                                                                   0.9089 0.5794
--      93-   106    841077 ***                                                                    0.9301 0.6054
--     107-   121    316528 *                                                                      0.9478 0.6301
--     122-   137    279913 *                                                                      0.9545 0.6407
--     138-   154    259305 *                                                                      0.9607 0.6521
--     155-   172    155958                                                                        0.9663 0.6635
--     173-   191    165569                                                                        0.9697 0.6714
--     192-   211    125902                                                                        0.9733 0.6808
--     212-   232    117380                                                                        0.9761 0.6885
--     233-   254     95576                                                                        0.9787 0.6966
--     255-   277     80427                                                                        0.9808 0.7038
--     278-   301     75089                                                                        0.9825 0.7104
--     302-   326     75531                                                                        0.9842 0.7171
--     327-   352     66373                                                                        0.9858 0.7245
--     353-   379     45581                                                                        0.9873 0.7314
--     380-   407     44386                                                                        0.9883 0.7366
--     408-   436     35952                                                                        0.9893 0.7420
--     437-   466     35274                                                                        0.9901 0.7467
--     467-   497     29560                                                                        0.9909 0.7516
--     498-   529     21508                                                                        0.9915 0.7560
--     530-   562     21517                                                                        0.9920 0.7594
--     563-   596     22825                                                                        0.9925 0.7631
--     597-   631     17052                                                                        0.9930 0.7672
--     632-   667     16309                                                                        0.9933 0.7704
--     668-   704     13965                                                                        0.9937 0.7737
--     705-   742     14322                                                                        0.9940 0.7767
--     743-   781     12134                                                                        0.9943 0.7799
--     782-   821     10240                                                                        0.9946 0.7828
--
--           0 (max occurrences)
--  3216434807 (total mers, non-unique)
--    45115667 (distinct mers, non-unique)
--           0 (unique mers)
-- Finished stage 'meryl-process', reset canuIteration.
--
-- Removing meryl database 'unitigging/0-mercounts/B3-2.ms22'.
--
-- OVERLAPPER (normal) (assembly) erate=0.01
--
----------------------------------------
-- Starting command on Fri Jan 16 01:16:48 2026 with 4557633.203 GB free disk space

    cd unitigging/1-overlapper
    /share/org/YZWL/yzwl_lixg/miniforge3/envs/canu_v.2.3/bin/overlapInCorePartition \
     -S  ../../B3-2.seqStore \
     -hl 160000000 \
     -rl 5000000000 \
     -ol 500 \
     -o  ./B3-2.partition \
    > ./B3-2.partition.err 2>&1

-- Finished on Fri Jan 16 01:16:48 2026 (fast as lightning) with 4557633.187 GB free disk space
----------------------------------------
--
-- Configured 21 overlapInCore jobs.
-- Finished stage 'utg-overlapConfigure', reset canuIteration.
--
-- Running jobs.  First attempt out of 2.
----------------------------------------
-- Starting 'utgovl' concurrent execution on Fri Jan 16 01:16:48 2026 with 4557633.156 GB free disk space (21 processes; 11 concurrently)

    cd unitigging/1-overlapper
    ./overlap.sh 1 > ./overlap.000001.out 2>&1
    ./overlap.sh 2 > ./overlap.000002.out 2>&1
    ./overlap.sh 3 > ./overlap.000003.out 2>&1
    ./overlap.sh 4 > ./overlap.000004.out 2>&1
    ./overlap.sh 5 > ./overlap.000005.out 2>&1
    ./overlap.sh 6 > ./overlap.000006.out 2>&1
    ./overlap.sh 7 > ./overlap.000007.out 2>&1
    ./overlap.sh 8 > ./overlap.000008.out 2>&1
    ./overlap.sh 9 > ./overlap.000009.out 2>&1
    ./overlap.sh 10 > ./overlap.000010.out 2>&1
    ./overlap.sh 11 > ./overlap.000011.out 2>&1
    ./overlap.sh 12 > ./overlap.000012.out 2>&1
    ./overlap.sh 13 > ./overlap.000013.out 2>&1
    ./overlap.sh 14 > ./overlap.000014.out 2>&1
    ./overlap.sh 15 > ./overlap.000015.out 2>&1
    ./overlap.sh 16 > ./overlap.000016.out 2>&1
    ./overlap.sh 17 > ./overlap.000017.out 2>&1
    ./overlap.sh 18 > ./overlap.000018.out 2>&1
    ./overlap.sh 19 > ./overlap.000019.out 2>&1
    ./overlap.sh 20 > ./overlap.000020.out 2>&1
    ./overlap.sh 21 > ./overlap.000021.out 2>&1

-- Finished on Fri Jan 16 01:44:00 2026 (1632 seconds) with 4559742.093 GB free disk space
----------------------------------------
-- Found 21 overlapInCore output files.
--
-- overlapInCore compute 'unitigging/1-overlapper':
--   kmer hits
--     with no overlap       1310726288  37.5238095 +- 38870495.609
--     with an overlap         27934545  6.42857143 +- 774295.55
--
--   overlaps                  27934545  6.42857143 +- 774295.55
--     contained                8039421  .571428571 +- 223545.416
--     dovetail                19895124  .857142857 +- 555449.637
--
--   overlaps rejected
--     multiple per pair              0           0 +- 0
--     bad short window               0           0 +- 0
--     bad long window                0           0 +- 0
-- Finished stage 'utg-overlapCheck', reset canuIteration.
----------------------------------------
-- Starting command on Fri Jan 16 01:44:00 2026 with 4559742.078 GB free disk space

    cd unitigging
    /share/org/YZWL/yzwl_lixg/miniforge3/envs/canu_v.2.3/bin/ovStoreConfig \
     -S ../B3-2.seqStore \
     -M 4-8 \
     -L ./1-overlapper/ovljob.files \
     -create ./B3-2.ovlStore.config \
     > ./B3-2.ovlStore.config.txt \
    2> ./B3-2.ovlStore.config.err

-- Finished on Fri Jan 16 01:44:00 2026 (like a bat out of hell) with 4559742.062 GB free disk space
----------------------------------------
--
-- Creating overlap store unitigging/B3-2.ovlStore using:
--      1 bucket
--      1 slice
--        using at most 2 GB memory each
--
-- Running jobs.  First attempt out of 2.
----------------------------------------
-- Starting 'ovS' concurrent execution on Fri Jan 16 01:44:00 2026 with 4559742.046 GB free disk space (1 processes; 62 concurrently)

    cd unitigging
    ./B3-2.ovlStore.sh 1 > ./B3-2.ovlStore.000001.out 2>&1

-- Finished on Fri Jan 16 01:44:15 2026 (15 seconds) with 4559710.89 GB free disk space
----------------------------------------
-- Checking store.
----------------------------------------
-- Starting command on Fri Jan 16 01:44:15 2026 with 4559710.89 GB free disk space

    cd unitigging
    /share/org/YZWL/yzwl_lixg/miniforge3/envs/canu_v.2.3/bin/ovStoreDump \
     -S ../B3-2.seqStore \
     -O  ./B3-2.ovlStore \
     -counts \
     > ./B3-2.ovlStore/counts.dat 2> ./B3-2.ovlStore/counts.err

-- Finished on Fri Jan 16 01:44:15 2026 (furiously fast) with 4559710.859 GB free disk space
----------------------------------------
--
-- Overlap store 'unitigging/B3-2.ovlStore' successfully constructed.
-- Found 55869090 overlaps for 268874 reads; 1665503 reads have no overlaps.
--
--
-- Purged 0.629 GB in 63 overlap output files.
----------------------------------------
-- Starting command on Fri Jan 16 01:44:16 2026 with 4559710.859 GB free disk space

    cd unitigging
    /share/org/YZWL/yzwl_lixg/miniforge3/envs/canu_v.2.3/bin/ovStoreStats \
     -C 50 \
     -S ../B3-2.seqStore \
     -O  ./B3-2.ovlStore \
     -o  ./B3-2.ovlStore \
     > ./B3-2.ovlStore.summary.err 2>&1

-- Finished on Fri Jan 16 01:44:24 2026 (8 seconds) with 4559710.843 GB free disk space
----------------------------------------
--
-- Overlap store 'unitigging/B3-2.ovlStore' contains:
--
--   category            reads     %          read length        feature size or coverage  analysis
--   ----------------  -------  -------  ----------------------  ------------------------  --------------------
--   middle-missing        148    0.05    13717.98 +- 6457.49        571.32 +- 546.37     (bad trimming)
--   middle-hump            11    0.00    11966.91 +- 5224.65       5608.55 +- 3002.47    (bad trimming)
--   no-5-prime            421    0.15    12396.10 +- 5913.94       1859.54 +- 2595.71    (bad trimming)
--   no-3-prime            380    0.14    11892.05 +- 6139.47       2139.64 +- 2979.60    (bad trimming)
--   
--   low-coverage         1533    0.55     9394.84 +- 5808.75          6.23 +- 3.68       (easy to assemble, potential for lower quality consensus)
--   unique             222634   80.37    11820.54 +- 5963.95         45.65 +- 8.27       (easy to assemble, perfect, yay)
--   repeat-cont         18825    6.80     9543.72 +- 5428.43        937.44 +- 779.03     (potential for consensus errors, no impact on assembly)
--   repeat-dove           268    0.10    20398.09 +- 2050.71        420.46 +- 478.42     (hard to assemble, likely won't assemble correctly or even at all)
--   
--   span-repeat          3158    1.14    13434.07 +- 5187.83       3141.67 +- 3759.35    (read spans a large repeat, usually easy to assemble)
--   uniq-repeat-cont    14958    5.40    12212.77 +- 4867.32                             (should be uniquely placed, low potential for consensus errors, no impact on assembly)
--   uniq-repeat-dove     2896    1.05    18643.48 +- 2578.73                             (will end contigs, potential to misassemble)
--   uniq-anchor          3642    1.31    13059.36 +- 4782.91       7611.62 +- 4907.76    (repeat read, with unique section, probable bad read)
-- Finished stage 'utg-createOverlapStore', reset canuIteration.
--
-- Loading read lengths.
-- Loading number of overlaps per read.
--
-- Configure RED for 16gb memory.
--                   Batches of at most (unlimited) reads.
--                                      500000000 bases.
--                   Expecting evidence of at most 536870912 bases per iteration.
--
--           Total                                               Reads                 Olaps Evidence
--    Job   Memory      Read Range         Reads        Bases   Memory        Olaps   Memory   Memory  (Memory in MB)
--   ---- -------- ------------------- --------- ------------ -------- ------------ -------- --------
--      1 16385.06         1-46607          6679    108950094 13299.78      1160665    13.28  1024.00
--      2 16384.82     46608-89674          6205    108939095 13298.42      1257740    14.39  1024.00
--      3 16386.38     89675-133298         6219    108914909 13295.47      1652467    18.91  1024.00
--      4 16384.28    133299-188214         7975    108959620 13300.99       986851    11.29  1024.00
--      5 16385.45    188215-241843         7817    108908521 13294.74      1634358    18.70  1024.00
--      6 16385.04    241844-284328         6096    108896561 13293.23      1730937    19.81  1024.00
--      7 16386.19    284329-336394         7438    108986397 13304.24       869573     9.95  1024.00
--      8 16384.72    336395-394245         8540    108883137 13291.67      1839909    21.06  1024.00
--      9 16385.25    394246-437262         6037    108905083 13294.27      1658658    18.98  1024.00
--     10 16384.62    437263-485708         6929    108968133 13301.99       928818    10.63  1024.00
--     11 16384.11    485709-549074         9071    108875212 13290.72      1869768    21.40  1024.00
--     12 16385.51    549075-591069         5954    108913913 13295.34      1587669    18.17  1024.00
--     13 16384.69    591070-638861         6710    108958924 13300.86      1033682    11.83  1024.00
--     14 16384.39    638862-702833         9302    108882803 13291.65      1812035    20.74  1024.00
--     15 16384.48    702834-743734         5886    108924194 13296.60      1387808    15.88  1024.00
--     16 16385.06    743735-789951         6386    108955593 13300.44      1102075    12.61  1024.00
--     17 16385.68    789952-855388         9351    108892424 13292.83      1821849    20.85  1024.00
--     18 16384.20    855389-896230         5812    108912786 13295.20      1485821    17.00  1024.00
--     19 16385.17    896231-940491         6319    108954978 13300.37      1118368    12.80  1024.00
--     20 16384.76    940492-1007950        9586    108879645 13291.27      1877542    21.49  1024.00
--     21 16385.46   1007951-1048320        5747    108970899 13302.29       975943    11.17  1024.00
--     22 16385.71   1048321-1091700        6115    108927322 13296.98      1461544    16.73  1024.00
--     23 16384.69   1091701-1147351        7945    108954294 13300.33      1079413    12.35  1024.00
--     24 16385.44   1147352-1195096        6798    108902405 13293.96      1701600    19.47  1024.00
--     25 16385.86   1195097-1237364        6066    108924149 13296.60      1508698    17.27  1024.00
--     26 16385.32   1237365-1289743        7454    108978371 13303.26       879271    10.06  1024.00
--     27 16385.66   1289744-1343200        7588    108907872 13294.66      1660668    19.00  1024.00
--     28 16385.69   1343201-1385350        5957    108891843 13292.65      1839028    21.05  1024.00
--     29 16385.77   1385351-1436141        7115    108981521 13303.63       885743    10.14  1024.00
--     30 16386.78   1436142-1492882        8126    108909715 13294.90      1737007    19.88  1024.00
--     31 16385.25   1492883-1534583        5972    108901567 13293.84      1696129    19.41  1024.00
--     32 16384.12   1534584-1581401        6751    108964291 13301.52       926209    10.60  1024.00
--     33 16386.96   1581402-1641206        8572    108900925 13293.84      1845380    21.12  1024.00
--     34 16384.32   1641207-1680816        5824    108916124 13295.61      1460309    16.71  1024.00
--     35 16385.80   1680817-1725103        6384    108959093 13300.87      1129526    12.93  1024.00
--     36 16385.12   1725104-1787556        8954    108880816 13291.40      1898330    21.72  1024.00
--     37 16385.06   1787557-1827354        5815    108918275 13295.87      1501696    17.19  1024.00
--     38 16384.74   1827355-1870656        6285    108953468 13300.18      1096991    12.55  1024.00
--     39 16385.33   1870657-1933209        9073    108897209 13293.40      1741449    19.93  1024.00
--     40  3304.49   1933210-1934377         159      1901932   232.17        27563     0.32  1024.00
--   ---- -------- ------------------- --------- ------------ -------- ------------ -------- --------
--                                                 4250004113              55869090
-- Finished stage 'readErrorDetectionConfigure', reset canuIteration.
--
-- Running jobs.  First attempt out of 2.
----------------------------------------
-- Starting 'red' concurrent execution on Fri Jan 16 01:44:31 2026 with 4559710.796 GB free disk space (40 processes; 22 concurrently)

    cd unitigging/3-overlapErrorAdjustment
    ./red.sh 1 > ./red.000001.out 2>&1
    ./red.sh 2 > ./red.000002.out 2>&1
    ./red.sh 3 > ./red.000003.out 2>&1
    ./red.sh 4 > ./red.000004.out 2>&1
    ./red.sh 5 > ./red.000005.out 2>&1
    ./red.sh 6 > ./red.000006.out 2>&1
    ./red.sh 7 > ./red.000007.out 2>&1
    ./red.sh 8 > ./red.000008.out 2>&1
    ./red.sh 9 > ./red.000009.out 2>&1
    ./red.sh 10 > ./red.000010.out 2>&1
    ./red.sh 11 > ./red.000011.out 2>&1
    ./red.sh 12 > ./red.000012.out 2>&1
    ./red.sh 13 > ./red.000013.out 2>&1
    ./red.sh 14 > ./red.000014.out 2>&1
    ./red.sh 15 > ./red.000015.out 2>&1
    ./red.sh 16 > ./red.000016.out 2>&1
    ./red.sh 17 > ./red.000017.out 2>&1
    ./red.sh 18 > ./red.000018.out 2>&1
    ./red.sh 19 > ./red.000019.out 2>&1
    ./red.sh 20 > ./red.000020.out 2>&1
    ./red.sh 21 > ./red.000021.out 2>&1
    ./red.sh 22 > ./red.000022.out 2>&1
    ./red.sh 23 > ./red.000023.out 2>&1
    ./red.sh 24 > ./red.000024.out 2>&1
    ./red.sh 25 > ./red.000025.out 2>&1
    ./red.sh 26 > ./red.000026.out 2>&1
    ./red.sh 27 > ./red.000027.out 2>&1
    ./red.sh 28 > ./red.000028.out 2>&1
    ./red.sh 29 > ./red.000029.out 2>&1
    ./red.sh 30 > ./red.000030.out 2>&1
    ./red.sh 31 > ./red.000031.out 2>&1
    ./red.sh 32 > ./red.000032.out 2>&1
    ./red.sh 33 > ./red.000033.out 2>&1
    ./red.sh 34 > ./red.000034.out 2>&1
    ./red.sh 35 > ./red.000035.out 2>&1
    ./red.sh 36 > ./red.000036.out 2>&1
    ./red.sh 37 > ./red.000037.out 2>&1
    ./red.sh 38 > ./red.000038.out 2>&1
    ./red.sh 39 > ./red.000039.out 2>&1
    ./red.sh 40 > ./red.000040.out 2>&1

-- Finished on Fri Jan 16 01:57:19 2026 (768 seconds) with 4559091.843 GB free disk space
----------------------------------------
-- Found 40 read error detection output files.
-- Finished stage 'readErrorDetectionCheck', reset canuIteration.
--
-- Loading read lengths.
-- Loading number of overlaps per read.
--
-- Configure OEA for 8gb memory.
--                   Batches of at most (unlimited) reads.
--                                      300000000 bases.
--
--           Total                                               Reads                 Olaps  Adjusts
--    Job   Memory      Read Range         Reads        Bases   Memory        Olaps   Memory   Memory  (Memory in MB)
--   ---- -------- ------------------- --------- ------------ -------- ------------ -------- --------
--      1  2835.30         1-122141        17483    300015992   294.65      3839756   117.18   375.47
--      2  2837.24    122142-263032        20460    300003743   294.73      3900652   119.04   375.47
--      3  2835.16    263033-405394        20567    300005434   294.74      3832433   116.96   375.47
--      4  2841.23    405395-549727        20594    300016657   294.75      4030927   123.01   375.47
--      5  2847.32    549728-693862        20551    300015281   294.74      4230646   129.11   375.47
--      6  2814.16    693863-821248        18063    300003090   294.66      3146843    96.03   375.47
--      7  2845.49    821249-954713        18998    300003063   294.68      4172457   127.33   375.47
--      8  2843.94    954714-1093258       19684    300007795   294.71      4120901   125.76   375.47
--      9  2840.51   1093259-1228101       19274    300016932   294.71      4008716   122.34   375.47
--     10  2838.71   1228102-1365675       19539    300016024   294.71      3949384   120.53   375.47
--     11  2832.65   1365676-1505008       19740    300002492   294.71      3750969   114.47   375.47
--     12  2842.31   1505009-1643329       19853    300013949   294.72      4067006   124.12   375.47
--     13  2848.84   1643330-1779825       19767    300006416   294.71      4281252   130.65   375.47
--     14  2816.73   1779826-1898771       17306    300002250   294.63      3231936    98.63   375.47
--     15  2519.02   1898772-1934377        5133     49874995    55.72      1305212    39.83   375.47
--   ---- -------- ------------------- --------- ------------ -------- ------------ -------- --------
--                                                 4250004113              55869090
-- Finished stage 'overlapErrorAdjustmentConfigure', reset canuIteration.
--
-- Running jobs.  First attempt out of 2.
----------------------------------------
-- Starting 'oea' concurrent execution on Fri Jan 16 01:57:27 2026 with 4559091.375 GB free disk space (15 processes; 62 concurrently)

    cd unitigging/3-overlapErrorAdjustment
    ./oea.sh 1 > ./oea.000001.out 2>&1
    ./oea.sh 2 > ./oea.000002.out 2>&1
    ./oea.sh 3 > ./oea.000003.out 2>&1
    ./oea.sh 4 > ./oea.000004.out 2>&1
    ./oea.sh 5 > ./oea.000005.out 2>&1
    ./oea.sh 6 > ./oea.000006.out 2>&1
    ./oea.sh 7 > ./oea.000007.out 2>&1
    ./oea.sh 8 > ./oea.000008.out 2>&1
    ./oea.sh 9 > ./oea.000009.out 2>&1
    ./oea.sh 10 > ./oea.000010.out 2>&1
    ./oea.sh 11 > ./oea.000011.out 2>&1
    ./oea.sh 12 > ./oea.000012.out 2>&1
    ./oea.sh 13 > ./oea.000013.out 2>&1
    ./oea.sh 14 > ./oea.000014.out 2>&1
    ./oea.sh 15 > ./oea.000015.out 2>&1

-- Finished on Fri Jan 16 02:34:03 2026 (2196 seconds) with 4559122.25 GB free disk space
----------------------------------------
-- Found 15 overlap error adjustment output files.
-- Finished stage 'overlapErrorAdjustmentCheck', reset canuIteration.
----------------------------------------
-- Starting command on Fri Jan 16 02:34:03 2026 with 4559122.234 GB free disk space

    cd unitigging/3-overlapErrorAdjustment
    /share/org/YZWL/yzwl_lixg/miniforge3/envs/canu_v.2.3/bin/loadErates \
      -S ../../B3-2.seqStore \
      -O ../B3-2.ovlStore \
      -L ./oea.files \
    > ./oea.apply.err 2>&1

-- Finished on Fri Jan 16 02:34:03 2026 (furiously fast) with 4559122.109 GB free disk space
----------------------------------------
-- No report available.
-- Finished stage 'updateOverlapStore', reset canuIteration.
-- Finished stage 'unitig', reset canuIteration.
--
-- Running jobs.  First attempt out of 2.
----------------------------------------
-- Starting 'bat' concurrent execution on Fri Jan 16 02:34:03 2026 with 4559122.062 GB free disk space (1 processes; 1 concurrently)

    cd unitigging/4-unitigger
    ./unitigger.sh 1 > ./unitigger.000001.out 2>&1

-- Finished on Fri Jan 16 02:34:18 2026 (15 seconds) with 4559103.812 GB free disk space
----------------------------------------
-- Unitigger finished successfully.
--  
--  ERROR RATES
--  -----------
--                                                   --------threshold------
--  302105                       fraction error      fraction        percent
--  samples                              (1e-5)         error          error
--                   --------------------------      --------       --------
--  command line (-eg)                           ->     30.00        0.0300%
--  command line (-ef)                           ->  -----.--      ---.----%
--  command line (-eM)                           ->     30.00        0.0300%
--  mean + std.dev       0.39 +-  12 *     2.85  ->     34.58        0.0346%
--  median + mad         0.00 +-  12 *     0.00  ->      0.00        0.0000%
--  90th percentile                              ->      1.00        0.0010%  (enabled)
--  
--  BEST EDGE FILTERING
--  -------------------
--  At graph threshold 0.0300%, reads:
--    available to have edges:        49319
--    with at least one edge:         39040
--  
--  At max threshold 0.0300%, reads:
--    available to have edges:        49319
--    with at least one edge:         39040
--  
--  At tight threshold 0.0010%, reads with:
--    both edges below error threshold:     33938  (80.00% minReadsBest threshold = 31232)
--    one  edge  above error threshold:      3749
--    both edges above error threshold:      1353
--    at least one edge:                    39040
--  
--  At loose threshold 0.0300%, reads with:
--    both edges below error threshold:     39040  (80.00% minReadsBest threshold = 31232)
--    one  edge  above error threshold:         0
--    both edges above error threshold:         0
--    at least one edge:                    39040
--  
--  
--  INITIAL EDGES
--  -------- ----------------------------------------
--    222002 reads are contained
--   1678814 reads have no best edges (singleton)
--       415 reads have only one best edge (spur) 
--                223 are mutual best
--     33146 reads have two best edges 
--                873 have one mutual best edge
--              31921 have two mutual best edges
--  
--  
--  FINAL EDGES
--  -------- ----------------------------------------
--    222002 reads are contained
--   1679208 reads have no best edges (singleton)
--       296 reads have only one best edge (spur) 
--                237 are mutual best
--     32871 reads have two best edges 
--                693 have one mutual best edge
--              31906 have two mutual best edges
--  
--  
--  EDGE FILTERING
--  -------- ------------------------------------------
--         0 reads are ignored
--     11003 reads have a gap in overlap coverage
--       175 reads have lopsided best edges
-- Found, in version 1, after unitig construction:
--   contigs:      115 sequences, total length 68656157 bp (including 120 repeats of total length 2851960 bp).
--   bubbles:      169 sequences, total length 5180830 bp.
--   unassembled:  21619 sequences, total length 238130617 bp.
--
-- Contig sizes based on genome size 85mbp:
--
--            NG (bp)  LG (contigs)    sum (bp)
--         ----------  ------------  ----------
--     10     5215836             2    11366057
--     20     4299372             4    20275367
--     30     3788910             6    28346641
--     40     3431999             8    35392598
--     50     2505516            11    43879308
--     60     1799857            15    52140465
--     70     1061458            21    60258951
--     80       22372            78    68002578
--
-- Finished stage 'unitigCheck', reset canuIteration.
----------------------------------------
-- Starting command on Fri Jan 16 02:34:18 2026 with 4559103.796 GB free disk space

    cd unitigging
    /share/org/YZWL/yzwl_lixg/miniforge3/envs/canu_v.2.3/bin/utgcns \
      -S ../B3-2.seqStore \
      -T  ./B3-2.ctgStore 1 \
      -partition 0.8 1.5 0.1 \
    > ./B3-2.ctgStore/partitioning.log 2>&1

-- Finished on Fri Jan 16 02:34:27 2026 (9 seconds) with 4559102.531 GB free disk space
----------------------------------------
-- Using slow alignment for consensus (iteration '0').
-- Configured 11 consensus jobs.
-- Finished stage 'consensusConfigure', reset canuIteration.
--
-- Local: cns        9.250 GB    8 CPUs x  11 jobs   101.750 GB  88 CPUs  (consensus)
--
--
-- Running jobs.  First attempt out of 2.
----------------------------------------
-- Starting 'cns' concurrent execution on Fri Jan 16 02:34:27 2026 with 4559102.5 GB free disk space (11 processes; 11 concurrently)

    cd unitigging/5-consensus
    ./consensus.sh 1 > ./consensus.000001.out 2>&1
    ./consensus.sh 2 > ./consensus.000002.out 2>&1
    ./consensus.sh 3 > ./consensus.000003.out 2>&1
    ./consensus.sh 4 > ./consensus.000004.out 2>&1
    ./consensus.sh 5 > ./consensus.000005.out 2>&1
    ./consensus.sh 6 > ./consensus.000006.out 2>&1
    ./consensus.sh 7 > ./consensus.000007.out 2>&1
    ./consensus.sh 8 > ./consensus.000008.out 2>&1
    ./consensus.sh 9 > ./consensus.000009.out 2>&1
    ./consensus.sh 10 > ./consensus.000010.out 2>&1
    ./consensus.sh 11 > ./consensus.000011.out 2>&1

-- Finished on Fri Jan 16 02:41:02 2026 (395 seconds) with 4559096.718 GB free disk space
----------------------------------------
-- Using slow alignment for consensus (iteration '1').
-- Configured 11 consensus jobs.
-- All 11 consensus jobs finished successfully.
-- Finished stage 'consensusCheck', reset canuIteration.
-- Using slow alignment for consensus (iteration '0').
-- Configured 11 consensus jobs.
----------------------------------------
-- Starting command on Fri Jan 16 02:41:02 2026 with 4559096.671 GB free disk space

    cd unitigging
    /share/org/YZWL/yzwl_lixg/miniforge3/envs/canu_v.2.3/bin/tgStoreLoad \
      -S ../B3-2.seqStore \
      -T  ./B3-2.ctgStore 2 \
      -L ./5-consensus/ctgcns.files \
    > ./5-consensus/ctgcns.files.ctgStoreLoad.err 2>&1

-- Finished on Fri Jan 16 02:41:04 2026 (2 seconds) with 4559095.812 GB free disk space
----------------------------------------
----------------------------------------
-- Starting command on Fri Jan 16 02:41:04 2026 with 4559095.812 GB free disk space

    cd unitigging
    /share/org/YZWL/yzwl_lixg/miniforge3/envs/canu_v.2.3/bin/tgTigDisplay \
      -S ../B3-2.seqStore \
      -b \
      -o ../B3-2.contigs.unsorted.bam \
      -L ./5-consensus/ctgcns.files \
    > ./5-consensus/ctgcns.files.contigs.bam.err 2>&1

-- Finished on Fri Jan 16 02:43:50 2026 (166 seconds) with 4558996.593 GB free disk space
----------------------------------------
----------------------------------------
-- Starting command on Fri Jan 16 02:43:50 2026 with 4558996.593 GB free disk space

    cd .
    samtools sort \
      --write-index \
      --threads 2 \
      -o ./B3-2.contigs.bam ./B3-2.contigs.unsorted.bam \
    > ./ctgcns.bam.err 2>&1

-- Finished on Fri Jan 16 02:44:54 2026 (64 seconds) with 4558975.906 GB free disk space
----------------------------------------
-- Purging consensus output after loading to ctgStore.
-- Purged 11 .cns outputs.
----------------------------------------
-- Starting command on Fri Jan 16 02:44:54 2026 with 4558977.875 GB free disk space

    cd unitigging
    /share/org/YZWL/yzwl_lixg/miniforge3/envs/canu_v.2.3/bin/tgStoreDump \
      -S ../B3-2.seqStore \
      -T ./B3-2.ctgStore 2 \
      -sizes -s 85000000 \
    > ./B3-2.ctgStore/seqDB.v002.sizes.txt
ZERO length suplied to intervalList::add(), ignoring interval.
ZERO length suplied to intervalList::add(), ignoring interval.
ZERO length suplied to intervalList::add(), ignoring interval.
ZERO length suplied to intervalList::add(), ignoring interval.
ZERO length suplied to intervalList::add(), ignoring interval.
ZERO length suplied to intervalList::add(), ignoring interval.
ZERO length suplied to intervalList::add(), ignoring interval.
ZERO length suplied to intervalList::add(), ignoring interval.
ZERO length suplied to intervalList::add(), ignoring interval.
ZERO length suplied to intervalList::add(), ignoring interval.
ZERO length suplied to intervalList::add(), ignoring interval.
ZERO length suplied to intervalList::add(), ignoring interval.
ZERO length suplied to intervalList::add(), ignoring interval.
ZERO length suplied to intervalList::add(), ignoring interval.
ZERO length suplied to intervalList::add(), ignoring interval.
ZERO length suplied to intervalList::add(), ignoring interval.
ZERO length suplied to intervalList::add(), ignoring interval.
ZERO length suplied to intervalList::add(), ignoring interval.
ZERO length suplied to intervalList::add(), ignoring interval.
ZERO length suplied to intervalList::add(), ignoring interval.
ZERO length suplied to intervalList::add(), ignoring interval.
ZERO length suplied to intervalList::add(), ignoring interval.
ZERO length suplied to intervalList::add(), ignoring interval.
ZERO length suplied to intervalList::add(), ignoring interval.
ZERO length suplied to intervalList::add(), ignoring interval.
ZERO length suplied to intervalList::add(), ignoring interval.
ZERO length suplied to intervalList::add(), ignoring interval.
ZERO length suplied to intervalList::add(), ignoring interval.
ZERO length suplied to intervalList::add(), ignoring interval.
ZERO length suplied to intervalList::add(), ignoring interval.
ZERO length suplied to intervalList::add(), ignoring interval.
ZERO length suplied to intervalList::add(), ignoring interval.
ZERO length suplied to intervalList::add(), ignoring interval.
ZERO length suplied to intervalList::add(), ignoring interval.
ZERO length suplied to intervalList::add(), ignoring interval.
ZERO length suplied to intervalList::add(), ignoring interval.
ZERO length suplied to intervalList::add(), ignoring interval.
ZERO length suplied to intervalList::add(), ignoring interval.
ZERO length suplied to intervalList::add(), ignoring interval.
ZERO length suplied to intervalList::add(), ignoring interval.
ZERO length suplied to intervalList::add(), ignoring interval.
ZERO length suplied to intervalList::add(), ignoring interval.
ZERO length suplied to intervalList::add(), ignoring interval.
ZERO length suplied to intervalList::add(), ignoring interval.
ZERO length suplied to intervalList::add(), ignoring interval.
ZERO length suplied to intervalList::add(), ignoring interval.
ZERO length suplied to intervalList::add(), ignoring interval.
ZERO length suplied to intervalList::add(), ignoring interval.
ZERO length suplied to intervalList::add(), ignoring interval.
ZERO length suplied to intervalList::add(), ignoring interval.
ZERO length suplied to intervalList::add(), ignoring interval.
ZERO length suplied to intervalList::add(), ignoring interval.
ZERO length suplied to intervalList::add(), ignoring interval.
ZERO length suplied to intervalList::add(), ignoring interval.
ZERO length suplied to intervalList::add(), ignoring interval.
ZERO length suplied to intervalList::add(), ignoring interval.
ZERO length suplied to intervalList::add(), ignoring interval.
ZERO length suplied to intervalList::add(), ignoring interval.
ZERO length suplied to intervalList::add(), ignoring interval.
ZERO length suplied to intervalList::add(), ignoring interval.
ZERO length suplied to intervalList::add(), ignoring interval.
ZERO length suplied to intervalList::add(), ignoring interval.
ZERO length suplied to intervalList::add(), ignoring interval.
ZERO length suplied to intervalList::add(), ignoring interval.
ZERO length suplied to intervalList::add(), ignoring interval.
ZERO length suplied to intervalList::add(), ignoring interval.
ZERO length suplied to intervalList::add(), ignoring interval.
ZERO length suplied to intervalList::add(), ignoring interval.
ZERO length suplied to intervalList::add(), ignoring interval.
ZERO length suplied to intervalList::add(), ignoring interval.
ZERO length suplied to intervalList::add(), ignoring interval.

-- Finished on Fri Jan 16 02:44:54 2026 (lickety-split) with 4558977.875 GB free disk space
----------------------------------------
-- Found, in version 2, after consensus generation:
--   contigs:      115 sequences, total length 89643310 bp (including 120 repeats of total length 3952401 bp).
--   bubbles:      169 sequences, total length 6892436 bp.
--   unassembled:  21619 sequences, total length 325928723 bp.
--
-- Contig sizes based on genome size 85mbp:
--
--            NG (bp)  LG (contigs)    sum (bp)
--         ----------  ------------  ----------
--     10     6776547             2    14762990
--     20     5984053             3    20747043
--     30     5598391             4    26345434
--     40     4930699             6    36849703
--     50     4474385             8    46043120
--     60     3586641            10    53849080
--     70     3044092            12    60153901
--     80     2037651            16    69916186
--     90     1580778            20    77086328
--    100      574352            28    85415006
--
-- Finished stage 'consensusLoad', reset canuIteration.
----------------------------------------
-- Starting command on Fri Jan 16 02:44:54 2026 with 4558977.859 GB free disk space

    cd .
    /share/org/YZWL/yzwl_lixg/miniforge3/envs/canu_v.2.3/bin/tgStoreDump \
      -S ./B3-2.seqStore \
      -T ./unitigging/B3-2.ctgStore 2 \
      -o ./B3-2.contigs \
      -layout \
    > ./B3-2.contigs.layout.err 2>&1

-- Finished on Fri Jan 16 02:44:55 2026 (one second) with 4558977.796 GB free disk space
----------------------------------------
----------------------------------------
-- Starting command on Fri Jan 16 02:44:55 2026 with 4558977.796 GB free disk space

    cd .
    /share/org/YZWL/yzwl_lixg/miniforge3/envs/canu_v.2.3/bin/tgStoreDump \
      -S ./B3-2.seqStore \
      -T ./unitigging/B3-2.ctgStore 2 \
      -consensus -fasta \
      -unassembled \
    > ./B3-2.unassembled.fasta
    2> ./B3-2.unassembled.err
ZERO length suplied to intervalList::add(), ignoring interval.
ZERO length suplied to intervalList::add(), ignoring interval.
ZERO length suplied to intervalList::add(), ignoring interval.
ZERO length suplied to intervalList::add(), ignoring interval.
ZERO length suplied to intervalList::add(), ignoring interval.
ZERO length suplied to intervalList::add(), ignoring interval.
ZERO length suplied to intervalList::add(), ignoring interval.
ZERO length suplied to intervalList::add(), ignoring interval.
ZERO length suplied to intervalList::add(), ignoring interval.
ZERO length suplied to intervalList::add(), ignoring interval.
ZERO length suplied to intervalList::add(), ignoring interval.
ZERO length suplied to intervalList::add(), ignoring interval.
ZERO length suplied to intervalList::add(), ignoring interval.
ZERO length suplied to intervalList::add(), ignoring interval.
ZERO length suplied to intervalList::add(), ignoring interval.
ZERO length suplied to intervalList::add(), ignoring interval.
ZERO length suplied to intervalList::add(), ignoring interval.
ZERO length suplied to intervalList::add(), ignoring interval.
ZERO length suplied to intervalList::add(), ignoring interval.
ZERO length suplied to intervalList::add(), ignoring interval.
ZERO length suplied to intervalList::add(), ignoring interval.
ZERO length suplied to intervalList::add(), ignoring interval.
ZERO length suplied to intervalList::add(), ignoring interval.
ZERO length suplied to intervalList::add(), ignoring interval.
ZERO length suplied to intervalList::add(), ignoring interval.
ZERO length suplied to intervalList::add(), ignoring interval.
ZERO length suplied to intervalList::add(), ignoring interval.
ZERO length suplied to intervalList::add(), ignoring interval.
ZERO length suplied to intervalList::add(), ignoring interval.
ZERO length suplied to intervalList::add(), ignoring interval.
ZERO length suplied to intervalList::add(), ignoring interval.
ZERO length suplied to intervalList::add(), ignoring interval.
ZERO length suplied to intervalList::add(), ignoring interval.
ZERO length suplied to intervalList::add(), ignoring interval.
ZERO length suplied to intervalList::add(), ignoring interval.
ZERO length suplied to intervalList::add(), ignoring interval.
ZERO length suplied to intervalList::add(), ignoring interval.
ZERO length suplied to intervalList::add(), ignoring interval.
ZERO length suplied to intervalList::add(), ignoring interval.
ZERO length suplied to intervalList::add(), ignoring interval.
ZERO length suplied to intervalList::add(), ignoring interval.
ZERO length suplied to intervalList::add(), ignoring interval.
ZERO length suplied to intervalList::add(), ignoring interval.
ZERO length suplied to intervalList::add(), ignoring interval.
ZERO length suplied to intervalList::add(), ignoring interval.
ZERO length suplied to intervalList::add(), ignoring interval.
ZERO length suplied to intervalList::add(), ignoring interval.
ZERO length suplied to intervalList::add(), ignoring interval.
ZERO length suplied to intervalList::add(), ignoring interval.
ZERO length suplied to intervalList::add(), ignoring interval.
ZERO length suplied to intervalList::add(), ignoring interval.
ZERO length suplied to intervalList::add(), ignoring interval.
ZERO length suplied to intervalList::add(), ignoring interval.
ZERO length suplied to intervalList::add(), ignoring interval.
ZERO length suplied to intervalList::add(), ignoring interval.
ZERO length suplied to intervalList::add(), ignoring interval.
ZERO length suplied to intervalList::add(), ignoring interval.
ZERO length suplied to intervalList::add(), ignoring interval.
ZERO length suplied to intervalList::add(), ignoring interval.
ZERO length suplied to intervalList::add(), ignoring interval.
ZERO length suplied to intervalList::add(), ignoring interval.
ZERO length suplied to intervalList::add(), ignoring interval.
ZERO length suplied to intervalList::add(), ignoring interval.
ZERO length suplied to intervalList::add(), ignoring interval.
ZERO length suplied to intervalList::add(), ignoring interval.
ZERO length suplied to intervalList::add(), ignoring interval.
ZERO length suplied to intervalList::add(), ignoring interval.
ZERO length suplied to intervalList::add(), ignoring interval.
ZERO length suplied to intervalList::add(), ignoring interval.
ZERO length suplied to intervalList::add(), ignoring interval.
ZERO length suplied to intervalList::add(), ignoring interval.

-- Finished on Fri Jan 16 02:44:56 2026 (one second) with 4558977.468 GB free disk space
----------------------------------------
----------------------------------------
-- Starting command on Fri Jan 16 02:44:56 2026 with 4558977.468 GB free disk space

    cd .
    /share/org/YZWL/yzwl_lixg/miniforge3/envs/canu_v.2.3/bin/tgStoreDump \
      -S ./B3-2.seqStore \
      -T ./unitigging/B3-2.ctgStore 2 \
      -consensus -fasta \
      -contigs \
    > ./B3-2.contigs.fasta
    2> ./B3-2.contigs.err
ZERO length suplied to intervalList::add(), ignoring interval.
ZERO length suplied to intervalList::add(), ignoring interval.
ZERO length suplied to intervalList::add(), ignoring interval.
ZERO length suplied to intervalList::add(), ignoring interval.
ZERO length suplied to intervalList::add(), ignoring interval.
ZERO length suplied to intervalList::add(), ignoring interval.
ZERO length suplied to intervalList::add(), ignoring interval.
ZERO length suplied to intervalList::add(), ignoring interval.
ZERO length suplied to intervalList::add(), ignoring interval.
ZERO length suplied to intervalList::add(), ignoring interval.
ZERO length suplied to intervalList::add(), ignoring interval.
ZERO length suplied to intervalList::add(), ignoring interval.
ZERO length suplied to intervalList::add(), ignoring interval.
ZERO length suplied to intervalList::add(), ignoring interval.
ZERO length suplied to intervalList::add(), ignoring interval.
ZERO length suplied to intervalList::add(), ignoring interval.
ZERO length suplied to intervalList::add(), ignoring interval.
ZERO length suplied to intervalList::add(), ignoring interval.
ZERO length suplied to intervalList::add(), ignoring interval.
ZERO length suplied to intervalList::add(), ignoring interval.
ZERO length suplied to intervalList::add(), ignoring interval.
ZERO length suplied to intervalList::add(), ignoring interval.
ZERO length suplied to intervalList::add(), ignoring interval.
ZERO length suplied to intervalList::add(), ignoring interval.
ZERO length suplied to intervalList::add(), ignoring interval.
ZERO length suplied to intervalList::add(), ignoring interval.
ZERO length suplied to intervalList::add(), ignoring interval.
ZERO length suplied to intervalList::add(), ignoring interval.
ZERO length suplied to intervalList::add(), ignoring interval.
ZERO length suplied to intervalList::add(), ignoring interval.
ZERO length suplied to intervalList::add(), ignoring interval.
ZERO length suplied to intervalList::add(), ignoring interval.
ZERO length suplied to intervalList::add(), ignoring interval.
ZERO length suplied to intervalList::add(), ignoring interval.
ZERO length suplied to intervalList::add(), ignoring interval.
ZERO length suplied to intervalList::add(), ignoring interval.
ZERO length suplied to intervalList::add(), ignoring interval.
ZERO length suplied to intervalList::add(), ignoring interval.
ZERO length suplied to intervalList::add(), ignoring interval.
ZERO length suplied to intervalList::add(), ignoring interval.
ZERO length suplied to intervalList::add(), ignoring interval.
ZERO length suplied to intervalList::add(), ignoring interval.
ZERO length suplied to intervalList::add(), ignoring interval.
ZERO length suplied to intervalList::add(), ignoring interval.
ZERO length suplied to intervalList::add(), ignoring interval.
ZERO length suplied to intervalList::add(), ignoring interval.
ZERO length suplied to intervalList::add(), ignoring interval.
ZERO length suplied to intervalList::add(), ignoring interval.
ZERO length suplied to intervalList::add(), ignoring interval.
ZERO length suplied to intervalList::add(), ignoring interval.
ZERO length suplied to intervalList::add(), ignoring interval.
ZERO length suplied to intervalList::add(), ignoring interval.
ZERO length suplied to intervalList::add(), ignoring interval.
ZERO length suplied to intervalList::add(), ignoring interval.
ZERO length suplied to intervalList::add(), ignoring interval.
ZERO length suplied to intervalList::add(), ignoring interval.
ZERO length suplied to intervalList::add(), ignoring interval.
ZERO length suplied to intervalList::add(), ignoring interval.
ZERO length suplied to intervalList::add(), ignoring interval.
ZERO length suplied to intervalList::add(), ignoring interval.
ZERO length suplied to intervalList::add(), ignoring interval.
ZERO length suplied to intervalList::add(), ignoring interval.
ZERO length suplied to intervalList::add(), ignoring interval.
ZERO length suplied to intervalList::add(), ignoring interval.
ZERO length suplied to intervalList::add(), ignoring interval.
ZERO length suplied to intervalList::add(), ignoring interval.
ZERO length suplied to intervalList::add(), ignoring interval.
ZERO length suplied to intervalList::add(), ignoring interval.
ZERO length suplied to intervalList::add(), ignoring interval.
ZERO length suplied to intervalList::add(), ignoring interval.
ZERO length suplied to intervalList::add(), ignoring interval.

-- Finished on Fri Jan 16 02:44:57 2026 (one second) with 4558977.359 GB free disk space
----------------------------------------
-- Finished stage 'generateOutputs', reset canuIteration.
--
-- Assembly 'B3-2' finished in '/share/org/YZWL/yzwl_lixg/project/28.大豆疫霉菌三代基因组/03.hicanu/B3-2/01.raw_output'.
--
-- Summary saved in 'B3-2.report'.
--
-- Sequences saved:
--   Contigs       -> 'B3-2.contigs.fasta'
--   Unassembled   -> 'B3-2.unassembled.fasta'
--
-- Read layouts saved:
--   Contigs       -> 'B3-2.contigs.layout'.
--
-- Bye.

2026-01-16 02:44:57.354 - WARNING - 输出文件不存在|Output file does not exist: /share/org/YZWL/yzwl_lixg/project/28.大豆疫霉菌三代基因组/03.hicanu/B3-2/01.raw_output/B3-2.unitigs.fasta
Usage: biopytools ragtag [OPTIONS]
Try 'biopytools ragtag -h' for help.

Error: Invalid value for '-r' / '--reference': 文件不存在|File does not exist: /share/org/YZWL/yzwl_lixg/project/28.大豆疫霉菌三代基因组/04.ragtag/Psoja_T2T.fa
Usage: biopytools genomesyn [OPTIONS]
Try 'biopytools genomesyn -h' for help.

Error: Invalid value for '-i' / '--ref': Path '04.ragtag/B3-2/hicanu/B3-2_RagTag_scaffolded.fa' does not exist.
Job 68886830 stderr output:

