Usage: biopytools ragtag [OPTIONS]
Try 'biopytools ragtag -h' for help.

Error: Invalid value for '-r' / '--reference': 文件不存在|File does not exist: /share/org/YZWL/yzwl_lixg/project/28.大豆疫霉菌三代基因组/04.ragtag/Psoja_T2T.fa
Usage: biopytools genomesyn [OPTIONS]
Try 'biopytools genomesyn -h' for help.

Error: Invalid value for '-i' / '--ref': Path '04.ragtag/B4-1/hifiasm/B4-1_RagTag_scaffolded.fa' does not exist.
2026-01-16 03:16:00.264 - WARNING - 命令错误输出|Command stderr:
-- canu master +27 changes (r10515 2a41e933b8de6ed66723d75d36dd071b46d2c347)
--
-- CITATIONS
--
-- For assemblies of PacBio HiFi reads:
--   Nurk S, Walenz BP, Rhiea A, Vollger MR, Logsdon GA, Grothe R, Miga KH, Eichler EE, Phillippy AM, Koren S.
--   HiCanu: accurate assembly of segmental duplications, satellites, and allelic variants from high-fidelity long reads.
--   biorXiv. 2020.
--   https://doi.org/10.1101/2020.03.14.992248
-- 
-- Read and contig alignments during correction and consensus use:
--   Šošic M, Šikic M.
--   Edlib: a C/C ++ library for fast, exact sequence alignment using edit distance.
--   Bioinformatics. 2017 May 1;33(9):1394-1395.
--   http://doi.org/10.1093/bioinformatics/btw753
-- 
-- Overlaps are generated using:
--   Berlin K, et al.
--   Assembling large genomes with single-molecule sequencing and locality-sensitive hashing.
--   Nat Biotechnol. 2015 Jun;33(6):623-30.
--   http://doi.org/10.1038/nbt.3238
-- 
--   Myers EW, et al.
--   A Whole-Genome Assembly of Drosophila.
--   Science. 2000 Mar 24;287(5461):2196-204.
--   http://doi.org/10.1126/science.287.5461.2196
-- 
-- Contig consensus sequences are generated using an algorithm derived from pbdagcon:
--   Chin CS, et al.
--   Nonhybrid, finished microbial genome assemblies from long-read SMRT sequencing data.
--   Nat Methods. 2013 Jun;10(6):563-9
--   http://doi.org/10.1038/nmeth.2474
-- 
-- CONFIGURE CANU
--
-- Detected Java(TM) Runtime Environment '17.0.15-internal' (from '/share/org/YZWL/yzwl_lixg/.local/bin/java') without -d64 support.
--
-- WARNING:
-- WARNING:  Failed to run gnuplot using command 'gnuplot'.
-- WARNING:  Plots will be disabled.
-- WARNING:
--
-- Detected samtools version '1.22' / htslib version 'htscodecs=1.6.3' (from 'samtools').
--
-- Detected 88 CPUs and 503 gigabytes of memory on the local machine.
--
-- Detected Slurm with 'sinfo' binary in /opt/skyformai/bin/sinfo.
--          Slurm disabled by useGrid=false
--
-- Detected  '' with 'pbsnodes' binary in /opt/skyformai/bin/pbsnodes.
--           disabled by useGrid=false
--
-- Detected LSF with 'bsub' binary in /opt/skyformai/bin/bsub.
--          LSF disabled by useGrid=false
--
-- Local machine mode enabled; grid support not detected or not allowed.
--
-- Found trimmed raw PacBio HiFi reads in the input files.
--
--                                (tag)Concurrency
--                         (tag)Threads          |
--                (tag)Memory         |          |
--        (tag)             |         |          |       total usage      algorithm
--        -------  ----------  --------   --------  --------------------  -----------------------------
-- Local: meryl     12.000 GB    4 CPUs x  22 jobs   264.000 GB  88 CPUs  (k-mer counting)
-- Local: cormhap   13.000 GB   11 CPUs x   8 jobs   104.000 GB  88 CPUs  (overlap detection with mhap)
-- Local: obtovl     8.000 GB    8 CPUs x  11 jobs    88.000 GB  88 CPUs  (overlap detection)
-- Local: utgovl     8.000 GB    8 CPUs x  11 jobs    88.000 GB  88 CPUs  (overlap detection)
-- Local: cor        -.--- GB    4 CPUs x   - jobs     -.--- GB   - CPUs  (read correction)
-- Local: ovb        4.000 GB    1 CPU  x  88 jobs   352.000 GB  88 CPUs  (overlap store bucketizer)
-- Local: ovs        8.000 GB    1 CPU  x  62 jobs   496.000 GB  62 CPUs  (overlap store sorting)
-- Local: red       16.000 GB    4 CPUs x  22 jobs   352.000 GB  88 CPUs  (read error detection)
-- Local: oea        8.000 GB    1 CPU  x  62 jobs   496.000 GB  62 CPUs  (overlap error adjustment)
-- Local: bat       32.000 GB    8 CPUs x   1 job     32.000 GB   8 CPUs  (contig construction with bogart)
-- Local: cns        -.--- GB    8 CPUs x   - jobs     -.--- GB   - CPUs  (consensus)
--
-- Generating assembly 'B4-1' in '/share/org/YZWL/yzwl_lixg/project/28.大豆疫霉菌三代基因组/03.hicanu/B4-1/01.raw_output':
--   genomeSize:
--     85000000
--
--   Overlap Generation Limits:
--     corOvlErrorRate 0.0000 (  0.00%)
--     obtOvlErrorRate 0.0250 (  2.50%)
--     utgOvlErrorRate 0.0100 (  1.00%)
--
--   Overlap Processing Limits:
--     corErrorRate    0.0000 (  0.00%)
--     obtErrorRate    0.0250 (  2.50%)
--     utgErrorRate    0.0003 (  0.03%)
--     cnsErrorRate    0.0500 (  5.00%)
--
--   Stages to run:
--     assemble HiFi reads.
--
--
-- BEGIN STORE CREATION
----------------------------------------
-- Starting command on Fri Jan 16 00:22:30 2026 with 4564543.421 GB free disk space

    cd .
    ./B4-1.seqStore.sh \
    > ./B4-1.seqStore.err 2>&1

-- Finished on Fri Jan 16 00:29:52 2026 (442 seconds) with 4563544.015 GB free disk space
----------------------------------------
--
-- In sequence store './B4-1.seqStore':
--   Found 281918 reads.
--   Found 4250010616 bases (50 times coverage).
--    Histogram of corrected reads:
--    
--    G=4250010616                       sum of  ||               length     num
--    NG         length     index       lengths  ||                range    seqs
--    ----- ------------ --------- ------------  ||  ------------------- -------
--    00010        24508     15789    425001329  ||       1246-2417         6395|--------------
--    00020        22209     34072    850014885  ||       2418-3589        11983|--------------------------
--    00030        20720     53915   1275010943  ||       3590-4761        12628|---------------------------
--    00040        19541     75058   1700013783  ||       4762-5933        11948|--------------------------
--    00050        18560     97380   2125007985  ||       5934-7105        11062|------------------------
--    00060        17648    120863   2550008866  ||       7106-8277         9923|----------------------
--    00070        16667    145619   2975013061  ||       8278-9449         9135|--------------------
--    00080        15182    172175   3400010194  ||       9450-10621        8090|------------------
--    00090         9896    205686   3825017064  ||      10622-11793        7065|----------------
--    00100         1246    281918   4250010616  ||      11794-12965        6053|-------------
--    001.000x              281918   4250010616  ||      12966-14137        6169|--------------
--                                               ||      14138-15309       10875|------------------------
--                                               ||      15310-16481       20744|---------------------------------------------
--                                               ||      16482-17653       29125|--------------------------------------------------------------
--                                               ||      17654-18825       29645|---------------------------------------------------------------
--                                               ||      18826-19997       24965|------------------------------------------------------
--                                               ||      19998-21169       19021|-----------------------------------------
--                                               ||      21170-22341       14368|-------------------------------
--                                               ||      22342-23513       10375|-----------------------
--                                               ||      23514-24685        7554|-----------------
--                                               ||      24686-25857        5088|-----------
--                                               ||      25858-27029        3743|--------
--                                               ||      27030-28201        2350|-----
--                                               ||      28202-29373        1613|----
--                                               ||      29374-30545         969|---
--                                               ||      30546-31717         542|--
--                                               ||      31718-32889         264|-
--                                               ||      32890-34061         119|-
--                                               ||      34062-35233          66|-
--                                               ||      35234-36405          28|-
--                                               ||      36406-37577           7|-
--                                               ||      37578-38749           2|-
--                                               ||      38750-39921           0|
--                                               ||      39922-41093           2|-
--                                               ||      41094-42265           0|
--                                               ||      42266-43437           0|
--                                               ||      43438-44609           0|
--                                               ||      44610-45781           1|-
--                                               ||      45782-46953           0|
--                                               ||      46954-48125           1|-
--    
--
-- In sequence store './B4-1.seqStore':
--   Found 281918 reads.
--   Found 4250010616 bases (50 times coverage).
--    Histogram of corrected-trimmed reads:
--    
--    G=4250010616                       sum of  ||               length     num
--    NG         length     index       lengths  ||                range    seqs
--    ----- ------------ --------- ------------  ||  ------------------- -------
--    00010        24508     15789    425001329  ||       1246-2417         6395|--------------
--    00020        22209     34072    850014885  ||       2418-3589        11983|--------------------------
--    00030        20720     53915   1275010943  ||       3590-4761        12628|---------------------------
--    00040        19541     75058   1700013783  ||       4762-5933        11948|--------------------------
--    00050        18560     97380   2125007985  ||       5934-7105        11062|------------------------
--    00060        17648    120863   2550008866  ||       7106-8277         9923|----------------------
--    00070        16667    145619   2975013061  ||       8278-9449         9135|--------------------
--    00080        15182    172175   3400010194  ||       9450-10621        8090|------------------
--    00090         9896    205686   3825017064  ||      10622-11793        7065|----------------
--    00100         1246    281918   4250010616  ||      11794-12965        6053|-------------
--    001.000x              281918   4250010616  ||      12966-14137        6169|--------------
--                                               ||      14138-15309       10875|------------------------
--                                               ||      15310-16481       20744|---------------------------------------------
--                                               ||      16482-17653       29125|--------------------------------------------------------------
--                                               ||      17654-18825       29645|---------------------------------------------------------------
--                                               ||      18826-19997       24965|------------------------------------------------------
--                                               ||      19998-21169       19021|-----------------------------------------
--                                               ||      21170-22341       14368|-------------------------------
--                                               ||      22342-23513       10375|-----------------------
--                                               ||      23514-24685        7554|-----------------
--                                               ||      24686-25857        5088|-----------
--                                               ||      25858-27029        3743|--------
--                                               ||      27030-28201        2350|-----
--                                               ||      28202-29373        1613|----
--                                               ||      29374-30545         969|---
--                                               ||      30546-31717         542|--
--                                               ||      31718-32889         264|-
--                                               ||      32890-34061         119|-
--                                               ||      34062-35233          66|-
--                                               ||      35234-36405          28|-
--                                               ||      36406-37577           7|-
--                                               ||      37578-38749           2|-
--                                               ||      38750-39921           0|
--                                               ||      39922-41093           2|-
--                                               ||      41094-42265           0|
--                                               ||      42266-43437           0|
--                                               ||      43438-44609           0|
--                                               ||      44610-45781           1|-
--                                               ||      45782-46953           0|
--                                               ||      46954-48125           1|-
--    
--
-- Correction skipped; not enabled.
--
-- Trimming skipped; not enabled.
--
-- BEGIN ASSEMBLY
----------------------------------------
-- Starting command on Fri Jan 16 00:29:52 2026 with 4563543.968 GB free disk space

    cd unitigging/0-mercounts
    ./meryl-configure.sh \
    > ./meryl-configure.err 2>&1

-- Finished on Fri Jan 16 00:29:53 2026 (one second) with 4563543.968 GB free disk space
----------------------------------------
--  segments   memory batches
--  -------- -------- -------
--        01 10.72 GB       2
--        02  5.61 GB       2
--        04  2.94 GB       2
--        06  2.13 GB       2
--        08  1.60 GB       2
--        12  1.07 GB       2
--        16  0.80 GB       2
--        20  0.65 GB       2
--        24  0.54 GB       2
--        32  0.40 GB       2
--        40  0.32 GB       2
--        48  -.-- GB       -  (segment size too small)
--        56  -.-- GB       -  (segment size too small)
--        64  -.-- GB       -  (segment size too small)
--        96  -.-- GB       -  (segment size too small)
--
--  For 281918 reads with 4250010616 bases, limit to 42 batches.
--  Will count kmers using 01 jobs, each using 12 GB and 4 threads.
--
-- Finished stage 'merylConfigure', reset canuIteration.
--
-- Running jobs.  First attempt out of 2.
----------------------------------------
-- Starting 'meryl' concurrent execution on Fri Jan 16 00:29:53 2026 with 4563543.937 GB free disk space (1 processes; 22 concurrently)

    cd unitigging/0-mercounts
    ./meryl-count.sh 1 > ./meryl-count.000001.out 2>&1

-- Finished on Fri Jan 16 00:33:28 2026 (215 seconds) with 4562695.125 GB free disk space
----------------------------------------
-- Found 1 Kmer counting (meryl) outputs.
-- Finished stage 'utg-merylCountCheck', reset canuIteration.
--
-- Running jobs.  First attempt out of 2.
----------------------------------------
-- Starting 'meryl' concurrent execution on Fri Jan 16 00:33:28 2026 with 4562695.093 GB free disk space (1 processes; 22 concurrently)

    cd unitigging/0-mercounts
    ./meryl-process.sh 1 > ./meryl-process.000001.out 2>&1

-- Finished on Fri Jan 16 00:33:32 2026 (4 seconds) with 4562694.062 GB free disk space
----------------------------------------
-- Meryl finished successfully.  Kmer frequency histogram:
--
-- WARNING: gnuplot failed.
--
----------------------------------------
--
--  22-mers                                                                                           Fraction
--    Occurrences   NumMers                                                                         Unique Total
--       1-     1         0                                                                        0.0000 0.0000
--       2-     2    792485 ***                                                                    0.0172 0.0005
--       3-     4    159232                                                                        0.0197 0.0006
--       5-     7     46430                                                                        0.0211 0.0007
--       8-    11     41906                                                                        0.0218 0.0008
--      12-    16    181824                                                                        0.0230 0.0009
--      17-    22    556338 **                                                                     0.0280 0.0021
--      23-    29   1510188 *****                                                                  0.0413 0.0061
--      30-    37   8106800 *******************************                                        0.0815 0.0222
--      38-    46  17799384 ********************************************************************** 0.2849 0.1255
--      47-    56  10608984 *****************************************                              0.6715 0.3651
--      57-    67   1696002 ******                                                                 0.8716 0.5129
--      68-    79    724928 **                                                                     0.9015 0.5392
--      80-    92   1062401 ****                                                                   0.9178 0.5569
--      93-   106    604857 **                                                                     0.9408 0.5857
--     107-   121    255467 *                                                                      0.9528 0.6028
--     122-   137    319594 *                                                                      0.9583 0.6119
--     138-   154    194647                                                                        0.9652 0.6249
--     155-   172    176167                                                                        0.9692 0.6334
--     173-   191    149124                                                                        0.9731 0.6425
--     192-   211    107594                                                                        0.9762 0.6508
--     212-   232    102428                                                                        0.9786 0.6576
--     233-   254     85638                                                                        0.9808 0.6647
--     255-   277     82468                                                                        0.9826 0.6712
--     278-   301     64686                                                                        0.9844 0.6780
--     302-   326     61409                                                                        0.9858 0.6838
--     327-   352     48032                                                                        0.9871 0.6898
--     353-   379     47380                                                                        0.9881 0.6949
--     380-   407     36406                                                                        0.9891 0.7003
--     408-   436     35950                                                                        0.9899 0.7047
--     437-   466     33202                                                                        0.9907 0.7096
--     467-   497     26101                                                                        0.9914 0.7142
--     498-   529     23506                                                                        0.9920 0.7181
--     530-   562     21695                                                                        0.9925 0.7218
--     563-   596     18439                                                                        0.9930 0.7256
--     597-   631     20033                                                                        0.9934 0.7289
--     632-   667     16038                                                                        0.9938 0.7327
--     668-   704     15671                                                                        0.9941 0.7360
--     705-   742     13403                                                                        0.9945 0.7393
--     743-   781     12387                                                                        0.9948 0.7424
--     782-   821     10545                                                                        0.9950 0.7453
--
--           0 (max occurrences)
--  3195025816 (total mers, non-unique)
--    46087942 (distinct mers, non-unique)
--           0 (unique mers)
-- Finished stage 'meryl-process', reset canuIteration.
--
-- Removing meryl database 'unitigging/0-mercounts/B4-1.ms22'.
--
-- OVERLAPPER (normal) (assembly) erate=0.01
--
----------------------------------------
-- Starting command on Fri Jan 16 00:33:32 2026 with 4562695.031 GB free disk space

    cd unitigging/1-overlapper
    /share/org/YZWL/yzwl_lixg/miniforge3/envs/canu_v.2.3/bin/overlapInCorePartition \
     -S  ../../B4-1.seqStore \
     -hl 160000000 \
     -rl 5000000000 \
     -ol 500 \
     -o  ./B4-1.partition \
    > ./B4-1.partition.err 2>&1

-- Finished on Fri Jan 16 00:33:32 2026 (lickety-split) with 4562695.015 GB free disk space
----------------------------------------
--
-- Configured 21 overlapInCore jobs.
-- Finished stage 'utg-overlapConfigure', reset canuIteration.
--
-- Running jobs.  First attempt out of 2.
----------------------------------------
-- Starting 'utgovl' concurrent execution on Fri Jan 16 00:33:32 2026 with 4562694.984 GB free disk space (21 processes; 11 concurrently)

    cd unitigging/1-overlapper
    ./overlap.sh 1 > ./overlap.000001.out 2>&1
    ./overlap.sh 2 > ./overlap.000002.out 2>&1
    ./overlap.sh 3 > ./overlap.000003.out 2>&1
    ./overlap.sh 4 > ./overlap.000004.out 2>&1
    ./overlap.sh 5 > ./overlap.000005.out 2>&1
    ./overlap.sh 6 > ./overlap.000006.out 2>&1
    ./overlap.sh 7 > ./overlap.000007.out 2>&1
    ./overlap.sh 8 > ./overlap.000008.out 2>&1
    ./overlap.sh 9 > ./overlap.000009.out 2>&1
    ./overlap.sh 10 > ./overlap.000010.out 2>&1
    ./overlap.sh 11 > ./overlap.000011.out 2>&1
    ./overlap.sh 12 > ./overlap.000012.out 2>&1
    ./overlap.sh 13 > ./overlap.000013.out 2>&1
    ./overlap.sh 14 > ./overlap.000014.out 2>&1
    ./overlap.sh 15 > ./overlap.000015.out 2>&1
    ./overlap.sh 16 > ./overlap.000016.out 2>&1
    ./overlap.sh 17 > ./overlap.000017.out 2>&1
    ./overlap.sh 18 > ./overlap.000018.out 2>&1
    ./overlap.sh 19 > ./overlap.000019.out 2>&1
    ./overlap.sh 20 > ./overlap.000020.out 2>&1
    ./overlap.sh 21 > ./overlap.000021.out 2>&1

-- Finished on Fri Jan 16 01:08:30 2026 (2098 seconds) with 4557799.453 GB free disk space
----------------------------------------
-- Found 21 overlapInCore output files.
--
-- overlapInCore compute 'unitigging/1-overlapper':
--   kmer hits
--     with no overlap       1232979655  16.9047619 +- 37039831.132
--     with an overlap         56423244  1.14285714 +- 1542949.51
--
--   overlaps                  56423244  1.14285714 +- 1542949.51
--     contained               14056439  .238095238 +- 373224.359
--     dovetail                42366805  66.9047619 +- 1174058.371
--
--   overlaps rejected
--     multiple per pair              0           0 +- 0
--     bad short window               0           0 +- 0
--     bad long window                0           0 +- 0
-- Finished stage 'utg-overlapCheck', reset canuIteration.
----------------------------------------
-- Starting command on Fri Jan 16 01:08:30 2026 with 4557799.437 GB free disk space

    cd unitigging
    /share/org/YZWL/yzwl_lixg/miniforge3/envs/canu_v.2.3/bin/ovStoreConfig \
     -S ../B4-1.seqStore \
     -M 4-8 \
     -L ./1-overlapper/ovljob.files \
     -create ./B4-1.ovlStore.config \
     > ./B4-1.ovlStore.config.txt \
    2> ./B4-1.ovlStore.config.err

-- Finished on Fri Jan 16 01:08:30 2026 (in the blink of an eye) with 4557799.421 GB free disk space
----------------------------------------
--
-- Creating overlap store unitigging/B4-1.ovlStore using:
--      1 bucket
--      1 slice
--        using at most 4 GB memory each
--
-- Running jobs.  First attempt out of 2.
----------------------------------------
-- Starting 'ovS' concurrent execution on Fri Jan 16 01:08:30 2026 with 4557799.406 GB free disk space (1 processes; 62 concurrently)

    cd unitigging
    ./B4-1.ovlStore.sh 1 > ./B4-1.ovlStore.000001.out 2>&1

-- Finished on Fri Jan 16 01:08:56 2026 (26 seconds) with 4557797.062 GB free disk space
----------------------------------------
-- Checking store.
----------------------------------------
-- Starting command on Fri Jan 16 01:08:56 2026 with 4557797.062 GB free disk space

    cd unitigging
    /share/org/YZWL/yzwl_lixg/miniforge3/envs/canu_v.2.3/bin/ovStoreDump \
     -S ../B4-1.seqStore \
     -O  ./B4-1.ovlStore \
     -counts \
     > ./B4-1.ovlStore/counts.dat 2> ./B4-1.ovlStore/counts.err

-- Finished on Fri Jan 16 01:08:57 2026 (one second) with 4557797.031 GB free disk space
----------------------------------------
--
-- Overlap store 'unitigging/B4-1.ovlStore' successfully constructed.
-- Found 112846488 overlaps for 268747 reads; 1646606 reads have no overlaps.
--
--
-- Purged 1.098 GB in 63 overlap output files.
----------------------------------------
-- Starting command on Fri Jan 16 01:08:57 2026 with 4557798.109 GB free disk space

    cd unitigging
    /share/org/YZWL/yzwl_lixg/miniforge3/envs/canu_v.2.3/bin/ovStoreStats \
     -C 50 \
     -S ../B4-1.seqStore \
     -O  ./B4-1.ovlStore \
     -o  ./B4-1.ovlStore \
     > ./B4-1.ovlStore.summary.err 2>&1

-- Finished on Fri Jan 16 01:09:14 2026 (17 seconds) with 4557733.718 GB free disk space
----------------------------------------
--
-- Overlap store 'unitigging/B4-1.ovlStore' contains:
--
--   category            reads     %          read length        feature size or coverage  analysis
--   ----------------  -------  -------  ----------------------  ------------------------  --------------------
--   middle-missing        113    0.04    14234.44 +- 7344.03        985.46 +- 1645.35    (bad trimming)
--   middle-hump            36    0.01    15015.28 +- 3302.94       7327.89 +- 4395.00    (bad trimming)
--   no-5-prime            592    0.21    12806.62 +- 4709.43       2285.15 +- 3120.15    (bad trimming)
--   no-3-prime            581    0.21    12303.57 +- 5223.89       2488.03 +- 3239.46    (bad trimming)
--   
--   low-coverage         2159    0.77     9819.51 +- 5106.81          6.32 +- 3.84       (easy to assemble, potential for lower quality consensus)
--   unique             208522   73.97    11510.68 +- 5259.11         42.36 +- 8.49       (easy to assemble, perfect, yay)
--   repeat-cont         25323    8.98    10270.61 +- 4560.34       2032.12 +- 1341.61    (potential for consensus errors, no impact on assembly)
--   repeat-dove           230    0.08    19934.55 +- 2270.08       1080.22 +- 1233.77    (hard to assemble, likely won't assemble correctly or even at all)
--   
--   span-repeat          6407    2.27    13448.98 +- 4434.10       3316.14 +- 3458.95    (read spans a large repeat, usually easy to assemble)
--   uniq-repeat-cont    16612    5.89    11471.84 +- 4373.81                             (should be uniquely placed, low potential for consensus errors, no impact on assembly)
--   uniq-repeat-dove     3725    1.32    17395.89 +- 2774.17                             (will end contigs, potential to misassemble)
--   uniq-anchor          4447    1.58    12357.75 +- 4343.35       7460.96 +- 4565.98    (repeat read, with unique section, probable bad read)
-- Finished stage 'utg-createOverlapStore', reset canuIteration.
--
-- Loading read lengths.
-- Loading number of overlaps per read.
--
-- Configure RED for 16gb memory.
--                   Batches of at most (unlimited) reads.
--                                      500000000 bases.
--                   Expecting evidence of at most 536870912 bases per iteration.
--
--           Total                                               Reads                 Olaps Evidence
--    Job   Memory      Read Range         Reads        Bases   Memory        Olaps   Memory   Memory  (Memory in MB)
--   ---- -------- ------------------- --------- ------------ -------- ------------ -------- --------
--      1 16384.44         1-42481          6121    108797383 13281.12      2736632    31.32  1024.00
--      2 16384.08     42482-90493          6951    108872499 13290.32      1901161    21.76  1024.00
--      3 16385.26     90494-141859         7510    108839796 13286.34      2351717    26.91  1024.00
--      4 16384.90    141860-184356         6345    108601249 13257.19      4868187    55.71  1024.00
--      5 16384.03    184357-235456         7676    108929297 13297.27      1289238    14.75  1024.00
--      6 16385.32    235457-291884         8203    108751817 13275.63      3293814    37.69  1024.00
--      7 16386.31    291885-335768         6390    108632881 13261.05      4653595    53.26  1024.00
--      8 16384.15    335769-387413         7650    108935312 13298.01      1235583    14.14  1024.00
--      9 16386.22    387414-445124         8431    108759012 13276.51      3295195    37.71  1024.00
--     10 16384.08    445125-488116         6410    108625589 13260.16      4536424    51.92  1024.00
--     11 16384.89    488117-538025         7351    108917699 13295.85      1489295    17.04  1024.00
--     12 16386.08    538026-596361         8531    108780088 13279.09      3057893    34.99  1024.00
--     13 16384.04    596362-638722         6325    108665565 13265.04      4107369    47.01  1024.00
--     14 16384.26    638723-686655         7137    108892758 13292.80      1700573    19.46  1024.00
--     15 16384.60    686656-745880         8641    108760329 13276.68      3138385    35.92  1024.00
--     16 16384.69    745881-788217         6277    108724697 13272.26      3533268    40.44  1024.00
--     17 16386.18    788218-835880         7001    108869393 13289.94      2117764    24.24  1024.00
--     18 16384.79    835881-895458         8840    108735134 13273.61      3423993    39.18  1024.00
--     19 16385.74    895459-937930         6311    108732918 13273.26      3537571    40.48  1024.00
--     20 16384.63    937931-985706         7008    108853290 13287.98      2154071    24.65  1024.00
--     21 16386.60    985707-1046958        8983    108753587 13275.87      3384755    38.74  1024.00
--     22 16384.38   1046959-1089870        6240    108784077 13279.50      2872884    32.88  1024.00
--     23 16384.77   1089871-1135077        6792    108803082 13281.84      2703005    30.93  1024.00
--     24 16385.05   1135078-1196013        8876    108755617 13276.11      3227560    36.94  1024.00
--     25 16384.35   1196014-1237306        6170    108767897 13277.53      3043348    34.83  1024.00
--     26 16385.48   1237307-1282509        6689    108807737 13282.40      2715085    31.07  1024.00
--     27 16385.04   1282510-1342619        8854    108766207 13277.40      3113740    35.63  1024.00
--     28 16387.02   1342620-1384058        6152    108794505 13280.77      2992216    34.24  1024.00
--     29 16387.14   1384059-1428800        6566    108841471 13286.52      2500797    28.62  1024.00
--     30 16384.92   1428801-1487735        8676    108772056 13278.11      3041876    34.81  1024.00
--     31 16386.74   1487736-1528968        6056    108810873 13282.77      2794105    31.98  1024.00
--     32 16385.51   1528969-1572664        6405    108824675 13284.46      2538150    29.05  1024.00
--     33 16385.47   1572665-1630125        8370    108788469 13280.11      2915490    33.37  1024.00
--     34 16384.47   1630126-1670546        5990    108800536 13281.50      2705953    30.97  1024.00
--     35 16384.81   1670547-1714067        6362    108814433 13283.21      2586159    29.60  1024.00
--     36 16384.49   1714068-1770287        8293    108768104 13277.62      3047003    34.87  1024.00
--     37 16384.96   1770288-1812419        6085    108840015 13286.33      2326865    26.63  1024.00
--     38 16385.13   1812420-1854738        6353    108799525 13281.39      2773065    31.74  1024.00
--     39 16384.12   1854739-1910741        8227    108775895 13278.57      2932300    33.56  1024.00
--     40  3961.29   1910742-1915353         670      7265149   886.88       210404     2.41  1024.00
--   ---- -------- ------------------- --------- ------------ -------- ------------ -------- --------
--                                                 4250010616             112846488
-- Finished stage 'readErrorDetectionConfigure', reset canuIteration.
--
-- Running jobs.  First attempt out of 2.
----------------------------------------
-- Starting 'red' concurrent execution on Fri Jan 16 01:09:21 2026 with 4557733.671 GB free disk space (40 processes; 22 concurrently)

    cd unitigging/3-overlapErrorAdjustment
    ./red.sh 1 > ./red.000001.out 2>&1
    ./red.sh 2 > ./red.000002.out 2>&1
    ./red.sh 3 > ./red.000003.out 2>&1
    ./red.sh 4 > ./red.000004.out 2>&1
    ./red.sh 5 > ./red.000005.out 2>&1
    ./red.sh 6 > ./red.000006.out 2>&1
    ./red.sh 7 > ./red.000007.out 2>&1
    ./red.sh 8 > ./red.000008.out 2>&1
    ./red.sh 9 > ./red.000009.out 2>&1
    ./red.sh 10 > ./red.000010.out 2>&1
    ./red.sh 11 > ./red.000011.out 2>&1
    ./red.sh 12 > ./red.000012.out 2>&1
    ./red.sh 13 > ./red.000013.out 2>&1
    ./red.sh 14 > ./red.000014.out 2>&1
    ./red.sh 15 > ./red.000015.out 2>&1
    ./red.sh 16 > ./red.000016.out 2>&1
    ./red.sh 17 > ./red.000017.out 2>&1
    ./red.sh 18 > ./red.000018.out 2>&1
    ./red.sh 19 > ./red.000019.out 2>&1
    ./red.sh 20 > ./red.000020.out 2>&1
    ./red.sh 21 > ./red.000021.out 2>&1
    ./red.sh 22 > ./red.000022.out 2>&1
    ./red.sh 23 > ./red.000023.out 2>&1
    ./red.sh 24 > ./red.000024.out 2>&1
    ./red.sh 25 > ./red.000025.out 2>&1
    ./red.sh 26 > ./red.000026.out 2>&1
    ./red.sh 27 > ./red.000027.out 2>&1
    ./red.sh 28 > ./red.000028.out 2>&1
    ./red.sh 29 > ./red.000029.out 2>&1
    ./red.sh 30 > ./red.000030.out 2>&1
    ./red.sh 31 > ./red.000031.out 2>&1
    ./red.sh 32 > ./red.000032.out 2>&1
    ./red.sh 33 > ./red.000033.out 2>&1
    ./red.sh 34 > ./red.000034.out 2>&1
    ./red.sh 35 > ./red.000035.out 2>&1
    ./red.sh 36 > ./red.000036.out 2>&1
    ./red.sh 37 > ./red.000037.out 2>&1
    ./red.sh 38 > ./red.000038.out 2>&1
    ./red.sh 39 > ./red.000039.out 2>&1
    ./red.sh 40 > ./red.000040.out 2>&1

-- Finished on Fri Jan 16 01:35:32 2026 (1571 seconds) with 4560225.515 GB free disk space
----------------------------------------
-- Found 40 read error detection output files.
-- Finished stage 'readErrorDetectionCheck', reset canuIteration.
--
-- Loading read lengths.
-- Loading number of overlaps per read.
--
-- Configure OEA for 8gb memory.
--                   Batches of at most (unlimited) reads.
--                                      300000000 bases.
--
--           Total                                               Reads                 Olaps  Adjusts
--    Job   Memory      Read Range         Reads        Bases   Memory        Olaps   Memory   Memory  (Memory in MB)
--   ---- -------- ------------------- --------- ------------ -------- ------------ -------- --------
--      1  2922.26         1-131503        19055    300002270   294.69      6823706   208.24   371.33
--      2  2997.46    131504-270938        20736    300011994   294.75      9285775   283.38   371.33
--      3  2927.22    270939-406750        19841    300002125   294.71      6985490   213.18   371.33
--      4  2976.17    406751-540105        19679    300003708   294.71      8589439   262.13   371.33
--      5  2976.63    540106-675731        20057    300005824   294.72      8604206   262.58   371.33
--      6  2972.26    675732-813702        20259    300016435   294.74      8460305   258.19   371.33
--      7  2983.01    813703-951172        20460    300016712   294.74      8812317   268.93   371.33
--      8  2945.83    951173-1092435       20642    300006912   294.74      7594225   231.76   371.33
--      9  2969.78   1092436-1229653       20288    300010101   294.73      8379399   255.72   371.33
--     10  2907.75   1229654-1366062       20237    300004162   294.72      6346832   193.69   371.33
--     11  2969.36   1366063-1501500       19857    300023079   294.73      8365435   255.29   371.33
--     12  2960.44   1501501-1633820       19380    300000761   294.69      8074508   246.41   371.33
--     13  2912.12   1633821-1759153       18450    300007731   294.67      6491685   198.11   371.33
--     14  2944.22   1759154-1885166       18518    300009159   294.68      7543568   230.21   371.33
--     15  2551.03   1885167-1915353        4459     49889643    55.71      2489598    75.98   371.33
--   ---- -------- ------------------- --------- ------------ -------- ------------ -------- --------
--                                                 4250010616             112846488
-- Finished stage 'overlapErrorAdjustmentConfigure', reset canuIteration.
--
-- Running jobs.  First attempt out of 2.
----------------------------------------
-- Starting 'oea' concurrent execution on Fri Jan 16 01:35:40 2026 with 4560122.625 GB free disk space (15 processes; 62 concurrently)

    cd unitigging/3-overlapErrorAdjustment
    ./oea.sh 1 > ./oea.000001.out 2>&1
    ./oea.sh 2 > ./oea.000002.out 2>&1
    ./oea.sh 3 > ./oea.000003.out 2>&1
    ./oea.sh 4 > ./oea.000004.out 2>&1
    ./oea.sh 5 > ./oea.000005.out 2>&1
    ./oea.sh 6 > ./oea.000006.out 2>&1
    ./oea.sh 7 > ./oea.000007.out 2>&1
    ./oea.sh 8 > ./oea.000008.out 2>&1
    ./oea.sh 9 > ./oea.000009.out 2>&1
    ./oea.sh 10 > ./oea.000010.out 2>&1
    ./oea.sh 11 > ./oea.000011.out 2>&1
    ./oea.sh 12 > ./oea.000012.out 2>&1
    ./oea.sh 13 > ./oea.000013.out 2>&1
    ./oea.sh 14 > ./oea.000014.out 2>&1
    ./oea.sh 15 > ./oea.000015.out 2>&1

-- Finished on Fri Jan 16 03:04:28 2026 (5328 seconds) with 4558138.218 GB free disk space
----------------------------------------
-- Found 15 overlap error adjustment output files.
-- Finished stage 'overlapErrorAdjustmentCheck', reset canuIteration.
----------------------------------------
-- Starting command on Fri Jan 16 03:04:28 2026 with 4558138.203 GB free disk space

    cd unitigging/3-overlapErrorAdjustment
    /share/org/YZWL/yzwl_lixg/miniforge3/envs/canu_v.2.3/bin/loadErates \
      -S ../../B4-1.seqStore \
      -O ../B4-1.ovlStore \
      -L ./oea.files \
    > ./oea.apply.err 2>&1

-- Finished on Fri Jan 16 03:04:28 2026 (fast as lightning) with 4558137.984 GB free disk space
----------------------------------------
-- No report available.
-- Finished stage 'updateOverlapStore', reset canuIteration.
-- Finished stage 'unitig', reset canuIteration.
--
-- Running jobs.  First attempt out of 2.
----------------------------------------
-- Starting 'bat' concurrent execution on Fri Jan 16 03:04:28 2026 with 4558137.937 GB free disk space (1 processes; 1 concurrently)

    cd unitigging/4-unitigger
    ./unitigger.sh 1 > ./unitigger.000001.out 2>&1

-- Finished on Fri Jan 16 03:04:55 2026 (27 seconds) with 4558128.359 GB free disk space
----------------------------------------
-- Unitigger finished successfully.
--  
--  ERROR RATES
--  -----------
--                                                   --------threshold------
--  305460                       fraction error      fraction        percent
--  samples                              (1e-5)         error          error
--                   --------------------------      --------       --------
--  command line (-eg)                           ->     30.00        0.0300%
--  command line (-ef)                           ->  -----.--      ---.----%
--  command line (-eM)                           ->     30.00        0.0300%
--  mean + std.dev       0.60 +-  12 *     3.48  ->     42.37        0.0424%
--  median + mad         0.00 +-  12 *     0.00  ->      0.00        0.0000%
--  90th percentile                              ->      1.00        0.0010%  (enabled)
--  
--  BEST EDGE FILTERING
--  -------------------
--  At graph threshold 0.0300%, reads:
--    available to have edges:        59970
--    with at least one edge:         44050
--  
--  At max threshold 0.0300%, reads:
--    available to have edges:        59970
--    with at least one edge:         44050
--  
--  At tight threshold 0.0010%, reads with:
--    both edges below error threshold:     35715  (80.00% minReadsBest threshold = 35240)
--    one  edge  above error threshold:      6341
--    both edges above error threshold:      1994
--    at least one edge:                    44050
--  
--  At loose threshold 0.0300%, reads with:
--    both edges below error threshold:     44050  (80.00% minReadsBest threshold = 35240)
--    one  edge  above error threshold:         0
--    both edges above error threshold:         0
--    at least one edge:                    44050
--  
--  
--  INITIAL EDGES
--  -------- ----------------------------------------
--    212834 reads are contained
--   1662971 reads have no best edges (singleton)
--       473 reads have only one best edge (spur) 
--                260 are mutual best
--     39075 reads have two best edges 
--               1664 have one mutual best edge
--              36973 have two mutual best edges
--  
--  
--  FINAL EDGES
--  -------- ----------------------------------------
--    212834 reads are contained
--   1663408 reads have no best edges (singleton)
--       342 reads have only one best edge (spur) 
--                283 are mutual best
--     38769 reads have two best edges 
--               1517 have one mutual best edge
--              36941 have two mutual best edges
--  
--  
--  EDGE FILTERING
--  -------- ------------------------------------------
--         0 reads are ignored
--     12975 reads have a gap in overlap coverage
--       191 reads have lopsided best edges
-- Found, in version 1, after unitig construction:
--   contigs:      134 sequences, total length 71082799 bp (including 277 repeats of total length 11215249 bp).
--   bubbles:      637 sequences, total length 34365287 bp.
--   unassembled:  30540 sequences, total length 332361253 bp.
--
-- Contig sizes based on genome size 85mbp:
--
--            NG (bp)  LG (contigs)    sum (bp)
--         ----------  ------------  ----------
--     10     7598912             2    16021849
--     20     6217702             3    22239551
--     30     4926609             4    27166160
--     40     3447316             6    35218651
--     50     2757111             9    44693659
--     60     2081389            12    51203917
--     70      960654            19    60422584
--     80      192930            36    68103004
--
-- Finished stage 'unitigCheck', reset canuIteration.
----------------------------------------
-- Starting command on Fri Jan 16 03:04:55 2026 with 4558128.343 GB free disk space

    cd unitigging
    /share/org/YZWL/yzwl_lixg/miniforge3/envs/canu_v.2.3/bin/utgcns \
      -S ../B4-1.seqStore \
      -T  ./B4-1.ctgStore 1 \
      -partition 0.8 1.5 0.1 \
    > ./B4-1.ctgStore/partitioning.log 2>&1

-- Finished on Fri Jan 16 03:05:04 2026 (9 seconds) with 4558127.156 GB free disk space
----------------------------------------
-- Using slow alignment for consensus (iteration '0').
-- Configured 11 consensus jobs.
-- Finished stage 'consensusConfigure', reset canuIteration.
--
-- Local: cns       12.500 GB    8 CPUs x  11 jobs   137.500 GB  88 CPUs  (consensus)
--
--
-- Running jobs.  First attempt out of 2.
----------------------------------------
-- Starting 'cns' concurrent execution on Fri Jan 16 03:05:04 2026 with 4558127.125 GB free disk space (11 processes; 11 concurrently)

    cd unitigging/5-consensus
    ./consensus.sh 1 > ./consensus.000001.out 2>&1
    ./consensus.sh 2 > ./consensus.000002.out 2>&1
    ./consensus.sh 3 > ./consensus.000003.out 2>&1
    ./consensus.sh 4 > ./consensus.000004.out 2>&1
    ./consensus.sh 5 > ./consensus.000005.out 2>&1
    ./consensus.sh 6 > ./consensus.000006.out 2>&1
    ./consensus.sh 7 > ./consensus.000007.out 2>&1
    ./consensus.sh 8 > ./consensus.000008.out 2>&1
    ./consensus.sh 9 > ./consensus.000009.out 2>&1
    ./consensus.sh 10 > ./consensus.000010.out 2>&1
    ./consensus.sh 11 > ./consensus.000011.out 2>&1

-- Finished on Fri Jan 16 03:12:07 2026 (423 seconds) with 4557824.234 GB free disk space
----------------------------------------
-- Using slow alignment for consensus (iteration '1').
-- Configured 11 consensus jobs.
-- All 11 consensus jobs finished successfully.
-- Finished stage 'consensusCheck', reset canuIteration.
-- Using slow alignment for consensus (iteration '0').
-- Configured 11 consensus jobs.
----------------------------------------
-- Starting command on Fri Jan 16 03:12:08 2026 with 4557824.187 GB free disk space

    cd unitigging
    /share/org/YZWL/yzwl_lixg/miniforge3/envs/canu_v.2.3/bin/tgStoreLoad \
      -S ../B4-1.seqStore \
      -T  ./B4-1.ctgStore 2 \
      -L ./5-consensus/ctgcns.files \
    > ./5-consensus/ctgcns.files.ctgStoreLoad.err 2>&1

-- Finished on Fri Jan 16 03:12:09 2026 (one second) with 4557823 GB free disk space
----------------------------------------
----------------------------------------
-- Starting command on Fri Jan 16 03:12:09 2026 with 4557823 GB free disk space

    cd unitigging
    /share/org/YZWL/yzwl_lixg/miniforge3/envs/canu_v.2.3/bin/tgTigDisplay \
      -S ../B4-1.seqStore \
      -b \
      -o ../B4-1.contigs.unsorted.bam \
      -L ./5-consensus/ctgcns.files \
    > ./5-consensus/ctgcns.files.contigs.bam.err 2>&1

-- Finished on Fri Jan 16 03:14:53 2026 (164 seconds) with 4557787.718 GB free disk space
----------------------------------------
----------------------------------------
-- Starting command on Fri Jan 16 03:14:53 2026 with 4557787.718 GB free disk space

    cd .
    samtools sort \
      --write-index \
      --threads 2 \
      -o ./B4-1.contigs.bam ./B4-1.contigs.unsorted.bam \
    > ./ctgcns.bam.err 2>&1

-- Finished on Fri Jan 16 03:15:56 2026 (63 seconds) with 4557760.031 GB free disk space
----------------------------------------
-- Purging consensus output after loading to ctgStore.
-- Purged 11 .cns outputs.
----------------------------------------
-- Starting command on Fri Jan 16 03:15:56 2026 with 4557763.078 GB free disk space

    cd unitigging
    /share/org/YZWL/yzwl_lixg/miniforge3/envs/canu_v.2.3/bin/tgStoreDump \
      -S ../B4-1.seqStore \
      -T ./B4-1.ctgStore 2 \
      -sizes -s 85000000 \
    > ./B4-1.ctgStore/seqDB.v002.sizes.txt
ZERO length suplied to intervalList::add(), ignoring interval.
ZERO length suplied to intervalList::add(), ignoring interval.
ZERO length suplied to intervalList::add(), ignoring interval.
ZERO length suplied to intervalList::add(), ignoring interval.
ZERO length suplied to intervalList::add(), ignoring interval.
ZERO length suplied to intervalList::add(), ignoring interval.
ZERO length suplied to intervalList::add(), ignoring interval.
ZERO length suplied to intervalList::add(), ignoring interval.
ZERO length suplied to intervalList::add(), ignoring interval.
ZERO length suplied to intervalList::add(), ignoring interval.
ZERO length suplied to intervalList::add(), ignoring interval.
ZERO length suplied to intervalList::add(), ignoring interval.
ZERO length suplied to intervalList::add(), ignoring interval.
ZERO length suplied to intervalList::add(), ignoring interval.
ZERO length suplied to intervalList::add(), ignoring interval.
ZERO length suplied to intervalList::add(), ignoring interval.
ZERO length suplied to intervalList::add(), ignoring interval.
ZERO length suplied to intervalList::add(), ignoring interval.
ZERO length suplied to intervalList::add(), ignoring interval.
ZERO length suplied to intervalList::add(), ignoring interval.
ZERO length suplied to intervalList::add(), ignoring interval.
ZERO length suplied to intervalList::add(), ignoring interval.
ZERO length suplied to intervalList::add(), ignoring interval.

-- Finished on Fri Jan 16 03:15:56 2026 (lickety-split) with 4557763.078 GB free disk space
----------------------------------------
-- Found, in version 2, after consensus generation:
--   contigs:      134 sequences, total length 92784639 bp (including 277 repeats of total length 14881958 bp).
--   bubbles:      637 sequences, total length 44977230 bp.
--   unassembled:  30540 sequences, total length 462229330 bp.
--
-- Contig sizes based on genome size 85mbp:
--
--            NG (bp)  LG (contigs)    sum (bp)
--         ----------  ------------  ----------
--     10    10947970             1    10947970
--     20     9873698             2    20821668
--     30     8078761             3    28900429
--     40     6396554             4    35296983
--     50     4497183             6    45799620
--     60     4361544             8    54568104
--     70     3035167            10    61199466
--     80     2053275            13    68698274
--     90     1419396            18    77409543
--    100      553396            27    85316153
--
-- Finished stage 'consensusLoad', reset canuIteration.
----------------------------------------
-- Starting command on Fri Jan 16 03:15:56 2026 with 4557763.062 GB free disk space

    cd .
    /share/org/YZWL/yzwl_lixg/miniforge3/envs/canu_v.2.3/bin/tgStoreDump \
      -S ./B4-1.seqStore \
      -T ./unitigging/B4-1.ctgStore 2 \
      -o ./B4-1.contigs \
      -layout \
    > ./B4-1.contigs.layout.err 2>&1

-- Finished on Fri Jan 16 03:15:57 2026 (one second) with 4557763.031 GB free disk space
----------------------------------------
----------------------------------------
-- Starting command on Fri Jan 16 03:15:57 2026 with 4557763.031 GB free disk space

    cd .
    /share/org/YZWL/yzwl_lixg/miniforge3/envs/canu_v.2.3/bin/tgStoreDump \
      -S ./B4-1.seqStore \
      -T ./unitigging/B4-1.ctgStore 2 \
      -consensus -fasta \
      -unassembled \
    > ./B4-1.unassembled.fasta
    2> ./B4-1.unassembled.err
ZERO length suplied to intervalList::add(), ignoring interval.
ZERO length suplied to intervalList::add(), ignoring interval.
ZERO length suplied to intervalList::add(), ignoring interval.
ZERO length suplied to intervalList::add(), ignoring interval.
ZERO length suplied to intervalList::add(), ignoring interval.
ZERO length suplied to intervalList::add(), ignoring interval.
ZERO length suplied to intervalList::add(), ignoring interval.
ZERO length suplied to intervalList::add(), ignoring interval.
ZERO length suplied to intervalList::add(), ignoring interval.
ZERO length suplied to intervalList::add(), ignoring interval.
ZERO length suplied to intervalList::add(), ignoring interval.
ZERO length suplied to intervalList::add(), ignoring interval.
ZERO length suplied to intervalList::add(), ignoring interval.
ZERO length suplied to intervalList::add(), ignoring interval.
ZERO length suplied to intervalList::add(), ignoring interval.
ZERO length suplied to intervalList::add(), ignoring interval.
ZERO length suplied to intervalList::add(), ignoring interval.
ZERO length suplied to intervalList::add(), ignoring interval.
ZERO length suplied to intervalList::add(), ignoring interval.
ZERO length suplied to intervalList::add(), ignoring interval.
ZERO length suplied to intervalList::add(), ignoring interval.
ZERO length suplied to intervalList::add(), ignoring interval.
ZERO length suplied to intervalList::add(), ignoring interval.

-- Finished on Fri Jan 16 03:15:59 2026 (2 seconds) with 4557762.578 GB free disk space
----------------------------------------
----------------------------------------
-- Starting command on Fri Jan 16 03:15:59 2026 with 4557762.578 GB free disk space

    cd .
    /share/org/YZWL/yzwl_lixg/miniforge3/envs/canu_v.2.3/bin/tgStoreDump \
      -S ./B4-1.seqStore \
      -T ./unitigging/B4-1.ctgStore 2 \
      -consensus -fasta \
      -contigs \
    > ./B4-1.contigs.fasta
    2> ./B4-1.contigs.err
ZERO length suplied to intervalList::add(), ignoring interval.
ZERO length suplied to intervalList::add(), ignoring interval.
ZERO length suplied to intervalList::add(), ignoring interval.
ZERO length suplied to intervalList::add(), ignoring interval.
ZERO length suplied to intervalList::add(), ignoring interval.
ZERO length suplied to intervalList::add(), ignoring interval.
ZERO length suplied to intervalList::add(), ignoring interval.
ZERO length suplied to intervalList::add(), ignoring interval.
ZERO length suplied to intervalList::add(), ignoring interval.
ZERO length suplied to intervalList::add(), ignoring interval.
ZERO length suplied to intervalList::add(), ignoring interval.
ZERO length suplied to intervalList::add(), ignoring interval.
ZERO length suplied to intervalList::add(), ignoring interval.
ZERO length suplied to intervalList::add(), ignoring interval.
ZERO length suplied to intervalList::add(), ignoring interval.
ZERO length suplied to intervalList::add(), ignoring interval.
ZERO length suplied to intervalList::add(), ignoring interval.
ZERO length suplied to intervalList::add(), ignoring interval.
ZERO length suplied to intervalList::add(), ignoring interval.
ZERO length suplied to intervalList::add(), ignoring interval.
ZERO length suplied to intervalList::add(), ignoring interval.
ZERO length suplied to intervalList::add(), ignoring interval.
ZERO length suplied to intervalList::add(), ignoring interval.

-- Finished on Fri Jan 16 03:16:00 2026 (one second) with 4557762.437 GB free disk space
----------------------------------------
-- Finished stage 'generateOutputs', reset canuIteration.
--
-- Assembly 'B4-1' finished in '/share/org/YZWL/yzwl_lixg/project/28.大豆疫霉菌三代基因组/03.hicanu/B4-1/01.raw_output'.
--
-- Summary saved in 'B4-1.report'.
--
-- Sequences saved:
--   Contigs       -> 'B4-1.contigs.fasta'
--   Unassembled   -> 'B4-1.unassembled.fasta'
--
-- Read layouts saved:
--   Contigs       -> 'B4-1.contigs.layout'.
--
-- Bye.

2026-01-16 03:16:00.268 - WARNING - 输出文件不存在|Output file does not exist: /share/org/YZWL/yzwl_lixg/project/28.大豆疫霉菌三代基因组/03.hicanu/B4-1/01.raw_output/B4-1.unitigs.fasta
Usage: biopytools ragtag [OPTIONS]
Try 'biopytools ragtag -h' for help.

Error: Invalid value for '-r' / '--reference': 文件不存在|File does not exist: /share/org/YZWL/yzwl_lixg/project/28.大豆疫霉菌三代基因组/04.ragtag/Psoja_T2T.fa
Usage: biopytools genomesyn [OPTIONS]
Try 'biopytools genomesyn -h' for help.

Error: Invalid value for '-i' / '--ref': Path '04.ragtag/B4-1/hicanu/B4-1_RagTag_scaffolded.fa' does not exist.
Job 68886836 stderr output:

