2026-01-13 14:53:50.172 - INFO - ============================================================
2026-01-13 14:53:50.172 - INFO - VCF抽样流程|VCF Sampling Pipeline
2026-01-13 14:53:50.172 - INFO - ============================================================
2026-01-13 14:53:50.172 - INFO - 输入文件|Input file: /share/org/YZWL/yzwl_lixg/project/21.野生大豆群体/05.所有样品/14.实验室的样品/06.第一次根据枝长筛选的样品/variation.filtered.snp.biallelic.vcf.gz
2026-01-13 14:53:50.172 - INFO - 输出文件|Output file: /share/org/YZWL/yzwl_lixg/project/21.野生大豆群体/05.所有样品/14.实验室的样品/06.第一次根据枝长筛选的样品/05.第一次选择的807个样品的admixture/lab.snp.025.vcf.gz
2026-01-13 14:53:50.172 - INFO - 抽样比例|Sampling rate: 25.0%
2026-01-13 14:53:50.172 - INFO - 随机种子|Random seed: 1288
2026-01-13 14:53:50.172 - INFO - ============================================================
2026-01-13 14:53:50.172 - INFO - 步骤1/3|Step 1/3: 统计SNP数量|Count SNPs by chromosome
2026-01-13 14:53:50.172 - INFO - ============================================================
2026-01-13 14:53:50.172 - INFO - 开始统计每条染色体的SNP数量|Start counting SNPs by chromosome
2026-01-13 14:53:50.173 - INFO - 检测到VCF索引|VCF index detected
2026-01-13 14:53:50.274 - INFO - 检测到|Detected 20 条染色体|chromosomes
2026-01-13 14:55:08.826 - DEBUG - 染色体|Chromosome Chr01: 415,612 个SNP|SNPs
2026-01-13 14:56:05.780 - DEBUG - 染色体|Chromosome Chr02: 303,238 个SNP|SNPs
2026-01-13 14:57:13.554 - DEBUG - 染色体|Chromosome Chr03: 359,614 个SNP|SNPs
2026-01-13 14:58:18.639 - DEBUG - 染色体|Chromosome Chr04: 342,297 个SNP|SNPs
2026-01-13 14:59:09.342 - DEBUG - 染色体|Chromosome Chr05: 269,105 个SNP|SNPs
2026-01-13 15:00:20.166 - DEBUG - 染色体|Chromosome Chr06: 375,583 个SNP|SNPs
2026-01-13 15:01:13.413 - DEBUG - 染色体|Chromosome Chr07: 281,752 个SNP|SNPs
2026-01-13 15:02:09.458 - DEBUG - 染色体|Chromosome Chr08: 297,810 个SNP|SNPs
2026-01-13 15:03:13.533 - DEBUG - 染色体|Chromosome Chr09: 339,134 个SNP|SNPs
2026-01-13 15:04:21.056 - DEBUG - 染色体|Chromosome Chr10: 358,823 个SNP|SNPs
2026-01-13 15:05:07.866 - DEBUG - 染色体|Chromosome Chr11: 250,046 个SNP|SNPs
2026-01-13 15:06:08.143 - DEBUG - 染色体|Chromosome Chr12: 320,941 个SNP|SNPs
2026-01-13 15:07:02.882 - DEBUG - 染色体|Chromosome Chr13: 291,299 个SNP|SNPs
2026-01-13 15:08:14.923 - DEBUG - 染色体|Chromosome Chr14: 380,899 个SNP|SNPs
2026-01-13 15:09:39.220 - DEBUG - 染色体|Chromosome Chr15: 448,738 个SNP|SNPs
2026-01-13 15:10:39.987 - DEBUG - 染色体|Chromosome Chr16: 320,682 个SNP|SNPs
2026-01-13 15:11:33.801 - DEBUG - 染色体|Chromosome Chr17: 285,869 个SNP|SNPs
2026-01-13 15:13:14.912 - DEBUG - 染色体|Chromosome Chr18: 537,078 个SNP|SNPs
2026-01-13 15:14:24.014 - DEBUG - 染色体|Chromosome Chr19: 363,268 个SNP|SNPs
2026-01-13 15:15:31.288 - DEBUG - 染色体|Chromosome Chr20: 356,716 个SNP|SNPs
2026-01-13 15:15:31.334 - INFO - 总SNP数量|Total SNP count: 6,898,504
2026-01-13 15:15:31.334 - INFO - 染色体数量|Chromosome count: 20
2026-01-13 15:15:31.334 - INFO - 步骤1完成|Step 1 completed
2026-01-13 15:15:31.334 - INFO - 
2026-01-13 15:15:31.334 - INFO - 步骤2/3|Step 2/3: 选择SNP索引|Select SNP indices
2026-01-13 15:15:31.334 - INFO - ============================================================
2026-01-13 15:15:31.334 - INFO - 开始随机抽取SNP (抽样比例|sampling rate: 25.0%)
2026-01-13 15:15:32.068 - INFO - 总共选择|Total selected: 1,724,618 个SNP|SNPs
2026-01-13 15:15:32.068 - INFO - 步骤2完成|Step 2 completed
2026-01-13 15:15:32.068 - INFO - 
2026-01-13 15:15:32.068 - INFO - 步骤3/3|Step 3/3: 写入抽样结果|Write sampled results
2026-01-13 15:15:32.068 - INFO - ============================================================
2026-01-13 15:15:32.068 - INFO - 开始写入抽样的VCF文件|Start writing sampled VCF file
2026-01-13 15:58:06.278 - INFO - 总SNP数|Total SNP count: 6,898,504
2026-01-13 15:58:06.287 - INFO - 写入的SNP数|Written SNP count: 1,724,618
2026-01-13 15:58:06.287 - INFO - 实际抽样比例|Actual sampling rate: 25.00% (目标|target: 25.0%)
2026-01-13 15:58:06.287 - INFO - 输出文件|Output file: /share/org/YZWL/yzwl_lixg/project/21.野生大豆群体/05.所有样品/14.实验室的样品/06.第一次根据枝长筛选的样品/05.第一次选择的807个样品的admixture/lab.snp.025.vcf.gz
2026-01-13 15:58:06.287 - INFO - 创建VCF索引|Creating VCF index...
2026-01-13 16:00:38.262 - INFO - 索引创建成功|Index created successfully
2026-01-13 16:00:38.262 - INFO - 步骤3完成|Step 3 completed
2026-01-13 16:00:38.262 - INFO - 
2026-01-13 16:00:38.262 - INFO - ============================================================
2026-01-13 16:00:38.262 - INFO - 抽样总结|Sampling Summary
2026-01-13 16:00:38.262 - INFO - ============================================================
2026-01-13 16:00:38.262 - INFO - 总SNP数|Total SNPs: 6,898,504
2026-01-13 16:00:38.262 - INFO - 抽取的SNP数|Sampled SNPs: 1,724,618
2026-01-13 16:00:38.263 - INFO - 实际抽样比例|Actual sampling rate: 25.00% (目标|target: 25.0%)
2026-01-13 16:00:38.263 - INFO - 运行时间|Runtime: 4008.09 秒|seconds
2026-01-13 16:00:38.263 - INFO - 输出文件|Output file: /share/org/YZWL/yzwl_lixg/project/21.野生大豆群体/05.所有样品/14.实验室的样品/06.第一次根据枝长筛选的样品/05.第一次选择的807个样品的admixture/lab.snp.025.vcf.gz
2026-01-13 16:00:38.263 - INFO - ============================================================
2026-01-13 16:00:38.263 - INFO - VCF抽样流程成功完成|VCF sampling pipeline completed successfully
2026-01-13 16:00:42.667 - INFO - === 软件环境检查|Software Environment Check ===
2026-01-13 16:00:42.706 - INFO - plink 已安装|plink is installed
2026-01-13 16:00:42.718 - INFO - admixture 已安装|admixture is installed
2026-01-13 16:00:42.762 - INFO - bcftools 已安装|bcftools is installed
2026-01-13 16:00:42.903 - INFO - Rscript 已安装|Rscript is installed
2026-01-13 16:00:42.904 - INFO - ================================================================================
2026-01-13 16:00:42.904 - INFO - 程序|Program: ADMIXTURE Population Structure Analysis
2026-01-13 16:00:42.904 - INFO - 版本|Version: 1.0.0
2026-01-13 16:00:42.904 - INFO - ================================================================================
2026-01-13 16:00:42.904 - INFO - ================================================================================
2026-01-13 16:00:42.904 - INFO - 开始ADMIXTURE群体结构分析|Starting ADMIXTURE Population Structure Analysis
2026-01-13 16:00:42.904 - INFO - ================================================================================
2026-01-13 16:00:42.904 - INFO - 输入VCF文件|Input VCF file: /share/org/YZWL/yzwl_lixg/project/21.野生大豆群体/05.所有样品/14.实验室的样品/06.第一次根据枝长筛选的样品/05.第一次选择的807个样品的admixture/lab.snp.025.vcf.gz
2026-01-13 16:00:42.904 - INFO - 输出目录|Output directory: /share/org/YZWL/yzwl_lixg/project/21.野生大豆群体/05.所有样品/14.实验室的样品/06.第一次根据枝长筛选的样品/05.第一次选择的807个样品的admixture
2026-01-13 16:00:42.904 - INFO - K值范围|K range: 2-20
2026-01-13 16:00:42.904 - INFO - 线程数|Threads: 64
2026-01-13 16:00:42.904 - INFO - ================================================================================
2026-01-13 16:00:42.904 - INFO - 步骤1: VCF文件预处理|Step 1: VCF file preprocessing
2026-01-13 16:00:42.904 - INFO - 跳过VCF预处理|Skipping VCF preprocessing
2026-01-13 16:00:42.904 - INFO - 步骤2: 转换为PLINK格式|Step 2: Convert to PLINK format
2026-01-13 16:00:42.904 - INFO - 开始|Starting: 检测染色体数量|Detect chromosome count
2026-01-13 16:00:42.904 - INFO - 执行命令|Executing command: zcat /share/org/YZWL/yzwl_lixg/project/21.野生大豆群体/05.所有样品/14.实验室的样品/06.第一次根据枝长筛选的样品/05.第一次选择的807个样品的admixture/lab.snp.025.vcf.gz|grep -v '^#'|cut -f1|sort -n|uniq|wc -l
2026-01-13 16:04:11.378 - INFO - 命令输出|Command output:
20
2026-01-13 16:04:11.378 - INFO - 完成|Completed: 检测染色体数量|Detect chromosome count
2026-01-13 16:04:11.378 - INFO - 检测到 20 个染色体|Detected 20 chromosomes
2026-01-13 16:04:11.378 - INFO - 设置autosome-num参数为 20|Set autosome-num parameter to 20
2026-01-13 16:04:11.378 - INFO - 开始|Starting: VCF转换为PLINK格式|Convert VCF to PLINK format
2026-01-13 16:04:11.378 - INFO - 执行命令|Executing command: plink --vcf /share/org/YZWL/yzwl_lixg/project/21.野生大豆群体/05.所有样品/14.实验室的样品/06.第一次根据枝长筛选的样品/05.第一次选择的807个样品的admixture/lab.snp.025.vcf.gz --make-bed --out /share/org/YZWL/yzwl_lixg/project/21.野生大豆群体/05.所有样品/14.实验室的样品/06.第一次根据枝长筛选的样品/05.第一次选择的807个样品的admixture/raw_data --allow-extra-chr --double-id --autosome-num 20
2026-01-13 16:06:24.687 - INFO - 命令输出|Command output:
PLINK v1.9.0-b.8 64-bit (22 Oct 2024)              cog-genomics.org/plink/1.9/
(C) 2005-2024 Shaun Purcell, Christopher Chang   GNU General Public License v3
Logging to /share/org/YZWL/yzwl_lixg/project/21.野生大豆群体/05.所有样品/14.实验室的样品/06.第一次根据枝长筛选的样品/05.第一次选择的807个样品的admixture/raw_data.log.
Options in effect:
  --allow-extra-chr
  --autosome-num 20
  --double-id
  --make-bed
  --out /share/org/YZWL/yzwl_lixg/project/21.野生大豆群体/05.所有样品/14.实验室的样品/06.第一次根据枝长筛选的样品/05.第一次选择的807个样品的admixture/raw_data
  --vcf /share/org/YZWL/yzwl_lixg/project/21.野生大豆群体/05.所有样品/14.实验室的样品/06.第一次根据枝长筛选的样品/05.第一次选择的807个样品的admixture/lab.snp.025.vcf.gz

515165 MB RAM detected; reserving 257582 MB for main workspace.

--vcf: 1k variants complete.
--vcf: 2k variants complete.
--vcf: 3k variants complete.
--vcf: 4k variants complete.
--vcf: 5k variants complete.
--vcf: 6k variants complete.
--vcf: 7k variants complete.
--vcf: 8k variants complete.
--vcf: 9k variants complete.
--vcf: 10k variants complete.
--vcf: 11k variants complete.
--vcf: 12k variants complete.
--vcf: 13k variants complete.
--vcf: 14k variants complete.
--vcf: 15k variants complete.
--vcf: 16k variants complete.
--vcf: 17k variants complete.
--vcf: 18k variants complete.
--vcf: 19k variants complete.
--vcf: 20k variants complete.
--vcf: 21k variants complete.
--vcf: 22k variants complete.
--vcf: 23k variants complete.
--vcf: 24k variants complete.
--vcf: 25k variants complete.
--vcf: 26k variants complete.
--vcf: 27k variants complete.
--vcf: 28k variants complete.
--vcf: 29k variants complete.
--vcf: 30k variants complete.
--vcf: 31k variants complete.
--vcf: 32k variants complete.
--vcf: 33k variants complete.
--vcf: 34k variants complete.
--vcf: 35k variants complete.
--vcf: 36k variants complete.
--vcf: 37k variants complete.
--vcf: 38k variants complete.
--vcf: 39k variants complete.
--vcf: 40k variants complete.
--vcf: 41k variants complete.
--vcf: 42k variants complete.
--vcf: 43k variants complete.
--vcf: 44k variants complete.
--vcf: 45k variants complete.
--vcf: 46k variants complete.
--vcf: 47k variants complete.
--vcf: 48k variants complete.
--vcf: 49k variants complete.
--vcf: 50k variants complete.
--vcf: 51k variants complete.
--vcf: 52k variants complete.
--vcf: 53k variants complete.
--vcf: 54k variants complete.
--vcf: 55k variants complete.
--vcf: 56k variants complete.
--vcf: 57k variants complete.
--vcf: 58k variants complete.
--vcf: 59k variants complete.
--vcf: 60k variants complete.
--vcf: 61k variants complete.
--vcf: 62k variants complete.
--vcf: 63k variants complete.
--vcf: 64k variants complete.
--vcf: 65k variants complete.
--vcf: 66k variants complete.
--vcf: 67k variants complete.
--vcf: 68k variants complete.
--vcf: 69k variants complete.
--vcf: 70k variants complete.
--vcf: 71k variants complete.
--vcf: 72k variants complete.
--vcf: 73k variants complete.
--vcf: 74k variants complete.
--vcf: 75k variants complete.
--vcf: 76k variants complete.
--vcf: 77k variants complete.
--vcf: 78k variants complete.
--vcf: 79k variants complete.
--vcf: 80k variants complete.
--vcf: 81k variants complete.
--vcf: 82k variants complete.
--vcf: 83k variants complete.
--vcf: 84k variants complete.
--vcf: 85k variants complete.
--vcf: 86k variants complete.
--vcf: 87k variants complete.
--vcf: 88k variants complete.
--vcf: 89k variants complete.
--vcf: 90k variants complete.
--vcf: 91k variants complete.
--vcf: 92k variants complete.
--vcf: 93k variants complete.
--vcf: 94k variants complete.
--vcf: 95k variants complete.
--vcf: 96k variants complete.
--vcf: 97k variants complete.
--vcf: 98k variants complete.
--vcf: 99k variants complete.
--vcf: 100k variants complete.
--vcf: 101k variants complete.
--vcf: 102k variants complete.
--vcf: 103k variants complete.
--vcf: 104k variants complete.
--vcf: 105k variants complete.
--vcf: 106k variants complete.
--vcf: 107k variants complete.
--vcf: 108k variants complete.
--vcf: 109k variants complete.
--vcf: 110k variants complete.
--vcf: 111k variants complete.
--vcf: 112k variants complete.
--vcf: 113k variants complete.
--vcf: 114k variants complete.
--vcf: 115k variants complete.
--vcf: 116k variants complete.
--vcf: 117k variants complete.
--vcf: 118k variants complete.
--vcf: 119k variants complete.
--vcf: 120k variants complete.
--vcf: 121k variants complete.
--vcf: 122k variants complete.
--vcf: 123k variants complete.
--vcf: 124k variants complete.
--vcf: 125k variants complete.
--vcf: 126k variants complete.
--vcf: 127k variants complete.
--vcf: 128k variants complete.
--vcf: 129k variants complete.
--vcf: 130k variants complete.
--vcf: 131k variants complete.
--vcf: 132k variants complete.
--vcf: 133k variants complete.
--vcf: 134k variants complete.
--vcf: 135k variants complete.
--vcf: 136k variants complete.
--vcf: 137k variants complete.
--vcf: 138k variants complete.
--vcf: 139k variants complete.
--vcf: 140k variants complete.
--vcf: 141k variants complete.
--vcf: 142k variants complete.
--vcf: 143k variants complete.
--vcf: 144k variants complete.
--vcf: 145k variants complete.
--vcf: 146k variants complete.
--vcf: 147k variants complete.
--vcf: 148k variants complete.
--vcf: 149k variants complete.
--vcf: 150k variants complete.
--vcf: 151k variants complete.
--vcf: 152k variants complete.
--vcf: 153k variants complete.
--vcf: 154k variants complete.
--vcf: 155k variants complete.
--vcf: 156k variants complete.
--vcf: 157k variants complete.
--vcf: 158k variants complete.
--vcf: 159k variants complete.
--vcf: 160k variants complete.
--vcf: 161k variants complete.
--vcf: 162k variants complete.
--vcf: 163k variants complete.
--vcf: 164k variants complete.
--vcf: 165k variants complete.
--vcf: 166k variants complete.
--vcf: 167k variants complete.
--vcf: 168k variants complete.
--vcf: 169k variants complete.
--vcf: 170k variants complete.
--vcf: 171k variants complete.
--vcf: 172k variants complete.
--vcf: 173k variants complete.
--vcf: 174k variants complete.
--vcf: 175k variants complete.
--vcf: 176k variants complete.
--vcf: 177k variants complete.
--vcf: 178k variants complete.
--vcf: 179k variants complete.
--vcf: 180k variants complete.
--vcf: 181k variants complete.
--vcf: 182k variants complete.
--vcf: 183k variants complete.
--vcf: 184k variants complete.
--vcf: 185k variants complete.
--vcf: 186k variants complete.
--vcf: 187k variants complete.
--vcf: 188k variants complete.
--vcf: 189k variants complete.
--vcf: 190k variants complete.
--vcf: 191k variants complete.
--vcf: 192k variants complete.
--vcf: 193k variants complete.
--vcf: 194k variants complete.
--vcf: 195k variants complete.
--vcf: 196k variants complete.
--vcf: 197k variants complete.
--vcf: 198k variants complete.
--vcf: 199k variants complete.
--vcf: 200k variants complete.
--vcf: 201k variants complete.
--vcf: 202k variants complete.
--vcf: 203k variants complete.
--vcf: 204k variants complete.
--vcf: 205k variants complete.
--vcf: 206k variants complete.
--vcf: 207k variants complete.
--vcf: 208k variants complete.
--vcf: 209k variants complete.
--vcf: 210k variants complete.
--vcf: 211k variants complete.
--vcf: 212k variants complete.
--vcf: 213k variants complete.
--vcf: 214k variants complete.
--vcf: 215k variants complete.
--vcf: 216k variants complete.
--vcf: 217k variants complete.
--vcf: 218k variants complete.
--vcf: 219k variants complete.
--vcf: 220k variants complete.
--vcf: 221k variants complete.
--vcf: 222k variants complete.
--vcf: 223k variants complete.
--vcf: 224k variants complete.
--vcf: 225k variants complete.
--vcf: 226k variants complete.
--vcf: 227k variants complete.
--vcf: 228k variants complete.
--vcf: 229k variants complete.
--vcf: 230k variants complete.
--vcf: 231k variants complete.
--vcf: 232k variants complete.
--vcf: 233k variants complete.
--vcf: 234k variants complete.
--vcf: 235k variants complete.
--vcf: 236k variants complete.
--vcf: 237k variants complete.
--vcf: 238k variants complete.
--vcf: 239k variants complete.
--vcf: 240k variants complete.
--vcf: 241k variants complete.
--vcf: 242k variants complete.
--vcf: 243k variants complete.
--vcf: 244k variants complete.
--vcf: 245k variants complete.
--vcf: 246k variants complete.
--vcf: 247k variants complete.
--vcf: 248k variants complete.
--vcf: 249k variants complete.
--vcf: 250k variants complete.
--vcf: 251k variants complete.
--vcf: 252k variants complete.
--vcf: 253k variants complete.
--vcf: 254k variants complete.
--vcf: 255k variants complete.
--vcf: 256k variants complete.
--vcf: 257k variants complete.
--vcf: 258k variants complete.
--vcf: 259k variants complete.
--vcf: 260k variants complete.
--vcf: 261k variants complete.
--vcf: 262k variants complete.
--vcf: 263k variants complete.
--vcf: 264k variants complete.
--vcf: 265k variants complete.
--vcf: 266k variants complete.
--vcf: 267k variants complete.
--vcf: 268k variants complete.
--vcf: 269k variants complete.
--vcf: 270k variants complete.
--vcf: 271k variants complete.
--vcf: 272k variants complete.
--vcf: 273k variants complete.
--vcf: 274k variants complete.
--vcf: 275k variants complete.
--vcf: 276k variants complete.
--vcf: 277k variants complete.
--vcf: 278k variants complete.
--vcf: 279k variants complete.
--vcf: 280k variants complete.
--vcf: 281k variants complete.
--vcf: 282k variants complete.
--vcf: 283k variants complete.
--vcf: 284k variants complete.
--vcf: 285k variants complete.
--vcf: 286k variants complete.
--vcf: 287k variants complete.
--vcf: 288k variants complete.
--vcf: 289k variants complete.
--vcf: 290k variants complete.
--vcf: 291k variants complete.
--vcf: 292k variants complete.
--vcf: 293k variants complete.
--vcf: 294k variants complete.
--vcf: 295k variants complete.
--vcf: 296k variants complete.
--vcf: 297k variants complete.
--vcf: 298k variants complete.
--vcf: 299k variants complete.
--vcf: 300k variants complete.
--vcf: 301k variants complete.
--vcf: 302k variants complete.
--vcf: 303k variants complete.
--vcf: 304k variants complete.
--vcf: 305k variants complete.
--vcf: 306k variants complete.
--vcf: 307k variants complete.
--vcf: 308k variants complete.
--vcf: 309k variants complete.
--vcf: 310k variants complete.
--vcf: 311k variants complete.
--vcf: 312k variants complete.
--vcf: 313k variants complete.
--vcf: 314k variants complete.
--vcf: 315k variants complete.
--vcf: 316k variants complete.
--vcf: 317k variants complete.
--vcf: 318k variants complete.
--vcf: 319k variants complete.
--vcf: 320k variants complete.
--vcf: 321k variants complete.
--vcf: 322k variants complete.
--vcf: 323k variants complete.
--vcf: 324k variants complete.
--vcf: 325k variants complete.
--vcf: 326k variants complete.
--vcf: 327k variants complete.
--vcf: 328k variants complete.
--vcf: 329k variants complete.
--vcf: 330k variants complete.
--vcf: 331k variants complete.
--vcf: 332k variants complete.
--vcf: 333k variants complete.
--vcf: 334k variants complete.
--vcf: 335k variants complete.
--vcf: 336k variants complete.
--vcf: 337k variants complete.
--vcf: 338k variants complete.
--vcf: 339k variants complete.
--vcf: 340k variants complete.
--vcf: 341k variants complete.
--vcf: 342k variants complete.
--vcf: 343k variants complete.
--vcf: 344k variants complete.
--vcf: 345k variants complete.
--vcf: 346k variants complete.
--vcf: 347k variants complete.
--vcf: 348k variants complete.
--vcf: 349k variants complete.
--vcf: 350k variants complete.
--vcf: 351k variants complete.
--vcf: 352k variants complete.
--vcf: 353k variants complete.
--vcf: 354k variants complete.
--vcf: 355k variants complete.
--vcf: 356k variants complete.
--vcf: 357k variants complete.
--vcf: 358k variants complete.
--vcf: 359k variants complete.
--vcf: 360k variants complete.
--vcf: 361k variants complete.
--vcf: 362k variants complete.
--vcf: 363k variants complete.
--vcf: 364k variants complete.
--vcf: 365k variants complete.
--vcf: 366k variants complete.
--vcf: 367k variants complete.
--vcf: 368k variants complete.
--vcf: 369k variants complete.
--vcf: 370k variants complete.
--vcf: 371k variants complete.
--vcf: 372k variants complete.
--vcf: 373k variants complete.
--vcf: 374k variants complete.
--vcf: 375k variants complete.
--vcf: 376k variants complete.
--vcf: 377k variants complete.
--vcf: 378k variants complete.
--vcf: 379k variants complete.
--vcf: 380k variants complete.
--vcf: 381k variants complete.
--vcf: 382k variants complete.
--vcf: 383k variants complete.
--vcf: 384k variants complete.
--vcf: 385k variants complete.
--vcf: 386k variants complete.
--vcf: 387k variants complete.
--vcf: 388k variants complete.
--vcf: 389k variants complete.
--vcf: 390k variants complete.
--vcf: 391k variants complete.
--vcf: 392k variants complete.
--vcf: 393k variants complete.
--vcf: 394k variants complete.
--vcf: 395k variants complete.
--vcf: 396k variants complete.
--vcf: 397k variants complete.
--vcf: 398k variants complete.
--vcf: 399k variants complete.
--vcf: 400k variants complete.
--vcf: 401k variants complete.
--vcf: 402k variants complete.
--vcf: 403k variants complete.
--vcf: 404k variants complete.
--vcf: 405k variants complete.
--vcf: 406k variants complete.
--vcf: 407k variants complete.
--vcf: 408k variants complete.
--vcf: 409k variants complete.
--vcf: 410k variants complete.
--vcf: 411k variants complete.
--vcf: 412k variants complete.
--vcf: 413k variants complete.
--vcf: 414k variants complete.
--vcf: 415k variants complete.
--vcf: 416k variants complete.
--vcf: 417k variants complete.
--vcf: 418k variants complete.
--vcf: 419k variants complete.
--vcf: 420k variants complete.
--vcf: 421k variants complete.
--vcf: 422k variants complete.
--vcf: 423k variants complete.
--vcf: 424k variants complete.
--vcf: 425k variants complete.
--vcf: 426k variants complete.
--vcf: 427k variants complete.
--vcf: 428k variants complete.
--vcf: 429k variants complete.
--vcf: 430k variants complete.
--vcf: 431k variants complete.
--vcf: 432k variants complete.
--vcf: 433k variants complete.
--vcf: 434k variants complete.
--vcf: 435k variants complete.
--vcf: 436k variants complete.
--vcf: 437k variants complete.
--vcf: 438k variants complete.
--vcf: 439k variants complete.
--vcf: 440k variants complete.
--vcf: 441k variants complete.
--vcf: 442k variants complete.
--vcf: 443k variants complete.
--vcf: 444k variants complete.
--vcf: 445k variants complete.
--vcf: 446k variants complete.
--vcf: 447k variants complete.
--vcf: 448k variants complete.
--vcf: 449k variants complete.
--vcf: 450k variants complete.
--vcf: 451k variants complete.
--vcf: 452k variants complete.
--vcf: 453k variants complete.
--vcf: 454k variants complete.
--vcf: 455k variants complete.
--vcf: 456k variants complete.
--vcf: 457k variants complete.
--vcf: 458k variants complete.
--vcf: 459k variants complete.
--vcf: 460k variants complete.
--vcf: 461k variants complete.
--vcf: 462k variants complete.
--vcf: 463k variants complete.
--vcf: 464k variants complete.
--vcf: 465k variants complete.
--vcf: 466k variants complete.
--vcf: 467k variants complete.
--vcf: 468k variants complete.
--vcf: 469k variants complete.
--vcf: 470k variants complete.
--vcf: 471k variants complete.
--vcf: 472k variants complete.
--vcf: 473k variants complete.
--vcf: 474k variants complete.
--vcf: 475k variants complete.
--vcf: 476k variants complete.
--vcf: 477k variants complete.
--vcf: 478k variants complete.
--vcf: 479k variants complete.
--vcf: 480k variants complete.
--vcf: 481k variants complete.
--vcf: 482k variants complete.
--vcf: 483k variants complete.
--vcf: 484k variants complete.
--vcf: 485k variants complete.
--vcf: 486k variants complete.
--vcf: 487k variants complete.
--vcf: 488k variants complete.
--vcf: 489k variants complete.
--vcf: 490k variants complete.
--vcf: 491k variants complete.
--vcf: 492k variants complete.
--vcf: 493k variants complete.
--vcf: 494k variants complete.
--vcf: 495k variants complete.
--vcf: 496k variants complete.
--vcf: 497k variants complete.
--vcf: 498k variants complete.
--vcf: 499k variants complete.
--vcf: 500k variants complete.
--vcf: 501k variants complete.
--vcf: 502k variants complete.
--vcf: 503k variants complete.
--vcf: 504k variants complete.
--vcf: 505k variants complete.
--vcf: 506k variants complete.
--vcf: 507k variants complete.
--vcf: 508k variants complete.
--vcf: 509k variants complete.
--vcf: 510k variants complete.
--vcf: 511k variants complete.
--vcf: 512k variants complete.
--vcf: 513k variants complete.
--vcf: 514k variants complete.
--vcf: 515k variants complete.
--vcf: 516k variants complete.
--vcf: 517k variants complete.
--vcf: 518k variants complete.
--vcf: 519k variants complete.
--vcf: 520k variants complete.
--vcf: 521k variants complete.
--vcf: 522k variants complete.
--vcf: 523k variants complete.
--vcf: 524k variants complete.
--vcf: 525k variants complete.
--vcf: 526k variants complete.
--vcf: 527k variants complete.
--vcf: 528k variants complete.
--vcf: 529k variants complete.
--vcf: 530k variants complete.
--vcf: 531k variants complete.
--vcf: 532k variants complete.
--vcf: 533k variants complete.
--vcf: 534k variants complete.
--vcf: 535k variants complete.
--vcf: 536k variants complete.
--vcf: 537k variants complete.
--vcf: 538k variants complete.
--vcf: 539k variants complete.
--vcf: 540k variants complete.
--vcf: 541k variants complete.
--vcf: 542k variants complete.
--vcf: 543k variants complete.
--vcf: 544k variants complete.
--vcf: 545k variants complete.
--vcf: 546k variants complete.
--vcf: 547k variants complete.
--vcf: 548k variants complete.
--vcf: 549k variants complete.
--vcf: 550k variants complete.
--vcf: 551k variants complete.
--vcf: 552k variants complete.
--vcf: 553k variants complete.
--vcf: 554k variants complete.
--vcf: 555k variants complete.
--vcf: 556k variants complete.
--vcf: 557k variants complete.
--vcf: 558k variants complete.
--vcf: 559k variants complete.
--vcf: 560k variants complete.
--vcf: 561k variants complete.
--vcf: 562k variants complete.
--vcf: 563k variants complete.
--vcf: 564k variants complete.
--vcf: 565k variants complete.
--vcf: 566k variants complete.
--vcf: 567k variants complete.
--vcf: 568k variants complete.
--vcf: 569k variants complete.
--vcf: 570k variants complete.
--vcf: 571k variants complete.
--vcf: 572k variants complete.
--vcf: 573k variants complete.
--vcf: 574k variants complete.
--vcf: 575k variants complete.
--vcf: 576k variants complete.
--vcf: 577k variants complete.
--vcf: 578k variants complete.
--vcf: 579k variants complete.
--vcf: 580k variants complete.
--vcf: 581k variants complete.
--vcf: 582k variants complete.
--vcf: 583k variants complete.
--vcf: 584k variants complete.
--vcf: 585k variants complete.
--vcf: 586k variants complete.
--vcf: 587k variants complete.
--vcf: 588k variants complete.
--vcf: 589k variants complete.
--vcf: 590k variants complete.
--vcf: 591k variants complete.
--vcf: 592k variants complete.
--vcf: 593k variants complete.
--vcf: 594k variants complete.
--vcf: 595k variants complete.
--vcf: 596k variants complete.
--vcf: 597k variants complete.
--vcf: 598k variants complete.
--vcf: 599k variants complete.
--vcf: 600k variants complete.
--vcf: 601k variants complete.
--vcf: 602k variants complete.
--vcf: 603k variants complete.
--vcf: 604k variants complete.
--vcf: 605k variants complete.
--vcf: 606k variants complete.
--vcf: 607k variants complete.
--vcf: 608k variants complete.
--vcf: 609k variants complete.
--vcf: 610k variants complete.
--vcf: 611k variants complete.
--vcf: 612k variants complete.
--vcf: 613k variants complete.
--vcf: 614k variants complete.
--vcf: 615k variants complete.
--vcf: 616k variants complete.
--vcf: 617k variants complete.
--vcf: 618k variants complete.
--vcf: 619k variants complete.
--vcf: 620k variants complete.
--vcf: 621k variants complete.
--vcf: 622k variants complete.
--vcf: 623k variants complete.
--vcf: 624k variants complete.
--vcf: 625k variants complete.
--vcf: 626k variants complete.
--vcf: 627k variants complete.
--vcf: 628k variants complete.
--vcf: 629k variants complete.
--vcf: 630k variants complete.
--vcf: 631k variants complete.
--vcf: 632k variants complete.
--vcf: 633k variants complete.
--vcf: 634k variants complete.
--vcf: 635k variants complete.
--vcf: 636k variants complete.
--vcf: 637k variants complete.
--vcf: 638k variants complete.
--vcf: 639k variants complete.
--vcf: 640k variants complete.
--vcf: 641k variants complete.
--vcf: 642k variants complete.
--vcf: 643k variants complete.
--vcf: 644k variants complete.
--vcf: 645k variants complete.
--vcf: 646k variants complete.
--vcf: 647k variants complete.
--vcf: 648k variants complete.
--vcf: 649k variants complete.
--vcf: 650k variants complete.
--vcf: 651k variants complete.
--vcf: 652k variants complete.
--vcf: 653k variants complete.
--vcf: 654k variants complete.
--vcf: 655k variants complete.
--vcf: 656k variants complete.
--vcf: 657k variants complete.
--vcf: 658k variants complete.
--vcf: 659k variants complete.
--vcf: 660k variants complete.
--vcf: 661k variants complete.
--vcf: 662k variants complete.
--vcf: 663k variants complete.
--vcf: 664k variants complete.
--vcf: 665k variants complete.
--vcf: 666k variants complete.
--vcf: 667k variants complete.
--vcf: 668k variants complete.
--vcf: 669k variants complete.
--vcf: 670k variants complete.
--vcf: 671k variants complete.
--vcf: 672k variants complete.
--vcf: 673k variants complete.
--vcf: 674k variants complete.
--vcf: 675k variants complete.
--vcf: 676k variants complete.
--vcf: 677k variants complete.
--vcf: 678k variants complete.
--vcf: 679k variants complete.
--vcf: 680k variants complete.
--vcf: 681k variants complete.
--vcf: 682k variants complete.
--vcf: 683k variants complete.
--vcf: 684k variants complete.
--vcf: 685k variants complete.
--vcf: 686k variants complete.
--vcf: 687k variants complete.
--vcf: 688k variants complete.
--vcf: 689k variants complete.
--vcf: 690k variants complete.
--vcf: 691k variants complete.
--vcf: 692k variants complete.
--vcf: 693k variants complete.
--vcf: 694k variants complete.
--vcf: 695k variants complete.
--vcf: 696k variants complete.
--vcf: 697k variants complete.
--vcf: 698k variants complete.
--vcf: 699k variants complete.
--vcf: 700k variants complete.
--vcf: 701k variants complete.
--vcf: 702k variants complete.
--vcf: 703k variants complete.
--vcf: 704k variants complete.
--vcf: 705k variants complete.
--vcf: 706k variants complete.
--vcf: 707k variants complete.
--vcf: 708k variants complete.
--vcf: 709k variants complete.
--vcf: 710k variants complete.
--vcf: 711k variants complete.
--vcf: 712k variants complete.
--vcf: 713k variants complete.
--vcf: 714k variants complete.
--vcf: 715k variants complete.
--vcf: 716k variants complete.
--vcf: 717k variants complete.
--vcf: 718k variants complete.
--vcf: 719k variants complete.
--vcf: 720k variants complete.
--vcf: 721k variants complete.
--vcf: 722k variants complete.
--vcf: 723k variants complete.
--vcf: 724k variants complete.
--vcf: 725k variants complete.
--vcf: 726k variants complete.
--vcf: 727k variants complete.
--vcf: 728k variants complete.
--vcf: 729k variants complete.
--vcf: 730k variants complete.
--vcf: 731k variants complete.
--vcf: 732k variants complete.
--vcf: 733k variants complete.
--vcf: 734k variants complete.
--vcf: 735k variants complete.
--vcf: 736k variants complete.
--vcf: 737k variants complete.
--vcf: 738k variants complete.
--vcf: 739k variants complete.
--vcf: 740k variants complete.
--vcf: 741k variants complete.
--vcf: 742k variants complete.
--vcf: 743k variants complete.
--vcf: 744k variants complete.
--vcf: 745k variants complete.
--vcf: 746k variants complete.
--vcf: 747k variants complete.
--vcf: 748k variants complete.
--vcf: 749k variants complete.
--vcf: 750k variants complete.
--vcf: 751k variants complete.
--vcf: 752k variants complete.
--vcf: 753k variants complete.
--vcf: 754k variants complete.
--vcf: 755k variants complete.
--vcf: 756k variants complete.
--vcf: 757k variants complete.
--vcf: 758k variants complete.
--vcf: 759k variants complete.
--vcf: 760k variants complete.
--vcf: 761k variants complete.
--vcf: 762k variants complete.
--vcf: 763k variants complete.
--vcf: 764k variants complete.
--vcf: 765k variants complete.
--vcf: 766k variants complete.
--vcf: 767k variants complete.
--vcf: 768k variants complete.
--vcf: 769k variants complete.
--vcf: 770k variants complete.
--vcf: 771k variants complete.
--vcf: 772k variants complete.
--vcf: 773k variants complete.
--vcf: 774k variants complete.
--vcf: 775k variants complete.
--vcf: 776k variants complete.
--vcf: 777k variants complete.
--vcf: 778k variants complete.
--vcf: 779k variants complete.
--vcf: 780k variants complete.
--vcf: 781k variants complete.
--vcf: 782k variants complete.
--vcf: 783k variants complete.
--vcf: 784k variants complete.
--vcf: 785k variants complete.
--vcf: 786k variants complete.
--vcf: 787k variants complete.
--vcf: 788k variants complete.
--vcf: 789k variants complete.
--vcf: 790k variants complete.
--vcf: 791k variants complete.
--vcf: 792k variants complete.
--vcf: 793k variants complete.
--vcf: 794k variants complete.
--vcf: 795k variants complete.
--vcf: 796k variants complete.
--vcf: 797k variants complete.
--vcf: 798k variants complete.
--vcf: 799k variants complete.
--vcf: 800k variants complete.
--vcf: 801k variants complete.
--vcf: 802k variants complete.
--vcf: 803k variants complete.
--vcf: 804k variants complete.
--vcf: 805k variants complete.
--vcf: 806k variants complete.
--vcf: 807k variants complete.
--vcf: 808k variants complete.
--vcf: 809k variants complete.
--vcf: 810k variants complete.
--vcf: 811k variants complete.
--vcf: 812k variants complete.
--vcf: 813k variants complete.
--vcf: 814k variants complete.
--vcf: 815k variants complete.
--vcf: 816k variants complete.
--vcf: 817k variants complete.
--vcf: 818k variants complete.
--vcf: 819k variants complete.
--vcf: 820k variants complete.
--vcf: 821k variants complete.
--vcf: 822k variants complete.
--vcf: 823k variants complete.
--vcf: 824k variants complete.
--vcf: 825k variants complete.
--vcf: 826k variants complete.
--vcf: 827k variants complete.
--vcf: 828k variants complete.
--vcf: 829k variants complete.
--vcf: 830k variants complete.
--vcf: 831k variants complete.
--vcf: 832k variants complete.
--vcf: 833k variants complete.
--vcf: 834k variants complete.
--vcf: 835k variants complete.
--vcf: 836k variants complete.
--vcf: 837k variants complete.
--vcf: 838k variants complete.
--vcf: 839k variants complete.
--vcf: 840k variants complete.
--vcf: 841k variants complete.
--vcf: 842k variants complete.
--vcf: 843k variants complete.
--vcf: 844k variants complete.
--vcf: 845k variants complete.
--vcf: 846k variants complete.
--vcf: 847k variants complete.
--vcf: 848k variants complete.
--vcf: 849k variants complete.
--vcf: 850k variants complete.
--vcf: 851k variants complete.
--vcf: 852k variants complete.
--vcf: 853k variants complete.
--vcf: 854k variants complete.
--vcf: 855k variants complete.
--vcf: 856k variants complete.
--vcf: 857k variants complete.
--vcf: 858k variants complete.
--vcf: 859k variants complete.
--vcf: 860k variants complete.
--vcf: 861k variants complete.
--vcf: 862k variants complete.
--vcf: 863k variants complete.
--vcf: 864k variants complete.
--vcf: 865k variants complete.
--vcf: 866k variants complete.
--vcf: 867k variants complete.
--vcf: 868k variants complete.
--vcf: 869k variants complete.
--vcf: 870k variants complete.
--vcf: 871k variants complete.
--vcf: 872k variants complete.
--vcf: 873k variants complete.
--vcf: 874k variants complete.
--vcf: 875k variants complete.
--vcf: 876k variants complete.
--vcf: 877k variants complete.
--vcf: 878k variants complete.
--vcf: 879k variants complete.
--vcf: 880k variants complete.
--vcf: 881k variants complete.
--vcf: 882k variants complete.
--vcf: 883k variants complete.
--vcf: 884k variants complete.
--vcf: 885k variants complete.
--vcf: 886k variants complete.
--vcf: 887k variants complete.
--vcf: 888k variants complete.
--vcf: 889k variants complete.
--vcf: 890k variants complete.
--vcf: 891k variants complete.
--vcf: 892k variants complete.
--vcf: 893k variants complete.
--vcf: 894k variants complete.
--vcf: 895k variants complete.
--vcf: 896k variants complete.
--vcf: 897k variants complete.
--vcf: 898k variants complete.
--vcf: 899k variants complete.
--vcf: 900k variants complete.
--vcf: 901k variants complete.
--vcf: 902k variants complete.
--vcf: 903k variants complete.
--vcf: 904k variants complete.
--vcf: 905k variants complete.
--vcf: 906k variants complete.
--vcf: 907k variants complete.
--vcf: 908k variants complete.
--vcf: 909k variants complete.
--vcf: 910k variants complete.
--vcf: 911k variants complete.
--vcf: 912k variants complete.
--vcf: 913k variants complete.
--vcf: 914k variants complete.
--vcf: 915k variants complete.
--vcf: 916k variants complete.
--vcf: 917k variants complete.
--vcf: 918k variants complete.
--vcf: 919k variants complete.
--vcf: 920k variants complete.
--vcf: 921k variants complete.
--vcf: 922k variants complete.
--vcf: 923k variants complete.
--vcf: 924k variants complete.
--vcf: 925k variants complete.
--vcf: 926k variants complete.
--vcf: 927k variants complete.
--vcf: 928k variants complete.
--vcf: 929k variants complete.
--vcf: 930k variants complete.
--vcf: 931k variants complete.
--vcf: 932k variants complete.
--vcf: 933k variants complete.
--vcf: 934k variants complete.
--vcf: 935k variants complete.
--vcf: 936k variants complete.
--vcf: 937k variants complete.
--vcf: 938k variants complete.
--vcf: 939k variants complete.
--vcf: 940k variants complete.
--vcf: 941k variants complete.
--vcf: 942k variants complete.
--vcf: 943k variants complete.
--vcf: 944k variants complete.
--vcf: 945k variants complete.
--vcf: 946k variants complete.
--vcf: 947k variants complete.
--vcf: 948k variants complete.
--vcf: 949k variants complete.
--vcf: 950k variants complete.
--vcf: 951k variants complete.
--vcf: 952k variants complete.
--vcf: 953k variants complete.
--vcf: 954k variants complete.
--vcf: 955k variants complete.
--vcf: 956k variants complete.
--vcf: 957k variants complete.
--vcf: 958k variants complete.
--vcf: 959k variants complete.
--vcf: 960k variants complete.
--vcf: 961k variants complete.
--vcf: 962k variants complete.
--vcf: 963k variants complete.
--vcf: 964k variants complete.
--vcf: 965k variants complete.
--vcf: 966k variants complete.
--vcf: 967k variants complete.
--vcf: 968k variants complete.
--vcf: 969k variants complete.
--vcf: 970k variants complete.
--vcf: 971k variants complete.
--vcf: 972k variants complete.
--vcf: 973k variants complete.
--vcf: 974k variants complete.
--vcf: 975k variants complete.
--vcf: 976k variants complete.
--vcf: 977k variants complete.
--vcf: 978k variants complete.
--vcf: 979k variants complete.
--vcf: 980k variants complete.
--vcf: 981k variants complete.
--vcf: 982k variants complete.
--vcf: 983k variants complete.
--vcf: 984k variants complete.
--vcf: 985k variants complete.
--vcf: 986k variants complete.
--vcf: 987k variants complete.
--vcf: 988k variants complete.
--vcf: 989k variants complete.
--vcf: 990k variants complete.
--vcf: 991k variants complete.
--vcf: 992k variants complete.
--vcf: 993k variants complete.
--vcf: 994k variants complete.
--vcf: 995k variants complete.
--vcf: 996k variants complete.
--vcf: 997k variants complete.
--vcf: 998k variants complete.
--vcf: 999k variants complete.
--vcf: 1000k variants complete.
--vcf: 1001k variants complete.
--vcf: 1002k variants complete.
--vcf: 1003k variants complete.
--vcf: 1004k variants complete.
--vcf: 1005k variants complete.
--vcf: 1006k variants complete.
--vcf: 1007k variants complete.
--vcf: 1008k variants complete.
--vcf: 1009k variants complete.
--vcf: 1010k variants complete.
--vcf: 1011k variants complete.
--vcf: 1012k variants complete.
--vcf: 1013k variants complete.
--vcf: 1014k variants complete.
--vcf: 1015k variants complete.
--vcf: 1016k variants complete.
--vcf: 1017k variants complete.
--vcf: 1018k variants complete.
--vcf: 1019k variants complete.
--vcf: 1020k variants complete.
--vcf: 1021k variants complete.
--vcf: 1022k variants complete.
--vcf: 1023k variants complete.
--vcf: 1024k variants complete.
--vcf: 1025k variants complete.
--vcf: 1026k variants complete.
--vcf: 1027k variants complete.
--vcf: 1028k variants complete.
--vcf: 1029k variants complete.
--vcf: 1030k variants complete.
--vcf: 1031k variants complete.
--vcf: 1032k variants complete.
--vcf: 1033k variants complete.
--vcf: 1034k variants complete.
--vcf: 1035k variants complete.
--vcf: 1036k variants complete.
--vcf: 1037k variants complete.
--vcf: 1038k variants complete.
--vcf: 1039k variants complete.
--vcf: 1040k variants complete.
--vcf: 1041k variants complete.
--vcf: 1042k variants complete.
--vcf: 1043k variants complete.
--vcf: 1044k variants complete.
--vcf: 1045k variants complete.
--vcf: 1046k variants complete.
--vcf: 1047k variants complete.
--vcf: 1048k variants complete.
--vcf: 1049k variants complete.
--vcf: 1050k variants complete.
--vcf: 1051k variants complete.
--vcf: 1052k variants complete.
--vcf: 1053k variants complete.
--vcf: 1054k variants complete.
--vcf: 1055k variants complete.
--vcf: 1056k variants complete.
--vcf: 1057k variants complete.
--vcf: 1058k variants complete.
--vcf: 1059k variants complete.
--vcf: 1060k variants complete.
--vcf: 1061k variants complete.
--vcf: 1062k variants complete.
--vcf: 1063k variants complete.
--vcf: 1064k variants complete.
--vcf: 1065k variants complete.
--vcf: 1066k variants complete.
--vcf: 1067k variants complete.
--vcf: 1068k variants complete.
--vcf: 1069k variants complete.
--vcf: 1070k variants complete.
--vcf: 1071k variants complete.
--vcf: 1072k variants complete.
--vcf: 1073k variants complete.
--vcf: 1074k variants complete.
--vcf: 1075k variants complete.
--vcf: 1076k variants complete.
--vcf: 1077k variants complete.
--vcf: 1078k variants complete.
--vcf: 1079k variants complete.
--vcf: 1080k variants complete.
--vcf: 1081k variants complete.
--vcf: 1082k variants complete.
--vcf: 1083k variants complete.
--vcf: 1084k variants complete.
--vcf: 1085k variants complete.
--vcf: 1086k variants complete.
--vcf: 1087k variants complete.
--vcf: 1088k variants complete.
--vcf: 1089k variants complete.
--vcf: 1090k variants complete.
--vcf: 1091k variants complete.
--vcf: 1092k variants complete.
--vcf: 1093k variants complete.
--vcf: 1094k variants complete.
--vcf: 1095k variants complete.
--vcf: 1096k variants complete.
--vcf: 1097k variants complete.
--vcf: 1098k variants complete.
--vcf: 1099k variants complete.
--vcf: 1100k variants complete.
--vcf: 1101k variants complete.
--vcf: 1102k variants complete.
--vcf: 1103k variants complete.
--vcf: 1104k variants complete.
--vcf: 1105k variants complete.
--vcf: 1106k variants complete.
--vcf: 1107k variants complete.
--vcf: 1108k variants complete.
--vcf: 1109k variants complete.
--vcf: 1110k variants complete.
--vcf: 1111k variants complete.
--vcf: 1112k variants complete.
--vcf: 1113k variants complete.
--vcf: 1114k variants complete.
--vcf: 1115k variants complete.
--vcf: 1116k variants complete.
--vcf: 1117k variants complete.
--vcf: 1118k variants complete.
--vcf: 1119k variants complete.
--vcf: 1120k variants complete.
--vcf: 1121k variants complete.
--vcf: 1122k variants complete.
--vcf: 1123k variants complete.
--vcf: 1124k variants complete.
--vcf: 1125k variants complete.
--vcf: 1126k variants complete.
--vcf: 1127k variants complete.
--vcf: 1128k variants complete.
--vcf: 1129k variants complete.
--vcf: 1130k variants complete.
--vcf: 1131k variants complete.
--vcf: 1132k variants complete.
--vcf: 1133k variants complete.
--vcf: 1134k variants complete.
--vcf: 1135k variants complete.
--vcf: 1136k variants complete.
--vcf: 1137k variants complete.
--vcf: 1138k variants complete.
--vcf: 1139k variants complete.
--vcf: 1140k variants complete.
--vcf: 1141k variants complete.
--vcf: 1142k variants complete.
--vcf: 1143k variants complete.
--vcf: 1144k variants complete.
--vcf: 1145k variants complete.
--vcf: 1146k variants complete.
--vcf: 1147k variants complete.
--vcf: 1148k variants complete.
--vcf: 1149k variants complete.
--vcf: 1150k variants complete.
--vcf: 1151k variants complete.
--vcf: 1152k variants complete.
--vcf: 1153k variants complete.
--vcf: 1154k variants complete.
--vcf: 1155k variants complete.
--vcf: 1156k variants complete.
--vcf: 1157k variants complete.
--vcf: 1158k variants complete.
--vcf: 1159k variants complete.
--vcf: 1160k variants complete.
--vcf: 1161k variants complete.
--vcf: 1162k variants complete.
--vcf: 1163k variants complete.
--vcf: 1164k variants complete.
--vcf: 1165k variants complete.
--vcf: 1166k variants complete.
--vcf: 1167k variants complete.
--vcf: 1168k variants complete.
--vcf: 1169k variants complete.
--vcf: 1170k variants complete.
--vcf: 1171k variants complete.
--vcf: 1172k variants complete.
--vcf: 1173k variants complete.
--vcf: 1174k variants complete.
--vcf: 1175k variants complete.
--vcf: 1176k variants complete.
--vcf: 1177k variants complete.
--vcf: 1178k variants complete.
--vcf: 1179k variants complete.
--vcf: 1180k variants complete.
--vcf: 1181k variants complete.
--vcf: 1182k variants complete.
--vcf: 1183k variants complete.
--vcf: 1184k variants complete.
--vcf: 1185k variants complete.
--vcf: 1186k variants complete.
--vcf: 1187k variants complete.
--vcf: 1188k variants complete.
--vcf: 1189k variants complete.
--vcf: 1190k variants complete.
--vcf: 1191k variants complete.
--vcf: 1192k variants complete.
--vcf: 1193k variants complete.
--vcf: 1194k variants complete.
--vcf: 1195k variants complete.
--vcf: 1196k variants complete.
--vcf: 1197k variants complete.
--vcf: 1198k variants complete.
--vcf: 1199k variants complete.
--vcf: 1200k variants complete.
--vcf: 1201k variants complete.
--vcf: 1202k variants complete.
--vcf: 1203k variants complete.
--vcf: 1204k variants complete.
--vcf: 1205k variants complete.
--vcf: 1206k variants complete.
--vcf: 1207k variants complete.
--vcf: 1208k variants complete.
--vcf: 1209k variants complete.
--vcf: 1210k variants complete.
--vcf: 1211k variants complete.
--vcf: 1212k variants complete.
--vcf: 1213k variants complete.
--vcf: 1214k variants complete.
--vcf: 1215k variants complete.
--vcf: 1216k variants complete.
--vcf: 1217k variants complete.
--vcf: 1218k variants complete.
--vcf: 1219k variants complete.
--vcf: 1220k variants complete.
--vcf: 1221k variants complete.
--vcf: 1222k variants complete.
--vcf: 1223k variants complete.
--vcf: 1224k variants complete.
--vcf: 1225k variants complete.
--vcf: 1226k variants complete.
--vcf: 1227k variants complete.
--vcf: 1228k variants complete.
--vcf: 1229k variants complete.
--vcf: 1230k variants complete.
--vcf: 1231k variants complete.
--vcf: 1232k variants complete.
--vcf: 1233k variants complete.
--vcf: 1234k variants complete.
--vcf: 1235k variants complete.
--vcf: 1236k variants complete.
--vcf: 1237k variants complete.
--vcf: 1238k variants complete.
--vcf: 1239k variants complete.
--vcf: 1240k variants complete.
--vcf: 1241k variants complete.
--vcf: 1242k variants complete.
--vcf: 1243k variants complete.
--vcf: 1244k variants complete.
--vcf: 1245k variants complete.
--vcf: 1246k variants complete.
--vcf: 1247k variants complete.
--vcf: 1248k variants complete.
--vcf: 1249k variants complete.
--vcf: 1250k variants complete.
--vcf: 1251k variants complete.
--vcf: 1252k variants complete.
--vcf: 1253k variants complete.
--vcf: 1254k variants complete.
--vcf: 1255k variants complete.
--vcf: 1256k variants complete.
--vcf: 1257k variants complete.
--vcf: 1258k variants complete.
--vcf: 1259k variants complete.
--vcf: 1260k variants complete.
--vcf: 1261k variants complete.
--vcf: 1262k variants complete.
--vcf: 1263k variants complete.
--vcf: 1264k variants complete.
--vcf: 1265k variants complete.
--vcf: 1266k variants complete.
--vcf: 1267k variants complete.
--vcf: 1268k variants complete.
--vcf: 1269k variants complete.
--vcf: 1270k variants complete.
--vcf: 1271k variants complete.
--vcf: 1272k variants complete.
--vcf: 1273k variants complete.
--vcf: 1274k variants complete.
--vcf: 1275k variants complete.
--vcf: 1276k variants complete.
--vcf: 1277k variants complete.
--vcf: 1278k variants complete.
--vcf: 1279k variants complete.
--vcf: 1280k variants complete.
--vcf: 1281k variants complete.
--vcf: 1282k variants complete.
--vcf: 1283k variants complete.
--vcf: 1284k variants complete.
--vcf: 1285k variants complete.
--vcf: 1286k variants complete.
--vcf: 1287k variants complete.
--vcf: 1288k variants complete.
--vcf: 1289k variants complete.
--vcf: 1290k variants complete.
--vcf: 1291k variants complete.
--vcf: 1292k variants complete.
--vcf: 1293k variants complete.
--vcf: 1294k variants complete.
--vcf: 1295k variants complete.
--vcf: 1296k variants complete.
--vcf: 1297k variants complete.
--vcf: 1298k variants complete.
--vcf: 1299k variants complete.
--vcf: 1300k variants complete.
--vcf: 1301k variants complete.
--vcf: 1302k variants complete.
--vcf: 1303k variants complete.
--vcf: 1304k variants complete.
--vcf: 1305k variants complete.
--vcf: 1306k variants complete.
--vcf: 1307k variants complete.
--vcf: 1308k variants complete.
--vcf: 1309k variants complete.
--vcf: 1310k variants complete.
--vcf: 1311k variants complete.
--vcf: 1312k variants complete.
--vcf: 1313k variants complete.
--vcf: 1314k variants complete.
--vcf: 1315k variants complete.
--vcf: 1316k variants complete.
--vcf: 1317k variants complete.
--vcf: 1318k variants complete.
--vcf: 1319k variants complete.
--vcf: 1320k variants complete.
--vcf: 1321k variants complete.
--vcf: 1322k variants complete.
--vcf: 1323k variants complete.
--vcf: 1324k variants complete.
--vcf: 1325k variants complete.
--vcf: 1326k variants complete.
--vcf: 1327k variants complete.
--vcf: 1328k variants complete.
--vcf: 1329k variants complete.
--vcf: 1330k variants complete.
--vcf: 1331k variants complete.
--vcf: 1332k variants complete.
--vcf: 1333k variants complete.
--vcf: 1334k variants complete.
--vcf: 1335k variants complete.
--vcf: 1336k variants complete.
--vcf: 1337k variants complete.
--vcf: 1338k variants complete.
--vcf: 1339k variants complete.
--vcf: 1340k variants complete.
--vcf: 1341k variants complete.
--vcf: 1342k variants complete.
--vcf: 1343k variants complete.
--vcf: 1344k variants complete.
--vcf: 1345k variants complete.
--vcf: 1346k variants complete.
--vcf: 1347k variants complete.
--vcf: 1348k variants complete.
--vcf: 1349k variants complete.
--vcf: 1350k variants complete.
--vcf: 1351k variants complete.
--vcf: 1352k variants complete.
--vcf: 1353k variants complete.
--vcf: 1354k variants complete.
--vcf: 1355k variants complete.
--vcf: 1356k variants complete.
--vcf: 1357k variants complete.
--vcf: 1358k variants complete.
--vcf: 1359k variants complete.
--vcf: 1360k variants complete.
--vcf: 1361k variants complete.
--vcf: 1362k variants complete.
--vcf: 1363k variants complete.
--vcf: 1364k variants complete.
--vcf: 1365k variants complete.
--vcf: 1366k variants complete.
--vcf: 1367k variants complete.
--vcf: 1368k variants complete.
--vcf: 1369k variants complete.
--vcf: 1370k variants complete.
--vcf: 1371k variants complete.
--vcf: 1372k variants complete.
--vcf: 1373k variants complete.
--vcf: 1374k variants complete.
--vcf: 1375k variants complete.
--vcf: 1376k variants complete.
--vcf: 1377k variants complete.
--vcf: 1378k variants complete.
--vcf: 1379k variants complete.
--vcf: 1380k variants complete.
--vcf: 1381k variants complete.
--vcf: 1382k variants complete.
--vcf: 1383k variants complete.
--vcf: 1384k variants complete.
--vcf: 1385k variants complete.
--vcf: 1386k variants complete.
--vcf: 1387k variants complete.
--vcf: 1388k variants complete.
--vcf: 1389k variants complete.
--vcf: 1390k variants complete.
--vcf: 1391k variants complete.
--vcf: 1392k variants complete.
--vcf: 1393k variants complete.
--vcf: 1394k variants complete.
--vcf: 1395k variants complete.
--vcf: 1396k variants complete.
--vcf: 1397k variants complete.
--vcf: 1398k variants complete.
--vcf: 1399k variants complete.
--vcf: 1400k variants complete.
--vcf: 1401k variants complete.
--vcf: 1402k variants complete.
--vcf: 1403k variants complete.
--vcf: 1404k variants complete.
--vcf: 1405k variants complete.
--vcf: 1406k variants complete.
--vcf: 1407k variants complete.
--vcf: 1408k variants complete.
--vcf: 1409k variants complete.
--vcf: 1410k variants complete.
--vcf: 1411k variants complete.
--vcf: 1412k variants complete.
--vcf: 1413k variants complete.
--vcf: 1414k variants complete.
--vcf: 1415k variants complete.
--vcf: 1416k variants complete.
--vcf: 1417k variants complete.
--vcf: 1418k variants complete.
--vcf: 1419k variants complete.
--vcf: 1420k variants complete.
--vcf: 1421k variants complete.
--vcf: 1422k variants complete.
--vcf: 1423k variants complete.
--vcf: 1424k variants complete.
--vcf: 1425k variants complete.
--vcf: 1426k variants complete.
--vcf: 1427k variants complete.
--vcf: 1428k variants complete.
--vcf: 1429k variants complete.
--vcf: 1430k variants complete.
--vcf: 1431k variants complete.
--vcf: 1432k variants complete.
--vcf: 1433k variants complete.
--vcf: 1434k variants complete.
--vcf: 1435k variants complete.
--vcf: 1436k variants complete.
--vcf: 1437k variants complete.
--vcf: 1438k variants complete.
--vcf: 1439k variants complete.
--vcf: 1440k variants complete.
--vcf: 1441k variants complete.
--vcf: 1442k variants complete.
--vcf: 1443k variants complete.
--vcf: 1444k variants complete.
--vcf: 1445k variants complete.
--vcf: 1446k variants complete.
--vcf: 1447k variants complete.
--vcf: 1448k variants complete.
--vcf: 1449k variants complete.
--vcf: 1450k variants complete.
--vcf: 1451k variants complete.
--vcf: 1452k variants complete.
--vcf: 1453k variants complete.
--vcf: 1454k variants complete.
--vcf: 1455k variants complete.
--vcf: 1456k variants complete.
--vcf: 1457k variants complete.
--vcf: 1458k variants complete.
--vcf: 1459k variants complete.
--vcf: 1460k variants complete.
--vcf: 1461k variants complete.
--vcf: 1462k variants complete.
--vcf: 1463k variants complete.
--vcf: 1464k variants complete.
--vcf: 1465k variants complete.
--vcf: 1466k variants complete.
--vcf: 1467k variants complete.
--vcf: 1468k variants complete.
--vcf: 1469k variants complete.
--vcf: 1470k variants complete.
--vcf: 1471k variants complete.
--vcf: 1472k variants complete.
--vcf: 1473k variants complete.
--vcf: 1474k variants complete.
--vcf: 1475k variants complete.
--vcf: 1476k variants complete.
--vcf: 1477k variants complete.
--vcf: 1478k variants complete.
--vcf: 1479k variants complete.
--vcf: 1480k variants complete.
--vcf: 1481k variants complete.
--vcf: 1482k variants complete.
--vcf: 1483k variants complete.
--vcf: 1484k variants complete.
--vcf: 1485k variants complete.
--vcf: 1486k variants complete.
--vcf: 1487k variants complete.
--vcf: 1488k variants complete.
--vcf: 1489k variants complete.
--vcf: 1490k variants complete.
--vcf: 1491k variants complete.
--vcf: 1492k variants complete.
--vcf: 1493k variants complete.
--vcf: 1494k variants complete.
--vcf: 1495k variants complete.
--vcf: 1496k variants complete.
--vcf: 1497k variants complete.
--vcf: 1498k variants complete.
--vcf: 1499k variants complete.
--vcf: 1500k variants complete.
--vcf: 1501k variants complete.
--vcf: 1502k variants complete.
--vcf: 1503k variants complete.
--vcf: 1504k variants complete.
--vcf: 1505k variants complete.
--vcf: 1506k variants complete.
--vcf: 1507k variants complete.
--vcf: 1508k variants complete.
--vcf: 1509k variants complete.
--vcf: 1510k variants complete.
--vcf: 1511k variants complete.
--vcf: 1512k variants complete.
--vcf: 1513k variants complete.
--vcf: 1514k variants complete.
--vcf: 1515k variants complete.
--vcf: 1516k variants complete.
--vcf: 1517k variants complete.
--vcf: 1518k variants complete.
--vcf: 1519k variants complete.
--vcf: 1520k variants complete.
--vcf: 1521k variants complete.
--vcf: 1522k variants complete.
--vcf: 1523k variants complete.
--vcf: 1524k variants complete.
--vcf: 1525k variants complete.
--vcf: 1526k variants complete.
--vcf: 1527k variants complete.
--vcf: 1528k variants complete.
--vcf: 1529k variants complete.
--vcf: 1530k variants complete.
--vcf: 1531k variants complete.
--vcf: 1532k variants complete.
--vcf: 1533k variants complete.
--vcf: 1534k variants complete.
--vcf: 1535k variants complete.
--vcf: 1536k variants complete.
--vcf: 1537k variants complete.
--vcf: 1538k variants complete.
--vcf: 1539k variants complete.
--vcf: 1540k variants complete.
--vcf: 1541k variants complete.
--vcf: 1542k variants complete.
--vcf: 1543k variants complete.
--vcf: 1544k variants complete.
--vcf: 1545k variants complete.
--vcf: 1546k variants complete.
--vcf: 1547k variants complete.
--vcf: 1548k variants complete.
--vcf: 1549k variants complete.
--vcf: 1550k variants complete.
--vcf: 1551k variants complete.
--vcf: 1552k variants complete.
--vcf: 1553k variants complete.
--vcf: 1554k variants complete.
--vcf: 1555k variants complete.
--vcf: 1556k variants complete.
--vcf: 1557k variants complete.
--vcf: 1558k variants complete.
--vcf: 1559k variants complete.
--vcf: 1560k variants complete.
--vcf: 1561k variants complete.
--vcf: 1562k variants complete.
--vcf: 1563k variants complete.
--vcf: 1564k variants complete.
--vcf: 1565k variants complete.
--vcf: 1566k variants complete.
--vcf: 1567k variants complete.
--vcf: 1568k variants complete.
--vcf: 1569k variants complete.
--vcf: 1570k variants complete.
--vcf: 1571k variants complete.
--vcf: 1572k variants complete.
--vcf: 1573k variants complete.
--vcf: 1574k variants complete.
--vcf: 1575k variants complete.
--vcf: 1576k variants complete.
--vcf: 1577k variants complete.
--vcf: 1578k variants complete.
--vcf: 1579k variants complete.
--vcf: 1580k variants complete.
--vcf: 1581k variants complete.
--vcf: 1582k variants complete.
--vcf: 1583k variants complete.
--vcf: 1584k variants complete.
--vcf: 1585k variants complete.
--vcf: 1586k variants complete.
--vcf: 1587k variants complete.
--vcf: 1588k variants complete.
--vcf: 1589k variants complete.
--vcf: 1590k variants complete.
--vcf: 1591k variants complete.
--vcf: 1592k variants complete.
--vcf: 1593k variants complete.
--vcf: 1594k variants complete.
--vcf: 1595k variants complete.
--vcf: 1596k variants complete.
--vcf: 1597k variants complete.
--vcf: 1598k variants complete.
--vcf: 1599k variants complete.
--vcf: 1600k variants complete.
--vcf: 1601k variants complete.
--vcf: 1602k variants complete.
--vcf: 1603k variants complete.
--vcf: 1604k variants complete.
--vcf: 1605k variants complete.
--vcf: 1606k variants complete.
--vcf: 1607k variants complete.
--vcf: 1608k variants complete.
--vcf: 1609k variants complete.
--vcf: 1610k variants complete.
--vcf: 1611k variants complete.
--vcf: 1612k variants complete.
--vcf: 1613k variants complete.
--vcf: 1614k variants complete.
--vcf: 1615k variants complete.
--vcf: 1616k variants complete.
--vcf: 1617k variants complete.
--vcf: 1618k variants complete.
--vcf: 1619k variants complete.
--vcf: 1620k variants complete.
--vcf: 1621k variants complete.
--vcf: 1622k variants complete.
--vcf: 1623k variants complete.
--vcf: 1624k variants complete.
--vcf: 1625k variants complete.
--vcf: 1626k variants complete.
--vcf: 1627k variants complete.
--vcf: 1628k variants complete.
--vcf: 1629k variants complete.
--vcf: 1630k variants complete.
--vcf: 1631k variants complete.
--vcf: 1632k variants complete.
--vcf: 1633k variants complete.
--vcf: 1634k variants complete.
--vcf: 1635k variants complete.
--vcf: 1636k variants complete.
--vcf: 1637k variants complete.
--vcf: 1638k variants complete.
--vcf: 1639k variants complete.
--vcf: 1640k variants complete.
--vcf: 1641k variants complete.
--vcf: 1642k variants complete.
--vcf: 1643k variants complete.
--vcf: 1644k variants complete.
--vcf: 1645k variants complete.
--vcf: 1646k variants complete.
--vcf: 1647k variants complete.
--vcf: 1648k variants complete.
--vcf: 1649k variants complete.
--vcf: 1650k variants complete.
--vcf: 1651k variants complete.
--vcf: 1652k variants complete.
--vcf: 1653k variants complete.
--vcf: 1654k variants complete.
--vcf: 1655k variants complete.
--vcf: 1656k variants complete.
--vcf: 1657k variants complete.
--vcf: 1658k variants complete.
--vcf: 1659k variants complete.
--vcf: 1660k variants complete.
--vcf: 1661k variants complete.
--vcf: 1662k variants complete.
--vcf: 1663k variants complete.
--vcf: 1664k variants complete.
--vcf: 1665k variants complete.
--vcf: 1666k variants complete.
--vcf: 1667k variants complete.
--vcf: 1668k variants complete.
--vcf: 1669k variants complete.
--vcf: 1670k variants complete.
--vcf: 1671k variants complete.
--vcf: 1672k variants complete.
--vcf: 1673k variants complete.
--vcf: 1674k variants complete.
--vcf: 1675k variants complete.
--vcf: 1676k variants complete.
--vcf: 1677k variants complete.
--vcf: 1678k variants complete.
--vcf: 1679k variants complete.
--vcf: 1680k variants complete.
--vcf: 1681k variants complete.
--vcf: 1682k variants complete.
--vcf: 1683k variants complete.
--vcf: 1684k variants complete.
--vcf: 1685k variants complete.
--vcf: 1686k variants complete.
--vcf: 1687k variants complete.
--vcf: 1688k variants complete.
--vcf: 1689k variants complete.
--vcf: 1690k variants complete.
--vcf: 1691k variants complete.
--vcf: 1692k variants complete.
--vcf: 1693k variants complete.
--vcf: 1694k variants complete.
--vcf: 1695k variants complete.
--vcf: 1696k variants complete.
--vcf: 1697k variants complete.
--vcf: 1698k variants complete.
--vcf: 1699k variants complete.
--vcf: 1700k variants complete.
--vcf: 1701k variants complete.
--vcf: 1702k variants complete.
--vcf: 1703k variants complete.
--vcf: 1704k variants complete.
--vcf: 1705k variants complete.
--vcf: 1706k variants complete.
--vcf: 1707k variants complete.
--vcf: 1708k variants complete.
--vcf: 1709k variants complete.
--vcf: 1710k variants complete.
--vcf: 1711k variants complete.
--vcf: 1712k variants complete.
--vcf: 1713k variants complete.
--vcf: 1714k variants complete.
--vcf: 1715k variants complete.
--vcf: 1716k variants complete.
--vcf: 1717k variants complete.
--vcf: 1718k variants complete.
--vcf: 1719k variants complete.
--vcf: 1720k variants complete.
--vcf: 1721k variants complete.
--vcf: 1722k variants complete.
--vcf: 1723k variants complete.
--vcf: 1724k variants complete.
--vcf:
/share/org/YZWL/yzwl_lixg/project/21.野生大豆群体/05.所有样品/14.实验室的样品/06.第一次根据枝长筛选的样品/05.第一次选择的807个样品的admixture/raw_data-temporary.bed
+
/share/org/YZWL/yzwl_lixg/project/21.野生大豆群体/05.所有样品/14.实验室的样品/06.第一次根据枝长筛选的样品/05.第一次选择的807个样品的admixture/raw_data-temporary.bim
+
/share/org/YZWL/yzwl_lixg/project/21.野生大豆群体/05.所有样品/14.实验室的样品/06.第一次根据枝长筛选的样品/05.第一次选择的807个样品的admixture/raw_data-temporary.fam
written.
1724618 variants loaded from .bim file.
807 samples (0 males, 0 females, 807 ambiguous) loaded from .fam.
Ambiguous sex IDs written to
/share/org/YZWL/yzwl_lixg/project/21.野生大豆群体/05.所有样品/14.实验室的样品/06.第一次根据枝长筛选的样品/05.第一次选择的807个样品的admixture/raw_data.nosex
.
Using 1 thread (no multithreaded calculations invoked).
Before main variant filters, 807 founders and 0 nonfounders present.
Calculating allele frequencies... 0%1%2%3%4%5%6%7%8%9%10%11%12%13%14%15%16%17%18%19%20%21%22%23%24%25%26%27%28%29%30%31%32%33%34%35%36%37%38%39%40%41%42%43%44%45%46%47%48%49%50%51%52%53%54%55%56%57%58%59%60%61%62%63%64%65%66%67%68%69%70%71%72%73%74%75%76%77%78%79%80%81%82%83%84%85%86%87%88%89%90%91%92%93%94%95%96%97%98%99% done.
Total genotyping rate is 0.932037.
1724618 variants and 807 samples pass filters and QC.
Note: No phenotypes present.
--make-bed to
/share/org/YZWL/yzwl_lixg/project/21.野生大豆群体/05.所有样品/14.实验室的样品/06.第一次根据枝长筛选的样品/05.第一次选择的807个样品的admixture/raw_data.bed
+
/share/org/YZWL/yzwl_lixg/project/21.野生大豆群体/05.所有样品/14.实验室的样品/06.第一次根据枝长筛选的样品/05.第一次选择的807个样品的admixture/raw_data.bim
+
/share/org/YZWL/yzwl_lixg/project/21.野生大豆群体/05.所有样品/14.实验室的样品/06.第一次根据枝长筛选的样品/05.第一次选择的807个样品的admixture/raw_data.fam
... 0%1%2%3%4%5%6%7%8%9%10%11%12%13%14%15%16%17%18%19%20%21%22%23%24%25%26%27%28%29%30%31%32%33%34%35%36%37%38%39%40%41%42%43%44%45%46%47%48%49%50%51%52%53%54%55%56%57%58%59%60%61%62%63%64%65%66%67%68%69%70%71%72%73%74%75%76%77%78%79%80%81%82%83%84%85%86%87%88%89%90%91%92%93%94%95%96%97%98%99%done.
2026-01-13 16:06:24.710 - INFO - 完成|Completed: VCF转换为PLINK格式|Convert VCF to PLINK format
2026-01-13 16:06:24.710 - INFO - 跳过质量控制步骤-使用已预处理的数据|Skipping quality control steps - using pre-processed data
2026-01-13 16:06:24.710 - INFO - 假设输入数据已经过质量控制|Assuming input data is already quality controlled
2026-01-13 16:06:24.710 - INFO - 步骤: 修复染色体编号|Step: Fixing chromosome codes
2026-01-13 16:06:24.710 - INFO - 修复染色体编号为整数格式|Fixing chromosome codes to integer format
2026-01-13 16:06:25.718 - INFO - 当前染色体编号|Current chromosome codes: ['1', '2', '3', '4', '5', '6', '7', '8', '9', '10', '11', '12', '13', '14', '15', '16', '17', '18', '19', '20']
2026-01-13 16:06:25.718 - INFO - 所有染色体编号已为数字格式|All chromosome codes are already numeric
2026-01-13 16:06:25.726 - INFO - 更新分析文件基础名称|Updating analysis base name to: raw_data
2026-01-13 16:06:25.726 - INFO - 步骤4: ADMIXTURE分析|Step 4: ADMIXTURE analysis
2026-01-13 16:06:25.726 - INFO -   开始ADMIXTURE分析|Starting ADMIXTURE analysis
2026-01-13 16:06:25.726 - INFO -  运行ADMIXTURE K=2|Running ADMIXTURE K=2
2026-01-13 16:06:25.726 - INFO - 开始|Starting: ADMIXTURE分析 K=2|ADMIXTURE analysis K=2
2026-01-13 16:06:25.726 - INFO - 执行命令|Executing command: cd /share/org/YZWL/yzwl_lixg/project/21.野生大豆群体/05.所有样品/14.实验室的样品/06.第一次根据枝长筛选的样品/05.第一次选择的807个样品的admixture && admixture --cv=5 -j64 raw_data.bed 2 > log_2.out 2>&1
2026-01-13 17:27:07.880 - INFO - 完成|Completed: ADMIXTURE分析 K=2|ADMIXTURE analysis K=2
2026-01-13 17:27:07.880 - INFO -   K=2 分析成功完成|K=2 analysis completed successfully
2026-01-13 17:27:07.880 - INFO -  运行ADMIXTURE K=3|Running ADMIXTURE K=3
2026-01-13 17:27:07.881 - INFO - 开始|Starting: ADMIXTURE分析 K=3|ADMIXTURE analysis K=3
2026-01-13 17:27:07.881 - INFO - 执行命令|Executing command: cd /share/org/YZWL/yzwl_lixg/project/21.野生大豆群体/05.所有样品/14.实验室的样品/06.第一次根据枝长筛选的样品/05.第一次选择的807个样品的admixture && admixture --cv=5 -j64 raw_data.bed 3 > log_3.out 2>&1
2026-01-13 19:51:05.502 - INFO - 完成|Completed: ADMIXTURE分析 K=3|ADMIXTURE analysis K=3
2026-01-13 19:51:05.504 - INFO -   K=3 分析成功完成|K=3 analysis completed successfully
2026-01-13 19:51:05.504 - INFO -  运行ADMIXTURE K=4|Running ADMIXTURE K=4
2026-01-13 19:51:05.504 - INFO - 开始|Starting: ADMIXTURE分析 K=4|ADMIXTURE analysis K=4
2026-01-13 19:51:05.504 - INFO - 执行命令|Executing command: cd /share/org/YZWL/yzwl_lixg/project/21.野生大豆群体/05.所有样品/14.实验室的样品/06.第一次根据枝长筛选的样品/05.第一次选择的807个样品的admixture && admixture --cv=5 -j64 raw_data.bed 4 > log_4.out 2>&1
2026-01-14 00:59:32.863 - INFO - 完成|Completed: ADMIXTURE分析 K=4|ADMIXTURE analysis K=4
2026-01-14 00:59:32.875 - INFO -   K=4 分析成功完成|K=4 analysis completed successfully
2026-01-14 00:59:32.875 - INFO -  运行ADMIXTURE K=5|Running ADMIXTURE K=5
2026-01-14 00:59:32.875 - INFO - 开始|Starting: ADMIXTURE分析 K=5|ADMIXTURE analysis K=5
2026-01-14 00:59:32.875 - INFO - 执行命令|Executing command: cd /share/org/YZWL/yzwl_lixg/project/21.野生大豆群体/05.所有样品/14.实验室的样品/06.第一次根据枝长筛选的样品/05.第一次选择的807个样品的admixture && admixture --cv=5 -j64 raw_data.bed 5 > log_5.out 2>&1
2026-01-14 05:02:37.804 - INFO - 完成|Completed: ADMIXTURE分析 K=5|ADMIXTURE analysis K=5
2026-01-14 05:02:37.805 - INFO -   K=5 分析成功完成|K=5 analysis completed successfully
2026-01-14 05:02:37.805 - INFO -  运行ADMIXTURE K=6|Running ADMIXTURE K=6
2026-01-14 05:02:37.805 - INFO - 开始|Starting: ADMIXTURE分析 K=6|ADMIXTURE analysis K=6
2026-01-14 05:02:37.805 - INFO - 执行命令|Executing command: cd /share/org/YZWL/yzwl_lixg/project/21.野生大豆群体/05.所有样品/14.实验室的样品/06.第一次根据枝长筛选的样品/05.第一次选择的807个样品的admixture && admixture --cv=5 -j64 raw_data.bed 6 > log_6.out 2>&1
2026-01-14 17:07:41.999 - INFO - 完成|Completed: ADMIXTURE分析 K=6|ADMIXTURE analysis K=6
2026-01-14 17:07:42.052 - INFO -   K=6 分析成功完成|K=6 analysis completed successfully
2026-01-14 17:07:42.052 - INFO -  运行ADMIXTURE K=7|Running ADMIXTURE K=7
2026-01-14 17:07:42.052 - INFO - 开始|Starting: ADMIXTURE分析 K=7|ADMIXTURE analysis K=7
2026-01-14 17:07:42.052 - INFO - 执行命令|Executing command: cd /share/org/YZWL/yzwl_lixg/project/21.野生大豆群体/05.所有样品/14.实验室的样品/06.第一次根据枝长筛选的样品/05.第一次选择的807个样品的admixture && admixture --cv=5 -j64 raw_data.bed 7 > log_7.out 2>&1
2026-01-15 06:28:00.366 - INFO - 完成|Completed: ADMIXTURE分析 K=7|ADMIXTURE analysis K=7
2026-01-15 06:28:00.368 - INFO -   K=7 分析成功完成|K=7 analysis completed successfully
2026-01-15 06:28:00.368 - INFO -  运行ADMIXTURE K=8|Running ADMIXTURE K=8
2026-01-15 06:28:00.368 - INFO - 开始|Starting: ADMIXTURE分析 K=8|ADMIXTURE analysis K=8
2026-01-15 06:28:00.368 - INFO - 执行命令|Executing command: cd /share/org/YZWL/yzwl_lixg/project/21.野生大豆群体/05.所有样品/14.实验室的样品/06.第一次根据枝长筛选的样品/05.第一次选择的807个样品的admixture && admixture --cv=5 -j64 raw_data.bed 8 > log_8.out 2>&1
2026-01-15 14:41:20.570 - INFO - 完成|Completed: ADMIXTURE分析 K=8|ADMIXTURE analysis K=8
2026-01-15 14:41:20.625 - INFO -   K=8 分析成功完成|K=8 analysis completed successfully
2026-01-15 14:41:20.625 - INFO -  运行ADMIXTURE K=9|Running ADMIXTURE K=9
2026-01-15 14:41:20.625 - INFO - 开始|Starting: ADMIXTURE分析 K=9|ADMIXTURE analysis K=9
2026-01-15 14:41:20.625 - INFO - 执行命令|Executing command: cd /share/org/YZWL/yzwl_lixg/project/21.野生大豆群体/05.所有样品/14.实验室的样品/06.第一次根据枝长筛选的样品/05.第一次选择的807个样品的admixture && admixture --cv=5 -j64 raw_data.bed 9 > log_9.out 2>&1
2026-01-16 00:12:33.589 - INFO - 完成|Completed: ADMIXTURE分析 K=9|ADMIXTURE analysis K=9
2026-01-16 00:12:33.616 - INFO -   K=9 分析成功完成|K=9 analysis completed successfully
2026-01-16 00:12:33.632 - INFO -  运行ADMIXTURE K=10|Running ADMIXTURE K=10
2026-01-16 00:12:33.632 - INFO - 开始|Starting: ADMIXTURE分析 K=10|ADMIXTURE analysis K=10
2026-01-16 00:12:33.632 - INFO - 执行命令|Executing command: cd /share/org/YZWL/yzwl_lixg/project/21.野生大豆群体/05.所有样品/14.实验室的样品/06.第一次根据枝长筛选的样品/05.第一次选择的807个样品的admixture && admixture --cv=5 -j64 raw_data.bed 10 > log_10.out 2>&1
2026-01-16 10:59:02.681 - INFO - 完成|Completed: ADMIXTURE分析 K=10|ADMIXTURE analysis K=10
2026-01-16 10:59:02.682 - INFO -   K=10 分析成功完成|K=10 analysis completed successfully
2026-01-16 10:59:02.682 - INFO -  运行ADMIXTURE K=11|Running ADMIXTURE K=11
2026-01-16 10:59:02.682 - INFO - 开始|Starting: ADMIXTURE分析 K=11|ADMIXTURE analysis K=11
2026-01-16 10:59:02.682 - INFO - 执行命令|Executing command: cd /share/org/YZWL/yzwl_lixg/project/21.野生大豆群体/05.所有样品/14.实验室的样品/06.第一次根据枝长筛选的样品/05.第一次选择的807个样品的admixture && admixture --cv=5 -j64 raw_data.bed 11 > log_11.out 2>&1
2026-01-17 01:26:27.505 - INFO - 完成|Completed: ADMIXTURE分析 K=11|ADMIXTURE analysis K=11
2026-01-17 01:26:27.549 - INFO -   K=11 分析成功完成|K=11 analysis completed successfully
2026-01-17 01:26:27.549 - INFO -  运行ADMIXTURE K=12|Running ADMIXTURE K=12
2026-01-17 01:26:27.549 - INFO - 开始|Starting: ADMIXTURE分析 K=12|ADMIXTURE analysis K=12
2026-01-17 01:26:27.549 - INFO - 执行命令|Executing command: cd /share/org/YZWL/yzwl_lixg/project/21.野生大豆群体/05.所有样品/14.实验室的样品/06.第一次根据枝长筛选的样品/05.第一次选择的807个样品的admixture && admixture --cv=5 -j64 raw_data.bed 12 > log_12.out 2>&1
2026-01-17 12:06:32.415 - INFO - 完成|Completed: ADMIXTURE分析 K=12|ADMIXTURE analysis K=12
2026-01-17 12:06:32.417 - INFO -   K=12 分析成功完成|K=12 analysis completed successfully
2026-01-17 12:06:32.417 - INFO -  运行ADMIXTURE K=13|Running ADMIXTURE K=13
2026-01-17 12:06:32.417 - INFO - 开始|Starting: ADMIXTURE分析 K=13|ADMIXTURE analysis K=13
2026-01-17 12:06:32.417 - INFO - 执行命令|Executing command: cd /share/org/YZWL/yzwl_lixg/project/21.野生大豆群体/05.所有样品/14.实验室的样品/06.第一次根据枝长筛选的样品/05.第一次选择的807个样品的admixture && admixture --cv=5 -j64 raw_data.bed 13 > log_13.out 2>&1
2026-01-18 00:43:05.557 - INFO - 完成|Completed: ADMIXTURE分析 K=13|ADMIXTURE analysis K=13
2026-01-18 00:43:05.560 - INFO -   K=13 分析成功完成|K=13 analysis completed successfully
2026-01-18 00:43:05.560 - INFO -  运行ADMIXTURE K=14|Running ADMIXTURE K=14
2026-01-18 00:43:05.560 - INFO - 开始|Starting: ADMIXTURE分析 K=14|ADMIXTURE analysis K=14
2026-01-18 00:43:05.560 - INFO - 执行命令|Executing command: cd /share/org/YZWL/yzwl_lixg/project/21.野生大豆群体/05.所有样品/14.实验室的样品/06.第一次根据枝长筛选的样品/05.第一次选择的807个样品的admixture && admixture --cv=5 -j64 raw_data.bed 14 > log_14.out 2>&1
2026-01-18 12:37:08.758 - INFO - 完成|Completed: ADMIXTURE分析 K=14|ADMIXTURE analysis K=14
2026-01-18 12:37:08.788 - INFO -   K=14 分析成功完成|K=14 analysis completed successfully
2026-01-18 12:37:08.788 - INFO -  运行ADMIXTURE K=15|Running ADMIXTURE K=15
2026-01-18 12:37:08.788 - INFO - 开始|Starting: ADMIXTURE分析 K=15|ADMIXTURE analysis K=15
2026-01-18 12:37:08.788 - INFO - 执行命令|Executing command: cd /share/org/YZWL/yzwl_lixg/project/21.野生大豆群体/05.所有样品/14.实验室的样品/06.第一次根据枝长筛选的样品/05.第一次选择的807个样品的admixture && admixture --cv=5 -j64 raw_data.bed 15 > log_15.out 2>&1
2026-01-19 06:17:24.764 - INFO - 完成|Completed: ADMIXTURE分析 K=15|ADMIXTURE analysis K=15
2026-01-19 06:17:24.765 - INFO -   K=15 分析成功完成|K=15 analysis completed successfully
2026-01-19 06:17:24.777 - INFO -  运行ADMIXTURE K=16|Running ADMIXTURE K=16
2026-01-19 06:17:24.777 - INFO - 开始|Starting: ADMIXTURE分析 K=16|ADMIXTURE analysis K=16
2026-01-19 06:17:24.777 - INFO - 执行命令|Executing command: cd /share/org/YZWL/yzwl_lixg/project/21.野生大豆群体/05.所有样品/14.实验室的样品/06.第一次根据枝长筛选的样品/05.第一次选择的807个样品的admixture && admixture --cv=5 -j64 raw_data.bed 16 > log_16.out 2>&1
2026-01-20 00:58:24.036 - INFO - 完成|Completed: ADMIXTURE分析 K=16|ADMIXTURE analysis K=16
2026-01-20 00:58:24.037 - INFO -   K=16 分析成功完成|K=16 analysis completed successfully
2026-01-20 00:58:24.037 - INFO -  运行ADMIXTURE K=17|Running ADMIXTURE K=17
2026-01-20 00:58:24.037 - INFO - 开始|Starting: ADMIXTURE分析 K=17|ADMIXTURE analysis K=17
2026-01-20 00:58:24.037 - INFO - 执行命令|Executing command: cd /share/org/YZWL/yzwl_lixg/project/21.野生大豆群体/05.所有样品/14.实验室的样品/06.第一次根据枝长筛选的样品/05.第一次选择的807个样品的admixture && admixture --cv=5 -j64 raw_data.bed 17 > log_17.out 2>&1
2026-01-20 13:38:45.650 - INFO - 完成|Completed: ADMIXTURE分析 K=17|ADMIXTURE analysis K=17
2026-01-20 13:38:45.669 - INFO -   K=17 分析成功完成|K=17 analysis completed successfully
2026-01-20 13:38:45.669 - INFO -  运行ADMIXTURE K=18|Running ADMIXTURE K=18
2026-01-20 13:38:45.669 - INFO - 开始|Starting: ADMIXTURE分析 K=18|ADMIXTURE analysis K=18
2026-01-20 13:38:45.669 - INFO - 执行命令|Executing command: cd /share/org/YZWL/yzwl_lixg/project/21.野生大豆群体/05.所有样品/14.实验室的样品/06.第一次根据枝长筛选的样品/05.第一次选择的807个样品的admixture && admixture --cv=5 -j64 raw_data.bed 18 > log_18.out 2>&1
2026-01-21 06:49:05.373 - INFO - 完成|Completed: ADMIXTURE分析 K=18|ADMIXTURE analysis K=18
2026-01-21 06:49:05.375 - INFO -   K=18 分析成功完成|K=18 analysis completed successfully
2026-01-21 06:49:05.375 - INFO -  运行ADMIXTURE K=19|Running ADMIXTURE K=19
2026-01-21 06:49:05.375 - INFO - 开始|Starting: ADMIXTURE分析 K=19|ADMIXTURE analysis K=19
2026-01-21 06:49:05.375 - INFO - 执行命令|Executing command: cd /share/org/YZWL/yzwl_lixg/project/21.野生大豆群体/05.所有样品/14.实验室的样品/06.第一次根据枝长筛选的样品/05.第一次选择的807个样品的admixture && admixture --cv=5 -j64 raw_data.bed 19 > log_19.out 2>&1
2026-01-22 15:12:05.782 - INFO - 完成|Completed: ADMIXTURE分析 K=19|ADMIXTURE analysis K=19
2026-01-22 15:12:05.838 - INFO -   K=19 分析成功完成|K=19 analysis completed successfully
2026-01-22 15:12:05.839 - INFO -  运行ADMIXTURE K=20|Running ADMIXTURE K=20
2026-01-22 15:12:05.839 - INFO - 开始|Starting: ADMIXTURE分析 K=20|ADMIXTURE analysis K=20
2026-01-22 15:12:05.839 - INFO - 执行命令|Executing command: cd /share/org/YZWL/yzwl_lixg/project/21.野生大豆群体/05.所有样品/14.实验室的样品/06.第一次根据枝长筛选的样品/05.第一次选择的807个样品的admixture && admixture --cv=5 -j64 raw_data.bed 20 > log_20.out 2>&1
2026-01-23 06:54:27.643 - INFO - 完成|Completed: ADMIXTURE分析 K=20|ADMIXTURE analysis K=20
2026-01-23 06:54:27.646 - INFO -   K=20 分析成功完成|K=20 analysis completed successfully
2026-01-23 06:54:29.809 - INFO -  ADMIXTURE分析完成|ADMIXTURE analysis completed
2026-01-23 06:54:29.809 - INFO -  最优K值|Best K value: 20
2026-01-23 06:54:29.809 - INFO - 步骤5: 结果处理|Step 5: Results processing
2026-01-23 06:54:29.809 - INFO -  处理分析结果|Processing analysis results
2026-01-23 06:54:32.394 - INFO -  结果已保存|Results saved:
2026-01-23 06:54:32.394 - INFO -   -  个体祖先成分|Individual ancestry proportions: /share/org/YZWL/yzwl_lixg/project/21.野生大豆群体/05.所有样品/14.实验室的样品/06.第一次根据枝长筛选的样品/05.第一次选择的807个样品的admixture/admixture_proportions.csv
2026-01-23 06:54:32.394 - INFO -   -  统计信息|Statistics: /share/org/YZWL/yzwl_lixg/project/21.野生大豆群体/05.所有样品/14.实验室的样品/06.第一次根据枝长筛选的样品/05.第一次选择的807个样品的admixture/admixture_statistics.txt
2026-01-23 06:54:32.406 - INFO - 步骤6: 生成总结报告|Step 6: Generate summary report
2026-01-23 06:54:32.406 - INFO - 分析总结已保存|Analysis summary saved: /share/org/YZWL/yzwl_lixg/project/21.野生大豆群体/05.所有样品/14.实验室的样品/06.第一次根据枝长筛选的样品/05.第一次选择的807个样品的admixture/analysis_summary.txt
2026-01-23 06:54:32.406 - INFO - ================================================================================
2026-01-23 06:54:32.406 - INFO - ADMIXTURE分析圆满完成|ADMIXTURE analysis completed successfully!
2026-01-23 06:54:32.406 - INFO - ================================================================================
2026-01-23 06:54:32.406 - INFO - 最优K值|Best K value: 20
2026-01-23 06:54:32.406 - INFO - 结果目录|Results directory: /share/org/YZWL/yzwl_lixg/project/21.野生大豆群体/05.所有样品/14.实验室的样品/06.第一次根据枝长筛选的样品/05.第一次选择的807个样品的admixture
2026-01-23 06:54:32.406 - INFO - 主要输出文件|Main output files:
2026-01-23 06:54:32.406 - INFO -   - admixture_proportions.csv: 个体祖先成分|Individual ancestry proportions
2026-01-23 06:54:32.406 - INFO -   - gwas_covariates.txt: GWAS协变量文件|GWAS covariate file
2026-01-23 06:54:32.406 - INFO -   - cv_results.csv: 交叉验证结果|Cross-validation results
2026-01-23 06:54:32.406 - INFO -   - analysis_summary.txt: 分析总结报告|Analysis summary report
2026-01-23 06:54:32.407 - INFO - ================================================================================
2026-01-23 06:54:32.417 - INFO - 流程总结|Pipeline Summary
2026-01-23 06:54:32.417 - INFO - ================================================================================
2026-01-23 06:54:32.417 - INFO - 总运行时间|Total runtime: 831229.74 seconds
2026-01-23 06:54:32.417 - INFO - 输出目录|Output directory: ./
2026-01-23 06:54:32.417 - INFO - 流程完成|Pipeline completed successfully
