2026-01-16 14:34:14.867 - WARNING - 命令错误输出|Command stderr:
-- canu master +27 changes (r10515 2a41e933b8de6ed66723d75d36dd071b46d2c347)
--
-- CITATIONS
--
-- For assemblies of PacBio HiFi reads:
--   Nurk S, Walenz BP, Rhiea A, Vollger MR, Logsdon GA, Grothe R, Miga KH, Eichler EE, Phillippy AM, Koren S.
--   HiCanu: accurate assembly of segmental duplications, satellites, and allelic variants from high-fidelity long reads.
--   biorXiv. 2020.
--   https://doi.org/10.1101/2020.03.14.992248
-- 
-- Read and contig alignments during correction and consensus use:
--   Šošic M, Šikic M.
--   Edlib: a C/C ++ library for fast, exact sequence alignment using edit distance.
--   Bioinformatics. 2017 May 1;33(9):1394-1395.
--   http://doi.org/10.1093/bioinformatics/btw753
-- 
-- Overlaps are generated using:
--   Berlin K, et al.
--   Assembling large genomes with single-molecule sequencing and locality-sensitive hashing.
--   Nat Biotechnol. 2015 Jun;33(6):623-30.
--   http://doi.org/10.1038/nbt.3238
-- 
--   Myers EW, et al.
--   A Whole-Genome Assembly of Drosophila.
--   Science. 2000 Mar 24;287(5461):2196-204.
--   http://doi.org/10.1126/science.287.5461.2196
-- 
-- Contig consensus sequences are generated using an algorithm derived from pbdagcon:
--   Chin CS, et al.
--   Nonhybrid, finished microbial genome assemblies from long-read SMRT sequencing data.
--   Nat Methods. 2013 Jun;10(6):563-9
--   http://doi.org/10.1038/nmeth.2474
-- 
-- CONFIGURE CANU
--
-- Detected Java(TM) Runtime Environment '25.0.1-internal' (from '/share/org/YZWL/yzwl_lixg/miniforge3/envs/telocomp/lib/jvm/bin/java') without -d64 support.
--
-- WARNING:
-- WARNING:  Failed to run gnuplot using command 'gnuplot'.
-- WARNING:  Plots will be disabled.
-- WARNING:
--
-- Detected samtools version '1.22' / htslib version 'htscodecs=1.6.3' (from 'samtools').
--
-- Detected 88 CPUs and 503 gigabytes of memory on the local machine.
--
-- Detected Slurm with 'sinfo' binary in /opt/skyformai/bin/sinfo.
--          Slurm disabled by useGrid=false
--
-- Detected  '' with 'pbsnodes' binary in /opt/skyformai/bin/pbsnodes.
--           disabled by useGrid=false
--
-- Detected LSF with 'bsub' binary in /opt/skyformai/bin/bsub.
--          LSF disabled by useGrid=false
--
-- Local machine mode enabled; grid support not detected or not allowed.
--
-- Found trimmed raw PacBio HiFi reads in the input files.
--
--                                (tag)Concurrency
--                         (tag)Threads          |
--                (tag)Memory         |          |
--        (tag)             |         |          |       total usage      algorithm
--        -------  ----------  --------   --------  --------------------  -----------------------------
-- Local: meryl     12.000 GB    4 CPUs x  22 jobs   264.000 GB  88 CPUs  (k-mer counting)
-- Local: cormhap   13.000 GB   11 CPUs x   8 jobs   104.000 GB  88 CPUs  (overlap detection with mhap)
-- Local: obtovl     8.000 GB    8 CPUs x  11 jobs    88.000 GB  88 CPUs  (overlap detection)
-- Local: utgovl     8.000 GB    8 CPUs x  11 jobs    88.000 GB  88 CPUs  (overlap detection)
-- Local: cor        -.--- GB    4 CPUs x   - jobs     -.--- GB   - CPUs  (read correction)
-- Local: ovb        4.000 GB    1 CPU  x  88 jobs   352.000 GB  88 CPUs  (overlap store bucketizer)
-- Local: ovs        8.000 GB    1 CPU  x  62 jobs   496.000 GB  62 CPUs  (overlap store sorting)
-- Local: red       16.000 GB    4 CPUs x  22 jobs   352.000 GB  88 CPUs  (read error detection)
-- Local: oea        8.000 GB    1 CPU  x  62 jobs   496.000 GB  62 CPUs  (overlap error adjustment)
-- Local: bat       32.000 GB    8 CPUs x   1 job     32.000 GB   8 CPUs  (contig construction with bogart)
-- Local: cns        -.--- GB    8 CPUs x   - jobs     -.--- GB   - CPUs  (consensus)
--
-- Generating assembly 'A1-10' in '/share/org/YZWL/yzwl_lixg/project/28.大豆疫霉菌三代基因组/03.hicanu/A1-10/01.raw_output':
--   genomeSize:
--     85000000
--
--   Overlap Generation Limits:
--     corOvlErrorRate 0.0000 (  0.00%)
--     obtOvlErrorRate 0.0250 (  2.50%)
--     utgOvlErrorRate 0.0100 (  1.00%)
--
--   Overlap Processing Limits:
--     corErrorRate    0.0000 (  0.00%)
--     obtErrorRate    0.0250 (  2.50%)
--     utgErrorRate    0.0003 (  0.03%)
--     cnsErrorRate    0.0500 (  5.00%)
--
--   Stages to run:
--     assemble HiFi reads.
--
--
-- BEGIN STORE CREATION
----------------------------------------
-- Starting command on Fri Jan 16 12:40:54 2026 with 4530899.687 GB free disk space

    cd .
    ./A1-10.seqStore.sh \
    > ./A1-10.seqStore.err 2>&1

-- Finished on Fri Jan 16 12:47:29 2026 (395 seconds) with 4532170.406 GB free disk space
----------------------------------------
--
-- In sequence store './A1-10.seqStore':
--   Found 242599 reads.
--   Found 4250007934 bases (50 times coverage).
--    Histogram of corrected reads:
--    
--    G=4250007934                       sum of  ||               length     num
--    NG         length     index       lengths  ||                range    seqs
--    ----- ------------ --------- ------------  ||  ------------------- -------
--    00010        27487     14337    425009402  ||       1235-2466         7361|--------------------
--    00020        25331     30494    850022493  ||       2467-3698        10609|----------------------------
--    00030        23841     47808   1275016832  ||       3699-4930         9548|--------------------------
--    00040        22635     66110   1700005393  ||       4931-6162         8148|----------------------
--    00050        21569     85348   2125006196  ||       6163-7394         7144|-------------------
--    00060        20535    105537   2550014670  ||       7395-8626         6326|-----------------
--    00070        19408    126806   2975012062  ||       8627-9858         5698|----------------
--    00080        17944    149515   3400011996  ||       9859-11090        4872|-------------
--    00090        13278    175550   3825008926  ||      11091-12322        4329|------------
--    00100         1235    242599   4250007934  ||      12323-13554        3820|-----------
--    001.000x              242599   4250007934  ||      13555-14786        3413|----------
--                                               ||      14787-16018        4729|-------------
--                                               ||      16019-17250        9082|------------------------
--                                               ||      17251-18482       15411|-----------------------------------------
--                                               ||      18483-19714       20811|-------------------------------------------------------
--                                               ||      19715-20946       23882|---------------------------------------------------------------
--                                               ||      20947-22178       23419|--------------------------------------------------------------
--                                               ||      22179-23410       20011|-----------------------------------------------------
--                                               ||      23411-24642       16201|-------------------------------------------
--                                               ||      24643-25874       12329|---------------------------------
--                                               ||      25875-27106        8948|------------------------
--                                               ||      27107-28338        6253|-----------------
--                                               ||      28339-29570        4273|------------
--                                               ||      29571-30802        2724|--------
--                                               ||      30803-32034        1670|-----
--                                               ||      32035-33266         900|---
--                                               ||      33267-34498         439|--
--                                               ||      34499-35730         170|-
--                                               ||      35731-36962          51|-
--                                               ||      36963-38194          12|-
--                                               ||      38195-39426           7|-
--                                               ||      39427-40658           1|-
--                                               ||      40659-41890           2|-
--                                               ||      41891-43122           0|
--                                               ||      43123-44354           4|-
--                                               ||      44355-45586           0|
--                                               ||      45587-46818           0|
--                                               ||      46819-48050           0|
--                                               ||      48051-49282           0|
--                                               ||      49283-50514           2|-
--    
--
-- In sequence store './A1-10.seqStore':
--   Found 242599 reads.
--   Found 4250007934 bases (50 times coverage).
--    Histogram of corrected-trimmed reads:
--    
--    G=4250007934                       sum of  ||               length     num
--    NG         length     index       lengths  ||                range    seqs
--    ----- ------------ --------- ------------  ||  ------------------- -------
--    00010        27487     14337    425009402  ||       1235-2466         7361|--------------------
--    00020        25331     30494    850022493  ||       2467-3698        10609|----------------------------
--    00030        23841     47808   1275016832  ||       3699-4930         9548|--------------------------
--    00040        22635     66110   1700005393  ||       4931-6162         8148|----------------------
--    00050        21569     85348   2125006196  ||       6163-7394         7144|-------------------
--    00060        20535    105537   2550014670  ||       7395-8626         6326|-----------------
--    00070        19408    126806   2975012062  ||       8627-9858         5698|----------------
--    00080        17944    149515   3400011996  ||       9859-11090        4872|-------------
--    00090        13278    175550   3825008926  ||      11091-12322        4329|------------
--    00100         1235    242599   4250007934  ||      12323-13554        3820|-----------
--    001.000x              242599   4250007934  ||      13555-14786        3413|----------
--                                               ||      14787-16018        4729|-------------
--                                               ||      16019-17250        9082|------------------------
--                                               ||      17251-18482       15411|-----------------------------------------
--                                               ||      18483-19714       20811|-------------------------------------------------------
--                                               ||      19715-20946       23882|---------------------------------------------------------------
--                                               ||      20947-22178       23419|--------------------------------------------------------------
--                                               ||      22179-23410       20011|-----------------------------------------------------
--                                               ||      23411-24642       16201|-------------------------------------------
--                                               ||      24643-25874       12329|---------------------------------
--                                               ||      25875-27106        8948|------------------------
--                                               ||      27107-28338        6253|-----------------
--                                               ||      28339-29570        4273|------------
--                                               ||      29571-30802        2724|--------
--                                               ||      30803-32034        1670|-----
--                                               ||      32035-33266         900|---
--                                               ||      33267-34498         439|--
--                                               ||      34499-35730         170|-
--                                               ||      35731-36962          51|-
--                                               ||      36963-38194          12|-
--                                               ||      38195-39426           7|-
--                                               ||      39427-40658           1|-
--                                               ||      40659-41890           2|-
--                                               ||      41891-43122           0|
--                                               ||      43123-44354           4|-
--                                               ||      44355-45586           0|
--                                               ||      45587-46818           0|
--                                               ||      46819-48050           0|
--                                               ||      48051-49282           0|
--                                               ||      49283-50514           2|-
--    
--
-- Correction skipped; not enabled.
--
-- Trimming skipped; not enabled.
--
-- BEGIN ASSEMBLY
----------------------------------------
-- Starting command on Fri Jan 16 12:47:30 2026 with 4532170.359 GB free disk space

    cd unitigging/0-mercounts
    ./meryl-configure.sh \
    > ./meryl-configure.err 2>&1

-- Finished on Fri Jan 16 12:47:30 2026 (like a bat out of hell) with 4532170.359 GB free disk space
----------------------------------------
--  segments   memory batches
--  -------- -------- -------
--        01 10.81 GB       2
--        02  5.75 GB       2
--        04  2.97 GB       2
--        06  2.14 GB       2
--        08  1.61 GB       2
--        12  1.07 GB       2
--        16  0.81 GB       2
--        20  0.65 GB       2
--        24  0.54 GB       2
--        32  0.41 GB       2
--        40  0.32 GB       2
--        48  -.-- GB       -  (segment size too small)
--        56  -.-- GB       -  (segment size too small)
--        64  -.-- GB       -  (segment size too small)
--        96  -.-- GB       -  (segment size too small)
--
--  For 242599 reads with 4250007934 bases, limit to 42 batches.
--  Will count kmers using 01 jobs, each using 12 GB and 4 threads.
--
-- Finished stage 'merylConfigure', reset canuIteration.
--
-- Running jobs.  First attempt out of 2.
----------------------------------------
-- Starting 'meryl' concurrent execution on Fri Jan 16 12:47:30 2026 with 4532170.328 GB free disk space (1 processes; 22 concurrently)

    cd unitigging/0-mercounts
    ./meryl-count.sh 1 > ./meryl-count.000001.out 2>&1

-- Finished on Fri Jan 16 12:50:55 2026 (205 seconds) with 4532829.093 GB free disk space
----------------------------------------
-- Found 1 Kmer counting (meryl) outputs.
-- Finished stage 'utg-merylCountCheck', reset canuIteration.
--
-- Running jobs.  First attempt out of 2.
----------------------------------------
-- Starting 'meryl' concurrent execution on Fri Jan 16 12:50:55 2026 with 4532829.906 GB free disk space (1 processes; 22 concurrently)

    cd unitigging/0-mercounts
    ./meryl-process.sh 1 > ./meryl-process.000001.out 2>&1

-- Finished on Fri Jan 16 12:51:01 2026 (6 seconds) with 4532829.421 GB free disk space
----------------------------------------
-- Meryl finished successfully.  Kmer frequency histogram:
--
-- WARNING: gnuplot failed.
--
----------------------------------------
--
--  22-mers                                                                                           Fraction
--    Occurrences   NumMers                                                                         Unique Total
--       1-     1         0                                                                        0.0000 0.0000
--       2-     2    200076                                                                        0.0044 0.0001
--       3-     4     63252                                                                        0.0054 0.0002
--       5-     7     18191                                                                        0.0061 0.0002
--       8-    11      9007                                                                        0.0063 0.0002
--      12-    16     30145                                                                        0.0065 0.0003
--      17-    22    169450                                                                        0.0074 0.0005
--      23-    29    921490 ****                                                                   0.0122 0.0019
--      30-    37   5040954 ***********************                                                0.0377 0.0118
--      38-    46  14846567 *********************************************************************  0.1702 0.0775
--      47-    56  14848154 ********************************************************************** 0.5156 0.2869
--      57-    67   3943007 ******************                                                     0.8206 0.5081
--      68-    79    724446 ***                                                                    0.8924 0.5695
--      80-    92    947406 ****                                                                   0.9081 0.5858
--      93-   106    809449 ***                                                                    0.9293 0.6118
--     107-   121    393338 *                                                                      0.9465 0.6358
--     122-   137    298641 *                                                                      0.9548 0.6491
--     138-   154    262022 *                                                                      0.9615 0.6612
--     155-   172    166485                                                                        0.9671 0.6728
--     173-   191    164665                                                                        0.9708 0.6812
--     192-   211    113171                                                                        0.9744 0.6904
--     212-   232    102864                                                                        0.9769 0.6975
--     233-   254     94767                                                                        0.9792 0.7047
--     255-   277     84129                                                                        0.9812 0.7117
--     278-   301     76468                                                                        0.9831 0.7187
--     302-   326     67346                                                                        0.9848 0.7255
--     327-   352     57684                                                                        0.9863 0.7321
--     353-   379     47804                                                                        0.9875 0.7382
--     380-   407     40988                                                                        0.9886 0.7435
--     408-   436     38300                                                                        0.9895 0.7485
--     437-   466     31908                                                                        0.9903 0.7536
--     467-   497     31424                                                                        0.9910 0.7580
--     498-   529     25886                                                                        0.9917 0.7627
--     530-   562     21176                                                                        0.9923 0.7668
--     563-   596     19709                                                                        0.9928 0.7704
--     597-   631     16554                                                                        0.9932 0.7739
--     632-   667     17535                                                                        0.9936 0.7771
--     668-   704     16008                                                                        0.9940 0.7807
--     705-   742     11458                                                                        0.9943 0.7840
--     743-   781     11310                                                                        0.9946 0.7866
--     782-   821     10079                                                                        0.9948 0.7893
--
--           0 (max occurrences)
--  3213629785 (total mers, non-unique)
--    45016828 (distinct mers, non-unique)
--           0 (unique mers)
-- Finished stage 'meryl-process', reset canuIteration.
--
-- Removing meryl database 'unitigging/0-mercounts/A1-10.ms22'.
--
-- OVERLAPPER (normal) (assembly) erate=0.01
--
----------------------------------------
-- Starting command on Fri Jan 16 12:51:01 2026 with 4532829.406 GB free disk space

    cd unitigging/1-overlapper
    /share/org/YZWL/yzwl_lixg/miniforge3/envs/canu_v.2.3/bin/overlapInCorePartition \
     -S  ../../A1-10.seqStore \
     -hl 160000000 \
     -rl 5000000000 \
     -ol 500 \
     -o  ./A1-10.partition \
    > ./A1-10.partition.err 2>&1

-- Finished on Fri Jan 16 12:51:01 2026 (fast as lightning) with 4532829.39 GB free disk space
----------------------------------------
--
-- Configured 21 overlapInCore jobs.
-- Finished stage 'utg-overlapConfigure', reset canuIteration.
--
-- Running jobs.  First attempt out of 2.
----------------------------------------
-- Starting 'utgovl' concurrent execution on Fri Jan 16 12:51:01 2026 with 4532829.359 GB free disk space (21 processes; 11 concurrently)

    cd unitigging/1-overlapper
    ./overlap.sh 1 > ./overlap.000001.out 2>&1
    ./overlap.sh 2 > ./overlap.000002.out 2>&1
    ./overlap.sh 3 > ./overlap.000003.out 2>&1
    ./overlap.sh 4 > ./overlap.000004.out 2>&1
    ./overlap.sh 5 > ./overlap.000005.out 2>&1
    ./overlap.sh 6 > ./overlap.000006.out 2>&1
    ./overlap.sh 7 > ./overlap.000007.out 2>&1
    ./overlap.sh 8 > ./overlap.000008.out 2>&1
    ./overlap.sh 9 > ./overlap.000009.out 2>&1
    ./overlap.sh 10 > ./overlap.000010.out 2>&1
    ./overlap.sh 11 > ./overlap.000011.out 2>&1
    ./overlap.sh 12 > ./overlap.000012.out 2>&1
    ./overlap.sh 13 > ./overlap.000013.out 2>&1
    ./overlap.sh 14 > ./overlap.000014.out 2>&1
    ./overlap.sh 15 > ./overlap.000015.out 2>&1
    ./overlap.sh 16 > ./overlap.000016.out 2>&1
    ./overlap.sh 17 > ./overlap.000017.out 2>&1
    ./overlap.sh 18 > ./overlap.000018.out 2>&1
    ./overlap.sh 19 > ./overlap.000019.out 2>&1
    ./overlap.sh 20 > ./overlap.000020.out 2>&1
    ./overlap.sh 21 > ./overlap.000021.out 2>&1

-- Finished on Fri Jan 16 13:20:17 2026 (1756 seconds) with 4532568.265 GB free disk space
----------------------------------------
-- Found 21 overlapInCore output files.
--
-- overlapInCore compute 'unitigging/1-overlapper':
--   kmer hits
--     with no overlap       1320934446  40.2857143 +- 39568913.194
--     with an overlap         40468067  0.80952381 +- 1093027.898
--
--   overlaps                  40468067  0.80952381 +- 1093027.898
--     contained                9205325  8.80952381 +- 244995.083
--     dovetail                31262742     1488702 +- 855428.118
--
--   overlaps rejected
--     multiple per pair              0           0 +- 0
--     bad short window               0           0 +- 0
--     bad long window                0           0 +- 0
-- Finished stage 'utg-overlapCheck', reset canuIteration.
----------------------------------------
-- Starting command on Fri Jan 16 13:20:17 2026 with 4532568.25 GB free disk space

    cd unitigging
    /share/org/YZWL/yzwl_lixg/miniforge3/envs/canu_v.2.3/bin/ovStoreConfig \
     -S ../A1-10.seqStore \
     -M 4-8 \
     -L ./1-overlapper/ovljob.files \
     -create ./A1-10.ovlStore.config \
     > ./A1-10.ovlStore.config.txt \
    2> ./A1-10.ovlStore.config.err

-- Finished on Fri Jan 16 13:20:17 2026 (fast as lightning) with 4532568.234 GB free disk space
----------------------------------------
--
-- Creating overlap store unitigging/A1-10.ovlStore using:
--      1 bucket
--      1 slice
--        using at most 3 GB memory each
--
-- Running jobs.  First attempt out of 2.
----------------------------------------
-- Starting 'ovS' concurrent execution on Fri Jan 16 13:20:17 2026 with 4532568.218 GB free disk space (1 processes; 62 concurrently)

    cd unitigging
    ./A1-10.ovlStore.sh 1 > ./A1-10.ovlStore.000001.out 2>&1

-- Finished on Fri Jan 16 13:20:33 2026 (16 seconds) with 4532559.015 GB free disk space
----------------------------------------
-- Checking store.
----------------------------------------
-- Starting command on Fri Jan 16 13:20:33 2026 with 4532559.015 GB free disk space

    cd unitigging
    /share/org/YZWL/yzwl_lixg/miniforge3/envs/canu_v.2.3/bin/ovStoreDump \
     -S ../A1-10.seqStore \
     -O  ./A1-10.ovlStore \
     -counts \
     > ./A1-10.ovlStore/counts.dat 2> ./A1-10.ovlStore/counts.err

-- Finished on Fri Jan 16 13:20:33 2026 (furiously fast) with 4532557.156 GB free disk space
----------------------------------------
--
-- Overlap store 'unitigging/A1-10.ovlStore' successfully constructed.
-- Found 80936134 overlaps for 238636 reads; 1244918 reads have no overlaps.
--
--
-- Purged 0.796 GB in 63 overlap output files.
----------------------------------------
-- Starting command on Fri Jan 16 13:20:34 2026 with 4532501.843 GB free disk space

    cd unitigging
    /share/org/YZWL/yzwl_lixg/miniforge3/envs/canu_v.2.3/bin/ovStoreStats \
     -C 50 \
     -S ../A1-10.seqStore \
     -O  ./A1-10.ovlStore \
     -o  ./A1-10.ovlStore \
     > ./A1-10.ovlStore.summary.err 2>&1

-- Finished on Fri Jan 16 13:20:46 2026 (12 seconds) with 4532502.546 GB free disk space
----------------------------------------
--
-- Overlap store 'unitigging/A1-10.ovlStore' contains:
--
--   category            reads     %          read length        feature size or coverage  analysis
--   ----------------  -------  -------  ----------------------  ------------------------  --------------------
--   middle-missing        116    0.05    15961.98 +- 7005.06        707.91 +- 830.57     (bad trimming)
--   middle-hump             9    0.00    16725.11 +- 2651.99       7014.33 +- 5007.86    (bad trimming)
--   no-5-prime            436    0.18    13894.29 +- 5870.73       1479.33 +- 2703.81    (bad trimming)
--   no-3-prime            488    0.20    12254.11 +- 6892.56       1578.03 +- 2731.91    (bad trimming)
--   
--   low-coverage          831    0.34    11213.14 +- 6126.32          5.58 +- 3.54       (easy to assemble, potential for lower quality consensus)
--   unique             195892   80.75    13429.41 +- 6030.57         45.97 +- 8.81       (easy to assemble, perfect, yay)
--   repeat-cont         18966    7.82    11280.38 +- 5314.06       1707.79 +- 1307.68    (potential for consensus errors, no impact on assembly)
--   repeat-dove           323    0.13    21122.84 +- 1951.35        639.48 +- 685.31     (hard to assemble, likely won't assemble correctly or even at all)
--   
--   span-repeat          3018    1.24    14937.51 +- 5219.74       3110.47 +- 3644.83    (read spans a large repeat, usually easy to assemble)
--   uniq-repeat-cont    12495    5.15    13383.80 +- 4897.93                             (should be uniquely placed, low potential for consensus errors, no impact on assembly)
--   uniq-repeat-dove     2788    1.15    19694.66 +- 2871.47                             (will end contigs, potential to misassemble)
--   uniq-anchor          3274    1.35    14478.20 +- 5065.48       8332.98 +- 5309.82    (repeat read, with unique section, probable bad read)
-- Finished stage 'utg-createOverlapStore', reset canuIteration.
--
-- Loading read lengths.
-- Loading number of overlaps per read.
--
-- Configure RED for 16gb memory.
--                   Batches of at most (unlimited) reads.
--                                      500000000 bases.
--                   Expecting evidence of at most 536870912 bases per iteration.
--
--           Total                                               Reads                 Olaps Evidence
--    Job   Memory      Read Range         Reads        Bases   Memory        Olaps   Memory   Memory  (Memory in MB)
--   ---- -------- ------------------- --------- ------------ -------- ------------ -------- --------
--      1 16385.28         1-31997          5223    108871902 13290.19      2017500    23.09  1024.00
--      2 16385.18     31998-66551          5809    108929270 13297.21      1395072    15.97  1024.00
--      3 16384.23     66552-106670         6547    108887408 13292.13      1756567    20.10  1024.00
--      4 16387.03    106671-140360         5470    108835241 13285.72      2560497    29.30  1024.00
--      5 16384.01    140361-177792         6109    108882731 13291.54      1788299    20.47  1024.00
--      6 16385.66    177793-227346         8148    108810750 13282.82      2695151    30.84  1024.00
--      7 16384.22    227347-260684         5363    108837518 13286.00      2291137    26.22  1024.00
--      8 16386.13    260685-295647         5791    108889238 13292.33      1905055    21.80  1024.00
--      9 16384.83    295648-346513         8347    108812193 13283.00      2606232    29.83  1024.00
--     10 16385.17    346514-378723         5268    108916543 13295.64      1531562    17.53  1024.00
--     11 16384.04    378724-412854         5535    108805294 13282.07      2618897    29.97  1024.00
--     12 16385.35    412855-452822         6661    108975634 13302.90       912848    10.45  1024.00
--     13 16384.52    452823-495668         6890    108826863 13284.75      2426791    27.77  1024.00
--     14 16385.11    495669-529552         5458    108819753 13283.83      2558393    29.28  1024.00
--     15 16384.80    529553-565096         5975    108900065 13293.65      1672849    19.14  1024.00
--     16 16385.13    565097-612271         7734    108834603 13285.72      2395451    27.41  1024.00
--     17 16386.67    612272-644205         5327    108826007 13284.59      2628385    30.08  1024.00
--     18 16385.26    644206-678787         5708    108904589 13294.20      1666195    19.07  1024.00
--     19 16384.04    678788-728580         8026    108805541 13282.18      2609035    29.86  1024.00
--     20 16385.50    728581-761357         5313    108928369 13297.09      1433811    16.41  1024.00
--     21 16386.82    761358-795246         5516    108835317 13285.73      2541137    29.08  1024.00
--     22 16386.43    795247-834213         6397    108985620 13304.11       902041    10.32  1024.00
--     23 16386.06    834214-876562         6966    108840605 13286.43      2414452    27.63  1024.00
--     24 16386.86    876563-910542         5473    108828409 13284.89      2618877    29.97  1024.00
--     25 16385.90    910543-947707         5949    108908065 13294.63      1683674    19.27  1024.00
--     26 16387.27    947708-995486         7703    108843293 13286.78      2490083    28.50  1024.00
--     27 16387.15    995487-1028563        5339    108861335 13288.91      2293429    26.25  1024.00
--     28 16385.81   1028564-1062479        5654    108895726 13293.11      1808677    20.70  1024.00
--     29 16385.47   1062480-1110211        7748    108841800 13286.60      2347827    26.87  1024.00
--     30 16385.75   1110212-1142134        5215    108934457 13297.83      1390973    15.92  1024.00
--     31 16384.80   1142135-1174649        5408    108833922 13285.56      2380206    27.24  1024.00
--     32 16385.00   1174650-1212525        6203    108978852 13303.28       849336     9.72  1024.00
--     33 16384.82   1212526-1252413        6532    108843411 13286.75      2277570    26.06  1024.00
--     34 16386.20   1252414-1284907        5380    108825712 13284.56      2590574    29.65  1024.00
--     35 16384.24   1284908-1320346        5801    108898965 13293.51      1636056    18.72  1024.00
--     36 16384.93   1320347-1365728        7423    108827788 13284.88      2451370    28.05  1024.00
--     37 16384.62   1365729-1397976        5359    108821422 13284.03      2498169    28.59  1024.00
--     38 16384.53   1397977-1433115        5610    108905646 13294.32      1590678    18.20  1024.00
--     39 16385.89   1433116-1481785        7924    108816847 13283.56      2650706    30.33  1024.00
--     40  3582.99   1481786-1483554         297      4181230   510.41        50572     0.58  1024.00
--   ---- -------- ------------------- --------- ------------ -------- ------------ -------- --------
--                                                 4250007934              80936134
-- Finished stage 'readErrorDetectionConfigure', reset canuIteration.
--
-- Running jobs.  First attempt out of 2.
----------------------------------------
-- Starting 'red' concurrent execution on Fri Jan 16 13:20:52 2026 with 4532496.312 GB free disk space (40 processes; 22 concurrently)

    cd unitigging/3-overlapErrorAdjustment
    ./red.sh 1 > ./red.000001.out 2>&1
    ./red.sh 2 > ./red.000002.out 2>&1
    ./red.sh 3 > ./red.000003.out 2>&1
    ./red.sh 4 > ./red.000004.out 2>&1
    ./red.sh 5 > ./red.000005.out 2>&1
    ./red.sh 6 > ./red.000006.out 2>&1
    ./red.sh 7 > ./red.000007.out 2>&1
    ./red.sh 8 > ./red.000008.out 2>&1
    ./red.sh 9 > ./red.000009.out 2>&1
    ./red.sh 10 > ./red.000010.out 2>&1
    ./red.sh 11 > ./red.000011.out 2>&1
    ./red.sh 12 > ./red.000012.out 2>&1
    ./red.sh 13 > ./red.000013.out 2>&1
    ./red.sh 14 > ./red.000014.out 2>&1
    ./red.sh 15 > ./red.000015.out 2>&1
    ./red.sh 16 > ./red.000016.out 2>&1
    ./red.sh 17 > ./red.000017.out 2>&1
    ./red.sh 18 > ./red.000018.out 2>&1
    ./red.sh 19 > ./red.000019.out 2>&1
    ./red.sh 20 > ./red.000020.out 2>&1
    ./red.sh 21 > ./red.000021.out 2>&1
    ./red.sh 22 > ./red.000022.out 2>&1
    ./red.sh 23 > ./red.000023.out 2>&1
    ./red.sh 24 > ./red.000024.out 2>&1
    ./red.sh 25 > ./red.000025.out 2>&1
    ./red.sh 26 > ./red.000026.out 2>&1
    ./red.sh 27 > ./red.000027.out 2>&1
    ./red.sh 28 > ./red.000028.out 2>&1
    ./red.sh 29 > ./red.000029.out 2>&1
    ./red.sh 30 > ./red.000030.out 2>&1
    ./red.sh 31 > ./red.000031.out 2>&1
    ./red.sh 32 > ./red.000032.out 2>&1
    ./red.sh 33 > ./red.000033.out 2>&1
    ./red.sh 34 > ./red.000034.out 2>&1
    ./red.sh 35 > ./red.000035.out 2>&1
    ./red.sh 36 > ./red.000036.out 2>&1
    ./red.sh 37 > ./red.000037.out 2>&1
    ./red.sh 38 > ./red.000038.out 2>&1
    ./red.sh 39 > ./red.000039.out 2>&1
    ./red.sh 40 > ./red.000040.out 2>&1

-- Finished on Fri Jan 16 13:36:01 2026 (909 seconds) with 4532333.812 GB free disk space
----------------------------------------
-- Found 40 read error detection output files.
-- Finished stage 'readErrorDetectionCheck', reset canuIteration.
--
-- Loading read lengths.
-- Loading number of overlaps per read.
--
-- Configure OEA for 8gb memory.
--                   Batches of at most (unlimited) reads.
--                                      300000000 bases.
--
--           Total                                               Reads                 Olaps  Adjusts
--    Job   Memory      Read Range         Reads        Bases   Memory        Olaps   Memory   Memory  (Memory in MB)
--   ---- -------- ------------------- --------- ------------ -------- ------------ -------- --------
--      1  2857.90         1-98471         16278    300017799   294.62      5016367   153.09   362.20
--      2  2865.33     98472-204851        17330    300015190   294.65      5258813   160.49   362.20
--      3  2897.95    204852-305715        16508    300006246   294.61      6328935   193.14   362.20
--      4  2905.50    305716-413666        17620    300004611   294.64      6575027   200.65   362.20
--      5  2875.91    413667-522004        17656    300020401   294.66      5604983   171.05   362.20
--      6  2847.15    522005-629476        17769    300006537   294.65      4662893   142.30   362.20
--      7  2911.50    629477-738634        17812    300015098   294.66      6771215   206.64   362.20
--      8  2850.32    738635-837173        16118    300004313   294.60      4768425   145.52   362.20
--      9  2903.95    837174-939713        16664    300011809   294.62      6525038   199.13   362.20
--     10  2887.59    939714-1047049       17362    300003825   294.64      5988421   182.75   362.20
--     11  2873.67   1047050-1152287       17188    300002321   294.63      5532736   168.85   362.20
--     12  2841.26   1152288-1254709       16863    300004567   294.62      4471044   136.45   362.20
--     13  2904.68   1254710-1360348       17317    300016841   294.65      6548347   199.84   362.20
--     14  2850.38   1360349-1456313       15696    300006892   294.59      4770969   145.60   362.20
--     15  2530.37   1456314-1483554        4418     49871484    55.70      2112921    64.48   362.20
--   ---- -------- ------------------- --------- ------------ -------- ------------ -------- --------
--                                                 4250007934              80936134
-- Finished stage 'overlapErrorAdjustmentConfigure', reset canuIteration.
--
-- Running jobs.  First attempt out of 2.
----------------------------------------
-- Starting 'oea' concurrent execution on Fri Jan 16 13:36:08 2026 with 4532333.75 GB free disk space (15 processes; 62 concurrently)

    cd unitigging/3-overlapErrorAdjustment
    ./oea.sh 1 > ./oea.000001.out 2>&1
    ./oea.sh 2 > ./oea.000002.out 2>&1
    ./oea.sh 3 > ./oea.000003.out 2>&1
    ./oea.sh 4 > ./oea.000004.out 2>&1
    ./oea.sh 5 > ./oea.000005.out 2>&1
    ./oea.sh 6 > ./oea.000006.out 2>&1
    ./oea.sh 7 > ./oea.000007.out 2>&1
    ./oea.sh 8 > ./oea.000008.out 2>&1
    ./oea.sh 9 > ./oea.000009.out 2>&1
    ./oea.sh 10 > ./oea.000010.out 2>&1
    ./oea.sh 11 > ./oea.000011.out 2>&1
    ./oea.sh 12 > ./oea.000012.out 2>&1
    ./oea.sh 13 > ./oea.000013.out 2>&1
    ./oea.sh 14 > ./oea.000014.out 2>&1
    ./oea.sh 15 > ./oea.000015.out 2>&1

-- Finished on Fri Jan 16 14:22:13 2026 (2765 seconds) with 4530770.921 GB free disk space
----------------------------------------
-- Found 15 overlap error adjustment output files.
-- Finished stage 'overlapErrorAdjustmentCheck', reset canuIteration.
----------------------------------------
-- Starting command on Fri Jan 16 14:22:13 2026 with 4530770.906 GB free disk space

    cd unitigging/3-overlapErrorAdjustment
    /share/org/YZWL/yzwl_lixg/miniforge3/envs/canu_v.2.3/bin/loadErates \
      -S ../../A1-10.seqStore \
      -O ../A1-10.ovlStore \
      -L ./oea.files \
    > ./oea.apply.err 2>&1

-- Finished on Fri Jan 16 14:22:13 2026 (in the blink of an eye) with 4530770.734 GB free disk space
----------------------------------------
-- No report available.
-- Finished stage 'updateOverlapStore', reset canuIteration.
-- Finished stage 'unitig', reset canuIteration.
--
-- Running jobs.  First attempt out of 2.
----------------------------------------
-- Starting 'bat' concurrent execution on Fri Jan 16 14:22:13 2026 with 4530770.687 GB free disk space (1 processes; 1 concurrently)

    cd unitigging/4-unitigger
    ./unitigger.sh 1 > ./unitigger.000001.out 2>&1

-- Finished on Fri Jan 16 14:22:34 2026 (21 seconds) with 4530756.5 GB free disk space
----------------------------------------
-- Unitigger finished successfully.
--  
--  ERROR RATES
--  -----------
--                                                   --------threshold------
--  271651                       fraction error      fraction        percent
--  samples                              (1e-5)         error          error
--                   --------------------------      --------       --------
--  command line (-eg)                           ->     30.00        0.0300%
--  command line (-ef)                           ->  -----.--      ---.----%
--  command line (-eM)                           ->     30.00        0.0300%
--  mean + std.dev       0.37 +-  12 *     2.72  ->     33.01        0.0330%
--  median + mad         0.00 +-  12 *     0.00  ->      0.00        0.0000%
--  90th percentile                              ->      1.00        0.0010%  (enabled)
--  
--  BEST EDGE FILTERING
--  -------------------
--  At graph threshold 0.0300%, reads:
--    available to have edges:        41773
--    with at least one edge:         36800
--  
--  At max threshold 0.0300%, reads:  (not computed)
--    available to have edges:            0
--    with at least one edge:             0
--  
--  At tight threshold 0.0010%, reads with:
--    both edges below error threshold:     32154  (80.00% minReadsBest threshold = 29440)
--    one  edge  above error threshold:      3219
--    both edges above error threshold:      1427
--    at least one edge:                    36800
--  
--  At loose threshold 0.0300%, reads with:
--    both edges below error threshold:     36800  (80.00% minReadsBest threshold = 29440)
--    one  edge  above error threshold:         0
--    both edges above error threshold:         0
--    at least one edge:                    36800
--  
--  
--  INITIAL EDGES
--  -------- ----------------------------------------
--    195398 reads are contained
--   1254765 reads have no best edges (singleton)
--       272 reads have only one best edge (spur) 
--                140 are mutual best
--     33119 reads have two best edges 
--                946 have one mutual best edge
--              31745 have two mutual best edges
--  
--  
--  FINAL EDGES
--  -------- ----------------------------------------
--    195398 reads are contained
--   1255053 reads have no best edges (singleton)
--       175 reads have only one best edge (spur) 
--                148 are mutual best
--     32928 reads have two best edges 
--                848 have one mutual best edge
--              31737 have two mutual best edges
--  
--  
--  EDGE FILTERING
--  -------- ------------------------------------------
--         0 reads are ignored
--      8844 reads have a gap in overlap coverage
--       140 reads have lopsided best edges
-- Found, in version 1, after unitig construction:
--   contigs:      169 sequences, total length 70908514 bp (including 230 repeats of total length 7660094 bp).
--   bubbles:      257 sequences, total length 10800246 bp.
--   unassembled:  13628 sequences, total length 172818798 bp.
--
-- Contig sizes based on genome size 85mbp:
--
--            NG (bp)  LG (contigs)    sum (bp)
--         ----------  ------------  ----------
--     10     6390333             2    14299320
--     20     5840894             3    20140214
--     30     4619905             5    29576625
--     40     3886753             7    37376900
--     50     3300417             9    44226172
--     60     2510200            12    52220525
--     70     1370979            17    60816714
--     80       47452            42    68039805
--
-- Finished stage 'unitigCheck', reset canuIteration.
----------------------------------------
-- Starting command on Fri Jan 16 14:22:34 2026 with 4530756.484 GB free disk space

    cd unitigging
    /share/org/YZWL/yzwl_lixg/miniforge3/envs/canu_v.2.3/bin/utgcns \
      -S ../A1-10.seqStore \
      -T  ./A1-10.ctgStore 1 \
      -partition 0.8 1.5 0.1 \
    > ./A1-10.ctgStore/partitioning.log 2>&1

-- Finished on Fri Jan 16 14:22:43 2026 (9 seconds) with 4530755.265 GB free disk space
----------------------------------------
-- Using slow alignment for consensus (iteration '0').
-- Configured 10 consensus jobs.
-- Finished stage 'consensusConfigure', reset canuIteration.
--
-- Local: cns       11.750 GB    8 CPUs x  11 jobs   129.250 GB  88 CPUs  (consensus)
--
--
-- Running jobs.  First attempt out of 2.
----------------------------------------
-- Starting 'cns' concurrent execution on Fri Jan 16 14:22:43 2026 with 4530755.234 GB free disk space (10 processes; 11 concurrently)

    cd unitigging/5-consensus
    ./consensus.sh 1 > ./consensus.000001.out 2>&1
    ./consensus.sh 2 > ./consensus.000002.out 2>&1
    ./consensus.sh 3 > ./consensus.000003.out 2>&1
    ./consensus.sh 4 > ./consensus.000004.out 2>&1
    ./consensus.sh 5 > ./consensus.000005.out 2>&1
    ./consensus.sh 6 > ./consensus.000006.out 2>&1
    ./consensus.sh 7 > ./consensus.000007.out 2>&1
    ./consensus.sh 8 > ./consensus.000008.out 2>&1
    ./consensus.sh 9 > ./consensus.000009.out 2>&1
    ./consensus.sh 10 > ./consensus.000010.out 2>&1

-- Finished on Fri Jan 16 14:30:01 2026 (438 seconds) with 4530464.953 GB free disk space
----------------------------------------
-- Using slow alignment for consensus (iteration '1').
-- Configured 10 consensus jobs.
-- All 10 consensus jobs finished successfully.
-- Finished stage 'consensusCheck', reset canuIteration.
-- Using slow alignment for consensus (iteration '0').
-- Configured 10 consensus jobs.
----------------------------------------
-- Starting command on Fri Jan 16 14:30:01 2026 with 4530464.906 GB free disk space

    cd unitigging
    /share/org/YZWL/yzwl_lixg/miniforge3/envs/canu_v.2.3/bin/tgStoreLoad \
      -S ../A1-10.seqStore \
      -T  ./A1-10.ctgStore 2 \
      -L ./5-consensus/ctgcns.files \
    > ./5-consensus/ctgcns.files.ctgStoreLoad.err 2>&1

-- Finished on Fri Jan 16 14:30:02 2026 (one second) with 4530464.187 GB free disk space
----------------------------------------
----------------------------------------
-- Starting command on Fri Jan 16 14:30:02 2026 with 4530464.187 GB free disk space

    cd unitigging
    /share/org/YZWL/yzwl_lixg/miniforge3/envs/canu_v.2.3/bin/tgTigDisplay \
      -S ../A1-10.seqStore \
      -b \
      -o ../A1-10.contigs.unsorted.bam \
      -L ./5-consensus/ctgcns.files \
    > ./5-consensus/ctgcns.files.contigs.bam.err 2>&1

-- Finished on Fri Jan 16 14:32:56 2026 (174 seconds) with 4529932.218 GB free disk space
----------------------------------------
----------------------------------------
-- Starting command on Fri Jan 16 14:32:56 2026 with 4529932.218 GB free disk space

    cd .
    samtools sort \
      --write-index \
      --threads 2 \
      -o ./A1-10.contigs.bam ./A1-10.contigs.unsorted.bam \
    > ./ctgcns.bam.err 2>&1

-- Finished on Fri Jan 16 14:34:12 2026 (76 seconds) with 4529127.828 GB free disk space
----------------------------------------
-- Purging consensus output after loading to ctgStore.
-- Purged 10 .cns outputs.
----------------------------------------
-- Starting command on Fri Jan 16 14:34:12 2026 with 4529129.796 GB free disk space

    cd unitigging
    /share/org/YZWL/yzwl_lixg/miniforge3/envs/canu_v.2.3/bin/tgStoreDump \
      -S ../A1-10.seqStore \
      -T ./A1-10.ctgStore 2 \
      -sizes -s 85000000 \
    > ./A1-10.ctgStore/seqDB.v002.sizes.txt
ZERO length suplied to intervalList::add(), ignoring interval.
ZERO length suplied to intervalList::add(), ignoring interval.
ZERO length suplied to intervalList::add(), ignoring interval.
ZERO length suplied to intervalList::add(), ignoring interval.
ZERO length suplied to intervalList::add(), ignoring interval.
ZERO length suplied to intervalList::add(), ignoring interval.
ZERO length suplied to intervalList::add(), ignoring interval.
ZERO length suplied to intervalList::add(), ignoring interval.
ZERO length suplied to intervalList::add(), ignoring interval.
ZERO length suplied to intervalList::add(), ignoring interval.
ZERO length suplied to intervalList::add(), ignoring interval.
ZERO length suplied to intervalList::add(), ignoring interval.
ZERO length suplied to intervalList::add(), ignoring interval.
ZERO length suplied to intervalList::add(), ignoring interval.
ZERO length suplied to intervalList::add(), ignoring interval.
ZERO length suplied to intervalList::add(), ignoring interval.
ZERO length suplied to intervalList::add(), ignoring interval.
ZERO length suplied to intervalList::add(), ignoring interval.
ZERO length suplied to intervalList::add(), ignoring interval.
ZERO length suplied to intervalList::add(), ignoring interval.
ZERO length suplied to intervalList::add(), ignoring interval.
ZERO length suplied to intervalList::add(), ignoring interval.
ZERO length suplied to intervalList::add(), ignoring interval.
ZERO length suplied to intervalList::add(), ignoring interval.

-- Finished on Fri Jan 16 14:34:12 2026 (in the blink of an eye) with 4529129.796 GB free disk space
----------------------------------------
-- Found, in version 2, after consensus generation:
--   contigs:      169 sequences, total length 92679444 bp (including 230 repeats of total length 10382705 bp).
--   bubbles:      257 sequences, total length 14229642 bp.
--   unassembled:  13628 sequences, total length 237479954 bp.
--
-- Contig sizes based on genome size 85mbp:
--
--            NG (bp)  LG (contigs)    sum (bp)
--         ----------  ------------  ----------
--     10    10307911             1    10307911
--     20     8300048             2    18607959
--     30     7582808             3    26190767
--     40     5997742             5    38462008
--     50     5113587             6    43575595
--     60     4622716             8    53257843
--     70     3604092            10    61163430
--     80     2778905            13    70754650
--     90     1886120            16    77403458
--    100      516852            23    85492586
--
-- Finished stage 'consensusLoad', reset canuIteration.
----------------------------------------
-- Starting command on Fri Jan 16 14:34:12 2026 with 4529129.781 GB free disk space

    cd .
    /share/org/YZWL/yzwl_lixg/miniforge3/envs/canu_v.2.3/bin/tgStoreDump \
      -S ./A1-10.seqStore \
      -T ./unitigging/A1-10.ctgStore 2 \
      -o ./A1-10.contigs \
      -layout \
    > ./A1-10.contigs.layout.err 2>&1

-- Finished on Fri Jan 16 14:34:13 2026 (one second) with 4529129.75 GB free disk space
----------------------------------------
----------------------------------------
-- Starting command on Fri Jan 16 14:34:13 2026 with 4529129.75 GB free disk space

    cd .
    /share/org/YZWL/yzwl_lixg/miniforge3/envs/canu_v.2.3/bin/tgStoreDump \
      -S ./A1-10.seqStore \
      -T ./unitigging/A1-10.ctgStore 2 \
      -consensus -fasta \
      -unassembled \
    > ./A1-10.unassembled.fasta
    2> ./A1-10.unassembled.err
ZERO length suplied to intervalList::add(), ignoring interval.
ZERO length suplied to intervalList::add(), ignoring interval.
ZERO length suplied to intervalList::add(), ignoring interval.
ZERO length suplied to intervalList::add(), ignoring interval.
ZERO length suplied to intervalList::add(), ignoring interval.
ZERO length suplied to intervalList::add(), ignoring interval.
ZERO length suplied to intervalList::add(), ignoring interval.
ZERO length suplied to intervalList::add(), ignoring interval.
ZERO length suplied to intervalList::add(), ignoring interval.
ZERO length suplied to intervalList::add(), ignoring interval.
ZERO length suplied to intervalList::add(), ignoring interval.
ZERO length suplied to intervalList::add(), ignoring interval.
ZERO length suplied to intervalList::add(), ignoring interval.
ZERO length suplied to intervalList::add(), ignoring interval.
ZERO length suplied to intervalList::add(), ignoring interval.
ZERO length suplied to intervalList::add(), ignoring interval.
ZERO length suplied to intervalList::add(), ignoring interval.
ZERO length suplied to intervalList::add(), ignoring interval.
ZERO length suplied to intervalList::add(), ignoring interval.
ZERO length suplied to intervalList::add(), ignoring interval.
ZERO length suplied to intervalList::add(), ignoring interval.
ZERO length suplied to intervalList::add(), ignoring interval.
ZERO length suplied to intervalList::add(), ignoring interval.
ZERO length suplied to intervalList::add(), ignoring interval.

-- Finished on Fri Jan 16 14:34:14 2026 (one second) with 4529129.5 GB free disk space
----------------------------------------
----------------------------------------
-- Starting command on Fri Jan 16 14:34:14 2026 with 4529129.5 GB free disk space

    cd .
    /share/org/YZWL/yzwl_lixg/miniforge3/envs/canu_v.2.3/bin/tgStoreDump \
      -S ./A1-10.seqStore \
      -T ./unitigging/A1-10.ctgStore 2 \
      -consensus -fasta \
      -contigs \
    > ./A1-10.contigs.fasta
    2> ./A1-10.contigs.err
ZERO length suplied to intervalList::add(), ignoring interval.
ZERO length suplied to intervalList::add(), ignoring interval.
ZERO length suplied to intervalList::add(), ignoring interval.
ZERO length suplied to intervalList::add(), ignoring interval.
ZERO length suplied to intervalList::add(), ignoring interval.
ZERO length suplied to intervalList::add(), ignoring interval.
ZERO length suplied to intervalList::add(), ignoring interval.
ZERO length suplied to intervalList::add(), ignoring interval.
ZERO length suplied to intervalList::add(), ignoring interval.
ZERO length suplied to intervalList::add(), ignoring interval.
ZERO length suplied to intervalList::add(), ignoring interval.
ZERO length suplied to intervalList::add(), ignoring interval.
ZERO length suplied to intervalList::add(), ignoring interval.
ZERO length suplied to intervalList::add(), ignoring interval.
ZERO length suplied to intervalList::add(), ignoring interval.
ZERO length suplied to intervalList::add(), ignoring interval.
ZERO length suplied to intervalList::add(), ignoring interval.
ZERO length suplied to intervalList::add(), ignoring interval.
ZERO length suplied to intervalList::add(), ignoring interval.
ZERO length suplied to intervalList::add(), ignoring interval.
ZERO length suplied to intervalList::add(), ignoring interval.
ZERO length suplied to intervalList::add(), ignoring interval.
ZERO length suplied to intervalList::add(), ignoring interval.
ZERO length suplied to intervalList::add(), ignoring interval.

-- Finished on Fri Jan 16 14:34:14 2026 (fast as lightning) with 4529129.375 GB free disk space
----------------------------------------
-- Finished stage 'generateOutputs', reset canuIteration.
--
-- Assembly 'A1-10' finished in '/share/org/YZWL/yzwl_lixg/project/28.大豆疫霉菌三代基因组/03.hicanu/A1-10/01.raw_output'.
--
-- Summary saved in 'A1-10.report'.
--
-- Sequences saved:
--   Contigs       -> 'A1-10.contigs.fasta'
--   Unassembled   -> 'A1-10.unassembled.fasta'
--
-- Read layouts saved:
--   Contigs       -> 'A1-10.contigs.layout'.
--
-- Bye.

2026-01-16 14:34:14.870 - WARNING - 输出文件不存在|Output file does not exist: /share/org/YZWL/yzwl_lixg/project/28.大豆疫霉菌三代基因组/03.hicanu/A1-10/01.raw_output/A1-10.unitigs.fasta
Job 68889942 stderr output:

