Usage: biopytools ragtag [OPTIONS]
Try 'biopytools ragtag -h' for help.

Error: Invalid value for '-r' / '--reference': 文件不存在|File does not exist: /share/org/YZWL/yzwl_lixg/project/28.大豆疫霉菌三代基因组/04.ragtag/Psoja_T2T.fa
Usage: biopytools genomesyn [OPTIONS]
Try 'biopytools genomesyn -h' for help.

Error: Invalid value for '-i' / '--ref': Path '04.ragtag/B2-1/hifiasm/B2-1_RagTag_scaffolded.fa' does not exist.
2026-01-16 02:48:49.499 - WARNING - 命令错误输出|Command stderr:
-- canu master +27 changes (r10515 2a41e933b8de6ed66723d75d36dd071b46d2c347)
--
-- CITATIONS
--
-- For assemblies of PacBio HiFi reads:
--   Nurk S, Walenz BP, Rhiea A, Vollger MR, Logsdon GA, Grothe R, Miga KH, Eichler EE, Phillippy AM, Koren S.
--   HiCanu: accurate assembly of segmental duplications, satellites, and allelic variants from high-fidelity long reads.
--   biorXiv. 2020.
--   https://doi.org/10.1101/2020.03.14.992248
-- 
-- Read and contig alignments during correction and consensus use:
--   Šošic M, Šikic M.
--   Edlib: a C/C ++ library for fast, exact sequence alignment using edit distance.
--   Bioinformatics. 2017 May 1;33(9):1394-1395.
--   http://doi.org/10.1093/bioinformatics/btw753
-- 
-- Overlaps are generated using:
--   Berlin K, et al.
--   Assembling large genomes with single-molecule sequencing and locality-sensitive hashing.
--   Nat Biotechnol. 2015 Jun;33(6):623-30.
--   http://doi.org/10.1038/nbt.3238
-- 
--   Myers EW, et al.
--   A Whole-Genome Assembly of Drosophila.
--   Science. 2000 Mar 24;287(5461):2196-204.
--   http://doi.org/10.1126/science.287.5461.2196
-- 
-- Contig consensus sequences are generated using an algorithm derived from pbdagcon:
--   Chin CS, et al.
--   Nonhybrid, finished microbial genome assemblies from long-read SMRT sequencing data.
--   Nat Methods. 2013 Jun;10(6):563-9
--   http://doi.org/10.1038/nmeth.2474
-- 
-- CONFIGURE CANU
--
-- Detected Java(TM) Runtime Environment '17.0.15-internal' (from '/share/org/YZWL/yzwl_lixg/.local/bin/java') without -d64 support.
--
-- WARNING:
-- WARNING:  Failed to run gnuplot using command 'gnuplot'.
-- WARNING:  Plots will be disabled.
-- WARNING:
--
-- Detected samtools version '1.22' / htslib version 'htscodecs=1.6.3' (from 'samtools').
--
-- Detected 88 CPUs and 503 gigabytes of memory on the local machine.
--
-- Detected Slurm with 'sinfo' binary in /opt/skyformai/bin/sinfo.
--          Slurm disabled by useGrid=false
--
-- Detected  '' with 'pbsnodes' binary in /opt/skyformai/bin/pbsnodes.
--           disabled by useGrid=false
--
-- Detected LSF with 'bsub' binary in /opt/skyformai/bin/bsub.
--          LSF disabled by useGrid=false
--
-- Local machine mode enabled; grid support not detected or not allowed.
--
-- Found trimmed raw PacBio HiFi reads in the input files.
--
--                                (tag)Concurrency
--                         (tag)Threads          |
--                (tag)Memory         |          |
--        (tag)             |         |          |       total usage      algorithm
--        -------  ----------  --------   --------  --------------------  -----------------------------
-- Local: meryl     12.000 GB    4 CPUs x  22 jobs   264.000 GB  88 CPUs  (k-mer counting)
-- Local: cormhap   13.000 GB   11 CPUs x   8 jobs   104.000 GB  88 CPUs  (overlap detection with mhap)
-- Local: obtovl     8.000 GB    8 CPUs x  11 jobs    88.000 GB  88 CPUs  (overlap detection)
-- Local: utgovl     8.000 GB    8 CPUs x  11 jobs    88.000 GB  88 CPUs  (overlap detection)
-- Local: cor        -.--- GB    4 CPUs x   - jobs     -.--- GB   - CPUs  (read correction)
-- Local: ovb        4.000 GB    1 CPU  x  88 jobs   352.000 GB  88 CPUs  (overlap store bucketizer)
-- Local: ovs        8.000 GB    1 CPU  x  62 jobs   496.000 GB  62 CPUs  (overlap store sorting)
-- Local: red       16.000 GB    4 CPUs x  22 jobs   352.000 GB  88 CPUs  (read error detection)
-- Local: oea        8.000 GB    1 CPU  x  62 jobs   496.000 GB  62 CPUs  (overlap error adjustment)
-- Local: bat       32.000 GB    8 CPUs x   1 job     32.000 GB   8 CPUs  (contig construction with bogart)
-- Local: cns        -.--- GB    8 CPUs x   - jobs     -.--- GB   - CPUs  (consensus)
--
-- Generating assembly 'B2-1' in '/share/org/YZWL/yzwl_lixg/project/28.大豆疫霉菌三代基因组/03.hicanu/B2-1/01.raw_output':
--   genomeSize:
--     85000000
--
--   Overlap Generation Limits:
--     corOvlErrorRate 0.0000 (  0.00%)
--     obtOvlErrorRate 0.0250 (  2.50%)
--     utgOvlErrorRate 0.0100 (  1.00%)
--
--   Overlap Processing Limits:
--     corErrorRate    0.0000 (  0.00%)
--     obtErrorRate    0.0250 (  2.50%)
--     utgErrorRate    0.0003 (  0.03%)
--     cnsErrorRate    0.0500 (  5.00%)
--
--   Stages to run:
--     assemble HiFi reads.
--
--
-- BEGIN STORE CREATION
----------------------------------------
-- Starting command on Fri Jan 16 00:52:24 2026 with 4559584.015 GB free disk space

    cd .
    ./B2-1.seqStore.sh \
    > ./B2-1.seqStore.err 2>&1

-- Finished on Fri Jan 16 00:59:57 2026 (453 seconds) with 4558524.25 GB free disk space
----------------------------------------
--
-- In sequence store './B2-1.seqStore':
--   Found 270910 reads.
--   Found 4250007973 bases (50 times coverage).
--    Histogram of corrected reads:
--    
--    G=4250007973                       sum of  ||               length     num
--    NG         length     index       lengths  ||                range    seqs
--    ----- ------------ --------- ------------  ||  ------------------- -------
--    00010        24561     15763    425023941  ||       1242-2474         5685|------------
--    00020        22198     34037    850014554  ||       2475-3707         9794|---------------------
--    00030        20626     53931   1275019604  ||       3708-4940        10094|---------------------
--    00040        19399     75194   1700020761  ||       4941-6173         9274|--------------------
--    00050        18329     97742   2125013097  ||       6174-7406         7976|-----------------
--    00060        17345    121579   2550019195  ||       7407-8639         6975|---------------
--    00070        16334    146817   2975006341  ||       8640-9872         6034|-------------
--    00080        15088    173821   3400010583  ||       9873-11105        5232|-----------
--    00090        12438    204103   3825016293  ||      11106-12338        5204|-----------
--    00100         1242    270910   4250007973  ||      12339-13571        8984|-------------------
--    001.000x              270910   4250007973  ||      13572-14804       16712|-----------------------------------
--                                               ||      14805-16037       24984|----------------------------------------------------
--                                               ||      16038-17270       30594|---------------------------------------------------------------
--                                               ||      17271-18503       29591|-------------------------------------------------------------
--                                               ||      18504-19736       24998|----------------------------------------------------
--                                               ||      19737-20969       19824|-----------------------------------------
--                                               ||      20970-22202       14959|-------------------------------
--                                               ||      22203-23435       10975|-----------------------
--                                               ||      23436-24668        7833|-----------------
--                                               ||      24669-25901        5560|------------
--                                               ||      25902-27134        3774|--------
--                                               ||      27135-28367        2472|------
--                                               ||      28368-29600        1574|----
--                                               ||      29601-30833         899|--
--                                               ||      30834-32066         495|--
--                                               ||      32067-33299         232|-
--                                               ||      33300-34532         110|-
--                                               ||      34533-35765          45|-
--                                               ||      35766-36998          14|-
--                                               ||      36999-38231           3|-
--                                               ||      38232-39464           3|-
--                                               ||      39465-40697           1|-
--                                               ||      40698-41930           2|-
--                                               ||      41931-43163           2|-
--                                               ||      43164-44396           0|
--                                               ||      44397-45629           1|-
--                                               ||      45630-46862           0|
--                                               ||      46863-48095           0|
--                                               ||      48096-49328           0|
--                                               ||      49329-50561           1|-
--    
--
-- In sequence store './B2-1.seqStore':
--   Found 270910 reads.
--   Found 4250007973 bases (50 times coverage).
--    Histogram of corrected-trimmed reads:
--    
--    G=4250007973                       sum of  ||               length     num
--    NG         length     index       lengths  ||                range    seqs
--    ----- ------------ --------- ------------  ||  ------------------- -------
--    00010        24561     15763    425023941  ||       1242-2474         5685|------------
--    00020        22198     34037    850014554  ||       2475-3707         9794|---------------------
--    00030        20626     53931   1275019604  ||       3708-4940        10094|---------------------
--    00040        19399     75194   1700020761  ||       4941-6173         9274|--------------------
--    00050        18329     97742   2125013097  ||       6174-7406         7976|-----------------
--    00060        17345    121579   2550019195  ||       7407-8639         6975|---------------
--    00070        16334    146817   2975006341  ||       8640-9872         6034|-------------
--    00080        15088    173821   3400010583  ||       9873-11105        5232|-----------
--    00090        12438    204103   3825016293  ||      11106-12338        5204|-----------
--    00100         1242    270910   4250007973  ||      12339-13571        8984|-------------------
--    001.000x              270910   4250007973  ||      13572-14804       16712|-----------------------------------
--                                               ||      14805-16037       24984|----------------------------------------------------
--                                               ||      16038-17270       30594|---------------------------------------------------------------
--                                               ||      17271-18503       29591|-------------------------------------------------------------
--                                               ||      18504-19736       24998|----------------------------------------------------
--                                               ||      19737-20969       19824|-----------------------------------------
--                                               ||      20970-22202       14959|-------------------------------
--                                               ||      22203-23435       10975|-----------------------
--                                               ||      23436-24668        7833|-----------------
--                                               ||      24669-25901        5560|------------
--                                               ||      25902-27134        3774|--------
--                                               ||      27135-28367        2472|------
--                                               ||      28368-29600        1574|----
--                                               ||      29601-30833         899|--
--                                               ||      30834-32066         495|--
--                                               ||      32067-33299         232|-
--                                               ||      33300-34532         110|-
--                                               ||      34533-35765          45|-
--                                               ||      35766-36998          14|-
--                                               ||      36999-38231           3|-
--                                               ||      38232-39464           3|-
--                                               ||      39465-40697           1|-
--                                               ||      40698-41930           2|-
--                                               ||      41931-43163           2|-
--                                               ||      43164-44396           0|
--                                               ||      44397-45629           1|-
--                                               ||      45630-46862           0|
--                                               ||      46863-48095           0|
--                                               ||      48096-49328           0|
--                                               ||      49329-50561           1|-
--    
--
-- Correction skipped; not enabled.
--
-- Trimming skipped; not enabled.
--
-- BEGIN ASSEMBLY
----------------------------------------
-- Starting command on Fri Jan 16 00:59:58 2026 with 4558524.203 GB free disk space

    cd unitigging/0-mercounts
    ./meryl-configure.sh \
    > ./meryl-configure.err 2>&1

-- Finished on Fri Jan 16 00:59:58 2026 (like a bat out of hell) with 4558524.203 GB free disk space
----------------------------------------
--  segments   memory batches
--  -------- -------- -------
--        01 10.81 GB       2
--        02  5.75 GB       2
--        04  2.97 GB       2
--        06  2.14 GB       2
--        08  1.60 GB       2
--        12  1.07 GB       2
--        16  0.81 GB       2
--        20  0.65 GB       2
--        24  0.54 GB       2
--        32  0.41 GB       2
--        40  0.32 GB       2
--        48  -.-- GB       -  (segment size too small)
--        56  -.-- GB       -  (segment size too small)
--        64  -.-- GB       -  (segment size too small)
--        96  -.-- GB       -  (segment size too small)
--
--  For 270910 reads with 4250007973 bases, limit to 42 batches.
--  Will count kmers using 01 jobs, each using 12 GB and 4 threads.
--
-- Finished stage 'merylConfigure', reset canuIteration.
--
-- Running jobs.  First attempt out of 2.
----------------------------------------
-- Starting 'meryl' concurrent execution on Fri Jan 16 00:59:58 2026 with 4558524.171 GB free disk space (1 processes; 22 concurrently)

    cd unitigging/0-mercounts
    ./meryl-count.sh 1 > ./meryl-count.000001.out 2>&1

-- Finished on Fri Jan 16 01:03:40 2026 (222 seconds) with 4557950.484 GB free disk space
----------------------------------------
-- Found 1 Kmer counting (meryl) outputs.
-- Finished stage 'utg-merylCountCheck', reset canuIteration.
--
-- Running jobs.  First attempt out of 2.
----------------------------------------
-- Starting 'meryl' concurrent execution on Fri Jan 16 01:03:40 2026 with 4557950.453 GB free disk space (1 processes; 22 concurrently)

    cd unitigging/0-mercounts
    ./meryl-process.sh 1 > ./meryl-process.000001.out 2>&1

-- Finished on Fri Jan 16 01:03:45 2026 (5 seconds) with 4557951.078 GB free disk space
----------------------------------------
-- Meryl finished successfully.  Kmer frequency histogram:
--
-- WARNING: gnuplot failed.
--
----------------------------------------
--
--  22-mers                                                                                           Fraction
--    Occurrences   NumMers                                                                         Unique Total
--       1-     1         0                                                                        0.0000 0.0000
--       2-     2    270199 *                                                                      0.0060 0.0002
--       3-     4     86107                                                                        0.0073 0.0003
--       5-     7     24623                                                                        0.0082 0.0003
--       8-    11     11102                                                                        0.0085 0.0003
--      12-    16     15285                                                                        0.0087 0.0004
--      17-    22     98312                                                                        0.0091 0.0004
--      23-    29    627046 **                                                                     0.0119 0.0013
--      30-    37   4740032 *********************                                                  0.0305 0.0086
--      38-    46  15443521 ********************************************************************** 0.1577 0.0718
--      47-    56  15342298 *********************************************************************  0.5179 0.2905
--      57-    67   3538409 ****************                                                       0.8309 0.5176
--      68-    79    552710 **                                                                     0.8938 0.5714
--      80-    92    943725 ****                                                                   0.9060 0.5841
--      93-   106    912048 ****                                                                   0.9275 0.6105
--     107-   121    343621 *                                                                      0.9468 0.6375
--     122-   137    264965 *                                                                      0.9538 0.6486
--     138-   154    274999 *                                                                      0.9599 0.6598
--     155-   172    173898                                                                        0.9658 0.6720
--     173-   191    180644                                                                        0.9696 0.6807
--     192-   211    134552                                                                        0.9736 0.6910
--     212-   232    110288                                                                        0.9765 0.6992
--     233-   254     92802                                                                        0.9790 0.7068
--     255-   277     82843                                                                        0.9810 0.7138
--     278-   301     83976                                                                        0.9828 0.7207
--     302-   326     61780                                                                        0.9847 0.7282
--     327-   352     59898                                                                        0.9861 0.7342
--     353-   379     47483                                                                        0.9874 0.7405
--     380-   407     43269                                                                        0.9884 0.7459
--     408-   436     36620                                                                        0.9894 0.7512
--     437-   466     31892                                                                        0.9902 0.7560
--     467-   497     29120                                                                        0.9909 0.7604
--     498-   529     26732                                                                        0.9915 0.7648
--     530-   562     21496                                                                        0.9921 0.7690
--     563-   596     18917                                                                        0.9926 0.7727
--     597-   631     16802                                                                        0.9930 0.7761
--     632-   667     17707                                                                        0.9934 0.7793
--     668-   704     16022                                                                        0.9938 0.7829
--     705-   742     14392                                                                        0.9941 0.7863
--     743-   781     12253                                                                        0.9944 0.7895
--     782-   821     11081                                                                        0.9947 0.7924
--
--           0 (max occurrences)
--  3210205352 (total mers, non-unique)
--    45040639 (distinct mers, non-unique)
--           0 (unique mers)
-- Finished stage 'meryl-process', reset canuIteration.
--
-- Removing meryl database 'unitigging/0-mercounts/B2-1.ms22'.
--
-- OVERLAPPER (normal) (assembly) erate=0.01
--
----------------------------------------
-- Starting command on Fri Jan 16 01:03:45 2026 with 4557951.062 GB free disk space

    cd unitigging/1-overlapper
    /share/org/YZWL/yzwl_lixg/miniforge3/envs/canu_v.2.3/bin/overlapInCorePartition \
     -S  ../../B2-1.seqStore \
     -hl 160000000 \
     -rl 5000000000 \
     -ol 500 \
     -o  ./B2-1.partition \
    > ./B2-1.partition.err 2>&1

-- Finished on Fri Jan 16 01:03:45 2026 (furiously fast) with 4557951.046 GB free disk space
----------------------------------------
--
-- Configured 21 overlapInCore jobs.
-- Finished stage 'utg-overlapConfigure', reset canuIteration.
--
-- Running jobs.  First attempt out of 2.
----------------------------------------
-- Starting 'utgovl' concurrent execution on Fri Jan 16 01:03:45 2026 with 4557951.015 GB free disk space (21 processes; 11 concurrently)

    cd unitigging/1-overlapper
    ./overlap.sh 1 > ./overlap.000001.out 2>&1
    ./overlap.sh 2 > ./overlap.000002.out 2>&1
    ./overlap.sh 3 > ./overlap.000003.out 2>&1
    ./overlap.sh 4 > ./overlap.000004.out 2>&1
    ./overlap.sh 5 > ./overlap.000005.out 2>&1
    ./overlap.sh 6 > ./overlap.000006.out 2>&1
    ./overlap.sh 7 > ./overlap.000007.out 2>&1
    ./overlap.sh 8 > ./overlap.000008.out 2>&1
    ./overlap.sh 9 > ./overlap.000009.out 2>&1
    ./overlap.sh 10 > ./overlap.000010.out 2>&1
    ./overlap.sh 11 > ./overlap.000011.out 2>&1
    ./overlap.sh 12 > ./overlap.000012.out 2>&1
    ./overlap.sh 13 > ./overlap.000013.out 2>&1
    ./overlap.sh 14 > ./overlap.000014.out 2>&1
    ./overlap.sh 15 > ./overlap.000015.out 2>&1
    ./overlap.sh 16 > ./overlap.000016.out 2>&1
    ./overlap.sh 17 > ./overlap.000017.out 2>&1
    ./overlap.sh 18 > ./overlap.000018.out 2>&1
    ./overlap.sh 19 > ./overlap.000019.out 2>&1
    ./overlap.sh 20 > ./overlap.000020.out 2>&1
    ./overlap.sh 21 > ./overlap.000021.out 2>&1

-- Finished on Fri Jan 16 01:34:50 2026 (1865 seconds) with 4559898.593 GB free disk space
----------------------------------------
-- Found 21 overlapInCore output files.
--
-- overlapInCore compute 'unitigging/1-overlapper':
--   kmer hits
--     with no overlap       1397340467  22.2380952 +- 41759781.936
--     with an overlap         44842548  9.42857143 +- 1223037.499
--
--   overlaps                  44842548  9.42857143 +- 1223037.499
--     contained                9791400  .142857143 +- 269021.64
--     dovetail                35051148  2.28571429 +- 957887.558
--
--   overlaps rejected
--     multiple per pair              0           0 +- 0
--     bad short window               0           0 +- 0
--     bad long window                0           0 +- 0
-- Finished stage 'utg-overlapCheck', reset canuIteration.
----------------------------------------
-- Starting command on Fri Jan 16 01:34:50 2026 with 4559898.578 GB free disk space

    cd unitigging
    /share/org/YZWL/yzwl_lixg/miniforge3/envs/canu_v.2.3/bin/ovStoreConfig \
     -S ../B2-1.seqStore \
     -M 4-8 \
     -L ./1-overlapper/ovljob.files \
     -create ./B2-1.ovlStore.config \
     > ./B2-1.ovlStore.config.txt \
    2> ./B2-1.ovlStore.config.err

-- Finished on Fri Jan 16 01:34:50 2026 (furiously fast) with 4559898.562 GB free disk space
----------------------------------------
--
-- Creating overlap store unitigging/B2-1.ovlStore using:
--      1 bucket
--      1 slice
--        using at most 3 GB memory each
--
-- Running jobs.  First attempt out of 2.
----------------------------------------
-- Starting 'ovS' concurrent execution on Fri Jan 16 01:34:50 2026 with 4559898.546 GB free disk space (1 processes; 62 concurrently)

    cd unitigging
    ./B2-1.ovlStore.sh 1 > ./B2-1.ovlStore.000001.out 2>&1

-- Finished on Fri Jan 16 01:35:10 2026 (20 seconds) with 4560234.937 GB free disk space
----------------------------------------
-- Checking store.
----------------------------------------
-- Starting command on Fri Jan 16 01:35:10 2026 with 4560234.937 GB free disk space

    cd unitigging
    /share/org/YZWL/yzwl_lixg/miniforge3/envs/canu_v.2.3/bin/ovStoreDump \
     -S ../B2-1.seqStore \
     -O  ./B2-1.ovlStore \
     -counts \
     > ./B2-1.ovlStore/counts.dat 2> ./B2-1.ovlStore/counts.err

-- Finished on Fri Jan 16 01:35:10 2026 (lickety-split) with 4560224.109 GB free disk space
----------------------------------------
--
-- Overlap store 'unitigging/B2-1.ovlStore' successfully constructed.
-- Found 89685096 overlaps for 266789 reads; 1617259 reads have no overlaps.
--
--
-- Purged 0.904 GB in 63 overlap output files.
----------------------------------------
-- Starting command on Fri Jan 16 01:35:12 2026 with 4560224.171 GB free disk space

    cd unitigging
    /share/org/YZWL/yzwl_lixg/miniforge3/envs/canu_v.2.3/bin/ovStoreStats \
     -C 50 \
     -S ../B2-1.seqStore \
     -O  ./B2-1.ovlStore \
     -o  ./B2-1.ovlStore \
     > ./B2-1.ovlStore.summary.err 2>&1

-- Finished on Fri Jan 16 01:35:24 2026 (12 seconds) with 4560224.14 GB free disk space
----------------------------------------
--
-- Overlap store 'unitigging/B2-1.ovlStore' contains:
--
--   category            reads     %          read length        feature size or coverage  analysis
--   ----------------  -------  -------  ----------------------  ------------------------  --------------------
--   middle-missing        138    0.05    15361.94 +- 7460.81        582.30 +- 984.95     (bad trimming)
--   middle-hump            10    0.00    15264.90 +- 2383.72       5182.20 +- 3818.82    (bad trimming)
--   no-5-prime            418    0.15    11391.12 +- 5342.26       1351.92 +- 2063.40    (bad trimming)
--   no-3-prime            459    0.17    10086.98 +- 5934.21        975.10 +- 1846.96    (bad trimming)
--   
--   low-coverage          948    0.35     8836.84 +- 5091.56          5.94 +- 3.86       (easy to assemble, potential for lower quality consensus)
--   unique             220478   81.38    12038.80 +- 4916.55         46.12 +- 8.21       (easy to assemble, perfect, yay)
--   repeat-cont         21420    7.91    10308.87 +- 4249.54       1724.52 +- 1311.43    (potential for consensus errors, no impact on assembly)
--   repeat-dove           269    0.10    19586.56 +- 1903.58        744.91 +- 943.27     (hard to assemble, likely won't assemble correctly or even at all)
--   
--   span-repeat          2136    0.79    13040.43 +- 4340.87       2925.52 +- 3546.48    (read spans a large repeat, usually easy to assemble)
--   uniq-repeat-cont    13982    5.16    11972.50 +- 3938.18                             (should be uniquely placed, low potential for consensus errors, no impact on assembly)
--   uniq-repeat-dove     2651    0.98    17670.06 +- 2915.80                             (will end contigs, potential to misassemble)
--   uniq-anchor          3880    1.43    12600.17 +- 4062.56       7539.50 +- 4404.44    (repeat read, with unique section, probable bad read)
-- Finished stage 'utg-createOverlapStore', reset canuIteration.
--
-- Loading read lengths.
-- Loading number of overlaps per read.
--
-- Configure RED for 16gb memory.
--                   Batches of at most (unlimited) reads.
--                                      500000000 bases.
--                   Expecting evidence of at most 536870912 bases per iteration.
--
--           Total                                               Reads                 Olaps Evidence
--    Job   Memory      Read Range         Reads        Bases   Memory        Olaps   Memory   Memory  (Memory in MB)
--   ---- -------- ------------------- --------- ------------ -------- ------------ -------- --------
--      1 16386.25         1-45995          6680    108902320 13293.95      1773914    20.30  1024.00
--      2 16384.89     45996-90304          6420    108870542 13290.06      1994688    22.83  1024.00
--      3 16384.64     90305-134797         6419    108799912 13281.44      2726335    31.20  1024.00
--      4 16385.72    134798-188129         7567    108934838 13297.95      1377845    15.77  1024.00
--      5 16384.44    188130-239469         7232    108818457 13283.73      2508404    28.71  1024.00
--      6 16385.66    239470-282725         6283    108744864 13274.72      3403086    38.95  1024.00
--      7 16385.96    282726-332938         7162    108971937 13302.46      1004412    11.49  1024.00
--      8 16384.28    332939-386789         7747    108780695 13279.14      2895639    33.14  1024.00
--      9 16386.36    386790-429672         6224    108776403 13278.57      3127377    35.79  1024.00
--     10 16384.16    429673-477260         6876    108920453 13296.17      1397217    15.99  1024.00
--     11 16385.12    477261-533312         8088    108802386 13281.80      2737459    31.33  1024.00
--     12 16384.52    533313-576377         6184    108836869 13285.95      2322092    26.57  1024.00
--     13 16386.07    576378-622456         6656    108895838 13293.16      1827391    20.91  1024.00
--     14 16385.91    622457-680017         8264    108785107 13279.69      2989966    34.22  1024.00
--     15 16384.51    680018-721871         6117    108840904 13286.44      2278113    26.07  1024.00
--     16 16384.19    721872-766626         6477    108873416 13290.42      1902886    21.78  1024.00
--     17 16385.89    766627-825865         8536    108796990 13281.15      2860605    32.74  1024.00
--     18 16384.44    825866-868073         6145    108904271 13294.17      1596410    18.27  1024.00
--     19 16385.06    868074-911998         6387    108820042 13283.90      2547855    29.16  1024.00
--     20 16386.64    911999-967773         7855    108927046 13297.01      1541145    17.64  1024.00
--     21 16384.16    967774-1013740        6714    108776286 13278.57      2935266    33.59  1024.00
--     22 16385.98   1013741-1058043        6278    108826873 13284.73      2556056    29.25  1024.00
--     23 16386.08   1058044-1108659        7215    108973172 13302.62      1001360    11.46  1024.00
--     24 16385.25   1108660-1157886        7097    108801152 13281.61      2764460    31.64  1024.00
--     25 16384.62   1157887-1200615        6144    108752352 13275.63      3232624    36.99  1024.00
--     26 16384.98   1200616-1249315        6912    108945647 13299.25      1200234    13.74  1024.00
--     27 16384.43   1249316-1302062        7589    108789543 13280.21      2814813    32.21  1024.00
--     28 16384.88   1302063-1344398        6168    108801214 13281.59      2734142    31.29  1024.00
--     29 16384.32   1344399-1391506        6765    108884120 13291.73      1798727    20.58  1024.00
--     30 16385.26   1391507-1446402        7946    108805828 13282.21      2712909    31.05  1024.00
--     31 16385.93   1446403-1489624        6165    108844572 13286.88      2363020    27.04  1024.00
--     32 16384.46   1489625-1535254        6560    108886248 13291.98      1788977    20.47  1024.00
--     33 16385.23   1535255-1591267        8071    108795403 13280.94      2821672    32.29  1024.00
--     34 16384.95   1591268-1633988        6070    108849506 13287.48      2225110    25.46  1024.00
--     35 16386.03   1633989-1680853        6517    108880762 13291.31      1985275    22.72  1024.00
--     36 16386.53   1680854-1737803        8253    108801408 13281.68      2870100    32.85  1024.00
--     37 16385.34   1737804-1779542        6040    108842236 13286.60      2337125    26.75  1024.00
--     38 16385.71   1779543-1824815        6416    108886940 13292.06      1891366    21.64  1024.00
--     39 16384.55   1824816-1880750        8225    108797520 13281.21      2738975    31.35  1024.00
--     40  3691.31   1880751-1884048         446      5063901   618.17       100046     1.14  1024.00
--   ---- -------- ------------------- --------- ------------ -------- ------------ -------- --------
--                                                 4250007973              89685096
-- Finished stage 'readErrorDetectionConfigure', reset canuIteration.
--
-- Running jobs.  First attempt out of 2.
----------------------------------------
-- Starting 'red' concurrent execution on Fri Jan 16 01:35:31 2026 with 4560225.171 GB free disk space (40 processes; 22 concurrently)

    cd unitigging/3-overlapErrorAdjustment
    ./red.sh 1 > ./red.000001.out 2>&1
    ./red.sh 2 > ./red.000002.out 2>&1
    ./red.sh 3 > ./red.000003.out 2>&1
    ./red.sh 4 > ./red.000004.out 2>&1
    ./red.sh 5 > ./red.000005.out 2>&1
    ./red.sh 6 > ./red.000006.out 2>&1
    ./red.sh 7 > ./red.000007.out 2>&1
    ./red.sh 8 > ./red.000008.out 2>&1
    ./red.sh 9 > ./red.000009.out 2>&1
    ./red.sh 10 > ./red.000010.out 2>&1
    ./red.sh 11 > ./red.000011.out 2>&1
    ./red.sh 12 > ./red.000012.out 2>&1
    ./red.sh 13 > ./red.000013.out 2>&1
    ./red.sh 14 > ./red.000014.out 2>&1
    ./red.sh 15 > ./red.000015.out 2>&1
    ./red.sh 16 > ./red.000016.out 2>&1
    ./red.sh 17 > ./red.000017.out 2>&1
    ./red.sh 18 > ./red.000018.out 2>&1
    ./red.sh 19 > ./red.000019.out 2>&1
    ./red.sh 20 > ./red.000020.out 2>&1
    ./red.sh 21 > ./red.000021.out 2>&1
    ./red.sh 22 > ./red.000022.out 2>&1
    ./red.sh 23 > ./red.000023.out 2>&1
    ./red.sh 24 > ./red.000024.out 2>&1
    ./red.sh 25 > ./red.000025.out 2>&1
    ./red.sh 26 > ./red.000026.out 2>&1
    ./red.sh 27 > ./red.000027.out 2>&1
    ./red.sh 28 > ./red.000028.out 2>&1
    ./red.sh 29 > ./red.000029.out 2>&1
    ./red.sh 30 > ./red.000030.out 2>&1
    ./red.sh 31 > ./red.000031.out 2>&1
    ./red.sh 32 > ./red.000032.out 2>&1
    ./red.sh 33 > ./red.000033.out 2>&1
    ./red.sh 34 > ./red.000034.out 2>&1
    ./red.sh 35 > ./red.000035.out 2>&1
    ./red.sh 36 > ./red.000036.out 2>&1
    ./red.sh 37 > ./red.000037.out 2>&1
    ./red.sh 38 > ./red.000038.out 2>&1
    ./red.sh 39 > ./red.000039.out 2>&1
    ./red.sh 40 > ./red.000040.out 2>&1

-- Finished on Fri Jan 16 01:52:13 2026 (1002 seconds) with 4559520 GB free disk space
----------------------------------------
-- Found 40 read error detection output files.
-- Finished stage 'readErrorDetectionCheck', reset canuIteration.
--
-- Loading read lengths.
-- Loading number of overlaps per read.
--
-- Configure OEA for 8gb memory.
--                   Batches of at most (unlimited) reads.
--                                      300000000 bases.
--
--           Total                                               Reads                 Olaps  Adjusts
--    Job   Memory      Read Range         Reads        Bases   Memory        Olaps   Memory   Memory  (Memory in MB)
--   ---- -------- ------------------- --------- ------------ -------- ------------ -------- --------
--      1  2899.93         1-123480        17899    300006493   294.65      6016395   183.61   373.67
--      2  2911.73    123481-260897        19575    300009930   294.71      6401137   195.35   373.67
--      3  2910.97    260898-398210        19698    300014381   294.72      6375901   194.58   373.67
--      4  2904.63    398211-534318        19677    300005736   294.71      6168532   188.25   373.67
--      5  2929.65    534319-670728        19672    300007077   294.71      6988277   213.27   373.67
--      6  2862.49    670729-794209        17839    300010456   294.66      4789373   146.16   373.67
--      7  2926.48    794210-926234        19111    300013355   294.70      6884770   210.11   373.67
--      8  2921.35    926235-1060542       19167    300005662   294.69      6716868   204.98   373.67
--      9  2906.72   1060543-1192300       18920    300000195   294.68      6237913   190.37   373.67
--     10  2924.35   1192301-1325508       19122    300000911   294.69      6815362   207.99   373.67
--     11  2880.68   1325509-1460271       19408    300009899   294.70      5383955   164.31   373.67
--     12  2924.15   1460272-1594657       19310    300013211   294.70      6808468   207.78   373.67
--     13  2926.29   1594658-1730376       19295    300011983   294.70      6878488   209.91   373.67
--     14  2866.42   1730377-1853665       17785    300010783   294.66      4918152   150.09   373.67
--     15  2547.62   1853666-1884048        4432     49887901    55.71      2301505    70.24   373.67
--   ---- -------- ------------------- --------- ------------ -------- ------------ -------- --------
--                                                 4250007973              89685096
-- Finished stage 'overlapErrorAdjustmentConfigure', reset canuIteration.
--
-- Running jobs.  First attempt out of 2.
----------------------------------------
-- Starting 'oea' concurrent execution on Fri Jan 16 01:52:21 2026 with 4559469.921 GB free disk space (15 processes; 62 concurrently)

    cd unitigging/3-overlapErrorAdjustment
    ./oea.sh 1 > ./oea.000001.out 2>&1
    ./oea.sh 2 > ./oea.000002.out 2>&1
    ./oea.sh 3 > ./oea.000003.out 2>&1
    ./oea.sh 4 > ./oea.000004.out 2>&1
    ./oea.sh 5 > ./oea.000005.out 2>&1
    ./oea.sh 6 > ./oea.000006.out 2>&1
    ./oea.sh 7 > ./oea.000007.out 2>&1
    ./oea.sh 8 > ./oea.000008.out 2>&1
    ./oea.sh 9 > ./oea.000009.out 2>&1
    ./oea.sh 10 > ./oea.000010.out 2>&1
    ./oea.sh 11 > ./oea.000011.out 2>&1
    ./oea.sh 12 > ./oea.000012.out 2>&1
    ./oea.sh 13 > ./oea.000013.out 2>&1
    ./oea.sh 14 > ./oea.000014.out 2>&1
    ./oea.sh 15 > ./oea.000015.out 2>&1

-- Finished on Fri Jan 16 02:36:53 2026 (2672 seconds) with 4559197.546 GB free disk space
----------------------------------------
-- Found 15 overlap error adjustment output files.
-- Finished stage 'overlapErrorAdjustmentCheck', reset canuIteration.
----------------------------------------
-- Starting command on Fri Jan 16 02:36:53 2026 with 4559197.531 GB free disk space

    cd unitigging/3-overlapErrorAdjustment
    /share/org/YZWL/yzwl_lixg/miniforge3/envs/canu_v.2.3/bin/loadErates \
      -S ../../B2-1.seqStore \
      -O ../B2-1.ovlStore \
      -L ./oea.files \
    > ./oea.apply.err 2>&1

-- Finished on Fri Jan 16 02:36:53 2026 (furiously fast) with 4559197.343 GB free disk space
----------------------------------------
-- No report available.
-- Finished stage 'updateOverlapStore', reset canuIteration.
-- Finished stage 'unitig', reset canuIteration.
--
-- Running jobs.  First attempt out of 2.
----------------------------------------
-- Starting 'bat' concurrent execution on Fri Jan 16 02:36:53 2026 with 4559197.296 GB free disk space (1 processes; 1 concurrently)

    cd unitigging/4-unitigger
    ./unitigger.sh 1 > ./unitigger.000001.out 2>&1

-- Finished on Fri Jan 16 02:37:15 2026 (22 seconds) with 4559192.5 GB free disk space
----------------------------------------
-- Unitigger finished successfully.
--  
--  ERROR RATES
--  -----------
--                                                   --------threshold------
--  297938                       fraction error      fraction        percent
--  samples                              (1e-5)         error          error
--                   --------------------------      --------       --------
--  command line (-eg)                           ->     30.00        0.0300%
--  command line (-ef)                           ->  -----.--      ---.----%
--  command line (-eM)                           ->     30.00        0.0300%
--  mean + std.dev       0.36 +-  12 *     2.75  ->     33.37        0.0334%
--  median + mad         0.00 +-  12 *     0.00  ->      0.00        0.0000%
--  90th percentile                              ->      1.00        0.0010%  (enabled)
--  
--  BEST EDGE FILTERING
--  -------------------
--  At graph threshold 0.0300%, reads:
--    available to have edges:        42054
--    with at least one edge:         36518
--  
--  At max threshold 0.0300%, reads:  (not computed)
--    available to have edges:            0
--    with at least one edge:             0
--  
--  At tight threshold 0.0010%, reads with:
--    both edges below error threshold:     32062  (80.00% minReadsBest threshold = 29214)
--    one  edge  above error threshold:      3273
--    both edges above error threshold:      1183
--    at least one edge:                    36518
--  
--  At loose threshold 0.0300%, reads with:
--    both edges below error threshold:     36518  (80.00% minReadsBest threshold = 29214)
--    one  edge  above error threshold:         0
--    both edges above error threshold:         0
--    at least one edge:                    36518
--  
--  
--  INITIAL EDGES
--  -------- ----------------------------------------
--    223154 reads are contained
--   1629967 reads have no best edges (singleton)
--       322 reads have only one best edge (spur) 
--                140 are mutual best
--     30605 reads have two best edges 
--               1014 have one mutual best edge
--              29190 have two mutual best edges
--  
--  
--  FINAL EDGES
--  -------- ----------------------------------------
--    223154 reads are contained
--   1630353 reads have no best edges (singleton)
--       209 reads have only one best edge (spur) 
--                161 are mutual best
--     30332 reads have two best edges 
--                877 have one mutual best edge
--              29154 have two mutual best edges
--  
--  
--  EDGE FILTERING
--  -------- ------------------------------------------
--         0 reads are ignored
--     11457 reads have a gap in overlap coverage
--       167 reads have lopsided best edges
-- Found, in version 1, after unitig construction:
--   contigs:      103 sequences, total length 67749164 bp (including 155 repeats of total length 3252075 bp).
--   bubbles:      243 sequences, total length 6122537 bp.
--   unassembled:  17596 sequences, total length 201553796 bp.
--
-- Contig sizes based on genome size 85mbp:
--
--            NG (bp)  LG (contigs)    sum (bp)
--         ----------  ------------  ----------
--     10     7254471             2    15685585
--     20     4605714             3    20291299
--     30     3539229             5    27748686
--     40     3372072             7    34517751
--     50     3018537            10    43881283
--     60     1731189            14    52327589
--     70     1202582            20    60196847
--
-- Finished stage 'unitigCheck', reset canuIteration.
----------------------------------------
-- Starting command on Fri Jan 16 02:37:15 2026 with 4559192.484 GB free disk space

    cd unitigging
    /share/org/YZWL/yzwl_lixg/miniforge3/envs/canu_v.2.3/bin/utgcns \
      -S ../B2-1.seqStore \
      -T  ./B2-1.ctgStore 1 \
      -partition 0.8 1.5 0.1 \
    > ./B2-1.ctgStore/partitioning.log 2>&1

-- Finished on Fri Jan 16 02:37:25 2026 (10 seconds) with 4559192.125 GB free disk space
----------------------------------------
-- Using slow alignment for consensus (iteration '0').
-- Configured 10 consensus jobs.
-- Finished stage 'consensusConfigure', reset canuIteration.
--
-- Local: cns       12.500 GB    8 CPUs x  11 jobs   137.500 GB  88 CPUs  (consensus)
--
--
-- Running jobs.  First attempt out of 2.
----------------------------------------
-- Starting 'cns' concurrent execution on Fri Jan 16 02:37:25 2026 with 4559192.093 GB free disk space (10 processes; 11 concurrently)

    cd unitigging/5-consensus
    ./consensus.sh 1 > ./consensus.000001.out 2>&1
    ./consensus.sh 2 > ./consensus.000002.out 2>&1
    ./consensus.sh 3 > ./consensus.000003.out 2>&1
    ./consensus.sh 4 > ./consensus.000004.out 2>&1
    ./consensus.sh 5 > ./consensus.000005.out 2>&1
    ./consensus.sh 6 > ./consensus.000006.out 2>&1
    ./consensus.sh 7 > ./consensus.000007.out 2>&1
    ./consensus.sh 8 > ./consensus.000008.out 2>&1
    ./consensus.sh 9 > ./consensus.000009.out 2>&1
    ./consensus.sh 10 > ./consensus.000010.out 2>&1

-- Finished on Fri Jan 16 02:44:57 2026 (452 seconds) with 4558992.218 GB free disk space
----------------------------------------
-- Using slow alignment for consensus (iteration '1').
-- Configured 10 consensus jobs.
-- All 10 consensus jobs finished successfully.
-- Finished stage 'consensusCheck', reset canuIteration.
-- Using slow alignment for consensus (iteration '0').
-- Configured 10 consensus jobs.
----------------------------------------
-- Starting command on Fri Jan 16 02:44:58 2026 with 4558992.171 GB free disk space

    cd unitigging
    /share/org/YZWL/yzwl_lixg/miniforge3/envs/canu_v.2.3/bin/tgStoreLoad \
      -S ../B2-1.seqStore \
      -T  ./B2-1.ctgStore 2 \
      -L ./5-consensus/ctgcns.files \
    > ./5-consensus/ctgcns.files.ctgStoreLoad.err 2>&1

-- Finished on Fri Jan 16 02:44:59 2026 (one second) with 4558991.39 GB free disk space
----------------------------------------
----------------------------------------
-- Starting command on Fri Jan 16 02:44:59 2026 with 4558991.39 GB free disk space

    cd unitigging
    /share/org/YZWL/yzwl_lixg/miniforge3/envs/canu_v.2.3/bin/tgTigDisplay \
      -S ../B2-1.seqStore \
      -b \
      -o ../B2-1.contigs.unsorted.bam \
      -L ./5-consensus/ctgcns.files \
    > ./5-consensus/ctgcns.files.contigs.bam.err 2>&1

-- Finished on Fri Jan 16 02:47:44 2026 (165 seconds) with 4558617.171 GB free disk space
----------------------------------------
----------------------------------------
-- Starting command on Fri Jan 16 02:47:44 2026 with 4558617.171 GB free disk space

    cd .
    samtools sort \
      --write-index \
      --threads 2 \
      -o ./B2-1.contigs.bam ./B2-1.contigs.unsorted.bam \
    > ./ctgcns.bam.err 2>&1

-- Finished on Fri Jan 16 02:48:46 2026 (62 seconds) with 4558570.609 GB free disk space
----------------------------------------
-- Purging consensus output after loading to ctgStore.
-- Purged 10 .cns outputs.
----------------------------------------
-- Starting command on Fri Jan 16 02:48:46 2026 with 4558572.515 GB free disk space

    cd unitigging
    /share/org/YZWL/yzwl_lixg/miniforge3/envs/canu_v.2.3/bin/tgStoreDump \
      -S ../B2-1.seqStore \
      -T ./B2-1.ctgStore 2 \
      -sizes -s 85000000 \
    > ./B2-1.ctgStore/seqDB.v002.sizes.txt
ZERO length suplied to intervalList::add(), ignoring interval.
ZERO length suplied to intervalList::add(), ignoring interval.
ZERO length suplied to intervalList::add(), ignoring interval.
ZERO length suplied to intervalList::add(), ignoring interval.
ZERO length suplied to intervalList::add(), ignoring interval.
ZERO length suplied to intervalList::add(), ignoring interval.
ZERO length suplied to intervalList::add(), ignoring interval.
ZERO length suplied to intervalList::add(), ignoring interval.
ZERO length suplied to intervalList::add(), ignoring interval.
ZERO length suplied to intervalList::add(), ignoring interval.
ZERO length suplied to intervalList::add(), ignoring interval.
ZERO length suplied to intervalList::add(), ignoring interval.
ZERO length suplied to intervalList::add(), ignoring interval.
ZERO length suplied to intervalList::add(), ignoring interval.
ZERO length suplied to intervalList::add(), ignoring interval.
ZERO length suplied to intervalList::add(), ignoring interval.
ZERO length suplied to intervalList::add(), ignoring interval.
ZERO length suplied to intervalList::add(), ignoring interval.
ZERO length suplied to intervalList::add(), ignoring interval.

-- Finished on Fri Jan 16 02:48:47 2026 (one second) with 4558572.515 GB free disk space
----------------------------------------
-- Found, in version 2, after consensus generation:
--   contigs:      103 sequences, total length 88366381 bp (including 155 repeats of total length 4475738 bp).
--   bubbles:      243 sequences, total length 8229879 bp.
--   unassembled:  17596 sequences, total length 280155089 bp.
--
-- Contig sizes based on genome size 85mbp:
--
--            NG (bp)  LG (contigs)    sum (bp)
--         ----------  ------------  ----------
--     10    10958278             1    10958278
--     20     9454377             2    20412655
--     30     5977801             3    26390456
--     40     4582884             5    36089387
--     50     4383689             7    44891136
--     60     3986117             9    53145853
--     70     3162092            11    60234522
--     80     2269404            14    68102870
--     90     1583844            19    76802685
--    100      585089            26    85321750
--
-- Finished stage 'consensusLoad', reset canuIteration.
----------------------------------------
-- Starting command on Fri Jan 16 02:48:47 2026 with 4558572.5 GB free disk space

    cd .
    /share/org/YZWL/yzwl_lixg/miniforge3/envs/canu_v.2.3/bin/tgStoreDump \
      -S ./B2-1.seqStore \
      -T ./unitigging/B2-1.ctgStore 2 \
      -o ./B2-1.contigs \
      -layout \
    > ./B2-1.contigs.layout.err 2>&1

-- Finished on Fri Jan 16 02:48:47 2026 (like a bat out of hell) with 4558572.468 GB free disk space
----------------------------------------
----------------------------------------
-- Starting command on Fri Jan 16 02:48:47 2026 with 4558572.468 GB free disk space

    cd .
    /share/org/YZWL/yzwl_lixg/miniforge3/envs/canu_v.2.3/bin/tgStoreDump \
      -S ./B2-1.seqStore \
      -T ./unitigging/B2-1.ctgStore 2 \
      -consensus -fasta \
      -unassembled \
    > ./B2-1.unassembled.fasta
    2> ./B2-1.unassembled.err
ZERO length suplied to intervalList::add(), ignoring interval.
ZERO length suplied to intervalList::add(), ignoring interval.
ZERO length suplied to intervalList::add(), ignoring interval.
ZERO length suplied to intervalList::add(), ignoring interval.
ZERO length suplied to intervalList::add(), ignoring interval.
ZERO length suplied to intervalList::add(), ignoring interval.
ZERO length suplied to intervalList::add(), ignoring interval.
ZERO length suplied to intervalList::add(), ignoring interval.
ZERO length suplied to intervalList::add(), ignoring interval.
ZERO length suplied to intervalList::add(), ignoring interval.
ZERO length suplied to intervalList::add(), ignoring interval.
ZERO length suplied to intervalList::add(), ignoring interval.
ZERO length suplied to intervalList::add(), ignoring interval.
ZERO length suplied to intervalList::add(), ignoring interval.
ZERO length suplied to intervalList::add(), ignoring interval.
ZERO length suplied to intervalList::add(), ignoring interval.
ZERO length suplied to intervalList::add(), ignoring interval.
ZERO length suplied to intervalList::add(), ignoring interval.
ZERO length suplied to intervalList::add(), ignoring interval.

-- Finished on Fri Jan 16 02:48:48 2026 (one second) with 4558572.187 GB free disk space
----------------------------------------
----------------------------------------
-- Starting command on Fri Jan 16 02:48:48 2026 with 4558572.187 GB free disk space

    cd .
    /share/org/YZWL/yzwl_lixg/miniforge3/envs/canu_v.2.3/bin/tgStoreDump \
      -S ./B2-1.seqStore \
      -T ./unitigging/B2-1.ctgStore 2 \
      -consensus -fasta \
      -contigs \
    > ./B2-1.contigs.fasta
    2> ./B2-1.contigs.err
ZERO length suplied to intervalList::add(), ignoring interval.
ZERO length suplied to intervalList::add(), ignoring interval.
ZERO length suplied to intervalList::add(), ignoring interval.
ZERO length suplied to intervalList::add(), ignoring interval.
ZERO length suplied to intervalList::add(), ignoring interval.
ZERO length suplied to intervalList::add(), ignoring interval.
ZERO length suplied to intervalList::add(), ignoring interval.
ZERO length suplied to intervalList::add(), ignoring interval.
ZERO length suplied to intervalList::add(), ignoring interval.
ZERO length suplied to intervalList::add(), ignoring interval.
ZERO length suplied to intervalList::add(), ignoring interval.
ZERO length suplied to intervalList::add(), ignoring interval.
ZERO length suplied to intervalList::add(), ignoring interval.
ZERO length suplied to intervalList::add(), ignoring interval.
ZERO length suplied to intervalList::add(), ignoring interval.
ZERO length suplied to intervalList::add(), ignoring interval.
ZERO length suplied to intervalList::add(), ignoring interval.
ZERO length suplied to intervalList::add(), ignoring interval.
ZERO length suplied to intervalList::add(), ignoring interval.

-- Finished on Fri Jan 16 02:48:49 2026 (one second) with 4558572.078 GB free disk space
----------------------------------------
-- Finished stage 'generateOutputs', reset canuIteration.
--
-- Assembly 'B2-1' finished in '/share/org/YZWL/yzwl_lixg/project/28.大豆疫霉菌三代基因组/03.hicanu/B2-1/01.raw_output'.
--
-- Summary saved in 'B2-1.report'.
--
-- Sequences saved:
--   Contigs       -> 'B2-1.contigs.fasta'
--   Unassembled   -> 'B2-1.unassembled.fasta'
--
-- Read layouts saved:
--   Contigs       -> 'B2-1.contigs.layout'.
--
-- Bye.

2026-01-16 02:48:49.565 - WARNING - 输出文件不存在|Output file does not exist: /share/org/YZWL/yzwl_lixg/project/28.大豆疫霉菌三代基因组/03.hicanu/B2-1/01.raw_output/B2-1.unitigs.fasta
Usage: biopytools ragtag [OPTIONS]
Try 'biopytools ragtag -h' for help.

Error: Invalid value for '-r' / '--reference': 文件不存在|File does not exist: /share/org/YZWL/yzwl_lixg/project/28.大豆疫霉菌三代基因组/04.ragtag/Psoja_T2T.fa
Usage: biopytools genomesyn [OPTIONS]
Try 'biopytools genomesyn -h' for help.

Error: Invalid value for '-i' / '--ref': Path '04.ragtag/B2-1/hicanu/B2-1_RagTag_scaffolded.fa' does not exist.
Job 68886828 stderr output:

